Márpedig az NSZK-ban szinte mindig vannak valahol vagy helyhatósági , vagy tartományi választások — ezen az őszön például a Saar-vidéken és Brandenburgban — , s hosszabb távon egyetlen párt sem veszhet össze a választóival .	választóival	33	Ins
A legfontosabb feladatnak a hatóságok azt tartják , hogy elhelyezzék a katasztrófa következtében otthontalanná vált mintegy 600 ezer túlélőt — korábban 200 ezer hajléktalanról érkeztek hírek .	túlélőt	18	Acc
A japán rendőrség több akciót hajtott végre , a Rajfu Szupeszu szekta után kutatva , amely azóta hallatott magáról , hogy két tagjának szállodaszobájában egy mumifikált holttestre bukkantak .	szállodaszobájában	23	Ine
Az IMF által tanácsolt közvetlen jövedelemkiegészítési támogatás bevezetése — amely sok farmert érzékenyen érintene — ugyancsak nehéz döntés elé állítja a török kormányt , mivel a 65 milliós lakosság 45 százaléka gazdálkodó , ami jelentős politikai erőt jelent .	támogatás	6	Nom
Rohamosan veszít népszerűségéből a nagyobbik német kormánypárt , az SPD , s vele együtt Gerhard Schröder kancellár , elsősorban a 30 milliárd márkás takarékossági csomagterv s a párton belül ennek kapcsán felszínre került ellentétek miatt .	párton	27	Sup
A moszkvai külügyminiszteri megbeszéléseken Martonyi János föl kívánja vetni a Szovjetunióba vitt magyar műkincsek visszaszolgáltatásának kérdését .	megbeszéléseken	3	Sup
De kaptam felkérést a Budapesti Csellóegyüttestől és egy férfi-énekszextettől is , úgyhogy szerencsére bőven el vagyok látva feladatokkal .	feladatokkal	17	Ins
Az elégedetlenséget hosszabb távon az ellenzék , elsősorban is az iszlámisták aknázhatják ki , akiknek jelentős politikai muníciót szolgáltathat a " könyörtelen , profitéhes építészeti maffia " elleni harag .	elégedetlenséget	1	Acc
Méteres hótorlaszokon vágták át magukat a Pest Megyei Közterület-fenntartó Vállalat hómarógépei tegnap hajnalban ( meg délelőtt és délután ) a Pilisvörösvárt Pilisszántóval összekötő mellékútvonalon .	mellékútvonalon	23	Sup
Akkoriban a cég — átmeneti sikerrel — megszerezte a Magyar Nemzet , az Esti Hírlap és az Expressz kiadói jogát , 1997 végén pedig megindította a Napi Magyarország című napilapot .	napilapot	29	Acc
Ez utóbbit növelhetik a költségek csökkentésével , a korszerűséggel , valamint a megbízhatósággal ; nem véletlen napjainkban a márkanév jelentőségének növekedése .	csökkentésével	5	Ins
A Magyar Tudományos Akadémia ( MTA ) épületében helyet kapott találkozót Glatz Ferenc akadémiai elnök nyitotta meg , aki a magyar nemesség történelmi szerepéről tartott előadást .	találkozót	10	Acc
A Trajkovics-féle javaslatot a hivatalos Belgrád egyelőre nem kommentálta , ám szerbiai értesülések szerint a színfalak mögötti tárgyalások napirendjén mindig ott volt a Koszovó megosztását szorgalmazó javaslat .	megosztását	24	Acc
A májusról novemberre halasztott Martonyi-vizittől szakértők azt várják , hogy kedvező politikai légkört teremt a kétoldalú kapcsolatokban fennálló vitás kérdések megoldásához .	novemberre	2	Sub
Az elmúlt napok időjárása nyomán a Budapesttől alig 30 kilométerre fekvő pilisi települések lakói is megismerték az elszigeteltség érzését .	elszigeteltség	17	Nom
Weltekére most viszont az a feladat vár , hogy 2002-ben elbúcsúztassa a németek háború utáni identitásának legfontosabb támaszát , hiszen az euró teljes körű bevezetésével a hétköznapi életben is meg kell majd válniuk a márkától .	bevezetésével	24	Ins
A kiállítás egyik szenzációja az az egy méter magas , áttört Zsolnay-díszváza , amely ezen a kiállításon látható először .	Zsolnay-díszváza	11	Nom
Decemberben , a kolozsváriak tervezett Vígszínház-beli vendégjátékán erről a budapesti közönség is megbizonyosodhat , amikor is majd Shakespeare Troilus és Cressidájának Teiresziászaként láthatjuk őt a magyar fővárosban .	vendégjátékán	6	Sup
Szakértők szerint a nemzetközi döntőbíráskodást megtiltó 1995-ös törvény más egyéb okokkal együtt 2-6 milliárd dollárnyi külföldi beruházástól fosztotta meg a gazdaságot , főként az infrastruktúra területén .	okokkal	10	Ins
Tudják , hogy az imént letakarított útszakaszra percek múlva vissza kell térniük .	percek	7	Nom
Ennek ellenére egy " optikai tuningfelszerelések " tömkelegében pompázó Audi A4 Quattro nekivág a domboknak Pilisszántó irányában .	tömkelegében	7	Ine
Tavaly az állami gabonatanács 8 millió tonna szemes terményt vett át , s a mennyiséget az idén 4,5 millióban szeretné korlátozni , mert tavaly például előfordult , hogy olcsón beszerzett iraki búzát adtak tovább a hatóságoknak .	búzát	31	Acc
Az eredeti gipszminta alapján negatívokat készítenek a 3,4 méter magas szoborról , majd a viaszkópiák alapján Gödöllőn egy magánöntődében újraöntik a szobrot .	gipszminta	2	Nom
Nem következett be világméretű katasztrófa , mert a globalizált gazdaságban a nagy tőketömegek mozgatásával ezt el lehetett kerülni .	gazdaságban	9	Ine
Az orosz kormányfő büntetlenséget ígért azoknak a csecsen fegyvereseknek , akiknek nem tapad vér a kezéhez , s leteszik a fegyvert a szövetségi erők előtt .	büntetlenséget	3	Acc
A vörösváriak és a pilisszántóiak többsége azonban nem siet sehova .	pilisszántóiak	4	Nom
Igaz , emberi " segítséget " is kapott a települések elszigeteléséhez .	települések	9	Nom
A szerbek közül jelenleg csak az ellenzékiek támogatják azt a néhány évvel ezelőtt előterjesztett tervet , mely szerint Koszovót meg kellene osztani a szerbek és a lakosság többségét kitevő albánok között .	többségét	27	Acc
Mindaz a képzeletszülte meseelem , ami a gorillacsaládban nevelkedő embergyerek regénybeli történetének kalandos feszültséget és romantikus lendületet kölcsönzött , ezúttal a rajzfilm műfajában levetette az élő megjelenítés korlátait .	meseelem	3	Nom
Raj Tamás , a Makkabi Kiadó vezetője , a judaisztika kiváló magyarországi szakértője lapunknak beszámolt arról , hogy igazi ritkaságok is találhatók az árverésre szánt anyagban .	judaisztika	9	Nom
A tervezet értelmében Koszovó északi , Szerbiával határos részei kerülnének szerb irányítás alá , s a szerb kantonoknak Kosovska Mitrovica és Gnjilane lenne a központja .	részei	8	Nom
— Az utóbbi években a közönség több filmben is találkozhatott önnel .	közönség	5	Nom
Van viszont üldözés sítalpakon és sárkányrepülőn , motorcsónakon és olajvezetékben , és még egy atom-tengeralattjáró belseje is fontos szerepet kap , de ott már Bond az idővel is harcban áll , hogy megmenthesse az emberiséget .	motorcsónakon	7	Sup
Így aztán két év múltán az ifjú már valóban a szegedi alma materben folytathatta tanulmányait , ahol — kiváló eredményei birtokában — élvezte a Nobel-díjas tudós segítőkészségét .	materben	12	Ine
A szépet , a jót kell megmutatni .	szépet	1	Acc
A kamattámogatás is differenciált : az állami garancia nélküli hitelekre 100 , a garantált hitelekre pedig a kezességvállalás mértékének növekedésével csökkenően 75 , illetve 40 százalék .	hitelekre	9	Sub
Ki kérdezné , hogy a fénykép miért éppen síelőket mutat , amikor Magyarország a pusztáról híres , meg arról , hogy egy olyan sípálya sincs területén , melyen életveszély nélkül le lehetne siklani .	síelőket	8	Acc
Bernard Kouchner , a koszovói ENSZ-közigazgatás vezetője szerdán közölte : megelégelte az ENSZ biztonságot és megbékélést célzó koszovói erőfeszítéseit érő bírálatokat .	erőfeszítéseit	18	Acc
A CTK hírügynökség szerint a betonfal lebontása 56 ezer cseh koronába került .	hírügynökség	2	Nom
Az 1944. március 19-e után elindított csoportba került e történet hőse is , a már majdnem orvos fiatalember .	19-e	3	Nom
Bernard Kouchner , a koszovói ENSZ-közigazgatás vezetője szerdán közölte : megelégelte az ENSZ biztonságot és megbékélést célzó koszovói erőfeszítéseit érő bírálatokat .	megbékélést	15	Acc
A másik kocsinak már a nyomai sem látszanak .	nyomai	5	Nom
Elhitették vele , hogy szeretője , Marina Fjodorovna Mangurina teherbe esett tőle , és abortuszon kellett átesnie .	abortuszon	14	Sup
Mostanában , a cseh-szlovákiai " bársonyos forradalom " tizedik évfordulójára emlékezve , magától értetődően , sok szó esik Alexander Dubcek személyiségéről , a szlovák történelemben betöltött szerepéről .	évfordulójára	9	Sub
— Általában a ritmusos kompozíciókat szeretem , a giusto tempójú darabokat , amelyekben kézenfekvő az ütőhangszerek használata .	használata	16	Nom
Az ENSZ és a NATO abban bízik , hogy a tények kozmetikázásával sikerül valamilyen formában helyreállítani a tartomány többnemzetiségű státusát .	kozmetikázásával	11	Ins
Orwell 1984-ről szóló regényének megrázó negatív nyelvi utópiája azért lehetett mozgósító erejű a szabadsághiányos múltban , mert semmi nem lehetett hatékonyabb érv a szólásszabadság mellett , mint a szólásszabadság hiánya .	múltban	14	Ine
Az áldozat fia , a szekta 31 éves tanítványa azt állította , hogy apja még élt , amikor megtalálták , és a boncolás okozta halálát .	fia	2	Nom
Kísértetek szabadultak el a szabaddá vált nyilvánosságban , a szavak gyilkos , ordas , gonosz indulatok árján úszva szorongást , félelmet , az egyszer volt újra megtörténhetésének vélelmét keltették fel .	nyilvánosságban	6	Ine
( Radnóti a második transzportban volt . )	transzportban	4	Ine
Az illetékesek elejétől fogva óvatosan kezelték a Nyugatra szökött volt KGB-ügynök " leleplezéseit " , ezért az olaszokra vonatkozó listát ugyan közreadták , de az igazságügyi szervek azóta alaposan tanulmányozzák azt .	szervek	26	Nom
— Ez alatt a fél évszázad alatt szinte az egész baritonrepertoárt elénekelte , egyedül Wagner darabjaiban nem lépett színpadra .	színpadra	18	Sub
Ma a világ három legfontosabb — a japán , a délkelet-ázsiai , az USA — gazdaságában újabb növekedési hullám kezdődött .	gazdaságában	15	Ine
Az államnak csupán a gazdaság szervezésében , az információ közvetítésében , az alkalmazkodás segítésében kell részt vennie , nem szabad közvetlenül beavatkoznia a gazdaságba .	közvetítésében	9	Ine
Az újság szerint az államfőt november 1-jén már későn — legalább két nappal bélátfúródása után — operálták meg , ami súlyos hashártyagyulladást és vérmérgezést okozott szervezetében .	szervezetében	25	Ine
A kiadvány 160 színes fotó segítségével ad képet az alkotó munkásságáról .	alkotó	9	Nom
A magyar keretlegények durvasága , az élelem- és gyógyszerhiány , a hideg , a piszok megtette a magáét .	hideg	11	Nom
Akkoriban a cég — átmeneti sikerrel — megszerezte a Magyar Nemzet , az Esti Hírlap és az Expressz kiadói jogát , 1997 végén pedig megindította a Napi Magyarország című napilapot .	jogát	19	Acc
A XVIII. században Lengyelországban készült , a Lemberg melletti Libahara faluból származik .	században	2	Ine
A két évtizede tartó változások következtében a török gazdaság szinte lokomotívként száguldott , teljesítményét pontosan mérni sem lehetett a feketegazdaság hatalmas volumene miatt .	feketegazdaság	19	Nom
A japán rendőrség több akciót hajtott végre , a Rajfu Szupeszu szekta után kutatva , amely azóta hallatott magáról , hogy két tagjának szállodaszobájában egy mumifikált holttestre bukkantak .	akciót	4	Acc
A szobor alkotójával beszélgettünk .	alkotójával	2	Ins
Johann Strauss műve pedig azért jutott eszembe , mert csodálatos muzsika , ami a dalszínházban mindig is a legnagyobb énekesek előadásában hangzott fel .	műve	2	Nom
A virtuális gazdaság tehát képes az önkorrekcióra , ugyanakkor egyéb jellemzőivel is számolni kell .	önkorrekcióra	6	Sub
A 6-os úton keletkezett torlódás miatt bizonytalan időre lezárták a dunaföldvári hidat .	úton	2	Sup
A magyar-orosz kapcsolatokat azonban nem ez jellemezte az eltelt időszakban .	kapcsolatokat	2	Acc
Az oroszok azonban feltűnően békésen viselkednek , s egyelőre semmi jele annak , hogy a katonák erőszakos akcióra készülnének .	akcióra	17	Sub
A német bankvilág Olümpuszát eddig megjárt hét elnök ugyanis a pénzügyi stabilitás legfőbb őreként , a szigorú kamatpolitika és a pénzmennyiség kézbentartása útján akár a mindenkori kormánnyal való konfliktust is vállalva , a márka értékállóságát helyezte mindenek elé .	pénzmennyiség	20	Nom
Az alelnök meséli el azt is , hogy az egyik elakadt autót rövid két óra alatt sikerült , az ítéletidő ellenére , valakinek kifosztania .	autót	11	Acc
Nem közlekedett a Volán az M1-es autópályán sem , mivel azt a rendőrség lezárta .	autópályán	6	Sup
A politikai közbeszédben egyeduralomra jutott jogi nyelvhasználat előfeltevése , hogy csak azt lehet számon kérni , ami le van írva és ahogyan le van írva .	közbeszédben	2	Ine
Bár e kérdések egynémelyikében nincs nézetazonosság a két ország között , az eszmecsere a várakozások szerint jó lehetőséget teremt az álláspontok kifejtésére , s talán közelítésére is .	kifejtésére	21	Sub
Nyitott gazdaságunkra jellemző a természeti tényezők szűkössége , a külkereskedelem szükségessége , az integráció igénye .	gazdaságunkra	1	Sub
Az úttorlaszokat építő és folyamatosan tüntető albánok azzal indokolják viselkedésüket , hogy az oroszok elfogultak az albánokkal szemben , s a koszovói albánok elleni szerb támadásokban több száz orosz zsoldos is részt vett .	albánok	6	Nom
Németországban Baden-Württemberg tartományban és Bajorországban a főutakon és az autópályán egyaránt 25-30 kilométer hosszan torlódtak fel az személygépkocsik és az autóbuszok .	autópályán	9	Sup
A Vatikán ajánlásainak engedve a német katolikus püspökök úgy határoztak , hogy egyházuk módosítani akarja részvételét a terhestanácsadás törvény által szabályozott rendszerében .	rendszerében	21	Ine
Nem szeretem a zsúfoltságot , egy zsúfolt kiállításról jobb az elején kijönni , mielőtt elfolyik a maradék életerőnk .	zsúfoltságot	3	Acc
A rosszfiúk jó része szláv akcentussal töri az angolt , de ez , valljuk be , csak arra a nyomorúságra utal , amelyben az utóbbi évek szegény akciófilm-forgatókönyvírói kénytelenek kiizzadni egy valamirevaló főgonoszt a kémhistóriájukhoz .	akciófilm-forgatókönyvírói	27	Nom
Az áldozat fia , a szekta 31 éves tanítványa azt állította , hogy apja még élt , amikor megtalálták , és a boncolás okozta halálát .	halálát	24	Acc
Jaroslav Volf azt állítja , hogy az egész históriában roppant homályos Dubcek gépkocsivezetőjének , Ján Rezníknek a szerepe .	históriában	8	Ine
A 485,7 milliárd márkás német költségvetésből 30 milliárd megspórolására hivatott tervből ( HVG , 1999. július 10. ) immár hivatalos kormány-előterjesztéssé nemesedett intézkedéssorozat már a párton , sőt annak parlamenti frakcióján belül sem talált egyértelmű támogatásra .	frakcióján	30	Sup
A magyar fővárosban december 8-án a Néprajzi Múzeumban kerül sor az album 1-től 10-ig sorszámozott példányainak az aukciójára , míg Bécsben várhatóan a jövő év februárjában rendezik meg a licitet .	februárjában	25	Ine
Az áprilisi választások révén hatalomra jutott bal-jobb koalíció az utóbbi négy év legstabilabb török kormányának tűnik , a földrengés azonban veszélyt jelenthet erre a politikai egységre .	hatalomra	4	Sub
Budapest bízik abban , hogy az utóbbi hónapokban keletkezett vitákat , félreértéseket az orosz fél számára is megnyugtatóan sikerült tisztázni és lezárni .	félreértéseket	11	Acc
A " legkevésbé ismert " jelzőt először Péter Vladimir használta velem kapcsolatban , mikor 97-ben megkaptam a Soros-ösztöndíjat .	jelzőt	5	Acc
A Trajkovics-tervezet a szerbeket hozná kedvezőbb helyzetbe , hiszen épp ezekben a körzetekben találhatóak a tartomány legjobb bányái és legnagyobb ipari üzemei .	szerbeket	3	Acc
Raj Tamás , a Makkabi Kiadó vezetője , a judaisztika kiváló magyarországi szakértője lapunknak beszámolt arról , hogy igazi ritkaságok is találhatók az árverésre szánt anyagban .	árverésre	23	Sub
Az egész estés rajzfilm készítői egyszerű , kedves történetet mesélnek egy lényről , aki az állatok között tapasztalja meg a szeretet , a családi összetartozás erejét , s aki ember mivoltára ébredve is inkább a dzsungelt választja .	erejét	25	Acc
Ez utóbbit növelhetik a költségek csökkentésével , a korszerűséggel , valamint a megbízhatósággal ; nem véletlen napjainkban a márkanév jelentőségének növekedése .	utóbbit	1	Acc
A hibátlanul sikerült szinkron mellett a magyar változat meglepetése , hogy Phil Collins remek ritmusú betétdalait Ákos énekli , saját műfordításában , hibátlan stílusérzékkel .	műfordításában	20	Ine
Ma a korszerű hangzáshoz hozzátartozik az ütős hangszerek kiemelt szerepeltetése is , s úgy veszem észre , hogy a közönség is szereti az ilyen kompozíciókat .	észre	15	Sub
Súlyosnak minősítette a horvát köztársasági elnök egészségi állapotát a Tudjmant kezelő zágrábi orvoscsoport .	állapotát	7	Acc
Hasonló ártámogatási rendszer működik egyébként a cukorrépa és a dohány esetében is .	dohány	9	Nom
Én pontosan emlékszem egy negyvenöt esztendővel ezelőtti beszélgetésre , amelynek minden szavát megfogadtam .	beszélgetésre	7	Sub
Pedig a kilencvenes évek előtt még igenis lehetett ebben a műfajban is eredményes az ember , hiszen a 180-as csoporttal tizenkét éven át telt házak előtt játszhattunk a Zeneakadémián , jelentős törzsközönségünk volt , készültek lemez- és rádiófelvételeink .	műfajban	10	Ine
Ebből a szempontból is különleges jelentősége van annak , hogy az albánok már több mint egy hete nem engedik be a városba azokat az orosz Kfor-katonákat , akiknek az Orahovacban június óta szolgáló hollandokat kellett volna felváltaniuk .	jelentősége	5	Nom
Persze vezetőjét hiába kérlelik a közúti hómunkások .	vezetőjét	1	Acc
Ez talán túlzott derűlátás , de lehet , hogy a közeljövőben minden konjunktúra-dekonjunktúra elméletet felül kell vizsgálni .	konjunktúra-dekonjunktúra	12	Nom
A Magyar Tudományos Akadémia ( MTA ) épületében helyet kapott találkozót Glatz Ferenc akadémiai elnök nyitotta meg , aki a magyar nemesség történelmi szerepéről tartott előadást .	előadást	25	Acc
Ez alkalmazkodási hajlandósággal jár .	hajlandósággal	2	Ins
Hiába nyilvánvaló , hogy a nagy fővárosi közlekedési fejlesztésekben az államnak is részt kell vennie , még ha a politikai akarat meg is van , akkor sem lehet ezt a hatalmas beruházási igényt kielégíteni .	fejlesztésekben	8	Ine
Ha a szemlélő túlteszi magát az egy éve tartó és várhatóan tovább durvuló főváros-kormány vitán , akkor is látszik , hogy a nagyobb beruházások még közös finanszírozásban is túl nagy falatot jelentenének .	finanszírozásban	26	Ine
Az éjszaka eredménye 12 személyautó , 2 autóbusz és a ráadás : a Pilisszántóba igyekvő kenyereskocsi kiszabadítása a hó fogságából .	autóbusz	7	Nom
Az EU éppen a fal lebontásának napján tette közzé nyilatkozatát , amely szerint a cseh EU-tagság egyik fő gondja a csehországi roma népességgel való nem megfelelő bánásmód .	nyilatkozatát	9	Acc
Hazudik , aki azt állítja , hogy nem akar sikeres lenni vagy hogy számára nem fontos , hogy minél több visszajelzést kapjon .	visszajelzést	20	Acc
— A szép beszéd egyébként is kiemelkedő szerephez jut pályáján , hiszen minden évben egyszer díjátadóként lép színpadra az Operaházban , hogy a szép magyar kiejtésért alapított elismerését az erre legméltóbbnak talált kollégájának átnyújtsa .	színpadra	17	Sub
Így aztán két év múltán az ifjú már valóban a szegedi alma materben folytathatta tanulmányait , ahol — kiváló eredményei birtokában — élvezte a Nobel-díjas tudós segítőkészségét .	alma	11	Nom
Szekszárdon a 6-os úton parkolóba terelték az arra tartókat , s számukra itt pihenő-melegedő helyet alakítottak ki — tájékoztatta lapunkat Schieber József , a Polgári Védelem Országos Parancsnokságának szóvivője .	tartókat	8	Acc
— Többször dolgozott együtt az Amadinda együttessel , számos darabjában kapnak fontos szerepet az ütőhangszerek ...	darabjában	9	Ine
A pesszimisták szerint ez az — árnyékgazdaságnak is nevezett — " léggömb " ki fog pukkadni .	pesszimisták	1	Nom
— Az ember csak reménykedhet , s igyekezhet a hangjával hosszabb és rövid távon is gazdálkodni .	távon	13	Sup
Kísértetek szabadultak el a szabaddá vált nyilvánosságban , a szavak gyilkos , ordas , gonosz indulatok árján úszva szorongást , félelmet , az egyszer volt újra megtörténhetésének vélelmét keltették fel .	indulatok	15	Nom
Meglepett , amikor ezekre a szerepekre felkértek , hiszen voltam alvilági főnök és őrült SS-tiszt , játszhattam a Balekok és banditákban , valamint a Hány az óra , Vekker úr ? című produkciókban .	szerepekre	5	Sub
Tegnap újabb házak dőltek össze a hó súlya alatt .	súlya	7	Nom
Szakértők szerint a nemzetközi döntőbíráskodást megtiltó 1995-ös törvény más egyéb okokkal együtt 2-6 milliárd dollárnyi külföldi beruházástól fosztotta meg a gazdaságot , főként az infrastruktúra területén .	Szakértők	0	Nom
Ez a műfaj lényege : olyan szuggesztivitással , olyan hőfokon kell előadni az operákat , hogy természetesnek hasson az éneklés .	szuggesztivitással	6	Ins
Három magas rangú olasz katonatiszt a hidegháború idején fontos államtitkokat adott át a volt szovjet hírszerzésnek — vélik tudni a szerdai olasz újságok .	katonatiszt	4	Nom
A hibátlanul sikerült szinkron mellett a magyar változat meglepetése , hogy Phil Collins remek ritmusú betétdalait Ákos énekli , saját műfordításában , hibátlan stílusérzékkel .	stílusérzékkel	23	Ins
A világgazdaság gyors , országhatárokon átívelő fejlődését több tényező idézi elő .	országhatárokon	4	Sup
De azért kérdésünkre megindul a panaszáradat .	kérdésünkre	2	Sub
Ilyen például a teljes német Talmud-fordítás , amely a náci Németországban jelent meg , és a kikiáltási ára 200 ezer forint .	Talmud-fordítás	5	Nom
A társaság végelszámolással történő megszüntetéséről döntenek a Corso Rt. tulajdonosai a cipőkereskedelmi cég jövő hétre meghirdetett közgyűlésén .	hétre	14	Sub
A tévé szerint a támadók egy négytagú járőrre nyitottak tüzet .	járőrre	7	Sub
Hiszen a keleti szél pár másodpercen belül újra hótakarót borít rá .	szél	3	Nom
Simicska akkor formálisan nem vett részt a Mahir Rt. 1994. eleji privatizációjában , ám hamarosan átvette a cég irányítását , amelynek 1998-ig áttételesen résztulajdonosa is volt .	privatizációjában	11	Ine
A májusról novemberre halasztott Martonyi-vizittől szakértők azt várják , hogy kedvező politikai légkört teremt a kétoldalú kapcsolatokban fennálló vitás kérdések megoldásához .	kapcsolatokban	16	Ine
Zsoldos Árpád is jól ismert és kedvelt színész Magyarországon : elég , ha csak a szentgyörgyi színház nagy sikerű Hegedűs a háztetőn című musicaljében nyújtott madárcsontú , mégis hihetetlenül erős Tevje-alakítására gondolunk .	musicaljében	23	Ine
" Minden napra esik egy szemantikai puccs .	napra	2	Sub
Fejérben volt a legkritikusabb a helyzet : 8 települést egyáltalán nem lehet megközelíteni , s időlegesen elvesztette kapcsolatát a külvilággal Lepsény és Enying is .	települést	8	Acc
A kutatók minden bizonnyal felfigyelnek a nagykövet által önállótlanul alkalmazott kétosztatú gondolkodásra , mely tisztességesekre és tisztességtelenekre osztja a társadalmat , melynek elvben osztatlan képviseletét kellene ellátnia .	elvben	22	Ine
Egy héten belül immár másodszor bénította meg a lengyel fővárost a hatalmas hózuhatag .	hózuhatag	12	Nom
A roppant terhek , az örökös hadi készültség , a csapatok mozgatása , az ütközetek , az utánpótlás megszervezése , a millió véletlen esemény elviselése és integrálása a katonai folyamatokba , megviselték .	megszervezése	18	Nom
A betegség kitörése , azaz a 80-as évek eleje óta a kórokozó 50 millió embert fertőzött meg .	kitörése	2	Nom
Az egyszerű az , hogy miután éveken keresztül rétegelt lemezből dolgoztam , eluntam a rétegelést , mást akartam — és a lyukasztgatás jutott az eszembe , ami hallatlanul munkaigényesnek bizonyult , de úgy tűnik a kiállításból , van eredménye .	rétegelést	14	Acc
Én pontosan emlékszem egy negyvenöt esztendővel ezelőtti beszélgetésre , amelynek minden szavát megfogadtam .	szavát	11	Acc
A csehországi Ústi nad Labemben szerda hajnalban teljesen lebontották azt a falat , amelyet a város vezetése építtetett október elején azért , hogy elválassza a helyi romákat a szomszédos családi házak lakóitól .	falat	11	Acc
