A horvát alkotmányban csak a tartós akadályoztatás fogalmát rögzítették , amely az államfő helyettesítésének esetére kötelezően előírta új elnökválasztás kiírását is .	akadályoztatás	6	Nom
A magyar keretlegények durvasága , az élelem- és gyógyszerhiány , a hideg , a piszok megtette a magáét .	piszok	14	Nom
— Igen , bár nehéz egészséges arányt találni a két műfaj között .	arányt	6	Acc
Megközelíthetetlenné vált nyolc Vas megyei község , s hótorlasz mögé szorul a Bács-Kiskun megyei Újsolt 190 lakosa is .	hótorlasz	8	Nom
Az IMF által tanácsolt közvetlen jövedelemkiegészítési támogatás bevezetése — amely sok farmert érzékenyen érintene — ugyancsak nehéz döntés elé állítja a török kormányt , mivel a 65 milliós lakosság 45 százaléka gazdálkodó , ami jelentős politikai erőt jelent .	kormányt	22	Acc
Dubceknak az volt az álláspontja , hogy a közös állam szétválasztása egyes cseh és szlovák politikusok egyéni ambícióit szolgálhatja ugyan , de semmiképpen nem a két nép érdekeit .	politikusok	15	Nom
Oroszország nagyhatalom és fontos partner Magyarország számára .	nagyhatalom	1	Nom
II. János Pál pápa már júniusi , majd szeptemberi levelében is bírálta a német püspökségek részvételét a terhes nőknek szervezett állami tanácsadásban , azt vetve a szemükre , hogy az igazolások kiállításával lehetővé teszik meg nem született életek elpusztítását .	tanácsadásban	21	Ine
Mindez annak köszönhető , hogy elképesztő méretekben fejlődött a feldolgozóipar , szinte alig van olyan világcég , amelynek a most sújtott Izmitben vagy környékén name lenne vegyesvállalata .	méretekben	6	Ine
Az állásbörze nemcsak a végzős diákoknak hasznos , az alsóbb évesek is gyűjthetnek tapasztalatokat , felmérhetik a követelményeket , kapcsolatba kerülhetnek a vállalatokkal , szakmai gyakorlatokra jelentkezhetnek .	vállalatokkal	22	Ins
Az illetékesek elejétől fogva óvatosan kezelték a Nyugatra szökött volt KGB-ügynök " leleplezéseit " , ezért az olaszokra vonatkozó listát ugyan közreadták , de az igazságügyi szervek azóta alaposan tanulmányozzák azt .	olaszokra	17	Sub
A megyeszékhelyen egyébként csütörtökre és péntekre tanítási szünetet rendeltek el .	megyeszékhelyen	1	Sup
Kiemelkedik az aukcióban részt vevő darabok közül egy ezüstből készült emeletes szédertál , amelyet cizellált arany elemekkel díszítettek és a súlya megközelíti a négy kilót .	aukcióban	2	Ine
A nyomozást azt követően rendelték el , hogy a közelmúltban egy holttestet leltek a tokiói repülőtér közelében fekvő egyik szállodában .	nyomozást	1	Acc
Hasonlóan járt a Fidesz számára politikai kudarcot és eladósodást hozó 1994-es választások után : túladtak rajta mint gazdasági igazgatón .	igazgatón	18	Sup
Veszprém megyében a 8-as úton órákon állt a forgalom Várpalota és a péti elágazás között két elakadt kamion miatt .	kamion	17	Nom
Megszervezték ugyanis az Első Magyarországi Judaika Árverést , amelynek keretében értékes kulturális-történeti anyag — könyvek , kéziratok , kegytárgyak és festmények — kerül kalapács alá .	kéziratok	16	Nom
A Magyar Tudományos Akadémia ( MTA ) épületében helyet kapott találkozót Glatz Ferenc akadémiai elnök nyitotta meg , aki a magyar nemesség történelmi szerepéről tartott előadást .	helyet	8	Acc
A Corso talpra állítása a társaságot 1994-ben privatizáló — a cég vezetőiből és alkalmazottaiból álló — konzorciumnak sem sikerült ( a vételár mindössze 198 millió forint volt , amelynek csak a 30 százalékát kellett készpénzben kifizetni ) .	készpénzben	34	Ine
A realista a jó szándékot látja benne , no meg azt : ennyire tellett .	szándékot	4	Acc
A nisi polgármesteri hivataltól származó értesüléseink szerint a szerbiai városba szerda este megérkezett a 10 teherautó , amely az Európai Unió és a szerb ellenzék között létrejött megállapodás értelmében fűtőolajat szállít az ellenzéki vezetésű , közép-szerbiai településnek .	megállapodás	27	Nom
Először Don Alfonsót alakítottam benne , majd Guglielmo lettem , több év elteltével pedig ismét megkaptam az öreg filozófus szerepét .	elteltével	12	Ins
Ázsiában ezzel szemben mind több sikerrel veszik fel az AIDS-szel szembeni küzdelmet .	küzdelmet	11	Acc
A Volánbusz Rt. távolsági járatai közül nem indulnak a Bakonyba és Tolna, Baranya, Bács-Kiskun megye egyes településeire buszok .	településeire	16	Sub
A hófúvás a MÁV teljes hálózatán fennakadásokat okozott , mindenütt legalább 30 percet késtek a vonatok .	hálózatán	5	Sup
A testület rendkívüli ülésén kétharmados szavazattöbbséggel elfogadott törvényt azonnal ki is hirdették , így az azonnal érvénybe is lépett .	szavazattöbbséggel	5	Ins
parlament szerepét betöltő svájci nemzeti tanács hétfőn 11 órás vita után ratifikálta az alpesi ország és az Európai Unió ( EU ) között négyéves tárgyalás után nemrégiben létrejött eddigi legfontosabb dokumentumot .	dokumentumot	30	Acc
A világgazdaság gyors , országhatárokon átívelő fejlődését több tényező idézi elő .	világgazdaság	1	Nom
A Maticni utcai " etnikai elválasztófal " megszüntetéséről kedden hozott döntést Ústi nad Labem városi tanácsa .	tanácsa	15	Nom
Pozsony soha nem ismerte el a cseh követelés jogosultságát .	jogosultságát	8	Acc
Putyin ezúttal nem zárta ki teljesen Groznij ostromát , azt hangoztatva , hogy a bázisokat és a fegyverraktárokat meg fogják semmisíteni .	ostromát	7	Acc
A megállapodás várhatóan 2001-ben lép hatályba , miután valamennyi uniós tagország parlamentje is ratifikálta .	parlamentje	11	Nom
A megyében a legnagyobb problémát az átutazó forgalom okozza , s habár nem lehet közlekedni , a kamionok és buszok sofőrjei nem hajlandóak leállítani járműveiket — magyarázta Lánczos János , a Fejér Megyei Közútkezelő Kht. osztályvezetője .	járműveiket	24	Acc
Mario Babiucról van szó , aki " Ikar " fedőnéven szerepelt a szovjet titkosszolgálat jelentéseiben .	fedőnéven	9	Sup
Nem nehéz megjósolni : az elnapolt terv olyan nagyszabású fejlesztéseket javasol , melyeket a közelgő közlekedési krízis ellenére sem tud a főváros — természetesen pénz hiányában — megvalósítani .	krízis	16	Nom
Ennek a jelzőnek nagy sikere lett , mert nálunk imádják a mártírokat , akik magányosan tönkremennek .	mártírokat	11	Acc
A tárlaton mintegy hatvan művet tekinthetnek meg az érdeklődők Marghescuné Hunor Mária gyűjteményéből .	tárlaton	1	Sup
A mintegy 180 magyarországi taggal rendelkező egyesület találkozóján részt vett Habsburg Ottó is , akinek Magyarországon élő fia , György szintén tagja a szervezetnek .	taggal	4	Ins
A vastagon behavazott úton tényleg ez a helyzet .	úton	3	Sup
A jövő év január 5-ig látható kiállításon a kerámiatárgyak mellett Balogh István Péter és Börzsönyi Kollarits Ferenc képei is bemutatkoznak .	kerámiatárgyak	8	Nom
Pedig úgy gondolom , én nem csináltam semmi mást , csak szolgáltam a muzsikát és a közönséget .	közönséget	16	Acc
Állták a szavukat : a szerződés ratifikálása után a szlovák aranykincs várhatóan a jövő év elején , azt követően kerülhet Pozsonyba , hogyha az egyezményt már a két parlament is ratifikálta .	aranykincs	10	Nom
— Azt írta önről valaki , hogy az egyik legkevésbé ismert magyar szobrász , sokak szerint mégis kultikus figura ...	szobrász	12	Nom
A cég 1997-ben 1 milliárd forint körüli árbevétel mellett 500 millió forintos adózás előtti nyereséget ért el , míg tavaly az orosz válság hatására árbevételük 600 millió forintra , eredményük 140 millió forintra csökkent .	nyereséget	14	Acc
A mintegy kétszázezer koszovói szerb közül már csak alig húszezren maradtak a június óta NATO-ellenőrzés alatt lévő dél-szerbiai tartományban .	tartományban	18	Ine
Tegnap este az autóbuszok sok helyütt két és fél órás késéssel érkeztek a célállomásra , a főútvonalakon pedig több kilométer dugók alakultak ki .	főútvonalakon	16	Sup
A Magyar Tudományos Akadémia ( MTA ) épületében helyet kapott találkozót Glatz Ferenc akadémiai elnök nyitotta meg , aki a magyar nemesség történelmi szerepéről tartott előadást .	épületében	7	Ine
Erre azonban a szaktárca vezetője szerint nincs szükség , bár a miniszter felkérte a fuvarozókat , lehetőleg name hagyják el a telephelyeiket .	szaktárca	3	Nom
Mostanában , a cseh-szlovákiai " bársonyos forradalom " tizedik évfordulójára emlékezve , magától értetődően , sok szó esik Alexander Dubcek személyiségéről , a szlovák történelemben betöltött szerepéről .	történelemben	24	Ine
A csehországi Ústi nad Labemben szerda hajnalban teljesen lebontották azt a falat , amelyet a város vezetése építtetett október elején azért , hogy elválassza a helyi romákat a szomszédos családi házak lakóitól .	romákat	26	Acc
Akinek pedig lapát van a kezében , biztosan nem fázik .	kezében	5	Ine
Anynyit nézem a munkámat , hogy a végén már nem látom .	munkámat	3	Acc
Szerdán megalakult a rendkívüli havazás miatt kialakult káosz kezelésével megbízott operatív bizottság .	kezelésével	8	Ins
Olyan vagyok ebben a társadalomban , mint volt egykor a dinoszaurusz : hiába mondták neki , hogy " Repülj ! " , nem tudott repülni és kihalt .	társadalomban	4	Ine
Az Erste Bank Hungary Rt. a jövő héten teszi közzé az újságokban , milyen áron hajlandó megvenni a mintegy 1200 kisbefektető kezében lévő 77 ezer darab , a bank 9,2 milliárd forintos jegyzett tőkéjének négy százalékát kitevő részvényeit .	kezében	21	Ine
Ezen az árverésen azok is megtalálhatják a nekik tetsző tárgyat , akik jó befektetésre vágynak , de a kispénzű érdeklődők is reménykedhetnek , mert akad a listán könyvritkaság mindössze 800 forint kikiáltási áron .	árverésen	2	Sup
A cég helyzetét a növekvő konkurencián kívül rontotta , hogy a kiskereskedelmi üzletek eladását szolgáló előprivatizáció keretében több boltját elvonták , ingatlanvagyonának 86 százalékát így két nagyméretű — 6 ezer négyzetméter körüli — raktár tette ki .	helyzetét	2	Acc
II. János Pál pápa már júniusi , majd szeptemberi levelében is bírálta a német püspökségek részvételét a terhes nőknek szervezett állami tanácsadásban , azt vetve a szemükre , hogy az igazolások kiállításával lehetővé teszik meg nem született életek elpusztítását .	szemükre	26	Sub
A megye több más települését is csupán kerülővel , egyetlen irányból lehetett megközelíteni — tájékoztatta lapunkat Szabó Ferenc ezredes , a megyei védelmi bizottság titkára .	kerülővel	7	Ins
Hiszen a személyi ellentétekben is megnyilvánuló pozícióharc első nagy vesztese a klasszikus szociáldemokrata értékekre előszeretettel hivatkozó Oskar Lafontaine pártelnök lett , aki márciusban távozott a pénzügyminiszteri posztról .	márciusban	22	Ine
A magyar országgyűlési képviselő , ha akarja , szenátornak nevezi magát , ugyanaz a párt egyik nap ellenzék , a másik nap kormányoldalon álló , sőt a parlamenti többség akarata még a matematikánál is erősebb .	kormányoldalon	22	Sup
Törökország például Európa legnagyobb szállítója a textiláruk terén , Isztambul pedig Szöultól nyugatra a legnagyobb , elektronikai eszközöket gyártó központ .	nyugatra	12	Sub
Az eldugott települések lakói már hozzászokhattak , hogy a közepesnél erősebb havazások majd minden esztendőben elzárják őket néhány napra a külvilágtól .	havazások	11	Nom
Az oslói orosz nagykövetség korábban még azt közölte a norvég külügyminiszterrel : Ivanov túlzottan elfoglalt , így a hónap hátralévő részében már nem tud találkozni vele .	külügyminiszterrel	10	Ins
Putyin ezúttal nem zárta ki teljesen Groznij ostromát , azt hangoztatva , hogy a bázisokat és a fegyverraktárokat meg fogják semmisíteni .	bázisokat	14	Acc
A judaika-árverés szervezői azt remélik , hogy ez az újfajta , tematikus aukció új színfoltot hoz az őszi árverési dömpingbe , és új távlatokat nyit a gyűjtők előtt .	judaika-árverés	1	Nom
Én csak ülök itt a műteremben és dolgozom .	műteremben	5	Ine
A megyeszékhelyen egyébként csütörtökre és péntekre tanítási szünetet rendeltek el .	csütörtökre	3	Sub
Weltekére most viszont az a feladat vár , hogy 2002-ben elbúcsúztassa a németek háború utáni identitásának legfontosabb támaszát , hiszen az euró teljes körű bevezetésével a hétköznapi életben is meg kell majd válniuk a márkától .	életben	27	Ine
Más városokban sem sokkal jobb a helyzet : Gnjilanéban néhány nappal ezelőtt egy szerb tulajdonban lévő videotékára dobtak kézigránátokat .	kézigránátokat	18	Acc
Szakadár albán fegyveresek kedden este tüzet nyitottak egy szerb rendőrjárőrre Koszovó délkeleti határa mentén , a biztonsági övezet közelében : két rendőr megsebesült — jelentette szerdán az RTS szerb állami tévé .	rendőrjárőrre	9	Sub
A vészhelyzetből egyedül a taxisok húztak hasznot .	hasznot	6	Acc
Goebbelsi módszereket tulajdonít a díjazott újságíróknak , miközben ő maga az , aki Goebbelset követi , jóllehet , a mester jóval tehetségesebben alkalmazta a nevéről elnevezett módszert .	módszert	26	Acc
Mellette a közelmúltban átalakult gyár művészeti stúdiójában készült , kézzel festett legszebb egyedi darabjai láthatók .	gyár	4	Nom
A lakásokban .	lakásokban	1	Ine
Ő maga szállít élelmet az elzártaknak — traktoron .	traktoron	7	Sup
Mellette a közelmúltban átalakult gyár művészeti stúdiójában készült , kézzel festett legszebb egyedi darabjai láthatók .	stúdiójában	6	Ine
Elhangzik egyszer egy mű egy koncerten , a jelen lévő néhány száz ember meghallgatja , s még akkor , ha sikert arat , sincs biztosítva , hogy legközelebb is lesz mód az előadásra .	koncerten	5	Sup
1992-ben ő volt az Öregasszony Spiró György Csirkefejének Szamos-parti előadásában az Anya szerepét alakította Camus A félreértés című színművében .	színművében	18	Ine
A Corriere della Sera című lap szerint az egyik nevet sikerült azonosítania az üggyel foglalkozó katonai főállamügyésznek .	üggyel	13	Ins
Ezért siettették az ítélet meghozatalával az ügy lezárását , és arra is számíthattak : az önálló Szlovákia megteremtésének láza el is tereli a figyelmet a gyanús körülményekről .	lezárását	7	Acc
" Úgy vélem , hogy az albán reakció ugyan helytelen , ám érthető " — vélekedett Jackson tábornok , s hozzátette : a blokád legfeljebb rögnek tekinthető a rendezés felé vezető úton .	úton	31	Sup
A politikai közbeszédben egyeduralomra jutott jogi nyelvhasználat előfeltevése , hogy csak azt lehet számon kérni , ami le van írva és ahogyan le van írva .	egyeduralomra	3	Sub
A tekercset az ő rokona kívánja most értékesíteni .	tekercset	1	Acc
— A szobor hálós szerkezetű , a háló adja ki a jaguár formáját , ami tehát belül üres .	szobor	2	Nom
A horvát alkotmányban csak a tartós akadályoztatás fogalmát rögzítették , amely az államfő helyettesítésének esetére kötelezően előírta új elnökválasztás kiírását is .	alkotmányban	2	Ine
Az újság szerint az államfőt november 1-jén már későn — legalább két nappal bélátfúródása után — operálták meg , ami súlyos hashártyagyulladást és vérmérgezést okozott szervezetében .	hashártyagyulladást	21	Acc
Mert kétségtelen tény , hogy minél szélesebb körben terítik a terheket , annál könnyebb összeszedni a hiányzó pénzt — de annál nagyobb az érintett választók száma is .	terheket	10	Acc
E tekintetben figyelemre méltó , hogy még legkeményebb bírálói is elismerik : akkor van igazán elemében , ha küzdenie kell .	figyelemre	2	Sub
Az összedőlt házak romjain egy újfajta polgári kezdeményezés csírái kezdtek kialakulni , a hivatalos állami segítség hiányát pótolva .	hiányát	16	Acc
A kormányhatározat által nyújtott lehetőség alapján 11,5 milliárd forint új hitelt vehetnek fel a tartósítóipari termékeket gyártók , a nyolc hónapos futamidejű konstrukcióban a tőketörlesztésre négy hónap moratóriumot kapnak .	hitelt	10	Acc
A kft 1998-ig elsősorban felújított Ikarus buszok oroszországi , illetve FÁK-országi exportjával , valamint pótalkatrész értékesítésével foglalkozott .	értékesítésével	15	Ins
Az intézkedést most is az orosz válság miatt megingott likviditású cégek hitelképtelensége indokolja , ami az alapanyag-termelők pozícióit is veszélyezteti .	pozícióit	17	Acc
Az isztambuli értéktőzsdén ( ISE ) jegyzett 279 vállalat zöme a Márvány-tenger földrengés által sújtott keleti partvidékén és környékén — Törökország ipari szívében — vert tanyát , de többségük a börzéhez eljuttatott jelentésében nem tesz említést jelentősebb károkról .	zöme	9	Nom
A virtuális gazdaság tehát képes az önkorrekcióra , ugyanakkor egyéb jellemzőivel is számolni kell .	jellemzőivel	10	Ins
Olyan az emlékezet , mint a zsidó sírokon a kődarab .	sírokon	7	Sup
A pusztító törökországi földrengés — amely az újabb adatok szerint mintegy 10 milliárd dollárnyi anyagi kárt okozott — nem akadályozta meg az ankarai kormányt abban , hogy töretlenül folytassa a tragédia előtt megkezdett gazdasági reformokat .	kormányt	23	Acc
Az ellenzéki pártok képviselői az alkotmányerejű törvény ellen szavaztak , egyebek között arra hivatkozva , hogy a kormánypárt nem tartja tiszteletben az alkotmányban foglaltakat , és nem hajlandó megállapodni a parlamenti választások időpontjáról sem .	kormánypárt	17	Nom
Ez a műfaj lényege : olyan szuggesztivitással , olyan hőfokon kell előadni az operákat , hogy természetesnek hasson az éneklés .	hőfokon	9	Sup
Az eladásra szánt vállalatok között szerepel továbbá a nemzeti légitársaság , a Türk Hava Yollari — amelynek 30 százalékát kínálják fel — és a Türk Telekom is , amelynek privatizálásából 5,3 milliárd dollárt várnak .	eladásra	1	Sub
A héttagú családot kiköltöztették , s ideiglenesen szövetkezeti vagy egyházi lakásban szállásolják el — tájékoztatta lapunkat Eller János polgármester .	családot	2	Acc
A török alkotmány úgy utal az államra , mint amelynek " területe és nemzete " van , szemben a nyugat-európai felfogással , ahol a nép alkotja az államot .	alkotmány	2	Nom
Emberfeletti feladat volt , hiszen minden hangjegyre meg volt a kötelező mozdulat .	mozdulat	11	Nom
Rájuk férne némi fűtőolaj-szállítmány , hogy a fagyos viszony felengedjen , és ők is — hasonlóan az unióhoz — name csak a frázisok terén legyenek energikusak , hanem a demokráciát illetően is .	frázisok	22	Nom
A hófúvás a MÁV teljes hálózatán fennakadásokat okozott , mindenütt legalább 30 percet késtek a vonatok .	fennakadásokat	6	Acc
Zaporozsje megyeszékhelyen a leszakadt villanyvezetékek miatt rendkívüli állapotot vezettek be .	megyeszékhelyen	1	Sup
A globalizáció a gazdaság kínálati oldalát befolyásolja , és nem hat a jövedelmek nemzeti kereteken belül történő elosztására .	kereteken	14	Sup
Aszlan Maszhadov csecsen elnök közölte : az urusz-martani harcosok megfogadták , hogy egész télen helyükön maradnak és harcolnak .	helyükön	14	Sup
Egyébként is nagyon kedvelem az etnozenét , az afrikai , a távol-keleti zenét ; magam is foglalkoztam ezekkel a muzsikákkal .	muzsikákkal	19	Ins
A szerbek nem csak Orahovacban érzik magukat szorongatva : múlt hét elején a tartományi székhelyen , Pristinában , három szerb nőt bántalmaztak albán támadók , s ismeretlen fegyveresek rálőttek két cigány férfire is .	szerbek	1	Nom
Az egyetemen immár hagyománnyá vált az egy hónapos Felkészítő Napok rendezvénysorozat , amelyen az álláskeresés módszereit ismerhetik meg jobban a hallgatók ; hogyan viselkedjenek , kommunikáljanak , miként mutassák be tudásukat , képességeiket egy interjú során .	hallgatók	20	Nom
Azelőtt az export és a beruházások játszották a főszerepet a gazdasági életben , az elmúlt év elején azonban az export dinamikája lassult , a beruházások egész évben stagnáltak , a belső fogyasztás pedig növekedett . )	életben	11	Ine
S bár nagyon jó viszonyban voltunk , és meghatározó volt életemben ez a vendégszereplés , nemet mondtam .	életemben	10	Ine
S miközben Törökország ásványkincsekben szegény , külkereskedelme gyors ütemben bővül .	ásványkincsekben	3	Ine
II. János Pál pápa már júniusi , majd szeptemberi levelében is bírálta a német püspökségek részvételét a terhes nőknek szervezett állami tanácsadásban , azt vetve a szemükre , hogy az igazolások kiállításával lehetővé teszik meg nem született életek elpusztítását .	kiállításával	31	Ins
A rendőrök keveset tudnak a szektáról , amely rendszeres és drága " önfelfedezési " szemináriumokat rendez .	szemináriumokat	14	Acc
Rezníkről az a hír járta , hogy a rendszerváltás előtt az állambiztonsági szolgálat alkalmazottja volt , tehát érthető volt Dubcek tartózkodása azzal az emberrel szemben , aki korábbi üldözői közé tartozott .	üldözői	28	Nom
Három magas rangú olasz katonatiszt a hidegháború idején fontos államtitkokat adott át a volt szovjet hírszerzésnek — vélik tudni a szerdai olasz újságok .	újságok	22	Nom
A török alkotmány úgy utal az államra , mint amelynek " területe és nemzete " van , szemben a nyugat-európai felfogással , ahol a nép alkotja az államot .	államra	6	Sub
A mondatot pontosan értette a vallató és a vallatott szerepében kényszerűen egyaránt járatos igazgató , és értetlenséget színlelve megtiltotta a költőnek , hogy szavai nyilvánosságot kapjanak .	szerepében	9	Ine
Egyelőre nincs végleges válasz arra , milyen utat kövessenek a szociáldemokraták a jövő évezredben — de arra sem , hogyan veszik majd az ősszel esedékes tartományi és helyhatósági választások akadályait .	évezredben	13	Ine
Egy magángyűjtemény képei címmel nyílik kiállítás ma a budapesti Szépművészeti Múzeumban .	magángyűjtemény	1	Nom
— Mozart operája örökérvényű remekmű , amelynek minden korban van mondanivalója .	remekmű	4	Nom
A Vecernji List című napilap úgy értesült , hogy a Dubrava kórházban lélegeztető készülékkel segítik Tudjman szervezetének működését , de az államfő nincs kómában .	kómában	23	Ine
Van viszont üldözés sítalpakon és sárkányrepülőn , motorcsónakon és olajvezetékben , és még egy atom-tengeralattjáró belseje is fontos szerepet kap , de ott már Bond az idővel is harcban áll , hogy megmenthesse az emberiséget .	sítalpakon	3	Sup
A megyei mentési feladatokkal a megyei védelmi bizottságokat bízták meg , ezek irányítását és az információszolgáltatást pedig az operatív bizottság végzi .	irányítását	12	Acc
1955-ben végzett a marosvásárhelyi főiskolán , több színháznak is tagja volt , de legnagyobb alakításai a Tamási Áron Színházhoz fűzik , ahol ma is dolgozik .	főiskolán	4	Sup
Kouchner erről a Párizsban rendezett balkáni újjáépítési fórumon beszélt .	fórumon	7	Sup
Decemberben , a kolozsváriak tervezett Vígszínház-beli vendégjátékán erről a budapesti közönség is megbizonyosodhat , amikor is majd Shakespeare Troilus és Cressidájának Teiresziászaként láthatjuk őt a magyar fővárosban .	kolozsváriak	3	Nom
Bernard Kouchner , az átmeneti ENSZ-kormányzat francia vezetője ugyan elvetette a Koszovó kantonizálását célzó javaslatot , ám azt is hangsúlyozta , hogy a szerbek biztonságának szavatolása érdekében fontolóra kellene venni egyes szerb közösségek ideiglenes átköltöztetését .	fontolóra	27	Sub
A diplomata ugyanakkor hozzátette : a restitúcióra csak kedvező politikai légkörben kerülhet sor .	légkörben	10	Ine
A kamionok nyári gumival , hólánc nélkül indulnak útnak — mondta Balogh András , a Veszprém Megyei Közútkezelő Kht. igazgatója .	hólánc	5	Nom
A törlesztés határideje 2000. január 31.	törlesztés	1	Nom
A Jutarnji List című ellenzéki napilap szerdai számának címoldalán A legrosszabb várható címmel arról adott hírt , hogy " többé már az intenzív kezelés sem segít " az elnökön .	hírt	15	Acc
Olyan énekes , aki tökéletes átéléssel , szenvedéllyel , humorral alakítja lírai , drámai és buffoszerepeit .	szenvedéllyel	7	Ins
Jó lenne ezt a tendenciát folytatni a 2000. évben is .	tendenciát	4	Acc
Ezért siettették az ítélet meghozatalával az ügy lezárását , és arra is számíthattak : az önálló Szlovákia megteremtésének láza el is tereli a figyelmet a gyanús körülményekről .	meghozatalával	4	Ins
A pályaudvari ceremóniára a hajdani " bajtársat " is meghívták .	bajtársat	6	Acc
A diákok egy helyen , kötetlen formában tájékozódhatnak a lehetőségekről , a vállalatok pedig széles körből , személyes benyomás alapján választhatják ki a legfelkészültebb jelentkezőt .	jelentkezőt	24	Acc
