Daljni smoter poučevanja v skoraj 50 podružnicah po vsem svetu je izločiti škodljive vplive iz življenja in s tem nadzirati lastno življenje .	izločiti	11	Perf
Od doma gre vedno urejena , kar pa ji ponavadi ne vzame veliko časa .	vzame	11	Perf
Takšno ravnanje ne bi bilo v prid niti zmernemu pitju , kajti od tisoč pivcev ne boste našli niti enega , ki bi mu bilo všeč , da mu o alkoholu pridiga sovražnik alkohola .	našli	17	Perf
» Z grafikami lahko naredite nekaj , česar kratko malo ne morete z nobenim drugim medijem .	morete	11	Imp
To pomeni dvoje : da talig ni v drevesu in da jih moramo , če jih hočemo dodati , zapeljati levo od vdilj .	dodati	17	Perf
Vse sodne instance so tožilsko zahtevo za preiskavo zavrnile , generalna državna tožilka pa se je pred tedni znašla med kandidati za nove ministre .	zavrnile	8	Perf
Osnova vseh opisanih sledilnih naprav je tehnologija VersaPoint , zato se po vodenju kazalca po zaslonu tako rekoč ne razlikujejo .	razlikujejo	19	Imp
Mleko naj bi se skisalo in jedi naj bi se pokvarile , če so se jih dotaknile ženske med mesečno krvavitvijo .	pokvarile	10	Perf
* Če nosite kontaktne leče , jih posebno skrbno čistite in shranjujte .	čistite	9	Imp
Ko ste izbrali želeno velikost zaslona , to potrdite z gumbom OK .	potrdite	8	Perf
Če se težko sprijaznite z njenim položajem , se skušajte mirno pogovoriti z njo .	pogovoriti	11	Perf
skozi liste izloči vodo ja	izloči	2	Perf
Ko je vse to prišlo na dan , sem mislila , da razpadam na koščke , dokončno pa je razpadla tudi moja iluzija o njem .	mislila	9	Imp
Obrnila se je , kot da bi začutila , da jo nekdo gleda .	začutila	7	Perf
veš ti si moraš sebi primerno izbrati razumeš da se s tabo stara da je pol da sta isto skupaj upognjena pa to [audience:laughter]	izbrati	6	Perf
Možno je , da bomo kakšno omejitev še omilili .	omilili	8	Perf
Spet segrejte halogo , dodajte mešanico miso in na počasnem ognju kuhajte tri minute .	kuhajte	11	Imp
Bila pa sem prava mora za sodnike , saj sem igrala zelo počasi .	igrala	10	Imp
V muzeju si je moč ogledati najrazličnejše čebelarsko orodje ter slikovno in drugo gradivo .	ogledati	5	Perf
Za razliko od drugih standardov v računalništvu se izdelovalci tu zadev lotevajo nekoliko drugače .	lotevajo	11	Imp
pa če še daneš zraven poljanška pa tam daleč planinška pa tam noter daš še enega kaj je že tisti ?	daneš	3	Perf
Brazilec s portugalskim potnim listom , ki je tekmo začel namesto Ruija Coste , je poskrbel za podajo , Maniche pa je z natančnim strelom poskrbel za pravi delirij v portugalski prestolnici .	poskrbel	25	Perf
DANES NA HRIBU OKROG NJEGOVE NAGROBNE PLOŠČE ČEPIJO ANTROPOMORFNE SKALE , NA KATERIH MRGOLI MALIH KUŠČARJEV MAVRIČNIH BARV .	MRGOLI	13	Imp
Tako je bogato obložena miza teden dni spremljala pustne norčije tja do zaključnega romanja na Ptuj , kjer so bili pustni krofi in drugo pecivo zakon .	spremljala	7	Imp
Da sovražniki ne bi mogli vstopati v cerkev na konjih , da roparji ne bi mogli v cerkev potisniti vozov , na katere bi tam nalagali dragocenosti …	vstopati	5	Imp
Suho listje jima je šelestelo pod čevlji , ko sta se plazila mimo opustelih gredic in praznih posod za rože proti hiši .	šelestelo	4	Imp
Skrb zbujajoče je , da se tik pred sprejemom nove ustave in pred vstopom novih članic napetost še povečuje .	povečuje	18	Imp
Strupenih živali na otoku ni , zato pa je mogoče naleteti na številne kuščarje , ki spominjajo na naše martinčke .	spominjajo	16	Imp
Potočniku je jasno , da obstajajo tehnični problemi , ne more pa pristati na to , da niso rešljivi .	pristati	12	Perf
Poudaril je , da si BiH nihče ne bi smel lastiti , kar naj bi po njegovem počela mednarodna skupnost .	Poudaril	0	Perf
Vzel si tist metadon , pol si šu pa vseen drogo iskat .	iskat	11	Imp
Za tožbo se je odločil , ker so zapisali , da naj bi sam direktor na leto zbral za 400.000 mark sponozorskih prispevkov , od katerih naj bi " v lasten žep vtaknil " 40.000 mark .	vtaknil	32	Perf
Da bi torej dokončno razjasnili stanje in ker družba v celoti vztraja pri svojem predlogu o nezakonitosti stavke in njegovi utemeljitvi , bo Comet podal pritožbo zoper izdani sklep sodišča .	vztraja	11	Imp
Ima vitko srednje veliko telo prelivajoče se rjave barve , spodaj je svetlejši .	Ima	0	Imp
Na njih so lahko prebrali , da je Nemčija polna lažnih azilantov in tujih delavcev na črno , ki imajo menda več pravic kot čistokrvni Nemci , poleg tega jim odžirajo delo .	odžirajo	30	Imp
Zato so na župana naslovili prošnjo , ki jo je podpisalo 69 mater oziroma očetov , naj v prvih razredih omogoči skupinsko pedagoško delo .	podpisalo	10	Perf
S pogledom sem ošinil svojega šoferja in se prepričal , da bo ostal miren in da se mi ne bo skušal približati ali pokazati , da se poznava .	prepričal	8	Perf
» Menimo , da je prav , da končno uresničimo zahteve ustavnega sodišča , ki je že leta 1996 zahtevalo takšno spremembo olajšav za otroke , da bodo neobdavčeni dohodki , nujni za preživljanje otroka .	Menimo	1	Imp
Leta 2000 so kljub zatrjevanju založnikov , da prodaja knjig pada , nekatere domače založniške hiše dosegle osebne prodajne rekorde , kar potrjujejo tudi številni ponatisi .	potrjujejo	22	Imp
Ne , če te hočejo pokončati , te bodo našli kjerkoli .	hočejo	4	Imp
Ob neki priložnosti je celo dejala , da sumi , da Moorova na drugi strani žice ni sama in da si nekdo zapisuje njun pogovor .	sumi	8	Imp
V vodi mrtvic se bohotijo nenavadne in redke rastlinske vrste , saj mnogih ne najdemo nikjer drugje v Sloveniji .	bohotijo	4	Imp
Od tega mojega idiotskega spodnjega rakurza se mi je zvrtelo , skoraj bi se razbil , ker sem se toliko nagibal nazaj .	zvrtelo	9	Perf
Ta mala , mehka bitja si izdelajo hišo iz snovi , ki je desetkrat trša od betona !	izdelajo	6	Perf
Ognjeni zublji so se hitro razširili na bližnjo stanovanjsko hišo in v celoti uničili leseno ostrešje .	razširili	5	Perf
Ugibala sem , ali ima to kakšno zvezo z dogodkom v garderobi .	Ugibala	0	Imp
a super jaz tudi malo nič malo visim na kompu pa malo facebook pa take fore saj veš	visim	7	Imp
Primeri iz prakse prikazujejo izvirnost in inovativnost učiteljev na tem področju .	prikazujejo	3	Imp
Preprosto je nadaljeval z nasiljem , ki ga je že predhodno izvajal in se je tokrat končalo z dvojnim umorom .	nadaljeval	2	Imp
Hitreje in bolj zanesljivo skozi ovinke : novi variabilni zaporni sistem odpravlja večino slabosti klasične diferencialne zapore , zato nudi več voznih užitkov na različnih cestnih podlagah .	odpravlja	11	Imp
» Spustil bom može iz laboratorija , da pregledajo stanovanje , nato pa ti dostavimo truplo .	dostavimo	14	Perf
Vatanenu je pojasnjeval stare verske običaje in rituale , pri čemer je dodal , da sam ni prevzel enakih navad kakor predniki pred tisoči let .	dodal	12	Perf
Če otroka piči čebela , osa ali sršen , ga skrbno opazujemo zaradi znakov preobčutljivostne reakcije , kot so huda bolečina , oteklina , oteženo dihanje .	piči	2	Perf
Z ultralahkim letalom in brez helikopterskega spremstva ni samostojnega preleta čez Sibirijo doslej opravil še nihče .	opravil	13	Perf
Le kako je bilo pri duši nesrečnemu Janezu Kohku , ki so mu odpovedali že napovedano operacijo in se je z bolečo ključnico iz bolnišnice vrnil domov ?	odpovedali	13	Perf
Poiščimo na tej sliki besedo kan .	Poiščimo	0	Perf
Autosport poroča , da je posel sklenjen , čaka se le še na uradno potrditev , ki naj bi prišla v naslednjih dneh .	poroča	1	Imp
NJEGOV SPOL SO ODKRILI ŠELE PO SMRTI , ČEPRAV JE ŽE VRSTO LET ŽIVEL Z ŽENSKO , KI PA TUDI NI VEDELA ZA NJEGOV SPOL .	ŽIVEL	13	Imp
V taksiju sta se pogovarjala .	pogovarjala	4	Imp
film črpa iz bogate in neizčrpne dediščine serije satir gola pištola	črpa	1	Imp
To je vprašanje za predsednika državnega zbora , predvsem pa je vprašanje za vodje poslanskih skupin in predsednike delovnih teles , ki se ukvarjajo s temi zadevami .	ukvarjajo	23	Imp
Tako so začele muslimanske oblasti v zveznih državah , kjer so muslimani v večini , uvajati šariatske zakone , s čimer pa tamkajšnji kristjani niso bili zadovoljni .	uvajati	15	Imp
Prav takega igralca bi potrebovali , se je pošalil .	pošalil	8	Perf
To je bilo prvič , da sem opazil , da te je lahko ravno tako strah , če od spodaj gledaš zelo visoko , kot če od zgoraj gledaš zelo globoko .	gledaš	28	Imp
Tako je kmečka Ljudska stranka ( PSL ) lani ustvarila največji dohodek ( okoli 27 milijonov dolarjev ) , ko je prodala več kot 80 objektov in lokalov .	prodala	21	Perf
Slišati pa je tudi , da se je ZLSD z LDS že dogovorila , da naj bi v morebitnem drugem krogu podprli Viko Potočnik , če se bo ta " spopadla " s pomladnim protikandidatom .	podprli	21	Perf
Ko se je nadaljevalo sojenje predsedniku Clintonu , je ta v svojem letnem sporočilu predlagal , da bi okrog 2,7 bilijona dolarjev načrtovanih proračunskih presežkov v naslednjih 15 letih namenili za pokojninski sistem .	nadaljevalo	3	Imp
V nejeveri je gledal , ko je Alex Cross ustrelil Willa Rudolpha na cesti Chapel Hilla .	gledal	3	Imp
in zgolj za primer preko sto tisoč evrov da naša država tudi delavka mure tudi vsi mi za to da leto dni stoji plakat v b [gap] na bruseljskem letališču	stoji	22	Imp
vi morate vedeti da eee nekdo ki želi nekoga umoriti kot so nekateri patološki morilci ki so v zadnjem času eden je tudi pred nekaj časa v sloveniji moril	moril	28	Imp
S sprejemom v OZN je bilo Sloveniji omogočeno , da se je lahko včlanila v številne mednarodne gospodarske , finančne , kulturne , športne in druge organizacije .	včlanila	13	Perf
Pri nas pomanjkanje časa ( verjetno ) še ni tako pereče , da bi v kakšnem izmed podjetij že razmišljali o tem , da bi učinkovitost dela proizvodnega in vodstvenega kadra izboljševali s takimi metodami .	razmišljali	19	Imp
Armaturna plošča je oblikovno dokaj trendovska , a opremljena s skrbno razmeščenimi instrumenti , vendar se je treba na njihovo razporeditev privaditi .	privaditi	21	Perf
Tako spremenjene informacije nihanja po dovodnem kablu pripeljejo v elektrodo , ki je navadno nameščena na bolnikovem hrbtu tako , da na njej leži .	leži	23	Imp
Dodajte koščke jagnjetine , ki ste jih prej povaljali v moki , in jih pecite , dokler ne porjavijo .	porjavijo	18	Perf
Znanstvenike njihova božanska radovednost in neustavljivi entuziazem zaslepita do te mere , da praviloma niti ne uvidijo možnih negativnih posledic svojega dela , prav tako pa jim nikoli v zgodovini ni uspelo nadzirati družbenih posledic svojih odkritij .	uvidijo	16	Perf
Vse te in kasnejše razširitve domen in diskurzev javne komunikacije niso vse do najnovejšega časa bistveno spremenile aristotelovske razdelitve in njene osnovne koncepcije .	spremenile	16	Perf
pa če noče zaspati ko je še mala pa ji špilaš pred posteljico veš [audience:laughter] tako delaš ti di di pa še igraš	igraš	22	Imp
V žrebanje bodo uvrščeni vsi pravilni odgovori , ki bodo prispeli v času trajanja nagradne igre , tj. med 1. marcem in 16. majem 2004 .	prispeli	10	Perf
Če se prav spominjam , je kot opravičilo navajal , da je prezaposlen v matični hiši .	navajal	8	Imp
Pojavili se bodo namreč nasprotniki , ki bodo trdili , da bi bilo odstranjevanje napisov v angleščini nedemokratično .	trdili	8	Imp
Na redni tiskovni konferenci policijske uprave Ljubljana so nam izročili fotografije policistov , ki naj bi ju bili trije fantje pred lokalom Breskvar tako močno zbrcali , da sta zaradi poškodb morala na bolniški dopust .	izročili	9	Perf
Osnovna šola iz kraja , od koder prihajam , ima v sedanjih prvih petih razredih po tri paralelke .	prihajam	7	Imp
V svetu , ki ga šele začneš spoznavati , v katerem še nisi osvojil razumevanja in orodij , s katerimi se lotevaš različnih problemov , se vsaka težava zdi ogromna .	spoznavati	7	Imp
skozi da se res spreminja	spreminja	4	Imp
Če smo še pred desetimi leti živeli v Jugoslaviji , se še vedno radi spominjamo pozitivnih in lepih trenutkov , ki so se nam tedaj dogajali .	dogajali	25	Imp
Opiši jo .	Opiši	0	Perf
Predlagani proračun za leto 2002 znaša 2,412 milijarde tolarjev , zadolžiti pa se nameravajo za 94 milijonov tolarjev	znaša	5	Imp
Samica pripravi na samčevem teritoriju gnezdo in vanj odloži ikre .	odloži	8	Perf
Veliko dejavnikov vpliva na to , kako bo sadje uspevalo na našem vrtu , na nas pa je , da jih pravilno ocenimo in izberemo našim razmeram najustreznejše sorte .	uspevalo	9	Imp
Najine oči so se srečale .	srečale	4	Perf
Zvenela je nekam ljudsko , domače , mehko , hkrati pa je bila zvokovno tako bogata in široka kot malokatera preprosta skladba .	Zvenela	0	Imp
Spet segrejte halogo , dodajte mešanico miso in na počasnem ognju kuhajte tri minute .	segrejte	1	Perf
Ta je še zmeraj v službi v 1. policijski postaji , toda iz mesta namestnika poveljnika postaje so ga premestili na detektor laži .	premestili	19	Perf
[audience:laughter] [name:personal] [name:surname] je že starejša oseba ki je že pred enim letom vstopila v tretjo fazo življenja se pravi v penzion	vstopila	13	Perf
Oba oškodovanca pogrešata vsak svoj avtoradio .	pogrešata	2	Imp
V finalu bo nastopilo 52 parov iz Dolenjske , Bele krajine , Posavja , Trbovelj in Zagorja .	nastopilo	3	Perf
to ropota kot hudič	ropota	1	Imp
Terme Čatež so se že v preteklosti izrekle , da ne želijo razvijati takšnega tipa turizma , Terme Olimia iz Podčetrtka imajo drugačne investicijske načrte .	izrekle	7	Perf
V ugotovljenih primerih nezakonite posesti in nošenja orožja smo sprožili ustrezne postopke .	sprožili	9	Perf
Zmedo , ki nastane v takih primerih , lahko bistveno zmanjšamo , če se tuje jezike učimo s tem programom .	zmanjšamo	10	Perf
Druga ne prevaja , ampak ponudi v nekaj različnih jezikih jezikovne možnosti s pomočjo izpeljanke na vpisano besedo , glagol …	ponudi	5	Perf
Ustavil ga je , pokazal , kam naj pelje in fant je ubogal .	Ustavil	0	Perf
Napotili sva se naprej proti novi trgovini .	Napotili	0	Perf
Druga ne prevaja , ampak ponudi v nekaj različnih jezikih jezikovne možnosti s pomočjo izpeljanke na vpisano besedo , glagol …	prevaja	2	Imp
Seveda zdravniki ne zanikajo vrednosti psihiatrije in pomena svojih kolegov , ki se ukvarjajo s tem , nastopajo le proti nekakšnemu kultu , ki je obdal psihiatre .	ukvarjajo	13	Imp
upam da kakšen od odgovornih je že zbujen in posluša	posluša	9	Imp
Razpravi o sovražnosti med kulturami je do pred kratkim primanjkovalo dejstev , ki bi jo podprla .	primanjkovalo	9	Imp
Pri IBM so morda hoteli z imenom svojega novega operacijskega sistema povedati , da bodo njegove sposobnosti videti čarobne .	hoteli	4	Imp
Tudi najučinkovitejši izvozniki so v zadnjih tednih razlagali , da bi se bilo treba na fiksiranje tečaja tolarja bolje pripraviti .	razlagali	7	Imp
“ Doslej smo le opazovali in nismo ukrepali .	ukrepali	7	Imp
Če pa se tečaj ponovno odbije od 20.000 tolarjev , lahko pričakujemo vsaj petodstotni porast .	odbije	5	Perf
Poraženci za kaj takega nimajo časa , saj se morajo umikati .	umikati	10	Imp
- Z DNEM PRENEHANJA VELJAVNOSTI DELOVNEGA DOVOLJENJA POGODBA O ZAPOSLITVI , KI JO SKLENE TUJEC ALI OSEBA BREZ DRŽAVLJANSTVA , PRENEHA VELJATI PO SAMEM ZAKONU .	PRENEHA	20	Perf
Naknadne posevke sejemo za vrtninami , ki jih že poleti pospravimo .	sejemo	2	Imp
Ja , tudi iz Poljske sem dobivala veliko pošte mojih občudovalcev .	dobivala	6	Imp
Po odzivih bi lahko sklepali , da jim je za poklic policista uspelo navdušiti lepo število otrok .	sklepali	4	Imp
Med metom prosto vrvico držimo v levi roki .	držimo	4	Imp
Postalo me je malo sram , da tako govorim , vendar se nisem mogla zadržati .	zadržati	14	Perf
Spodbuja k pozitivnemu mišljenju , dejavnosti in odprtosti .	Spodbuja	0	Imp
jaz sem crkovala ej od smeha	crkovala	2	Imp
Komisija je zahtevo za revizijo postopka zavrnila z razlago , da v reviziji postopka oddaje javnega naročila ni mogoče oddati začasne odredbe .	oddati	19	Perf
Kot otrok sem brcal žogo pred blokom , nato pa je prišla zamisel , da bi začel trenirati v nogometnem klubu in prišlo je do vpisa v Primorje .	trenirati	17	Imp
Renton odide na stranišče in za seboj zaklene vrata .	zaklene	7	Perf
Želi še kdo obrazložiti svoj glas .	Želi	0	Imp
Naslednji dan se je Vatanen z zajčkom napotil v heinolsko banko .	napotil	7	Perf
Vsakič , ko vstopim v kuhinjo , ga nežno pobožam in mu rečem kakšno lepo besedo .	vstopim	3	Perf
Na skupno občinsko vajo bodo povabili tudi ekipo gozdarjev , saj imajo letos v " načrtu " gozdni požar .	povabili	5	Perf
Po zasedanju izvršnega komiteja jo bo sporočil predsednik FIFA Joseph Blatter .	sporočil	6	Perf
" Odigrala sva zelo zanesljivo , tudi v finalu sva ostala mirna , potem ko zaradi nekaj napak dvoboja nisva zaključila že po dveh nizih .	Odigrala	1	Perf
Mleko naj bi se skisalo in jedi naj bi se pokvarile , če so se jih dotaknile ženske med mesečno krvavitvijo .	skisalo	4	Perf
EUA je začela priprave na konvencijo že takoj po praškem vrhu , k delu pa je pritegnila vsa svoja uradna telesa in članice .	pritegnila	16	Perf
To je bil imeniten obračun in upam , da jih tudi na evropskih ne bo manjkalo , " je dejal po dirki Rossi .	manjkalo	15	Imp
V prošnji so zapisali , da bi se pri takšnem delu učiteljica in vzgojiteljica laže posvetili tistim učencem , ki imajo pri pouku težave , oziroma laže dodatno zaposlili tiste , ki nekatere dele učnega programa že obvladajo .	zaposlili	28	Perf
Širil se je in se v orjaških obročih vrtinčil pod nebo .	vrtinčil	8	Imp
Ko vemo , kam sodi naša vsebnost sečnine , iz preglednice 4 odčitamo , kaj je potrebno spremeniti pri krmljenju .	sodi	4	Imp
Šlo je za primer generala srbske vojske , ki je pisal dnevnik in v njem opisoval tudi vojne zločine , ki so jih zagrešili .	opisoval	15	Imp
Njegovo breme je vrgla na ramo , čeprav se je tudi sama že komaj vlekla po razmočeni cesti .	vrgla	3	Perf
Razburjeni Rus je z dodatnim strelom zadel le 8,6 kroga in moral zlato kolajno prepustiti rojaku Mihailu Nestruevu .	prepustiti	14	Perf
Hotel sem oditi , toda Pastirica me je povabila , naj pogledam proti judu .	oditi	2	Perf
Motomontaži je že septembra istega leta uspelo pridobiti pogodbo za montažo avtomobilov DKW v Jugoslaviji .	pridobiti	7	Perf
Namesto Rodeta si tako privoščim novega slovenskega Freuda , Vic in njegov odnos do nezavednega , pravkar izšlo v zbirki Analecta .	izšlo	17	Perf
Losjon Ceramide Defining Eye Brightener , ki ga nanašamo pod ličila , je primeren za vse vrste kože , ki se spopadajo s težavami staranja .	nanašamo	8	Imp
jaz bi se kar preselila na primorsko	preselila	4	Perf
» Nisem vedel , da so želve del detektivske opreme , « se je posmehnil in jo odložil na tla .	odložil	17	Perf
Mislm , mat ga je kar ven pelala v tistmu vozičku .	Mislm	0	Imp
Od glave na koncu ostanejo le lobanja in čeljustne kosti .	ostanejo	4	Perf
Pomembnejše pesmi označuje nekoliko obširneje in si pri tem prizadeva , da bi opozoril tudi na artistično stran Župančičevega ustvarjanja , na slog , muzikalnost in zgradbo pesmi .	označuje	2	Imp
medtem ko slovenska policija o interesu preiskave še kar molči je skop z besedami tudi bodoči pravosodni minister	molči	9	Imp
Kdaj je nazadnje pred vašo hišo pripeljal tovornjak in jo skorajda zasul z več tonami premoga , s katerim ste se potem greli vso zimo ?	greli	22	Imp
V požaru je zgorela nočna omarica , zavesa , parket , preproga , knjige in posteljnina .	zgorela	3	Perf
Spominjam se , da smo se takrat na igralski akademiji pogovarjali o možnosti , da bi zunaj gledaliških institucij začeli z novim teatrom , ki bi se razlikoval od senilnega socrealističnega gledališča .	Spominjam	0	Imp
Pri postavljanju razstave lahko učenci uporabljajo usvojena znanja s področij plastičnega oblikovanja in oblikovanja prostora , ki pa imajo v okviru te zaposlitve sekundarno vlogo .	uporabljajo	5	Imp
Martinovanje z mladim vinom , pečenimi goskami in drugimi dobrotami je privabilo v Laško več ljudi , kot so si upali napovedovati tudi največji optimisti .	privabilo	11	Perf
Sam bolečino pa zdej zamena grda , gola , črna depresija .	zamena	4	Perf
eee gor ste pa tudi najbrž prebrali priporočila tega zdravnika iz celja	prebrali	6	Perf
Po prvih počitnicah se je John vrnil bled in napet .	vrnil	6	Perf
Tudi jaz sem se podil po trgcu : snemal sem turiste , ki so hodili po granitnih ploščah , svojega brata Charlesa , nekaj mulcev , ki so se kotalkali , plesalca , ki je oponašal robota .	podil	4	Imp
Se oproščam , ker govorim za podatke za januar , ker je to pač izhodišče za proračun , ki smo ga sprejemali , da je primerljivo v bruto nacionalnem dohodku .	govorim	4	Imp
Prepoznaven je po naprej potegnjeni maski z dvema hudomušno okroglima žarometoma , dokaj temeljitemu vetrobranskemu steklu in kratkemu zadku , ki ga zaključujeta nosilec za kovček in strešica v spodnjem delu .	zaključujeta	22	Imp
Tanin se je v zadnjih letih reševal z odkupom na slovenskem trgu , kjer je vzpostavil mrežo odkupovalcev , oblikoval pogodbene sekaške ekipe in vzpodbujal k sanitarni sečnji kostanja .	reševal	6	Imp
Kar videla sta , kako jim žarijo oči in kako s ponosom pritrjujejo , da je to prav tista violina , s katero je Žiga zmagal .	pritrjujejo	12	Imp
Neki tinjanski podložnik je pobil beneškega vojaka , ki je iz Poreča v Brest nesel pošto .	pobil	4	Perf
Okolje , v katerem se gibljete , bi vas bolje sprejemalo , če bi bili večkrat dobre volje in prenesli svojo vedrino tudi na druge .	gibljete	5	Imp
Finci so pač domnevali , da kupci njihovih slušalk Bluetooth uporabljajo tudi njihove mobilnike .	domnevali	3	Imp
- pri krstu majhnega otroka se po možnosti udeleži priprave na krst ; pri krstu dejavno sodeluje in po krstu z zgledom in molitvijo podpira krščenca .	udeleži	8	Perf
Preizkušali sta najrazličnejše trenerje in učitelje jahanja , prebirali knjige o umetnosti jahanja ter gledali nastope svetovne dresurne in skakalne elite .	prebirali	8	Imp
Žrtvi so zvezali zapestja na hrbtu in jo privezali na škripec .	privezali	8	Perf
» Spričo odhoda na Japonsko te je Veliki kan razrešil guvernerske funkcije .	razrešil	9	Perf
Odbor je sklenil , da bo režijo ponudil Miletu Korunu , takratnemu stalnemu režiserju v ljubljanski Drami .	sklenil	2	Perf
» Jaz sem Abu Seif , « je zadonelo v moji glavi in istočasno se mi je prikazala slika človeka , ki je v rokah vihtel krivo , arabsko sabljo .	vihtel	25	Imp
Razburjeni Rus je z dodatnim strelom zadel le 8,6 kroga in moral zlato kolajno prepustiti rojaku Mihailu Nestruevu .	zadel	6	Perf
Ne morš ga falit .	morš	1	Imp
Dobili pa smo tudi očitke , da smo si sami izmislili teroriste IT in da želimo le povečati prodajo .	povečati	17	Perf
Ker je več kot očitno , da je vodilna kultura že posrkala vse subkulture , jih prežvečila in zmešala z drugimi , bi bilo nespametno neki nočni klub voditi le za absolutno alter sceno .	voditi	28	Imp
Nekoč so tod živeli tudi do meter veliki , o katerih so menili , da so že davno izumrli .	menili	12	Imp
V istem Terezijinem delu lahko preberemo : “ Vrtnar , ki goji kak sad s prav izredno skrbnostjo , da bi mu dozorel pred časom , ima pri tem poseben namen .	goji	11	Imp
Vino zmešamo s pomarančami in sokom ter ponudimo .	ponudimo	7	Perf
kaj pa prva dajmo prvo pogledati še enkrat	pogledati	5	Perf
V tem primeru bi začela veljati s 1. julijem .	veljati	5	Imp
Nekaj si si vendarle moral misliti .	misliti	5	Imp
V naslednjem trenutku sem čutila samo tresenje in močan udarec .	čutila	4	Imp
Mislim , da je zares velik dar srečati takega človeka .	Mislim	0	Imp
Delovni vizum je torej v bistvu dovoljenje za prebivanje tujca zaradi zaposlitve in se praviloma izdaja za čas veljavnosti delovnega dovoljenja .	izdaja	15	Imp
Ne smemo pa pozabiti , da je slika le posrednik , ki simulira njegovo prisotnost .	pozabiti	3	Perf
Geoplin je namreč še vedno med zadnjimi na Agenciji za privatizacijo in prestrukturiranje in se mu lahko zgodi , da bo prešel v last Slovenske razvojne družbe .	prešel	21	Perf
Ministrstvo je tudi preučilo devizni in tolarski del cene plina ( prvi znaša dobrih 89 odstotkov ) .	preučilo	3	Perf
recite mi kaj bova špilala nocoj	recite	0	Perf
Njegovi opogumljeni nasprotniki so prihrumeli na ulice in nenadoma je bil Milošević bivši predsednik , ne da bi bil odjeknil en sam strel .	odjeknil	19	Perf
S prvim januarjem 2003 naj bi sedanjo VVO nasledil vrtec Ciciban s sedežem v Ragovski ulici , od nje pa se bo odcepil novi javni zavod vrtec Pedenjped v Šegovi ulici .	nasledil	8	Perf
Toda take izsiljene rešitve ne trajajo dlje kot razmerje sil , ki jih je diktiralo .	trajajo	5	Imp
Mobilizira svojo armado v Galiciji , da bi Rusiji onemogočila poslati svojo glavnino na Krim .	onemogočila	9	Perf
New York Times poudarja , da bi utegnil omenjeni predlog povzročiti razhajanja med tistimi republikanci , ki so naklonjeni krepitvi ameriške vojaške moči , in zagovorniki " večje discipline " na področju proračuna .	poudarja	3	Imp
Ti so slovenski jezik ohranili kot materni jezik in se priučili jezika okolja .	ohranili	4	Perf
Superprevodniki imajo namreč še eno zanimivo lastnost : iz svoje notranjosti izrivajo magnetno polje .	izrivajo	11	Imp
Gora pa se je še vedno zibala navkreber , pod nebo .	zibala	6	Imp
Treba je spoštovati red in bolniki ne smejo hoditi naokrog kar v svojih oblekah !	hoditi	8	Imp
Enako jih imenujejo tudi zdravniki , opisujejo pa kot drobne ulkuse razjede , ki se lahko pojavljajo posamezno ali v skupinah na notranji strani lic , ustnic ali pod jezikom .	opisujejo	6	Imp
Veliki brat je pozabljen , na sceno stopa Veliki želodec .	stopa	7	Imp
In če bodo podpisali vsak blok , ki so ga dobili , ne morejo ničesar utajiti , ne da bi postali sumljivi ! "	podpisali	3	Perf
