Danes so vojne drugačne , ljudje in narava so se v stoletjih verjetno manj spremenili .	spremenili	14	Perf
V pogovoru je priznala , da je ecstasy in amfetamin nabavljala že od sredine lanskega leta od 24 - letnega D. Š. iz Kopra , ki ji je v tem času dal za uživanje najmanj 20 tablet ecstasyja .	nabavljala	10	Imp
Glavata želva je edina v Jadranu stalno prisotna vrsta morskih želv , v Mediteranu pa poleg nje gnezdi le še t. i. zelena želva .	gnezdi	17	Imp
Tako da ji je , kadar je spregovorila , porumenila glas grenkoba in prsti so ji tolkli po pasu kakor ključi .	tolkli	16	Imp
Resno drhtenje , ki ga je spremljala mučna slabost v želodcu , jo je preplavljalo v močnih valovih , ki se niso hoteli umiriti , naj si je še tako prizadevala .	prizadevala	30	Imp
Ko je človek do kraja prepričan , da je vse neresnično , res ne ve , čemu bi se trudil , da to dokaže .	trudil	19	Imp
Ob razformiranju Prirodoslovne matematične fakultete so k FAGV pridružili še študij biologije in jeseni leta 1961 se je ustanova preoblikovala v Biotehniško fakulteto .	pridružili	8	Perf
Trenutno se oborožujejo z glasbenimi naslovi .	oborožujejo	2	Imp
NOVO MESTO - Planinsko društvo Novo mesto vabi planince na zimski vzpon na Veliki Javornik ( 1023 m ) , ki bo v soboto , 4. februarja .	vabi	7	Imp
LJUBLJANA , 15. Kot smo že poročali , je ustavno sodišče zavrnilo pritožbo gradbenih podjetij SCT in Impregilo .	poročali	6	Imp
Ekstremno resno so nam zabičali , da njihovih imen ne smemo javno objaviti , ker si pač ne želijo publicitete .	zabičali	4	Perf
Lisa je premišljeno zganila in nato raztrgala papir , ki ga je držala v rokah .	raztrgala	6	Perf
V ponedeljek izide razpis za vpis v srednješolske programe v letu 2002 / 2003	izide	2	Perf
če dovolite … glejte mi dovolite … a mi dovolite da dam en predlog	dam	11	Perf
Najmanj sto let lahko dočakaš .	dočakaš	4	Perf
Miso v skodelici zmešajte z dvema žlicama hladne vode .	zmešajte	3	Perf
Nemoteno delovanje zagotavljajo obsklepne vezi in sklepna ovojnica ter normalno delujoče mišice , ki se pritrjajo okrog sklepa .	zagotavljajo	2	Imp
Kot prva je v svojem programu izvajala tudi aksel .	izvajala	6	Imp
Razvojni krog hruševe rje je naslednji : zelo nežne spore ( bazidiospore ) s smrdljivega brina v pozni spomladi okužijo hruševo listje .	okužijo	19	Perf
Sprašujem se , zakaj je predsednik vlade Drnovšek tako priljubljen , saj pravzaprav ne počne nič .	Sprašujem	0	Imp
Prepričan sem , da je terjalo veliko korajže , je svečano rekel Tom .	terjalo	5	Imp
Ameriško vesoljsko plovilo Columbia se je po 17 dneh spet vrnilo na trdna tla .	vrnilo	10	Perf
Z naravnimi sredstvi ostanete kljub daljšim poletnim večerom v formi	ostanete	3	Perf
Kritiki sistema to najpogosteje prikazujejo s teoretičnim modelom , po katerem bi stranka , ki bi v vseh okrajih dobila poslance z 51 odstotki glasov , zasedla ves DZ .	zasedla	26	Perf
Ob koncu potovanja bodo izdali literarni potopis .	izdali	4	Perf
- Zamislite si položaj , v katerem si želite nastopiti mirno in sproščeno .	Zamislite	1	Perf
Osnovni razlogi za uporabo krajevnega spleta so enaki razlogom , ki so povzročili eksplozivni razmah Interneta v zadnjem letu in pol .	povzročili	12	Perf
Na bojnih džunkah so mongolski vojaki sestavljali katapulte in topove .	sestavljali	6	Imp
Kot je poročal francoski gospodarski časnik Les Echos , naj bi lani s prodajo preko 270 milijonov steklenic šampanjca porušili " vse rekorde " .	poročal	2	Imp
Eno najprimernejših mest za odlaganje jajc bi bila v hrvaškem delu Jadrana lahko peščena plaža na Lopudu , vendar se ji želve zaradi obilice kopalcev pač izogibajo .	izogibajo	26	Imp
Otroška leta in čas osnovnošolskega šolanja preživi v Brežicah .	preživi	6	Perf
Lani so na občinskih , regijskih in državnih tekmovanjih osvojili kar 11 pokalov .	osvojili	9	Perf
Že pred letom in pol sem povedal , da je kapitala za lastninjenje v eni zavarovalnici in pozavarovalnici ( gre predvsem za vrednotenje zavarovalnice Triglav in pozavarovalnice Sava ) za približno 500 milijonov mark .	povedal	6	Perf
Prazgodovinski strip v naših najpomembnejših dokumentih na žalost ni ravno doprinos k identiteti sodobne Slovenije , izpričuje bolj otroško dobo slovenske državnosti ( in nekaterih državnikov ) .	izpričuje	16	Imp
Zaradi vlage se radi zvijajo .	zvijajo	4	Imp
eee ki te mačke pobira pa jih domov nosi pa	pobira	4	Imp
Odkar je Drow opazil temni oblak , še ni uporabil mreže .	uporabil	9	Perf
Marsikateri seksualno sprevrženi Kozorog se poslužuje hujših oblik sadizma , kot so denimo igrice » ujetništva « .	poslužuje	5	Imp
aaa kjer eee se trudimo to aktualizirati eee te dogodke pač tako da eee se da vsepovsod videti kje nastopamo kako pa kaj	nastopamo	19	Imp
Sabina je stara 15 let in si že štiri cikluse vsak večer zapisuje telesne znake , ki jih opazi čez dan .	opazi	18	Perf
» Kakovosten razpis bo opravil prvo selekcijo in privabil primerne kandidate .	opravil	4	Perf
Občutljive ljudi lahko z resnico prizadenete .	prizadenete	5	Perf
To pa pomeni , da podjetnik , ko obračunava kilometrino , ne sme obračunati nobenega drugega stroška , ki se nanaša na uporabo osebnega avta v službene namene .	obračunati	13	Perf
Če je Bog lahko trdil , da je " tisti , ki je " , bi se lahko človek nasprotno definiral kot " tisti , ki ni " .	trdil	4	Imp
Previdno zakoračim v trdem snegu v prečnico proti levi , kjer skalna klada v pobočju zadržuje sneg in tvori snežni grebenček .	tvori	18	Imp
Komaj kje v Emoni so našli sledove zidanega ognjišča .	našli	5	Perf
Vendar pa če bodo študije še naprej prikazovale , da so samo za polovico varnejši , je vprašanje , ali jih bomo obdržali na listi .	prikazovale	7	Imp
Zdrava hrana naj bi krepila imunski sistem in ohranjala zdravo kožo .	krepila	4	Imp
Kot smo poročali v prejšnji številki Mladine , so volilci najbolj razočarali socialne demokrate SPD .	poročali	2	Imp
Oven naj hvali Levovo seksualno tehniko , Lev pa naj se potrudi , da v Ovnu ne bi zatiral prirojene potrebe po prevladovanju .	hvali	2	Imp
Njegova svetloba bo prepričala marsikatero rastlino , da bo še vztrajala v cvetenju , razkošju barv in želji , ugajati nam .	prepričala	3	Perf
Hugo Friedrich je v delu Struktura moderne lirike poudarjal , da pri sodobnih pesnikih prevladuje tisti tip , ki se ponavadi imenuje genitivna metafora .	poudarjal	8	Imp
Potem imamo ponovno analizo zbranih podatkov , v kateri sta Aaron Wildavsky in Karl Dake6 povezala naravnanost do tveganja s političnimi preferencami .	povezala	15	Perf
Kandidati , ki izpolnjujejo z zakoni predpisane pogoje , naj pošljejo prijave z dokazili v 8 dneh po objavi razpisa na naslov šole .	izpolnjujejo	3	Imp
Kazalo je , da ga navdaja neka misel , za katero se ne more takoj odločiti .	Kazalo	0	Imp
če pa ti borta nekdo je pa ja bolje da ti poborta	poborta	11	Perf
Vedela sem , da bi me zadavila , če bi jo zbudila ob tej uri .	zadavila	6	Perf
Tako nam ni preostalo drugega , kot da smo pustili nepopito pijačo in odšli .	pustili	9	Perf
Njihovo vlado so vodili majhni fevdalni plemiči vojščaki , ki so uporabljali na novo izumljeni bojni voz s konjsko vprego .	vodili	3	Imp
Mlada vojaka , ranjenca , ki okrevata , se " pred prijazno krčmo pod cvetočo lipo " pogovarjata o ljubezni do ženske in jo hvalita .	okrevata	6	Imp
To pa je lahko zelo neprijetno tako za mladostnika kot za njegove starše , kajti starši z velikim zadovoljstvom opazujejo , kako njihov otrok na svojem začenja živeti samostojno življenje .	začenja	26	Imp
Avstrijec je strelivo na sopotnikovem sedežu prekril s kapo in papirji v upanju , da ga bodo naši obmejni organi spregledali .	prekril	6	Perf
poglejte kako se streže to v tujini	streže	3	Imp
Prah mu je drsel pod dlanmi , prsti so se ugrezali v blato .	drsel	3	Imp
Koksibi te ne zaščitijo , če imaš težave z ledvicami , ki jih imajo številni bolniki , dvigujejo krvni tlak .	dvigujejo	17	Imp
Dijaki z učiteljem kritično ( pisno ali ustno ) ocenijo uprizoritveno besedilo , opravijo prve korekture in pretehtajo možnosti postavitve .	pretehtajo	17	Perf
Dobro je gospodaril in bogastvo se mu je množilo .	množilo	8	Imp
Mislim , da gospa Ravbarjeva podcenjuje parlament , konec koncev v našem parlamentu tudi nekaj vemo o gospodarstvu .	podcenjuje	5	Imp
Je izginila v nenavadnih okoliščinah ?	izginila	1	Perf
ČLENU ZOBR POSEBEJ UREJA TUDI ODPOVED POGODBE O ZAPOSLITVI .	UREJA	3	Imp
" Ne bo , " izjavi sprevodnik tramvaja .	izjavi	5	Perf
Na sredi Medine so stali vojaki v obliki pravokotnika , okrog pa je bila množica opazovalcev .	stali	4	Imp
Ko je Victor dvignil fotoaparat , je Prosper skoraj že tekel .	tekel	10	Imp
Lani je napisal odmevno izjavo Izvensodni proces in v njej protestiral , da so ga mediji drug za drugim brez ovinkov obtožili in hkrati že obsodili , češ da je kriv nezakonite in koristoljubne zlorabe uradnega položaja .	obsodili	25	Perf
Okvirji zagotavljajo šabloni stabilno obliko .	zagotavljajo	1	Imp
S projektom , ki vključuje tudi razstavo originalnih del , objavljenih v antologiji , stripovske delavnice , jam sessione in predavanja , so letos gostovali že v Budimpešti , Poitiersu , Bourgesu in Parizu .	gostovali	24	Imp
Danes spoznava , da se življenje vedno bolj odvija po njegovih željah .	odvija	8	Imp
Toda spet jih je presenetil , ko je v bliskovitem manevru na dagestansko - čečenski meji zajel 22 ruskih policistov , ki jih je potem čez nekaj dni izpustil .	zajel	16	Perf
Begbiejeve bojevite oči , odprt gobec pa zamrznena faca se stran obrnejo pa probavajo nekak dojet to informacijo pa se odločt , a je to zdaj v redu , slabo al pa ga totalno boli kurac za vse skupi .	odločt	20	Perf
Popolno ljubezen ima lahko tudi tisti , ki ni krščen , ki je druge vere , če si prizadeva živeti v skladu s svojo vestjo in svojo vero ter se svojih grehov iskreno kesa .	kesa	33	Imp
Izbrana priležnica je pokleknila in se s ponižnim nasmehom prizadevno lotila opravila .	lotila	10	Perf
K ponižnemu človeku se sklanja Bog , ponižnemu daje veliko milosti in po ponižanju ga povišuje v slavo .	povišuje	15	Imp
o čakajte to m [gap] … m [gap]	čakajte	1	Imp
Mislili smo na srečne dni otroštva in zdihovali .	zdihovali	7	Imp
V obratu bi lahko na leto predelali 6,5 milijona litrov odpadnih olj , investicijska vrednost objekta pa je po ocenah štiri milijone ameriških dolarjev .	predelali	6	Perf
Slovenija bo skupaj s Hrvaško pripravila posebno strokovno študijo o razvoju obmejnega območja v letih 2002 do 2006 .	pripravila	5	Perf
Finec se je namreč na prvih štirih dirkah katastrofalno odrezal , zato je nujno potreboval zmago .	odrezal	9	Perf
Vstopila sta in me začela poučevati o programu , ki je postal pozneje poznan pod imenom Anonimni Alkoholiki .	poučevati	5	Imp
ja aber tule morava travo še [name:personal] a boš ti hambrt a boš ti tudi farbala ? … sieben minus funf gleich zwei	farbala	15	Imp
Le rahel košček neba ju je zares ločeval .	ločeval	7	Imp
- Skupaj se krohotava še pozno v večer .	krohotava	3	Imp
Skrajni čas je , da članice EU spet začnejo bolj poslušati druga drugo in hkrati bolj misliti na Evropo .	poslušati	10	Imp
Tri pomaranče stisnemo , eno pa olupimo in zrežemo na rezine .	stisnemo	2	Perf
» Odkar pomnim , « je odgovoril Renzo .	pomnim	2	Imp
Tako nam ni preostalo drugega , kot da smo pustili nepopito pijačo in odšli .	odšli	13	Perf
- Maksimalno , vendar realno upoštevajmo vlogo otroka pri oblikovanju in vodenju njegovega portfolia kar je mogoče , delajmo skupaj v vrtcu .	delajmo	18	Imp
Teči skozi visok gost plevel je bilo , kakor da bi brodila po vodi .	Teči	0	Imp
" Dušan Šešok je medtem igral kadrovske igrice , menjaval direktorje , dokler se ni pojavil uspešni Boštjan Šoba , ki je z novimi posli v kratkem času dosegel zaslužek podjetja v višini milijon mark .	dosegel	28	Perf
Šele vsi ti zakoni skupaj bodo predstavljali potrebno normativno podlago za trajno tržno zasnovan gospodarski sistem .	predstavljali	6	Imp
Seznanitev s pravili v zvezi s sprejemanjem daril naj bi stranke odvrnila od poskusov nedovoljenega » obdarovanja « javnih uslužbencev , hkrati pa krepila zaupanje strank v delo uprave .	krepila	23	Imp
Nameravala sem napisati še nekaj nadaljevanj , vendar so ta na žalost ostala samo v moji glavi .	Nameravala	0	Imp
Potrebujemo glavico novega zelja , 4 korenčke , 2 žlici sesekljane čebule , malo sladkorja , 4 žlice majoneze , 4 žlice kisle smetane , 4 rezine šunke .	Potrebujemo	0	Imp
Prehajamo na odločanje amandmaja k 65. členu .	Prehajamo	0	Imp
Obljubljajo , da so dejavnosti zelo raznovrstne , da ne dišijo po šoli , a vseeno veliko prinašajo .	Obljubljajo	0	Imp
BILA JE IZ UGLEDNE DRUŽINE , A KER JE RODILA NEZAKONSKEGA OTROKA , SE JI JE DRUŽINA ODREKLA .	ODREKLA	17	Perf
Zunanjepolitična sla po oblasti je v bistvu iracionalna in vselej trči ob nasprotnika , ki je prav tako iracionalen .	trči	10	Perf
ali boš buljil skozi okoli ali boš pa tam nekaj telefon drkal	buljil	2	Imp
Predstavilo se bo sto razstavljavcev iz petnajstih držav , ki bodo razstavljali in prodajali naravne in obdelane lepote skritega podzemlja .	prodajali	13	Imp
Izpleni razvojnih aktivnosti so ključni in je potrebno od široke baze idej preko sistema selekcij in vrednotenja idej na koncu priti do prave kakovosti izdelkov , ki medicini in zdravstvu prinašajo neko dodano vrednost .	prinašajo	30	Imp
Siliato , ki ji Barberis očita " zelo veliko domišljije " , hoče dokazati " pristnost " prta , vendar se teoloških vprašanj ne dotika .	dokazati	13	Perf
Dan za dnem dobivamo ponudbe za kreditne kartice , stanovanjska posojila , nove mednarodne telefonske storitve ali popuste pri nakupu hrane na bližnji tržnici .	dobivamo	3	Imp
V zvezi z njim so policisti zbrali kar precej podatkov , ki bi lahko pripomogli k temu , da bi razjasnili okoliščine njegovega izginotja in ga našli .	razjasnili	20	Perf
Izbruhnil je velik škandal , disciplinska komisija združenja ameriškega nogometa pa je sporočila , da proti osumljenim igralcem ne bo ukrepala , dokler svojega ne bo povedalo sodišče .	sporočila	12	Perf
Slišati pa je tudi , da se je ZLSD z LDS že dogovorila , da naj bi v morebitnem drugem krogu podprli Viko Potočnik , če se bo ta " spopadla " s pomladnim protikandidatom .	spopadla	30	Perf
aha samo odkimavanje v redu nisem mislil tako dobesedno ampak eee nič kaj se ne truditi	truditi	15	Imp
Zmajal je z glavo , se vrnil v dnevno sobo in si na Nutromacu naročil prigrizek .	vrnil	6	Perf
Matej naj bi bil enega od policistov udaril v obraz .	udaril	7	Perf
Prečenje je torej manever , pri katerem jadrnica zamenja uzde tako , da najprej zavije proti vetru .	zavije	14	Perf
to sam videl in tako no ko sem jaz končal ikš eee ja učili so nas imeli smo slovnico estetsko vzgojo eee mogel sem prebrati prečitati kako knjigo	učili	13	Imp
Učenci bodo opazovali spremembe v naravi , eksperimentirali in izvajali različne poskuse .	opazovali	2	Imp
Prav bi bilo , če bi tudi vi ponudili kakšno denarno pomoč , če to zmorete , seveda .	ponudili	8	Perf
Najti bo treba način , da se uravnovesite in ohranjate svojo žensko naravo , ki je sprejemanje , nežnost in sproščenost .	ohranjate	9	Imp
namreč kot lion eee imaš pravico eee kjerkoli v svetu si poiskati lokalni klub še posebej če rabiš pomoč in lahko računaš na pomoč	računaš	21	Imp
Pivovarna Laško je ugotovila , da multinacionalne družbe z nakupom podjetja dobijo tudi lokalni tržni delež , zato je skušala braniti svoj položaj doma in postati sama prevzemnik z nakupom Unionovih delnic .	braniti	20	Imp
ja kar redno se dobivamo eee vadimo pa tudi skoraj tako redno kot se dobivamo	vadimo	6	Imp
Enega je vložil v pištolo in jo nameril taksistu v glavo .	nameril	7	Perf
Mali me je trdno prijel za roko .	prijel	4	Perf
Glavna oseba tega dela , Marta , mlado kmečko dekle , ki služi v mestu , stopi v ljubezensko razmerje s študentom in pesnikom Lojzetom .	služi	12	Imp
Ker nihče ne želi več besede , zaključujem razpravo o predlogu zakona o gozdovih in prekinjam to točko dnevnega reda do odločanja .	zaključujem	7	Imp
Ozrem se in se stisnem ob obledele stene , saj prihajata bolničarja z vozičkom , za katerim stopa ženska z okamnelim izrazom na obrazu .	Ozrem	0	Perf
Kadar hujšate , pazite vsaj na to , da boste zaužili dovolj beljakovin .	hujšate	1	Imp
Kateri planinec še ni okusil ugodja , ko si je po vrnitvi z gora namakal noge v hladnem potočku !	okusil	4	Perf
Premoč se izraža v bojih , ki jih samci bijejo med seboj .	bijejo	9	Imp
Razumem , da živalski vrt potrebuje denar , a da ga zbira s predragimi sladoledi in poskakovanju po napeti tkanini , preprosto nima smisla .	zbira	11	Imp
Ko prevzame svoje delo , pošlje prvič proti jajčnikom znanilce pomladi , ki požgečkajo nekaj spečih jajčec .	požgečkajo	13	Perf
Ob napadu jugovojske so nas podprli pisatelji iz vsega sveta .	podprli	5	Perf
Poleti se sprostim , spočijem in uživam na morju .	spočijem	4	Perf
Tako da ji je , kadar je spregovorila , porumenila glas grenkoba in prsti so ji tolkli po pasu kakor ključi .	spregovorila	7	Perf
Nemčija in Češka sta sicer leta 1997 podpisali dokument , v katerem zavračata obremenjevanje današnjih odnosov in prihodnosti z zgodovinskimi zamerami .	zavračata	12	Imp
Velika svečanost po mitraičnem koledarju se je odvijala 25. decembra , vsak 16. dan v mesecu je bil posvečen Mitru .	odvijala	7	Imp
Ugotavljamo , da smo v zadnjih treh mesecih minulega leta , ko se je to najbolj dogajalo , prejeli za več kot 800 milijonov evrov dodatnih pritokov v tujih valutah .	dogajalo	16	Imp
Žrtvi so zvezali zapestja na hrbtu in jo privezali na škripec .	zvezali	2	Perf
Jörg Haider , ki odpoveduje denar predvsem alternativnim in provokativnim projektom , poskuša s stalno prisotnostjo v medijih ustvariti kulturno nezadovoljstvo .	poskuša	12	Imp
Kreativni del človeške zgodovine se ne dogaja brez prehodov in razvidne kontinuitete : renesančniki so še kako študirali in odkrivali antiko in niso spregledali tudi srednjeveškega izročila .	spregledali	23	Perf
Dolgo ne boste več mogli vleči za nos dveh oseb hkrati .	vleči	5	Imp
Po velikem uspehu sta se Annarita Sidoti ( desno ) in njena rojakinja Erica Alfridi veselili z maskoto evropskega prvenstva v Budimpešti .	veselili	15	Imp
a se bomo kot irci v časih krompirjeve lakote selili s trebuhom za kruhom ?	selili	9	Imp
Tedaj sem si pozorno ogledal njegove čekane v obliki mečev in bral na njih besedi , zapisani z velikimi črkami .	ogledal	4	Perf
V industriji so jo izrinila cenejša vlakna tropskih predivnic , največ pa je k izginjanju navadne konoplje prispevala indijska konoplja , ki vsebuje omamne snovi ( THC ) .	izrinila	4	Perf
Po drugi strani pa lahko dokazuješ , da je kršitev človekovih pravic manj in da si zato bolj uspešen , saj se je nate obrnilo manj ljudi .	dokazuješ	5	Imp
Hočeš nočeš sta jo puntarja ubrala zraven in kobilice so v diru odskakljale proti svojemu plenišču .	Hočeš	0	Imp
Vprašanje : Rojena sem bila 5. 10. 1957 in sem se zaposlila 6. 9. 1973 , to je pred 18. letom starosti .	zaposlila	11	Perf
Neka psihologinja mi je rekla , da moram živeti le zase in za svojega otroka , sestro pa moram enostavno odmisliti , če me ne posluša .	posluša	25	Imp
V obeh primerih je treba pisati tudi delovni dnevnik , v katerem dijak sproti zapisuje novo znanje in pomembne dogodke .	zapisuje	14	Imp
Nacionalni program predvideva tudi priprave programov na lokalni ravni .	predvideva	2	Imp
Večer prinese izboljšanje vremena , temna oblačna fronta odjadra nekam za Grandes Jorasses .	prinese	1	Perf
Ogledali si boste naslednja spletna mesta :	Ogledali	0	Perf
V zjutraj še vedno nabito polnem priljubljenem lokalu Evergreen ( v katerem se sicer zbirajo predstavniki nekoliko mlajše generacije ) ni nič novega .	zbirajo	14	Imp
Nasledil ga je sin Oton I. , prvi sveti rimski cesar .	Nasledil	0	Perf
Včasih ujameš kak kanal , ki predvaja stare črno - bele filme .	ujameš	1	Perf
kaj izraža ta glagol ?	izraža	1	Imp
zaostala je precej več kot sekundo razočarana bo zagotovo s svojim nastopom	zaostala	0	Perf
Potem , ko smo odstranili oči , lahko skozi odprtine v lobanji odstranimo lične mišice , jezik in vsa tkiva na glavi .	odstranili	4	Perf
Ravnatelj zavrača tudi vse očitke na razredničarko ter z ugotovitvijo šolskega inšpektorata dokazuje , da je šola v primeru Filipa Kodriča ravnala korektno .	ravnala	21	Imp
V bistvu je vse skupaj podobno popotovanjem prvih pionirjev , ki so odkrivali ameriški divji zahod .	odkrivali	12	Imp
Vsem napovedim navkljub je bruseljska komisija na sestanku veterinarskega odbora sredi tedna nenadoma umaknila predlog embarga .	umaknila	13	Perf
Primer protinaravosti je , z njegovo osamo se lahko kosa le njegova negotovost .	kosa	9	Imp
Desni stranki DVU je namreč uspelo zbrati 5,4 odstotka glasov , s čimer je prehitela vse tekmice iz svojega tabora .	prehitela	14	Perf
Deklica se je čisto slekla , dala nase lutko in z njo ponavljala spolne gibe , ki jih je na njej izvajal osumljenec .	izvajal	21	Imp
Današnji tempo stvari spreminja vsak mesec , vprašanje pa je , kdaj se splača obnoviti knjižno obliko in ali je perioda petih let za to prekratka .	spreminja	3	Imp
Tujih jezikov se moramo učiti , da bi ohranili slovenščino .	ohranili	8	Perf
O problemih se odprto pogovarjajo in predvsem redno spremljajo doseganje ciljev in skrbijo za hitro ukrepanje .	skrbijo	12	Imp
Včasih sem se priplazil sem in opazoval bogataške otroke , ki so se igrali na njem .	priplazil	3	Perf
Vlada vsebinsko podpira , vendar zaradi jasnejše dikcije predlaga svoj amandma .	podpira	2	Imp
Razmislite , ali je ta beseda ustrezna za naslov romana .	Razmislite	0	Perf
Dolgo sem ležal buden in premišljeval o tej zadevi .	premišljeval	5	Imp
Dvakrat je preveril varnostno zaporo in potisnil pištolo v tok .	potisnil	6	Perf
Glavo tiščijo v pesek in mislijo , da bodo begunci kar odšli , « kritizira državin odnos do beguncev in uradovih predlogov Šuštar .	tiščijo	1	Imp
Ponavadi mirni tok prekinja okrog 50 jezov , ki so jih postavili za mline in žage .	prekinja	3	Imp
Najpomembnejša pri vsem skupaj je zagotovo prihodnost njenega otroka in če se ji boste zaradi svojega nestrinjanja morda odtujili , boste mogoče zamudili enega izmed najlepših in najplodnejših odnosov v življenju .	zamudili	22	Perf
Rola , ki se odvija , ko zobatec vleče proč , in dolga vrvica omogočata , da riba odplava od lovca in da vrvico lahko vlečemo k sebi ali popuščamo .	vlečemo	25	Imp
tule nisem čisto prepričan ampak mislim da so že nekaj tudi takrat takoj snovali samo kaj pa ne vem ne tako da bi bilo treba malo preveriti ne	snovali	13	Imp
Preden pa se kdo preveč razgreje , bi želel napisati nekaj pojasnil .	želel	8	Imp
Se pa zavedajte , da bo tako vaš sin prišel do e - pošte , ki vam jo piše žena - a po drugi strani boste tudi vi prišli do zapisov njegovih klepetalnih dogodivščin . . .	zavedajte	2	Imp
S 1. oktobrom je začela veljati tako imenovana Montijeva direktiva , ki v vseh državah EU uveljavlja nov način prodaje , servisiranja in poprodajnih storitev prodajalcev in serviserjev avtomobilov .	uveljavlja	16	Imp
Zakaj je Slovenija več uvažala kot izvažala ?	izvažala	6	Imp
Nenadoma občutiti , da vemo o vseh stvareh natančno toliko kot Bog , in prav tako nenadoma ugledati , kako to občutje izginja .	občutiti	1	Perf
Pa ne domov - hitela je , kolikor so jo nesle nožice , da bi ujela Trohca in cirkusanarje .	hitela	4	Imp
Obenem tudi ugotoviva , da sva dosegla toliko pričakovano škrbino , kjer se je Marjanu pred šestimi leti stojišče enostavno podrlo pod nogami .	podrlo	20	Perf
Njihov osnovni del , ki omogoča le navidezni zaslon , se namesti v dodaten zavihek v Display Properties , nekaj dodatnih programčkov pa dobi svoje ikone in se namesti v menu Start .	namesti	28	Perf
Zaveda se , da so tovrstni tabori odlična priložnost za pridobivanje mladih moči na področju ekologije .	Zaveda	0	Imp
Jaz te bom zagovarjala , ker si nedolžna .	zagovarjala	3	Imp
Ko izračunamo kontrolne meje , jih vrišemo v oba grafikona kot jih prikazuje slika DD .	izračunamo	1	Perf
Grozdje za to vino so na Sremiču potrgali 31. januarja letos in donegovali vino , ki je postalo svetovni prvak in ponos vinske kleti , ki letos slavi 70 - letnico ustanovitve .	potrgali	7	Perf
Glede zadnjega dela vprašanja vam moram priznati , da o tem problemu še nisem nič slišal .	priznati	6	Perf
PRITOŽBA ZADRŽI IZVRŠITEV ODLOČITVE O PRAVICI OZIROMA OBVEZNOSTI IZ DELOVNEGA RAZMERJA JAVNEGA USLUŽBENCA , ČE ZAKON NE DOLOČA DRUGAČE .	DOLOČA	17	Imp
V knjigi sem brala , da mora za krožničke biti zemlja TKS 2 , to je listavka z malo šotnice in mivke .	brala	3	Imp
Očitno ji je nekdo na drugi strani razložil , da je zavarovalnica predlog umaknila .	umaknila	13	Perf
Ne pa , da imam prvi teden občutek , kot da spremljamo tretjeligaško vaško tekmo v balinanju , iz katere potem Nataša v duetu s Kukovico brije norca .	spremljamo	11	Imp
" Tistega večera sem preveč popil , zgodilo se je mesec dni po tem , ko sem izvedel , da me žena vara .	vara	22	Imp
Tabela in slike na tej strani pojasnjujejo osnovne razlike med različnimi živimi vabami , ki se navadno uporabljajo za morski ribolov .	pojasnjujejo	6	Imp
Prav nobeden od štirih poslancev LDS , ki so se prijavili za evropsko prvenstvo , se izbirnega tekmovanja ni udeležil .	udeležil	19	Perf
Nimate veliko stika z žogo in rokometaši pravijo , da je vaša naloga » delati gužvo « .	Nimate	0	Imp
Če povsod najdemo več resničnosti kot v sebi , to pomeni priznanje , da smo izbrali napačno pot in si zaslužimo propad .	zaslužimo	20	Perf
" Psihoterapevtka je ponovila njegov stavek in ga vprašala , ali so bile počitnice zanj težke .	vprašala	8	Perf
