Lastnica Jožica Bohak mi je ob prvem obisku prijazno predstavila zgodovino islandskih konj in mi tako ponudila pomoč ob veliki travmi , ki sem jo doživela pred nekaj meseci .	doživela	25	Perf
Vse to ga je spravilo v dobro voljo .	spravilo	4	Perf
No , tudi to obdobje je minilo in konj se je prenehal usedati .	usedati	12	Imp
[incident] pa imate pa imajo vsi cajt ker ti to bolj veš meni se sploh ne ljubi več pisati okrog	ljubi	16	Imp
Mornarji , ki niso spali , so strahoma oprezali za mesecem .	oprezali	8	Imp
Prebivalci menijo , da garažna hiša , bloki in široke ceste ne sodijo v staro mestno jedro	menijo	1	Imp
Najmanj 40 jih je poiskalo zdravniško pomoč , 12 razgrajačev pa je policija aretirala .	poiskalo	4	Perf
Približajte se ji , kolikor se ji morete .	Približajte	0	Perf
Najti bo treba način , da se uravnovesite in ohranjate svojo žensko naravo , ki je sprejemanje , nežnost in sproščenost .	Najti	0	Perf
Verjetno bi se mi zmešalo od dolgčasa in slabe volje , če ne bi potrkalo na moja vrata .	zmešalo	4	Perf
Ko sem noge prekrižal na naslonjali stola , sem se delal , da je to popolnoma normalno , da to počnem vsakič , kadar grem v kino .	delal	10	Imp
Vsebinsko so se njihove raziskave ukvarjale z nacistično okupacijo in odporom na omenjenem območju , pri čemer so raziskave časovno segale tudi v predvojno in povojno obdobje .	ukvarjale	5	Imp
Sta že vse pozabla , kako je ta pizda domov polcaje prvleku večkrat koker jaz ; jaz sem bil vsej tolk kulturen , da sem po svojmu lastnmu pragu sral .	prvleku	11	Perf
Naj naštejem še nekaj splošnih in nekaj bolj konkretnih področij , ki so se mi zdela pomembna , nadrejena in sem jih ob različnih priložnosti izpostavljal .	izpostavljal	25	Imp
Hranim ga z umazano posodo in on mi zvesto , brez ugovarjanja , ob spremljavi nežne melodije , ki spominja na šumenje morja in na romantične sprehoda v nevihti , opere umazano vsebino .	Hranim	0	Imp
Spala je na spodnjem pogradu , medtem ko so ženske z zgornjih postelj mimo njene glave bruhale , kar so zaužile .	Spala	0	Imp
Gradišnik : Zdaj jih tako ne bo nihče hotel , ker po pravkar predlaganih spremembah za lastnika res ne bo nič več ostajalo .	ostajalo	22	Imp
DELAVKA , ZA KATERO JE BILA S SKLEPOM SKUPNOSTI POKOJNINSKEGA IN INVALIDSKEGA ZAVAROVANJA UGOTOVLJENA SPREMENJENA DELOVNA ZMOŽNOST ZARADI POSLEDIC POKLICNE BOLEZNI , IMA PRAVICO DO PRERAZPOREDITVE NA DRUGO USTREZNO DELOVNO MESTO V 15 DNEH PO DOKONČNOSTI PRAVNOMOČNOSTI SKLEPA .	IMA	22	Imp
Pearl je sedela na koncu pomola in uživala ob slastnih grižljajih ribe , ki jo je našla , Frances se je vrnila v San Antonio in Juanita mu je kuhala kavo .	vrnila	21	Perf
V VINICI ZASEGLI OROŽJE - Orožje , ki sta ga Belokranjca ponujala za borih 6 tisoč nemških mark , bi lahko imelo hude posledice .	ZASEGLI	2	Perf
ne to imamo mi že eee tako imava navodila kako se naloga oblikuje	oblikuje	12	Imp
Zelo dolgo se lahko igra z različnimi ropotuljami in drugimi igračkami , ki oddajajo zvoke in jih lahko stlači v usta .	stlači	18	Perf
Vallaressovi so izgubili svoje premoženje in zapustili otok in s sestro sva si poiskala delo v mestu .	poiskala	13	Perf
Dal ji je pooblastilo , da seznani s skrivnostjo svoje poizvedbe nekaj oseb , če bi se to izkazalo za potrebno , in pismo , ki označuje njegovo zaupanje vanjo brez namiga na zaupano poslanstvo .	izkazalo	18	Perf
Previdno zakoračim v trdem snegu v prečnico proti levi , kjer skalna klada v pobočju zadržuje sneg in tvori snežni grebenček .	zakoračim	1	Perf
Bil je kot bakla , ki z ognjem požira vse okrog sebe .	požira	8	Imp
Ždela je v kuhinji in čakala , da se bo prebudil .	prebudil	10	Perf
" V nekdanji Jugoslaviji denarja za trenersko usposabljanje ni manjkalo , tudi sam sem se tako usposabljal na Japonskem .	manjkalo	9	Imp
Na Ostrvu junosti , Otoku mladosti , se je trlo mladih parov , ki so se vozili s katamarani , se objemali na plaži in se sprehajali po skrivnih potkah .	trlo	9	Imp
recimo eee ko se samo sprehajaš sam ne ali ko se voziš s kolesom ali eee ali ko se ponoči zbudiš pa pol ure ne moreš zaspati	zaspati	26	Perf
Hitreje shodijo , spregovorijo in se ponavadi hitro razvijajo .	spregovorijo	3	Perf
Čeprav je ta stranka zasedla največ sedežev v parlamentu , je s padcem deležev glasov s 40 odstotkov izpred štirih let na 36 odstotkov dosegla najnižji rezultat v Hamburgu po drugi svetovni vojni .	zasedla	4	Perf
PRITOŽBA ZADRŽI IZVRŠITEV ODLOČITVE O PRAVICI OZIROMA OBVEZNOSTI IZ DELOVNEGA RAZMERJA JAVNEGA USLUŽBENCA , ČE ZAKON NE DOLOČA DRUGAČE .	ZADRŽI	1	Perf
Z izjemo obrobne koalicije HSLS - DC s tremi poslanci je HSS za HDZ edina resnejša politična sila , s katero lahko gredo sestavljati vladi .	sestavljati	23	Imp
Vlada ne podpira .	podpira	2	Imp
Mesec maj je tudi v Šaleški dolini namenjen čiščenju in pospravljanju odpadkov , večjo pozornost namenjajo posebnim in velikim , kosovnim odpadkom .	namenjajo	15	Imp
Ko hodim po ulici , čutim življenje , ki ga ljubim .	hodim	1	Imp
Z njim Vanessa Mae vodi poslušalce , ki se ji odzivajo s ploskanjem najbolj trdih poudarkov .	odzivajo	10	Imp
Baumax , Bauhaus , Interspar in njegove mega ponudbe bi morale doživeti bojkot slovenskih potrošnikov .	morale	10	Imp
testo razvaljamo v takole kačo ki jo razrežemo na enako velike koščke	razrežemo	7	Perf
V postholokavtski in postapartheidski družbi so se institucije spremenile predvsem v tem , da spodbujajo mišljenje .	spremenile	8	Perf
tele [name:personal] oče stari oče ve tisto ti ne poznal ti so črejvle videli	poznal	9	Imp
da hodiš po sredi lahko ne in še tam pri kraju lahko daš	hodiš	1	Imp
Leta 1986 je vzniknila ideja o preoblikovanju muzeja iz posebnega v splošni pokrajinski muzej , ki naj bi skrbel za varstvo premične kulturne dediščine , njeno realizacijo pa je prinesla sprememba financiranja muzeja leta 1990 .	skrbel	18	Imp
Noge zakoračijo samodejno preko zabreklih in od zastrugov razjedenih planjav , ki se na desni ostro končujejo v načičkanih robovih opasti .	končujejo	16	Imp
Namesto da bi država naročila vsaj predinvesticijsko študijo ali preučila možnosti , kako bi lahko pomagala podjetju in občini , je predloge že na začetku zatrla .	naročila	4	Perf
Budimpešta - Leto 2000 , v katerem je Madžarska poleg drugega praznovala svojo tisočletnico , ocenjujejo državljani , politične stranke in mednarodne institucije na moč različno .	praznovala	11	Imp
Dan ne bi bil popoln , če ne bi sklenila enega od najinih dogovorov .	sklenila	9	Perf
Najbrž mi ne bo treba , saj sta jih Hartliebova gotovo že prečesala .	prečesala	12	Perf
ODPRAVILA SE JE NA POTOVANJE IN TAKOJ ODKRILA , DA KOT SAMSKA , NEZAVAROVANA ŽENSKA NE BO MOGLA PREŽIVETI , SAJ SO JO NAJPREJ SPOLNO NAPADLI IN NATO ŠE PRODALI .	MOGLA	17	Imp
A ko je Jordan prijel za roko in jo odvedel v zgradbo , se je spraševal , kako jim bo to sploh uspelo .	prijel	4	Perf
si mi povedala ja sem pa že vsem povedal da prideš	povedal	8	Perf
Ta določba je podobna določbi prvega odstavka 28. člena ZUS , z edino razliko , da ZUS določa , da je tožbi treba priložiti izpodbijani akt v izvirniku , prepisu ali kopiji .	priložiti	23	Perf
Takrat se je namreč dogajal grunge .	dogajal	4	Imp
Dere se .	Dere	0	Imp
Zavrnili so predlog in vztrajali pri ločenosti deželne brambe od linijske armade kot tudi pri dvoletnem vojaškem roku .	vztrajali	4	Imp
Te tujci majo probleme z našo kraljevsko angleščino , jebemti , sej štekaš .	majo	2	Imp
Materina ljubezen , če je prava , ne zahteva povračila ; spolna ljubezen pa pričakuje neposredni odmev svojega dajanja .	pričakuje	14	Imp
Veterinar vsakega kmeta pri zdravljenju opozori na to in vsak kmet ima t. i. hlevsko knjigo , kamor se te stvari zapisujejo .	zapisujejo	21	Imp
Avtorji se v filmu sprehajajo skozi čas in prostor , skušajo nam predstaviti bogato zgodovino in manj znano bogastvo Roga .	skušajo	10	Imp
Zaledeneli žlebovi v zadnji tretjini stene me spominjajo na velike centralnoalpske ture .	spominjajo	7	Imp
Z vesoljskimi plovili je tako kot z življenjem : največ stroškov , truda in miselnega napora je potrebno vložiti vanje , še preden lahko sploh slutimo rezultate .	slutimo	25	Imp
Pečeno meso razrežemo na rezine in ponudimo z omako , ki jo pripravimo iz pečenkinega soka , pretlačene priložene jušne zelenjave , juhe in malo moke in izboljšamo s kislo smetano	ponudimo	6	Perf
Veliko več državljanov je nanj namreč odgovorilo , da je njihov materni jezik italijanščina , kot se jih je izreklo za italijansko narodnost .	odgovorilo	6	Perf
Nivo preverjanja V daje bolj strmo OC krivuljo in zato zmanjša tveganje kupca .	zmanjša	10	Perf
Na srečo pa nisem imel bližnjega srečanja s plazilci , saj sem z njimi podpisal premirje .	podpisal	14	Perf
Nato so se umaknili za vogal in se tam delali , kakor da so kilometre daleč .	umaknili	3	Perf
Ministrstvo za promet je lani za pripravo študij , analiz in strokovno razvojnih nalog s prometnega področja in za strokovne podlage za pripravo nacionalnih programov ter podzakonskih predpisov porabilo 29,8 milijona tolarjev .	porabilo	28	Perf
Z zmago bi si že petič zapored priigral naziv igralca leta , če pa mu spodleti , se utegne zgoditi , da mu tekmeci ne bodo prisodili laskave lovorike .	priigral	7	Perf
Hočeš nočeš sta jo puntarja ubrala zraven in kobilice so v diru odskakljale proti svojemu plenišču .	ubrala	5	Perf
Tak izlet pripravijo zdaj že nekaj let zapovrstjo in zlasti najmlajši člani organizacije se ga nadvse veselijo .	veselijo	16	Imp
Slovenska politika je brez koncepta , kako sploh ravnati .	ravnati	8	Imp
Palico držimo iztegnjeno pred sabo .	držimo	1	Imp
Na tečajih , ki so razdeljeni na deset delov , poleg židovske prakse poučujejo še numerologijo in pomen obraznih potez .	poučujejo	13	Imp
Zdi se , da so nove tehnologije tesno povezane z oblikami » privatizacije « , ki jih je opisal Ros Pesetsky ( 1981 ) .	opisal	18	Perf
Varujta me v vseh nevarnostih in me po končanem zemeljskem romanju srečno pripeljita v večno domovino .	Varujta	0	Imp
Včeraj se je vnovič sestal izvršni odbor Hokejske zveze Slovenije , ki naj bi razpravljal o spremembi tekmovalnega sistema za naslov državnega prvaka , potem ko so iz lige izključili ekipo Acroni Jesenic .	razpravljal	14	Imp
Tudi to bo koristilo .	koristilo	3	Imp
Vsakega sodnika bodo poslej ocenjevali vsakih šest let , temu se ne bodo izognili niti sodniki svetniki , ki so bili doslej nedotakljivi .	izognili	13	Perf
Zunanji minister Dimitrij Rupel je pisal pismo poslancem državnega zbora in jih prosil , naj premislijo o njeni kandidaturi .	pisal	5	Imp
Na peščini je veter pihal v tako silovitih sunkih , da so se vojaki stežka premikali .	premikali	15	Imp
Sam za ketnco potegneš pa pride paznca pa te začne pedenat , a štekaš .	pedenat	10	Imp
Nikakor ne zagovarjam vožnje zunaj utrjenih cest da bi se približali objektu .	približali	10	Perf
Meso se pri kuhanju razbarva in ni nevarno .	razbarva	4	Perf
Živo vabo na čolnu hranimo v posebni posodi .	hranimo	4	Imp
Na katero koli stran sem pogledala , povsod je bil samo gozd .	pogledala	5	Perf
Zdravniki priporočajo , da bi matere samo dojile otroke šest mesecev .	priporočajo	1	Imp
pa pol narisal ano hribar	narisal	2	Perf
Nimam računalnika , interneta , ne uporabljam mobilnega telefona .	uporabljam	6	Imp
Rečemo lahko , da so dihala teh najpreprostejših danes živečih vretenčarjev nekakšen osnoven prototip škržnega sistema , s katerim danes dihajo v vodi vse višje razvite ribe .	dihajo	20	Imp
Bangladeška premierka Kalejda Zia je takoj po brodolomu odredila reševalno operacijo .	odredila	8	Perf
A ob desetih zvečer , ko se v Tobačni v proizvodnji zamenjata popoldanska in nočna izmena , je bilo med prihajajočimi in odhajajočimi delavci čutiti močno napetost .	zamenjata	11	Perf
Po drugi strani se podoživljanju teh dogodkov človek ne more izogniti , tudi če bi se preselil na drugi konec zemlje .	izogniti	10	Perf
Velike klinične raziskave so namreč dokazale , da tako lahko zelo učinkovito zmanjšamo nevarnost , da bi nastali zapleti , ki sem jih omenil in ki so za bolnika lahko tudi usodni .	dokazale	5	Perf
Najnovejše spremembe se zvrstijo v 76 členih .	zvrstijo	3	Perf
Za začetek je najbolje , da ugotovite , ali vaš dih seže do spolnih organov .	ugotovite	6	Perf
Zato je težje sprejemati spolno ljubezen ; ta sili človeka k ljubezenski dejavnosti .	sprejemati	3	Imp
Beki mi je prirasel k srcu in z njim je v vsakem letnem času lepo in nepozabno .	prirasel	3	Perf
Roditi želim po naravni poti brez lajšanja bolečin , ker menim , da bolečina poveže mamo in otroka .	poveže	14	Perf
» Varnostni sistem v notranjosti zaznava eno osebo , « je rekla Vrana .	zaznava	5	Imp
Udeležence že opozarjajo , naj med tekom ne jemljejo vode iz rok neznanih mimoidočih gledalcev .	jemljejo	8	Imp
» Pod nizozemsko zastavo pluje , « je pripomnil .	pluje	4	Imp
Louise Hay v svoji uspešnici You Can Heal Your Life ( Svoje življenje lahko ozdravite sami ) piše :	ozdravite	14	Perf
Razmišljate o darilu za Rakico ?	Razmišljate	0	Imp
Tehnologijo je razvil svetovalec kanadske vlade dr. Norman L. Arrison , ki je drugim povedal , da v osmih državah po svetu že deluje 27 projektov s tovrstno tehnologijo .	razvil	2	Perf
Pred oltarjem naj bi jima delali družbo vsi štirje Kevinovi otroci .	delali	5	Imp
Pravico do stavke omejuje natanko toliko , kolikor jo omejuje sedanji zakon o stavki .	omejuje	3	Imp
JBX ponuja vsem udeležencem , ki sodelujejo v procesu razvoja programske opreme v javi , izvrstna orodja .	sodelujejo	6	Imp
Dlaka na vratu se mi je naježila .	naježila	6	Perf
Pritrdite njenemu mnenju . . .	Pritrdite	0	Perf
če dovolite … glejte mi dovolite … a mi dovolite da dam en predlog	dovolite	5	Perf
Postal sem periodični pivec .	Postal	0	Perf
Ta kurc mi pomaha , nej stopm na stran .	pomaha	3	Perf
Meditacija je po definiciji sposobnost mišljenja o eni sami stvari , ne da bi se pustili zmotiti ali zdolgočasiti in ne da bi zapadli v sanjarjenje .	zapadli	23	Perf
Zmešajte paradižnikovo mezgo in sveži sir , da dobite gosto omako .	Zmešajte	0	Perf
Toda njegova najbolj goreča želja , ki jo vedno znova poudarja , je , da bi dobil sinčka .	poudarja	10	Imp
Sedemletni fantič iz Daruvarja zdaj dobro okreva , čaka pa ga še socialno okrevanje	okreva	6	Imp
Kdaj je nazadnje pred vašo hišo pripeljal tovornjak in jo skorajda zasul z več tonami premoga , s katerim ste se potem greli vso zimo ?	pripeljal	6	Perf
Poudaril je , da si BiH nihče ne bi smel lastiti , kar naj bi po njegovem počela mednarodna skupnost .	lastiti	10	Imp
tisti ki se bo vpisal za poklic mizar oziroma lesarski tehnik eee bo skorajda že v prvem letniku imel zagotovljeno službo	vpisal	4	Perf
mi doma si eee podarimo praktična darila	podarimo	4	Perf
cilj smisel tega projekta pa je to ne da se dobijo informacije direktno od uporabnikov objektov	dobijo	10	Perf
Minuli teden nas je zapustil človek , ki je pri svojem delovanju ubral precej drugačno pot , kot jo izpričujejo omenjeni novokomponirani politični petelinčki .	izpričujejo	19	Imp
Tole ratuje idiotsko .	ratuje	1	Imp
Ob jubileju ne kaže prezreti dejstva , da danes v domu prebivajo predvsem dijaki premožnejših staršev .	prebivajo	11	Imp
Je mož , ki zmeraj vključi svetilko in jo podrži v obraz , ki z zavihanimi rokavi štorklja po sobi in pri katerem si je treba kozarec vode šele zaslužiti .	zaslužiti	29	Perf
Neki tinjanski podložnik je pobil beneškega vojaka , ki je iz Poreča v Brest nesel pošto .	nesel	14	Imp
Ob šotorskem prazniku je Jezus klical : » Če je kdo žejen , naj pride k meni in naj pije .	pije	19	Imp
V zadevo se je na koncu vpletel še predsednik Mednarodnega olimpijskega komiteja Jacques Rogge , ki je vlado v Rimu zaprosil za pomoč .	vpletel	6	Perf
Vse , kar je treba narediti , je namestiti program DNKA , ki ga skupaj s preprostimi navodili najdete na naslovu http://dnka.com/ .	najdete	18	Perf
Sociobiološka teorija inkluzivne pripravljenosti je okrog organizma in njemu sorodnih zapečatila nekakšno ovojnico , ki pa jo je evolucijska teorija poznih sedemdesetih in osemdesetih vedno znova odpirala .	odpirala	26	Imp
Spominjam se otroških let pod Šmarno goro , kjer smo vedno radi prisluhnili cvrčanju po travnikih in senožetih , mu sledili in s travno bilko izbezali iz rova črno živalco z veliko glavo murna .	izbezali	25	Perf
Res so njegovi sodelavci kaj hitro ugotovili , da manjkajo prepisi nekaterih njegovih pogovorov z najtesnejšimi sodelavci .	manjkajo	9	Imp
Ura je štiri zjutraj in na vzhodu se začenja daniti .	začenja	8	Imp
Mnogokrat so se obračali tudi na vodne vile nimfe in duha travnikov in gozdov Silena , dasiravno so , kot bomo brž slišali , ti duhovi lahko tudi pomenili prevod pojmov iz staroselskih verskih predstav v Italikom razumljivo govorico .	obračali	3	Imp
Plavajte enakomerno in tekoče .	Plavajte	0	Imp
» Z grafikami lahko naredite nekaj , česar kratko malo ne morete z nobenim drugim medijem .	naredite	4	Perf
Izostanek obeh strank z naroka povzroči , da sodišče narok preloži , izostanek z dveh zaporednih narokov pa povzroči fikcijo umika tožbe .	preloži	10	Perf
Ali ne bi mogli malo bolj upoštevati tudi naše skupne dediščine kot ozadja za aktualna vprašanja , tistih delov dediščine , ki se dobro dopolnjujejo in lahko obe strani bogatijo ?	bogatijo	29	Imp
Tisto pijanko in pocestnico vedno otroci spravijo " varno " domov .	spravijo	6	Perf
Namesto da jemljete vitamine v tabletah , si privoščite več naravnih sadežev .	jemljete	2	Imp
MILANO - Videoposnetke nesrečnega poleta v italijanskem mestecu Cavalese , ko je trčenje z vrvjo žičnice terjalo 20 smrtnih žrtev , so na ukaz mornariškega častnika Chandlerja Seagreavesa uničili .	terjalo	16	Imp
Dober interpret njegovih pesmi in igralec , ki ga upodablja v filmu o njem , mora izpolnjevati ta prvi pogoj .	upodablja	9	Imp
Velika Britanija in Španija sta se sporazumeli o pogojih za bančne in zavarovalniške družbe s sedežem v Gibraltarju , da bodo lahko prodajale svoje produkte v Evropski uniji , ter za splošno evropsko priznanje tamkajšnjih osebnih izkaznic .	sporazumeli	6	Perf
Zakaj je torej Adam hotel po vsej sili kupiti to parcelo , se je vprašala .	vprašala	14	Perf
V sirotišnici sem se naučil enostavnega , toda pomembnega pravila : v konfrontaciji sogovorniku nikar ne zapiraj izhoda , ker se bo čutil ujetega v past in bo postal nasilen .	čutil	22	Imp
Marion je štiriletnega sina Johna dala v rejo v dobri veri , da mu bo s tem omogočila boljše življenje .	omogočila	17	Perf
Ena in druga pripadata družini sedmih vrst teh plazilcev , ki vsi spadajo med najbolj ogrožene morske živalske vrste .	pripadata	3	Imp
Njegovim klubskim kolegom , lanskemu podprvaku Valterju Bonči , cestnemu prvaku s Ptuja Borisu Premožiču in Mitji Mahoriču , so dirke kar po vrsti odpadale .	odpadale	24	Imp
O tem so se dogovorili prejšnji teden na sedežu fundacije Evropska integracija Brandenburg ( EIB ) v mestu Elsterwerda , 40 kilometrov od Dresdna .	dogovorili	4	Perf
Velika stara stranka je dolgo " počivala " v opoziciji , in ko si je zadosti odpočila , je spet stopila v vlado .	počivala	6	Imp
Do tega je upravičen le upravljalec javne poti ( občina , komunalno podjetje ) , kamor naslovite vaš zahtevek .	naslovite	16	Perf
Naš test vam bo izdal , ali znate drugim pokazati , kaj hočete …	hočete	12	Imp
" Po njej sem previdno stopal v črno temo in prižgal ročno baterijsko svetilko .	stopal	5	Imp
- Mladenič , ki si je za svoj šport izbral lokostrelstvo , išče dobre poznavalce izdelovanja lokov .	išče	12	Imp
Notranja stena arterij ( endotelij ) se po mastnem obroku pogosto skrči in maši .	skrči	11	Perf
Ne George ne jaz se nisva upala obrniti .	upala	6	Imp
Zanima me , zakaj moški hranijo Playboye ?	Zanima	0	Imp
Takoj so mu ponudili mesto svetovalca .	ponudili	3	Perf
Potem ko sem pisma spustila v nabiralnik , nisem prenesla tega , da bi odmaknila roko .	odmaknila	14	Perf
Sedemnajst primorskih županov je konec aprila ministru Janezu Kopaču poslalo jezno pismo .	poslalo	9	Perf
Rečne mrtvice so občutljivi vodni sistemi , hitro se spreminjajo in zakopnevajo .	spreminjajo	9	Imp
ZA DRŽAVNE ORGANE PA VELJA LE , ČE POSAMEZNA VPRAŠANJA , KI JIH UREJA , NISO Z ZAKONOM DRUGAČE UREJENA .	VELJA	4	Imp
Prispevek obravnava sisteme oblasti , ki so se v Istri zvrstili v prehodnem obdobju od padca Beneške republike 1797 do dunajskega kongresa 1814 / 15 .	obravnava	1	Imp
Vidno vlogo je imel Nemec še pred tremi leti , ko je na začetku tako močno dominiral , da je njegov najbolj nevarni tekmec Mika Häkkinen čutil že veliko pritiska na svojih ramenih .	dominiral	16	Imp
Pred dvema letoma je ta tukaj zablestela s senzacionalno štafetno zmago , lani se je Avstrija spet oddaljila od svetovnega vrha .	zablestela	6	Perf
Na žalost so te teme precej obsežne in presegajo obseg te knjige .	presegajo	8	Imp
pol bi pa koga v rit špiknil	špiknil	6	Perf
Umeščena je bila sredi razmeroma malo obljudene pokrajine in je mogla ponujati svoje tržno posredovanje razmeroma majhnemu območju .	ponujati	11	Imp
Tanin se je v zadnjih letih reševal z odkupom na slovenskem trgu , kjer je vzpostavil mrežo odkupovalcev , oblikoval pogodbene sekaške ekipe in vzpodbujal k sanitarni sečnji kostanja .	vzpodbujal	24	Imp
Upamo , da bo SAS naše analize in predloge skrbno proučil in nas v naših prizadevanjih podprl !	proučil	10	Perf
Roke sproščeno počivajo ob telesu .	počivajo	2	Imp
Komajda je stala ali celo sedela , vendar mu je namenila , za kar je mislila , da je slaboten nasmeh .	namenila	10	Perf
V zadnjem času število nekoliko narašča , trenutno poznam dvanajst primerov , ki so aktualni .	narašča	5	Imp
koliko bart je že vlačila nas [name:personal] notri po špitalih a ? ja bom ti pa izračunaj ta prvo ne skupaj računajva pojdi	izračunaj	16	Perf
Namesto kreme za toniranje lahko sami pripravite mešanico , ki bo napravila kožo vaših dekolteja in ramen bleščečo in voljno .	napravila	11	Perf
Konec februarja 1920 se je v Genovi vkrcala v podpalubje ladje Bologna , saj ji že dodobra izčrpano premoženje za kaj boljšega ni zadoščalo .	vkrcala	7	Perf
Če tega primanjkuje , poskuša ščitnica s svojim večanjem in intenzivnejšim delovanjem preprečiti njegovo izgubljanje iz telesa .	poskuša	4	Imp
V obeh primerih je treba pisati tudi delovni dnevnik , v katerem dijak sproti zapisuje novo znanje in pomembne dogodke .	pisati	5	Imp
DELODAJALEC MORA DELAVCU NADURNO DELO ODREDITI V PISNI OBLIKI ( IZJEMOMA TUDI USTNO , V TEM PRIMERU SE PISNO ODREDITEV VROČI DELAVCU NAKNADNO , VENDAR NAJKASNEJE DO KONCA DELOVNEGA TEDNA PO OPRAVLJENEM NADURNEM DELU ) .	ODREDITI	5	Perf
ker bom šla drugo leto ven študirat	študirat	6	Imp
Ivje , led ali tanka snežna prevleka so nove razsežnosti , ki jih okrasnim travam doda zimski čas .	doda	15	Perf
Upamo , da bo SAS naše analize in predloge skrbno proučil in nas v naših prizadevanjih podprl !	Upamo	0	Imp
K vsemu skupaj je veliko pripomoglo tudi to , da je ameriška vlada dvignila roke od omrežja , tako da so svojo priložnost dobili zasebniki .	pripomoglo	5	Perf
nekateri menijo da je izšel iz grške besede grafo kar pomeni pisati drugi pa pojem povezujejo z italijansko besedo gre [gap] grafiare ki pomeni spraskati	pisati	11	Imp
Tako sta minila dva dneva , nato pa je luna obsijala temno gladino oceana , kakor da je beli dan .	minila	2	Perf
O istih informacijah govorijo v različnih krogih , občasno jih je treba spraviti v en koš in to po tridesetih letih predstavljamo s tem slovarjem .	predstavljamo	21	Imp
Pater Nicholas je zagotovil , da v votlino ni nihče niti poskušal stopiti .	poskušal	11	Imp
eee televizijska postaja hezbolah ki obširno o tem poroča al džazira torej arabski mediji so zelo dejavni jih spremljamo in tako dobivamo tudi informacije z druge strani čeprav ne s prve roke	poroča	8	Imp
Ponižnemu razodeva svoje skrivnosti in ga ljubeče k sebi vleče in vabi .	razodeva	1	Imp
- Ali konj z izkazanim veseljem ter zadovoljstvom pričakuje in v relativno kratkem času zaužije obrok krme , ki mu ga položite ?	zaužije	14	Perf
" Če sledimo tej logiki , ni izključeno , da bi ta posadka , če bi zavzela oblast , skušala podaljšati svoj mandat in razveljaviti jesenske volitve , " je povedal Golobič .	zavzela	16	Perf
Ker je mesto bilo pred ustanovitvijo in po njej še celo stoletje najpomembnejša naselbina in edino mesto v Slovenski marki , se je to stoletje sicer gospodarsko ugodno razvijalo .	razvijalo	28	Imp
Požarna pregrada v drugem svežnju popravkov za Windows XP deluje tako , da preprečuje povezave , ki jih računalnik ali uporabnik nista zahtevala .	preprečuje	13	Imp
Že pred drugo vojno so kupili novo brizgalno , ki je veljala takrat 5 do 6 parov dobrih volov .	veljala	11	Imp
Nekateri še vedno vztrajno nabirajo regrat , čeprav je šel že v cvet in se mleček kar cedi iz njega .	cedi	17	Imp
Dekle je zadevo prijavilo dan potem , ko se je zgodila .	prijavilo	3	Perf
Enako je treba tudi spodbudo , če želimo izvleči najdragocenejše dele informacij , analizirati .	izvleči	8	Perf
Prosimo načrtovalce srečanja Bush - Putin , da ju z Brnika odpeljejo naravnost na Brdo in nazaj .	Prosimo	0	Imp
Mladi košarkarji San Antonia se bodo na lastni koži prepričali , da je laže osvojiti naslov prvakov kot ga ubraniti .	ubraniti	19	Perf
Vendar je bil glede prvenstva v golfu ravno na predlog LDS sprejet sklep , da se tekmovanja udeleži samo dvojica iz Slovenije in da se za izbor naredi izbirno tekmovanje .	naredi	27	Perf
Podržal je tricikel , da se ne bi sam odpeljal naprej , in se smehljal , ko se je dekletce sklonilo in razkrilo očarljive rdeče žabice .	smehljal	14	Imp
