Pečeno meso razrežemo na rezine in ponudimo z omako , ki jo pripravimo iz pečenkinega soka , pretlačene priložene jušne zelenjave , juhe in malo moke in izboljšamo s kislo smetano	izboljšamo	27	Perf
Ustavno sodišče je predlog pomladnikov zavrnilo z modro obrazložitvijo , da gre v tem primeru za " pozitivno diskriminacijo " .	zavrnilo	5	Perf
Prav zato za OI tudi ne želim dajati kakšnih posebnih napovedi , saj se ti lahko zgodi , da že na začetku dobiš močno nasprotnico , ki nato izpade in nimaš več popravnega izpita .	izpade	28	Perf
[gap] kako to zrcalimo	zrcalimo	3	Imp
Ta ukaz zaženete s klikom na usercfg gumb v oknu kontrolne plošče ali z zagonom terminalskega okna , kjer vpišete :	vpišete	19	Perf
Skupaj z znanstveniki , ki so ga navdušeni vabili v svoje vrste , je pregledoval in urejal gradivo , ki ga je vsa ta leta pošiljal z odprave .	pošiljal	25	Imp
Denar omogoča strasti in sproža maščevalnost , omogoča pa tudi plemenitost in ljubezen .	sproža	4	Imp
Na Dobrovniškem Dolinskem se severozahodno od Lendave in Dolge vasi razprostirajo Črni logi , znani po sestojih črne jelše .	razprostirajo	10	Imp
Ni še sodelovala pri zapletenejšem reševanju .	sodelovala	2	Imp
» Ah , končno sem dočakala te presnete točke , « je malce po prihodu v cilj dejala tekmovalka , ki se je k slovenski biatlonski reprezentanci preselila iz vrst hrvaških nordijcev pred sezono 2000 / 01 .	dočakala	5	Perf
Takšna psihološka grozljivka je trajala skoraj deset let .	trajala	4	Imp
In ko je " Baško " z nagajivim nasmehom skrivaj pomežiknil članom slovenske delegacije , je bilo jasno , da je Slovenija zmagala .	zmagala	22	Perf
kandidata trdo delata v glavnem se mudita v državah kjer se napovedujejo tesni izidi	mudita	6	Imp
Kot smo že poročali , je bila afera Holmec eden od razlogov , da so v parlamentu zamenjali notranjega ministra Mirka Bandlja ( LDS ) .	poročali	3	Imp
Ko je prvič za steklom zagledal starkin obraz , je prestrašen odletel , vendar se je počasi navajal na njeno navzočnost .	navajal	17	Imp
Zato , da se ne ugreznemo v pesek , ko gremo po puščavi !	ugreznemo	5	Perf
Tako se večkrat zgodi , da so podjetja še vesela , če občani ne zberejo kaj dosti teh odpadkov , saj bi sicer račun kaj hitro pokazal rdeče številke .	pokazal	26	Perf
Čutil sem njene polne nenašminkane ustnice , ki so polagoma dojemale , kako zelo si jih želim .	Čutil	0	Imp
Vsega nikoli ne morete imeti , partnerju potrdite , da na nekem področju niste uspešni .	potrdite	7	Perf
Iztegnila je roke , da bi sprejela nekaj nematerialnega in otroškega .	Iztegnila	0	Perf
Vsaj prvih 7 do 8 dni rabijo mladiči izredno veliko živalskih beljakovin , zato se varčevanje z njimi ne izplača .	rabijo	6	Imp
Samci morskih levov tehtajo do 250 kilogramov in nadzorujejo ter pred drugimi samci varujejo teritorij , na katerem je tudi do trideset samic .	varujejo	13	Imp
Za glasbeni predah je poskrbel trio Glasbene šole Marjana Kozina , v katerem igrajo Nastasia Suhadolnik , Sandra Poredoš in Ana Arh , kot gosta pa sta sodelovala še fotografa Borut Peterlin in Drago Vuica s projekcijo diapozitivov .	poskrbel	4	Perf
ko pa sem ko pa sem pisal spis pa sem dobil spet eee ena do dva ker je tisti profesor iz iz božje milosti nekaj mi šenkal	šenkal	26	Perf
Ali bo zmogla tudi slednje , pa je veliko vprašanje tudi zato , ker tako rekoč vsi odgovorni v vladi hkrati sami sedijo na visokošolskih stolih .	sedijo	22	Imp
Poroka je potekala brez zamude okoli poldneva , dirko pa so prestavili za dvajset minut .	prestavili	11	Perf
sedem minut je še do pol osmih kadilci so danes na boljšem kot so bili vso zimo kajti sonce jih pridno greje in zdajle je že šest sedem stopinj	greje	21	Imp
tako [name:personal] je na tablo dokončal ste pogledali preverili svoje rezultate ? … a je [name:personal] prav naredil ? prav [gap] sistematično to tako kot je [gap]	preverili	8	Perf
se pravi posluša	posluša	2	Imp
Prepričana sem , da si je najin otrok izbral prav naju za starša , ker potrebuje za življenje ravno to , kar mu midva lahko nudiva , "	nudiva	25	Imp
Vsako leto se skušam vpisati v šolo , a žal ni časa , ker neprestano potujem .	potujem	15	Imp
Prosila je torej za novo avdienco .	Prosila	0	Imp
Zakon sam ne predpisuje roka , v katerem mora računsko sodišče predlagati uvedbo postopka , mora pa seveda paziti , da prekršek ne zastara .	predpisuje	3	Imp
Ta del je bil sila splošen , tako nabit z gradivom , da smo mu komaj sledili , ampak je sprehod povezovala nikoli moteča se Tajda Lekše , ki bi bila sposobna odrecitirati na pamet cel Krst pri Savici .	povezovala	21	Imp
Bo se je nasmehnil in postavil v držo .	nasmehnil	3	Perf
Spati mi namreč ne da nov predlog zakona o divjadi in lovstvu oziroma njegovi nasprotniki .	Spati	0	Imp
Ker smo na vsak način hoteli Igrice krstiti , sem se sam lotil režije .	hoteli	5	Imp
Seveda ga je vrgla iz tira vojna .	vrgla	3	Perf
Poleg običajnih zaporednih in vzporednih kablov TranXit podpira tudi vmesnike , združljive z IrDA , kar ga ločuje od tekmecev .	podpira	7	Imp
Stopil je okoli hiše , do okna brloga , kjer je skozi režo med odejo in zidom videl dovolj .	Stopil	0	Perf
Čudil sem se pešcem , ki so še kar naprej hiteli za svojimi obveznostmi , ne da bi se zavedali , da se motajo med nogami velikana .	hiteli	10	Imp
Nenadoma je odmaknila pogled z ekrana , nagnila glavo in začela poslušati .	odmaknila	2	Perf
Če semenčice ne dobijo vloge v veliki predstavi , če par nima spolnih odnosov , je to še vedno edina 100 - odstotna zanesljiva metoda , da se partnerja izogneta nosečnosti .	izogneta	29	Perf
Na dvorišču policijske postaje je vse več zaplenjenih vozil , ki so prevažala ilegalce .	prevažala	12	Imp
Z delnicami bodo delničarji razpolagali v skladu s predpisi o izdaji delnic v nematerializirani obliki ob upoštevanju predkupne pravice delničarjev , ki so prevzeli delnice na podlagi skupščinskega sklepa .	prevzeli	23	Perf
Ta sklep je že dokaj konkretno nakazoval usmeritev k oblikovanju skupnega ogrodja za kvalifikacije v evropskem visokošolskem prostoru .	nakazoval	6	Imp
Po našem merjenju časa je preteklo po strugi Donave veliko vode do ponovnega utelešanja .	preteklo	5	Perf
Če pa želite svoje čebelice toplo odeti že oktobra , naj bo opaž zračen in suh .	odeti	6	Perf
Mladi košarkarji San Antonia se bodo na lastni koži prepričali , da je laže osvojiti naslov prvakov kot ga ubraniti .	osvojiti	14	Perf
Odkar pomnim , je Orto bar edini popularen kraj v Ljubljani , kjer se lahko navadni civili srečamo s tistim skromnim preostankom ortodoksnih pripadnikov preživelih subkultur .	pomnim	1	Imp
Ne mencajte oči , če pa to vendarle storite , si roke umijte .	umijte	12	Perf
Premerila me je od vrha do tal in se tudi ona nasmehnila .	Premerila	0	Perf
Prav dobro pa se spominjam da razlogom , ki jih je navajal , nisem verjel .	spominjam	4	Imp
Včasih , ko sem se streznil po nekajtedenski zapijanki , sem se v pravični jezi nad samim sabo odločil , da bom nehal .	streznil	5	Perf
pa eee moram se spomniti da jo vprašam	spomniti	4	Perf
Kljub tradiciji so bili tokrat organizatorji prisiljeni izvesti nekatere spremembe .	izvesti	7	Perf
Čas je , da uživate na lovorikah , poleg tega pa nekaj časa posvetite razvajanju svojega telesa .	uživate	4	Imp
V primeru uspeha si lahko oddahneš , z neuspehom pogoriš .	pogoriš	9	Perf
Lahko pa kot prilogo naredite tudi zelenjavni pire .	naredite	4	Perf
Toda slednje velja predvsem za deskarje v prostem slogu ( freestyle ) , medtem ko se je tekmovalni del , imenovan alpine , z leti razvil v pravi profesionalni cirkus , ki ne dopušča ponočevanja in popivanja .	razvil	25	Perf
Ne da bi pogledal , sem zakoračil v eno izmed vrst , z roko udaril po poklopljenem lesenem sedalu stola , da je glasno počilo , ko je skočilo v vodoravni položaj .	zakoračil	6	Perf
Če semenčice ne dobijo vloge v veliki predstavi , če par nima spolnih odnosov , je to še vedno edina 100 - odstotna zanesljiva metoda , da se partnerja izogneta nosečnosti .	dobijo	3	Perf
ZASTAVE - Vsak predšolski otrok bi z lahkoto preštel tistih nekaj zastav , ki so ob dnevu samostojnosti visele v Črnomlju .	visele	18	Imp
Končno le odkrijeva levo za razom navpično zajedo , ki se izgublja nekam pod nebo .	odkrijeva	2	Perf
Komajda je stala ali celo sedela , vendar mu je namenila , za kar je mislila , da je slaboten nasmeh .	sedela	5	Imp
Takrat sem noge malomarno dvignil in jih položil na naslonjalo stola pred sabo , čeprav tega nisem nikoli počel , vedno mi je šlo na živce , kadar so to počeli drugi .	dvignil	4	Perf
pa z [gap] ko ste zdaj pripravljali osnutek	pripravljali	6	Imp
V zvezi z značilnostmi in izborom umetnostnih besedil se nam zastavljajo še nekatera vprašanja in pomisleki :	zastavljajo	10	Imp
Fotograf je imel roko na sprožilcu in bi lahko vsak trenutek pritisnil .	pritisnil	11	Perf
Selilske oblike rastejo vse tja do 20. leta .	rastejo	2	Imp
Veliko je odvisno od tega , kakšnega nasprotnika ti že na začetku določi žreb .	določi	12	Perf
Skočil sem v dusterja , in še preden sem zapeljal s parkirišča , sem že vozil sedemdeset kilometrov na uro .	Skočil	0	Perf
vesta kaj to je tako ker tudi t [gap] koalicija slovenija je bila razpredena kot čipka	vesta	0	Imp
Prvi je izdeloval in prodajal standardizirana lahka vozila na lasten pogon .	prodajal	4	Imp
kar sem rekel samo tako da zdaj v bistvu lahko probaš če boš odgovoril ali [speaker:laughter]	probaš	10	Perf
Met začnemo z dviganjem vrvice , ki jo dvigamo toliko časa , da se izravna in je brez vozlov .	dvigamo	8	Imp
Stoletje pozneje so na sceno stopili vampirji , izobraženstvo pa je bilo tako zazrto v diabolično Transilvanijo , da je papež Benedikt XIV. moral posvariti celo škofe , naj ne zapadejo vampirski skušnjavi .	zapadejo	30	Perf
Poveljnik PGD Branko Zore je povedal , da je v vrstah PGD Štatenberk poleg 106 članov še več kot 50 pionirjev in mladincev .	povedal	5	Perf
Rešitev naj bi se skrivala v možnosti , da se vsak posameznik lahko prostovoljno odloči za služenje vojaškega roka ali pa da država organizira profesionalno vojsko .	skrivala	4	Imp
Preizkušali sta najrazličnejše trenerje in učitelje jahanja , prebirali knjige o umetnosti jahanja ter gledali nastope svetovne dresurne in skakalne elite .	Preizkušali	0	Imp
Dovolj je bilo , da je zaužila nekaj rubinastih zrnc , in ostala je za vedno obsojena na življenje z vladarjem podzemnega sveta .	zaužila	6	Perf
V SPEČEM ŽIVLJENJU RUTH RENDELL INŠPEKTORJU WEXFORDU USPE RAZVOZLATI MISTERIOZNI PRIMER UMORA ŠELE S POMOČJO HČERINE PRIPOMBE , DA BI MORALE ŽENSKE PRAKTICIRATI EONIZEM , ČE BI HOTELE BITI ENAKOPRAVNE .	MORALE	20	Imp
Francoza sta odšla naprej , Nemci pa kar nekaj " čarajo " cele pol ure , preden lahko nadaljujeva .	čarajo	10	Imp
Po njihovem naročilu vzbrsti v zgornji plasti maternične sluznice veliko krvnih žilic , žleze se razvijajo in vsepovsod se skladiščijo hranljive snovi .	skladiščijo	19	Imp
Spet sta se približala z ustnicami in se združila v dolgem poljubu .	združila	8	Perf
Ta nasprotna stališča pojasnjujejo predvsem z močno polarizacijo družbe , ki je po mnenju večine opazovalcev posledica ideologije Fidesz - MPP , ki temelji na ustvarjanju bipolarnega političnega sistema v državi .	pojasnjujejo	3	Imp
Saj je že dovolj hudo , ko pride , ne da bi nam bilo treba že vnaprej trpeti , ker bi vedeli zanj .	trpeti	17	Imp
Zdaj pa si predstavljajte , kako nekdo , ki ne govori tekoče francosko , nekomu , ki ne govori tekoče angleško , dopoveduje , kako so v Sloveniji liberalne demokrate na oblasti zamenjali slovenski demokrati .	predstavljajte	3	Imp
Ugotovimo sklepčnost !	Ugotovimo	0	Perf
Sodobna krpanka se je osvobodila nekdanjih togih oblikovalskih pravil , ki so temeljila na povezovanju pravokotniških oblik in umirjenih enobarvnih ter vzorčastih ostankov blaga .	temeljila	12	Imp
sicer sicer misli odplavajo drugam	odplavajo	3	Perf
Vabim vas na tortice v slaščičarno tja čez .	Vabim	0	Imp
Bolgarska cerkev pa je popularne knjige o Harryju Potterju označila kot duhovni aids za bralce , saj naj bi oslabile imunski sistem proti črni magiji in jih napravile dovzetnejše za zlo .	označila	9	Perf
Moji učitelji so kavsali .	kavsali	3	Imp
Od treh lepotic iz prvega dela filma Charlijevi angelčki je na vlogo v nadaljevanju do zdaj pristala le Drew Barrymore , medtem ko se Lucy Liu še vedno pogaja .	pogaja	28	Imp
Na občini že razmišljajo o novih rešitvah .	razmišljajo	3	Imp
[gap] zdajle še malo drugega prodati	prodati	5	Perf
Zakaj sta si premislila in hotela Damijana R. oropati , bo pokazala preiskava .	oropati	8	Perf
če seštejem bo prišlo pet iks minus tri	seštejem	1	Perf
Že pred dobrim letom smo z operativnimi metodami in upravnimi ukrepi ugotavljali verodostojnost listin in upravičenost nošenja orožja vseh imetnikov orožja , pri čemer smo zajeli tudi bivše pripadnike JLA , ki so tako orožje oz. listine posedovali .	zajeli	25	Perf
So trenutne sledi , na katere se osredotočajo polja sil , ali pa so informacijski vektorji v komajda utelešeni in nadvse spremenljivi semiozi , ki jo usmerjajo dejanja prepoznavanja in napačnega prepoznavanja .	usmerjajo	26	Imp
Nekaj danes že legendarnih vicev preberem naglas tudi P.	preberem	5	Perf
Vsa leta njegove bolezni sem trpela in sočustvovala z njim ter umirala v sebi .	trpela	5	Imp
Upniki bi ga pribili na križ , če bi še živel .	pribili	3	Perf
Prospero ga je nagovoril , učil ga je govoriti in sploh je bil do njegove umske revščine zelo pozoren .	nagovoril	3	Perf
Kriki , ko pred stavbo bolnico premeščajo v reševalni avtomobil , pa se nekako ne skladajo s sončnim dnem .	premeščajo	6	Imp
Zdelo se mu je logično , da se bo oblekel v svojo obleko , ki je tudi veliko toplejša od pižame in bolniške halje .	Zdelo	0	Imp
Počutila sem se izdano , prevarano in peklensko je bolelo .	Počutila	0	Imp
Žrtvi se odpravita proti studiu , sumljivi individuum pa odide v svojo hišo .	odide	9	Perf
ja govori o neki ženski a je ta žens [gap] ampak kako govori o neki ženski ne da jo zdaj ne vem opisuje predstavlja označuje ampak kako govori o njej da je z njo nekoč doživel neko prijetno	označuje	24	Imp
Enemu od policistov se je vendarle uspelo prebiti do marice in Mateja je skušal potisniti noter .	skušal	13	Imp
Na Ostrvu junosti , Otoku mladosti , se je trlo mladih parov , ki so se vozili s katamarani , se objemali na plaži in se sprehajali po skrivnih potkah .	objemali	21	Imp
Eden izmed teh elementov je prav kontekst , ki je definiran pravzaprav kot tisti del zunajjezikovnega sveta , na katerega se nanaša vsebina jezikovnega sporočila s pomočjo referencialne funkcije jezika .	nanaša	21	Imp
To je izrazil v pismu pisateljici Zofki Kvedrovi , ko ji je napisal :	izrazil	2	Perf
Vsak moj stik z Bekijem je zame poseben čar , ki ga je nemogoče opisati , ker je to treba doživeti in sama to doživljam vsakič znova .	doživljam	24	Imp
Japonska je pokazala , da je tudi sama pripravljena odpreti vrata svojemu območju in narediti korak iz sto let samote , samo da ne bi še naprej zaostajala za azijsko velesilo .	zaostajala	27	Imp
V zadnjih 20 letih so se ti cilji stalno spreminjali .	spreminjali	9	Imp
Brežice - Stalna mešana hrvaško slovenska komisija , ki bo skrbela za uveljavitev določil sporazuma o obmejnem prometu in sodelovanju ( Sops ) na naši južni meji , se bo drugič sestala v začetku prihodnjega meseca .	sestala	31	Perf
Na mostu je tudi samodejna vremenska postaja , ki voznike prek prikazovalnikov opozarja na močan veter ali poledico .	opozarja	12	Imp
Trajalo je sicer nekaj ur , da sem dojel , kaj se mi je primerilo - ampak potem se je znenada pojavilo ogorčenje .	Trajalo	0	Imp
Hitreje ko se vrnemo v cesarstvo našega gospoda , bolje se bom počutil .	vrnemo	3	Perf
V našem okolju ni vinogradov , zato tudi ni nihče nikdar omenjal črička .	omenjal	11	Imp
KI SO GA SKLENILI VLADA REPUBLIKE SLOVENIJE , PREDSTAVNIKI DELOJEMALCEV IN PREDSTAVNIKI DELODAJALCEV ( SOCIALNI PARTNERJI ) , OPREDELJUJE OSNOVNA NAČELA IN CILJE , KI JIH SOCIALNI PARTNERJI ŽELIJO DOSEČI NA PODROČJU POLITIKE PLAČ .	SKLENILI	3	Perf
Bržčas pa so si tudi želele iz oči v oči videti žensko , pisateljico , ki si je vendarle zagotovila trdno mesto na sočasni literarni sceni .	želele	5	Imp
Blair je tudi opozoril , da ni več mogoče načeloma podpirati širitve , v praksi pa jo zavlačevati .	opozoril	3	Perf
Vsi dosedanji načrti za zmanjšanje svetovne revščine so se izjalovili , kar sta pred leti priznali tudi Svetovna banka in Mednarodni denarni sklad .	priznali	15	Perf
Država potemtakem mora uvesti nove davke , če hoče ohraniti zatečeno stanje , ali pa zaposlene v javnem sektorju odpuščati .	ohraniti	9	Perf
Erzberger predloži državnemu zboru " mirovno resolucijo " .	predloži	1	Perf
Kazalo je , da bodo drug z drugim lepo shajali .	shajali	9	Imp
Najboljši košarkarski klubi v Sloveniji pozabljajo , da je praznovanje sploh obstajalo , kajti drevi jih čaka 17. krog domačega prvenstva 1. A lige .	obstajalo	11	Imp
Smehljajte se v svoje središče in segrevajte to pomembno območje .	Smehljajte	0	Imp
Izbrana priležnica je pokleknila in se s ponižnim nasmehom prizadevno lotila opravila .	pokleknila	3	Perf
Večer prinese izboljšanje vremena , temna oblačna fronta odjadra nekam za Grandes Jorasses .	odjadra	8	Perf
In prijateljica reka jo je vzela v svoj blagi objem , si položila njeno utrujeno glavo na prsi in utišala bolečino .	položila	12	Perf
• Vaš partner ima usodno hibo oziroma napako , ki je noče odpraviti .	odpraviti	12	Perf
KI SO GA SKLENILI VLADA REPUBLIKE SLOVENIJE , PREDSTAVNIKI DELOJEMALCEV IN PREDSTAVNIKI DELODAJALCEV ( SOCIALNI PARTNERJI ) , OPREDELJUJE OSNOVNA NAČELA IN CILJE , KI JIH SOCIALNI PARTNERJI ŽELIJO DOSEČI NA PODROČJU POLITIKE PLAČ .	OPREDELJUJE	18	Imp
V tujini je zdržal le leto dni .	zdržal	3	Perf
Komercializacija trpljenja se glasi elegantna uradna utemeljitev .	glasi	3	Imp
V času , ko sem imel vaje v Ateljeju 212 , sem se sprijateljil z dramaturgom Jocom , kot smo imenovali Mirino desno roko Jovana Ćirilova , ki je bil pozneje direktor v Jugoslovanskem dramskem gledališču .	sprijateljil	13	Perf
Mineva leto dni , odkar me je pot vodila v Spodnji Gasteraj k družini Bohak , Jožici , Zarji in Ernestu .	Mineva	0	Imp
Razvil se je skriti zaslon in se osvetlil .	osvetlil	7	Perf
O , a sem ti omenu , da sem seropozitiven ?	omenu	5	Perf
Obmolknil je in me pogledal in zdelo se mi je , da mu je prek obraza šinila smrt .	šinila	16	Perf
Kot otrok sem brcal žogo pred blokom , nato pa je prišla zamisel , da bi začel trenirati v nogometnem klubu in prišlo je do vpisa v Primorje .	brcal	3	Imp
Noge postanejo lažje in tudi manj bolijo .	postanejo	1	Perf
Pivovarna Laško je ugotovila , da multinacionalne družbe z nakupom podjetja dobijo tudi lokalni tržni delež , zato je skušala braniti svoj položaj doma in postati sama prevzemnik z nakupom Unionovih delnic .	skušala	19	Imp
Neverjetno , edinstveno vznemirjenje ob tem , da prelamljaš svete tabuje družbe in izživljaš dovršene fantazije , je bilo neustavljivo .	prelamljaš	8	Imp
Prah mu je drsel pod dlanmi , prsti so se ugrezali v blato .	ugrezali	10	Imp
Kljub moji invalidnosti lahko doživim lepe trenutke , ne samo ob jahanju z njim , ampak tudi ob tem , ko ga hranim s kruhom , korenjem , ovsom in drugo hrano za konje .	hranim	22	Imp
Namesto sedmih v evropski parlament izvoljenih slovenskih poslancev naj bi v državni zbor sedli Darja Lavtižar Bebler , Breda Pečan , Matjaž Falkner in Siniša Germovšek	sedli	13	Perf
Ponovno je poprijel in se nato potegnil navzgor .	potegnil	6	Perf
Notranja stena arterij ( endotelij ) se po mastnem obroku pogosto skrči in maši .	maši	13	Imp
Čisto me je prevzelo , tako da je to opazila tudi Jasna .	opazila	9	Perf
Varnostne sile so sprožile akcijo iskanja storilcev .	sprožile	3	Perf
eee in je rekla je rekla bom jaz probala pravi	probala	8	Perf
Kot bi ruj želel , da ga ne pozabimo do prihodnje pomladi , ko bo zopet lep , lepši , najlepši .	želel	3	Imp
mogoče je še kdo med vami pred petdesetimi leti ročno pobiral koloradske hrošče ki so ogrožali pridelek škrobnatih in okusnih gomoljev	pobiral	10	Imp
Seveda sem moral tudi zdaj zložiti vse ven vse do zadnjega in seveda je nisem našel .	zložiti	5	Perf
Pogledal je na uro .	Pogledal	0	Perf
Kdor je bil prvi , je pač zasadil svojo zastavo in zemljo proglasil za svojo .	proglasil	12	Perf
Ta stari nasvet onemogoča vsakršno razsodbo , kajti nekoga obsojamo ravno zato , ker se ne moremo postaviti na njegovo mesto .	obsojamo	9	Imp
Jaz bi vljudno predlagal , da bi glasovali o ponovitvi glasovanja , ker dopuščam možnost , da se je kdo od poslancev zmotil .	zmotil	22	Perf
Dobro nastopate .	nastopate	1	Imp
Imamo čas za razmislek , kaj nam čustvo sporoča in kako bomo ukrepali , če bo potrebno .	ukrepali	12	Imp
Drugi je zavrniti takó disciplino kot skupnost , ki izvršuje nadzor .	izvršuje	9	Imp
pa ti po tistih terenih smučaš vsi ostali pa ne rabijo zraven tebe biti	smučaš	5	Imp
Na pomoč mora priskočiti najin doma tolikokrat prebrani opis , ki ga morava z mnogo mimike prevajati v francoščino in nemščino .	morava	12	Imp
namreč kot lion eee imaš pravico eee kjerkoli v svetu si poiskati lokalni klub še posebej če rabiš pomoč in lahko računaš na pomoč	poiskati	11	Perf
Pojasnite , da vam ni nič dolžan in da upate samo to , da bo tudi on skušal pomagati drugim alkoholikom , ko se bo sam izvlekel iz težav .	Pojasnite	0	Perf
Mary Douglas vse življenje spremlja teorija institucij .	spremlja	4	Imp
Pred desetletji je bilo dokaj znano ime Anuška , ki so ga potem krajšali ali prirejali v Nušo ali Anito ali celo v Aniko .	krajšali	13	Imp
