Balzac disse :	disse	1	Past
Quale fiume scorre sotto il ponte George Washington a New York ?	scorre	2	Pres
Cliccando su di esso , le persone visualizzeranno i tuoi aggiornamenti pubblici nella loro sezione notizie .	visualizzeranno	7	Fut
Onori a Mario Monti , ma sappiate che a breve , per spirito patrio , saremo costretti ad accettare la sua minestra e lo odieremo per questo .	odieremo	24	Fut
Ad aprile le vendite saliranno del 22% - arriva la nuova F 355 .	saliranno	4	Fut
Si è laureata in pianoforte a Dallas , all’ Università del North Texas .	laureata	2	Past
Mai sterili ! - « Che la tua vita non sia una vita sterile . Sii utile , lascia traccia » . *** Appena lessi ... http://t.co/Xhqxf1XEfZ	lessi	24	Past
E ricercare invece forme di intervento e di azione che coinvolgano l' assieme delle forze che si richiamano al movimento operaio e democratico dell' Europa e del mondo intero .	coinvolgano	10	Pres
Il reddito imponibile dell' esercizio ammonterà quindi a l 2.250 .	ammonterà	5	Fut
Un forte indirizzo antimafia del governo , del parlamento , dei partiti , dei principali esponenti politici tranquillizza il collaboratore , lo induce a dire tutto quello che sa .	induce	22	Pres
Napolitano auspica un' efficace e condivisa azione di governo , Monti si prepara a guidare l' esecutivo ... http://t.co/aOK4tBbY	auspica	1	Pres
Milano - il vecchio spionaggio industriale matura , diventa scienza e riesce a portare attorno a un tavolo come alleati una trentina di colossi industriali aspri concorrenti nella gestione quotidiana .	matura	6	Pres
Salvini all' Isis : " Ho fatto un anno di servizio miltare " . Aggiungi un anno di judo e si arrendono . [ CONTINUA su https://t.co/oDPUtx2DvV ]	Aggiungi	14	Pres
Mi portavano curiose lettere ingiallite dal tempo , e in esse trovavo nomi dimenticati , modi di dire a me insoliti , sentimenti che non riuscivo a capire .	portavano	1	Imp
Papa Giovanni Paolo II visiterà Cuba dal 21 al 25 del prossimo anno .	visiterà	4	Fut
Dato che le istituzioni finanziarie attiravano i migliori e i più brillanti da tutto il mondo , non si poteva sperare nulla di diverso .	attiravano	5	Imp
#Grillo : " colpito chi si oppone . dopo la lega punteranno Idv e noi " . Si paracula preventivamente . #codadipaglia ?	punteranno	11	Fut
In secondo luogo , la globalizzazione finanziaria è stata osannata in modo esagerato .	osannata	9	Past
Eguzzoni ha annunciato che querelerà Borgogni .	querelerà	4	Fut
Gli tolsero la pistola di ordinanza e lo trasferirono a Catania .	tolsero	1	Past
La dichiarazione del creditore di rimettere il debito estingue l' obbligazione quando è comunicata al debitore , salvo che questi dichiari in un congruo termine di non volerne profittare .	dichiari	20	Pres
La #manovra del Governo #Monti sulle Province non delude , ascoltiamo il resto	ascoltiamo	10	Pres
#CrespiRicerche : Mario #Monti , favore al 56 % ; #Governo al 60 % . Tra i ministri spiccano le donne . http://t.co/Wv0DuqWD #luigicrespi #crisi	spiccano	18	Pres
Ignazio Marino ci ripensa . " Ci vediamo a Valencia ! " [ @user ]	ripensa	3	Pres
LAZIONEWS . EU - MERCATO . BRANCA : “ ZARATE ? Decideremo se riscattarlo dopo l' ultima giorn... http://t.co/qQfM5snQ #lazio #calcio	Decideremo	11	Fut
È vietata la riorganizzazione , sotto qualsiasi forma , del disciolto partito fascista .	vietata	1	Past
Mi portavano curiose lettere ingiallite dal tempo , e in esse trovavo nomi dimenticati , modi di dire a me insoliti , sentimenti che non riuscivo a capire .	trovavo	11	Imp
Anche perché sembrava proprio che il nuovo presidente , con il suo stile spiccio e diretto , intendesse fare sul serio .	intendesse	17	Imp
Le armi chimiche sono gas velenosi che possono uccidere in pochi minuti le persone che li respirano o li assorbono attraverso la pelle .	respirano	16	Pres
La sua previsione rappresentava la semplice estrapolazione di due trend :	rappresentava	3	Imp
#chetempochefa si riverberà ? Il perfetto professor Monti sbaglia il futuro di riverberare .	riverberà	2	Fut
governo #Monti favorevole a tutte le mozioni ( compresa Idv , con riformulazione ) tranne #Lega . Leghisti ironizzano : Grazie ! #opencamera	compresa	8	Past
Quando domani approveremo il processo verbale della seduta odierna i colleghi che dovessero ritenerlo inadeguato potranno chiedere che esso venga modificato .	approveremo	2	Fut
Ma cosa accadrà domani mentre a Belgrado e a Tirana Milosevic e Berisha appaiono sempre più deboli ?	accadrà	2	Fut
Mario Monti nomina a Premier ? Per tutta la vita guadagnerà 25mila euro al mese http://t.co/w1QMZOqk	guadagnerà	10	Fut
Mosca accetterà quindi di aderirvi soltanto a condizione che contestualmente venga firmato un accordo separato sulle sue relazioni con la Nato .	accetterà	1	Fut
Il che , ammetterà , è singolare ;	ammetterà	3	Fut
@user : Ci diranno che Mario Monti è poco Italiano , ma spero che gli Italiani gli assomiglieranno sempre più : http://t.co/1m1GGJGb	assomiglieranno	17	Fut
Consigliamo ai visitatori di non passare la notte in città senza l' assistenza di qualcuno del posto .	Consigliamo	0	Pres
Catanzaro / Operazione Perseo , a fine mese il verdetto : A fine mese scadranno i termini processuali relativ... http://t.co/NqetbXw4Aa	scadranno	14	Fut
dopo il primo shock petrolifero , gli altri paesi hanno capito che occorreva riportare al più presto il bilancio in equilibrio aumentando la pressione fiscale .	occorreva	12	Imp
Chiusi le porte , abbassai le persiane .	Chiusi	0	Past
Ma un altro simbolo gigantesco è sospeso al grande lucernario sulla scalinata che sale al primo piano :	sale	13	Pres
I Romantici , in particolare , acclamarono il genio di Shakespeare , e i Vittoriani adorarono Shakespeare con una reverenza che George Bernard Shaw chiamò " bardolatria " .	adorarono	15	Past
Quale strumento suonava Louis Armstrong ?	suonava	2	Imp
Dopo una visita al ghetto di Roma , i partecipanti alla crociera sono stati portati in pullman a Brindisi dove dei finti soldati britannici fingevano di controllare i loro passaporti .	portati	14	Past
Anche qualche ora in più di #scienza non avrebbe gustato ne #labuonascuola . Qui riassuntino : http://t.co/U5vWXjGII8 via @user	riassuntino	14	Pres
- Le attività analizzate sono state ritenute pertinenti e corrispondenti agli obiettivi principali del programma .	analizzate	3	Past
Male male male .. Un governo Monti con Letta vice , Palma e Frattini riconfermati , Ichino ( Pd ) al welfare ... Per fare cosa ? #elezionisubito	riconfermati	14	Pres
Una speranza nuova mi trarrà domattina ancora più avanti , verso quelle montagne inesplorate che le ombre della notte stanno occultando .	trarrà	4	Fut
A quale velocità viaggia la luce nello spazio ?	viaggia	3	Pres
22/4/2011 : - Fu leakkato il Remix di " TTWE " con Niki Minaj e Ke$ha - " S&M REMIX " sale alla #1 della Billboard hot ... http://t.co/KlDLuqeM	leakkato	4	Past
Si trattava di calcolare il numero delle pubblicazioni sulle riviste internazionali , dei brevetti , delle citazioni ottenute dagli scienziati italiani per capire chi davvero lavorava e chi , invece , batteva la fiacca .	trattava	1	Imp
Tra le sfide più delicate del governo #Monti , i flussi migratori . Riuscirà lì dove tutti hanno fallito ( stracciando il trattato d' amicizia ) ?	Riuscirà	13	Fut
Mario Monti nuovo premier cambiera qualcosa ? http://t.co/TJaOBiDW	cambiera	4	Fut
Questa tecnica dona nuova forza e flessibilità ai versi di opere come Giulio Cesare e Amleto .	dona	2	Pres
#MarieMonti : Obama : appoggieremo in parlamento il governo #Monti , mentre Zapatero si appresta a fare #opposizione ... ahhh la globalizzazione	appresta	14	Pres
Degan , infatti , era stato allertato dai suoi esperti legali :	allertato	6	Past
Il compratore si risparmierà dunque il fastidio di dover lanciare un' Opa successiva per raggiungere il 100% del capitale .	risparmierà	3	Fut
i due erano rimasti intrappolati in una caverna .	intrappolati	4	Past
BERLUSCONI APPOGGIA IL GOVERNO MONTI : FARLO CADERE E' DA IRRESPONSABILI http://t.co/70Gm9iU8	APPOGGIA	1	Pres
Stasera #piazzapulita SALVATORI DELLA PATRIA Il governo Monti stanga i ceti deboli . Quando toccherà a quelli che non vengono mai toccati ?	toccherà	14	Fut
Hańska era sposata con un uomo vent' anni più grande di lei , Wacław Hanski , un ricco possidente polacco che viveva vicino a Kiev .	sposata	2	Past
Mutano i profili professionali mentre divengono sempre più centrali i temi del governo delle innovazioni e della organizzazione del lavoro .	divengono	5	Pres
Il seminario avrà luogo nell' aula magna dell' accademia venerdì 27 maggio e inizierà alle ore nove .	inizierà	13	Fut
#visco : Con la #manovra scende il Pil . Grazie professor #monti . se al tuo posto ci mettevamo l' omino del banco della frutta faceva meglio .	faceva	25	Imp
@user non mi fido mai di quelle che si truccano . Chissà cosa nascondono .	truccano	9	Pres
La modifica della direttiva oggi in discussione non implica la modifica dell' armonizzazione attualmente vigente all' interno della comunità delle norme in materia di trasporto di merci pericolose .	implica	8	Pres
Tutti gli esseri umani hanno capacità non sfruttate , non utilizzate .	sfruttate	7	Past
Ritrovata la salma di Mike Bongiorno . Giusto in tempo , nel Governo Monti c' è ancora un Ministero libero	Ritrovata	0	Past
Ma questi Movimenti nuovi , nei loro modi e in forma a volte indiretta , esprimevano un' esigenza di riforma della politica ;	esprimevano	15	Imp
a chi chiederemo conto , adesso , di quest' altro danno ?	chiederemo	2	Fut
Vedrete che su Pechino le Erinni cercheranno di farle cambiare idea e , se sceglierà di fare la democristiana , troverà un trucco per mandare pure la Melandri " .	cercheranno	6	Fut
Quando ebbi infilato l' abito - giacca , calzoni e panciotto - constatai piacevolmente che non mi tirava o stringeva da nessuna parte , come accade quasi sempre con i vestiti nuovi .	stringeva	19	Imp
Quale autore si firmava con lo pseudonimo " Boz " ?	firmava	3	Imp
Nel 1599 , due bozze iniziali dei sonetti 138 e 144 comparvero ne Il pellegrino appassionato , pubblicato a nome di Shakespeare ma senza il suo permesso .	comparvero	11	Past
Datagate : anche l' Europa spiava . Ora che sono tutti colpevoli , facciamo un tana libera tutti e ricominciamo a spiare da capo .	spiava	5	Imp
< i risultati dell' indagine ministeriale - ha aggiunto Poli Bortone - verranno anche messi a disposizione del parlamento che potrebbe istituire una commissione parlamentare , come ha già ipotizzato il Pds > .	ipotizzato	29	Past
Prevede , quest' intesa , che l' ente del binario costruisca nuovi uffici assicurando in cambio il completamento dell' anello ferroviario , una specie di grande raccordo su rotaia .	Prevede	0	Pres
Se il proprietario preferisce di ritenerle , deve pagare a sua scelta il valore dei materiali e il prezzo della mano d' opera oppure l' aumento di valore recato al fondo ( 2 ) .	recato	28	Past
A fine novantatre avevamo inoltre un residuo di 260 miliardi già spesati in conto economico a fronte di progetti che riteniamo porteranno risultati nel tempo .	porteranno	21	Fut
Ho appena ricevuto la telefonata del presidente del consiglio , Mario Monti . Si è complimentato per la gestione ... http://t.co/lg19iObb	ricevuto	2	Past
La norma è già sospesa dal decreto legge 257 .	sospesa	4	Past
Credevo , inconsapevole , che averne ne sette fosse addirittura un' esagerazione .	Credevo	0	Imp
L' accelerazione della crescita registrata all' inizio dell' anno si attenuerà nella seconda parte , conducendo ad un tasso di crescita del pil del 3,2% in media annua .	attenuerà	10	Fut
Il militare inveiva anche nei confronti della figlia Marianna .	inveiva	2	Imp
capisco che sperate nel governo monti , però non fate finta di non vederne contraddizioni e pericolosità	sperate	2	Pres
Nel 1962 suonava il clarinetto nel gruppo musicale dei Flippers .	suonava	2	Imp
L' influenza dei livelli e della composizione della nutrizione materna su un feto di sesso femminile continuerà fino all' età adulta , quando anche lei diventerà una madre .	diventerà	25	Fut
L' autorità giudiziaria dispone direttamente della polizia giudiziaria .	dispone	3	Pres
Non ci crederà , lo sa che alla fine le Erinni sono andate a congratularsi con lei ?	crederà	2	Fut
IL PAESE ASPETTA CON ANSIA LE ( URGENTI ) MISURE DEL GOVERNO MONTI il Velino/AGV Agenzia Giornalis http://t.co/8SbxbNe6	ASPETTA	2	Pres
#Grillo relatore di stato dell' arte delle truffe politiche perchè la politica in Italia è truffa . la truffe / tartufo : va annusata non sniffata	annusata	23	Past
Una Soluzione flessibile e innovativa ( anche se in realtà già sperimentata con successo , si veda il grafico ) potrebbe dunque trovarsi proprio introducendo un prezzo da pagare per utilizzare il centro urbano .	sperimentata	11	Past
#Grillo è la #Lega del 2012 . Contro i ladroni , per il potere al popolo e forse lo ha duro anche lui . Finirà a lingotti e diamanti ?	Finirà	24	Fut
Che titolo si richiede ?	richiede	3	Pres
ma voi credete che il governo monti eviterà la crisi italiana , io ho molti dubbi	eviterà	7	Fut
RT @user : " Tu che stai leggendo questo , ne uscirai , non c' è bisogno che ti dica da cosa . "	uscirai	11	Fut
" occorre un coordinatore unico incarnato da un' autorità al di sopra delle esigenze di settore .	incarnato	5	Past
#Pisapia a #inmezzora parla del rischio che il governo #Monti spacchi il centrosinistra	spacchi	10	Pres
Don Milani notava che tutte queste persone si allontanavano sempre più dalla Chiesa e dalla fede cristiana .	notava	2	Imp
Ne La fenice e la tartaruga , pubblicata in Love 's Martyr , di Robert Chester nel 1601 , si piange la morte della leggendaria fenice e della sua amata , la fedele tartaruga .	piange	20	Pres
I toscani hanno pagato e continueranno a pagare l' addizionale Irpef più bassa d' Italia . Il governo Monti ha ... http://t.co/yzybjVb8	continueranno	5	Fut
" Cambio sempre ruolo , ma le fan mi hanno etichettato " .	etichettato	10	Past
Deve avere in soffitta una locandina di " Rusty il selvaggio " con il suo ritratto che invecchia per lui , come Dorian Gray .	invecchia	17	Pres
Quando l' ho conosciuta nel 2012 , aveva appena portato a termine il primo raccolto di mais cresciuto da un seme adattato al clima della Tanzania .	adattato	21	Past
Scilipoti non voterà il governo Monti . E adesso , come faremo ? Ruberemo ? Nikki - nikki , chi ruba s' impicchi !	Ruberemo	13	Fut
RT @user : Game Over Liga !!!! Grande Mou ora che salgano tutti sul carro !!! ”	salgano	11	Pres
Per quanto riguarda il totoscommesse , Cardia ieri si è impegnato a intervenire presso Dini per avviare l' iter legislativo prima dell' inizio dei campionati , ricorrendo anche a un decreto .	impegnato	10	Past
Se consento alle persone di seguirmi , quali aggiornamenti vedranno ?	vedranno	9	Fut
E' vergognoso pensare che tra i primi provvedimenti del governo Monti ci sara' una tassa sugli animali domestici .	sara'	12	Fut
@user ci stanno PONENDO IL CETRIOLO DRITTO DRITTO NEL ... ma loro se la sono pagata la pensione , PENSA AI CONTRIBUTI FIGURATIVI #M5S	pagata	15	Past
Nessun accordo può però concepirsi come spartizione di zone d' influenza che non tenga conto della piena sovranità degli stati .	tenga	13	Pres
In seguito la rocca viene caricata in cantra del lavaggio e poi questo filo lavato ed asciugato su appositi cilindri a vapore è pronto per le lavorazioni tessili del rayon .	asciugato	16	Past
Ucciso il leader degli avvocati curdi . Tanto gli erano rimasti pochi clienti . [ arthur rombò ]	Ucciso	0	Past
Considerato che una concezione comune di questi diritti e di questa libertà è della massima importanza per la piena realizzazione di questi impegni ;	Considerato	0	Past
state tranquilli , quest' anno sorveglierò io le designazioni , ho messo lì apposta Paparesta , se vi fanno qualche torto rivolgetevi a me .	sorveglierò	5	Fut
Tutti e sette mi hanno servito con una tenacia e una devozione che difficilmente riuscirò mai a ricompensare .	riuscirò	14	Fut
Nonostante la sua bellezza , le sue frasi tendono ad iniziare , fermarsi e finire alla fine del verso , con il rischio di risultare monotone .	tendono	8	Pres
@user1 @user2 sarà ma io ho come l' impressione che il governo Monti non interverrà sulla spesa pubblica ( vedi La Casta )	interverrà	14	Fut
L' intenzione del legislatore era di stabilire che la proprietà di alcuni beni obbligasse il proprietario ad un comportamento attivo .	obbligasse	13	Imp
Le persone che lavorano sono soprattutto operai e contadini e guadagnano pochissimo .	lavorano	3	Pres
" Rabin traditore , morirai " .	morirai	4	Fut
Negli ultimi anni , invece , hanno vinto sempre le squadre automobilistiche con più soldi delle altre squadre e le gare non presentavano più sorprese per il pubblico .	presentavano	22	Imp
Anni fa , ha ricordato il direttore dello Sco , anche in Campania c' erano finanziarie che offrivano un interesse del 7 % mensile a chi affidava loro i propri risparmi .	offrivano	17	Imp
Beh , alcuni di noi se li mangerebbero invece di farli passare in giro .	mangerebbero	7	Pres
Se l' assemblea è d' accordo seguirò il suggerimento dell' onorevole Evans .	seguirò	6	Fut
" Vi daremo le statistiche alla fine " , promettono i generali croati .	daremo	2	Fut
Stefano , non c' è dubbio , purtroppo , il colombre ha scelto te e finché tu andrai per mare non ti darà pace .	andrai	17	Fut
Nel maggio del 1967 uscì il libro della Scuola di Barbiana Lettera a una professoressa che parlava della scuola italiana e di tutti i suoi problemi .	uscì	4	Past
@user chissà cosa ne pensano le vittime di una figlia violentata o uccisa a riguardo della #penadimorte	violentata	10	Past
A coordinare il lavoro sarà Business International , divisione del gruppo < The Economist > , che gestirà fisicamente il " data base " in cui confluiranno tutte le statistiche delle aziende .	confluiranno	26	Fut
Il ritmo frenetico , come all' Etoile o sugli Champs-elysées , lo troveremo a due stazioni di metrò , tra gli eleganti grattacieli della Potsdamer Platz oggi deserta ex terra di nessuno .	troveremo	12	Fut
Le forze di polizia hanno inoltre portato a termine con successo una serie di operazioni , smantellando zecche clandestine e confiscando ingenti quantitativi di banconote e monete contraffatte prima che venissero messe in circolazione .	contraffatte	27	Past
Si sono radunati ai piedi dello straordinario hotel che D' Annunzio aveva ribattezzato Portofino Vetta , hanno diviso il parco in sei " posti di blocco " ferocemente presidiati .	radunati	2	Past
Nelle sue pagine egli cercò di favorire la completa imparzialità ed un riconoscimento ragionato delle varie ideologie .	cercò	4	Past
Prendere in considerazione , nella fase della progettazione , l' impatto ambientale che un prodotto eserciterà nell' intero arco della sua vita può agire favorevolmente sull' ambiente e sui costi .	eserciterà	15	Fut
@user1 @user2 il problema #Grillo 33ª forza sono le alleanze che si creeranno per contrastarlo . Ingovernabilità e #trasformismo	creeranno	12	Fut
Nel 2012 sono stati registrati 207 milioni di casi di malaria che hanno poi portato a 627 mila decessi .	registrati	4	Past
A destra , toeletta e sgabello tipicamente viennesi primo Ottocento , dove la signora Meier sedeva pudicamente a spazzolare i lunghi capelli .	sedeva	15	Imp
Rispose acquistando un' inserzione segreta nella gazzetta di Francia , sperando che la sua critica anonima la trovasse .	Rispose	0	Past
Di quanto aumenta la popolazione mondiale ogni anno ?	aumenta	2	Pres
Prevedeva un più sofisticato raggruppamento delle persone che lavorano attorno a un problema .	Prevedeva	0	Imp
Quelle legislative rinviano al Governo i disegni di legge , ad esse trasmessi , con eventuali osservazioni e proposte di emendamenti .	trasmessi	12	Past
RT @user : Riconosciamo che dal #XF7 italiano nn uscirà mai un cantante internazionale .	uscirà	9	Fut
La bugia del Governo Monti : Liberalizzare e privatizzare . In questo modo ripartiremo e ricondurremo , finalmente ,... http://t.co/DKn95yK2	ripartiremo	13	Fut
Tasse : i ricchi tremano , arriva la super - Ici sulle seconde e terze case : Il governo Monti si prepara a colpire l... http://t.co/pmnpWhUb	prepara	21	Pres
Adesso , a coloro che nel settembre ottantaquattro si erano dichiarati contrari ha chiesto se avessero , e perché , cambiato opinione .	dichiarati	10	Past
Il governo Monti di tecnici ha il dovere di dimostrare di essere migliore dei politici o torneremo al governo di Silvio Sciliputin . Aiuto	torneremo	16	Fut
Ci diranno che Mario Monti è troppo poco italiano . Bene ! #rimontiamo http://t.co/9IzeZEed via @user	diranno	1	Fut
Dal diciottesimo secolo , il desiderio di avere ritratti originali di Shakespeare alimentò la diffusione di dichiarazioni di autenticità di varie immagini che ritraevano Shakespeare .	ritraevano	23	Imp
Faremo molta attenzione allora alla redazione del processo verbale , come per altro facciamo sempre .	Faremo	0	Fut
Nei campi di concentramento gli ebrei erano prigionieri , lavoravano molto , avevano poco cibo e soffrivano il freddo .	lavoravano	9	Imp
Porsi a distanza , quel tanto che basta per mettere bene a fuoco e osservare che le cose non sono esattamente come credevi che fossero .	credevi	22	Imp
Altri vanno avanti senza l' ancoraggio di quella certezza , ma è come se l' invisibile tarlo di un' ossessione insidiasse il lavoro , e allora propongono dilemmi all' editore e agli amici :	insidiasse	20	Imp
Il pisolino di Scilipoti E' stato fotografato da un collega mentre dormiva sul divano della sala di lettura di ... http://t.co/avF7YGJQ	dormiva	11	Imp
Chi ha accoltellato Monica Seles ?	accoltellato	2	Past
Infatti gli evasori possono decidere di pagare una somma di denaro in aggiunta alle tasse già pagate .	pagate	16	Past
In realtà in questi anni a Tirana si sono scontrati in una dura lotta di potere i clan legati alla vecchia nomenklatura , trasversali sia ai partiti di Governo che di opposizione .	scontrati	9	Past
Oltre agli scrittori e agli attori , ogni sera , partecipano anche musicisti famosi che suonano mentre lo scrittore o l’ attore leggono i testi .	suonano	15	Pres
A lei , in coscienza , rincresceva di vederlo così col viso lungo , però non aveva cuore di lusingarlo con belle parole .	rincresceva	6	Imp
Rimasta senza lavoro dopo la fine del regime comunista , era riuscita a mettere in piedi una finanziaria che pagava interessi del 50 % al mese .	pagava	19	Imp
In ogni caso che sua figlia dipingeva molto meglio .	dipingeva	6	Imp
Mi pareva " .	pareva	1	Imp
Susanna aveva sposato un fisico , John Hall , nel 1607 e Judith aveva sposato Thomas Quiney , un vinaio , due mesi prima della morte di Shakespeare .	sposato	14	Past
" risposta scontata : " dopo averli selezionati li smisteranno per Srebrenica , Potocari e Tuzla .	smisteranno	9	Fut
I suoi oggetti e i suoi spazi , ricostruiti in una grande esposizione nella capitale austriaca , stanno incontrando un successo senza precedenti .	ricostruiti	8	Past
La qualità dei prodotti agricoli sarà il tema di fondo che accompagnerà la manifestazione del 2000 , e si comincia subito all' apertura , quest' anno spostata alla Camera di commercio .	accompagnerà	11	Fut
“ Siamo rimasti scioccati nell’ apprendere che è in condizioni critiche e seguiamo con attenzione gli ultimi bollettini medici da Grenoble ” fa sapere la Mercedes in una nota .	seguiamo	12	Pres
“ Che cosa faremo , come agiremo nel prossimo anno , per rendere un poco migliore la nostra città ?	agiremo	6	Fut
È l' euforia della presa di Knin , spiegherà dopo Ante , a farlo parlare così .	spiegherà	8	Fut
Se tutto funziona come speriamo e se tutte le rappresentanze politiche agiscono con senso di responsabilità , i primi risultati si vedranno già il prossimo inverno " .	vedranno	21	Fut
Concludendo , chiedo alla commissione di tenere conto di questi cinque punti quando si tratterà di definire le conclusioni relative ai quattro pilastri ;	tratterà	14	Fut
I banditi sono entrati e l' hanno rapinata di un milione di lire .	rapinata	7	Past
Scusate , dicevano , ma intanto continuavano con il tam tam : " speriamo che i cinghiali lo sentano , e se ne stiano rintanati " , ridacchiavano fra di loro .	ridacchiavano	27	Imp
In realtà , la riduzione dei tassi di crescita è il risultato naturale dell' atteso ribilanciamento dell' economia cinese .	atteso	14	Past
#Mihajlovic a MC : " Dobbiamo giocare sempre per vincere , giocherà chi merita . #Romagnoli ed #Ely ? Hanno fatto bene " .	giocherà	11	Fut
Circa 230 anni dopo la morte di Shakespeare , i dubbi sull' autenticità delle opere a lui attribuite , iniziarono ad emergere .	attribuite	17	Pres
Il dialogo ripreso con la Confindustria è appena un primo balbettio .	ripreso	2	Past
E lo dimostrò subito con un immediato taglio ai finanziamenti , che atterrì la comunità scientifica italiana .	atterrì	12	Past
Gli ultimi progressi nel campo della biologia molecolare offrono delle soluzioni analoghe , ma ben più sofisticate .	offrono	8	Pres
< è come se si fosse spenta la luce e si aspetti qualcuno che la riaccenda > : commenta Antonio Masala , dirigente bancario oristanese .	spenta	6	Past
E anche nella lontana città gli capitava di svegliarsi in piena notte con inquietudine .	capitava	6	Imp
La banca mondiale si è impegnata a raccogliere presso 40 paesi donatori 2,7 miliardi di dollari in cinque anni .	impegnata	5	Past
Non c' è nulla di simulato , però , negli sforzi profusi da noi ucraini per difendere il nostro paese e la nostra democrazia .	simulato	5	Past
Di segno opposto i risultati ottenuti nel novantatre sul mercato interno .	ottenuti	5	Past
Ho chiesto cosa succedesse e un medico mi ha detto che c' era un problema " .	succedesse	3	Imp
Passati gli anni della lotta , soprattutto con la presentazione del suo programma economico all' inizio del 1993 , l' Anc ha incominciato ad attraversare il guado dalla rivoluzione alle riforme .	incominciato	22	Past
