Sì , onorevole Scroedter , esaminerò volentieri i fatti relativi alla questione da lei esposta non appena avrò ricevuto la sua lettera .	esaminerò	5	Fut
Quando Massa e Siena si " litigavano " Vetulonia , la Colonna etrusca http://t.co/TyrQj9o80j	litigavano	6	Imp
" Si sono fermati a pochi metri da dove mi trovavo io - ha detto il barbone - e sembravano intenzionati a restarci a lungo " .	trovavo	10	Imp
accade inoltre che , per ignoranza o insufficiente preparazione dei conducenti o di altri addetti ai vari mezzi di trasporto , un piccolo incidente si trasformi in una sciagura di grandi proporzioni .	trasformi	25	Pres
In passato la povertà e la ricchezza dipendevano soprattutto dalla struttura del tessuto economico locale .	dipendevano	7	Imp
Rassegnamoci , la situazione non muterà nei prossimi giorni : le previsioni meteorologiche sono favorevoli al ristagno e l' allarme ozono rimane .	muterà	5	Fut
Di regola nella tasca destra della giacca io non metto niente , le carte le tengo nella tasca sinistra .	metto	9	Pres
Signora presidente , onorevoli colleghi , sono piuttosto sorpreso del comportamento del collega , onorevole Barón Crespo , che ora pretende che il punto in questione venga inserito nell' ordine del giorno di mercoledì .	pretende	20	Pres
Se la password da te immessa non è abbastanza sicura , prova a mescolare lettere minuscole e maiuscole o scegli una password più lunga .	scegli	19	Pres
#labuonascuola di #Renzi vuol sintonizzare scuola e mondo del lavoro , infatti ti insegna a esser precario e stare muto fin da subito #JobsAct	muto	19	Past
A Ciani si affiancherà Pierangelo Magnone con la carica di direttore generale della Nfm .	affiancherà	3	Fut
@user Fantastico ! vi seguirò dal lavoro ! :) e potrei anche proporre di proiettarvi su schermo in biblioteca ! #librinnovando	seguirò	4	Fut
Mangiavano abbastanza frutta e verdura e bevevano parecchio vino .	Mangiavano	0	Imp
E il traffico è salito a 2500 ore al giorno .	salito	4	Past
È oggi interesse di tutti che le divergenze che si sono manifestate a Ginevra vengano superate e che il negoziato , posto su nuove basi , possa portare a risultati positivi .	manifestate	11	Past
Quando domani approveremo il processo verbale della seduta odierna i colleghi che dovessero ritenerlo inadeguato potranno chiedere che esso venga modificato .	approveremo	2	Fut
In quale provincia è situata Calgary ?	situata	4	Past
adorava Balzac e ne studiò attentamente le opere , anche se criticava quella che chiamava la " volgarità di Balzac " .	criticava	11	Imp
Giovanni Parisi è salito ieri sera a Roma allo Sheraton hotel sul ring , dopo il mondiale perso con Chavez , ed ha battuto al quinto round per ko il messicano Angel Fernandez .	battuto	23	Past
Tutti i provvedimenti giurisdizionali devono essere motivati .	motivati	6	Past
L' industria inoltre riutilizza la lana ricavata dagli scarti di produzione ;	riutilizza	3	Pres
Ma urgeva il miraggio di una vita di lussi sfrenati .	urgeva	1	Imp
Mario Monti acclamato dal popolo del web . Cosa deciderà il Colle ? http://t.co/i0vGaXXB #rimontiamo #308	deciderà	9	Fut
- È lei piuttosto che mi volta le spalle , quando mi vede , quasi fossi uno scomunicato - rispondeva il contadino .	rispondeva	19	Imp
Ogni volta respiravo di sollievo .	respiravo	2	Imp
Diversamente da quanto tendenzialmente vorrebbero gli stati membri l' Europa non dovrebbe sparire completamente .	vorrebbero	4	Pres
I dati #Istat sul #pil dimostrano che la #crisi è nera . Se non si cambiano politiche pagheranno prezzo più alto i giovani #Governo #Monti	pagheranno	17	Fut
E poi nell' autunno novantasei firmeremo la moratoria generale .	firmeremo	5	Fut
Tutti i fondi disponibili in più , rispetto all' anno precedente , sarebbero stati assegnati a " programmi strategici " che si riprometteva di mettere a punto nei mesi successivi .	riprometteva	22	Imp
E tu fuggivi , fuggivi .	fuggivi	4	Imp
I laboratori di via Salaria vennero dotati a questo scopo di impianti che includevano :	includevano	13	Imp
Dal canto loro , gli Stati Uniti hanno fatto affidamento sui prodotti cinesi a basso costo per aumentare il potere d' acquisto dei consumatori ormai provati .	provati	25	Past
L' uomo li aveva rimproverati perché facevano baccano mentre lui tentava di prendere sonno sulla gradinata della chiesa e loro hanno reagito colpendolo .	tentava	10	Imp
Vedremo come andrà a finire la sua vicenda giudiziaria " .	Vedremo	0	Fut
Peppa , che tremava solo per lui , se lo vide tornare ferito , che si strascinava appena , e si buttava carponi per ricaricare la carabina .	tremava	3	Imp
Altrimenti si nascondevano le mappe e si sosteneva che non c' era più disponibilità di aree adeguate > .	sosteneva	7	Imp
Caro #Grillo l' unico demente sei tu . Nei partiti c' è gente che con passione e voglia di fare tirerà fuori l' Italia dalla crisi .	tirerà	20	Fut
Il garante della privacy tuona contro gli americani . Ma il messaggio è rivolto al governo italiano http://t.co/OQmPJ99F05	rivolto	13	Pres
Qualcuno progettava di sostituirsi al magistrato , di spacciarsi per lui magari per entrare e uscire impunemente da un carcere o organizzare un' evasione ?	progettava	1	Imp
D'Alema : il governo Monti è una nostra vittoria , ci lavoravamo da un anno . Ecco meno male , perché nel Pd non la pensavano tutti così	pensavano	25	Imp
Che prodotti sono stati venduti ?	venduti	4	Past
Negli anni 1593 e 1594 , quando i teatri rimasero chiusi a causa della peste , Shakespeare pubblicò due poemi narrativi dal tema erotico , Venere e Adone e il ratto di Lucrezia .	rimasero	9	Past
Alfano : “ Con i terroristi agiremo come con la mafia “ . Nascerà Forza Isis . [ @user ]	agiremo	6	Fut
Neppure un paio di mesi fa , quando già alcuni fondi di investimento spericolati faticavano a pagare gli interessi , il lek , la moneta albanese , aveva toccato i massimi sul dollaro .	faticavano	14	Imp
Ciò non impedirà invece l' abbassamento dei tassi di mercato già avviato nelle ultime due settimane che viene visto da Francoforte come possibile coadiuvante all' addomesticamento di M3 .	impedirà	2	Fut
il padre , pensionato , lavorava all' Ospedale Maggiore di Milano , oggi ci lavora l' altro fratello di Michele .	lavorava	5	Imp
Secondo il quotidiano , che cita fonti investigative , il pilota andava fortissimo .	andava	11	Imp
Nel 1985 nella stessa zona è stata uccisa l' antropologa Diane Fossey , che si batteva per la salvezza del parco .	uccisa	7	Past
Quante persone affogarono quando l' " Estonia " si ribaltò ed affondò ?	affogarono	2	Past
#Grillo entrerà in Parlamento . #Bertinotti debutterà a teatro . #Berlusconi girerà un film . Solo io e #Bersani non abbiamo un cazzo da fare !	debutterà	6	Fut
Si ribelleranno o cercheranno di tenersi buone le più forti ?	cercheranno	3	Fut
I manifestanti agitavano i ritratti come se i tre personaggi fossero dei complici :	agitavano	2	Imp
La bozza del disegno di legge , al quale si sta lavorando alacremente , sarà inviata tempestivamente alle regioni e discussa alla prossima riunione del comitato .	discussa	20	Past
#governo #monti #tecnici dimostreranno miopia dei #partiti coltivatori di consensi sull' onda di ideologie ormai vetuste	dimostreranno	3	Fut
Tuttavia appare frammentato quel patrimonio culturale e politico che negli anni 70 segnò e influenzò la società e la politica .	segnò	12	Past
" e le leggi - ha ribadito Cito - dicono che è necessario avere i documenti in tasca e vietano di utilizzare i bambini per chiedere l' elemosina " .	vietano	19	Pres
Due di loro sarebbero i sequestratori che hanno rapito e violentato Gabriella .	violentato	10	Past
- Fatti i compiti per le vacanze ? - No . - Cominciamo bene ! - Prof , stia sereno ! Mi giudichi nel 2017 . #labuonascuola	stia	18	Pres
Allo stesso modo , quando gli europei riusciranno a fare le scelte politiche giuste e a stimolare le rispettive economie , il mondo ne uscirà avvantaggiato .	riusciranno	7	Fut
Spetta alle Regioni la potestà legislativa in riferimento ad ogni materia non espressamente riservata alla legislazione dello Stato .	Spetta	0	Pres
Chi ha fondato Rhode Island ?	fondato	2	Past
L' inchiesta giudiziaria sulle armi trovate nell' auto del giudice antimafia e su una vecchia Dyane azzurra .	trovate	5	Past
@user1 @user2 #Grillo può star tranquillo non falliremo e tornasse a fare il comico !!	tornasse	9	Imp
Prima , le squadre con più soldi costruivano e usavano due motori , uno per il giro di qualifica e uno per la gara .	costruivano	7	Imp
Gli studi dimostrano che l' aumento della produttività agricola è il modo più efficace per ridurre la povertà nell' Africa sub - sahariana .	dimostrano	2	Pres
Ieri mattina picchetti di scioperanti presidiavano gli ingressi delle sedi della Bbc , ma non si sono segnalati incidenti .	presidiavano	5	Imp
L' ammissione avverrà sulla base dei materiali che i candidati invieranno entro il 28 luglio .	invieranno	10	Fut
A tale proposito ricordo la risoluzione del 15 settembre scorso , in cui si raccomandava di presentare la proposta il più rapidamente possibile .	raccomandava	14	Imp
#serviziopubblico il #profeta #Grillo predica in diretta , ascoltate e ripetete tutti le parole di verità , giovani fedeli prostratevi #amen	predica	4	Pres
Lo statuto è sottoposto a referendum popolare qualora entro tre mesi dalla sua pubblicazione ne faccia richiesta un cinquantesimo degli elettori della Regione o un quinto dei componenti il Consiglio regionale .	sottoposto	3	Past
990 . Alberi di alto fusto divelti , spezzati o periti .	spezzati	8	Past
Non molto tempo fa essi erano visti come l' ancora di salvezza dell' economia mondiale , il motore di una crescita destinata ad affermarsi mentre gli Stati Uniti e l' Europa languivano .	languivano	31	Imp
RT @user : " Rideva sempre e rumorosamente , eppure si portava sopra una tristezza incredibile . "	Rideva	4	Imp
Nel caso in cui questo tipo di flessibilità dovesse dare adito a un' insufficiente regolamentazione in alcuni paesi occorrerà procedere a una ulteriore armonizzazione .	occorrerà	18	Fut
La bugia del Governo Monti : Liberalizzare e privatizzare . In questo modo ripartiremo e ricondurremo , finalmente ,... http://t.co/DKn95yK2	ricondurremo	15	Fut
La firma del vettore e quella del mittente possono essere stampate o sostituite da un timbro .	sostituite	12	Past
Così , l' idea di quella creatura nemica che lo aspettava giorno e notte divenne per Stefano una segreta ossessione .	aspettava	10	Imp
Naturalmente , il sistema si allungava in orizzontale .	allungava	5	Imp
Zayn : Mi fa male vedere una ragazza piangere . Spesso cerco di confortarla ma finisco a piangere anche io . :')	finisco	15	Pres
Moltissimi tifosi e sportivi , italiani e stranieri , vedranno le partite negli stadi tedeschi o in Italia , per televisione .	vedranno	9	Fut
Sarà lui che , alla fine degli esami , commenterà e analizzerà per un' ora i risultati e formulerà la diagnosi .	analizzerà	11	Fut
Alfano : " Dopo le amministrative arriverà la più grande novità della politica italiana " . Ah , ve ne andate e sparite per sempre ?	arriverà	6	Fut
ma Shakespeare li usava per esplorare le menti dei personaggi .	usava	3	Imp
L' identità delle persone si compone di elementi singoli e di elementi facenti parte di unità più ampie , e l' impatto delle persone sulla realtà dipende da quali elementi prevalgano sul comportamento .	prevalgano	30	Pres
Nel capitolo successivo vedremo come la disambiguazione e la correzione sono effettuate in un sistema in cui il modulo sintattico è costituito da un parser basato sui diamanti ;	vedremo	3	Fut
Prima dell' autunno non succederà nulla .	succederà	4	Fut
Ad esempio : il giocatore della squadra nazionale argentina , Leandro Cufrè , gioca con la squadra della Roma ;	gioca	13	Pres
Nei distretti maggiori c' erano parecchi aspiranti , che presentavano una gamma più vasta di titoli preferenziali .	presentavano	9	Imp
Ma alla clinica Mayo non tutto è affidato agli automatismi elettronici :	affidato	7	Past
Eppure più tardi , mentre rincasavo , mi accorsi che il vecchietto aveva lasciato un malessere dentro di me ( forse per i troppi insistenti e melliflui sorrisi ) .	rincasavo	5	Imp
Su di loro i riflettori del processo Enimont si accenderanno martedì cinque luglio nell' aula della quinta sezione del tribunale penale di Milano , presieduta dal giudice Romeo Simi De Burgis .	accenderanno	9	Fut
Si è parlato ahimè dei favoritismi , della corruzione , della promiscuità della corte che circondava Allende .	circondava	15	Imp
Il Pd si costituirà parte civile nel processo Mafia Capitale . Così sono sicuri di vincere . [ CONTINUA su http://t.co/oDPUtx2DvV ]	costituirà	3	Fut
Governo Monti : ricetta efficace per il bene dell' Italia ? Diamoci da fare tutti e salveremp qs ns povero paese ...	salveremp	16	Fut
#Grillo [ VIDEO ] Ci hanno regalato la #crisi | Italia dei Dolori : http://t.co/HUs6lgvY #Norimberga ? No : galera !! via @user	regalato	6	Past
Io morirò per primo .	morirò	1	Fut
In Rai moltissimi ritrovano il gusto per la santa messa del mattino ... Ulteriore miracolo del Governo Monti ...	ritrovano	3	Pres
Nessuno dei #ministri del governo #monti é del sud Italia e la #lega nn voterà la fiducia ... #soncose	voterà	14	Fut
@user e magari son gli stessi che hanno votato x il #PDL dove hanno molti indagati x mafia . purtroppo l' italia e anche questa .	votato	8	Past
a Trinità Dei Monti , è confermato sfileranno anche gli abiti di Armani indossati come sempre da 21 esili modelle .	sfileranno	7	Fut
Il 27 giugno l' Ina sbarcherà sul mercato con un' offerta pubblica di vendita che oscillerà tra i 4.488 e i 5.508 miliardi .	sbarcherà	5	Fut
Preferisci la macedonia o il gelato ?	Preferisci	0	Pres
L' interesse degli investitori si è soffermato sui titoli delle società in odore di acquisizione , risentendo della recente offerta lanciata dalla Sandoz nei confronti della Gerber .	lanciata	20	Past
Farei lo stesso se in campo scendesse la Lucchese " .	scendesse	6	Imp
Signor presidente , signor commissario , onorevoli colleghi , desidero innanzi tutto ringraziare la relatrice onorevole Schroedter per il lavoro svolto , a mio parere , egregiamente .	svolto	20	Past
L' ansia di rintracciare da dove partissero prima che accadesse qualcosa di irrimediabile si è trasformata in meraviglia quando è stato individuato l' apparecchio dal quale venivano effettuate :	accadesse	9	Imp
L' iter al senato partirà già lunedì con l' approdo in commissione lavoro .	partirà	4	Fut
Decidi se pagare solo quando le persone cliccano ( modello CPC ) o visualizzano ( modello CPM ) la tua inserzione .	Decidi	0	Pres
Fra trentaquattro anni ( prima anzi , molto prima ) Domenico scorgerà inaspettatamente i fuochi del mio accampamento e si domanderà perché mai nel frattempo , io abbia fatto così poco cammino .	scorgerà	11	Fut
Nel periodo precedente alla seconda guerra mondiale il Ministro per le Ferrovie non permise che nuove linee private attraversassero la Yamanote per arrivare nei quartieri centrali .	attraversassero	18	Imp
Governo , Monti : Confido saremo sostenuti in Parlamento : Anche se forze politiche non si parlavano fino l' altro ieri http://t.co/Qtm15j2H	parlavano	16	Imp
Disordini si segnalano anche in numerose altre città .	segnalano	2	Pres
#2011in3words precariato , ansia . ( la terza è stata tagliata dal governo Monti )	tagliata	10	Past
La mia domanda si ricollega a un tema all' ordine del giorno di giovedì e che formulerò di nuovo al momento opportuno .	formulerò	16	Fut
Il 7% circa di azioni che oggi detengono nell' insieme Pesenti , Ras e Bhf - anch' essi rappresentati nel patto Mediobanca - dovrebbe essere infatti ridotto in questo modo a meno della metà .	detengono	7	Pres
Maroni conferma : " Governo Monti ? Noi fuori " : ROMA – '' Se il presidente della Repubblica Napolitano dara' l' inca... http://t.co/nZAXYpPJ	dara'	20	Fut
Non accadeva , in gare internazionali , da ben 15 anni .	accadeva	1	Imp
“ Vincere non e importante ma e l' unica cosa che conta “ - Gianpiero Boniperti	conta	11	Pres
adorava Balzac e ne studiò attentamente le opere , anche se criticava quella che chiamava la " volgarità di Balzac " .	criticava	11	Imp
la #fornero se mette a piagne mentre spiega come la #manovra del governo #MONTI metterà in ginocchio la gente : #lacrimedicoccodrillo	metterà	14	Fut
Infatti ricavava lo zucchero da una pianta , la canna da zucchero .	ricavava	1	Imp
L' Osce reagirà ancora più lentamente , per la complessità stessa dei suoi meccanismi decisionali .	reagirà	2	Fut
Il 1° novembre 2006 la Costituzione europea entrerà in vigore , cioè diventerà una legge .	diventerà	12	Fut
Le interrogazioni cui è stata data risposta in precedenza riguardavano un intervento della commissario de Palacio in un caso determinato , non le dichiarazioni pubblicate dal giornale ABC il 18 novembre scorso .	riguardavano	9	Imp
E , con l' aiuto e l' assistenza tecnica dell' Europa , ne creeremo uno .	creeremo	13	Fut
Un modo effettivo di offrire tale supporto a un vasto numero di società sarebbe di combinarlo con linee creditizie fornite dalle banche commerciali .	fornite	19	Past
Faremo molta attenzione allora alla redazione del processo verbale , come per altro facciamo sempre .	facciamo	13	Pres
E quelle persone sopportarono l' inquinamento e l' assorbirono sotto la pelle e nel corpo perché avevano bisogno di denaro .	sopportarono	3	Past
Sentito Fini a #serviziopubblico : condivisibile . Dubbio : B. avallerà il governo Monti o opterà per Cada Sansone con tutti gli Italiani ...	opterà	15	Fut
Attacca le banche , la politica e gli Stati Uniti . Se rivendica anche il corridoio di Danzica #Grillo può rifondare il Nazionalsocialismo .	rivendica	12	Pres
Tuttavia , il tempo trascorso in solitudine gli diede tutto il tempo di leggere qualsiasi libro che gli capitasse .	capitasse	18	Imp
Non manca nemmeno il conto per il " materasso Clinitron " , di quelli che evitano le piaghe da decubito dovute a una lunga permanenza a letto nella stessa posizione .	evitano	15	Pres
Parisi s' allena Fernandez ko alla 5 ripresa .	allena	2	Pres
@user1 @user2 @user3 #labuonascuola siamo noi docenti delle GI infetti da supplentite #MIDAperRUOLO ce lo meritiamo tutti !!	meritiamo	15	Pres
E i funzionari dell' Onu ritengono che dopo aver conquistato l' aeroporto il fronte patriottico sferrerà l' offensiva finale contro Kigali .	sferrerà	15	Fut
Ma non posso trascurare le osservazioni che ricevo dai cittadini e dai medici .	ricevo	7	Pres
Il PD e' d' accordo al 100 % con il governo Monti perché non saprebbe come governare l' Italia il peggio e' che gli toccherà essere scoperti	toccherà	24	Fut
Si riprenderà il 13 maggio a Barcellona .	riprenderà	1	Fut
@user1 @user2 il governo #Monti é come l' amore : va riconfermato costantemente . Un bel paradosso per il partito dell' amore	riconfermato	11	Past
Scappavano come conigli , ma noi non ne abbiamo abusato .	Scappavano	0	Imp
Quando Stefano Roì compì i dodici anni , chiese in regalo a suo padre , capitano di mare e padrone di un bel veliero , che lo portasse con sé a bordo .	compì	3	Past
Di conseguenza , i critici del periodo consideravano soprattutto Shakespeare al di sotto di John Fletcher e Ben Jonson .	consideravano	7	Imp
Se esso non rifletterà correttamente le posizioni potrà essere modificato .	rifletterà	3	Fut
Il corazziere è stato individuato ma il suo nome è " top secret " .	individuato	4	Past
Dove si tenne la Conferenza Mondiale sulla Popolazione ?	tenne	2	Past
@user si , perché i miei non hanno la macchina . Si in effetti , però rimane sempre bellissimo , perché ? Io lo bacerei comunque lol .	bacerei	24	Pres
Come tutti i drammaturghi del tempo , adattava per il teatro storie da fonti come Plutarco e Holinshed .	adattava	7	Imp
Il nuovo polo del Far East assorbirà già quest' anno un centinaio di Ferrari , che punta ad un rapido raddoppio così da arrivare allo stesso volume che fa il solo Giappone .	assorbirà	6	Fut
Perciò gli alimenti non si potevano conservare e bisognava fare la spesa tutti i giorni .	bisognava	8	Imp
ma durante il XVIII secolo , i critici iniziarono a rispondere a Shakespeare con i suoi termini e a acclamare quello che consideravano il suo genio naturale .	consideravano	22	Imp
Se fossi un politico darei la piena fiducia al governo Mario Monti .	darei	4	Pres
Che si blocchi subito l' euforia del crollo del prezzo del petrolio , evitando altri sconti nella fattura elettrica .	blocchi	2	Pres
Perché non compri quel settimanale con le ricette di cucina vegetariana ?	compri	2	Pres
RT @user : Uscire dalla stanza in pigiama e trovarsi davanti sconosciuti che ti fissano . Cos' è ? Non avete mai visto un pigiama co…	fissano	14	Pres
Ma lotterò , con le mie ultime forze " .	lotterò	1	Fut
Lo volle Carlo III di Borbone per la sua Reggia di Caserta e noi , turisti casuali capitati in un giorno qualsiasi , lo ritroviamo intatto e immenso qual era :	ritroviamo	24	Pres
La canzone è cantata in puro stile scream .	cantata	3	Past
Secondo gli analisti , la performance del mercato tedesco dipenderà fortemente nei prossimi giorni dall' andamento di Wall Street .	dipenderà	9	Fut
" Questo è enorme - si indigna - e supera ogni limite di decenza civile e di offesa al diritto .	indigna	6	Pres
Ebbene , in questi casi , i colleghi dapprima sghignazzano poi , quando la scoperta è riconosciuta da tutti , si convincono che avrebbero benissimo potuto farla loro .	sghignazzano	9	Pres
Nel gruppo c’ era anche Bill Berry , che suonava la batteria .	suonava	9	Imp
#Grillo dice una cosa giusta , se pagassimo le tasse siamo sicuri che il Paese andrebbe bene ? Io , guardando il passato , dico di NO !	pagassimo	7	Imp
Roma - s' infiamma il dibattito sulla riforma della legge Merloni , mentre si attende che il governo , con un decreto legge , fissi i primi punti fermi della discussione .	fissi	24	Pres
Nuvoloni si addenseranno anche sull' Appennino e sulle coste dell' alto e medio Adriatico .	addenseranno	2	Fut
Per risparmiare tempo , la salma di Pietro Ingrao verrà sepolta già rivoltata . [ @user ]	sepolta	10	Past
Si sfumano i confini netti che in passato segnavano le differenti funzioni e collocazioni .	segnavano	8	Imp
FACEBOOK : ISCRIVETEVI AL GRUPPO Governo Mario Monti per il 150° anniversario dell' unità d' Italia , venite a conos. questa nuova piatt. polit. !	venite	17	Pres
Però ella seguitava a dire che non lo conosceva neanche di vista quel cristiano ;	seguitava	2	Imp
Piazza Farnese si presenta nell' ormai consueto assetto di guerra , presidiata da polizia e carabinieri , vietata anche ai pedoni .	presidiata	11	Past
E desidero far sapere che , per quanto riguarda la commissione , siamo pronti e disposti a tenere questo dibattito quando lo si ritenga opportuno ;	ritenga	23	Pres
I periodi di rapida crescita nell' attività creditizia sono spesso associati ai boom edilizi , in parte perché i beni immobiliari facilmente valgono come garanzie per i prestiti .	associati	10	Past
@user No , ho fatto la brava . Quando ci sarà un Social che legge le menti , ne starò alla larga . I pensieri deliranti non li scrivo mai .	starò	19	Fut
Fino a un contratto che si intreccerà con il rapimento .	intreccerà	6	Fut
Rispetto ad aprile , infatti , l' indice depurato dai fattori stagionali è sceso nel mese corrente dell' 1,1% , portandosi a quota 96,2 da 97,3 ( base 1990-equ-100 ) .	depurato	8	Past
@user non lo so , davvero non lo so . quei due mi odiano ;_____;	odiano	13	Pres
I prezzi al consumo sono saliti solo dello 0,1 per cento , meno di quanto avessero previsto gli analisti di Wall Street e meno che in maggio ( 0,3 ) .	saliti	5	Past
La buona scuola proposta dal governo Renzi . Prime valutazioni ( non sfugga una perla preziosa ) http://t.co/lfHpiDBDra	sfugga	12	Pres
Dov' è detenuto Hugo Lacour ?	detenuto	2	Past
Quando l' avviso di mora è notificato dal messo notificatore , esso deve essere annotato in uno speciale registro cronologico intestato ed affidato al messo anzidetto .	notificato	6	Past
#visco : Con la #manovra scende il Pil . Grazie professor #monti . se al tuo posto ci mettevamo l' omino del banco della frutta faceva meglio .	mettevamo	18	Imp
Il terzo problema è l' invecchiamento demografico , una questione che pone sfide dure anche ai sistemi politici ben strutturati .	strutturati	19	Past
Tale tutela giurisdizionale non può essere esclusa o limitata a particolari mezzi di impugnazione o per determinate categorie di atti .	limitata	8	Past
Una buona parte cercherà di ingraziarsi Paparesta ( probabile apripista di Lanese ) per garantirsi il futuro e si preoccuperà di capire i criteri di giudizio del successore .	preoccuperà	19	Fut
GOVERNO MONTI : FORUM TERZO SETTORE , APPREZZAMENTO PER I DUE NUOVI MINISTERI : Il Forum del Terzo Settore augura a ... http://t.co/Sg6HX38R	augura	19	Pres
Ma non è questo l' unico indizio ad inchiodare Marcello Calabria - 27 anni , una vita da balordo - alla responsabilità di aver violentato una ragazza di 16 anni .	violentato	24	Past
quando Gastaldello sporcava la prestazione con un appoggio inutile e sballato a Manninger costringendo il portiere ad entrare da rigore su Cruz , mezzo metro dentro l' area , ne avevamo la conferma decisiva .	sporcava	2	Imp
@user ho le balle girate di mio , ok ? se poi devo sentirmi la ramanzina da te , guarda , vai pure a quel paese	girate	4	Past
Nella scuola primaria , oltre alla lingua italiana , i bambini e le bambine studieranno un’ altra lingua europea , per esempio l’ inglese .	studieranno	14	Fut
Gli investigatori hanno controllato decine di persone e nel pomeriggio hanno puntato l' attenzione su un immigrato dell' Europa dell' Est che è stato fermato .	controllato	3	Past
Che tristezza #Santoro . Una settimana fa #Grillo rispondeva a #Ruotolo e andava bene . Oggi è uguale agli altri perché ha evitato Bertazzoni ?	rispondeva	8	Imp
Come può essere eliminato il rigetto del sistema immunitario ?	eliminato	3	Past
