Invece aveva potuto solamente una volta e mezza ; in una giornata , mentre noi avanzavamo di quaranta leghe , lui ne divorava sessanta , ma non di più .	avanzavamo	15	Imp
Il libro sul tavolo in cucina te l' ha regalato Francesco ?	regalato	9	Past
Insomma , la stagione dei rinnovi contrattuali , che per 15 anni ha segnato il punto più alto della tensione nelle relazioni industriali , questa volta non decolla .	decolla	27	Pres
Altri Protagonisti , tra i fornitori di elettricità , non se ne intravedono :	intravedono	12	Pres
La mia domanda si ricollega a un tema all' ordine del giorno di giovedì e che formulerò di nuovo al momento opportuno .	formulerò	16	Fut
Benché il bastimento già volasse , portato da un magnifico vento al giardinetto , quella cosa manteneva sempre la distanza .	manteneva	16	Imp
Alfred Pollard definì alcuni di questi " bad quartos " dato che erano testi adattati , parafrasati e alterati e , in alcuni punti , erano ricostruiti a memoria .	alterati	18	Past
Nei campi di concentramento i tedeschi uccidevano molti prigionieri nelle camere a gas , cioè in camere piene di gas velenosi .	uccidevano	6	Imp
Riassumiamo alcuni chiarimenti utili per i contribuenti che sono stati forniti in passato dall' amministrazione finanziaria e che sono tuttora validi :	forniti	10	Past
@user appena me ne sono accorta l' ho cancellato subito ahahhah invece jasy non ci avevo fatto proprio caso ahhaha	cancellato	8	Past
Le generazioni future continueranno a godere di una migliore qualità della vita rispetto ai loro predecessori ?	continueranno	3	Fut
Che farai questa sera dopo la palestra ?	farai	1	Fut
L' Iniziativa , intitolata una stazione per suonare , è organizzata dall' Atac - Cotral e patrocinata da comune di Roma .	patrocinata	16	Past
De Bendictis - ieri beffato in ritardo dalla giuria , da un verdetto arrivato quando aveva una medaglia al collo e togliersela fa male - ;	beffato	4	Past
Pensava che il suo lavoro non consistesse nel frequentare la società ma nel crearla . "	Pensava	0	Imp
La rivoluzione modernista nell' arte durante il xx secolo , ben lungi dal scartare Shakespeare , attribuì ansiosamente il suo lavoro al servizio dell' avanguardia .	attribuì	16	Past
#WeAreHereForDecarli noi ci siamo sempre . Grazie per tutti i sorrisi , ti amiamo castorino del nostro cuore . x23	amiamo	13	Pres
Il memorandum d' intesa articolava il programma di collaborazione in tre fasi :	articolava	4	Imp
IL PD E IL GOVERNO MONTI . GOTOR A TUTTO CAMPO ALL' INCONTRO PROMOSSO DAL PD http://t.co/HaRRZeoX	PROMOSSO	13	Past
Non ci proponiamo di peggiorare unilateralmente le condizioni di concorrenza per alcuni paesi , favorendo paesi di transito come l' Austria .	proponiamo	2	Pres
Le colonne hanno il fusto scolpito con raffigurazioni di colombi nell' atto di beccare delle spighe di grano , e sono poste su basamenti quadrangolari che presentano ognuno due vaschette con relative cannelle .	scolpito	5	Past
E anche i bosniaci si ribellano , cercano di riprendersi gli armamenti che hanno ceduto a " Zepa smilitarizzata " , ma una volta tanto l' Onu mantiene gli impegni e si oppone .	ribellano	5	Pres
Nel novantaquattro i conti torneranno in nero - il gruppo cerca una partnership nelle telecomunicazioni .	torneranno	4	Fut
La pensione sarà , invece , calcolata in base ai contributi che ogni lavoratore ha versato , in modo quasi analogo ad una assicurazione privata .	calcolata	6	Past
Fu rimpiazzato da Robert Armin a cavallo del XVI secolo , che recitò in parti come quella di Touchstone in Come Vi Piace e quella del pazzo in Re Lear .	Piace	22	Pres
Ciò significa che gli account congiunti non sono consentiti .	consentiti	8	Past
La febbre dengue è una delle principali cause di malattia e morte nelle aree tropicali e subtropicali e sono circa 100 milioni le persone che vengono infettate ogni anno .	infettate	26	Past
Già nei prossimi giorni verrà comunicato il calendario del road show che interesserà tutte le principali piazze finanziarie internazionali e che partirà da Roma il 7 giugno .	partirà	21	Fut
E quelle parti di delfino contenevano un tasso di PCB elevatissimo , diossine e metalli pesanti .	contenevano	5	Imp
b ) che , tenuto conto delle circostanze , è lecito ritenere che il difetto che ha causato il danno non esistesse quando l' aveva messo in circolazione o sia sorto successivamente ;	esistesse	21	Imp
Ciò pone anche problemi nuovi con cui occorre misurarsi studiando l' adozione di norme adeguate , anche statutarie .	pone	1	Pres
Insomma , accade con il Moretti esercente un po' lo stesso che accade con il suo cinema :	accade	2	Pres
Poche settimane fa i dirigenti della " Campagnola " , storica fabbrica vicentina di biciclette , hanno rivolto un appello ai parroci della zona per aiutarli a trovare una ventina di operai .	rivolto	17	Past
Chi ha imposto l' embargo in Iraq ?	imposto	2	Past
#Grillo entrerà in Parlamento . #Bertinotti debutterà a teatro . #Berlusconi girerà un film . Solo io e #Bersani non abbiamo un cazzo da fare !	girerà	11	Fut
Leopoldo Pirelli , informa una nota diffusa ieri dal gruppo , abbandona la presidenza della Fin P , ex finanziaria di famiglia , e viene sostituito da Marco Tronchetti Provera .	diffusa	6	Past
Qual è il pericolo di contrarre l' infezione nel corso di un rapporto occasionale , di uno di quegli incontri - per intenderci - che in tempi sessualmente più spensierati chiamavamo avventure ?	chiamavamo	30	Imp
RT @user : Speravo solo che Mazzarri dicesse qualcosa sui cori contro i napoletani . Silenzio stampa . Spero che lo faccia in settimana	Speravo	3	Imp
Valle , d' accordo in questo con il padre della ragazza , Claudio Cesaroni , ha sottolineato che " le indagini devono riprendere , riesaminando tutto quello che è stato tralasciato " .	tralasciato	30	Past
I redditi risultanti da tali righi della dichiarazione vanno confrontati con i corrispondenti redditi della dichiarazione dell' anno precedente .	confrontati	9	Past
Chiudi gli occhi , respira profondamente e lentamente , ma senza sforzo .	Chiudi	0	Pres
Se qualcosa si è pietrificato , in che cosa si è trasformato ?	trasformato	11	Past
#animali Arriva la " soluzione " per scongiurare sorprese da parte degli " amici a quattro zampe " http://t.co/JQcMWMMVcp	Arriva	1	Pres
Sempre che vengano rispettati i termini e le condizioni di cui sopra , la presente licenza è perpetua ( e concessa per tutta la durata del diritto d' autore sull' opera applicabile ) .	rispettati	3	Past
Probabilmente varcherò il limite senza accorgermene neppure , e continuerò ad andare avanti , ignaro .	varcherò	1	Fut
Immergiamo il pennello più grande nel colore per stoffe e dipingiamo tutta la superficie della foglia .	Immergiamo	0	Pres
Ma in seguito ad un incidente quasi fatale nel 1832 ( scivolò per strada e si fratturò la testa ) , Balzac decise di non candidarsi per l' elezione .	scivolò	11	Past
Blinder , secondo voci riferite dal New York Times , sperava di succedere al presidente Greenspan quando a marzo scadrà la sua nomina .	scadrà	19	Fut
per Scalfaro il dialogo fra i due poli " si è allargato , esteso , approfondito .	allargato	11	Past
Ho fatto 1 sogno oggi : pensavo : " che bella la nuova scuola riformata " , poi mi sono svegliato e ho letto Tagli lineari Altro che #labuonascuola	pensavo	6	Imp
In altre parole , l' imprevedibilità degli eventi storici come quelli accaduti in Ucraina ha a che fare con un elemento di incertezza dell' identità umana .	accaduti	11	Past
Fatemi capire . L' ultima battaglia di #Grillo è per l' elezione diretta del presidente della Rep ? Vuole un sistema presidenziale ?	Vuole	18	Pres
Anche la commissione nominata da Mussolini prese di mira Galeazzo Ciano , disegnandone un ritratto un po' trucido .	nominata	3	Past
@user1 @user2 caga rorj o ti picchio , e se magari caghi anche me non mi offendo eh hahaha	picchio	6	Pres
Rivoluzione copernicana per B. che fino a stamattina ripeteva urbi et orbi di vedere all' orizzonte solo il voto , ora apre a un governo Monti	ripeteva	8	Imp
il prezzo d' acquisto varia da 990 mila lire ( NecP 2200 importata dalla Digitronica ) a 4.755.000 lire ( C. Itoh C - 815 Supra venduta dalla Adelsi ) ;	importata	12	Past
Evidentemente il processo verbale della seduta di domani riporterà tutte le eventuali dichiarazioni complementari .	riporterà	8	Fut
Sapevo che , ogniqualvolta riscuotevo denari dalla giacca , avveniva nel mondo qualcosa di turpe e doloroso .	avveniva	9	Imp
@user Volevo scrivere qualcosa d' intelligente . Ti twitto così posso illudermi del fatto che sai che esisto / bastava dire ciao :)	bastava	19	Imp
ovvio , #Grillo demagogo e senzaproposte . ma gli zombie dirigenti politici sordi con tutti , e arroccati nel ... vitalizio . Domani @user	arroccati	17	Pres
Non è solo la necessità di ottenere risultati , ma è un rapporto basato sul fatto di possederla , di essere capaci di usarla .	basato	13	Past
Il controllo e la valutazione dei piani efficienza , in particolare , spetteranno esclusivamente all' apposito comitato tecnico scientifico istituito dalla legge di accompagnamento alla finanziaria a palazzo Vidoni .	spetteranno	12	Fut
Non vi viene infatti attribuita la dovuta attenzione , e non è la prima volta che ciò accade :	accade	17	Pres
Di conseguenza , i critici del periodo consideravano soprattutto Shakespeare al di sotto di John Fletcher e Ben Jonson .	consideravano	7	Imp
Silenzioso , come il pesce rondine che nella calura guizzava in quello specchio di mare .	guizzava	9	Imp
Leggerezza e ridotto spessore consentono , usando solo collanti , grande facilità di posa , anche sopra vecchie pavimentazioni e con ridottissimo intervento ai serramenti .	consentono	4	Pres
E altre parti dell' economia che forniscono servizi all' industria finanziaria - i rivenditori Porsche e gli strip club , ad esempio - saranno similmente incoraggiati .	incoraggiati	25	Past
Fra trentaquattro anni ( prima anzi , molto prima ) Domenico scorgerà inaspettatamente i fuochi del mio accampamento e si domanderà perché mai nel frattempo , io abbia fatto così poco cammino .	domanderà	20	Fut
Eravamo 4 ladri al bar ..... quando io dicevo che alla festa dell' Unità giravano soldi a nero ... il segretario ... http://t.co/42TFwjHpvZ	giravano	14	Imp
Manovra Salva Italia del governo Monti : la illustrerà Rosato http://t.co/L7vsMo31	illustrerà	8	Fut
L' articolo , quindi , si richiama al principio che vieta l' ingiustificato arricchimento [ v. 2041 - 2042 ] .	vieta	10	Pres
Eppure mi fasciava alla perfezione .	fasciava	2	Imp
All' inizio dell' " attività " di solito erano in società con gli italiani , da cui affittavano le barche e dividevano al 50 % i guadagni .	affittavano	17	Imp
Bologna , mascherati da Mario Monti murano agenzia Unicredit per protesta #oramonti	mascherati	2	Pres
Altri vanno avanti senza l' ancoraggio di quella certezza , ma è come se l' invisibile tarlo di un' ossessione insidiasse il lavoro , e allora propongono dilemmi all' editore e agli amici :	propongono	26	Pres
Il diciannove luglio si svolgerà nella scalinata di Trinità Dei Monti la sfilata di alta moda " donna sotto le stelle "	svolgerà	4	Fut
I piloti correranno la prossima gara del mondiale di Formula Uno in Brasile il 6 aprile .	correranno	2	Fut
Le persone compravano prodotti freschi nei mercati o in negozi piccoli .	compravano	2	Imp
Sembra tutto fatto , ma entrano in scena quelli del Ccd : " la sinistra fa il gioco delle tre carte " , Baresi e Tanzilli ritirano le firme per la redigente .	Sembra	0	Pres
@user , vestirà in modo bizzarro , ma è uno dei giornalisti economici più preparato e intellettualmente onesto che ci siano in Italia	vestirà	2	Fut
Le spese dell' atto sono a carico del concedente .	concedente	8	Pres
Le sue colleghe dormiranno invece all' Hassler o al Minerva .	dormiranno	3	Fut
Un piano di assistenza ( 50 - 100 milioni di dollari ) cercherà di attutire il crack delle piramidi .	cercherà	12	Fut
Che scuola frequenterà William , il figlio maggiore del principe Carlo ?	frequenterà	2	Fut
Giovedì invece rientreranno Balbo e Fonseca , attualmente in vacanza dopo gli impegni della coppa America con le rispettive nazionali .	rientreranno	2	Fut
Ma secondo voi super #Mario #Monti riuscirà a tassare anche la felicità ?	riuscirà	6	Fut
Cambieranno le linee dei percorsi fisici nell' ufficio " .	Cambieranno	0	Fut
" noi avevamo proposto che si aprisse una stagione costituente dentro la quale si possono discutere diverse proposte che riguardano la forma di stato e di governo .	aprisse	6	Imp
Nel diciannovesimo secolo , l' ammirazione critica del genio di Shakespeare spesso sfociava nell' adulazione .	sfociava	12	Imp
Sport nel quale si distinse Sensi .	distinse	4	Past
" raccontiamo - voce di Nizzola - quello che è successo , cioè che ce ne torniamo a casa con un pugno di mosche da riempire .	torniamo	16	Pres
Sei agenti sono stati uccisi , due bruciati tra le fiamme del loro ufficio incendiato dai rivoltosi , gli altri linciati dalla folla inferocita , due manifestanti freddati a colpi di arma da fuoco .	incendiato	14	Past
@user1 @user2 il fatto che una persona che vada in discoteca implichi che questa si droghi è una fesseria ...	implichi	11	Pres
La Francia respinge i migranti a causa delle precarie condizioni igieniche . La replica : " Tranquilli , ci abitueremo " . [ acid rain ]	abitueremo	19	Fut
Non sarà facile perché gli oppositori di Mediobanca cercheranno d' impedire la consegna dell' Enel privatizzato nelle mani dei nipotini dell' anziano banchiere .	privatizzato	15	Past
Era immobilizzato e non rispondeva alle domande , aveva dei movimenti spontanei .	rispondeva	4	Imp
E poi stupisce che nel tamburo della pistola mancasse un proiettile .	mancasse	8	Imp
Quanta strada percorreresti se partecipassi ad una maratona ?	partecipassi	4	Imp
Insomma , il sindacato dei vigili garantisce : non ci saranno persecuzioni .	garantisce	6	Pres
Tra i bancari minori si è ripetuto il copione del giorno prima , anche se le vendite sono state più generalizzate .	ripetuto	6	Past
Se , invece , non godono di buona salute si increspano e si appiccicano , provocandone la caduta .	godono	5	Pres
Lanciata ieri a Roma dalla prima conferenza degli assessori alla cultura di An .	Lanciata	0	Past
Partirà a novembre " sei Milano " la tv dei Benetton : 24 ore di news con giornalisti giovani armati di telecamere " Video 8 " .	Partirà	0	Fut
I Comuni , le Province e le Città metropolitane hanno potestà regolamentare in ordine alla disciplina dell' organizzazione e dello svolgimento delle funzioni loro attribuite .	attribuite	24	Past
Domani 21.10 #LA7 #Piazzapulita : E DOPO ? La manovra del governo #Monti servirà a salvare il Paese e a scongiurare il #default ?	servirà	13	Fut
Che vuol dire " la Melandri è preparata sull' argomento " ... .	preparata	7	Past
il 20 e il 21 febbraio tutti i porporati del pianeta , nello spirito collegiale voluto fortemente dal Pontefice , affronteranno con Bergoglio i problemi dell’ episcopato mondiale ;	affronteranno	20	Fut
Chernobil , con le sue vittime e le conseguenze ancora tutte da scoprire , rallenterà quello europeo .	rallenterà	14	Fut
I Sudisti vedevano infatti nella propaganda abolizionista una minaccia per la loro unica fonte di ricchezza .	vedevano	2	Imp
L' obiettivo che si è prefissato il Cnel non lascia spazio agli equivoci .	prefissato	5	Past
Quale paese ha colonizzato Hong Kong ?	colonizzato	3	Past
Fammi una domanda http://t.co/ah3g2f0LxG PLEASE MI ANNOIO ... POTETE CHIEDERMI DI TUTTO	Fammi	0	Pres
L' annuncio è atteso per oggi .	atteso	3	Past
Trovato l' ispiratore delle ricette del governo Monti : Bisogna prendere il denaro dove si trova . Presso i poveri .... http://t.co/sh54bMiN	Trovato	0	Past
Infatti il Caravaggio dipingeva in modo originale le figure e dava molta importanza alla luce .	dipingeva	3	Imp
Non cederemo più nessuna area del territorio sovrano ucraino .	cederemo	1	Fut
Ieri si è riunito per la prima volta il suo consiglio di amministrazione , che ha nominato Vito Gamberale ( nella foto ) amministratore delegato .	nominato	16	Past
Non venne mai chiarito quale formazione era stata responsabile del sequestro e chi intervenne in favore degli ostaggi .	intervenne	13	Past
Nel programma Art Attack Giovanni Muciaccia insegnava ai bambini a fare disegni e a realizzare oggetti con materiali molto semplici .	insegnava	6	Imp
- insistere soprattutto sulla formazione e sull' assistenza tecnica nei nuovi Stati membri , conferendo la priorità a quegli Stati che per primi introdurranno l' euro come moneta unica .	introdurranno	23	Fut
Gli adattamenti proposti riguardano :	riguardano	3	Pres
I dati #Istat sul #pil dimostrano che la #crisi è nera . Se non si cambiano politiche pagheranno prezzo più alto i giovani #Governo #Monti	cambiano	15	Pres
#labuonascuola è quella che studia i poeti della categoria #twitterpride2014 . Altrimenti non me lo spiego	spiego	15	Pres
Il particolato prodotto dalla sua combustione e la nebbia si combinavano in un aerosol caratteristico .	combinavano	10	Imp
Alfred Nobel era molto ricco e si interessava di letteratura , di ingegneria e di scienze .	interessava	7	Imp
Le prime venivano ottenute versando in una forma matrice del bronzo fuso che si andava a sostituire alla cera del modello originale .	andava	14	Imp
Fu arrestato nel 1999 in un processo per mafia dove compariva anche il senatore del Popolo della Libertà Marcello Dell' Utri .	compariva	10	Imp
Noi rilasciavamo enormi quantità di sostanze inquinanti nell' aria e nell' acqua .	rilasciavamo	1	Imp
Queste opere pativano la mancanza di una conoscenza di prima mano ;	pativano	2	Imp
Mondiali di atletica - Un milanese sbanca la 20 km in una disciplina da sempre targata Italia .	sbanca	6	Pres
Quale uccello depone uova blu ?	depone	2	Pres
Quando Stefano Roì compì i dodici anni , chiese in regalo a suo padre , capitano di mare e padrone di un bel veliero , che lo portasse con sé a bordo .	portasse	27	Imp
La compagnia petrolifera BP ha intentato causa al tribunale del Texas contro il governo degli USA .	intentato	5	Past
Le aziende otterranno altre facilitazioni attraverso un allentamento delle leggi sui fallimenti e un innalzamento della soglia del fatturato al di sotto del quale non serve una certificazione dei bilanci .	otterranno	2	Fut
#Grillo fa finta di non capire che in rete si segue anche se disprezzi o non condividi . Fa le stime a #cazzo come #Berlusconi	disprezzi	13	Pres
Se consento alle persone di seguirmi , quali aggiornamenti vedranno ?	vedranno	9	Fut
Irpef , stangata Regioni : ecco quanto pagheremo addizionale , irpef , regioni , mario monti , governo ,. http://t.co/78mQ0MbC	pagheremo	7	Fut
Bonanni avrebbe anche ragione a criticare il governo Monti . Ma perchè non ha mai criticato il governo Berlusconi ? Non ci si può fidare di lui	criticato	15	Past
Come tutti i drammaturghi del tempo , adattava per il teatro storie da fonti come Plutarco e Holinshed .	adattava	7	Imp
L' operazione da mille miliardi partirà a metà giugno - Sip e Pirellina ridurranno la quota di controllo al 42% .	partirà	5	Fut
Regionali in Veneto , Alessandra Moretti si presenta senza il simbolo del Pd . Non si abbinava con il vestito . [ @user ]	abbinava	16	Pres
Il fatto che #Obama chiami #Napolitano per fare il punto sul governo #Monti la dice lunga sulla paura del mondo che l' Italia crolli	chiami	4	Pres
Tuttora convinti che il piano atomico non si debba toccare i repubblicani .	convinti	1	Past
- esclamò - se non avete visto bene , non vi lascerò gli occhi per piangere !	lascerò	11	Fut
E la regìa mobile che inviava in diretta le domande degli spettatori , da casa , simili a sfere che puntavano alle gambe degli amministratori .	inviava	5	Imp
NON CREDO NEL GOVERNO MONTI ..... CADRA' IN PRIMAVERA ... E CHE TONFO .....!	CADRA'	6	Fut
LA HIT DEL 2012 E' FUORI . NACHO , PAKOS E UNCLE J COME MARIO MONTI SE NON LA POMPI NON APPREZZI IL BELLO http://t.co/K2IZBUh7	POMPI	19	Pres
Si pensi a come alcuni anni fa , poco prima del collasso di Lehman Brothers , il settore finanziario si vantasse della sua capacità di innovazione .	vantasse	20	Imp
Mi limiterò a poche considerazioni .	limiterò	1	Fut
Gli studenti che frequenteranno anche il quarto anno avranno un diploma .	frequenteranno	3	Fut
Renzi convoca una conferenza stampa per elencare le sue riforme . Per una volta che bastava un tweet . [ @user ]	bastava	15	Imp
E del tutto oscuri sono i motivi che spingono periodicamente persone in apparenza normali ad afferrare un fucile , ad appostarsi nel parcheggio di un supermercato e sparare a casaccio sui passanti .	spingono	8	Pres
Oppure preferisci andare con Francesco ?	preferisci	1	Pres
< il progetto era , è e resterà di grande importanza - ha affermato Ottolenghi - .	resterà	7	Fut
Prime ore del governo Monti : scelte autorevoli , equilibrate ; nomi che uniscono ; promessa di concertazione ed equità . Panico al Corriere .	uniscono	13	Pres
era questo un metodo che conferiva alle piastrelle " fiammature " naturali dovute all' incostanza della temperatura .	conferiva	5	Imp
Anni fa lei sosteneva che c' era un rapporto tra il design e la magia , malgrado la razionalità della tecnica .	sosteneva	3	Imp
Morto in un incidente il più stretto collaboratore di Kim Jong-un . Ora dovranno farlo sembrare un omicidio . [ @user ]	Morto	0	Past
Sui giornali del mattino campeggiava la notizia di una rapina avvenuta il giorno prima .	campeggiava	4	Imp
Dopo la sua , è cominciata la persecuzione delle progressiste .	cominciata	5	Past
Si trattava di un Tizio perbene , scombussolato dalla Rivoluzione Francese , indignato contro Napoleone , rassicurato dalle conservatrici parrucche bianche dei congressisti di Vienna .	trattava	1	Imp
Improvvisamente hanno ceduto i bordi del fossato sui quali era stato accumulato il terriccio scavato .	ceduto	2	Past
Si apre il confronto sulle pensioni .	apre	1	Pres
Cinquecento metri di arrampicata e Jalabert scatta , Bottaro prova a parare la botta ma non ci riesce , lo scavalca Podenzana , ma ormai Jalabert lo rivedranno all' arrivo .	rivedranno	27	Fut
Se il fondo servente viene diviso e la servitù ricade su una parte determinata del fondo stesso , le altre parti sono liberate .	liberate	22	Past
L' impegno organizzativo e politico di massa ad essa collegato apriva la fase storica della lotta per la democrazia .	apriva	10	Imp
La pensione è la somma di denaro che ogni mese spetta ai lavoratori regolari da quando smettono di lavorare per tutto il resto della loro vita .	spetta	10	Pres
Sul nome di Mattarella sono confluite tutte le personalità del Pd . Comprese le due di Civati . [ CONTINUA su http://t.co/oDPUtx2DvV ]	confluite	5	Past
La lettera di trasporto aereo viene emessa dal mittente in tre esemplari originali .	emessa	6	Past
@user1 @user2 se saranno confermate le indiscrezioni , accetterete le timidissime #liberalizzazioni del #governo #monti ?	accetterete	8	Fut
Max Sciandri , nato a Derby 28 anni or sono da genitori toscani che gestivano un ristorante , ha sempre mantenuto il doppio passaporto .	gestivano	14	Imp
@user1 @user2 @user3 lo terrano vivo a costo di mandarci in rovina , sanno che andare alle urne porterebbe al trionfo del #M5S .	terrano	4	Fut
@user oltre #Grillo , #Travaglio e #Bossi , in passato anche un illustrissimo #DeAndrè insultava i #nani in 1 notissima canzone !	insultava	14	Imp
Tutti a lezione di comunicazione da #Grillo su #serviziopubblico . Favorevoli o contrari .. lui comunica gli altri farneticano . | NZ	farneticano	18	Pres
Con Agrilatte , la società costituita la settimana scorsa , i produttori associati all' Unalat vogliono partecipare all' aumento di capitale di 200 miliardi che la Cirio finanziaria di Sergio Cragnotti varerà a settembre .	varerà	31	Fut
Il riso integrale , cioè il riso con i chicchi coperti dalla buccia , contiene anche molta fibra .	coperti	10	Past
La margarina e qualche chilo di vernice che , in linea di massima , non comportavano rischi , hanno provocato un' autentica catastrofe .	comportavano	15	Imp
Altri robot mixano beveroni energetici , localizzano e sconfiggono la cellulite , eliminano impurità della pelle e ... ogni giorno si inventano una diavoleria nuova .	sconfiggono	8	Pres
In quali stati americani ci sono stati incidenti mortali causati da valanghe di neve ?	causati	9	Past
Egli oscillava frequentemente tra i lavori in corso , e i lavori " finiti " furono spesso rivisti nelle varie edizioni .	oscillava	1	Imp
#labuonascuola CV di TUTTI i professori online subito ! vedrai poi quanti si salvano criteri di valutazione subito ! vedrai che risate	vedrai	19	Fut
Sotto la stoffa rispondeva il confortante scricchiolio della carta moneta .	rispondeva	3	Imp
Moriremo democristiani , massoni e difensori di boia : una dedica alla #Guardasigilli http://t.co/tpLg947e #Severino #Diaz #governo #monti	Moriremo	0	Fut
c ) che non ha fabbricato il prodotto per la vendita o qualsiasi altra forma di distribuzione a scopo economico , né l' ha fabbricato o distribuito nel quadro della sua attività professionale ;	fabbricato	5	Past
Minacciano azioni contro il governo in caso di pesanti revisioni o di svuotamenti della Merloni .	Minacciano	0	Pres
Durante la trasmissione Dopofestival giornalisti e personaggi famosi parleranno del Festival e delle canzoni di quest’ anno .	parleranno	8	Fut
Presentava da 200 a 400 volte il tasso di tossicità mai concesso dall' Epa .	Presentava	0	Imp
I sondaggi rivelano una schiacciante maggioranza ( 60,70% ) di italiani contrari alle centrali nucleari .	rivelano	2	Pres
La spiaggia era un luogo di fuga , ci si nascondeva per evitare le pattuglie , si cercava un po' di solitudine dalla povertà esasperante delle viuzze sovrappopolate .	nascondeva	10	Imp
Anche qui tremano Il Comune nega l' elettricità a #Grillo « Faremo il comizio coi generatori » #Belluno http://t.co/ymYDPatx #m5s #m5sTour	Faremo	11	Fut
