Questa è una Repubblica indipendente , urlano i valonesi trincerati dietro carcasse di auto rovesciate , bidoni e travi di legno affastellate per bloccare la strada .	urlano	6	Pres
Si livella , si chiude con un' altra piastra e si pressa .	pressa	11	Pres
Tutto dunque congiurava a dimostrarmi che , senza saperlo , io avevo stretto un patto col demonio .	congiurava	2	Imp
La norma disciplina rapporti tra proprietari vicini , ed è quindi utilizzabile solo dal proprietario , o da chi vive sul fondo .	disciplina	2	Pres
Invece aveva potuto solamente una volta e mezza ; in una giornata , mentre noi avanzavamo di quaranta leghe , lui ne divorava sessanta , ma non di più .	divorava	22	Imp
#Renzie promette di investire su #labuonascuola , ma vuole tagliare il 3 % di spesa da tutti Ministeri ( anche MIUR ) #EffettoSottoZeroConGelato	promette	1	Pres
La Cisl '' sosterrà a piene mani '' il governo Monti . Adesso ho paura davvero #oramonti	sosterrà	3	Fut
Mi attaccheranno ancora e io risponderò .	risponderò	5	Fut
Non è ammessa l' estradizione dello straniero per reati politici .	ammessa	2	Past
Totò Riina : “ Berlusconi dava alla mafia 250 milioni ogni sei mesi “ . E pensa se avessero divorziato ! [ valerio ]	divorziato	19	Past
Preferisci spaghetti e gelato o pizza e crostata di mele ?	Preferisci	0	Pres
E' per questi motivi che voteremo a favore .	voteremo	5	Fut
Se agli inizi della prossima settimana non ci sarà più il governo Berlusconi ma il governo Monti lo spread scenderà almeno a 300	scenderà	19	Fut
La vedete intrufolata tra i vostri tweets la differenza tra il governo Monti e quello di B. ? Adesso finalmente leggo messaggi di speranza	intrufolata	2	Past
Arrestato a Torino il professionista della fattura falsa .	Arrestato	0	Past
E , sebbene egli non ne comprendesse la natura , aveva qualcosa di indefinibile , che lo attraeva intensamente .	comprendesse	6	Imp
Insieme con quel senso di " desencanto " che vi si sente ogni volta che lei parla di Castro .	sente	11	Pres
Qui sotto , una delle sale di attesa in cui i candidati al check-up sostano prima di essere chiamati alla visita generale .	sostano	14	Pres
Rossini è una vecchia e amata consuetudine dei francesi e di Aix , dove è rimasta leggendaria la Semiramide del 1980 con Montserrat Caballé e Marilyn Horne .	rimasta	15	Past
Dopo aver letto i giornali di oggi , per il rubinetto che perde chiamerò Mario Monti ; e per sintonizzarmi Sky ; magari risolve pure #splinder	chiamerò	13	Fut
È il 14 luglio , ogni due minuti ce lo ricordano gli infervorati telecronisti , come se non lo sapessimo già .	sapessimo	19	Imp
CAMBRIDGE - La promessa che ogni generazione se la caverà meglio della precedente è un principio fondamentale della società moderna .	caverà	9	Fut
Ciao Tata ! ..... tu ti sei innamorata dell' Italia ..... io della tua Spagna ...... siamo pari !	innamorata	7	Past
io forse riuscirò a vedere i miei idoli da lontano , e il resto del mondo li incontra pure per strada . what 's wrong with me ?	riuscirò	2	Fut
È confermato che le agevolazioni spettano anche ai soggetti in contabilità semplificata .	confermato	1	Past
Ce lo confermano le grandi rassegne internazionali del libro ( dal salone di Francoforte a quello di Bologna del libro per ragazzi ) all' interno delle quali si allestiscono sezioni destinate all' editoria elettronica .	allestiscono	28	Pres
ricordo quando mi fece vedere in privato " La dolce vita " , film che lui notoriamente detestava .	detestava	17	Imp
« Bush è stato a San Francisco per dieci minuti , forse per fare pipì , e non ha nemmeno visto Marina » impreca Paul Morris , che ha avuto la casa lesionata .	impreca	23	Pres
È stato preso in carico senza ritardi ” .	preso	2	Past
@user Sono stata K.O per 4 giorni ma andando lo stesso a scuola , il cibo non l' ho toccato per niente ... Infatti ho perso dei kg !	toccato	19	Past
L' Ucraina non è la Bosnia , dove la costituzione è nata da trattative di pace che ponevano fine ad anni di sanguinosa guerra all' indomani della dissoluzione della Jugoslavia .	ponevano	17	Imp
Papa Francesco : “ Maria lavava e stirava le camicie di Gesù “ . Ma con le lenzuola era una frana . [ CONTINUA su http://t.co/oDPUtxTqU7 ]	lavava	5	Imp
La storica città tedesca si avvia a cambiare il suo volto , profondamente segnato dalla storia e dalla guerra che cosa direbbe Doblin ?	avvia	5	Pres
Lo dicevano i palloncini verdi , lo riecheggiavano i politici verdi , lo ripetevano i cartelloni dei Verdi .	riecheggiavano	7	Imp
#Grillo incalza : “ siamo alla #resadeiconti ” - http://t.co/CQeEL8i3	incalza	1	Pres
Offerte anche le Popolare di Novara e le Popolare Commercio Industria ( rispettivamente min0,8 e min0,5% ) , mentre le Popolare dell' Emilia Romagna hanno recuperato quanto ceduto lunedì .	recuperato	25	Past
Apparecchiature fotografiche , anche queste automatiche , rilevano la targa degli evasori , che vengono perseguiti informando un centro elettronico .	rilevano	7	Pres
I cittadini cui sono affidate funzioni pubbliche hanno il dovere di adempierle con disciplina ed onore , prestando giuramento nei casi stabiliti dalla legge .	affidate	4	Past
B ) gli ammortamenti delle immobilizzazioni materiali , così come definite alla voce b ii dell' attivo dello stato patrimoniale .	definite	10	Past
Serviranno #Grillo in tutte le salse . Può anche darsi che le tv superino il limite e ci sia una crisi di rigetto .	Serviranno	0	Fut
Merkel : « Le riforme strutturali del governo Monti sono impressionanti » . il ristorante di Montecitorio diventerà un self-service .	diventerà	17	Fut
il prezzo d' acquisto varia da 990 mila lire ( NecP 2200 importata dalla Digitronica ) a 4.755.000 lire ( C. Itoh C - 815 Supra venduta dalla Adelsi ) ;	venduta	26	Past
Dal menu nella colonna a sinistra , clicca su protezione .	clicca	7	Pres
Quale catena di fast food abbassò il prezzo dell' hamburger Big Mac ?	abbassò	5	Past
@user grazie ! vale anche per me pensa che alcune mi eliminano perchè oso dire che sono esagerate	oso	13	Pres
L' indebolimento del dollaro sui mercati dei cambi ha poi stimolato alcuni realizzi di beneficio , cosicché l' indice Dow Jones ha chiuso a 4708,82 in ribasso dello 0,39 per cento .	stimolato	10	Past
MATURA VOGLIOSA ASCOLTA E GODI ( tutta italia ) http://t.co/73M0wzbfr2	GODI	4	Pres
Michele marciava e Pietro Pastorini vedeva suo genero , tirato su come un figlio " e allora scusate se mi sono commosso .	marciava	1	Imp
Sia per le forme originali ( spesso assai fluttuanti ) con cui procedevano ad organizzarsi .	procedevano	12	Imp
Molto interessante la disciplina dettata dal 3° comma , che permette modifiche al deflusso naturale delle acque per raggiungere un' adeguata sistemazione agraria .	permette	10	Pres
Si parla di #labuonascuola e poi si leggono le cifre del costo sul #TFAordinario .. Buono non dovrebbe essere anche equo ?	leggono	7	Pres
L' effetto valutario ha compresso l' utile operativo a 12,5 miliardi di yen .	compresso	4	Past
#Grillo #movimento5stelle #SKYRassegne ha ragione siamo diventati i guardoni della politica	diventati	6	Past
" È ora che il divario di opportunità venga dappertutto colmato " , aggiunge , e pronuncia una frase significativa :	colmato	10	Past
Naturalmente , si affretta ad aggiungere , è un rischio teorico perché a nessuno salterebbe in testa di passar la notte fuori dai confini .	salterebbe	14	Pres
Oggi pranzo da nonna . Tornerò rotolando	Tornerò	5	Fut
Quindi verificheremo con estrema attenzione per essere certi che tutto sia corretto .	verificheremo	1	Fut
Ma il pericolo maggiore viene dalle colline che sovrastano le città turche , colline a cui sono stati tagliati tutti gli alberi e su cui sorgono bidonville abitate da migliaia e migliaia di persone .	sovrastano	8	Pres
Ed è stato anche allertato l' elicottero di Aiut Alpin Dolomites , il prezioso velivolo che è specializzato negli interventi in montagna .	allertato	4	Past
Quante volte al giorno pregano i musulmani osservanti ?	pregano	4	Pres
A S. Donato don Milani trovò contadini e operai senza istruzione , giovani sfruttati , che lavoravano anche di notte , senza nessuna garanzia e assicurazione .	lavoravano	16	Imp
Consideriamo quest' idea alla luce della logica che segue .	Consideriamo	0	Pres
E' in questa luce che giudicheremo il successo delle linee direttrici in parola :	giudicheremo	5	Fut
In italiano 8 Sidor significa " 8 pagine " .	significa	4	Pres
Spesso coloro che subiscono un attacco cardiaco ritengono che la loro vita , da quel momento in poi , sia destinata a non avere più sale :	ritengono	7	Pres
Il termine di prescrizione per il diritto annuale è decennale , come confermato dal Ministero Dell' Industria .	confermato	12	Past
Ma non succederà poi che , come sostiene Nicolini , l' eccesso di complicazione servirà a smussare le volontà di cambiamento ?	servirà	14	Fut
Essi sono dotati di ragione e di coscienza e devono agire gli uni verso gli altri in spirito di fratellanza .	dotati	2	Past
Beh certo , tenere il cellulare al bar in tasca vicino alle parti intime ci salverà tutti dal tumore . Udine cell free http://t.co/BnQ6lJ65	salverà	15	Fut
Quale college frequentò Allen Iverson ?	frequentò	2	Past
Gli autori dei pezzi teatrali del Parnassus del St John's College di Cambridge l' hanno citato insieme a Chaucer , Gower e Spenser .	citato	15	Past
Per tutta la giornata i carabinieri hanno controllato decine di persone , tra cui i cinque utilizzatori del box dove sarebbe avvenuta la violenza :	controllato	7	Past
Da tre anni , i responsabili del Comune di Roma e della Casa delle letterature organizzano il Festival internazionale delle Letterature .	organizzano	15	Pres
Se vuoi che il fast relax sia davvero efficace tieni d' occhio l' orologio e scegli :	scegli	15	Pres
GOVERNO MONTI , AGENZIA SIR : AMPIA FIDUCIA IN PARLAMENTO SI TRADUCA IN INIEZIONE DI FIDUCIA PER IL PAESE : eldquo ; ... http://t.co/neKDAlPV	TRADUCA	11	Pres
Gli chiese scorgendolo infine a poppa , in piedi , che fissava le onde .	fissava	11	Imp
I confini tra Ruanda , Zaire e Uganda costituivano un itinerario che rientrava nei cataloghi di viaggi organizzati .	rientrava	12	Imp
@user L' invenzione di Berlusconi : Ci saranno 2 PDL uno classico , uno zero corrotti . Si uniranno dopo le elezioni ! http://t.co/vTE7YOWP	uniranno	18	Fut
La quota di azioni riservata al mercato statunitense è ancora top secret e dipenderà ovviamente dagli umori del mercato alla vigilia dell' Opv .	dipenderà	13	Fut
Quale di questi libri ti ha regalato Francesco ?	regalato	6	Past
A giugno , i leader di tutta l' Africa si incontreranno a Malabo , nella Guinea Equatoriale , per definire l' agenda della politica agricola dei prossimi dieci anni .	incontreranno	10	Fut
Balzac soffrì di problemi di salute nel corso della sua vita , forse a causa dei suoi intensi ritmi di scrittura .	soffrì	1	Past
Chiedevano il pagamento dello straordinario per il lavoro svolto negli orari d' ufficio .	Chiedevano	0	Imp
Il giornale stampato arrivava a casa dei lettori per posta .	arrivava	3	Imp
i filamenti che escono dalla filiera formano il filo singolo che viene roccato sulla macchina di filatura .	escono	3	Pres
Fino al 18 giugno 2004 , i paesi dell’ Unione Europea regolavano i loro rapporti con trattati , cioè con accordi sui problemi comuni .	regolavano	11	Imp
Avevo fatto lo studente , la guerra , cercavo di sopravvivere come potevo , con pochi soldi disegnavo .	disegnavo	17	Imp
#Grillo favorirà il centrodestra anche in questa tornata di #amministrative ? #QuintoPolo	favorirà	1	Fut
Il Pdl si spaccherà davvero e definitivamente sul sostegno al governo Monti ? Dopo le dimissioni di B. sarebbe la seconda bellissima notizia	spaccherà	3	Fut
Marco Galluzzo sul Corriere individua i diversi ambiti in cui Mario Monti intende operare in sede europea . http://t.co/GnJAKdrE	individua	4	Pres
Kim Jong-un sposta gli orologi 30 minuti indietro . Adesso è di nuovo ora di pranzo . [ @user ]	sposta	2	Pres
il bus sa di profumo di A&F Anchio lo metto ma non così tanto ! È tutto di ragazzino piccolino ma con profumo e profumo addosso ! Hahaha :')	metto	9	Pres
" Saltavo per prima ed essendomi trovata subito in testa aspettavo che le altre reagissero ;	aspettavo	10	Imp
Mentre Orsi accoglieva i giapponesi della Hitachi per negoziare una possibile cessione di Ansaldo Breda , l' ex ad di banca Intesa ribadiva la necessità di mantenere la testa dell' azienda in Italia .	accoglieva	2	Imp
Le donne candidate vengono ritenute dalle donne elettrici intelligenti nel 63,8 per cento delle risposte , coraggiose nel 54,6 , competenti nel 43,5 , arriviste ed ambiziose soltanto dal 10 per cento delle interrogate .	ritenute	4	Past
" Marmo ricomposto " ( materiale frantumato miscelato a resine e pressato sottovuoto ) della serie " Stonit " di Stone Italia .	pressato	11	Past
A quale partito apparteneva Hitler ?	apparteneva	3	Imp
Il suo cuore non aveva retto allo sforzo di correre a perdifiato i 42 chilometri e 125 metri che separavano il campo di battaglia da Atene .	separavano	19	Imp
Sì , onorevole Scroedter , esaminerò volentieri i fatti relativi alla questione da lei esposta non appena avrò ricevuto la sua lettera .	esaminerò	5	Fut
Le condizioni del testamento prevedevano che lei avrebbe passato la tenuta intatta al " primo figlio maschio che il suo corpo avrebbe generato " .	prevedevano	4	Imp
E ciò per i motivi che così schematicamente riassumiamo :	riassumiamo	8	Pres
Decidi se pagare solo quando le persone cliccano ( modello CPC ) o visualizzano ( modello CPM ) la tua inserzione .	cliccano	7	Pres
Ventenne gira i primi filmini in Super 8 , finché il suo primo lungometraggio , Io sono un autarchico , nel '76 , diventa un piccolo caso e viene proiettato al Filmstudio di Roma .	gira	1	Pres
Due giorni dopo Sudja Kademi , la ' zingara ' , annunciava agli albanesi che la sua piramide finanziaria era fallita .	annunciava	11	Imp
Signora presidente , mi permetta di formulare un paio di osservazioni .	permetta	4	Pres
#mario #monti il posto fisso e' noioso ma alle tue banche bastera' dire questo per prendere un mutuo ? #forsel'haisparatagrossa	bastera'	11	Fut
Fondi per l' Editoria , si attendono ancora risposte certe dal governo Monti . Temo che non arriveranno	arriveranno	17	Fut
Tornò terrorizzato , la prima cosa che vide fu un cadavere che galleggiava nell' acqua , non si poteva nemmeno identificare .	galleggiava	12	Imp
Governo , Monti : Se resto in politica ? Credo ne avrò abbastanza ... : Ho una responsabilità straordinaria , penso so... http://t.co/C5X1jltV	avrò	11	Fut
Il punto vita non è strizzato , tutta la femminilità esplode in drappeggi , pieghe , merli trine e ricami .	strizzato	5	Past
Infatti , Marco Pantani aveva perso interesse per il lavoro , era andato via dalla sua casa , non incontrava più parenti e amici e stava spesso da solo .	incontrava	19	Imp
E soprattutto , si puniscano i praticanti stregoni .	puniscano	4	Pres
Tanto da far ritenere al giudice Salvini che nel Veronese operasse un' altra Gladio , ancor più deviata di quella " ufficiale " .	operasse	10	Imp
Per gli esattori che operano nella Regione Sicilia la certificazione anzidetta sarà sostituita da una dichiarazione rilasciata dal consorzio regionale goffi fra gli esattori della Sicilia ( 14/a ) .	operano	4	Pres
Pensava che il suo lavoro non consistesse nel frequentare la società ma nel crearla . "	consistesse	6	Imp
@user1 @user2 NO i #Quota96Scuola sono regolarmente a scuola ( forse servirà ' la badante !!! ) #labuonascuola con ins . vecchi	servirà	11	Fut
@user camminava tutto tranquillo con la sua tracolla al boschetto . credo fosse lì o.o	camminava	1	Imp
@user tutti mi dicono : ' il Prato ? Soffocherai ' , sono in ansia .	Soffocherai	9	Fut
RT @user : QUANDO CAPIRETE CHE NON CREDERE NELLA ZERRIE NON CORRISPONDE AD ODIARE PERRIE O INSULTARLA ALL DAY ALL NIGHT ? MINCHIA AVETE …	CAPIRETE	4	Fut
Agli effetti dell' estinzione si computa anche il tempo per il quale la servitù non fu esercitata dai precedenti titolari .	computa	5	Pres
In modo analogo , la bolla Dot - Com che ha preceduto questo periodo fu marcata dall' innovazione - i siti web attraverso i quali si potevano ordinare cibi per cani e bibite online .	marcata	15	Past
La lega non sosterrà il governo monti . Comincio a strapparmi i capelli x il dispiacere .	Comincio	8	Pres
Ebola , il medico italiano guarisce grazie a una cura sperimentale . Che ora verrà testata sui vigili di Roma . [ @user ]	guarisce	5	Pres
I vertici delle sette banche più esposte verso la Fochi ( nella foto , Roberto Fochi ) e i tre commissari si incontreranno martedì prossimo nella sede bolognese dell' azienda .	incontreranno	22	Fut
Il pisolino di Scilipoti E' stato fotografato da un collega mentre dormiva sul divano della sala di lettura di ... http://t.co/avF7YGJQ	fotografato	6	Past
Bank of China aprirà filiale operativa a Milano .	aprirà	3	Fut
#Governo #Monti sempre più deludente : le #lobby non vengono toccate , i tassisti , ancora una volta , si salvano . Pagano sempre i più deboli .	salvano	20	Pres
Incontri tra giovanissimi in un club di calcio dove accadeva di tutto .	accadeva	9	Imp
La Rost ha conquistato la platea che alla fine si dichiarava affascinata dalla sua voce chiara e espressiva e il suo talento drammatico .	dichiarava	10	Imp
Puntare su Blinder significherebbe per la Casa Bianca affrontare una nuova spinosa questione politica .	significherebbe	3	Pres
La direttiva 78 / 170 / CEE deve pertanto essere abrogata .	abrogata	10	Past
È quindi probabile che , ancora per qualche giorno , tutto dipenderà dalle iniziative dei singoli Paesi e dalla capacità di autocontrollo degli stessi albanesi .	dipenderà	11	Fut
Sarà lui che , alla fine degli esami , commenterà e analizzerà per un' ora i risultati e formulerà la diagnosi .	formulerà	18	Fut
« Se un dì il professor #Monti / che vien dalla #Bocconi / sbagliasse a fare i conti ? » / Saranno lacrimoni ! ? #sapevatelo @user	sbagliasse	13	Imp
Loro del resto hanno allargato la protezione anche al di fuori del mondo della criminalità organizzata :	allargato	4	Past
I giornalisti favorevoli al governo Monti , sostengono che si farà . I contrari dicono di no . Avanza lo sputtanamento della professione .	Avanza	18	Pres
L' influenza di Parigi pervade la Comédie .	pervade	4	Pres
Balzac rivedeva i suoi lavori in maniera ossessiva , ricoprendo le prove di stampa con cambiamenti e aggiunte da sistemare .	rivedeva	1	Imp
Quindi mezzo governo è nelle scuole , hanno preso alla lettere chi sbraitava " tornate a studiare " #sischerza #labuonascuola	sbraitava	12	Imp
Giorni fa ho visto un comico che mi ha fatto veramente ridere , parlava del lavoro , si chiamava Mario Monti , lo conoscete ?	parlava	13	Imp
Alcuni attori , invece , leggono , testi dello stesso scrittore già pubblicati e conosciuti in tutto il mondo .	leggono	5	Pres
I festeggiamenti nella città feudo del fronte nazionale sono stati disertati da buona parte dei cittadini .	disertati	10	Past
Perché quando un ecologo guarda l' oceano , noi riusciamo a vedere tutte le interconnessioni .	riusciamo	9	Pres
Nel caso di espropriazione per pubblico interesse ( 834 ) , l' indennità si ripartisce a norma del comma precedente .	ripartisce	14	Pres
Si sono manifestati attacchi alle prerogative del parlamento e spinte alla delegittimazione della magistratura al fine di renderla subalterna all' esecutivo .	manifestati	2	Past
" c' è stato un primo smottamento - ha raccontato un testimone della sciagura - una parte della collina s' è come sgretolata , travolgendo le case che sorgevano sulle sue pendici .	sorgevano	28	Imp
Mario Monti ha detto che sarà un periodo di sacrifici ... e te pareva ... @user1 @user2 @user3	pareva	13	Imp
Esso ha anche il grande vantaggio di essere percepito per lo più come qualcosa di incredibilmente noioso .	percepito	8	Past
Il primo gruppo di sfide include problemi preoccupanti che coinvolgono le esternalità - un caso esemplare è il degrado ambientale .	coinvolgono	9	Pres
Qualche ragazza giovane trattenuta per il festino .	trattenuta	3	Past
Evidentemente molti di coloro che avevano investito in queste società avevano ricevuto il pagamento degli interessi ma tornavano ad affidare i loro soldi a noi .	tornavano	17	Imp
« Vedrete che tornerà e al primo dribbling riconquisterà Napoli » .	riconquisterà	8	Fut
Il grande problema del M5S è che non si capisce ancora quale sia il ruolo di #Grillo #piazzapulita	capisce	9	Pres
Nei campi di concentramento , gli ebrei erano prigionieri , lavoravano molto , avevano poco cibo e soffrivano il freddo.Molti ebrei morivano di fame e di freddo .	soffrivano	17	Imp
Nel 1591 le autorità riportarono che John Shakespeare non andava in chiesa " per paura di un processo per debiti " , una dispensa comune fra i cattolici .	andava	9	Imp
Ma il mercato mondiale scommette su una vera pace .	scommette	4	Pres
Tiziana Maiolo , protagonista di furibondi scontri in commissione giustizia , aspetta al varco , " vedremo se il Pds manterrà l' impegno " .	manterrà	20	Fut
Magari me sbaglio , ma se la Cgil dice che questa manovra ' uccide i pensionati ' , il mio parere è che Mario Monti lo stia facendo benissimo <3	uccide	13	Pres
Lo dicevano i palloncini verdi , lo riecheggiavano i politici verdi , lo ripetevano i cartelloni dei Verdi .	dicevano	1	Imp
Cambridge - la promessa che ogni generazione se la caverà meglio della precedente è un principio fondamentale della società moderna .	caverà	9	Fut
non è che non lo avessi prima , posso dire che ne ho un pò di più " .	avessi	5	Imp
Testimonianza . Durante 7 anni in cui per lavoro ho frequentato Bruxelles , ho constatato che Mario Monti è un italiano stimatissimo in Ue	frequentato	10	Past
Ucciso il leader degli avvocati curdi . Tanto gli erano rimasti pochi clienti . [ arthur rombò ]	rimasti	10	Past
#Grillo #DiPietro : ” Parte la raccolta firme per abrogare i rimborsi elettorali ” | Italia dei Dolori : http://t.co/k6yJnNXN @user	Parte	4	Pres
Egli è già andato a dormire e ripartirà domani stesso all' alba .	ripartirà	7	Fut
Al massimo , li ridurrà da otto a sette .	ridurrà	4	Fut
E mentre la Procura sentirà a breve Mancini , il gip ha respinto la scarcerazione di Ceraudo .	sentirà	4	Fut
Mi chiedo perché oggi abbiano censurato la denuncia di Farage .. siamo in Italia mica in Corea del Nord ! #sapevatelo #governo #monti #oramonti	censurato	5	Past
" oh , non ti avessi ascoltato " esclamò il capitano .	ascoltato	6	Past
Nel 1979 nasce la terza rete dedicata soprattutto ai programmi regionali .	dedicata	6	Past
Ciò avverrà nel rispetto dei criteri enunciati nella direttiva sulle norme fondamentali di sicurezza ( direttiva 96 / 29 / Euratom ) .	avverrà	1	Fut
Ciò permetterà di perseguire la strategia di sviluppo che dovrebbe portare a varcare la soglia dei 4 mila miliardi di fatturato entro il novantasei .	permetterà	1	Fut
Ma i segni della normalizzazione si vedono anche nel riquadro dedicato ai sondaggi di opinione sulla popolarità dei deputati che avevano destato le ire del Cremlino .	destato	21	Past
@user per fare due salti ! Eravamo in centro ... ti dirò ci ho incontrato più gente fiorentina di quanto mi aspettassi ;)	aspettassi	21	Imp
Mentre disdegnava l' etichetta di " realista " , Flaubert ha chiaramente tratto da Balzac l' attenzione ai dettagli e la rappresentazione nuda e cruda della vita borghese .	disdegnava	1	Imp
In questa vicenda tira un' aria tutta balcanica .	tira	3	Pres
E per realizzarle , Mandela e il gruppo dirigente del suo partito , compresi i comunisti , hanno capito che occorreva l' aiuto dei bianchi .	occorreva	20	Imp
1 ) se l' enfiteuta deteriora il fondo o non adempie all' obbligo di migliorarlo ;	adempie	10	Pres
Fra tanti accessori maschili e femminili , fa mostra di sè una vestaglia da uomo interamente ricamata , con cui il padrone di casa soleva ricevere anche ospiti " di lavoro " .	soleva	24	Imp
Successo anche per Frank Lopardo ( Alfredo Germont ) e Renato Bruson ( il padre ) , subissato di applausi .	subissato	17	Past
E , dall' altro , si giungesse a un' intesa fra le potenze occidentali e l' Unione Sovietica tale da dar vita a un sistema di sicurezza collettiva nel quadro della società delle nazioni .	giungesse	6	Imp
L' alternativa che i comunisti propongono vuole , dunque , sollecitare il concorso di forze di diversa ispirazione e di differente orientamento ideale e culturale .	propongono	5	Pres
Come se la lontananza da quel giorno , la presenza sulla stessa pista di Mike Marsh e Yuji Nakamura , rammentasse solo un brutto sogno dell' umanità .	rammentasse	20	Imp
Si posano su fondo di cemento e calce e si puliscono con acqua e sapone di Marsiglia , rendendole poi gradualmente lucide con cera da passare più volte perché penetri nel cemento .	penetri	29	Pres
Fra l' altro erano state divorate dalle fiamme le casseforti di un grande istituto immobiliare , che contenevano oltre centotrenta milioni in contanti .	contenevano	17	Imp
Quest' anno interesserà le circoscrizioni 3 , 5 e 7 , quella di Porta Palazzo .	interesserà	2	Fut
L' avanzamento del progetto dipendeva dal mutuo accordo tra le parti che si impegnavano a divulgare liberamente le informazioni ottenute e a non scambiarsi qualsivoglia ammontare di denaro .	dipendeva	4	Imp
Il debitore non può liberarsi eseguendo una prestazione diversa da quella dovuta , anche se di valore uguale o maggiore , salvo che il creditore consenta .	consenta	25	Pres
Michele marciava e io rivedevo il film della mia vita " .	rivedevo	4	Imp
Certo , Echevarri fa il suo mestiere , fa il giro delle ammiraglie e dice : ok , noi perdiamo il tour ma voi perdete il podio .	perdete	24	Pres
La legge siciliana , che risale al 1996 , vieta le promozioni nei 45 giorni precedenti all' inizio dei saldi .	vieta	9	Pres
Tutti gli esseri umani hanno capacità non sfruttate , non utilizzate .	utilizzate	10	Past
