tuntui siltä , että loppukilpailussa voi käydä vaikka kuinka hyvin .	siltä	1	Abl
Näin jääkiekon maailmanmestaruuden ( joita ilmeisesti tulee vain 16 vuoden välein ) ohella on mukava nostaa esiin suomalaisten harrastelijoiden ( tai ei ehkä enää pelkkien harrastelijoiden ) tekemä pioneerityö , jolla he pyrkivät uudistamaan tapaa , jolla elokuvia tehdään .	joita	4	Par
Me kysyttiin , että eikö ole vaarana , että alaikäiset ostavat automaateista kaljaa .	Me	0	Nom
Ehkä juuri dopingin ansiosta ( tai no mistä muustakaan ) aika moni oma joukkueemme putosi jo alussa , jotta pääsi harrastamaan lisää dopingia jonnekin lämpimään .	muustakaan	8	Ela
Mikäs meän oli ollessa .	meän	1	Gen
Minkähän niminen keittiömestari meillä mahtaa silloin juhannuksena olla ?	Minkähän	0	Gen
Mitä henkilötiedoilla tehdään , Veikkaus Oy Ab:n tiedottaja Johanna Seppälä ?	Mitä	0	Par
Tässäkin tilanteessa katsoisin , että laiha sopu oli parempi kuin lakkojen alkaminen , PALTAn varatoimitusjohtaja Harri Hietala kuvailee neuvottelutulosta Ylelle .	Tässäkin	0	Ine
A : Mulla on varmaan lämpöä , taitaa olla flunssa tulossa .	Mulla	2	Ade
No kukas se sieltä tulee ?	kukas	1	Nom
Millä homma saataisiin toimimaan ?	Millä	0	Ade
Kenelle soitat useimmin Suomeen ?	Kenelle	0	All
Mistä tiedetään , paljonko työtä tietty kurssi on opiskelijalta vaatinut ?	Mistä	0	Ela
Kello on joltakulta varastettu .	joltakulta	2	Abl
Linnasta lähetetyt varoitukset otettiin vastaan ensimmäisenä vartiovuorenmäeltä , josta ne välitettiin edelleen kaupunkiin päin .	josta	8	Ela
Niitten jälkeen kävi aikamoinen parku eri puolueissa kuinka meitä kohdeltiin näin , miten tää nyt näin meni , siinä meni meiltä vaalivoitto ja muuta tämmöstä .	Niitten	0	Gen
Kuka tutkii mitä - ja millä hinnalla ?	Kuka	0	Nom
Näistä valitaan finaaliehdokkaat soveltuvuustutkimusta varten , heitä on yleensä kolmesta viiteen .	Näistä	0	Ela
Perehdytän teidät sambaan .	teidät	1	Acc
Sitten se sanoi minulle , että ota Alfas ja mene .	minulle	3	All
Ja juhlavampia , kesäisempiä korkkareita en omistakaan , joten noille toisille oli tilausta .	noille	9	All
Poliisit kertoivat silminnäkijöiden arvioita olevan useampiakin .	useampiakin	5	Par
Meil oli ennen vanhaan taas toi nii olikii velimies ja ja tota noin ni se tuli kerran töistä kotiin Keravalla ja meni pyyhkäs lähikauppaan .	Meil	0	Ade
Täst on patteri loppui .	Täst	0	Ela
Se sanokin että hoida ite lehmäs , ja painu siihen suuntaan missä sanoin sen pyörän olevan .	siihen	9	Ill
Tuo kone , joka sinne oli laskeutunut tuntui olevan syynä siihen , ettei uudessa laajennusosassa toiminut mikään niin kuin olisi pitänyt .	siihen	10	Ill
Heissä on jotakin samaa , terävä lintumainen olemus .	Heissä	0	Ine
Loki osaa kertoa vain sitsien ulkopuolisista tapahtumista , sillä toinen lokikirjamme hävisi sitsien saatossa .	toinen	9	Nom
Näiden lisäksi kiinnostavaa olisi tehdä myös high-speed salamatriggeri ja muutamia muita valokuvaukseen liittyviä sovelluksia .	Näiden	0	Gen
Tämä ei ole vaikuttanut yhdessäkään tapauksessa äänestystulokseen , koska enemmistöt eivät ole muuttuneet .	yhdessäkään	4	Ine
Mitä väliä .	Mitä	0	Par
Joidenkin niistä odotetaan liittyvän EMN:n täysjäseniksi vuonna 2006 .	Joidenkin	0	Gen
Huiput urheilkoot ja heitä seurattakoon .	heitä	3	Par
Kysyn neuvoston puheenjohtajalta , onko hän samaa mieltä kanssani arviossaan , että Kuuban hallituksella on kuljettavana vielä pitkä matka täyttääkseen demokratialausekkeessa edellytetyt velvoitteet niin assosiointisopimusta varten kuin solmiakseen muita siteitä Euroopan unionin kanssa .	samaa	6	Par
Ja juhlavampia , kesäisempiä korkkareita en omistakaan , joten noille toisille oli tilausta .	toisille	10	All
Sen tekee hyvällä autolla neljässä tunnissa .	Sen	0	Gen
Samoihin aikoihin hän valtasi myös rikkauksistaan kuuluisan Kolkhiksen .	Samoihin	0	Ill
Kaikki se puuttuu meiltä .	meiltä	3	Abl
Kirjassa mietitään , millaisia koulutuksellisia ja kasvatuksellisia tarpeita aateluus , pappeus , porvarius ja talonpoikainen maatalous asettivat säätyihin kuuluville ja toisaalta niihin pyrkiville pojille ja tytöille .	niihin	21	Ill
Häntä verrataan Muhammad Aliin .	Häntä	0	Par
Samassa yhteydessä asuinalue purettiin .	Samassa	0	Ine
Ja että yhdestä tukista käytetään aina pareittain tulevat laudat , toinen toiselle ja toinen toiselle puolelle ; siten ne taipuvat samalla tavalla .	toiselle	14	All
Jos minä menisin kysymään joltakin naiselta Espan puistossa , syökö tämä makkaratuotteita usein ja minkä ikäinen hän on , minut vietäisiin mustamaijaan .	minut	19	Acc
Kaikkeen tottuu .	Kaikkeen	0	Ill
Vastahan sinä tulit ja olet pirusti myöhässä .	sinä	1	Nom
Ja että yhdestä tukista käytetään aina pareittain tulevat laudat , toinen toiselle ja toinen toiselle puolelle ; siten ne taipuvat samalla tavalla .	toiselle	14	All
Luennon jälkeinen lounastauko kuluu raivoisaan selviytymistaisteluun Macciavellin keskipäivän jonoviidakossa , ja ruokapöytäkeskustelu pyörii muuan nimeltä mainitsemattoman kahden opintopisteen kurssin aiheuttaman infernaalisen työmäärän ja tästä syntyvän paniikin ympärillä , minkä lisäksi jaamme ahdistuksemme myös ehtimisestä seuraavalle luennolle .	muuan	13	Nom
Muistakaa opiskella , hakea kesätöitä , mutta ehkä ennen kaikkea : pitää huolta toisistanne ja muistaa vaihtaa myös vapaalle ettei opiskelu lehden teeman mukaisesti kävisi liian työstä !	toisistanne	13	Ela
Hän puolustelee eläinten kidutusta sillä , että eläimetkin syövät toisiaan ja tämä on hänen mielestään " jäänyt kettutytöiltä täysin huomiotta " .	toisiaan	9	Par
Ja silloin minä ensimmäistä kertaa kunnolla näen hänet silmissäni .	hänet	7	Acc
Jostain aivokuolleesta syystä jänistän lennokkien keruusta henkilöllisyyteni varjelemiseksi ja lähden paikalta koska en kuulu koko kurssille .	Jostain	0	Ela
Muille ei kukaan ole koskaan voinut siitä puhua .	Muille	0	All
Siellä hän karismallaan sai useita nuoria miehiä kiinnostumaan jesuiittaurasta , minkä lisäksi hänestä itsestään tuli vaikutusvaltainen henkilö Portugalin hovissa .	itsestään	13	Ela
En tuntenut Kostjaa itse asiassa lainkaan , olin tavannut hänet lapsena , mutta hän oli oleskellut miltei koko elämänsä Ranskassa .	itse	3	Nom
Meiltä puuttuu asunnosta hattuhuone .	Meiltä	0	Abl
Jolle Mara jää käteen , on presidentti .	Jolle	0	All
Älä sitten puhu tästä kenellekään .	tästä	3	Ela
tottakai me otamme heitä sitä varten , että heillä olisi mahdollisuus myös urallaan edetä .	heitä	3	Par
- Mitäs tässä .	Mitäs	1	Par
Niin tekis mieli kysyä että kuka sitten tästä vastaa loppujenlopuks .	tästä	7	Ela
Meidät mielletään kuuluvaksi nokialaiseen musiikkielämään .	Meidät	0	Acc
Josta sinä aina sanoit , että Täti Vihreä .	sinä	1	Nom
Useimmat ovat taittelukaavioidensa mukaisia monisteita , mutta joukossa on mitä mielikuvituksellisimpia variaatioita samasta teemasta .	samasta	12	Ela
se ol Hiakal trenkin , ja sanos et se hyppäs yli aeraj ja häm putos sen suust ja häm pääs puuhu ja sit se , ol puuj juures pystös se susi , ja nual vert ko tul häne reirestäs	häm	18	Nom
Meiltä hoituvat isot ja pienet tilaisuudet ammattitaidolla ja kokemuksella	Meiltä	0	Abl
Olin varmasti jättänyt ne siihen , jätän ne aina Nikon viereen .	siihen	4	Ill
Minä en jaksa tätä elämää	Minä	0	Nom
Mulla ei ole mitään päälle pantavaa .	Mulla	0	Ade
Minkä ikänen olit ku alotit lätkän ?	Minkä	0	Gen
Heillä on rahaa vaikka toisille jakaa .	toisille	4	All
Meidän täytyy kannattaa näiden eurooppalaisten oikeutta Euroopan unionin jäsenyyteen heti , kun he täyttävät eurooppalaiset perusvaatimukset .	he	12	Nom
Minä haluan sen kiinni niitten kaikkien naisten takia , mutta en Järven .	Minä	0	Nom
Hitsi et se oli tylyy se ku meil oli : .	meil	7	Ade
He ovat jo hyvissä ajoin päättäneet äänestää , mutta ratkaisevat vasta vaalitaistelun loppusuoralla , ketä .	He	0	Nom
Venäjän pääministeri Vladimir Putin haukkuu Yhdysvaltoja maailmantalouden loiseksi , joka ei elä varojensa mukaan ja siirtää vastuun taakan muille maille .	muille	18	All
Seinät olivat valkoiset , ovet puuta , ja niissä oli kirkkaat kromiset kahvat .	niissä	8	Ine
Loput kaksi liitäntää ovat joko common cathode ( yhteiskatodi ) tai common anode ( yhteisanodi ) tyyppisiä , joista kumpikin on kytketty omalle numerolleen jokaiseen 7:ään osaan .	jokaiseen	24	Ill
– Missä lapset ovat ?	Missä	1	Ine
Esineet , joista emme oikeasti pidä ja joihin emme koskaan koske keräävät pölyn lisäksi negatiivista energiaa .	joista	2	Ela
Johan susta tuli mulle varsinainen riesa !	susta	1	Ela
Jotta ei loukkaisi ketään , tyttö oli hiljaa .	ketään	3	Par
Joka tapauksessa puhun myöhemmin enemmän joistakin tarkistuksista , joissa käsitellään näitä näkökohtia .	joistakin	5	Ela
3 ) Eläinperäisissä elintarvikkeissa olevien eläinlääkejäämien enimmäismääriä vahvistettaessa olisi määriteltävä ne eläinlajit , joissa jäämiä voi esiintyä , sallitut pitoisuudet jokaiselle hoidetusta eläimestä saadulle lihakudokselle ( kohdekudos ) ja jäämien valvonnan kannalta merkityksellisen jäämän luonne ( merkkijäämä ) .	joissa	13	Ine
Mulla olis kaikenlaista juotavaa huoneessani .	Mulla	0	Ade
Eiköhän tuosta meillekin murusia heltiä .	meillekin	2	All
Näistä vahinkokuvista tulee aina todella outoja .	Näistä	0	Ela
se ol Hiakal trenkin , ja sanos et se hyppäs yli aeraj ja häm putos sen suust ja häm pääs puuhu ja sit se , ol puuj juures pystös se susi , ja nual vert ko tul häne reirestäs	häne	37	Gen
Johannan päällä on kirkkaampia värejä kuin mistä hän itse pitää .	mistä	6	Ela
En sanonu Jussille mitään , mielestäni häne käytös tällaisella ilmalla oli ollut hieman törkeetä .	häne	6	Gen
Sekö että istuu autossa tunnin ylimääräistä ?	Sekö	0	Nom
Mihin niitä kelaatteja sitten käytetään ?	Mihin	0	Ill
Kaikkien päät kääntyvät minuun .	minuun	3	Ill
Moitti minua , että so on minun ja palvelusväen vika ko tyär puhhuu ko runsunen jätkä .	so	4	Nom
Säädökset estävät meiltä asiaan puuttumisen	meiltä	2	Abl
Panttila on sen verran kettu mies , ett ei häntä kovin helppo ole ohittaa .	häntä	9	Par
Näin sieltä sinutkin	sinutkin	2	Acc
Kun puhelinkeskustelussa antaa lausuntoja , ei voi välttyä siltä , ett eikö jotakin väärinkäsityksiä syntyisi .	jotakin	12	Par
Sepäs sattui .	Sepäs	0	Nom
Türki ( 1000-luvulta lähtien türkčä tai türk tili , myöhemmin türkī ) on eräiden turkkilaisten kansojen historiallisista kirjakielistä käytetty nimitys .	eräiden	13	Gen
- Ei mulla ole ketään muuta .	mulla	2	Ade
Jotenkin sille kaikelle kiltteydelle ja miellyttämisen halulle on vain niin vaikea laittaa aikuisen nimilappua .	kaikelle	2	All
ei te häirittem meitä vähääkää	te	1	Nom
Tässä Yhdysvaltain eräässä asukasluvultaan pienimmässä osavaltiossa esivaalit järjestetään tulevana tiistaina .	eräässä	2	Ine
Kaisulla on itselläänkin paljon tekemistä .	itselläänkin	2	Ade
Turun yliopiston tuottaa eri alojen asiantuntijoita ja tutkimusta yhteiskunnan jokaiselle sektorille .	jokaiselle	9	All
Olisi mukava tietää mihin se pitää viedä , mikäli siihen tulee vika .	siihen	9	Ill
Silmälasit välähtivät , kun Ilkka poimi jonkin paperin pinosta ja siirsi sen toiseen .	jonkin	6	Gen
Mut sen kerkee koukkaa teilt vielä jos se nyt oli nii et sil ei sit ollu	teilt	4	Abl
Vaadimme , että tiedotusvälineet saavat toimia vapaasti ja että opposition edustajat saavat näkyvyyttä niissä .	niissä	13	Ine
Naisia rangaistiin , joll eivät he synnyttäneet vähintään kolmea lasta .	he	5	Nom
Termi voi olla käytössä myös kiinteistöyhtiöissä , erityisesti jos niihin sovelletaan asunto-osakeyhtiölakia lain tai yhtiöjärjestyksen perusteella .	niihin	9	Ill
Apteekkari suri ainoan ystävänsä , nimismiehen kovaa kohtaloa ja joi itsensä puolessa vuodessa hengiltä .	ainoan	2	Gen
Hän saapui suojatielle , teiden risteykseen ja kuuliaisena poikana katsoi kumpaankin suuntaan liikenteen varalta , vaikka tiesi jollain tasolla ettei sieltä kuitenkaan autoa tulisi .	kumpaankin	10	Ill
Jostain syystä en enää edes muista mistä .	Jostain	0	Ela
Minäkään en pidä siitä , liittomme on vahva .	Minäkään	0	Nom
Jos papereihin on uskomista , niin Reinhold Ryynäsellä kokemusta oli vaikka toisille jakaa .	toisille	11	All
Luennolla olijoita pyydettiin lopulta kutakin poimimaan läheinen lennokki .	kutakin	4	Par
Samassa yhteydessä valitustuomioistuin kaksinkertaisti naisen neljätoista kertaa joukkoraiskanneiden miesten tuomioiden pituudet .	Samassa	0	Ine
Niitä tuntui naurattavan hysteerisesti oma puolivillainen tilansa .	Niitä	0	Par
En käsittänyt syitä tälle lainkaan .	tälle	3	All
Sinähän seuraat täältä saakka asioita .	Sinähän	0	Nom
Se sinun ihmeellinen Lassesi pistää rahasi kurkustaan alas ja juottaa vielä muita naisia .	sinun	1	Gen
Menkäämme itseemme .	itseemme	1	Ill
Hän tarkasteli tutkimuksessaan lasten näkemyksiä hyvästä hoidosta haastattelemalla lapsia , joilla oli kokemuksia sairaalahoidosta .	joilla	10	Ade
Nainen pysähtyi jalkakäytävän reunaan , katsoi kumpaankin suuntaan tielle kuten kuuluukin , toivotti Jalmarille huomenet ja alkoi paukuttaa lautaisia yhteen niin , että hampaista paikat irtoilivat .	kumpaankin	6	Ill
Mikri Vuoma oli tuonu meile hillat , sienet , potut ja poronlihat .	meile	4	All
Nyt tilanne on heidän mukaansa liian usein se , että ensimmäinen yritys viestiä tutkimuksestaan on väitöskirjatiedotteen laatiminen .	heidän	3	Gen
Varsinkin halpatyövomana laittomat siirtolaiset ovat joustava työvoimareservi , jolla ei ole oikeuksia , oli kysymyksessä työturvallisuus , työajat tai palkat .	jolla	8	Ade
Kenelläkään muulla ei ollut lippua kuin minulla .	muulla	1	Ade
Kuka sen on sanonut , että terroristit ovat partaisia , epämääräisen näköisiä nahkatakkimiehiä ?	Kuka	0	Nom
– Me emme ole tehneet sinunkauppoja .	Me	1	Nom
Venäjänhän asioita on jo pitkään hoideltu pikapaikkauksin , presidentin ukaasein , jotka saattavat olla ristiriidassa lain kanssa mutta joilla saadaan lakia nopeammin muutoksia aikaan .	joilla	18	Ade
Ne muutamat joiden suonia verenhimo vielä pakotti , tekivät joitakin laimeita yrityksiä .	muutamat	1	Nom
Etenkin urheilijoiden ravintoa olisi säänneltävä järkevästi , koska tässä on ensiksikin kyse kuluttajan terveydestä - jotta kuluttajaa suojeltaisiin väärien tietojen aiheuttamilta pettymyksiltä ja ennakkoodotuksilta - toiseksi on kyse myös näiden elintarvikkeiden vaikutuksista .	näiden	29	Gen
Mutta on aivan liian myöhäistä ajatella , en voi enää liikkua tästä , en voi muuta kuin odottaa .	muuta	15	Par
Eräät katalonialaiset ja baskiedustajat torjuivat uuden hymnin korostaen , että heidän kansoillaan on jo käytössä omat hymnit .	Eräät	0	Nom
Sinulle , jolta intti on vielä suorittamatta , voin sanoa , että kyllä sen läpi selviää , jos vain on huumorintajua eikä rasita itseään turhilla pohdinnoilla .	jolta	2	Abl
Näille viidelle ojennettiin kullekin salmiakkia .	kullekin	3	All
Miksen minä koskaan tehnyt niin kun olin vielä elossa , kun minulla oli vielä jalat joita heilutella laiturilla , kädet joilla olisin todella koskettanut toista ihmistä ja päästänyt jonkun lähelleni .	joilla	20	Ade
Näin ei ole jokaisessa jäsenvaltiossa , koska eläkkeet kuvastavat erityisiä kulttuurisia ja historiallisia tilanteita .	jokaisessa	3	Ine
Minussa ei ole sijaa arktisuudelle sen paremmin kuin arkisuudellekaan	Minussa	0	Ine
Nyt ku tosta puuttuu tosta komerosta toine ovi ni nyt o vähemmä tilaa työntää kenkiä .	tosta	2	Ela
Sen vuoksi valiokunta päätti esittää tarkistuksia , jotka estävät tällaisen rehujen palauttamisen .	Sen	0	Gen
Sul on vääräs ajas ku se on seis koko ajan . ”	Sul	0	Ade
He aliravitsivat häntä	häntä	2	Par
Joillekin voi tietysti järjestyä palkkaamalla hoitaja kotiin .	Joillekin	0	All
Tarkistussoitto muulle porukalle , jotka olivat heränneet Turussa aamuviideltä ja kömpineet bussiin kuudelta , ja saimme kuulla että yhdeksältä olisi ensimmäinen peli oman joukkueemme , Jyrki Pulliainen ja Takapaksin Palomiehet , osalta .	muulle	1	All
Se ei viitsinyt edes soittaa ovikelloa vaan astui sisään muina miehinä omilla avaimillaan , mikä minusta ei ollut erityisen korrektia .	minusta	15	Ela
Ihmisten mittakaavassa niiden lennolla oli mittaa puoli miljoonaa vuotta .	niiden	2	Gen
Mitä sä olet mieltä siitä asiasta ?	Mitä	0	Par
Sä kysyit mitä kellon on , ja tää on nyt tän verran .	tän	10	Gen
Monet ovat hurmaantuneet tähänkin mennessä .	tähänkin	3	Ill
Tämä on mielenkiintoinen tapaus .	Tämä	0	Nom
Ilpo sormeili rahojaan ja osti harvemman .	harvemman	5	Gen
Yhtä asiaa ihmettelivät muutkin	muutkin	3	Nom
Sinua on hauska kiduttaa , mutta saat syyttää itseäsi .	Sinua	0	Par
Tuo olkikoira , jonka aamulla nimesin Pyroksi , taitaa olla jokin lapsuuden kaipuun ikoni , esine joka linkittää tämän hetken siihen hetkeen , jolloin en tiennyt huomisesta mitään .	siihen	20	Ill
Sinun kanssasi on mukava jutella	Sinun	0	Gen
Kaikissa nykyaikaisissa satamissa pitäisi sallia itsekäsittely , jos se on mahdollista , sekä laivalla että maissa .	Kaikissa	0	Ine
Jotkin Välimeren alueen kumppaneista suhtautuvat varmasti erittäin myönteisesti kaikkiin näihin toimiin .	Jotkin	0	Nom
Yht’ äkkiä naisella oli kummassakin kädessään isot käsilautaset , jonkinlaiset symbaalit joita ainakin marssimusiikissa käytetään .	kummassakin	4	Ine
Sillä ei ole takkia päällä edes talvipakkasella .	Sillä	0	Ade
Mikäli häpeä , estot ja oma kontrollointi estävät meiltä tämän nautinnon , vaikuttaa se kaikkeen muuhunkin elämässämme .	kaikkeen	14	Ill
Aina toki löytyy myös niitä , jotka eivät osaa antaa anteeksi toisille , saatikka itselleen .	toisille	11	All
Hän olisi ollut valmis uhrautumaan eläinten puolesta , miksei ihmistenkin , useimpien .	useimpien	11	Gen
Teille minä olen herra majuri .	Teille	0	All
Miltä nyt tuntuu ?	Miltä	0	Abl
Kaikissa Suomen antennikodeissa televisio pimeni , jos kotiin ei oltu hankittu digisovitinta .	Kaikissa	0	Ine
Molemmat ehdokkaat käyttivät kaatuneiden sotilaiden tarinoita oman näkemyksensä ajamiseen .	Molemmat	0	Nom
Mä vien sut oikeuteen ja mä tapan sut !	sut	2	Acc
Jotka miettivät olevansa Jeesuksen kanssa samalla puolella kun Hän tulee , ovat sitä jo nyt .	Jotka	0	Nom
Monessa Etelä-Euroopan maassa julkinen velka on kestämättömällä tasolla , ja maassa kuin maassa 2009 lamaa torjuttiin ottamalla lisää lainaa .	Monessa	0	Ine
Järjestelmäasiantuntija hyötyy samoista asioista , mutta sen lisäksi tulee löytyä halua keskittyä johonkin tiettyyn osa-alueeseen , kuten ohjelmointiin , tietokantoihin tai testaukseen .	samoista	2	Ela
Sit se oli itte ollu tää naapurin pikkupoika semne et ku sil oli ollu ittellää synttärit ni se oli aina seissy ninku ovella tällee näi vastassa ku vieraat tuli et LAHJA LAHJA	ittellää	14	Ade
Mut minä en tunne kettää .	kettää	4	Par
He rutistivat otsaansa uusia uria miettiessään , kumpi tulee ennen , huipputiedemies vai huippuyliopisto .	He	0	Nom
Tietysti rakastan sinuakin .	sinuakin	2	Par
Et sä viitsis soittaa Eilalle ja mut sullakaan ei oo niiden puhelinnumeroo , vai onks sul .	sullakaan	7	Ade
Kun uskomme itseemme , unelmiimme ja pidämme kiinni näistä kahdesta , voimme tehdä mitä ikinä haluamme .	itseemme	2	Ill
Pisteitä tarkkaillaan , ja niiden kertymisen avulla seurataan opintojen etenemistä .	niiden	4	Gen
- Luonnon- ja lääketieteen tutkijat ovat kovin riippuvaisia projektirahoituksesta palkan lisäksi , koska monet tutkimusmenetelmät vaativat infrastruktuuria , joka itsessään , tai jonka käyttö maksaa , Jaakkola toteaa .	itsessään	19	Ine
Sillä tulee olemaan yksi talouspoliittinen hallitus , yksi valuutta ja yksi yhteinen ulkopolitiikka .	Sillä	0	Ade
samalla luokalla oltii , kolmannesta luokasta lähtie ollaan käytyk koulua , yhtä aikaa , siit lähtie ollaa tunnettut toisemme , vuodesta neljäkymmentä .	toisemme	18	Gen
Uskon sinun tulevan	sinun	1	Gen
Miltä tuntuisi , jos työnantajasi voisi silmäillä geenejäsi työhönotossa ?	Miltä	0	Abl
Kenestä se tuoksu oli jäänyt ?	Kenestä	0	Ela
Kumpikin on tottunut puhumaan mallina .	Kumpikin	0	Nom
Hän lupaa lähettää Sinulle SALT-paperinsa heti kun se on kirjoitettu .	Sinulle	3	All
heiltä puuttui halu sovinnon etsimiseen .	heiltä	0	Abl
Samastakin määrästä siitepölyä eri ihmiset voivat saada eri tavalla allergiaoireita .	Samastakin	0	Ela
Meiltä kun puuttuvat nämä vuoristot , varsinkin Pohjanmaalta .	Meiltä	0	Abl
He olisivat siis ilman turvaa 65:nteen ikävuoteen asti , jolloin heidän eläkkeensä olisi noin 500 euroa kuukaudessa .	heidän	10	Gen
Norjassa Ruijan puolella sekä ylimmässä Lapissa on alueita , joilta sopulit ovat kadonneet .	joilta	9	Abl
Seuraa ote eräästä tavanomaisesta torstaipäivästä .	eräästä	2	Ela
OIKEIN MUKAVAA JA MAKOISAA VAPPUA KAIKILLE BLOGISSANI PIIPAHTAVILLE .	KAIKILLE	5	All
vaikea saadas selvää kuvaa siitä , siitäkään .	siitäkään	6	Ela
Mul on kello . ”	Mul	0	Ade
Minäkö se laulan ja huojun ?	Minäkö	0	Nom
Mulle pitää yleensä aina olla makkaran kanssa sinappia , vaan nämä eivät kaivanneet mitään peittämään omaa hyvää makuaan .	Mulle	0	All
eihän ne ni ihtiisäj juovuksiij juonnu .	ihtiisäj	3	Par
Sen sijaan eräästä toisesta firmasta soitettiin takaisin toukokuussa ja kolmannesta paikasta soitettiin vasta kesäkuussa . ”	eräästä	2	Ela
Siks mä aloin jo juoksemaan Mollaa kohti , mutta se näytti hermostuvan mun juoksusta , ja lähti itekin pois päin siitä kohtaa missä se ois voinu vielä kahlata puron yli .	mun	12	Gen
He tulevat tekemään töitä , joita amerikkalaiset ja maassa laillisesti olevat siirtolaiset eivät halua tehdä .	He	0	Nom
Arduino on italialainen keksintö , mutta alustoja on saatavilla hyvin monia erilaisia .	monia	10	Par
Siitä on hyötyä itselle ja muille .	itselle	3	All
Kun puhelinkeskustelussa antaa lausuntoja , ei voi välttyä siltä , etteikö jotakin väärinkäsityksiä syntyisi .	siltä	8	Abl
samassa yhtteyvessä Tiina sano että tilloo hänellenni semmonen , semmonen pakki millä nuotiolla keitettää .	hänellenni	6	All
Visualisoinnit on tehty neljästä kysymyksestä , jotka valitsin yksinkertaisten vastausvaihtoehtojen ” Kyllä ” ja ” Ei ” perusteella .	jotka	6	Nom
Vittuako se kenellekään kuuluu , moottoripyörämies sanoi .	kenellekään	2	All
Gallin ja Aholan tutkimuksessa kävi kuitenkin ilmi , että työantajat harvoin tietävät tästä mahdollisuudesta , ja aloite koulutukseen hakemisesta tulee yleensä opiskelijalta itseltään .	itseltään	22	Abl
Suoraviivaisimmat luokittelijat ovat niputtaneet Breivikin kanssa samaan psykopaattijoukkoon kaikki , jotka ovat uskaltaneet puhua maahanmuuton lieveilmiöistä .	jotka	10	Nom
Sama terminologia on periytynyt monien muidenkin kielten kielioppeihin .	Sama	0	Nom
Entinen Ylen pääjohtaja Sakari Kiuru ( sd ) liittyi eilen Demariin kirjoittamassaan kolumnissa niihin , jotka --	niihin	13	Ill
Kaikilla oli kiire rintamalle , eikä kenelläkään näyttänyt olevan aikaa minulle .	kenelläkään	6	Ade
taputin häntä lepyttävästi polvelle .	häntä	1	Par
Kenellekään ei voinut jäädä epäselväksi , kenen poika hän oli .	Kenellekään	0	All
Heitä huolettaa se , että julkisuus omii heidät .	Heitä	0	Par
Minä tosiaan ajattelin nyt vaan poiketa morjestamaan sinua , täällä sinun omissa kotioloissasi .	Minä	0	Nom
Mitä se tähän kuuluu ?	tähän	2	Ill
Siinä ei puhuta mitään siitä , mihin pitäisi päästä , mitkä ovat uudet strategiat , uudet kehityslinjat .	mitään	3	Par
Uutta Garboa minusta ei tullut , sillä halusin säilyttää oman tyylini .	minusta	2	Ela
Kun vanhalla Saintillani ajoin öisiä , rikkinäisten katulamppujen valaisemia katuja , ajattelin ' turha toivo , ei avaruus ole Orkideapolun astronauttia varten , eivätkä nämä kädet sinusta otetta edes saisi ' .	sinusta	26	Ela
Sen lupa oli myönnetty 19. lokakuuta ja lupahakemuksen liitteenä oli ampumaseuran todistus jäsenyydestä .	Sen	0	Gen
Kerro Marjut keneltä sä oot saanu tän .	keneltä	2	Abl
Juu , kyllä sitä minullakin korvat kutisevat aina välillä allergian takia .	minullakin	4	Ade
Syytteen mukaan sisäpiirikauppoja on tehty 23 pörssikaupassa ja saatu yli 3 milj. euroa voittoja , jotka on saatettu pimittää verottajalta .	jotka	15	Nom
Tämä ilmenee eräästä komission puheenjohtajan Santerin Euroopan parlamentin puhemies Gil-Roblesille 11. marraskuuta 1997 lähettämästä kirjeestä .	eräästä	2	Ela
Heidät pitäisi saattaa YK:n ihmisoikeuskomission eteen vastaamaan kansanmurhasta .	Heidät	0	Acc
Haluan korostaa , että toimikunnat ovat hyvät ihmiset juuri Teitä varten ja kaikille avoimia !	Teitä	9	Par
Nyt myös muun muassa käyttäjäkunnan on sovellettava direktiiviä , ja me olemme saaneet siihen mukaan yhteiskäsitteen , jotta tiedämme , mistä puhumme .	mistä	20	Ela
Komeat kengät on sinullakin .	sinullakin	3	Ade
Tosiasiassa en tiennyt hänestä sen enempää kuin itsestänikään .	itsestänikään	7	Ela
He saivat jonkun pulaan .	He	0	Nom
Niit on erityyppisii .	Niit	0	Par
Olin jo varma , että eroamme , mutta muutamien hermosavujen jälkeen Mies palasi takaisin sänkyyni .	muutamien	8	Gen
Vilkaisu ylös saa meidät epäilemään tehtävän onnistumista : kaukana kaukana suoraan yläpuolellamme näyttää olevan .	meidät	3	Acc
Hienoa , lompakkonikin oli jäänyt sinne mistä tulin .	mistä	6	Ela
- Joo mää tuon .	mää	2	Nom
Mul oli semmost asiaa että eilen tuli tieto siitä Jyväskylästä että ne on tullu ne kirjat .	Mul	0	Ade
