Ehdotetut Euroopan yhdenvertaisten mahdollisuuksien teemavuosi 2007 ja Euroopan kulttuurien välisen vuoropuhelun teemavuosi 2008 ovat tärkeitä aloitteita , joilla lisätään tietoisuutta näistä asioista ja joilla edistetään tavoitteiden saavuttamista .	näistä	20	Ela
Mulla ei ole puukko matkassa .	Mulla	0	Ade
Minä tykkään ja et se on väärin	Minä	0	Nom
Sinulle , jolta intti on vielä suorittamatta , voin sanoa , että kyllä sen läpi selviää , jos vain on huumorintajua eikä rasita itseään turhilla pohdinnoilla .	Sinulle	0	All
Enkä tiiä ees ketää , kuka käyttäis	ketää	3	Par
Leon mukaan ” Mitro Repo on opiskelunsa aikana ja pappisvihkimisessään sitoutunut tähän kirkon perinteeseen ” .	tähän	11	Ill
Sit ku puhuttiin et jos mennään johonki semmoseen paikkaan mis ois mahdollisesti vaikka jotain jameja ni onks se torstai just se päivä millon ne onnettomat paikat mitkä ne pistää sitte kiinni jos ne pistää	mis	9	Ine
Jos itsellekin on sattunut kertymään vähän ylikiloja , innostutaan vertailemaan vararenkaita laihduttajan kanssa : minunhan tässä pitäisi laihduttaa eikä sinun .	minunhan	14	Gen
b ) aiheuttaa huomattavia menetyksiä henkilöille , joita asia koskee , ja	joita	7	Par
Teidät käsitetään opiskelijoina , mutta älkää unohtako olevanne myös ainutlaatuisia ihmisiä .	Teidät	0	Acc
Villit huhut kertovat mm. muuan uskalikosta , joka matkusti pienessä autossa eläinlääkärin , kolmen fuksianpunaisen fyysikon ja diplomi-insinöörin kanssa Helsinkiin Matlun Klusterille tanssimaan pöydillä palaten Otaniemeen mukanaan järjestölehtipornon hienoin saavutus .	muuan	4	Nom
Ei se milloinkaan meiltä ihan tietymättömissä ollut .	meiltä	3	Abl
Et sä viitsis soittaa Eilalle ja mut sullakaan ei oo niiden puhelinnumeroo , vai onks sul .	sul	15	Ade
He rakastavat toisiaan .	toisiaan	2	Par
Näin sinne sinutkin	sinutkin	2	Acc
Tässä minä nyt istun , elintoiminnot hidastuen kokoajan .	Tässä	0	Ine
Vai voiko tosiaan pitää paikkansa , että minun neljäs olohuoneeni , jonne tulen arki-iltana juomaan teetä ja pelaamaan lautapelejä kavereiden kanssa , on jollekin laittautumisen , aloittelun ja jatkojen väliin jäävä bilepaikka ?	jollekin	23	All
Mikäli kaikki menee hyvin , myöhemmin on tiedossa vielä toinen haastattelukierros , ja jos senkään jälkeen ei ole onnistunut vakuuttamaan haastattelijoita olemattomista kyvyistään , voi työsopimus olla kourassa hyvinkin pian .	senkään	14	Gen
Kerro Marjut keneltä sä oot saanu tän .	tän	6	Gen
Eikä hällä ollu mitään papereit siinä itsellään	hällä	1	Ade
Mitäpä mies .	Mitäpä	0	Par
- Mitämitä , Lasarin S-market ja Alko avattu ? ! ? !	Mitämitä	1	Par
Näillä sanoilla yritän lohduttaa miestäni joka aamu , kun hän aukaisee silmänsä ja näkee ensimmäisenä minut .	Näillä	0	Ade
Joulu on eräällä tavalla jäänyt taakse , talvi on tullut oikein kunnolla ja kodissa vallitsee joulun jälkeinen kaaostila … ;)	eräällä	2	Ade
Tuolla tavalla meistäkin olisi tullut kuuluisia .	meistäkin	2	Ela
Vaksi tuli ihmettelemään piruako siinä norkoilin , minä selvitin etsiväni työnjohtajaa ja se kysyi ketä niistä .	ketä	14	Par
Teos sai nimekseen Sinulle	Sinulle	3	All
Ja senhän minä tekisin .	senhän	1	Gen
silt on tästä pudonnu tää osa mis on sen nimi	silt	0	Abl
He huolehtivat toinen toisestaan .	toisestaan	3	Ela
Erääseen kammioon unohtunut hallintovirkamies kuuli uudistushankkeesta .	Erääseen	0	Ill
Ihan normaalia lapsen toimintaa , mutta monilla vaihe jää pysyvästi päälle .	monilla	6	Ade
Ja sinulla oli se vasta ostettu kävelypuku .	sinulla	1	Ade
Siitähän on jo 10 vuotta !	Siitähän	0	Ela
Ja nyt tuntuu siltä , että on pakko jatkaa .	siltä	3	Abl
Merja Larivaara on tässäkin kaunotarpoliisi Ilona Lumme ja Niko Saarela asiaan kuuluva hönttipoliisi Muilu .	tässäkin	3	Ine
En koskaan saa tätä anteeksi , enkä tule koskaan saamaankaan .	tätä	3	Par
Ninan äiti teki meille minihameet , joilla me sitten paistateltiin Norssissa .	joilla	6	Ade
Tosilla oli todella iso tukkapehko .	Tosilla	0	Ade
No minäkös siihen sanomaan , ettei kukaan huoli tuon näköistä mihinkään .	minäkös	1	Nom
vadelmahillo antaa mukavaa yhteismakua muidenkin marjojen kanssa .	muidenkin	4	Gen
Samassa häntä alkoi ärsyttää koko tapahtuma .	häntä	1	Par
Vimin keskeinen idea on , ettei kumpaakaan kättä tarvitse siirtää näppäimistöltä ( esimerkiksi hiirelle ) minkään toiminnon , kuten tallentamisen , ajaksi .	minkään	15	Gen
Nimi johtui siitä , että potilas sai niin kovan päänsäryn , että se teki hänet hulluksi .	hänet	14	Acc
Joku nimesi hänet pubissa Euroopan rumimmaksi mieheksi , joka ei ymmärrä jääkiekosta senkään vertaa kuin KuPSin kannattaja jalkapallosta .	senkään	12	Gen
Hän puree huuliaan , saa ne näyttämään siltä kuin olisi suudellut rakastaan tunteja .	siltä	7	Abl
Vetoomusvaliokunta ei tietenkään ole mikään maailman napa , se on kuitenkin tämän Euroopan parlamentin valiokunta , joka on erilainen kuin muut .	muut	20	Nom
Haagin ohjelman mukaan yhteisiin perusperiaatteisiin perustuvien puitteiden olisi muodostettava pohja EU:n tuleville aloitteille , joissa määritellään selkeät tavoitteet ja arviointikeinot .	joissa	14	Ine
olin käyttäytynyt täysin rauhallisesti aina siihen asti , kun tulivat paikoille .	siihen	5	Ill
Huomaan , että komissio ja ympäristöjärjestöt uskovat , että käytännössä voitaisiin saavuttaa paljon enemmän ja että muutamat jäsenvaltiot ovat joka tapauksessa sitoutuneet alentamaan merkittävästi ilman epäpuhtauksia - vaikka se ei pidäkään paikkaansa kaikkien kohdalla .	muutamat	16	Nom
Sen sijaan että orjuuttaisimme itseämme hamassa tulevaisuudessa epämääräisesti häämöttävän palkinnon toivossa , tulisi meidän vapautua suorituspaineistamme , karistaa ylimääräinen vastuuntunto harteiltamme ja ryhtyä nauttimaan raukeasta elämästä .	itseämme	4	Par
4 ) Lisätään 7 artiklaan kohta seuraavasti , jolloin nykyisestä ainoasta kohdasta tulee 1 kohta :	ainoasta	10	Ela
maasta toiseen muuttaminen	toiseen	1	Ill
Kaikki ovat turtuneita arkeen , sen pyörittämiseen sekä joka päivä toistuviin samoihin rutiineihin .	samoihin	11	Ill
Sinun täytyy lähteä	Sinun	0	Gen
Ja kun hän oli humalassa , hänelle tuli valheellisen turvallinen olo sellaisessa mielentilassa teki helposti varomattomuuksia .	hänelle	6	All
Miltä nyt tuntuu ?	Miltä	0	Abl
Talovahtina ties kuinka monennetta kertaa	monennetta	3	Par
Siitä vain läksyjä lukemaan .	Siitä	0	Ela
– Sitä pitää varmaan kysyä siltä itseltään .	itseltään	6	Abl
Se minua sapettaa niin helvetisti .	minua	1	Par
Eikä itsestään huolehtiminen mitään turhamaisuutta ole – muuta kuin niiden akkojen mielestä , jotka ovat miehensä toivomuksesta tai laiskuuttaan alkaneet niihin säkkeihin pukeutua .	muuta	7	Par
Mull on tossa viimene rulla saat sen se on kahenkymmenen neljän kuvan et sil nyt kuvaa jonkun verran jo ,	Mull	0	Ade
Tarkemmat rakenteet ( jokaisessa taulussa indeksi id-sarakkeessa ) voit vilkaista tekstin lopusta .	jokaisessa	3	Ine
Arduinoon on saatavilla erilaisia ” laajennuksia ” , shieldejä , joilla sitä saa laajennettua esim. GPS-trackeriksi tai GSM-puhelimeksi .	joilla	10	Ade
Accenturen mannekiinin Tiger Woodsin komistamien Powerpoint-kalvojen ihmettelyn jälkeen lähdemme tekemään kiertokäynnin accenturelaisten työtiloihin muutamaa kerrosta ylempänä .	muutamaa	13	Par
Itselleni ja pojalleni .	Itselleni	0	All
Joo muutamissa sekunneissa ymmärrän , ettei niin huonoa vitsiä voi olla olemassa ja alan itkeä .	muutamissa	1	Ine
Kolmanneksi tässäkin raportissa ympäristönäkökohtien sisällyttäminen Lissabonin strategiaan vaikuttaa todella pelkältä nimelliseltä eleeltä .	tässäkin	1	Ine
Kummallakin oli ase kädessään .	Kummallakin	0	Ade
Mistä he pitävät ja mistä eivät .	he	1	Nom
Myös joitain nopeakasvuisia mäntylajikkeita , kuten montereynmäntyä ( Pinus Radiata ) voidaan käyttää hiokkeen valmistuksessa .	joitain	1	Par
meillä voisi olla tarve tukea ja kannustaa sitä , mikä meidän suomalaisessa kulttuurissamme on hyvää , niin filmissä kuin kirjallisuudessa kuin paljossa muussakin .	muussakin	22	Ine
Kello on varastettu joltakulta .	joltakulta	3	Abl
Siitä minäkin olen tänään nauttinut .	Siitä	0	Ela
Eihän meillä olisi silloin ollut edes tilaa millekään junanradalle , hyvä kun itse mahduttiin kaikki yhtaikaa lattialle seisomaan .	millekään	7	All
Toisilla kaljaa oli kaljaa , mutta toisilla ei .	Toisilla	0	Ade
Lopulliset iltamenot jäi itseltä väliin , kun parin päivän minimi-yöunet ja väsymys alkoi painaa liikaa .	itseltä	3	Abl
( 16 ) Kaikille matkustajille olisi annettava perustiedot korvausvastuuseen sovellettavista säännöistä , jotta he voivat tarvittaessa ottaa lisävakuutuksen ennen matkaa .	Kaikille	3	All
Joka tapauksessa puhun myöhemmin enemmän joistakin tarkistuksista , joissa käsitellään näitä näkökohtia .	joissa	8	Ine
Mut minä en tunne kettää .	kettää	4	Par
Ensinnäkin hän oli nuori ja toisekseen aurinko ilkkui hänelle enimmän osan vuodesta kotimaan kamaralla , piiloutui milloin minnekin pilvien taakse tai kieltäytyi osan aikaa edes näyttäytymästä .	hänelle	8	All
Meidän pitäisi kannattaa tätä mietintöä ja antaa hänelle tukemme .	hänelle	7	All
Joskus biisin loppupuolella he ovat keränneet paikalle sen verran ihmisiä että puu saadaan ilmaan tyvipäästä ja minut raahataan väkisin pois lepäämästä .	minut	16	Acc
Laulua saatiin kuulla paljon ja korkealta ; joku epäili lokiin eräiden miespuolisten festeilijöiden kivesten kadonneen .	eräiden	10	Gen
Ma oon ollu , sillon tällön tollasessa , erilaisis tilaisuuksis niin ku säestämässä , jotai yksillaulajaa tai , sellasta , esimerkiks jossai häissä mä oon olluj ja , tommosissa	jossai	21	Ine
– Siihen on tietysti monia syitä .	monia	4	Par
Tositilanne on nimittäin se , ettei kellään vaikuttaisi olevan juuri minkäänlaista yleispätevää käsitystä siitä , mitä tuo 27 tunnin työmäärä käytännössä tarkoittaa .	kellään	6	Ade
Eilen halusin vielä ryypätä , koska jokainen lukemani " viini " sana sai minut muistelemaan suloista punaista nestettä , mutta tänään minusta on alkanut tuntua , kuin kaikki Chinaskin juoma alkoholi vaikuttaisi minussakin ja saisi minutkin kärsimään kroonista krapulaa .	minutkin	35	Acc
Jone katsoo hetken silmiin , vilkaisee rannalle ja katsoo minua jälleen .	minua	9	Par
Minun on pakko käydä maksamassa sähkölasku , meiltä on pantu sähköt poikki .	meiltä	7	Abl
He eivät saaneet hevosta taltutettua ja se pääsi heiltä pakoon .	heiltä	8	Abl
Haluaisin kysyä teiltä , isiltä ja äideiltä , jotka annatte lapsillenne ilmakivääreitä lahjoiksi , että tiedättekö mitä lapsenne niillä tekevät ?	teiltä	2	Abl
Tuletko sinä ?	sinä	1	Nom
On meillä lomaa .	meillä	1	Ade
Tää on tän verran ku se on .	tän	2	Gen
Ei nainen tai vaimo ole mikään tavara , joka haetaan itselle sitten , kun mieli tekee .	itselle	10	All
Kyl se niin on et ei täs elämäs mittään saa jos nyt yhteen tonttiin juuttuu .	mittään	8	Par
Kenelläkään muulla ei ollut lippua kuin minulla .	Kenelläkään	0	Ade
Ei kenelläkään muulla ole sellaista nenää jollainen minulla on .	muulla	2	Ade
Jotkin niistä parantavat selvästi neuvoston yhteistä kantaa ja näin ollen komissio hyväksyy ne kokonaisuudessaan , periaatteessa tai osittain .	Jotkin	0	Nom
Kansankoti Ruotsin tuleva kuningatar saa naida kenet haluaa .	kenet	6	Acc
Jos minulla olisi pedagogista tajua ja lasiliike ja sika , minä opettaisin sen sian ruokapalkintojen avulla .	minulla	1	Ade
Niin , visualisointeja voisin ehkä noista tehdä , saa nähdä .	noista	5	Ela
Minä ostin leipää .	Minä	0	Nom
Moneltakos se yöjuna lähtee .	Moneltakos	0	Abl
Kas siinäpä kysymys .	siinäpä	1	Ine
- Ei mulla ole ketään muuta .	muuta	5	Par
Oom mä pyrkiny aina kesällä siim pari viikkoo , lähtemään tonne meiäm mummol luom maalle	meiäm	11	Gen
Kaikille sattuu vahinkoja .	Kaikille	0	All
Sit se oli itte ollu tää naapurin pikkupoika semne et ku sil oli ollu ittellää synttärit ni se oli aina seissy ninku ovella tällee näi vastassa ku vieraat tuli et LAHJA LAHJA	itte	3	Nom
siinähä o hirveesti englanninkielisiä termiä	siinähä	0	Ine
Useimmilla on mies mukana .	Useimmilla	0	Ade
- Opettaja , mä näin sut eilen kaupungilla .	sut	5	Acc
Pitää muistaa aina se , että pyritään syöttämään edes siihen suuntaan mihi se kaveri on menossa .	mihi	11	Ill
Se maa tulee kestämään yli vielä sinunkin elinaikasi .	sinunkin	6	Gen
Näin tehtyäni pohdin muutaman hetken siirtymistä kofeiinipitoisen aamiaisen pariin keittiöön , mutta huoneilman hyytävä kylmyys ja jäsenieni uninen kohmeisuus pakottavat minut palaamaan peiton alle vielä viideksitoista minuutiksi .	minut	20	Acc
Minä teetin muurarilla autioon taloon uunin .	Minä	0	Nom
Yleisesti voidaan todeta , että paikalliset identiteetit eivät ole kadonneet mihinkään liitosten myötä .	mihinkään	10	Ill
Kuumenna rasva pannulla , lisää curry ja pyöräytä , lisää keitetty pasta ja muut mausteet ja paista pasta kevyesti välillä sekoitellen .	muut	13	Nom
Kummassakin puolueessa on Koivistolla vankka kannatus .	Kummassakin	0	Ine
Mulla on kahvi valmistumassa .	Mulla	0	Ade
Sillä käytiin kirjeenvaihtoa ja luotiin runoutta .	Sillä	0	Ade
Olin matkalla ystäväni kosteille syntymäpäiväkutsuille , ja ajattelin haaveillen sitä kuinka olin pakottanut hänet kutsumaan sinutkin .	sinutkin	15	Acc
Pyydät häntä istumaan vieressäsi psykologiassa , seuraavassa jaksossa kaikissa samoissa kursseissa ja teistä tulisi nopeasti hyvät ystävät , haluaisit jotain enemmänkin .	samoissa	9	Ine
Meidän on pohdittava kaikkea tätä Basel II -sopimuksen yhteydessä , jossa – sisäistä tai ulkoista – luokitusta sovelletaan yhä enemmän pienten ja keskisuurten yritysten rahoitukseen .	Meidän	0	Gen
Pakistanissa suojeltavat terroristit ovat uhka paitsi Intialle myös muulle maailmalle ja siten myös Euroopan unionille .	muulle	8	All
Olisitte kilttejä toisillenne .	toisillenne	2	All
päätin etten kerro kummastakaan koska vaikka Hanna on maailman kaunein nainen se saattaa silti alkaa haukkua .	kummastakaan	3	Ela
Minusta näyttää nyt vahvasti siltä , että Nato ei ole tajunnut tätä tosiasiaa , Sacirbey sanoi toimittajille .	siltä	4	Abl
Paras luokitus on harvoilla yrityksillä	harvoilla	3	Ade
Linnuilla on varsin etevä aisti vaaratilanteisiin eikä tästä syystä tämä ollut tohtinut asettua näytille ruokalassa , ties vaikka olisi joutunut soppakattilaan ja miehen suuhun saakka .	tästä	7	Ela
Mitä sä siinä teet .	Mitä	0	Par
" Valdas " , mies esitteli itsensä .	itsensä	6	Gen
Mull oli vähän hommaa saada se puuhaan jotain et mä ehdin koluta siellä	Mull	0	Ade
Sulla ittelläs mittään olluk kus sä tähän tulit .	Sulla	0	Ade
Ihmiset jotka on helpoin leimata -sossupummit , narkkarit työttömät ja vain olevat olennot , muut oudot ja kertakäyttökusipäät- ovat vain tiedostaneet olevansa paskaa ja eivät siksi hakeudukaan ruokapöydälle , ettei tule kaikille mielipahaa .	kaikille	31	All
Minusta elikko ei väliittänyt mitään , vaikka muutamien metrien päästä räpsin kuvia ... .	muutamien	7	Gen
Meidät on nimitetty tähän parlamenttiin tekemään historiaa .	Meidät	0	Acc
Tämäkö on ihmisen aikaansaamaa ?	Tämäkö	0	Nom
Täytteenä on kinuskikermavaahtoa ja kotimaisia vadelmia ja toisessa välissä säilykepersikkaa ja sitruunarahka-kermaseosta .	toisessa	7	Ine
Teos sai nimekseen Sinulle	Sinulle	3	All
Ei minua pelottanut puheet kuumista ja jäätävistä työskentelyolosuhteista , minä halusin olla yhtä ison koneen kanssa ja kiskoa ihmisiä ja tavaroita pitkin raiteita .	minua	1	Par
Mistähän sitä aloittaisi ?	Mistähän	0	Ela
asunto , jota tarjotaan vuokralle	jota	2	Par
Sama terminologia on periytynyt monien muidenkin kielten kielioppeihin .	muidenkin	5	Gen
kuka tahansa voi tilata sähkönsä keneltä tahtoo .	keneltä	5	Abl
Tuossa ledinäytössä on 16 liitäntää , mutta käytän niistä vain yhdeksää .	Tuossa	0	Ine
Perryn mietintö antaakin viimevuotisen Gutiérrez Díazin ja vuoden 1995 Kuhnin mietintöjen jälkeen todellista syvyyttä tälle vetoomusvaliokunnalle .	tälle	14	All
Pyydä sitä avaamaan kaappinsa , tai onhan sinulla itselläsikin avain kaikkiin kaappeihin .	itselläsikin	8	Ade
Koko päivän ajan omatuntoni ruoskii minua käsiin levinneistä aikatauluista , koulutöiden aloittamisen siirtämisestä ja muusta yleisestä saamattomuudesta .	minua	5	Par
Verkkojen luona , joita on vedessä 261 kappaletta , on tehtävä ensin puoli tuntia lapiotöitä ennen kuin pääsee tuuratöihin .	joita	3	Par
Yhdistynyt Eurooppa on kaikkien eurooppalaisten koti , myös niiden , jotka eivät vielä tänään kuulu unioniimme , mutta jotka haluavat olla mukana työssä yhdistyneen Euroopan hyväksi .	jotka	10	Nom
Komissio edistää ja tukee jäsenvaltioiden pyrkimyksiä , jotka liittyvät työllisyyteen , sosiaaliasioihin sekä miesten ja naisten yhtäläisiin mahdollisuuksiin .	jotka	7	Nom
Itsensä helliminen on aikamme harraste .	Itsensä	0	Gen
Kyl niilki on varmaa oikee kello , ja jos se on eri ajassa ku tää , ni minkä mä sille voin ?	niilki	1	Ade
Sinähän joit sitä aika paljon viime keväänä ?	Sinähän	0	Nom
Se ketä ei tästä pidä ei ymmärrä hyvästä elokuvasta yhtään mitään	tästä	3	Ela
Niihin tumma sointuisi kuin luonnostaan – tumma tukka , marmorinvaalea iho .	Niihin	0	Ill
Toisilleen he eivät asiaa kertoneet .	he	1	Nom
ton Lauran näinkin sillon sillon Pirjon häissä kun olin kuokkimassa kirkossa .	ton	0	Gen
Linnulla oli paksu harmaa höyhenpeite , kiivaasti tykyttävä rinta sekä nappisilmät , jotka nyt rellottivat kiinni .	jotka	12	Nom
g ) ' Montrealin yleissopimuksella ' tarkoitetaan Montrealissa 28 päivänä toukokuuta 1999 allekirjoitettua eräiden kansainvälistä ilmakuljetusta koskevien sääntöjen yhtenäistämisestä tehtyä yleissopimusta .	eräiden	13	Gen
Sinä olit kuultavana .	Sinä	0	Nom
Mut sillo oli jo pikkujoulut justtii et mihkään ei tainnu päästäkkää .	mihkään	7	Ill
6 ) jäsenvaltioilla on yksinomainen toimivalta yleisen järjestyksen ylläpitämisessä ja sisäisen turvallisuuden varmistamisessa sekä sen määrittelemisessä , mitkä toimenpiteet kussakin tilanteessa ja vaiheessa ovat välttämättömiä ja suhteellisia tavaroiden vapaan liikkuvuuden edistämiseksi alueellaan ,	kussakin	19	Ine
Reitesi lepää omieni päällä ja ihosi pinnalla oleva nukka on herkintä , mitä sinussa on .	sinussa	13	Ine
Kun joltakulta otetaan pois toivo , viedään samalla hänen rationaalisuutensa , Alony sanoo .	joltakulta	1	Abl
jokaiseen nakkiin meni 2 siivua pekonia , joten aika tuhtia syötävää olivat , vaan hyviä .	jokaiseen	0	Ill
Adoptiovanhemmiksi eivät käy ketkä hyvänsä	ketkä	3	Nom
Muutoksia perustellaan tarpeella pienentää maasta toiseen leviävien kriisien todennäköisyyttä .	toiseen	5	Ill
- ( PT ) Euroopan parlamentin hyväksymässä päätöslauselmassa otetaan esiin huolenaiheita , joista olemme samaa mieltä , ja esitetään ehdotuksia , joita kannatamme , vaikka olemmekin joistakin kohdista eri mieltä .	joistakin	26	Ela
On löytynyt uusia kantoja , joihin penisilliinit eivät pure .	joihin	5	Ill
Miltähän tuntuisi jos olisi siivooja .	Miltähän	0	Abl
Kummallakin oli ase kädessään .	Kummallakin	0	Ade
Huomasin Jussin tulleen ulos päärakennuksesta , huikkasin sille että menis Mollan toiselle puolelle hiljaa kiertäen , mutta se tyhmä juoksi suoraan mun luo ja alko meuhkaamaan että mitä mä tällä ilmalla teen näin kaukana meidän tilalta .	toiselle	11	All
Pelin idea taisi jäädä siihen osallistuneillekin hieman arvoitukseksi .	siihen	4	Ill
Hän tiesi kaikkien kutsuvan sitä kaljamahaksi , joten hän antoi mennä .	kaikkien	2	Gen
Joidenkin ehdokkaiden kotisivuna on puolueen kotisivu , joillakin oli facebookin etusivu , joillakin wordpressin etusivu .	joillakin	7	Ade
Kääpiäinen oli tylsistynyt , se oli päässyt tai joutunut eläkkeelle , en käsittänyt kumpaa .	kumpaa	13	Par
Teetin työn toisilla	toisilla	2	Ade
Mikäli häpeä , estot ja oma kontrollointi estävät meiltä tämän nautinnon , vaikuttaa se kaikkeen muuhunkin elämässämme .	muuhunkin	15	Ill
Otaniemen säätila takasi kostean olon myös holittomalle osalle festiväkeä , jota vahvisti kuraisella ruohikolla pelattu parijalkapallo .	jota	10	Par
Sulle ei yhtää kamppaari maistus .	Sulle	0	All
Koska suurin osa työntekijöistä tekee enimmät duuninsa asiakkaiden tiloissa , ei juuri kenelläkään toimitusjohtajaa lukuun ottamatta ole omaa toimistoa .	kenelläkään	12	Ade
Tiina sano että tilloo hänellenni semmonen , semmonen pakki mitä- millä nuotiolla keitettää .	hänellenni	4	All
Taustalla voi selvästi nähdä vetoomuksen " meille kannattaa tulla , meillä et saastuta luontoa " .	meille	6	All
Suomen ja Kiinan kahdenvälinen kauppa on hyvä esimerkki siitä , kuinka kaksi toisiaan täydentävää taloutta voi hyötyä toinen toisestaan .	toisestaan	18	Ela
b ) ' yhteisön lentoliikenteen harjoittajalla ' tarkoitetaan lentoliikenteen harjoittajaa , jolla on asetuksen ( ETY ) N:o 2407/92 säännösten mukainen jäsenvaltion myöntämä voimassa oleva liikennelupa ;	jolla	11	Ade
Onko kellään kokemusta alueelta ?	kellään	1	Ade
Meistä yli kolmekymppisistä monet ovat päässeet kiinni " kunnon kansalaisen " elämään : työ , perhe ja oma koti .	Meistä	0	Ela
Näyttöä demokratisoitumisesta saadaan ensi kesän paikallisneuvostojen vaaleissa , joihin on tulossa useampia ehdokkaita .	joihin	8	Ill
Heille annettiin itselleenkin tunnustusta .	itselleenkin	2	All
Päinvastoin , määrittelen itsenikin ensisijaisesti ammattinimikkeeni perusteella .	itsenikin	3	Gen
Älä tee sitäkään .	sitäkään	2	Par
Toisilla taas vähän lyhyempi .	Toisilla	0	Ade
Saimme heiltä sähkeen hääpäivänä , ja myös äidiltä ja siskoilta tuli sähke .	heiltä	1	Abl
Selvät ja fiksut pukevat muutenkin liivit päälleen , mutta moniko humalapäissään muistaa ne ?	moniko	9	Nom
Tasavallan presidentin virka-asunto Mäntyniemi tarjoaa yllätyksen toisensa jälkeen .	toisensa	6	Gen
EU:n ja Tunisian assosiaationeuvosto , joka ottaa huomioon Euroopan yhteisöjen ja niiden jäsenvaltioiden sekä Tunisian tasavallan välisestä assosiaatiosta tehdyn Euro–Välimeri-sopimuksen , sekä katsoo seuraavaa :	niiden	11	Gen
Aho ei suostunut sanomaan , kenet pankin johdosta pitäisi erottaa .	kenet	5	Acc
Päävalmentaja ilmaisee asian näin : " Jani tekee mitä haluaa , muut mitä osaavat . "	muut	11	Nom
meiltä meni vähän yli kolme tuntia ennen kuin löysimme hänet .	meiltä	0	Abl
Kullakin jäsenvaltiolla on oikeus jättää tämän asetuksen soveltamisalan ulkopuolelle sellaiset tavarakuljetukseen tarkoitetut tieliikenteen moottoriajoneuvot , joiden hyötykuorma tai suurin sallittu massa kuormattuna on tiettyä rajoitusta pienempi .	Kullakin	0	Ade
Näiden kokousten perusteella komissio päätteli , että vaikka joistakin artikloista vaikuttaisi aiheutuvan ongelmia , ongelmat eivät koske kaikkia jäsenvaltioita .	joistakin	8	Ela
Mikäs meidän muumien on täällä elellessä .	Mikäs	0	Nom
Seminaari antoi kuulijoille hyvän käsityksen siitä , mihin kaikkeen Linux nykyään kykenee ja missä sitä käytetään kaupallisesti .	kaikkeen	8	Ill
Tuolla tavalla olisi meistäkin tullut kuuluisia .	meistäkin	3	Ela
Näin lehdessä ilmoituksen , jolla etsittiin tutkimushenkilöitä Alzheimer-projektiin jollekin Turun yliopiston laitokselle .	jollekin	8	All
Näille viidelle ojennettiin kullekin salmiakkia .	Näille	0	All
Saatteks te selvää tästä ?	tästä	3	Ela
Kuka tuo Virosta ikkunat , ketä tekee ite .	ite	7	Nom
Tuskin kukaan voi vakavissaan väittää , että tilanne olisi enää vuonna 1993 tullut kenelläkään yllättäen .	kenelläkään	13	Ade
Ennen kaikkea oliko hän varmasti tietoinen mitä teki muille .	muille	8	All
Kenellä on paras valmennusjärjestelmä , menestyy .	Kenellä	0	Ade
Voi että tulispa niit lisää ,	niit	3	Par
Jos sana on vanhentunut , leikillinen tai halventava , milloin se on mitäkin niistä ?	mitäkin	12	Par
Samoin , jos jaksaisin , luultavasti muistaisin mistä sen ostin .	mistä	7	Ela
Kaikista mieluiten olisin viettänyt päiväni makuupussissa , mutta kun siinä on hieman vaikea kävellä . ;)	Kaikista	0	Ela
Itselleen se tömäytti myös .	Itselleen	0	All
Antaako taloudellinen riippumattomuutemme Neuvostoliitosta meille aikaisempaa vapaammat kädet ja miten EY-maiden mahdollisesti aggressiiviseksikin muotoutuva idänpolitiikka meihin vaikuttaa , ovat avainkysymyksiä .	meihin	15	Ill
Näiden unelmien sivussa , lukion viimeisenä vuotena kaikuisi käytävillä tämä suru-uutinen ; hän oli vienyt henken itseltään , ei kestänyt yksinäisyyttä ja masennusta enää , ja stressi ylioppilaskokeista oli laukaissut tämän vyyhdin pillereiden avulla .	itseltään	16	Abl
Näytössä on molemmissa numeroissa 7 eri osaa , joissa jokaiselle on oma ledi .	jokaiselle	9	All
Annammeko tämän jatkua sanomatta mitään ?	mitään	4	Par
Lisättäköön tähän , että itse asiassa M45 eli Plejadit ( Seulaset ) ovat kirkkain syvän taivaan kohde ( avoin tähtijoukko ) , mutta tähän aikaan en siitä ollut tietoinen .	tähän	1	Ill
Vaihtoehdot ovat Katilla kovin harvassa .	harvassa	4	Ine
Toisessa kuvassa lapset pärskivät vettä toistensa päälle nauraen .	Toisessa	0	Ine
Miltäpä kuulostaisi esimerkiksi italian kielikurssi Italian Salernossa ?	Miltäpä	0	Abl
Ensimmäisen sukupolven Agila oli uudelleen nimetty versio Suzuki Wagon R:stä , jota valmistettiin Japanissa .	jota	11	Par
Tälle paperille painetaan mm. tehtaan toisen omistajan , New York Timesin viikonloppuliite	Tälle	0	All
Minun on sääli häntä .	häntä	3	Par
Meistä voi tulla	Meistä	0	Ela
