Uusissa kasvua ja työllisyyttä koskevissa yhdennetyissä suuntaviivoissa jäsenvaltioita kehotetaan toteuttamaan toimia , joilla parannetaan maahanmuuttajien työllisyyttä .	joilla	12	Ade
Sen jälkeen kun homoja muutenkin alkoi telkkarissa olla ihan omana itsenään ?	Sen	0	Gen
Monella on jo käytössään GSM-puhelin .	Monella	0	Ade
Senhän olemme jo usein todenneet , että seksistä , sen tavoista ja haluista on vaikeaa keskustella , varsinkin kumppanin kanssa .	Senhän	0	Gen
Miehellä on paljon omaisuutta , joten voi kysyä , onko se osittain tai kokonaan kertynyt riistämällä toisilta .	toisilta	16	Abl
Ni menee tuntikin joka mum mielestä on aika pitkä aika ni jopa tunti yhden otsikon miettimiseen .	mum	4	Gen
Jossakin vaiheessa hän huomasi , että tummalle iholle on erittäin vaikea löytää oikean sävyisiä meikkituotteita .	Jossakin	0	Ine
Itse olen vuosien saatossa osallistunut kahteen kahteen ulkomailla ja moneen Suomessa järjestettyyn kesäyliopistoon .	moneen	9	Ill
Toimintasuunnitelma perustuu 19. ja 20. lokakuuta pidettyyn konferenssiin , jossa käsiteltiin ihmiskaupan torjuntaa sekä siihen liittyviä toimia ja parhaita käytäntöjä Euroopassa ja jonka järjestivät puheenjohtajavaltio Yhdistynyt kuningaskunta , komissio ja Ruotsi .	siihen	14	Ill
Voi olla , että tämä voi olla typerimpiä tapoja lähteä maailmasta , ehkä minulle nauretaan , etten keksinyt parempaakaan kuin jäätyminen kuoliaaksi .	minulle	13	All
Ne saattaa sej jälkee mennä jonnekkit toimistoo istumaa	sej	2	Gen
Hänhän asuu muualla .	Hänhän	0	Nom
Sanoiko hän muuta ?	muuta	2	Par
Ensimmäinen ihminen kenet löysin , oli ikäiseni oloinen nainen .	kenet	2	Acc
- Sinusta ei ole ollut täällä muuta kuin harmia .	Sinusta	1	Ela
Sanoin Jussille , että tulisi mullekin ilmottamaan tämän kirjeen saatuaan , mikäli ei joutuisi välittömästi arestiin .	mullekin	5	All
Liekö vaikka jotakuta ärsyttäisi , tiedä häntä .	jotakuta	2	Par
On täällä ollut pahempiakin tapauksia ja hekin ovat selviytyneet , hoitaja lohdutteli .	hekin	6	Nom
Ei mene kuin muutama päivä kun kuuluu että uusi pääosanesittäjä kiduttaa ohjaajaa , tekee kaiken mahdottomaksi kaikille , on piru .	kaikille	16	All
Häntä riivasi raivoisa mustasukkaisuus .	Häntä	0	Par
Sen avulla saavutetaan tavoite , jonka me kaikki olemme jakaneet alusta alkaen , ja olen tässä yhteydessä pahoillani siitä , että esittelijä Jarzembowski pitää riittämättömänä sitä , mitä siinä on esitetty .	Sen	0	Gen
Ostaisit sä mullekin kahvia .	mullekin	2	All
Osa aidsin aiheuttamaa tyrmistystä on vastuullisuus , joka on äkisti palautettukin ihmisten itsensä kannettavaksi .	itsensä	12	Gen
En mä halua tehdä tätä , mutta ei mulla ole parempiakaan ideoita .	tätä	4	Par
Muutamat jäsenvaltiot näyttävät tulleen neuvotteluihin mukanaan kirjekuori , jossa on muutamia laskelmia , ja kieltäytyneen tekemästä minkäänlaisia myönnytyksiä asettaakseen itselleen realistiset tavoitteet .	itselleen	19	All
Vuonna 2004 niiden keskimääräinen asukaskohtainen BKT oli 72 prosenttia EU:n keskiarvosta , ja useimmissa tapauksissa alhaisempi kuin millään muulla alueella kyseisissä maissa .	muulla	18	Ade
moneen suuntaan aktiivinen	moneen	0	Ill
Varovaisen mutta todenmukaisen arvioni , joka perustuu laserin lailla leikkaavaan tarkkailukykyyni , mukaan 75 % toiseen naiseen liittyvistä riidoista eivät liity millään tavalla mustasukkaisuuteen .	toiseen	15	Ill
Lisäksi muutamilla saarilla esiintyy myös kallio- ja hiekkarantoja .	muutamilla	1	Ade
Kyselyn mukaan sekä Clinton että Obama saisivat kumpikin noin 33 prosenttia demokraattien äänistä ja kolmanneksi tulisi John Edwards , joka saisi kyselyn mukaan 20 prosenttia annettavista äänistä .	kumpikin	7	Nom
Kumpaa katsot mieluummin Prätkähiiriä vai tanssiesitystä .	Kumpaa	0	Par
Ja taatusti en mene Raiviolle puhumaan yhtään mitään .	mitään	7	Par
Tässäkö se muka oli ?	Tässäkö	0	Ine
Tuostahan sinä voit saada vaikka minkälaisen taudin .	Tuostahan	0	Ela
Eurooppalaisten siirtolaisten tulo kuitenkin jatkui ja Te Rauparaha kieltäytyi myymästä heille uusia alueita .	heille	10	All
Näette sen ylläni huomisessa risteilypostauksessa eräässä sovituskuvassa .	eräässä	5	Ine
Pupu hoitaa pihat ja istutukset , mikä vähän kuin vahingossa on jättänyt minulle jäljelle talonmiehen , ylläpitäjän roolin .	minulle	12	All
Sirolalta on itseltään jäänyt huomiotta seikka , että eläin toimii pääasiassa vaistojensa mukaan .	itseltään	2	Abl
Oli jo liian myöhä lähteä ajamaan ryöväreitä takaa ja seuraavan yön lumisade peitti heidän jälkensä .	heidän	13	Gen
Nyt on tästäkin viikonlopusta selvitty !	tästäkin	2	Ela
Seitsemän henkeä jätti käyttämättä hissiä , mutta jokaisessa tapauksessa jättivät koska he nauroivat liian kovaa .	jokaisessa	7	Ine
Sen ilma tuntui tunkkaiselta , hiekkaiselta ja betoniselta .	Sen	0	Gen
Näistä huiputtajista olikin tulossa uuden hännänhuippuyliopiston arvostetuimpia tiedemiehiä , sillä vanhasta otsanryppyihin perustuvasta arvomaailmasta irtautuminen oli jo osoittautunut mahdottomaksi .	Näistä	0	Ela
Kehitetään innovatiivisia lähestymistapoja , joilla estetään syrjintä työmarkkinoilla	joilla	4	Ade
Kumpikaan ehdokkaista ei suostunut suoralta kädeltä mainitsemaan , mitä muutoksia heidän hallitusohjelmaansa on tehtävä vakavan talouskriisin johdosta .	heidän	10	Gen
On meistä itsestämme kiinni , kuinka kauas kantoinen sen antama selviytymisen , unelmien toteuttamisen ja kiitollisuuden tunne on .	itsestämme	2	Ela
Velkojen hoito viivästyy ja velkaongelma pahenee usein yhdestä ja samasta syystä : velka on suomalaiselle häpeä .	samasta	9	Ela
Eräälläkin tuomarityttösellä oli kankaiset tennarit jalassa .	Eräälläkin	0	Ade
Tämä ystävyys oli verrattain nuori , vasta kaksikymmentäviisi vuotta vanha , ensimmäinen solmittu ystävyyssuhde uudessa maassa .	Tämä	0	Nom
Tietenkin kaikella on syynsä .	kaikella	1	Ade
Pannahisen kännykkä oli yön aikana tyhjentynyt , ja kuten monella muullakin , oli Jalmarillakin tapana luottaa tähän nykyajan ihmeeseen herätyskellona .	muullakin	10	Ade
Hän huolestuneena tiedusteli , mahtaisimmeko jaksaa majoittaa heitä niin usein .	heitä	7	Par
Mut et säkään taida tajuta .	säkään	2	Nom
Anja muute kirjotti ni se vaa puhu et hän vois järjestää jotkut pikkujoulut heillä ku hää ei oo koskaa järjestäny mitää pileitä ja hänest ois niiku kivaa niiku sit nähä kaikkia .	hänest	23	Ela
Se kurssi tekisi varmaan hyvää itse kullekin , Kati tuumasi .	kullekin	6	All
jonkinlaista mainosta jollekin	jollekin	2	All
Jommankumman täytyy olla väärässä tai matkia toista .	Jommankumman	0	Gen
Kenellä oli noussut vuokra , kenellä ei .	Kenellä	0	Ade
Heillä ei ole harrastuksia , koska he rakentavat taloa .	Heillä	0	Ade
Jos haluaa että jotain tapahtuu itselle on itse tehtävä jotain .	itselle	5	All
Mutta koko tää ajattelu siis siitä että et on niinku tiukka itsekuri ja tähtää kirjallisesti määrittelemiinsä päämääriin nii eiks tää oo ihan samaa ku se mitä työssä tekee .	samaa	22	Par
Leppoisia välipäiviä itse kullekin ! :)	kullekin	3	All
Mä en tiiä nyt yhtää mitää yhtää mistää	mistää	7	Ela
Suomikin on hänelle mahdollinen asiakas , jos se sitä haluaa .	hänelle	2	All
Sinulla on onnea - paitsi että lupaa ottaa Sinut vastaan hän myös osoittaa lämmintä mielenkiintoa sinun vaiheitasi kohtaan .	Sinut	8	Acc
Siihen on tarkoitus päästä keräämällä yhteen ja asettamalla saataville jo olemassa olevia tietoja sekä tarkastelemalla uudelleen ja analysoimalla olemassa olevia merkityksellisiä tietoja .	Siihen	0	Ill
- Tiiätkö , mää oon kelannu .	mää	3	Nom
Koska olemme itkeneet yhdessä niin monesti , on meillä enää jäljellä suuri rakkaus toisiimme .	toisiimme	13	Ill
Ehkä hänen ihonsa itkee , jonkin hänessä on pystyttävä siihen .	hänessä	6	Ine
Syöhän tätä .	tätä	1	Par
Siellä oli nyt ne kirjalliset ohjeet , tutustutte niihij ja katotaan .	niihij	8	Ill
Tänään kuitenkaan ei uusia asukkaita ollut ilmaantunut , niitä tippui tähän vuodenaikaan harvakseen .	tähän	10	Ill
Rakkauden ja valon täyttämää kevättä Sinulle ! :)	Sinulle	5	All
Tai siis puolirikollinen hullu , joten mitähän se mustasukkaisuus siis edes tarkoittaa .	mitähän	6	Par
Inhimillinen unohdus vai tosi anarkistinen veto , siinäpä pähkinä purtavaksi .	siinäpä	7	Ine
Häntä pelottaa puhua vieraita kieliä .	Häntä	0	Par
On ehkä mahdollista , että lapsena olin nähnyt sellaisen jossain ja tajunnut haluavani samanlaisen .	jossain	9	Ine
“ Niil on eri kello ku mulla ? ”	Niil	1	Ade
Mulla suattaa olla vellinkeittäjä katottuna .	Mulla	0	Ade
Innostui tuosta Perttikin niin , että samalta seisomalta sosiaalitoimistoon meni .	tuosta	1	Ela
Tämä ei ole vain velvollisuus , vaan myös meidän etumme mukaista .	Tämä	0	Nom
Hänelle on tärkeä saavuttaa , rakentaa , valloittaa ja omistaa .	Hänelle	0	All
Tosca haukkui innoissaan kun näki minut ovella .	minut	5	Acc
Refereitä miettiessä ensimmäisenä tuli mieleen Sinut .	Sinut	5	Acc
Eräiden salaliittoteoreetikoiden mukaan kyykkäfinaali oli ns. sopupeli ja johtui ennen kisaa lyödystä ” voittaja järjestää ensi vuoden Festit ” -vedosta .	Eräiden	0	Gen
Ruskistin kyljykset paistinpannulla tilkassa öljyä ( kaksi kyljystä mahtui just ja just ruskistumaan samanaikaisesti isolle pannulle ) + ripsottelin mustapippurirouhetta ja suolaa lihoille ja lisäsin samalle pannulle ruskistumaan omenalohkot ja otin ne sitten lautaselle odottamaan ... .	samalle	25	All
He joutuivat tappiolle ja menettivät alkuperäisen maansa Pohjoissaaren pohjoisessa nurkassa .	He	0	Nom
Kenelle kanava annetaan , on ennen kaikkea poliittinen kysymys .	Kenelle	0	All
Kahtiajaon yhteiskunnassa tätä keskustelua käydään liian vähän .	tätä	2	Par
on vaikea saadas selvää kuvaa siitä , siitäkään .	siitäkään	7	Ela
meillä voisi olla tarve tukea ja kannustaa sitä , mikä meidän suomalaisessa kulttuurissamme on hyvää , niin filmissä kuin kirjallisuudessa kuin paljossa muussakin .	muussakin	22	Ine
Start- ja stop-toiminnot laitan myöhemmin saman nappulan alle .	saman	5	Gen
Ottamatta tässä huomioon kansallisten yhteyspisteiden varsinaiseen perustamiseen liittyviä henkilöstö- , toimitila- ja tietotekniikkajärjestelyitä , EMN:n toiminnan keskeiset tulokset vuodesta 2002 aina tähän hetkeen voidaan noiden periaatteiden pohjalta esittää seuraavasti :	tähän	21	Ill
Ma oon ollu , sillon tällön tollasessa , erilaisis tilaisuuksis niin ku säestämässä , jotai yksillaulajaa tai , sellasta , esimerkiks jossai häissä mä oon olluj ja , tommosissa	jotai	14	Par
Teen erilaisia office concepteja meidän tälle asiakas " firmalle " , kivaa ja mielenkiintoista , mutta aika työlästä :)	tälle	5	All
ICT-talossa pidettiin samaan aikaan myös ICT Kampus -rekrytointitapahtuma , joka oli keskittynyt erityisesti kesätöiden tarjontaan .	samaan	2	Ill
Alakomitea arvioi jäljempänä luetelluilla aloilla tapahtunutta edistystä , tarkastelee niillä mahdollisesti ilmeneviä ongelmia ja ehdottaa toimia niiden ratkaisemiseksi .	niillä	9	Ade
Hän oli kaikkensa yrittänyt .	kaikkensa	2	Gen
mä pidin itteeni semmosena fiksuna ja sen takia oli pää auki aina ja joka paikassa ja .	itteeni	2	Par
( 9 ) Vaikka on tunnustettua , että EKP:n perussäännön 34.1 artiklan nojalla antamissa asetuksissa ei anneta mitään oikeuksia eikä aseteta mitään velvollisuuksia rahaliittoon osallistumattomille jäsenvaltioille , perussäännön 5 artikla koskee sekä rahaliittoon osallistuvia että siihen osallistumattomia jäsenvaltioita .	siihen	35	Ill
Tämäkö se paikka on ?	Tämäkö	0	Nom
Saanen kysyä sinulta seuraavat kysymykset : - -	sinulta	2	Abl
Heille taputettiin itselleenkin .	itselleenkin	2	All
Molemmissa tulee samanlainen olo , hiukan ahdistava ja kalsea , ja sitä pitää ponnistella viihtyäkseen .	Molemmissa	0	Ine
Josta sinä aina sanoit , että Täti Vihreä .	Josta	0	Ela
Ainoa ovi on salin takapäässä , joten luennolta on helppo poistua .	Ainoa	0	Nom
Sit meil oli kauheen mukavaa .	meil	1	Ade
Siihenkö sitä nyt ollaan rakastuttu , kaupungin kauneimpaan naiseen ?	Siihenkö	0	Ill
− Risto Lammintausta on monellakin tavalla ainutlaatuinen ihminen tällä alalla Suomessa .	monellakin	4	Ade
Seminaari antoi kuulijoille hyvän käsityksen siitä , mihin kaikkeen Linux nykyään kykenee ja missä sitä käytetään kaupallisesti .	mihin	7	Ill
Voin nähdä sieluni silmin kuinka äidin musta , pitkä tukka hulmuaa tuulessa ja hän hymyilee kääntyessään katsomaan minua .	minua	17	Par
Kenties jotakuta kiinnostaa tämän takana oleva simppeli koodikin , joten laitetaan näytille kun kerta ohjelmointi-kategoriaan tämän postaan .	jotakuta	1	Par
Jos joku kenet milloin jättää , niin se olen kyllä minä .	kenet	2	Acc
Kuule kun tota mä löysin kaks tämmöst perunkirjaa jos näis nyt olis sinne pankkii mitkä mä oon ottanu joskus jäljen- yhes jäljentämös	näis	9	Ine
Kenellekään siitä ei kehdannut kertoa , ei edes äidille .	Kenellekään	0	All
Samoihin aikoihin hän myös tapasi Stanley Donwoodin , taiteilijan joka on vuodesta 1994 ollut tärkeä osa Radioheadin albumien ja singlejen kansien ulkoasujen teossa .	Samoihin	0	Ill
En mä sua huijais , niinku en ketää muutakaan . ”	ketää	7	Par
No minäkös siihen sanomaan , ettei kukaan huoli tuon näköistä mihinkään .	siihen	2	Ill
Joihinkin anisviinoihin lisätään sokeria valmistusvaiheessa .	Joihinkin	0	Ill
Älä sie märise - met kaajoimme kolmeen havumajaan ainakin tusinan ukkoja .	met	4	Nom
Heille itselleenkin taputettiin .	itselleenkin	1	All
ajatus oli sekö , että aloitetaan kysymyksistä ?	sekö	2	Nom
Kummastakin maasta tuli näin itsenäinen .	Kummastakin	0	Ela
Kenellä oli noussut vuokra , kenellä ei .	kenellä	5	Ade
Vaikuttaa myös siltä , että moottori sisäänajauduttuaan kunnolla parani .	siltä	2	Abl
Useita kertoja viikossa , jopa päivässä , olen ajatellut , että tästä kirjoitan ja tämän muistan varmasti , mutta tietokoneen ääressä inspiraationi katoaa ja huomaankin kirjoittelevani turhia viestejä samoille typerille foorumeille .	samoille	28	All
On minultakin kysytty , miten voin ampua jonkun viattoman luontokappaleen .	minultakin	1	Abl
Sinua on hauska kiduttaa , mutta saat syyttää itseäsi .	Sinua	0	Par
Olisi pitänyt löytää vanha tukeva juuttikankainen säkki , joita ei varmaan enää edes valmisteta	joita	8	Par
Marjaisan herkun voi tehdä muistakin marjoista kuin mustikasta ... .	muistakin	4	Ela
Nämä tehtävät on määritelty perussäännössä ja eräissä tapauksissa perustamissopimuksen 107 artiklan 6 kohdassa tarkoitetuissa neuvoston säännöksissä .	eräissä	6	Ine
Jos oli , kysyi tämä heiltä , osaisivatko he pelata biljardia .	heiltä	5	Abl
- Ettei sinulla ole jotakin mikä kuuluu niille .	jotakin	4	Par
Myös avioeron hän hyväksyy , jos ei kerran tule toinen toisensa kanssa juttuun	toisensa	10	Gen
" Tuohan on imartelevaa " , Nadja Pyykkö vastaa .	Tuohan	1	Nom
Sitten nainen alkoi ylittää katua , varoen tarkoin ettei astuisi muille kuin valkoisille viivoille .	muille	10	All
Niihin osallistuvat lukiolaiset saavat opintopistehyvityksen kurssista , mikäli tulevat yliopistoon opiskelemaan .	Niihin	0	Ill
Me emme saaneet kuulla tästä Kallelta mitään .	mitään	6	Par
Poika oli pelannut viime lauantaina ystävineen läpi yön uutta Wrath of the Lich King -lisäosaa , joka on Svenska Dagbladetin mukaan ollut huolenaihe muidenkin pelaajien vanhemmille .	muidenkin	23	Gen
Toki tykkään joskus pienestä luksuksesta , mutta kaikkein tärkeintä hyvinvoinnilleni on se , että saan tehdä elämässä niitä asioita , jotka herättävät minussa onnen tunteita .	minussa	22	Ine
silt on tästä pudonnu tää osa mis on sen nimi	mis	6	Ine
Jos yhtään tunnen Sinua .	Sinua	3	Par
Savugeneraattori on yksinkertaisimmillaan eräissä moottoritorpedoveneissä ; venäläiset kehittivät erittäin suositun keinon : he laskivat erillisestä putkistosta raakaa naftaa torpedoveneen kuumiin pakoputkiin , jolloin nafta kiehui ja muodosti paksua savua .	eräissä	3	Ine
Myyntipalvelumme kunnia-asia on auttaa Sinua toteuttamaan yksilöllinen , juuri sinun näköisesi juhlatilaisuus .	Sinua	4	Par
Häpeä voi saada ihmisen kieltämään seksuaaliset tarpeensa , kirjoittaa Heidi Lindgren eräässä lehtiartikkelissa .	eräässä	11	Ine
Tutkimustulosten perusteella suositellaan näiden tuotteiden käytön vähentämistä , ylilääkäri sanoo Taloussanomille .	näiden	3	Gen
Itse neljänkympin kriisissä , senhän näki päältä .	senhän	4	Gen
Siitä mitä on arvovapaa opetus ja tutkimus voisi keskustella paljonkin	Siitä	0	Ela
Heille ei annettu etukäteen mitään tietoa irtisanomissuunnitelmista .	Heille	0	All
ku mä kävin neuvonnast kysyy ni se sano et kysy tolta	tolta	10	Abl
Eräät yrittävät hankkia lisäansiota esimerkiksi taksinkuljettajina tai vartiointitehtävissä .	Eräät	0	Nom
- Mut mee Janican tai Eetvartin luokse , nekin tykkää Killersistä ...	nekin	8	Nom
Kuule tota liikeniskö teiltä yhtä mankkaa vähäks aikaa	teiltä	3	Abl
Mäkin muistin sut heti .	sut	2	Acc
En siis kuulu niihin , joiden kuusi lentää pihalle vasta sitten , kun siinä ei ole jäljellä yhtään neulasta …	niihin	3	Ill
Onneksi olin tästä tietoinen , joten vältyin pettymykseltä .	tästä	2	Ela
Välillä taantuma laskee tunnelmaa , mutta uutteralla työllähän siitäkin selvitään .	siitäkin	8	Ela
Vuosittain professorit kokoontuivat keskinäiseen tuloskeskusteluun , jossa he mittasivat toistensa otsaryppyjen syvyyttä ja sitten taputtivat kohteliaasti niille , joilla oli kaikkein syvimmät rypyt .	joilla	18	Ade
Siksi minusta ei tullut sirkusihmistä , vaan näyttelijä .	minusta	1	Ela
Tämä tarkoittaa sitä , että tätä kysymystä koskevan sovittelumenettelyn esteet voitiin poistaa .	tätä	5	Par
Mie en tie missä asti se ois sitte lähin linja-autopysäkki .	Mie	0	Nom
Monien merkkien mukaan tunturisopulit ovat syksyllä lähdössä vaellukselle , ja silloin Pohjois-Lappi kuhisee sopuleita .	Monien	0	Gen
Katsokaas kun minun täytyy aina aamulääkkeiden jälkeen tehdä kävelylenkki ; lääkäri on määrännyt .	minun	2	Gen
Heinonen valotti ritarisotilaiden elämää suhteessa keskiaikaisiin ritaritarinoihin , jotka edelleen elävät osana eurooppalaista tarinaperinnettä .	jotka	8	Nom
Valmet on valmistanut tähän asti lähes puolet Calibroista .	tähän	3	Ill
- Ei kummankaan tarvitse olla väärässä .	kummankaan	2	Gen
Juuri kun olin astumassa tukevalle lattialle takaisin , sain huomata tuon venäläisen yrittävän työntää minua hissikuiluun kokonaan .	minua	14	Par
Oma miehenikin tarkisti tämän kirjoituksen ja totesi minulle ykskantaan että ” olen eri mieltä ” .	minulle	7	All
Kyllä minä ymmärrän , että sinä laihtua haluat , mutta en sitä , miksi siitä pitää amerikkalaisille maksaa .	sinä	5	Nom
Että niin rappioitunut ja alkoholisoitunut elämänpakenija voi saada elätettyä itsensä runoillaan ja luennoillaan , mutta minä , näennäisesti pirteä ja selväjärkinen , en saa mitään aikaiseksi .	mitään	24	Par
Mitä varte siun täytyy periaatteita kannattaa tommosissa .	siun	2	Gen
Annetaan ihmisille esim. tiedotuskampanjoiden , näyttelyjen ja monikulttuuristen tapahtumien välityksellä enemmän tietoja maahanmuuttajista , jotta heidät hyväksytään paremmin yhteiskunnassa	heidät	15	Acc
Sen jälkeen yrityksen pitoaika on noin 4-8 vuotta , jonka jälkeen kuluu vielä puolesta vuodesta vuoteen ns. exit -vaiheeseen , Routila sanoi .	Sen	0	Gen
Merinäköala on oltava , ei odotuksessa olisi muuten mitään mieltä .	mitään	8	Par
Tuostahan sinä voit saada vaikka minkälaisen taudin .	Tuostahan	0	Ela
Suhteellisen absurdia oli lukea aamubussissa metro-lehdestä juttua tapahtumasta , josta oli vasta tulossa kotiin :D	josta	9	Ela
Kansa on opetettu luottamaan viranomaisiin , heiltä saa avun tilanteessa kuin tilanteessa .	heiltä	6	Abl
Oletetaan , että minulla on se mitä sinä ja ne muut haluavat .	minulla	3	Ade
Polkupyörällä tarkoitetaan yhden tai useamman henkilön tai tavaran kuljettamiseen rakennettua , vähintään kaksipyöräistä , polkimin tai käsikammin varustettua moottoritonta ajoneuvoa .	useamman	4	Gen
Kun kassit saatiin kuosiin ja ihmisiä alkoi virrata laivaan , pystytimme Mintun kanssa ilmoittautumispisteen ja jakelimme lahjakasseja kaikille .	kaikille	17	All
Suomen ja Kiinan kahdenvälinen kauppa on hyvä esimerkki siitä , kuinka kaksi toisiaan täydentävää taloutta voi hyötyä toinen toisestaan .	toisestaan	18	Ela
Tuossa näkyy sinutkin .	sinutkin	2	Acc
Työn tulokset ratkaisisivat sen , mitä kenellekin maksetaan palkkaa .	kenellekin	6	All
Että siitäs saisin .	siitäs	1	Ela
Suomen ja Kiinan kahdenvälinen kauppa on hyvä esimerkki siitä , kuinka kaksi toisiaan täydentävää taloutta voi hyötyä toinen toisestaan .	toisiaan	12	Par
” Vaan jonkunhan nekin työt on tehtävä . ”	jonkunhan	2	Gen
Sinua ei näkynyt Kekkosen hautajaisissa .	Sinua	0	Par
Järjestetään eritasoisia koulutuspaketteja , joissa otetaan huomioon erilaiset koulutustaustat sekä aiemmat tiedot vastaanottavasta valtiosta	joissa	4	Ine
jotta he voivat nämä edellytykset täyttää , heidän persoonansa täytyy olla jakautunut .	heidän	7	Gen
Yksi ainoa kysymys : Kenellä on positiivisia muistoja hyttysistä ?	Kenellä	4	Ade
Suomalaiset taitavat olla vähän kateellisia meille , mutta olkoot vain , siihen heillä on meidän lupa !	meille	5	All
Mistä tiedät , tuleeko hän jo tänään ?	Mistä	0	Ela
Yhdysvallat juhli vankien vapautusta heidän laskeuduttua Kaliforniaan Los Angelesin lähistöllä Burbankin lentokentälle .	heidän	4	Gen
1. Monille tiedekuntamme opiskelijoille rakkaan SPSS-ohjelmiston käyttökurssi : kaksi tuntia luennointia , kahdeksan tuntia harjoituksia .	Monille	1	All
Mieheni ei laita koskaan tomaatteja ja kurkkuja samalle leivälle .	samalle	7	All
Kulttuurin evoluutio ja aivojen evoluutio kulkivat rinta rinnan , kumpikin toistaan edistäen .	toistaan	10	Par
Jos hän niin olisi tehnyt näiden 32 julkisuuden vuoden aikana , häntä ei enää olisi .	häntä	11	Par
Tähänkin on varmasti jäsenvaltioissa varauksia , jotka halutaan kiertää tällä väliaikaisella sopimuksella .	Tähänkin	0	Ill
Sen massa on 1,9 Maan massaa .	Sen	0	Gen
Kysyin heiltä , olihan uimarenkaat mukana .	heiltä	1	Abl
Sitten heristelin sormeani ja varoittelin Doraa , ettei hänelle jää tästä ajasta muuta muistoa kuin kauhea krapula .	hänelle	8	All
Tuolle värille on oma sanansa , tyttö miettii , muttei ihan tavoita sitä .	Tuolle	0	All
Sanoisin , etten tiedä mitään ärsyttävämpää kuin se , että joku kuvaa minua , vaikka nimenomaan olen sanonut , etten halua naamaani kameran eteen . :/	minua	12	Par
Mutta jotenkin tämä sopi vain minulle , halusin että tunnen kuinka elintoimintoni hiipuvat .	minulle	5	All
Äiti puhui minulle aina saksaa .	minulle	2	All
Mikään jäsenvaltio ei ole ratifioinut yleissopimusta .	Mikään	0	Nom
Hyvää uutta vuotta Sinulle ! :)	Sinulle	3	All
Ja sitte se tietysti semmoinen iso pullo ja sitä olisi tietysti riittänyt ja meille että ottakaa nyt että ei ku ei ole kiire ja muuta .	muuta	24	Par
Te , kansliapäällikkö Rauta , olette häpäissyt itsenne .	itsenne	7	Gen
Enimmäkseen hän törmää nuoriin perheisiin , joissa ei ole ennen lapsen tuloa tehty ruokaa edes itselle .	itselle	15	All
s oli kuulemma- mä en ite huamannu mut se oli kuulemma Ruatsis ja Ruatsin laival ni ihan sairaasti juonu .	s	0	Nom
Tuosta lukutaidon asteesta niin minä lisäisin siihen vielä löylyä .	Tuosta	0	Ela
Olen juuri kuullut uutisen , jonka mukaan pääoppositiopuolue vetäytyy petosepäilyjen tutkimisprosessista , koska väitteiden mukaan , sen edustajia on estetty osallistumasta siihen .	siihen	21	Ill
Mitä paskaa sä jauhat ?	Mitä	0	Par
meiän täytyy itte vahtia noita saatanan osakkeita	itte	2	Nom
Näistä opettajista riippuvaisia perheitä uhkaa todellakin köyhyys .	Näistä	0	Ela
Minussa ei ole sijaa arktisuudelle sen paremmin kuin arkisuudellekaan .	Minussa	0	Ine
Joillakin tytöistä vannehame vaihtuu toiseksi hetkessä .	Joillakin	0	Ade
Toisaalta myös pienet ja lyhyet kurssit voivat olla sisällöltään tarpeellisia , ja suppeudestaan huolimatta niistäkin on pakko antaa jotain pisteitä .	niistäkin	14	Ela
meiltä on pantu sähköt poikki .	meiltä	0	Abl
Simo kommentoi sitä hiljaa vierustoverille : ” Ei tossa ole mitään järkeä . ”	tossa	8	Ine
Kaikille maksettaisiin ensin 2,4 prosentin korotus tai vähintään 200 markkaa lisää kuukaudessa .	Kaikille	0	All
Mutta minun ei olisi tarvinnut huolehtia , sillä hän ei enää nostanut katsettaan minuun , siirteli vain jalkojaan pitkin hiekkaa ja katseli sitä melko lumoutuneena .	minuun	13	Ill
Toivottavasti olen väärässä , mutta vaikuttaa siltä , että uusimmissa kansainvälisen yhteisön päätöksissä Iranin johdon sallitaan edelleen toimia oman mielensä mukaan .	siltä	6	Abl
Niin että virtaus oli varmasti itsestä poispäin .	itsestä	5	Ela
Valmet on valmistanut tähänkin asti lähes puolet Calibroista .	tähänkin	3	Ill
Tai oikeastaan ihmisten typeryys , tietämättömyys , välipitämättömyys ja laiskuus , joka niihin liittyy .	niihin	12	Ill
Sit se rupes kattoon et mikäs se tuolla lihatiskil oj jossei heidän Ville heh hi hi kissa istu siel lihatiski ääressä heh katto silmät ymmyrkäisinä kanoja grillissä	mikäs	5	Nom
me teemme kaikkemme , ettei niin tapahdu .	kaikkemme	2	Gen
Samat aiheet toistuivat myös kehittämisehdotuksissa , mikä kertoo uuden tutkinnon asiakaskunnan erilaisista koulutuskokemuksista ja -odotuksista sekä koulutusohjelmien tasoeroista : jossain on onnistuttu hyvin , toisaalla on vielä kehitettävää .	Samat	0	Nom
Sinulle minä joka puhun olen sinä .	Sinulle	0	All
