Hänessä on jotain outoa .	Hänessä	0	Ine
Muutamat jäsenvaltiot näyttävät tulleen neuvotteluihin mukanaan kirjekuori , jossa on muutamia laskelmia , ja kieltäytyneen tekemästä minkäänlaisia myönnytyksiä asettaakseen itselleen realistiset tavoitteet .	Muutamat	0	Nom
Hän on vuosilomalla , ja minun ymmärtääkseni vielä jossain etelässä .	minun	5	Gen
Hän haukkui miehiä siihen malliin , että välillä tuntui olevan syytetyn penkillä kaikkien feministien huohottaessa niskaan .	kaikkien	12	Gen
Ei sen puoleen , etteikö minulla olisi ollut omia näkemyksiä .	minulla	5	Ade
ku mä kävin neuvonnast kysyy ni se sano et kysy tolta	tolta	10	Abl
Siitä vain läksyjä lukemaan .	Siitä	0	Ela
Hyvinvointi on sittenkin aika paljon itsestä kiinni , Rauramo pohtii .	itsestä	5	Ela
Molemmat emot huolehtivat poikasista , jotka ovat pesäpakoisia .	jotka	5	Nom
mihil lien ne myyjät männy	mihil	0	Ill
Millä te Australiassa eläisitte ?	Millä	0	Ade
Toisilleen he eivät asiaa kertoneet .	Toisilleen	0	All
toisen pääl ei voi nukkuu ollenkaa ku se pitää nii kauheeta metelii	toisen	0	Gen
Emme voi sysätä vastuutamme muille , sillä asettuessaan ehdokkaaksi Euroopan parlamenttivaaleissa jokainen meistä otti tehtävänsä vapaaehtoisesti vastaan .	muille	4	All
Robert I osallistui veljensä Ludvigin seurassa seitsemännelle ristiretkelle ja sai surmansa eräässä hyökkäyksessa Mansourahin linnoitusta vastaan vuonna 1250 .	eräässä	11	Ine
Meillä oli loukkaantuneita pelaajia ja moni ajatteli vain omaa tulevaisuuttaan pelaajana tässäkin turnauksessa .	tässäkin	11	Ine
Ja mikäs on silloin tällöin matkustaessa , kun on löytänyt rinnalleen miehen , joka antaa vaimolleen runsaasti vapautta .	mikäs	1	Nom
Sit meil oli kauheen mukavaa .	meil	1	Ade
Kyllä se hyvin meni , vaikka kyllä aina laulaa hiljempaa kun muut kuuntelee takana .	muut	11	Nom
En usko , että kenelläkään oli mielessä 2-1 maalin jälkeen , että matsi oli selvä .	kenelläkään	4	Ade
Me laskimme ne vieressä kuohuvaan koskeen , josta uskoin niiden matkaavan aina maailman ääriin asti .	Me	0	Nom
eikä hän pitäisi pahana vaikka omatkin lapset tekisivät saman valinnan .	saman	8	Gen
Kenen kanssa sä olet ?	Kenen	0	Gen
Ensinnäkin kansallisten yhteyspisteiden oikeudellisessa asemassa ja erikoistumisaloissa ja niiden käyttöön annetuissa henkilöstö- ja rahoitusresursseissa sekä teknisissä laitteissa esiintyy huomattavaa kirjavuutta , joten yhteyspisteiden sitoutumisasteet ovat myös erilaisia .	niiden	8	Gen
Käännyin takaisin sinne mistä olin tullut , ja huomasin toisessakin päässä , ettei sielläkään ollut ovea .	toisessakin	9	Ine
Sinähän osaat jo sen ulkoa .	Sinähän	0	Nom
Häntä kuulusteltiin sisäpiiritiedon väärinkäytöstä Saunalahden osakkeilla vuonna 2005 .	Häntä	0	Par
Täytyy osaa eka tulkita sitä oikein et voi tajuu mist on kyse .	mist	9	Ela
Komissio on ehdottanut , että tähän uuteen asetukseen sisällytettäisiin useita ehdotuksia , joilla muutettaisiin huomattavasti voimassa olevaa aikaisempaa asetusta .	tähän	5	Ill
Olisin erittäin tyytyväinen , jos saisimme täällä aikaan uuden arvion , jossa tuotaisiin esiin paljon enemmän kuin vain ne asiat , joita olemme käsitelleet tähän mennessä .	tähän	24	Ill
Miksi emme hae itsellemme sitä nautintoa , jota kaipaamme ?	itsellemme	3	All
Haluan myös antaa hänelle tunnustusta siitä tehokkaasta tavasta , jolla hän on etsinyt teollisuuden mielipiteitä ja myös ottanut niistä vaikutteita , mikä on mielestäni järkevää .	hänelle	3	All
Sen sijaan ruohonpäristäjän merkitystä ei olekaan enää niin helppo arvata .	Sen	0	Gen
Ensimmäinen autolasti saapui oikeaoppisesti ajoissa paikalle , mutta sai odottaa toista , jonka navigaattori ei ollut aivan ammattitasoa .	toista	10	Par
Minun täytyy mennä	Minun	0	Gen
Mitäpä se mulle kuuluu .	Mitäpä	0	Par
Yhtäkään ei jäänyt myymättä , halvin maksoi 16_000 mk plus alv:n .	Yhtäkään	0	Par
Outokummun Magnets Oy:llä on ollut enemmän tilauksia kuin tehdas on voinut ottaa vastaan tähän mennessä .	tähän	13	Ill
Sinäpä sen sanoit .	Sinäpä	0	Nom
Sulla ittelläs mittään olluk kus sä tähän tulit .	mittään	2	Par
Hyvin harvat ovat kiinnostuneita hänen teoriastaan .	harvat	1	Nom
Ymmärsin hyvin häne näkökulman , varsinkin kun ite saatoin karannutta lehmää mutaisissa saappaissa , joiden käytöstä yhteiseksi hyödyksi minua luultavasti jopa nuhdeltaisiin .	häne	2	Gen
Jossaki vaiheessa sillon ku ma olin kansakoulussa ni , sekä muv veljeni että minä nin , meill oli , koulum puolesta semmonen , me osallistuttiin semmoseen koulupuutarhahommaan ,	meill	16	Ade
Miksi pitää kiinni kenestäkään , kun myöhemmin pakotetaan kuitenkin päästämään irti ?	kenestäkään	3	Ela
Valinta miljoonien lauseiden joukosta on minun tekoni .	minun	5	Gen
Pysykää toisistanne erillään .	toisistanne	1	Ela
Mitä sitten mahdolliseen ydinvoiman lisärakentamiseen tulee , viimeisimpien kokemusten läntisestä naapurimaastamme Ruotsista tulisi antaa itse kullekin ajattelemisen aihetta .	kullekin	15	All
Minut valtasi lämmin ja rauhallinen olo .	Minut	0	Acc
( 5 ) toissijaisuusperiaatteen mukaisesti yhteisten tilastostandardien laatiminen yhdenmukaisten tietojen tuottamiseksi on toimintaa , joka voidaan toteuttaa tehokkaasti ainoastaan yhteisötasolla , vaikka tiedot kerätään kussakin jäsenvaltiossa virallisten tilastojen laatimisesta vastaavien virastojen ja laitosten johdolla ,	kussakin	24	Ine
Anja muute kirjotti ni se vaa puhu et hän vois järjestää jotkut pikkujoulut heillä ku hää ei oo koskaa järjestäny mitää pileitä ja hänest ois niiku kivaa niiku sit nähä kaikkia .	heillä	13	Ade
On ensiarvoisen tärkeää , että etiopialaisten odotukset vaalitulosten oikeellisuudesta toteutuvat , ja vaalitarkkailuvaltuuskunta tekee kaikkensa varmistaakseen , että näin tapahtuu .	kaikkensa	14	Gen
Niillä pesii useita lajeja , mm. uhanalaisia kuikkia ja selkälokkeja .	Niillä	0	Ade
À eli à ( a ja gravis ) on ranskankielisestä prepositiosta lainattu tapa merkitä kappalehintaa tai muuta yksikkökohtaisesti laskettavaa ominaisuutta .	muuta	16	Par
Mul on tota nää on ollu kaikki tästä näi mitä nytte mä sain semmosta rasvaa nii nää on ollu kaikki ihan punasena tästä .	Mul	0	Ade
Mullahan oli muuten älyttömän upeet soittajatkin tällä levyllä .	Mullahan	0	Ade
Monille riittää , että jonkin asian takana on gallupin mukaan 51 prosenttia kansalaisista .	Monille	0	All
Lomaa meillä on .	meillä	1	Ade
Jälleen parisataa sivua tarinaa ihmelapsesta , jolla on kympin keskiarvot , joka juoksee rajun jätkän vauhdilla pikamatkoja kuin Zola Budd konsanaan .	jolla	6	Ade
suomalainen graniitti on se perustus , jolta hänen presidentin virka-asuntonsa kohoaa .	jolta	6	Abl
Oli kolmosluokan ensimmäinen päivä , aurinko oli kirkas ja meillä molemmilla oli uudet hienot shortsit ja lenkkarit , niillä olisi hyvä pelata jalkapalloa välitunneilla .	molemmilla	10	Ade
Sanoi : ” olisimme tämänkin matkan hinnalla saaneet käsirahan keskuslukitukseen ” .	tämänkin	4	Gen
Miltähän tuntuisi jos olisi oma siivooja	Miltähän	0	Abl
EU:n kahdenvälisten viisumisopimusten yhtenä tavoitteena on ilman muuta kuitenkin oltava , että helpotetaan kaikkien liikkuvuutta , eikä ainoastaan tiettyjen ryhmien liikkumista .	kaikkien	13	Gen
Liikeniskö teiltä yhtä mankkaa vähäks aikaa ?	teiltä	1	Abl
Niillä on se luulo , ettei niiden tartte maksaa velkojaan eikä mitään .	Niillä	0	Ade
se oli parasta mitä minulle saattoi tapahtua .	minulle	4	All
Jossakin tilaisuudessa oli naisille ja miehille eri kakut , ja miehet saivat kerrankin kokea millaista on olla syrjityssä asemassa .	Jossakin	0	Ine
Sen arvoitukset avautuvat myöhemmin .	Sen	0	Gen
Minun on ikävä häntä .	häntä	3	Par
kuka tahansa voi tilata sähkönsä keneltä tahtoo .	keneltä	5	Abl
Mulla on kylmä	Mulla	0	Ade
Kussakin alakomitean kokouksessa voidaan käsitellä yhtä , useampaa tai kaikkia edellä luetelluista aloista .	Kussakin	0	Ine
Siit mun piti sulle sanookki et me otettiin se .	Siit	0	Ela
Häntä ilahdutti erityisesti ajeluun osallistunut Volvo BV 544 , jollaisen hän itse oli omistanut 50-luvulla .	Häntä	0	Par
Mut et sellaist ihmisist mist sä näät niinku et , et ne tykkää susta ni sellasten kanssa on hirvee helppo olla	mist	4	Ela
Teille olisi puhelu .	Teille	0	All
Teen näin varmistaakseni sen , ettei Euroopan unionin tarvitse puuttua asioihin seuraavan kerran , kun jollakin suurella eurooppalaisella joella tapahtuu onnettomuus , koska näin voi tapahtua , ellemme laajenna kuluttajansuojalainsäädäntöä koskemaan myös tätä alaa .	jollakin	15	Ade
Eikä hänen pitäisi verrata tätä turhautumisen tunnetta siihen , jota hän tuntee seistessään lähellä rakastaan , mutta hän tekee niin .	jota	9	Par
Kolmanneksi komissio on suhtautunut täysin välinpitämättömästi näiden ihmisten ahdinkoon .	näiden	6	Gen
Säädökset kieltävät meiltä asiaan puuttumisen	meiltä	2	Abl
Mieliala kohoaa , päivävireys paranee ja koko olo kohentuu , joiltakin katoavat kesäksi kilotkin .	joiltakin	10	Abl
a ) aiheuttaa konkreettisesti tai muulla tavalla vakavaa häiriötä tavaroiden vapaalle liikkuvuudelle estämällä , viivyttämällä tai hankaloittamalla niiden tuontia jäsenvaltioon , niiden vientiä jäsenvaltiosta tai niiden kuljettamista jäsenvaltion kautta ,	muulla	5	Ade
Ei mutta kato että eihän se nyt sua nyt aivan huali näännyttää yhtä ihmistä .	sua	7	Par
" Requiem " on siitä erikoinen , että Tabucchi on tehnyt sen portugaliksi ( 1991 ) ja käännättänyt muilla italiaksi ( 1992 ) .	muilla	18	Ade
Joku kaunis päivä , ehkä päivä 76 tai 93 , hän pyytää sinua ystäväksi ja suostut , odotat häntä aina koneella ja keksit etukäteen mitä sanoisit hänelle .	sinua	12	Par
Vapautusta edeltäneinä kuukausina hän eli väärän nimen turvin eräässä eteläisen Belgian pienessä kylässä .	eräässä	8	Ine
Avauspäivän toritapahtumaan oli leivottu maailman suurin karjalanpiirakka , jolla oli mittaa 45 metriä .	jolla	8	Ade
Koirat antavat itsestään vieraalle varsin susimaisen vaikutelman kiiluvine silmineen .	itsestään	2	Ela
investointi maksaa itsensä takaisin	itsensä	2	Gen
Mitä aiot tehdä ?	Mitä	0	Par
Sitäkin on sopiva hetki miettiä , miten me kehitämme edunvalvontaamme .	Sitäkin	0	Par
Kansliapäällikkö halveksi miestä koko loppuikänsä luonnehtien häntä kansliapäällikköaikansa tyhmimmäksi oikeusministeriksi .	häntä	6	Par
Eikä tänään must ollu niin hirvittävän kuumaa ku -- ainakaan nyt illalla	must	2	Ela
Niillä on se luulo , ettei niiden tartte maksaa velkojaan eikä mitään .	niiden	6	Gen
Itse tehty jäätelö ei välttämättä tule halvemmaksi kuin ostettu , mutta siihen saa taatusti mieleisensä maut .	siihen	11	Ill
Hyvinvointi on sittenkin aika paljon itsestä kiinni , Rauramo pohtii .	itsestä	5	Ela
Siitäkin huomasi , että hän ei ollut tosi mies .	Siitäkin	0	Ela
Perustetaan kansallisia ohjelmia , joilla kaksisuuntainen lähestymistapa pannaan täytäntöön	joilla	4	Ade
Uniaika on läsnä joka hetki : se on täysin toinen todellisuuden taso , joka on olemassa limittäin ihmisten kosmoksen kanssa .	toinen	9	Nom
minun ansiostani nämä kissat elävät .	minun	0	Gen
Hän kätteli minut	minut	2	Acc
Jonkun täytyi rikkoa ne , että ihmiset osaisivat elää , koska se taito on täysin unohtunut .	Jonkun	0	Gen
Alue oli Palestiinan arabien asuttama , ja nämä ajettiin käydyssä sodassa pois kodeistaan .	nämä	7	Nom
oltais haluttuk kammatakkim poikaa mut poika ei siitäkään tykänny .	siitäkään	7	Ela
Miksi niin moni mies kertoo , kuinka ” se makasi kuin lahna , ei koskettanut minun kalua tai mitään muutakaan paikkaa , se odotti vain valmista , ei edes suudellut ” .	minun	15	Gen
Tämäkin päätellään nokkelasti − teatteri .	Tämäkin	0	Nom
Jeltsinin uusi arvovalta tuli näkyviin tavasta , jolla hän pani järjestykseen kokousta alkupäivät johtaneen Vitali Kazakovin .	jolla	7	Ade
Varkaat ovat niin taitavia , etteivät uhrit useinkaan edes huomaa , kun heiltä häviää pankkikortti automaatilla asioinnin yhteydessä .	heiltä	12	Abl
Joskin tässä suhteessa lienee osuvampaa verrata valtakuntaa siihen ujoon serkkuun , joka jokaisessa sukujuhlassa mielellään ei nosta itsestään metakkaa ja joutuu myös hintelyytensä vuoksi aina istumaan nurkkapöydässä .	jokaisessa	12	Ine
Nimeä kysytään , koska jos jollekin käy huonosti , silminnäkijältä saatetaan tarvita tietoja siitä , mitä todella tapahtui .	jollekin	5	All
Joitakin kontakteja ei edes saa ilman tätä .	Joitakin	0	Par
Siitäpä olenkin ylpeä .	Siitäpä	0	Ela
Niillä menee läpi sit tälläset niinku tää hymy et sä oot nii valoinen- valoisa ja myönteinen ja hymyilevä kyl sä varmasti onnistut ja muuta ni ni mä sanoin omalla kohdalla et kylhän sä hymyilet ihan nätisti mutta .	Niillä	0	Ade
Meistä tulee onnellisia .	Meistä	0	Ela
Tuostahan voi saada vaikka minkälaisen taudin .	Tuostahan	0	Ela
Heille itselleen taputettiin .	Heille	0	All
Meille tuodaan - joskin myös meiltä viedään - ulkomailta uutta lehmäainesta .	meiltä	5	Abl
Kokonaan toinen kysymys on , teenkö enää koskaan elokuvia , ja siihen kysymykseen minulla ei ole vastausta .	toinen	1	Nom
Jokaisessa diktatuurissa syntyy kuitenkin kapina , koska kansalaiset alkavat aina jossain vaiheessa vaatia vapauksia .	Jokaisessa	0	Ine
Mitä se tarkottaa ? ”	Mitä	0	Par
Sinua etsii vaalea , symppis , 28v , omillaan toimeentuleva yh-äiti	Sinua	0	Par
Osasyynä tähän(kin) opetteluun on ollut laiskuus eli mukavuudenhalu ; en jaksanut kohdistaa putkea muutaman tunnin havainnoinnin ajaksi , vaan mielummin etsin kohteet manuaalisesti .	tähän(kin)	1	Ill
Komission ja parlamentin välillä oli kiistaa , montako erityisdirektiiviä tulisi ottaa mukaan .	montako	7	Nom
Nuo viivästykset ja valitukset huolestuttivat kansalaisia ja johtivat kesäkuun 6. , 7. ja 8. päivän traagisiin tapahtumiin , joihin vaalitarkkailuvaltuuskunta otti heti julkisesti kantaa .	joihin	18	Ill
Sitä paitsi voin vielä tunnustaa , että en minä sitä ensimmäisellä kerralla huomannut vaan minulle huomautettiin siitä	minulle	14	All
Piste suureni suurenemistaan ja lopulta vanhus sai vanhoilla silmillään selkoa , mistä oli kyse .	mistä	11	Ela
Sinulle tämä on tärkeä tilaisuus , minulle se on ainoa .	Sinulle	0	All
Jos yhteisön ulkopuoliset lentoliikenteen harjoittajat huolehtivat kaikista kuljetuksista , 1 ja 2 kohtaa sovelletaan vain yhteisöön , yhteisöstä tai sen sisällä tehtäviin kuljetuksiin . "	kaikista	6	Ela
Ari : Mä ajattelenki just niitä ihmisiä ketkä on niinku ihan normaalilinjoilla liikkuu .	ketkä	7	Nom
Muutamat henkilöt edistivät projektia sovittamalla Vimin muun muassa UNIXille ja DOSille .	Muutamat	0	Nom
He seisoivat eteisessä kasvokkain .	He	0	Nom
Heidät lakaisi syrjemmälle vaatimus , että aktiivipoliitikkoa ei voi valita korkeaan , vallankäyttöä valvovaan virkaan .	Heidät	0	Acc
Ei kenelläkään muulla ole sellaista nenää kuin minulla .	muulla	2	Ade
Se oli kuitenkin lähellä Järntorgetia , rauta- ja kuparikaupan keskusta eikä Mårten halunnut muuttaa sieltä muualle , vaikka hänellä olisikin pian varaa rakennuttaa itselleen kartano Tukholman liepeille .	itselleen	23	All
Ka niin kyllä myö on huomennakki on ajateltu että lähettään jonnekki ajeleksimmaan kahtelemmaan varsinni jos tämmönen keli on ni ,	myö	3	Nom
Joille tämä ei sovi , voivat perua tai lykätä matkansa .	Joille	0	All
Niitä tarkistuksia , joilla mahdollisuuksia itsekäsittelyyn rajoitetaan monella tavalla muun muassa niin , että oikeus itsekäsittelyyn rajoitetaan koskemaan ainoastaan merellä työskentelevää henkilökuntaa , ei voida hyväksyä .	monella	7	Ade
Myymistä se on itsensäkin myyminen ; oikeastaan se vasta myymistä onkin !	itsensäkin	3	Gen
EU:n naapurimaille on tehtävä selväksi , millaiset edellytykset niiden on täytettävä , jotta viisumimenettelyjä ensiksikin aidosti yksinkertaistetaan ja toiseksi jotta pakollisesta viisumivaatimuksesta jonakin päivänä luovutaan .	niiden	8	Gen
Yhtä säännöllisiä olivat nämä kävelyt lähemmäksi merta ja vasta perillä ymmärsin , miksi olin tullut .	nämä	3	Nom
Vuonna 2006 järjestettävässä ensimmäisessä kokouksessa on tarkoitus keskustella lisää eräistä asioista , jotka on jäsenvaltioiden täytäntöönpanotoimien arvioinnin yhteydessä todettu ongelmallisiksi ja olennaisen tärkeiksi .	eräistä	9	Ela
Mulla on kylmä	Mulla	0	Ade
- Mulla on sauna varattuna .	Mulla	1	Ade
Pakko alkaa lukemaan ranskankielisiä lehtiä ja kirjoja ja mentävä jollekin kurssille syksyllä , oli sen verran traumaattinen kokemus toi kielen unohtaminen .	jollekin	9	All
Meiltä unohtui eväät .	Meiltä	0	Abl
Teillä onkin edessä sellainen remontti , että itku vielä pääsee , mies naurahteli .	Teillä	0	Ade
Minä olinkin koneessa näkevinäni hänet , mutta en luottanut silmiini ...	hänet	4	Acc
No niin , tästäkin päivästä tuli rajoittunut , sillä jalkaani vihloo aivan jatkuvalla syötöllä .	tästäkin	3	Ela
Vieressä kuuluisi olla käsivarsi tai edes selkä , mutta ei , se on taas missälieneejossain ylitöissä .	missälieneejossain	14	Ine
Siin o varmaa joku puoltoisttonnii on vuokra sit siinä .	Siin	0	Ine
Lähdin etsimään ihmisiä tuolta asemalta , jos vaikka joku voisi auttaa .	tuolta	3	Abl
Tämä on elämäni pohjanoteeraus .	Tämä	0	Nom
prosessivertaus nyt ei aivan täsmälleen siihen tietysti sovi mutta mutta saman tyyppisiä elementtejä siinä on materiaalihankintaa ö asian tutkimista päätöstä siitä että tälläiseen työhön ryhtyy ja ja sitten sen toteuttaminen mh määrätyssä aikataulussa jonka on itsellensä mhh luonut	itsellensä	35	All
Mitäs me noille laulettas ?	noille	2	All
Kenenkään ei ole pakko ostaa kyseisiä elintarvikkeita , mutta me uskomme , että niille ihmisille , jotka niitä haluavat ostaa , tulisi myös antaa mahdollisuus saada runsaasti tietoa aiheesta .	Kenenkään	0	Gen
Kukakohan sen sanoi ?	Kukakohan	0	Nom
Kenen avulla he käyvät sotaa ?	Kenen	0	Gen
Mutta meillä naisilla on myös vastuu – vastuu pukeutua hyvännäköisesti ja huolitella itsemme niin , että tunnemme itsemme kauniiksi ja seksikkääksi .	itsemme	17	Gen
Mille Kari nauraa ?	Mille	0	All
Euroopassa , joka on olevinaan sosiaalinen , tuomitsemme myös komission kyynisyyden , joka on ajanut nämä työntekijät suuriin vaikeuksiin – työntekijät , joista eräät ovat lastensa pääasiallisia elättäjiä ja joista monet ovat naisia .	monet	30	Nom
tästäkin huolimatta laitan näiden kuvan tänne ja suosituksen kokeilla .	tästäkin	0	Ela
Elokuvia heiltä syntyi peräti 1480 kappaletta .	heiltä	1	Abl
Gorgon on sirkustaiteilija jo ties kuinka monennessa polvessa	monennessa	6	Ine
Joidenkin mielestä sen pitäisi kuitenkin tapahtua muuttamalla jo olemassa olevan joukkueen kotipaikkaa uuden seuran perustamisen sijaan .	Joidenkin	0	Gen
Nää vissii jää nää kuvat tänne	Nää	0	Nom
Joidenkin tarkistusten tarkoituksena näyttää kuitenkin olevan niiden toimien hidastaminen tai jopa lopettaminen , jotka on toteutettu Euroopan satamien toiminnan vireyttämiseksi ja , kuten aiemmin mainitsin , sekä vientiämme muualle maailmaan helpottavan pitkänmatkan meriliikenteen mahdollisuuksien että lyhyenmatkan meriliikenteen parantamiseksi .	niiden	6	Gen
Noita oli aikalailla 200 kassia !	Noita	0	Par
Elikkä , onks teil se hakemus täytetty sitte jo	teil	3	Ade
Näissä vasemmisto piti hallussaan 51 departementtia 101:sta , ja vahvisti näissäkin otettaan .	näissäkin	10	Ine
Muutoksen on lähdettävä meistä itsestämme tai sitten se jää tulematta .	itsestämme	4	Ela
Tuomioistuin voi myös määrätä ehdollisen vankeuden täytäntöönpantavaksi vain osaksi , jolloin rangaistus jää muulta osin ehdolliseksi entisin koeajoin .	muulta	13	Abl
Näyttääkö tuo sinusta tulehtuneelta ?	sinusta	2	Ela
Olisi mukava tietää mihin se pitää viedä , mikäli siihen tulee vika .	mihin	3	Ill
Marko kyseli Twitterissä tuon näytön kytkentöjä , joten piirsin eräälle common cathode-tyyppiselle näytölle sellaiset ( riippuu täysin näytön tyypistä ja valmistajasta ) .	eräälle	9	All
Sä tiedät että mä oon seurannut sua siitä asti kun mä näin sut .	sut	12	Acc
Kenellä on paras valmennusjärjestelmä , menestyy .	Kenellä	0	Ade
Kun on kyse tällaisesta tapauksesta , eli direktiivistä , joka hyväksyttiin - huomatkaa - yksimielisesti , meiltä puuttuu mahdollisuus tarkistaa direktiiviä automaattisesti kymmenen vuoden kuluttua , jos yksi jäsenvaltio sitä pyytää .	meiltä	16	Abl
Minusta tuntuu , että siitä tulee susi	Minusta	0	Ela
Siitä , voidaanko EU:sta erottaa , ei ole olemassa säännöksiä tai sopimuksia .	Siitä	0	Ela
Huoneessaan pieni poika leikki pakonomaisesti leluautoillaan , esitti itselleen ettei mitään ollut tapahtunutkaan , vaikka sen huudon peittämiseksi olisi korvien päälle tarvittu kahdet kädet lisää , ' antakaa minut anteeksi ' .	itselleen	8	All
– Ongelman kärjistymisen voisi monessa tapauksessa välttää tarttumalla härkää sarvista heti , kun ensimmäiset merkit ongelmista ilmenevät .	monessa	4	Ine
Peruskarsinnan jälkeen pidetään välipalaveri ja päätetään ketkä kutsutaan haastatteluun .	ketkä	6	Nom
Vuoden mittaan saattaa tulla ja tuleekin elämään kuuluvia eripuraisuuksia joko syystä tai tyhjästä , mutta jouluna muistetaan kaikki se hyvä , mitä on toisilta saatu .	toisilta	23	Abl
Näistä yksi , siis vain yksi rupesi kasvattamaan itseään kuin kide .	Näistä	0	Ela
Yhtä hankalaa on jäällä nyt kalastajalla itselläänkin .	itselläänkin	6	Ade
Uskoisin , että taso on parempi mitä moni kuvittelee .	moni	7	Nom
Sieltä mistä me kaikki olemme tulleet , sieltä minne me kaikki vielä menemme .	mistä	1	Ela
tästähä ei tuu mitää tästä meijän hyvästelystä	tästähä	0	Ela
Haluan myös onnitella komissiota , koska meillä on nykyään käytettävissämme hyvä ja suorasukainen selvitys vallitsevasta tilanteesta .	meillä	6	Ade
myykö kasvattaja vain raakit ja jättää parhaat lupaukset itselleen ?	itselleen	8	All
Mårten selosti tarkkaan , mihin hintaan Johanin oli myytävä kuparia ja paljonko hän saisi enintään maksaa kuparin toimittajille .	mihin	4	Ill
Asiantuntijamme voivat varmaankin antaa paljon sellaista perustietoutta , joka säästää teiltä aikaa ja rahaa .	teiltä	10	Abl
Kokous voidaan kutsua koolle jommankumman sopimuspuolen pyynnöstä , jonka asianomainen sihteeri toimittaa toiselle sopimuspuolelle .	jommankumman	4	Gen
Kuulkaapa tätä .	tätä	1	Par
ajateltti ett ei sateevarjo kukkaam pitäis siäl .	kukkaam	4	Nom
Aho ei suostunut sanomaan , kenet pankin johdosta pitäisi erottaa .	kenet	5	Acc
Jos nyt Suomen kansa viisaudessaan päättää olla liittymättä tähän me ollaan näin paljon tähän nyt jo satsattu niin kuka tästä sitten vastaa tästä valtavasta katastrofista --	tästä	19	Ela
Kerrottuani tämän tarinan , nostit minut ylös ja halasit lujaa .	minut	5	Acc
Viirupallokala kasvaa luonnossa noin 30 cm pitkäksi , akvaariossa sen koko jää puoleen tästä .	tästä	13	Ela
Muista asiakirjoista käy ilmi täysin tavanomainen kielikoulutuksen suunnittelu ajanjaksolle 2004–2005 , mutta yhtäkkiä , kesäkuussa 2004 , opettajat saivat kuulla äkillisestä irtisanomisestaan .	Muista	0	Ela
Mikäli häpeä , estot ja oma kontrollointi estävät meiltä tämän nautinnon , vaikuttaa se kaikkeen muuhunkin elämässämme .	meiltä	8	Abl
Mistä lie johtuu , mutta Sibelius-viulukilpailun yleisökoostumus ei ole ollut aivan nuorimmasta päästä .	Mistä	0	Ela
Laita lapsi asialle , mene itse perässä	itse	5	Nom
Tää on jotain niin mahtavaa !	Tää	0	Nom
Millä te Australiassa eläisitte ?	Millä	0	Ade
Niillä on se luulo , ettei niiden tartte maksaa velkojaan eikä mitään .	mitään	11	Par
me kirjotettaa että häne joko täytys antaa potkut tälle miehelle tai jos tätä Kivistä ei ole ennemmin näkynä juovuksissa ni lähettää hänet viipymättä kottii	häne	3	Gen
Jos niilt kysyy et ootsä niin kun kavereiden kans ulkona tai jotain nin eiei en mä ehi oikeen kun mä aina har- mä harrastan sitä ja harrastan tätä	niilt	1	Abl
Puhu puhu vaan , ei sinua kukaan usko .	kukaan	6	Nom
Jotkin paikat tuntuivat vaativan hieman lisää työtä .	Jotkin	0	Nom
Se oli sinulta tosi kauniisti tehty ;	sinulta	2	Abl
Mull on niinku iha semmonen fiilis että että että mie haluaisin kyllä yhen kunnon drinkin tänä iltana	Mull	0	Ade
En halua luovuttaa aarteitani jollekin , joka väittää , että ne kuuluvat hänelle , koska hänellä on pitempi nenä tai erimuotoiset sukuelimet .	jollekin	4	All
Hän teki kaiken niin kuin hän oli nähnyt toistenkin tekevän .	toistenkin	8	Gen
- He tulivat synnintuntoon .	He	1	Nom
Noilla kolmella juoksulla Hamina murskasi Haapajärven selkärangan .	Noilla	0	Ade
Kerro Marjut keneltä sä oot saanu tän .	tän	6	Gen
Eile oli kyl must iha älyttömän kuuma .	must	3	Ela
Tässä valtiovalta on pelkästään tarkkailevassa asemassa .	Tässä	0	Ine
Joidenkin ehdokkaiden kotisivuna on puolueen kotisivu , joillakin oli facebookin etusivu , joillakin wordpressin etusivu .	Joidenkin	0	Gen
Haluaisin kysyä teiltä , isiltä ja äideiltä , jotka annatte lapsillenne ilmakivääreitä lahjoiksi , että .	teiltä	2	Abl
( 4 ) Tässä asetuksessa säädetyt toimenpiteet ovat sokerin hallintokomitean lausunnon mukaiset ,	Tässä	3	Ine
Sen tarkoituksena on päästä Guinnesin Ennätyskirjaan suurimmalla joukkutanssilla joka on Michael Jacksonin Thriller .	Sen	0	Gen
Kun tämä kuoli , Bithynian kuningas Nikomedes sekaantui yllättäen valtataisteluun ja julisti tukevansa erästä poikaa , jonka hän väitti olevan kuningas Ariarathes VI:n kolmas poika .	erästä	13	Par
