اگر یہ فلائی۔اوور مکمل کر لیا جاتا ہے تو جے این ٹی یو تا ہائی۔ٹیک سٹی کی ٹریفک کے لیے سہولت۔بخش ثابت ہوگا ۔	سٹی	15	Acc
ممتاز پاکستان گلوکارہ ٹپسنا شانی , فیض احمد فیض کی مقبول عام غزلیں پیش کریں_گی ۔	فیض	8	Acc
ممبئی کے لیے آؤٹ ہونے والے کھلاڑیوں مےں سچن تنڈولکر ( 35 ) اور امبتی رائیڈو ( 37 ) اور اوپنر جیمس فرینکلن ( 6 ) نے اپنا کردار ادا کیا ۔	تنڈولکر	9	Nom
دِین حق کی خدمت کا جذبہ حضرت ابوعبدالرحمن کو وراثتاً اپنے والد محترم سے ملا تھا ۔	ابوعبدالرحمن	7	Acc
راجو اس ماہ 19 کو دبئی سے ہندوستان واپس آیا اور آتے وقت 1.25 لاکھ روپئے ساتھ لایا -	راجو	0	Nom
سارے مسلمان جگن اور وجیہ اماں کے ساتھ ہےں آکسیجن پر رہنے والے کانگریس کے مسلم قائدین کی کڑپہ مےں انتخابی مہم بنجر زمین پر ہل چلانے کے مانند ہے ۔	اماں	5	Acc
اے آئی اے ڈی ایم کے ( AIADMK ) عاملہ کا اجلاس 27 مئی کو منعقدشدنی ہے , جہاں حالیہ اختتام_پذیر لوک سبھا انتخابات میں پارٹی کی ناقص کارکردگی کی وجوہات کا جائزہ لیا جائے گا ۔	AIADMK	7	Acc
دریں اثنا ایک سماجی کارکن اومیش چوبے نے پولیس پر اس کیس کی منصفانہ تحقیقات نہ کرنے کا الزام عائد کیا ہے ۔	چوبے	6	Acc
ڈاکٹر محمد علیم الدین میڈیکل آفیسر محکمہ ضلع میڈیکل اینڈ ہیلتھ آفیسر نے ضلع کریم نگر سے متعلقہ تقریباً 200 عازمین حج کو پولیو خوراک دی ۔	عازمین	20	Nom
انھوں نے کہا کہ وہ چاہتے ہیں کہ انڈین ٹیم متحد اور طاقتور قوت بنے جیسا کہ بالی ووڈ فلم " چک دے انڈیا " میں دکھایا گیا ہے ۔	چک	21	Nom
ایرو ویرنمنٹ کمیٹی کے ترجمان نے کہا کہ ریون کا استعمال اٹلی اسپین اور ناروے سمیت کئی امریکی اتحادی کرتے ہیں ۔	اٹلی	11	Acc
جناب رحیم قریشی نے بتایا کہ مقدمہ کی ہر سماعت کے لیے وکلاء کی فیس تقریباً 5 لاکھ تک ہو رہی ہے ۔	رحیم	1	Nom
مسٹر رے نے ماکھن لال چترویدی نیشنل یونیورسٹی برائے صحافت و کمیونکیشن کے ایک سمینار سے خطاب کرتے ہوئے کہا کہ پیسے دیکر خبریں فراہم کرنا یا حاصل کرنا معلومات کے شعبہ کی بدترین لعنت ہے ۔	رے	1	Acc
بزم کا اگلا مشاعرہ 20 جون کو بطرح ) ڈھل گئی عمر تو غزلوں پہ جوانی آئی ( منعقد ہوگا ۔	غزلوں	13	Nom
ریاست کے عوام بہوجن سماج پارٹی ( بی ایس پی ) کی حکومت سے اکتا چکے ہیں ۔	بہوجن	3	Nom
دریں اثنا بیرونی ملک میں موجود پربھاکرن کے ایک قریبی ساتھی سیلواراسا پدماناتھن نے پربھاکرن کی موت کو افواہ قرار دیتے ہوئے کہا کہ پربھاکرن آج بھی زندہ اور بحفاظت ہیں ۔	سیلواراسا	11	Nom
انہوں نے کہا کہ انہیں خاص طور پر کانگریس لیڈر دگ وجئے سنگھ کی جانب سے ان پر کی گئی تنقید سے تکلیف ہوئی ہے ۔	دگ	10	Nom
رکن پارلیمنٹ پرنم پربھاکر نے مخاطب کرتے ہوئے کہا کہ کریم نگر مےں مسلم بھائیوں نے ہمیشہ کانگریس کا ساتھ دیا ہے ۔	پربھاکر	3	Acc
ایک اور آئی پی ایل کھلاڑی اویس شاہ سلیکٹروں کا اعتماد حاصل نہ کر سکے اور انہیں دورہ ویسٹ انڈیز پر ناقص مظاہروں کا خمیازہ بھگتنا پڑا ۔	انڈیز	19	Acc
اسی کوشش کی ابتداء کلیان سنگھ کو پارٹی میں شامل کرتے ہوئے کی گئی اور اعظم خان کا اخراج اس سمت میں دوسرا قدم کہا جا سکتا ہے ۔	کلیان	4	Nom
جس میں سرِفہرست ۔ع۔ کے غلام معین الدین ہیں ، جنہیں جونیر انٹر میں 93 فیصد مارکس حاصل ہوئے ہیں جن کا ہال ٹکٹ نمبر 08271192 ہے ۔	معین	6	Nom
آئی پی ایل کے سرکاری ویب_سائٹ کے لیے تحریر_کردہ اپنے کالم مےں سریکانت نے مہندر سنگھ دھونی , انل کمبلے , یوراج سنگھ اور شین وارن کو آئی پی ایل کے بہترین کپتان قرار دیا ہے ۔	کمبلے	19	Acc
اس خصوص میں اظہار خیال کرتے ہوئے سوان نے کہا کہ ویسٹ انڈیز ٹیم اسپنرس کے خلاف جدوجہد کرتی نظر آتی ہے لہذا وہ مونٹی پنیسر کے ساتھ مہمان ٹیم کو مزید مشکلات میں مبتلا کرنے کے خواہش_مند ہیں ۔	پنیسر	25	Acc
1787 ء مےں امریکی باشندے جان فٹچ نے ایسی اسٹیم بوٹ متعارف کرائی جس کے دونوں جانب پیڈل نصب تھے جنھیں اسٹیم بوٹ شافٹ چلاتے تھے ۔	فٹچ	6	Acc
ایر فرانس کا ایک جیٹ طیارہ ، جس میں 228 افراد سوار تھے ریوڈی جنیرو سے پیرس جاتے ہوئے بحر اوقیانوس پر سے گزرنے کے دوران ایر ٹرافک کنٹرولرس سے رابطہ کھو بیٹھا ۔	فرانس	1	Acc
یمن مےں قبائلی گروہوں اور القاعدہ کے عسکریت_پسندوں نے گذشتہ 24 گھنٹوں کے دوران مختلف کارروائیاں کرتے ہوئے کم از کم 22 افراد کو ہلاک کر دیا ہے اور دیگر درجنوں کو یرغمال بنا لیا ہے ۔	یمن	0	Acc
ایڈیشنل جوائنٹ کلکٹر سندرابھنیار نے مخاطب کرتے ہوئے کہا کہ ترملا تروپتی دیواستھانم کے تحت ضلع سطح پر 20 مئی کو اجتماعی شادیوں کا انعقاد عمل مےں لایا جا رہا ہے ۔	تروپتی	11	Nom
گریٹر حیدرآباد میونسپل کارپوریشن کے اسپیشل آفیسر و کمشنر مسٹر ایس پی سنگھ نے بلدیہ کے 150 حلقوں کی حد_بندی سے متعلق ڈرافٹ پلان مع مختلف سیاسی جماعتوں کی تجاویز کے حکومت کو روانہ کر دی ہیں ۔	گریٹر	0	Nom
جس کے لیے جواہر لال نہرو نیشنل اربن رینول مشین سے فنڈ حاصل کئے جائیں گے ۔	نہرو	5	Nom
ایر فرانس کا ایک جیٹ طیارہ ، جس میں 228 افراد سوار تھے ریوڈی جنیرو سے پیرس جاتے ہوئے بحر اوقیانوس پر سے گزرنے کے دوران ایر ٹرافک کنٹرولرس سے رابطہ کھو بیٹھا ۔	ایر	0	Nom
ترنمول کانگریس سربراہ ممتا بنرجی نے آج الزام عائد کیا کہ سی پی آئی ایم جادھو پور حلقہ اسمبلی کے چند بوتھس پر رائےدہی کے دوران قبضہ کرنے کی کوشش کی ۔	بنرجی	4	Acc
اس اجلاس میں نومنتخب رکن اسمبلی گجویل ٹی نرساریڈی شرکت کریں گے ۔	نرساریڈی	8	Nom
سونیا گاندھی نے آر جے ڈی قائد رگھو ونش پرساد سنگھ کی حلفبرداری کے بعد انہیں پرجوش مبارکباد دی ۔	رگھو	7	Nom
حیدرآباد کے ڈسٹرکٹ کلکٹر نٹراجن گلزار نے موضع شیخ پیٹ کے تحت بھولکپور نالہ کے قریب اراضی کی فروخت کے خلاف عوام کو خبردار کیا ہے ۔	نٹراجن	4	Nom
جن کی نماز جنازہ دارالعلوم جامعہ عربیہ بھینسہ مےں مرحوم کے بھائی قاری صدیقی احمد صدیقی سکریٹری سرسید ایجوکیشنل سوسائٹی نرمل نے پڑھائی ۔	عربیہ	6	Nom
افغانستان مےں امریکی مداخلت کے حوالے سے پاکستان کے بارے مےں امریکی پالیسی مےں '' ڈومور '' کا لفظ بار بار دہرایا جاتا رہا ہے حالانکہ اس جنگ مےں پاکستانیوں کی قربانیاں سب سے زیادہ ہےں ۔	ڈومور	15	Acc
کولکتہ نائٹ رائڈرس کوچی ٹسکرس کے خلاف کل ہوئی شکست کو پس_پشت ڈالتے ہوئے رائل چیلنجرس بنگلور کے خلاف کل یہاں ایڈن گارڈن مےں کھیلے جانے والے مقابلہ کے ذریعہ دوبارہ کامیابی کی سمت واپسی کی خواہاں ہے ۔	ایڈن	21	Nom
تلگودیشم پارٹی ذرائع کے مطابق تلگودیشم قیادت نے وجئے راما راؤ کو صدارت کے عہدے سے ہٹانے کا ذہن بنا لیا ہے ۔	راما	9	Nom
انہوں نے پاکستان کے اٹارنی جنرل لطیف کھوسا کے مباحث کا جواب دیا جو انہوں نے 30 مئی کو اس مقدمہ میں پیش کیے تھے ۔	کھوسا	7	Acc
پولیس نے ان کے قبضہ سے دیڑھ لاکھ نقد رقم 15 تولہ سونا اور تین موٹر سیکلوں کو ضبط کر لیا ۔	سونا	12	Acc
ملکان گیری تھانہ کے انچارج آر کے پاٹل نے بتایا کہ سنتوش نے جنوبی زون کے ڈی آئی جی پولیس سومیندر پریہ درشی کے سامنے خودسپردگی کی ۔	پریہ	21	Nom
ڈیرہ قائد کی ویانا میں تشدد میں موت واقع ہو گئی تھی ۔	ویانا	3	Acc
اسی طرح مولانا عبدالعزیز ناظم مجلس علمیہ کی نواسی اور دختر حافظ عبدالماجد امام مسجد مدینہ سوریہ پیٹ کا نکاح مفتی شوکت فرزند عبدالرؤف موظف انجینئر پنچایت راج نلگنڈہ سے انجام پایا ۔	شوکت	21	Nom
انہوں نے کہا کہ لال گیری کراس پر برسوں سے جو مکانات موجود تھے , انہیں منہدم کرنے کا ذمہ_دار کون ہے ۔	کراس	6	Acc
ہالیہ کے سب انسپکٹر آف پولیس بلونت ایا کے مطابق اس واقعہ مےں ملوث اس کا اےک اور ساتھی سنپت نائک مفرور ہے ۔	ایا	7	Acc
پڑوسی ضلع کربیلانگ میں ایک انکاؤنٹر میں نیشنل ڈیموکریٹک فرنٹ آف بوڈو لینڈ این ڈی ایف بی کے چھ شورش_پسندوں کو ہلاک کر دیا گیا ۔۔	فرنٹ	9	Nom
انھوں نے یہ بھی کہا کہ گگن اجیت سنگھ , لن ایپا اور ارجن ہالپا جیسے کھلاڑیوں کو جنھیں گل کی میعاد کے دوران حاشیہ پر رکھ دیا گیا ۔ ٹیم سےلکشن کے دوران زیر غور لایا جائےگا ۔	ہالپا	14	Nom
بعدازاں گذشتہ سال منعقدہ ضمنی چناؤ میں بھی رام لنگا ریڈی ٹی آر ایس نے تلگو دیشم کے امیدوار متیم ریڈی کو دوبارہ شکست سے دوچار کیا تھا -	لنگا	9	Nom
انھوں نے موصل جانے کا مشورہ دیا ۔	موصل	2	Nom
اِسلام نے جن کاموں کو غلط قرار دیا ، اُس کی خرابیوں اور ایذارسانیوں کا مشاہدہ تمام انسان کرتے آ رہے ہیں ۔	اِسلام	0	Acc
گذشتہ دنوں دارالحکومت دہلی کے پڑوسی شہر نوئیڈا مےں دو بہنوں کی فاقہ_کشی کا واقعہ بھی حکومت کو فراموش نہیں کرنا چاہئے ۔	نوئیڈا	7	Acc
کہا گیا ہے کہ دمشق کے شمال مشرقی علاقہ زابادانی مےں احتجاجیوں نے بشر الاسد کی حکومت کے خاتمہ پر زور دیا تاہم پولیس نے انہیں فوری وہاں سے منتشر کر دیا ۔	دمشق	4	Acc
ضلع کلکٹر میدک مسٹر سریش کمار اور آرمی رکروٹمنٹ بورڈ آفیسر کرنل تھامس میتھیو نے میدک ٹاؤن کا دورہ کرتے ہوئے اندرا گاندھی اسپورٹس اسٹیڈیم میدک کا معائنہ کیا	میتھیو	13	Acc
سنتوش ہیگڈے نے کہا کہ پہلے رسواکن مہم کا آغاز انا ہزارے کے خلاف کیا گیا اور اب اس کے بعد شانتی بھوشن اور پرشانت بھوشن کے خلاف یہ مہم جاری ہے ۔	شانتی	21	Nom
دریں اثناء عالمی نمبر 2 اور آسٹریلین اوپن چیمپین سرینا ولیمس ، سوئتلانا کوزنیٹسوا ، وینس ولیمس ، ویرا زونیریوا اور ایلینا ڈیمنٹیوا کا ایلینا یانکووچ سے سامنا ہو سکتا ہے ۔	ڈیمنٹیوا	22	Acc
رام ولاس پاسوان نے الزام عائد کیا کہ مرکزی حکومت نے چار نکات پر بھی کوئی قدم نہیں اٹھایا ہے ۔	پاسوان	2	Acc
انگلش پریمئر مانچسٹر یونائیٹڈ نے نیوکاسل کے خلاف ڈرا میچ کھیل کر آرسنل کے خلاف 9 پوائنٹ کی بڑی برتری حاصل کرنے کا موقع گنوا دیا ۔	انگلش	0	Nom
اعظم خان نے پارٹی میں سابق چیف منسٹر کلیان سنگھ کی شمولیت کے خلاف احتجاج کیا تھا اور انہیں بابری مسجد کی شہادت کا ذمہ_دار قرار دیا تھا ۔	کلیان	8	Nom
ضلع نلگنڈہ سے مسٹر کے جانا ریڈی , کومٹ ریڈی , وینکٹ ریڈی اور اتم کمار ریڈی وغیرہ کے نام زیر غور ہیں -	وینکٹ	11	Nom
مفتی ندیم الدین نے مخاطب کرتے ہوئے کہا کہ کانگریس کو چاہیئے کہ مسلم امیدوار کو ٹکٹ بھی دے اور اُس کی کامیابی کے لیے اقدامات بھی کرے ۔	ندیم	1	Nom
خطبہ نکاح مولانا زکریا و صدر مدرس اشرف المدارس مولانا قاری امیر الحسن نے پڑھا -	امیر	11	Nom
مکہ مسجد بم دھماکے کیس کی تحقیقات کا آغاز کرتے ہوئے نیشنل انوسٹی گیشن ایجنسی ( این آئی اے ) نے ایجنسی کے سربراہ مسٹر ایس سی سنہا کی قیادت مےں آج مکہ مسجد کا معائنہ کیا ۔	دھماکے	3	Nom
واضح رہے کہ عباس ٹائر والا منا بھائی ایم بی بی ایس ۔ مقبول اور میں ہوں نا ۔ کے کہانی_کار ہیں ۔	ٹائر	4	Nom
حفیظ گل بہادر نے حکومت پاکستان کے ساتھ اےک امن معاہدہ بھی کیا تھا ۔	گل	1	Nom
تحریک غلبہ اسلام ( ٹی جی آئی ) کے پمفلٹ میں شر۔پسند عناصر نے تحریر کیا کہ " ان پولیس والوں کے قتل کی ذمہ_داری تحریک غلبہ اسلام ( ٹی ۔ جی ۔ آئی ۔ ) لیتی ہے ۔	غلبہ	1	Nom
کرکٹ سری لنکا کے صدر سوما چندرا ڈیسلوا اور آئی سی سی کے نائب صدر شردپوار سے اعجازبٹ کی اہم ملاقاتوں کے بعد اس اجلاس کی اہمیت بڑھ گئی ہے ۔	سوما	5	Nom
راجستھان چاہےگا کہ اس کے اہم آل راؤنڈر شین واٹسن بہتر مظاہرہ کریں جبکہ یوہان بوتھا اور راس ٹیلرس سے بھی ٹیم کو بہتر مظاہرے کی امید ہے ۔	یوہان	14	Nom
کہا گیا ہے کہ دمشق کے شمال مشرقی علاقہ زابادانی مےں احتجاجیوں نے بشر الاسد کی حکومت کے خاتمہ پر زور دیا تاہم پولیس نے انہیں فوری وہاں سے منتشر کر دیا ۔	زابادانی	9	Acc
حضرت مجدد الف ثانی رحم اللہ علیہ اپنے مکتوبات مےں فرماتے ہےں کہ سالک اس وقت تک واصل نہیں ہوتا , جب تک کہ اپنے آپ کو خسیس کتے سے بھی بدتر نہ سمجھے ۔	مجدد	1	Nom
دریں اثناء راجر فیڈرر اور جوکووچ کے درمیان سیمی فائنل متوقع ہے جبکہ نڈال فائنل میں مذکورہ کھلاڑیوں میں کسی ایک کا سامنا کر سکتے ہیں ۔	جوکووچ	5	Acc
ضلع ہورا کے بالی مقام پر اےک جلسہ عام سے خطاب کرتے ہوئے کرت نے کہا کہ سونیا جی آج لفٹ کے زیر قیادت حکومت پر مغربی بنگال مےں ترقی کی کمی کو تنقید کا نشانہ بناتی ہے ۔	کرت	13	Acc
ضلع کلکٹر سمیتا سبھروال نے زرعی عہدیداروں کو ہدایت دی کہ وہ ربیع کی پیداوار دھان کی حکومت کی مقررہ امدادی قیمت پر خریداری کے لیے پہلے سے ہی منصوبہ بنا لیں ۔	سمیتا	2	Nom
ان کا کہنا ہے کہ الوپیتھک کے علاوہ آیورویدیک ہومیوپتھی کاسمیتھ جڑی بوٹیوں کی ادویات سستی اور معیاری ہوتی ہیں اور اس کے استعمال سے کافی فائدہ حاصل ہوتا ہے ۔	کاسمیتھ	10	Acc
اسی اثناء میں یو پی میں پارٹی کی شکست پر غور کرنے کے لیے بی جے پی کے ریاستی صدر ڈاکٹر رمایتی رام ترپاٹھی نے پارٹی کے ہارے جیتے امیدواروں کا ایک جلسہ 29 مئی کو طلب کیا ہے ۔	ترپاٹھی	23	Acc
والدین اپنی لڑکیوں کو دنیاوی تعلیم کے ساتھ ساتھ دینی تعلیم اور اردو ادب کی بھی تعلیم دیں , اس کے پڑھنے سے حدیث شریف اور دیگر معلومات مےں اضافہ ہوگا ۔	حدیث	23	Nom
جسٹس کاٹجو نے کہا کہ پنڈت نہرو نے اس دباؤ کو تسلیم نہیں کیا اور وہ اپنے موقف پر قائم رہے کہ ہندوستان اےک سیکولر ملک رہےگا ۔	نہرو	6	Acc
اس دوروزہ تلگودیشم مہاناڈو کا یوں تو 27 مئی کو آغاز ہوگا اور 28 مئی کو مختلف قراردادوں کی منظوری کے بعد اختتام عمل میں آئے گا ۔	تلگودیشم	2	Nom
بیت المقدس مےں آخری آرام_گاہ بنی ۔	المقدس	1	Acc
ضلع کلکٹر سمیتا سبھروال نے زرعی عہدیداروں کو ہدایت دی کہ وہ ربیع کی پیداوار دھان کی حکومت کی مقررہ امدادی قیمت پر خریداری کے لیے پہلے سے ہی منصوبہ بنا لیں ۔	دھان	15	Acc
فرانس کے وزیر ٹرانسپورٹ ژاں لوئی بورلو نے کہا کہ طیارے کے حشر کے بارے میں ہمیں بدترین اطلاع کے لیے تیار رہنا چاہیے ۔	ژاں	4	Nom
اٹاپٹو کی بیٹنگ کوچ کے طور پر تقرری تلک رتنے دلشان کو کپتان بنائے جانے کے اےک روز بعد ہوئی ہے ۔	اٹاپٹو	0	Acc
دریں اثنا پانچوں ملزمین کے کونسل شہباز راجپوت نے یہ ادعا کیا ہے کہ حکام نے جج کہوت کو برخاست کر دیا ہے ۔	راجپوت	7	Acc
کرہ ارضی کے کسی خطے سے لیے گئے پانی کے خواص زمزم سے کسی طرح بھی مشابہت نہیں رکھتے ۔	زمزم	11	Acc
اگر یہ فلائی۔اوور مکمل کر لیا جاتا ہے تو جے این ٹی یو تا ہائی۔ٹیک سٹی کی ٹریفک کے لیے سہولت۔بخش ثابت ہوگا ۔	ہائی۔ٹیک	14	Nom
کروناندھی نے کہا کہ پرکاش کرت نے ڈی ایم کے کو کڈمبا منترا کازگم پارٹی ( خاندانی بہبود پارٹی ) قرار دیا تھا ۔	منترا	12	Nom
اس دوران اےک اور سماجی کارکن اومکار رازدان نے اےک بیان جاری کرتے ہوئے کہا کہ بھوشن باپ بیٹے کو اس کمیٹی سے مستعفی ہو جانا چاہیے بصورت دیگر انا ہزارے کی مہم فوت ہو جائےگی ۔	ہزارے	30	Acc
سَرسید احمد خاں پہلے مسلمان رہنما ہےں جنہوں نے مسلمانوں کو انگریزی پڑھنے پر اُبھارا اور مسلمانوں سے چندہ جمع کر کے علی گڑھ کالج قائم کیا جو بعد مےں ترقی کر کے '' مسلم یونیورسٹی '' بن گئی ۔	سَرسید	0	Nom
خواتین کے ڈبلز زمرے مےں دولت مشترکہ کھیلوں مےں طلائی تمغہ حاصل کرنے والی ہندوستانی جوڑی جوالا گٹّا اور اشونی پونپا کو دو مقام کی تنزلی کا سامنا کرنا پڑا وہ اب 20ویں مقام پر پہنچ گئے ہیں ۔	پونپا	20	Acc
اسلم خان کی زیر قیادت سےلکشن پیانل میں سابق اولمپینس ظفر اقبال ۔ اشوک کمار ۔ اجیت پال سنگھ اور دھنراج پلے بھی شامل ہیں ۔	دھنراج	20	Nom
اس موقع پر کاماریڈی ڈی ایف او شیخ سالم , ڈی ایف او تماریڈی , ڈی ایف او اشوک کمار , ڈوما پی ڈی ویرا چاری اور فارسٹ عہدیدار کے علاوہ دیگر بھی موجود تھے ۔	ویرا	24	Nom
اسی طرح ہائی۔ٹیک سٹی ریلوے اسٹیشن کے حدود میں تعمیر کیے جا رہے فلائی۔اوور کی حالت بھی ایسی ہی ہے ۔	ہائی۔ٹیک	2	Nom
تب حضرت سلمان فارسی رضی اللہ عنہ نے ایرانی طرز کی خندق کھودنے کا مشورہ دیا اور آپ کے مشورہ پر ساڑھے تیس میل لمبی اےک خندق کھودی گئی ۔	رضی	4	Nom
اس جوڑے کی ان کے والدین کی مرضی سے دسمبر 1997 ء میں شادی ہوئی تھی ۔	دسمبر	9	Acc
زبیری اسٹریٹ مےں نائب صدر یمن ابوربو منصور ہادی کی رہائش_گاہ بھی واقع ہے اور پولیس کے ساتھ احتجاجیوں کی جھڑپ رہائش_گاہ سے قریب جاری ہے ۔	زبیری	0	Nom
ان کے علاوہ مسٹر نرمل پھاٹک ( دینک ہندوستان , نئی دہلی ) اور مسٹر ولاس اے مراٹھی ( دینک ہندوستان امراوتی ) شامل ہےں ۔	دینک	7	Nom
1995 ء مےں ہری کرشنا نے اس وقت اپنے بہنوئی این چندرا بابو نائیڈو کی تائید کی تھی , جب انہوں نے ( نائیڈو ) نے اپنے خسر این ٹی راماراؤ کے خلاف بغاوت کی تھی ۔	راماراؤ	30	Acc
پاکستان کرکٹ بورڈ کے چیرمین اعجازبٹ جنوبی افریقہ مےں زمبابوے اور جنوبی افریقہ کرکٹ بورڈس کے سربراہوں سے ملاقات کریں گے ۔	زمبابوے	9	Acc
نیز جوس مورینہو کا یہ پہلا ٹورنمنٹ ہے کیوںکہ انہوں نے انٹرملان سے رئیل میڈرڈ مےں شمولیت اختیار کی ۔	انٹرملان	11	Acc
تقریباً 10 ماہ بعد واپسی کر رہی سابق عالمی نمبر ایک روسی ٹینس اسٹار ماریا شاراپووا واپسی کے بعد پہلے گرانڈ سلام کے پہلے مقابلے میں بیلاروس کی انستسیا یاکیمووا سے مقابلہ کریں گی ۔	شاراپووا	15	Acc
صدر شام بشر الاسد کی جانب سے کئی دہوں قدیم ایمرجنسی قانون کی برخواستگی کے اےک دن بعد سرکاری افواج نے ملک کے مختلف شہروں اور ٹاؤنس مےں احتجاجیوں پر گولیوں کی بوچھار کر دی ۔	الاسد	3	Acc
نیٹکو ٹائیلس کو اس سال 2007 - 08 ء میں 51.02 کروڑ روپئے کا منافع ہوا جو پیداوار کا 34 فیصد ہے ۔	ٹائیلس	1	Acc
صدر ایران محمود احمدی نژاد نے کہا کہ وہ اور دیگر دو صدور علاقائی مسائل جیسے انتہا_پسندی , فوجی مداخلت , دہشت_گردی اور منشیات کی اسمگلنگ جیسے اہم مسائل پر نمایاں معاہدہ کر چکے ہیں -	ایران	1	Nom
رئیل میڈرڈ نے جوس مورینہو کی سرپرستی اور اضافی وقت مےں اپنے اسٹرائکر کرسٹیانو روناڈلو کے فیصلہ_کن گول کی بدولت اسپانش کپ کے فائنل مےں اپنی کٹرحریف ٹیم بارسیلونا کو 1 سے شکست دی ۔	رئیل	0	Nom
شمالی کوریا نے 29 اپریل کو انتباہ دیا تھا کہ وہ اقوام متحدہ کی سلامتی کونسل کے 5 اپریل سے راکٹ تجربہ پر اس کی سرزنش کے خلاف بطور احتجاج نیوکلیئر تجربہ کرے گا ۔	سلامتی	14	Nom
ایل ٹی ٹی ای کو امریکہ اور یوروپی یونین نے بھی دہشت_گرد تنظیم قرار دیا تھا ۔	یونین	8	Acc
