حماس کی وزارت داخلہ نے سزائے موت کا ویب سائیٹ پر اعلان کرتے ہوئے کہا کہ مجرمین شادی معضون ، رید مجاسی اور شادی احمد ان ہلاکتوں کے علاوہ دیگر جرائم کے مرتکب بھی پائے گئے ہیں ۔	مجاسی	21	Nom
مکہ مسجد بم دھماکے کیس کی تحقیقات کا آغاز کرتے ہوئے نیشنل انوسٹی گیشن ایجنسی ( این آئی اے ) نے ایجنسی کے سربراہ مسٹر ایس سی سنہا کی قیادت مےں آج مکہ مسجد کا معائنہ کیا ۔	نیشنل	11	Nom
ضلع کے دونپاٹ موضع کے ہوڑا گھاٹ علاقہ میں انتہاپسندوں کی موجودگی کی ایک اطلاع پر 19 گارڈ کے فوجیوں نے ایک آپریشن شروع کیا تھا ۔	گھاٹ	6	Acc
انگریز حکمرانوں نے 1957 کی پہلی جدوجہد آزادی ( غدر ) کے بعد یہ چال چلی تھی ۔	1957	3	Acc
دریں اثناء عالمی نمبر 2 اور آسٹریلین اوپن چیمپین سرینا ولیمس ، سوئتلانا کوزنیٹسوا ، وینس ولیمس ، ویرا زونیریوا اور ایلینا ڈیمنٹیوا کا ایلینا یانکووچ سے سامنا ہو سکتا ہے ۔	ولیمس	16	Acc
اسی طرح مولانا عبدالعزیز ناظم مجلس علمیہ کی نواسی اور دختر حافظ عبدالماجد امام مسجد مدینہ سوریہ پیٹ کا نکاح مفتی شوکت فرزند عبدالرؤف موظف انجینئر پنچایت راج نلگنڈہ سے انجام پایا ۔	سوریہ	16	Nom
کینٹش ٹاؤن کمیونٹی آرگنائزیشن ) کے ٹی سی او ( کے چیرمین شرحبیل لون نے کہا کہ ان نوجوانوں میں واحد مشترک بات یہ ہے کہ وہ بیرون ملک عربی پڑھ رہے ہیں اور صومالی نژاد ہیں ۔	کینٹش	0	Nom
اس موقع پر انہوں نے پاکستان کے لیے نیک خواہشات کا اظہار کرتے ہوئے کہا کہ وہ دعاگو ہیں کہ اللہ تعالیٰ پاکستان کو مستحکم ، دہشت گردی سے پاک اور ایک خوش_حال ملک میں تبدیل کر دے ۔	پاکستان	22	Acc
سستی مقبولیت حاصل کرنے کے لیے اپنی کھوئی ساکھ کو دوبارہ بحال کرنے چیتاپور نیوکلیر پلانٹ کے خلاف مقامی عوام کے احتجاج کو تشدد کا رُخ دے دیا ۔	چیتاپور	13	Nom
راجیو ودیا مشن ضلع میدک کی جانب سے سدی پیٹ ڈیویژن کے تحت اےک سمینار بعنوان '' قانون حق اطفال برائے مفت و لازمی تعلیم '' کا انعقاد مدینہ فنکشن ہال مےں عمل مےں آیا ۔	راجیو	0	Nom
ضلع رنگاریڈی کلکٹریٹ دفتر سے ضلع پرجا پریشد کے دفتر مےں اعلی عہدوں پر آندھرائی قائدین فائز ہےں ۔	رنگاریڈی	1	Nom
خطبہ نکاح مولانا زکریا و صدر مدرس اشرف المدارس مولانا قاری امیر الحسن نے پڑھا -	الحسن	12	Acc
تفصیلات کے لیے 24470822 پر ربط کریں ۔	24470822	3	Acc
آل انگلینڈ کلب کے چیف ایگزیکٹیو ربان رٹچی نے کہا کہ 125 چیمپین_شپ مےں جملہ انعامی رقم 23.8 ملین ڈالرس کر دی گئی ہے ۔	انگلینڈ	1	Acc
ڈیرہ سچکنڈ قائد کی ہلاکت کے بعد پنجاب اور ہریانہ میں سکھوں کے درمیان پرتشدد واقعات پیش آئے تھے ۔	ڈیرہ	0	Nom
آئی_ٹی کمپنیوں کا ہب سمجھا جانے والا مادھاپور علاقہ میں کئی کمپنیاں قائم ہیں ۔	مادھاپور	7	Nom
فرنچ اوپن کا اتوار کو آغاز ہو رہا ہے ۔	فرنچ	0	Nom
اس موقع پر CITU کے قائد راجو , لنگم , راملو , سعداللہ , لکشمی اور بالراج وغیرہ موجود تھے ۔	CITU	3	Acc
ایر فرانس کا لاپتہ مسافر جیٹ طیارہ جس میں 228 افراد سوار تھے ، امکان ہے کہ بجلی گرنے کے حادثہ کا شکار ہو گیا ہے ۔	ایر	0	Nom
چندرابابو نائیڈو کڑپہ ضمنی انتخابات کی مہم چلا رہے ہےں ۔	چندرابابو	0	Nom
جبکہ جناب شیخ عبید بن عثمان العمودی اور جناب غلام حامد خان نقشبندی چشتی قادری مہمان خصوصی کی حیثیت سے شرکت کریں_گے ۔	چشتی	13	Nom
پارٹی کے تیس کارکنوں کے ایک گروپ نے بزنس ڈسٹرکٹ آف میرین پوائنٹ میں واقع آسٹریلیائی قونصل خانہ گئے اور ہندوستانی طلبہ پر حملوں کے خلاف نعرے بازی کی ۔	آسٹریلیائی	15	Nom
لیکن اضافی وقت مےں 103ویں منٹ مےں اینجل ڈی ماریہ کی جانب سے دیے جانے والے پاس کو رونالڈو نے گول مےں تبدیل کرتے ہوئے 1993 کے بعد پہلے ڈومیسٹک کپ مےں کامیابی دلوائی ۔	رونالڈو	18	Acc
دونوں شہروں حیدرآباد و سکندرآباد میں خاص طور پر نشیبی علاقوں میں صفائی کے انتظامات پر خاص توجہ کی ضرورت ہے ۔	سکندرآباد	4	Acc
اس دورے کے موقع پر رکن اسمبلی حلقہ دباک چیرکو متیم ریڈی نے کہا کہ غیرموسمی بارش سے چیگنٹہ منڈل اور دولت_آباد منڈل مےں سیکڑوں ایکر اراضی کی فصلوں کو شدید نقصان ہوا ہے ۔	چیگنٹہ	18	Acc
جاپانی سائنسداں نے مزید انکشاف کرتے ہوئے کہا کہ مسلمان کھانے , پینے اور ہر کام کرنے سے پہلے '' بسم اللہ '' پڑھتے ہیں ۔	بسم	20	Nom
لاری ڈرائیور جگن ناتھ فرار بتایا گیا ہے پولیس بگدل نے ضابطہ کی کارروائی انجام دی ۔	بگدل	9	Acc
دہلی سے شائع ہونے والا ماہنامہ طبی ڈائجسٹ الشفاء نئی دہلی کا مئی 2011 ء کا شمارہ منظر عام پر آ گیا ہے ۔	ڈائجسٹ	7	Nom
جوائنٹ کمشنر ٹرانسپورٹ نے توقع ظاہر کی کہ یکم مئی سے شروع کی جانے والی خدمات کامیاب رہےگی ۔	ٹرانسپورٹ	2	Acc
تلگودیشم پارٹی نے اس نشست کو 3 مرتبہ چیرکو متیم ریڈی کو اپنا امیدوار بناتے ہوئے دوباک نشست پر اپنا قبضہ برقرار رکھا تھا -	متیم	9	Nom
ملکان گیری تھانہ کے انچارج آر کے پاٹل نے بتایا کہ سنتوش نے جنوبی زون کے ڈی آئی جی پولیس سومیندر پریہ درشی کے سامنے خودسپردگی کی ۔	تھانہ	2	Acc
مسٹر پرکاش چوہان مقامی رکن اسمبلی نے افتتاح کیا ۔	پرکاش	1	Nom
انہوں نے قبل_ازیں تلنگانہ راشٹریہ سینا قائم کر کے ٹی آر ایس کے سی آر تلنگانہ راشٹریہ سمیتی میں ضم کر دیا تھا ۔	سمیتی	17	Acc
کینیڈانژاد ڈونلڈ میکے کلیپرشپ کا ڈیزائنر تھا اس کا تیارکردہ پہلا جہاز 200 فٹ لانبا تھا جو 1500 ٹن کارگو لے جانے کی صلاحیت رکھتا تھا ۔	کلیپرشپ	3	Acc
اعجاز بٹ جمعہ کو جوہانسبرگ روانہ ہو رہے ہےں جہاں وہ آئی پی ایل فائنل کے موقع پر جنوبی افریقہ ہندوستان , زمبابوے اور ویسٹ انڈین بورڈس کے سربراہوں سے ملاقاتیں کریں گے ۔	اعجاز	0	Nom
ستیہ سائی بابا 23 نومبر 1926 ء کو آندھراپردیش کے خشک ضلع اننت_پور کے اےک پسماندہ گاؤں پٹاپارتھی کے اےک معمولی خاندان مےں پیدا ہوئے تھے ۔	اننت_پور	12	Acc
انہوں نے کہا کِہ اس علاقہ میں 5 بڑے چمڑے کے کارخانے تھے ۔ جو کنور موضع بھونگیر کو منتقل ہو چکے ہیں ۔	کنور	15	Acc
انہوں نے بتایا کہ بی جے پی قائد پردیپ ساؤ کے قتل کے بعد ایف آئی آر درج کر دئے جانے کے بعد ان کے قتل کی تحقیقات کا آغاز کر دیا گیا ہے ۔	پردیپ	8	Nom
پرکاش کرت نے کہا کہ ریاستی حکومت آمدنی کا پچاس فیصد حصہ چاہتی ہے ۔	کرت	1	Acc
حماس کی وزارت داخلہ نے سزائے موت کا ویب سائیٹ پر اعلان کرتے ہوئے کہا کہ مجرمین شادی معضون ، رید مجاسی اور شادی احمد ان ہلاکتوں کے علاوہ دیگر جرائم کے مرتکب بھی پائے گئے ہیں ۔	رید	20	Nom
رائے جو ترنمول کانگریس کے جنرل سکریٹری بھی ہیں نے کہا کہ ممتا نے مرکزی وزیر فینانس پرنب مکرجی سے طوفان کے متعلق فون پر بات چیت کی -	ممتا	12	Acc
اللہ تعالی کی عطاکردہ نعمتوں میں صحت سب سے بڑی نعمت ہے ۔	تعالی	1	Acc
ممبئی کے لیے آؤٹ ہونے والے کھلاڑیوں مےں سچن تنڈولکر ( 35 ) اور امبتی رائیڈو ( 37 ) اور اوپنر جیمس فرینکلن ( 6 ) نے اپنا کردار ادا کیا ۔	فرینکلن	22	Acc
مولانا سید شریف الحسن ترمذی ، سابق صدر مجلس علمیہ آندھرا پردیش مرحوم کے پوتے سید انصر حسین ترمذی فرزند اصغر حسین کا نکاح سید صدیق احمد سکریٹری مجلس تحفظ ختم نبوت نلگنڈہ کی دختر سے انجام پایا ۔	اصغر	20	Nom
مسٹر سنگھ کی پیدائش 26 ستمبر 1932 ۶ کو پنجاب کے موضع گہہ میں ہوئی ، جو اب پاکستان میں واقع ہے ۔	1932	6	Acc
صدر ایران محمود احمدی نژاد نے دورہ پاکستان کے موقع پر صدر پرویز مشرف اور وزیراعظم یوسف رضا گیلانی سے ملاقات کی ۔	احمدی	3	Nom
حضور صلی_اللہ_علیہ_وسلم نے اس سونے کو حضرت سلمان فارسی رضی اللہ عنہ کے حوالے کر دیا , اس طرح آپ آزاد ہو گئے اور اپنے آقا صلی اللہ علیہ وسلم کے دامن پناہ مےں پہنچ گئے ۔	حضور	0	Nom
اس طرح امریکہ کو پھر ایک مرتبہ زبردست سفارتی شکست ہوئی اور وہ ایران پر دباؤ ڈالنے کے لیے ہندوستان کو استعمال کرنے کے مقصد میں ناکام رہا ۔	ایران	13	Acc
نیٹکو ٹائیلس کو اس سال 2007 - 08 ء میں 51.02 کروڑ روپئے کا منافع ہوا جو پیداوار کا 34 فیصد ہے ۔	نیٹکو	0	Acc
پرجا راجیم اپنی تشکیل سے آج تک سیکولرازم کے ایجنڈے پر قائم ہے اور مستقبل میں بھی قائم رہنے کا ایک سے زائد مرتبہ چرنجیوی نے اعلان کیا ہے ۔	چرنجیوی	24	Acc
نو میعاد کے رکن مانک راؤ گویٹ جو 27 سال اور آٹھ ماہ کا اجتماعی پارلیمانی تجربہ رکھتے ہیں ۔ ان کے عبوری اسپیکر کے طور پر مقرر کیے جانے کا امکان ہے ۔	گویٹ	6	Nom
کلیان سنگھ نے سماج وادی پارٹی کی تائید سے بحیثیت آزاد امیدوار مقابلہ کیا تھا ۔	کلیان	0	Nom
مسٹر نوین پٹنائک کو آج مسلسل تیسری میعاد کے لیے چیف منسٹر اڑیسہ کی حیثیت سے حلف دلایا گیا ۔	اڑیسہ	12	Acc
دہلی پولیس کے ترجمان راجن بھگت نے کہا کہ اس کیس کو تحقیقات کے لئے خصوصی سیل منتقل کیا گیا ہے ۔	بھگت	5	Acc
پاکستان کی ایک عدالت نے جماعت الدعو کے سربراہ حافظ محمد سعید کی گرفتاری کو چیلنج کرتے ہوئے پیش_کردہ درخواست کی سماعت کل تک کے لیے ملتوی کر دی ۔	پاکستان	0	Acc
مولانا محمد امجد علی قاسمی حال_مقیم امریکہ و رکن تاسیسی مجلس تحفظ ختم نبوت نے مسجد اکبری ، اکبر باغ میں منعقدہ مجلس تحفظ ختم نبوت کے اجتماع میں اپنے خطاب کے دوران ان خیالات کا اظہار کیا ۔	نبوت	13	Acc
عظیم۔تر بلدیہ حیدرآباد 18 سرکلس پر مشتمل ہے ۔	عظیم۔تر	0	Nom
11 جنوری 2002 ء کو تیاگی کی زیر قیادت ایک خصوصی پولیس ٹیم نے رویندر نامی شخص کے مکان پر چھاپا مارا تھا اور بعدازاں اس شخص کو پولیس ٹیم کی جانب سے ہلاک کر دیا گیا تھا ۔	تیاگی	5	Acc
جبکہ سیزن کے پہلے گرانڈ سلام آسٹریلین اوپن کے تیسرے راؤنڈ مےں انہیں روسی ٹینس اسٹار الیسا کلیبینوا نے شکست دی تھی ۔	الیسا	16	Nom
جن مےں راجیو دھون ' پی پی راؤ ' انوپ جارج چودھری اور یوسف مچھالا شامل ہےں ۔	مچھالا	14	Nom
گورنر مسٹر ایم بی بھنڈاری نے 62 سالہ مسٹر پٹنائک کو عہدہ اور رازداری کا حلف دلایا ۔	پٹنائک	9	Acc
تاہم دورہ کرنے والے دوسرے گرو 66 سالہ سنت نرنجن داس کی حالت مستحکم بتائی جاتی ہے ۔	نرنجن	9	Nom
حضرت عوف رضی اللہ عنہ نے گھر پہنچ کر اپنی بیوی سے بتایا اور دونوں نے پڑھنا شروع کر دیا ۔	عوف	1	Nom
پرسٹن اسکول کال سنٹر کے لکچرار محمد حقانی نے مخاطب کرتے ہوئے کہا کہ اس دستاویزی فلم سے کافی کچھ معلومات حاصل ہوئی اور آج کے دور میں ہمارے لوگ بھی اردو پر توجہ نہیں دے رہے ہیں ۔	پرسٹن	0	Nom
یعنی عزازیل کو شیطان کس نے بنایا ؟ ۔	عزازیل	1	Acc
انہوں نے کہا کہ پارٹی حالیہ انتخابات میں اس مایوس_کن مظاہرے کی تمام_تر وجوہات ، خاص طور پر مغربی بنگال اور کیرالا میں خراب مظاہرے پر غور و خوض کرے گی ۔	کیرالا	21	Acc
یہ واقعہ کانپور کے مکانپور ارولی دیہات مےں پیش آیا ۔	ارولی	5	Acc
مجلس بلدیہ حیدرآباد نے 150 بلدی حلقوں کی ترتیب دی ہے لیکن اس ازسرنو حدبندی میں بلدی حلقہ چارمینار کو شاہ علی بنڈہ اور حسینی علم میں تقسیم کرتے ہوئے بلدی حلقہ چارمینار کو ختم کر دیا گیا ۔	چارمینار	32	Acc
1807 ء مےں کلیرمونٹ نے نیویارک سے البانی کے درمیان 150 میل کا سفر اےک رات قیام کے ساتھ 30 گھنٹوں مےں طئے کیا تھا ۔	البانی	7	Acc
تم لوگوں کے ہر ظلم کا بدلہ انشاءاللہ تحریک غلبہ اسلام ( ٹی ۔ جی ۔ آئی ۔ ) لے کر رہے گی ۔	اسلام	10	Acc
اب پانچ مسلم ورکرس نے باضابطہ شکایات پولیس کے علاوہ سکیورٹی سرویس کے کام کی نگرانی کرنے والے ادارہ اور اپنے مقامی رکن پارلیمنٹ فرینک ڈابسن کو پیش کی ہیں ۔ دی انڈیپنڈنٹ نے آج یہ بات کہی ۔	فرینک	24	Nom
تلگو دیشم دور حکومت کے آخری سال 2003 ۔ 2004 میں آندھرا پردیش کا بجٹ خسارے میں تھا ۔	2004	9	Acc
شہر حیدرآباد سے 3 قائدین ششی_دھر ریڈی , ڈی ناگیندر اور مکیش کے نام زیر غور ہیں -	ناگیندر	9	Acc
پولیس انسپکٹر سکرتار سنگھ نے یہ بات بتائی ۔	سکرتار	2	Nom
تمام فریق مسئلہ کشمیر کا مستقل حل نکالنے کے خواہاں ہیں ۔	کشمیر	3	Acc
کل فرنچ اوپن کا آغاز ہو رہا ہے اور سفینا پہلی مرتبہ کسی گرانڈ سلام میں بحیثیت نمبر ون کھلاڑی شرکت کر رہی ہیں -	سفینا	9	Nom
اعجازبٹ نے کہا کہ سری لنکا اور ہندوستان کے دوروں کے بعد صورتحال مےں بہتری آنے کا امکان ہے ۔	اعجازبٹ	0	Acc
انہوں نے جنرل سکریٹری اے آئی سی سی و انچارج اُمور آندھرا پردیش مسٹر ویرپا موئیلی سے ملاقات کی اور ریاست میں کابینہ کی تشکیل کے بارے میں تبادلہ خیال کیا ۔	اُمور	10	Nom
قبل_ازیں نارائن رانے نے شیوسینا پر دھاوا بولتے ہوئے ایوان مےں کہا کہ کم و بیش 10 سے 11 کاروباری افراد نے جیتا پور پروجیکٹ کو بند کرنے کے لیے 500 کروڑ روپے کی سپاری دی ہے ۔	شیوسینا	4	Acc
اٹاپٹو دور انگلینڈ کے لیے منعقد ہونے والے تربیتی کیمپ مےں عبوری کوچس اسٹیورٹ لای , چمپاکارا منائیکے اور رووان کلپگے کے ساتھ ٹیم مےں شمولیت کریںگے ۔	انگلینڈ	2	Acc
اڑیسہ اور آندھراپردیش کی سرحد پر سرگرم ماونواز لیڈر سنتوش عرف ساریامی ڈورا نے اڑیسہ کے ملکان گیری تھانہ مےں آج خودسپردگی اختیار کر لی	ڈورا	12	Acc
ان کی نماز جنازہ جامع مسجد کوہیر مےں مولوی سید مقصود علی نے پڑھائی ۔	کوہیر	6	Acc
حضور صلی اللہ علیہ وسلم کے سامنے آپ نے پوری روداد سفر سنا دی ۔	حضور	0	Acc
یوگیتا اشوک ٹھاکرے , جو صدر اسٹیٹ بی جے پی نتن گڈکری کی ملکیت والی ایک کار میں پُراسرار حالات میں مردہ ملی تھی ۔ اُس کے اندرونی کپڑوں پر خون کے دھبے پائے گئے ہیں ۔	یوگیتا	0	Nom
حکومت گجرات نے آج ہائیکورٹ کی تجویز پر عمل کرتے ہوئے آئی پی ایس عہدیداروں پی پی پانڈے , جی ایل سنگھل اور اے سی پی ترون بروت کا تبادلہ کر دیا ۔	ترون	26	Nom
سی پی آئی ایم پولیٹ بیورو رکن سیتارام یچوری نے الیکشن کمشنر سے ملاقات کرتے ہوئے وزارت داخلہ پر الزام عائد کیا کہ وہ دانستہ طور پر ریاست مےں سیاسی اموات کی تفصیلات کو سامنے لائی ہے ۔	پولیٹ	4	Nom
تلنگانہ برہمن جے اے سی کے لیڈر بھانو مورتی نے کہا کہ تلنگانہ مےں برہمن درحقیقت اےک خوشحال طبقہ نہیں ہے ۔	مورتی	8	Acc
انہوں نے مزید کہا کہ بچوں کو دنیا کی تعلیم کے ساتھ اللہ اور اُس کے رسول صلی اللہ علیہ وسلم کے بتائے ہوئے راستے پر لے کر چلنا اصل کامیابی ہے ۔	علیہ	19	Nom
انہوں نے کہا کہ وزیراعظم نتن یاہو کو یہ تیقن دیا گیا ہے کہ ایران کو کسی بھی قیمت پر نیوکلیر توانائی کا حامل ملک بننے نہیں دیا جائے گا ۔	ایران	14	Acc
اس موقع پر ڈاکٹر وی ہری کمار سی ای او بھارتیہ ویدیا ویدھان لمیٹیڈ و دیگر موجود تھے ۔	لمیٹیڈ	13	Nom
پولیس شیورام پلی نے اس خصوص مےں مقدمہ درج کر لیا ہے اور تحقیقات جاری ہیں ۔	شیورام	1	Nom
فلک۔نما ناگل بنڈہ مین روڈ پر کل دن دہاڑے پولیس پر اندھا۔دھند فائرنگ کے سنسنی۔خیز واقعے کی تحقیقات میں پولیس نے شدت پیدا کر دی ہے ۔	ناگل	1	Nom
اس سمینار سے سکریٹری تنظیم المساجد شاہد الرشید کے علاوہ غوث محی الدین موظف صدر مدرس نے بھی مخاطب کیا ۔	الرشید	7	Acc
رکن اسمبلی مسٹر مہیندر ریڈی نے کہا کہ تلنگانہ سے تعلق رکھنے والے جوائنٹ کلکٹر کو سازش کرتے ہوئے معطل کروایا گیا ۔	مہیندر	3	Nom
جبکہ جناب شیخ عبید بن عثمان العمودی اور جناب غلام حامد خان نقشبندی چشتی قادری مہمان خصوصی کی حیثیت سے شرکت کریں_گے ۔	العمودی	6	Nom
کیڈمیم آکسائیڈ ایسا کیمیائی مادہ ہے جو کہ ٹیلی_ویژن کے بلیک اینڈ وہائٹ اور کلر ٹیوب مےں گرین فاسفورس کی شکل مےں استعمال کیا جاتا ہے ۔	کیڈمیم	0	Nom
انا ہزارے ، شانتی بھوشن ، پرشانت بھوشن ، سنتوش ہیگڑے اور کیجری وال کو اس مےں شامل کیا گیا تھا جبکہ مرکزی وزرا مےں پرنب مکھرجی ، پی چدمبرم ، سلمان خورشید ، ویرپا موئیلی بھی شامل تھے ۔	ہزارے	1	Nom
جنرل سرتھ فونسیکا نے ریاستی ٹیلی ویژن کو بتایا کہ سری لنکا کو تباہ و برباد کرنے والے باغی قائد پربھاکرن کی نعش ابھی کچھ گھنٹہ قبل میدان جنگ سے دستیاب ہوئی ہے ۔	فونسیکا	2	Acc
ان روپیوں میں سے سائیلو نے اپنا قرض ادا کرنے کے لیے میڈیکل مالک سرینواس کو 43 ہزار روپئے دے دیے -	سرینواس	14	Acc
آل انگلینڈ کلب کے چیف ایگزیکٹیو ربان رٹچی نے کہا کہ 125 چیمپین_شپ مےں جملہ انعامی رقم 23.8 ملین ڈالرس کر دی گئی ہے ۔	125	11	Nom
وہ جہاں پرجا راجیم انتخابی منشور کمیٹی کے صدرنشین ہیں وہیں پرجا راجیم تادیبی کمیٹی , سیاسی اُمور کمیٹی اور لیگل سیل کے سربراہ کی حیثیت سے خدمات انجام دے رہے ہیں ۔	راجیم	3	Nom
دوسری جانب ویسٹ انڈیز ٹیم بھی یکساں صورت_حال کا سامنا کر رہی ہے ، جس کے کپتان کریس گیل خود پہلے میچ کے آغاز سے 48 گھنٹے قبل انگلینڈ پہنچے ہیں ۔	ویسٹ	2	Nom
گیل کی آمد اور سری لنکائی ٹیم کے نئے کپتان تلک رتنے دلشان کے ہمراہ اے بی ڈی ولیئرس اور ویراٹ کوہلی کی موجودگی کے بعد بنگلور ٹیم کا بیٹنگ شعبہ کاغذ پر کافی مضبوط دکھائی دے رہا ہے	ولیئرس	18	Acc
لیکن مقام کا قطعی تعین نہیں کیا تھا لیکن انتخابی نتائج کے فوری بعد پارٹی کے بعض اہم قائدین کے ساتھ تفصیلی تبادلہ_خیال کرنے کے بعد مہاناڈو پروگرام کے مقام کو بھی قطعیت دے دی گئی ہے ۔	مہاناڈو	26	Nom
قبل_ازیں مسٹر سنگھ , ریزرو بینک آف انڈیا کے گورنر ، وزیر فینانس اور دیگر اہم عہدوں پر فائز رہنے کے بعد 22 مئی 2004 کو ، وہ ملک کے پہلے سکھ وزیراعظم بنے ۔	2004	24	Acc
جنت تین آدمیوں کی مشتاق ہے , یعنی حضرت علی , حضرت عمار بن یاسر اور حضرت سلمان فارسی رضی اللہ عنہمہ کی ۔	عمار	12	Nom
جسٹس رجنا دیسائی اور آر کے کیٹکر نے آدرش ہاؤزنگ سوسائٹی اسکےم سے متعلق سماعت کرنے کے بعد ان ہدایات کو جاری کیا ۔	ہاؤزنگ	9	Nom
انہوں نے بتایا کہ تبت کے علاقہ میں چاول کی زبردست مانگ ہے جبکہ اس کو تجارتی فہرست میں شامل نہ کئے جانے کے سبب ہندوستانی تاجرین اس کی تبت کو تجارت سے قاصر ہیں ۔	تبت	4	Acc
مکہ مسجد بم دھماکے کیس کی تحقیقات کا آغاز کرتے ہوئے نیشنل انوسٹی گیشن ایجنسی ( این آئی اے ) نے ایجنسی کے سربراہ مسٹر ایس سی سنہا کی قیادت مےں آج مکہ مسجد کا معائنہ کیا ۔	ایجنسی	14	Acc
وہاں کے لوگوں نے حضرت موسیٰ علیہ السلام سے درخواست کی کہ آپ دعاء فرمائیں کہ اللہ تعالیٰ حقیقت حال ظاہر فرما دے ۔	موسیٰ	5	Nom
الحاج حافظ محمد غوث رشیدی نگرانی کریں_گے ۔	رشیدی	4	Acc
گورنر گووا ڈاکٹر ایس ایس سدھو کے خصوصی سکریٹری این رادھا کرشنا نے درخواست داخل کرتے ہوئے گوووا ریاستی انفارمیشن کمیشن کے احکام کو چیلنج کیا تھا ۔	گووا	1	Nom
