Významnou událost umožnili mnozí sponzoři z Rakouska ( včetně nechvalně proslulého Warimpexu ) , z domácích se přidaly filiální Casinos Czechoslovakia .	Warimpexu	11	Inan
Četrans oslovil sedm velkých evropských výrobců nákladních automobilů .	Četrans	0	Inan
V nedělním hlasování se bude rozhodovat o tom , zda má tato alpská země vynaložit 14 miliard švýcarských franků na stavbu železniční trasy přes průsmyk sv . Gottharda a Lötschberg .	Gottharda	27	Anim
Alcar a ceny	Alcar	0	Inan
RNDr . Josef Chalupský , CSc .	Chalupský	3	Anim
Žijící legenda - SYMBOL BAUCH *	BAUCH	4	Anim
Podle informací LN činí například české pohledávky v Jemenu 739 miliónů korun , v Súdánu 1.19 miliardy korun a v Mosambiku 411 miliónů korun .	Súdánu	14	Inan
Na největší burzu pirátských videokazet narazila Česká protipirátská unie v Potůčkách nedaleko Karlových Varů .	Varů	13	Inan
Na Příbramsku s ní již # září začal Státní statek Sedlčany , provozovna Kosova Hora za pomoci posluchačů Zemědělského odborného učiliště ze Sedlčan , kteří se zavázali vybrat brambory z # hektarů .	Sedlčany	10	Inan
Trhu dominovala IBM , k dalším výrazným výrobcům patřily společnosti CDC , RCA , o něco později Burroughs , Amdahl a Cray Research .	CDC	10	Inan
Hráčem s nejvyšší roční smlouvou v NHL , který startuje v současné době na mistrovství světa v Itálii , je Joe Sakic z celku Quebec Nordiques .	Quebec	24	Inan
Na potížích se podepsal i příliš optimistický předpoklad vedení , že na domácím trhu uspěje s kvalitními pokladnami pro obchody a restaurace v licenci firmy Anker .	Anker	25	Inan
Dobal předloží " rasové důvody " Ústavnímu soudu	Dobal	0	Anim
ČSAD Český Těšín 78 116	Těšín	2	Inan
Skvělým debutovým albem Life ( 1990 ) se Inspiral Carpets přesně trefili do někdejšího vkusu posluchačů .	Life	3	Inan
O rafinerie se již ucházejí vlastními projekty Mezinárodní ropné konsorcium IOC ( složené z Agip , Conoco , Shell a Total ) , a . s . Chemapol a s . r . o . Inekon .	Shell	18	Inan
Paštuni jsou v Afghánistánu nejen nejsilnější , ale také státotvorní : z jejich řad vyšla většina vládců země .	Paštuni	0	Anim
Na dotaz , proč nezůstalo jen u zmrazení účtů , R . Salzmann uvedl , že ani toto opatření nebylo stoprocentně spolehlivé .	Salzmann	12	Anim
V krátkém sledu již třetí kniha na téma Dalí představuje malířův pohled na svět , jak vyplynul z rozhovoru se známým propagátorem kouzelnických jiter Louisem Pauwelsem .	Dalí	8	Anim
Foto : ČSTK - Vladislav Galgonek	Galgonek	5	Anim
Německý reprezentant Matthias Sammer podepsal smlouvu s Borussií Dortmund do 30 . 6 . 1999 .	Sammer	3	Anim
Český ministr se také sešel s kanadským ministrem zahraničního obchodu Royem MacLarenem .	Royem	10	Anim
( LN 31 . 1 . 1995 ) Hynku Krátkému z jeho článku úplně zmizela učiliště .	Krátkému	9	Anim
Jan sám se podpisoval jako rodilý z Pomuku " Johannes filius Welfini de Pomuk " .	Johannes	9	Anim
Vyšetřující soudce Beffi , který se zabývá úplatkářskou aférou Ol . Marseille , dostal několik výhrůžných dopisů , jejichž autory jsou s největší pravděpodobností fanoušci jihofrancouzského fotbalového týmu .	Ol	9	Inan
Největší problém jsou peníze , které nám stále scházejí , " řekl nám technický náměstek DPMO Rudolf Pavelek .	Pavelek	17	Anim
Poté zavítal do JZD Vratimov u Ostravy , kde mají nový typ senážních věží o průměru devět metrů a kapacitě # krychlových metrů .	Vratimov	4	Inan
Souběžně s porážkou Hezbe islámí začal údajně rozklad jiné paštunské organizace , Ittihádu , jehož bojovníci přebíhají na stranu islámských studentů .	Ittihádu	12	Inan
Tentokrát zdolala v domácím prostředí Frýdek - Místek 2 : 0 , když obě branky vstřelil Bartl , který dvakrát skóroval i v minulém kole .	Bartl	16	Anim
K nejvýznamnějším z několika desítek dodnes zachovaných pyramid , ležících asi v šedesát kilometrů dlouhém pásu , sahajícím od Káhiry k Fajjúmu , náleží pyramidy vybudované v Gíze .	Fajjúmu	21	Inan
Včera to sdělil ředitel Celního úřadu Břeclav - dálnice Zdeněk Belica .	Belica	10	Anim
Ludvík Vaculík píše : Vláda možná nedovažuje jednu věc : znakem dnešního režimu není jenom to , že trhovci na zlínském náměstí si můžou konkurovat cenami svého zboží , ale i to , že nemůžou .	Vaculík	1	Anim
Překvapivé vítězství Turnova	Turnova	2	Inan
Taliban už několikrát vyzval vojska prezidenta Rabbáního , ovládající Kábul , aby se stáhly na pozice , které držely před porážkou Hezbe islámí .	Taliban	0	Inan
Tak jsem byl z více stran informován o poradách špiček národních socialistů u Englišů , kde se promýšlela strategie a taktika .	Englišů	13	Anim
Zahrnovala kromě semtexu osm raket země - vzduch Stinger , komunikační a odposlouchávací zařízení , 400 pistolí a 100 samopalů a množství munice .	semtexu	2	Inan
Některé - například Spilwut - přišly snad pokaždé s jinou částí svého repertoáru , jiné zase - třeba kvarteto Hofgesindt , i tak jeden z nejzajímavějších souborů - ohrávaly neustále dvě skladby .	Hofgesindt	19	Inan
50 procentní podíl akcií Saab - Scania na výrobci osobních automobilů Saab Automobile by měl být převeden na holding Investor .	Automobile	12	Inan
Maďarský prezident Árpád Göncz včera jmenoval Lajose Bokrose ministrem financí , Tamáse Suchmana ministrem bez portfeje , který bude odpovídat za privatizaci , a Györgye Surányiho předsedou Maďarské národní banky .	Suchmana	12	Anim
Martin Koloc , vedoucí jezdec Evropského poháru tahačů v divizi Race Trucks , je připraven příští víkend potvrdit své výborné postavení při VC České republiky , dalším podniku EP na mosteckém automotodromu .	EP	28	Inan
V podstatě je to konflikt mezi předsedou svazu Jäkelem , nová liga je totiž jeho dítětem , a pokladníkem Düsseldorfu Gossmannem , za nímž stojí velké kluby . "	Düsseldorfu	19	Inan
Další utkání : Zimbabwe - Mauritius 1 : 0 ( 1 : 0 ) .	Mauritius	5	Inan
Ve finále exhibičního turnaje v New Havenu zvítězila Američanka Martina Navrátilová nad českou tenistkou Janou Novotnou 7 : 5 , 7 : 5 .	Havenu	6	Inan
Skloform , ryze česká akciová společnost , předběhl záměr vybudovat soukromé stomatologické zařízení v Českých Velenicích s rakouskou kapitálovou účastí .	Skloform	0	Inan
* Forgáč informoval přítomné o tom , že se koná zasedání pléna KRB horských a podhorských oblastí , nutno zabezpečit účast * Švihly , * Zuny a * Bretfelda .	Švihly	22	Anim
Návrh Plánu aktivity ZO ROH při LŠU v Hranicích a v Lipníku nad Bečvou byl schválen .	Lipníku	11	Inan
Dvě kapely nás bezesporu ovlivňují - Red Hot Chilli Pepper a Pearl Jam .	Jam	12	Inan
Musím zdůraznit , že nevypovídáme žádné terminované vklady , řekl včera v rozhovoru pro LN a Českou televizi generální ředitel Komerční banky Richard Salzmann .	Salzmann	23	Anim
Revue Literatura , vzniklá odštěpením od polofilozofických Problemů , má opravdu vynikající úroveň .	Problemů	7	Inan
Ze stříbrného týmu z MS tak bude ve slovinském Mariboru chybět jen zraněný obránce Maldini , jehož místo by měl zaujmout klubový kolega z AC Milán Panucci .	Maldini	14	Anim
Tucson , kde skleníky jsou , leží ve výši 700 metrů nad mořem .	Tucson	0	Inan
Je chybou autokrativně rozhodujícího Ivana Hlinky , že po bezbarvém vystoupení na olympijských hrách naivně vložil svou důvěru i do hráčů , kteří ho v Lillehammeru nemohli nezklamat .	Lillehammeru	25	Inan
Bývalého generála sovětského strategického letectva nezapře Džochar Dudajev vzorně salutující na slavnostní přehlídce uspořádané při příležitosti třetího výročí vyhlášení nezávislosti Čečenska na Rusku	Džochar	6	Anim
Film Krásný Serge znamenal nejen debut osmadvacetiletého francouzského režiséra Clauda Chabrola , ale dodnes je považován za dílo , které ohlásilo nástup jednoho z nejvýznamnějších hnutí v historii kinematografie - Francouzské nové vlny .	Clauda	9	Anim
V případě radikálů z Damašku Ahmeda Džibríla a Nájifa Havatmy se nelze divit , že se ozvali , když je ministr zahraničí Peres vybraně urazil .	Havatmy	9	Anim
Souvisí to s naší životosprávou , zejména s nadměrným požíváním tuků , omezeným pohybem atd . , vysvětluje vedoucí oddělení hygieny výživy KHS Č . Budějovice Peter Horan .	Horan	27	Anim
Hynek Mühlbach , IC Banka : první den dojde k souběhu objednávek tuzemských firem i zahraničních klientů na tituly stanovené na základě dlouhodobější analýzy .	Hynek	0	Anim
Olympijští vítězové z Lillehammeru a třetí celek z posledního mistrovství světa je největším favoritem turnaje .	Lillehammeru	3	Inan
Český Woodstock začíná v Trutnově	Trutnově	4	Inan
Úvod druhé části záznamu otevírá sólo bubeníka Maxe Roache , který virtuózně hraje a improvizuje svou skladbu Mr . Hi Hat .	Hi	19	Anim
Jan Talich st . a ml . byli přes několik zvukových a intonačních nedotažeností velmi dobří a doslova spolu dýchali .	Talich	1	Anim
Na pozadí v podstatě banálního příběhu rozehrává Řezníček s nenasytnou chutí hraničící až s obžerstvím hostiny imaginace a humoru , které však zdaleka nejsou samoúčelné .	Řezníček	7	Anim
Do pobočného závodu AZNP Kvasiny , připojeného k mladoboleslavské automobilce v roce # současně se závodem AZNP Vrchlabí , byla převedena výroba automobilu Škoda Octavia Combi .	AZNP	3	Inan
Překonali tím rekordní rozdíl , kterým kdy tento klub vyhrál - dosud platilo 155 : 116 z 30 . prosince 1990 proti Utahu .	Utahu	22	Inan
Organizuje I . T . E . Technical Services , s . r . o . , Mikuláše z Husi 12 , 140 00 Praha 4 , tel . / FAX : ( 02 ) 422026 .	Services	8	Inan
Kromě Osgooda , Webba , Harrise a Hollinse tu hráli ještě tak výborní fotbalisté jako Bobby Tambling , Terry Venables a hlavně Jimmy Greaves , který drží dosud všechny klubové střelecké rekordy .	Hollinse	7	Anim
Zatímco karibští Indiáni strčili do úst kousek surové gumy v té podobě , jak jej utrhli od kůry , Mayové na poloostrově Yucatán přivedli žvýkání na vyšší úroveň .	Yucatán	22	Inan
Předsedkyně ÚVOS , soudružka Hana Růžičková , zhodnotila během pracovní diskuse vzájemné styky mezi našimi bratrskými svazy a navrhla další účinné formy spolupráce v nejbližších letech .	ÚVOS	1	Inan
V úterý pokračovala Rallye Paříž - Peking 760 km dlouhou etapou z Hami do Jiayuguanu .	Jiayuguanu	14	Inan
Dodávky byly plněny v rámci Státního statku Polerady .	Polerady	7	Inan
Obchod s Čínou se v naší statistice ukrývá pod položkou státy se systémem státního obchodu , kam dále metodicky patří KLDR , Kuba , Vietnam a Mongolsko .	Vietnam	24	Inan
Jak uvedl včera na tiskové konferenci majitel firmy FALL František Urik , má jeho společnost zájem o koupi stoprocentního podílu na pivovaru Bohemia Rakovník .	FALL	8	Inan
Přinejmenším 25 ruských vojáků přišlo o život , když v sobotu na jižním předměstí čečenské metropole Grozného vybuchla dosud blíže nespecifikovaná trhavina .	Grozného	16	Inan
Emmerson Fittipaldi v závěru kariéry ve formuli 1 jezdil na brazilském voze Copersucar , který by se měl objevit na brněnském okruhu na přelomu září a října	Emmerson	0	Anim
Zmíněná čtvrtmiliardová dotace byla poskytnuta automobilce Tianjin Automotive Industry Corp . na zvýšení výroby ze současných 60 tisíc na 150 tisíc vozů ročně .	Industry	8	Inan
Novinkou je smlouva s AB Barrandov na české filmy od roku 1965 , které by se do distribuce měly dostat v dubnu .	Barrandov	5	Inan
Založení chovu však může stát víc než nový favorit	favorit	8	Inan
V * oblastech v povodí velkých řek , jako jsou Nil , Eufrat , Tigris , Indus , Ganges a Jang - c ' - ťiang , vznikají ve starověku velké říše se svéráznými architekturami .	Tigris	14	Inan
Krále Ludvíka XIII . hraje Zdeněk Žák , kardinála Richelieu Pavel Pípal , starého D ' Artagnana Otakar Brousek starší .	Brousek	18	Anim
Proíránská Organizace islámské svaté války ( Džihád ) mezitím v telefonickém rozhovoru s agenturou AFP v Bejrútu oznámila , že nalezené ostatky jsou Williama Buckleyho .	Bejrútu	16	Inan
Klobouk naopak smekám před výkonem obránce Hořavy , který v poslední třetině téměř nestřídal . "	Hořavy	6	Anim
Valeček z rady odstoupil poté , co třináct členů opavského zastupitelstva v otevřeném dopise upozornilo na jeho minulost vedení města .	Valeček	0	Anim
Největším problémem Chrysleru bylo , že mu scházel přiměřený nový výrobek .	Chrysleru	2	Inan
Vydal ERM , Praha 1994 , jako 3 . svazek Edice světové prózy .	ERM	1	Inan
Hvězdou festivalu má být především někdejší člen skupiny Jethro Tull Mick Abrahams , který přijede se svou novou skupinou .	Abrahams	11	Anim
Britský boxer Chris Eubank obhájil v Cardiffu podvanácté svůj titul mistra světa v polotěžké váze Světové boxerské organizace ( WBO ) .	Cardiffu	6	Inan
Bytovou výstavbu na části pozemku Salavova zahrada nelze uskutečnit , uplatňuje zde nárok bytové družstvo z Košíř Rodom .	Rodom	17	Inan
Zítra jedu na utkání Slovensko - Francie , kam mají přijet šéfové UEFA pánové Johansson a Aigner .	Johansson	14	Anim
Jak upřesňuje P . Horan , poradna nabízí tyto služby zdarma , neboť jde o součást programu dotovaného ministerstvem zdravotnictví .	Horan	4	Anim
Stock Consult důvěřuje movitým	Consult	1	Inan
Na třítýdenní ozdravný pobyt do městečka Villach v rakouských Korutanech odjela včera skupina sedmdesáti dětí ze smogem ohrožených severočeských měst Most a Děčín .	Most	20	Inan
Německý cyklista Heiko Latocha samostatným únikem v posledních 40 km rozhodl o svém vítězství ve třetí etapě závodu Bohemia .	Heiko	2	Anim
Ve studiu C Radima Pařízka sice nahrávají většinou tvrdé kapely , ale řekli jsme si , že to zkusíme u nich v Direktu .	Radima	3	Anim
Za nejzajímavější zápas prvního kola je považován souboj Chorvata Ivaniševiče ( nasazen jako č . 5 ) a Švýcara Rosseta , který v Barceloně porazil Ivaniševiče ve třech setech a získal olympijské zlato .	Rosseta	19	Anim
Vedle Viktora Tichonova a kanadských koučů Renneyeho a Dubého na něm přednáší i bývalý brankář československé reprezentace a mistr světa z Prahy 1985 Jiří Králík .	Dubého	8	Anim
Prvního září šli školáci do školy a novináři do pražského Abakusu .	Abakusu	10	Inan
Galerie dá šanci také žákům místní základní umělecké školy , později zde vystaví např . Bořivoj Borovský , Jaroslav Jebavý , Iva Ohrabková , Jiří Lacina a další .	Bořivoj	15	Anim
Druhý skončil nejrychlejší muž v tréninku Gordon s Lolou Ford Cosworth .	Cosworth	10	Inan
Jednotné zemědělské družstvo Rozvoj Brandýs mělo letos oseto pšenicí # hektarů .	Rozvoj	3	Inan
Dodnes legendární snaživý premiant z Fričových " študáckých " komedií , rozšafný policista Mrázek z Hříšných lidí města pražského , v dabingu kongeniální alter ego Louise de Funèse , v rozhlase a na gramofonových deskách neodolatelný vyprávěč .	Louise	25	Anim
O právu odborů na spolupřípravu sociálních zákonů přesvědčoval včera Richard Falbr i diváky v televizní Aréně .	Falbr	10	Anim
Coppola , jenž po svém Draculovi patrně našel zalíbení v nelidských příšerách , svěřil svůj projekt čtyřiatřicetiletému herci , divadelníkovi a filmaři , u nás známému snímky Jindřich V . a Znovu po smrti .	Draculovi	5	Anim
Úspornější tahače Četransu	Četransu	2	Inan
Převážně nová herecká sestava ( v rolích Vilmy a Primáře se v lednu představí ještě Ivana Chýlková a Pavel Landovský ) prokázala hned napoprvé ( což nebývá obvyklé - připomeňme si problémy staro - nových souborů ) svou životaschopnost .	Landovský	19	Anim
Galerie Behémót , Praha .	Behémót	1	Inan
Zásah pořádkových sil byl podle J . Tuchyni přiměřený a předešlo se jím možná daleko těžším následkům .	Tuchyni	7	Anim
Jan sám se podpisoval jako rodilý z Pomuku " Johannes filius Welfini de Pomuk " .	Pomuk	13	Inan
Největším akcionářem zůstává s 24.5 procenta Creditanstalt , zatímco Fond národního majetku , který držel 25.2 procenta akcií , již 13 procent prodal .	Creditanstalt	6	Inan
Kromě toho vyplynulo z celkového jednání , že je reálný předpoklad , aby byly založeny dvě další základní organizace SSM ve Dvoře Králové a ve Vrchlabí .	Dvoře	21	Inan
Na videozáznamu , který zveřejnila proíránská šíitská organizace " svatých bojovníků za svobodu " , Kemptner čte připravené prohlášení , v němž vyzývá spolkového kancléře Helmuta Kohla , aby omilostnil bratry Hamadíovy .	Kemptner	15	Anim
Druhou zkoumanou lokalitou byl Chvojen u Benešova u Prahy .	Chvojen	4	Inan
S tím souhlasil také kladenský trenér Jan Poštulka , který dodal : Na výkonu mužstva se podepsalo páteční rozhodnutí disciplinární komise , která nám odebrala tři body za neoprávněný start Petra Svobody v utkání s Turnovem .	Turnovem	35	Inan
Do úvodní kvalifikace proti Bělorusku ( 29 . 3 . v Ostravě ) totiž nesmí nikdo z trojice Kubík , Novotný , Suchopárek .	Suchopárek	22	Anim
Univerzální gravitační válečková trať je výrobek družstva Likov z Liberce , které ji dodává v libovolných délkách .	Likov	7	Inan
Zástupci kubánského týmu v neděli prohlásili , že žádný z nich neslyšel , že by Oropesa hledal v USA azyl .	Oropesa	15	Anim
Nixdorf plánuje v příštím roce prodat přes půl milionu osobních počítačů , z toho ekonomická ( ergonometrická a ekologická ) řada SCENIC má tvořit 80 % .	Nixdorf	0	Inan
Uvedl to včera předseda Českého svazu bojovníků za svobodu ( ČSBS ) Jakub Čermín .	ČSBS	10	Inan
Překlad , bohužel plný těžkopádností a drobných germanismů , je dílem samotného nakladatele Ludvíka Kavína , jinak též šéfa Theater Brett ve Vídni a bývalého ředitele brněnského Národního divadla .	Theater	19	Inan
K průmyslovému Karlínu a Smíchovu přibyla průmyslová Libeň a na ni navazující se Vysočany a dále dvě převážně obyvatelské čtvrti , Žižkov a Královské Vinohrady .	Vysočany	13	Inan
Mašek a Severa hlasovali pro - telefonicky z nákladní lodi Bretaň na účet Korejše z Bronxu .	Korejše	13	Anim
George Adamson , který spolu s Joy vychoval a vrátil divočině lvici Elsu , však říká , že věří domorodcům , ti prý rozumějí nočnímu řevu lvů , který hlásá všem vetřelcům :	Adamson	1	Anim
V předpokládané sestavě jeho jméno neuvedl a včera uvedl tato jména : Stejskal - Suchopárek - Lerch , Pěnička - Vávra , Krištofík , Bejbl , Šmejkal , Novotný - Knoflíček , Hogen , Šmicer .	Vávra	20	Anim
V East Rutherfordu podlehli již podruhé Boston Bruins , i když tentokrát až v prodloužení .	Rutherfordu	2	Anim
Sněhová nadílka je letos v Beskydech štědrá : od 60 cm na Javorovém až po 113 cm na Lysé Hoře .	Beskydech	5	Inan
Moravanu , a . s . Petřvald , jehož uzenářské výrobky patří na severu Moravy mezi velmi žádané .	Petřvald	6	Inan
Všichni , kdo Schumpetera znali - a byli mezi nimi ekonomové jako Samuelson , Taussig , Keynes - se shodují v tom , že to byla zcela mimořádná osobnost .	Samuelson	12	Anim
Jediný člověk , s kterým se Perda v Poděbradech utkal , byl jeho nejlepší kamarád Zach .	Perda	6	Anim
Přehled nejdůležitějších výsledků výzkumné činnosti ÚJČ dosažených v # .	ÚJČ	5	Inan
Uvedl to v včerejším vydání arabského deníku Al - Haját , jenž vychází v několika metropolích včetně Bejrútu .	Haját	9	Inan
To vedlo k nynějšímu měření sil mezi prezidentem a Sejmem .	Sejmem	9	Inan
Podle Žáka je kupní smlouva o prodeji budovy společnosti Themos podána u katastrálního úřadu Praha město , její vklad však byl úřadem zastaven kvůli soudnímu napadení vlastnictví .	Themos	9	Inan
Pomoc pro JAR ve výši 48.5 miliónu dolarů podepsal v Kapském Městě švédský premiér I . Carlsson , který je v Jihoafrické republice na návštěvě .	Carlsson	16	Anim
Rodinné tradice začínají mít povážlivé trhliny , " domnívá se Carl Brandenburger .	Brandenburger	11	Anim
Majitel a předseda klubu Bernard Tapie , jehož soudce Beffi ve středu vyslýchal , prohlásil , že jde o pokus zničit klub a jeho osobně .	Beffi	9	Anim
Schválil * Horálek , ředitel ÚJČ ČSAV .	ÚJČ	5	Inan
Na prodej bylo v Rabacu nabídnuto více než 500000 akcií , každá v nominální hodnotě 100 DEM .	Rabacu	4	Inan
První české soukromé nábytkářské učiliště otevřela ve středu v Koryčanech na Kroměřížsku společnost Koryna .	Koryčanech	9	Inan
Katastrofální hospodaření v armádě , při němž jsou velitelské špičky propojeny s firmami , má podle poslance Michala Krause ( ČSSD ) na svědomí náměstek ministra obrany Miroslav Kalousek .	Kalousek	28	Anim
Czernin by rád dostal zpět mj . v západních Čechách Svrčovec , Chudenice , vodní hrad Švihov atd . , v jižních Čechách kromě jiného panství Jindřichův Hradec se zámkem , vlastní elektrárnou a pivovarem .	Svrčovec	10	Inan
Trenérem roku byl oficiálně vyhlášen Dušan Uhrin z pražské Sparty , který v první polovině sezóny 1990 / 91 získal titul půlmistra s Chebem a posléze se stal se Spartou mistrem .	Chebem	23	Inan
Nakladatelství Naše vojsko se jejím prostřednictvím vrací k myšlence mapovat nejnovější ruské dějiny - navazuje na studii Michala Reimana Ruská revoluce a na knihu Marjana Britovšeka Stalinův termidor ( obě z roku 1991 ) .	Marjana	24	Anim
Napomenutí může být od včerejška uloženo občanům Jirkova na Chomutovsku , kteří budou ve vymezené zóně topit uhlím , přestože mají podmínky pro topení jiným : ekologicky výhodnějším způsobem .	Jirkova	7	Inan
" Naše problémy jsou stejné jako ty , které vedly k úpadku Říma , " řekl president Nixon šéfredaktorům a vydavatelům amerických listů .	Nixon	17	Anim
Foto : MARKET CHODURA V HAVÍŘOVĚ :	HAVÍŘOVĚ	5	Inan
Krále Ludvíka XIII . hraje Zdeněk Žák , kardinála Richelieu Pavel Pípal , starého D ' Artagnana Otakar Brousek starší .	Pípal	11	Anim
Odešli : Obajdin ( hostování ve Frankfurtu ) , Hauzner , Culek ( oba před uzavřením hostování v Benešově ) , Rampáček ( před uzavřením hostování v Teplicích ) .	Rampáček	21	Anim
Když uvedu , že Středočeský kraj má # tisíc mladých lidí od # do # let , z toho # svazáků a # tisíc v ostatních organizacích ( Svazarm ) , je to málo .	Svazarm	28	Inan
Nakonec si vybral Ruckého , protože tohoto atraktivního důstojníka s kníry pokládal za partnera " jako stvořeného pro volební kampaň " .	Ruckého	3	Anim
Od roku # pak je tento problém řešen ve VUSTE Praha , státním programem Strojplast v objemu asi # * .	Strojplast	14	Inan
Jako Evropa po Mnichovu .	Mnichovu	3	Inan
Platini je zase jediným hráčem , který dokázal tuto poctu získat třikrát za sebou ( Cruyff má jednu roční pauzu ) .	Cruyff	15	Anim
* Jelenová se sympozia zúčastnila jako referentka pro zahraniční styky v ÚJČ .	ÚJČ	11	Inan
Ale kdoví , jak to vypadalo dříve ve staré Praze , třeba i takový pivovar U Fleků nestál za moc , když ho v dávné minulosti otevřeli .	Fleků	16	Inan
" Jakého - Meiera ? "	Meiera	3	Anim
V dobách prosperity zajišťovalo v Rabacu hlavní turistickou sezonu kolem 1700 lidí .	Rabacu	5	Inan
Během jara hrál tým zpravidla ve složení : Hedman - Sundgren , Mjällby , Jansson , Espmark - Nordin , Simpson , Borgqvist - Nergstrand , Hjelm .	Sundgren	10	Anim
Fotbalisté Ajaxu Amsterdam se chystají bojkotovat přátelské mezistátní utkání s Portugalskem , plánované na příští středu do Eindhovenu .	Eindhovenu	17	Inan
Byl to politický tah v době , kdy se SNS štěpila a Mečiar vstupoval do koalice , jejímž významným představitelem byl také právě pan Moric .	Moric	24	Anim
Hranice mezi realitou , snem a mýtem se přece už dávno setřely , podobně jako hustě nanesená rtěnka barvy krve na rtech surově zavražděné dcery úctyhodného místního občana Lelanda Palmera .	Palmera	29	Anim
V takovém případě by se dopravní náklady vyrovnaly , uvedl Heinz Dürr .	Dürr	11	Anim
V roce # byla zřízena tato vedoucí pracoviště vědeckotechnického rozvoje v oblasti rozvoje uplatnění plastů , VUSTE Praha pro oblasti uplatnění plastických hmot ve strojírenské výrobě a konstrukcích .	VUSTE	16	Inan
ŽK : Brabec , Klhůfek , Mucha - Bečka , Slabý , Janoušek , Diepold .	Bečka	8	Anim
Krebs přidal k rekordu i prvenství v sobotním finále .	Krebs	0	Anim
Drvota nám půjčoval desky s originálním reggae a my jsme zjistili , že je to kouzelná muzika .	Drvota	0	Anim
MIROSLAV SRB , Pardubice	MIROSLAV	0	Anim
Jiří Kovář zůstává i nadále předsedou oblastní rady ODS v Hodoníně .	Hodoníně	10	Inan
Zlepšení se realizují neustále v průběhu celého roku # , nejvíce změn se však zavádí do výroby vždy po celozávodní dovolené v AZNP .	AZNP	22	Inan
