Dílčí projekty organizací ČSOP se naopak velice různí - od konkrétních činů na záchranu vymírajících druhů po společenský tlak na navrácení územního plánování do resortu ministerstva životního prostředí .	ČSOP	3	Inan
Milionářům na MS vévodí Sakic	Sakic	4	Anim
Salón , který pořádají londýnská firma International Trade and Exibitions Ltd ve spolupráci s pražskou firmou CS Crossland s . r . o . , představí poprvé v Československu supersportovní verzi Chevroletu Corvette .	Chevroletu	31	Inan
Petrovi Vopěnkovi se vyčítalo , že nedokáže vyřešit problémy učilišť a nejraději by se jich v resortu školství zbavil .	Vopěnkovi	1	Anim
Bavorský tým ( bez potrestaného Papina ) porazil ve 3 . kole bundesligy hladce Mönchengladbach 3 : 0 .	Mönchengladbach	14	Inan
Konečný důkaz o jejím vlivu na předměty viděl na vlastní oči poprvé Gagarin , abstrahujeme - li od krátkých stavů beztíže v letadlech a jiných důkazů .	Gagarin	12	Anim
Al Unser jr . s vozem Penske Ilmor vyhrál GP Kanady amerického mistrovství automobilů formule IndyCar .	Ilmor	7	Inan
" Winter nebyl schopen se půl roku s Chicagem kontaktovat , a tak Sparta pozvala zástupce Chicaga do Prahy , kde jsme se během odpoledne dohodli , " řekl pan Halík .	Winter	1	Anim
Jen několik hodin před vyhlášením příměří však našla policie na předměstí města Antrim zavražděného muže .	Antrim	12	Inan
Ivan Drahola , Ředitel Národního divadla v Brně	Drahola	1	Anim
Po setkání s někdejším šéfem Bílého domu Jimmy Carterem v Atlantě Clinton prohlásil , že by mohlo jít přibližně o 600 milionů dolarů během nadcházejících tří let .	Carterem	8	Anim
Na Štrbském Plese se mu sice příliš nedařilo , ale v Harrachově skončil pátý .	Harrachově	11	Inan
Pana Hrabáka bude určitě zajímat věc , která podstatně ovlivňuje cenu obrazu , ač nemá s jeho hodnotou nic společného - totiž místo prodeje .	Hrabáka	1	Anim
Karel Hrabák , Roztoky u Prahy	Hrabák	1	Anim
Po šestatřicáté za sebou určili novináři v anketě časopisu France Football , komu připadne Zlatý míč - ocenění pro nejlepšího evropského fotbalistu roku .	Football	10	Inan
Čelákovický měšťan a purkmistr Pavel Ježdík nám o této zlé době zachoval pozoruhodné svědectví .	Ježdík	5	Anim
Jokohama a kolektiv nahradili mechanické kontakty na Danjonově astrolábu magnetickými spinači .	Jokohama	0	Anim
Těch , kteří byli na sjezdu poprvé v životě , ale * těch , kteří pamatují sjezdy ČSM .	ČSM	17	Inan
Mluvčí společnosti Eurostar v Londýně však odmítl tuto informaci potvrdit nebo vyvrátit .	Eurostar	2	Inan
Pro hydrografa může být středem Evropy některé významné rozvodí ( i když asi ne to mezi Váhem a Hronem ) .	Váhem	16	Inan
Kontakt : Alcar , velkoobchod průmyslovým zbožím , Husova 331 , 549 31 Hronov , tel . : ( 0441 ) 8896	Hronov	13	Inan
Barrett se kvůli problémům s drogami na pódiu neobjevil .	Barrett	0	Anim
To už dvacet chlapců a děvčat oddílu pionýrské skupiny z Kolína dobře vědělo , že si ke stanování vybrali správný ztracený kout lesa .	Kolína	10	Inan
Na farmě u města Brits v západním Transvaalu byly nalezeny automatické zbraně , brokovnice a další typy zbraní .	Transvaalu	7	Inan
Od vzniku společnosti Ostroj - Hansen & Reinders v roce 1993 je tomu naopak .	Hansen	5	Anim
Všichni hráči působí v domácích klubech , jediný legionář Carmel Busuttil se nedávno z belgického Genku vrátil domů do Sliemy Wanderers .	Carmel	9	Anim
A Tádžikistán dnes připomíná Kubu .	Tádžikistán	1	Inan
Snímek Des a Jen Bartlettovi , National Geographic , únor 1979 , str . 208	Geographic	7	Inan
PSP také zaměstnává mistry uměleckých řemesel , jako jsou restaurátoři , kameníci , truhláři , štukatéři a další specialisté , kteří se tvůrčím způsobem podílejí na obnově historických památek na území hlavního města Prahy , uvedl F . Šimon .	PSP	0	Inan
Vymáhání nedobytných pohledávek je pro ni podle slov ředitele společnosti Jiřího Slováka vedlejší činností , nicméně jsou v tomto oboru úspěšní v 35 až 40 procentech případů .	Slováka	11	Anim
Jestliže malý a roztomilý Oberstdorf je spíš místem zimní rekreace středních vrstev , pak noblesní až poněkud snobský Garmisch - Partenkirchen je tradičním místem horních deseti tisíc .	Partenkirchen	20	Inan
Začátkem roku 1991 světové burzy s napětím očekávaly výsledky mírových rozhovorů tehdejšího ministra zahraničí USA Jamese Bakera s jeho iráckým protějškem Tárikem Azízem ohledně irácké okupace Kuvajtu .	Kuvajtu	26	Inan
Curt Lundmark , trenér Švédů - dnešního soupeře Slováků - přivezl do Zlína výběr složený ze zkušených hráčů ( Svensson , Bergqvist , Larsson ) a několika nováčků .	Švédů	4	Anim
Svatyně boha Marduka , Babylónská věž , byla vybudována na vysoké podezdívce o straně # * .	Marduka	2	Anim
podzim 1983 : Nick Mason ohlásil odchod ze skupiny a o několik měsíců později se rozchází i Gilmour s Watersem .	Mason	4	Anim
Až po vláskovou buňku v Cortiho orgánu je přenos zvuku mechanický .	Cortiho	5	Anim
Podání salicylátů ( acylpyrin ) může vzácně vyvolat u mladších jedinců ( do šestnácti let ) tzv . Reyův syndrom s fatálními následky , proto někteří preferují paralen či brufen .	acylpyrin	3	Inan
hlavní zájem VÚMS se tou dobou soustředil již na další projekt , elektronkový počítač 1 . generace EPOS 1 .	VÚMS	2	Inan
" Přijel jsem se s jabloneckým prezidentem Peltou dohodnout , aby nám uvolnil na hostování Šimka s Justem , " vysvětloval Cerman svou přítomnost .	Cerman	21	Anim
Standish nalezl postačující podmínku pro možnost úniku v problému tří těles .	Standish	0	Inan
Předseda ČTS Jan Kodeš se bezprostředně po turnaji Škoda Czech Open vyjádřil velmi kriticky ke vzájemné spolupráci a označil smlouvu za velmi nevýhodnou pro tenisový svaz .	Kodeš	3	Anim
O případném vstupu kanadské firmy Alcan do společnosti Alufinal Žiar nad Hronom by v termínu , který bude dohodnut ještě tento týden , měli jednat představitelé obou firem .	Alufinal	8	Inan
Amokachi je teprve druhým hráčem tmavé pleti , který bude v Evertonu působit .	Evertonu	11	Inan
Chronotechna Šternberk se spojuje s německým partnerem Europa Šternberk ( bk ) -	Šternberk	1	Inan
MěNV Frýdlant reagoval na dopis TIBA pouze vyčítavou odpovědí odboru výstavby , podklady nezajistil a odvolal se na příslušný vodohospodářský orgán ONV Liberec .	TIBA	5	Inan
Podle L . Kárského se také budou muset sladit individuální starty se štafetovým závodem : " Jediným problémem je , kdyby Formanová postoupila do semifinále na 800 metrů , protože rozběh štafety následuje za čtyřicet minut .	Kárského	3	Anim
Jana Nepomuckého vyjádřil dne 2 . března léta Páně 1979 ve svém listě Františku kardinálu Tomáškovi , arcibiskupovi pražskému , u příležitosti 250 . výročí svatořečení světce sám svatý otec Jan Pavel II .	Tomáškovi	15	Anim
V posledních letech však pracovníci Beskydsportu nebyli schopni zajistit odbyt , a tak výrobu před třemi roky zastavili .	Beskydsportu	5	Inan
Děti manželů Baughanových z anglického hrabství Leicester měly včera při své první poprázdninové cestě do školy přece jen doprovod , když jejich novému pečovateli ze Švédska udělil milost sám britský ministr vnitra Kenneth Clarke .	Leicester	6	Inan
Do roku 1990 byly vzájemné obchodní vztahy mezi Českou republikou a Čínskou republikou na Tchaj - wanu slabé .	wanu	16	Inan
S hodnocením a rozborem současné situace vystoupila na členské schůzi i soudružka Urbánková z LŠU v Lipníku .	Lipníku	16	Inan
Utkání 3 . kola II . ligy Uherské Hradiště - Bohumín se koná už v sobotu od 16.30 h .	Bohumín	10	Inan
Jedním z nejdůležitějších objevů Szent Györgyiho školy bylo zjištění , že aktin a myosin tvoří mezi sebou silnou fyzikálně , chemickou vazbu .	Györgyiho	5	Anim
Za uplynulý rok jej získal J . P . Papin z Olympique Marseille , ale v první desítce jsou překvapivě jen dva fotbalisté z nejvíce ceněné ligové soutěže světa - z Itálie .	Papin	9	Anim
K vrcholům programu patřilo vystoupení Anglického symfonického orchestru pod taktovkou Yehudi Menuhina v Plauenu .	Menuhina	11	Anim
nelze tvrdit , že Michelangelo byl méně pokročilý než Picasso .	Michelangelo	4	Anim
V roce # došlo k znárodnění podniku Texlen .	Texlen	7	Inan
Podobné řešení se nabízí v případě dopravy ze Smíchova na Barrandov .	Smíchova	8	Inan
Výrobce - typ : MURATEC M 700	MURATEC	4	Inan
Jiným takovým příkladem by mohl být i Sigmund Freud s jeho pokusy aplikovat svou psychoanalytickou metodu na vysvětlení sociální skutečnosti .	Sigmund	7	Anim
Působil v Rainbow i Black Sabbath .	Sabbath	5	Inan
Dalšího půl milionu do vývoje přidal Jozef Tárnok , majitel firmy ET system , který má v tento projekt stejnou důvěru .	system	12	Inan
Pražská premiéra snímku se chystá 23 . února v kině Světozor .	Světozor	10	Inan
Jeden z důvodů nižšího počtu nově evidovaných absolventů spatřuje ředitel Úřadu práce v Ostravě Zdeněk Prouza v jejich snaze prodloužit si dobu letního volna .	Prouza	15	Anim
Jak však experti uvedli , těchto případů bylo poměrně málo , takže nemohly ovlivnit celkový výsledek voleb , v nichž Zedillo Ponce zvítězil nad Diegem Fernándezem de Cevallose ( PAN ) v poměru 48 procent hlasů proti 31 .	Diegem	24	Anim
Patří k nim i vedoucí představitel kodaňské školy * Hjelmslev .	Hjelmslev	9	Anim
V rozhovoru pro vojenský týdeník " Be Machane " prohlásil šéf izraelské zpravodajské služby Oren Šachor , že " není vyloučeno , že arabské státy vyrobí atomovou bombu bez vědomí Izraele .	Šachor	15	Anim
Už v roce # v dopise Marii Vaníčkové se Fučík ptá .	Fučík	9	Anim
Předseda židovských obcí v SRN Ignatz Bubis pro LN	Ignatz	5	Anim
V závěru třetiny z ojedinělého protiútoku dali Švýcaři branku , která pro čs . mužstvo jakoby nic neznamenala .	Švýcaři	7	Anim
František Dombaj má právě do Neratova co nejdříve přijet , neboť mu zde nabídl pomoc a nový život páter Josef Suchár , správce střediska pro postižené děti .	Neratova	5	Inan
V doprovodných textech a ve speciálním německo - anglickém čísle revue Archigrad ( prodává se za sto korun ) se o tom píše leccos zajímavého .	Archigrad	11	Inan
A Zdeněk Kryzánek píše dlouhé věnování soudruhovi Ondřejíkovi , který pomáhá filmařům .	Kryzánek	2	Anim
O zasedání věděl jen důstojník BIS ing . Koníček , který se hlasování zúčastnil v masce poslance Kužílka .	Kužílka	17	Anim
DO NORIMBERKA zamíří s Václavem Klausem na palubě na své první cestě nový osmnáctimístný proudový letoun Challenger CL 601 - 3 A zakoupený pro potřeby Státního leteckého útvaru federálního ministerstva vnitra .	Challenger	16	Inan
Reedice se na podzim dočká první deska Marsyas , kde Kalandra dříve hrál společně s Oskarem Petrem a Zuzanou Michnovou .	Marsyas	7	Inan
Režie : Yurek Bogayevicz .	Bogayevicz	3	Anim
Její zřizovatelé - pražské společnosti Corfin , Creative Communications , Hanyko a Olympus Czechoslovakia Trading - se touto formou snaží o poskytování kvalitnějších nemocničních i ambulantních služeb při léčbě srdečních chorob Pražanů .	Olympus	12	Inan
My už spolupracujeme se sovětským sovchozem Podolskij od roku # .	Podolskij	6	Inan
Nebyl to zrovna Ravi Shankar , ale muzikanti asi tak stejné kvality , a to už je něco .	Ravi	3	Anim
TIBA požádal dne # předsedu MěNV ve Frýdlantě o předání podkladů pro vypracování investičního záměru , jelikož dle posledního rozhodnutí GŘ BP musí zajistit výstavbu společné ČOV ve Frýdlantě .	Frýdlantě	28	Inan
Lokvenc přitom stačil ozdobit svůj gól jesličkami a Siegl lišáckým lobem nad bezmocným brankářem Bernadym .	Bernadym	14	Anim
Stať D . Povolného je zakončena výzvou seriózním sociologům , aby se pokusili zjistit , proč se dnes k ekologii vyjadřuje kdekdo , bez ohledu na svoji profesní specializaci .	Povolného	3	Anim
Rozhodující je pro nás dopis Smirnova , který říká , že prezidentem je Syč . "	Syč	13	Anim
" Už nám přišel Ládíček pro holčičku ! "	Ládíček	4	Anim
Projektový ústav Metroprojekt připravuje projekt dalších tras metra , předpokládá se prodloužení úseku trasy * z náměstí Míru k Olšanským hřbitovům v roce # , trasy * z Kačerova do Chodova v roce # .	Kačerova	28	Inan
SCHENECTADY : Senzační cestu Australana Morgana z kvalifikace až do finále ukončil Ferreira výhrou 6 : 2 , 6 : 7 , 6 : 2 .	Australana	4	Anim
Folta má potíže se zády , Škutu zlobí zánět nohy a Chlubnu opět koleno .	Chlubnu	11	Anim
Částečné řešení nabídly koncem 60 . let společnosti DEC a Hewlett - Packard , které zavedly novou kategorii tzv . minipočítačů .	Packard	12	Inan
Při požáru v kombinátu Majak v Čeljabinské oblasti ( Ural ) došlo k významnému úniku radioaktivních látek .	Ural	9	Inan
Bagdád žádá o odvolání sankcí	Bagdád	0	Inan
Při souboji u hrazení zasáhl místo Vorobjeva jen dvířka a vřítil se k nohám Měsíčka , který si právě odpykával desetiminutový trest .	Měsíčka	14	Anim
Kdyby se to však povedlo , boj o životy nenarozených by se stal jedním z hlavních námětů prezidentské kampaně Lecha Walesy v budoucím roce , a nejen jeho .	Lecha	19	Anim
KONRAD LORENZ v knize Kurta Mündla Zachraňme naději ( rozhovory s Konradem Lorenzem ) , Panorama , Praha 1992 , str . 82 - 83	Kurta	4	Anim
Na český trh vstoupila společnost Sodexho v roce 1992 po Eurestu , který zde začal v oboru veřejného stravování působit jako vůbec první .	Eurestu	10	Inan
Mladému Jiřímu Ortenovi vyšla první kniha až po tragickém 15 . březnu 1939 .	Ortenovi	2	Anim
Předvojem byl podpis smlouvy s ČMFS o zajišťování výstroje pro fotbalovou reprezentaci , další aktivity bude zajišťovat nový oficiální distributor Pumy pro ČR Active Sports .	Sports	24	Inan
Dva japonští vědci z osacké univerzity prof . Tomoji Kawai a Shichio Kawai vytvořili nový materiál , který projevuje supravodivost při teplotě -103 C .	Kawai	12	Anim
Mezi největší akcionáře patří PSP Imtertrade , s 27 procenty za ním pak následují Investiční a poštovní banka a PIAS .	PSP	4	Inan
Ředitel podniku , náměstkové Repš , Lábus , Glazar , Diviš , Šulc .	Glazar	8	Anim
Podle pracovníků Telecomu je na severní Moravě podobná situace ještě v Jeseníku a Litovli , protože stejně jako Bruntál nemají napojení na automatickou ústřednu .	Jeseníku	11	Inan
Pořádá Olbron , a . s . , 301 17 Plzeň , Radčická 2 , tel . / FAX : ( 019 ) 225565 .	Olbron	1	Inan
Vítěz Rodion Gataullin překonal laťku ve výšce 5.86 m , což je letošní nejlepší světový výkon .	Gataullin	2	Anim
Z behavioristických badatelů je tu příkladem * nebo Hebb .	Hebb	8	Anim
* Marr a jeho stoupenci vyvíjeli v tomto směru dosti dlouho značnou aktivitu a dovedli si získávat i podporu veřejných činitelů .	Marr	1	Anim
Pro slaboučký svit komety se Finkovi nepodařilo odhalit ani stopy po oxidu uhelnatém , který je v normální kometě nejhojnější uhlíkatou molekulou .	Finkovi	5	Anim
Pokles postihl osm titulů , nejhlubší , shodou okolností také investiční fond , Creditanstalt IPF .	Creditanstalt	13	Inan
Počátkem toho týdne kdosi zastrčil za roletu Havránkova krámku protiříšské letáky a pan Havránek nesplnil svoji povinnost a nenahlásil to úřadům .	Havránek	13	Anim
Pakosta a Palinek v kvalifikační skupině Světové série v plážovém volejbalu v Brazílii porazili Peru 15 : 4 .	Palinek	2	Anim
I při neúčasti zraněného brankáře Biegla se ukázalo , že máme kvalitní náhradu v podobě Salfického . "	Biegla	5	Anim
Podle Češky je zdůvodněna tak , že hovořil o dluhu ve výši 308 milionů korun vůči fondu jako o Čekanově závazku a nikoliv jako o dluhu firmy Intercom , společnosti s ručením omezeným .	Intercom	27	Inan
Lewis za rok skončí	Lewis	0	Anim
Hráč Dynama Minsk Valentin Bělkevič byl přistižen při dopinku při namátkové kontrole v prvním utkání předkola Poháru UEFA Dynamo Minsk - FC Hibernians ( Malta ) 9 . srpna .	Bělkevič	4	Anim
Jak dále řekl F . Tuhý , dobré obchodní vztahy mezi OP Prostějov a jeho odběrateli narušují pohledávky po lhůtě splatnosti .	Tuhý	5	Anim
Na článek o jugoslávských uprchlících v Rozvadově pod titulkem Bez pomoci na hranici reagoval Jan Králíček z Kopřivnice .	Rozvadově	6	Inan
ŽK : Plachta , Štěpaník , Čudrák - Kučera , Soukeník , Rusňák .	Čudrák	6	Anim
V této oblasti je třeba hledat cesty k zintenzivnění akcí pořádaných zejména orgány ČSTV .	ČSTV	13	Inan
Na závěr Demirelovy návštěvy král připomněl , že obě země byly tvrdě postiženy sankcemi proti Iráku po jeho útoku na Kuvajt v srpnu 1990 .	Kuvajt	20	Inan
Tádžikistán : volby bez účasti opozice	Tádžikistán	0	Inan
Brněnská plnící stanice , vybudovaná z bývalého policejního kontrolního objektu na staré výpadovce do Vyškova , zatím čeká na 20 autobusů Dopravního podniku .	Vyškova	14	Inan
Jak řekl LN velitel vsetínské městské policie Josef Jirků , značný podíl na narušování veřejného pořádku mají romští spoluobčané .	Jirků	8	Anim
Ve dvacátých letech jsou pak plánovitě z nařízení pražského magistrátu v Bubnech a na Letné asanovány průmyslové závody a přemístěny do nově připojených okrajových čtvrtí a na uvolněných parcelách se stavějí exkluzívní obytné domy .	Bubnech	11	Inan
Jejich požadavky byly jednoznačně namířeny proti korupci vládních kruhů a vyvrcholily částečnou demolicí vily ministra dopravy Ros Chana .	Chana	17	Anim
Jejím autorem je Vladimír Oppl .	Oppl	4	Anim
Hlavní otázka zní : jde tady vskutku o souboj hodných církevních Fridolínů se zlými státními Dětřichy , jak se domnívá pan Kalina ?	Kalina	21	Anim
Jezdí - li například po hlavním tahu mezi Berounem a Rokycany podle úseků 9000 až 12000 vozidel denně , pohybuje se tu při obsazenosti vozidla jen dvěma lidmi 18000 až 24000 potenciálních zákazníků .	Rokycany	10	Inan
Samuelson vzpomíná , že byl velký showman , jehož saka a kravaty budily závist , skvělý pedagog používající sokratovskou metodu , v níž studenti tvořili diskusí sami názory na ekonomické problémy , a suverén v téměř všech oborech kultury .	Samuelson	0	Anim
Nad touto nenovou , ale vždy aktuální otázkou se v obšírném článku Mistře , vychovej žáka zamýšlí významný sovětský režisér a pedagog Sergej Gerasimov , z jehož tvůrčí dílny na VGIKu vyšla celá plejáda úspěšných mladých herců a režisérů .	VGIKu	30	Inan
Elektrické krby Hélios vynikají nejen krásným vzhledem , ale i vysokou tepelnou účinností .	Hélios	2	Inan
Podle R . Poláška bude dohoda platit do té doby , než se ze dvou proudů brněnské ODS stane jeden .	Poláška	3	Anim
Shor , Weitzenhoffer , Hilgard a zejména As zkoumali , jak souvisí hypnotické zkušenosti s různými zážitky známými z bdělého stavu .	Shor	0	Anim
Proti Benešovu nás Bernady hlavně v závěru podržel , říká k vyřešení tajenky mezi tyčemi trenér Baníku Lička .	Bernady	3	Anim
Když jsme dojeli do Slaného , zjistili jsme , že naše hlavní dekorace zůstala v Praze .	Slaného	4	Inan
Při nácviku boje se sekerou nám velmi pomohli členové skupiny historického šermu " Tulichy vulgo zrazichy " Štylfríd a Mojslav , kteří si přejí být uvedeni pouze křestními jmény .	Tulichy	13	Inan
Šampaňské ze Starého Plzence se letos poprvé dostalo do USA , do Velké Británie , Německa , Polska , několik láhví do Dominikánské republiky i Mongolska .	Plzence	3	Inan
Největší z nich , Írán , podporuje šíitskou frakci Hezbe vahadat , kterou roku 1990 sám vytvořil .	vahadat	10	Inan
Viceprezident USA Al Gore se hodlá tento týden setkat v Irsku s premiérem A . Reynoldsem , aby s ním jednal o mírových perspektivách v Ulsteru .	Reynoldsem	15	Anim
Je to William Buckley ?	Buckley	3	Anim
V obou případech v Goetheho institutu v Praze .	Goetheho	4	Anim
Když se 57 letý řidič J . N . ve Fiatu Panda vyhýbal na silnici překážce , najel na dřevěný hranol , dostal se do smyku a havaroval .	Fiatu	10	Inan
Prodlužující se čekací doby vyvolají podle Tomáše Nováka , spolumajitele firmy Netto , která provozuje odstavné parkoviště , další jednání zainteresovaných stran o systému odbavování kamionů před hraničními přechody s odstavnými parkovišti .	Nováka	7	Anim
Kopie žádosti bude vystavena na tradiční výstavě v Indianapolisu , při které Tyson Washingtonovou znásilnil .	Tyson	12	Anim
To píše Václav Mencl v prvém čísle Zpravodaje na adresu členů .	Mencl	3	Anim
následovaly však další konference na stejné téma r . 1983 ( Rauischholzhausen ) a r . 1986 ( Nairobi ) .	Rauischholzhausen	11	Inan
Zřejmě s ním tvoří další komplex , poněvadž zvyšuje jeho viskozitu , Ebashi a Komada , * je toto , že tropomyosin i v přítomnosti hořčíku a ATP úplně zamezí tvorbě aktomyosinového komplexu a uplatnění jeho atpasové aktivity .	Ebashi	12	Anim
K tomu sekretář ing . Gábr : " Náš útok konečně vypadá jako útok , Zelníček z Baníku , Hamsa z Bohemians a Hamár z BOBY Brno nastříleli z 11 gólů osm !	Gábr	5	Anim
Drnovickému kouči Stanislavu Jarábkovi to však nedalo , aby se po prohře svého týmu 0 : 4 sparťana Horsta Siegla nezeptal : " Co si myslíš o tom , jak tě Šilhavý se Šlachtou hlídali ? "	Jarábkovi	3	Anim
Po postupu Newcastlu do čtvrtfinále Anglického poháru vypadl i Srníček a místo Skuhravého chce dát trenér příležitost útočníkům z domácí soutěže .	Newcastlu	2	Inan
Autor , ředitel oddělení marketingu světoznámé cestovní kanceláře Club Mediterranée , s jemným humorem a francouzským šarmem předkládá čtivou příručku metod ofenzivního marketingu .	Club	8	Inan
Začal jsem ji milovat prostřednictvím spisovatelů a dramatiků E . Hemingwaye , A . Millera , T . Williamse .	Hemingwaye	10	Anim
Zahájení se zúčastnili představitelé 95 členských zemí této organizace , která má 104 členů a do níž budou při této příležitosti přijaty Brunej a Uzbekistán .	Uzbekistán	24	Inan
Jednal s premiérem Jozefem Moravčíkem a prezidentem Michalem Kováčem .	Michalem	7	Anim
Svazarm připravuje armádě celou řadu odborností .	Svazarm	0	Inan
Střelou vypálenou z perkusního revolveru měla v sobotu ráno kolem 5.30 v kulturním domě Vranov u Stříbra 30 letá Plzeňačka zasáhnout svého 26 letého druha ze Stříbra .	Vranov	14	Inan
Tento trend naznačil včera při setkání se studenty Univerzity Palackého v Olomouci ministr kultury Pavel Tigrid .	Palackého	9	Anim
O příměří v Irsku jednal včera také americký prezident Bill Clinton s irským ministrem zahraničí Dickem Springem .	Springem	16	Anim
Vůbec si neumím představit , že bych se jako poslanec za jihomoravský kraj a okres Žďár nad Sázavou chtěl dotazovat na vývoj kriminality v tomto okrese pana ministra Rumla .	Žďár	15	Inan
Nejvřelejší vztah Jelcin projevuje vůči své dlouholeté manželce Naině a premiérovi Viktoru Černomyrdinovi .	Černomyrdinovi	12	Anim
Z krajánků se představí Jerguš Bača ( Leksand ) a Oto Haščák ( Kaufbeuren ) .	Kaufbeuren	13	Inan
Vývoj v prvých desetiletích # století zasáhl širokou oblast okrajových území , především Strašnice , Michli , Podolí , Bráník , Dejvice a Hloubětín .	Bráník	19	Inan
Severnější má podobu erbového štítu , který nese reliéf dvou zkřížených ostrví pánů z Lipé , majitelů hradu Pirkštejna v Ratajích , jižnější tvoří čtyřlistou , lupením pokrytou rosetu .	Pirkštejna	18	Inan
Řekl to novinářům M . Černík , kterého svoláním tiskové konference pověřil Inekon .	Inekon	12	Inan
Výroba a odbyt piva v pivovaru Bernard v Humpolci vzrostly proti roku 1991 o více než pět set procent .	Humpolci	8	Inan
Teď najednou Quebec získal výměnou za Lindrose pět většinou zkušených hráčů .	Quebec	2	Inan
Podle Irů je jeho Odysseus , zachycující jeden den života jednoho Dubliňana , největším románem dvacátého století vůbec .	Odysseus	4	Anim
První tři místa v kategorii deska roku obsadila Duhová cesta ( Kamelot ) , Starodávný svět ( Druhá tráva ) a Veselá bída ( Hop trop ) .	trop	25	Inan
slovo má DAVID BERDYCH , člen agentury 10 : 15	DAVID	2	Anim
Naši Loprais a Kahánek ( oba Tatra ) obsadili v etapě čtvrté a páté místo a celkově uhájili druhou a čtvrtou příčku .	Kahánek	3	Anim
Za velmi příznivého počasí proběhly ve španělském Jerezu oficiální testy týmů mistrovství světa silničních motocyklů .	Jerezu	7	Inan
Když se včera dopoledne jednání obnovilo , delegáti Slovenska , Malty , Argentiny , Guamu , Hondurasu , Guatemaly , Uruguaye a Ekvádoru oznámili , že podporují Vatikán , a tudíž text nepřijímají .	Ekvádoru	22	Inan
Podle jejího vrchního ředitele Jiřího Mandíka se nyní postupně inventarizuje a zpřesňuje majetek použitelný ke komerčním účelům .	Mandíka	5	Anim
