Současně s nimi Český spisovatel vydá také monografii Vladimíra Karfíka Jiří Kolář , která analyzuje umělcovu básnickou tvorbu .	Kolář	11	Anim
Tak vznikl program Proxis .	Proxis	3	Inan
Christie na mítinku v Bruselu již letos podruhé podlehl Nigerijci Adenikenovi , Lewis v Kodani skončil druhý za svým krajanem Mitchellem .	Christie	0	Anim
Se stejnou radostí však zamlčí , že Řekové často a s oblibou žvýkali kousky ztuhlé mízy mastikového keře ( pistacia lenticus ) , který se pěstuje především na ostrově Chios .	Chios	29	Inan
Miliardu franků CFA poskytne Francie své bývalé kolonii Čadu , aby jí pomohla zorganizovat svobodné a spravedlivé volby .	CFA	2	Inan
Šedesát let rozeznívá Václav Suchánek ze Slavoňova u Nového Města nad Metují zvony místní starobylé zvonice .	Suchánek	4	Anim
Proti nedávnému brankáři ostravského Baníku Bernadymu ( nyní Drnovice ) se Sieglovi vždy dařilo , ale to prý nebyl důvod , proč šel za stavu 0 : 0 kopat penaltu .	Sieglovi	11	Anim
Aparatura byla vyvinuta společně vědci Kalifornské univerzity v Davisu a firmy IBM .	Davisu	8	Inan
Poprvé o Rudolfu Firkušném	Firkušném	3	Anim
Projekt KCF Petrol naplňuje rozhodující předpoklad vlády , aby petrochemický komplex jako strategický obor zůstal v majetku českých subjektů .	Petrol	2	Inan
Protože pan prof . Koštíř je tč . upoután na lůžko , nemohl jsem se - a tedy ani čtenáře Vesmíru - poučit více .	Koštíř	4	Anim
I další jména jsou zárukou kvality : Angličané Doncaster a Wigg , Dán Staechmann a další Australan Crump	Staechmann	13	Anim
Slovanský obřad byl zakázán , do kláštera uvedl Břetislav mnichy latinského vzdělání z Břevnova v čele s opatem Děthardem .	Břevnova	13	Inan
Nebudou si proto muset před nimi zacpávat uši voskem , jak to učinil Odysseus svým námořníkům , ani se přivazovat ke stěžni ( reálpolitiky ) , jak to učinil on sám .	Odysseus	13	Anim
Jindřich Bělecký , Rokycany	Rokycany	3	Inan
Vychází z walrasovského modelu všeobecné rovnováhy - Walrase pokládá mimochodem za největšího ekonoma všech dob - a pojímá jej jako ryze stacionární .	Walrase	7	Anim
Bohumír Duží , ETS Praha :	ETS	3	Inan
V září 1927 na Voltově kongresu v Como ( v Itálii ) Bohr tvrdil , že kvantová mechanika je úplná - že principiálně nemůžeme vědět více , než co je schopna vypovědět vlnová funkce .	Bohr	12	Anim
Ministři se zabývali také problémem exportní banky a postavením EGAP ( Exportní garanční a pojišťovací společnost ) .	EGAP	9	Inan
Zařízeními firmy Honeywell jsou v ČR vybaveny kromě jiných společnosti Bohemia Glass Poděbrady , Chemopetrol Litvínov , Kaučuk Kralupy a Spolana Neratovice .	Glass	11	Inan
Několik vozidel obsazených Somálci a vyzbrojených kulomety a raketomety se střetlo před hotelem Sahafi , který byl několikrát zasažen .	raketomety	8	Inan
přišel s ní již v 60 . letech nositel Nobelovy ceny za ekonomii Ronald Coase .	Coase	14	Anim
Hradec Králové : T . Poštulka - Havlíček - Pilný , Urbánek - Ulich , Džubara , Šmarda , Breda , Menčík ( 76 .	Menčík	21	Anim
Když se včera dopoledne jednání obnovilo , delegáti Slovenska , Malty , Argentiny , Guamu , Hondurasu , Guatemaly , Uruguaye a Ekvádoru oznámili , že podporují Vatikán , a tudíž text nepřijímají .	Guamu	14	Inan
Zároveň pracuji na scénáři hraného filmu podle povídky Jerzyho Wawrzaka Čára .	Wawrzaka	9	Anim
Pittsburgh podlehl týmu Tampa Bay 2 : 4 , Rangers prohráli s Hartfordem 1 : 2 .	Hartfordem	12	Inan
Lac de Madine -	Lac	0	Inan
Radim Smolař , Smolné	Radim	0	Anim
Na věčnost to však není , " říká Prokopec .	Prokopec	8	Anim
O co Japoncům vlastně jde ?	Japoncům	2	Anim
Takže vidět současný spor opozice z jižní části země s klikou prezidenta Rachmana Nabijeva z průmyslovějšího severu ( za Brežněva prvního tajemníka zdejší komunistické strany ) jako střetnutí dobra se zlem , by bylo zjednodušené .	Rachmana	12	Anim
Než ho dojel , Havel byl už na půl cestě do Nymburka .	Nymburka	11	Inan
Ve 29 . minutě jim to vyšlo - Pavlík chytře prostrčil míč Purkartovi , který zblízka prostřelil Ondrůška .	Purkartovi	12	Anim
Holešov ( ivh ) -	Holešov	0	Inan
S oranžovým dresem Nizozemska se po MS rozloučily dlouholeté opory - Rijkaard , R . Koeman a Wouters , Gullit pokračuje v bojkotu reprezentace , na marodce jsou nejen dlouhodobě zraněný van Basten , ale i Bergkamp a Taument .	Basten	32	Anim
Smolná byla především obě soustředění : na závěr pobytu v Nymburce se zranili Drulák a Weber , v Rakousku zase Gibala a Rusnák .	Rusnák	22	Anim
Tato výzva byla opět ignorována a Paisley se pustil do čtení papíru , v němž hrubě obviňoval Británii ze zaprodání Ulsteru nacionalistickým katolíkům .	Paisley	6	Anim
Podle poslední kapitoly knihy Meadows už zpracoval Hranice růstu jako počítačovou hru , která se používá ve školách ve třiceti zemích ( viz Bild der Wissenschaft č . 6 / 1992 ) .	Bild	23	Inan
Týkalo se to hlavně tvrdých sýrů z Příšovic a výrobků soukromé mlékárny ve Frýdlantě .	Frýdlantě	13	Inan
Podle názoru Miroslava Somola by při dělení kvót na Českou republiku a Slovensko nemělo dojít k potížím .	Somola	3	Anim
K výhře nad Stuttgartem jsem přispěl jedním gólem .	Stuttgartem	3	Inan
Jsou to zejména Egypt , Mezopotámie , Indie a Čína .	Egypt	3	Inan
Ve 20 . minutě se po chybě Staše k míči dostal Klusáček a zblízka prostřelil Barcucha - 0 : 1 .	Staše	7	Anim
Po přestávce nejprve Samec srovnal na 1 : 1 , v 54 . minutě domácí Švach zvýšil na 2 : 1 , ale po biliárové akci tří hráčů a gólu Šebesty se začínalo od nuly .	Švach	15	Anim
Kuvajťan byl rychlou Záchrannou službou převezen do pražské Thomayerovy nemocnice , kde byl také operován .	Kuvajťan	0	Anim
Uspět jsme mohli jen v případě , kdyby se fotbal hrál na rohy - to by asi byla remíza , " poznamenal hořce brněnský trenér Večeřa .	Večeřa	25	Anim
Narážky na * námětů místní tradice si Erben poznamenal ve svém cestopisném deníku , kam si zaznamenal průběh svého pobytu na hradě Točníku .	Točníku	22	Inan
Majitelem sítě Polonia je italský podnikatel Nicola Grauso , hlavní podílník deníku Lycie Warszawy , majitel sardinských novin L ' Unione Sarda a italské televizní stanice RTV .	Nicola	6	Anim
Kolor vysílal reklamu EB .	EB	3	Anim
Motor České Budějovice , národní podnik .	Motor	0	Inan
Vladimir Žirinovskij během svého pobytu v Bagdádu zdůraznil " nutnost zrušit embargo uvalené na Irák " mezinárodním společenstvím po invazi do Kuvajtu v srpnu 1990 .	Kuvajtu	21	Inan
V pátek měla premiéru jeho adaptace klasického dramatu Maryša bratří Mrštíků .	Mrštíků	10	Anim
" No a dnes jedeme na techno do Pudilova , " říká Aleš mladé kuchařce , která s obdivem zkoumala jeho pearcing .	Pudilova	8	Inan
Novou odbornost v dělnických profesích získalo v letošním roce v rekvalifikačním středisku Závodů těžkého strojírenství v Dubnici nad Váhem na 200 pracovníků .	Váhem	18	Inan
Zatímco před půl rokem Scharping jako uchazeč o kancléřství vedl vysoko nad Kohlem a SPD měla víc přívrženců než CDU , je situace dnes přesně opačná .	Scharping	4	Anim
Podle Talibanu má ovládnutí provincie , v jejímž čele stojí vicepremiér bývalé Rabbáního vlády Arsallá Rahmání , spíše politický než strategický význam .	Talibanu	1	Inan
Do východní , jižní a západní okrajové části je převážně dodávána voda ze Želivky , objasňuje Zdeněk Brachtl , ředitel Pražské vodárny , závodu Rozvod vody .	Brachtl	17	Anim
Jak posuzujete antukové úspěchy Davida Rikla ( semifinále v Monte Carlu a čtvrtfinále v Mnichově ) a dalších hráčů druhého sledu v souvislosti s nominací na čtvrtfinále Davis Cupu s Rusy ?	Rikla	5	Anim
Určeno všem pracovníkům ÚJČ .	ÚJČ	3	Inan
LITVA - VILNIUS :	VILNIUS	2	Inan
Konkrétní úvahy o zřízení střediska nadstandardní péče v nemocnici ve Vsetíně nechávají tamní pracovníci až na dobu , kdy skončí privatizace zdravotnictví .	Vsetíně	10	Inan
[ Simon Pierre LAPLACE ]	LAPLACE	3	Anim
Bunnag včera v doprovodu skupiny thajských poslanců přicestoval na Uhdeho pozvání na pětidenní návštěvu České republiky .	Bunnag	0	Anim
TIBA převede investoru KSVK Praha na základě zvláštních delimitačních protokolů zahajovací limity ve výši # Kčs pro rok # , zahajovací limity ve výši # Kčs pro rok # a zahajovací limity ve výši # Kčs pro rok # .	TIBA	0	Inan
Kolem 11000 hostů může denně přijmout perla severního Jadranu Rabac .	Rabac	9	Inan
Suchdol nad Lužnicí ( ria ) -	Suchdol	0	Inan
Pětadvacetiletý Miroslav Náhončík je 175 - 180 cm vysoký , zavalité postavy a má nakrátko ostříhané špinavě blond vlasy .	Náhončík	2	Anim
Vojta Náprstek a dům U Halánků	Vojta	0	Anim
Později skupina spolupracovala ještě na filmech Rollo , 2001 - Vesmírná Odyssea , Zabriskie Point a La Vallée .	Point	14	Inan
Co tomu říkáte , Flajšmánku ? "	Flajšmánku	4	Anim
Všechny podmínky vytýčené von Neumannem jsou splněny .	Neumannem	4	Anim
W . Lička , trenér Ostravy : Obě mužstva chtěla zvítězit .	Lička	2	Anim
V takovém případě podle slov Viléma Kohnera není firma motivována ani k vymáhání nájemného od neplatičů .	Kohnera	6	Anim
O rafinerie se již ucházejí vlastními projekty Mezinárodní ropné konsorcium IOC ( složené z Agip , Conoco , Shell a Total ) , a . s . Chemapol a s . r . o . Inekon .	Total	20	Inan
Luboš Stehlík 2 . abonentní koncert cyklu Filharmonikové komorně : Dagmar Pecková , Karel Špelina , Jaroslav Šaroun .	Šaroun	17	Anim
Chov Luboše Königa patří k nejlepším v republice .	Königa	2	Anim
O osudu této pasáže informoval novináře japonský ministr zahraničí Kabun Mutó , když je s prohlášením seznamoval .	Mutó	10	Anim
Zdroj : Business Week	Week	3	Inan
Jindy jsem se sešel u L . Reinische v Ottobrunnu s naším spisovatelem Otou Filipem , který emigroval do Spolkové republiky .	Otou	13	Anim
Když jsem pak byl v Ga - Pa sedmý , pochopil jsem , že prvenství už neobhájím .	Ga	5	Inan
Uvedl výstavbu velkokravínu pro # tisíc dojnic v Loučanech , jenž bude mít plně mechanizovaný provoz a nejvýkonnější technické parametry .	Loučanech	8	Inan
Loni si v Eindhovenu vybojovali postup mezi elitu a nehodlají účinkování v ní omezit pouze na italské intermezzo .	Eindhovenu	3	Inan
Dlouho utajovaný zázrak má nakonec podobu Fiatu 124 ( u nás nejblíže vozu Lada 1200 ) , který licenčně vyrábí indická firma Premier .	Fiatu	6	Inan
Nákladní loď však tvrdošíjně stanici Mir míjela .	Mir	5	Inan
Slovy " paměť diváků trvá " zakončil Martin J . Švejda svůj sloupek o derniéře poslední inscenace Jana Grossmana , Kafkově brku v Divadle Na zábradlí ( Loučení velkého muže , LN 2 . 2 . 1995 ) .	Švejda	10	Anim
Oficiálně do včerejška nejmenovaný nástupce severokorejského vůdce Kim Ir - Sena , jeho syn Kim Čong - Il , včera oslavil za velké publicity 53 . narozeniny , ale na oslavách se neobjevil .	Čong	15	Anim
Zdá se , že se postoj americké diplomacie zjednodušil na jedinou otázku : " Kam až hodláš zajít , Slobodane ? "	Slobodane	19	Anim
" Pan Winter žádal Hrbka , aby podepsal smlouvu , ve které bylo přímo uvedeno , že Sparta nedostane žádné odstupné .	Hrbka	4	Anim
Dále je významným dodavatelem pro podniky Zetor , DESTA a LIAZ , důležitým odběratelem je i Agrozet Roudnice .	LIAZ	10	Inan
Z taktických záměrů prozradil náš trenér pouze to , že " skvělého režiséra hry a technika Scifa budeme střežit osobně , ale ne tak , aby za ním náš hráč běhal úplně všude . "	Scifa	16	Anim
K průmyslovému Karlínu a Smíchovu přibyla průmyslová Libeň a na ni navazující se Vysočany a dále dvě převážně obyvatelské čtvrti , Žižkov a Královské Vinohrady .	Karlínu	2	Inan
Tím argumentoval i prezident Lech Walesa , když ministra vnitra žádal , aby nového šéfa rozvědky odvolal .	Walesa	5	Anim
Po přepravě přes Středozemní moře absolvovali účastníci Rallye Paříž - Kapské Město první etapu po africkém kontinentě , která vedla z Misratahu do Sirtu a měřila 651 km , z čehož 204 km byla dlouhá rychlostní zkouška .	Sirtu	23	Inan
Ten kdysi studoval v Praze u Ladislava Černého a nyní zde působí jako velvyslanec Chorvatské republiky .	Černého	7	Anim
Na dobré zkušenosti v oblasti masové politické práce chce navázat závodní klub ROH Bytex Vratislavice nad Nisou i v letošním roce .	Bytex	13	Inan
Francouzský dozor nad Temelínem	Temelínem	3	Inan
Podle výkonného prezidenta firmy NEC H . Sasakiho se nová paměť DRAM uplatní především v multimediálních terminálech napojených na kabelové sítě a v příští generaci počítačů třídy notebook .	NEC	4	Inan
Zašli jsme do Národní galerie za Petrem Hartmanem z Odboru správy sbírek a výstav .	Hartmanem	7	Anim
Do Pardubic má zavítat i předseda direktoria Martellu Patrick Martell , který před nedávnem řekl : " Styky naší firmy s vaší zemí trvají už 110 let a dnes jsme nadšeni , že můžeme toto spojení upevnit ! "	Martellu	7	Inan
* ABEL POSSE , argentinský spisovatel a diplomat v Praze , velmi rád nedělá nic .	ABEL	1	Anim
V 80 . letech měl vlastní skupinu a její nejlepší skladby nyní přináší výběr Diamond u Popronu .	Popronu	16	Inan
V určitém smyslu se život kolem nás mění v poušť , poznamenal slavný anglický malíř Francis Bacon v pozoruhodném britském portrétu , který v sobotu dopoledne uvedla Česká televize .	Francis	15	Anim
Pražská skupina Babalet je plná rastafanů .	Babalet	2	Inan
Brankář Cagaš byl pro nás nepřekonatelný . "	Cagaš	1	Anim
Podle místopředsedy J . Lesáka se rozbíhají jednání o případné integraci s ODS .	Lesáka	4	Anim
Salvador po volbách	Salvador	0	Inan
Ve vlaku jedoucím z Českého Těšína do Karviné vešli v sobotu před stanicí Karviná - Darkov do kupé k 31 letému slovenskému občanovi tři muži .	Darkov	15	Inan
Dnes už zřejmě nikdo nespočítá , kolika profesionálních ( i ochotnických ) verzí se na našich jevištích moravská tragédie bratří Mrštíků dočkala .	Mrštíků	20	Anim
Kdo jiný se může vyjádřit líp k " souboji pohlaví " , jak je označován páteční zápas Navrátilové s Connorsem v Las Vegas .	Connorsem	19	Anim
Výtěžek z koncertu by měl být příspěvkem pro Fond Rafaela Kubelíka , jehož správcem je Česká filharmonie .	Kubelíka	10	Anim
Kdo se dívá na manéž Bolka Polívky , ví , o co v mušvilu půjde : o první mistrovství světa v chytání much .	Polívky	6	Anim
Čech Kůrka nastřílel v základním závodě 593 bodů .	Kůrka	1	Anim
Emmerson Fittipaldi v závěru kariéry ve formuli 1 jezdil na brazilském voze Copersucar , který by se měl objevit na brněnském okruhu na přelomu září a října	Copersucar	12	Inan
Hlavní přínos plodného života prof . Málka byl však v posledním desetiletí v popularizaci vědy .	Málka	6	Anim
Předseda fondu také uvedl , že fond souhlasí s tím , aby firma Pech s . r . o . vrátila veškerý majetek vydražených Mrazíren Dýšina .	Pech	13	Anim
Peter Scherhaufer dokončuje třetí část shakespearomanie - Člověk Bouře .	Scherhaufer	1	Anim
Liberec : Maier - Nesvačil - Lexa , Klimeš , R . Macháček - Janáček , Culek ( 33 .	Maier	2	Anim
Těchto sponzorů je 57 , jejich seznam zahrnuje jména takových firem jako Dow Chemical Co . , Eastman Kodak , Standard Oil a Westinghouse Electric Corp .	Westinghouse	23	Inan
Největším překvapením tohoto kola bylo vítězství Turnova v Karviné s Vítkovicemi 1 : 0 .	Turnova	6	Inan
Ve francouzské lize byla ostuda po nerozhodném souboji Lyonu s Olympiquem Marseille .	Olympiquem	10	Inan
V Oberstdorfu včera vydatně sněžilo , takže reprezentační trenéry jsme místo z tréninku vyrušili z partičky karet .	Oberstdorfu	1	Inan
V tie breaku pátého setu byl šťastnější Američan Reneberg .	Reneberg	8	Anim
Pan Yaa Say Dooklin , ministr vnitra Jižního Beninu : Skutečnost , že jediný občan obviněný z korupce musel být osvobozen , svědčí o mimořádné kvalitě vašeho boje s korupcí .	Beninu	8	Inan
Jak včera oznámil šéf KP Ján Findra , je to výsledek rozpočtového provizoria vlády V . Mečiara , která i ve schváleném návrhu rozpočtu na tento rok pokračuje v dalším snižování mzdových prostředků pro KP .	Findra	6	Anim
V partii Drejev - Rausis , Luzern 1993 , od postavení po tahu 38 .	Rausis	4	Anim
" V Oseku ty děti nechtěli mít .	Oseku	2	Inan
Zjednodušeně lze říci , že ceny průměrných obrazů Mařákovců se ve Vadamu pohybují mezi 30 a 40 tisíci zatímco v Solidetu mezi deseti a dvaceti tisíci .	Vadamu	11	Inan
Pouze u autorádií se na prvním místě neocitla česká značka , ale Sony s 25 procenty , na druhém místě s výrazným odstupem Philips se 12 procenty a třetí je Blaupunkt s 8 procenty .	Philips	23	Inan
Akci zpestřil tradiční příjezd patrona nejvyšších českých hor Krakonoše .	Krakonoše	8	Anim
Minulý týden hnutí dobylo Charasjáb , hlavní stan nejsilnější afghánské opoziční frakce bývalého premiéra Gulbuddína Hekmatjára .	Gulbuddína	14	Anim
V Lichtenbergu , nejlidnatějším z východoberlínských obvodů , kde žije vedle Ralfa Schmidta 170000 dalších spolkových občanů , přebývá podle všeho také jeden přízrak . . .	Lichtenbergu	1	Inan
Syřanům prý premiér předložil čtyřbodový návrh , který počítá s odsunem izraelských vojáků z Golan , obsazených Izraelem v roce 1967 .	Syřanům	0	Anim
Příběh Cida Válečníka do značné míry kopíruje osudy skutečné historické osobnosti - Rodríga Díaze de Vivar ( kolem 1043 - 1099 ) .	Cida	1	Anim
Konstrukčně šlo o repliky počítačů IBM 360 , později 370 a 4341 ( řada JSEP - mainframe ) a počítačů HP 1000 ( později i jiných strojů - řada SMEP , minipočítače ) .	HP	20	Inan
Karel Přenosil , trenér Chebu : " Nemám , co bych k zápasu řekl .	Přenosil	1	Anim
Druhý skončil Bulhar Sevdalin Minčev výkonem o 2.5 kg nižším , vytvořil však světový rekord v trhu , když dostal nad hlavu činku o hmotnosti 125 kg .	Sevdalin	3	Anim
Nespokojeni s Gesamtmetallem , svazem zaměstnavatelů v kovoprůmyslu , jsou i podnikatelé jiných odvětví .	Gesamtmetallem	2	Inan
Ze stříbrného týmu z MS tak bude ve slovinském Mariboru chybět jen zraněný obránce Maldini , jehož místo by měl zaujmout klubový kolega z AC Milán Panucci .	Mariboru	9	Inan
Atrakcí Rallye Bohemia je jistě i start Slováka Drotára s BMW M 3 , Rakušana Brandstettera se Subaru a Holanďana van Krimpena s Fordem Escort Cosworth .	Slováka	7	Anim
Německé železnice , společnost Deutsche Bahn AG , vloni podle nedělního listu " Welt am Sonntag " ušetřily na zakázkách asi 20 procent celkových nákladů .	Welt	13	Inan
Do této skupiny patří také sklo ve formě zazdívané nebo zabetonované tlustostěnné desky nebo dlaždic zabetonovaných do železobetonových rámečků anebo přímo ve formě sklobetonové tvárnice Luxfer .	Luxfer	25	Inan
Sovětské automatické stanice přistály na Měsíci , Venuši a Marsu .	Marsu	9	Inan
Místopředseda ČMKOS Jiří Ryvola LN sdělil , že konečné rozhodnutí bude záležet na definitivní podobě návrhu , který vláda předloží sněmovně .	Ryvola	3	Anim
Josef Kunášek , komerční právník	Kunášek	1	Anim
Čtvrtý závod GP před dvěma týdny v Berlíně byl poznamenán kolizí dvou nejlepších Rusů - Nikulina a Balašova .	Balašova	17	Anim
Z dopisu Bedřicha Kováře , ředitele úseku pojištění osob v České pojišťovně vyjímáme :	Bedřicha	2	Anim
V eseji o dvou kulturách ( humanistické a přírodovědecké ) lord Snow popsal jednostrannost dnešních vzdělaných lidí .	Snow	11	Anim
Podle Kanta je rozum obtěžován otázkami jej přesahujícími , jež není s to odmítnout , a ovšem ani vyřešit .	Kanta	1	Anim
Šestičlenná americká delegace , vedená blízkým spolupracovníkem prezidenta Clintona a bývalým členem Kongresu B . Morrisonem , přiletěla včera do Dublinu na setkání s irským premiérem A . Reynoldsem .	Reynoldsem	28	Anim
Ubytovací zařízení : Apartmány Les Marines de Gassin	Gassin	7	Inan
Samotné koncertní pásmo se bude skládat z krátkých spojovacích textů ( Ryanův Nejdelší den , Churchillovy Paměti ) a písní ( Helena Vondráčková , Karel Černoch , Karel Gott , Karel Hála , Jiří Korn a další ) .	Korn	34	Anim
S novým trenérem Scottie Bowmanem nemáme problémy .	Bowmanem	4	Anim
Coventry si bez větších problémů poradilo s West Hamem , kterému v tabulce patří až dvacáté místo .	Hamem	8	Inan
Jedním z nich byl křídelní útočník Maltais , v Tampě však už podepsal nový kontrakt za 200000 dolarů .	Maltais	6	Anim
Adam Dwilewicz měl ve své prodejně s půjčovnou v Bialystoku na 1500 kompaktů .	Adam	0	Anim
Šerák - 1353 m n . m . , Keprník - 1423 m n . m .	Šerák	0	Inan
Reportáž psanou na oprátce , v níž herec hrál skutečnou postavu Julia Fučíka , a film Zkouška pokračuje , kde Fučík sám přímo nevystupoval , kde však byl stále vnitřně přítomný .	Fučík	20	Anim
Slavia má po úterním střetnutí se Zlínem zraněného brankáře Tótha a obránce Hořavu .	Hořavu	12	Anim
Nový fond , nazvaný The Czech Republic Fund , Inc . ( CRF ) je podle svého tvrzení registrován na newyorské burze .	CRF	12	Inan
Ceny jednolůžkových pokojů v hotelech Ski a Sněžné se pohybují od 90 do 100 korun , dvoulůžkových kolem 150 korun a plná penze přijde na 100 Kčs .	Ski	5	Inan
Soud bude mimoto zvažovat i vinu Chadimové na údajném podvodně vylákaném nábytku z farního úřadu v Kájově u Českého Krumlova v ceně asi 80000 korun .	Kájově	16	Inan
Včerejšek byl vyhrazen neoficiálnímu tréninku , punc oficiálnosti bude mít až dnes , ještě předtím , než v Ga - Pa vypukne silvestrovské veselí .	Ga	18	Inan
Na podporu nové inscenace Shakespearova Hamleta v režii Jana Nebeského se v pátek konal benefiční večírek v pražském klubu Roxy .	Hamleta	5	Anim
Po postupu Newcastlu do čtvrtfinále Anglického poháru vypadl i Srníček a místo Skuhravého chce dát trenér příležitost útočníkům z domácí soutěže .	Srníček	9	Anim
Osm pro Sirakova	Sirakova	2	Anim
K ilustraci vznikajícího nesouhlasu srovnejme Hirschův seznam pojmů se seznamem kompilovaným Charlesem L . Koelschem a Ashleyem G . Morganem zahrnutým v jejich knize Vědecká gramotnost v letech šedesátých .	Charlesem	11	Anim
Janney měl už jednou v St . Louis na kahánku , když byl nabídnut Vancouveru za Petra Nedvěda , jenomže v poslední chvíli Blues cukli a nabídli raději Jeffa Browna , Breta Hedicana a Nathana LaFayetta .	Jeffa	28	Anim
Erben , ač sám povoláním historik , dopřává lidové tradici právo , které má poezie proti vědě , právo na naivní smyšlenku .	Erben	0	Anim
A díky prozíravým hostitelům se o sobě i přítomní Středoevropané navzájem dozvěděli leccos , na co doma nebývá čas .	Středoevropané	9	Anim
Martell a Seagram sponzorují mimo Velké i dalších šest dostihů .	Seagram	2	Inan
Nejsem ovšem pro psaní Marz ;	Marz	4	Inan
Mnichov - 2 . kolo : Mansdorf - Braasch 7 : 6 ( 7 : 5 ) , 6 : 7 ( 4 : 7 ) , 7 : 6 ( 8 : 6 ) .	Mansdorf	6	Anim
Na třítýdenní ozdravný pobyt do městečka Villach v rakouských Korutanech odjela včera skupina sedmdesáti dětí ze smogem ohrožených severočeských měst Most a Děčín .	Korutanech	9	Inan
Jiří Bubák , Heřmanův Městec	Městec	4	Inan
GEN čili Galerie Elity Národa , tak zní pracovní název ojedinělého projektu soukromého studia FEBIO , respektive jeho zakladatele a ředitele , známého režiséra FERO FENIČE .	FENIČE	25	Anim
Proč se asi Vlámům ze spleti našich státoprávních problémů zalíbila domnělá vykutálenost Čechů ?	Vlámům	3	Anim
Dále upřesnil , že chystáte výrobu nového vozu vyšší třídy - něco mezi modely VW GOLF a PASSAT .	PASSAT	17	Inan
Novým sekretářem Slovenského svazu PTP byl zvolen ing . Pavel Žilinek .	Žilinek	10	Anim
Nejvíce čerpadel má v SR š . p . Benzinol , který prodává na celém území za stejnou cenu : Super za 18.60 , Speciál za 17.60 , Natural za 18.50 a naftu za 15.70 Sk .	Super	20	Inan
Seba Tanvald přerušila na pět týdnů výrobu textilu	Tanvald	1	Inan
V * oblastech v povodí velkých řek , jako jsou Nil , Eufrat , Tigris , Indus , Ganges a Jang - c ' - ťiang , vznikají ve starověku velké říše se svéráznými architekturami .	ťiang	25	Inan
Oba prominentní a letos až nečekaně úspěšní škodováčtí piloti - Sibera i Triner - zatím tedy vidí svůj rok 1994 jen mlhavě .	Sibera	10	Anim
Stejné štěstí neměl Horace Dove - Edwin , stříbrný medailista z běhu na 100 m .	Dove	4	Anim
S výhradami by přijal návrh i Rudolf Opatřil ( ČMSS ) .	Opatřil	7	Anim
Okres Jeseník vznikne z 22 obcí v dnešním okrese Šumperk a 1 obce v okrese Bruntál .	Jeseník	1	Inan
Navíc jsme s využitím poznatků Pavla Huťky , zástupce Pro Kennex v Československu , dali dohromady typ Destiny Black ACE pro špičkové závodní hráče .	Kennex	10	Inan
A kdy pravičáčtí , majstři pera i politikové typu Smrkovského vydávali tento protisovětský pokřik za mínění lidu .	Smrkovského	9	Anim
Když výhru potvrdíme v utkání s Libercem , tak už bude dobře .	Libercem	6	Inan
