Náš čtenář by kupř . mohl uspět i v Rovensku , kde sídlí brusírna diamantů pana Patočky , která brousí a prodává diamanty dovezené z Afriky .	Patočky	16	Anim
Korunu našeho fotbalového krále uplynulé sezóny převzal včera v pražském hotelu Atrium z rukou šéfredaktora časopisu Stadión Milana Macha hráč FC Janov Tomáš Skuhravý ( na snímku ) .	Janov	21	Inan
Pro Japonce natočí filharmonie s dirigenty Neumannem a Albrechtem další ze zahájených cyklů nahrávek Mahlerových a Brucknerových symfonií , dvakrát Dvořákovu Novosvětskou a silvestrovský koncert sestavený z děl českých autorů .	Albrechtem	8	Anim
Jak řekl LN ředitel Městské nemocnice v Litoměřicích MUDr . Miroslav Jiránek , byli první čtyři pacienti doslova nadšeni .	Jiránek	11	Anim
Britská oficiální místa zdůrazňují , že Ulster není jen teror .	Ulster	6	Inan
Ekologicky žádoucí trasa by překročila Krušné hory u Chomutova .	Chomutova	8	Inan
RAV 4 vybavený šestnáctipalcovými koly má díky této síle docela svižné zrychlení z 0 na 100 km za 10 s .	RAV	0	Inan
OK - Tours připravuje pobyty turistů z Dálného východu , mj . Tchaj - wanu a Japonska .	wanu	14	Inan
V průběhu roku byly zpracovány protipovodňové plány závodů TIBA dle metodických pokynů GŘ BP , protihavarijní plány sestavené dle vyhlášky MLHV ČSR , ochrana jakosti povrchových a podzemních vod .	TIBA	8	Inan
Philips prožívá konjunkturu	Philips	0	Inan
Přitom pořád slyšíme , jak všichni kolem nás posilují , včetně ohrožených mužstev Bohumína či Xaverova , boj o záchranu bude velmi těžký .	Xaverova	15	Inan
Podobně jako v Obersdorfu při letech museli pořadatelé v Mariboru pro nepříznivé počasí zrušit nedělní druhé kolo slalomu .	Obersdorfu	3	Inan
Podle 700 stránkové obžaloby Vogel jako zmocněnec východoněmeckého režimu pro takzvané humanitární otázky nutil žadatele o emigraci do tehdejší Spolkové republiky , aby mu levně odprodali své nemovitosti , které pak předával prominentům východoněmeckého režimu .	Vogel	4	Anim
Devatenáctiletá Francouzka se úspěšně přiživuje na popularitě amerických sourozenců ( French Open absolvovala s Lukem Jensenem ) , kteří dráždí konzervativce , zato diváci jejich výstřelkům aplaudují .	Jensenem	15	Anim
Kretschmer : Leptosom ( vysoký a štíhlý ) , atlet ( silná kostra , vyvinuté svalstvo ) , pyknick ( rozložitý , oblé tvary ) ;	Kretschmer	0	Anim
Robert Změlík se tedy pod dohledem svého týmu připravuje na mistrovství světa ' 93 , na své další střetnutí s obhájcem titulu a světovým rekordmanem O ' Brienem .	Změlík	1	Anim
Na minulém jednání vlády SR měl být schválen návrh na odvolání šéfa slovenské tajné služby SIS Vladimíra Mitra , s tím , že na jeho místo navrhl Mečiarův kabinet jmenovat Ivana Lexu .	Mitra	17	Anim
INHORGENTA München - 21 . mezinárodní odborný veletrh hodin , bižuterie , drahých kamenů , perel , stříbrného zboží a zařízení pro jejich zhotovení : 4 . - 7 . 2 .	München	1	Inan
O věrohodnosti ohlášené belgické sestavy náš trenér příliš přesvědčen není , zdá se mu přece jen příliš defenzívní : " Nejsem přesvědčen o tom , že Belgičané nastoupí ve složení , jaké van Himst ohlásil .	Himst	33	Anim
Knoflíček II . poprvé v Baníku	Knoflíček	0	Anim
Jistě , porovnáme asi neporovnatelné , ale jak jinak vyjádřit uznání a obdiv takovým Brunclíkům , Židům , Čížkům , Králům a mnoha jiným .	Králům	20	Anim
Stejně jako krutý vladař z třetího století před křesťanským letopočtem , věří také Teng na velké reformy .	Teng	13	Anim
Po rozvinutí mladých listů přihnojíme tekutým hnojivem OBM a přeneseme rostlinu do teplejšího prostředí , nejlépe s teplotou kolem # * .	OBM	7	Inan
Uvedl , že Egypt nezná rozsah projektu , který je údajně uskutečňován několik kilometrů od jeho hranic .	Egypt	3	Inan
Řada týmů z různých zemí analyzuje ekologické důsledky iráckého útoku na Kuvajt .	Kuvajt	11	Inan
Chystá se Inteco - Arbien	Arbien	4	Inan
Ševardnadze zároveň upozornil , že tento incident by mohl ohrozit jeho čtvrteční setkání s ruským prezidentem Jelcinem , na němž se má jednat o konfliktu v Abcházii .	Jelcinem	16	Anim
Spolupráce s MKS se týká výzkumu teorie jazyka a jazykových stylů , výzkumu současného spisovného jazyka , výzkumu nářečního , přípravy Slovanského jazykového atlasu a Slovníku slovanské onomastické terminologie .	MKS	2	Inan
Angličan Philip Griffiths mohl po čtvrté etapě volat své manželce do Stoke :	Griffiths	2	Anim
Plukovník StB Čadek udělal chybu , když poslechl doporučení novinářů a uchýlil se do předem připravených pozic .	Čadek	2	Anim
Na tomto řešení se včera podle TV Nova dohodl se zástupci Lidového svazu péče o válečné německé hroby se sídlem v Kasselu .	Kasselu	21	Inan
: Nepřipravovali jsme se na utkání jako na odvetu za Lillehammer , ale pouze jako na čistě přípravný zápas , kde by naše mladé mužstvo mělo získat zkušenosti .	Lillehammer	10	Inan
V zákulisí se však začíná proslýchat , že by Bukač mohl být tajně vyplacen z kontraktu a že na jeho místo nastoupí Hans Zach z Düsseldorfu .	Düsseldorfu	25	Inan
SAVEX - výstava zabezpečovací techniky , vojenského , leteckého a policejního vybavení : 9 . - 12 . 6 . 1994 .	SAVEX	0	Inan
Vsetínský Mařák využil v 9 . minutě zmatek před Čapkem a bylo to 1 : 0 .	Čapkem	9	Anim
Většina akcí z bodu # se děla v rámci závazků vyplývajících z rozvoje iniciativy pracujících , které pracovníci ÚJČ uzavřeli na počest # výročí osvobození .	ÚJČ	18	Inan
Důsledkem bude , že do soukromých škol už nebudou děti vybírány podle talentu , ale podle bohatství rodičů , " postěžovala si nám za rodiče dětí reálného gymnázia v Praze - Vysočanech Eva Benešová .	Vysočanech	31	Inan
Postup prací ukazuje , že VKD má bohaté zkušenosti s tak náročnou prací .	VKD	5	Inan
Výsadkářští veteráni sledují svého kolegu : pětaosmdesát britských účastníků bitvy o Arnhem si dalo " opakovací kurs " po padesáti letech , aby se mohli podílet na zopakování seskoku při vzpomínce na výročí bitvy .	Arnhem	11	Inan
Kromě Zairu o tom svědčí i vývoj v Angole , kde byla nedávno oslabena mise OSN právě v době , kdy se Jonas Savimbi z UNITA pokusil vrhnout zemi do nového kola občanské války a lidského utrpení .	Savimbi	23	Anim
Teprve roku # povolilo Nové Město pekaři Janu Petržílkovi z Malé Strany postavit mlýn na místě Spáleného mlýna před Oujezdskou branou .	Petržílkovi	8	Anim
Každý film dokončený v Ateliérech Barrandov se slavil právě v téhle vile .	Barrandov	5	Inan
Dluh částečně napravuje publikace Dušana Hladíka Porta coeli , kterou s podtitulem Dějiny kláštera od založení do skončení husitských válek vydalo tišnovské nakladatelství Sursum .	Sursum	23	Inan
J . Zenkl rovněž absolutně odmítl informace o problémech s převáženými vojsky .	Zenkl	2	Anim
Wilde mezi těmi , z nichž si nejvíc střílel	Wilde	0	Anim
V připravované akci Profitu získáte - motocykl , fax	Profitu	3	Inan
Kdyby v případě jabloneckého napadení Romů skinheady jednal tak , jak mu ukládá zákon , nemusel Čepela zemřít .	Čepela	16	Anim
Musicvars je agenturou specializující se na pořádání různých společenských a kulturních akcí , velkých prezentací .	Musicvars	0	Inan
Stejné je to i s řidiči metra a S - Bahnu .	Bahnu	10	Inan
Partneři v Ostroji nám vycházeli vstříc , takže stabilní vztah důvěry a motivace pro budoucnost se nám podařilo vybudovat velmi rychle .	Ostroji	2	Inan
Německý sedlák Vincenc Prieznitz z Gräfenbergu ( dnes Jeseníku ) si kdysi všiml , že si srnka poraněnou nohu máčí ve vodě .	Jeseníku	8	Inan
Náš brankář Hnilička inteligentní není a přesně to , co navrhoval agent Winter Hrbkovi , udělal .	Winter	12	Anim
Tak , jako se už navždy bude lišit výstavná západoberlínská třída Kurfürstendamm od chladně prefabrikované Karl - Marx - Allee .	Kurfürstendamm	11	Inan
Nejdůležitějšími centry obchodu s diamanty jsou dnes belgické Antverpy , americký New York , anglický Londýn , izraelský Ramat Gan , indická Bombaj .	Gan	19	Inan
Eros with Hare 60	Eros	0	Anim
Mezi ženami byla nejrychlejší Bogačevová z Kyrgyzstánu v čase 2 : 36 : 54 hodiny .	Kyrgyzstánu	6	Inan
Na fotografii Davida C . Turnleye pláče třiadvacetiletý americký seržant Ken Kozakiewicz nad smrtí svého kamaráda Andyho Alanize .	Turnleye	5	Anim
Katastrofa se odehrála takto : na zádi ponorky Komsomolec , která se 7 . dubna 1989 plavila jižně od Špicberků , vypukl požár .	Špicberků	19	Inan
Komentář Jan Gazdík	Gazdík	2	Anim
PŘEDSEDA BAVORSKÉ VLÁDY Max Streibl spolu s premiéry Václavem Klausem a Vladimírem Mečiarem pózovali včera v Norimberku pro fotografy během zahájení třetí konference šéfů vlád Pracovního sdružení podunajských zemí	Streibl	4	Anim
Toto všechno jsou samozřejmě i otázky pro L . Montagniera .	Montagniera	9	Anim
Voleník ( vlevo ) a Peřich krátce po jmenování do funkcí	Voleník	0	Anim
Tvůrcem nového termínu je Joseph Fisher .	Fisher	5	Anim
Bombardování bylo odpovědí na noční akci Hizballáhu , při níž byl zabit příslušník SLA a jeden povstalec .	Hizballáhu	6	Inan
Pořádá Hamburg Messe und Congres , GmbH , pražské zastoupení , 110 00 Praha 1 , Senovážné náměstí 20 , tel . : ( 02 ) 242236 45 , 236 3323 , FAX : 242236 56 , 236 3328 .	Messe	2	Inan
Moucheville - Olšany open	Moucheville	0	Inan
Jak včera sdělil tiskový mluvčí Antonín Dohnal , do konce letošního roku hodlá nakoupit 31 tahačů návěsů od nizozemské firmy DAF a 20 tahačů od rakouské firmy Stayer .	Dohnal	6	Anim
Jeruzalém / Washington -	Jeruzalém	0	Inan
Na rozdíl od předchozích pokusů se tentokrát nákladní loď nepřibližovala v automatickém režimu , ale řídil ji velitel posádky stanice Mir Jurij Malenčenko .	Mir	20	Inan
Písemný materiál uvedl TN Jiránek .	Jiránek	4	Anim
Na pražském hlavním nádraží se vedle čistě německých náboženských plakátů , zaplňujících podzemní chodby vedoucí na nástupiště , objevila na boční prosklené stěně nádražní haly více než metrová světelná písmena " AEG Bahnsysteme " . ;	Bahnsysteme	32	Inan
Podle Martina Švehly však nehrozí , že by causa Kreditní a průmyslové banky mohla mít bezprostřední vliv na stabilitu obdobných malých finančních ústavů .	Švehly	2	Anim
Vojtěch Starý , předseda ZV ROH , Miroslav Pohanka , podnikový ředitel .	Pohanka	8	Anim
Odstoupením Cavaka Silvy , který zemi převzal v roce 1986 , tři měsíce předtím , než vstoupila do Evropského společenství , končí období , kdy Portugalsko našlo politickou a ekonomickou stabilitu .	Cavaka	1	Anim
Opata břevnovského kláštera Anastáze Opaska a pracovníka bývalého OPBH Praha 1 vyslechl včera mezi dalšími svědky senát Městského soudu v Praze , který projednává žalobu na Martu Chadimovou .	Anastáze	3	Anim
Polský výtvarník a divadelník TADEUSZ KANTOR sjezdil s divadlem CRICOT 2 , které založil v roce 1955 , takřka celý svět .	KANTOR	5	Anim
Fangio trpí onemocněním ledvin a třikrát týdně se musí podrobit dialýze .	Fangio	0	Anim
Čtyřiatřicetiletý Gudlaugsson má v nominaci hráče podle svých představ , nejzkušenějším je obránce Jakobsen ( 31 let , 46 x v reprezentaci ) , jediným krajánkem útočník Muller , který obléká dres dánského Aarhusu .	Aarhusu	33	Inan
Na naši otázku , v čem může být v nových podmínkách kultuře prospěšný odbor kultury brněnského magistrátu , hájil jeho vedoucí dr . Stanislav Jabůrek tvrdošíjně potřebu " politických a řídicích funkcí " svého úřadu .	Jabůrek	24	Anim
Po groteskní projížďce gubernií dosahují na plese v Petrohradě ( vyprávění se pomocí hlučného a hybného komparsu a velkého lustru proměňuje v živý obraz ) " revizorovy " nezadržitelně výmluvné opilecké výmysly rozměrů fantaskní megalomanie .	Petrohradě	8	Inan
Tomuto zájmu vychází vstříc kniha Vladislava Pavláta Kapitálové trhy a burzy ve světě , kterou vydalo nakladatelství Grada .	Pavláta	6	Anim
Trolejbusy začaly jezdit v Tomsku , Čitě , Bělgorodu i v mnoha jiných městech , kde ještě zavedeny nebyly .	Bělgorodu	8	Inan
Miamští Kubánci prý mají připraveny miliardy dolarů pro okamžité investice na Kubě .	Kubánci	1	Anim
Izrael vyvíjí zvyšující se politický , vojenský a hospodářský nátlak na Libanon , aby ho oddělil od Sýrie v blízkovýchodním mírovém procesu , ale jeho pokusy nebudou úspěšné .	Libanon	11	Inan
V první řadě je to zlepšená doprava a především pravidelný letecký most z Prahy do Varny a do Burgasu .	Burgasu	18	Inan
Podobné řešení se nabízí v případě dopravy ze Smíchova na Barrandov .	Barrandov	10	Inan
Z Rothovy románové tvorby dále prosluly texty Hotel Savoy ( 1924 ) , Vzpoura ( 1924 ) , Job : román prostého člověka ( 1930 , česky 1934 a 1991 ) a Příběh tisící druhé noci ( 1939 ) .	Savoy	8	Inan
V pondělí v poledne má přicestovat do Prahy pětičlenná delegace hlavního města Alžíru , vedená starostou , profesorem Bachirem Mentourem .	Alžíru	12	Inan
Ve filmu se to už jednou stalo : před třiadvaceti lety v komedii Jacqua Demyho Největší událost od chvíle , kdy člověk vstoupil na Měsíc se ovšem Marcello Mastroianni stal obětí těhotenství hysterického .	Jacqua	13	Anim
Vysočany , část Holešovic , horní Žižkov jsou v této době mladými dělnickými obvody , jejichž dělnickou základnu tvořilo obyvatelstvo především prvé , případně druhé generace .	Vysočany	0	Inan
Anglický fyzik Rutherford a německý fyzik Geiger se v zabývali podrobnými pokusy s průchodem částic hmotou .	Geiger	6	Anim
Martin Kozumplík , Efekte Consulting : První den na burze po zavedení akcií z druhé vlny se dá jen těžko odhadnout .	Consulting	4	Inan
Osvěžily se i vzpomínky na nedávné republikánské extempore v Terezíně .	Terezíně	9	Inan
Závěrem shrnul Vacík hlavní úkoly pro nejbližší období .	Vacík	2	Anim
K ukončení sankcí OSN proti Iráku vyzvali včera v Ammánu turecký president Süleyman Demirel a jordánský král Husajn .	Ammánu	9	Inan
Jak uvedl včera na tiskové konferenci majitel firmy FALL František Urik , má jeho společnost zájem o koupi stoprocentního podílu na pivovaru Bohemia Rakovník .	Rakovník	23	Inan
Pro zlepšení zásobování zahájí MěstNV v rámci akce * výstavbu nové prodejny Pramen s občerstvením ve čtvrti Marxovy domy .	Pramen	12	Inan
Slavii bude proti Jihočechům chybět potrestaný Suchopárek a zraněný Šmicer , v péči lékaře a maséra je Šmejkal , který má nakopnutý stehenní sval , ale měl by být fit .	Šmejkal	17	Anim
Olympijský vítěz v desetiboji Robert Změlík se v minulých dnech nastěhoval se svou přítelkyní Andreou Sollárovou do nového bytu na sídlišti v Praze - Řepích .	Změlík	5	Anim
Projektový ústav Metroprojekt připravuje projekt dalších tras metra , předpokládá se prodloužení úseku trasy * z náměstí Míru k Olšanským hřbitovům v roce # , trasy * z Kačerova do Chodova v roce # .	Chodova	30	Inan
V malé privatizaci koupil a . s . Zakládání staveb za 330 milionů korun pan Březovský , statkář ve Škvorci .	Březovský	15	Anim
Zásady pro poskytování odměn a prémií pracovníkům ÚJČ ČSAV .	ÚJČ	7	Inan
Kytkovým reggae se skupina Babalet vrací k českému posluchači	Babalet	4	Inan
Mezi návštěvníky byli také lázeňští hosté z Toušeně a mezi zapsanými je také návštěvník z Habartova , okres Sokolov .	Habartova	15	Inan
Vyprávím celou tuto historku podplukovníku milice * Žurkovi s tajnou nadějí , že se od něho dovím ještě něco dalšího o pokladech a jejich hledačích .	Žurkovi	7	Anim
Atrakcí Rallye Bohemia je jistě i start Slováka Drotára s BMW M 3 , Rakušana Brandstettera se Subaru a Holanďana van Krimpena s Fordem Escort Cosworth .	Krimpena	21	Anim
Laureát Nobelovy ceny , jeden z nejváženějších amerických ekonomů Martin Feldstein tvrdí , že měnová unie plánovaná Maastrichtem je zbytečný luxus - regionálního vyrovnávání se totiž dá lépe dosáhnout změnami měnového kursu než odlišnými politikami pro určitá území .	Feldstein	10	Anim
V roce 1972 stáli v čele Němci Beckenbauer , G . Müller ( oba hráli za Bayern Mnichov ) a Netzer ( B . Mönchengladbach ) .	Beckenbauer	7	Anim
Výšlap po nich na skokanský můstek ve Frenštátu pod Radhoštěm není příliš bezpečný .	Frenštátu	7	Inan
Bubny se stávají výrazně dělnickou lokalitou na přelomu šedesátých a sedmdesátých let # století .	Bubny	0	Inan
Právě tehdy uviděl poprvé Peter Jenner v londýnském klubu Marquee hrát Syda Barretta , Rogera Waterse , Nicka Masona a Richarda Wrighta .	Syda	11	Anim
U řadového německého občana - na rozdíl od Francouzů či Dánů - bývá pak jeho pasivita vykládána spíše jako nedostatek vůle k vlastnímu úsudku : " Však už to vláda nějak zařídí . . . "	Dánů	10	Anim
3 / omyly smutného hrdiny povídek Václava Čtvrtka strážmistra Kuleho , který sám sebe zavřel a loupežníka Rumcajse propustil .	Kuleho	9	Anim
Při práci na osobním počítači jsem poznala programy WordPerfect a SUN .	WordPerfect	8	Inan
Nahrávky vznikly při vystoupeních v New Yorku , Ventuře a Dallasu v prosinci roku 1992 a v dubnu roku následujícího pro kanadskou pobočku firmy Sony / Columbia .	Dallasu	10	Inan
Podle Warda je to soukromá skupina lidí , které nadchla myšlenka vytvořit něco podobného , jako bývalo pražské anglické gymnázium .	Warda	1	Anim
Klicperovo divadlo v Hradci Králové uvádí dnes večer ( 19.00 ) premiéru inscenace Zazi v metru podle románu Raymonda Queneaua ( dramatizace Zora Vondráčková , režie Karel Brožek ) .	Raymonda	18	Anim
Klejch - 27 .	Klejch	0	Anim
Předseda klubu Augusto Cesar Lendoiro uvedl , že i bez obou Brazilců Deportivo na síle neztratí , navíc dodal , že na dobré cestě jsou jednání o přestupu uruguayského útočníka Rubena Sosy z Interu Milán .	Interu	33	Inan
První etapu má zahájit norská firma OPUS holding Bergen v příštím roce .	Bergen	8	Inan
Jako kandidáty do národní přehlídky navrhla porota soubory dva , taneční soubor Malá Jasénka z Klubu pracujících ve Vsetíně za vedení Věry Peroutkové a Dětský hanácký soubor Ječmínek ze ZK Uničovských strojíren v Uničově , vedoucí Eugenie Dubová .	Uničově	33	Inan
Přišli : Hamřík ( Edessaikos Edessa ) , Široký ( z juniorky ) , Kovář ( z vojny ze Znojma ) .	Široký	8	Anim
Tchaj - wan nyní realizuje šestiletý program rozvoje , který si vyžádá velké investice .	wan	2	Inan
Vystavoval v různých amerických městech a také v Evropě ( v Amsterodamu , Paříži a Londýně ) .	Amsterodamu	11	Inan
Zisk Peaccocka a Furlonga je Hoddleho úspěchem , byl o ně zájem v celé Anglii .	Furlonga	3	Anim
Nabízí se spolupráce s ligovým Vsetínem , ale to vše musíme teprve zvážit , dodal M . Broukal .	Vsetínem	5	Inan
Den nato napsal Krčín Vilému z Rožmberka .	Krčín	3	Anim
Pastorek , vedený tak jistě v záměru režisérem , svého Gottwalda jakoby buduje zevnitř , začíná mozkem a srdcem , rozumem a přesvědčením .	Gottwalda	10	Anim
Oba soupeři hlásí zranění klíčových hráčů : Brno Marošiho , Kobylky a Kuklety , Slavia Kozla , Šmicera , drobné problémy prý měli i Vávra s Krištofíkem , pro žluté karty navíc nesmí nastoupit reprezentant Berger .	Vávra	24	Anim
Po neděli retrospektiva pokračuje snímkem Mlčeti zlato , dobovou veselohrou s Mauricem Chevalierem , parafrází faustovského tématu Ďáblova krása s Gérardem Philippem a Michelem Simonem , a ironickým obrázkem maloměstské idyly Velké manévry s Philippem a Michéle Morganovou .	Gérardem	20	Anim
Pokud jsou počítače ve firmě propojeny do sítě , umí díky snadnému zaznamenání zvuku na počítačích Macintosh sezvat hlasem šéfa v jeho nepřítomnosti podřízené pracovníky na poradu .	Macintosh	16	Inan
Barevnou fotografii téměř nahého následníka britského trůnu prince Charlese otiskl včera na první straně nejrozšířenější německý deník Bild Zeitung .	Bild	17	Inan
S tímto předsevzetím přijel dvakrát na start také polský reprezentant Henryk Lasak .	Lasak	11	Anim
Na výstavě Ecolife budou představeny výrobky zdravé výživy , přírodní kosmetika , homeopatické látky , ekologicky nezávadné obaly a podobné produkty , které mohou ke zdravému způsobu života významně přispět .	Ecolife	2	Inan
Prezidentův přední rival , předseda parlamentu Ruslan Chasbulatov se včera zasedání ústavní porady nezúčastnil .	Ruslan	6	Anim
Kurz má na starosti Barbaru Rittnerovou , třetí tenistku SRN a 26 . hráčku světového žebříčku .	Kurz	0	Anim
Objevte kouzlo starých loutek v letohrádku Mitrovských ( do 31 . 7 . )	Mitrovských	6	Anim
Po asanaci Starého Města a Josefova se řada lidí ze středních sociálních vrstev , řemeslníků a zejména úředníků , stěhuje do Buben a na Letnou a narušuje dělnický charakter těchto obvodů .	Buben	21	Inan
Zástupce starosty Krnova ( okres Bruntál ) Vladimír Vocelka , s nímž se LN podařilo telefonicky spojit , označil situaci s telefonními službami v celém bruntálském okrese za obzvlášť kritickou .	Vocelka	8	Anim
O DŮVĚŘE PANIČOVI SE BUDE HLASOVAT V PÁTEK	PANIČOVI	2	Anim
Lesní závod Horní Maršov zaměstnává při zalesňování Krkonoš vedle Ukrajinců také téměř třicet dělníků z východního Slovenska , kde podobná práce buď chybí , nebo je hůř placená než v Čechách .	Ukrajinců	9	Anim
Opata břevnovského kláštera Anastáze Opaska a pracovníka bývalého OPBH Praha 1 vyslechl včera mezi dalšími svědky senát Městského soudu v Praze , který projednává žalobu na Martu Chadimovou .	Opaska	4	Anim
Prohlásil to v úterý venezuelský prezident Carlos Andres Perez v reakci na rozhodnutí Ekvádoru vystoupit z OPEC .	OPEC	16	Inan
Bohuslav Zajkr , Milan Kříž	Kříž	4	Anim
CERAMITEC - 6 . mezinárodní odborný veletrh strojů , přístrojů , zařízení , řízení a surovin pro celou keramickou a práškovou metalurgii : 11 . - 15 . 10 .	CERAMITEC	0	Inan
TRHY : Karlovy Vary - Drahovice , Kolín , Lázně Mšené - Ředhošť , Nymburk , Ostrava ( Černá louka ) , Přepeře u Turnova , Teplice ( stadion Na stínadlech ) , Valy u Přelouče .	Turnova	24	Inan
Praha 1 , Výstavní dům U Hybernů : FINALMAT - výstava finálních obkladových materiálů 5 . - 8 . 5 .	FINALMAT	8	Inan
Cyklistická extraliga PM Eurotrade po 15 závodech ( zbývají jen dva závody ) : 1 .	Eurotrade	3	Inan
Silnice z Vrchlabí do Špindlu byla z poloviny ucpaná .	Špindlu	4	Inan
Na závěr uvítali pořadatelé na výstavišti ministra * , místopředsedu státní plánovací komise Pavla Bahyla , ministra obchodu ČSR Josefa Trávníčka , sovětského konzula v Brně Vasilije Josipoviče Maljavka a předsedu severomoravského KNV Miroslava Čapku .	Josipoviče	27	Anim
Waters proto přivedl nového kytaristu Davida Gilmoura ( 1946 ) .	Waters	0	Anim
O případném vstupu kanadské firmy Alcan do společnosti Alufinal Žiar nad Hronom by v termínu , který bude dohodnut ještě tento týden , měli jednat představitelé obou firem .	Žiar	9	Inan
Protest aktivistů Charty 77 , Občanských komisí , HOS a Jazzové sekce	HOS	8	Inan
V kapse měl pouze 20 korun , tak je jisté , že se co nevidět někde objeví , řekl LN k případu pracovník tiskového oddělení východočeské správy policie Jaroslav Charvát .	Charvát	29	Anim
Tato slova řekl Raimund Strathman , muž z Evangelické vesnice mládeže , která má sídlo v Rensburgu v německé spolkové zemi Šlesvicko - Holštýnsko .	Strathman	4	Anim
S tříměsíčním zpožděním dostane ČSAD Ostrava a . s . 20 malých autobusů Mercedes - Benz 310 D .	Benz	15	Inan
1 . září 1939 zahájily výstřely z křižníku Schleswig - Holstein proti polskému Westerplatte druhou světovou válku .	Schleswig	8	Inan
Ladislav Martikán , Úvalno	Martikán	1	Anim
Sousedství s Temelínem si vybralo také hnutí Duha pro svůj červencový tábor v Zálší .	Temelínem	2	Inan
V nejbližších dvou dnech by měl do Grozného odletět jeden z místopředsedů ruského parlamentu .	Grozného	7	Inan
Myslivec Tomáš Svoboda z Češova byl pak popraven za přechovávání nekatolické literatury a za neúctu ke sv . Janu Nepomuckému nikoli na nádvoří Hradu , ale 29 . ledna 1726 v Kopidlně .	Češova	4	Inan
Osmatřicetiletý M . Werner , který utrpěl těžké poranění mozku , leží v kritickém stavu na neurochirurgickém oddělení nemocnice v Brně - Bohunicích .	Werner	3	Anim
Jeho patronem se stal doyen francouzských herců Jean Marais , který se však z návštěvy Pardubic pro nemoc omluvil .	Marais	8	Anim
Během týdenního pobytu uspořádá NVP pro hosty bohatý program spojený s besedami a návštěvami podniků a zařízení , kde se budou moci zástupci alžírského města seznámit s výstavbou Prahy a komunálním hospodářstvím .	NVP	4	Inan
2 . března 1968 : Syd Barrett opustil definitivně skupinu .	Barrett	6	Anim
Kontakt : Moravan , a . s . Petřvald , 742 60 Petřvald , tel / FAX : ( 0656 ) 91225	Petřvald	8	Inan
Boris Vian : Pěna dní .	Vian	1	Anim
