Bozduğunu o düzeltemez artık , lafını ilk defa o gün orada ettim .	lafını	5	Acc
Birlikten kuvvet doğar .	Birlikten	0	Abl
Bu atılımın son dalgaları , sonuna ulaşmakta olduğumuz yüzyılın ilk yarısında , fizikte izafiyet ve kuantum teorileriyle , biyolojide genetik alanında gerçekleşmiştir .	teorileriyle	16	Ins
Ama orada gayet normal hareket eden insanların çoğu , yandaki salona geçtiğinde şoka giriyorsunuz ; Resmen hard seks yapıyorlar .	seks	17	Nom
Taksitli satışlarda temerrüde düşen tüketiciye sağlanan haklar genişletiliyor .	tüketiciye	4	Dat
Olayın ikiyüzkırkyedi mağduru olduğu ifade edilen fezlekede , Akgündüz'ün , TCK'nın " W dolandırıcılık " suçunu tanımlayan beşyüzdört . maddesinin sekiz . fıkrasının ikiyüzkırkyedi kez uygulanması suretiyle cezalandırılması istendi .	fıkrasının	22	Gen
Pazartesiye haftalığımla birlikte verecek .	Pazartesiye	0	Dat
Ben kızdığım insanla halleşmezsem imkanı yok rahatlamam .	insanla	2	Ins
Bu raporlardan birer fotokopi aldılar .	fotokopi	3	Nom
Bunun üzerine askeri savcılıktan bir defa daha talepte bulunup Ankara Asliye Hukuk mahkemesindeki davanın selahiyeti açısından raporları eksiksiz görmek istediklerini belirttiler .	savcılıktan	3	Abl
Dosyada dikkatimi çeken ilk şey olayın en başından bu yana benim yanılmadığımı ispat etmesiydi ...	Dosyada	0	Loc
Gene de dedemi çok seviyorum , yanlış anlama .	dedemi	2	Acc
Cennet bekçisi İrfan oynamayı bırakıp bir köşeye çekilmişti .	bekçisi	1	Nom
Bağımlılar her şeyin en iyisini bildiklerinden kendileri için birinden yardım istemek egolarına ters düşer .	egolarına	11	Dat
Eniştem emekli olduktan sonra döndüler Ankara'ya , yerleştiler dişlerinden tırnaklarından ayırdıkları paralarla güç bela edindikleri kooperatif evine .	paralarla	11	Ins
Sürekli olarak bir duygudan bir başkasına atlamak , hiçbirini tam yaşamadan , hepsini şöyle bir hissedip geçmek beni yormaya başlamıştı .	duygudan	3	Abl
Ara sıra temizliği aksatsa da kendisine hep siz diyen bir kızcağız .	temizliği	2	Acc
Herkes uykuda , dedi .	uykuda	1	Loc
Sol eliyle içki kadehini kavradığında , içindeki zıkkımın bir yudumunu bile ziyan etmeden ağzına götürebilmesi için sağ eliyle tuttuğu kravatın ucunu yavaş yavaş çekerek sol elini harekete geçirirdi .	eliyle	1	Ins
Şirketin patronu olan okul arkadaşım her zaman giydiği birbirinin aynı siyah takım elbiseleri , inanılmaz derecede parlak kravatlarıyla öğlen yemeğine giderken kapıdan kafasını uzatıp Kaç ? diye soruyordu , ona o ana kadar okuyup kaydettiğim cinayetlerin sayısını söylüyordum .	kapıdan	21	Abl
Ne ki , zamanla yoğun sıkıntıya yolaçtı , bana göre , tekdüze , coşkusuz , amaçsız yaşam ; depreşti , ölçüye sığmaz oldu içki bağımlılığım .	zamanla	3	Ins
onbeş günlük iznini ABD'den gelen kardeşi , annesi ve babasıyla İstanbul'da geçiren Tuncer'in arkadaşları , şunları söyledi : " Aktan görev gereği zaman zaman uçakla Macaristan'a gidiyordu .	ABD'den	3	Abl
Türkiye , geçmişle ve geçmişin korkularıyla bağlarını kopardı gidiyor .	korkularıyla	5	Ins
Hem bir şey kırk kere söylenirse olurmuş .	kere	4	Nom
Dere yatağından getirilip köpeklerin erişemeyeceği bir yükseklikteki kütük setin üstüne istiflenmiş buz bloklarından bıçağıyla kopardığı parçaları kovaya dolduruyor .	parçaları	15	Acc
Yeni ilişkiler yeni hipotezlere ve bu hipotezler temelinde yükselen yeni kuramlara götürür .	hipotezlere	3	Dat
Bonnor : Fiziksel bir süreci betimlemeye çalışan matematiksel bir modelde ortaya çıkan tekillik genellikle kuramın çöktüğüne işaret eder .	modelde	9	Loc
CHP Genel Sekreter Yardımcısı Algan Hacaloğlu'nun hazırladığı pakette , " Kürt sorunu " ve " Güneydoğu sorunu " ifadeleri yerine " etnik duyarlılıklara demokratik çözüm " ve " kültürel çoğulculuk " kavramları tercih edildi .	ifadeleri	18	Nom
' BİNNAZ ' adlı şarkısıyla olay yaratan Ciguli , katıldığı canlı yayında dramını anlatıp herkesi ağlatınca iş sahibi oldu .	şarkısıyla	4	Ins
Katı , otoriter ve ilgisiz bir doktorla evli olan kadın , acısını uyuşturucu haplarla dindiriyor , yaşamındaki sevgi boşluğunu ise hayatını oğluna adayarak gidermeye çalışıyordu .	doktorla	6	Ins
Özene bezene kurulan her eve eninde sonunda ölüm girer .	eninde	5	Loc
Yaşamöyküsünü sürdürelim .	Yaşamöyküsünü	0	Acc
Eldiveninin iç tarafındaki kürkü tutarak tekrarladı : Siegen .	Eldiveninin	0	Gen
Yoksa , çalıp söylerken göz ucuyla kendilerini izleyen Saffet , ertesi gün canlarına okurdu .	canlarına	12	Dat
Benim evle ilgili ütopyam , baştan beri evle ilgili söylediklerimden sonra , ütopyanın reddine dayanmaktadır .	reddine	13	Dat
Başbakanlık'ta gazeteciler ile sohbet eden Şahin , önceki hükümetin memur maaşlarına hedef enflasyona göre zam yapma sözü verdiğini , ancak kendilerinin ikibinüç zammını geçmiş enflasyonlara göre vermeyi planladıklarını söyledi .	hükümetin	8	Gen
Gün boyu ormanda odun kesip kamyona yüklemekten yorgun düşmüş dört kişi depoya kamyonu yaklaştırmanın yollarını aradı .	kamyona	5	Dat
" Gönüllü " uygulanacak projeye göre , " zorunlu " olarak boşaltılan köylere dönüş imkanı verilecek , " terörden " mağdur olan köylülere tazminat ödenecek .	terörden	18	Abl
Eyvah ! Mantara basıyoruz galiba .	Mantara	2	Dat
On sekiz yaşında sırasıyla , içki , kokain ve eroinle tanışıyor .	eroinle	9	Ins
Mebrure zarfı bana uzattı .	zarfı	1	Acc
yirmibeş cesedin kimliğinin ise DNA incelemesiyle belirleneceği bildirildi .	kimliğinin	2	Gen
Bir gün bir küçük kaza olur , çantanızdaki bir flaster belki de hayatınızı kurtarır .	hayatınızı	12	Acc
İlkokul , ortaokul , üniversite .	ortaokul	2	Nom
' Grup Başkanvekilleri Salih Kapusuz , Eyüp Fatsa ve CHP Grup Başkanvekili Haluk Koç ile Büyükelçilik Konutu'nda dün sabah kahvaltıda bir araya gelen ' , milletvekilleri ile Irak'ı görüştü .	Konutu'nda	16	Loc
Matematikte doğruluğunu kendi içinde barındıran hipotezlerden yola çıkarak bir teoremi kanıtlarsınız ve dosya kapanır .	Matematikte	0	Loc
Nüfuslarının azalmasına paralel , kültürleri de dönüşüme uğradı .	Nüfuslarının	0	Gen
Bu saman sarısı saçların , takma kirpiklerin ve kelebek kanadı gibi boyalı dudaklarınla daha önce de arkadan vermiş olmalısın mı demişti .	kirpiklerin	6	Nom
Aygün , kredi kartı faiz oranlarının yüzde 118'lere kadar çıktığını , bir aylık ödemenin yapılmaması halinde temerrüdün devreye girmesiyle faiz oranlarının yüzde 375'e kadar yükseldiğini belirterek bunun akılla , Anayasa'yla ve demokrasiyle bağdaşmadığını söyledi .	demokrasiyle	31	Ins
Türkiye'nin yapacağı hibe ve yardımlarla ilgili olarak da Cumhurbaşkanı ve Başbakan'ın yetkileri saklı kalmak kaydıyla hükümetin belirleyeceği kişi ve kuruluşlar yetkili olacak .	kaydıyla	14	Ins
Çünkü kuantum kuramının öngörülerinden biri olan virtual parçacıklarla gerçek parçacıklar arasındaki ayrım oldukça ilginçtir ve açısından öğreticidir .	parçacıklarla	7	Ins
Toplantıyı evinde yapacak olan kişi , Sakarya caddesindeki iki büyük bakkaldan , ya da Bulvar üzerindeki Trakya Şarküterisi'nden peynir , salam , tarama , Rus salatası , dolma gibi şeyler alırdı .	bakkaldan	10	Abl
Aklım fikrim evde , gözüm gönlüm evde , ruhum kalbim evde , beş liraya bir de bisiklet aldım , her paydosta gidip gelmeye başladım .	paydosta	20	Loc
Güreş daha sonra Kara Havacılık Okulu'na gidiyor ve orada bir demeç veriyor .	demeç	10	Nom
Fuhuşun ıslak dünyası .	Fuhuşun	0	Gen
Bu kaybın , " turizm gelirlerindeki kesilme " , " petrol fiyatlarındaki artış " , " faiz oranlarındaki artış " ve " yabancı yatırımcının Türkiye'den kaçışı " gibi nedenlerden ortaya çıkması bekleniyor .	kaçışı	25	Nom
Ben de o gece kardeşlerimin yatma saati gelene kadar uzun uzun köpeğimizi anlattım onlara , ne de olsa o artık evimizin köpeğiydi .	evimizin	20	Gen
Kardeşimin kurtulacağını biliyordum " diye konuştu .	Kardeşimin	0	Gen
Üniversiteye lise bitirme derecesine göre alınıyor .	Üniversiteye	0	Dat
İnönü Meydanı'nda toplanan kalabalık , çözümsüzlüğün nedeni olarak Denktaş'ı gösterdi .	Meydanı'nda	1	Loc
Ölümü ensemde hissediyordum .	Ölümü	0	Acc
Evin , o eve özgü kokusu , mekanın sesi vardır .	Evin	0	Gen
Fasulye , pilakide havuçtan ve sarmısaktan takviye alır .	havuçtan	3	Abl
yedi yıl baba olma hasretiyle yanan Murat Öğretmen , ikibuçuk ay önce dünyaya gelen kızı İrem ve eşi Eser'i kazada kaybetti .	hasretiyle	4	Ins
Düşen " Konya " uçağında kabin görevlisi olan Deniz Karasu'nun hostes ablası Gaye Karasu , kardeşinin öldüğüne inanamadı .	uçağında	4	Loc
Bu hafta okurlardan gelen umumi talep üzerine Kırmızı Türkler'in temel özelliklerini madde madde sıralıyoruz : .	özelliklerini	10	Acc
Bunlar olup biterken küçük sarışın çocuk , kucağında , bacaklarının arasına sıkıştırdığı darbukaya sol eliyle hiç ses çıkarmadan , okşarcasına vuruyor , sağ eliyle de tabağındakileri ağzına tıkıştırıyordu .	eliyle	14	Ins
Ellerimi tuttu , şefkatle gözlerime baktı : .	Ellerimi	0	Acc
Ne rengi benzer , ne biçimi .	biçimi	5	Acc
Şimdi bu uçak kazasından da yaralı olarak çıktı .	kazasından	3	Abl
Ecevit partisinin bakanlarıyla protokolün bir tarafında otururken , diğer tarafta CHP'liler yer aldı .	bakanlarıyla	2	Ins
Sesler değişse bile duyguların seslere kattığı tonlamalar değişmez , ne kadar saklamak isteseler de bunu beceremezler , bir köpekten kokularını saklayamayacakları gibi benden de seslerini saklayamazlardı .	köpekten	18	Abl
Öyle bir felsefe ki bu , kendi içinde bir çelişkiyi taşıyor ; varoluşla yaşamanın birbirine hiç uygun düşmeyeceğini , bu ikisi arasındaki çelişkiyi anlatıyor .	varoluşla	12	Ins
Günü birlik yaşıyor , her konjonktürden , yasal ya da yasa dışı imkandan yararlanıyorlar .	imkandan	12	Abl
Kardeşinin bilincinin yerinde olduğunu , ancak konuşmadığını ve ailesini sormadığını ifade eden Mehmet Karamutlu , şöyle konuştu : .	bilincinin	1	Gen
Rengarenk oyuncaklar , birkaç dakikadan fazla ilgisini çekmedi küçük oğlumun .	dakikadan	4	Abl
Derhal müzik koymalıyım , beni alıp götürsün , şuradan Lou Reed kasetini .	kasetini	11	Acc
Mükelleflerin son dört yıldaki vergi matrahlarını artırmaları ve borçlarını uzun vadeli taksitlerle ödemeleri halinde vergi incelemesi yapılmamalı .	taksitlerle	11	Ins
Cumhuriyetçi Türk Partisi ( and ) Genel Sekreteri Ferdi Sabit Soyer de " Poor's'un planına halkın sahip çıktığını " söyledi .	planına	14	Dat
Rumların , Kıbrıs Türklerine yönelik uygulayacağı tedbirler ve AB'nin KKTC'yi IMF'nin - AKP'lilerin ederek Türk tarafındaki bazı çevrelere yapacağı yardım , halkta bölünmeye yol açabilir .	çevrelere	17	Dat
Katana gururla saatine baktı .	gururla	1	Ins
İşinden de olacak .	İşinden	0	Abl
Ama asıl avuçları iyi tanıyordu o cetveli .	avuçları	2	Acc
Bir binbaşı , bir yüzbaşı ve üç astsubaydan oluşan bir kaza kırım heyeti çağrılıyor .	astsubaydan	7	Abl
Hemen oracıkta kafanı bir güzel tıraşlayıvermiştin .	oracıkta	1	Loc
Öğretmenim , babam tarlada çalışıyordu ...	tarlada	3	Loc
Resmi tarihle , alternatif tarih arasında bir seçim yapmak zorundaymışız .	tarihle	1	Ins
' Hoca'nın son iddialarını ciddiye almadılar .	iddialarını	3	Acc
Kaç kez denemişti ; iki türküden sonra balıkçılar , utangaç hallerinden sıyrılıp , tarihin değil , doğanın kendilerine verdiği niteliği yeğleyerek , masalarda oturan yabancı kadınlara göz süzmeye başlıyorlardı .	hallerinden	10	Abl
Bölgedeki bazı ülkelerde iç karışıklıklara da neden olabilir .	karışıklıklara	4	Dat
Oğlan kurulmuş yay gibi fırladı yerinden : .	yay	2	Nom
Ardımdan da kendimi gördüm : kanalların suları üzerinde , kendiliğinden yol alan bir sandalda , daha büyük kanallara geçen , açık denize doğru yol alan kendimi .	Ardımdan	0	Abl
Gemi uzaklaştıkça el - kol hareketleri , çırpınışları görülmez oluyor .	Gemi	0	Nom
babasına yemek götürdük , dedi Katana duyulur duyulmaz bir sesle .	sesle	9	Ins
Bunlar olup biterken küçük sarışın çocuk , kucağında , bacaklarının arasına sıkıştırdığı darbukaya sol eliyle hiç ses çıkarmadan , okşarcasına vuruyor , sağ eliyle de tabağındakileri ağzına tıkıştırıyordu .	bacaklarının	9	Gen
Şimdiye kadar hiç bir köpekte görmediğim yeşil gözleri , gözünün üstüne düşen alacalı tüyleri var .	köpekte	4	Loc
Aygün , tüccar ve sanayicinin ödeyemediği vergilerden dolayı sıkıntı içinde olduğunu , bunların bir kısmı için icra işlemi başlatıldığını aktararak , ' düzenleme talebinde bulunduklarını ifade etti .	talebinde	23	Loc
Elma alınmasın ama , domates ismini hak eder .	ismini	5	Acc
Ah'lara , vah'lara gerek yok .	vah'lara	2	Dat
Artık savını şöyle düzeltmeyi öneriyorum : Deneysel ve gözlemsel içerikten yoksun olan bir bilimsel kuram , kendi içinde tutarlı da olsa mantıksal olarak zayıftır , metafiziktir .	içerikten	9	Abl
Dosya elimize geçtikten sonra ise olay aydınlanmaya başladı bizim açımızdan .	açımızdan	9	Abl
Norveç'ten ithal edilen Destecioğlu cihazının maliyeti üçyüzelli bin doları ( yaklaşık beşyüzelli milyar lira ) buluyor .	doları	8	Acc
Sezai Uyardı başlıklı haber , Göztepe takımı teknik direktörünün ismini içeriyordu .	direktörünün	8	Gen
Bilimin bugün içinde bulunduğu konumu daha yakından çözümlemek ve geleceğe ilişkin bazı kestirimlerde bulunabilmek için , burada sözünü ettiğimiz ilişkilerin tarih içinde izlediği gelişme çizgisini ele almak istiyoruz .	çizgisini	24	Acc
Gözlerinde korku ve acı ile bize bakıyordu .	Gözlerinde	0	Loc
Yataktan kalkıp balkona çıkmış , bir sigara yakmıştı .	balkona	2	Dat
Ne ki , zamanla yoğun sıkıntıya yolaçtı , bana göre , tekdüze , coşkusuz , amaçsız yaşam ; depreşti , ölçüye sığmaz oldu içki bağımlılığım .	ölçüye	20	Dat
Diyarbakır'da bir inşaat firmasında proje müdürü olarak çalışan inşaat mühendisi Servet Karadağ , evlendikten sonra da eşini yanından hiç ayırmadı .	proje	4	Nom
Her zamanki masasında oturuyordur .	masasında	2	Loc
Belki sekiz on - avukata müracaat ettim .	avukata	4	Dat
Naci Bey , şu sayfadan şu sayfaya kadar okuyun , demiş .	sayfadan	4	Abl
Buna göre bakanlık soruşturmayı yenileyebilirdi .	soruşturmayı	3	Acc
Huzur ormanında doğdu Ortadoğu barışı .	ormanında	1	Loc
Fezlekede , Almanya'daki bazı Türk vatandaşlarının " dolandırıcılık " iddiasıyla Akgündüz hakkında suç duyurusunda bulundukları belirtildi .	iddiasıyla	9	Ins
Bugün aralarında Sakaca konuşmalarına rağmen istatistiklerin gösterdiği yüzde kırk ikilik bir bölüm , kendi dilini biliyor .	istatistiklerin	5	Gen
Bu davanın sağlıklı görülebilmesi için de askeri savcının hazırladığı kararların ve bu kararlara alt yapı oluşturan raporların tamamının askeri savcılıktan istenmesi ve dava ile ilgili kişilerce incelenmesi gerekiyordu .	savcının	7	Gen
Sosyal güvenlik kuruluşları , belediyeler , il özel idareleri , KİT'ler , bağlı ortaklıkları , kamu kuruluşu niteliğindeki meslek kuruluşları da kapsama alınıyor .	kuruluşları	2	Nom
Ya da barınağın , konutun , bir türlü evleşememesine neden olabilir .	barınağın	2	Gen
Önlerinde hazırlanan raporların hepsi vardı artık ve zaman makinesi bir kez daha , bu sefer geriye , kazanın olduğu o ilk anlara doğru çalıştı ..	raporların	2	Gen
Yedi yıl boyunca çocuk hasretiyle yanıp tutuşuyorlardı .	hasretiyle	4	Ins
Hala okuyabilir , anlattığı aşklara katılabilir , maceralarında uzun yolculuklara çıkabilirdik .	yolculuklara	9	Dat
Rakının yanından eksik etmeyin .	Rakının	0	Gen
Bu atılımın son dalgaları , sonuna ulaşmakta olduğumuz yüzyılın ilk yarısında , fizikte izafiyet ve kuantum teorileriyle , biyolojide genetik alanında gerçekleşmiştir .	atılımın	1	Gen
Kentten iki mikrofonla , gerekli öteki aygıtları getirtmişti .	Kentten	0	Abl
Velhasıl , gevşek bir İhtilal Harekatı idi .	Harekatı	5	Nom
Elini sol cebine sokup bir fotoğraf çıkarttı , uzun uzun baktı .	Elini	0	Acc
Ev , ya da ev yapmak adına , ülkemizdeki gecekondu uygulamalarından öğrenecek epey şeyimiz olduğunu düşünüyorum .	uygulamalarından	10	Abl
Programda konser veren bin bağlamacının 500'ü Türkiye'den , 500'ü ise Avrupa'dan geldi .	Programda	0	Loc
Ormanlarda , sularda dans ediyordum .	Ormanlarda	0	Loc
Dere yatağından getirilip köpeklerin erişemeyeceği bir yükseklikteki kütük setin üstüne istiflenmiş buz bloklarından bıçağıyla kopardığı parçaları kovaya dolduruyor .	bloklarından	12	Abl
Dikkatimi çeken herkesin bizim gibi özenli giyimiydi .	Dikkatimi	0	Acc
Bir ara babanızla annenizin ayrılacağından korktunuz .	annenizin	3	Gen
Anlattığına göre , Evenlerin ataları Baykal Gölü'nün dağlık ve ormanlık doğu bölgesi , Amur Nehri Havzası ve Mançurya civarında yaşıyordu .	Gölü'nün	6	Gen
Stas , evin dışındaki yine kütüklerden inşa edilmiş depoda yeni avlanmış bir yaban koyununun derisini ve boynuzunu gösteriyor misafire .	kütüklerden	5	Abl
üç Kasım seçimlerinin ardından ağır yenilgiye uğrayıp barajın altında kalan siyasi partilerin binaları sessizliğe gömülürken , partililer de yeni konjonktüre ayak uydurma çabasında .	yenilgiye	5	Dat
YAŞ toplantılarında yıllardır tekrarlanan uygulamaya göre Taylor'ın üyeleri toplantının ilk bölümü ve Anıtkabir'i ziyaretlerinin ardından bir kuvvet komutanının verdiği öğle yemeğinde bir araya geliyor .	ziyaretlerinin	13	Gen
Albümleri geriye doğru çevirdim .	Albümleri	0	Acc
Bazen şarkı söylerken de olur bu , arkadaşlar bilir ( arkadaşlar , yani bıyıklarına ak düşmüş emekli sarhoşlar gözlerini yumup başlarını hafifçe eğerek onaylıyorlar ) okursa hüzzam okur , herkesi kahırlandırır .	başlarını	20	Acc
Koşarak ona yaklaştı heyecanla Abi ! ...	heyecanla	3	Ins
Perakendecilikte araştırmaları ve metodoljik çalışmalarıyla tanınan Underhill , dünyada " Why We Buy : The Science of Shopping " ( Neden satın Alıyoruz : Alışveriş Bilimi ) adlı kitabıyla tanındı .	Perakendecilikte	0	Loc
Bunlar senin Kutup Yıldızı'nın fikirleri , izlemen gereken yol da bu .	Yıldızı'nın	3	Gen
Hazine , ikibinüç yılı dış borçlanma programı çerçevesinde ikinci ihracını gerçekleştirerek , beşyüz milyon Finnur tutarında beş yıl vadeli ve yüzde on kupon faizli ' cinsi tahvil ihracı yaptı .	ihracını	9	Acc
Annemin bahsettiği sürpriz yoksa üvey baba olmasın ?	Annemin	0	Gen
Tezgahtan ve günün hayhuyundan ne kadar uzak olduğu sanılırsa sanılsın bu oda bir süre sonra tezgahı aratır oldu .	Tezgahtan	0	Abl
Ben akşama vurulacak insanların o sırada neler yaptığını merak ederek cinayet haberlerini kesip dosyalarına koyardım ; arada ilginç bir cinayet çıkarsa , kimin , nerede , nasıl öldürdüğünü yanımda taşıdığım özel cinayet defterime kendim için kaydederdim .	dosyalarına	13	Dat
Buna karşılık ben de onun mutsuzluk oyununu oynamadım .	mutsuzluk	5	Nom
Ama böyle birdenbire nasıl oldu bu iş ? Yüreğinden ve beyninden nasıl çıktınız ? İçeride mi o ? dedim .	beyninden	10	Abl
Arının peteğini , ayının inini , kuşun yuvasını insanın evinden ayıran şey , onların , o canlılar için bir ev olmamasıdır .	evinden	9	Abl
Son köşeyi dönerken , bembeyaz elbisesi içinde , kucağında yastığı , kaldırımda cansız yatan Hülya'nın üzerine kapanmaya hazırdım .	elbisesi	5	Nom
Adam , argoyla karışık da olsa - ki bu , sınıfını gizlemediğini gösterdiğinden bir erdem sayılabilirdi - Necmi Bey'i aratmayan güzel cümleler kurabiliyordu .	argoyla	2	Ins
Hamamcıoğlu , gelir oranı aynı olan ülkelerle kıyaslandığında anne ve bebek ölümleri oranının Türkiye'de yüksek olduğuna da dikkat çekti .	oranının	12	Gen
Bunları söylerken iki adımda Ömür Uzatma Kıraathanesi'nin kapısına varmıştı .	kapısına	7	Dat
Belediyelerden personel nakline izin verilmemesinin planlandığı pakette ayrıca , makam görev ve temsil tazminatlarının emekli keseneğine tabi tutulması önerisi de yer alıyor .	nakline	2	Dat
Dondurmacıya beklemesini söylediler .	Dondurmacıya	0	Dat
Seçimden önce dosyası Yargıtay'a gönderilen Akgündüz'ün yargılaması , Siirt'ten bağımsız milletvekili seçilmesi nedeniyle durdurulmuştu .	Seçimden	0	Abl
Toplantılarda herkes açık kalple konuşuyordu .	Toplantılarda	0	Loc
Alışveriş merkezlerinde raf etiketinde belirtilen fiyatla kasa fiyatı arasında farklılık olması durumunda satışın tüketici lehine olan fiyat üzerinden yapılması öngörülüyor .	kasa	6	Nom
Özellikle biyoloji ve jeolojinin insanın ve dünyanın kökenine ilişkin bulguları , evrenin merkezindeki durağan dünyasının sıradan bir gezegen olmasına yeni yeni kendini alıştırmaya başlamış olan Kilise'nin elinde kalan son önemli alana - Yaratılış Efsanesine - cepheden darbeler indirmiştir .	Efsanesine	33	Dat
Tüm bir kış bozulmadan kalmış karın içinde kenardan köşeden , ağaç aralarından ya da çalı diplerinden yürümüş farklı farklı hayvanların dağlarıydı buralar .	köşeden	8	Abl
Bana göre , eroin bağımlılarının büyük bir oranı zekalarından dolayı ve duygularını tanıyamadıkları için topluma uyum sağlamak yerine kendilerini iptal eden kişiler .	topluma	14	Dat
Tatarca uyuyan topraklar anlamına gelen Sibirya'nın bu insan yaşamaz taygasında kızağın kırılması , geyiğin kaçması , hatta avlanan kurtların saldırısı bir bakıma hayata noktayı koymak anlamına geliyordu .	noktayı	23	Acc
Nüfuslarının azalmasına paralel , kültürleri de dönüşüme uğradı .	dönüşüme	6	Dat
bildirilerinin hepsinde , evrim kuramına karşı geliştirilen bir sav ön plana çıkmaktadır : bir kuram , hipotez veya varsayım gözlem , deney veya bulgularla kanıtlanmadıkça doğru değildir .	plana	10	Dat
Kokteyle CHP Genel Başkanı Deniz Baykal ile çok sayıda partili katıldı .	Kokteyle	0	Dat
Kafamın yetmediği fen derslerinde düşünürdüm : Aynı hoca ağabeyime de böyle anlatmış .	Kafamın	0	Gen
Tam dört yıl önce , evimin tüm eşyasını kutulara doldurup bir depoya koydular .	kutulara	8	Dat
Müdür delikanlının uyuşturucu aldığını biliyor ama eroini aklına bile getirmiyordu .	eroini	6	Acc
İşçi Partisi ve Aydınlık gazetesinin çeşitli davaları dahil belalı denebilecek pek çok davayı alıp , üzerine gitmekten çekinmiyordu .	gazetesinin	4	Gen
Cumhurbaşkanı Ahmet Necdet Sezer , Akgüney Genel Başkanı Recep Tayyip Erdoğan'ın TCK'nın üçyüzoniki . maddesinden aldığı cezaya ilişkin hak kısıtlamalarını tamamen ortadan kaldıran basın yoluyla işlenen suçların ertelenmesine ilişkin yasayı veto etti .	maddesinden	14	Abl
Oğlan pantolonunu , gömleğini giyinmiş , donunu kayığın üstüne sermişti .	pantolonunu	1	Acc
yazarları Termodinamiğin İkinci Yasası'nın tanımını ve yorumunu yanlış yapıyorlar ! Yanlış ! Entropinin sürekli arttığını savunan Boltzmann yorumu , dizgedeki entropi üretiminin ısı akısı ve bu akıya neden olan sıcaklık gradyentinden hesaplandığını söyler .	akıya	26	Dat
Kaç kez denemişti ; iki türküden sonra balıkçılar , utangaç hallerinden sıyrılıp , tarihin değil , doğanın kendilerine verdiği niteliği yeğleyerek , masalarda oturan yabancı kadınlara göz süzmeye başlıyorlardı .	türküden	5	Abl
Bu alışveriş biliminin ilk ve en basit prensibidir .	biliminin	2	Gen
Deliği alkolle , haplarla , kokainle , LSD ile ya da eroin ile doldurmam fark etmiyordu .	haplarla	3	Ins
yazarları Termodinamiğin İkinci Yasası'nın tanımını ve yorumunu yanlış yapıyorlar ! Yanlış ! Entropinin sürekli arttığını savunan Boltzmann yorumu , dizgedeki entropi üretiminin ısı akısı ve bu akıya neden olan sıcaklık gradyentinden hesaplandığını söyler .	gradyentinden	30	Abl
Sovyet döneminin asimilasyon politikalarından da nasiplerini aldı Evenler .	nasiplerini	5	Acc
Ana Jet Üs Komutanlığı'na ait iki adet CASA - dört keşif uçağı , eğitim uçuşu için Erhaç Havaalanı'ndan kalkışlarından kısa bir süre sonra iddiaya göre havada çarpıştıktan sonra çakıldı .	Havaalanı'ndan	17	Abl
" Haberde Zago'nun İtalya'da üst üste iki yıl ' yılın futbolcusu ' seçildiği yazılı .	Haberde	1	Loc
İthal ederler .	İthal	0	Nom
babasına yemek götürdük , dedi Katana duyulur duyulmaz bir sesle .	babasına	0	Dat
Gerçekten de bu bin yılda önce evrenin merkezinde değil , Güneş etrafında dönen sıradan bir gezegende olduğumuzu öğrendik ; sonra sıradan bir canlı türü olduğumuzu .	gezegende	15	Loc
Bir mikrofon , ağzının tam karşısında , bir mikrofon da Recep'in darbukasının önünde dururdu .	darbukasının	11	Gen
Çünkü çocuğun dünyası saf duygudan ibarettir .	duygudan	4	Abl
Bir kuramın yanlışlanabilirliği o kuramın olumsuzluğuna , işe yaramazlığına değil , tam tersine verimliliğine , doğurganlığına işaret eder .	doğurganlığına	15	Dat
YSK , kapatmaya itirazları reddetti .	itirazları	3	Acc
Ama böyle birdenbire nasıl oldu bu iş ? Yüreğinden ve beyninden nasıl çıktınız ? İçeride mi o ? dedim .	İçeride	14	Loc
