PKK Ateş Açtı başlığı ise içerde kullanılmış .	içerde	5	Loc
Rumların , Kıbrıs Türklerine yönelik uygulayacağı tedbirler ve AB'nin KKTC'yi IMF'nin - AKP'lilerin ederek Türk tarafındaki bazı çevrelere yapacağı yardım , halkta bölünmeye yol açabilir .	IMF'nin	10	Gen
Sonunda elde kalanın doyum mu , doyumsuzluk mu olduğuna karar veremediğin , tütsülerin savrulduğu anıt - mezarlar ...	doyumsuzluk	6	Nom
Abajuru fişe takınca ışık verdi .	fişe	1	Dat
Teşvik uygulama , Sanayi Bakanlığı'na bağlansın .	Teşvik	0	Nom
Melek her zamanki yerinde , ümitle gelene geçene flasterlerini ve kalemlerini uzatıyordu , ama nafile ; kimsenin ona aldırdığı yoktu .	ümitle	5	Ins
Başbakanlık'ta gazeteciler ile sohbet eden Şahin , önceki hükümetin memur maaşlarına hedef enflasyona göre zam yapma sözü verdiğini , ancak kendilerinin ikibinüç zammını geçmiş enflasyonlara göre vermeyi planladıklarını söyledi .	enflasyonlara	24	Dat
Yatak odamı beğeneceksin ama .	odamı	1	Acc
Zeynep merak ve endişeyle kardeşine baktı : Orhan sen benden bir şeyler gizliyorsun ?	endişeyle	3	Ins
Bir Aydınlık gazetesi aldı , kazayla ilgili çıkan ilk haberi okudu ve hemen telefona sarıldı .	kazayla	5	Ins
Bu yüzden , çaldığı iki ağır türkünün ardından yine kıvrak bir göbek dansına , ya da bir bozlağa geçer , balıkçılar oturmayacak olurlarsa , kaş göz işaretleri yaparak , masalarına gitmeleri gerektiğini anlatırdı .	bozlağa	17	Dat
Hakkı'nın kız kardeşi benim adımı Karanlıkta Gelen Adam koydu bu olaydan sonra .	olaydan	10	Abl
Yerimden fırladım , kapıyı hızla açıp Ömür Uzatma Kıraathanesi'nden dışarıya çıktım .	dışarıya	9	Dat
En büyük isteklerinden biri bir çocuk sahibi daha olmaktı .	isteklerinden	2	Abl
Koray , bilim etkinliğinin tarih içindeki serüvenini geleceğe de uzanarak analiz ederken dosyamıza güzel bir giriş de yapıyor .	etkinliğinin	3	Gen
O arada geri dönüp olanları anlatmaya çalışan Ramiz'in kafasına indirdi cetvelini .	kafasına	8	Dat
Yataktan kalkıp balkona çıkmış , bir sigara yakmıştı .	Yataktan	0	Abl
İzzettin Doğan ve Alevi Bektaşi Kültürü Derneği Başkanı Ali Balkız gibi Alevi temsilcileri oturdu .	Kültürü	5	Acc
Annemle babam benimle ilgilenmiyor demek istemiyorum ; ama ben onlarla daha fazla birlikte olmak istiyorum .	Annemle	0	Ins
Ancak çok deneyimli bir psikiyatrist ya da psikolog bu kabuğun altındaki duygusal boşluğu sezebilir ve pek çok aydının çok dokunaklı bulduğu bu zeka parıltılarından etkilenmeden tanısını koyabilir .	parıltılarından	23	Abl
Ağır , babacan bir gülüşle gülüyorlar , önlerine eğdikleri başlarını ( saygıdan tabii ) ağır ağır sallıyorlar : Yazık , çok yazık , diyorlar .	saygıdan	11	Abl
Dosyamız esas olarak iki bölümden oluşuyor .	bölümden	4	Abl
Lacivert takım elbiseli , kır saçlı olan adam .	takım	1	Nom
Olayın ikiyüzkırkyedi mağduru olduğu ifade edilen fezlekede , Akgündüz'ün , TCK'nın " W dolandırıcılık " suçunu tanımlayan beşyüzdört . maddesinin sekiz . fıkrasının ikiyüzkırkyedi kez uygulanması suretiyle cezalandırılması istendi .	W	12	Nom
Ardımdan da kendimi gördüm : kanalların suları üzerinde , kendiliğinden yol alan bir sandalda , daha büyük kanallara geçen , açık denize doğru yol alan kendimi .	kanallara	17	Dat
Kadınlar sadece erkekler yüzünden mi derviş olmaz .	derviş	5	Nom
dörtyüzotuz trilyon ciroyla Türkiye'nin en büyük yirmiüç'üncü kuruluşu olan TPAO ve ikibinbir yılı vergi rekortmeni Kıyı Emniyeti , gelirlerinin yüzde on'unu bütçeye aktaracak .	rekortmeni	14	Nom
Sonra , patron olduğunu anımsatmak için , soymakta olduğu patatesleri bırakıp , bir çay doldurdu , masalardan birine geçti , sabahtan beri bakıla bakıla paçavra gibi olmuş gazeteyi eline aldı .	patron	2	Nom
Tramvaylar geçiyor , biraz önce dinmiş olan yağmurun ıslattığı kaldırımları , ara sıra elektrik tellerinde yol açtıkları kıvılcımlanmalar aydınlatıyordu .	kaldırımları	9	Nom
Geceleri kakıp , konuklara sunulacak rakı , votka , viski ne bulursam ; birer ikişer yudum kafama dikmeden , bölük pörçük uykumu bile sürdüremiyorum .	uykumu	21	Acc
" Kamunun bilgilenmesini gerektiren , ciddi boyutlu bu konuda anlamlı bir habercilikle , kimi intiharlar işlenebilir .	intiharlar	14	Nom
Peluş terliklerini gördüm , ayrımında değil .	ayrımında	4	Loc
Bunlar olup biterken küçük sarışın çocuk , kucağında , bacaklarının arasına sıkıştırdığı darbukaya sol eliyle hiç ses çıkarmadan , okşarcasına vuruyor , sağ eliyle de tabağındakileri ağzına tıkıştırıyordu .	darbukaya	12	Dat
Ayrılıkların hüzünleriyle yeni birlikteliklerin neşesi birbirine karışıyor , aynı günde birkaç duyguyu bir - iki saat arayla yaşıyordum .	hüzünleriyle	1	Ins
entelektüel yetilerde uzunca bir süre bozulma görülmeyeceğinden bağımlı kişilerde temelde yatan kişilik bozukluğuyla da beslenmiş , parlak bir zeka ve yalancı bir filozofluk çok belirgin bir ortak özelliktir .	kişilerde	8	Loc
Yaşamının son dönemlerinde kendini dine ve astrolojiye veren Newton'un , İngiltere'deki meşruti monarşiden esinlenerek formüle ettiği hızlaştırma çözümü bu açıdan tipik sayılabilir .	astrolojiye	6	Dat
Ütopya biliyorsunuz , olmayan yer , düş ülkesi demektir .	Ütopya	0	Nom
Sözleşmelerde yer alan tüketici aleyhine koşullara ilişkin düzenleme yapılarak , bu tür hükümlerin na olması sağlanıyor .	Sözleşmelerde	0	Loc
Arınç kürsüde önemli açıklamalar yaparken , babayla oğlu da anfide sohbet etti .	babayla	6	Ins
Kadınlar rahatça mağazada dolaşmaya , satış elemanlarıyla konuşmaya , ürünleri incelemeye , sorular sormaya , ürünleri denemeye ve sonunda satın almaya daha yatkın .	elemanlarıyla	6	Ins
Zenginlik içinde geçen mutsuz bir hayatın son demlerinde eroin bana mutluluk veriyor .	demlerinde	7	Loc
Daha sonra bu avukatla birlikte bir dosya hazırlamalısınız .	avukatla	3	Ins
KÜTÜK , yaşadıklarını şöyle anlattı : " Yapımcıyla konuşup dizide oynamak istediğimi söyledim .	KÜTÜK	0	Nom
Ayağımıza , bacağımıza , çenemize , hayatımıza , bir hareket geldi , bir hareket ...	Ayağımıza	0	Dat
Öğle yemeğinden sonra kadavra üzerinde yapacağımız çalışmayı asistanıma anlatırken kapı çaldı .	asistanıma	7	Dat
Üç makine , beş makine derken şaka maka dükkan , koca atölye oldu .	maka	7	Nom
Saime Sezginler'in uçak kazasıyla ilgili çaresizliği bir uçak yolculuğunda son buldu .	kazasıyla	3	Ins
Prezervatif yok mu bu markette ? diye sordun .	markette	4	Loc
Israr etseydin bize , daha güzel bir isim önerseydin ! ..	Israr	0	Nom
Hülya'nın dairesinde ışık yanmıyordu .	dairesinde	1	Loc
ATO Başkanı Sinan Aygün , altı bankanın temerrüt faizini düşüreceğini , diğer bankalarla da görüşmelerin halen devam ettiğini söyledi .	görüşmelerin	14	Gen
En sonunda içeriden gök gürültüsü gibi bir ses gelmiş .	içeriden	2	Abl
İki genç çoban biraz daha erken kahvaltılarını bitirip geyikleri geceledikleri bölgeden toplamış , sürerek getiriyorlardı .	bölgeden	10	Abl
Mazeret bildirip uçuşa gitmeyen ikinci pilotun yerine göreve çağrıldı , böylece o gece eşiyle yemeğe gitmek yerine ölüme kanat açtı .	ölüme	17	Dat
Niye olmasın ; iş hayatındaki başarının sırrı , ciddiyet ; güvenilir olmak , ama en çok da takipçiliktir , bütün bunlar da yeğenlerde fazlasıyla var doğrusu .	başarının	5	Gen
Yanında oturan annesinin , ağzına zorla tıkıştırdığı lokmayı bir hamlede yuttu ; parmakları darbukanın derisini okşadı ; başını çevirip , arkası dönük oturduğu sahneye baktı .	lokmayı	7	Acc
Şefkatle okşadım çizmeleri oturduğum kızakta .	çizmeleri	2	Acc
Recep'e kadınların ayaklarını gösterdi belli belirsiz bir göz işaretiyle .	işaretiyle	8	Ins
Binamıza isim bulmak diye bir mesele çıkmıştı .	Binamıza	0	Dat
Bu saman sarısı saçların , takma kirpiklerin ve kelebek kanadı gibi boyalı dudaklarınla daha önce de arkadan vermiş olmalısın mı demişti .	dudaklarınla	12	Ins
Güneş yeniden bulutların kalın örtüsü ardında kaybolmuştu .	bulutların	2	Gen
Bu konudan bahsettim .	konudan	1	Abl
Merdiveni geri çıkarken başımı Hülya'nın sırtına yasladım .	başımı	3	Acc
Nereye yönelsem arkamdan yetişiyordu , Sen kömür sobasını beceremezsin , yan odadan elektrikli zamazingoyu al , dolaptaki rakı çok soğuktur , en iyisi yattığım odanın aç kapısını , bak hemen kapının arkasında , kap gel ...	zamazingoyu	13	Acc
Çocukları yok .	Çocukları	0	Nom
Bu kaybın , " turizm gelirlerindeki kesilme " , " petrol fiyatlarındaki artış " , " faiz oranlarındaki artış " ve " yabancı yatırımcının Türkiye'den kaçışı " gibi nedenlerden ortaya çıkması bekleniyor .	nedenlerden	28	Abl
Çocukluğunda duygularını bastırmak zorunda kalmış , uyuşturucu alırken duygularını öldürmüş yetişkin çocuk birdenbire maddeyi bıraktığında psikolojik bunalımlar yaşıyor : bastırılmış ; nevroz , depresyon , takıntılar , kleptomani vb .	kleptomani	27	Nom
Sanıyorum , zaman aşımına uğradığı için benim itiraz sürem de geçmişti .	itiraz	7	Nom
Oktay Sarıtop nazik bir dille kaleme aldığı eleştirisinde " Türkiye'nin en iyi gazetesi olan Milliyet'i her zaman takdir ettiğimi bilmenizi isterim " diyor .	dille	4	Ins
İkinci dubleden sonra kravat düzeneğine gerek kalmazdı artık .	dubleden	1	Abl
Karşısında , pantolonu dizlerine dek ıslak , önlük torbası ham eriklerle dolu İbrahim dikiliyordu .	eriklerle	10	Ins
Bir solukta ufaklığı , annemle yaptığımız anlaşmayı , bu köpeği ne kadar çok istediğimi herşeyi ama herşeyi en ince ayrıntısına kadar anlattım .	herşeyi	16	Acc
Sözgelimi , Gümrük Birliği gibi bir yolculuğa çıkarken , çevresindeki duvarları yıkmaya çalışınca , eski eşyayla yenilerin bakışması gibi , hüzünlü ve çarpıcı yalnızlıklar yaşayan bir ülkeyi ...	eşyayla	15	Ins
Ayrılıkların hüzünleriyle yeni birlikteliklerin neşesi birbirine karışıyor , aynı günde birkaç duyguyu bir - iki saat arayla yaşıyordum .	Ayrılıkların	0	Gen
Bağcılar Cumhuriyet Başsavcılığı , Siirt'teki seçimin iptaliyle milletvekilliği düştükten sonra gıyabi tutuklama kararı vicahiye çevrilerek cezaevine konulan Fadıl Akgündüz hakkında , dörtyüzdoksandört - binikiyüzotuzbeş yıl arasında hapis cezası istemiyle fezleke hazırladı .	istemiyle	28	Ins
Oturma odasında cam kaseye kurulur .	kaseye	3	Dat
Bunlar olup biterken küçük sarışın çocuk , kucağında , bacaklarının arasına sıkıştırdığı darbukaya sol eliyle hiç ses çıkarmadan , okşarcasına vuruyor , sağ eliyle de tabağındakileri ağzına tıkıştırıyordu .	eliyle	23	Ins
Bakışları özlemle parkın ulu yeşil ağaçlarının dallarında , havuzdaki fıskiyenin parıltısında , kenardaki çiçek tarhlarının üstünde geziniyordu .	tarhlarının	14	Gen
Terk etmenin top yekün olduğunu düşündüğüm için ...	top	2	Nom
Abajuru fişe takınca ışık verdi .	Abajuru	0	Acc
Diğer Tunguz halklarının , Moğol kabilelerinin , hatta Tofa , Dolgan gibi bazı Türk boylarının da yaşam biçimine dönüşen geyik çobanlığını Asya'da ilk tecrübe eden onlar .	biçimine	17	Dat
Bilimde bu tür mucizevi elatmalara yer olmadığı gibi , varlığı , Tanrı'ya inananlar için tehlike yaratır : diferansiyel eşitliklerinizdeki matematiksel tekillikleri daha iyi bir modelle ortadan kaldırdığınızda Tanrınız da tekillikle birlikte ortadan kalkar .	tekillikle	29	Ins
Sözleşmelerde yer alan tüketici aleyhine koşullara ilişkin düzenleme yapılarak , bu tür hükümlerin na olması sağlanıyor .	koşullara	5	Dat
Katkısı için Ayhan'a teşekkürler .	Katkısı	0	Nom
EN SON ANNESİNİ ARADI .	ANNESİNİ	2	Acc
Sorumluluk nedir hiç öğrenmemişti ki .	Sorumluluk	0	Nom
Esin'le Özer birbirlerine baktılar Özer Prensesi ben koruyacağım ! dedi , Esin de gülümseyerek odanın ortasında dönmeye başladı yeniden : Ben bir prensesim , ben bizim evin prensesiyim . diye mırıldanarak .	Prensesi	5	Acc
Bir yandan da Kahve'nin günde kaç öğün yemek yiyeceğini , hangi vitaminleri alacağını , muhallebisinin şekersiz olması gerektiğini yoksa gözlerinin bozulacağını , aşılarının tarihini anlatıp duruyordu .	muhallebisinin	14	Gen
Sadece donuk bakışlarla etrafını süzüyor .	bakışlarla	2	Ins
Dört yıl depoda bekleyen ve soğuk duvarların arasında hapsedilen geçmişim , bana dünyayla arasına duvarlar ören bir masal ülkesini hatırlattı .	dünyayla	12	Ins
bilim dallarındaysa , gözlem veya deneylerden türetilen ilk ilkelerden , hipotez veya varsayımlardan yola çıkılır .	varsayımlardan	12	Abl
Güneş bulutların arkasından çıkmak istiyor , mat bir ışık olarak aydınlığını kentin üzerine vuruyordu .	aydınlığını	10	Acc
Matematikte doğruluğunu kendi içinde barındıran hipotezlerden yola çıkarak bir teoremi kanıtlarsınız ve dosya kapanır .	doğruluğunu	1	Acc
Oğlunun ölüm haberini Antalya'da alan baba Kemal Ulusu , dostlarının gönderdiği özel uçakla İstanbul'a döndü .	haberini	2	Acc
Ben hanımefendiyle beraber davaya başladıktan sonra elimizde belge , doküman yoktu .	hanımefendiyle	1	Ins
Yüzüme bakıp dudaklarını büzdü .	Yüzüme	0	Dat
Tatarca uyuyan topraklar anlamına gelen Sibirya'nın bu insan yaşamaz taygasında kızağın kırılması , geyiğin kaçması , hatta avlanan kurtların saldırısı bir bakıma hayata noktayı koymak anlamına geliyordu .	geyiğin	13	Gen
Kemal'in sözlerini tekrarlayarak , sevgilinin uyurkenki beş ayrı halini yirmisekizer , Hülya'nın gözkapaklarına çöküp toplanan buğunun renklerini otuzbeşer defa gözlerimin önünden geçirdikten sonra , uyuyamayacağımı anlayıp doğruldum .	gözkapaklarına	12	Dat
Cadı üvey anne üzerine yazılmış masallar .	Cadı	0	Nom
Yanımdaki koltuğa yerleştirdi ince bedenini .	koltuğa	1	Dat
Ben ağabeyleri olarak onların rahatını sağlamalı , onları zorluklardan kurtarmalıydım .	zorluklardan	8	Abl
Çocukların işi zor .	Çocukların	0	Gen
Bu kuruluşların ciro büyüklüklerine göre yaklaşık elli trilyonluk bir gelir sağlanacak .	kuruluşların	1	Gen
Sözleşmelerde yer alan tüketici aleyhine koşullara ilişkin düzenleme yapılarak , bu tür hükümlerin na olması sağlanıyor .	hükümlerin	12	Gen
En azından fen dahisi .	fen	2	Nom
Dört külah dondurmayı iki eliyle tutan kız takunyalarını tıkırdatarak içeri girdi .	dondurmayı	2	Acc
Birlikte inşaat işinde ortak olduk .	işinde	2	Loc
Naci Bey , şu sayfadan şu sayfaya kadar okuyun , demiş .	sayfaya	6	Dat
" Kimliği , askeri künyesinden saptanan Tuncer , bekardı .	künyesinden	4	Abl
" Kamunun bilgilenmesini gerektiren , ciddi boyutlu bu konuda anlamlı bir habercilikle , kimi intiharlar işlenebilir .	habercilikle	11	Ins
Bir müzikal yapalım : Hadi fıstık , ya da fındık aryaları söyledi .	aryaları	10	Acc
Bakalım daha nelere sokacak Grek burnunu ...	burnunu	5	Acc
Hadi lan , dedi Katana , sopa yiyeceğiz Naci Beyden .	Beyden	9	Abl
NA olgun bir kişiliğin göstergesi olan sabrı da öğretiyor .	kişiliğin	3	Gen
Askeri savcılık ilk olarak raporların bir kısmını gönderdi .	savcılık	1	Nom
İNANOĞLU , bu konuda " Evet , böyle şeyler söyledim ama artık işlerim yoluna girdi .	yoluna	13	Dat
Birkaç adım atıp , kumsalı okşayan yumuşak dalgaların çıplak ayaklarına değmesini bekledi .	dalgaların	7	Gen
Tayyip Erdoğan'ın yanında , onun yanlışlarına ortak olsaydım kesinlikle bu noktalarda bulunmazdım " sözünün Milliyet tarafından farklı yansıtıldığını öne sürdü .	noktalarda	10	Loc
Üvey babasıyla yaptığı kavgadan sonra , darbukasını , birkaç parça giysisini almış , yola düşmüştü .	babasıyla	1	Ins
Ünlü markaların bir yıl önceki modellerini uygun fiyatlarla Oparia Continuato'da , Magazine Montenapoleone'de bulabilirsiniz .	fiyatlarla	7	Ins
Kliniğe yatırma önerilerine karşı çıkamadım sonunda .	önerilerine	2	Dat
Dışardaki çadırda Şura ekmek hazırlıyor .	çadırda	1	Loc
Asıl düğümü çözmek ve en önemlisi hukuksal alt yapıyı sağlam temellere oturtabilmek için dokümanların tamamına ulaşmak gerekiyordu .	yapıyı	8	Acc
Dünyada olmak çelişik bir durum ...	Dünyada	0	Loc
Uyum paketinin ele alındığı toplantının ardından açıklama yapan Başbakan Yardımcısı Ertuğrul ' , daha önce otuzaltı madde olarak açıklanan paketin otuziki'ye düşürüldüğünü belirtti .	paketinin	1	Gen
Onlar krizmalarıyla yaşıyorlar .	krizmalarıyla	1	Ins
Efendi görünme dalgasına değildi , zorunluluktandı .	dalgasına	2	Dat
Yurtdışlarına gitti , ekonomi - mekonomi , işletme - mişletme de okudu .	Yurtdışlarına	0	Dat
Ele aldığımız sorun , iki yurttaş arasında , basit bir meta alış verişidir .	alış	11	Nom
Geceyarısından sonra biten işimden çıktığımda , o zamanların Beyoğlu'sunda varolan , kendine özgü , sabaha kadar açık kulüplere dadandım .	Geceyarısından	0	Abl
O sırada , iş dönüşü yorgun ve dalgın adımlarla geçip gidenlerden bir ikisinin gözleri takılır kenardakilere .	adımlarla	8	Ins
Bu amaçla bir heyet ocakta tesislerimizi gezmeye gelecek .	ocakta	4	Loc
Yurdundan kopup gelen aile , büyük kentin kendine uygun bir yerinde , önce başını sokacak bir göz oda ve çevrelediği alanın odadan kopuk bir yerinde helasını yapıyordu .	Yurdundan	0	Abl
Tramvaylar geçiyor , biraz önce dinmiş olan yağmurun ıslattığı kaldırımları , ara sıra elektrik tellerinde yol açtıkları kıvılcımlanmalar aydınlatıyordu .	tellerinde	14	Loc
Dosyanın önümüzdeki günlerde ele alınması bekleniyor .	Dosyanın	0	Gen
Şunu niçin düşünmüyorsun , diye başladı Hülya yeniden , bu insanların hemen hepsi çeşitli zamanlarda özel birtakım konularını seninle konuşurlar , sana danışırlar , senin söyleyeceklerine önem vermeye hazırdırlar .	konularını	17	Acc
Adını önce İngiltere ve Amerika'da duyuran Çağlayan , Paris'te yükselen yıldızını , başkentin gözde konser salonlarından ' Salla Gaveau'daki çılgın defilesiyle ' en iyiler ' arasına yazdırdı .	salonlarından	15	Abl
home lideri Recep Tayyip Erdoğan'ı taşıyan uçağın Pekin'e zorunlu iniş yapacağının duyulmasının ardından olayı Türkiye'ye bildirmek isteyen gazetecilerle işadamları arasında kısa süreli bir gerginlik yaşandı .	gazetecilerle	17	Ins
Kampın kasabaya yakın olmasının avantajından masadaki çilek reçelini tadarak yararlanıyoruz .	avantajından	4	Abl
Ben ürkerim zamandan .	zamandan	2	Abl
Bir taksi bulduk .	taksi	1	Nom
Görüldüğü gibi , dışarıdan bakıldığında doktor baba , sadık eş ve üniversite bitirmiş , iş hayatına atılmış delikanlı ; toplumun aile imajına ve değerlerine ne de uygun bir aile .	dışarıdan	3	Abl
Ailenin görev ( ! ) anlayışıyla yaptığı tüm fedakarlıklar da içten bir sarılmanın , doğal bir sevginin yerini tutmuyor .	anlayışıyla	5	Ins
Bu büyüme için öncelikle makroekonomik istikrarın en geç iki yıl içinde sağlanması gerektiğine dikkat çeken Özilhan , işsizlik konusunda yalnızca büyümenin yeterli olmadığını , aynı zamanda AKP'nin istihdamın önünde yükselen duvarların da yıkılması Arch gerektiğini belirtti .	duvarların	30	Gen
Ömür Uzatma Kıraathanesi'nin kapısı güm güm vuruldu .	Kıraathanesi'nin	2	Gen
doğada hepsinin birer barınağı var .	barınağı	3	Nom
Oğlunuza sarıldığınızda , aklınızdan , Ya bu ona son sarılışımsa gibi aptalca bir düşünce geçiyor .	Oğlunuza	0	Dat
Anne buna itiraz edince adam belindeki kayışı çıkarıp anne ile kızı öldüresiye dövmüş .	itiraz	2	Nom
Kemal Ulusu oğlunun naaşını almak için Diyarbakır'a giderken , anne İlkin Hanım ile diğer oğlu Atilla ilaçlarla yatıştırılmaya çalışıldı .	ilaçlarla	16	Ins
Berkeley ve yazarlarının savlarının , benzerliğine demeyeceğim , aynılığına dikkat ediniz !	benzerliğine	5	Dat
Bu incelemenin neticesinde vardıkları sonuç , uçak buzlanmadan pervanelerdeki ve motordaki buzlanmadan dolayı düşmüş olabilir .	neticesinde	2	Loc
Kapattınız mı zarfı .	zarfı	2	Acc
Böylece , insanlarla beraber kal ve yalnızlığı unut .	yalnızlığı	6	Acc
Lange Leidsewards Straat'da Kierkegaard okuyan kıza , kendisiyle yeniden görüşmekten sevinç duyacağımı söylemiş , ertesi gün öğleye doğru , onun oturduğu sokağın başındaki o güzel , iki katlı kahveye çağırmıştım onu .	öğleye	16	Dat
Saatine baktı .	Saatine	0	Dat
Bu yüzden , çaldığı iki ağır türkünün ardından yine kıvrak bir göbek dansına , ya da bir bozlağa geçer , balıkçılar oturmayacak olurlarsa , kaş göz işaretleri yaparak , masalarına gitmeleri gerektiğini anlatırdı .	dansına	12	Dat
Felsefeye merakı onu ünlü yazar , çizer ve ressamların dünyasına sokuyor .	çizer	6	Nom
Sen donunu taşı , dedi Recep oğlana , kayığın üstünde unuttuğu donu gösterip .	kayığın	8	Gen
Uçak seferlerini de artıracağız .	seferlerini	1	Acc
Ev , ya da ev yapmak adına , ülkemizdeki gecekondu uygulamalarından öğrenecek epey şeyimiz olduğunu düşünüyorum .	Ev	0	Nom
Bu savların hepsinin yanlışlığı ( fallacies ) gösterilmiş , idealist dizgeler yadsınmıştır ( refuted ) .	savların	1	Gen
Harun Yahya ve yazarlarının herbiri sanki reenkarnasyona uğramış Berkeley ! İlgili okura , Bertrand Russell'ın Türkçe'ye de çevrilmiş olan The History of Western Philosophy adlı kitabının Berkeley bölümünü okumalarını salık veririm .	okura	11	Dat
Ayrıca , mülteci ve göçmenler için yapılacak harcamaların bazı kanunlardan istisna tutulması için Bakanlar Kurulu'na yetki verildi .	kanunlardan	9	Abl
Şahin , makamında gazetecileri gruplar halinde kabul ederek sorularını yanıtladı .	sorularını	8	Acc
Dolayısıyla başkaları için ev yapmak - o evi yapan mimar da olsa - o başkalarının , o ailenin yaşantısını ve hatta hayatını yönlendirmek demektir : Ne büyük bir sorumluluk , acaba altından kalkılabilinir mi ?	yaşantısını	18	Acc
Ailesinden kalan , harcasa harcasa bitiremeyeceği kadar çok parası olan bu kadınla tanışmamın öyküsü bile tek başına bir kitap konusu olabilir .	Ailesinden	0	Abl
Türkiye bilim dünyasında spekülasyona , mistisizme , yazgıcılığa , kötümserliğe yer yok !	spekülasyona	3	Dat
Geceyarısından sonra biten işimden çıktığımda , o zamanların Beyoğlu'sunda varolan , kendine özgü , sabaha kadar açık kulüplere dadandım .	kulüplere	17	Dat
Bir kere tuvaletini yapmak için sık sık dışarı çıkarmak yoktu , çünkü o zaman ayakları kirlenir ve her defasında yıkamak gerekirdi .	tuvaletini	2	Acc
Çay bahçesinde tanışmışlar .	bahçesinde	1	Loc
Yolculuk bir barınağın önünde son buldu .	Yolculuk	0	Nom
Görmüyorlar mıydı : Girişten mağlup başlıyor , gelişme bölümünün ortasına bile sağ salim varamıyordum ; sonucu da felaket oluyordu bu durumda tabii .	Girişten	3	Abl
Gecenin hangi saatinde eve dönsem de , yakındaki açık gece mağazasından yiyecek birşeyler alabilirdim .	saatinde	2	Loc
Bu hafta borsa sekizbinbesyuz dokuzbinuzyuz - aralığı bandında hareket edebilir .	bandında	7	Loc
Ayşe Canatan haberin yeterli araştırma yapılmadan hazırlandığını ve okuru yanılttığını düşünüyor .	okuru	8	Acc
Komşular ihbar etmiş .	ihbar	1	Nom
Bodrum evi için bir anlamı ve güzelliği olan gumbillinin ( Bodrum evine özgü çatı parapeti köşelerinde yer alan süs elemanı ) ve beyazın , binlerce tekrardan sonra mide bulandırdığını söylemeliyim .	köşelerinde	15	Loc
Yerimden fırladım , kapıyı hızla açıp Ömür Uzatma Kıraathanesi'nden dışarıya çıktım .	Yerimden	0	Abl
İş Kanunu'nda öngörülen değişikliklerin bir an önce gerçekleştirilmesi ve bunun , İş Güvencesi Yasası'ndan önce yürürlüğe sokulması hayati önem taşıyor " diye konuştu .	Yasası'ndan	13	Abl
Çevresi gerçekten geniş olan bu genç kız , erkek arkadaş olarak hep hastalıklı , kendisine bakıcılık yapabileceği kültürlü ve bağımlı erkekleri seçiyor .	bakıcılık	15	Nom
Giderdik konserlere , tiyatrolara , sinemalara .	sinemalara	5	Dat
Ötekinde evrak çantam .	Ötekinde	0	Loc
Hızlı adımlarla yeniden Taşhan'a döndüm .	adımlarla	1	Ins
Tarihi , içinden dersler çıkarılacak cep kılavuzu olmaktan kültür boyutuna taşımak gerekiyor .	dersler	3	Nom
Türkiye'nin yapacağı hibe ve yardımlarla ilgili olarak da Cumhurbaşkanı ve Başbakan'ın yetkileri saklı kalmak kaydıyla hükümetin belirleyeceği kişi ve kuruluşlar yetkili olacak .	yardımlarla	4	Ins
İçki - miçki , kumar - mumar , sefahat - mefahat , coşku - moşku açısından ben önde .	miçki	2	Nom
Benim her zaman konuştuğum adam , yanıbaşımda masasında oturuyordu .	yanıbaşımda	6	Loc
Yaka takmadığı için Naci Bey birkaç kez kocaman kafasına tahta cetvelle vurmuştu .	kafasına	8	Dat
Boş zamanlarımda bazen cinayetlerin işlendiği yerlerde dolaşıp çevreye bakınır , cinayet anını gözümde canlandırmaya uğraşırdım .	zamanlarımda	1	Loc
Çantasını karıştırıyor , bir kalem arıyordu .	Çantasını	0	Acc
İkincisi de teknik raporun , Kara Havacılık Okulu'ndan bir albayın ve uçak şirketinden iki yetkilinin düzenlediği rapordaki bilgilerin aslında sadece enkazla ilgili olduğunu , uçağın düşüş nedeniyle ilgili olmadığını söylüyor .	albayın	9	Gen
