Köpeklerin çok sık yıkanması da iyi olmayacağından bu kurala uymam köpeğimin de iyiliği içindi .	iyiliği	12	Nom
Ancak ailesi huzursuz olduğu için birçok yolculuğunu karayoluyla yapardı .	karayoluyla	7	Ins
Arkadaşımı kaybettiğim için acım sonsuz .	Arkadaşımı	0	Acc
Kerem başını kaldırmış , ona bakıyordu .	başını	1	Acc
Bu gerçeklik içinde bir nesne gibi bakabiliriz ona , öznel bir nesne , bir gerçeklik görünüşü var .	gerçeklik	1	Nom
Bu konuda Cumhurbaşkanı Ahmet Necdet Sezer'in de " Türban tartışması bitmiştir " diyerek son noktayı koyduğu belirtildi .	Cumhurbaşkanı	2	Nom
Harun Yahya ve yazarlarının herbiri sanki reenkarnasyona uğramış Berkeley ! İlgili okura , Bertrand Russell'ın Türkçe'ye de çevrilmiş olan The History of Western Philosophy adlı kitabının Berkeley bölümünü okumalarını salık veririm .	reenkarnasyona	6	Dat
Bu atılım , insanlığı çağdaş bilim kavramının eşiğine ulaştırmış , ama Roma İmparatorluğu ve onu izleyen feodal dönemle kesintiye uğramıştır .	insanlığı	3	Acc
Yarın akşam , bana burada kaldığım evi bulan - ev de tanıdığım bir profesörün ya - Madam Kuve'ye yemeğe çağrılıyım .	profesörün	13	Gen
Aynada kendimi çok beğendim .	Aynada	0	Loc
Ben ona hep Kahve ismini yakıştırdım .	ismini	4	Acc
Irak tehdidi tepemizde durmasına karşın borsacıların hayalindeki hükümet formülü olan DYP CHP - koalisyonunun gerçekleşmesi durumunda borsa seçimden sonra bir ralli yapabilir .	koalisyonunun	13	Gen
Bu yaklaşım , toplumsal bilimleri de kapsamına alarak , tarihsel materyalizmi doğurmuştur .	materyalizmi	10	Acc
Bunun üzerine askeri savcılıktan bir defa daha talepte bulunup Ankara Asliye Hukuk mahkemesindeki davanın selahiyeti açısından raporları eksiksiz görmek istediklerini belirttiler .	talepte	7	Loc
İçeriden fırlayan genç çobanlar , geyikleri kızaklarından çözmeye başlarken yolcular hızla içeri girdi , ben de arkalarından .	İçeriden	0	Abl
Çoğu , çok kere beni daha çok falan filan bulurlarmış .	kere	3	Nom
Bakışları özlemle parkın ulu yeşil ağaçlarının dallarında , havuzdaki fıskiyenin parıltısında , kenardaki çiçek tarhlarının üstünde geziniyordu .	parkın	2	Gen
Kıskanmanın çaresizliğinden ve içimde yarattığı aşağılanma duygusundan kurtulmak ve bana kaçınılmaz gözüken o terk edilme gününun acısını daha baştan hafifletmek için , hayatıma kattığım kadınların sayısı artıyordu .	çaresizliğinden	1	Abl
Rastgele bir odanın kapısını vurdum .	kapısını	3	Acc
Artık eski iktidar mevzilerini yitirmiş olan Kilise , varlığını sürdürebilmek için , burjuvazi egemenliğinde daha geri noktalarda tutunmaya razı olmuştur .	varlığını	8	Acc
Hiç anlamadığım ayıplardan birkaçı bunlar .	ayıplardan	2	Abl
Hükümetin hedefleri tutturabilmek için önümüzdeki yaklaşık on günlük süreçte yeni gelir artırıcı veya harcama azaltıcı tedbir paketleri hazırlaması gerekiyor .	Hükümetin	0	Gen
Genelkurmay Başkanı'nın eşi de aralarında Başbakan , Milli Savunma Bakanı ve kuvvet komutanlarının da bulunduğu Grossman üyelerinin eşlerini öğle yemeğinde ağırlıyor .	yemeğinde	19	Loc
Aşınmış mermer merdiveni tırmandım .	merdiveni	2	Acc
" Taylor bugüne kadar ifade ettiği hususların , üniversite yönetimleriyle özerklikleriyle , akademik özgürlüklerle ilişkisi yok .	hususların	6	Gen
Herkes onun peşinde .	peşinde	2	Loc
Birçok kez eroinden kurtulmak için yurtdışında değişik hastanelerde yatmış ama her seferinde kendisinden daha bencil olan eroine dönmüştü .	hastanelerde	7	Loc
Taşhan'ın asma katı , kapısı kapalı odalarla doluydu .	odalarla	6	Ins
Yoksa bilim ile din arasındaki bu karşılıklı hoşgörü , bazılarının ileri sürdüğü gibi , Batı demokrasisinin ulaştığı ve örnek alınması gereken olgunluk düzeyinin bir sonucu değildir .	düzeyinin	22	Gen
Hepimiz heyecanla yerlerimizden fırladık .	yerlerimizden	2	Abl
Birçok kez eroinden kurtulmak için yurtdışında değişik hastanelerde yatmış ama her seferinde kendisinden daha bencil olan eroine dönmüştü .	eroinden	2	Abl
Ancak burada üretilen elektron - pozitron çifti hiç yoktan yaratılmamış , gama fotonundan üretilmiştir .	fotonundan	12	Abl
Bunun senin için gündelik hayatın olağan bir parçası olduğunu düşün .	hayatın	4	Gen
FDR'nin altıyüzotuzdört sefer sayılı Konya uçağının tekerleklerinin , yaklaşma hattının soluna kaydığı , ancak kaptanın uçağı düzeltme manevrası yaparken sol ana iniş takımının tepeye çarptığı ve pist başına yakın bir noktada parçalandığı ileri sürüldü .	kaptanın	14	Gen
Kadın bakmış ev konak gibi koskocaman , ambarları yiyecek dolu , bağlarda üzümler salkım salkım , ineklerin memelerinden süt damlıyor .	salkım	13	Nom
Meyhanelerin , o dönemlerde , erkeklerin sayıca ağır bastığı havası , sıkıyordu beni .	Meyhanelerin	0	Gen
Benim adam her zamanki masasında oturuyordu .	masasında	4	Loc
Diğer taraftan bilimin her teorik atılımı , yeni bir kavramsal yapının oluşturulup eski bazı kavramlardan kopuşu içerdiği için , ideolojide bir dönüşüme yol açar .	ideolojide	19	Loc
Bir dilim ekmek ve bir fincan çayı hızla midesine indirdi .	çayı	6	Acc
Belli ki modern dünyanın hantal varoluş biçimleriyle yüzleşmek geyiklerin hoşuna gitmiyor .	biçimleriyle	6	Ins
Raporları incelerken gelişmelerini yakından izlediği olayda kimi yetkililerin yaptığı açıklamalar ile raporlarda kimi ifadelerin ortak yönlerini , farklılıklarını karşılaştırmaya başladı .	ifadelerin	13	Gen
Tümüyle meşru yollarla yüksek rakımlı tepeye çıkmış adamı şişman ve ahaliyi pişman eyliyorlar .	ahaliyi	10	Acc
Belgin Dorukları da gittiğimiz yere götürüyoruz .	Dorukları	1	Acc
Gecede bir konuşma yapan Ecevit , cemevlerinin devletin katkısıyla yaygınlaşması gerektiğini söyledi .	katkısıyla	8	Ins
onbeş günlük iznini ABD'den gelen kardeşi , annesi ve babasıyla İstanbul'da geçiren Tuncer'in arkadaşları , şunları söyledi : " Aktan görev gereği zaman zaman uçakla Macaristan'a gidiyordu .	iznini	2	Acc
Üstelik , cinayetsiz bir cinayet romanı , romancı olduğunu kimsenin bilmediği bir romancı için de uygun bir konuydu bence .	romancı	7	Nom
Sağındaki taburede de darbukasıyla , Recep olurdu .	darbukasıyla	3	Ins
Bu tevazuyu gerektiriyor .	tevazuyu	1	Acc
Bütün bu olasılıklardan daha da can sıkıcı olanı , zamansız uyanan ayıların civarda olabileceği endişesiydi .	civarda	12	Loc
Her ne kadar Amatem'de görev yapan psikiyatrist Ali Babaoğlu bu zeka pırıltılarını eleştirse de : ...	Amatem'de	3	Loc
Harekatın çeşitli nedenlerle ertelenmesinin kısa vade için piyasaları olumlu etkileyeceği düşünülebilir .	nedenlerle	2	Ins
Korkunç düşlerle dolu bir uykuya sürüklenmek üzereydim .	düşlerle	1	Ins
Ayakta alkışladık .	Ayakta	0	Loc
Önce kahvelerimizi içelim de ...	kahvelerimizi	1	Acc
Mükelleflerin son dört yıldaki vergi matrahlarını artırmaları ve borçlarını uzun vadeli taksitlerle ödemeleri halinde vergi incelemesi yapılmamalı .	matrahlarını	5	Acc
İzleyiciler bu bakışın farkında olmasalar da , Recep kahrolur , darbukasına hırsla vurmaya , tempoyu hızlandırıp Saffet'i zorlamaya başlardı .	darbukasına	10	Dat
Yerde araç izinin olmaması ve kamyonun ilerleyecek yol bulamaması , ormanın bu bölümüne kasabadan sıkça gelinmediğini gösteriyordu .	Yerde	0	Loc
Dikkatle bakınca , bunun , büyük olasılıkla , her teknede bulunan , turistlerin eline verilen türden , ucuz darbukalardan biri olduğunu anladı .	darbukalardan	18	Abl
Ayrılıkların hüzünleriyle yeni birlikteliklerin neşesi birbirine karışıyor , aynı günde birkaç duyguyu bir - iki saat arayla yaşıyordum .	birlikteliklerin	3	Gen
Bul bir fıstık kan , at evine , rahatla , derdin bu senin .	fıstık	2	Nom
Geçen cuma günü son derste açıkladı .	derste	4	Loc
Oysa kıçlarını kaldırma zahmetine katlansalardı kendilerine bıraktığım dosyada yapacağım deneylerin üreme organlarıyla ilgili olduğunu , gönderilecek kadavranın cinsiyetinin de önemle dişi olması gerektiğini görebilirlerdi .	zahmetine	3	Dat
Bu hafta okurlardan gelen umumi talep üzerine Kırmızı Türkler'in temel özelliklerini madde madde sıralıyoruz : .	okurlardan	2	Abl
Fezlekede , Almanya'daki bazı Türk vatandaşlarının " dolandırıcılık " iddiasıyla Akgündüz hakkında suç duyurusunda bulundukları belirtildi .	duyurusunda	13	Loc
Kıbrıslı ayağa kalktı .	ayağa	1	Dat
Evi ev yapan , duvarlarına asılan resimlerdir , tablolardır , kullanılan biblolar , kap kacaktır .	Evi	0	Acc
Bu süreçle siyasal düzlemde ilişkilendirilen olgu da artık devrimler değil , devrimsizlik ve küreselleşme sürecidir .	süreçle	1	Ins
Son köşeyi dönerken , bembeyaz elbisesi içinde , kucağında yastığı , kaldırımda cansız yatan Hülya'nın üzerine kapanmaya hazırdım .	yastığı	9	Acc
Bir arkadaki kızağı çeken Yeltsin ve Çernomirdin ile ara ara göz göze geldiğimizde şefkatli bakışlarını seziyordum .	göze	11	Dat
Elinde beyaz bir zarf tutuyordu .	Elinde	0	Loc
Hükümetin hedefleri tutturabilmek için önümüzdeki yaklaşık on günlük süreçte yeni gelir artırıcı veya harcama azaltıcı tedbir paketleri hazırlaması gerekiyor .	süreçte	8	Loc
Acaba hata mı ettim parktan dışarıya çıkmakla ?	parktan	4	Abl
Hemen hemen planlanmamış alışverişin tamamı mağazada dokunarak yapılmış alıverişlerdir .	mağazada	5	Loc
Rehberde varsa telefonu ...	Rehberde	0	Loc
Avukat Nusret Senem : Olayın böyle üstünkörü kapatılmaya çalışıldığı konusunda , askeri makamlarda genel bir mutabakat olduğu anlaşılıyordu .	makamlarda	12	Loc
Bir dilim ekmeğe muhtaçız , diye yanıtlamış küçük kız .	ekmeğe	2	Dat
Leidse Alanından Vondelpark yönüne doğru , bir nehri andıran kanalın kıyısına iniliyordu , oradaydı bu geniş , rahat , sulara bakan kahve .	Alanından	1	Abl
İkili , bu birbuçuk saat zarfında dosyaların ellerine ulaşmayan parçalarını çıkarttılar .	zarfında	5	Loc
doğada hepsinin birer barınağı var .	doğada	0	Loc
Stas , evin dışındaki yine kütüklerden inşa edilmiş depoda yeni avlanmış bir yaban koyununun derisini ve boynuzunu gösteriyor misafire .	depoda	8	Loc
Uçaktan indiğimde , Üstündekiler olmaz .	Uçaktan	0	Abl
Baba , baba ! Hoca efendinin gırtlağından yukarısı tam dört tane patlıcan dolması aldı .	efendinin	5	Gen
Yok , yok , bilmez değilim : birçok eski dinin ürettiği efsaneler , iğretilemeler , kısa öykücükler de söylemek ister bunu ; ama bambaşka bir anlamda .	dinin	9	Gen
Taşhan'ın kapısını itip içeriye girdim .	kapısını	1	Acc
Beni niye sevdiğini hiçbir zaman anlayamamıştım , ama beni niye terk ettiğini biliyordum , bütün kadınlar beni hep aynı şekilde ve aynı nedenden terk ederlerdi zaten .	nedenden	22	Abl
Kağıt kalem bulmalıyım , bir de zarf .	zarf	6	Nom
Hazine tarafından dış borçlanmalar için verilebilecek garanti tutarı beşyüz milyon dolarla sınırlandırıldı .	dolarla	10	Ins
Madde kullanımı arttıkça acı eşiği de intihara , ölüme varana kadar yükseliyor .	ölüme	8	Dat
Okulun açıldığı ilk gün bayrak töreninden sonra sınıfa girdik ; herkes beğendiği yere oturdu .	töreninden	5	Abl
O kayıtsızlığıyla beni yerden yere vurdu , ben uğradığım muamele karşısında kapıldığım dehşetle kendimi yerden yere vurdum .	dehşetle	12	Ins
O gecenin - daha doğrusu sabahın - öyküsü şöyle : Sevda'nın güzel yemekleriyle şiş midemizle Özer'lerden çıktık .	yemekleriyle	12	Ins
Seni pencerede gördüm , dedi Maryline .	pencerede	1	Loc
Bu sözler , Batılı yiyecek ve tedavi kültürünün Evenlere ulaşmadan önceki durumu özetliyordu aslında .	sözler	1	Nom
Doğuştan da biraz iriydi zaten .	Doğuştan	0	Abl
Doktorlar kısa sürede kendisini toparlayacağını , ameliyatların iyi geçtiğini söyledi " dedi .	ameliyatların	6	Gen
Babam kapıda hazır beni bekliyordu .	kapıda	1	Loc
Pamuk Prenses masalının üvey babaya uyarlanması olmuş bence .	babaya	4	Dat
Duyguları öldürme eşiğinin tavanı ise ölüm .	Duyguları	0	Acc
Hayır , önce yemeğini bitir , diye üsteledi anne .	yemeğini	3	Acc
AB'ye uyum süreci nedeniyle hazırlanan azınlık cemaatleri vakıflarının mal edinmelerini düzenleyen yönetmelik kapsamına alınmayan Süryani ve Protestanlar isyan etti .	cemaatleri	6	Nom
Benim sileceğim araba Mersedes , BMW falan olacak .	BMW	5	Nom
Şimdi hiçbir şeye yaramadıklarını düşünsem de , yaşayabilmek için yazmak ! Böylece , o beklemekle , aramakla , bütün bu zaman parçalarını dolduracak olan boşlukla ve sıkıntıyla dolu yaşam çizgimi belirledim sanıyorum .	boşlukla	24	Ins
Leblebicilik , çıraklığı , kalfalığı , ustalığı olan bir meslek .	çıraklığı	2	Acc
Aygün , tüccar ve sanayicinin ödeyemediği vergilerden dolayı sıkıntı içinde olduğunu , bunların bir kısmı için icra işlemi başlatıldığını aktararak , ' düzenleme talebinde bulunduklarını ifade etti .	sıkıntı	8	Nom
bildirilerinin hepsinde , evrim kuramına karşı geliştirilen bir sav ön plana çıkmaktadır : bir kuram , hipotez veya varsayım gözlem , deney veya bulgularla kanıtlanmadıkça doğru değildir .	kuramına	4	Dat
Seçim gezilerine Şanlıurfa'dan başlayan SP'nin Topçu Meydanı'nda düzenlenen " Saadete Davet " mitingine Erbakan da katıldı .	SP'nin	4	Gen
Etrafı zaman zaman on metreye kadar yükselen ve bir sura dönüşen kayalarla çevrelenen bu ırmak , geyik sürülerinin dışarıdan gelebilecek saldırılara karşı kendilerini korudukları doğal bir sığınaktı .	kayalarla	11	Ins
Kimi bir şişe rakıyla öldürüyor , kimi üç gram kokainle , kimi beş gram eroinle .	rakıyla	3	Ins
Saime Sezginler aylarca çalışmış , kardeşinin arkadaşlarıyla saatlerce konuşmuş , kitaplar tercüme etmiş , ettirmiş ve bir uzmanın sahip olacağı teknik bilgiyi öğrenmişti .	arkadaşlarıyla	6	Ins
Sanırım gezmediği ülke , danışmanı olmadığı kimse , bilmediği ilke kalmadı .	ilke	9	Nom
Bir süre kepenkleri inmiş dükkanların önünden yürüdüm , gece zamanı karanlık ve sessiz duran şadırvana bir göz attım .	dükkanların	4	Gen
Aydınlık gazetesinde konuştuğu muhabirler , Biz size yardımcı olalım , dediler .	gazetesinde	1	Loc
Görgü tanığı köylüler , uçakların havada çarpıştıktan sonra yere çakıldığını ve gökyüzünde açılan paraşütler gördüklerini söyledi .	gökyüzünde	11	Loc
Bu büyüme için öncelikle makroekonomik istikrarın en geç iki yıl içinde sağlanması gerektiğine dikkat çeken Özilhan , işsizlik konusunda yalnızca büyümenin yeterli olmadığını , aynı zamanda AKP'nin istihdamın önünde yükselen duvarların da yıkılması Arch gerektiğini belirtti .	istihdamın	27	Gen
Gururlu bir gülümseme dolaştı somurtkan suratında .	suratında	5	Loc
Ütopya biliyorsunuz , olmayan yer , düş ülkesi demektir .	düş	6	Nom
Çayırlığa çıktılar .	Çayırlığa	0	Dat
Timur , Artık kendi yalnızlığımda tutunacak dal kalmamıştı , ruhsal çöküntümün önüne geçemiyordum , madde bana başlangıçta ihtiyacım olan şeyleri verdi : deliğimi kapattı , eksikliğimi giderdi .	eksikliğimi	25	Acc
Kabuğunu bile korumuştur .	Kabuğunu	0	Acc
Yunanlıların savaşım verdikleri konulardan biri de budur .	konulardan	3	Abl
Sevdiği genç trafik kazasında ölünce küsmüş hayata , teyzemden rivayet - olabilir de , insaf , on beş yıl geçmiş aradan .	teyzemden	8	Abl
Norveç'ten ithal edilen Destecioğlu cihazının maliyeti üçyüzelli bin doları ( yaklaşık beşyüzelli milyar lira ) buluyor .	maliyeti	5	Nom
Annem parmaklarını avcuna bir bir kapatarak anlatıyor : Bir kere işe güce hiç sebat etmemiş .	Annem	0	Nom
Elinde kağıtlar tutuyordu .	Elinde	0	Loc
Neleri sevmediklerine gelince , müşteri , beklemeyi , kendisine gereksiz soruların sorulmasını , stokta kalmamış ürünleri , okunamayan fiyat etiketlerini ve rahatsız edici hizmeti sevmez .	stokta	13	Loc
Hangi aday kazanırsa kazansın birlikte mücadeleyi sürdüreceklerini ifade eden Çelebi , ANAP'ı ayağa kaldırmak için hep birlikte çaba harcayacaklarını söyledi .	mücadeleyi	5	Acc
Salondan çıkarken herkesin yüzünün güldüğünü fark ettim .	Salondan	0	Abl
Duyguları öldürme eşiği hücrelerinde kayıtlı olduğu için yerine başka bir şey koysa da o şeyi de had safhada kullanıyor .	safhada	17	Loc
O nasıl her olumsuzluğa olumlu bir gözle bakıyor öyküde ?	öyküde	8	Loc
İzleyiciler bu bakışın farkında olmasalar da , Recep kahrolur , darbukasına hırsla vurmaya , tempoyu hızlandırıp Saffet'i zorlamaya başlardı .	bakışın	2	Gen
Ulvi meslek öğretmenliğe sığındık .	öğretmenliğe	2	Dat
Başbakan Abdullah Gül imzasıyla dün tüm valilere gönderilen genelgede yoksullukla mücadele için ilk adım olarak Ramazan Bayramı öncesi yoksullara ulaştırılmak üzere onsekiz trilyonluk kaynak ayırdığı belirtildi .	imzasıyla	3	Ins
Olası Irak operasyonunda Türkiye'den taleplere ilişkin son kararın alınacağı MGK öncesinde Ankara'ya gelen ABD'nin iki bakan yardımcısı yirmi milyar dolarlık paket açacak .	operasyonunda	2	Loc
Bilimsel teori , bir yandan içinde oluştuğu toplumun kavramsal yapısıyla , yani ideolojisiyle sınırlıdır ; öte yandan kendi ürettiği kavramlarla o ideolojiyi etkiler .	toplumun	7	Gen
YAŞ toplantılarında yıllardır tekrarlanan uygulamaya göre Taylor'ın üyeleri toplantının ilk bölümü ve Anıtkabir'i ziyaretlerinin ardından bir kuvvet komutanının verdiği öğle yemeğinde bir araya geliyor .	toplantılarında	1	Loc
Babasına koşmuş yumurcak .	Babasına	0	Dat
Yüzümün değişiminden ürkmüş gibi .	değişiminden	1	Abl
Onun çetrefil , kimi zaman açmazlarla dolu ruhunun içindeyiz demek , dedim .	açmazlarla	5	Ins
Sigarama davrandım , saygılıyım , ikincisine .	Sigarama	0	Dat
Türkiye savaş alanlarında değil , kelimelerle yürütülen mücadelelerde kaybediyor .	kelimelerle	5	Ins
Erkekler Parkı'nın yolunu bilmiyorum .	Parkı'nın	1	Gen
Ama gerçeklerden ne yarar gördüm ki ? derken yaşanmamış bir hayatın acı kıvılcımları , donuk gözlerinde çakıyor .	kıvılcımları	12	Nom
Zamanından önce programa başlamak zorunda kalan Saffet , baktı ki olacak gibi değil , türkünün ardından hemen kıvrak bir oyun havasına geçti .	türkünün	14	Gen
Yalanlara ve yanlışlara ömür boyu mahkum edilmiş bireyler ve toplumların dışarıdan görüntüsünün zeka sefaletiyle eşdeğer olacağı da doğru ...	dışarıdan	10	Abl
Ağır , babacan bir gülüşle gülüyorlar , önlerine eğdikleri başlarını ( saygıdan tabii ) ağır ağır sallıyorlar : Yazık , çok yazık , diyorlar .	gülüşle	4	Ins
Aygün , kredi kartı faiz oranlarının yüzde 118'lere kadar çıktığını , bir aylık ödemenin yapılmaması halinde temerrüdün devreye girmesiyle faiz oranlarının yüzde 375'e kadar yükseldiğini belirterek bunun akılla , Anayasa'yla ve demokrasiyle bağdaşmadığını söyledi .	oranlarının	20	Gen
Bağımlı kişinin beyninde duygular eşittir acı çekmek formülü vardır .	formülü	7	Nom
Biz sadece Milli Görüş tabanından değil , bütün kesimlerden oy aldık .	kesimlerden	8	Abl
Artık savını şöyle düzeltmeyi öneriyorum : Deneysel ve gözlemsel içerikten yoksun olan bir bilimsel kuram , kendi içinde tutarlı da olsa mantıksal olarak zayıftır , metafiziktir .	savını	1	Acc
Aileye damat olarak pancar da girdi .	Aileye	0	Dat
Boşalmasını sabırsızlıkla beklerim .	sabırsızlıkla	1	Ins
Gönlünün büyüklüğünü gösterdi .	Gönlünün	0	Gen
İkinci dubleden sonra kravat düzeneğine gerek kalmazdı artık .	düzeneğine	4	Dat
Serhat , Öyle bir şey öneriyorsun ki Kemal , dedi , bu öyle bir çırpıda karar verilebilecek bir şey değil .	çırpıda	14	Loc
mimarların , bazen kendilerini Tanrı gibi gördükleri duygusunun temelinde bu yatar .	duygusunun	7	Gen
Evin arkasındaki ormandan çıkmış , az ilerideki çitlerle çevrili alana doğru yürüyordu geyik sürüsü .	ormandan	2	Abl
Virgülden sonra Tayyip Bey'in de ismi gelince ikisi de aynı kefeye konmuş oluyor .	Virgülden	0	Abl
Stas , evin dışındaki yine kütüklerden inşa edilmiş depoda yeni avlanmış bir yaban koyununun derisini ve boynuzunu gösteriyor misafire .	boynuzunu	16	Acc
Kumru sabah akşam sarılıyormuş telefona .	telefona	4	Dat
Yattım nilüfer kayığına ...	kayığına	2	Dat
Geceyarısından sonra biten işimden çıktığımda , o zamanların Beyoğlu'sunda varolan , kendine özgü , sabaha kadar açık kulüplere dadandım .	işimden	3	Abl
Ankara Temsilcisi Fikret Bila da , Arınç'ı arayarak , " Bir serzenişte bulunmuşsunuz , ama sözleriniz teypte böyle , isterseniz deşifresini okuyayım , dedi .	teypte	16	Loc
Botel Maliye Hesap Uzmanları Vakfı'na hazırlattığı " Türk Vergi Sistemi , Sorunlar ve Çözüm Önerileri " başlıklı raporda vergi mevzuatı bütün yönleriyle değerlendirildi .	yönleriyle	21	Ins
Gece zamanı buldunuz bu kıraathaneyi .	kıraathaneyi	4	Acc
Tek hedefleri vardı : askeri savcılığın elinde bulunan tahkikat dosyasını bulabilmek .	dosyasını	9	Acc
Saime Sezginler aylarca çalışmış , kardeşinin arkadaşlarıyla saatlerce konuşmuş , kitaplar tercüme etmiş , ettirmiş ve bir uzmanın sahip olacağı teknik bilgiyi öğrenmişti .	bilgiyi	21	Acc
Halbuki şu anda işyerlerinin sağladığı finansmanla bu iş yürüyor " dedi .	işyerlerinin	3	Gen
Ama zaten buraya daha çok klasik dansı sevenler geliyor .	dansı	6	Acc
Arçelik olarak genelde tahminimizin üzerinde iyi bir yıl geçirdik .	tahminimizin	3	Gen
En sorunlu ülkelerden biri , basın özgürlüğünün " had safhada " olduğu - ve her gün ortalama seksenbes intiharın yaşandığı - ABD .	özgürlüğünün	6	Gen
Geçen süre zarfında İMKB'nin kısa tarihinde de yaşanan " en uzun düşüş dönemi " sonucunda hisse senetlerinin değer kaybı bugün TL bazında yüzde elli'leri buldu .	zarfında	2	Loc
O gecenin - daha doğrusu sabahın - öyküsü şöyle : Sevda'nın güzel yemekleriyle şiş midemizle Özer'lerden çıktık .	sabahın	5	Gen
Gazetecilere uçak havada yanarak geldi yere çakıldı diyen tanıklar , anket heyetinin hazırladığı raporlara göre , farklı konuşmuşlardı .	Gazetecilere	0	Dat
Çünkü kuantum kuramının öngörülerinden biri olan virtual parçacıklarla gerçek parçacıklar arasındaki ayrım oldukça ilginçtir ve açısından öğreticidir .	öngörülerinden	3	Abl
Alev'in babasının amacı , annesinin parasını istediği gibi kullanmak ve sevgilisiyle gününü gün etmek .	annesinin	4	Gen
Başlığı bulunca rahatladım , krizden kurtuldum ...	krizden	4	Abl
Adam kızın annesini görür görmez kadının güzelliğine vurulmuş .	güzelliğine	6	Dat
Hakkı'yla ihtilale bakmak istiyorduk .	ihtilale	1	Dat
Leblebi beyliğinin üç başkenti var : Çorum , Çankırı , Tavşanlı .	beyliğinin	1	Gen
Muhalifleri , halkın yüzde kırk bir buçuğunun oy desteğine mazhar olmuşlarsa , bu sonuca asla razı olmuyorlar .	sonuca	13	Dat
Esin'in bu cevabımı çok beğendiği her halinden belli oluyordu .	halinden	6	Abl
' seçim döneminde kendisini Çankaya Köşkü'ne çıkaracağı yolunda Milli Görüş tabanına propaganda yaptığını öne süren kapatılan RP'nin Genel Başkanı Necmettin Erbakan'a ' milletvekilleri sert tepki gösterdi .	yolunda	7	Loc
Onun yerine okula , ' Adını mezar taşına değil , okula yazdır ' pankartı asıldı .	okula	10	Dat
Ama ayakta kalmayı başardılar .	ayakta	1	Loc
Hayatın böyle ya da başka türlü olmasını ne ya da kim sağlıyor , bu iyi mi kötü mü .	Hayatın	0	Gen
Bir onyedi - onsekiz. yüzyıl bişopuna görünen gerçeklerle Harun Yahya ve baş yazarlarına görünen gerçeklerin bu denli benzeşmesi oldukça şaşırtıcı .	yazarlarına	12	Dat
Bugün doksaniki gün vadeli referans bono ihalesi ile piyasaların önüne çıkılacak .	piyasaların	8	Gen
House Zirvesi'nde TÜSİAD Başkanı , her yıl istihdam yaratmanın yolunun , yüksek ve istikrarlı büyüme temposundan geçtiğini vurguladı .	temposundan	15	Abl
Lafı ağzına tıkadım : Yahu , kızın ne kabahati var ! Anababalar münasebetsizse ...	Lafı	0	Acc
Irak tehdidi tepemizde durmasına karşın borsacıların hayalindeki hükümet formülü olan DYP CHP - koalisyonunun gerçekleşmesi durumunda borsa seçimden sonra bir ralli yapabilir .	tepemizde	2	Loc
Ve o filmden gitgide uzaklaşıyoruz .	filmden	2	Abl
bilim dallarındaysa , gözlem veya deneylerden türetilen ilk ilkelerden , hipotez veya varsayımlardan yola çıkılır .	ilkelerden	8	Abl
Babam , Ali'nin annesi Nihan teyzeden kağıt kalem isteyerek yapmamız gerekenleri tüm ayrıntılarıyla yazdı .	ayrıntılarıyla	12	Ins
Bartın gecesinden soğuk bir yel esmeye başlamıştı .	gecesinden	1	Abl
" Yurtdışında kazan konusunda uzman bir firmayla ortaklık yapmak istiyoruz .	firmayla	6	Ins
Bu kamp alanında depoların dışında iki ev var .	depoların	3	Gen
Yağla soğanla tencere içine kapatılmaz .	Yağla	0	Ins
Timur , Artık kendi yalnızlığımda tutunacak dal kalmamıştı , ruhsal çöküntümün önüne geçemiyordum , madde bana başlangıçta ihtiyacım olan şeyleri verdi : deliğimi kapattı , eksikliğimi giderdi .	çöküntümün	10	Gen
Madde kırkdört'e karşı dörtyüzkırkiki oyla kabul edildi .	Madde	0	Nom
MART'I BEKLİYORLARDI .	MART'I	0	Acc
