В таких опытах невозможен " слепой " метод : экспериментатор подопытный точно знает , какому воздействию он себя подвергает .	подопытный	10	Nom
Например , мусор у конкурентов собирается в съемный пластиковый бункер , который довольно быстро заполняется .	пластиковый	8	Acc
Прихожу к бабушке , старенькой совсем , седенькой .	седенькой	7	Dat
Скандальной - да _ .	Скандальной	0	Ins
Здесь делают упор на подготовку полиграфистов , и этот факт , как оказалось , известен всем кадровым службам , с которыми пришлось иметь дело Басковой .	кадровым	16	Dat
Этот большой закрытый канал пролегал от Форума прямиком в Тибр между Капитолийским и Палатинским холмами .	Капитолийским	11	Ins
Правительство всего лишь перестало искусственно поддерживать общину , как оно это делало с середины 1870-х годов .	1870-х	14	Gen
Установку смонтировали в химическом цехе Сахалинской ГРЭС , которая использует огромное количество морской воды для охлаждения агрегатов станции , так что проблем подачи воды на установку здесь нет .	химическом	3	Loc
У высокоорганизованных животных процесс потребления пищи управляется при участии центральной нервной системы , у менее высокоорганизованных этот процесс контролируется периферической нервной системой .	периферической	19	Ins
Проникновение человека в космос - это грандиозная программа , по-настоящему оценить результаты которой можно будет только в будущем .	грандиозная	6	Nom
Есть ли способы примирить на первый взгляд непримиримое : желание инвесторов получать выгоду от владения историческим объектом и желание общества сохранить его для потомков ?	непримиримое	7	Acc
Ежедневное круглосуточное наблюдение за передним краем позволяло предполагать , где могут появиться танки , где расположены огневые точки и противотанковые орудия .	передним	4	Ins
Позднее , 21 февраля по 23 марта 1919 года служил начальником штаба и временно командующим Сводным ( 5 - м ) Стерлитамакским корпусом .	Стерлитамакским	21	Ins
Вот некоторые из имевших ранее хождение в любительской среде , но сейчас совершенно не применяемых правил :	любительской	7	Loc
Но и в том наиболее вероятном случае , что у Бауэра просто не выдержало сердце , он стал последней жертвой Аушвица .	вероятном	5	Loc
Впереди всех Греция , Португалия , Испания и Ирландия - страны ЕС , опережающие по уровню традиционности и большинство посткоммунистических стран , что не мешает этой четверке динамично модернизироваться .	посткоммунистических	19	Gen
Эволюционная теория Ламарка предполагала внутренне присущее всему живому стремление к совершенствованию и наследование приобретенных при этом признаков .	присущее	5	Acc
Я не оспариваю роль фактора особой " ресурсной " экономики ( она же распределительная или раздаточная ) - но не принимаю идею предопределенности этого фактора .	ресурсной	7	Gen
От людей требуется создать подходящий формальный язык и программу , которая умеет проверять записанные на нем доказательства .	формальный	5	Acc
Таким образом , в процесс вовлекается вся вегетативная нервная система , и имеет место энергетическая активация тканей как верхних конечностей , так и всего тела .	энергетическая	14	Nom
Значит , отказ в приеме на работу по причине несоответствия психологического портрета кандидата будет необоснованным " , - поясняет юрист Елена Завьялова .	необоснованным	14	Ins
Грегори с родителями жил в маленьком , но довольно знаменитом провинциальном городке , известном своим университетом .	маленьком	5	Loc
Он приобретает опыт , становится заметным на рынке труда , появляются потребности , запросы растут , в результате человек переходит на более высокооплачиваемую работу .	высокооплачиваемую	22	Acc
- Директор кирпичного завода по моей просьбе перевел маму во вторую смену .	кирпичного	2	Gen
В ряде стран планеристы имеют право продолжать подниматься в облаках в неконтролируемом воздушном пространстве , однако в большинстве стран пилот обязан прекратить взлет до достижения нижней части облака .	неконтролируемом	11	Loc
Новорожденная девочка осталась жива .	Новорожденная	0	Nom
Во фракцию " Родина " с ее известными представлениями о добре и зле он вступил по зову сердца еще в рогозинские времена .	рогозинские	20	Acc
Государство у нас является недобросовестным собственником , пользуясь административным ресурсом , поощряет монополии , рейдерство , " бархатную реприватизацию " и т. д .	бархатную	17	Acc
Руки его дрожали , а голубые бездонные глаза неподвижно глядели на улицу , где неистовствовал поток ног - белых , черных , синих , красных , разноцветных .	синих	22	Gen
История знает много примеров , когда использование формальных спецслужб для решения щекотливых поручений било по репутации государства .	щекотливых	11	Gen
Появление преуспевающих бизнесменов и профессионалов , целенаправленно оставляющих карьеру , переходя к пониженному уровню потребления , выглядит парадоксом в логике стратификационного подхода - статусной системы , в которой социальная мобильность бывает только вертикальной .	статусной	23	Gen
А на востоке " северяне " направились в сторону Джелалабада ( к вечеру , по неподтвержденным данным , этот город тоже пал ) .	неподтвержденным	15	Dat
Есть та самая логика , пусть и вычисляемая задним числом , пусть эти вычисления так затруднительны в отношении Саакашвили .	задним	8	Ins
В русском языке это слово почему-то всегда связывается с чем-то очень архаичным , близким к земле и сельскому труду , и народному творчеству .	сельскому	17	Dat
Из нескошенного , засыпанного снегом пшеничного поля стали подыматься головы .	пшеничного	5	Gen
Как правило , это люди одухотворенные , устремленные к высокому , с большим опытом внутренних духовных переживаний .	одухотворенные	5	Nom
Помню нелепый спор из-за приземистого предмета , который она называла козеткой , - мне так же мало хотелось впустить его в свою комнату , как паршивого пса .	паршивого	25	Acc
Не рекомендуется менять Цилиндры местами : одновременно брать Солнечный Цилиндр в левую , а Лунный - в правую руку .	Солнечный	8	Acc
Категорически утверждать , что такого не будет никогда , нельзя , но очевидно , что сегодня подобные проекты носят " погромный " характер по отношению ко всей существующей цивилизации .	погромный	20	Acc
Правда , совершенно не согласен с этим Сергей Рощин : - Уже через год специалист , приехавший из региона , адаптируется к столичным реалиям .	столичным	22	Dat
И наша гражданская активность должна проявляться именно здесь .	гражданская	2	Nom
Это очень страшно видеть потому , что начиналась ведь судебная реформа .	судебная	9	Nom
Таким образом , мы получаем возможность видеть на экране компьютера невидимое обычному глазу биополе человека .	обычному	11	Dat
Сырье и энергетика , естественно , останутся базой развития Сибири - трудно представить , что холодный регион станет поставщиком на мировой рынок хлопчатобумажных тканей или овощей с фруктами .	хлопчатобумажных	22	Gen
Однако по уровню необходимой подготовки подледные погружения все-таки ближе к обычному дайвингу .	обычному	10	Dat
Станция Лиски в то время была очень значимым узлом в том смысле , что через нее активно перемещались потоки людей , влекомые своими политическими пристрастиями .	значимым	7	Ins
Этим он обязан уникальной ультразвуковой системе ориентации .	ультразвуковой	4	Dat
Тут , конечно , приходит на ум притча о заблудшей овце , ради которой добрый пастырь оставляет всё стадо - так говорил Спаситель , и это было для него очень принципиально .	заблудшей	9	Loc
Наблюдатели , находящиеся в различных инерциальных системах отсчёта , но `` в одной &#39;&#39; пространственной точке , всегда могут сравнить текущие показания своих часов .	пространственной	14	Loc
Единственным у нас в стране специалистам по гидроупругости за короткий срок фактически удалось создать новый метод для расчета поведения плавающих пластин , который , по признанию специалистов в этой области , на сегодняшний день является лучшим в мире .	Единственным	0	Dat
Я уверена , что крепкие православные убеждения Матушки Анны найдут применение в ее новом назначении - не может же она , будучи глубоко верующим человеком , поступиться православными принципами , догмами и т. д. идти на компромиссы , нарушая их	православными	27	Ins
Как подследственные , так и только что получившие срок попадают в местную тюрьму , откуда их удобно возить в суд и обратно .	местную	11	Acc
Высокоточное сканирование поверхности и многократное воздействие позволят создать протяженные объекты , характеризующиеся регулярной наноструктурой .	регулярной	12	Ins
Тардавка ( иногда встречается Тардовка ) была образована при реке Тарлау в 1880 -- 1882 годах .	1880	12	Loc
Пожалуй , Зыкова с годами еще отощала и в ее перманенте больше стало седого сена , но по-прежнему она груба и энергична и по-прежнему стоит за правду , как ее понимает .	седого	13	Gen
Но конкурентоспособным практически всегда оказывается второй .	конкурентоспособным	1	Ins
Говорить о том , что они поставят какой-то более высококвалифицированный менеджмент и он изменит ситуацию , ну , это … не очень серьезно " .	высококвалифицированный	9	Acc
Что будто бы он сильный и мужественный и любил ее , а она тоже любила , но почему-то говорила " Нет ! " - и он уехал далеко на север и стал рыбаком , а она страдала .	мужественный	6	Nom
Вот " Единую Россию " не выбрали бы в думское большинство .	Единую	2	Acc
Если между ультразвуковым датчиком и изучаемым объектом нет препятствий , которые вносят искажения в волновой фронт , то луч можно сфокусировать на определенном участке объекта ( А ) .	ультразвуковым	2	Ins
Не исключено , на трудности подобного рода будет рассчитывать кое-кто из " гвардии " застойного периода , привыкшей монопольно решать , кому из наиболее верных , а еще лучше зависимых " друзей " представлять народ в Верховном Совете .	Верховном	36	Loc
Не являясь активистом движения , дорогу я оплачивала сама , но проживание в палатках и кормежка были бесплатными .	бесплатными	17	Ins
Для этого пришлось пройти через долгое и болезненное переосмысление прошлого , чего в России так и не было сделано .	болезненное	7	Acc
Казалось бы , потребительскому буму должно сопутствовать хотя бы туповатое благодушие .	туповатое	9	Nom
В Белгородской области ликвидация угрожает каждой шестой НКО , в Хакасии и Кемеровской области - _ каждой седьмой , в Калмыкии - _ каждой восьмой , в Калининградской и Астраханской областях - _ каждой десятой .	десятой	34	Dat
Может возникнуть вопрос , а нужно ли при отсутствии каких-либо государственных нормативно - правовых документов и материалов в системе отношений вузовской журналистики и практики СМИ искать пути их интеграции , стучаться в наглухо закрытые двери .	правовых	13	Gen
Тогда же партия создает штурмовые отряды ( СА ) для охраны партийных митингов , а в марте 1923 года - _ более элитарные охранные отряды ( СС ) .	штурмовые	4	Acc
Официальное сообщение ОПЕК на этот счет возможно уже сегодня .	Официальное	0	Nom
Чуть приоткрытые в полуулыбке губы нежно вмяты в добрые полные щеки , большие серые глаза будто присматриваются к чему-то хорошему , радостному .	радостному	21	Dat
Большая часть его побережья дикая и неприступная .	дикая	4	Nom
Первая , по всей видимости , была развернута в ходе Альбигойских войн .	Альбигойских	10	Gen
В частности , в бюллетене рекомендуется немедленно эвакуировать людей от источника угрозы , ни в коем случае не пользоваться сотовыми телефонами и пейджерами поблизости .	сотовыми	19	Ins
Российские медики провели 12 хирургических операций , ряд пострадавших был направлен в близлежащие больницы , остальным сотрудники МЧС оказали помощь амбулаторно .	близлежащие	12	Acc
Они оказались включенными в серпентинитовом " меланже " вместе с округлыми телами альбититов .	округлыми	10	Ins
Самый древний из сохранившихся манускриптов ( Манускрипт F ) существенно короче остальных , но текстологические данные заставляют предполагать , что другие сохранившиеся манускрипты основаны на более полных оригинальных текстах .	оригинальных	27	Loc
Все 10 подсудимых обвиняются в терроризме , бандитизме , захвате заложников , незаконном приобретении и ношении оружия .	незаконном	12	Loc
Доказательства оскорблений выглядят даже несколько юмористично , а аргументы обвинения написаны на таком языке , который хоть и выглядит русским , но вразумительному прочтению не поддается .	вразумительному	22	Dat
Беседа руководителя КНДР и южнокорейского дипломата прошла в " теплой и дружественной обстановке " , отмечается в сообщении агентства .	дружественной	11	Loc
И этот системный конфликт , может , окажется долгосрочным .	системный	2	Nom
В своих работах они рассматривают мыслительную деятельность как результат взаимодействия между нейронами в головном мозге .	мыслительную	5	Acc
Причем с неопробованным методом очистки отходящих газов .	неопробованным	2	Ins
При смерти головного мозга могут сохраняться рефлексы , связанные со спинным мозгом .	спинным	10	Ins
Но парадокс устраняется , если понять , что гламуроемкость - более значимый фактор , чем наукоемкость : эффективность расходов на исследования и разработку определяется направленностью этих исследований .	значимый	11	Nom
В таких условиях представление о российском обществе как коллективистском , соборном и общинном - это миф .	коллективистском	8	Loc
В минувшем году в этой области наметились весьма значительные достижения .	минувшем	1	Loc
Нельзя не узнать его характерное лицо с выпяченной нижней губой .	характерное	4	Acc
" Применение максимально суровой кары позволит " бессильно злобствующему " в первый момент даже испытать исключительно сильное чувство исполненного долга .	суровой	3	Gen
" Она достаточно быстро уловила причинно-следственную связь между неприятными минутами растяжки и лихим забрасыванием ноги за ухо " , - смеется ее мама .	лихим	12	Ins
Был случай , когда в парикмахерской на проспекте Сталина , где иногда стригся , я почувствовал неладное .	неладное	16	Acc
Таким образом , " Альфа-Капитал " даст жителям регионов возможность вложения средств , которая " смогла бы потенциально обеспечить высокую доходность , в сочетании с приемлемым уровнем надежности " .	приемлемым	25	Ins
Поставляет компьютеры , офисную , презентационную , копировальную технику , оснащает офисы серверами , проводит сети и телекоммуникации .	презентационную	5	Acc
Только подвод световых потоков решен иначе : здесь должны заблистать ослепительные солнечные лучи , подводимые извне , с внешней оболочки корпуса , и от параболических зеркальных концентраторов , направляющих лучи на изумрудного цвета взвесь хлореллы в питательной среде .	питательной	36	Loc
