Чрезвычайная ситуация объявлена в пятницу администрацией Иркутска в связи с обильными снегопадами и шквалистым ветром .	шквалистым	13	Ins
Мы в силу зависимости от исторического пути не можем осуществить реформу так , как это было сделано в наиболее привлекательных для нас вариантах , известных из книг или иных источников .	привлекательных	19	Loc
Потому что в аттосекундном диапазоне почти все уже стоит , почти все уже неподвижно .	аттосекундном	3	Loc
Мое желание было учтено , и я уже в качестве лица , призванного на действительную военную службу , был приписан к этому военно - медицинскому подразделению .	медицинскому	24	Dat
Волновые потоки ( постоянные волны в земной атмосфере , аналогичные ряби на поверхности потока воды ) .	Волновые	0	Nom
- Весь некоммерческий сектор России был создан благодаря международным фондам .	некоммерческий	2	Nom
Вовлеченность научного сообщества в политический процесс давно носит асимметричный характер .	асимметричный	8	Acc
Кто станет вечным хозяином Алазанской долины или южнорусского уникального чернозема - крестьяне или дельцы теневой экономики вкупе с коррумпированными лицами из той самой административно-командной системы ?	южнорусского	7	Gen
Индонезия расположена на островах Зондского архипелага , а её острова связаны между собой только морским и воздушным сообщением .	Зондского	4	Gen
По странному совпадению он отмечался тогда же , когда праздновали и намного более популярный День милиции - 10 ноября .	странному	1	Dat
Особенность научно - просветительной деятельности по проблемам позднего средневековья ; Проблемы сохранения , реставрации и учета памятников позднего средневековья .	просветительной	3	Gen
Большевики в 1905 году очень точно поставили антивоенную тему в центр своей пропаганды .	антивоенную	7	Acc
На севере Волгоградской области располагается , пожалуй , самое загадочное место в нашей стране - Медведицкая гряда , тянущаяся вдоль реки Медведица цепь небольших холмов .	Волгоградской	2	Gen
В 1959 году запатентованные Нильсом Болином трехточечные ремни были впервые применены в виде штатного оборудования на автомобилях VOLVO P120 Amazon и VOLVO PV 544 только для шведского рынка .	трехточечные	6	Nom
Измерить в рублях качественную разницу между кожаным и обычным автомобильными салонами - задача непростая и часто субъективная , что и является главным аргументом противников гедонистических индексов .	гедонистических	24	Gen
Военные конструкторы и ученые многих армий мира уделяют огромное внимание и затрачивают огромные средства для создания все более сложных и дорогих систем высокоточного оружия для полного уничтожения цели и исключения потерь среди мирного населения .	мирного	32	Gen
Под нож пойдут зарплаты госслужащих , выплаты на рождение детей ( аналог российского материнского капитала ) , часть инвестиционных программ .	инвестиционных	18	Gen
После обряда посвящения его участники торжественно надевали собственноручно сделанные деревянные маски , под глазами которых вырезали слезы - знак пережитых ими болезненных испытаний .	деревянные	9	Acc
Например , материалы , из которых сделаны различные промышленные товары , которые мы потребляем во все большем количестве .	большем	16	Loc
Запирание и отпирание затвора производится путём поворота ствола вокруг своей оси , скользящего фигурным пазом по выступу поперечно расположенного в рамке пистолета штифта .	фигурным	13	Ins
Пожар , вспыхнувший на крыше торгового павильона в Восточном административном округе Москвы на Свободном проспекте , ликвидирован .	Свободном	13	Loc
" В результате мы можем прийти к дефляционному циклу " , - отмечает заместитель председателя совета директоров Government of Singapore Investment Corp . Тони Тэн .	дефляционному	7	Dat
Доктор Гринспун был первым врачом в США , прописавшим карбонат лития при биполярном аффективном расстройстве .	биполярном	12	Loc
Так что со временем все больше таких материалов , изготовляемых в космосе , переходит в разряд выгодных .	выгодных	16	Gen
Или точнее , человек , зажатый между национальной культурой , отрицающей перемены , и демонстрационным эффектом , требующим модернизации , оказывается в тяжелейшем положении .	демонстрационным	14	Ins
По телевизору тем временем кадры замерзающего Тбилиси сменяются гораздо более привычными картинками из Южной Осетии .	привычными	10	Ins
С предложением принять этот документ выступил председатель думского Международного комитета Дмитрий Рогозин .	думского	7	Gen
В случае изменившейся трактовки закона плательщик не виноват - он руководствовался исполнительными рекомендациями " , - успокаивает Константин Сасов , старший юрист юридической компании " Пепеляев , Гольцблат и партнеры " .	исполнительными	11	Ins
Однако не все бизнес - школы хотят возиться с бакалаврами - не хватает площадей , либо они просто не считают нужным заниматься " детьми " .	нужным	20	Ins
В 2012 году Мел Дэниелс вошёл в баскетбольный Зал славы , тем самым став одним из немногих игроков АБА удостоившихся этой чести ...	баскетбольный	7	Acc
Как сообщил , выступая по республиканскому телеканалу , министр внутренних дел Киргизии Темирбек Акматалиев , " нападавшие были хорошо организованы , а акция спланирована заранее " .	республиканскому	5	Dat
Силы правительства Хамида Карзая и американские войска при участии британцев и канадцев начали масштабное наступление на позиции противника в ночь на субботу .	масштабное	13	Acc
Сколько средств освободится при снижении налогов , куда они пойдут , как их будет использовать бизнес : вкладывать в инвестиции , направлять в уставный капитал либо капитализировать ?	уставный	23	Acc
Алюминий и титан содержатся в широко распространенных нефтелинах , апатитах , титанистых и иных глинах , титаносодержащих бедных железных рудах , залежи которых поистине неисчерпаемы .	титаносодержащих	16	Loc
А к вопросу о том , с кем приличному человеку пристало садиться за один стол , а кого приличному человеку надо сторониться , мы еще обязательно вернемся .	приличному	8	Dat
В Брауншвейге он начал с организации в 1952-м процесса против Отто Эрнста Ремера , руководившего подавлением путча против Гитлера 20 июля 1944 года .	1952-м	7	Loc
Непонимание профсоюзов , как противостоять бесконтрольному росту рабочей недели , отличает и такую страну , как Япония , где понятие " ненормированный рабочий день " прочно закрепилось в корпоративной культуре .	бесконтрольному	5	Dat
На данный момент витализм слился с эзотерическими восточными учениями и выражается в представлениях об ауре и биополе , существования которых наука не признает , поскольку объективными методами подобные явления не регистрируются .	эзотерическими	6	Ins
А если учесть , что возраст многих вагонов приближается к 40 годам , то 15 рублей за часовую поездку в крутом олдтаймере - это почти подарок .	часовую	17	Acc
Группы авторов додзинси в манге обычно называются английским термином circle ( кружок ) .	английским	7	Ins
" При наличии каких-либо патологий в теле человека наблюдается температурная асимметрия больных участков по отношению к здоровым .	здоровым	16	Dat
То есть , как и пантограф , бугель не нуждается в устройстве стрелок на контактном проводе и не подвержен риску схода с контактного провода .	подвержен	18	Nom
Она вмещала и высокие идеи Права , и идеал беспристрастного , независимого суда , и вполне трезвый расчет .	трезвый	16	Acc
Дело в том , что даже при самых щадящих настройках тренажер не просто вибрирует , а РЕАЛЬНО вибрирует , превращая тренирующегося в живое подобие отбойного молотка .	отбойного	24	Gen
В частности , Яли указывал на неидентичность мариупольских греческих диалектов и новогреческого языка и на то , что димотика может использоваться в учебном процессе только с некоторыми коррективами .	новогреческого	11	Gen
И вот Хоу приснился ночной кошмар : его захватили в плен людоеды , угрожая убить , если он немедленно не создаст швейную машинку !	швейную	21	Acc
Они давали начало ручьям , которые пополняли небольшую речку , русло которой служило границей между крестьянскими землями и помещичьей землей на другой ее стороне .	крестьянскими	15	Ins
Каждый из этих периодов характеризуется вполне определенными процессами , происходящими в организме : вначале расцветом , а потом угасанием функций , нейроэндокринной перестройкой , появлением возрастных заболеваний .	нейроэндокринной	21	Ins
Бренды , целенаправленно создаваемые как кратковременные - на один сезон или на два - три , призваны резко выделять товар из рутинной череды стабильных брендов и быстро мобилизовывать целевые группы трендоидов .	стабильных	23	Gen
Как рассказывают в сервисном центре Electrolux , многие хозяева отказываются брать вместо неисправного пылесоса новый , терпеливо ожидая починки именно своего домашнего робота .	сервисном	3	Loc
Первые два вопроса взаимосвязаны постольку , поскольку договариваться нужно с радикально недовольными , и договоренность может предусматривать ту или иную форму вовлечения .	недовольными	11	Ins
Заметенные снегом , они двинулись , смутно различимые сквозь поземку .	различимые	7	Nom
Не надо стесняться ( бояться ) говорить , что у ТОЙ или ИНОЙ партии хорошо проработана _ или предложено правильное решение ТАКОЙ-ТО проблемы , и что мы в данном вопросе солидаризируемся с кем-то и с чем-то .	ТАКОЙ-ТО	21	Gen
Как сказал мне директор школы деревни Жанаталап ( Беляевский район ) Марсель Дияров : " В школу входит интернет , интерактивные доски и многое другое , но никто не занят изучением , куда это все идет " .	Беляевский	8	Nom
И весь контроль , все управление дублируется с " Земли " - из главного зала управления , расположенного на втором этаже НЭКа в комнате за застекленным торцевым балконом .	торцевым	26	Ins
Мне думается , что отделения Национальной ассамблеи в регионах , может , не по названию , но по сути , должны стать чем-то вроде Комитетов по ненасильственному гражданскому сопротивлению .	ненасильственному	26	Dat
Лучшим результатом Морасси в итоговом общем зачёте Кубка мира является 38 - е место в сезоне 2006-2007 .	Лучшим	0	Ins
Польская оппозиционная элита к 80-м годам была зрелой не только интеллектуально , но и политически .	Польская	0	Nom
Горячая масса металла пытается протолкнуть в узкое отверстие , по сути , холодную или мало нагретую пробку .	узкое	6	Acc
После войны коммунист возглавил в ГДР обком и национализировал имение графа , но , продолжая лагерные споры , они вели дружескую переписку , пока в 60-х партия не запретила коммунисту эти вредные рефлексии .	лагерные	15	Acc
С тех времен кое-где даже остались слаженные на скорую руку камины , они , может быть , не сильно греют , но шашлык в них получается без всякой мариновки .	скорую	8	Acc
Впрочем , для начала академик Скулачев изучил апоптоз на внутриклеточном уровне .	внутриклеточном	9	Loc
В этом году удалось , наконец , получить точную и подробную картину основной цели гормона адреналина , а именно - бета - 2 адренорецептора .	точную	8	Acc
Создавались уникальные установки и приборы , позволявшие исследовать и многотонные изделия , и микроскопические образцы .	микроскопические	13	Acc
По моему мнению , по мнению всех участников конференции с восточноевропейской стороны , не является .	восточноевропейской	10	Gen
Темп -- посёлок в Крыловском районе Краснодарского края .	Крыловском	4	Loc
О Резервном фонде .	Резервном	1	Loc
Этот сигнал он посылает согражданам , и это тоже соблазнительно счесть банальным способом найти виноватого для вымещения на нем социальной злобы .	банальным	11	Ins
Костная структура головки бедренной кости .	Костная	0	Nom
Так , например , для анализа сложности алгоритмов шифрования и дешифровки используется недоказанная гипотеза Римана .	недоказанная	12	Nom
Возбудитель способен длительно сохранять вирулентные свойства при низких температурах , но нестоек к высоким температурам ( при кипячении погибает через 41700 мин ) , дезинфицирующим средствам и ультрафиолетовому излучению .	ультрафиолетовому	27	Dat
У слепоглухонемых феноменальная усидчивость и сосредоточенность , очень хорошая память .	феноменальная	2	Nom
Всегда будь готов к самым крутым реанимационным мерам .	крутым	5	Dat
Эллиотт предлагает также и методы для анализа звуковых сообщений .	звуковых	7	Gen
Родился в 1883 году в Бердянске в многодетной семье ( 14 детей ) бердянского купца Осипа Фирсова .	1883	2	Loc
В мае 1986 года во время проведения отраслевого совещания работников авиапромышленности по указанию Пугина продажа спиртных напитков была организована в санатории - профилактории объединения " Салют " .	спиртных	15	Gen
Стремление не упустить конкурентные преимущества ?	конкурентные	3	Acc
Уральская епархия объединяет общины и религиозные группы древлеправославных христиан , проживающих в Пермской , Свердловской , Оренбургской областях , а также в Башкирии и Западном Казахстане .	Уральская	0	Nom
Компьютерное моделирование стало неотъемлемой частью подготовки изделий - от сложных деталей и аппаратов до предметов обихода .	неотъемлемой	3	Ins
В материальном мире не существует ни одного предмета , понятия или явления , которое было бы им описано .	материальном	1	Loc
В воздухе летает очень много предложений по изменению налоговой системы .	налоговой	8	Gen
Молодой , энергичный , красивый - в такого сразу влюбится треть всех наших женщин .	Молодой	0	Nom
Но именно поэтому оказалось востребованным чувство правоты , с которым как защитники , так и противники " Пусси " боролись друг с другом .	востребованным	4	Ins
Например , в ясную теплую погоду человек чувствует прилив сил , подъем настроения .	теплую	4	Acc
Каждое утро из железного дыма вставало кровавое солнце и , поднимаясь по бледному небу , становясь розовым , вещало мороз .	розовым	16	Ins
Общим мотивом была заинтересованность в исчезновении документов , из которых без труда могли быть выведены реституционные требования .	реституционные	15	Nom
Бомбоубежище было не в нашем доме , а в соседнем , через двор , мне все казалось , что мы занимаем в нем чье-то чужое место .	чье-то	23	Acc
Характерны деревянные токарные изделия с росписью `` под фон &#39;&#39; с золочёным , виртуозным по рисунку узором ( причудливые садовые цветы ) на красном или чёрном фоне .	Характерны	0	Nom
Флоринский был русским патриотом , участвовал в патриотическом и монархическом движении на Украине .	патриотическом	7	Loc
И совместно , общими дружескими усилиями повлиять на своенравного Асада .	дружескими	4	Ins
Другие известные в настоящее время места произрастания осмунды , расположенные ближе всего к Припятскому Полесью , находятся в Польше - в 200 - 500 км на юго-запад от него .	Припятскому	13	Dat
