Прихожу к бабушке , старенькой совсем , седенькой .	старенькой	4	Dat
В декларации говорится , что САДК уверено , что так называемый план " быстрого переселения " направлен на рациональное и справедливое перераспределение земли на благо граждан Зимбабве .	справедливое	20	Acc
Жара не спала ; воздух дрожит от бесконечных вееров ; здесь вперемешку все - зрелые мужчины , юные женщины , крохотные дети и старики в инвалидных колясках .	инвалидных	25	Loc
В октябре 1919 года на подступах к Волновахе шли упорные бои частей ВСЮР и отрядов Революционной повстанческой армии Украины ( махновцев ) .	повстанческой	16	Gen
Среди важнейших - вовлечение в мировое капиталистическое хозяйство , которое после краха социализма стало глобальным , более миллиарда работников с пока качественно более низкими потребностями и ожиданиями из Китая , Индии , других стран Южной и Восточной Азии .	глобальным	14	Ins
Шахматные темы также достаточно распространены в изобразительном искусстве .	изобразительном	6	Loc
Горгонейон можно встретить как в архитектуре этой эпохи , так и в отделке мебели и холодного оружия , например , на эфесах шпаг .	холодного	15	Gen
По информации продюсерской компании " Стиллкинг Филмс " , съемки начнутся в столице Чехии в конце 2003 года .	продюсерской	2	Gen
Придумал себе романтическое жизнеописание …	романтическое	2	Acc
Уместно вспомнить слова В. И. Ленина о том , что законодательствовать нужно с тройной оглядкой и семь раз примерить , прежде чем принять новое законодательное решение .	законодательное	24	Acc
Модели современных вертолетов по своей сложности не уступают полноразмерным родственникам , а часто и превосходят их .	полноразмерным	8	Dat
А через несколько минут навстречу самолету летят ленты немецких трассирующих пуль .	трассирующих	9	Gen
Мировой кризис сказался и на инфляции .	Мировой	0	Nom
Кому же нужен инспектор ( а кстати , и соответствующий министр тоже ) , который сквозь пальцы пропускает налоговые утечки в миллиарды долларов ? !	налоговые	18	Acc
В белых костюмах и белых шапочках с зелеными целлулоидными козырьками , они играли в теннис , громко и отрывисто выкрикивая : " Плэй ! " .	зелеными	7	Ins
Ответы на эти вопросы интуитивно появлялись вследствие сбора , казалось бы , незначительной информации .	незначительной	12	Gen
Впрочем , амнистия на боевиков как на людей , совершивших тяжкие и особо тяжкие преступления , все равно не распространится .	тяжкие	13	Acc
Один раз была обнаружена углублённая в землю и под большие камни глинобитная печь .	глинобитная	11	Nom
Ученые обнаружили , что ночная сторона Венеры светится в инфракрасном диапазоне .	инфракрасном	9	Loc
Многие из них неприемлемы , поскольку специалистам давно известен результат их реализации ( например , управление в " ручном режиме " , " властная вертикаль " и т. д ) .	ручном	18	Loc
Любопытно , что спустя почти 80 лет российская экономика подошла примерно к тому же рубежу - доля розничных сетей в товарообороте на общероссийском уровне недавно преодолела 20%-ный рубеж .	общероссийском	22	Loc
Не найдя в 90-е годы собственного пути к системной модернизации , Петербург принял правила модернизации общероссийской - модернизации с ее подчинением бизнеса властям ; _ тех и других - мировой нефтяной игре .	нефтяной	30	Dat
И если в экономический блок Саакашвили командирует тех , без кого ему просто не обойтись , то силовые позиции он доверяет исключительно близким друзьям .	силовые	17	Acc
Ввиду наличия обязательств Батория перед Турцией и султаном , в условиях недовольства последнего частыми походами казаков на Молдавию , он грозил Баторию собственноручно выступить против казаков , если с ними не сможет справиться Баторий .	частыми	13	Ins
Пишут , что , падая , он подал масонский знак помощи .	масонский	8	Acc
Лунный стержень служит катализатором , который придает солнечному стержню большую активность " .	солнечному	7	Dat
Так что гламур правильнее считать не стилем , эстетикой или идеологией , но универсальной логикой сверхновой экономики .	универсальной	13	Ins
Да это очень ситуативный вопрос .	ситуативный	3	Nom
Похоже , что стремление властей забрать чужое имущество часто было важнее разбирательства дела как такового и вынесения наказания непосредственному виновнику .	такового	14	Gen
С этого момента гражданин совершает любые юридические действия по собственному разумению , не сообразуя их с мнением опекунов .	юридические	6	Acc
Среди сторонников реставрации коммунистов преобладали как раз те , кто сам не хотел ничего делать - по разным , в том числе и уважительным причинам .	уважительным	23	Dat
Создание единого учебника как инструмента объединения нации упирается в необходимость уже иметь такую единую нацию для создания учебника .	единую	13	Acc
Прогнозировать изменение или ухудшение трактовок закона правовым подразделениям компаний почти невозможно .	правовым	6	Dat
В 1471 году богатый португальский купец Фернан Гомиш отправил к югу вдоль западного побережья Африки экспедицию , командовали которой Жуан де Сантарен и Перу Эшкобар .	1471	1	Loc
Саудовский наследный принц Абдалла призвал в воскресенье израильтян к отказу от политики премьер-министра Ариэля Шарона , сравнив его с римским императором Нероном .	наследный	1	Nom
Вышестоящие инстанции пресекли беззаконие еще в середине прошлого года коллегия по уголовным делам Верховного суда РСФСР и Прокуратура РСФСР отменили все обвинительные решения Башкирии по Богданову и прекратили уголовное дело за отсутствием состава преступления .	Вышестоящие	0	Nom
Демократическим реформам ?	Демократическим	0	Dat
Не следует забывать и о повышенном расходе топлива в случае избыточной загрузки машины .	избыточной	10	Gen
На некоторых старинных японских мечах линия закалки имеет настолько сложный рисунок , что даже современные эксперты не понимают , каким образом мастер смог ее создать .	японских	3	Loc
В 1930-х годах теория термоядерного синтеза предложила новый источник энергии звезд , а радиоизотопный метод в 1940-х определил возраст Земли в более чем 3 миллиарда лет .	термоядерного	4	Gen
Сегодняшние критики " бериевского либерализма " образца 1953 года говорят , что при первых неудачах он возобновил бы террор .	Сегодняшние	0	Nom
Но и новые ручьи влились в этот поток , грозящий стать сокрушительным , недавно - это результат попыток силовыми приемами решить сложные , многослойные проблемы .	силовыми	18	Ins
Близкая к нулю температура воды им не страшна .	Близкая	0	Nom
" Оловянная чума " погубила многие ценнейшие коллекции солдатиков .	Оловянная	1	Nom
Перед отливкой оловянного солдатика гипсовая форма обязательно должна несколько дней сохнуть , чтобы в ней не осталось и следа влаги .	гипсовая	4	Nom
Между разными оппозиционными силами не обязательно должно существовать развернутое соглашение о совместной платформе .	оппозиционными	2	Ins
В этих условиях надежды на доброго царя , на умеренного или неумеренного прогрессиста , равно как и надежды на противоречия в элитарной среде , малообоснованны .	элитарной	21	Loc
Она резко упростила описание электромагнитных явлений и дала целую серию новых предсказаний , самое известное из которых - лежащая в основе ядерной энергетики эквивалентность массы и энергии E = mc2 .	электромагнитных	4	Gen
Его мысль в том , что любая созданная человеком знаковая система , язык это или нет _ окажется посередине между абсолютно случайной последовательностью символов и последовательностью строго определенной .	случайной	21	Ins
26 июля 811 года болгары атаковали центр византийской армии , где был императорский отряд .	императорский	12	Nom
В субботу в одной из самых зрелищных гонок Олимпиады полька Юстина Ковальчик стала олимпийской чемпионкой на дистанции 30 км классическим стилем , опередив в финишном створе трехкратную победительницу этих Игр норвежку Марит Бьорген .	классическим	19	Ins
Желтая , грязная моча необъятным потоком ( точно мочилась лошадь ) текла мимо Крэка , не достигая его .	грязная	2	Nom
👑 2 место - новенький IPHONE 7 + фирменный чехол от Палаты ;)	новенький	4	Nom
Кроме того , полупроводники с шириной запрещённой зоны меньше более легко образуют омические контакты , потому что их сродство к электрону ( и , следовательно , высота барьера ) , как правило , ниже .	омические	12	Acc
Поэтому брендинг оформился в особую сферу профессиональной деятельности и стал технологией создания виртуальной стоимости , которая может значительно превышать стоимость реальных затрат на производство продукта .	виртуальной	12	Gen
Некоторые являются адекватными , а иногда даже полезными .	полезными	7	Ins
Первый заместитель министра финансов госпожа Голикова пишет в Академию наук : " Министерство финансов Российской Федерации просит Российскую академию наук в сроки , установленные протоколом , сообщить о выполнении следующих поручений .	Российскую	17	Acc
► Артикуляционное упражнение с игрушечным ёжиком	игрушечным	4	Ins
Не менее дальновидным было бы подготовиться к расходам на пособия по безработице и на центры переобучения .	дальновидным	2	Ins
Все более образованные индийцы или китайцы составляют реальную конкуренцию программистам , инженерам , даже врачам .	реальную	7	Acc
Бен Ладен может иметь биологическое оружие .	биологическое	4	Acc
Подобным по механизму случаем в Северном полушарии было похолодание 6200 лет до н. э ...	Подобным	0	Ins
Кстати , вначале герои были более брутальные , более жесткие .	брутальные	6	Nom
Основание : мировые судьи решают споры исковой стоимостью до 100 тысяч рублей ( сейчас до 50 ) .	исковой	6	Ins
Имея главной задачей президентской власти - решать нерешаемые проблемы - попытаться создать условия постепенного перехода от демократии ( власти народа ) , а фактически - власти бюрократии , к ноократии - власти науки , мысли , интеллекта .	нерешаемые	7	Acc
Данциг ( Гданьск ) с польским меньшинством и Мемельская ( Клайпедская ) область с литовским большинством передавались под управление союзнической комиссии .	Клайпедская	10	Nom
Третьим мощнейшим инфляционным фактором будет снижение налогов .	мощнейшим	1	Ins
Кроме того , британский премьер хочет стать посредником между США и Евросоюзом , позиции которых по ближневосточному конфликту существенно разошлись с обострением ситуации в регионе .	ближневосточному	16	Dat
Если неспособны , то их надо просто разгонять , а не наделять новыми властными полномочиями !	властными	13	Ins
Читателя , привыкшего к благонамеренной мемуаристике , в которой отдают должное родителям и учителям , дневники удивят .	благонамеренной	4	Dat
- Обучение там , разумеется , контрактное , без бюджетных мест .	контрактное	6	Nom
В самом начале 2009 года в издательстве `` Волтерс Клувер &#39;&#39; вышла на русском языке книга известного французского учёного Раймона Леже , посвящённая великим правовым системам современности , где детально рассмотрен вопрос современной правовой карты мира .	правовым	24	Dat
`` Главный промысел и упражнение яицких казаков состоит в рыбной ловле , которая нигде в России столь хорошо не распоряжена и законами не ограничена , как в здешнем месте &#39;&#39; , -- писал в XVIII веке академик Паллас .	рыбной	9	Loc
Вермеера часто называют Дельфтским Сфинксом - отчасти из-за отсутствия развернутых биографических сведений , отчасти из-за крайне малого количества работ , каждая из которых , по уровню мастерства исполнения и силе эмоционального воздействия , ставит его в ряд величайших художников .	развернутых	9	Gen
Самодовольное и самоуверенное общество , привыкшее к халяве , получив экономический нокдаун , впадает в ярость , ищет виноватых .	Самодовольное	0	Nom
Для удобства лепки ноги можно прибить к деревянному брусочку .	деревянному	7	Dat
Одним из активных участников форума стало Европейское космическое агентство ( ЕКА ) , которое также было представлено на предшествовавшей форуму Международной конференции " Роль науки в информационном обществе " .	информационном	26	Loc
Буквально через пару дней после его визита Боталов узнал , что несколькими днями ранее из Челябинского краеведческого музея были украдены башкирские нагрудники , сделанные из серебряных монет .	Челябинского	15	Gen
Другим производителям приходится изворачиваться , заново изобретая циклонную систему , и далеко не всегда удается достичь наилучшего результата .	циклонную	7	Acc
Растения и бактерии тоже обладают способностью к активному , более того , упорядоченному перемещению под действием внешних факторов ( таксису ) .	упорядоченному	12	Dat
В ноябре японские войска перерезали Китайско - Восточную железную дорогу ( КВЖД ) , вызвав тем самым обмен жесткими нотами между СССР и Японией , а в январе 1932 года японский флот подверг бомбардировке Шанхай .	жесткими	18	Ins
Минувшей осенью работам мешали то выходившие грунтовые воды , то непонятное свечение из-под земли , исчезавшее при приближении к раскопу .	Минувшей	0	Ins
Позже хранители информации оказались загадочными волнами , получившими название солитонов .	загадочными	4	Ins
Тяжелые условия существования , лишения , а также неправильный образ жизни способствуют ускоренному старению и увеличивают биологический возраст .	ускоренному	12	Dat
Норем исследует так называемый защитный пессимизм - стратегию поведения , когда человек стремится мысленно проиграть предстоящую ситуацию , учитывая мелкие препятствия , с которыми он может столкнуться .	предстоящую	15	Acc
Однако возможна и необходима переработка сырья на месте с последующей продажей готовой продукции в Китай , Японию , страны Юго-Восточной Азии - это и будет настоящей " новой индустриализацией Сибири " .	готовой	11	Gen
После войны окончил Военную артиллерийскую академию им. Ф. Э. Дзержинского и проходил службу в Туркестанском военном округе в должностях офицера штаба округа , начальника штаба артиллерии армейского корпуса , командира полка и начальника артиллерии дивизии .	Туркестанском	14	Loc
Для продавливания придуманного им нанотехнологического проекта Дрекслер сослался на высказывание нобелевского лауреата по физике , незыблемый авторитет в глазах сенаторов .	незыблемый	15	Acc
Желтый с зеленым означают , что мы его немножко нагнали и следует снизить скорость до 60 км / ч .	Желтый	0	Nom
В городе работает гимназия с преподаванием на литовском языке , гимназия с преподаванием на польском и русском языках .	литовском	7	Loc
В церемониал поклона входил и обычай обнажать голову , тоже восходящий к первобытным верованиям ( времен Ветхого Завета -- `` Самсон и Далила &#39;&#39; ) .	первобытным	12	Dat
Один из двух самых титулованных игроков Джон Лоу в 1984 году получил самый большой приз в истории дартс , 102000 фунтов , за то , что завершил лег всего за девять ходов .	титулованных	4	Gen
