Isto je istraživanje ukazalo što još odbija na spoju : loš ten ( 34 posto ) , previše make-upa ( 30 posto ) , zapušteni nokti ( 29 posto ) i izražena dlakavost ( 28 posto ) .	ukazalo	3	Neut
Svake godine u ovo doba godine sjećamo se velikog čovjeka koji nas je prerano napustio , a ja sam uvjeren da ćemo i dogodine evocirati uspomenu na Zlatka na ovaj način .	napustio	14	Masc
Ramkovski je djelovao preko svojih 15 tvrtki -- koje posluju i u Turskoj i Sjedinjenim Američkim Državama -- čije je sjedište naveo na adresi A1 TV .	djelovao	2	Masc
Stekle su mnoge prijatelje i bave se u slobodno vrijeme mnogobrojnim aktivnostima .	Stekle	0	Fem
Televizija A1 i četiri novine zatvoreni su zato što nisu plaćali porez i ispunjavali obveze prema vjerovnicima .	ispunjavali	13	Masc
Preseljenjem u nove prostorije otvoreno je novo poglavlje u radu Područnog ureda Rijeka i Županijskog centra 112 , koji je dosad zbog svoje dislociranosti djelovao u skučenim i neprimjerenim uvjetima .	djelovao	24	Masc
U muzeju se ionako nismo više usudili pitati apsolutno ništa o Formuli .	usudili	6	Masc
Ne znate što biste napisali zgodnom tipu ?	napisali	4	Masc
Dominikanska gimnazija u Bolu odgojila je brojne hrvatske intelektualce .	odgojila	4	Fem
Don Nikola Bošnjak , rodio se u Biogracima 1909. god. , župa Ljuti Dolac .	rodio	4	Masc
Na pitanje jesu li Crnogorci danas slobodniji , gorko se nasmijao i citirao staru izreku .	citirao	12	Masc
Turska je doživjela novo razočaranje nakon što je dizač utega Tanir Sagir u srijedu ispao iz natjecanja u kategoriji do 77 kg , ne uspjevši iz tri pokušaja trzaja podići 165 kg .	ispao	14	Masc
Oni ističu da je Grčka ustuknula pod pritiskom Izraela .	ustuknula	5	Fem
Nismo ga niti prali baš često .	prali	3	Masc
Ako je stranka iznevjerila njegova stajališta , logično je da je napusti .	iznevjerila	3	Fem
Broj je znatno manji u odnosu na proteklu godinu kada se u ovo vrijeme već odvijao vrhunac epidemije .	odvijao	15	Masc
Gledala me radoznalo .	radoznalo	2	Neut
Na primjer , činjenica da Philip nikad nije jeo šećernu vunu , ili bio na karnevalu , pripisuje se njegovoj religiji , iako Jehovini svjedoci nikad nisu osudili navedene aktivnosti .	osudili	27	Masc
Na koji je način ugrožena sloboda medija ? " , rekla je Velinovska za SETimes .	rekla	10	Fem
Konzumov honorar Ergencu dovoljan je i za pokretanje 110 tvrtki ( d.o.o.-a ) , ali i za pokrivanje gubitka Mediteranske plovidbe koji je zabilježila u prvih devet mjeseci ove godine ( 1,72 milijuna kuna ) .	zabilježila	23	Fem
Tužitelji su izveli 25 svjedoka koji su rekli da je Ramkovski izbjegavao platiti 4,5 milijuna eura poreza , te da je prisvojio 17,5 milijuna eura kroz prijevare -- kao što je izdavanje računa s lažnim sadržajem .	prisvojio	21	Masc
Elfs , koji čine dizajneri Ivan Tandarić i Aleksandar Šekuljica , prikazali su kolekciju nadahnutu američkom sapunicom " Dinastija " iz 1980-ih .	prikazali	11	Masc
Upravo u ovom potonjem Windowsi 7 su prilično napredovali u odnosu na Vistu ( a posebno ako se usporede s Windowsima XP ) i slobodno možemo reći da rad s radnom površinom u sedmici predstavlja pravo osvježenje .	napredovali	8	Masc
Radio je ispočetka kao kovač kod krsnog kuma - koga je , također , bio pokrao - a ljeta 1874. napisao je roman Die Rose von Ernstthal , što je bio objavljen već u studenome .	napisao	20	Masc
Nastao je kad se Babić razišao s Globalnetom .	Nastao	0	Masc
Preciznost i sigurnost bili su glavni ciljevi operacije , koja je trajala 90 minuta .	trajala	11	Fem
Cijenu je nazvala " razumnom " kada se usporedi s kapitalizacijom , jer je zapravo veća .	nazvala	2	Fem
" Sporazum je uslijedio nakon što smo se s geopolitičkog prebacili na tržišni pristup " , kazao je Tserovski .	uslijedio	3	Masc
Mjesto danas izgleda vrlo otužno , zapušteno , a kiša je samo dodala na dojmu .	dodala	12	Fem
Kosovo je u srijedu ( 9. prosinca ) zadobilo potporu Francuske , Jordana i Norveške , dan nakon što su to učinile i Sjedinjene Američke Države .	učinile	21	Fem
Tamo je uhićen i optužen da je ukrao isti džepni sat , lulu i cigaršpic svoga sustanara .	ukrao	7	Masc
Svi su tako vjerovali u Fernandovu pobjedu , čak sam se malo i bojala svih tih silnih gužvi u muzeju , ali u dva sata utrke u Abu Dhabiju sve nam se okrenulo .	bojala	13	Fem
Neki su mediji , uključujući i dnevne novine Danas , osudile ovaj događaj i ocijenile ga kao " cirkus " , dok su drugi , poput Kurira , izvijestili kako su cipele bile talijanske i koštale oko 100 eura .	ocijenile	14	Fem
U organizaciji ove manifestacije kao tehnički suorganizator programa pridružila nam se hotelska kuća Valamar Riviera , a domaćinstvo tijekom polufinalnog i finalnog natjecanja pružio nam je Valamar Diamant Hotel Residence .	pridružila	8	Fem
Djelatnici Zemljišno-knjižnog odjela godinama su bili pod stalnim pritiskom golemog broja neriješenih predmeta i stalnih dolazaka stranaka koje su s pravom gubile strpljenje .	gubile	21	Fem
Točno na granici od magičnih sto metara , ni desetak metara podno Kamenitih vrata dočekalo ih je petnaestak namrgođenih specijalaca , prepriječivši im put do Markova trga .	dočekalo	14	Neut
Poznati makedonski redatelj Milčo Mančevski započeo je rad na svojem trećem igranom filmu " Kosti " .	započeo	5	Masc
Određeni članovi tih ekstremističkih skupina čak su se kanili infiltrirati među sudionike parade , što bi im omogućilo da kasnije izravno napadnu sudionike .	kanili	8	Masc
I ministar gospodarstva , rada i poduzetništva Đuro Popijač požalio se na suprostavljanje projektima za koje ulagači pokazuju interes .	požalio	9	Masc
Ovaj mi je puta iznimno drago što se EK umiješala i spriječila novi krug politizacije .	umiješala	9	Fem
Išao sam u vrlo kvalitetnu i strogu IV. gimnaziju , u kojoj su predavali odlični profesori .	predavali	13	Masc
Možda se povučete , izbjegavate bilo kakvu interakciju dok se ne ohladite , a onda nastavite gdje ste stali kao da se ništa nije dogodilo .	stali	18	Masc
Bivši predsjednik parlamenta Skender Gjinushi i potpredsjednik Makbule Ceco također su podigli tužbe protiv ovog lista .	podigli	11	Masc
Prve su noći bacane boce na bosanski band Dubioza kolektiv nakon što su svirali " Ne mogu oprostiti " , pjesmu o masakru u Srebrenici .	svirali	13	Masc
Baš zbog greške EU s Rumunjskom i Bugarskom , mi smo upali u te stroge kriterije .	upali	11	Masc
Još mi je draže što je ona našla zajednički jezik za ljude različitih shvaćanja .	našla	7	Fem
Snježna oluja Q zahvatila je 20-ak saveznih država u SAD-u i otežala živote više od 60 milijuna stanovnika , paralizirajući u potpunosti promet na pojedinim područjima , javlja CNN .	zahvatila	3	Fem
Tijekom devedesetih oko 25 posto stanovništva napustilo je Albaniju .	napustilo	6	Neut
To ne bi bilo moguće da u pomoć nije priskočila Županija .	priskočila	9	Fem
Povod takvom stanju bio je bivši suprug , izraziti agresivac koji je prijetio njoj i djetetu .	prijetio	12	Masc
U pozdravnom govoru , Gul je istaknuo kako su i Turska i Saudijska Arabija pretrpjele terorističke napade , te bi se sukobi trebali rješavati dijalogom .	pretrpjele	14	Fem
Procjenjuje se kako se cijene nafte u svijetu neće mijenjati onoliko koliko su se mijenjale u 2005. godini , čime će biti riješen drugi inflatorni čimbenik .	mijenjale	14	Fem
Posebno ga je izbacila iz takta Jenniferina navodna izjava da je već krenula u potragu za novim muškarcem za svoju Courteney .	izbacila	3	Fem
U međuvremenu , Turska je naznačila kako ne planira ukinuti svoj embargo .	naznačila	5	Fem
Ove godine je na godišnjicu 25. lipnja bio još jedan razlog za slavlje : ta je zemlja zatvorila posljednja poglavlja u procesu pregovora sa EU .	zatvorila	17	Fem
Da se vlada sada nije pozabavila pitanjem imovine manjina , kaže Aktar , izložila bi se mogućnosti isplate znatnih naknada u slučajevima koji se iznose pred ECHR .	pozabavila	5	Fem
Trebao bi spriječiti mogućnost političkog kaosa " .	Trebao	0	Masc
Htio bih okupiti grupu entuzijasta u Rijeci koji bi se bavili proučavanjem psihičkih sposobnosti i njihove primjene na svijet oko nas .	Htio	0	Masc
Google , Facebook i eBay već su odgovorili kako će se boriti protiv ovih optužbi , dok ostale tvrtke još nisu komentirale tužbu .	odgovorili	7	Masc
Morina , koji je bio politički savjetnik zamjenika ministra kulture i honorarni urednik kosovskog dnevnika Bota Sot , poznavao je Svjedoka 2 i imao " dva podulja sastanka s njim " .	imao	23	Masc
Žene su tada vodile preko 24.000 tvrtki , koje su zapošljavale 127.000 ljudi .	vodile	3	Fem
U ponedjeljak ( 7. travnja ) , vlada je priopćila kako je ovog tjedan početi razgovore u cilju rješavanja postojećeg spora oko naziva s Grčkom , koji je Makedoniju koštao pozivnice u NATO .	koštao	29	Masc
Suci su ukazali kako se Morina ispričao Svjedoku 2 koji nije popustio pod pritiskom i na kraju svjedočio protiv Haradinaja i dvojice ostalih zapovjednika Oslobodilačke vojske Kosova ( OVK ) .	popustio	11	Masc
Znanstvena djelatnica i ekonomistica , ona se pridružila Svjetskoj banci 1993. godine , gdje je u početku radila na pitanjima životnog okoliša , a kasnije na socijalnim pitanjima .	pridružila	7	Fem
" Može li mi bilo tko navesti neki otok koji koristi pogon za pročišćavanje otpadnih voda ? " , citirale su novine pitanje Sekipa Yalcina , 48-godišnjeg ribara .	citirale	19	Fem
Finski ministar vanjskih poslova Alexander Stubb , ovogodišnji predsjedatelj OESS-a , izjavio je kako je predložio upućivanje još 100 promatrača .	predložio	15	Masc
" Treba biti svjestan kako se u vrijeme snimanja filma Jugoslavija nalazila iza " željezne zavjese " kao zemlja istočnog bloka .	nalazila	11	Fem
I mislit ću , da je ova naša trudnoća bila prava trudnoća , da je i nama sve išlo dobro , da bi i naša bebica bila tolika ...	išlo	18	Neut
Rumunjski grad Sibiu , zajedno s Luxembourgom , bit će Europski glavni grad kulture u 2007. godini na temelju odluke koju je Vijeće EU donijelo ranije ove godine .	donijelo	24	Neut
" Ne želimo se miješati u bilo kakve unutarnje probleme , ali smo vrlo zainteresirani za pronalaženje prijateljskih rješenja " , rekao je Prodi , dok je Sanader stajao pored njega .	stajao	28	Masc
Bez obzira što su u igri bile nesvakidašnje , kockaste boće igralo se za pečenog odojka i piće .	igralo	11	Neut
U međuvremenu , Vlada Srbije u četvrtak je usvojila izvješće u kojem se nadležne agencije kritiziraju zbog velikih sigurnosnih propusta u trenutku atentata na Đinđića .	usvojila	8	Fem
To je dovoljno da bi se dobila osnovna informacija o nečijem identitetu .	dobila	6	Fem
Nešto bolje stanje je u telekomunikacijama i bankarskim institucijama , a najsnažniji segment s 394 milijuna dolara vrijednosti u prošloj godini predstavljale su usluge .	predstavljale	21	Fem
I više od toga , mnogi su progovorili književnom varijantom materinjeg ( hrvatskog ) jezika zahvaljujući među ostalim stvarima , kvalificiranim u nevrijedno štivo , njegovoj jednoj jedinoj knjizi , komplimentirao je Šoljan .	komplimentirao	30	Masc
HDZ je , primjerice , koristio plakate podijeljene na crveno ( što predstavlja SDP ) i plavo ( HDZ ) .	koristio	5	Masc
Najavljivalo se kako će se to dogoditi 2005. no papa je umro , a proces je zastao .	Najavljivalo	0	Neut
Upucavši svoju srednju kćer u Milanovu upravu Berlusconi je i na toj razini pokazao da računa na opstanak dinastije .	pokazao	13	Masc
Prije deset godina bilo je 11 posto žena rukovoditelja u susjednoj Hrvatskoj , a 2007. godine , koja je predstavljala najveći uspjeh za žene gledano po postotku , između 25 i 30 posto .	predstavljala	19	Fem
Svuda je zavladala zbrka , kašnjenje , ima i laži .	zavladala	2	Fem
Basescu je podigao tužbu protiv novina koje su prve objavile fotografije navodnog incidenta , kao i Dina Patricia , poslovnog čovjeka koji je ustvrdio kako je svjedočio događaju .	ustvrdio	23	Masc
Njihova sestrinska firma Brandoctor osmislila je brand strategiju i ambalažu za američki proizvod " Bold for Man " , koji je uvršten u poklon pakete za uzvanike na zabavi uoči Oscara .	osmislila	4	Fem
Oko 55.000 obožavatelja iz Crne Gore , Albanije , Bosne i Hercegovine i Italije nazočilo je u ponedjeljak ( 9. srpanj ) koncertu Rolling Stonesa na plaži Jaz u blizini Budve .	nazočilo	14	Neut
No , kad je uvidjela da akupunktura nije nikakvo istočnjačko čudo i da Kinezi tom metodom uspješno liječe mnoge zdravstvene tegobe , uvjerila se u njenu svrsishodnost .	uvjerila	22	Fem
Ako se pokrene sudski postupak , dodala je , poslodavcima bi mogla biti izrečena kazna od 100 eura do 8.000 eura , u ovisno i o težini prekršaja .	dodala	6	Fem
Nakon što je HDZ objavio predizborni spot u kojem Niko Kovač poziva birače da glasaju za tu stranku , SDP im se narugao svojim spotom s kumicom Jadrankom Puž .	narugao	22	Masc
Popis mjesta koja je Karl May posjetio u Americi 1908. govori da je , manje-više , izbjegavao otići do lokacija na kojima je smjestio radnju najvećeg dijela svojih romana , te jedne knjige što ju je pisao cijeloga života .	posjetio	6	Masc
Tri godine od kada je atentator ubio prvog premijera Srbije u post-Miloševićevu razdoblju , brojna pitanja vezana za zavjeru za ubojstvo ostala su bez odgovora .	ostala	21	Neut
Depresije su u životu Jadranke R. postale svakodnevnica , nerijetko je pomišljala na samoubojstvo , a u kakvoj-takvoj normali održavali su je Prozac i goleme količine raznih antidepresiva .	postale	6	Fem
Navodno se planira akcija slična onoj u studenom 2008. godine u Mumbaiu , kada su naoružani teroristi upali u luksuzni hotel " Taj Mahal " i više zgrada u gradu i nasumice ubijali sve koga su stigli .	upali	17	Masc
Tako je bilo i jučer , u noći punog mjeseca kad su se održavale tradicionalne Vatre sv. Ivana .	održavale	13	Fem
U Budimpešti je u utorak ( 19. rujan ) protekla i druga noć sukoba između policije i prosvjednika u najvećem valu nasilja koji je Mađarska doživjela od pada komunizma 1989 .	doživjela	25	Fem
Grčka se u nedjelju ( 9. ožujka ) oprostila od zime karnevalima i tradicionalnim ritualima diljem zemlje .	oprostila	8	Fem
Premijer Vojislav Koštunica također je obilježio godišnjicu Đinđićeve smrti na ceremoniji koja je održana na mjestu gdje je ubijen .	obilježio	5	Masc
Posljednji međunarodni napori za ujedinjenje Cipra propali su u travnju prošle godine , kada su ciparski Grci u velikom broju odbacili plan rješenja kojeg su predložili UN .	odbacili	20	Masc
BEOGRAD " Zoran Đinđić je ubijen zato što je svojom politikom udario na dvije ključne stvari : organizirani kriminal i ratne zločince .	udario	11	Masc
Nedavna kampanja za novi Audi A3 , koja je naglašavala odvažnost , brzinu i dobro držanje u zavojima , koincidirala je s pogibijom trojice Varteksovih nogometaša u istom takvom automobilu , i to zbog neprilagođene brzine .	naglašavala	9	Fem
Te nade dodatno je podgrijalo uhićenje ključnog člana Zemunskog klana Dejana Milenkovića u Solunu 16. srpnja 2004. godine .	podgrijalo	4	Neut
O radovima u zborniku , koji su objavljeni na blizu 300 stranica , na skupu su govorili i akademik dr. Ivan Gušić i član-suradnik HAZU-a prof. dr. Slobodan Kaštela .	govorili	16	Masc
Otišla je prerano , pamtit ćemo je dugo i tugovat za njom	Otišla	0	Fem
Pozitivan rezultat studije izvedivosti vezane uz Stabilizaciju i pridruživanje u EU , a koji je Srbija primila 25. travnja , odaslala je " vrlo snažan signal investitorima " , rekao je Lemierres .	primila	16	Fem
Da je umro prije napada Njemačke na Norvešku , svi bi bili za , ali on je u ratu osramotio sebe , izdao Domovinu , i opravdavao zločin	osramotio	19	Masc
Napisala je magisterij iz imunologije tumora , a na poziv Svjetske zdravstvene organizacije otišla je u Peking gdje je na Institutu za tradicionalnu kinesku medicinu kod dr. Zhou Yun Xian studirala akupunkturu .	Napisala	0	Fem
Lokalna uprava u Novom Sadu financijski je poduprla festival , kao i federalna vlada .	poduprla	7	Fem
Europska narodna stranka ( EPP ) pozvala je u petak ( 31. ožujak ) na obnovu napora UN-a na pronalaženje rješenja pitanja Cipra i na snažniju ulogu EU u tom procesu .	pozvala	6	Fem
Dana 26. ožujka 1899. krenuo je sa suprugom na svoje prvo putovanje prema istoku , u Libanon , Jemen , Izrael sve do Indonezije .	krenuo	4	Masc
Albanska vlada planira otvoriti 14 infomativnih ureda u pograničnim područjima kako bi informirala građane o mogućnostima zapošljavanja i obuke u inozemstvu .	informirala	12	Fem
Iako se sloboda diljem svijeta općenito pogoršala , nekolicina balkanskih zemalja pokazuje određeni napredak .	pogoršala	6	Fem
Pokazala je prstima 25 eura i nagazila na gas .	nagazila	6	Fem
Kad je postao predsjednik , obično pismo koje su mu generali uputili videći da ruši ono za što su se oni borili , proglasio je DRŽAVNIM UDAROM i bavljenjem politikom .	borili	21	Masc
" Odlučili smo osnovati zajedničku firmu , a uspjeli smo opstati na tržištu zahvaljujući hrabrosti da preuzmemo rizik za privatni biznis te odgovornom i profesionalnom odnosu prema klijentima , primjerice , poštivanju rokova .	uspjeli	8	Masc
Kukan : Još jednom , ne bih želio nagađati o budućem dijalogu , ali smatram da će se na koncu morati pronaći praktično i političko rješenje .	želio	7	Masc
Ma uveličao si ti čitav svijet svojim dolaskom na njega .	uveličao	1	Masc
Zbog osnovane sumnje da je počinio kaznena djela zlouporabe opojnih droga i nedozvoljenog posjedovanja oružja i eksplozivnih tvari , protiv 28-godišnjaka slijedi podnošenje kaznene prijave Općinskom državnom odvjetništvu u Puli , izvijestila je istarska policija .	počinio	5	Masc
Nedavna kampanja za novi Audi A3 , koja je naglašavala odvažnost , brzinu i dobro držanje u zavojima , koincidirala je s pogibijom trojice Varteksovih nogometaša u istom takvom automobilu , i to zbog neprilagođene brzine .	koincidirala	19	Fem
Diana Mihok , donedavno i predsjednica Udruge homeopata , pripada prvoj generaciji u Hrvatskoj koja je završila dvogodišnji studij londonskog međunarodnog koledža klasične homeopatije .	završila	16	Fem
" Bilo je trenutaka kada sam plakala cijele noći , jer je izgledalo da neću uspjeti vratiti kredite " , rekla je .	plakala	6	Fem
Odgovornost za napad preuzela je radikalna sunitska organizacija Jundullah ( Božji ratnici ) koju povezuju sa Al Qaidom .	preuzela	3	Fem
Ribari navode kako su visoke razine zagađenja rezultirale sve slabijim ulovom .	rezultirale	7	Fem
Bivša ministrica kulture Melina Mercouri je 1989. objavila međunarodni natječaj za dizajn novog objekta , no projekt koji je tada odabran nikad nije stigao do realizacije .	stigao	23	Masc
Tadićev tim zadužen za kampanju odgovorio je kako je sporna internet stranica " originalna , legalna , moderna i proročanska " , načinjena po uzoru na uspješne europske i međunarodne političare .	odgovorio	5	Masc
Proteklih je devet godina Sarajevski tjedan mode Jana ( SFW ) ugošćavao dizajnere iz cijelog svijeta , a dvije su se glavne revije odvijale u proljeće i jesen .	odvijale	23	Fem
Najdraži moji , danas mi se javila čitateljica iz Melburnea .	javila	6	Fem
Ističe da se ne bi izgubilo ni dana , odnosno da bi se nastavilo s poslom s kojim se stalo .	stalo	19	Neut
Dodao je kako su promjene provedene u Srbiji i Crnoj Gori zemlju ponovno povratile pozornost ulagača .	povratile	13	Fem
- Sigurno je time nešto izgubio .	izgubio	5	Masc
Gavran je uzletio i s leđa se , ženi koja je vodila psa , sjurio prema glavi .	vodila	11	Fem
Tada još nije znala da posjeduje nadnaravne sposobnosti , ali u protekla tri desetljeća u brojnim se situacijama uvjerila u svoju sposobnost predviđanja .	znala	3	Fem
Pogledala je okolo , kao da je očima tražila nekog šefa , ali budući da ni zaposlenika nije bilo previše , nastavila je ono paaa ...	tražila	8	Fem
U agenciji ističu da su problemi u irskom bankovnom sustavu teži no što se procjenjivalo i da će troškovi spasonosnog financijskog paketa , dogovoreni u načelu , bez detalja , dodatno opteretiti irske javne financije .	procjenjivalo	14	Neut
Bili smo zgnječeni 15 minuta u nepomičnom položaju , kad sam se probudio čuo sam galamu , jauk , jedan glas se nije čuo .	čuo	23	Masc
" Ne znam za postojanje crnih fondova , a da znam prijavio bi ih .	prijavio	11	Masc
Mogao je i Mandekić pozvati Ljilju Drljević , Indiru Bajt , Vujević , a on je , kako ga zeznula Rajna Šargač , u zadnji moment pozvao lokalku , Karmen Mrakovčić	Mogao	0	Masc
Borisov je također priopćio kako uspostavlja treću dužnost potpredsjednika vlade i izabrao svojeg ekonomskog savjetnika Iliana Mihova , profesora u međunarodnoj poslovnoj školi INSEAD , za taj posao .	izabrao	11	Masc
Vrijednost i značenje projekta prepoznalo je Ministarstvo kulture Republike Hrvatske te Raiffeisen banka koji su kroz natječaje za potporu projektima u kulturi pomogli pokretanje i realizaciju projekta .	prepoznalo	4	Neut
Najbolji njemački strijelac Marc Politze šest je puta pucao na gol , ali samo su dva prošla pored vratara .	pucao	8	Masc
Finac je odvozio utrku po špagi i donio momčadi Rona Dennisa razloge za zadovoljstvo .	odvozio	2	Masc
Administracija UN na Kosovu povukla je u ponedjeljak ( 17. ožujak ) svoje policijske snage iz dijelova etnički podijeljenog grada Mitrovice naseljenih Srbima nakon što su izbili sukobi sa srpskim prosvjednicima .	povukla	4	Fem
Whispers Like Thunder bilježi istinitu priču u kojoj su glavni likovi tri američke Indijanke , tri sestre koje su preživjele 65 godišnju borbu protiv američke vlade ne bi li zaštitile Wyandot , indijansko sveto groblje u Kansasu .	preživjele	19	Fem
- Istina , nemamo generalnog sponzora jer smo zaključili da naš ugled ne možemo dati ispod neke cijene .	zaključili	8	Masc
U susretu stolnotenisačica , Rumunjska je izgubila od Hong Konga 0 - 3 .	izgubila	6	Fem
Moody's dodijelio rejting B2 novim obveznicama Agrokora	dodijelio	1	Masc
Koncert skupine , koji je održan u sklopu turneje Big Bang , trajao je dva sata .	trajao	12	Masc
Gospodski sinak proveo šest semestara besposleno u Budimpešti , kartao se , trošio silan novac i zadužio se tako da je time upropastio svoga oca koji bijaše čovjek valjan i svagdje uvažen .	zadužio	16	Masc
Primjerice , samo u zadnja dva mjeseca agencije Tridvajedan i Laboratorium dobile su na međunarodnim natjecanjima u Ateni , Chicagu i New Yorku nekoliko prvih nagrada .	dobile	11	Fem
Kao takvu ju je upoznao i oženio Konstancije Klor .	oženio	6	Masc
IVIĆ PAŠALIĆ : Ne , bilo je i prije , bilo je u Novom listu , bilo je u Tjedniku , zvali su iz Nacionala , zvali su svi .	zvali	26	Masc
Isaja , koja je podrijetlom iz Rumunjske , doselila se s obitelji u Makedoniju 1951. godine i kasnije postala jedna od najtalentiranijih i najpopularnijih osoba na makedonskoj kazališnoj sceni .	postala	18	Fem
- Najradije se sjećam 30-ak autobusa koji su razvozili radnike u prvu , drugu i treću smjenu .	razvozili	8	Masc
Od ostalih vijesti iz kulture : srpska učenica ušla je u polufinale foto natjecanja koje organizira Google .	ušla	8	Fem
Za razliku od toga , trojica su od najboljih igrača Grčke morala biti zamijenjena uslijed ozljeda koje su zadobili tijekom utakmice .	zadobili	18	Masc
Ova novocirkuska senzacija koja je cijeli jezik predstave prenijela u svijet vrhunske akrobatike , kombinira iznimnu tehniku s nježnošću .	prenijela	8	Fem
Radi toga zahtijevamo objavu stvarnog broja Hr. branitelja , što je i sama premijerka Jadranka Kosor pozdravila i napomenula da će se sa objavom ići samo da se reguliraju neka zakonska pitanja .	pozdravila	16	Fem
Ministar je istaknuo da treba definirati razvojnu strategiju i jasno odrediti što je čija zadaća , a razvojne agencije umrežiti kako bi se lakše razmijenila iskustva i što bolje došlo do pristupnih fondova .	razmijenila	24	Fem
Nastupila sam bolesna , s temperaturom , a Goran Karan mi je na to rekao - ako bolesna pjevaš dobro , onda znaš pivati .	Nastupila	0	Fem
Samsonova majka Mara je neplodna i već je izgubila nadu da će ikada imati djece kada joj se ukaže tajanstveni stranac i prorekne da će roditi sina koji će spasiti svoj narod iz filistejskog ropstva .	izgubila	8	Fem
Obnavljale su se škole , igrališta , sadilo drveće i dijelila kamena vuna .	dijelila	10	Fem
Polako je shvaćao potencijal širokog tumačenja svoga mandata , kojeg bi se moglo iskoristiti kako bi se proces pomaknuo naprijed .	pomaknuo	18	Masc
Jovanov : Ponovno napadaju , tražili su da se predamo da ne bi bilo žrtava , jer su navodno Male Bare i Tetinje pali .	tražili	5	Masc
" Prvo smo prije dvije godine uzeli kredit kako bismo otišli na medeni mjesec , a zatim sam naslijedio ovaj stan u koji smo se onda uselili .	naslijedio	18	Masc
Izgleda da ljutitom instruktoru vožnje ni to nije bilo dovoljno te je suparniku više puta zaprijetio i ubojstvom , te je uz prekršajnu zaradio i kaznenu prijavu .	zaradio	23	Masc
Mowgli ga je potjerao uz potporu vučje braće .	potjerao	3	Masc
" Albanija je postala druga zemlja od pada komunizma " , kaže Remzi Lani , bivši urednik novina Glas mladeži .	postala	3	Fem
Lokalitet oko Kule Stojana Jankovića naseljen je još od neolita , napomenuo je Uglešić dodavši kako je u rimskom razdoblju zbog svog položaja na tom području bila važna utvrda .	napomenuo	11	Masc
' Neovisno Kosovo ' tvorevina je NATO-a koji je stvorio ovu državu i dodijelio sebi vrhovnu i apsolutnu vlast u njoj " , kazali su intelektualci u priopćenju koje je pročitao pisac Matija Bećković .	dodijelio	13	Masc
Prema njihovu dokumentu , ključan razlog protiv pridruživanja NATO-u jest akcija Saveza u bivšoj Jugoslaviji 1999. godine u kojoj je poginulo , kako se procjenjuje , oko 2.500 civila .	poginulo	20	Neut
Bollano se kandidirao za drugi mandat .	kandidirao	2	Masc
