Okupljene je pozdravio aktualni predsjednik Stjepan Ključariček te zajedno sa tajnikom udruge Antunom Hrbićem predstavio radno predsjedništvo .	predstavio	14	Masc
Nakon , rekli bismo , promašenih Storma i Storma II , ovo je ipak prvi BlackBerrry s dobrim ekranom osjetljivim na dodir , pravim kapacitivnim , koji podržava i multitouch .	rekli	2	Masc
Ustaški pokret nastao je iz bolesne želje za vlašću .	nastao	2	Masc
U euforiji koja je zahvatila Hrvatsku , teško da je itko o tome razmišljao .	zahvatila	4	Fem
Također ovog tjedna : makedonski premijer Nikola Gruevski boravio u posjetu Tel Avivu kako bi promicao poslovne mogućnosti .	promicao	15	Masc
Daytonski sporazum , stvoren kako bi se okončao rat i poslužio kao temelj za mir , morao je odražavati određene okolnosti i politički okvir .	okončao	7	Masc
U cilju zaštite privatnosti , vlasti nisu objavile njezino ime .	objavile	7	Fem
Ta je izjava autentična , samo što , kada ju je izgovorio , Eduardo nije mislio na Slavena Leticu , već na Slavena Bilića .	mislio	15	Masc
Mančevski se proslavio filmom " Prije kiše " koji je 1998. godine osvojio Zlatnog lava na Filmskom festivalu u Veneciji .	osvojio	12	Masc
Europska komisija zatražila je potporu Rumunjske u pronalaženju cjepiva protiv virusa gripe H1N1 , priopćilo je u utorak ( 2. lipnja ) rumunjsko Ministarstvo zdravstva .	zatražila	2	Fem
Ako odem u samoposlugu ili u restoran i moja kartica ne radi , kako bi to izgledalo " , kaže Tina Manescu , 26-godišnja tajnica .	izgledalo	16	Neut
Rumunjska vlada je u srijedu , 23. lipnja , odobrila hitnu odredbu kojom se povećava udio profita koji državne tvrtke moraju pridonositi u državni proračun te se uvode novi porezi za fizičke osobe .	odobrila	9	Fem
Govoreći na poslovnom forumu , istaknuo je kako je Makedonija potpisala tri multilateralna sporazuma o slobodnoj trgovini i stvorila povoljne uvjete za inozemne ulagače u zonama tehnološko-industrijskog razvitka .	stvorila	18	Fem
S druge strane , predsjednik Nacionalnog savjeta za suradnju s Haškim sudom Rasim Ljajić jučer je odmah uzvratio udarac i obitelji poručio da podnošenje prijedloga da se Mladića proglasi mrtvim neće utjecati na potragu za njim .	uzvratio	17	Masc
Teroristička prijetnja s kojom se svijet suočava danas postala je " puno složenija i raznolikija " , izjavio je novinarima u Bruxellesu .	postala	8	Fem
Pod okriljem noći s petka na subotu nepoznati je počinitelj provalio u kafić Alfa na Voštarnici te je iz dva aparata za zabavu ukrao novac oštetivši 47-godišnjeg vlasnika za tisuću kuna .	ukrao	23	Masc
Popović se ozljedio sredinom druge četvrtine , te se više nije vraćao u igru .	ozljedio	2	Masc
Studio za oblikovanje vizualnih komunikacija Laboratorium , osnovali su 2001. Orsat Franković i Ivana Vučić , a dobio je čak 50 nagrada , a od toga 45 u inozemstvu .	dobio	17	Masc
" U 2006. godini zaprimljene su 62 pritužbe zbog tjelesnih ozljeda koje je nanijela policija , uz pritužbe za nepristojno i neprofesionalno ponašanje .	nanijela	13	Fem
Gol koji je postigao Mršić je prekrasan , dugo nisam vidio takav zgoditak , kako na našim tako ni na europskim terenima	postigao	3	Masc
Razlikovala je tjelesno , socijalno i duhovno siromaštvo .	Razlikovala	0	Fem
Upravo suprotno , muškarci iz moje branše prihvatili su me s poštovanjem i kao gospoda , pomogli su mi puno puta , govoreći kako se dive mojoj hrabrosti i ustrajnosti " , rekla je Marjanović za SETimes .	rekla	32	Fem
S druge strane globalna kompanija News Corporation u vlasništvu medijskog magnata Ruperta Murdocha napravila je iskorak prema razvoju poslovnih modela naplaćivanja internetskog sadržaja .	napravila	13	Fem
Govoreći o svojoj dugoj karijeri , ispričao je da je vrlo brzo želio " postati marka , jer stil nestaje nakon tri mjeseca , dok marka ostaje " .	ispričao	6	Masc
Od ukupnog broja muškaraca , njih 451 je patilo od azoospermije .	patilo	8	Neut
U kući u kojoj je nerijetko vladala glad .	vladala	6	Fem
Od 2004. godine , kada je donesen hrvatski zakon o azilu , 382 osobe zatražile su azil , ali su sve odbijene .	zatražile	14	Fem
Potapšao sam ga po leđima ; to je bio znak zahvalnosti jer on je ribu mogao zadržati , pokazati je prijateljima , pripremiti ukusan objed , ali nije učinio ništa od toga i zato sam mu zahvalan .	Potapšao	0	Masc
Od kada sam rođena , imali smo samo jednog komunističkog predsjednika -- ovo je prvi proeuropski predsjednik u mojem životu " , rekla je za SETimes 11-godišnja učenica Inga Taranu .	rekla	22	Fem
Svoj stil definiraju kao " humanizirani funkcionalizam " , a uzore su našli u najvećim dizajnerskim imenima iz tridesetih , koja su , kaže , postavila nove standarde .	našli	12	Masc
Također , važno je što akupunktura djeluje i preventivno , što su stari Kinezi odavno koristili u tretiranju zdravih ljudi , zaključuje dr. Lukić-Nagy dodajući da se do rezultata dolazi kroz najmanje 7 - 10 tretmana .	koristili	15	Masc
Udio uređaja temeljenih na Symbianu je tokom trećeg kvartala pao sa 44,6 na 36,6 % , dok je istovremeno Android skočio sa samo 3,5 % u isto vrijeme prošle godine na 25,5 % tržišta .	skočio	20	Masc
Kako zlo nikad ne dolazi samo , u ovoj ionako siromašnoj zemlji , nakon potresa se umiralo od gladi i kolere , a u anarhiji koja je zavladala , došlo je i do trgovanja ljudima .	umiralo	16	Neut
Poveli smo 16 razlike i onda se dogodila totalna blokada .	dogodila	7	Fem
Također je signalizirao kako postoji mogućnost potencijalnog kompromisa .	signalizirao	2	Masc
Međutim , isti fenomen dogodio se 1997. godine , kada je DS bila prisiljena otići s vlasti .	dogodio	4	Masc
Tipičan su rod XVII . stoljeća melodrame , a najviše su ih napisali Junije Palmotić i Ivan Gundulić .	napisali	12	Masc
Adriano Galliani , predsjednik Milana , objasnio je novinarima da će nova članica uprave prvo proći kroz sve sektore Milana da bi se upoznala s njima , a tek onda će odlučiti čime će se baviti .	upoznala	23	Fem
Mnoge su kolekcije portabilnih programa ideju pokupile upravo od U3 smart driveova koji se od tradicionalnih USB Flash memorija razlikuju samo po tome što oni dolaze predinstalirani s nizom portabilnih programa .	pokupile	6	Fem
Kasnije zbirke , Pobuna ( 1957. g. ) i Drugo rođenje ( 1963. g. ) naznačile su duboke promjene u odnosu na dotadašnje konvencije modernog iranskog pjesništva .	naznačile	15	Fem
No u acro jogu sam se odmah zaljubila pa ju i danas vježbam .	zaljubila	7	Fem
Compagnie XY zapravo se i rodila kroz prenošenje znanja i vještina s učitelja ( Abdeliazide Senhajdi , Nordine Allal , Mahmoud Louretani ) na učenike .	rodila	5	Fem
Ono što nisu iskoristili Zadrani , iz prvog pokušaja je pošlo za rukom gostima koji su u 15. minuti pomalo sretno poveli .	pošlo	10	Neut
Pa neletile i urmašice i tulumbe , a što ćeš na kraju nego i kukuruza probati iz susjedova vrta .	neletile	1	Fem
Zbog tjeranja Leke i Pokrivača navodno je i svlačionica ustala i htjela njihov povratak .	ustala	9	Fem
Ove lokacije pretrpjele su štetu u potresu u ožujku ove godine .	pretrpjele	2	Fem
Opasnost mogućeg veta na Barrosov predloženi tim 2004. godine praktično je prisilila talijanskog i letonskog kandidata Rocca Buttiglionea i Ingridu Udre na povlačenje kandidatura .	prisilila	11	Fem
Govoreći na komemoraciji nakon Fehmiuove smrti , njegov kolega i bivši srpski ministar kulture Branislav Lečić rekao je kako je mnogo naučio od Fehmiua , uz kojeg je započeo svoju glumačku karijeru .	naučio	21	Masc
Inzistirajući kako mora zadržati neki oblik suvereniteta nad pokrajinom , Srbija je odlučno odbacila neovisnost kao moguće rješenje .	odbacila	13	Fem
Godine 1945. ponovno počinje s nastavom , ali bez prava javnosti pa kontinuitet preuzima Dominikanska srednja vjerska škola za spremanje svećenika , koja je nakon duge i burne prošlosti , pošto je odgojila generacije učenika , prestala s radom 1973.	odgojila	32	Fem
Osim toga imamo u planu ići sa peticijom registra HR. branitelja koju pozdravljaju svi diljem Lijepe naše , naravno osim onih koji su svoja prava stekli na nezakonit način i onih koji su im ih davali .	davali	35	Masc
Izgleda kao da nikad ne jedete odreske niti ste ikad čuli za njih . '	čuli	10	Masc
U tom je trenutku ta stranica za ozlijeđenog Julia bila joga u kojoj je pronašao novu dimenziju tjelesnog postojanja i otkrio snagu unutrašnjeg pokreta .	otkrio	20	Masc
' Neovisno Kosovo ' tvorevina je NATO-a koji je stvorio ovu državu i dodijelio sebi vrhovnu i apsolutnu vlast u njoj " , kazali su intelektualci u priopćenju koje je pročitao pisac Matija Bećković .	pročitao	30	Masc
Članove Pravosudnog vijeća do sada je birao parlament , pa se tvrdilo kako je taj proces stranački obojen .	tvrdilo	11	Neut
Dvoje optuženih , Anita Lončar Papeš i Bojan Dimić , preko čijih tvrtki se također izvlačio novac iz državnih institucija i tvrtki u HDZ-ov " crni fond " , priznali su krivnju .	priznali	29	Masc
On posjeduje i u Sebi sadrži sve što postoji , što nije imalo početak i nije mu suđeno završiti .	imalo	12	Neut
Najdalje su otišli švedski znanstvenici iz Youth Care Foundationa koji su video igre usporedili sa kokainom , iako je riječ o besmislici jer se narkotici konkretnim kemijskim putem vežu za neurosinapse i pritom stvaraju ovisnost .	usporedili	13	Masc
" Nijedna od mojih kćeri nema i nije imala nikakve veze s bilo kakvim zakladama , pa tako ni sa Žužulovom , ako takva postoji .	imala	8	Fem
Hrvat Ivica Kostelić osvojio je svoje prvo zlato u Svjetskom kupu od 2003. godine .	osvojio	3	Masc
Tako je ispričala da je zasad zadovoljna komentarima koje je primila za svoj rad , ali i kako rado prihvaća sve kritike .	ispričala	2	Fem
Hoće li i Ducati , proizvođač koji je veći dio dosadašnje egzistencije bilježio gubitke , također okrenuti ploču - ostaje za vidjeti .	bilježio	12	Masc
Zato o izlječenju ima pomalo filozofsko stajalište : Još dok sam radio u Moskvi , zanimalo me što mogu naučiti o čovjeku kao cjelini .	zanimalo	15	Neut
Arheolozi kažu kako bi se time samo nanijela dodatna šteta .	nanijela	7	Fem
As NBA Vlade Divac " zakucao " srbijansku vladu	zakucao	5	Masc
Abram je odgovorio na taj blagoslov drugačije od Adama .	odgovorio	2	Masc
Turski bi glumac mogao pomoći , pa bi se lako izgradile i tri .	izgradile	10	Fem
Dovoljno se film bavi Bruceovom psihom , ne može se reći da ne , ali opet , fali mu ono nešto mračno i zagonetno što je krasilo Michaela Keatona .	krasilo	26	Neut
Promatrao je premještanje zajedno s arhitektom novog muzeja , Bernardom Tschumijem , 25 veleposlanika iz zemalja članica EU i brojnim novinarima .	Promatrao	0	Masc
Dana 6. i 7. veljače u Bruxellesu je krovna svjetska organizacija za zaštitu zastupanje nogometaša , FifPro održala veliku konferenciju i predstavila takozvanu ' Crnu knjigu Istočne Europe ' .	održala	17	Fem
U ponedjeljak ( 7. travnja ) , vlada je priopćila kako je ovog tjedan početi razgovore u cilju rješavanja postojećeg spora oko naziva s Grčkom , koji je Makedoniju koštao pozivnice u NATO .	priopćila	9	Fem
Nekoliko svijetlih točaka odnosi se na zamjetna poboljšanja u 16 od 194 zemlje , a Hrvatska , Kosovo , Makedonija , Crna Gora i Srbija nalaze se među onima koje su pokazale napredak .	pokazale	31	Fem
Dodaje da su u početku redovno slale svoje radove na natječaje , no kasnije su odustale , " jer im se to činilo kao gubitak vremena , a manje kao dokaz kvalitete " .	slale	6	Fem
Rohan je u srijedu posjetio nekoliko srpskih sela na Kosovu kao i manastir Dečani , gdje je razgovarao sa stanovnicima i vjerskim velikodostojnicima Srpske pravoslavne crkve .	razgovarao	17	Masc
EBRD i Europska investicijska banka su na početku zasjedanja izjavili kako će u Srbiji uložiti dodatnih 250 mil . eura ove godine .	izjavili	9	Masc
To je znak da su se rumunjske kriminalne skupine koje su praznile bankovne račune tisuća ljudi na Zapadu kloniranjem njihovih kartica sada okrenule vlastitoj zemlji .	praznile	11	Fem
Na pozitivnom primjeru pisanja o pljački u koju su bile umiješane Hrvatske željeznice i Železnice Srbije Hedl izvlači zaključak kako bi bolja prekogranična suradnja novinara zasigurno rezultirala puno većim brojem otkrivenih korupcijskih afera .	rezultirala	26	Fem
Na pitanje može li hrvatski dizajn konkurirati svjetskom , Ira Payer je odgovorila da su hrvatski grafički dizajneri čak i ispred mnogih zemalja srednje i istočne Europe , te da ne zaostaju niti za razvijenim zemljama Zapada .	odgovorila	12	Fem
Na upit o Badr Hariju i njegovim prozivkama , Le Banner je odgovorio da nije izbjegavao Harija , te da će se , ako se ukaže prilika , boriti s njim .	odgovorio	12	Masc
Ako je sv. Pavao svojim mačem riječi možda i stvorio kakvu podjelu među ljudima , vjernicima i nevjernicima , Luka liječnik , vjerni Pavlov suradnik , unosio je neko zacjeljenje .	stvorio	9	Masc
Tukidid piše : Zdravi ljudi odjednom su dobili vrućicu u glavi , crvenilo i upalu u očima , unutrašnji dijelovi tijela poput grla i jezika postali su im krvavi i iz njih se širio neugodan zadah .	širio	33	Masc
Zajedno s njim u Madrid su doputovali i ministrica gospodarstva Lydia Shuleva , ministar vanjskih poslova Solomon Passy i ministar obrane Nikolay Svinarov .	doputovali	6	Masc
Koordinator EU protiv terorizma izrazio je zabrinutost da je sadašnja sigurnosna praznina u Libiji možda omogućila članovima sjevernoafričkih ogranaka al-Qaede da povećaju svoj arsenal oružja pljačkanjem , uključujući rakete zemlja-zrak , čime se potencijalno dovodi u opasnost putovanje zrakoplovima .	omogućila	15	Fem
Bugarska je u utorak ( 19. siječnja ) izabrala potpredsjednicu Svjetske banke Kristalinu Georgievu za svojeg novog kandidata za povjerenika EU , nakon što je prva kandidatkinja Rumiana Jeleva priopćila kako se povlači .	izabrala	8	Fem
Uz neobičan styling , teško je nalazila put do kupaca , ostvarujući vrlo slabe prodajne rezultate .	nalazila	6	Fem
Koristite češalj sa širokim zupcima kako biste ujednačeno nanijeli tretman na vlažnu kosu .	nanijeli	8	Masc
Zagreb je priznao neovisnost Kosova u ožujku 2008. godine i uspostavio diplomatske odnose s Prištinom u lipnju iste godine .	priznao	2	Masc
Izbila je tijekom Peloponeskog rata između Atene i Sparte , a odnijela je najmanje 30.000 života Atenjana ( umrlo je između jedne i dvije trećine svih stanovnika ) .	umrlo	18	Neut
Također , prijetilo se i zajedničkom presicom roditelja poginulih nogometaša i predstavnika automobilske tvrtke na kojoj bi se Index.hr optužilo za ismijavanje njihove tragedije .	optužilo	19	Neut
NIKE i Yonex stoje uz nju , postoje ljudi koji su prepoznali potencijal , uključili se u cijelu priču i upravo zahvaljujući njima Donni je omogućeno da ide ovim putem .	uključili	14	Masc
Agencija Moody's upozorila je u ponedjeljak da će najvjerojatnije biti prisiljena sniziti irski kreditni rejting za nekoliko stupnjeva s obzirom na troškove pomoći koju će toj otočnoj zemlji odobriti Europska unija i Međunarodni monetarni fond .	upozorila	2	Fem
" Jedna moja prijateljica je otišla u Grčku i kod kuće ostavila dvojicu sinova : jednog od 7 i drugog od 15 godina .	ostavila	11	Fem
" Haljina je naše vječno nadahnuće jer ju smatramo kraljicom mode " , rekle su sestre blizanke Morana Saračević i Marija Cicko Karapetrić iz Studia Boudoir .	rekle	13	Fem
Policija BiH priopćila je kako je skupina osoba koje se sumnjiči za povezanost s Wahhabi pokretom planirala izazvati etničke sukobe napadima na katoličke crkve .	priopćila	2	Fem
One su danas kreativne direktorice agencije , a dvojcu se nekoliko godina kasnije pridružila Narcisa Vukojević .	pridružila	13	Fem
- Depresija , depresija - mrmljala je Talijanka .	mrmljala	5	Fem
Olimpijske igre : " Crvene ajkule " pobijedile Grčku	pobijedile	7	Fem
Tužitelj je tražio da se 71 članu stranke , uključujući premijera Recep Tayyip Erdogana , zabrani bavljenje politikom na pet godina .	tražio	2	Masc
Nakon što se Ulemek sam predao vlastima 2. svibnja 2004. godine , porasle su nade kako će biti otkrivena puna istina .	porasle	12	Fem
Srpska državna televizija propustila je incident s cipelom i ispričala se gledateljima , rekavši kako su u tom trenutku kamere radile u automatskom načinu rada .	ispričala	9	Fem
U ponedjeljak [ 11. siječnja ] , skupina od 200 srpskih intelektualaca pozvala je na referendum o članstvu u NATO-u , tvrdeći kako se beogradske vlasti tajno kreću ka Savezu .	pozvala	12	Fem
To je ono što sam oduvijek htjela .	htjela	6	Fem
Kao voditelj pojedinih programa Poslovne škole u okviru izvodio je i aktivnosti na primjeni ISO-9000 i sustava upravljanja kvalitetom kao i company-treninge ( management , organizacija , razvojni programi , strateško upravljanje i upravljanje ljudima ) .	izvodio	8	Masc
" Ništa pozitivno ne bi donijeli novi pokušaji koji bi se završili , kao što su se završila prethodna dva , velikim neuspjehom ili frustrirajućim zastojem " .	završila	17	Neut
Nedavni nagli pad kriminala diljem Balkana pretvorio je tu regiju u jednu od najsigurnijih u Europi , navodi se u izvješću UN-ova Ureda za borbu protiv narkotika i kriminala ( UNODC ) objavljenom ranije ovog ljeta .	pretvorio	6	Masc
Uz razne peripetije vratio se u Zavod i 1861. položio završni ispit te se zaposlio kao učitelj u Glauchau .	vratio	3	Masc
Hrvatska i Srbija poboljšale su ocjenu za politička prava za po jedan bod , sa 2 na 1 odnosno sa 3 na 2 .	poboljšale	3	Fem
Unutrašnjost je ostala gotovo netaknuta , a na nju i nije bilo ranijih primjedbi .	ostala	2	Fem
Radi toga zahtijevamo objavu stvarnog broja Hr. branitelja , što je i sama premijerka Jadranka Kosor pozdravila i napomenula da će se sa objavom ići samo da se reguliraju neka zakonska pitanja .	napomenula	18	Fem
Velika većina onih koje smo pitali izvan muzeja , rekli su Ferrari je kriv , Alonso je u ovom trenutku najbolji svjetski vozač .	rekli	9	Masc
Španjolska je postala 12. članica koja je ratificirala protokol .	ratificirala	7	Fem
Europska komisija zatražila je potporu Rumunjske u pronalaženju cjepiva protiv virusa gripe H1N1 , priopćilo je u utorak ( 2. lipnja ) rumunjsko Ministarstvo zdravstva .	priopćilo	14	Neut
Zvezdan Jovanović , zamjenik zapovjednika JSO-a , uhićen je nekoliko dana nakon ubojstva i kako je izvješteno priznao je kako je on ispalio metak koji je ubio Đinđića .	ispalio	22	Masc
Onaj kome ste ju poslali dobit će link za download .	poslali	4	Masc
Večer je započela pjesmama Tamare Obrovac , nakon čega je prikazan dokumentarni film " Orel " u produkciji i režiji Igora Gala , a koji je nastao neposredno pred odlazak ovoga velikana hrvatske fotografije .	započela	2	Fem
Prijateljska atmosfera kulminirala je u drugom dijelu kada su šestorica igrača dobili opomenu suca Draženka Kovačića , a Dinu Drpića je posebno ' nagradio ' isključenjem četiri minute prije kraja .	kulminirala	2	Fem
Srpski vaterpolisti pobijedili su u četvrtak Sjedinjene Američke Države s rezultatom 4 - 2 , u susretu s malo zgoditaka kojim je dominirala obrana .	dominirala	22	Fem
Nagrada za fotografiju pripala je Tomislavu Gerogievu .	pripala	3	Fem
Sejdiu kaže da je to premalo , te da su neke zemlje u regiji prodavale samo jednu ili nekoliko tvrtki po toj cijeni .	prodavale	14	Fem
U finalu je 20-godišnja Olaru porazila slovenku Mašu Zec-Peškirić s 6-7 , 7-5 , 6-4 .	porazila	5	Fem
Štovatelji u Prištini i Beogradu odali su počast Fehmiu , koji je bio svojevrsna veza među Albancima i Srbima .	odali	5	Masc
Policija je pretražila još dvije lokacije u sarajevskim četvrtima Sedrenik i Barice , te je tom prilikom pronašla materijale koji se koriste za izradu eksploziva .	pretražila	2	Fem
Kroz našu ambulantu u proteklih nekoliko dana prošlo je 25 osoba za koje se sumnja da su se zarazile salmonelozom .	zarazile	18	Fem
U euforiji koja je zahvatila Hrvatsku , teško da je itko o tome razmišljao .	razmišljao	13	Masc
U njemu nisu mogli naći ništa što bi laskalo njihovoj uznositosti ili poticalo njihove slavoljubive nade .	poticalo	12	Neut
Samo se 25 posto izjasnilo u njegovu korist .	izjasnilo	4	Neut
Mlada turska sopranistica Burcu Uyar osvojila je nagradu DEBUT 2006 na europskom opernom natjecanju održanom prošlog tjedna u Mannheimu u Njemačkoj .	osvojila	5	Fem
Bili smo zgnječeni 15 minuta u nepomičnom položaju , kad sam se probudio čuo sam galamu , jauk , jedan glas se nije čuo .	probudio	12	Masc
Bugarska , Grčka i Rusija suglasile su se o izgradnji novog trans-balkanskog naftovoda kojim će se , kada postane operativan 2008. godine , prema očekivanjima , smanjiti pritisak na Bospor .	suglasile	5	Fem
Također su tvrdili kako su odštete koje bi novi vlasnik morao platiti u slučaju neispunjavanja svojih socijalnih obveza minimalne .	morao	10	Masc
U nedostatku vremena i prostora za pokop , tijela su ležala na ulicama grada .	ležala	10	Neut
Ured UN-a u Makedoniji dodijelio je nagradu za novinarski rad i fotografiju koje se bave siromaštvom .	dodijelio	4	Masc
Budući da je vijest izazvala nemalo uznemirenje u javnosti , njemački Savezni kriminalistički ured ( BKA ) se požurio opovrći ju .	izazvala	4	Fem
Tri mjeseca potom pacijentica je otišla na kontrolu a liječnici su rekli kako je bolest nestala .	nestala	15	Fem
Vrdoljak je sakupio niz glazbenih profila , od Ive Robića , Boška Petrovića , Zdenka Runjića , Olivera Dragojevića , Drage Mlinarca i ostalih manje ili više važnih junaka hrvatske glazbe .	sakupio	2	Masc
Postao je i prvi predsjednik Komisije za utvrđivanje ratnih i poratnih žrtava .	Postao	0	Masc
Naš je centar na ovogodišnjoj Svjetskoj konferenciji za outlet centre u Londonu bio prikazan kao uzorni projekt za takve centre , između ostalog i zato jer smo koristili hrvatsku arhitekturu .	koristili	27	Masc
Primjerice , studentica komunikacijskog dizajna iz Berlina kreirala je nakon samo nekoliko mjeseci ambalažu za maslinovo ulje Chiavalon , koja je nagrađena na Cropaku .	kreirala	7	Fem
U međuvremenu se izgubilo 100 tisuća radnih mjesta pa nema ni poreza ni doprinosa .	izgubilo	3	Neut
Odbojkašice Đakova ostvarile su povijesni uspjeh plasiravši se u 1. B ligu .	ostvarile	2	Fem
Nije nelogično da se Sanader uhvatio pisanja .	uhvatio	5	Masc
Napisala je magisterij iz imunologije tumora , a na poziv Svjetske zdravstvene organizacije otišla je u Peking gdje je na Institutu za tradicionalnu kinesku medicinu kod dr. Zhou Yun Xian studirala akupunkturu .	otišla	13	Fem
Isto tako želio sam karikirati HDZ-ovu kampanju gdje su instrumentizirali hrvatske sportaše i iskoristili ih u političke svrhe .	iskoristili	13	Masc
Trebalo je sve privatizirati , jer samo privatni vlasnik može povećati djelotvornost poslovanja poduzeća i cjelokupnog gospodarstva .	Trebalo	0	Neut
Mogao sam i bez toga , ljudi smo i griješimo .	Mogao	0	Masc
Scena : Kad ste se zaljubili u fotografiju ?	zaljubili	5	Masc
U klub je iz Rangersa stigao početkom ove godine , te do kraja sezone u 13 nastupa postigao čak 9 golova .	stigao	5	Masc
Istoga je dana hrvatski predsjednik nazočio otvaranju izložbe fotografija pod nazivom » Mjesta svjetske baštine u Hrvatskoj « na Manhattanu .	nazočio	5	Masc
Mirovne su aktivistice tijekom rata i u poslijeratnom razdoblju svoj rad usmjerile na ratne stradalnike i žrtve nasilja bilo koje vrste , pokušavajući im pomoći da lakše prebrode proživljene traume i smognu snage nastaviti život bez mržnje .	usmjerile	11	Fem
Sada kada se vratila na vlast , kažu kritičari , DS provodi još jedan krug " političke čistke " .	vratila	3	Fem
Šef ureda OESS-a u Albaniji Osmo Liponen izrazio je zabrinutost zbog nedavnih događaja u svezi sa slobodom tiska u toj zemlji .	izrazio	7	Masc
Drama " Yumurta " ( Jaje ) turskog redatelja Semiha Kaplanoglua osvojila je u nedjelju ( 9. ožujka ) nagradu za najbolji film na 13. Festivalu tursko-njemačkog filma u Nurembergu .	osvojila	11	Fem
Potvrdila je kako je glasovanje za članove Vijeća provedeno bez izgreda ili nepravilnosti .	Potvrdila	0	Fem
Nataša Strugar je navela kako je Bartol Kašić u udžbenicima za srednju školu zastupljen informativno , kao dio neke nastavne jedinice ili cjeline u područjima povijesti književnosti i jezika .	navela	3	Fem
Složili su se pomoći iračkoj vladi u obuci njezinih snaga sigurnosti i ponudili suradnju cjelokupnoj regiji Bliskog istoka .	ponudili	12	Masc
Policija je tajno snimila oba sastanka , navodi se u optužnici .	snimila	3	Fem
Dodala je kako je od tih 34,5 hektara formirana nova parcela , čiji su suvlasnici Nadbiskupija , država i Zračna luka .	Dodala	0	Fem
Snimka pokazuje predsjednika koji se naginje s pozornice s koje je držao govor u gradu Ploiesti tokom kampanje na lokalnim izborima prije pet godina , nastojeći čuti ženu koja je zatražila pomoć .	zatražila	30	Fem
Imao je 30:0 , a potom i dvije break lopte .	Imao	0	Masc
Kako je vrijeme odmicalo , pridruživalo se sve više suradnika koji su prepoznavali vrijednost i potencijal ovog projekta .	pridruživalo	5	Neut
Vlasti EU su te koje nisu ispunile svoja obećanja " .	ispunile	6	Fem
Želite li vizualizirati proizvodni proces kako bi ga približili široj javnosti ?	približili	8	Masc
Na radnom ručku najviših srpskih dužnosnika i ministara diljem regije postignut je konsenzus kako bi među balkanskim zemljama trebala biti unaprijeđena komunikacija , posebice s obzirom na zajednički cilj - članstvo u EU .	trebala	18	Fem
Manifestacija je okupila blizu 1.000 predstavnika etničke manjine Karakachani iz Bugarske i Grčke .	okupila	2	Fem
Upravo su takvim jednoglasno proglasili kritičari novi film ' Obsessed ' u kojem glavnu ulogu tumači tamnoputa pjevačica .	proglasili	4	Masc
Zatim su potkraj devedesetih napravili prvi cjeloviti projekt za namještaj , izradili prototipove i atraktivan portfolio te otišli na čuveni sajam pokućstva u Milanu .	otišli	17	Masc
