Bomba u pismovnoj pošiljci koja je nalikovala na poklon eksplodirala je u četvrtak uvečer , 24. lipnja , u grčkom ministarstvu unutarnjih poslova , usmrtivši visokopozicioniranog djelatnika .	nalikovala	6	Fem
Prvu nagradu osvojili su i za ambalažu cementnih vreća Optimo i Strukto proizvođača Cemex-Dalmacijacement na uglednom europskom natječaju ED Awards u Ateni .	osvojili	2	Masc
U proračunu za sljedeću godinu nema bolnih rezova , o kojima je sve donedavno govorila premijerka Jadranka Kosor .	govorila	14	Fem
Izaslanstvo Vijeća sigurnosti UN-a završilo je u subotu dvodnevnu misiju utvrđivanja činjenica na Kosovu i priopćilo kako će tom 15-članom tijelu biti potrebno još vremena za donošenje odluke o budućnosti pokrajine .	priopćilo	15	Neut
Drugo , vidjeli smo koliko je zapanjujuće da je Veliki Prasak bio tako fino udešen da je mogao stvoriti svemir koji podržava ljudski život .	vidjeli	2	Masc
Ako je SDS usvojila takvo stajalište , to bi značilo kako je odlučila uništiti izglede zemlje za pomicanje naprijed na putu ka Europi , dodaje OHR .	usvojila	3	Fem
Tijekom vikenda zamjenik šefa UNMIK-a Larry Rossin zahtijevao je okončanje pokušaja podrivanja nadležnosti UNMIK-a .	zahtijevao	7	Masc
Pokazuje i vlastiti zdravstveni karton u kojem piše da je 4. travnja miom bio velik 17 milimetara , a zatim se 8. svibnja smanjio na 11,5 milimetara .	smanjio	23	Masc
Zagrepčani su na trenutke dali naslutiti da mogu ozbiljnije zaprijetiti protivniku , ali nedostajalo je konstantnosti u njihovoj igri .	nedostajalo	13	Neut
Ostvarila je uvjerljivu pobjedu na prošlogodišnjim izborima osvojivši 47 posto glasova .	Ostvarila	0	Fem
Damir Burić postigao je tri zgoditka , dok su po dva postigli Maro Joković , Mile Slodlaka , Pavo Marković i Miho Bošković .	postigao	2	Masc
Poveli smo 16 razlike i onda se dogodila totalna blokada .	Poveli	0	Masc
Nakon razvoda s Bradom Pittom , tvrdi Arquette , Jennifer Aniston se nije micala iz njihove kuće , a navodno je s njima provodila vikende i praznike .	provodila	23	Fem
Arheolozi , aktivisti za zaštitu životnog okoliša i međunarodne nevladine udruge udružuju snage kako bi pokušali pronaći način za spašavanje arheološke lokacije stare 1.800 godina , koja bi trebala biti potopljena u studenom ove godine vodom s nove brane .	pokušali	15	Masc
Index.hr komentirao je fotomontažom smrskanog Audija u kojem su poginuli Silvester Sabolčki , Kristijan Kitner i Krunoslav Sabolić , te Audijeva oglasa .	komentirao	1	Masc
No , kad je uvidjela da akupunktura nije nikakvo istočnjačko čudo i da Kinezi tom metodom uspješno liječe mnoge zdravstvene tegobe , uvjerila se u njenu svrsishodnost .	uvidjela	4	Fem
U rezoluciji koju je usvojila na svojem dvodnevnom saboru u Rimu , EPP je pozvala glavnog tajnika UN-a Kofija Annana na " nastavak svoje inicijative za postizanje rješenja prihvatljivog za sve zajednice na Cipru " .	usvojila	4	Fem
Zagrepčanin Nikola Žinić od djetinjstva je crtao stripove i oslikavao , kako kaže , sve legalne i ilegalne površine , a studirao je arhitekturu i nakon toga dizajn .	studirao	21	Masc
Tvrtka povezana sa suosnivačem Microsofta , Paulom Allenom , podigla je tužbu protiv 11 velikih tvrtki zbog kršenja njezinih patenata .	podigla	9	Fem
Dakle , slično kao u Amsterdamu , kada su Mandžukić i Tadić , poslije i Mikić pritiskali i izbezumili Stama i Van der Wiela .	izbezumili	18	Masc
Nikada . " - glasio je tekst .	glasio	4	Masc
Izjavio je Dnevnom avazu kako je " jedini zemljovid BiH kojeg priznaje onaj s RS-om te teritorijalnim i političkim kapacitetom koje posjeduje .	Izjavio	0	Masc
Preživjeli smo , pružili 25 eura , uspjeli smo se tek izvući iz jednog automobila , za ruku su nas uhvatile dvije djevojke i htjele odvući u drugi .	htjele	24	Fem
Najpoznatiji makedonski redatelj Milčo Mančevski započeo je rad na svojem trećem igranom filmu " Kosti " .	započeo	5	Masc
Srpski vaterpolisti pobijedili su u četvrtak Sjedinjene Američke Države s rezultatom 4 - 2 , u susretu s malo zgoditaka kojim je dominirala obrana .	pobijedili	2	Masc
Mirjana Marinković iz Pridvorja kaže da su joj vukovi uzeli psa koji je bio pred kućom i odnijeli do škole koju pohađaju djeca od prvog do četvrtog razreda .	uzeli	9	Masc
" Naprosto su otvorili teretni prostor i prosuli sve .	prosuli	7	Masc
Nakon razvoda s Bradom Pittom , tvrdi Arquette , Jennifer Aniston se nije micala iz njihove kuće , a navodno je s njima provodila vikende i praznike .	micala	13	Fem
Ili da je Worf provalio : I told you so .	provalio	4	Masc
Treći Pride u Splitu najavljen je ovaj tjedan na konferenciji za medije na koji su organizatori predstavili novu LGBT udrugu Rišpet kao i najavili da će se Pride u Splitu održati 8. lipnja 2013. godine .	predstavili	16	Masc
U oštroj su konkurenciji dokazali da je kvaliteta nadvladala kvantitetu .	nadvladala	8	Fem
Do tada su se na ovom piscu odgojile tri generacije čitalaca .	odgojile	7	Fem
S tugom i bolom javljamo rodbini i prijateljima da je nakon duge i teške bolesti u 72. godini života preminula naša dobra , plemenita i jedina majka , baka i prabaka	preminula	19	Fem
Novac se nije ni djelomično preusmjerio u ekonomski opravdana kapitalna ulaganja .	preusmjerio	5	Masc
Turski pisac Orhan Pamuk primio je Nobelovu nagradu za književnost na ceremoniji koja je u ponedjeljak ( 11. prosinac ) održana u Stockholmu , a kojoj je nazočilo 1.600 gostiju i švedska kraljevska obitelj .	nazočilo	27	Masc
Četiri godine nakon što je Fondacija Rockefeller lansirala masovno financiranje protu-fertilitetnih vakcina , Akcijska skupina formirana je pod kontrolom WHO-a , WB-a i UN-ovog Populacijskog fonda .	lansirala	7	Fem
Labavo organizirana skupina -- čiji članovi dolaze iz šireg političkog spektra Srbije -- nije ranije surađivala i očito se konkretno okupila kako bi se suprotstavila članstvu u NATO-u .	suprotstavila	24	Fem
Posljednji međunarodni napori na okončanju podjele Cipra završeni su neuspjehom u travnju 2004. godine , kada su ciparski Grci velikom većinom odbacili Annanov plan za rješenje ciparskog pitanja , dok ga je većina ciparskih Turaka prihvatila .	odbacili	21	Masc
Simbolično sam uzeo Hajdukov moto , jer kada sam vidio naslov tribine razljutio sam se .	uzeo	2	Masc
Tijekom burne rasprave o njezinu imenovanju 12. siječnja , Jeleva je optužena od strane socijalističkih i liberalnih članova EP-a u Odboru za razvitak kako je krivotvorila svoju izjavu o financijskim interesima .	krivotvorila	25	Fem
Tako bi se sutradan znalo da je riba s odrezanim repom jučerašnja .	znalo	4	Neut
Kao rezultat toga došlo je do odgode početka redovitog prometa .	došlo	3	Neut
Vrištala je na njega , vrijeđala ga , gađala ga odjećom a on je stajao i šutio .	Vrištala	0	Fem
Meteorolog Duško Kraljev kazao je da palo 9 litara kiše po metru četvornom , što je vrlo zadovoljavajuće .	palo	6	Masc
Još nisam došao do toga da mi nedostaje inspiracije pa da je tražim .	došao	2	Masc
Premda je , kao i svako dijete , voljela igru i priče , ovakvi su se trenutci upisali duboko u dušu njezinoga bića .	voljela	8	Fem
Tri dana ranije oko 300 lokalnih srpskih prosvjednika silom je zauzelo zgradu .	zauzelo	10	Neut
Od ukupno 526 zastupnika koji su nazočili glasovanju o paketu izmjena , 514 je glasovalo za njihovo usvajanje .	nazočili	6	Masc
" Koliko god iznenađujuće bilo , balkanska regija jedna je od najsigurnijih u Europi " , napisao je u izvješću izvršni ravnatelj UNODC-a Antonio Maria Costa .	napisao	16	Masc
Veleposlanici su također posjetili Malu Krušu , gdje su srpske trupe 1999. godine ubile 116 albanskih muškaraca .	ubile	13	Fem
Tom : Kada smo napisali prvu pjesmu bili smo sigurni da će biti na albumu .	napisali	4	Masc
Izaslanstvo Vijeća sigurnosti UN-a otputovalo je s Kosova u subotu ( 28. travanj ) , nakon dvodnevne misije utvrđivanja činjenica .	otputovalo	4	Neut
Istovremeno pristigle su 433 prijave , od kojih se 307 odnosi na primarni jaslički i vrtićki program .	pristigle	1	Fem
Ministar je istaknuo da treba definirati razvojnu strategiju i jasno odrediti što je čija zadaća , a razvojne agencije umrežiti kako bi se lakše razmijenila iskustva i što bolje došlo do pristupnih fondova .	došlo	29	Neut
Nitko tko je ozbiljno bolestan neće se liječiti samo alternativnom medicinom , ali opasnost je u tome što ponekad pacijent dolazi prekasno , a moglo se još djelovati dok je on primjenjivao neku alternativnu metodu , kaže dr. Vrhovac .	primjenjivao	31	Masc
Poluotok i danas , kako kaže Perinović , jedva živi , odumire , a da ga se kojim slučajem odsiječe od ostatka grada , stvari bi se drastično pogoršale .	pogoršale	28	Fem
Iako su članice Saveza priznale kako je Makedonija ispunila preduvjete za članstvo , problem oko imena ostaje zaprekom .	priznale	4	Fem
Nestali su i ježinci .	Nestali	0	Masc
Mnoge mlađe žene same odlaze na Zapad kako bi prehranile obitelj i tako djeca odrastaju bez majki .	prehranile	9	Fem
Iako su te brojke još uvijek daleko iza vodećeg HP-a koji drži 24,3 % tržišta i Della s udjelom od 23,1 % , obje tvrtke su ostvarile približno jednake isporuke kao i prošle godine .	ostvarile	26	Fem
Također , osvrnuli smo se na aktualne jezične promjene koje su uslijedile u nazivima dvaju hrvatskih ministarstava ...	osvrnuli	2	Masc
Kao i ostala dva konkurenta , koristi Android operativni sustav , a teži 220 grama .	ostala	2	Neut
Budući da je vijest izazvala nemalo uznemirenje u javnosti , njemački Savezni kriminalistički ured ( BKA ) se požurio opovrći ju .	požurio	18	Masc
Skupinu koja je radila na tom dokumentu predvodio je sveučilišni profesor Kimet Fetahu , pripadnik makedonske manjine u Albaniji , koji je također organizirao okrugle stolove s predstavnicima različitih manjina .	predvodio	7	Masc
Dragovoljci su u petak održali spontani prosvjed upozorenja u dvorištu iza Bogoslovnog fakulteta jer su iznimno nezadovoljni odlukom Zagrebačke nadbiskupije koja je zemljište iznajmila baš Bienenfeldu .	održali	4	Masc
Osim njih , dobrom raspoloženju pridonijele su i članice klape Lucerne , pod vodstvom gospođe Zdenke Knapić .	pridonijele	5	Fem
No što bi moglo tu cjelinu uvećati i odakle bi ona došla ?	došla	11	Fem
Pratili su se podaci od kolovoza 2008. do prosinca 2009. , a zaključak je da je zrak na razini prve kategorije te da nema posljedica po zdravlje ljudi .	Pratili	0	Masc
Ako je entropium tako jak da je već nastupilo oštećenje rožnice operiramo odmah bez obzira na starost životinje .	nastupilo	8	Neut
Zaokružujući niz gubitaka , hrvači grčko-rimskim stilom Seref Erogul i Seref Tutenk izgubili su u kategorijama do 66 kg i 74 kg , dok je boksač Bahram Muzaffer izgubio u kategoriji do 81 kg .	izgubio	28	Masc
Godinu ranije poslovao je s dobiti od 2,73 milijarde dolara .	poslovao	2	Masc
UN-ov tribunal za ratne zločine proglasio je u srijedu krivim bivšeg kosovskog ministra kulture i njegova pomoćnika za nepoštivanje suda jer su pokušali zastrašiti zaštićenog svjedoka na suđenju bivšem kosovskom premijeru Ramushu Haradinaju .	proglasio	5	Masc
Nisam računao da ću se , slanjem te poruke , preračunati .	računao	1	Masc
Medijska su izvješća taj čin dovodila u svezu s činjenicom da je već dugo bio teško bolestan .	dovodila	5	Fem
I vi ste zaslužile novoga psića koji će krenuti s nama u novu Bijelu Kuću .	zaslužile	3	Fem
Surađivao je u praizvedbama suvremenih njemačkih kompozitora , te održao niz koncerata solo i u suradnji sa violinistom Istvanom Kurutzom u Njemačkoj , Švedskoj , Nizozemskoj , Italiji i Švicarskoj .	Surađivao	0	Masc
Verzija izvješća koja je procurila našla je svoj put do medija , a vlada je priopćila još prije nekoliko mjeseci kako će izvješće biti pozitivno .	našla	5	Fem
Da je Ivo Sanader ukrao 100 kuna prijavio bih to " , izjavio je Milinović danas na izvanrednoj konferenciji za novinare u Ministarstvu zdravstva i socijalne skrbi .	prijavio	7	Masc
- Ne dopustite da Vlada svojim mjerama mora štititi vaš ugled i dignitet i ne očekujte da će u eskalaciji nezadovoljstva koje je među građanima nastalo zbog uskraćene zdravstvene zaštite , oni naći razumijevanja za liječnike .	nastalo	25	Neut
Prošle godine Vlašić je osvojila zlatno odličje na svjetskom prvenstvu u skoku u vis na otvorenom koje je održano u Osaki .	osvojila	4	Fem
Fenomen administrativnih reformi započeo je 1992. godine , kada je pad komunizma otvorio put novom pluralističkom demokratskom sustavu sličnom onima na Zapadu .	otvorio	12	Masc
" Srbija bi nove kredite od EU i MMF-a trebala iskoristiti za ulaganja u tvrtke koje će se usredotočiti na izvoz , ili barem zamijeniti uvoz te tako novac zadržati u zemlji " , rekao je Ćulibrk .	trebala	9	Fem
Složili su se kako bi brzo potpisivanje Sporazuma o stabilizaciji i priključenju između Srbije i EU bilo u najboljem interesu sviju .	Složili	0	Masc
Cijene i nisu podigle toliko prašine , koliko novi način odvoza koji se tek počeo primjenjivati .	podigle	3	Fem
U ovogodišnjoj radionici sudjelovalo je 49 slikara iz devet zemalja .	sudjelovalo	3	Neut
Petra Maroja manekenka je i glumica koju smo gledali u sapunici Sve će biti dobro u ulozi novinarke Kristine Kovač te u reality showu Farma .	gledali	8	Masc
Passy je također govorio o još tri konferencije koje se planiraju ove godine .	govorio	3	Masc
Kao drugo , mandat ključnih međunarodnih institucija trebao bi biti dovoljno fleksibilan kako bi mogao služiti različitim ciljevima u različito vrijeme , i u svakom slučaju morao bi biti snažan od samog početka .	morao	26	Masc
Druga rumunjska gimnastičarka , Sandra Raluca Izbasa , osvojila je srebrno odličje u vježbi na gredi i brončano u višeboju .	osvojila	8	Fem
Lobotomizirala sam ja .	Lobotomizirala	0	Fem
Učenica 11-tog razreda Američkog sveučilišta u Sofiji osvojila je prvu nagradu na bugarskom Državnom natjecanju za mlade znanstvene talente .	osvojila	7	Fem
Andy se osim radioamaterizmom bavio i CB-om .	bavio	4	Masc
Iako imam putovnicu , sada sam sretan jer sam se uvijek bojao da ću je izgubiti ili takvo što .	bojao	11	Masc
Poraz od Argentine označio je kraj jedne ere , budući da je trener Otto Rehhagel najavio svoj dugo očekivani odlazak iz reprezentacije , koju je trenirao posljednjih devet godina .	najavio	15	Masc
Pola boda manje od domaćina sakupili su hrvači zagrebačke Like , dok je treće mjesto pripalo hrvačima Vrbovca .	pripalo	15	Neut
Međutim , u protekle tri godine došlo je do porasta nacionalističke retorike koju koriste čelnici triju vodećih etničkih zajednica zemlje u sklopu svojih svađa oko niza pitanja .	došlo	6	Neut
No i njih je iznenadila krajnje nepovoljna situacija : oko Isusa se okupilo toliko svijeta da nije bilo moguće doći u njegovu blizinu .	okupilo	12	Neut
Pokrenuta prije više od godinu dana , kroz platformu 3D Secure već je prošlo 4 milijuna dolara u transakcijama , čime je Rumunjska postala pionir u jugoistočnoj Europi .	postala	23	Fem
Kazna medijskom mogulu obnovila raspravu u Makedoniji	obnovila	3	Fem
Iako su crvenim tepihom u zagrebačkoj Dubravi prošetali svi preostali stanari , prvi je to ipak učinio Modni mačak , odnosno Marko Grubnić koji je osvojio najmanje simpatija gledatelja .	prošetali	7	Masc
Među prvom petoricom na četvrtom mjestu je BlackBerry s podrškom 12 % razvijatelja , te Windows Mobile koji je odabralo 6 % ispitanih razvijatelja .	odabralo	19	Neut
Srbija je tek deveta zemlja u Europi koja je usvojila zakon protiv mobinga , iako je u nekim europskim zemljama to pitanje regulirano ostalim propisima .	usvojila	9	Fem
Liječnik ulazi u stožer policije i ministarstvo unutarnjih poslova u Ateni nakon što je bomba tamo usmrtila jednu osobu u četvrtak , 24. lipnja .	usmrtila	16	Fem
Jandroković je rekao da je , tijekom razgovora s Rehnom , " posebno istaknuo spremnost Hrvatske da učini sve što je u njezinoj moći kako bi ispunila kriterije za punopravno članstvo i postala članica EU 2010 " .	postala	32	Fem
Dok su zauzimali zgradu , strgali su ploču UNMIK-a s fasade i uklonili zastavu UN , zamijenivši je zastavom Srbije .	uklonili	12	Masc
Joso svaki dan prošeta do obale ; voli ljude , pristojan je pa susjedu kaže ' Oprostite ako smetam ' - ali on bi malo popričao .	popričao	25	Masc
Natjecateljska komisija HNS-a načinila je prijedlog sudionika pet trećih liga	načinila	3	Fem
Mnogi istaknuti članovi napustili su stranku .	napustili	3	Masc
Korupcija ubija Kosovo , kaže Naim Rrustemi iz Saveza za budućnost Kosova ( AAK ) , ukazujući kako je to pitanje EK " spomenula 46 puta " .	spomenula	23	Fem
Kao drugo , mandat ključnih međunarodnih institucija trebao bi biti dovoljno fleksibilan kako bi mogao služiti različitim ciljevima u različito vrijeme , i u svakom slučaju morao bi biti snažan od samog početka .	mogao	14	Masc
Događanje , izvorno pokrenuto pod okriljem studentskog protestnog pokreta protiv Miloševićevog režima , tradicionalno je služilo kao forum za privlačenje pozornosti na ozbiljna socijalna pitanja .	služilo	15	Neut
Čelnici 26-članog Saveza pozdravili su prijenos ovlasti u Iraku s koalicijskih snaga predvođenih Sjedinjenim Državama na lokalne vlasti , koji je obavljen u ponedjeljak , dva dana prije nego što je bilo planirano .	pozdravili	3	Masc
SETimes : Srbija je pozvala na dijalog o stanju na graničnim prijelazima na sjeveru .	pozvala	4	Fem
U finalnom susretu Varaždinci su sinoć za sat vremena igre pobijedili momčad Centrometala iz Črečana 3:00 , po setovima 25:17:00 , 25:19:00 i 25:15:00 .	pobijedili	10	Masc
Rusija je odbacila sve prethodne verzije koje su u proteklih nekoliko tjedana izradili Sjedinjene Države i njihovi europski saveznici .	odbacila	2	Fem
Leonardo Benevolo , poznati povjesničar arhitekture i urbanizma , jednom je dobro zapazio : » La machina urbanisticha gira su se stessa « stroj urbanističke discipline vrti se sam od sebe .	zapazio	12	Masc
Jednostavno , neću crtati drvo , nešto što je Bog napravio savršeno , nego ću nacrtati nešto što ja vidim , a što možda netko drugi ne vidi pa da zajedno proširimo svoju percepciju .	napravio	10	Masc
Iako je Stefanović pokušao predstaviti sporazume kao nešto što će unaprijediti života kosovskih Srba , oporba ga je oštro optužila za ugrožavanje državnih interesa .	optužila	19	Fem
Prije nekoliko dana također je liječnici koja pomaže unesrećenima rekao kako bi on volio ' da mu daje usta na usta ' , te je poručio ljudima koji su ostali bez domova ' neka to shvate kao kampiranje ' .	poručio	25	Masc
No , najviše je na ovoj manifestaciji bio prisutan iz poštovanja prema velikom autoru i velikom prijatelju , s kojim se najčešće družio u Baškoj vodi .	družio	22	Masc
Zvezdan Jovanović , zamjenik zapovjednika JSO-a , uhićen je nekoliko dana nakon ubojstva i kako je izvješteno priznao je kako je on ispalio metak koji je ubio Đinđića .	priznao	17	Masc
Međunarodna pomoć , posebice od EU , olakšala je poslijeratni oporavak regije , dok je proces izgradnje čvršćih veza s Unijom otvorio granice i umanjio primamljivost krijumčarenja .	olakšala	7	Fem
Peder nikad , nikad , nikad ne bi otišao u krevet s muškarcem .	otišao	8	Masc
Akupunktura se već tada primjenjivala kod polovice čovječanstva : u Sovjetskom Savezu , Aziji i Australiji , a do danas se njezina popularnost proširila i na Europu i Ameriku .	primjenjivala	4	Fem
Iako su više od polovice činile vanjske transakcije privučene manjim dažbinama , postoji velika nada za budućnost .	činile	5	Fem
Prijava Crne Gore za članstvo službeno je odobrena na 119. zasjedanju glavne skupštine MOO-a u Guatemala Cityu , nakon što je Crna Gora proglasila neovisnost prošle godine .	proglasila	23	Fem
Imali smo 20 godina u prosjeku , volje , slobode i mašte kao u priči , samo mi je prazna kutija pizze falila i imali bismo idealan scenarij za gigantski doseg filmske industrije kao Rocco sreće Jennu .	falila	22	Fem
U vrijednost vlastite bioenergije Violeta Butina uvjerila se kad je u proljeće 2000. sama oboljela od mioma .	uvjerila	6	Fem
Iz straha , Karajevi roditelji nisu slavili rođendan svojeg sina skoro šest godina , budući je bila tabu tema izražavati bilo što drugo toga dana osim poštovanja prema umrlom diktatoru .	slavili	6	Masc
OHR je također smijenio nekoliko moćnih osoba iz razdoblja rata , utirući put reformama .	smijenio	3	Masc
" To je cipela nezadovoljnih građana koji su glasali za Srpsku radikalnu stranku i koji bi postupili jednako kao i ja " , rekla je Pop-Lazić nakon što je bila prinuđena napustiti parlament s jednom cipelom .	rekla	23	Fem
Prva je Sea Containers Limited , tvrtka sa sjedištem na Bermudima , koja se bavila prodajom i iznajmljivanjem kontejnera te je imala u vlasništvu više luka u kojima je obavljala lučke djelatnosti .	imala	21	Fem
Zajedno s helenizacijom Istoka tekla je i orijentalizacija helenizma .	tekla	4	Fem
" Moja ideja jest uključiti obje strane u proces konzultacija , da vidim imaju li neke nove ideje " , izjavio je u srijedu Ahtisaari , a prenijela tiskovna agencija AP .	prenijela	27	Fem
U Europi sam promjenio već osam momčadi i svaki puta sam se morao prilagođavati na nove suigrače .	promjenio	3	Masc
Rumunjska tenisačica Raluca Olaru osvojila je u nedjelju , 14. lipnja , teniski ATP turnir u Marseilleu , Francuska , izvijestili su rumunjski mediji .	osvojila	4	Fem
Trajao je 100 dana i označio početak kraja za Miloševića .	Trajao	0	Masc
Srpska učenica Vesna Stojaković iz Novog Sada kvalificirala se u polufinale natjecanja za najbolju fotografiju koje organizira Google .	kvalificirala	7	Fem
Nakon uspješno odrađene dvije utakmice iz kojih je Hrvatska izašla sa maksimalnim učinkom slijedi susret protiv Norveške .	izašla	9	Fem
Svake godine u ovo doba godine sjećamo se velikog čovjeka koji nas je prerano napustio , a ja sam uvjeren da ćemo i dogodine evocirati uspomenu na Zlatka na ovaj način .	sjećamo	6	Masc
Pojavila se u tri oblika : bubonska , plućna i septisemična .	Pojavila	0	Fem
Snimka pokazuje predsjednika koji se naginje s pozornice s koje je držao govor u gradu Ploiesti tokom kampanje na lokalnim izborima prije pet godina , nastojeći čuti ženu koja je zatražila pomoć .	držao	11	Masc
R klasa nije imala lak zadatak .	imala	3	Fem
" Umjesto da otpad bacaju 25-30 km od obale , barže su ga iskrcavale ovdje uz obalu " , rekao je krajem rujna za SETimes Angel Kishev , 80-godišnji ribar iz grada Chernomoretsa .	iskrcavale	13	Fem
Američki trandseteri proglasili su to jednom od najboljih ideja u svijetu mode i ljepote u 2006. godini , a ubrzo je uvršten u poklon pakete , koji su se uzvanicima dijelili na zabavi uoči Oscara .	dijelili	30	Masc
Nisko grmlje i šiblje grebalo mu je lice , ali nije ga moglo zaustaviti , tako da se , u samo par sekundi , našao uz rub asfalta .	grebalo	4	Neut
Samo su 2005. godine , kada su na natjecanju IF u Njemačkoj prezentirali 12 radova , dobili 11 nagrada .	prezentirali	12	Masc
Iako se isprva bavio samo manualnom terapijom , tj. masažom , nakon nekog vremena ponajviše kroz svoju praksu Kaliničenko je spoznao da bol nije dovoljno samo potisnuti jer je ona upozorenje kako čovjek kao cjelina nije skladan .	spoznao	20	Masc
" Imali su mogućnost pristupa oružju , uključujući osobno oružje i puškomitraljeze , ili određene rakete zemlja-zrak , koje su iznimno opasne " , izjavio je de Kerchove .	Imali	1	Masc
Neki drugi , u strahu od prvomajskih prosvjeda , zbrisali su preko granice .	zbrisali	9	Masc
Oko 3.000 članova i pristaša nazočilo je skupu Velike koalicije .	nazočilo	5	Masc
Prema Reutersu , novim nacrtom predviđeno je 120 dana pregovora između Beograda i Prištine , nakon čega bi Vijeće sigurnosti preuzelo pitanje u svoje ruke .	preuzelo	20	Neut
Preskočila je 203 cm .	Preskočila	0	Fem
Također , molimo građane da vozila ostavljaju na za tu namjenu označenim parkiralištima , kako bi se spriječile prometne gužve i zastoji , kažu iz Grada .	spriječile	17	Fem
Setimes : Posjetili ste makedonske vojnike koji čuvaju mir u Iraku .	Posjetili	2	Masc
Postala sam psihički stabilna i sposobna boriti se s nedaćama , a to je upravo ono što mi je trebalo , ispričala je Nacionalovim novinarima Jadranka R. .	ispričala	21	Fem
Prije ju je skrivao tvoj pisaći stol , ali ispod staklenog stolića sad se previše vidi .	skrivao	3	Masc
" Nema smisla stati ovdje i kazati ' Svi prethodni nesporazumi su nestali . ' Nisu nestali " , izjavio je britanski premijer Tony Blair .	nestali	12	Masc
Bilo je " nepravedno " to što zemlja nije dobila poziv za članstvo u NATO-u zbog grčkog veta , dodao je .	dobila	9	Fem
Potvrđujući zeleno svjetlo , Vijeće je također pozvalo Zagreb da nastavi s potrebnim promjenama .	pozvalo	7	Neut
Iako se proračunska potrošnja stavlja pod nadzor i cijene nafte stabiliziraju , vlada je malo učinila na hvatanju u koštac sa još jednim inflatornim čimbenikom : monopolizmom .	učinila	15	Fem
Gledali smo sa strane jednu plavušu u ultrakratkoj minici .	Gledali	0	Masc
Ja sam počeo svirati violinu na početku samo za tri pjesme , ali onda sam ostao samo ja i Tom , svi ostali su otišli iz benda .	otišli	24	Masc
Prije više godina mislilo se kako će simptome koji se otklone hipnozom zamijeniti neki drugi .	mislilo	3	Neut
Iako se oni za koje se vjeruje kako su izravno umiješani u ubojstvo nalaze iza rešetaka , istražitelji još uvijek trebaju utvrditi tko je zapovjedio i financirao zavjeru .	financirao	26	Masc
To izručenje , kao i slamanje organiziranog kriminala , koje je on inicirao , razljutilo je nacionaliste lojalne bivšem režimu .	razljutilo	14	Neut
Kao ravnateljica za životni okoliš u razdoblju 2000 - 2004 , vodila je pripreme za prvu strategiju Banke za životni okoliš i nadzirala proračun od 11 milijardi dolara za ekološke zajmove .	vodila	11	Fem
