Bývalá světová jednička tenisového žebříčku Švéd Mats Wilander má syna .	Mats	6	Sing
V kontrastu s barvami hýřícími a pohledy zákazníků přitahujícími stánky se krčila expozice Vitany Byšice .	Byšice	14	Plur
Dohoda , již podepsali náměstci ministrů zahraničí Ekvádoru a Peru Marcelo Fernández de Córdoba a Eduardo Ponce , stvrzuje příměří , které začátkem týdne jednostranně vyhlásilo Peru a které Ekvádor v úterý přijal .	Marcelo	10	Sing
V Liběnicích v ovčárně zdržoval se taky raráš .	Liběnicích	1	Plur
Viktoria Žižkov by ráda vyzkoušela Pohár UEFA	Viktoria	0	Sing
Budovy poté i nadále patřily n . p . SPN , ale 40 miliónů už podnik dlužil Taliánovi , který požadoval okamžité splacení této částky .	Taliánovi	17	Sing
S okamžitou platností VV SFŽ pozastavil činnost Petru Nogolovi v komisi delegátů svazu a v disciplinární komisi SFŽ , udělil důtku sekretáři SFŽ Josefu Dziadkovi za nevhodné vystupování na akcích Asociace fotbalových rozhodčích SFŽ .	Dziadkovi	24	Sing
Švédům zkomplikovalo situaci zranění antukového specialisty Gustafssona , místo něho nastoupí Larsson .	Švédům	0	Plur
Přestože Pixies předznamenali módní vlnu grunge , a tudíž hudební jazyk počátku let devadesátých , rozhodl se Black Francis minulý rok v lednu svou kapelu po vydání čtyř úspěšných alb rozpustit a věnovat se výhradně sólové tvorbě .	Pixies	1	Plur
Za výzvu , aby se Maďaři omluvili Židům , zažaloval premiéra Gyulu Horna Áron Mónus , nechvalně známý sepsáním a vydáním fašistického spisku .	Horna	12	Sing
Ředitelka Úřadu práce v Praze 7 Olga Nálevková přitom upozorňuje , že ztráty Drutěvy jsou ještě mnohem vyšší , než počítá vyhláška .	Nálevková	7	Sing
Před Palácem kultury si to rozdali Jugoslávci s Ukrajinci a výsledkem jejich konfliktu byl jeden pobodaný , dva postřelení a tři zadržení .	Jugoslávci	6	Plur
Po návratu z Betisu Sevilla , který za něho Vítkovicím nezaplatil ani korunu z dohodnutých šesti miliónů korun , začal hrát v Baníku .	Vítkovicím	9	Plur
Televizní seriál MĚSTEČKO TWIN PEAKS na nás od poloviny září minulého roku doléhal skoro každý pátek .	PEAKS	4	Plur
Zároveň byla vyhlášena nejsympatičtější žena podle mínění čtenářů časopisu Květy , kterou se s výrazným náskokem 600 bodů stala 31 letá Zdenka Jelínská z Karlových Varů , povoláním učitelka .	Varů	25	Plur
Proíránská Organizace islámské svaté války ( Džihád ) mezitím v telefonickém rozhovoru s agenturou AFP v Bejrútu oznámila , že nalezené ostatky jsou Williama Buckleyho .	Bejrútu	16	Sing
Jedna skupina vojáků zajede dnes odpoledne do Lidic , některé další se budou věnovat prohlídce Prahy .	Lidic	7	Plur
Prohlásil to maďarský ministr bez portfeje , pověřený dozorem nad maďarskými tajnými službami , Tibor Füzes .	Füzes	15	Sing
Peníze budou podle informací primáře MUDr . Petra Niederleho , který stojí v čele správního orgánu , použity na doplnění vybavení nemocnice na Homolce a dalších pražských ordinací .	Niederleho	8	Sing
Členy konsorcia jsou např . firma Kostelecké uzeniny , Agrofarm a Agrovysočina .	uzeniny	7	Plur
Jindřich Bělecký , Rokycany	Rokycany	3	Plur
Ve Strakonicích totiž jinak převažovaly pořady ( situované na hradní nádvoří ) typu pestrý kotel , a i když byly anoncovány pod různými názvy , šlo s drobnými variacemi prakticky o tytéž skládačky .	Strakonicích	1	Plur
Poněkud lepší situace je v Beskydech a Jeseníkách .	Beskydech	5	Plur
Revolver Revue - časopis pro literaturu a výtvarné umění , č . 22 ( Jáchym Topol ) , objednávky : Bolzanova 7 , Praha 1 )	Jáchym	14	Sing
Zesílenou hlídkovou činnost státních hranic se Saskem zahájila Pohraniční policie .	Saskem	6	Sing
Sály byly někdy velmi dlouhé , i padesátimetrové , ale poměrně úzké , poněvadž Asyřané nepoužívali středních podpor pro stropní překlady a místnosti uzavírali cihelnou klenbou o nevelkém rozpětí , zřídka větším než šest metrů .	Asyřané	14	Plur
Zařízeními firmy Honeywell jsou v ČR vybaveny kromě jiných společnosti Bohemia Glass Poděbrady , Chemopetrol Litvínov , Kaučuk Kralupy a Spolana Neratovice .	Neratovice	21	Plur
Jeruzalém / Káhira -	Jeruzalém	0	Sing
Velmi příjemným překvapením je herecký debut Petra Nárožného , takto konferenciéra Plavců , který v roli nápovědy povyšuje do zcela jiné roviny dřívější typ semaforských inspicientů .	Plavců	11	Plur
Den nato napsal Krčín Vilému z Rožmberka .	Vilému	4	Sing
Právě pro moderní koncepci zákona ČNR uvolnila holandská nadace FACE značné prostředky pro zalesnění Krkonoš .	Krkonoš	14	Plur
OKD Doprava bude provozovat asi pět tratí v ostravské aglomeraci , a to jak pro nákladní dopravu , tak i pro dopravu svých hnacích a služebních vozidel na těchto tratích .	OKD	0	Plur
Vedoucí jednotky MUDr . Václav Vobruba říká , že polovina dětí může dýchat jen díky plicnímu ventilátoru .	Vobruba	5	Sing
Agassi si samozřejmě poručil svou dávnou lásku Barbru Streisandovou , Michael Stich se otipoval na Crazy od Aerosmithů a Boris Becker navzdory pěvecké kariéře vlastní manželky chtěl hrát za zvuků Street Life od The Crusaders .	Aerosmithů	17	Plur
Zpráva potvrzuje " nejhorší očekávání Rakouska : jaderná elektrárna Dukovany , která je od roku 1985 v provozu , je zralá do šrotu , a proto je trvalým zdrojem nebezpečí pro rakouské obyvatelstvo " , uvádí News .	Dukovany	9	Plur
ŠVÉDOVÉ V USA BEZ ANTUKOVÉHO SPECIALISTY GUSTAFSSONA	ŠVÉDOVÉ	0	Plur
Z knihy Andrease Lommela , Pravěk a umění přírodních národů , s . 149 , Artia , Praha 1970	Andrease	2	Sing
Petr Hořejš , Kolín	Hořejš	1	Sing
Kvůli výměně tramvajových panelů v pražské Moskevské ulici ode dneška do 9 . 10 . večer dochází v oblasti Vinohrad a Vršovic ke změnám v tramvajové dopravě .	Vinohrad	19	Plur
Ale když je vám jich líto , proč vám není líto Alžběty ? "	Alžběty	11	Sing
V roce 1972 stáli v čele Němci Beckenbauer , G . Müller ( oba hráli za Bayern Mnichov ) a Netzer ( B . Mönchengladbach ) .	Beckenbauer	7	Sing
Tragikomickou miniaturu , čerta Omnimora v Drdových Hrátkách s čertem , ztvárnil ve filmu , na divadle i v rozhlase ( nastudování Josefa Bezdíčka z roku 1954 ) .	Omnimora	4	Sing
Při výhře v poháru v roce 1970 zdolala Chelsea tehdy vynikající Leeds United s Bremnerem , J . Charltonem , Lorimerem , Sprakerem , Copperem , Clarkem a manažerem Reviem .	Charltonem	18	Sing
Alžběta Pezoldová se současně soudní cestou domáhá vydání mnohamiliardového majetku hlubocké větve Schwarzenbergů , na který uplatnila nárok v lednu 1993 .	Schwarzenbergů	12	Plur
Jako ověření své hypotézy interpretuje McNeill výzkumy * Browna a * Bellugiové prováděné na dvou dětech osvojujících si angličtinu .	Browna	8	Sing
O něco menší obrázek téhož autora ( asi 40 x 30 ) , rovněž lesní motiv , stál ve stejné době ve starožitnictví Solidet na Vinohradech 12000 korun .	Solidet	23	Sing
Těmito slovy charakterizuje belgický farmář Marcel Gerin současnou situaci ve středoafrické Rwandě .	Gerin	6	Sing
Tento teoreticko - metodologický postup , rozpracovaný zvláště skupinou vedenou * Machoninem , sloužil k ospravedlnění revizionistické teze , podle níž třídy v naší společnosti přestaly existovat a vedoucí úloha dělnické třídy ztratila svůj význam .	Machoninem	11	Sing
Těchto metod však není mnoho , říká Tamara Svobodová a dodává : Zaměřujeme se na mechanismy protilátkové imunity .	Svobodová	8	Sing
V těch deskách je smlouva o přátelství a spolupráci mezi Kablem Kladno a závodem Podolská kabelovna Klementa Gottwalda , která byla podepsána loni v září v Podolsku u Moskvy .	Kablem	10	Sing
Vítězem mariášové olympiády v Kosicích na Královéhradecku se stal v sobotu Jiří Štefan z nedalekých Puchlovic .	Kosicích	4	Plur
Ještě v září , 24 . , uvidí Praha podruhé kapelu , která ji už jednou fascinovala - švýcarské Young Gods .	Gods	20	Plur
Starosta Košťan Jindřich Abrham : " Když odcházeli , řekli nám , že jsme vše podnikli protiprávně , že jsme jim způsobili škodu bráněním v podnikání a že celou věc předají právníkovi .	Košťan	1	Plur
Za účasti více než # členů se konala poprvé v nové klubovně oddílu Na Nivách .	Nivách	14	Plur
Předseda kontrolní a revizní komise ODS Richard Mandelík 29 . června 1993 prohlásil , že komise neobjevila nic , co by prokazovalo souvislost mezi činností Kováře a rozesíláním anonymních dopisů o Honajzrovi .	Mandelík	7	Sing
PŘI TRANSPORTU VLAKEM směřujícím do Společenství nezávislých států unikla v železniční stanici v Řikoníně ( okres Žďár nad Sázavou ) radioaktivní látka - chemický koncentrát uranu .	Řikoníně	13	Sing
Ladislav Polka připomněl , že fanouškové byli několikrát v maďarštině i slovenštině upozorněni , že se chystá zákrok a že tedy " ti slušní měli čas odejít " .	Polka	1	Sing
" Ale vždyť jste říkal , že jedete do Nízkých Tater ! " divila se dívka .	Tater	10	Plur
Na Správu silničního fondu přišlo 20 žádostí na výstavbu benzinové čerpací stanice podél pouhých 13 kilometrů dálnice mezi Mirošovicemi a Benešovem .	Mirošovicemi	18	Plur
" V Itálii se rozhoduje o budoucnosti našeho hokeje , " nechal se slyšet obránce mužstva André Malo , jeden ze zástupu naturalizovaných Kanaďanů , kteří přišli do Spojeného království z nižších zámořských soutěží .	Kanaďanů	23	Plur
Přestože starostové obcí Liblice a Čečelice na Mělnicku neuzavřeli se základní školou v Byšicích dohodu o zajištění povinné školní docházky , žádnému z přespolních žáků z těchto obcí nebylo 1 . 9 . bráněno vstoupit do školy .	Čečelice	5	Plur
Část kapitálu firmy by měla být nabídnuta Francouzům a zaměstnancům společnosti Renault , přičemž francouzský stát si na Renaultu v každém případě ponechá většinový podíl .	Francouzům	7	Plur
Usmyslel jsem si , že tohle divadlo je přesně to , co potřebujeme , a opravdu se nám nějak podařilo ukecat samotného E . F . Buriana , který nám je pronajal na šňůru pondělních představení .	Buriana	26	Sing
Prohlásil to v úterý venezuelský prezident Carlos Andres Perez v reakci na rozhodnutí Ekvádoru vystoupit z OPEC .	Ekvádoru	13	Sing
Velké chvály se naproti tomu dostalo v Diapasonu Dvořákově Armidě : Symfonickému orchestru a sboru Českého rozhlasu pod vzletným vedením Václava Jiráčka .	Diapasonu	7	Sing
" Benfika remizovala v tomto kole 1 : 1 s Penafielem , jehož nejlepším hráčem byl exhradecký brankář Musil .	Penafielem	10	Sing
JOZEFA CHOVANCE DÁL LÁKÁ TRENÉRSKÉ ŘEMESLO	JOZEFA	0	Sing
Rekordních čtyřiatřicet tisíc diváků si našlo včera cestu na brněnský stadión Za Lužánkami , kde fotbalisté Boby Brno hostili podzimního mistra , pražskou Slavii .	Lužánkami	12	Plur
Frank Sinatra právě slavil obrovský úspěch s hitem Strangers in the Night a Rolling Stones se potřetí dostali na první příčku v americké hitparádě s písní Paint in Black .	Stones	14	Plur
Žabčíkovci už na to přišli , našli si cestu , i když dá hodně starostí a hledání .	Žabčíkovci	0	Plur
Začíná hra na Veselé , Smolíky , Moravce , Schury , Melichovy , Oviony , Merckxe .	Smolíky	5	Plur
Evropský parlament proti JE Mochovce	Mochovce	4	Plur
Text publicisty Egona Lánského zveřejnil týdeník loni v březnu .	Egona	2	Sing
" Pro Brazilce je to obrovský šok , ztratili symbol národní hrdosti , " prohlásil Francův prezidentský předchůdce Jose Sarney .	Brazilce	2	Plur
ALENA NÁDVORNÍKOVÁ ( 1942 ) , historička výtvarného umění a " živá " surrealistka se narodila v Lipníku nad Bečvou , a třebaže je už řadu let spjata s Prahou , Olomouc je pro ni stále velmi důležitá .	Lipníku	17	Sing
Stavba německé části ropovodu z Ingolstadtu do Kralup nad Vltavou začne podle Wiesheua ještě letos .	Kralup	7	Plur
Smysl pro ironii nechtěně prokázal David Rikl , který si řekl o We Are The Champions od Queenů a prohrál dvakrát 2 : 6 .	Queenů	17	Plur
K ukončení několikaleté krize rukojmí zbývá propustit dva Němce , za něž jejich únosci požadují propuštění bratří Hamádíů , kteří jsou vězněni v Německu za vraždu , vzdušné pirátství a únos .	Hamádíů	17	Plur
Hospodářsko - provozní úsek převezme protokolárně objekt v Horních Počernicích od oddělení odvodnění , * Němec .	Počernicích	9	Plur
Na farmě u města Brits v západním Transvaalu byly nalezeny automatické zbraně , brokovnice a další typy zbraní .	Brits	4	Sing
V loňském roce dosáhl čistý zisk Canonu 211 miliónů USD , hodnota prodejů 18.3 miliardy USD .	Canonu	6	Sing
Proto bude v souboji s favorizovanými Australany chybět .	Australany	6	Plur
Vítězný čas Frankieho Frederickse z Namibie na 200 m ( 19.97 ) byl nejhodnotnějším výkonem pátečních soutěží .	Frankieho	2	Sing
Zážitků chtivé publikum ovšem s potěšením aplaudovalo i ruským jezdcům na Kamazech , kteří zaujali spíše drsným stylem jízdy a sem tam i poněkud krkolomnými kousky .	Kamazech	11	Plur
Pod vlivem francouzské revoluce vznikla v roce 1791 Society of United Irishmen ( Společnost sjednocených Irů ) s cílem dosáhnout národní nezávislosti a plné reformy zákonodárství .	Irů	15	Plur
Italská policie zatkla fanouška fotbalistů AC Milán Carla Giacominelliho , který je obviněn ze spoluúčasti na vraždě příznivce Janova Vincenza Spagnoly při utkání obou klubů 29 . ledna .	Spagnoly	20	Sing
Mluvčí německé Strany demokratického socialismu ( PDS ) Hanno Harnisch ( 42 ) byl v pátek odsouzen berlínským zemským soudem k pokutě 4800 marek a odnětí řidičského průkazu za jízdu pod vlivem alkoholu v ukradeném trabantu .	Harnisch	9	Sing
Country kolotoč Příšťpo 93 v přírodním amfiteátru Country Saloonu :	Příšťpo	2	Sing
K závažné dopravní nehodě , při které tři lidé zahynuli a jeden byl těžce zraněn , došlo ve středu na dálnici poblíž obce Koberovice na Pelhřimovsku .	Koberovice	23	Plur
" Snažíme se vyvážet co nejvíc , " prohlásil ředitel Kalinec .	Kalinec	10	Sing
Revue Literatura , vzniklá odštěpením od polofilozofických Problemů , má opravdu vynikající úroveň .	Problemů	7	Plur
Šermy a souboje měl na starosti Lucek Horálek , jehož skupina historického šermu Romantik v inscenaci rovněž účinkuje .	Horálek	7	Sing
Stíhání Minaříka začalo v roce 1991 .	Minaříka	1	Sing
Skončilo se také nekonečné čekání útočníků Krále a Smetáka , kteří včera večer definitivně odcestovali domů .	Smetáka	8	Sing
Pro zdravotně postižené děti obou škol navíc připravila firma Master foods k zahájení školního roku happening se sladkými dárky za 35000 Kčs .	foods	10	Plur
Dnes odjíždí automobilový závodník Antonín Charouz v barvách týmu Marlboro do Colorado Springs , aby zde poprvé trénoval na slavný závod do vrchu na Pikes Peak , jehož ostrý start bude 4 . 7 .	Springs	12	Sing
I to na sebe den před kvalifikačním zápasem prozradil nejpopulárnější fotbalista Faerských ostrovů , brankář JENS MARTIN KNUDSEN ( 25 ) .	KNUDSEN	17	Sing
Může se tedy stát , že Kamský překoná Ananda a bude hrát proti Kasparovovi poprvé .	Kasparovovi	13	Sing
V opačném případě dostane řidič cenu útěchy - tisíc korun , " vysvětlil šéf propagace Josef Prouza základní pravidla hry .	Prouza	16	Sing
Vítkovické železárny Klementa Gottwalda navštívil v pátek ministr zemědělství a výživy ČSSR * Večeřa .	Večeřa	13	Sing
Zejména v dnešní době , kdy se budou Ukrajinci držet volně směnitelných měn , pokud oficiální směnný kurz nadále poroste .	Ukrajinci	8	Plur
Nets chtějí pomoci nejschopnějším studentům k dosažení dobrých výsledků ve studiu i ve sportu .	Nets	0	Plur
Muzikantskou invenci však bratři Howardové ukazují ve všech skladbách .	Howardové	4	Plur
Prohlášení má písemnou formu a je podepsané Mandelíkem i Kovářem .	Mandelíkem	7	Sing
Nejdůležitějšími centry obchodu s diamanty jsou dnes belgické Antverpy , americký New York , anglický Londýn , izraelský Ramat Gan , indická Bombaj .	Gan	19	Sing
Pravděpodobně bude nutné přehodnotit i naše ledovcové sedimenty - morény údolních ledovců ve vrcholových partiích Krkonoš , Tater a dalších hor .	Tater	17	Plur
Nové kluby severoamerické NHL Tampa Bay Lightning a Ottawa Senators nabízejí podle přehledu hráčské asociace jedny z nejnižších platů v NHL .	Senators	9	Plur
Nejprve šlo o uznání tří kulturních komunit : nizozemské , francouzské a německé ve třech regionech Flandry , Valonsko a Brusel ;	Flandry	16	Plur
Tyto údaje se rozšiřují na disketách , v systému Eotel a ve Firemních kontaktech .	kontaktech	13	Plur
NSP Cheb pro léčebnu Harvey ve Františkových Lázních , FN Plzeň pro Konstantinovy Lázně , NSP Kolín pro léčebny Mír a Purkyně v Poděbradech , NSP Přerov pro léčebny Moravan a Bečvu v Teplicích nad Bečvou .	Bečvou	35	Sing
V roce 1993 figurovaly na kapitálovém trhu v této skupině prakticky jen akcie ČEZ a Elektrárny Opatovice .	Opatovice	16	Plur
A naopak ve čtyřech kvalifikačních zápasech ( ME 76 a MS 74 ) nedokázali Švýcaři ani jednou zdolat Turky .	Turky	18	Plur
Dr . Löw z Erlsfeldu jako hlavní znalec shledal , že kosti jsou všechny a že hmota , která vypadla z lebky , " podle své podoby , podstaty , cévnatosti , složení a červené barvy " je jazyk .	Erlsfeldu	4	Sing
Tak jsem byl z více stran informován o poradách špiček národních socialistů u Englišů , kde se promýšlela strategie a taktika .	Englišů	13	Plur
I když ve Flushing Meadows tentokrát nevytvořili tenisový pár životní partneři Medveděv a Huberová , soukromý svazek s Italem Massimem Valerim se rozhodla na kurtě otestovat argentinská kráska Sabatiniová .	Huberová	13	Sing
Pořádá Industriekontakte Janowsky , Homberg , SRN , informace Alfa + Omega , AG , P . O . BOX 94 , 142 00 Praha 411 , tel . / FAX : ( 02 ) 471 2374 .	Industriekontakte	1	Plur
A tam najednou objevil mezi jmény dvanácti zatčených Češek také jméno paní Formanové , té Formanové , pro kterou on , příslušník nadřazené rasy , kdysi pracoval jako polír .	Češek	8	Plur
Z trestného činu hanobení národa , rasy a přesvědčení se bude před soudem zodpovídat dělník družstevní drůbežárny v Lubech .	Lubech	18	Plur
Podle ředitele Institutu ekonomie České národní banky Jana Klacka dosáhl čistý kapitálový příliv do ČR v loňském roce 3.2 mld dolarů .	Klacka	8	Sing
Čestné Césary - prestižní filmová ocenění - převzali v Paříži americký herec Gregory Peck , francouzská herečka Jeanne Moreauová a americký režisér Steven Spielberg .	Césary	1	Plur
Guido Schmidt - Chiari , generální ředitel Creditanstalt , Vídeň	Chiari	3	Sing
Olympijský vítěz v desetiboji Robert Změlík se v minulých dnech nastěhoval se svou přítelkyní Andreou Sollárovou do nového bytu na sídlišti v Praze - Řepích .	Řepích	24	Plur
Úder přes Karpaty na Slovensko byl urychleně připraven ve velmi krátké době necelého týdne .	Karpaty	2	Plur
Syrský prezident Háfiz Asad odmítl jakékoli zlepšení vztahů s Izraelem , dokud z celého území Golan neodejdou izraelští vojáci .	Golan	15	Plur
Kucharčík , 51 .	Kucharčík	0	Sing
Scharpingovi se podařilo přesvědčit i svého rivala , předsedu dolnosaské vlády Gerharda Schrödera , aby se ucházel o resort hospodářství .	Scharpingovi	0	Sing
Tichý se věnuje především monumentálním tapisériím , z nichž vybíráme jednu z novějších - Poctu Shakespearovi ( 1990 - 1991 ) .	Shakespearovi	15	Sing
Litvínov bez Alinče a Kysely byl poněkud aktivnější , ale Cagašovi ve 24 . minutě pomohla tyč .	Alinče	2	Sing
Konstatovali to zástupci výrobců stavebních materiálů na firemním dni pořádaném obchodní organizací Staviva Brno .	Staviva	12	Plur
Ruská nákladní loď Progress M - 24 se včera spojila s orbitálním komplexem Mir .	Progress	3	Sing
MSFL - 10.15 : Karviná - Jihlava , NH Ostrava - Staré Město , Brno B - Přerov , Ostrava B - Poštorná , 17 : Ratíškovice - Dolní Benešov , Uničov - Slušovice , Kroměříž - Hranice .	Ratíškovice	26	Plur
Stálý dopisovatel na Blízkém východě Jehuda Lahav , Tel Aviv	Lahav	6	Sing
Jejich šťastnější druzi a mladá generace , Adygejci a Rusové , pracují společně v závodech a na polích , spolu se vzdělávají , řídí a vedou svou oblast .	Adygejci	7	Plur
Místostarosta městské části Praha - Modřany Vít Rázek se domnívá , že jakékoli jednání o případné integraci s jinými politickými stranami musí zachovat vlastní identitu KDS .	Modřany	5	Plur
Jemně a s vkusem zvýrazňuje nemnohé okamžiky , kdy tvrdou slupkou Strunové prostupuje alespoň na zlomek vteřiny třeba opravdové lidské pojetí .	Strunové	11	Sing
Lada Hesová , Jan Dražan	Dražan	4	Sing
Vedle nich v postupně přejmenovávaném souboru ( The Meggadeaths , Architectural Abbas , The Abbas , Tea Set a T - Set ) působili ještě Cliff Medcalf ( baskytara ) , Keith Noble a Julietta Galeová ( zpěv ) .	Meggadeaths	8	Plur
Žádný kout světa není bezpečný , " komentoval situaci generální tajemník IFJ Aidan White .	Aidan	12	Sing
Americká firma Falcon Products , Inc . koupila 51 procent nábytkářského podniku Miton Mimoň , a . s . , za která zaplatila 27.2 milionu korun .	Miton	12	Sing
Nové dnešní presbyterium je širší a značně delší než předcházející raně gotické z doby Přemysla # .	Přemysla	14	Sing
" Žil jsem v ústraní a ten mikrosvět mi vyhovoval , " řekl Hons .	Hons	13	Sing
Požár zničil na deset tisíc hektarů lesů západně od města Katovice .	Katovice	10	Plur
Teprve jeho nástupce , biskup Vojtěch z rodu Slavníkovců , osazuje v Čechách mužskou odnož benediktinů , nejprve v Kostelci nade Mží na Plzeňsku , potom v Břevnově , kde světí první kostel a uvádí sem mnichy z Kostelce .	Slavníkovců	8	Plur
V Calais jsme se dostali v takovém zařízení do podivuhodné společnosti mladých Arabů , Afričanů a hippies .	Afričanů	14	Plur
V téže době mění dělnické obyvatelstvo i ráz starých Holešovic .	Holešovic	9	Plur
Ve Zlatých časech rádia se vrací do dob , kdy rozhlas býval ještě králem , kdy vstupoval do domácnosti prostých Newyorčanů , ovlivňoval jejich životní styl .	Newyorčanů	20	Plur
Jörg Haider , vůdčí osobnost rakouské populistické pravice a obdivovatel ekonomického modelu " plné zaměstnanosti " , aplikovaného v Třetí říši , má obdobný názor .	Jörg	0	Sing
Po nekonečných měsících výslechů a psychického i fyzického mučení označili sami sebe za agenty CIA a doznali se k nejnemožnějším zločinům .	CIA	14	Sing
V posledních měsících italská policie zaregistrovala 124 prostitutek z Jugoslávie , Polek v těsném závěsu bylo 110 , Afričanek 77 , Kolumbijek 60 a dívek z Československa 58 .	Kolumbijek	21	Plur
Romario mi vysvětlil , že mým nejlepším startem v Evropě by byl Eindhoven .	Romario	0	Sing
Americký ministr obchodu Ronald H . Brown včera v Bruselu přivítal podpis americko - čínské dohody a prohlásil , že nyní , když je odvrácena hrozba obchodní války , budou USA směřovat k širokým obchodním vztahům s Čínou .	Ronald	3	Sing
Rothschild měl tehdy informaci o Wellingtonově vítězství o dvacet čtyři hodin dříve než britská vláda .	Rothschild	0	Sing
Lokalita Bradlo s hrádkem neznámého jména a neznámého založení leží na okraji stejnojmenného návrší v krajině na horním Labi mezi Dvorem Králové a Hostinným v katastru obce Mostek v okrese Trutnov .	Bradlo	1	Sing
U místních cestovních kanceláří je možno zakoupit výlety do Thessaloniki , Dionu , Athén , Delf apod .	Dionu	11	Sing
Prvním jeho rozsáhlým dílem byl návrh minipočítače JPR - 12 , vyráběného od roku 1974 Teslou Strašnice .	Strašnice	16	Plur
Vyplněnou přihlášku spolu s firemním profilem je třeba zaslat nejpozději do 15 . května 1994 na adresu agentury Phoeba .	Phoeba	18	Sing
Mezi vystavovateli byli i zástupci československých firem Jan Becher , Průmysl mléčné výživy Zábřeh na Moravě , Víno Mikulov , Budvar , Vitana Byšice , ústecká Fruta - Labena a Seliko .	Labena	28	Sing
Moskvané nastoupili oblečení spíše na fotbal než hokej .	Moskvané	0	Plur
Ve výstavbě dalších bytů se pokračuje a Klatované věnují výstavbě pozornost na svých procházkách .	Klatované	7	Plur
Také další dohoda , kterou uzavřel ZV ROH se ZV ROH ZPA Praha - Čakovice o pronajmutí rekreační chaty v Krkonoších , přináší zpestření života .	Čakovice	14	Plur
Z Wildeových knih jsou u nás dobře známy satira na gotické romány Cantervillské strašidlo a stevensonovské podobenství Obraz Doriana Graye .	Graye	19	Sing
[ Man hu ? ptali jsme se jako dávní Israelité : - co jest to ? ]	Israelité	9	Plur
Není vyloučeno , že by někteří jezdci v případě váhavého postoje FIA odmítli v Monaku startovat .	Monaku	14	Sing
Američané v Nebušicích	Nebušicích	2	Plur
