Platí to třeba o dopravou přetíženém středu Prahy , o středu Krkonoš , nějaké zahrady , dálnice , sálu , o středu skupiny diváků atp .	Krkonoš	11	Plur
Za Slovensko stačil v 17 . minutě kontrovat Cíger ( 1 : 2 ) , ale čtyři vteřiny před koncem třetiny zvýšil po Nedomově přihrávce na 3 : 1 Bělohlav .	Bělohlav	29	Sing
Oslabeným domácím ( dohrávali bez Vinopala ) však potom vzal naději na první bod dvěma góly Grussmann .	Grussmann	16	Sing
Holešovice , Bubny vznikly na katastrech dvou starých historických vsí , Buben a Holešovic .	Bubny	2	Plur
Odboráři upozorňují na současnou špatnou ekonomickou situaci rozhodujících podniků sdružených v Odborovém svazu KOVO na středním Slovensku , z nichž až 90 procent je ztrátových .	KOVO	13	Sing
Zalesňování z velké části hradí holandská nadace FACE , která v příštích dvaceti letech věnuje na záchranu Krkonoš téměř jednu miliardu korun .	Krkonoš	17	Plur
Zato jsem hrál skoro všechny Shakespeary , Říhala , Falstaffa , Capuleta , Klubka , mám to někde napsané , kdy , to zpaměti už nevím .	Shakespeary	5	Plur
Nejméně dva minometné granáty vybuchly v neděli večer v blízkosti kostela Sainte Famille , kde se skrývá více než 2000 uprchlíků převážně z menšinového kmene Tutsiů .	Tutsiů	25	Plur
Ministr vnitra by pak musel pro Přešovice vyhlásit nový termín voleb .	Přešovice	6	Plur
Vydává Mladá fronta , přeložila Marie Goldmannová a Eva Pátková .	Goldmannová	6	Sing
ČD zpracovaly podklady , podle nichž lze přesně stanovit současnou výši pronájmu v jednotlivých lokalitách v závislosti na jejich atraktivitě .	ČD	0	Plur
Veletrhy v Poznani organizují Miedzynarodowe targi Poznanskie , Glodowska 14 , 60 - 734 Poznaň , tel . : ( 4852 ) 692592 , telex : 413251 targ pl . Katowice	targi	5	Plur
Divadlo Za branou III , které počátkem letošního roku navázalo na práci divadelní scény vedené v paláci Adria režisérem Otomarem Krejčou , nemá dosud podle svých představitelů vyjasněny všechny majetkové vztahy s ministerstvem kultury .	Krejčou	20	Sing
Druhá nejvyšší suma ( 100 tisíc ) pomůže na světlo světa třetímu svazku Spisů Karla Teiga , jehož se nakonec ujalo další malé nakladatelství , pražská Aurora .	Teiga	15	Sing
Huler navrhl králi , aby odtrhl od pražské diecéze její západní díl a zřídil nové biskupství v Kladrubech u Stříbra .	Stříbra	19	Sing
Předseda okresního sdružení Miroslav Valenta jeho názor podpořil a uvedl , že " pro hladký průběh podnikání potřebujeme sociální smír " .	Valenta	4	Sing
Příběh Brita v iráckém zajetí	Brita	1	Sing
Z uveřejněných prací je známo , že se o zesilovač v pevné fázi řízený elektrickým polem zajímali již od začátku třicátých let našeho století profesor fyziky na universitě v Lipsku Julius Lilienfeld a Oskar Heil z Berlína .	Oskar	33	Sing
Samotný Důl Doubrava , těžící ročně 1.3 mil . tun černého koksovatelného uhlí , potřebuje letos zaměstnat asi 500 osob , dalších sedm dolů OKD pak přes 1000 osob .	OKD	24	Plur
Je to biologický problém , odpovídá Gottfried Mucha na otázku , kdy se podle něho přestane mluvit o různosti .	Gottfried	6	Sing
Samostatnou linii tvoří neustále se vracející turisté , hnaní z místa na místo svým ruským průvodcem Fedorem Balanovičem ( Jiří Klepl ) .	Fedorem	16	Sing
Z knihy Andrease Lommela , Pravěk a umění přírodních národů , s . 149 , Artia , Praha 1970	Artia	15	Sing
Jezdí - li například po hlavním tahu mezi Berounem a Rokycany podle úseků 9000 až 12000 vozidel denně , pohybuje se tu při obsazenosti vozidla jen dvěma lidmi 18000 až 24000 potenciálních zákazníků .	Rokycany	10	Plur
Byl jsem Vojnovičovou knihou okouzlen , řekl v neděli v Benátkách Menzel .	Benátkách	10	Plur
29 . 8 . mimořádná valná hromada a . s . Bioma Dřevohostice	Dřevohostice	12	Plur
Kromě instruktorů ( Jan Jehlík , Duncan McCorquodale , Ulrike Passe , Petr Pelčák , Katerina Ruedi ) jsou letos přizváni hosté , například Karel Hubáček , Vlado Milunič , Jiří Ševčík .	Hubáček	25	Sing
Jednou z nejdražších lodí na mistrovství světa je sjezdová debl kanoe , na níž Slováci Vladimír Vala , někdejší Čech , který se ve Zvolenu oženil , a Jaroslav Slúčik vyhráli stříbrnou medaili ve sjezdu .	Slúčik	29	Sing
Walesané mají opět šanci překvapit , ovšem jak Němci , tak Bulhaři budou zřejmě nad jejich síly .	Walesané	0	Plur
Renaulty jsou navíc velice odolná auta .	Renaulty	0	Plur
Toto Zákampí píšu se značným zpožděním jako odpověď na dopis , který mi kdysi poslal pan Josef Eger z Karlových Var .	Var	20	Plur
Je jako Benátky uměleckým dílem sama o sobě , ne tím , co uchovávají její muzea .	Benátky	2	Plur
Přesto je však nepovažuji za díla " vydaná po listopadu 89 " , protože byla vydaná v češtině již dříve , ať již v torontském ' 69 Publishers manželů Škvoreckých anebo v Petlici .	Publishers	27	Plur
Do obtížnější situace se dostal černý v partii Kremeněcký - Minasjan , hrané v Rusku v roce 1992 .	Kremeněcký	8	Sing
Její čtvrtfinálová soupeřka Francouzka Pierceová se přiživuje na popularitě excentrických bratrů Jensenů	Jensenů	11	Plur
Boca Juniors - Sao Paulo 1 : 0 .	Juniors	1	Plur
Zjistila jsem , že se tam dost hlučně baví kuchař Aleš s pomocnicí Blankou .	Blankou	13	Sing
SETKÁNÍ NA KANČÍ LOUCE s požehnáním Monitoru uskutečnily trampské skupiny Příboj , Ozvěna , Rowers , Karabina , Tramp Evergreen Band a Kamelot .	Rowers	14	Plur
Byl jsem totiž v letech 1981 - 1989 příslušníkem útvaru Sboru nápravné výchovy v Libkovicích , a to jako učitel ve Školském vzdělávacím středisku .	Libkovicích	14	Plur
Pikantní detail v celé záležitosti je , že třinácti až čtrnáctiletí chlapci si dům v Košťanech teprve upravovali .	Košťanech	15	Plur
RÁDIO HÁDY BRNO - 93.1 MHz	HÁDY	1	Plur
Roy Walford , lékař Biosféry tedy není znepokojen , ovšem tato hladová dieta nebyla součástí experimentování .	Walford	1	Sing
Sousedi si stěžovali , ale dnes už je stavba před dokončením , říká K . Veselá a dodává , že problémy s úřady a se sousedy má momentálně například i F . Ringo Čech , který staví v Modřanech .	Modřanech	38	Plur
Protesty sice působí efektně , ale Brazilce by jistě mnohem více potěšilo , kdyby jim prezident vysvětlil , odkud pocházejí finanční prostředky , s jejichž pomocí udržoval vysoký životní standard pro sebe i svou rodinu .	Brazilce	6	Plur
Jistě , porovnáme asi neporovnatelné , ale jak jinak vyjádřit uznání a obdiv takovým Brunclíkům , Židům , Čížkům , Králům a mnoha jiným .	Čížkům	18	Plur
K tomu množí # tisíc venkovních azalek , materiál původem též z Průhonic , vřesy ve # odrůdách získali z Litomyšle a množí jich přes # tisíc .	Litomyšle	20	Sing
Zajímavé bude sledovat , zda Slavia udrží stoprocentní bilanci i v zápase s Č . Budějovicemi a jestli Bohemians v Liberci ukončí šňůru porážek .	Budějovicemi	15	Plur
Minulý měsíc doporučila Mostecká uhelná společnost všem velkým producentům tepla a elektrické energie , aby vyzkoušeli spalování jejího uhlí ve fluidních kotlích francouzské firmy Groupe Charbonnages de France .	Charbonnages	25	Plur
Firma Société Européenne des Propulsions , tvůrce raket Ariane , podepsala už 33 kontraktů s výzkumnými středisky Ruska , Ukrajiny a Kazachstánu a chystá dalších 5 smluv o spolupráci při vývoji nadzvukových letadel .	Propulsions	4	Plur
Japonský soubor Nipponia z Tokia se přizpůsobil letošnímu brněnskému heslu Proměny hudby našeho věku a předvedl na rozdíl od vystoupení v Praze jen hudbu novou .	Nipponia	2	Sing
červen 1965 : Waters přivedl do skupiny svého spolužáka ze střední školy Syda Barretta .	Syda	12	Sing
Privatizační fond Creditanstalt , do něhož vložilo kupóny asi 220000 DIKů , připravuje vydání akcií v průběhu srpna .	Creditanstalt	2	Sing
Zástupce levice poslanec ČSSD Jozef Wagner odmítl snahy podsouvat automaticky celé levici vizi deficitního rozpočtu .	Wagner	5	Sing
Čížkovu bombu vyrazil brankář Malty před sebe , Onderka našel Lokvence , a ten skóroval .	Onderka	8	Sing
" Tvrdošíjná snaha Izraelců revidovat každý bod uzavřených dohod svědčí o tom , že jsme ve slepé uličce , " dodal Abid Rabbú , podle něhož nezbývá než jednání zastavit .	Izraelců	3	Plur
Pak mě pozvali do fabriky , do Jawy , kterou koupil pan Raskon Irany .	Jawy	7	Sing
Farma Popovice Státního statku Polerady měla vcelku stejné výsledky jako obě družstva .	Polerady	4	Plur
K nedělnímu obědu pozvali včera do lánského zámku manželé Havlovi premiéra Václava Klause s chotí Livií .	Livií	15	Sing
Podniky Glass TV Components , IF AlFA - Invest nebo Investa patří zároveň v RM - Systému k nejlevnějším .	Components	3	Plur
OKD Doprava bude druhým soukromým železničním dopravcem	OKD	0	Plur
V LN z 20 . 12 . je rozhovor s poslancem FS Stanislavem Devátým o interpelacích , s nimiž se poslanec Devátý spolu s poslanci Vidimem , Pospíšilem a Petrovou obrátili na ministra zahraničí J . Dientsbiera .	Vidimem	25	Plur
V Časopise houbařů , o kterém přineseme * , jsou i články z Čelákovic a okolí .	Čelákovic	13	Plur
Zelená perlička Zdeňku Galuškovi	Zdeňku	2	Sing
Mařas nás mezi dvěma šluky seznámil se svými nekompromisními názory na lidi , kteří chodí kouřit do cizích kanceláří , aby sami neseděli v čoudu .	Mařas	0	Sing
Za oněch deset tisíciletí postupně vzniklo a zase zaniklo mnoho vyspělých kultur a mocných říší , počínaje Sumery , Babylóňany a Asyřany přes egyptské tisícileté říše , Řeky a Římany až po středověké evropské civilizace .	Řeky	27	Plur
Právě tehdy uviděl poprvé Peter Jenner v londýnském klubu Marquee hrát Syda Barretta , Rogera Waterse , Nicka Masona a Richarda Wrighta .	Barretta	12	Sing
Interpelovat vládu , aby vysvětlila rozhodnutí o útlumu těžby v povrchovém hnědouhelném dole Chabařovice , budou poslanci LSU .	Chabařovice	13	Plur
V 2.05 hod . odjíždí do Nymburka osobní vlak se zastávkami v Čelákovicích , Lysé nad Labem a Kostomlatech nad Labem .	Čelákovicích	12	Plur
Daniel se tak v polovině sezony vrátil do Kaufbeurenu , kde se v kabině neostýchá mluvit česky .	Kaufbeurenu	8	Sing
Zajímá mě , v jakém časovém sledu se funkcionáři ministerstva obrany o případu dozvěděli a jak na něj reagovali vůči svým nadřízeným , vůči Bártovi a vůči veřejnosti , uvedl Šuman .	Bártovi	24	Sing
Na Casio s Mascou aneb Zlaté české ruce	Casio	1	Sing
Místostarosta městské části Praha - Modřany Vít Rázek se domnívá , že jakékoli jednání o případné integraci s jinými politickými stranami musí zachovat vlastní identitu KDS .	Rázek	7	Sing
Paul Johnson : DĚJINY 20 . STOLETÍ ( Praha , Rozmluvy , 1991 , překl . Jan Čulík )	Čulík	17	Sing
V bývalých lázních Šternberk na Kladensku stojí za sebou několik domů , které hostily Palackého , Jungmana , Elišku Krásnohorskou a Miroslava Tyrše .	Šternberk	3	Sing
Č . Budějovicím budou chybět potrestané opory středové řady Poborský a Povišer .	Budějovicím	2	Plur
Před půl rokem řešily úřady případ z Letňan , kde si jeden občan rozestavěl rodinný dům bez ohledu na předpisy .	Letňan	7	Plur
O dalších # let později tuto zemi ovládli Peršané .	Peršané	8	Plur
Uvádí se výčet vesnic se starobylými názvy jako Dojetřice , Radvanice , Bělokozy , Pyskocely , Mrchojedy , které doplňují majetek kláštera a zároveň ukazují svým názvem na to , že jsou původem starší než sám klášter .	Pyskocely	14	Plur
Litotryptorem začali pod dozorem zástupců z Výzkumného ústavu zdravotnické techniky MEDIPO Brno , který přístroj dodal , pracovat lékaři Městské nemocnice v Litoměřicích .	Litoměřicích	22	Plur
Podle ekvádorských zdrojů pokračovaly na sporném pomezí mezi oběma státy i včera šarvátky , a to navzdory příměří , které v úterý vyhlásili Peruánci a které Ekvádorci přijali .	Peruánci	23	Plur
" Ruský prezident připouští , že podobnou chybu udělal s Ruslanem Chasbulatovem , jenž loni na podzim spolu s Ruckým vedl vzpouru ruského parlamentu .	Chasbulatovem	11	Sing
Kubánci překročili minové pole	Kubánci	0	Plur
Jeruzalém se musí stát nefanatickou konfederací fanatiků .	Jeruzalém	0	Sing
Myšlení londýnských Timesů je pozoruhodně neevropské .	Timesů	2	Plur
V posledních letech jsou totiž velkokapacitní Boeingy využívány stále ve větší míře i armádami různých zemí .	Boeingy	6	Plur
Tedy Praha má své Plameny a Olomouc Ozvěny .	Plameny	4	Plur
Pan Březovský ihned propustil téměř celé hospodářské vedení , které se už na svá místa nikdy nevrátilo .	Březovský	1	Sing
Zloděj , který jedné noci odcizil z jednoho paláce v Benátkách vzácné koberce a porcelán , si místo činu obhlédl ve dne při normální turistické prohlídce , a jak se později zjistilo , ukryl se v rytířském brnění .	Benátkách	10	Plur
Narodil se v roce # v Českých Budějovicích a hned po ukončení studií na Vysoké škole chemickotechnologického inženýrství v Praze začal pracovat jako chemik cukrovaru v Židlochovicích .	Židlochovicích	26	Plur
Album bylo časopisem Sounds označeno za desku měsíce a Frank Black se na něm představuje dvaadvaceti písničkami , které nezapřou , kdo byl v Pixies vůdčí osobností .	Sounds	3	Plur
Jak ale připomněl poslanec Michal Lobkowicz , ve světě tyto instituce z 99 procent financuje stát .	Lobkowicz	5	Sing
Dalším příkladem opevněného sídla z téhož období je Týnec nad Sázavou , ležící nedaleko Chvojna na okraji výrazného návrší nad levým břehem Sázavy při staré cestě a brodu přes řeku .	Chvojna	14	Sing
Odjinud všechny opravy zasílejte na adresu , Elektro - Praga servis , Milotice nad Bečvou # .	Milotice	12	Plur
Komerční banka nabízí při nákupu akcií Energovodu ve svém Stock - Listu 1300 korun .	Energovodu	6	Sing
Takže na místě by byly , když už verše , tak asi nejspíše tyhle ze slavné básně Ludvíka Aškenazyho Křik : " Člověk se narodí , a hned / křičí .	Aškenazyho	18	Sing
Ve hře byl původně pouze projekt rodiny Petrofů , později však přišel se svým plánem i bývalý management státního podniku .	Petrofů	7	Plur
Režie : Stephen Surjik , scénář Mike Myers , Bonnie Turnerová , Terry Turner , kamera : Francis Kenny .	Kenny	18	Sing
Hudební divadlo Karlín uvádí dnes večer ( 19.00 ) premiéru klasické operety Franze Lehára Paganini v režii Oto Ševčíka a v hudebním nastudování Miloše Formáčka .	Franze	12	Sing
Podrobnější informace o technice tohoto umístění však zatím nemáme , " dodal Jiří Škaloud .	Škaloud	13	Sing
Ani jeho kolegové - kazašský palubní inženýr Talgat Musabajev a kosmonaut - výzkumník doktor Valerij Poljakov neměli s lety do vesmíru žádné zkušenosti .	Poljakov	15	Sing
Jaroslav Kučera ze společnosti Prag International , jež poskytuje mezinárodnímu projektu český štáb , dokonce připustil , že se uvažuje o náhradním ubytování pro ty , kdo si budou přát zcela klidný spánek .	Prag	4	Plur
Začíná hra na Veselé , Smolíky , Moravce , Schury , Melichovy , Oviony , Merckxe .	Melichovy	11	Plur
Také firma Belinda by asi na tramvajích snesla nápis Belinda dělá krásné nohy místo Belinda macht Beine .	Belinda	2	Sing
Ročně přepravíme asi dva miliony pasažérů a dosahujeme obrat kolem jedné miliardy marek , říká Chaim Mansfeld ( na snímku ) , generální ředitel El Al pro Rakousko , ČR , SR a Maďarsko .	Chaim	15	Sing
Namísto ministra obrany generála Gračova se dostavil jen náčelník generálního štábu M . Kolesnikov a namísto očekávaných statisíců Moskvanů přišlo své vojáky uvítat jen dva a půl tisíce lidí .	Moskvanů	18	Plur
" Když se cla sníží , tak v nejnižších kategoriích jsme schopni nabídnout levnější vozy než má Škodovka , " řekl tajemník SDA Zdeněk Lněnička .	Lněnička	24	Sing
Jejich kajakářské disciplíny oplývají desítkami vynikajících soupeřů a je také pravděpodobné , že při svém profesionálním přístupu k závodění i k životosprávě jim chybí trochu víc uvolněnosti , kterou naopak oplývá Pollert .	Pollert	31	Sing
Vzájemnou spolupráci uvedených tří součástí hypnózy si představují Kleinsorge a Klumbies schematicky takto .	Kleinsorge	8	Sing
Méně milovníků krkonošských hor však ví , že vychází pěkný časopis Krkonoše , který letos vstupuje již do šestého ročníku svého trvání .	Krkonoše	11	Plur
Hanáci budou mít problémy se sestavou , protože obránci Tejkl a Tomášek mají potíže s třísly , Eichennmann má po střetnutí s Jihlavou naražený stehenní sval a Zima onemocněl chřipkou .	Hanáci	0	Plur
Budou hrát v zdánlivě nezvyklém prostředí kostela Panny Marie na Slovanech .	Slovanech	10	Plur
Oblast Naran Bulag ( Zlatý sen ) v západní části kotliny Nemegt v jihozápadní Zaaltajské Gobi v Mongolsku , kde jako první paleontologická expedice působila v letech 1922 až 1929 výprava Amerického přírodovědeckého muzea	Nemegt	11	Sing
Mezi vystavujícími je např . Michal Cihlář , Michaela Pavlátová Michael Rittstein , Miroslav Rovenský , Joska Skalník a další .	Pavlátová	9	Sing
" Kupříkladu závod Ejpovice projevil zájem dokonce o 150 pracovníků , " uvedl Ladislav Vltavský .	Ejpovice	3	Plur
Podle vedoucího výroby Miloše Přiklopila má Seba rozpracovanou celou řadu zakázek .	Seba	6	Sing
V Londýně nastoupí Garri Kasparov proti Nigelu Shortovi , v dosud neurčeném nizozemském městě se střetnou Anatolij Karpov a Jan Timman .	Garri	3	Sing
Utkání hraje od svého založení na stadionu ve Stamford Bridge s kapacitou 36965 , z toho 28000 míst krytých ( původní kapacita 72000 ) .	Stamford	8	Sing
Zatímco v Chorvatsku a Slovinsku je benzín dostupný ( 15.90 Kč ) , v Bosně se sehnat nedá .	Slovinsku	4	Sing
Co snad bylo vůbec nejzajímavější , Smetanovci s Josefem Sukem dílo vůbec nezkoušeli .	Smetanovci	6	Plur
Na druhé straně se zahraničním podnikatelům rozhodně nevyplácí Japonce podceňovat a vystavovat se tak nebezpečí . . .	Japonce	8	Plur
Letos v anketě mimořádně uspěla CZ Bělehrad , vítěz PMEZ , která má v první desítce čtyři hráče : tři Jugoslávce ( Savičevič , Pančev , Prosinečki ) a jednoho Rumuna ( Belodedič ) .	Jugoslávce	20	Plur
Ctihodné londýnské Timesy z 23 . prosince použily osvědčenou metodu : nenaříkejte Britové , jinde je mnohem hůř .	Timesy	2	Plur
Jawa Divišov , výrobce závodních strojů na plochou dráhu , je na tom lépe , než její bývalá velká sestra z Týnce nad Sázavou .	Jawa	0	Sing
Tajná zpráva : Dukovany jsou velmi poruchové	Dukovany	3	Plur
Hlavním problémem Západočechů v podzimní části byla slabá gólová produktivita .	Západočechů	2	Plur
Drnovický místopředseda Gottvald se v rámci privatizace stal majitelem firmy Bioveta v Ivanovicích na Hané .	Ivanovicích	12	Plur
Zair se chce zbavit uprchlíků z Rwandy	Rwandy	6	Sing
Citlivá rekonstrukce architekta * Sokola odkryla klínová , na bocích prostě vyžlabená žebra vybíhající v širokých pásech z koutových přípor , jejichž tvar byl v podobě protáhlého klínu bez hlavic , takže docházelo k postupům .	Sokola	4	Sing
Týkalo se to hlavně tvrdých sýrů z Příšovic a výrobků soukromé mlékárny ve Frýdlantě .	Frýdlantě	13	Sing
Modernizovaná verze modelu Forman se má začít vyrábět počátkem příštího roku a první nové pick - upy budou sjíždět z pásů v závodě automobilky v Kvasinách od léta roku 1995 .	Kvasinách	25	Plur
Pomalu , věcně a přitom poutavě rekonstruuje Z . Smetánka krajinu , ve které žil , jeho sociální prostor , rozlohu obdělávaných polí .	Smetánka	9	Sing
Režie Aleny Vaňákové nepřekročila mez rutinního výkladu díla - možná také proto , že musela zápasit s nepřehlednou , ba zavádějící scénou Karla Zmrzlého .	Vaňákové	2	Sing
Další abonentní koncert cyklu Filharmonikové komorně patřil v úterý mezzosopranistce DAGMAR PECKOVÉ , violistovi KARLOVI ŠPELINOVI a klavíristovi JAROSLAVU ŠAROUNOVI .	ŠAROUNOVI	19	Sing
Od této vskutku převratné doby byly touhy a sny milionů Afričanů o úplné nezávislosti a ekonomickém rozvoji nahrazeny děsivými sociálně politickými a hospodářskými problémy .	Afričanů	10	Plur
Trenéři Vejnar a Řezáč se mají do konce týdne vyjádřit , zda za těchto podmínek ve funkcích setrvají .	Vejnar	1	Sing
Po čtyři následující neděle budou patřit dostihy Karlovým Varům .	Varům	8	Plur
Již ve 2 . minutě skóroval Stoičkov a i branky Beriguistaina a Sergiho padly v první půli .	Sergiho	12	Sing
Jinak řečeno , pomyslní motýli by se v adaptaci Salivarové novely zřejmě pohybovali reálnou jarní krajinou za mohutného doprovodu smyčců ;	Salivarové	9	Sing
Souboj slávisty Bejbla s jedním z Jihočechů sleduje rozhodčí Bohuněk	Jihočechů	6	Plur
Dvě branky vstřelil Argentinec Bisconti v dresu Marinos , Brazilec Leonardo dal svým gólem signál k výhře Kašimy nad Nagojou a svůj první gól v zemi vycházejícího slunce vstřelil Němec Buchwald .	Marinos	7	Plur
( Damiána sem nasadila komunistická tajná policie , což samozřejmě Povolný nemohl tušit , pozn . red . )	Damiána	1	Sing
Rezultát poroty , které letos předsedala Lia van Leerová z Izraele , vyzněl dost překvapivě .	Lia	6	Sing
Francouzský ministr vnitra a územního plánování Charles Pasqua nabídl v pondělí premiérovi Balladurovi svou demisi .	Balladurovi	12	Sing
Polákům , Maďarům , Rumunům , Ukrajincům a také Rusům dává najevo , že pro Čechy nejsou žádoucí jako partneři na cestě do západní Evropy .	Maďarům	2	Plur
Drobný spotřebitel kupuje prkna , fošny , hranoly , latě , lišty hranaté nebo profilované a desky z dřevitých hmot v prodejnách označených Stavebniny a Potřeby pro domácnost .	Stavebniny	23	Plur
Podle primářky Jechortové se lidé nechávají tetovat ve stavu euforie a během pár let , občas i měsíců si všechno rozmyslí .	Jechortové	2	Sing
Leo Jehne Eva Urbanová : Vado ma dove ?	Jehne	1	Sing
CD vydal : Clarton , 1994 .	Clarton	3	Sing
Nejvyšší podkoní Chetitů Kikuliš napsal mimo jiné přesný plán výcviku koně .	Chetitů	2	Plur
Vyráběli je rovnou u vodárny Na Poustce .	Poustce	6	Sing
Cenu za chemii získala Ivetta Bassaová za syntézu modrého " žužu " , cukrářského želé .	Ivetta	4	Sing
* # odešel Vach do Brna , vrcholný kult sborového zpěvu v Kroměříži značně slábl a zájem obecenstva se zvolna přesunoval k opeře a hudbě instrumentální .	Kroměříži	12	Sing
" Slušní lidé zaplatí , " domnívá se vedoucí sekce SCP Jaroslav Houštecký .	Houštecký	12	Sing
Ječmínek byl první v # kategorii před Orlovankou ZDŠ Orlová a před ZDŠ Uhřičice a Valáškem z Frenštátu .	Ječmínek	0	Sing
Ryszard Szurkowski je jedinečnou postavou světové cyklistiky a asi největší , jakou historie Závodu míru pamatuje .	Szurkowski	1	Sing
Automobilka v Mladé Boleslavi ve svých pobočných závodech ve Vrchlabí a v Kvasinách vyráběla také automobily Škoda Octavia Combi , vyrábí automobily s bezkapotovou karosérií v různých úpravách s označením Škoda Mikrobus , Dodávka , Sanita , Malý valník .	Kvasinách	12	Plur
Chadimová je obžalována z padělání veřejných listin a následného pokusu o podvodné vylákání nemovitého majetku .	Chadimová	0	Sing
Po sobotních bězích v jablonecké hale čekají opravy druholigového Drozdyho , který ještě není po dvou operacích achilovky a nezvládl Cooperův test .	Drozdyho	9	Sing
Ledovec vysoký 3100 metrů je součástí národního parku Gran Paradiso .	Paradiso	9	Sing
V nominaci jsou hráčky : Černá , Tarhaiová , Buchtová , Pospíšilová , Libánská , Ludmilová , Simonová , Koberová , Krbová , Hudáková , Majíčková , Romanová , Roubínková , Korandová , Čumplová .	Pospíšilová	11	Sing
V roce # má být uskutečněn francouzsko - sovětský pokus v Indickém oceánu , v Kerguelen Islands , s dvěma raketami .	Islands	16	Plur
Snad se jednou splní sen fanoušků sheffieldských Steelers a britští hokejisté se stanou novodobými Robiny Hoody a stadion v Sheffieldu bude mít stejnou proslulost jako nedaleký Sherwoodský hvozd .	Hoody	15	Plur
Němcům se podařilo vyrovnat těsně před koncem první třetiny , ale když Stavjaňa v 54 . minutě znovu strhl vedení na naši stranu , zdálo se , že se Bukač dočká i druhého triumfu .	Stavjaňa	12	Sing
JEŠTĚ O DIVOKÝCH KARTÁCH TENISTEK V KARLOVÝCH VARECH	VARECH	7	Plur
Jako velmi úspěšného průmyslového špiona uvádějí dějiny Alfréda Kruppa .	Kruppa	8	Sing
Přijedou tedy tradiční účastníci - postsovětské a postkomunistické země v čele s Ruskem , Polskem a Slovenskem , doplněné o Němce , Švýcary ( vede je bývalý trenér NDR Wolfram Lindner ) , Holanďany a Australany .	Holanďany	33	Plur
Štefan Mihálik zářil v dresu tehdy ještě druholigového Jablonce v předminulé sezoně .	Štefan	0	Sing
Z dopisu Josefa Vodičky , Stupice	Stupice	5	Plur
Hradec Králové : T . Poštulka - Havlíček - Pilný , Urbánek - Ulich , Džubara , Šmarda , Breda , Menčík ( 76 .	Šmarda	17	Sing
