Převedení projekčního střediska ČSSS Dešenice do Zemědělského stavebního podniku v Klatovech vzhledem k účelnosti odsouhlasila rada ONV v Klatovech .	Dešenice	4	Plur
Demonstrativním odchodem poslanců Ivana Maška ( ODA ) a Pavla Severy ( KDU - ČSL ) včera skončilo další jednání sedmičlenné parlamentní komise pro kontrolu Bezpečnostní a informační služby .	Severy	10	Sing
Vedoucímu KPÚ se ukládá vypracovat dekrety pro pracovníky s tím , že bude provedeno jejich přemístění k # do Michalovců .	Michalovců	19	Plur
Zámek zpět Paarům	Paarům	2	Plur
Problémy Davida Mellora propukly v červenci , kdy jeden z britských nedělníků odhalil ministrovu milostnou aféru s herečkou Antoniou de Sancha .	Mellora	2	Sing
Rocková skupina Rolling Stones absolvovala o víkendu v Johannesburgu své první dva koncerty na africkém kontinentě .	Stones	3	Plur
Oporou zadních řad by měl být reprezentant Antonín Stavjaňa ( na snímku ) , který po návratu ze Švédska pomáhal Vsetínu už loni v prolínací soutěži a podepsal smlouvu na 2 + 1 rok .	Stavjaňa	8	Sing
Nastaly časy Uralů , Minsků a příručních průbojníčků na děrnou pásku ;	Uralů	2	Plur
Josef Lux , Václav Klaus a předseda Českomoravského svazu zemědělských družstev Jan Fencl na včerejším setkání agrárníků	Fencl	12	Sing
Jako ověření své hypotézy interpretuje McNeill výzkumy * Browna a * Bellugiové prováděné na dvou dětech osvojujících si angličtinu .	McNeill	5	Sing
Nakoukla jsem zvědavě dovnitř a spatřila okatou Kateřinu , jak něco zapisuje do karty pacienta .	Kateřinu	7	Sing
V Jednotném zemědělském družstvu Řimice bylo letos # února ustaveno pět kolektivů soutěžících o titul * socialistické práce , a to tři v kravínech a dva v porodnách prasnic .	Řimice	4	Plur
Tentokrát však Bohumín na vlastním hřišti alespoň potrápil v severomoravském derby jednoho z favoritů celé soutěže Opavu , když do 85 . minuty s ní hrál nerozhodně .	Opavu	16	Sing
Kolem 11000 hostů může denně přijmout perla severního Jadranu Rabac .	Rabac	9	Sing
Největšími zakázkami Lucernafilmu byla smlouva s francouzským Gaumontem na 80 francouzských filmů , postupně k nim přibyly další z jiných evropských studií .	Lucernafilmu	2	Sing
Ke koncertu skupiny letos osmatřicetileté zpěvačky Siouxsie Sioux majitel agentury Mersey Pavel Tesař poznamenává : " Již tři roky poslouchám jediné brněnské rockové rádio Hády a vím , že nahrávky The Banshees představují jeden z pilířů vysílání .	Hády	24	Plur
Brno : M . Pařízek - Maléř - Křivánek - Zúbek - Kocman , Dostálek , Valnoha , Špinar , Soldán - Holomek , Cupák .	Holomek	22	Sing
Po úspěchu loňského setkání podnikatelů pořádalo koncem ledna Československé manažerské centrum ( CMC ) v Čelákovicích druhý ročník Podnikatelského fóra .	Čelákovicích	15	Plur
Celá historie Romů - Cikánů - v Evropě je nesporně historií násilí , bezpráví a smrti .	Cikánů	4	Plur
Agroslužby Kaplice 76 126	Kaplice	1	Plur
Na třítýdenní ozdravný pobyt do městečka Villach v rakouských Korutanech odjela včera skupina sedmdesáti dětí ze smogem ohrožených severočeských měst Most a Děčín .	Korutanech	9	Plur
Nebude - li vůle , nebudou peníze a bude to všechno daleko , daleko těžší a bude nebezpečí mnoha dalších Rwand .	Rwand	20	Plur
Během jara hrál tým zpravidla ve složení : Hedman - Sundgren , Mjällby , Jansson , Espmark - Nordin , Simpson , Borgqvist - Nergstrand , Hjelm .	Hjelm	26	Sing
Ve finálovém běhu na 60 metrů při mezistátním utkání ve Vídni zaklekli vedle sebe Angličan Lindford Christie , mistr světa a Evropy z letní stometrové trati , a český rekordman Jiří Valík z Olympu Praha .	Lindford	15	Sing
Ke stylu manželů Škvoreckých vždy patřilo nevzdávat se a bojovat za svou čest i kdyby to stálo bůhvíco .	Škvoreckých	3	Plur
Případ banditismu je pak hlášen z Kladenska .	Kladenska	6	Sing
Ale k těm Žabčíkovcům .	Žabčíkovcům	3	Plur
Mimo Máši ovšem .	Máši	1	Plur
Za jmény zemí a ostrovů , které nabízejí možnost zřízení zámořských podniků , si mnohdy my , Středoevropané , nedovedeme nic představit .	Středoevropané	17	Plur
Opět triumfovaly vozy Mitsubishi Pajero ( 1 . Weber , 2 . Saby ) , celkové vedení uhájil Lartigue ( Citroen ZX ) , který byl včera 3 . s odstupem 3 : 47 min za Weberem .	Citroen	20	Sing
Hradečtí se nyní vracejí na městský stadión v Malšovicích , kde naposledy hráli loni 11 . září proti Boby Brno .	Malšovicích	8	Plur
Byly tam z kamenů imitovány určité hřebeny hor s příslušným pojmenováním a navíc se tam s oblibou tehdy umísťovaly různé figuríny z keramiky , zvířátka , houby , hrady , Karkulky a podobně .	Karkulky	30	Plur
Ke střetu došlo poté , co asi 200 Albánců napadlo kamením policisty , kteří obklíčili budovu oficiálně nepovolené albánské univerzity .	Albánců	8	Plur
Nejpozději od # let pak na jihu Prahy vyrůstají další velká předměstí , Nusle , Vršovice , Košíře , Hlubočepy , na severu Prahy pak Břevnov a Bubeneč .	Hlubočepy	19	Plur
Katastrofa se odehrála takto : na zádi ponorky Komsomolec , která se 7 . dubna 1989 plavila jižně od Špicberků , vypukl požár .	Špicberků	19	Plur
Castrovi by mělo být jasné , že musí vzít seriózně situaci vlastního národa a provést reformu .	Castrovi	0	Sing
Na území Holešovic , Buben vytvořily se tedy v průběhu výstavby této čtvrti tři populačně , vzhledem k populaci dělnické , odlišné okrsky .	Holešovic	2	Plur
J . M . Harlin ( 1990 ) prováděl v Alabamě výzkum veřejného mínění týkajícího se skleníkového efektu .	Alabamě	10	Sing
Z domácích plošinářů pojede celá špička kromě zraněného Švába , který již byl převezen z Německa do nemocnice ve Střešovicích , a o účasti vyléčeného Jirouta se rozhodne podle jeho fyzické kondice , ale lékaři mu závodit ještě nedoporučují .	Střešovicích	19	Plur
Kamenem úrazu jsou však pasáže , jimiž Hladík zasazuje dějiny kláštera do širších souvislostí vývoje českého státu .	Hladík	7	Sing
Avantgardistická hříčka Mezihra a fantastická komedie Paříž spí zahájila včera přehlídku filmů Reného Claira , která se koná ve Francouzském institutu v Praze a potrvá do příštího pátku .	Reného	12	Sing
Finanční participace státu na jednotlivých projektech nepřesahuje podle Nekolného padesát procent , aby " nevznikl dojem jakési státní legitimity akce či projektu " .	Nekolného	8	Sing
Plán na zjednodušení německých daňových předpisů o 20 bodech zveřejnil včera německý ministr financí Theo Waigel .	Waigel	15	Sing
Optimalizací meziplanetárních drah s aplikací na lety Země , Venuše a Země , Mars se zabýval Gravier .	Gravier	16	Sing
Třiadvacet osob včera přišlo o život v Abcházii , když Abchazové sestřelili gruzínský vrtulník , který převážel uprchlíky .	Abchazové	10	Plur
Dá se tedy očekávat ještě větší vyhrocení vnitropolitických rozporů , a tím odpor Dánů proti Evropskému hospodářskému společenství .	Dánů	13	Plur
Z dojiček si v prvním čtvrtletí vedla nejlépe Hedvika Navarová , která nadojila průměrně # litru mléka od krávy za den .	Navarová	9	Sing
Izraelci jsou ještě stále nadšenými čtenáři , překlady nevyjímaje .	Izraelci	0	Plur
Veřejnou pochvalu obdržely Marie Musilová ze Studnic , Anna Franková z Komořan , Vlasta Kolaříková z Ivanovic , Jarmila Celá z Roštěnic , Eva Ravková z Vyškova , Marie Neckářová ze Zelené Hory , Dana Pořízková ze Studnic .	Ivanovic	16	Plur
Irsko , Portugalsko , Rakousko , Lichtenštejnsko , Lotyšsko .	Lichtenštejnsko	6	Sing
Zástavba volného katastru Holešovic pokračující na přelomu století , ale především od dvacátých let pak na rozdíl od Buben a Letné byla nadále určena dělnickým rodinám .	Holešovic	3	Plur
V průměrném utkání v East Rutherfordu zářil bostonský gólman Jon Casey , jenž kryl 34 z 35 přesných střel New Jersey .	Jon	9	Sing
Účastníci zájezdu pořádaného fotbalisty Boby Brno na nedělní ligové utkání do Trnavy obdrží zdarma klubovou vlajku v hodnotě 200 Kčs !	Trnavy	11	Sing
Husova zdánlivá podoba se promítá do soch Nepomukových , ne proto , aby jeden kult byl nahrazen druhým , ale protože v očích lidu oba Janové splývají .	Janové	25	Plur
Pátý markýz ze Salisbury trpěl prosopagnózií , neurologickou poruchou , při níž postižení nerozpoznávají tváře lidí , které dobře znají .	Salisbury	3	Sing
Naprosto jasně Boardman	Boardman	2	Sing
Je na něm založena jedna kapitola vynikající a slavné knihy Morrise Bermanna : The Reenchantment of the World , Bantam N . Y . 1984 , týkající se právě osobnosti Newtonovy ( cf . jablko ) . . . "	Morrise	10	Sing
O tom , jak probíhá privatizace nejen kuponová , Profit diskutoval s Tomášem Ježkem , předsedou Fondu národního majetku .	Ježkem	13	Sing
Evropský měnový systém je v troskách , Západoevropané nezastavili první válku na kontinentu od roku 1945 , neboť se nemohou dohodnout jak , neshodnou se ani na podobě budoucích vztahů s USA .	Západoevropané	7	Plur
Obyvatelé Kyjeva , Volgogradu a Jerevanu se seznámí s díly slovenských výtvarných umělců .	Volgogradu	3	Sing
Pracovníci ze ZD Volanice na Jičínsku se o nabídce vyjádřili velmi pochvalně .	Volanice	3	Plur
Nejen dnes , ale vždy v minulosti zněla slova Novohuťáků jako zvuk jejich oceli .	Novohuťáků	9	Plur
Připomíná v této souvislosti , že novým místopředsedou svazu se stal Jan Gottvald , donedávna předseda Drnovic .	Drnovic	16	Plur
Na obálce : Polychromované plastiky Eduarda Ovčáčka z let 1966 až 1973 ;	Ovčáčka	6	Sing
Kontakt : Nypro , velkoobchod hutním a stavebním materiálem , s . r . o . , 542 34 Malé Svatoňovice , tel . : ( 0439 ) 934321 - 3 , FAX : ( 0439 ) 934337 .	Svatoňovice	20	Plur
" Je možné , že lidé , kteří tuto chřipku loni prodělali , budou proti ní imunní , " míní Běla Tůmová .	Tůmová	21	Sing
V závěru třetiny z ojedinělého protiútoku dali Švýcaři branku , která pro čs . mužstvo jakoby nic neznamenala .	Švýcaři	7	Plur
V článku Čechem za tři boženky říká spisovatel Karel Pecka , že vláda překročila mez únosné tolerance vůči imigrantům a oblíbený slogan Romů , že Češi jsou nejblbější gádžové Evropy , je plně oprávněný .	gádžové	28	Plur
Za jednu z rozhodujících příčin přitom obzvlášť černí Jihoafričané považují slabý výkon policie .	Jihoafričané	8	Plur
Již od soboty se v dějišti zápasu připravuje dvojice Carl - Uwe Steeb a Patrik Kühnen , v neděli pak zahájil trénink rovněž Michael Stich .	Kühnen	15	Sing
Na tom , aby ve Šternberku ani v paláci Smiřických nevznikaly žádné příčky , trvají památkáři .	Smiřických	9	Plur
S výkonem Matthäuse ( Bayern ) proti Wattenscheidu byl spokojen i trenér německé reprezentace Vogts .	Wattenscheidu	7	Sing
V současné době mají Québečané samosprávu v oblasti kulturní , školské , sociální , zdravotní a ve využívání přírodních zdrojů .	Québečané	4	Plur
Se Švédy a Švýcary Island soutěžně ještě nehrál .	Švýcary	3	Plur
Almsicková s rekordem , do finále však výměnou	Almsicková	0	Sing
Polákům , Maďarům , Rumunům , Ukrajincům a také Rusům dává najevo , že pro Čechy nejsou žádoucí jako partneři na cestě do západní Evropy .	Polákům	0	Plur
Na další sankce této komise reagoval Dressler startem s anglickou licencí .	Dressler	6	Sing
VOJENSKÁ TECHNIKA byla nasazena na pomoc požárníkům , kteří se již několik dní potýkali s požárem v lesích u Katovic v Polsku .	Katovic	19	Plur
Například slovenské opoziční dokumenty adresované ministerskému předsedovi Istvánu Tiszovi , z nichž vychází najevo , že Slováci měli jasno v tom , že vytvoří s Maďary jedno státní společenství .	Maďary	25	Plur
Neznámý pachatel odcizil z louky ve Chvaleticích traktor Ostrowek s nakladačem a odjel s ním směrem ke vsi Kojice .	Chvaleticích	6	Plur
" Jazyk byl dán člověku proto , aby jej užíval surrealisticky , " napsal kdysi André Breton .	André	15	Sing
Podobá se Sancho Panzovi ten vychytralý rozum ve své slouhovské prohnanosti .	Panzovi	3	Sing
Článek uveřejnila Pravda a Izvestija na podzim roku # .	Izvestija	4	Plur
Případ začal před dvěma měsíci , kdy byla v severoitalském Comu zadržena zásilka uranu a zatčeno několik osob : dva Italové , dva Švýcaři , jeden Rakušan a jeden občan ČSFR .	Švýcaři	23	Plur
Mezi prvními , kdo vystrčil hlavu na chodbu , byl Kuka , který nahrál na tři góly Sieglovi .	Sieglovi	17	Sing
Jako třetí oblast bychom mohli uvést oblast Jeseníků .	Jeseníků	7	Plur
Jeho přítel a trenér Severočechů v jedné osobě Vlastimil Petržela však nechce o pohárových ambicích ani slyšet : " Neberu to vážně .	Severočechů	4	Plur
" Vyzývám zahraniční dárce a Světovou banku , aby konečně začali financovat běžné výdaje palestinské správy , která musí budovat nové hospodářství , " uvedl Kuráí na společné tiskové konferenci .	Kuráí	25	Sing
Současně s nimi Český spisovatel vydá také monografii Vladimíra Karfíka Jiří Kolář , která analyzuje umělcovu básnickou tvorbu .	Kolář	11	Sing
" Oberstdorf bude pro nás významný , protože tam se rozhodne , kdo bude český skok reprezentovat na MS v Thunder Bay , " řekl trenér Jiří Raška .	Oberstdorf	1	Sing
Nespokojeni s Gesamtmetallem , svazem zaměstnavatelů v kovoprůmyslu , jsou i podnikatelé jiných odvětví .	Gesamtmetallem	2	Sing
Tyto trati jsou zatím tři : ze Šumperka do Koutů nad Desnou v délce 19 kilometrů , tříkilometrová odbočka z Petrova nad Desnou do Sobotína a úzkorozchodná trať z Jindřichova Hradce do Nové Bystřice dlouhá 33 kilometrů .	Petrova	20	Sing
" Za větší bojovnost a výbornou hru bloků jsme si vítězství zasloužili , " řekl trenér vítězů Lenert .	Lenert	17	Sing
Nyní KMV , mj . výrobce Mattoniho kyselky , pokrývá potřeby tuzemského trhu z jedné třetiny .	KMV	1	Plur
Uvedl výstavbu velkokravínu pro # tisíc dojnic v Loučanech , jenž bude mít plně mechanizovaný provoz a nejvýkonnější technické parametry .	Loučanech	8	Plur
Pět výbuchů vytrhlo včera ze spánku obyvatele Atén .	Atén	7	Plur
Na podzim roku 1938 získal Hitler po mnichovském diktátu Sudety a všem bylo jasné , že je pouze otázkou času , kdy zhltne i zbytek osekaného Československa .	Sudety	9	Plur
Studentům prospěje svobodná kázeň , tvrdí Olga Sommerová	Sommerová	7	Sing
Vězení v Libkovicích - mýty a skutečnost	Libkovicích	2	Plur
S tímto titulkem jsme v Průboji publikovali dopis * Hegerové z Lovosic , která kritizovala , že čekárna pro matky s dětmi na lovosickém nádraží je neustále zavřena a klíč se vydává v kanceláři pouze na žádost .	Lovosic	11	Plur
Nejpozději od # let pak na jihu Prahy vyrůstají další velká předměstí , Nusle , Vršovice , Košíře , Hlubočepy , na severu Prahy pak Břevnov a Bubeneč .	Košíře	17	Plur
Obžaloba ji viní z toho , že padělala veřejné listiny , dále z pokusu o podvodné vylákání nemovitého majetku na Hradčanech a od řádu premonstrátů v Praze na Strahově v účetní ceně asi 43 miliónů korun .	Hradčanech	20	Plur
Dokazuje , jak stačí malá chyba , omyl a vzdělání je někdy málo platné ( záměna Pluto - Neptun ) .	Neptun	18	Sing
Z penalty se Šmejkal nezmýlil - 1 : 0 .	Šmejkal	3	Sing
Žižkov , Holešovice , Bubny a Libeň vykazují naopak horečný příliv obyvatelstva ještě v prvém desetiletí # století .	Bubny	4	Plur
Básník Adam Zagajewski a jeho hosté , Petr Král a překladatelka Daniela Lehárová , budou besedovat dnes v 18.30 v Polském kulturním středisku v Praze .	Adam	1	Sing
Sdělil to LN tiskový mluvčí pražského státního zastupitelství Slavomír Novák .	Slavomír	8	Sing
Americká strana bude také hradit výstavbu rodinných domků a školy pro americkou komunitu v Praze - Nebušicích .	Nebušicích	16	Plur
Energoatomizdat Moskva 1988	Energoatomizdat	0	Sing
Romatic je automatická elektrická pračka , která má plášť vyrobený z ocelového plechu povrchově chráněného vypalovacím lakem .	Romatic	0	Sing
Polákům , Maďarům , Rumunům , Ukrajincům a také Rusům dává najevo , že pro Čechy nejsou žádoucí jako partneři na cestě do západní Evropy .	Ukrajincům	6	Plur
Kandidáti z řad fundamentalistického hnutí Hizballáh a prosyrští politici se stali jasnými vítězi druhé etapy všeobecných voleb v Libanonu , které se v neděli konaly v libanonské metropoli Bejrútu a v horských oblastech , které ji obklopují .	Hizballáh	5	Sing
Navzdory televiznímu přenosu se na stadiónu Za Lužánkami čeká třicetitisícová návštěva , což by byl rekord samostatné české ligy .	Lužánkami	7	Plur
V Ostravě jsou už také Malťané , ale jejich cesta byla plná komplikací .	Malťané	5	Plur
Fangio mimo nebezpečí	Fangio	0	Sing
Bolen dravý 1988 9.80 88 Labe 9	Labe	5	Sing
Ale Miroslava Malecká jde dál .	Malecká	2	Sing
Další postup je zaměřen především pro závod Smidary , dále pak pro závod Zálabí .	Smidary	7	Plur
Technologie pro Vietnam	Vietnam	2	Sing
M . Bursík před časem kritizoval také smlouvu města s kanadskou hotelovou společností Four Seasons , která chce stavět na Alšově nábřeží u Karlova mostu .	Seasons	14	Plur
Tradice dělnického osídlení a generační stáří dělnického obyvatelstva na Smíchově , v Karlíně , v Libni , v Holešovicích , Bubnech , na Žižkově a ve Vysočanech není však stejná .	Bubnech	20	Plur
Polovina přístrojů bude sloužit ústavu pro postiženou mládež na Kociánce , zbývajících pět dostala základní škola pro nevidomé a slabozraké v Pisárkách .	Pisárkách	21	Plur
V pilotované kosmonautice je podepsána smlouva pouze s vysíláním francouzských astronautů k Miru .	Miru	12	Sing
Tým Mora Olomouc porazil v odvetě semifinále PMEZ ukrajinský klub Iskra Luhansk 3 : 2 , ovšem vzhledem k prohře 0 : 3 v prvním utkání byl vyřazen .	Luhansk	11	Sing
Ivo Žídek domýšlí , jde za hudební partituru a libreto , tvoří svou postavou , ať už je to tolikrát opakovaný Jeník anebo Michel v Juliettě či Manolio v Řeckých pašijích od Bohuslava Martinů .	Martinů	33	Plur
Veřejná soutěž na projekt hotelového komplexu kanadské společnosti Four Seasons na Alšově nábřeží v Praze na Starém Městě nedaleko Karlova mostu byla uzavřena 21 . listopadu 1994 .	Seasons	9	Plur
Podle tajné zprávy českého Státního úřadu pro jadernou bezpečnost , kterou se podařilo získat poslanci rakouských Zelených Rudolfu Anschoberovi , došlo v jaderné elektrárně Dukovany v jednom roce k 315 " větším a menším " poruchám .	Dukovany	24	Plur
Svůj nejvýkonnější server Prioris XL navrhla firma Digital s ohledem na bezpečnost dat v systému při vysokém výkonu stroje .	Prioris	3	Sing
Tato jména , která voní romantikou , mají však také něco společného s Hongkongem , Švýcarskem , Singapurem a Kyprem .	Hongkongem	13	Sing
Odešli : Šilhavý , Buryán ( oba hostování v Brandýse ) , Valkoun ( hostování v Xaverově ) , Pavlík ( bez angažmá ) , Zítka ( Havířov ) .	Buryán	4	Sing
Kontakt : Arxon , s . r . o . , Slezská 98 , 130 00 Praha 3 , tel . a FAX : ( 02 ) 251474 .	Arxon	2	Sing
Žaloba jej viní , že 6 . února nabídl Fergusonovi 100000 dolarů , jestliže jej nechá vyhrát .	Fergusonovi	9	Sing
Pracovníci Dopravního podniku se však obávají , že to bude právě pohoda prvních dnů rekonstrukce , co inspiruje Pražany , aby se přestali neuralgickému bodu vyhýbat .	Pražany	18	Plur
Bulharsko : Varna - zataženo 20 / 21 .	Varna	2	Sing
Firmě DBV Cycles za výrobu a prodej velké škály jízdních kol , hlavně dětských .	Cycles	2	Plur
Rabbáního síly začaly budovat nové obranné linie .	Rabbáního	0	Sing
Jeho penalta rozhodla o výhře Urawy nad Flugels 1 : 0 .	Flugels	7	Plur
Za oněch deset tisíciletí postupně vzniklo a zase zaniklo mnoho vyspělých kultur a mocných říší , počínaje Sumery , Babylóňany a Asyřany přes egyptské tisícileté říše , Řeky a Římany až po středověké evropské civilizace .	Asyřany	21	Plur
Odešli : Šilhavý , Buryán ( oba hostování v Brandýse ) , Valkoun ( hostování v Xaverově ) , Pavlík ( bez angažmá ) , Zítka ( Havířov ) .	Brandýse	9	Sing
Dodávky byly plněny v rámci Státního statku Polerady .	Polerady	7	Plur
Malťany jsem osobně hrát neviděl , ale podle mých informací mají vše postavené na obraně , zabetonují se před šestnáctkou a natahují čas .	Malťany	0	Plur
Jestli byl Eda někdy na zámku opravdu šťastný , pak jedině ve chvíli , kdy mu banda kluků močila na nohy .	Eda	2	Sing
Ten , bez věcné souvislosti , začíná zhodnocením dřívější publikační činnosti L . Vaculíka .	Vaculíka	13	Sing
Švejk tvrdí , že nejlepší je , je - li někdo přímo odněkud , a musím vám potvrdit , že není větší rozkoše , než být vlastním já , které mluví jen samo za sebe .	Švejk	0	Sing
Prostředí svérázných pařížských figurek plasticky dotvářejí také ostatní postavy , například Václav Dušek jako chlapácký Charles , Andrea Bogušovská jako Madla Nožka , připomínající oživlou panenku , a Vlastimil Čaněk jako veteránský švec Gridoux .	Madla	20	Sing
V čele tabulky se usadil Newcastle United , který porazil Southampton , a v prvních třech kolech zaznamenal 12 branek .	Southampton	10	Sing
V průměru vagon kulatiny denně zpracuje firma Nekima na stavební řezivo .	Nekima	7	Sing
Kubánci však přišli na nové slabé místo v železném plotě , který obhání jejich ostrov : jsou jím letadla ruské společnosti Aeroflot , která stále ještě létají jednou týdně z Moskvy na Kubu a zpět .	Aeroflot	21	Sing
Naděje žila přesně 45 minut čisté hry do okamžiku , kdy získal Villebon rozhodující 29 . bod .	Villebon	12	Sing
Pak už jen krátkou cestou po žluté a jste v Libošovicích , kde máte opět příležitost k občerstvení a vlak .	Libošovicích	10	Plur
Jako předkapela se na této obří diskotéce představí další technopopová formace 2 nd Nature , kterou doplní dva pražští předskokané - Technoboys a 2 Amigos .	Technoboys	21	Plur
Příbramskou lavičku už dříve musel opustit Michal Jelínek a Starého úvodní věta napovídá , proč se tak stalo .	Starého	9	Sing
Na českém trhu se prodejem tohoto zboží zatím zabývá pouze slovenská společnost Rios .	Rios	12	Sing
Před prázdninami vyšla v nakladatelství Galén kniha Děti , rodina a stres s podtitulem Vybrané kapitoly z prevence psychické zátěže u dětí .	Galén	5	Sing
Mám před sebou prospekt Okresního průmyslového podniku ve Vejprtech .	Vejprtech	8	Plur
V celé autonomní oblasti žije jen # Adygejců .	Adygejců	7	Plur
Během několika dnů se z Kájů , Fanoušů , Jeníčků , Jiříčků , Jaroušků stávají Karlové , Frantové , Vaškové , Honzové , Jirkové , Jardové .	Jiříčků	11	Plur
Můžete se zeptat Izraelců , ti to vědí , " dodal F . Šará .	Izraelců	3	Plur
První české soukromé nábytkářské učiliště otevřela ve středu v Koryčanech na Kroměřížsku společnost Koryna .	Koryčanech	9	Plur
Slavia má po úterním střetnutí se Zlínem zraněného brankáře Tótha a obránce Hořavu .	Hořavu	12	Sing
V případu vraždy anarchisty Zdeňka Čepely v Tanvaldu je podle představitele Českého anarchistického hnutí Jakuba Poláka spoluviníkem soudce Jan Kušnír .	Kušnír	19	Sing
Poslanec K . Ledvinka ( ODA ) řekl , že jeho klub souhlasí , aby byl zákon projednán .	Ledvinka	3	Sing
Na rychlé přemazávání před startem doplatil i sovětský běžec Tarakanov , zlatý z MS v Tatrách , který přišel na start o půl minuty později .	Tatrách	15	Plur
Za chvíli bude zahájena v místnosti tiskového střediska v Paláci sportu v Lužnikách konference , na které se má sejít na několik set zástupců tisku , rozhlasu a televize .	Lužnikách	12	Plur
Staronový předseda strany Peter Weiss porazil ziskem 131 hlasů z 245 svého hlavního protivníka Ľubomíra Fogaše hned v prvním kole .	Fogaše	15	Sing
Z našich skladatelů studií se tímto materiálem nejvíce zabývali Réti , Prokeš a Moravec .	Prokeš	11	Sing
Dobře zachytal Pejchar , vedle obránce Vlčka roste výkon Hanzlíka , který přišel z dorostu Rokycan . "	Rokycan	15	Plur
Do základní školy v Byšicích na Mělnicku nebylo včera se začátkem školního roku vpuštěno 77 přespolních žáků .	Byšicích	4	Plur
A stejně jako Němcům a Angličanům vadí pochopitelně i Švýcarům představa , že by jejich frank , synonymum pevnosti a stability měny , musel ustoupit ECU či nějaké jiné celoevropské měně .	Angličanům	5	Plur
Nesnažili se získat lidi z Omnipolu a zajímali se pouze o nové kontakty ( z nedostatku jiných ) .	Omnipolu	5	Sing
List Komsomolskaja pravda včera zveřejnil záznam telefonátu D . Dudajeva s bývalým ázerbájdžánským ministrem vnitra Iskenderem Gamidovem , který prý mimo jiné uvedl , že Slovensko poskytlo Čečencům 250000 dolarů .	Iskenderem	15	Sing
