Poprvé se takovéto pokusy uskutečnily v padesátých letech na ostrovech Curacao a Sanitel při pobřeží Venezuely a později se tato metoda zavedla i ve Spojených státech .	Venezuely	15	Sing
Paris - Nord , to byla vysněná příležitost skončit s mezinárodní jednotvárností letištního stylu , které se Paul Andreu chopil bohémským tempem francouzské impulsívnosti .	Andreu	18	Sing
Disk Orchestrální díla Bohuslava Martinů spojuje dohromady 3 . symfonii ( 1941 ) , Smyčcový kvartet s orchestrem ( 1931 ) a Suitu z opery Julietta ( 1939 ) .	Martinů	4	Plur
Silnice z Vrchlabí do Špindlu byla z poloviny ucpaná .	Špindlu	4	Sing
V měsíci prosinci byla také v závodě Smidary uskutečněna instruktáž předsedů závodních složek , vedení závodu za účasti ředitele podniku a * Jirouše .	Smidary	7	Plur
Přijme - li Polákův a Jasanského postup , opravdu se dobře zasměje .	Jasanského	5	Sing
Požadavek na řešení dopravního vozidla pro Michalovce a později Oravu .	Oravu	9	Sing
Převedeno na formuli máme několik jezdců typu Petersona , Revsona , Hulmeho , a možná i Stewarta nebo dokonce Fittipaldiho .	Fittipaldiho	19	Sing
Moskva neoficiálně upozornila Washington , že nesouhlasí se zrušením zbrojního embarga vůči bosenským Muslimům , a naopak dala jasně najevo , že důvěřuje Srbům , kteří přislíbili zastavení zbrojních dodávek svým srbským spojencům v Bosně .	Srbům	23	Plur
Popisuje svízelnou a při tom neúspěšnou cestu tří dělníků , komunistů z malé sklářské kolonie Bohemie za Stupnem - Břasy , * chlebem do Sovětského svazu v roce # .	Břasy	19	Plur
Sbor vystoupí na osmi koncertech - tři z nich budou samostatné - s širokým repertoárem od Scarlattiho a Vivaldiho přes Schuberta , Mozarta a Brucknera až po díla Dvořákova , Janáčkova , Martinů , Jana Nováka a Zdeňka Lukáše .	Martinů	32	Plur
Ron Atkinson ( 55 ) , bývalý šéf týmu Manchester United a Aston Villa , se stal novým trenérem účastníka nejvyšší anglické soutěže Coventry City .	Atkinson	1	Sing
Národní umělec Vladislav Vančura marně nenapsal .	Vančura	3	Sing
Američané jsou toho názoru , že právě nespokojení Kubánci by měli zůstat doma a snažit se o svržení neoblíbené vlády .	Kubánci	8	Plur
Jeho dojetí znásobila při vyhlašování přítomnost Tomáše Bati , Jiřího Lobkowitze , Tomáše Ježka a pořadatelů soutěže - Českého manažerského centra v Čelákovicích .	Lobkowitze	10	Sing
Lékař ve Stěbořicích a Velkých Heralticích má na starosti kolem 2300 lidí .	Heralticích	5	Plur
První knock - out však Claes dostal ze strany zcela nečekané : za postoj vůči fundamentalismu .	Claes	5	Sing
Olomouc byla přes výhru 3 : 2 nad ukrajinským Luganskem vyřazena z PMEZ , Olymp prohrál s pařížským Villebonem 2 : 3 a vypadl z Poháru CEV .	Villebonem	18	Sing
K vlastnímu obsahu časopisu Dieter Wild mj . poznamenal , že cílem je nepsat jen to , co lidé chtějí číst , ale také to , co by měli !	Wild	5	Sing
Spolupráce obou Procházků , kteří vypracovali ideální střeleckou příležitost pro Pateru , nám ve 45 . minutě zajistila dvoubrankové vedení .	Procházků	2	Plur
Středové trio Slávie pracovalo spolehlivěji než stejná řada Sparty .	Slávie	2	Sing
Po přepravě přes Středozemní moře absolvovali účastníci Rallye Paříž - Kapské Město první etapu po africkém kontinentě , která vedla z Misratahu do Sirtu a měřila 651 km , z čehož 204 km byla dlouhá rychlostní zkouška .	Sirtu	23	Sing
Oblast : Rakousko - Tyroly	Tyroly	4	Plur
Skutečnost však byla maličko jiná : titul Why Havel ? vyrobila v roce 1990 kanadská firma Les Productions la Fete Inc . , koproducentem se stal KF , a . s .	Productions	17	Plur
Kdybychom tyto stavby povolovali nebo doporučovali , nebyly by brzy v chráněných krajinných oblastech dominantami zalesněné kopce , ale stožáry s vrtulemi , " řekl nám Zdeněk Molitor , pracovník Správy chráněné krajinné oblasti Beskyd v Rožnově pod Radhoštěm .	Beskyd	34	Plur
Dále pak mj . požadovali zamezení předjíždění avií , které jsou odbavovány spolu s osobní dopravou , a poukazovali na nespolupráci mezi celníky a policisty .	avií	7	Plur
Před vyhlášením slibovaného povstání by se asi rozzlobený Cuauthémoc Cárdenas Solórzano měl ještě trochu zamyslet a všechno si lépe spočítat .	Solórzano	10	Sing
Letadlo L - 610 M bude armáda testovat ve Výzkumném ústavu letectva v Praze - Kbelích .	Kbelích	15	Plur
O podvod však v žádném případě nešlo , teď naposledy to zcela zřetelně ukazuje kniha Vladimíra Hanzela " Zrychlený tep dějin " - která přesně popisuje situaci jakéhosi " štábu " revoluce , jak operativně reaguje na tahy protivníka .	Hanzela	16	Sing
Druhou v pořadí Anne Samploniusovou z Kanady nechala za sebou o 45 sekund .	Samploniusovou	4	Sing
Dva sólové útoky Švacha a jeden Dostála ovšem Čaloun zlikvidoval .	Dostála	6	Sing
JARUZELSKI UZNÁVÁ SVOU ODPOVĚDNOST	JARUZELSKI	0	Sing
Okresní soud v Semilech uvalil minulé pondělí na Wonku vazbu a ten téhož dne při zatýkání utrpěl menší zranění .	Semilech	3	Plur
Vltava poskytovala poměrně dobré možnosti pro získání vodní energie .	Vltava	0	Sing
František Brůna své dělovky nemusí úzkostlivě balit do kufru , má je schované v ruce .	Brůna	1	Sing
Od 25 . září budou přepravovány těžké kamiony na trase Drážďany - Lovosice po železnici .	Lovosice	12	Plur
Ronaldo je objev křídelního útočníka Brazílie z MS 1970 Jairzinha , který je také sponzorem Ronalda .	Ronaldo	0	Sing
Jak řekl LN ředitel Městské nemocnice v Litoměřicích MUDr . Miroslav Jiránek , byli první čtyři pacienti doslova nadšeni .	Litoměřicích	7	Plur
Policie řidičům doporučuje , aby cestovali po náhradních trasách na pravém břehu Vltavy , v Nuslích nebo přes Spořilov a Vršovice .	Spořilov	18	Sing
Pořádá Asociace firem pro identifikační systémy - AMT ČR - AFIS , 101 00 Praha 10 - Vršovice , Kodaňská 45 , tel . : ( 02 ) 673123 46 .	Vršovice	17	Plur
Dne # listopadu o # hodině dopoledne se bude konat pietní akt položení věnců k hrobům rudoarmejců orgány města , organizací a závodů .	rudoarmejců	16	Plur
o Jak byste definoval Židy ?	Židy	4	Plur
Paštuni jsou v Afghánistánu nejen nejsilnější , ale také státotvorní : z jejich řad vyšla většina vládců země .	Paštuni	0	Plur
Podle slov jistého českého spisovatele žijícího v zahraničí , který si nepřál být jmenován , měl Kundera údajně uvažovat o rozvázání exkluzivní smlouvy s Atlantisem a dokonce rezignovat na vydávání svých knih v České republice vůbec .	Atlantisem	24	Sing
Reakce izraelského premiéra Jicchaka Rabina na skutečnost , že někteří Izraelci uctívají památku Barucha Goldsteina , který před rokem povraždil tři desítky Arabů v hebronské mešitě *	Izraelci	10	Plur
Hlavním dostihem zahajovací neděle je Cena Karlových Varů na 2000 metrů , kde mezi devíti startujícími koňmi najdeme i tříletky , kteří nedávno startovali v našem derby .	Varů	7	Plur
Srbové si odedávna " více cenili společenskou rovnost než vnitřní svobodu " , napsala Latinka Perovičová v jedněch srbských provinčních novinách a nová , protirežimní Borba to přetiskla .	Perovičová	15	Sing
Dvůr Králové .	Dvůr	0	Sing
Vnuk Sukův a pravnuk Dvořákův zasedl k prvnímu ze dvou violových pultů , aby završil svou hrou znamenitý projev Smetanovců , připomenul někdejší Dvořákovu hru na tento nástroj , a tak znovu potvrdil vlastní až podivuhodnou hudebnost .	Smetanovců	19	Plur
Sudety se mu zajídaly stejně jako mně , což dal najevo tím , že německému pošťákovi roztrhl nohavici .	Sudety	0	Plur
Comandos L mají podle Bryanta dostatečný počet členů , ale velitel neřekl , kolik .	Comandos	0	Plur
Obžalobu z vraždy , kterou podal prokurátor na Radka P . ze Šumperka , začal včera v hlavním líčení projednávat krajský soud v Ostravě .	Šumperka	12	Sing
David Rikl podlehl Australanovi Patricku Rafterovi 4 : 6 , 1 : 6 , 4 : 6 .	Rikl	1	Sing
Ředitel firmy , která pořádala závod v Irmole , je vyšetřován	Irmole	7	Sing
Krkonoše jsou bezesporu nejnavštěvovanější české hory .	Krkonoše	0	Plur
Památník rudoarmejcům představuje monolit , který opracovala provozovna Hlinsko .	rudoarmejcům	1	Plur
V Restaurantu u Babičů nás příjemně uvítala mladá servírka .	Babičů	3	Plur
LENKA LINDAUROVÁ , Paříž	LENKA	0	Sing
Policisté stále hledají pravděpodobného pachatele vraždy ženy , jejíž tělo bylo poslední červnový den nalezeno s mnoha ranami v Orlové - Lazích .	Lazích	21	Plur
Za # * poštovného dostane pěkně vypravenou knížku , která mu otevře nový , neznámý pohled na minulost Čelákovic .	Čelákovic	18	Plur
" Izáčku , nebojte se . "	Izáčku	1	Sing
Seidl za Cookem	Cookem	2	Sing
Jsme členy pionýrské skupiny v Bystrovanech .	Bystrovanech	5	Plur
Ve Strakonicích provozuje čtyři obchody a velkoobchodní sklad , jeden obchod má v Prachaticích .	Strakonicích	1	Plur
Hokej na ostrovech prožívá renesanci , ale ke snům o novodobých Robinech Hoodech je zatím daleko	Hoodech	12	Plur
Analýzu členů za posledních # let vypracoval Dejaiffe .	Dejaiffe	7	Sing
Napínavý příběh vypráví o pilotovi a jeho navigátorovi , jejichž letadlo bylo sestřeleno několik hodin po vypuknutí války o Kuvajt 17 . ledna 1991 a oba padli do iráckého zajetí , kde strávili plných 47 dní .	Kuvajt	19	Sing
Výchozím předpokladem transformacionalisticko - nativistického pojetí je v souladu s pojetím Chomského to , že proces osvojování jazyka dítětem je vysvětlován na základě vrozených jazykových dispozic .	Chomského	11	Sing
Čtvrtou etapu Rallye Paříž - Kapské Město , dlouhou 520 km s cílem v městě Tumu , stále ještě na území Libye , vyhrál Francouz Hubert Auriol na voze Micubiši a postoupil tak do čela celkové klasifikace .	Hubert	25	Sing
V době opata Silvestra byla vystavěna kaple * Marie , vymalován chrám a vestavěny oblouky arkádových zdí do nedokončené Bozděchovy výstavby , kterou umělečtí historikové považují za basiliku .	Silvestra	3	Sing
Zejména vedoucí trojka - kandidát Scharping , dolnosaský ministerský předseda Gerhard Schröder a jeho sárský kolega Oskar Lafontaine , tři úspěšní ministerští předsedové spolkových zemí - by měla imponovat voličům .	Lafontaine	17	Sing
Byla inspirována kolokviem , které loni v listopadu pět let po pádu berlínské zdi zorganizovalo francouzské ministerstvo kultury , " uvedl k tomu Krejča .	Krejča	23	Sing
V 2.05 hod . odjíždí do Nymburka osobní vlak se zastávkami v Čelákovicích , Lysé nad Labem a Kostomlatech nad Labem .	Kostomlatech	18	Plur
Oproti předchozí tvorbě Pixies jsou však Blackovy skladby většinou uhlazenější a líbivější ( Speedy Marie , Superabound ) .	Pixies	3	Plur
Firmě U Nedbálků , jejíž služby snesou nejpřísnější měřítka .	Nedbálků	2	Plur
Před listopadovou revolucí představovala zbrojní produkce 60 až 70 procent z celkového objemu výroby ZTS , dnes je to přibližně pět procent ( náhradní díly ) .	ZTS	14	Plur
RPF , ve které jsou zastoupeni převážně příslušníci kmene Tutsiů , tvrdí , že prozatímní vláda , která byla ustavena začátkem dubna po tragické smrti prezidenta Juvénala Habyarimany a v níž mají většinu Hutové , je nelegální .	Tutsiů	9	Plur
* Forgáč projednal možnosti stěhování VS do budovy v Pozdišovicích , stěhování bude postupné , počínaje # .	Pozdišovicích	9	Plur
K Čechám připadl Boží Dar teprve v roce 1556 .	Čechám	1	Plur
Podniku Olma , který přišel na trh s novou variantou másla s rostlinným olejem Zlatá Haná .	Olma	1	Sing
* Elstner projel s malým Popularem Spojenými státy a Mexikem , Rapid * Procházky a * Kubiase objel svět za # dní .	Mexikem	9	Sing
Chtěli bychom plnit vůči Pardubicím stejnou úlohu jako chemické továrny v Leverkusenu nebo Basileji .	Pardubicím	4	Plur
Křížovnice u Doubravníku :	Křížovnice	0	Plur
Dalšími místopředsedy SDL se stali Pavol Kanis , Milan Ftáčnik , Viliam Sopko a Juraj Horváth .	Juraj	14	Sing
Občan ze Srb se začátkem týdne vrátil v noci vlakem do Kamenných Žehrovic , a když se vydal na cestu domů , přepadl ho neznámý muž .	Žehrovic	12	Plur
V 8 . čísle Vesmíru píší Josef Babor a značka imh o Moodyho knize Životy před životem .	Moodyho	12	Sing
V našem národním podniku na lvovský systém najel od # závod Smidary .	Smidary	11	Plur
Nejasná smrt v baru TRAGICKÁ RVAČKA VZNIKLA Z NEDOROZUMĚNÍ NĚMCŮ	NĚMCŮ	9	Plur
Najdeme v něm požadavek státního sjednocení všech Paštunů .	Paštunů	7	Plur
O případném vstupu kanadské firmy Alcan do společnosti Alufinal Žiar nad Hronom by v termínu , který bude dohodnut ještě tento týden , měli jednat představitelé obou firem .	Alcan	5	Sing
Teprve třetího letošního vítězství dosáhli hokejisté Hartfordu Whalers , kteří porazili v domácím prostředí Montreal Canadiens 4 : 1 .	Canadiens	15	Plur
Výstavu navštívili žáci našich škol pod vedením učitelů a učitelek , a to nejen z Čelákovic , ale také z Horních Počernic .	Čelákovic	15	Plur
" Galásek rozhodně nezklamal , hrál zodpovědně , bez chyb a do mužstva dobře zapadl , " chválil reprezentační trenér kapitána olympioniků .	Galásek	1	Sing
Jistě , porovnáme asi neporovnatelné , ale jak jinak vyjádřit uznání a obdiv takovým Brunclíkům , Židům , Čížkům , Králům a mnoha jiným .	Židům	16	Plur
Hotel rakouské společnosti Rogner International Hotels & Resorts bude mít 400 klimatizovaných pokojů vybavených kabelovou televizí , bezpečnostním sejfem , telefonem a minibarem .	Hotels	5	Plur
V budoucnosti umožní krýt spotřebu pitné vody a vyřadit zdroj v Pisárkách , kterému nikdy nebyl přiznán statut vody vhodné pro úpravu na pitnou , dodává M . Staněk .	Pisárkách	11	Plur
Jicchak Rabin předložil Sýrii tříletý plán pro Golanské výšiny	Jicchak	0	Sing
Stehlík dále popřel informaci , podle níž jeho společnost dluží Energetickému centru v Kladně ( ECK ) 300 miliónů korun za dodávky tepla , což tisku sdělil ekonomický šéf ECK Jaroslav Ibl .	Ibl	31	Sing
Egypťané budují velká inženýrská díla .	Egypťané	0	Plur
The Cranberries live	Cranberries	1	Plur
Okolní postavy mu jenom přihrávají , ať už jde o Alexova kolegu , žlučovitého gynekologa Arbogasta , o gynekologovu rovněž těhotnou ex - manželku Angelu nebo o krásně popletenou vědcovu kolegyni z university Dianu Reddinovou .	Reddinovou	34	Sing
Pro ilustraci snad stačí uvést alespoň některá jména , Sternovi , Saussure , Buhlerovi , Vygotskij , Jakobson , Piaget .	Vygotskij	15	Sing
Japonské síly se na Filipínách vzdaly v roce 1945 , těsně předtím , než Tokio kapitulovalo .	Filipínách	4	Plur
České filmy Miloše Formana i Páralův nejlepší román Milenci a vrazi vznikly před více než čtvrt stoletím .	Formana	3	Sing
Tuto bezprecedentní žádost předal generál Gabi Gazit , který zastupuje Izrael v izraelsko - palestinské vojenské komisi pro koordinaci a spolupráci , palestinskému generálu Zijádovi Atrašovi .	Atrašovi	25	Sing
Podle Rudolfa Baránka se o státním rozpočtu musí každoročně upřímně diskutovat .	Baránka	2	Sing
Itálie : Benátky - skoro jasno 25 / 24 .	Benátky	2	Plur
Požadavky resortů Henych nehodnotí jako maximalistické , mají pouze zajistit fungování nových institucí .	Henych	2	Sing
Neboť i v Belgii se poslední dobou začínají prohlubovat rozpory mezi Vlámy a Valony .	Valony	13	Plur
Stašovo místo stopera zaujme Šilhavý a příležitost dostane i Šlachta , jenž přišel z Havířova .	Šilhavý	4	Sing
Juventus vyhrál nad Neapolí 1 : 0 a při porážce Parmy na hřišti v Cagliari zvýšil svůj náskok v čele tabulky na šest bodů .	Neapolí	3	Sing
Plán zahrnuje kulturní a studentskou výměnu , společný historický výzkum období druhé světové války , repatriaci Korejců , kteří zůstali v Rusku na Sachalinu , a náhradu Tchajwancům , kteří sloužili v japonské armádě před rokem 1945 .	Tchajwancům	27	Plur
Proti pomníku v Bolaticích vystoupil Klub českého pohraničí v Opavě , odmítavé stanovisko vydali i opavští komunisté .	Bolaticích	3	Plur
V Chabařovicích ukradl jednomu starému občanu jeho důchod .	Chabařovicích	1	Plur
Abchazové však oznámili , že palbu zahájili Gruzínci .	Abchazové	0	Plur
Egypt a Izrael se za včerejší návštěvy izraelského ministra zahraničí Šimona Perese v Káhiře nedohodly o Smlouvě o nešíření jaderných zbraní ( NPT ) a Peres se rozhodl odjet domů bez schůzky s prezidentem Husním Mubarakem .	Šimona	10	Sing
Původně etnicko - politický boj vládnoucích ( většinových ) Hutů proti odbojným menšinovým Tutsiům i proti Hutům z řad rwandské opozice přerůstá v zcela absurdní akty msty a nenávisti .	Hutům	16	Plur
Popáté se tento kousek povedl Curtisi Josephovi ze St . Louis při vítězství svého celku 4 : 0 nad Edmontonem .	Curtisi	5	Sing
Machala zároveň v Liblicích představil zajímavá díla poslední doby ( práce Daniely Hodrové , Michala Viewegha , Jáchyma Topola , avšak i Martina Nezvala či Maxi Marysko ) .	Liblicích	3	Plur
Škodě pomohl leasing k úspěchu	Škodě	0	Sing
Pozvali tam třeba jednu parádní indickou tanečnici a výborně hráli na sitáry .	sitáry	11	Plur
V Giardini v Benátkách jsou umístěny jednotlivé národní pavilony reprezentující architektonické styly doby svého vzniku .	Benátkách	3	Plur
Video s The Cranberries je dokonalá ukázka , jak lze prostými prostředky docílit mimořádně poutavého účinku .	Cranberries	3	Plur
Přes dlouholetou spolupráci s některými západními odběrateli a partnery padl konečný výběr na předního výrobce vstřikovacích zařízení pro dieselové motory - německou společnost Robert Bosch GmbH .	Bosch	24	Sing
Párek dospělých bizonů , které koupil od zoologické zahrady ve Vyškově , převezl na svou soukromou pastvinu v Maňavě u Horní Plané táborský podnikatel Jiří Rybák .	Maňavě	18	Sing
Pomník 202 rodákům , kteří padli za druhé světové války v řadách německé armády , odhalili v sobotu v Bolaticích na Hlučínsku .	Bolaticích	19	Plur
Kromě Australanů , Němců a Rumunů musíme počítat zvláště se zámořím - Novozélanďany , Kanaďany a Američany .	Novozélanďany	12	Plur
Tádžický ministr zahraničí Chudojberdy Chaliknazarov hodlá na 47 . zasedání Valného shromáždění OSN navrhnout , aby byly na tádžické území přesunuty mírové síly pod vlajkou OSN .	Chaliknazarov	4	Sing
Jedná se o levou Klausovu polobotku a několik vlasů , které mohou patřit buďto mluvčí ODS Janě Petrové , nebo poslankyni Marvanové .	Marvanové	21	Sing
Historicky významným prvkem fénické architektury je hlavice s volutami , nalezená na Kypru , která byla později převzata Řeky a stala se vzorem pro vytvoření iónské hlavice .	Řeky	18	Plur
Golany a mírová smlouva	Golany	0	Plur
Piero Capuccilli vytváří svého Figara s neobyčejnou bravurou , kde však je to zapotřebí , dovede se i decentně stáhnout do pozadí .	Capuccilli	1	Sing
Pražské pivovary zvyšují od příštího pondělí 27 . února cenu značek Staropramen , Měšťan a Branické pivo v průměru o 9.85 procenta , což představuje zhruba 60 haléřů na půllitr .	Staropramen	11	Sing
Jen trosky katedrály z 13 . století a hrobka nejslavnějšího königsbergského rodáka Immanuela Kanta dnes připomínají doby dávno minulé .	Immanuela	12	Sing
Ve stanicích Muzeum a Florenc lze přestoupit na trasu C ve směru Háje i Nádraží Holešovice .	Háje	12	Plur
Obranu Hradce Králové v Plzni vyztuží dvacetiletý obránce Hrotek , jehož Východočeši získali z Ostravy na měsíční hostování .	Východočeši	11	Plur
Přes rok existuje u Českých drah ( ČD ) Divize majetkového podnikání a privatizace , jejíž hlavní náplní je pronájem , prodej a privatizace nemovitého majetku .	ČD	7	Plur
V Libkovicích měli mladiství i jedinečnou šanci získat výuční list ve Školském vzdělávacím středisku .	Libkovicích	1	Plur
Návrh Plánu aktivity ZO ROH při LŠU v Hranicích a v Lipníku nad Bečvou byl schválen .	Hranicích	8	Plur
Jeho místo zaujme Berger ze Slavie , kterého v mužstvu ČR do 21 let nahradí Zúbek z Brna .	Zúbek	15	Sing
Ekonomickými věcmi na profesionální úrovni se bude zabývat Miroslav Pelta , v oblastech pak Vojtěch Čižinský v Čechách a Zdeněk Šrom na Moravě .	Čižinský	15	Sing
Situace naznačená v Holešovicích , Bubnech není však z hlediska celkového vývoje dělnického osídlení Prahy výjimečná .	Bubnech	5	Plur
Soudružka Kavanová v souvislosti s tím s velkým uznáním hovořila o obětavé a svědomité práci soudružky Juřinkové , školnice , topičky a uklízečky v jedné osobě .	Kavanová	1	Sing
Nejpozději od # let pak na jihu Prahy vyrůstají další velká předměstí , Nusle , Vršovice , Košíře , Hlubočepy , na severu Prahy pak Břevnov a Bubeneč .	Vršovice	15	Plur
Asi nejvíc se mi stýská po Tatrách .	Tatrách	6	Plur
Na území Holešovic , Buben vytvořily se tedy v průběhu výstavby této čtvrti tři populačně , vzhledem k populaci dělnické , odlišné okrsky .	Buben	4	Plur
Není to sice klasika typu Rolling Stones , ale ani novinka , jakou jsou třeba Cranberries . "	Stones	6	Plur
Ten přišel z celku Oesters Vaxjö , který v lize 1993 obsadil osmou pozici .	Oesters	4	Plur
Je to poslední velká bašta bouřících se Karenů na hranicích země .	Karenů	7	Plur
Nechť se nacionalismus upevňuje ve všech regionech , citovaly Mironova ve svém posledním čísle Moskovskije novosti .	novosti	15	Plur
Velitel extremistické organizace na Srí Lance Tygři osvobození tamilského Ílamu přijal v sobotu nabídku nové socialistické vlády zahájit bez předběžných podmínek mírové jednání o ukončení 11 let trvajícího etnického konfliktu mezi Tamily a Sinhálci .	Sinhálci	33	Plur
/ Přeložil Ivan Boháček /	Boháček	3	Sing
Jelikož se pan Švejda při zmíněných inscenačních přípravách nevyskytoval , není mi jasné , odkud podklady pro své výroky čerpal .	Švejda	3	Sing
The Hooters : Out Of The Body -	Hooters	1	Plur
Darované peníze využili čtyři svěřenci ve věku 16 a 17 let k útěku z Výchovného ústavu mládeže ve Střílkách na Kroměřížsku .	Střílkách	18	Plur
Hrozba uzavření dvou koksoven společnosti OKK v Ostravě byla zažehnána .	OKK	5	Plur
Zároveň byla vyhlášena nejsympatičtější žena podle mínění čtenářů časopisu Květy , kterou se s výrazným náskokem 600 bodů stala 31 letá Zdenka Jelínská z Karlových Varů , povoláním učitelka .	Zdenka	21	Sing
K průmyslovému Karlínu a Smíchovu přibyla průmyslová Libeň a na ni navazující se Vysočany a dále dvě převážně obyvatelské čtvrti , Žižkov a Královské Vinohrady .	Vinohrady	24	Plur
Basketbalový tým NBA New Jersey Nets , jehož dres oblékal nedávno zesnulý Dražan Petrovič , zřídí nadaci pro chorvatské studenty .	Nets	5	Plur
Do týmu se po bojkotu vracejí Kirjakov z Karlsruhe , Kančelskis z Manchesteru Unt . , Šalimov z Interu Milán a Kolyvanov z Foggie .	Kolyvanov	21	Sing
Guido Reni - Sv . Josef s Ježíškem	Reni	1	Sing
Obecně ve světě platí , že takovéto osoby požívají zvláštní důstojnosti a nedotknutelnosti , uvedl Dobal .	Dobal	15	Sing
( čta ) Série slepých přihrávek Východočechů způsobovaly , že byly pod tlakem Viktorie .	Východočechů	6	Plur
Nad horami obklopujícími město se zvedal kouř z vypálených domů , důsledku nové vlny bojů mezi příslušníky kmenů Hutů a Tutsiů .	Tutsiů	20	Plur
Album bylo časopisem Sounds označeno za desku měsíce a Frank Black se na něm představuje dvaadvaceti písničkami , které nezapřou , kdo byl v Pixies vůdčí osobností .	Pixies	24	Plur
V Libkovicích se tým odborníků snažil , aby se mladí chlapci vrátili do života duševně silní a fyzicky zdatní , aby mohli začít z té lepší stránky .	Libkovicích	1	Plur
Momentálně tedy nezbývá než doufat , že Genus se příští rok na obrazovkách objeví a že z nich nezmizí ani jiný populární cyklus Oko .	Genus	7	Sing
Slova admirála Philippa de Gaulla , syna největšího z francouzských politiků tohoto století .	Philippa	2	Sing
Premiérovi Reynoldsovi přispěchali na pomoc Iroameričané v čele s prezidentem Clintonem a jejich argumenty byly rovněž velmi pádné : po odzbrojení Ulsteru stejná hospodářská pomoc jako Palestincům a Izraeli na Blízkém východě .	Iroameričané	5	Plur
Ortodoxní část členské základny vyčítala Weissovu vedení koalici s pravicovým Křesťanskodemokratickým hnutím a připisovala mu vinu za odliv části členské základny směrem k Sdružení dělníků Jána Ľuptáka , kdysi člena SDL .	Ľuptáka	26	Sing
Startovní smlouvy směřovaly k 15 nejlepším jezdcům letošního peletonu profesionálů a amatérů - mistrům světa ( Pontoni , Arnould , Kluge , Frischknecht , De Bie , Baars ) i k našim nejlepším terénářům .	Arnould	18	Sing
A ze stejně neřešitelného dilematu , tentokrát v otázce " Evropa ano , či ne " , bude spoustu Švýcarů bolet hlava i před prosincovým hlasováním .	Švýcarů	19	Plur
Hospodu koupili manželé Anna a Jindřich Jurečkovi z Velkých Karlovic .	Karlovic	9	Plur
