Vaikkakin seurantamoottorilliset putket yleistyvät , on taivaan tunteminen siltikin tärkeää .	tunteminen	7	Minen
Kyseessä on ilmiselvästi osa valtion säästötoimia , mutta tarkemmin tutkittuna mielestäni varsin kyseenalaista säästämistä .	säästämistä	13	Minen
Luulevat , että vanhapiikuuksissaan Aboa on kehitellyt itselleen mielikuvituspoikaystävän .	vanhapiikuuksissaan	3	Vs
Turun Yliopiston perustamisen suuri muistomitali lyötettiin vuonna 1922 Turun Yliopiston avajaisten muistoksi .	perustamisen	2	Minen
Marko kyseli Twitterissä tuon näytön kytkentöjä , joten piirsin eräälle common cathode-tyyppiselle näytölle sellaiset ( riippuu täysin näytön tyypistä ja valmistajasta ) .	valmistajasta	20	Ja
Työn ikeestä vapautuminen on toki ollut ihmiskunnan ikiaikainen unelma , mutta se voidaan vihdoin julistaa auttamatta vanhentuneeksi .	vapautuminen	2	Minen
Nonon kohtaamat vaikeudet liittyivät tavallisesti hänen poliittiseen kantaansa .	vaikeudet	2	Vs
Lainsäädännössä edellytetään isännöitsijältä ainoastaan , ettei hän ole vajaavaltainen ( alle 18-vuotias tai edunvalvonnan alainen ) eikä konkurssissa ja että hänellä on asuinpaikka Euroopan talousalueella .	isännöitsijältä	2	Ja
Näitä ovat esimerkiksi syntymä ja erityisesti nimen antaminen , joka liittyy yhteisön jäseneksi ottamiseen , sukukypsyyden ja avioliiton solmimiseen soveliaan iän saavuttaminen , sekä tietenkin kuolema .	solmimiseen	18	Minen
Vaatimus on kova , sillä Kioton sopimus tähtää päästöjen alentamiseen 5 %:lla vuoden 1990 tasosta vuoteen 2012 mennessä .	alentamiseen	9	Minen
Hodgkinson oivalsi , että tiukan työmoraalin raiskaamaan länsimaiseen kulttuuriin kasvaminen johtaa päättömään ryntäilyyn , onnettomaan raatamiseen ja mahahaavaan , mutta paradoksaalisesti saisimme paljon enemmän aikaan antautumalla laiskuudelle ja velttoilulle .	ryntäilyyn	12	U
Uuden Suomen tietojen mukaan tilaisuuteen on ilmoittanut tulevansa kaupunginvaltuutettu Jussi Halla-aho ( sit. ) .	tilaisuuteen	4	Vs
Voin sulkea silmäni ja hengittää keuhkoni täyteen raikasta neulasten tuoksua .	tuoksua	9	U
Pääsääntöisesti väkiluvun kasvusta tuli kuitenkin maahanmuutosta , sillä maahan muutti vuonna 2007 25_900 henkeä ja maasta pois muutti 12_400 henkeä .	kasvusta	2	U
Kyseistä suuntausta on Margaret Thatcherin ilmaisun mukaan kutsuttu ns. uudeksi oikeistoksi .	ilmaisun	5	U
Ja jos työ muodostaa identiteettimme ytimen , työssä epäonnistumisen merkitys on helppo laskea .	epäonnistumisen	8	Minen
Sulkeumia voidaan käyttää myös hyödyksi esimerkiksi lastuamisessa , jossa runsaalla määrällä sulfidisulkeumia saadaan lastunmuodostusta parannettua ja voitelua lisättyä .	hyödyksi	4	U
Retken historiallinen anti saa täydennystä , kun savonlinnalaiset osallistuvat Turun yliopiston järjestämälle Agricola ja kolme -vekkulia kierrokselle , jossa kierrätetään viides- ja kuudesluokkalaisia koululaisryhmiä Tuomiokirkon ympäristössä ja Yliopistonmäellä .	savonlinnalaiset	7	Lainen
Tänä vuonna tapahtumaan on ensimmäistä kertaa kutsuttu myös alumneja kertomaan seminaarilaisille muun muassa valmistumisen jälkeisistä vaihtoehdoista .	seminaarilaisille	10	Lainen
Kansainvälinen osallistujajoukko koostuu TUCSin ja Kungliga Tekniska högskolanin tohtoriopiskelijoista , Paasio kertoi .	tohtoriopiskelijoista	8	Ja
Ohjelmana olivat yleisesti yliopisto-opiskelun luonteeseen tutustuminen sekä tiedekuntien esittelyt .	yliopisto-opiskelun	3	U
Toivon , että voimme sovittelumenettelyssä löytää tähän sellaisen terveeseen järkeen pohjautuvan ratkaisun , joka auttaa meitä keskittämään toimet ongelmallisimpiin aloihin sen sijaan , että kulutamme aikaa , rahaa ja energiaa kansanterveysriskin kannalta vähemmän ongelmalliseen pohjaveden hallintaan .	ratkaisun	11	U
Illan saldona oli haalariuintia , haalaritonta uintia , skumppaa , ruotsalaisia , oululaisia ja Gambinan nautittavuuden tarkastelua .	nautittavuuden	15	Vs
- Yksityisten toimijoiden välillä ilmenevät kysymykset ovat niin monitahoisia , että usein asioita voidaan selittää vain " case by case " -mentaliteetilla , Rosas sanoi .	toimijoiden	2	Ja
Mitalin myöntämisestä päättävän lautakunnan perustelu mitalin myöntämiselle oli , että Vuorio on huomattavalla tavalla toiminut Turun yliopiston henkisten päämäärien hyväksi ja aineellisen vaurastumisen edistämiseksi .	myöntämiselle	6	Minen
Binderup kuitenkin peräänkuuluttaa suvaitsevaisuuden lisäämistä ja kansalaisten identiteettien ymmärtämistä samanarvoisiksi .	lisäämistä	4	Minen
Varantovelvoitteen vahvistamista tai hyväksymistä koskevat menettelyt eivät rajoita tiedonantajien velvollisuutta toimittaa aina oikeat tilastotiedot sekä korjata mahdollisesti jo toimittamansa virheelliset tilastotiedot .	tiedonantajien	8	Ja
1. Ihmisoikeuksia ja demokratiaa käsittelevän alakomitean toimeksiantoon sisältyviä asioita voidaan myös ottaa käsittelyyn korkeammalla tasolla osana EU:n ja Tunisian välistä poliittista vuoropuhelua .	Ihmisoikeuksia	1	Vs
On korostettava , että kyseinen rikkomismenettely liittyy ainoastaan kansallisten toimien ilmoittamiseen eikä täytäntöönpanotoimien laatuun .	ilmoittamiseen	10	Minen
Ehdotetut Euroopan yhdenvertaisten mahdollisuuksien teemavuosi 2007 ja Euroopan kulttuurien välisen vuoropuhelun teemavuosi 2008 ovat tärkeitä aloitteita , joilla lisätään tietoisuutta näistä asioista ja joilla edistetään tavoitteiden saavuttamista .	tietoisuutta	19	Vs
Juhlantäyteinen viikonloppu alkoi deltalaisten osalta kosteissa merkeissä ; kahdeksalta aamulla pakkauduttiin ajoneuvoihin Quantumin varjossa ja aloitettiin reissun ensimmäisen siirtymäosuus .	siirtymäosuus	18	Vs
Bryssel oli aivan ihana kaupunki jota helli sellaiset mukavat 30 asteen helteet , ja viikonloppuna oli vielä Eurooppa-päivä sekä Festival d'Iris , mitkä tarkoittivat EU:n ja muiden organisaatioiden avointen ovien päivää sekä konsertteja ja bileitä pitkin kaupunkia .	viikonloppuna	14	U
Ystäviltä ja sukulaisilta kauan sitten saadut lahjat , lapsuuden lelut , nuoruuden lempivaatteet ja isovanhempien esineet tuovat meille turvallisuutta ja varmuutta siitä , että muistot eivät karkaa .	turvallisuutta	18	Vs
Ratcliffe oli Evertonin keskuspuolustaja lähes koko 1980-luvun .	keskuspuolustaja	3	Ja
Klassikon lukiolaiset Janne Talvitie ja Matti Juhanoja harkitsevat matemaattis-luonnontieteelliseen tiedekuntaan hakemista .	hakemista	10	Minen
Euroopassa ja Pohjois-Amerikassa orjuuteen joutuu lähinnä laittomasti maahantulleita siirtolaisia .	orjuuteen	3	Vs
Tuo olkikoira , jonka aamulla nimesin Pyroksi , taitaa olla jokin lapsuuden kaipuun ikoni , esine joka linkittää tämän hetken siihen hetkeen , jolloin en tiennyt huomisesta mitään .	lapsuuden	11	Vs
Opiskelupaikkaa Turun yliopistosta tavoittelee yhteensä 14_634 hakijaa .	hakijaa	6	Ja
Koululaisten videokurssi miltei päättyi tuhoisasti , kun kuusi yhdeksäsluokkalaista käsittänyt oppilasryhmä oli ruotsalaisen Ödeshögin kunnan postin edustalla kuvaamassa lavastettua ryöstöä .	Koululaisten	0	Lainen
Työnhakuun liittyvistä ongelmista ja huonosta tunnettuudesta huolimatta suurin osa Gallin ja Aholan haastattelemista ylemmän AMK-tutkinnon suorittaneista oli kuitenkin onnistunut etenemään urallaan .	Työnhakuun	0	U
Nämä tilastot kattavat yhteenlasketut rahoitussaamiset ja -velat , jotka ilmaistaan kantatietoina , korkeatasoisina virtatietoina lainojen osalta , ja myös rahalaitosten hallussa olevia arvopapereita koskevat virtatiedot esitetään tarkemmin .	rahoitussaamiset	4	Minen
Elämäntapaliitto kärähti RAY-avustusten käyttämisestä SDP:n tukemiseen	tukemiseen	5	Minen
Tästä huolimatta palveluja suunnitellaan .	palveluja	2	U
Sodan päättyessä vuonna 1944 Belgian kuningas ei olut maassa , vaan saksalaisten hallussa Saksassa ja Itävallassa .	saksalaisten	11	Lainen
Ensinnäkin Kuuba haluaa näin sen ilmaisi parlamentin valtuuskunnalle ulkoministeri Pérez Roque Euroopan unionin takaavan , että jos se pyytää pääsyä AKT-maiden joukkoon , Euroopan unioni ei vastusta sitä .	pääsyä	19	U
Pahalta velkaongelmalta voitaisiin kuitenkin usein välttyä , jos yhteyttä velkojiin ja velkaneuvontaan pidettäisiin ajoissa , Pekka Mäki sanoo .	yhteyttä	8	Vs
Palvelualojen työnantajien ( PALTA ) ja Suomen Lennonjohtajien Yhdistyksen ( SLJY ) väliseen työehtokiistaan on löytynyt sovinto .	Lennonjohtajien	7	Ja
Tiedon välittäminen ei riitä , vaan potilasohjaukseen on sisällytettävä sen arviointi , kykeneekö potilas todella hyödyntämään saamaansa tietoa .	välittäminen	1	Minen
Hänen kerrotaan sanoneen Mithridateelle , että tämän tuli joko olla roomalaisia mahtavampi tai totella heitä .	roomalaisia	10	Lainen
Ongelmaksi muodostuu se , että vähemmistöt joutuvat marginaaliin usein vain koska valtaväestö ei pidä niistä , vaikka niillä olisikin laillisesti tasa-arvoiset oikeudet .	oikeudet	21	Vs
Vuonna 2002 oikeus- ja sisäasioiden neuvosto kehotti perustamaan kotouttamisasioihin keskittyviä kansallisia yhteyspisteitä .	oikeus-	2	Vs
SLJY:n puheenjohtaja Antero Utunen kertoo Ylelle , että neuvottelut sujuivat asiallisessa ja rakentavassa hengessä .	neuvottelut	8	U
Turkin syyttäjäviranomaiset ovat aloittaneet toimenpiteet kurdimyönteisen DTP-puolueen kieltämiseksi .	kieltämiseksi	7	Minen
4 ) kyseiset toimenpiteet eivät saa vaikuttaa perusoikeuksiin , mukaan luettuna lakko-oikeus ,	lakko-oikeus	11	Vs
Jäynä kesti tasan kaksi tuntia päättyen yllättävästi vapaaehtoisesti , kun naurut oli naurettu ja hissikorin ylipaine kehittyi kivuliaaksi .	naurut	10	U
Tietojen keruu- ja käsittelymenetelmät on suunniteltava siten , että jäsenvaltioiden toimittamat tilastolliset tulokset täyttävät tarkkuutta koskevat vähimmäisvaatimukset , joissa otetaan huomioon jäsenvaltioiden tieliikenteen rakenteelliset ominaisuudet .	tarkkuutta	14	Vs
Koska kirjoittaja ei päässyt paikalle tähän peliin , niin ottelun kulusta ei voi juuri raportoida .	kulusta	10	U
Sen sijaan ruohonpäristäjän merkitystä ei olekaan enää niin helppo arvata .	ruohonpäristäjän	2	Ja
Eikä Suomi-kuva enää meidän aikanamme ole haudan vakava asia , sillä ranskalaistunut itsetuntomme kestää urheasti jopa sekaantumisen norjalaisiin ja sen , että jonkun mielestä Helsingissä kävelee jääkarhuja .	sekaantumisen	16	Minen
Rosasin mukaan voidaan intuitiivisesti todeta , että perusoikeuksia ei voida sulkea pois päätöksenteosta ja että velvollisuudet koskevat myös kansalaisia .	kansalaisia	18	Lainen
Nyt 15. kerran järjestettävissä laulukilpailuissa tuomariston puheenjohtajana toimii tenori Raimo Sirkiä .	puheenjohtajana	6	Ja
Koska suurin osa työntekijöistä tekee enimmät duuninsa asiakkaiden tiloissa , ei juuri kenelläkään toimitusjohtajaa lukuun ottamatta ole omaa toimistoa .	työntekijöistä	3	Ja
Juuri kun olin astumassa tukevalle lattialle takaisin , sain huomata tuon venäläisen yrittävän työntää minua hissikuiluun kokonaan .	venäläisen	11	Lainen
Puitteet kolmansien maiden kansalaisten kotouttamiselle Euroopan unionissa	kotouttamiselle	4	Minen
Meille kerrotaan tänään epäilemättä , ettei Belgian lainsäädäntöä , jolla nämä direktiivit pannaan täytäntöön , sovelleta komissioon julkisena hallintona , ja kuitenkin nämä opettajat palkattiin belgialaisin työsopimuksin , joihin sovelletaan Belgian työlainsäädäntöä .	opettajat	23	Ja
Autojen tyhjäkäyttämisestä on ehdottomasti luovuttava .	tyhjäkäyttämisestä	1	Minen
Turun yliopiston koulutus- ja kehittämiskeskuksen johtaman valtakunnallisen Aitoja makuja –hankkeen tarkoituksena on lisätä pienyrittäjien näkyvyyttä ja löydettävyyttä niin ruoka-alan ammattilaisten kuin suuren yleisön keskuudessa .	pienyrittäjien	13	Ja
Ranskalainen pyöräytti Citroeninsa neljännellä Mangen 1:sen erikoiskokeella , eikä talli saanut huoltotauolla ennen viidettä Stensjön 2:sen erikoiskoetta hänen autoaan kuntoon .	Ranskalainen	0	Lainen
Kun lapset tutustuivat tieteeseen ja tutkimukseen , viihtyivät heidän vanhempansa lauantaina äiti- ja isäparkissa , jossa professori Hannu Ruonavaara puhui asuntovarallisuudesta vanhuudenturvana ja PsT Katja Valli kertoi lasten nukkumisesta ja unennäöstä .	asuntovarallisuudesta	20	Vs
Maailman suurin hiukkaskiihdytin ja hadronien törmäytin saattaa tiedemiesryhmän mukaan aiheuttaa maailmanlopun .	maailmanlopun	10	U
Ruotsi sen sijaan on menettänyt hieman kiinnostavuuttaan suomalaismatkailijoiden keskuudessa , ilmenee Tilastokeskuksen selvityksestä .	suomalaismatkailijoiden	7	Ja
( 5 ) Kuluttajien akuuttia altistumista näille torjunta-aineille kaikkien sellaisten elintarvikkeiden välityksellä , jotka saattavat sisältää jäämiä , on tarvittaessa arvioitu yhteisössä käytettyjen menettelyjen ja käytänteiden mukaan ottaen samalla huomioon Maailman terveysjärjestön julkaisemat ohjeet .	altistumista	5	Minen
Tilastoissa asuntojen hintojen nousu näyttää maltilliselta ja omistusasuminen vaikuttaa vuokraamista viisaammalta .	omistusasuminen	7	Minen
Molemmat olivat kovin kiinnostuneita ja he olivatkin heti ottaneet yhteyttä tutkimusvastaavaan , joka oli sanonut isäni täyttävän kaikki kriteerit .	yhteyttä	9	Vs
Sanomalehti El Paísin mukaan kone olisi yrittänyt nousua kertaalleen ennen sen ajautumista ulos kiitotieltä .	ajautumista	11	Minen
Yhdysvaltalaisyrityksen perustajiin kuuluvan Nina S. Zagatin mukaan uudella toimintakentällä aiotaan edetä varovaisissa merkeissä .	perustajiin	1	Ja
Lauantaina 9. helmikuuta rallissa on edessä kuusi erikoiskoetta , joilla on pituutta yhteensä noin 120 kilometriä .	pituutta	11	Vs
Turun yliopiston tuottaa eri alojen asiantuntijoita ja tutkimusta yhteiskunnan jokaiselle sektorille .	asiantuntijoita	5	Ja
Tällaiset ruohonjuuritason merkit , vaikka vaikeatulkintaisia ja osin ongelmallisia ovatkin , herättävät optimistissa toivoa länsimaisen yhteiskunnan kehittymisestä inhimillisempään ja sosiaalisesti vastuullisempaan suuntaan .	kehittymisestä	16	Minen
Kuvia saavutuksestamme ei ole esittää , sillä värvätty kuvaaja koodasi eikä huomannut tapahtumia .	kuvaaja	8	Ja
Suomalaisten ikääntyessä myös asuntorakentamisen vaatimukset muuttuvat .	asuntorakentamisen	3	Minen
Sauna myös kirvoitti kielenkantoja laulun muodossa , kuten perinteisestikin .	laulun	4	U
Sen vuoksi valiokunta päätti esittää tarkistuksia , jotka estävät tällaisen rehujen palauttamisen .	palauttamisen	11	Minen
Innostus soutamiseen on kasvanut kovasti .	soutamiseen	1	Minen
Laskeutuja lähetti tietoja luotaimen kiertoradalla sijaitsevan satelliittiosan radiolinkkiin .	Laskeutuja	0	Ja
Käsittelyn aikana ei käytetty yhtäkään puheenvuoroa muutosesityksistä puhumattakaan .	Käsittelyn	0	U
Suuntaamisen jälkeen okulaarista näkyi tummalla taustalla punertava läikkä .	Suuntaamisen	0	Minen
Kirjoittaja sai http-paketin osumaan mutta väärin sijoitettu irc-paketti vei mahdollisuudet voittoon .	Kirjoittaja	0	Ja
Eurooppalainen ympäristölainsäädäntö ei ole turhaa , koska esimerkiksi ilmansaasteilla ja veden saastumisella on rajat ylittäviä vaikutuksia .	saastumisella	11	Minen
Daniel " Dan " Boyle ( s. 12. heinäkuuta 1976 Ottawa , Ontario ) on kanadalainen jääkiekon ammattipelaaja , joka nykyisin edustaa San Jose Sharksia National Hockey Leaguessa .	ammattipelaaja	17	Ja
Ylhäällä taasen on ylinen , eräänlainen ideaalimaailma , jota asuttavat myös suuret jumaluudet , kosmoksen luojat .	jumaluudet	12	Vs
* 7. toukokuuta 2009 : Venäjän ja Georgian neuvottelut jäihin	neuvottelut	8	U
4. Ihmisoikeudet ja perusvapaudet kuuluvat erottamattomasti ja olennaisen tärkeänä osana toimintakehykseen , joka ohjaa Euroopan unionin ja sen Välimeren alueeseen kuuluvien kumppanien suhteita niin alueellisesti Barcelonan prosessin / Euro-Välimeri-kumppanuuden yhteydessä kuin Välimeren alueen kumppaneiden kanssa tehtyjen kahdenvälisten assosiaatiosopimusten kautta .	Euro-Välimeri-kumppanuuden	28	Vs
Ajomatkan kotiin keskeytti hesepysähdys ja Pedobearin ilmestyminen takapenkin porno-huuruihin .	ilmestyminen	6	Minen
* Volgan türki , jota käytettiin Kazanin kaanikunnan kukistumisen jälkeen 1600-luvulta 1900-luvun alkuun saakka Volgan ja Uralin alueella .	kukistumisen	8	Minen
( 4 ) Kuluttajien elinikäistä ja lyhytaikaista altistumista tämän direktiivin soveltamisalaan kuuluvalle fenamifossille elintarvikkeiden välityksellä on arvioitu yhteisössä käytettyjen menettelyjen ja käytänteiden mukaan ottaen samalla huomioon Maailman terveysjärjestön julkaisemat ohjeet ( 7 ) .	altistumista	7	Minen
Niinpä tulin kuljeskelemaan alakertaan ja kauhistelemaan sotkua , joka ei edes ole mikään massiivinen .	sotkua	6	U
Kyselystä ilmenevien logistiikkayritysten positiivisten suhdannenäkymien taustalla ovat odotukset palvelujen kysynnän elpymisestä .	elpymisestä	10	Minen
Työryhmä ehdottaa mediamaksua YLEn rahoittamiseksi	mediamaksua	2	U
Vertailua vuokra-asumiseen voi tehdä tarkastelemalla vapaarahoitteisten asuntojen vuokria Helsingissä .	Vertailua	0	U
- Vaikka normaalinaama suomalaisella olisi maansa myynyt niin kyllä sitten juhlan tullen osataan juhlia ja juhlia kunnolla ! :)	suomalaisella	3	Lainen
Venäläiset haluaisivat aikaistaa yhden Helsingistä lähtevän Allegro-vuoron lähtöä , jotta jatkoyhteyksissä voitaisiin käyttää Pietarin metroa .	Venäläiset	0	Lainen
Risperidon vähentää käyttäjänsä käytöshäiriöitä , mutta se salpaa serotoniinireseptoreita joten se voi lisätä fyysistä aktiivisuutta .	aktiivisuutta	14	Vs
- Ihmiset ovat kertoneet kohdanneensa muun muassa enkeleitä , perheenjäsenen kummituksen , tunnistamattoman ihmisen muotoisen hahmon , paholaisen , jeesuksen , jumalan tai eläimen , kertoi Kirsi Hänninen vierailuluennolla nykysuomalaisten yliluonnollisista kokemuksista .	paholaisen	17	Lainen
Naapuri tai joku ohikulkija juoksee huutaen olenko kunnossa .	ohikulkija	3	Ja
Luennon jälkeinen lounastauko kuluu raivoisaan selviytymistaisteluun Macciavellin keskipäivän jonoviidakossa , ja ruokapöytäkeskustelu pyörii muuan nimeltä mainitsemattoman kahden opintopisteen kurssin aiheuttaman infernaalisen työmäärän ja tästä syntyvän paniikin ympärillä , minkä lisäksi jaamme ahdistuksemme myös ehtimisestä seuraavalle luennolle .	ehtimisestä	33	Minen
Miten pakolaisten ja suomalaisten kulttuurit saadaan kohtaamaan toisensa ?	pakolaisten	1	Lainen
Tässä mielessä tarkistus 10 asianmukaisesti muutettuna siten , että siihen tehdään joitakin tärkeitä mukautuksia , jotka ovat sopusoinnussa mahdollisesti löytämämme ratkaisun kanssa , voisi antaa meille mahdollisuuden päästä kompromissiin muotoilusta .	ratkaisun	20	U
Kasvun hulluina vuosina vain harvat tekivät arvonnousuilla tilin , suurin osa ei .	arvonnousuilla	6	U
Yksi Helsingin ja Pietarin välinen Allegro-junavuoro uhkaa jäädä ajamatta suomalaisten ja venäläisten aikataulukiistojen vuoksi , Etelä-Saimaa kirjoittaa .	suomalaisten	9	Lainen
Siellä ulkopuolisuuteni jatkuu ja korostuu , mutta pidän siitä : pidän roolistani tarkkailijana .	tarkkailijana	12	Ja
– Hoitotieteellisesti ajatellen potilaalla on oikeus kaikkeen tietoon , joka jollain tavalla liittyy hänen sairauteensa , professori Helena Leino-Kilpi pohti esitellessään voimavaraistumista tukevan potilasohjauksen teoreettista perustaa .	oikeus	5	Vs
– Palkkaratkaisu ei tietenkään ollut ihan tyydyttävä , mutta yhtä kaikki kompromissistahan tässä puhutaan , Utunen sanoo Ylelle .	Palkkaratkaisu	1	U
Halosen vaalikampanjalle tuli satoja tuhansia euroja ay-jäsenmaksuja - rahoja kierrätettiin SDP:n kautta	vaalikampanjalle	1	Ja
Turunen oli Viipurin maalaiskunnan taksoitussihteerinä 1921-1933 ja lastenvalvojana 1926-1944 .	lastenvalvojana	7	Ja
Olen viime kuukausien aikana tavannut irtisanottuja opettajia monta kertaa ja lukenut paljon asiakirjoja ajalta ennen irtisanomista .	irtisanomista	15	Minen
Hänen silmistään huutaa pelko miehen , josta hän on ollut vieraantumisestaan huolimatta hyvin riippuvainen , kuolemasta .	vieraantumisestaan	10	Minen
Ajoneuvoon asennettu anturi aktivoituu törmäyksen vaikutuksesta ja lähettää Euroopan laajuisen hätänumeron 112 kautta tiedon ajoneuvon sijainnista , nopeudesta ja omistajasta lähimmälle poliisille , palolaitokselle ja sairaanhoitopalveluun .	nopeudesta	17	Vs
Lupa-asioiden selvittelyä mutkistaa se , että väkeä on liikuteltu eri yritysten kautta .	selvittelyä	1	U
Uusiseelantilaiset katsovat kuten minä , suurista lasikatakombeista hiljaiselle Tyynellemerelle .	Uusiseelantilaiset	0	Lainen
Taina solmi tossunsa toistamiseen ja pompahteli vaaleanpunervassa lenkkipuvussaan verannan shakkiruudukossa kuin vaahtokarkki	lenkkipuvussaan	7	U
Pienemmän osallistujamäärän on tarkoitus taata mahdollisuus esimerkiksi juuri kysymysten esittämiseen .	esittämiseen	9	Minen
Yhtä säännöllisiä olivat nämä kävelyt lähemmäksi merta ja vasta perillä ymmärsin , miksi olin tullut .	kävelyt	4	U
Tähtikarttojen tarkastelu osoitti , että kohde oli Jupiter — tai niin ainakin oletin .	tarkastelu	1	U
Sittemmin Sturmgeist-tunnuksella esiintyneen käyttäjän YouTube-tunnus on suljettu , eikä videoita ole enää nähtävillä .	käyttäjän	3	Ja
( 2 ) Komission asetuksen ( EY ) N:o 1839/95 7 artiklan mukaisesti komissio voi asetuksen ( EY ) N:o 1784/2003 25 artiklassa säädettyä menettelyä noudattaen päättää tuontitullin enimmäisalennuksen vahvistamisesta .	menettelyä	24	U
Sosialistisen suunnitelma- ja kontrollijärjestelmän purkautuminen on johtanut Kiinassa poikkeuksellisen kirjavaan kaupunkikulttuuriin .	purkautuminen	4	Minen
Euroopan komission edustaja toimii alakomitean puheenjohtajana Euroopan yhteisön ja sen jäsenvaltioiden puolesta ja esittää näkemyksiä yhteisön toimivaltaan kuuluvista asioista .	puheenjohtajana	5	Ja
Menestynein ulkomaalainen on 2x maailmanmestari Ivan Cervantes .	ulkomaalainen	1	Lainen
Vaikka koululaiset tietävät paljon historiasta ja äidinkielestä , oppivat he kierroksella myös uutta .	koululaiset	1	Lainen
Onnittelut heille .	Onnittelut	0	U
Risperidon aiheuttaa kömpelyyttä , eikä suositella autolla ajamista eikä raskaiden työkoneiden käyttöä risperidonin vaikutuksen alaisena .	ajamista	7	Minen
3. c Kansallisten instituutioiden hallinnollisten valmiuksien lujittaminen .	valmiuksien	5	Vs
Mekko oli siis aivan liian iso edestä enkä tietenkään ollut sovittanut sitä ennen pakkaamista .	pakkaamista	13	Minen
Kokonaisuuden kruunaa upottavan pehmeä ja suorastaan nautinnollinen niskatuki .	Kokonaisuuden	0	Vs
Kuten tammikuun loppupuolella jo kirjoitin , suomensin koko ohjelman käyttöliittymän ja tuolloin oletin julkaisun tapahtuvan pian ( kehittäjiltä saatu tieto ) , mutta näin ei käynyt .	julkaisun	13	U
Tällöin komissio osallistuu alakomitean kokouksissa täysipainoisesti toiminnan suuntaviivojen ja tavoitteiden määrittelyyn .	määrittelyyn	10	U
( 8 ) Asetuksen ( EY ) N:o 2533/98 4 artiklassa säädetään , että jäsenvaltioiden on järjestettävä tilastotietojen keruu omalta osaltaan ja tehtävä EKP:n kanssa kiinteää yhteistyötä varmistaakseen perussäännön 5 artiklasta johtuvien velvollisuuksien täyttämisen .	täyttämisen	33	Minen
Hevosurheilu on toki vielä paljon kävelyä edellä siinä , että - -	Hevosurheilu	0	U
Kuinka kaiken aikaa muuttuvan , hahmottoman ja virtaavan voi asettaa pysyväksi tarkoitettuun systeemiin , ihmisten maailmankaikkeuteen ?	maailmankaikkeuteen	15	Vs
Tapahtumien kulusta Mikkosella ja Puolustusvoimien edustajilla on nyt jälkikäteen toisistaan eroava käsitys .	kulusta	1	U
Kaksikymmentä vuotta istuneen puheenjohtajan kaatajaisiin matkasi iso joukko maalaisliiton miehiä ja naisia .	puheenjohtajan	3	Ja
Hei , millainen muotibloggaaja ottaa viisi asukuvaa , joissa ei näy kuvattavan päätä eikä jalkoja ?	muotibloggaaja	3	Ja
Elämme historiallisen uudistumisen aikaa , joka avaa meille uusia ulottuvuuksia .	ulottuvuuksia	9	Vs
Toisinaan aurinko teki sitä huvikseen ja silkkaa tylsistymistään , mutta enimmäkseen rangaistakseen pahantekijöitä sekä niitä , jotka olivat jostain syystä astuneet sen tielle .	pahantekijöitä	12	Ja
Jäällä kävely avaa aina hauskoja ja erikoisia näkökulmia kaupunkiin .	kävely	1	U
Kiersin Jupiterin kuita ja juoksin Saturnuksen renkaita ympäri , ohikulkijoina komeetat hymyilivät ja meteoriittiparvet hiljaa kuiskivat ' pystyt mihin vain ' .	ohikulkijoina	9	Ja
Anttilan lääkeaineiden annostelun kehittämiseen liittyvässä perustutkimuksessa selvitettiin , miten läääkeaineiden vaikuttavien ainesosien kiteisyys tai kidetyyppi vaikuttaa lääkkeen tehokkuuteen .	kehittämiseen	3	Minen
Hän pitää rusinoista , kuorettomista nakeista , pianoista , hiuksistani ( ehkä ) , kukkien kastelemisesta , hyvinä päivinä töistään , karttapallosta , lapsistaan , koivuista , lämpimästä vedestä , maksalaatikosta , antiikkisista kynttilänjaloista , keltaisesta ja pihlajakaramelleista .	kastelemisesta	15	Minen
Suomalaiset ovat huolettomimpien EU-kansalaisten joukossa , mitä tulee ostokäyttäytymisen seurantaan .	Suomalaiset	0	Lainen
Euroopassa , joka on olevinaan sosiaalinen , tuomitsemme myös komission kyynisyyden , joka on ajanut nämä työntekijät suuriin vaikeuksiin – työntekijät , joista eräät ovat lastensa pääasiallisia elättäjiä ja joista monet ovat naisia .	vaikeuksiin	18	Vs
( 30 ) On perusteltua säätää hallintomenettelystä , jossa voidaan esittää väitteitä toimenpiteiden edunmukaisuudesta yhteisön kannalta , mukaan lukien kuluttajen edun mukaisuus , ja vahvistaa määräaika , jonka kuluessa kyseessä olevat tiedot on toimitettava , sekä vahvistaa osapuolien tiedonsaantioikeudet ;	edunmukaisuudesta	13	Vs
