Suullisen perimätiedon mukaan Isonvihan aikana mantereelta väkeä muutti asumaan Mikkelinsaarten Västra Finnholmenille pakoon venäläisiä , josta venäläiset lopulta heidät löysivät .	venäläiset	16	Lainen
Ravinto on niin monimutkainen asia , että on vaikeaa etukäteen arvioida , mitä seurauksia on jonkin tietyn ruoan runsaalla nauttimisella joka päivä .	nauttimisella	19	Minen
Tuoreessa teoksessa tarkastellaan Kiinan kaupunkien monimutkaista muutosta ja kiinnitetään huomiota muun muassa kaupunkisuunnitteluun .	kaupunkisuunnitteluun	12	U
Arvoisa puhemies , mietinnön esittelijänä ja asiasta vastaavana ryhmäni edustajana voin sanoa aivan päinvastaista .	edustajana	9	Ja
Pääkaupunkiseudulla nousua oli 3,7 prosenttia .	nousua	1	U
Nielun ylipapit kiljuivat saadakseen äänensä kuuluville väenpaljoudessa .	Nielun	0	U
Ratkaisut on mukautettava jäsenvaltioiden erilaisiin eläkejärjestelmiin .	Ratkaisut	0	U
Annetaan ihmisille esim. tiedotuskampanjoiden , näyttelyjen ja monikulttuuristen tapahtumien välityksellä enemmän tietoja maahanmuuttajista , jotta heidät hyväksytään paremmin yhteiskunnassa	näyttelyjen	5	U
Savugeneraattori on yksinkertaisimmillaan eräissä moottoritorpedoveneissä ; venäläiset kehittivät erittäin suositun keinon : he laskivat erillisestä putkistosta raakaa naftaa torpedoveneen kuumiin pakoputkiin , jolloin nafta kiehui ja muodosti paksua savua .	savua	28	U
Vertaisverkkoliikenteen ( P2P ) suhteellisesta määrästä Internetin dataliikenteestä ja tiedostojen jakamisen yleisyydestä eri maissa on saatu tuoretta tutkimustietoa .	jakamisen	10	Minen
Sen omistaa , tai se omistaa sinut : omaisuuden suuri paradoksi .	omaisuuden	8	Vs
Maksukorttien ja nettisivujen kautta tapahtuva seuranta huolestuttaa vain virolaisia vähemmän kuin suomalaisia .	virolaisia	8	Lainen
Ylemmän ammattikorkeakoulututkinnon huono tunnettuus vaikeuttaa tutkinnon suorittaneiden etenemistä uralla .	tunnettuus	3	Vs
Olisi vaarallista , jos jäsenvaltioihin sovellettaisiin komission ehdottamaa sanktio- ja rangaistusjärjestelmää , joka itse asiassa vahingoittaisi ammattilaisia .	ammattilaisia	16	Lainen
Hyvän kuluttajasuojan aikaansaamiseksi vaaditaan kansainvälisiä sääntöjä .	aikaansaamiseksi	2	Minen
Kilpailua on lisättävä noudattamalla paremmin julkisiin hankintoihin ja yksityistämiseen sovellettavia sääntöjä sekä jatkamalla markkinoiden vapauttamista ja sääntelyn purkamista .	sääntelyn	16	U
Näin ollen on selvää , ettemme voi hyväksyä tarkistuksia 36 ja 66 , joissa ehdotetaan neuvoston yhteisen kannan hylkäämistä .	hylkäämistä	18	Minen
- Liberaalien valtioiden täytyy olla neutraaleja , jotta ne voivat taata kansalaisilleen riittävät edellytykset hyvään elämään , sanoi Binderup .	kansalaisilleen	11	Lainen
Kirjassa perehdytään myös siihen , miten kasvatettiin yhteinen rahvas eli yhteiskunnan vähäosaiset , joita olivat esimerkiksi tilattomien lapset , orvot , huutolaiset ja mustalaislapset .	huutolaiset	21	Lainen
Uusien omistajien mukaan he jälleenmyyvät aluksen käteiskaupalla , jos ostaja löytyy .	omistajien	1	Ja
Nimittäin tämän valiokunnan parlamentaarinen merkitys Euroopan parlamentissa , Euroopan kansalaisen oikeuksien suojeleminen ja vaaliminen antaa mahdollisuuden toimia yhteisesti institutionaalisena välittäjäelimenä .	vaaliminen	13	Minen
Pidän itseäni ennen kaikkea opiskelijana , tarkemmin yhteiskuntatieteiden opiskelijana , sen sijaan että kokisin olevani pohjimmiltani turkulaistuva raumalainen , tyttöystävä tai Walter Moersin tuotannon intohimoinen lukija .	raumalainen	17	Lainen
- kyseisellä lennolla sovellettavasta lentoliikenteen harjoittajan korvausvastuun rajasta matkatavaran tuhoutumisen , katoamisen tai vahingoittumisen yhteydessä sekä varoitus , että kyseistä määrää arvokkaammista matkatavaroista olisi mainittava lentoyhtiölle lähtöselvityksessä tai matkustajan olisi vakuutettava ne ennen matkaa ,	tuhoutumisen	9	Minen
Kuten sanottu , puolueryhmämme sai läpi suurimman osan tarkistuksistamme , mutta olisimme toivoneet näkevämme , että olisi selkeämmin painotettu sellaisten hyvin toimivien markkinoiden tärkeyttä , joilla on tehostettava toimia vääristävää valtion tukea ja monopoleja vastaan .	tärkeyttä	23	Vs
Voimme kuitenkin yrittää saada luottoluokituslaitoksilta lupauksen , joka sisältäisi muun muassa avoimuutta koskevan sitoumuksen ja jonka komissio voisi ottaa työnsä lähtökohdaksi .	avoimuutta	11	Vs
Nämä menettelyt eivät rajoita mahdollisuutta pitää vähimmäisvarantoja välittäjän kautta .	välittäjän	7	Ja
Siirtyminen pois on selvää , kun sopimukset päättyvät ja silpputyöt vaihtuvat toisiin .	Siirtyminen	0	Minen
Tuoksu on yhtä henkilökohtainen asia kuin alusvaatteet . :)	Tuoksu	0	U
Myös viisumiasioiden hyvin hoitaminen on tärkeää , sillä venäläiset matkustelevat paljon Suomessa ja Euroopassa , kuluttavat rahaa ja ostavat kiinteistöjä .	venäläiset	8	Lainen
Erityisesti Afrikassa vaaleihin liittyy usein häirintää , väkivaltaa , petoksia tai kilpailijoiden ulkopuolelle sulkemista perustuslakia muuttamalla , kuten tapahtui äskettäin Norsunluurannikolla .	sulkemista	13	Minen
Yksi vastaus kolmannen tehtävän kansainvälistämiseen on yrittäjyyteen liittyvä tutkimus- , koulutus- ja kehittämistyö , jota Turun kauppakorkeakoulun yrittäjyyden professori Antti Paasio esitteli .	kansainvälistämiseen	4	Minen
Siitepölypäiväkirjan Suomen-osuudesta vastaa Turun yliopiston aerobiologian yksikkö .	Suomen-osuudesta	1	Vs
Kuten neuvoston puheenjohtaja Lehtomäkikin totesi , EU tarvitsee selkeän suunnitelman viisumimenettelyn yksinkertaistamiseksi ja lopulta viisumivaatimuksen poistamiseksi .	yksinkertaistamiseksi	11	Minen
Maija Hakkarainen EU:n tutkimus- ja kehitystyön sihteeristöstä esitteli EU:n 7. puiteohjelman tarjoamia mahdollisuuksia rahoitukseen ja verkostoitumiseen .	verkostoitumiseen	15	Minen
EU:n kantojen aukoton johdonmukaisuus varmistetaan .	johdonmukaisuus	3	Vs
Jokaisen seminaarilaisen on palautettava jokaiselle tapaamiskerralle harjoitustyöstä eriasteisia versioita , jotka kaikki seminaarilaiset lukevat ja opponoivat .	seminaarilaiset	12	Lainen
Levy-yhtiöt haastoivat ohjelmistojen kehittäjän	kehittäjän	3	Ja
Euroopan parlamentin ensimmäinen käsittely suoritettiin ilman mietintöä , kun taas toisen käsittelyn tarkistusehdotukset liittyivät komitologiamenettelyyn ja väliaikaisen järjestelyn käyttöön ottamiseen , josta äskettäin keskustelimme .	järjestelyn	17	U
Kaudeksi 2008-09 hän siirtyi Ruotsin Elitserienissä pelaavaan Färjestads BK:hon ja voitti siellä Ruotsin mestaruuden .	mestaruuden	13	Vs
Epäilty on viimeksi työskennellyt suunnittelijana Turun yliopiston oikeustieteellisessä tiedekunnassa .	suunnittelijana	4	Ja
Vaikka jatkotutkintokokeilut alkoivat jo vuonna 2002 , kaikki eivät vielä näytä tietävän millaisesta ja minkä tasoisesta koulutuksesta on kyse .	jatkotutkintokokeilut	1	U
( 9 ) alkuvaiheessa yhteisö voi tukea jäsenvaltioita taloudellisesti tarvittavien tehtävien suorittamisessa ,	suorittamisessa	11	Minen
Louramo voitti 100 metrin juoksun Suomen mestaruuden Turussa 2001 .	mestaruuden	6	Vs
Sovun myötä palkkoja korotetaan 1. elokuuta 2011 lähtien 2,9 prosentin suuruisella yleiskorotuksella .	Sovun	0	U
Lukiolaisten Viksu-tiedekilpailu järjestettiin kahdettatoista kertaa .	Lukiolaisten	0	Lainen
7. Kansalliset keskuspankit voivat myöntää poikkeuksen arvopapereiden arvostusmuutosten ilmoittamistiheyden ja toimittamisajan osalta ja vaatia näitä tietoja vuosineljänneksittäin noudattaen neljännesvuosittain toimitettavien kantatietojen toimitusaikaa , edellyttäen että seuraavia vaatimuksia noudatetaan :	ilmoittamistiheyden	8	Vs
Mutta siinä vaiheessa , kun mies huomaa ajattelevansa alkusuhteen jatkuvien aamu- ja päiväpanojen sijaan perhettä , häitä ja yhteistä vanhuutta , iskee miehelle paniikki , että joku muukin saattaa huomata sotasaaliin sääret .	vanhuutta	19	Vs
Aikaisemmin tänä vuonna kirjoitetussa raportissa huomautettiin minikokoisten mustien aukkojen eliniän olevan lyhyt ja että LHC:n käynnistämisessä ei aiheudu vaaraa .	käynnistämisessä	15	Minen
Palautteena saa kuvaajan , josta voi todeta kuinka omat oireet vaihtelevat ja miten ne ovat yhteydessä siitepölymääriin .	kuvaajan	2	Ja
Helsingin yliopiston Juhana Aunesluoma kommentoi Obornen ajatuksia sanomalla , että ne ovat provokaatioksi tarkoitettu heitto , jossa on kuitenkin osa totuutta .	totuutta	20	Vs
Toiseksi jäsen Jarzembowski on puhunut itsekäsittelystä .	itsekäsittelystä	5	U
Keskustelu maahanmuuton ongelmista ei saa loppua siksi , että norjalainen psykopaatti teki hirveitä .	Keskustelu	0	U
Arvoisa puhemies , hyvät kollegat , kannatan tietenkin rouva Van Dijkin mietintöä , jossa on hyvä ongelmanasettelu ja jossa kuvaillaan monien kanssaihmistemme oikeutettua suuttumusta ja eläinkuljetuksiin liittyviä skandaaleita .	ongelmanasettelu	16	U
The Pirate Bay on ruotsalainen bittorrent -seurantapalvelin jolla haetaan pääosin tekijänoikeuksia rikkovaa sisältöä .	tekijänoikeuksia	10	Vs
( 1 ) Direktiivin 70/524/ETY 2 artiklan aaa alakohdan mukaisesti kokkidiostaattien liikkeelle laskemisen hyväksymiseen vaaditaan liikkeeseen laskemisesta vastaava henkilö .	hyväksymiseen	13	Minen
Roomalaiset ilmeisesti myönsivät menettäneensä Iberian Iranin kanssa solmitun Acilisenen sopimuksen jälkeen vuonna 387 .	Roomalaiset	0	Lainen
Tai se on - en oleta sitä teidän osalta , mutta niiden , jotka tekivät sopimuksen sillä tavalla ja jotka myös soveltavat turvallisuuslauseketta niin yksipuolisesti - kyynistä asianomaisen väestön ongelmien ylenkatsomista .	ylenkatsomista	30	Minen
Valtaistuinpuheessaan keisari lupasi säädyille aloiteoikeuden kaikissa muissa paitsi perustuslakikysymyksissä eli vallanjakoa koskevissa kysymyksissä .	aloiteoikeuden	4	Vs
Kotiin oli palattava Festeistä palautumisen takia .	palautumisen	4	Minen
Meidän on tehostettava näitä palveluja , päästävä eroon monopoleista , joiden vuoksi joissain tapauksissa kyseiset palvelut maksavat jossakin EU:n satamassa 3-4 kertaa enemmän kuin jossakin toisessa , mikä puolestaan tarkoittaa sitä , että jossakin on jotakin vikaa .	palveluja	4	U
Bill Clinton teki yllätysvierailun Pohjois-Koreaan ja tapasi 4.8. johtajan Kim Jong Ilin sekä amerikkalaistoimittajat .	yllätysvierailun	3	U
Algoritmien ja ohjelmoinnin peruskurssin luennoitsija vastaa anonyymisti lähetettyyn sähköpostiin .	luennoitsija	4	Ja
Eroaminen ystävistäni raastoi rintakehääni , ja kyyneleet nousivat silmiini kaikista ponnisteluista huolimatta .	Eroaminen	0	Minen
Näistä kaksi pääsuuntaa ovat sitoutuminen ja välinpitämättömyys .	sitoutuminen	4	Minen
Ruotsissa äärivasemmistolaiset ovat suojelupoliisi Säpon mukaan käyttäneet väkivaltaa demokratiaa vastaan Europarlamenttivaalien alla .	äärivasemmistolaiset	1	Lainen
Lappeenrannan laulukilpailun finalistit valittu	laulukilpailun	1	U
Turun yliopiston tutkijat olivat vahvasti esillä V-S Kulttuurirahaston tämänvuotisten apurahojen saajina .	saajina	10	Ja
Jotkut nuoremmat tieteenharjoittajat koettivat vilunkipeliä ja kuivattivat otsaansa ryppyjä alunalla tai muilla kemikaaleilla .	tieteenharjoittajat	2	Ja
Se kaarteli horjahdellen puolelta toiselle , teki yllättäviä syöksyjä , nousi taas ylemmäs ja horjahteli jälleen .	syöksyjä	8	U
Tällaisissa tapauksissa tehdään oikaisuja tuonnin ja jälleenmyynnin välisten kaikenlaisten kustannusten , myös verojen ja tullien , ja voittomarginaalin huomioon ottamiseksi luotettavan vientihinnan laskemiseksi yhteisön rajalla .	laskemiseksi	22	Minen
Panostustamme uusiutuviin energialähteisiin kuvaavien lukujen katsominen ei pelkästään riitä , sillä luvuthan ovat täysin riittämättömiä , ehkäpä meidän olisi myös uhrattava vähän aikaa siihen , että tarkastelisimme rahallisesti sitä , missä määrin panostamme muihin energiamuotoihin , erityisesti ydinenergiaan .	katsominen	5	Minen
Komissio laatii viimeistään kolmen vuoden kuluttua siitä , kun asetusta ( EY ) N:o 889/2002 ( 7 ) alettiin soveltaa , kertomuksen tämän asetuksen soveltamisesta .	soveltamisesta	24	Minen
– Jos uhri on ollut alistetussa asemassa ja hänen vapauttaan on rajoitettu , on kyse ihmiskaupasta .	vapauttaan	9	Vs
Jotta saatte käsityksen Arduinon suosiosta ja mahdollisuuksista , suosittelen katsomaan nämä pätkät Youtubesta : Arduino High Speed Photography Trigger Collin's Lab : USB Hacking with Arduino	mahdollisuuksista	6	Vs
Puuttuvien tietojen keräämiseksi kahdella keskeisellä alalla on parhaillaan suunnitteilla toinen tutkimus valtioiden suhtautumisesta unionin alueella laittomasti oleskeleviin kolmansien maiden kansalaisiin sekä pienimuotoisempi selvitys turvapaikanhakijoiden vastaanottojärjestelyistä .	kansalaisiin	19	Lainen
American Photo Magazinen lukijat äänestivät Markin kaikkien aikojen vaikutusvaltaisimmaksi naisvalokuvaajaksi .	naisvalokuvaajaksi	9	Ja
Neuvonantajan roolista yrityskaupassa taas kertoi partner Kimmo Vilske PricewaterhouseCoopers Oy:stä .	Neuvonantajan	0	Ja
Accenturen asiakkaita ovat mm. niin monien tuntemat suuryritykset kuin julkiset toimijatkin .	toimijatkin	10	Ja
Kliinisen hoitotieteen päivässä 29.4. pohdittiin käytännön hoitotyötä ja osaamisen kehittämistä .	osaamisen	8	Minen
Myös yhden kunnan kautta keskuskuntaan vähintään 10 prosentin osuudella pendelöivät kunnat luetaan työssäkäynti-alueeseen kuuluviksi .	osuudella	8	Vs
Asuntoyhtiönlain mukaan isännöitsijä hoitaa yhtiön juoksevaa hallintoa hallituksen ohjeiden ja määräysten mukaisesti .	isännöitsijä	2	Ja
On kuitenkin tärkeää pitää kiinni siitä , että näiden rahastojen pääasiallisena prioriteettina on oltava suurimmissa vaikeuksissa olevien maiden ja alueiden sekä merentakaisien alueiden - esimerkkinä Portugali sekä Azoreiden ja Madeiran alueet - kehittäminen tavoitteenaan taloudellisen ja sosiaalisen yhteenkuuluvuuden saavuttaminen .	kehittäminen	32	Minen
On myös hyvä , että kansalaisetkin aina saavat tuoretta tietoa siitä , mihin kaikkiin suuntiin kulloinkin kuuluu olla rähmällään .	kansalaisetkin	5	Lainen
Viimeksi kuluneen vuoden aikana integraation syventämisestä talouspolitiikan puolelle on alettu puhua enemmän .	syventämisestä	5	Minen
31.1.2008 syyttäjä ensimmäisen kerran nosti syytteen The Pirate Bayn ylläpitäjiä vastaan .	ylläpitäjiä	9	Ja
Usein taloyhtiöt pyrkivät pitkäaikaisiin sopimussuhteisiin , sillä usein tapahtuva isännöitsijän vaihtaminen voi vaikeuttaa suunnitelmallista ja pitkäjännitteistä kiinteistönhoitoa .	isännöitsijän	9	Ja
Riita Kanadan ja EU: n välille syntyi 1995 , kun kalakannat siirtyivät Kanadan 200 merimailin aluevesirajan ulkopuolelle ja kanadalaiset päättivät suojella kalakantoja aluevesirajansa ulkopuolella .	kanadalaiset	18	Lainen
Kreviini-nimitystä alkoivat käyttää latvialaiset ( latviaksi krieviņi , alunperin tarkoittanut " venäläisiä " ) .	latvialaiset	3	Lainen
Otto Vilhelm ( O.V. ) Turunen ( 30. marraskuuta 1875 Heinävesi – 9. syyskuuta 1954 Mikkelin maalaiskunta ) oli suomalainen toimitusjohtaja , maanviljelijä ja sosialidemokraattien kansanedustaja .	kansanedustaja	25	Ja
Judgen isä Jim Judge oli antropologi ja äiti Margaret Blue opettaja , sekä kirjastonhoitaja .	kirjastonhoitaja	13	Ja
Tietojen keruu- ja käsittelymenetelmät on suunniteltava siten , että jäsenvaltioiden toimittamat tilastolliset tulokset täyttävät tarkkuutta koskevat vähimmäisvaatimukset , joissa otetaan huomioon jäsenvaltioiden tieliikenteen rakenteelliset ominaisuudet .	ominaisuudet	24	Vs
Mikään kamera ei voi tallentaa tuota näkyä ja taivaan syvänsinistä samettia siten , että näyttäisi koko upeutensa .	upeutensa	16	Vs
Neuvoston päätös 2005/784/YUTP , tehty 7 päivänä marraskuuta 2005 , Euroopan unionin osallistumista käsiaseiden ja kevyiden aseiden epävakauttavan keskittymisen ja leviämisen torjumiseen Kambodžassa koskevan päätöksen 1999/730/YUTP voimassaolon jatkamisesta ja sen muuttamisesta	torjumiseen	21	Minen
Vaikka sinänsä onkin tärkeää tietää , harrastaako ystävämme kaukalopalloa vai ratsastusta , ja onko hän avoliitossa vai ikisinkku , pystymme muodostamaan hänestä kokonaiskuvan vasta , kun tiedämme hänen olevan toimittaja , fysiikan opiskelija tai sairaanhoitaja .	toimittaja	29	Ja
4. Kansalliset keskuspankit määrittelevät ja toteuttavat kansalliset erityispiirteet huomioon ottaen ne tiedonantomenettelyt , joita varsinaisen tiedonantajien joukon on noudatettava .	tiedonantajien	15	Ja
On ensiarvoisen tärkeää , että etiopialaisten odotukset vaalitulosten oikeellisuudesta toteutuvat , ja vaalitarkkailuvaltuuskunta tekee kaikkensa varmistaakseen , että näin tapahtuu .	etiopialaisten	5	Lainen
Kaksikymmentätuhatta sukupolvea aiemmin heidän esivanhempansa olivat lähteneet Jumalten suuressa arkissa matkalle avaruuden halki , uudisraivaajiksi Luvattuun Maahan .	avaruuden	11	Vs
Museoviraston ylijohtaja Henrik Lilius esitti , että yksi mahdollinen selitys tutkakuvassa ilmenneelle heijastumalle voisi olla vanha tykki .	ylijohtaja	1	Ja
Anja kertoo puhuneensa useiden kyläläisten kanssa koulun johtajaopettajan käytöksestä .	kyläläisten	4	Lainen
Uuden vuoden lumous ei ole vain tämä hetki .	lumous	2	Vs
Kyselyn mukaan vauraat ovat valmiita myös tinkimään kotitalousvähennykseen oikeuttavien töiden teettämisestä , jos kotitalousvähennykseen kosketaan .	Kyselyn	0	U
Vuoden vaihtuessa mielen valtaa puhtaus , kirkkaus ja uudistuminen .	kirkkaus	6	Vs
Olenko ihan oikeasti empimässä sitä , voisiko vanha isäni päästä ilmaiseksi tutkimukseen , jossa tarkkaillaan hänen sairautensa etenemistä ja otetaan kaikki sellaiset kokeet , mitä julkisella puolella ei edes harkita .	sairautensa	16	Vs
Kielellä on rikas uskonnollinen ja historiallinen kirjallisuus .	kirjallisuus	6	Vs
Uhreista opiskelijoita oli seitsemän , viisi poikaa ja kaksi tyttöä .	opiskelijoita	1	Ja
Myymäläautojen " nousu ja tuho " liittyvät Lehtosen mukaan kiinteästi Suomessa tapahtuneeseen suureen murrokseen , jonka keskeisiä piirteitä ovat elinkeinorakenteen muutos , maaltapako ja autoistuminen .	autoistuminen	24	Minen
Rytmitajua tytöllä ei koskaan ole ollut myöskään toisten ihmisten kanssa .	Rytmitajua	0	U
Kreviinit olivat Latvian alueella eläneitä vatjalaisia .	vatjalaisia	5	Lainen
Paljon melua tyhjästä .	melua	1	U
Arduino on hyvin suosittu ympäri maailmaa , koska se on halpa , helppo ja nopeasti opittava alusta , jolla voi kehittää vaikka mitä yksinkertaisesta ledin vilkuttelusta 3D-tulostimiin saakka .	vilkuttelusta	25	U
Jokaisen seminaarilaisen on palautettava jokaiselle tapaamiskerralle harjoitustyöstä eriasteisia versioita , jotka kaikki seminaarilaiset lukevat ja opponoivat .	seminaarilaisen	1	Lainen
Taitava rakastaja kiihottaa ensiksi naisen vähiten erogeenisiä alueita .	rakastaja	1	Ja
* Tekstin visuaalinen muotoilu ( visual mode ) , eli " tekstipohjainen graafinen muotoilu " .	muotoilu	3	U
Annetaan työnantajille ja koulutuslaitoksille tietoa tutustuttamiskursseilta saatavista todistuksista , jotta voidaan edistää pääsyä työmarkkinoille ja lisäkoulutukseen	työnantajille	1	Ja
Päätöksen myötä hänen presidenttiytensä voi jatkua niin kauan kuin hän haluaa asettua uudelleen ehdolle .	presidenttiytensä	3	Vs
Bremerin mukaan stadilaisen erottaa böndestä se , että bönde yrittää olla stadilainen , kun taas stadilainen on stadilainen .	stadilaisen	2	Lainen
Alku näytti pahalta , koska mestaruusvyöt olivat hukassa ja katsomoon varattu Deltan lippu oli jäänyt autoon .	Alku	0	U
Yksi SOKRATES-ohjelman tavoitteista on edistää " eurooppalaista ulottuvuutta " opetuksessa , samalla kun sillä on " pystytty edistämään perustamissopimuksen 126 artiklassa määritellyn tavoitteen saavuttamista " , kuten mietinnössä on mainittu .	ulottuvuutta	7	Vs
Puulämmitteisyydestä johtuen savusaunan lämmittämiseen voi mennä tunteja ja sen sisätilat ovat savusta johtuen nokiset , minkä vuoksi siellä on yleensä melko hämärää ; myös mahdolliset ikkunat nokeentuvat nopeasti .	lämmittämiseen	3	Minen
Tai tekemistä ja tekemistä .	tekemistä	1	Minen
Libuše ( saks. Libussa tai Libuscha ) oli Přemyslidien hallitsijasuvun perustaja ja tšekkiläisten myyttinen esiäiti .	tšekkiläisten	12	Lainen
Nyt olemme kuitenkin tilanteessa , jossa samat ihmiset , jotka vaativat , että meidän on kehitettävä meriliikennettä , toisinaan myös vaikeuttavat kilpailukykyisemmän ja uusiin olosuhteisiin paremmin soveltuvan meriliikennejärjestelmän luomista .	luomista	28	Minen
Kiristelen hampaitani kun portaissa alaspäin on niin paljon jonoa että ohittamisesta on yhtä vähän hyötyä kuin Helsinki-Porvoo -tiellä .	ohittamisesta	10	Minen
Tässä asetuksessa ilmaisuilla " tiedonantajat " , " rahaliittoon osallistuva jäsenvaltio " ja " jossakin maassa oleva " on sama merkitys kuin niille on määritelty asetuksen ( EY ) N:o 2533/98 1 artiklassa .	tiedonantajat	4	Ja
Kuluttajaa kiinnostaa hänen oma työtilanteensa ja oma palkkanauhansa	Kuluttajaa	0	Ja
400 metrin juoksun mestaruuden hän voitti 1995 .	mestaruuden	3	Vs
Juhlaviikkojen lisäksi Helsingin olisi selviydyttävä tulevasta kulttuuripääkaupunkiudestakin .	kulttuuripääkaupunkiudestakin	6	Vs
* 13. toukokuuta 2009 : Mitro Revon eurovaaliehdokkuus ongelma ortodoksiselle kirkolle	eurovaaliehdokkuus	7	Vs
Suru , jonka muut ohittavat huulien mutristamisella ja lauseella " eihän se voi olla kuollut ! " .	mutristamisella	6	Minen
Se arvioi erityisesti lainsäädäntöjen lähentämisessä , täytäntöönpanossa ja soveltamisessa tapahtunutta edistystä .	soveltamisessa	8	Minen
Useimmat uusista jäsenvaltioista eivät ole vielä nimenneet yhteyspisteitään , joten ne osallistuvat EMN:n toimintaan tarkkailijoina .	tarkkailijoina	14	Ja
Antibiooteilla kyllästetyssä lihassa on lääkkeelle vastustuskykyisiä bakteereja , jotka voivat siirtyä lihan syöjään , kirjoittaa Aamulehti .	syöjään	12	Ja
Nykyisin hän on hieronta- ja akupunktio-alan yrittäjä sekä toimii hiihtovalmentajana .	yrittäjä	6	Ja
Kun he sitten kokoontuivat yhteiseen neuvonpitoon , heillä oli monta valmista huippuyliopistoksi tulemisen mallia .	tulemisen	12	Minen
McCainilla ja Obamalla ensimmäinen väittely	väittely	4	U
* 1970 – Neuvostoliittolainen kuukulkija Lunokhod 1 laskeutui Kuuhun .	kuukulkija	4	Ja
Kirjan Taistelu sosiaaliturvasta - Ammattiyhdistysväen toiminta sosiaaliturvan puolesta 1957-1963 mukaan työnantajian asiaa ajanut oikeisto on vastustanut sosiaaliturvan kehittämistä .	työnantajian	10	Ja
Ruotsalainen ja Säkö selittävät , että Accenturen toiminta jakaantuu karkeasti kolmeen osaan : liikkeenjohdon konsultointiin , järjestelmäintegraatio- ja teknologiakonsultointiin ja ulkoistuspalveluihin .	ulkoistuspalveluihin	20	U
Kansainvälisen siirtolaisjärjestön IOM:n johtajien mukaan on tärkeää tunnistaa uhrit , tukea laillista maahanmuuttoa laittoman siirtolaisuuden torjumiseksi ja tiedottaa ihmiskaupan muodoista kuluttajien vastuun parantamiseksi ja ihmiskaupan ylläpitämisen sijaan sen torjumiseksi .	siirtolaisuuden	14	Vs
Lainsäädännössä ei ole asetettu nimenomaisia pätevyysvaatimuksia isännöitsijäksi valittavan henkilön kyvyille ja taidoille .	isännöitsijäksi	6	Ja
Niissä tapahtuu EU-oikeuden jokapäiväinen soveltaminen .	soveltaminen	4	Minen
Viini on vaaleankeltainen , tuore ja tuoksultaan raikkaan hedelmäinen .	tuoksultaan	6	U
Vaikka mitään koulutusta ei suoranaisesta vaadita isännöitsijältä niin , isännöitsijöille järjestetään nykyään myös ammatillista koulutusta mm. Kiinteistöalan Koulutuskeskuksessa Helsingin Malmilla .	isännöitsijältä	6	Ja
Lisäksi hyönteismyrkkyjen liiallinen käyttö uhkaa paljasnaamalepakon tulevaisuutta .	tulevaisuutta	6	Vs
* 29. huhtikuuta 2009 : Kantelu Pohjan seurakunnan kirkkoherrasta tuomiokapitulille	Kantelu	5	U
Todellisuudessa mikään ei ole kuitenkaan kunnossa , jos vähemmistöllä on ollut hyvät perustelut ja jos päätöstä ei sovelleta käytäntöön .	Todellisuudessa	0	Vs
Kansallisten yhteyspisteiden kahdenväliset yhteydet ovat lisääntyneet verkoston toiminnan edetessä .	yhteydet	3	Vs
Kolmannessa erässä luovuttiin kokonaan vaihtopelaajien käytöstä ja joukkueemme peli loksahti kohdalleen .	vaihtopelaajien	4	Ja
Tästä syystä koko euroalue on nyt valtavissa vaikeuksissa , jotka pääsivät syntymään vain siksi , että aikanaan oli epäkorrektia epäillä pyhän euroideologian puhtautta .	puhtautta	22	Vs
Pääomasijoittajan näkökulmasta asiasta puhui toimitusjohtaja Panu Routila Ahlström Capital Oy:stä .	Pääomasijoittajan	0	Ja
Vähäisiä julkisen vallan käyttömahdollisuuksia on delegoitu lailla myös yksityisille kansalaisille ( esimerkiksi kalastuksenvalvojat ) , julkisomisteisille liikelaitoksille ja yksityisille yhteisöille ( esimerkiksi yksityiset perusopetuksen antajat ) .	kalastuksenvalvojat	12	Ja
Keskipäivän tienoilla SFO:n kokouksen päättymistä odotellessa osa festiläisistä paneutui kadonneesta lokivihkosta saatujen mahdollisten havaintojen tarkistamiseen .	tarkistamiseen	14	Minen
Yhden pisteen saa kun on päässyt Taiteilijaseuran vuosinäyttelyyn .	vuosinäyttelyyn	7	U
Pyöräilyn monumenteissa hän on sijoittunut toiseksi Pariisi–Roubaix'ssa 1994 , Flanderin ympäriajossa 1995 ja 1996 sekä Milano–San Remossa 2000 .	Pyöräilyn	0	U
Kuninkaalliset häät oli ihan jees , ikävästi vaan toi meidän excu konsulttifirmaan häiritsi katsomista , uskomatonta !	katsomista	13	Minen
Tietysti jätin kaikista mahdollisista tavaroista kameran kotiin Hollantiin , just tällaisena viikonloppuna kun olis ehkä halunnutkin tallentaa tapahtumia .	viikonloppuna	11	U
