Poliisin epäilee vuosina 2005–2008 tehdyistä törkeästä petoksesta vakuutusyhtiön työntekjöinä olleita vahinkotarkastajia ja useita suomalaisia yrityksiä .	vahinkotarkastajia	10	Ja
Eurooppa olisi kilpailukykyisempi palvelun tarjoaman koulutuksen vuoksi , ja palvelun suorittaneista tulisi aktiivisempia , asioista enemmän perillä olevia ja kilpailukykyisempiä kansalaisia .	kansalaisia	20	Lainen
Kotouttaminen liittyy kiinteästi useaan EU:n politiikan alaan .	Kotouttaminen	0	Minen
Niitä tarkistuksia , joilla mahdollisuuksia itsekäsittelyyn rajoitetaan monella tavalla muun muassa niin , että oikeus itsekäsittelyyn rajoitetaan koskemaan ainoastaan merellä työskentelevää henkilökuntaa , ei voida hyväksyä .	itsekäsittelyyn	5	U
Mediamaksu tulisi käyttöön vuonna 2011 .	Mediamaksu	0	U
He lähettivät sanansaattajia kaukaisiin maihin ja kirjoittivat pitkiä artikkeleita vierasmaalaisiin lehtiin saadakseen edes pienen vinkin .	sanansaattajia	2	Ja
Joskus lääkkeen käytön jälkeen tai seuraavana aamuna herätessä voi ilmetä huimausta tai päänsärkyä tai ihottumaa tai vatsavaivoja tai äärimmäisen harvinaisissa tapauksissa vaurioituneita maksoja .	huimausta	10	Vs
Jos matkustaja kuolee tai loukkaantuu , lentoliikenteen harjoittajan on suoritettava ennakkomaksu välittömistä taloudellisista tarpeista huolehtimiseksi 15 päivän kuluessa siitä , kun korvaukseen oikeutettu henkilö on yksilöity .	ennakkomaksu	10	U
Laajempi yhdentyminen toisi mukanaan myös poliittista vastustusta , kun kansallisvaltiot joutuisivat luopumaan itsemääräämisoikeudestaan .	itsemääräämisoikeudestaan	12	Vs
3. b Ihmisoikeuksia ja perusvapauksia koskevien keskeisten kansainvälisten yleissopimusten ratifiointi ja täytäntöönpano sekä edistyminen Tunisian allekirjoittamiin yleissopimuksiin liittyvien valinnaisten pöytäkirjojen ratifiointimenettelyssä .	edistyminen	13	Minen
Vanhaa tietä on käyttänyt päivittäin noin 9_000 autoilijaa , joista nyt 6_000: n arvellaan siirtyvän uuden ohitustien käyttäjiksi .	autoilijaa	7	Ja
Tätä asetusta ei saa tulkita niin , että sillä olisi vaikutuksia perusoikeuksien , mukaan lukien lakko-oikeus , käyttämiseen sellaisina kuin ne jäsenvaltioissa tunnustetaan .	lakko-oikeus	15	Vs
Onnettomuus ja vammautuminen eivät kysy varallisuusasemaa , niinpä ei vakuutuskorvauksenkaan tulisi olla siitä riippuvainen .	vammautuminen	2	Minen
Hän on suorittanut monia vartiointi- ja turvallisuusalan kursseja sekä työskennellyt kahtena kesänä vartijana Turun vankilassa 1990-luvulla .	vartijana	12	Ja
Kun naisen silmistä näkyy luottavainen varmuus tulevasta nautinnosta ja siitä , ettei mies voi tehdä mitään väärää , sekä halu rakastella miehen kanssa , mies innostuu valtavasti .	varmuus	5	Vs
Katson , että jos aioimme vakuuttaa kansalaiset Euroopan parlamentin vaalien tärkeydestä , meidän on onnistuttava hyvin perustuslain laadinnassa .	tärkeydestä	10	Vs
Olisin kiitollinen kuullessani , mitä aiotte tehdä , sillä Euroopan unioni ei voi selvästikään hylätä Kyproksen turkkilaisia , niin kuin se tällä hetkellä tekee .	turkkilaisia	16	Lainen
Velkaantuneiden määrästä kertovat myös tilastot velkajärjestelyistä .	velkajärjestelyistä	5	U
Eurooppalaisten siirtolaisten tulo kuitenkin jatkui ja Te Rauparaha kieltäytyi myymästä heille uusia alueita .	siirtolaisten	1	Lainen
Onnettomuuden syy ei ole vielä tiedossa .	Onnettomuuden	0	Vs
Tässä ohjelmassa olisi esitettävä aikataulu liittymistä valmistelevaan kumppanuuteen sisältyvien ensisijaisten tavoitteiden ja välitavoitteiden saavuttamiselle .	liittymistä	5	Minen
1. EKP laatii ja ylläpitää liitteessä I olevan 1 osan I kohdassa määrättyjen luokitusperiaatteiden mukaisesti tilastoinnissa käytettävän rahalaitosten luettelon ottaen huomioon tällaisen luettelon EKPJ:n vähimmäisvarantojärjestelmän yhteydessä tapahtuvan käytön toistuvuutta ja oikea-aikaisuutta koskevat vaatimukset .	toistuvuutta	28	Vs
Seminaaripäivän keskeisestä teemasta , tutkimusrahoituksesta Minttu Jaakkola kertoo , että TCSM:n tutkijoista osa on menestynyt rahoitushauissa erittäin hyvin .	rahoitushauissa	15	U
Sebamed on erittäin riittoisaa , pari pisaraa riittää kasvojen pesuun .	pesuun	9	U
Kyrillisiä näppäimistöjä käytetään kyrillisin kirjainmerkein kirjoitettujen kielten kirjoittamiseen .	kirjoittamiseen	7	Minen
Inglés on yksi suomalaisten suosituimmista lomakohteista .	suomalaisten	3	Lainen
Mary Ellen Mark ( s. 20. maaliskuuta 1940 , Philadelphia , Pennsylvania ) on yhdysvaltalainen valokuvaaja .	valokuvaaja	15	Ja
Nielun ylipapit kiljuivat saadakseen äänensä kuuluville väenpaljoudessa .	väenpaljoudessa	6	Vs
Kuvaukset ajan aateliston elämästä Suomessa ovat suomalaisen kirjallisuuden klassikoita .	kirjallisuuden	7	Vs
Rahoittavat yritykset ja jäsenvaltioiden valvovat viranomaiset reagoivat tähän erilaisin keinoin , joita olivat maksujen korottaminen , lisämaksut , eläketason alentaminen , eläkejärjestelmien sääntömuutokset ja järjestelmien sulkeminen uusilta jäseniltä .	maksujen	13	U
Mikään kamera ei voi tallentaa tuota näkyä ja taivaan syvänsinistä samettia siten , että näyttäisi koko upeutensa .	näkyä	6	U
- Tunteiden kautta puhuminen tekee ylipäätään kokemuksesta helpommin toisten kanssa jaettavan , Hänninen selitti .	puhuminen	3	Minen
Vaadimme silloin ja vaadimme nyt oppositiota pidättymään ja kehottamaan muita pidättymään kapinasta ja siihen kannustamisesta , perustuslain rikkomisesta sekä etnisiin konflikteihin lietsomisesta .	kannustamisesta	14	Minen
Tämä ei ole yllätys , koska jäsenvaltioiden eläkerakenteet ja -järjestelyt ovat huomattavan erilaisia .	-järjestelyt	9	U
Luennon päätyttyä osa läsnäolijoista siirtyi valmistautumaan illan sitsejä varten , kun taas jotkut jäivät houkuttelemaan herra luennoitsijaa mukaan sitsiin .	läsnäolijoista	3	Ja
Mainitaan vielä kuitenkin , että Asteriskin Jope-imitaattoreita on kuulemma kehoitettu pitämään turpansa kiinni niin suullisesti kuin fyysisen kontaktin avullakin , mutta emme ole vielä pystyneet vahvistamaan kyseistä huhua .	huhua	27	U
Sisäpiirikauppa on pörssiosakkeen myynti tai osto , jonka suorittaja kuuluu arvoon liittyen sisäpiiriin .	suorittaja	8	Ja
Sitäkin tärkeämpää on nyt , lähes vuosi Helsingin Eurooppa-neuvoston jälkeen , keskustella kansallisissa parlamenteissamme ja kansalaistemme kanssa Turkin liittymisen tulevaisuudennäkymistä .	liittymisen	18	Minen
Euroalueen johtajien sopiman Kreikan toisen pelastuspaketin yhteydessä tehtiin merkittäviä rakenteellisia muutoksia euroalueen väliaikaisen rahoitusvakausvälineen ERVV:n toimintavaltuuksiin .	toimintavaltuuksiin	15	Vs
Sellainen keskustelu voi ehkä myötävaikuttaa myös keskuudessamme elävien turkkilaisten siirtolaisten integroitumiseen .	siirtolaisten	9	Lainen
” Katsokaa , mitä minä tällä rakkauden julmalla valtikalla olen saavuttanut ! ”	rakkauden	6	Vs
Mies kohautti olkiaan ja jatkoi kulkuaan .	kulkuaan	5	U
Nordean mukaan " erityisen huolestuttavaa nyt julkaistuissa luvuissa on eteenpäin katsovien uusien tilausten vielä pääindeksiäkin selvempi lasku , mikä ennakoi indeksin heikkouden jatkuvan " .	heikkouden	21	Vs
Turvallisuusasiantuntija Totti Karpela hämmästyi sieppaamisesta epäillyn nimen ja kuvan tuomisesta julkisuuteen .	Turvallisuusasiantuntija	0	Ja
Tragedia Venäjän jääkiekkoliigassa : 19-vuotias pelaaja menehtyi ottelussa	ottelussa	7	U
Miesten mukaan vastuuta annetaan nuoremmillekin työntekijöille eivätkä pomot ole koko ajan olan takana komentamassa .	työntekijöille	5	Ja
( 10 ) on tarpeen säätää yksinkertaistetusta menettelystä tämän asetuksen täytäntöönpanemiseksi ja sen mukauttamiseksi taloudelliseen ja tekniseen kehitykseen , ja	mukauttamiseksi	13	Minen
Oman kanavansa saavat niin naiset sekä tv-sarjat että scifin harrastajat .	harrastajat	9	Ja
Kun otetaan huomioon viimeisen 500 vuoden historiallinen todellisuus , on yksinkertaisesti teeskenneltyä väittää , että vapaa kauppa toisi jotenkin itsestään mukanaan demokratian ja ihmisoikeudet .	todellisuus	7	Vs
Mutta mikä on sellaisen eliölajin tai -populaation merkitys , minkä kaikki ominaisuudet on luotu ärsyttämään muita .	ominaisuudet	11	Vs
Jos ehdollista vankeutta yksinään on pidettävä riittämättömänä rangaistuksena rikoksesta , voidaan sen ohessa tuomita sakkoa , tai jos ehdollinen vankeus on vuotta pidempi , tuomita vähintään 20 ja enintään 90 tuntia yhdyskuntapalvelua .	vankeus	19	Vs
Nyt 15. kerran järjestettävissä laulukilpailuissa tuomariston puheenjohtajana toimii tenori Raimo Sirkiä .	laulukilpailuissa	4	U
Ilta sujui yleisen hengailun merkeissä .	hengailun	3	U
Sulkeumien koostumusta analysoimalla saadaan tietoa metallin valmistuksesta , sillä sulkeumien koostumus heijastaa sulan käsittelyä .	käsittelyä	13	U
( 3 ) Fenamifossin osalta eräs jäsenvaltio ilmoitti komissiolle haluavansa tarkistaa kansallisia jäämien enimmäismääriä direktiivin 90/642/ETY 8 artiklan mukaisesti , sillä kuluttajien jäämille altistuminen aiheuttaa huolta .	altistuminen	23	Minen
Tässä luvussa kuvaillaan EMN:n nykytilaa eli sen toimintaa , tuloksia ja ongelmia , joiden ymmärtäminen on tärkeätä tulevasta rakenteesta päätettäessä .	ymmärtäminen	14	Minen
Maavoimilla savugeneraattoreita asennettiin joihinkin panssarivaunuihin ; samoin tykistöllä on olemassa erityisiä savukranaatteja , joiden toiminta perustuu kuoren sisällä palavaan kemikaaliseokseen ; savu purkautuu pyrstössä olevien reikien kautta .	savu	21	U
Vähemmän velvollisuudentuntoisuutta ja uurastusta painottava asenneilmasto voisikin siis olla yhteiskunnalle myös eduksi .	velvollisuudentuntoisuutta	1	Vs
Mikäli vanha mies olisi uskonut linnuille puhumiseen , olisi hän passittanut verbaalisesti tämän matkoihinsa .	puhumiseen	6	Minen
Mutta kun mä sain taas päähäni mielikuvan isoisästä soimaamassa mua sen saappaiden sotkemisesta , ni tuntu että Mollan kiinni saaminen ois pikku juttu , joten mä jätin polkupyörän sikseen ja jatkoin jalan .	sotkemisesta	12	Minen
Kaksi kesää olen haaveillut vanhanaikaisten puisten kattotikkaiden tekemisestä tai parin puutarhahuonekalun rakentamisesta , mutta vielä ei ole ehtinyt ...	rakentamisesta	11	Minen
Osa joukkueemme pelaajista oli pelin jälkeen varsin ärtynyt vastustajan pelityylistä .	vastustajan	8	Ja
Eräs sileäotsainen opiskelija , mieli vielä vapaana tiedon kahleista , totesi kilpailuvastauksessaan , että huippuyliopisto se on hännänhuippuyliopistokin .	opiskelija	2	Ja
Vastustaja pääsi iskemään helppoja maaleja , joten taukotilanne oli 9-5 Katkon joukkueen hyväksi .	Vastustaja	0	Ja
Keskuspuolustajaksi suhteellisen lyhyenä ( 5'11" , n. 180,5 cm ) hän ei taistellut ensisijaisesti korkeista keskityspalloista , vaan luotti parhaimmillaan häikäisevään nopeuteensa ja vahvaan taklauspeliin .	nopeuteensa	21	Vs
kuvasivat auringonlaskuja kaikilta mahdollisilta kallioilta kaikissa mahdollisissa turistirysissä .	auringonlaskuja	1	U
Guaramin poika ja seuraaja Stepanoz I ( hallitsi 590–627 ) alkoi kuitenkin tukea sassanideja ja yhdisti Iberian jälleen .	seuraaja	3	Ja
Laura Ling ja Euna Lee olivat rajalla tekemässä juttua pohjoiskorealaisista pakolaisista ja naiskaupasta .	pakolaisista	10	Lainen
Pururata tyhjeni kuntoilijoista , kun tieto levisi karhun liikkumisesta Lahden suosituimmalla Tapanilan lenkkeilyalueella .	kuntoilijoista	2	Ja
Myös esimerkiksi avioliiton vaikutuksia puolison sukunimeen , lasten huoltoa ja kansalaisuuden saamisen ehtoja koskevat säännökset uudistettiin sukupuolineutraaleiksi .	saamisen	11	Minen
Sahan yhteyteen nousi työläisten asuinalue .	työläisten	3	Lainen
Sen sijaan hän tuntee osan siitä paljastumisen pelosta luissaan , nostaa viltin harteilleen ja puhaltaa jäähtyneeseen teekuppiin tavan vuoksi .	paljastumisen	6	Minen
Raottanut huulensa , hengittänyt humuksesta sakeaa vettä vain uudelleensyntyäkseen omassa sängyssään , hiukset otsaan liimautuneina , mullan maku suussaan .	maku	17	U
Guaramidien tilat siirtyivät heidän sukulaisilleen Bagrationi-dynastiasta .	sukulaisilleen	4	Lainen
Naapurireviiriläiset saattavat tappaa alueelleen eksyneen naapurin nuoren yksilön .	Naapurireviiriläiset	0	Lainen
Maksuttoman palvelun avulla käyttäjä voi arvioida allergiaoireidensa yhteyttä siitepölymääriin .	palvelun	1	U
Ja luonnollisesti kun kännin suuruus ylittää tietyn kriittisen rajan , alkaa kännitzer lisätä voimasanoja tekstin joukkoon .	suuruus	4	Vs
Tanssien päätyttyä sitsaajat hajaantuivat jatkoille kukin minnekin .	sitsaajat	2	Ja
Minä laitoin koristeeksi punaherukoita mustikoiden sijaan antamaan kirpakkuutta herkulle .	kirpakkuutta	7	Vs
Sen elinympäristön laajuus on 1–10 miljoonaa neliökilometriä .	laajuus	2	Vs
Tietysti häirittiin excun pitäjää , olihan mekosta pakko vähän puhua tyttöjen kesken .	pitäjää	3	Ja
Asianomainen sihteeri kutsuu kokoukset koolle puheenjohtajaa kuultuaan .	puheenjohtajaa	5	Ja
Palvelu pelasi suhteellisen hyvin , tosin tarjoilija oli välillä matkalla jo pöydästä pois vastatessaan ruokailijoiden kysymyksiin .	ruokailijoiden	14	Ja
Nimittäin tämän valiokunnan parlamentaarinen merkitys Euroopan parlamentissa , Euroopan kansalaisen oikeuksien suojeleminen ja vaaliminen antaa mahdollisuuden toimia yhteisesti institutionaalisena välittäjäelimenä .	oikeuksien	10	Vs
Kannustetaan jäsenvaltioita kehittämään toimintamalleja , joilla tehostetaan siirtymistä työelämään	siirtymistä	7	Minen
- Opettaja , mä näin sut eilen kaupungilla .	Opettaja	1	Ja
Valitsen luovuuden , vapauden ja rakkauden .	luovuuden	1	Vs
( 16 ) Kaikille matkustajille olisi annettava perustiedot korvausvastuuseen sovellettavista säännöistä , jotta he voivat tarvittaessa ottaa lisävakuutuksen ennen matkaa .	matkustajille	4	Ja
- " tieliikenteen moottoriajoneuvolla " tarkoitetaan tieliikenteen ajoneuvoa , jonka ainoana käyttövoimana on moottori ja jota käytetään tavallisesti matkustajien tai tavaroiden kuljettamiseen maanteillä tai matkustajien tai tavaroiden kuljettamiseen käytettävien ajoneuvojen vetämiseen maantiellä ;	vetämiseen	30	Minen
Tunnetusti palokaasut ovat pahimpia tulipalon levittäjiä .	palokaasut	1	U
Väliaikainen sopimus merkitsee kumppanuus- ja yhteistyösopimuksen kauppapoliittisen osan poistamista .	kumppanuus-	3	Vs
Lahjoittajia on mukana vauvasta vaariin ja lahjoitetut summat ovat vaihdelleet kahden euron ja miljoonan välillä .	Lahjoittajia	0	Ja
* 1943 – SS-johtaja Heinrich Himmler määräsi romanit asetettavaksi " juutalaisten kanssa samaan asemaan ja sijoitettaviksi keskitysleireille " .	SS-johtaja	3	Ja
Yksi megatrendi on puhtaaseen teknologiaan satsaaminen .	satsaaminen	5	Minen
( 4 ) Luxemburgissa kokoontunut Eurooppa-neuvosto päätti , että liittymistä valmistelevan kumppanuuden toteuttamista ja edistymistä yhteisön säännöstön omaksumisessa tarkastellaan Eurooppa-sopimuksella perustetuissa elimissä .	omaksumisessa	17	Minen
Kyselyn sijoittajat uskovat , että Saksan inflaatio saattaa nousta vuoden loppua kohden , koska työttömyys on jo alempana kuin ennen kriisiä .	Kyselyn	0	U
Olen tyytyväinen mietintöön , koska sen ansiosta voidaan pelastaa satoja auto-onnettomuuksien uhreja , jotka jäävät loukkuun autoonsa eivätkä pysty käyttämään matkapuhelimiaan vammojensa vuoksi .	auto-onnettomuuksien	10	Vs
* 6. tammikuuta 2010 : Presidentti ei allekirjoittanut Icesave-talletusten takaisinmaksua	takaisinmaksua	9	U
Hänen joukkonsa taistelivat Balkanilla , ja osallistuivat taisteluun Titon partisaaneja vastaan .	taisteluun	7	U
2. Kuhunkin alaan liittyvät tilastolliset muuttujat , niiden määrittely ja niiden erittelyyn käytettyjen nimikkeistöjen tasot esitetään liitteissä .	erittelyyn	11	U
Velkaantuneen pahin virhe on ongelman kieltäminen ja sen hoitamisen viivyttely .	viivyttely	9	U
Opintojen laajuus 16 Opintopistettä .	laajuus	1	Vs
Tiistaiaamuksi alkavaksi suunnitellut pistelakot peruuntuvat sovun myötä .	sovun	5	U
Silti , se oli sellanen tuntu aina keväisin , että ties ettei nukkua paljo ehtiny ku pelloilla meni päivät ja illat .	tuntu	5	U
ell ei kulkuyhteyttä asunnon ja työpaikan välillä kerta kaikkiaan ole kieltäytyminen ei johda päivärahan menettämiseen .	kulkuyhteyttä	2	Vs
Monet etuusperusteisista eläkejärjestelmistä hyötyivät 1990-luvun noususuhdanteesta ja alensivat maksuja tai jopa luopuivat maksujen perimisestä määräajaksi sen sijaan , että ne olisivat kasvattaneet taloudellista varantoaan .	maksujen	12	U
Rahapula ja valtion nuiva suhtautuminen lannistivat oppilaitoksen innokkaimmatkin kannattajat .	suhtautuminen	4	Minen
Haluaisinkin , että hän puhuisi laajemmin taloudellisesta vapaudesta , perusoikeuksista tätä nimitettiin ennen muodolliseksi demokratiaksi , ja nyt se on meillä kaikilla sekä poliittisesta moniarvoisuudesta , jotka ovat yhteisessä kannassa esitetyt edellytykset .	vapaudesta	7	Vs
Tähän suureen saliin mahtuu tarvittaessa suurikin määrä opiskelijoita , mutta leveytensä vuoksi salissa ei ole autiota kovin pienelläkään ihmismäärällä .	opiskelijoita	7	Ja
Luokittajan mukaan Suomen näkymät ovat vakaat .	Luokittajan	0	Ja
Mahdollinen lakko voi aiheuttaa muutoksia lähtöaikoihin , joten oman lennon tilannetta kannattaa seurata esimerkiksi lentoyhtiön tarjoaman tekstiviestipalvelun kautta .	tekstiviestipalvelun	16	U
Yliopistoissa on opettajia , jotka ovat sairastuneet ja kuolemaisillaan .	opettajia	2	Ja
Kari Uusikylä ( s. 1945 ) on luovuuden ja lahjakkuuden tutkijana tunnetuksi tullut Helsingin yliopiston kasvatustieteen professori .	lahjakkuuden	9	Vs
Kun puhelinkeskustelussa antaa lausuntoja , ei voi välttyä siltä , ett eikö jotakin väärinkäsityksiä syntyisi .	puhelinkeskustelussa	1	U
Identiteettejä pyritään kokoamaan myös kulutusvalinnoilla — ilmiö , jota bränditeollisuus pyrkii kaikin keinoin käyttämään hyväkseen .	bränditeollisuus	9	Vs
Puhumattakaan lasten kasvusta .	kasvusta	2	U
Turnauksen järjestäminen oli kuitenkin vaakalaudalla koska turnaukseen oli ilmoittautunut vain kourallinen joukkueita ja liikuntasihteerillä oli muutenkin kädet täynnä töitä .	järjestäminen	1	Minen
Myös Antonio on sitä mieltä , että joukkue kaipaa uusia pelaajia mitaleille yltääkseen .	pelaajia	10	Ja
Edistetään oikeudesta perheenyhdistämiseen annetun direktiivin täytäntöönpanon yhteydessä maahanmuuttajanaisten työllistymistä muun muassa varmistamalla , että työmarkkinoille pääsyä rajoittavat esteet minimoidaan eikä niiden anneta vaikeuttaa kotoutumista	kotoutumista	23	Minen
Kuusi alakomiteaa on jo perustettu : Sisämarkkinat , Teollisuus , kauppa ja palvelut , Liikenne , ympäristö ja energia , Tutkimus ja innovaatio , Maatalous ja kalastus sekä Oikeus- ja turvallisuusasiat .	Teollisuus	8	Vs
Kotitalousvähennys on keskituloisten ja vauraiden käyttämä etuisuus , Aamulehden teettämä kysely kertoo .	kysely	10	U
Siihen kuuluu tietojen seuranta , vertailu , analysointi ja tutkiminen keräämällä jäsenvaltioista tietoja ja tekemällä omaa tutkimustyötä koko unionia käsittelevien analyysien tuottamiseksi sekä laajan tietokannan perustaminen kyseisiä tietoja varten .	vertailu	5	U
Näe , miten hävittäjällä tehdään pakkolasku , miten panda pelastuu .	pakkolasku	5	U
Kuudestatoista viran saajasta neljä oli Turun yliopistosta .	saajasta	2	Ja
- Onpa siellä kevät myöhässä ja hullut siitepölyt	siitepölyt	7	U
Tuoksu oli heikko , mutta se oli siinä .	Tuoksu	0	U
- Ihmiset ovat kertoneet kohdanneensa muun muassa enkeleitä , perheenjäsenen kummituksen , tunnistamattoman ihmisen muotoisen hahmon , paholaisen , jeesuksen , jumalan tai eläimen , kertoi Kirsi Hänninen vierailuluennolla nykysuomalaisten yliluonnollisista kokemuksista .	nykysuomalaisten	29	Lainen
Arvoisa puhemies , EU:n ja Turkin parlamentaarisen sekavaliokunnan jäsenenä käsittelen intensiivisesti Turkin unioniin liittymistä koskevia tulevaisuudennäkymiä .	liittymistä	13	Minen
Mediassa kuhistaan näistä downshiftaajiksi , suomalaisittain kohtuullistajiksi kutsuituista joutilaamman elämän ylistäjistä , jotka peräänkuuluttavat paitsi työkulttuurin hidastamista , myös yhteisöllisyyttä ja ekologisuutta .	ylistäjistä	10	Ja
Elämäntapaliiton toiminnanjohtaja Vertti Kiukas ei näe ongelmaa SDP:ltä ostetuissa tauluissa .	toiminnanjohtaja	1	Ja
On se hankalaa tämä päivittäisten asioiden hoitaminen .	hoitaminen	6	Minen
Kehumme : Penkkejä , kotoisuutta , mukavuutta , ihanuutta	ihanuutta	8	Vs
10 ) perustamissopimuksessa ei ole sen 235 artiklassa annetun toimivallan lisäksi muita määräyksiä tämän asetuksen antamiseksi tarvittavista valtuuksista ,	antamiseksi	15	Minen
Kannattaa myös pitää mielessä , ettei ylinen/alinen -jaottelu vastaa kristillistä taivas/helvetti -jaottelua .	-jaottelua	11	U
Lisäksi ohjelmassa on muun muassa anime- , manga- ja roolipeliaiheisia luentoja ja paneelikeskusteluja sekä eri harrastusyhteisöjen tapaamisia eli miittejä .	tapaamisia	16	Minen
Majuri Aarnion mukaan ei ole tavallista , että ulkopuolisia saapuisi sotaharjoituksiin sotilaspuvussa ja arvomerkit kaulassa .	sotilaspuvussa	11	U
Sänky pitää pyhittää unelle ja rakastelulle .	rakastelulle	5	U
6 ) jäsenvaltioilla on yksinomainen toimivalta yleisen järjestyksen ylläpitämisessä ja sisäisen turvallisuuden varmistamisessa sekä sen määrittelemisessä , mitkä toimenpiteet kussakin tilanteessa ja vaiheessa ovat välttämättömiä ja suhteellisia tavaroiden vapaan liikkuvuuden edistämiseksi alueellaan ,	edistämiseksi	30	Minen
Kansainvälisen siirtolaisjärjestön IOM:n johtajien mukaan on tärkeää tunnistaa uhrit , tukea laillista maahanmuuttoa laittoman siirtolaisuuden torjumiseksi ja tiedottaa ihmiskaupan muodoista kuluttajien vastuun parantamiseksi ja ihmiskaupan ylläpitämisen sijaan sen torjumiseksi .	torjumiseksi	28	Minen
Hallintovirkamies ojensi jokaiselle juhlijalle satamäärin kaavakkeita ja esitti useita niiden täyttämiseen liittyviä vaatimuksia .	täyttämiseen	10	Minen
Mutta koko tää ajattelu siis siitä että et on niinku tiukka itsekuri ja tähtää kirjallisesti määrittelemiinsä päämääriin nii eiks tää oo ihan samaa ku se mitä työssä tekee .	ajattelu	3	U
Suorakaiteen pituus kuvaa aktivaation pituutta : tyypillisesti olio aktivoituu ottaessaan viestin vastaan , ja aktivaatio päätyy paluunuoleen .	pituutta	4	Vs
On todennäköistä , että kaupungin hallinnossa on myös Neste Oilin työntekijöitä ja muita sidosryhmiä lomautuksista päättämässä .	työntekijöitä	10	Ja
Vaalien suurin voittaja oli Kokoomus joka sai 10 lisäpaikkaa .	voittaja	2	Ja
Samoin tullipalvelujen väliintulomahdollisuudet laajennetaan koskemaan kaikkia tullien toimintamahdollisuuksia , vapaaalueilla ja vapaavarastoissa olevia tavaroita sekä tullivalvonnan piiriin kuuluvia tavaroita .	väliintulomahdollisuudet	2	Vs
Taustalla voi tällöin olla esimerkiksi huoli siitä , että velka kaatuu takaajan vastuulle , hän arvelee .	takaajan	11	Ja
Voittaja oli siis KY-Hunks , mutta hienoa peliä pelasi myös joukkueemme .	Voittaja	0	Ja
” Älä stressaa ” on hyödytön neuvo , eikä laiskuuteen yllyttäminen sekään kuulosta kovin vastuulliselta .	laiskuuteen	9	Vs
Esimerkiksi valtio-opin perusopintoihin kuuluva luentokurssi vaatii takuuvarmasti eri määrän työtä ja panostusta riippuen siitä , onko kyseessä pää- vai sivuaineopiskelija .	sivuaineopiskelija	19	Ja
Tässä luvussa kuvaillaan EMN:n nykytilaa eli sen toimintaa , tuloksia ja ongelmia , joiden ymmärtäminen on tärkeätä tulevasta rakenteesta päätettäessä .	luvussa	1	U
136 matkustajaa on evakuoitu ; seitsemäntoista heistä kerrotaan saaneen lieviä vammoja .	matkustajaa	1	Ja
Liittymistä valmistelevan kumppanuuden toteuttamista valvotaan Eurooppa-sopimuksella perustetuissa elimissä ja asianomaisissa neuvoston elimissä , joille komissio raportoi säännöllisesti .	Liittymistä	0	Minen
Pidättäytymisemme äänestämästä osoittaa vastalauseemme pankkijärjestelmän niin kansallista kuin eurooppalaista järjestelmää vastaan .	Pidättäytymisemme	0	Minen
Laitan salin takaa jakoon sata kappaletta jäynäämisen perusteiden ( 0 op ) harjoitustyö I:tä .	jäynäämisen	6	Minen
Maailman suurin öljyn ja kaasun tuottaja on toistaiseksi pysytellyt WTO:n ulkopuolella .	kaasun	4	U
e ) ' erityisellä nosto-oikeudella ' tarkoitetaan Kansainvälisen valuuttarahaston määrittelemää erityistä nosto-oikeutta ;	nosto-oikeutta	11	Vs
Sovellan myös omassa oppimisessani periaatetta , että tulen koko ajan opetetuksi .	oppimisessani	3	Minen
Kansalaisia varmasti kiinnostaisi nähdä Lipponen ja Aho vastakkain .	Kansalaisia	0	Lainen
Opetusministeriön ehdotus ylioppilastutkinnon suuremmasta painotuksesta korkeakouluihin valittaessa ei saanut lukiolaisten keskuudessa kovin vahvaa kannatusta .	lukiolaisten	9	Lainen
Huomautin rouva Greenille , että ellemme me tavalliset riviedustajat olisi esimerkiksi matkustaneet polittisen ryhmän johtajan kanssa , olisimme saattaneet joutua pulaan .	riviedustajat	8	Ja
Keisari avasi valtiopäivät 15. – 19. syyskuuta pidetyissä juhlallisuuksissa .	juhlallisuuksissa	8	Vs
Tämä johti välien kiristymiseen eurooppalaisten kanssa jotka yrittivät lopulta pidättää hänet .	kiristymiseen	3	Minen
Tutkimuksessa todettiin myös , että joka viides Internetin-käyttäjä harjoitti tutkimusjakson aikana tiedostojen jakamista .	jakamista	12	Minen
Rehtorikin , joka aina sai sanat aseteltua kohdalleen , totesi jotain aiempaa ajattelijaa lainaten , että on hulluutta tehdä asiat aina samoin , mutta odottaa uusia tuloksia .	hulluutta	17	Vs
Iran hyväksyi järjestelyn vuoden 591 rauhassa , jossa Iberia jaettiin Bysantin ja Iranin välillä kahtia Tbilisissä .	järjestelyn	2	U
