Tarkoituksena oli hakea keskeltä kenttää Linuxin asennuslevyä muistuttava peliväline ja toimittaa se kotikoneelle tai vaihtoehtoisesti napata Windows-kiekko ja keplotella se vastustajan koneelle .	vastustajan	20	Ja
En alkuun ymmärtänyt kysymystä .	alkuun	1	U
Heimon miehet häpesivät kuitenkin naisvallan alla oloa , mistä suuttuneena Libuše lupasi osoittaa kansalle uuden miespuolisen hallitsijan , josta tulisi hänen aviomiehensä .	hallitsijan	16	Ja
Akateemisesti koulutettu ja tukevasti verkostoitunut viestintäammattilainen voi helposti heittäytyä freelanceriksi , aloittaa työt silloin kun toisaalla lounastetaan ja julistaa viikonloppunsa alkavaksi torstaina , mutta vaikkapa siivoojan palkalla kitkuttelevan yksinhuoltajan mahdollisuudet vastaavaan ovat varsin laihat .	viestintäammattilainen	5	Lainen
Lepakoita häiritsevät myös niiden ulostetta keräävät maanviljelijät .	maanviljelijät	6	Ja
Mikä vahinko ett ei se ole syntiä , huokailivat pariisilaiset ihastuksissaan .	pariisilaiset	9	Lainen
– Nokia tarvitsee kipeästi ensimmäiset Windows-puhelimensa pysäyttääkseen markkinaosuuden laskun ja hiljentääkseen kriitikot .	markkinaosuuden	7	Vs
Säätiö oli kuitenkin jo ennen tapauksen tultua julkisuuteen ottanut käytännöksi työnhaun yhteydessä tapahtuvan työnhakijoiden taustan tarkistamisen .	tarkistamisen	15	Minen
Yliopistolla ei ole juuri esimerkkejä edes tieteidenvälisestä kohtaamisesta , saati että mentäisiin akateemisen maailman ulkopuolelle .	kohtaamisesta	7	Minen
Sammonmaljan turnauksessa kilpaillaan Turun yliopiston ainejärjestöjen välisestä palloilulajien herruudesta .	herruudesta	8	Vs
Enintään kahden vuoden vankeusrangaistus voidaan määrätä ehdolliseksi , jollei rikoksen vakavuus , rikoksesta ilmenevä tekijän syyllisyys tai tekijän aikaisempi rikollisuus edellytä ehdottomaan vankeuteen tuomitsemista .	vankeuteen	22	Vs
Lehden mukaan taiwanilainen Android-valmistaja HTC kiri Nokian ohi .	Android-valmistaja	3	Ja
Sellaista tuskin kestää yksikään puoluejohtaja .	puoluejohtaja	4	Ja
Keskustelussa palattiin vapun jälkeiseen arkeen puhumalla talousvaikeuksiin vajonneelle Kreikalle vahvistuneesta talousapupaketista sekä tilanteen kirvoittamista kysymyksistä liittyen EU-politiikan tulevaisuuteen .	Keskustelussa	0	U
Joidenkin tarkistusten tarkoituksena näyttää kuitenkin olevan niiden toimien hidastaminen tai jopa lopettaminen , jotka on toteutettu Euroopan satamien toiminnan vireyttämiseksi ja , kuten aiemmin mainitsin , sekä vientiämme muualle maailmaan helpottavan pitkänmatkan meriliikenteen mahdollisuuksien että lyhyenmatkan meriliikenteen parantamiseksi .	vireyttämiseksi	19	Minen
Varsinkin halpatyövomana laittomat siirtolaiset ovat joustava työvoimareservi , jolla ei ole oikeuksia , oli kysymyksessä työturvallisuus , työajat tai palkat .	siirtolaiset	3	Lainen
Yö kului juhlallisen kiljahtelun siivittämänä hyvin outoa ulkomaista korttipeliä seuraten , vaikkakin eräs joukkueen jäsen olikin pelaamassa korttia aivan muualla , ihan keskellä päivää .	kiljahtelun	3	U
Fabio Baldato ( s. 13. kesäkuuta 1968 Lonigo , Vicenzan maakunta , Italia ) on entinen italialainen maantiepyöräilijä .	maantiepyöräilijä	17	Ja
Poliisi ei joutunut turvautumaan aseeseen , sillä koululaiset tottelivat poliisia .	koululaiset	7	Lainen
Oikeistolaisuuteen on perinteisesti kuulunut markkinatalouden suosiminen , vahva kansallisuusaate ja maanpuolustuksen arvostus .	Oikeistolaisuuteen	0	Vs
Illan saldona oli haalariuintia , haalaritonta uintia , skumppaa , ruotsalaisia , oululaisia ja Gambinan nautittavuuden tarkastelua .	oululaisia	12	Lainen
6. Assosiaationeuvosto on jo päättänyt perustaa assosiaatiokomitean yhteyteen alakomiteoita asianmukaisen institutionaalisen kehyksen luomiseksi yhteistyön täytäntöönpanoa ja tiivistämistä varten .	luomiseksi	12	Minen
Tämä on ensimmäinen viesti kansalaisille .	kansalaisille	4	Lainen
Keulaportin jumiutuminen kiinni viivästytti autolautta Wasa Queenin lähtöä .	jumiutuminen	1	Minen
Otin yhteyttä rautatieyhtiön pääkonttoriin ja kerroin halustani ajaa junaa .	halustani	6	U
Penkkien välissä olevat käsinojat lisäävät yksityisyyden tunnetta , mahdollistavat asentojen optimoinnin ja tuovat tyylikkään ripauksen ryhtiä penkkien muuhun pehmeyteen .	pehmeyteen	18	Vs
Akateemisesti koulutettu ja tukevasti verkostoitunut viestintäammattilainen voi helposti heittäytyä freelanceriksi , aloittaa työt silloin kun toisaalla lounastetaan ja julistaa viikonloppunsa alkavaksi torstaina , mutta vaikkapa siivoojan palkalla kitkuttelevan yksinhuoltajan mahdollisuudet vastaavaan ovat varsin laihat .	yksinhuoltajan	28	Ja
Marraskuun 1. päivän 2010 jälkeen rekisteröityneille nämä rajoitukset otetaan käyttöön kuuden kuukauden kuluttua rekisteröitymisestä .	rekisteröitymisestä	13	Minen
Tämä ei ole vain velvollisuus , vaan myös meidän etumme mukaista .	velvollisuus	4	Vs
Tarkoituksenani on aluksi hiukan harjoitella elektroniikkarakentelua ja Arduinon ohjelmointia ( ohjelmointi tapahtuu C/C++:n kaltaisella kielellä ) , jonka jälkeen lähden todennäköisesti kehittämään ainakin intervalliajastinta ja siihen moottoritoimista liikkuvaa jalustaa .	elektroniikkarakentelua	5	U
Suomalainen syö punaista lihaa keskimäärin 200 grammaa päivässä .	Suomalainen	0	Lainen
Lisäksi sanan vartalossa voi tapahtua astevaihtelua : nominativi kakku taipuu genetiiviin kakun - toinen k katoaa keskeltä sanaa .	astevaihtelua	5	U
Myöhemmät tutkimukset ovat osoittaneet ksylitolilla olevan muitakin terveyttä edistäviä vaikutuksia .	terveyttä	7	Vs
Syytettyinä ovat Pirate Bayn taustalla olevat Fredrik Neij , Gottfrid Svartholm ja Peter Sunde , sekä lisäksi liikemies Carl Lundström , joka on aikoinaan omistanut Pirate Baylle nettikapasiteettia toimittaneen Rix Port 80 -yrityksen .	Syytettyinä	0	U
" Bethin " lauluosuudet nauhoitettiin kokonaan uusiksi - alkuperäisen rumpalin Peter Crissin vokaalit korvasi silloinen kannuttaja Eric Carr .	lauluosuudet	3	Vs
Etenkin urheilijoiden ravintoa olisi säänneltävä järkevästi , koska tässä on ensiksikin kyse kuluttajan terveydestä - jotta kuluttajaa suojeltaisiin väärien tietojen aiheuttamilta pettymyksiltä ja ennakkoodotuksilta - toiseksi on kyse myös näiden elintarvikkeiden vaikutuksista .	terveydestä	13	Vs
Useat tämän ryhmän aineet aiheuttavat toistuvasti käytettynä riippuvuuden .	riippuvuuden	7	Vs
Tarjouskilpailun voittaa se tarjouksen tekijä , jonka tarjous on tuontitullin enimmäisalennuksen suuruinen tai sitä alhaisempi .	Tarjouskilpailun	0	U
Vastustajan taktiikkana oli vahva kilpikonnapuolustus johon vetomme useimmiten myös pysähtyivät .	Vastustajan	0	Ja
Lehtimajan mukaan syyttämättä jätetyllä on ratkaisun jälkeen oikeus tulla pidetyksi syyttömänä .	oikeus	7	Vs
Kari Uusikylä ( s. 1945 ) on luovuuden ja lahjakkuuden tutkijana tunnetuksi tullut Helsingin yliopiston kasvatustieteen professori .	luovuuden	7	Vs
Toisin kuin enemmistö silloisista kollegoista parlamentissa , kannatin täysin toimia , joihin kanadalaiset olivat ryhtyneet .	kanadalaiset	12	Lainen
Viimeisimmän neuvotteluista annetun tiedon mukaan osapuolten tarjoukset olivat kaukana toisistaan .	neuvotteluista	1	U
Bremerin mukaan stadilaisen erottaa böndestä se , että bönde yrittää olla stadilainen , kun taas stadilainen on stadilainen .	stadilainen	17	Lainen
Andrea oli EU-veteraani , takana 35 vuoden työura , ja oli hieno kuulla heidän tarinoitaan työskentelystä Brysselissä , kulttuurieroista , Euroopan muutoksesta jne .	työskentelystä	15	U
Savolainen on koulutukseltaan yo-merkonomi ja hieroja .	hieroja	5	Ja
( 1 ) Direktiivin 70/524/ETY 2 artiklan aaa alakohdan mukaisesti kokkidiostaattien liikkeelle laskemisen hyväksymiseen vaaditaan liikkeeseen laskemisesta vastaava henkilö .	laskemisen	12	Minen
Aikaisemmin vuonna 2009 paljastui mm. JHL:n jäsenmaksujen käyttö jättimäiseen SDP:n tukemiseen vuosina 2006-2008 .	tukemiseen	10	Minen
Falkbeerin vastagambiitti 2...d5 johtaa yleensä tasaisen oloisiin asemiin , joissa valkealla on mahdollisesti ongelmia f-sotilaan heikennyksen vuoksi , mutta hiukan paremmat mahdollisuudet päästä mustan kuninkaan kimppuun .	mahdollisuudet	21	Vs
Sätkä onnistuttiin kääntämään selällään , muttei onnistuttu hajottamaan talon ikkunoita falsettilaululla , ainakaan ennen sitsiläisten paluuta .	falsettilaululla	10	U
Täydellinen päivä nurtsilla makoilulle !	makoilulle	3	U
Tämän metallisen melun lisäksi lautaspaukuttelijan suusta alkoi tulla kovaa jodlausta , joka kieltämättä kruunasi kaiken tehden metakasta kokonaisuuden , jollaista ei voisi kuvitella lähtevän ihmisestä .	kokonaisuuden	17	Vs
Luisteluhiihdon taitajana Savolainen hiihti maajoukkueessa viestissä yleensä kolmannen tai neljännen osuuden , koska saman ajan suomalaisista naishuippuhiihtäjistä Pirkko Määttä ja Marja-Liisa Kirvesniemi olivat lähinnä perinteisen tyylin hiihtäjiä .	osuuden	10	Vs
Hallitus on keskustellut pääministerin mukaan myös sosiaalietuuksien saattamisesta veronalaiseksi .	sosiaalietuuksien	6	Vs
Sotilaspukuun ja majurin arvomerkkeihin sonnustautunut Mikkonen saapui yllättäen sotaharjoituksen tiedotuskeskukseen ja kiinnitti huomionsa paikalle olleen kersantin tapaan tervehtiä .	Sotilaspukuun	0	U
Sellaisten osapuolten , joiden välillä näyttää olevan yhtiösuhde tai hyvitysjärjestely , välisiä hintoja ei voida pitää tavanomaisessa kaupankäynnissä sovellettuina ja niitä voidaan käyttää normaaliarvon määrittämisessä vain , jos vahvistetaan , että tällainen yhteys ei vaikuta hintoihin .	määrittämisessä	24	Minen
Se ei ollut herrasmiehen ase , mutta pistoolinpiippuun tuijottaminen sai yleensä miehen miettimään tarkemmin sanojaan ja tekojaan .	tuijottaminen	8	Minen
Ylhäällä taasen on ylinen , eräänlainen ideaalimaailma , jota asuttavat myös suuret jumaluudet , kosmoksen luojat .	luojat	15	Ja
Merkittävä kysymys kuuluukin , miksi oikeudelliselta yksiköltä kysyttiin kantaa tällaiseen , jos kolmikantaneuvotteluissa ei ollut annettu tällaista taetta .	kolmikantaneuvotteluissa	12	U
Vainoharhaisuutta ja hulluutta se on .	hulluutta	2	Vs
Toivon , että voimme sovittelumenettelyssä löytää tähän sellaisen terveeseen järkeen pohjautuvan ratkaisun , joka auttaa meitä keskittämään toimet ongelmallisimpiin aloihin sen sijaan , että kulutamme aikaa , rahaa ja energiaa kansanterveysriskin kannalta vähemmän ongelmalliseen pohjaveden hallintaan .	sovittelumenettelyssä	4	U
Ja kesä kynnyksellä odotukset kohoavat korkeuksiin , kun sisäinen lapsemme haluaa sukeltaa sisälle lapsuuden kaltaiseen , ikuisuuksia kestäneeseen intiaanikesään .	lapsuuden	13	Vs
( 5 ) Kuluttajien akuuttia altistumista näille torjunta-aineille kaikkien sellaisten elintarvikkeiden välityksellä , jotka saattavat sisältää jäämiä , on tarvittaessa arvioitu yhteisössä käytettyjen menettelyjen ja käytänteiden mukaan ottaen samalla huomioon Maailman terveysjärjestön julkaisemat ohjeet .	menettelyjen	23	U
Hän tuki lähetyssaarnaajia ja lähetti mm. Pyhän Birinuksen evankelioimaan Isoa-Britanniaan .	lähetyssaarnaajia	2	Ja
Näihin kuuluvat esimerkiksi hiljattain annettu ehdotus direktiiviksi lisäeläkeoikeuksien siirrettävyyden parantamisesta ja meneillään olevat rikkomismenettelyt , jotka liittyvät eläkemaksujen yhdenvertaiseen verotukseen .	parantamisesta	9	Minen
Nelson Richard DeMille ( s. 23. elokuuta 1943 ) on yhdysvaltalainen jännityskirjailija .	jännityskirjailija	11	Ja
Suvun kaksi muuta haaraa asetettiin pian Gogarenen ja Gardmanin valtaistuimille : ne olivat kaksi Kaukasian alueen ruhtinaskuntaa , joissa kolme kansallisuutta , armenialaiset , albanialaiset ja georgialaiset , elivät yhdessä .	georgialaiset	26	Lainen
Senaatin komitea etsii nyt papereita , jotka kertovat Hillary Clintonin osuudesta Madison Guarantyn tilien hoidossa .	osuudesta	10	Vs
( 4 ) Luxemburgissa kokoontunut Eurooppa-neuvosto päätti , että liittymistä valmistelevan kumppanuuden toteuttamista ja edistymistä yhteisön säännöstön omaksumisessa tarkastellaan Eurooppa-sopimuksella perustetuissa elimissä .	kumppanuuden	11	Vs
Wilson oli ehdolla myös Grammis-palkinnon saajaksi vuoden naisartisti -sarjassa sekä Manifestin ” Pop of the year ” - ja paras live-esiintyjä -sarjoissa .	live-esiintyjä	20	Ja
Korjaussarjan kalahtelu ei kylläkään häirinnyt teekkareita , jotka valuivat festiretkeilijöiden yösijoille niiden vapautuessa .	kalahtelu	1	U
Tanssimiseen tarvitaan vakaammat jalat , liikkuvampi lantio .	Tanssimiseen	0	Minen
Positiivinen suvaitsevaisuus tarkoittaa esimerkiksi tilannetta , jossa ollaan päästy sellaiseen yhteiskunnalliseen tilaan , ettei asioita kansalaisten välillä enää tarvitse sovitella ja ihmiset hyväksyvät toistensa erilaisuuden .	erilaisuuden	24	Vs
Tällaisesta turmeltuneesta taipumuksesta on joissakin valtioissa tullut jopa todellinen kansallista urheilua .	urheilua	10	U
Kansalliset keskuspankit varmistavat , että näillä tiedonantomenettelyillä tuotetaan vaaditut tilastotiedot ja että niiden perusteella voidaan myös tarkistaa asianmukaisesti 3 kohdan mukaisten tietojen toimittamista , tarkkuutta , käsitteellistä vastaavuutta ja tarkistuksia koskevien vähimmäisvaatimusten noudattaminen .	vastaavuutta	27	Vs
Sisäpiirikauppaepäilyjä herännyt Suomessa ja Ruotsissa	Sisäpiirikauppaepäilyjä	0	U
Haluaisinkin , että hän puhuisi laajemmin taloudellisesta vapaudesta , perusoikeuksista tätä nimitettiin ennen muodolliseksi demokratiaksi , ja nyt se on meillä kaikilla sekä poliittisesta moniarvoisuudesta , jotka ovat yhteisessä kannassa esitetyt edellytykset .	perusoikeuksista	9	Vs
Sellaisten osapuolten , joiden välillä näyttää olevan yhtiösuhde tai hyvitysjärjestely , välisiä hintoja ei voida pitää tavanomaisessa kaupankäynnissä sovellettuina ja niitä voidaan käyttää normaaliarvon määrittämisessä vain , jos vahvistetaan , että tällainen yhteys ei vaikuta hintoihin .	yhteys	32	Vs
He olivat tyytyväisiä koulutuksen työelämäläheisyyteen , laadukkaaseen opetukseen sekä omaan ammatilliseen kehittymiseensä .	kehittymiseensä	11	Minen
Kesäkuussa Viroon risteili 41_000 suomalaista .	suomalaista	4	Lainen
Aamukasteen kostea nurtsi hohkaa vihreyttään auringonsäteissä .	vihreyttään	4	Vs
Prinsessan elämän erikoisuudet kahlitsivat lapsiyleisön mielenkiinnon .	erikoisuudet	2	Vs
CERN on Rösslerin kertoman mukaan myöntänyt LHC:n käynnistämisessä syntyvän mustia aukkoja .	käynnistämisessä	7	Minen
Mithridates toimi heti ja ajoi vallantavoittelijan Kappadokiasta .	vallantavoittelijan	5	Ja
Perustuslakien perusoikeudet ja kansainväliset ihmisoikeudet määrittelevät ensisijaisesti julkisen vallan ja yksityisten henkilöiden välisiä vertikaalisia suhteita .	perusoikeudet	1	Vs
Itse asiassa sen jälkeen löytyy aivan uusi energia sille tekemiselle , jonka tavaranpaljous on aiemmin tukahduttanut ! :_)	tekemiselle	9	Minen
Kiinan kaupungistumisen ilmiöistä kirjoittanut Outi Luova kertoo , että kiihkeätahtinen kaupungistuminen tarvitsee rakentamiseen ja kaupunkisuunnitteluun kansainvälistä apua .	kaupunkisuunnitteluun	14	U
Tämä ei ole ongelma , koska pilarirakenne on ainoastaan yleinen luokittelujärjestelmä , ja kaikissa kolmessa pilarissa on järjestelmiä , joissa varoja maksetaan yksittäisille edunsaajille .	edunsaajille	23	Ja
Palloset eivät maistu voimakkaasti sinihomejuustolle , joten ärtsymmästä tykkäävät voisivat lisätä esim. auramurua seokseen .	auramurua	12	U
Kun joku mainitsee epähuomiossa sanan kannustinloukku , sosiaalipoliitikot hyökkäävät kilvan todistamaan , että työttömät kyllä haluavat töihin , vaikka verojen , etuuksien laskun ja maksujen nousun jälkeen käteen jäävä raha olisi työttömyyskorvausta pienempi .	etuuksien	21	Vs
Koska tämäkin lepopäivä oli pitkä ja tylsä , kulutin aikaani tutustumalla risteilyltä saamiini kosmetiikkanäytteisiin .	risteilyltä	11	U
Pidän itseäni ennen kaikkea opiskelijana , tarkemmin yhteiskuntatieteiden opiskelijana , sen sijaan että kokisin olevani pohjimmiltani turkulaistuva raumalainen , tyttöystävä tai Walter Moersin tuotannon intohimoinen lukija .	opiskelijana	4	Ja
Kaikki tunnustavat henkilökohtaisesti tämän epäonnistumisen , mutta olisi tervettä toimia rohkeasti ja tunnustaa se julkisesti ja tehdä asiasta johtopäätökset .	epäonnistumisen	4	Minen
Tosin olihan se ihan kivaa vaihtelua , että kaikki eivät ajatelleet samalla tavalla ja sai olla erilainen kuin muut oppilaat .	vaihtelua	5	U
Pitkästä aikaa tuli viime viikonloppuna tehtyä pitsaa ...	viikonloppuna	4	U
Onnettomuus ja vammautuminen eivät kysy varallisuusasemaa , niinpä ei vakuutuskorvauksenkaan tulisi olla siitä riippuvainen .	varallisuusasemaa	5	Vs
Pituus 41–43 cm , siipien kärkiväli noin 82 cm ja paino 400 – 550 g .	Pituus	0	Vs
Agricola ja kolme vekkulia -kierroksella lähestytään historiaa oppineisuuden kautta .	oppineisuuden	7	Vs
Minulla on kiihkeähkö suhtautuminen ruokaan .	suhtautuminen	3	Minen
Sopimusta sovelletaan vain hyvin pieneen määrään ihmisiä – alle kymmenesosaan matkustavista kansalaisista – eikä sillä käytännössä yksinkertaisteta viisumimenettelyjä .	viisumimenettelyjä	17	U
Katjasta kehittyi nopeasti huippuammattilainen .	huippuammattilainen	3	Lainen
Binderup kuitenkin peräänkuuluttaa suvaitsevaisuuden lisäämistä ja kansalaisten identiteettien ymmärtämistä samanarvoisiksi .	suvaitsevaisuuden	3	Vs
Haluaisin tietää , aikooko puheenjohtajavaltio tehdä jotain Kyproksen turkkilaisia koskevassa kysymyksessä .	turkkilaisia	8	Lainen
Direktiivin täytäntöön panemiseksi toteutettujen jäsenvaltioiden toimien syvällinen analysointi ei ole vielä alkanut .	panemiseksi	2	Minen
Hoskins on myös tehnyt komediallisia töitä , kuten Brazil – tämän hetken tuolla puolen ( 1985 ) , Super Mario Bros. ( 1993 ) ja Mrs. Henderson esittää ( 2005 ) – josta hän sai Golden Globe -ehdokkuuden .	-ehdokkuuden	37	Vs
Elliott Smith kuoli vuonna 2003 34 vuoden iässä kahteen puukoniskuun rintakehässä .	puukoniskuun	9	U
Komission puolesta Frans ANDRIESSEN Varapuheenjohtaja	Varapuheenjohtaja	4	Ja
Tapahtuman muisteleminen ei naurata häntä vieläkään .	muisteleminen	1	Minen
Professori Kari Liuhto Turun kauppakorkeakoulusta kertoi näkevänsä Kansainvälisen valuuttarahaston ( IMF ) puuttumisen Kreikan tilanteeseen välttämättömyytenä .	puuttumisen	12	Minen
Lepsuilu presidentin ja hallituksen lainkäytön valvonnassa jatkunee vielä pitkään , sillä Aalto on vasta 60-vuotias .	Lepsuilu	0	U
Pulloposti on sinulle Alkon tilauspalvelun toimitus , viini punaista , vain punaista .	tilauspalvelun	4	U
− Hän on osoittanut toiminnallaan suurta rohkeutta ja näyttänyt mallia siitä , mihin määrätietoinen nuori humanisti voi pystyä , totesi vuoden humanistiteon valintaperusteet ja Carlsonin esitellyt dekaani Hiltunen .	rohkeutta	6	Vs
6. Alakomitean puheenjohtajuuteen sovelletaan EU:n osalta samoja sääntöjä kuin assosiaatiokomitean puheenjohtajuuteen .	puheenjohtajuuteen	2	Vs
Tarvitsisin hovikuvaajan ikuistamaan iltani , niin näissä kuvissa olisi edes vähän vaihtelua .	hovikuvaajan	1	Ja
– Ylemmän AMK-tutkinnon suorittaneet joutuvat työnhakutilanteissa usein selittämään tutkinnon laajuutta , sisältöä ja vastaavuutta maisterin tutkintoon nähden , koulutuksen tunnettuutta selvittäneet Loretta Galli ja Sakari Ahola Turun yliopiston koulutussosiologian tutkimuskeskuksesta toteavat .	tunnettuutta	19	Vs
Jossain puolen yön tienoilla oli tapahtunut migraatio festiläisille varattuihin makuutiloihin , jossa bileet vain jatkuivat .	festiläisille	7	Lainen
Risteily sisälsi luonnollisesti myös juoruja , kiukkua , itkua ja draamaa , mutta näin jälkikäteen mietittynä en jaksa asiasta enää jauhaa , vaikka vähän ärsyttääkin .	itkua	8	U
Nyt totuus on se , etteivät komission suuntaviivat noudata täysin näitä päämääriä .	totuus	1	Vs
Toimittajien sananvapausjärjestö Toimittajat ilman rajoja on listannut Gaddafin vapaan median saalistajaksi .	Toimittajat	2	Ja
Tarvitsisin hovikuvaajan ikuistamaan iltani , niin näissä kuvissa olisi edes vähän vaihtelua .	vaihtelua	11	U
Junassa matkustamisesta on tullut yhtä hienoa ja liikemiesmäistä kuin lentämisestä .	lentämisestä	9	Minen
Nyt ei kuitenkaan kaipaa laakereilla lepäämistä , vaan iloista , antavaa puuhastelua kodissa . :)	lepäämistä	5	Minen
Saatuaan kuulla tästä Ariarathes kokosi armeijan kappadokialaisista ja lähialueiden kuninkaiden lähettämistä joukoista .	kappadokialaisista	6	Lainen
On selvää , että transatlanttisen lentoliikenteen uusi oikeuskehys hyödyttää lentoalaa ja kuluttajia ja parantaa myös työllisyyttä .	kuluttajia	11	Ja
Järven pinta-ala on noin 8,2 km² , korkeus merenpinnasta 96,6 metriä ja suurin syvyys noin 10 metriä .	korkeus	7	Vs
Härkönen on muun muassa paheksunut Revon pukeutumista muotisuunnittelijan viittoihin , ajelua punaisella Alfa Romeolla ja esiintymistä viihdeohjelmissa .	muotisuunnittelijan	7	Ja
Aloite kansallishymnin sanoittamiseen tuli Espanjan olympiakomitealta , joka halusi antaa espanjalaisille urheilijoille mahdollisuuden laulaa kansallishymniä urheilukilpailuiden palkintojenjakotilaisuuksissa .	sanoittamiseen	2	Minen
Keskuspuolustajaksi suhteellisen lyhyenä ( 5'11" , n. 180,5 cm ) hän ei taistellut ensisijaisesti korkeista keskityspalloista , vaan luotti parhaimmillaan häikäisevään nopeuteensa ja vahvaan taklauspeliin .	Keskuspuolustajaksi	0	Ja
– Ylemmän AMK-tutkinnon suorittaneet joutuvat työnhakutilanteissa usein selittämään tutkinnon laajuutta , sisältöä ja vastaavuutta maisterin tutkintoon nähden , koulutuksen tunnettuutta selvittäneet Loretta Galli ja Sakari Ahola Turun yliopiston koulutussosiologian tutkimuskeskuksesta toteavat .	vastaavuutta	13	Vs
( 30 ) On perusteltua säätää hallintomenettelystä , jossa voidaan esittää väitteitä toimenpiteiden edunmukaisuudesta yhteisön kannalta , mukaan lukien kuluttajen edun mukaisuus , ja vahvistaa määräaika , jonka kuluessa kyseessä olevat tiedot on toimitettava , sekä vahvistaa osapuolien tiedonsaantioikeudet ;	tiedonsaantioikeudet	38	Vs
Työhön saatava rahoitus kattaa tutkijan palkan ja valituilla on mahdollisuus hakea myös tutkimuskulurahoitusta .	tutkijan	4	Ja
Sikiön vaurioituminen riippuu siitä , pystyykö äiti vähentämään alkoholinkäyttöään raskauden edetessä sekä käytetystä alkoholimäärästä .	vaurioituminen	1	Minen
Tällöin seksuaalisuuden ilmaiseminen on teko ja toiset ihmiset ovat välineitä .	ilmaiseminen	2	Minen
- Neuvonantaja on kuitenkin palveluammatissa .	Neuvonantaja	1	Ja
Nuo viivästykset ja valitukset huolestuttivat kansalaisia ja johtivat kesäkuun 6. , 7. ja 8. päivän traagisiin tapahtumiin , joihin vaalitarkkailuvaltuuskunta otti heti julkisesti kantaa .	kansalaisia	5	Lainen
Sen estäminen edellyttää uusia mekanismeja , joilla pystytään entistä aikaisemmin puuttumaan esimerkiksi holtittomaan velkaantumiseen ja valtioiden verotusjärjestelmiinkin , Aunesluoma sanoo .	estäminen	1	Minen
3 ) Eläinperäisissä elintarvikkeissa olevien eläinlääkejäämien enimmäismääriä vahvistettaessa olisi määriteltävä ne eläinlajit , joissa jäämiä voi esiintyä , sallitut pitoisuudet jokaiselle hoidetusta eläimestä saadulle lihakudokselle ( kohdekudos ) ja jäämien valvonnan kannalta merkityksellisen jäämän luonne ( merkkijäämä ) .	pitoisuudet	19	Vs
Maaliskuussa 1997 tehdyssä kolmikantasopimuksessa opettajat osoittivat halukkuutensa tehdä yhteistyötä vastauksena komission lupaukseen jatkaa heidän työsopimuksiaan eläkeikään asti .	halukkuutensa	6	Vs
Siinä ei tuoda esiin sitä johdonmukaisuutta , johon yhteiseurooppalainen keski- ja itäeurooppalaisia valtioita kohtaan harjoitettava politiikka perustuu .	johdonmukaisuutta	5	Vs
Lumpeiden asuttama utuinen lampi aukeaa hänen edessään ja näky on niin tuttu , että hän aavistaa rantaviivan auringonpolttamien kivien lämmön ennen kuin koskee niitä .	näky	8	U
Tässä mielessä taloudellisten ulkosuhteiden valiokunta on antanut lausuntonsa kiistellystä aiheesta , joka koskee matkustajien henkilökohtaisiin matkatavaroihin sisältyvien muihin kuin kaupallisiin tarkoituksiin tarkoitettujen tavaroiden tuontia ; taloudellisten ulkosuhteiden valiokunnassa hylättiin kaksi tällaisen tilanteen rajoittamiseksi tarkoitettua tarkistusta .	rajoittamiseksi	32	Minen
Hakijoita on kolmannes enemmän kuin viime vuonna .	Hakijoita	0	Ja
– Kasvua on yliopistojen viime vuoden yhteishakijamääräänkin verrattuna 850 hakijan verran .	Kasvua	1	U
Tutkinto antaa valmiuden hoitaa vaativien asuin- ja liikekiinteistöjen isännöintitehtäviä ja toimia isännöitsijätoimiston johdossa , kiinteistöpäällikkönä ja liikekiinteistöisännöitsijätehtävissä .	valmiuden	2	Vs
Kuten neuvoston puheenjohtaja Lehtomäkikin totesi , EU tarvitsee selkeän suunnitelman viisumimenettelyn yksinkertaistamiseksi ja lopulta viisumivaatimuksen poistamiseksi .	viisumimenettelyn	10	U
5 ) tämä asetus ei estä yhteisön toimia , jotka voivat joissakin tapauksissa olla tarpeen sisämarkkinoiden toiminnassa ilmenevien ongelmien ratkaisemiseksi , ottaen tarvittaessa huomioon tämän asetuksen soveltamisen ,	soveltamisen	26	Minen
Heikossa valossa ei puhuta rakkaudesta .	rakkaudesta	4	Vs
Opiskelijoiden keskuudessa suosittua erikoistyötapahtumaa 1980-luvun alussa kehittämässä ollut erikoistyötapahtuman isä , dosentti Seppo Sarimo muistuttaa , että erikoistyötapahtuma on usein nuorelle tutkijalle ensimmäinen julkinen esiintyminen .	tutkijalle	21	Ja
