מזכיר מועצת הפועלים והנהלת הפועל בית שאן , הודיעו שהשחקנים שנטלו עליהם יוזמה אישית , בניגוד לדעת ההנהלה , יועמדו לבירור משמעתי .	יועמדו	19	Pass
אנו כולנו מוכנים להילחם ולמות למען אללה ולמען ארצנו " , אמר קולונל סידי סאלח א - שמיירי , קצין הצבא הכווייתי המופקד על אימוני המתנדבים .	להילחם	3	Mid
אתמול דנה ועדת הכספים בהצעת משרד התעשייה ומשרד האוצר לקבוע פרמיה אחידה על ההלוואות בערבות מדינה בשיעור של 5.1 % לכל ההשקעות ברחבי הארץ .	דנה	1	Act
בבית החולים שיפא נפטרה אשה בת 55 , מדלילה אל - עמסי , ממחנה הפליטים נוסייראת , שנדקרה לפני שבועיים על - ידי רעולי פנים , לאחר שנחשדה בשיתוף פעולה .	נפטרה	3	Mid
יאן מולבי , הקשר הדני שעשוי לעבר השבוע לברצלונה , דייק מ - 11 מטרים .	דייק	10	Act
כדי לבצע את הבלתי אפשרי הוא חייב לדכא כל רגשי רחמים וכבר בפרק הפתיחה הוא מוצג כדורסני ואכזר , כמי שנמלט מחברת בני - אדם וכחוקר שיצאו לו מוניטין בשל דייקנותו .	מוצג	15	Pass
אחרי משחקי אתמול נותר הפועל באר שבע היחיד שעדיין לא נוצח ; ואת הטבלה סוגרות שלוש הקבוצות היחידות שעדיין לא השיגו ניצחון ( כפסר סבא , חולון , נתניה ) .	השיגו	20	Act
אולי הנוסח האורווליאני הזה היה מושפע ממחויבותו של חתן הפרס לתחום על שמו נקרא הפרס .	נקרא	13	Mid
800 שנה חלפו מאז חדר הכובש האנגלי לאי , וכמעט 004 שנה מאז השלים את כיבוש הצפון , שממנו טרם יצא .	השלים	13	Act
שני עמים אוחזים באותו חבל ארץ ; לכל אחד טענות הזכות הלגיטימיות והמוכרות , רגשות חיבה אל המולדת , ונכונות או כורח בלתי - מתפשר להיאבק על פיסת הארץ שישבו בה בעבר ואיש אינו רוצה לצאת ממנה .	להיאבק	25	Mid
שניים מהם אושפזו לקבלת טיפול בבית החולים הממשלתי ברמאללה .	אושפזו	2	Pass
מסמנים את קטע ההריסה ומתקנים אותו כמו בניתוח פלסטי .	מסמנים	0	Act
בדו"ח שורר נאמר כי ועדת הבדיקה לא קיבלה את כל המסמכים הדרושים לה , מכיוון שמסמכים כאלה לא נכתבו .	נאמר	2	Mid
יש להם גם דרך לחשוף את עצמם בצורה אינטימית , מבלי שהדברים ייראו כרכילות זולה וסרת טעם .	לחשוף	4	Act
חברות הביטוח המקבלות עסקים מסוכנות הביטוח של זאב זמיר , בדקו בימים האחרונים את האפשרות לסייע לזמיר להיחלץ מהקשיים הכספיים שאליהם נקלע בשל השקעות מחוץ לענף הביטוח .	נקלע	21	Mid
ממועמדי מפלגת השלטון המצרית הודחו מן הרשימה לאחר שהתברר כי נחשדו בשחיתות .	נחשדו	10	Mid
כעובד נקיון או עובד עזר בבנייה , מתייחסים עמיתיו אל הטורקי החי בגרמניה כאל קטין מפגר ומלגלגים עליו , מבעד למנסרות דעת הקהל הוא נשקף באור מסולף ומעוות .	מסולף	26	Pass
לעומת זאת , עם מדינות ערביות , ובהן כאלו שעד לפני כמה חודשים הוגדרו כעוינות , מקיים הממשל דושיח שוטף ברמה האסטראטגית ושיתוף פעולה צבאי הדוק ללא תקדים .	הוגדרו	13	Pass
מיקי שלא נגמר , מיקי שליחו לא נס .	נגמר	2	Mid
תעלולי בושוויץ לא עלו יפה , והוא הפסיד את מושבו .	עלו	3	Act
המסקנה הבלתי - נמנעת היא , למרבה הצער , רק זו : אם צרות גדולות מלמדות שהאל זועף , הרי הניגוסים הקטנים האלה מלמדים שהוא כבר לא זועף .	נמנעת	3	Mid
האחת טוענת כי הוא הוזמן על - ידי ידידו יאנק ריסקי , סופר אינטלקטואל ואדריכל פולני שהתגורר בארץ .	הוזמן	4	Pass
השופטת שושנה ברמן ציינה בגזר הדין , כי הרגשות האמביוולנטיים שהנאשם נתון בהם התייחסותו לאותה אשה כאל אשתו החוקית , ומנגד אי ההכרה הרשמית בה כאשתו גרמו לו לבלבול מסוים .	גרמו	26	Act
ארבעת החשודים ברצח יו"ר הפרלמנט המצרי מסרו מידע מפורט על מעשי טרור רבים , אשר בוצעו בקהיר ובמחוזות אחרים .	מפורט	8	Pass
לפעמים היא שואלת את עצמה מה שלום בלומה שלה .	שואלת	2	Act
מייקל מילקן , איש " אג"ח הזבל " של חברת ההשקעות דרקסל בארנם לאמבר , גרף במשך עבודתו בחברה מאות מיליוני דולר יותר מסכום העתק עליו דווח מלכתחילה כך טען אתמול ה"לוס אנגלס טיימס " .	דווח	26	Pass
הן היו זכאיות למיניותן , ו"לאחר גירושין לא היו אמורות להיות מושלכות מהבית ללא כל תמיכה פיננסית " , כותבת מינאי .	כותבת	19	Act
מסיבה זו הוחלט כי מוטב שלבנקים הייעודיים יהיו אפשרויות עסקיות נוספות להגדלת מקורות הרווחיות .	הוחלט	2	Pass
מנכ"ל הפועל יעקב אבימור הבהיר אתמול למזכיר מועצת פועלי בית שאן פיני קבלו שאם השחקנים יממשו את איומם לענוד סרט שחור ולעמוד דקת דומיה , הם יועמדו לדין משמעתי בפני ועדת המשמעת העליונה של מרכז הפועל .	יועמדו	26	Pass
עד כה לא נעצר ולו חשוד אחד במעשים הללו .	נעצר	3	Mid
קפכותאחד מוותיקי האוצר , המשנה לממונה על שוק ההון וביטוח , עומד לפרוש מתפקידו בינואר .	לפרוש	12	Act
הצלע הששית בתסבוכת אהבים זו היא אנריקו , חברו של פאולו , שאולי ניהל רומן עם פראנצסקה מאחורי גבו .	ניהל	13	Act
הוא בחר בבנו , יאיר , להיות שותפו לכתיבת הסדרה המשפחתית .	בחר	1	Act
מקורות פלשתיניים מסרו כי חיילים , שירדו ממיניבוס לבן בשכונת ראפידיה בשכם , ניפצו בעזרת אבנים זגוגיות של מכוניות חונות של תושבים מקומיים , ביניהן גם את חלונות מכוניתו של דר מוסטפא מקבול .	מסרו	2	Act
מנגד , אין הממשלה נוקפת אצבע לפתרון בעייתם של ילדים השוהים בבתי חולים לחולי נפש , כשאין זה מקומם על - פי אבחנה רפואית .	חולים	12	Act
ואין זה משנה אם המנחה היה ירון לונדון , שהבליט את אישיותו הטלוויזיונית , או מיכאל הנדלזלץ שהיה מסויג יותר בהבלטת אישיותו .	מסויג	18	Pass
יש שוני גדול בתוככי כל אחד מן הגושים פנימה , אך הפוליטיקה נחלקת בצורה שרירותית באמצע , בין אלה הנכונים או נאלצים לוותר לפלשתינאים לבין מי שעדיין מחפשים דרכים חלופיות .	נחלקת	12	Mid
על מנך " לית החברה , מיכל עמיר , הוטל להכין דו"ח נתונים מפורט לדיון בדבר מדיניות החברה בשנה הבאה .	מפורט	13	Pass
נציג דובר צה"ל בפיקוד דרום סירב לפרט באילו כדורים נפצעו התושבים .	לפרט	6	Act
הם רואים בכך אות לעברתו של הבורא , סימן לכעסו על בניו הסוררים , מופת לתחינתו אליהם שיסורו מדרך - הרע וישובו אליו , ועוד כהנה וכהנה עניינים נכבדים וחשובים .	רואים	1	Act
מרגיז אותי , כאשר אני רואה את ניר ריכליס עולה לכמה דקות , עושה שגיאה , ומיד יורד לספסל .	יורד	17	Act
העובדים מוחים על כך ששולמה להם רק מחצית משכורת אוקטובר ולא נראה סיכוי בשלב זה לתשלום המחצית השנייה .	מוחים	1	Act
כולם משוכנעים בצדקת דרכיהם , שהרי אם לא יאמצו את ההיגיון המתון או התקיף הטמון בתוכנית שלהם , מובטח שיימשך העימות .	מובטח	18	Pass
יעקבי התראיין בכלי התקשורת המקומיים , ואחד הראיונות לשדר גים וורן מרשת וו - אם - בי - אי הועבר ל061 תחנות רדיו ברחבי ארה"ב .	הועבר	19	Pass
שיקאגו באה לשם עם נצחון יתום בארבעה מישחקים וחזרה עם 021 001 מול הסלטיקס הבלתי מנוצחים .	מנוצחים	15	Pass
בהמשך נאמר , בין השאר , כי " מועדי היציאה הגמישים של כוח תשורת המשך הופכים את התוכנית לאטרקטיווית " .	נאמר	1	Mid
במאה ה02 , מאז יצאו האימפריות הקולוניאליסטיות מרוב מאחזיהן בעולם , פרצו עשרות עימותים בין עמים .	פרצו	11	Act
המספר , נרדף על - ידי זיכרונות מרים ממלחמת העולם השנייה ומהתבגרותו במשטר קומוניסטי , מוצג כאדם חסר אשליות החש עצמו מנותק מהחברה האנושית הרגילה , שבין כך ובין כך " אין לה שימוש לאף אחד " .	נרדף	2	Mid
גולן הביע שביעות - רצון מהדרך בה פועלת אלביט , כמפעל פרטי ראשון שקיבל על עצמו , מרצונו , את העקרונות שעל - פיהם עובדת הרשות לשיתוף פעולה תעשייתי .	פועלת	7	Act
במקום לממן לפחות חלק מההוצאות הגדולות שנובעות מגל העלייה על - ידי סגירת משרדים מיותרים , מדברים כרגיל על עוד קיצוץ בסובסידיות , עוד קיצוץ בתקציב הביטחון ועוד קיצוץ בקצבאות ביטוח לאומי .	לממן	1	Act
כל אוהדיה ובקיאיה של הספרות הלטינו - אמריקאית , או העולמית ( ולא היה סופר " עולמי " יותר מבורחס ) , פיללו שהוא יקבל את הפרס הזה .	פיללו	22	Act
מדוע זכה נושא זה לתחייה , זאת לא אבין .	זכה	1	Act
לעומת זאת מציע האוצר לשחוק ב8 % את שכרו של מתמחה מתחיל שהכנסתו ההמוצעת היום היא 3,825 שקלים ולהעמידה על 3,512 שקלים .	לשחוק	4	Act
בעקבות זאת החליט ועד התפעול לנקוט עיצומים , והעובדים הפסיקו לעבוד .	הפסיקו	9	Act
התרבו העדים שחזרו בהם בבית המשפט מגרסאות שמסרו בחקירתם במשטרה , ושהפלילו את הנאשמים , והיה ברור כי הם נוהגים כך מאימתו של העולם התחתון .	נוהגים	19	Act
גם הסדרי השכר הגיבו אמנם בפיגור מסוים על המיתון שהשתרר במשק החל מ7891 .	הגיבו	3	Act
ראש המועצה המקומית ירוחם מצפה שאוכלוסיית העיירה תוכפל עם בואם של העולים החדשים .	תוכפל	7	Pass
באולם הדיונים נראו אתמול שר האוצר שר התמ"ת והשרים לשעבר וקפכותשביתת האיגודים המקצועיים אומנם נסתיימה בראשית השבוע , ומשרד האוצר וראשי האיגודים המקצועיים המשיכו את המו"ם ביניהם , אך חותמה של השביתה ייראה כנראה במשכורתם של השובתים .	ייראה	32	Mid
התנגדותם לנסיעה זו של כמה מראשי האיגודים המסונפים להתאחדות , שפעילותם נפגעת בגלל קשיי מימון וחוסר תקציב , מובנת בהחלט וגם מוצדקת לחלוטין .	מוצדקת	21	Pass
מחמט מגיטולו ( 91 ) , הלך לקחת את אחותו מדירת מכרים במערב מינכן , לשם נמלטה הצעירה הכורדית עם ידידה , עלי , בן ה91 .	נמלטה	16	Mid
מלבד זאת , הצבעים החמים נוסכים הרגשה נעימה , בניגוד להרגשת הניכור האופפת את רובנו בכניסה לבתי חולים " .	נוסכים	5	Act
מקורות פלשתיניים טענו כי בסוף השבוע הוכו במרכז שכם 01 תושבים מקומיים בידי חיילי צה"ל , סמוך לשוק הירקות .	הוכו	6	Pass
פחדה היה מוצדק .	מוצדק	2	Pass
נצח אומרת , כי נדרשו לה שנתיים וחצי עד שהגיעה לראייה תקינה , מכיוון שעשתה הרבה הפסקות בתרגול ולא היתה במסגרת .	נדרשו	4	Mid
כתוצאה מזריקת אבנים לעבר אוטובוס ישראלי בחלחול , נפצעה ביום שישי קל תיירת בראשה , והיא טופלה במקום .	נפצעה	8	Mid
תקופה מסוימת התגורר חלאסקו בביתו של פרס , וגם אחר - כך , כשעבר לגור במלון " הס " ובמלון " ויקטורי " באלנבי , המשיכו השניים להיות חברים לשיחות נפש ולשתייה .	לגור	14	Act
חובות הקרן ומכללת בית - ברל הוערכו עוד בטרם הגשת הדו"ח ביותר מ20 מיליון שקל .	הוערכו	6	Pass
מקורות צבאיים מסרו כי ביום שישי הושלך בקבוק תבערה לעבר כוח משמר הגבול ברחבת כנסיית המולד בבית לחם , אך הוא התנפץ מבלי להתלקח ומבלי לגרום לנזק או לנפגעים .	מסרו	2	Act
עד כה הושכרו חדרים בבתי מלון עבור עולים מבריה"ם בלבד .	הושכרו	2	Pass
אני מתכוון לגישה המנוכרת , או נכון יותר המתנכרת ( שהרי תהליך ההתנכרות רק מחריף והולך כל הזמן ) לסמלים הלאומיים , לחוויות התשתית של הציונות , ולתפיסתן כחוויות מעצבות , ובעצם לרגש הלאומי עצמו .	מעצבות	29	Act
בפעם השנייה תוך חודש נפסק החשמל באמצע היום וללא התראה .	נפסק	4	Mid
כעבור שנה , כאשר נחתמו הסכמי קאמף - דייוויד , גרם לו גיבורו אכזבה מרה .	נחתמו	4	Mid
יו"ר בזק , יורם אלסטר , אמר אמש כי חברי הדירקטוריון קיבלו מסמך , שבו מפורטים קורות החיים של שני המועמדים .	מפורטים	15	Pass
וולסטון מעולם לא ביקר בישראל .	ביקר	3	Act
הלכה זו היתה בהחלט בגדר " מהפך " , לפחות בכל הנוגע לשחיקה המתמדת בזכויות הנאשמים , אך גם נתנה בידי העולם התחתון כלי חדש לעקוף את הסעיף האמור למנוע הפחדת עדים .	לעקוף	25	Act
בבית הספר מכה המורה את התלמידים , בצבא מכים את הטירונים , אסירים פוליטיים ופליליים עוברים עינויים דרך קבע .	מכים	8	Act
אמנם ירושלים שיחקה רק בשני מישחקי חוץ מתוך שבעה , אבל ניצחה בהם את מכבי תל אביב ( 98 66 ) ואת הפועל תל אביב ( 79 38 ) .	שיחקה	2	Act
אחד מגורמי המלונאות הציע להיכנס לשותפות בבעלות על החברה , אך הוחלט שלא למכור אותה .	להיכנס	4	Mid
אני מרגיש מרומה , טען .	מרומה	2	Pass
עכשיו , מסתבר , סבורים אגפים מסוימים בשמאל לא כולו כמובן שגם אושוויץ היא סמל מסוכן , שעלול להוליד רגשות של מיליטנטיות ושוביניזם לאומני .	להוליד	18	Act
בסעודיה נפוצו שמועות כי כוחות הברית מהססים לתת נשק בידי הכווייתים מחשש שהם יתחילו את המלחמה בעצמם .	נפוצו	1	Mid
שאלנו אותו על היהודים : האם יכלו לעשות יותר משעשו למען עצמם ?	שאלנו	0	Act
טי נתקע בכדור הארץ , בודד ואבוד , שלושה מיליון שנות - אור מהבית " , פונה סטיוון ספילברג אל הקהל מעל מסך הטלוויזיה , בכניסה לאתר הדמיוני באולפני יוניוורסל החדשים באורלנדו , פלורידה .	נתקע	1	Mid
בינתיים הוחזר הענק וסטריס לנבחרת ואולי הוא יפתור במידה חלקית את בעית זניאל .	יפתור	7	Act
" כיהודי מאמין אני עושה את מה שמצווה עלי התורה ואת מה שדורש ממני אלוהים " , אמר כהנא .	עושה	4	Act
חלאסקו ידע שאם ישוב , הוא ינודה וימנעו ממנו לפרסם וליצור .	ינודה	6	Pass
גלילי נפצע במשחק האחרון נגד הפועל חדרה .	נפצע	1	Mid
אין מנוס מהמסקנה : מיקי נשאר מיקי אבל הליגה הזו כבר לא אותה ליגה .	נשאר	5	Mid
אין זו רבותא לנהל קרן פנסיה שעתודותיה מושקעות באיגרות חוב בטוחות ב001 % , צמודות ב001 % , נושאות ריבית של 2.6 % , הצמודה אף היא ב001 % ופטורה מכל מס .	לנהל	3	Act
גם ביוון היו שלוחות של הקבוצה היא הוקמה שם ב5591 ופורקה ב8891 .	הוקמה	7	Pass
בימים אלה חויבו החוסכים בניירות - ערך בעמלת דמי - ניהול לרבעון .	חויבו	2	Pass
בפתח הספרייה הצטופפו פולנים , שכתוצאה ממצוקות הקיום היום - יומי נאלצו להרחיק לכת לישראל בחיפוש אחר עבודה .	להרחיק	12	Act
האוצר תובע מההסתדרות להתחייב לשקט תעשייתי בתקופת ההסכם לא רק על הנושאים הקשורים בו במישרין , אלא אם גם על נושאים ייחודיים עליהם הוכרזו סכסוכי עבודה , כגון תביעות עובדי משרד הקליטה ומשרד החוץ .	הוכרזו	23	Pass
באמצע שנות השמונים ציפו רבים כי הבשורה תצא מניו זילנד הרחוקה .	ציפו	3	Act
פאהד מלך סעודיה הבטיח שלשום לקרב את מלכותו לעבר משטר דמוקרטי .	לקרב	5	Act
השם מוקלד לתוך המחשב וביציאה נפרד מהם אי - טי לשלום באופן אישי בשמם .	מוקלד	1	Pass
בתקופה שכיהנתי כשר פנים חשפתי כמה מאותם מקרים , והאשמים הוענשו .	הוענשו	10	Pass
כמה דיפלומטים ממדינות המערב נחרדו מן הרעיון של הקמת ממשלה בהנהגת שקאר .	נחרדו	4	Mid
טיב ההסכם לא נודע , אך הגיבור המגמגם מת מיתה משונה עוד באותו פרק .	משונה	10	Pass
ביוניוורסל יש רודיאו דרייב , הכל חדש , מעוטר בהרבה גרפיטי והעיצוב תעשייתי עד מלוקק - בוהק .	מעוטר	8	Pass
בד בבד יוסר המצור מעיראק באורח הדרגתי ויבוטל החרם עליה .	יוסר	2	Pass
מקורות פלשתיניים טענו כי בתקרית בסיום התפילה במסגדים נפצע איסלאם גיבריל , בן 16 , תושב מחנה הפליטים עין בית אלמה , מקליע ברגלו .	נפצע	8	Mid
בשנה שחלפה נערכו חילופי משמרות בקרב רואי החשבון של כמה חברות ממשלתיות גדולות .	נערכו	2	Mid
ואילנה נחום מעירה : " זה רע מאוד אם יגיעו אלינו מכורח " .	מעירה	2	Act
הצפייה בהסרטות חיות נעשית מקרוב ( מבעד לזכוכית שקופה ומשוריינת , חסומה לקול ) , ומאפשרת התבוננות גם בסצינות רומנטיות , רגישות במיוחד .	נעשית	3	Mid
בין - לילה הוכח כי ניתן לפתור בעייה מכאיבה בת - שנים , אם הולכים בדרך נכונה ונוטשים את הרעיונות הריכוזיים הישנים .	הוכח	3	Pass
תלמידי בתי ספר וסטודנטים מן הקסטות הגבוהות מחו על החלטה זו ורבים העלו עצמם באש .	העלו	12	Act
ההתחייבות הכספית בתחום הזה בלבד מוערכת בכ20 מיליארד מארק .	מוערכת	5	Pass
ככל שהוא זוכר לא נוצר ביניהם קשר מיוחד ; באותה תקופה לא התעניין בילדות .	נוצר	4	Mid
על פי המידע המצוי בידיה מעכב שר הבריאות העברת כספים המגיעים למד"א כדי ללחוץ על ועדת העבודה והרווחה לאשר חוק שהוצע על ידי שר הבריאות המבטל את עצמאות מד"א כארגון וולונטארי .	מעכב	5	Act
לפרנסתו נאלץ לעבוד בבתי חרושת , ומפעם לפעם קיבל תרומות מסופר אחר ממוצא פולני ש"עשה זאת " באמריקה , יזי קושינסקי .	נאלץ	1	Mid
ישראל מצווה לשקוד על בטחונה , והיא תמלא חובתה זו בכל התנאים .	מצווה	1	Act
באחרונה צורפו לדירקטוריון לפי המלצת השר פנחסי עקיבא אטון , ומקורבו של פנחסי עמוס ברכה .	צורפו	1	Pass
בין - לילה הוכח כי ניתן לפתור בעייה מכאיבה בת - שנים , אם הולכים בדרך נכונה ונוטשים את הרעיונות הריכוזיים הישנים .	מכאיבה	8	Act
" בואי " , אמר בנימה מפייסת לאחותו , " נלך לקנות לך שמלת כלה " .	נלך	10	Act
ואולם הוא מביע ספק ( בראיון שהעניק לפני ימים אחדים ל"ניו יורק טיימס " ) האם זה היה " משרת את צורכי מאזן הכוחות לטווח ארוך באזור " .	מביע	2	Act
מומחים אחרים סבורים כי הסיבה פשוטה יותר : אם יוזרמו כוחות גדולים כל - כך למפרץ , לא יימצאו כוחות מספיקים בעורף כדי להחליף את אלה שבחזית .	מספיקים	20	Act
צופים , ואשר מילא כל פינה באצטדיון המקומי באשדוד , היה עד לדרבי המדובר של השבוע האחרון בו הופגנה רמה לא משכנעת .	מילא	3	Act
אפילו לה לא מפרגנים .	מפרגנים	3	Act
צרכנית חדת - עין מחיפה , סוזי גיורא , הבחינה כי על האריזה של פסטה מיובאת מארה"ב , " פטוציני עם תרד וביצים " , צוין כי היא " ללא כולסטרול " .	צוין	25	Pass
ציינת שאישתי ניגנה בחליל .	ניגנה	2	Act
שאלנו על הפולנים : האם יכלו לעשות יותר משעשו למען היהודים ?	שאלנו	0	Act
אינג הרצברג גורסת , כי העיוות הקל המתפתח בדלת הסנדוויץ הוא תוצאה של הדבקה לא טובה של הפורמייקה .	גורסת	2	Act
לפיד משיב כי יחסיו עם רשות השידור לא היו לבביים במיוחד , ויש להניח שלא זאת הסיבה .	משיב	1	Act
על - פי החלטות הממשלה יישלחו בהקדם שופטים ועובדי משרד המשפטים לדרום , כדי לאייש את המקומות הדרושים .	יישלחו	5	Mid
למחרת אמר לי הרב שלמרות כל השנאה השוררת בינינו , כלומר בין החרדים ליהודים המודרניים , אנו צריכים לזכור שעמנו שותף לאותו גורל : גם אבותיו וגם אבותי , חלקם הגדול נספו בשואה .	לזכור	18	Act
מיקי ברקוביץ , שיצא לקראת הסיום ב - 5 עבירות , מיעט לזרוק ולכן גם צבר מעט נקודות .	מיעט	11	Act
השגרירות עידכנה את משרד החוץ בירושלים בעניין החוב , כדי למנוע התפתחותה של תקרית מביכה מנכ"ל חברת טיולי הגליל , עזרא בן דורי , הביע מצדו נכונות לסיים את המחלוקת .	לסיים	27	Act
