המשטרה הזהירה אתמול חברי - כנסת ערבים ובעלי תפקידים בכירים במגזר הערבי , המתגוררים בצפון הארץ , כי קיים חשש לניסיונות פגיעה בהם .	הזהירה	1	Act
על המשטרה לקבל החלטה שבפקודות הקבע של השוטרים ייאמר במפורש ששוטרים לא ייצאו למשמרת ללא אפוד מגן .	ייאמר	8	Mid
כמו חילונים רבים ראיתי בהם טפילים , משום שרובם אינם משרתים בצה " ל ונציגיהם בכנסת שואפים לכפות על המדינה חוקי הלכה .	לכפות	17	Act
למרות שבית"ר ירושלים ראשון בטבלה , אני מהמר על ניצחון של באר שבע ( בשעה הראשית 1430 ) , בגלל הביתיות וגם מפני שלשחקני באר שבע תהיה שאפתנות מיוחדת לנצח את המוליך .	מהמר	7	Act
לפני כשנתיים התבקש לפיד על - ידי הטלוויזיה לכתוב סדרה קומית בהמשכים .	לכתוב	8	Act
הרצון לחסוך בהוצאות לדיור במשרדי הממשלה גרם למחלוקת קשה בין משרדי שבה מעורבים משרדי התעשיה והמסחר , איכות הסביבה והאוצר .	גרם	6	Act
אין זו רבותא לנהל קרן פנסיה שעתודותיה מושקעות באיגרות חוב בטוחות ב001 % , צמודות ב001 % , נושאות ריבית של 2.6 % , הצמודה אף היא ב001 % ופטורה מכל מס .	מושקעות	7	Pass
ב"ליצואן " , עלון החדשות של מכון היצוא לחודש אוקטובר , נכתב כי נמכרו כל שטחי התצוגה לשבוע המזון .	נמכרו	13	Mid
דוברת קופת חולים בחיפה והצפון יוכי באואר מסרה כי קופת חולים הכללית פיטרה את פרוף מרין מכיוון שביצע ניתוחים פרטיים בניגוד להסכם מפורש עמו .	מסרה	7	Act
ארה"ב קרבה בקצב מהיר לפרשת דרכים : על ממשלתה להחליט האם אפשר ליישב את המשבר במפרץ הפרסי במשא ומתן ישיר , מתוך , או או"מי או שלמעשה לא נותר אלא להילחם או להרים רגליים .	להילחם	30	Mid
מדוע הפסקות החשמל מובנות מאליהן לחברת החשמל ולכן הופכות לשגרה ?	מובנות	3	Pass
המכבים נסוגו כדי לשמור על יתרונם , גם דריקס ירד לעזרת ההגנה ואנדריי בל ומרכוס בכושר טוב שמרו על ניצחון מכבי .	נסוגו	1	Mid
בחלק מהמקרים , נטען בכתב האישום , אף ירה לייבוביץ בנשק כדי לקדם את ביצוע השוד וכדי להימלט מהמקום ללא הפרעה .	נטען	3	Mid
מפני שהיא מחייבת לאפשר לפלשתינאים לנהל את חייהם בעצמם , לגייס הון זר ולהשקיע בחינוך ובבריאות ובביטחון - פנים בלתי מזוין וליצור בסיס הנהגתי לניהול משא ומתן מדיני עם ישראל על פתרון הקבע .	לאפשר	3	Act
במחיר רכז התפוזים נרשמו אתמול ירידות , כתיקון טכני לאחר העלייה החדה של יום ד .	נרשמו	3	Mid
זהו ציפוי המילואה בפי - וי - סי , בשיטה שבה ההדבקה נעשית בתנאי ואקום , לחץ וטמפרטורה גבוהה .	נעשית	12	Mid
כל עוד האירועים בארץ והלחץ מבחוץ לא יביאו לשינוי מהותי בכיוון המחשבה הישראלית , מספר הדוגלים ביד החזקה נגד הערבים ילך ויגדל .	יביאו	7	Act
הוא ביקר דרך קבע במכירות פומביות מערביות , החל ב27 , והחליט להנהיג את השיטה ביפאן .	להנהיג	12	Act
בהמשך נאמר , בין השאר , כי " מועדי היציאה הגמישים של כוח תשורת המשך הופכים את התוכנית לאטרקטיווית " .	הופכים	15	Act
הסיוע לסטודנט צריך להיות ישיר ונפרד לחלוטין מהסיוע לאוניברסיטה , והוא צריך להינתן לכל ציבור הסטודנטים בארץ , בלי שים לב למוסד בו הם לומדים .	להינתן	12	Mid
היא עובדת בעיקר עם כפות , מזלגות וכפיות קטנות במיוחד .	עובדת	1	Act
בריוני - כדורגל תקפו שוטרים באבני מדרכה ובגז מדמיע , בשתי ערים במזרח גרמניה לשעבר , אחרי משחקי סוף השבוע מסרו אתמול מקורות רשמיים .	תקפו	3	Act
הם טענו כי מעמדם נמצא עתה בסכנה , עקב קירבתם ללוי , וכי שר החוץ עצמו אינו נחלץ להגן עליהם .	טענו	1	Act
שלושת החשודים הודו במעשה במהלך החקירה המשטרתית .	הודו	2	Act
המבקרים את הקמת המחוז החדש מדגישים , כי אם לא יוקצו לאלתר כמה מאות תקנים חדשים למשטרה וכן תוספת ניכרת של תקציבים ואמצעים , לתגבור ירושלים באורח קבע , לא תהיה שום משמעות להקמת המחוז החדש .	יוקצו	10	Pass
דובר מקורות אישר אמש שהחברה קיבלה הודעה מחברת החשמל על ניתוק הזרם למוביל הארצי ולמתקני שאיבה .	אישר	2	Act
אבין את הקורא שיאמר שסופר הזוכה בפרס נובל איננו יכול להיות גדול באמת , אף שתהיה באמירה שרירותיות גדולה כמעט כמו באמירה ההפוכה , המקובלת יותר .	אבין	0	Act
באר שבע שלטה יותר במחצית הראשונה , אך בדקה השלישית ניתנה הזדמנות מצויינת לבית"ר לכבוש שער , כאשר שוורץ בעט מקרוב אך אלטר זינק והדף באגרופו .	מצויינת	12	Pass
בשיעורי החינוך המיני פנה המורה לביולוגיה תמיד דווקא אליה בשאלות : " זה הצחיק אותו מאוד שתמיד הסמקתי " .	הסמקתי	17	Act
חוץ מזה אני לא רוצה להישאר .	להישאר	5	Mid
הנשים סובלות אפוא כפל כפליים .	סובלות	1	Act
בחוברת שכותרתה : " משרד המשטרה תפיסת היעוד , הארגון והניהול " , מדגיש המנכ"ל , בין השאר , גם את העקרונות שעל פיהם המליצה ועדת זמיר להקים את צוות המטה המקצועי ליד שר המשטרה .	מדגיש	13	Act
לנדאו תקף בחריפות את לוי באומרו כי הוא אינו מוכשר לכהן כיו"ר מרכז השלטון המקומי וכי הביא לשיתוק מוחלט בפעילות המרכז .	לכהן	10	Act
גורמים בכירים בצה"ל שיבחו את הכוחות שפעלו בלבנון , ומתחקיר שנערך לאחר הפעולה בעת ששבו הכוחות לשטח ישראל , עולה כי הכוחות פעלו בשילוב מוצלח .	שיבחו	3	Act
הבעיה המרכזית שמדינת ישראל עומדת בפניה קביעת עתידם המדיני של הפלשתינאים בשטחים המוחזקים אין לפותרה באמצעות רדיפת ערבים בירושלים ובהתנקשויות ביהודים , שאינם רואים בהמשך הכיבוש פתרון של קבע .	רואים	23	Act
בהודעה הזו עוד נאמר כי " מעשה הרצח הוא למעשה ביצוע גזר דין מוות שנפסק לכבוד הרב מאיר כהנא הי"ד על - ידי הכנסת , הבג"ץ והתקשורת הישראלית .	נאמר	3	Mid
בתחום המוגבל שלהם הם מבצעים כמרבית הקומיקאים את הדברים השקופים והצפויים ביותר .	מבצעים	4	Act
השבוע שוב חשף שר ההיסטוריה את חיוכו האירוני : מחולל רעיון הטרנספר נפל קורבן על מזבח רעיונותיו בשעה שתורתו נמצאת בשיא תפוצתה .	נמצאת	19	Mid
העובדה שהוא נבחר על ידי העם כולו , במערכת בחירות , מקנה לו השפעה פוליטית רבה על אף שזו אינה מתבטאת בחוקה .	נבחר	2	Mid
לפני כן עסק , במסגרת חברה שהקים , בהפקת סרטי רפואה ובבימוים .	עסק	2	Act
הרעב והתסכול הספרותי כישלון הקשר עם " מעריב " והעובדה שרק שני סיפורים שלו תורגמו לעברית ( " היום השמיני בשבוע " וסיפור בהמשכים ב"העולם הזה " ) הכריעו אותו .	תורגמו	14	Pass
בגין ורבין נזעקו לא מפני שתכניות יעקובי ורמון אינן מעשיות .	נזעקו	2	Mid
" כיום הוכח " , מוסיפה רוטנברג , " כי במפעל שנצבע וחזותו שופרה עלתה רמת המוטיוואציה של העובדים , ובהתאם לכך עלו גם תפוקתו ורווחיותו " .	הוכח	2	Pass
גם בעזה הוחל ביישום ההגבלות ; חולקו כרטיסים מגנטיים נוספים ונאסרה כניסתם לישראל של תושבים רבים .	חולקו	6	Pass
אך החברה הישראלית הוכיחת שתגובות שליליות מעין אלו הן בסך הכל חריגות למדי , מוקעות על - ידי כל הזרמים הפוליטיים , ובוודאי שיש להיאבק בהן .	מוקעות	14	Pass
היריות פרצו בגלל סכסוכי אדמות שהממשלה עדיין לא הצליחה לפתור , ובהקשר זה דרישות המורדים לקרקע מוצדקות .	מוצדקות	16	Pass
מחמט סטה בדרכו ליער פירסטנרידר , שם אילץ אותה לצאת מהמכונית ולכרוע על ברכיה .	סטה	1	Act
אך יש יצרנים המעדיפים להשקיע בהאדרתו של החומר הנוח , כדי שיוכלו ליהנות משני העולמות : גם חומר זול ליצרן , וגם יקר לצרכן .	ליהנות	12	Mid
שם מוצעים 600 מגרשים בנוסף ל1,000 שכבר נמסרו לאנשי לאנשי צבא הקבע במסגרת פרויקט רעות .	נמסרו	7	Mid
מנכ"ל האוצר , יעקב ליפשיץ , הסביר כי בספטמבר - אוקטובר נרשמו עליות מחירים של 11 % בשוק הבי"ל .	הסביר	6	Act
מחמוד גומעה סמרי , שנחשד בשיתוף פעולה עם השלטונות , נרצח בדקירות סכין וגופתו נשרפה .	נרצח	10	Mid
אלא ששוורצקוף נשלח למפרץ בראש גייסות , שאם יופעלו עלולים להידרש לבצע בדיוק את החלופה הלא - מועדפת על הגנרל .	יופעלו	8	Pass
לעולם לא אחזור למעורבות פוליטית מסיבה כלשהי , לעולם לא אפסיק לכתוב " .	לכתוב	11	Act
בעיירה לאביאנו , למשל , הוקצבו בממוצע כ036 דולר לנפש .	הוקצבו	5	Pass
" אני מקווה שהממשלה החדשה תחזיק מעמד עד סוף תקופת כהונתה 1994 " , אמר הנשיא לאחר טכס ההשבעה .	מקווה	2	Act
אם יחויב לנהוג כך , תעמוד בפניו הברירה של הקטנת העלות הכוללת באמצעות צמצום היקף ההזדקקות למשאב היקר .	יחויב	1	Pass
הפצועים הועברו לבתי החולים רמב"ם ובני ציון ( רוטשילד ) בחיפה .	הועברו	1	Pass
ארצות הברית , הזקוקה לקואליציה הערבית נגד עיראק , אינה יכולה להרשות שערבים תחת שלטון ישראל ייפגעו עתה .	ייפגעו	16	Mid
לדברי רוזנטל , הושלמו בהצלחה המגעים עם סיטונאי התיירות של בריטניה , שהתחייבו להמשיך ולפרסם את ישראל בתוכניות קיץ 19 .	להמשיך	13	Act
מנהל השיווק וסמנכ"ל השופרסל , מרדכי קריינר , אישר בתגובה לפנייתנו כי אכן היתה טעות בתרגום וכבר נשלחו לכל נקודות המכירה התוויות חדשות ובהן הוצאו המלים " ללא כולסטרול " .	הוצאו	24	Pass
מיליון דולר מסכום זה ישולמו במזומן , ועוד ארבעה מיליון בתשלומים דו - שנתיים ללא ריבית , כשהראשון שבהם ב1 בדצמבר .	ישולמו	4	Pass
איש אינו מכריח אותו לנסוע , והוא נוסע מפני שמה שהוא עתיד למצוא שם חשוב לו עוד כאן , כשהוא נמצא בארץ .	לנסוע	4	Act
הציפוי החיצוני יכול להיות פורניר , או צבוע בצבעים מסוגים שונים או מצופה פי - וי - סי .	מצופה	12	Pass
הרגשתי שמח שיש לנו מדינה ומקום לחיות בו : כן , " יהיה מה שיהיה " אני נשאר כאן .	הרגשתי	0	Act
החשש הוא ששוב נגיע לתחושה שנקלוט ונקלוט , ובסוף הם לא יאהבו אותנו " .	נגיע	3	Act
נאמר שקיבוץ הוא מקום שטוב לחיות בו , שלכולם יש זכויות שוות , אוכלים ביחד , אין בעיות .	נאמר	0	Mid
והם מסתערים ומסלקים את ח"כ רחבעם זאבי וצועקים לעברו טרמפיסט , ומקבלים בזרועות פתוחות את פלאטו - שרון , שאינו מחמיץ את החנגה ומוכן שיראו בו ספרדי טהור .	מחמיץ	20	Act
זו אולי אחת הסיבות שדווקא חקיינים וחקיינות ישירה וגם צפויה שאינה נחשבת להומור ברמה גבוהה פופולריים כל - כך .	נחשבת	11	Mid
רצח מדרגה שנייה הוא האישום החמור ביותר שבו ניתן להאשים חשוד ברצח במדינת ניו - יורק , שאינו מואשם ברצח של איש כוחות הביטחון .	מואשם	18	Pass
בעשרת החודשים הראשונים של השנה הונפקו 442 היתרים להשקעות ולהקמת חברות בחו"ל , בהיקף כולל של 012 מיליוני דולר .	הונפקו	5	Pass
לכן , למשל , מהססים להיענות ללחץ הממסד , התובע להכשיר כל אסם ומחסן בקיבוץ לקליטת עולים , מחשש ליצירת פערים בדיור .	להכשיר	10	Act
סקר גאלוף האחרון הראה כי עמדה כזו של הממשל תיהנה מתמיכה מאסיווית של דעת הקהל .	הראה	3	Act
הגענו , ראינו , זכרנו ונעצבנו ; זכרנו בעצב ורצנו בשמחת חיים אל האוטובוסים .	זכרנו	7	Act
מהפרקליטות הצבאית העבירו בימים האחרונים את חומר החקירה בכל הקשור לקצינים הבכירים ששמותיהם הוזכרו במשפט גבעתי ב למשטרה הצבאית , אשר בודקת עתה את החומר ותזמן לחקירה את מח"ט גבעתי לשעבר אל"ם אפי איתם .	הוזכרו	13	Pass
ההמלצה הועברה ל21 סוכנויות נסיעות המקיימות סיורים במצרים , ונתלתה על לוחות המודעות במסופי הגבול עם מצרים .	הועברה	1	Pass
לא ייתכן שעולה יבוא לקיבוץ כמו שהוא מגיע למחנה צה"ל .	יבוא	3	Act
רק גלוסקא תמות , כי היא רצתה יותר מפנטסיה .	תמות	2	Act
לפיכך משמשת המכירה בספטמבר , במידה מסוימת , בסיס לכל הקשור בקניות שיקנו היפאנים מיצירות אמנות מערביות מהמאות ה91 וה02 .	משמשת	1	Act
משטחי הצבע ברורים , וברחובות שוחזרו קטעים של ניו - יורק וסן - פרנסיסקו .	שוחזרו	5	Pass
שפע הדגמים הנראים באולמי התצוגה של ארונות המטבח אינם מסגירים את טיבם .	מסגירים	9	Act
הכל נעשה בתחכום רב , אמריקאי מאוד ובכל זאת מצליח להפתיע .	נעשה	1	Mid
מקורות פלשתיניים טענו אתמול כי בשכונת ראפידיה בשכם נפצעה אישה בת 44 , סמירה דבעי , מפגיעת אבן בראשה , ואושפזה בבית החולים בראפידיה .	נפצעה	8	Mid
" המצב הנוכחי " , הדגיש וולסטון , " אינו יכול להימשך , שאם לא כן יוסיפו ילדים פלשתינאים וישראלים להרוג אלה את אלה עוד דורות רבים " .	להימשך	11	Mid
רבים מהם חוזרים הביתה בתום תקופת מעצר - לפני - משפט , מפני שבתי המשפט עמוסים וההליכים איטיים ; אחרים מרצים תקופת - מאסר מקוצרת על התנהגות טובה ; ויש שאינם חוזרים מהחופשה בכלא , שמעניק להם החוק החדש .	מקוצרת	24	Pass
רוב מורשעי משפט גבעתי ב החליטו שלא לערער על הרשעתם ועל גזרי הדין שהוטלו עליהם לפני 11 יום .	מורשעי	1	Pass
הודף כדור הברזל האמריקאי רנדי בארנס עלול להפסיד יותר מחצי מיליון דולר , אם אמנם יאלץ להיעדר מפעילות שנתיים בגלל השעיה על שימוש בסמים .	הודף	0	Act
תגובת בית המשפט היתה קביעת ההלכה כי " עד מקשקש " נחשב ל"עד " , ולכן עדותו במשטרה עשויה להיות קבילה .	נחשב	11	Mid
לאחר מכן היא ממלאת את השק בחומרי ה"שפע " קטניות , זרעונים , אגוזים , שקדים , מקלות קינמון , גבעולי חיטה , פלפלים יבשים ועוד .	ממלאת	3	Act
במהשך הבקיע פיטר בירדסלי את השער הרביעי , גם הוא ממסירה של האוטון .	הבקיע	1	Act
" הספר משאיר אותך תוהה " , הוא אומר , " האם הכל היה בדיחה .	תוהה	4	Act
קפספבינאולדהאם נותרה ראשונה בליגה השניה עם 83 נקודות אחרי ניצחון 4 1 על ווטפורד , המדורגת אחרונה עם 9 נקודות בלבד .	נותרה	1	Mid
אנשים רבים , טטרים ורוסים כאחד , חוששים שלשלטונות המקומיים לא יהיו די אמצעים לניהול כלכלה מורכבת .	חוששים	7	Act
מי שלא יבוא מחאן יונס לאשקלון לא ידקור ולא יידקר .	ידקור	7	Act
מתווכים מסרו כי למרות השפל בתיירות , נמכרה יחידה בת 2 חדרים ( 60 מ"ר ) בפרויקט " מרין הייטס " בהרצליה פיתוח ב232 אלף דולר .	נמכרה	7	Mid
על הממשלה מופעל לחץ גם מצד תנועות לאוטונומיה מקומית בצפון , שזכו בהצלחה מרשימה בבחירות המקומיות במאי השנה .	מופעל	2	Pass
לדבריו הוקם באלביט גוף שמפקח על הקניות ובודק כל הזמנה המיועדת לחו"ל , אם ניתן לרכוש אותה בארץ .	הוקם	1	Pass
אנו שומעים רעיונות מבולבלים , המוזנים מתחושות של דחייה מסיבות שונות , והזעם מופנה כלפי הממסד .	שומעים	1	Act
שני ילדי הפלא מגלי צה"ל שלפחות היה אפשר לקוות שהספיקו לסגל לעצמם סגנון משלהם לא עומדים בציפיות ומאכזבים .	לקוות	8	Act
כל שעת עבודה נוספת , בשכר של ששה שקלים לשעה , מנוכה מהתשלום .	מנוכה	11	Pass
המינהל יקבל תמורת החכרת מגרש אחד 316 אלף ש"ח , ותמורת החכרת השני 376 אלף ש"ח .	יקבל	1	Act
האוהלים מונעים אומנם חדירת הגשמים , אולם המים נספגו בבד והוסיפו על הקור העז השורר בלילות בירושלים ממילא .	נספגו	8	Mid
דוברת קופת חולים בחיפה והצפון יוכי באואר מסרה כי קופת חולים הכללית פיטרה את פרוף מרין מכיוון שביצע ניתוחים פרטיים בניגוד להסכם מפורש עמו .	חולים	2	Act
האוצר מציע כי שכרם של בעלי תפקידים אלו ינוע בין 5,191 למומחה בכיר ל 6,592 למנהל בכיר .	ינוע	8	Act
רק אחרי שראיתי את הסרט ענק עם גיימס דין הבנתי מאיפה מארק לקח את המאניירות ואת המימיקה שלו .	הבנתי	9	Act
ביום רביעי הוצת אולם אירועים , וביום חמישי בלילה הושלך אל המעלית סדין בוער .	הוצת	2	Pass
40 איש נעצרו .	נעצרו	2	Mid
עיקר החריגה בתקציב הרגיל נבעה מהגידול בסעיפי השכר והמשכורת אשר לרשות מקומית יש עליהם שליטה מעטה בלבד .	נבעה	4	Act
יתר על כן , במגזר העסקי בוצעו בשנים האחרונות פיטורי ייעול בהיקף של רבבות עובדים , דבר שקשה היה להעלותו על הדעת בעבר .	בוצעו	6	Pass
התוכנית הראשונה שלהם בערוץ השני מאופיינת בהומור עייף , צפוי וחסר ייחוד .	מאופיינת	5	Pass
היריב העיקרי שלה , בריאן לניהן מן המפלגה השלטת , נאלץ להתפטר מתפקיד סגן ראש הממשלה יומיים לפני הבחירות , על רקע שערורייה אישית , ותוך איום שמפלגות הקואליציה האחרות יביעו אי - אמון בממשלה אם יישאר בכהונתו .	נאלץ	10	Mid
המקורות הפלשתיניים הוסיפו כי כוחות צה"ל עצרו רבים מן המתפרעים .	הוסיפו	2	Act
לחברת ויזה יש עניין מובן לעודד את השימוש בכרטיסי אשראי , אך הפעם נדמה שהפריזו .	לעודד	5	Act
יהיה מיפגש המוקד בין האלופה גלאזגו ריינגרס למוליכה דנדי יונייטד , שתי קבוצות שנחלו שלשום אכזבות בגביעי אירופה ( דנדי יונייטד הובסה בביתה 0 4 בידי ארנהם מהולנד וריינגרס סיימה רק 11 בבית עם הכוכב האדום בלגראד ) .	הובסה	21	Pass
גם אני מרוויחה את לחמי מהכאב , הצער והצרות של האחרים , אבל הדואליות הזאת היא בלתי נמנעת " .	נמנעת	17	Mid
אני נפגש עם שמיר לעתים לא קרובות והיחסים שלנו מצוינים .	נפגש	1	Mid
ודווקא בארץ זו יוקם בסיס מטוסי אף - 61 של נאט"ו .	יוקם	3	Pass
התוצאה היתה , לעתים קרובות , מוזרה : העדים הועמדו לדין על התנהגותם בבית המשפט ונשלחו לבית הסוהר , ואילו העבריינים שנגדם היו אמורים להעיד שוחררו או יצאו בעונשים קלים .	הועמדו	9	Pass
גם עובדים סוציאליים או קבוצות נשים נרתעים לפעמים לפרסם דיווחים על הנעשה במשפחות טורקיות .	נרתעים	6	Mid
באוטובוס היו באותה עת 16 תיירים , נהג ומורה - דרך , שחלקם נזרקו מהאוטובוס ונשכבו על הכביש .	נזרקו	13	Mid
בהודעת הקופה נאמר כי החל מהיום ייגבה מחברים אלו , המבקשים לשמור על זכויותיהם , מחצית מסכום המס האחיד ששילמו לפני עזיבתם את הארץ .	ייגבה	6	Mid
כדורסלן הגליל , שהיה מעורב בתקרית אחרי המישחק נגד הפועל ירושלים ביום חמישי במלחה , נשאר במעצר במגרש הרוסים עד לשעות הבוקר .	נשאר	15	Mid
היא נועדה להשתמש בכהנא כאליבי לעמדות אש"ף , ולפיגועים רחבי ההיקף של אותן שנים .	נועדה	1	Mid
מי שאינו שולט אינו נדרש לדין וחשבון .	נדרש	4	Mid
במהלך הפעולה נפגעו והושמדו כמה יעדים ששימשו את המחבלים ליציאה לפיגועים בדרום לבנון ובישראל .	נפגעו	2	Mid
הוא אמר , כי הוא מתנצל שהרשה למטה הבחירות שלו לצאת בהתקפה הזו , מתנצל על " נזק כלשהו אם נגרם " , ומקבל " אחריות מלאה " למעשה .	נגרם	20	Mid
ביוניוורסל קונים את אי - טי .	קונים	1	Act
אבל השירותים החברתיים , החינוכיים והתרבותיים יישארו עם קשיים גדולים יותר , בכל הנוגע , למשל , לתפקוד בתי - הספר .	יישארו	6	Mid
שפט יעקב ממן , 052 צופים , בלזרוס חולון .	שפט	0	Act
קיצן אמר כי כל החלטת או"ם לפעולה צבאית תהיה כרוכה בהתייעצויות מפורטות .	מפורטות	11	Pass
עד עתה מילא את תפקיד זה עמוס מר - חיים .	מילא	2	Act
