תוך שלוש שנים ייהפכו הנערות הטורקיות הלומדות שם לתופרות מיומנות .	ייהפכו	3	Mid
מעריכים שהישיבה תנוהל ע"י שלום עצמו .	תנוהל	2	Pass
בדרך זו יסופקו רבים מאנשי המחוזות הבריאים יחסית , וכן אנשי הפשע שיקימו בדרום מעין מדינה משלהם .	יסופקו	2	Pass
מכיוון שההקלה בקריטריונים לא גרמה לבריחת הון מהארץ , מתכוון בנק ישראל לאפשר הקלה נוספת בתנאים הקשורים להשקעות בחו"ל .	לאפשר	12	Act
הוקמה סדנת תפירה וההורים יכלו להיווכח במו עיניהם שבמקום אין גברים .	הוקמה	0	Pass
מצד זה הוא יכול להיחשב רומאן היסטורי , שמצויים בו כל היסודות שהפכוהו למעין אפוס לאומי אוסטרלי .	להיחשב	4	Mid
יש הרבה סיבות טובות להתרפק גם על הישגי נבחרות ישראליות בוגרות , מחושלות ויעילות , שלמעשה התבססו על הנוער המצטיין ושאבו ממנו את שחקני - המפתח .	מחושלות	12	Pass
הרכב המידרדר מראש הגבעה נעצר מטרים ספורים מחלון הקרונית .	נעצר	4	Mid
הם ממשיכים לרכב על אותו גל שהביא להם את ההצלחה .	ממשיכים	1	Act
פנקייביץ אמר שכל היהודים שהוא מכיר תמיד שואלים אותו את השאלה הזאת .	שואלים	7	Act
בדיון טען ועד עובדי בנק ישראל כי העיצומים שפרצו ביום שלישי , ומהלכם הופסקה עבודת המחשב , הם על רקע קידום בשכר ולאחר סכסוך עבודה עליו הוכרז כבר לפני שבועיים .	הוכרז	26	Pass
אין העיתונאים דורשים לעצמם זכויות מיוחדות וגם לא הגנה מיוחדת מטעם מוסדות המיועדים לשמירת החוק בתי - המשפט והמשטרה .	דורשים	2	Act
בדברו על מצב התעסוקה מתח מודעי ביקורת חריפה על הקולות שהושמעו לאחר שכוחות הביטחון סגרו את השטחים , בעוד שההעדרות של פועלי השטחים לרגל חגים או אירועים אחרים מתקבלת בהבנה .	מתח	4	Act
הציבור מחזיק כיום ב84 % ממניות ממ"ן .	מחזיק	1	Act
על מנך " לית החברה , מיכל עמיר , הוטל להכין דו"ח נתונים מפורט לדיון בדבר מדיניות החברה בשנה הבאה .	הוטל	9	Pass
הוא הואשם שסירב להתנער מיאסר ערפאת ומלואי פאראקאן .	הואשם	1	Pass
תשלום תוספות שאינן מעוגנות ברווחיות ישפיע לרעה על חברות ממשלתיות לא מעטות , ועלול להקרין גם על חברות לא - ממשלתיות .	מעוגנות	3	Pass
העובדים הפגינו ליד בניין הטלוויזיה נגד הצנזורה ונגד סיקור החדשות הנוטה לצד הממשלה .	הפגינו	1	Act
יש להרבות בסיורים אלה התורמים רבות להיקלטות טובה בארץ .	להרבות	1	Act
פוליטיקאי חייב להציג פתרון חד וברור , והכל , בימין ובשמאל , דומים בשל כך בהתנהגותם הנאיווית , המאמינה שאילו רק יושמה ההצעה שלהם הכל היה בא על פתרונו .	יושמה	21	Pass
במלחמה כזאת , שבה עשרות אלפי קורבנות , מובן שקוברים אנשים בקברי אחים .	מובן	8	Pass
הוא מאמין , כי לפלשתינאים בשטחים תינתן " מולדת כלשהי " , שאם לא כן " ילדים פלשתינאיים וישראליים יוסיפו להרוג אלה את אלה עוד דורות רבים " .	יוסיפו	19	Act
בחוזר שהופץ לפני ימים מספר בין כל עובדי הבנק נאמר , בין השאר , כי ב"מפעל סולתם שיסתה ההנהלה כלבים בעובדים , וכאן היא משסה קבוצות עובדים אחת בשנייה .	נאמר	9	Mid
כך למשל , ייפגשו ראשי הממשלות לפחות פעם אחת בשנה , ושרי החוץ לפחות פעמיים בשנה .	ייפגשו	3	Mid
הודעתו משקפת שינוי במדיניות הממשל , שהכריז לפני כחודש שבכוונתו להחליף את החיילים המוצבים בסעודיה על בסיס קבוע .	להחליף	10	Act
הלאומיות מתוארת כתופעה שפרחה במאתיים השנים האחרונות לאחר קריסתן של אימפריות - הענק חובקות עולם , ואשר הבחינה מאז בין עמים וקבעה סדר בין - לאומי חדש .	מתוארת	1	Pass
שר הביטחון משה ארנס ביקר ביום חמישי בשעות הבוקר בלבנון ונתן את האישור הסופי לביצוע פעולה .	ביקר	4	Act
שחקני מכבי ראשון לציון הצליחו לזכות בניצחון נוסף , הפעם על הפועל גבת העמק , לאחר משחק חלש שהסתיים ביתרון של 6 נקודות בלבד ( 92 98 ) .	הצליחו	4	Act
אין לנו כל רצון לפגוע בנוסעים ובצוות " , נאמר בהודעה .	נאמר	9	Mid
בדקה ה - 33 עוד היה 65 70 למכבי כשבוגין היה האיש של חולון , אבל מרסר דאג לפער מבטיח 65 76 וסימס סיים במיטווח משלו .	דאג	17	Act
מסלול ב , למשל , מוליך מהגורן דרך כרם של עצי זית ושקד , עובר ליד בית בד עתיק ומגיע אל גבעת המנורה .	עובר	14	Act
הניצחון של יובנטוס הנציגה השניה של איטליה בגביע המחזיקות על בולוניה הושג בזכות שער בבעיטת 11 בדקה ה - 66 מרגלי רוברטו באגו , השחקן היקר בעולם .	הושג	11	Pass
אמנם , מספר הבנות הרשאיות להשתתף בבחירת בן זוגן הולך וגדל , אך את מרבית הנישואים עדיין יוזמים הורים .	הולך	9	Act
בכירים במקורות האשימו את משרד האוצר כי " הפך את החברה לבת ערובה " , שכן אי - העברת הכספים מקורה בדרישת האוצר לייקר את מחירי המים .	האשימו	2	Act
חוגים אחרים בליכוד מסרו כי " כל ההצעה אינה רצינית ולא תצא אל הפועל " .	מסרו	3	Act
חיפה בנויה טוב , עומדת נכון במגרש , יש לה חוליית קישור מצויינת ושני חלוצים שיודעים להבקיע , ומבקיעים .	להבקיע	16	Act
הסוחרים ציינו כי חוסר הנכונות של ראשי 7 המדינות המתועשות המובילות להיפגש על מנת לדון במעמד הדולר בשוק הכספים מצביע על מעמדו האיתן של המארק בשוק הפיננסי .	ציינו	1	Act
הרופאים מספקים בימים אלה דוגמה מובהקת לכך .	מספקים	1	Act
המחירים הועלו לעתים בסכומים קטנים של 5,000 דולר , עד שהמחיר קפץ ל067 אלף דולר , בכ04 % יותר ממה שנדרש בתחילה .	הועלו	1	Pass
גם טענת בגין , כי מסירת השלטון המקומי לראשי הערים לא תפטור את ישראל מאחריות למתרחש שם , אינה מדויקת .	תפטור	11	Act
לא , אבל ייווצר מצב שדומה למולקולות בגז : כשמחממים את הגז , המולוקולות שואפות להתרחק זו מזו .	שואפות	14	Act
המספר הסידורי על קת אקדח המגנום , שבו ירה על - פי החשד א - נוסייר בכהנא , נמחק ולכן לא הצליחו החוקרים לגלות היכן קיבל אותו .	נמחק	18	Mid
אדם נהרג , אדם נרצח בידי רעולי פנים ואחר נדקר על ידם , 803 נפצעו , לפי מקורות פלשתיניים , וכן נפצעו שישה חיילי צה"ל ותיירת אחת באירועי השבוע בשטחים .	נדקר	9	Mid
נציגי מדינות מתפתחות מאסיה , אמריקה הדרומית ואסיה , הביעו אתמול דאגה עמוקה נוכח הקיפאון הנמשך בשיחות גאט"ט , שמטרתן רפורמה מרחיקת לכת בסחר העולמי .	מרחיקת	21	Act
אולם במקום חגיגה של דמוקרטיה , אופיינה המערכה באירועים אלימים רבים .	אופיינה	6	Pass
צוות מקצועי יוכל לבדוק בעיניים מבינות את פעולות המשטרה , לדרוש מהמשטרה ולספק לשר הממונה נתונים מלאים על עבודתה וכך לאפשר לו לקבל החלטות נכונות יותר .	לבדוק	3	Act
ד"ר בלשר מציין כי " ההסתדרות הרפואית נדרשת להסכים למבנה שכר חדש במסגרתו כ07 % מהרופאים ישמרו כביכול על המצב הקיים ואילו למעלה מ03 % יירדו בהשתכרותם כפי שהאוצר מכנה זאת " ייוותרו ללא פתרון " .	נדרשת	7	Mid
מקורות צבאיים מסרו כי אם יהיה שקט , יוסר העוצר לסירוגין .	יוסר	8	Pass
כי במו"ם צריך לעמוד על שלך , צריך להציג עמדות משכנעות ורציניות , וצריך גם לדעת להתפשר .	לדעת	15	Act
לעובדים בשטח ניתנה הוראה לא לשתף פעולה עם המנכ"ל עד להודעה חדשה .	ניתנה	2	Mid
כוח של צה"ל ניהל אתמול קרב יריות עם רעולי פנים , שירו על סיור צה"ל במהלך סיור שגרתי , בשכונת שאבורה שברפיח .	ניהל	3	Act
יש לקוות שיחזור מהר ככל האפשר לרדיו .	לקוות	1	Act
את ההדס רואים בסבך העולה מבריכת הערבות אל מעלה ארבעת המינים , אך מקומו לא נפקד גם ממעלה הבשמים , שם הוא גדל לצד עצי הכופר ( חינה ) והמור .	נפקד	15	Mid
גם אל ישראל נקשר בעבותות של אהבה .	נקשר	3	Mid
הנובלה הקצרה אך הדחוסה בשם " בשבחי האם החורגת " , שפורסמה זה עתה בחברת ההוצאה לאור " פרר , סטראוס אנד זירו " , נכתבה כאשר נכנס מחברה ב7891 לפוליטיקה של ארצו , כאיש הבשורה של כלכלת שוק .	נכתבה	25	Mid
כספים הוזרמו לא רק מרומא ומבריסל , אלא גם ישירות ממדינות אירופה ומארה"ב .	הוזרמו	1	Pass
פיטר ריד הוותיק , שהחליף זמנית את קולין הארווי , יוביל ביום א את מנצסטר סיטי למשחק החוץ שלה בלידס .	יוביל	10	Act
עוד ציינו בליכוד כי לא ייתכן להעניק לאגו"י ארבעה מושבים בוועדת הכספים .	ציינו	1	Act
דורון נשר שנבחר לשעשע את קהל הצופים נחשב לבחור מוכשר , אבל מתקבל הרושם שהוא מתפרס על - פני תחומים רבים מדי , ונוהג בכישוריו ביד נדיבה .	נחשב	7	Mid
תוצאות הפורענות הנלווית להלוויות - ההפגנה האלה , היו צנועות בשבוע שעבר לעומת הקודמות , הודות להיערכות נכונה יותר של המשטרה , שהשכילה ללמוד ממחדליה .	ללמוד	23	Act
הירידה במחיר הנפט נובעת גם ממימוש רווחים על - ידי הסוחרים , ומהיצעים גדולים לחוזי הנפט העתידיים , בעיקר לחוזים לחודשים דצמבר וינואר .	נובעת	3	Act
הפתקים הכתובים ערבית שנמצאו בארנקו , לצד מודעות בעיתונים על הופעות כהנא בניו - יורק , תורגמו על - ידי החוקרים , ונמסר כי הם היו בעלי אופי אישי .	תורגמו	16	Pass
נשמעה הטענה שכל תאגיד חייב לשלם את התעריף המקובל לעבודה , כשם שהוא חייב לשלם את המחיר המקובל תמורת מים , חשמל או חומרי גלם .	נשמעה	0	Mid
שתי הראשונות ישחקו מחר בבית נגד יריבות נוחות : המוליכה באיירן מינכן ( 71 נק ) מארחת את דורטמונד ( מדורגת 9 ) וקייזרסלאוטרן ( 61 נק ) מחכה לדיסלדורף ( מקום 21 ) .	מדורגת	20	Pass
באר שבע שלטה יותר במחצית הראשונה , אך בדקה השלישית ניתנה הזדמנות מצויינת לבית"ר לכבוש שער , כאשר שוורץ בעט מקרוב אך אלטר זינק והדף באגרופו .	לכבוש	14	Act
כמה יצרנים ישראלים כבר פנו למכון וביקשו בניית תקן ישראלי , לאחר שהתברר כי לארץ הגיעה סחורה גרועה .	פנו	4	Act
עוד דרשו החוטפים כי תאילנד תפסיק את כל ההשקעות בבורמה עד שהשלטון יימסר לידי ממשלה אזרחית ומתנגדי משטר בורמזים העצורים בתאילנד יקבלו מעמד של פליטים .	יימסר	12	Mid
זימנד , שתיק ההשקעות שלו נוהל בבנק איגוד בנאמנות עיוורת ( " דיסקרציה " ) , פנה לבית המשפט , בנימוק שתיק ההשקעות שלו נוהל בצורה רשלנית .	נוהל	5	Pass
דבר זה לא צוין בהודעה .	צוין	3	Pass
בהחלט נשמעו פה ושם אנחות חסרות פשר של צופר משועמם .	משועמם	9	Pass
בשנים האחרונות הקרן כמעט ולא פעלה , עד שניהולה הועבר לידי מנהלי סוכנות הביטוח סימון את ויזל , שנחשבת לגדולה בארץ בענף ביטוח החיים .	הועבר	9	Pass
בשלב זה יש להימנע מניסיון לעשות הון פוליטי מעלייה .	להימנע	3	Mid
המקורות מסרו על התנגשויות במחנות הפליטים ובעיר עזה .	מסרו	1	Act
כאשר ביקר בקזאן באוגוסט , אומר יארמקוב , " הוא אמר לנו לקחת כמה שאנו יכולים " .	ביקר	1	Act
אנחנו מנסים ליצור מקורות הכנסה נוספים .	ליצור	2	Act
לבית"ר זה היה הפסד ליגה ראשון שבעטיו נושל מראשות הטבלה .	נושל	7	Pass
תסלח לי , אבל זה כמו לשאול האם הדמויות שמצייר צייר ינסו לקום עליו ולדחוק את רגליו .	תסלח	0	Act
נשים ונערות טורקיות בגרמניה נתונות בפיקוח דרך קבע : דודות , דודים וקרובים רחוקים , מכרים , ידידים או אחים , חברים לעבודה של האב ובעיקר השכנים .	נתונות	4	Act
גזר דינו של מילקן אמור להיחרץ החודש , אולי אף השבוע .	להיחרץ	5	Mid
" זה שמכבי כבר נוצח בשני משחקים , אין בו לטשטש את העובדה שהפועל ירושלים היה הבולט בליגה ומקומו מוצדק " , אומר שרף .	מוצדק	19	Pass
אלא שהטקסטים פורשו עד כה בידי גברים , ולפחות כאשר המדובר בממסדים דתיים , היו אלה לעתים קרובות מדי שמרנים למהדרין .	פורשו	2	Pass
אם יחויב לנהוג כך , תעמוד בפניו הברירה של הקטנת העלות הכוללת באמצעות צמצום היקף ההזדקקות למשאב היקר .	לנהוג	2	Act
כל מסלול מסומן בשילוט בצבע שונה .	מסומן	2	Pass
טרייכמן , לאה ניקל , ליליאן קלפיש , יאיר גרבוז ומוטי מזרחי , ולצדם הדפסים של ציירים נוספים , בסך הכל כ56 עבודות , מוצגים בתערוכה הנושאת את השם " ההדפס האמנותי הישראלי " .	מוצגים	24	Pass
וכאשר כבר היה זה מעליב ממש הדברים הגיעו לידי כך שהענקת הפרס לסופר הישיש היתה עשויה להתפרש כעלבון נשאל בורחס על - ידי איש ספרות מקסיקאי אחד האם היה רוצה בו אילו ניתן לו לבסוף .	נשאל	18	Mid
עוד הסבירו במשרד השיכון כי 02 המשפחות הראשונות בארץ כבר שילמו דמי פיקדון והן עתידות להיכנס לקרוואנים בימים הקרובים .	להיכנס	15	Mid
ואם כדי להצליח בסטנד - אף קומדי חייב היה נשר להיות מצויד בחושים עיתונאיים מחודדים , כושר הבחנה מעולה ולשון משוחררת , קל וחומר כשמדובר בפינת ביקורת עיתונות .	מצויד	11	Pass
עוד נמסר כי אלביט תעביר לרשות לשיתוף פעולה את רשימות החברות בחו"ל שמהן היא קונה מוצרים , כדי שהרשות תפעל להשגת רכש גומלין מאותן חברות .	תפעל	19	Act
והם מושמצים בפי אזרחים מפוחדים .	מושמצים	1	Pass
הקשר היחיד בינינו בנושא הר הבית היה עוד בשנת 5791 , כאשר גיליתי לו בארבע עיניים בלבד , שהיו לי מחשבות בכיוון הזה , ושהמחשבות זכו לברכתו של הרב צבי יהודה קוק זצ"ל .	גיליתי	12	Act
ברצוני להבהיר חד משמעית , שבמפעל של לנקום , אשר נמצא בקודרי בצפון צרפת , לא מיוצרים מוצרי גמיי .	להבהיר	1	Act
רעיון ה"משפחתון " פותח בחסות האגודה למתן שירות לקשישים ( אש"ל ) ובשיתוף היחידה למפעלים מיוחדים במוסד לביטוח הלאומי .	פותח	3	Pass
ירושלים לכולם היתה רוצה ממשלתנו לספק פתרונות דיור הולמים : למיליון עולים חדשים , לזוגות צעירים , ליוצאי צה"ל , לחסרי דיור ועוד זאת גם כשמדובר בגיוס משאבים עצומים בארץ ובחו"ל .	לספק	5	Act
סמפדוריה ( 11 נק ) תשמור על הפיסגה אם תנצח כצפוי בביתה את פיזה .	תנצח	9	Act
מר - חיים ציין כי הגירעון בתקציב הרגיל היה נמוך מתחזית של 22 מיליון ש"ח , שצוינה בתקציב .	ציין	3	Act
סמפדוריה ( 11 נק ) תשמור על הפיסגה אם תנצח כצפוי בביתה את פיזה .	תשמור	5	Act
מה זה היה עוזר אילו ניסו להתנגד לגירושם ?	עוזר	3	Act
עיניהם , ועיני כל האחרים שראו במאיר כהנא " פטריוט " יהודי כי הטיף לשנוא את כל הערבים צריכות עתה להיפקח .	לשנוא	14	Act
החדר , שבו מתרחשת הפגישה הראשונה בין השניים , מואפל , כאמור , אבל מבעד לחרכי התריסים חודרות קרניים ונשברות במראות ובחפצי זכוכית ומטילות בחדר נגוהות .	חודרות	17	Act
הסיבוב השני של גביעי אירופה הושלם אמש , בהתמודדות בגביע אופ"א , בה ניצחה פרטיזן בלגראד את ריאל סוסיידאד 4 5 בבעיטות הכרעה מ - 11 מטרים .	הושלם	5	Pass
הסיפור גם דרש מאמץ רב כדי להימנע מהוולגריות של זימה וניבולי פה .	להימנע	6	Mid
הילדה פחדה פחד מוות שהאם תחזור על המעשה .	פחדה	1	Act
בנוסף לכך נחתמו חוזי עבודה עם רבים מאנשי הארגון במדינות ערביות ואיסלאמיות רבות " , טוען העיתון .	נחתמו	2	Mid
נשאלת השאלה , מנין האחוז הגבוה של שומן אם משתמשים בחלב רזה ?	נשאלת	0	Mid
הם טענו כי מעמדם נמצא עתה בסכנה , עקב קירבתם ללוי , וכי שר החוץ עצמו אינו נחלץ להגן עליהם .	נחלץ	17	Mid
אחדים מהח"כים תבעו לחייב את משרדי האוצר והאנרגיה לקבל את הסכמת הוועדה כל אימת שירצו להעלות את מחירי הדלק , בדומה לנעשה לגבי מחירי המים .	לחייב	3	Act
תל - אביב : ח"כ יוסי שריד הודיע לאחרונה כי טעה כאשר התנגד להפצצת הכור האטומי בעיראק .	טעה	10	Act
שניים נפצעו באורח קשה ו261 נפצעו , לפי מקורות פלשתיניים : 88 מהם מירי כדורים חיים , כדורי גומי ופלסטיק .	נפצעו	1	Mid
כאשר נפגע , הודיע דובר צה"ל כי היה מעורב בעימות עם כוחות הביטחון שפעלו להשלטת סדר באזור מגוריו , וכי נסיבות פציעתו נחקרות .	נחקרות	22	Mid
עיתוני הונגריה , שמסרו על כך , ציינו כי טרם נודעה עמדת בריה"ם בעניין זה .	נודעה	10	Mid
משקיפים פוליטיים במינסוטה מאמינים , כי ההתקפה הזו , על נייר המכתבים הרשמי של בושוויץ אם כי לא בחתימתו , עלתה לסנאטור הרפובליקאי במושבו .	עלתה	20	Act
היה זה בלתי נמנע שבפני חלק זה של הציבור תעמוד ברירה אכזרית , המוצאת יום - יום את חיזוקה במציאות : המשכו של המצב הקיים משמעו מלחמה יום - יומית בכל חצר , בכל סופרמרקט .	תעמוד	9	Act
הממשלה חייבת לחפש פתרון שישחרר לא רק את הפלשתינאים אלא גם אותנו מעול הכיבוש .	לחפש	2	Act
החוקרים סירבו לומר מה שיעור הגנבות הספרותיות בכתבי קינג , והסתפקו בקביעה כי יש בידם די ראיות לכאורה , שקינג הפר עקרונות של אתיקה והגינות אקדמית .	הפר	20	Act
הלקוח סירב ורק לאחר שהנאשם ירה מאקדחו , ציית הלקוח ונכנס לחדר המנהל .	ציית	8	Act
אולם האם באמת תיפתר הבעיה ?	תיפתר	3	Mid
הבניין , הנקרא מגדל קאנארי ורף והמתנשא לגובה של 05 קומות , נבנה על - ידי האחים רייכמן הקנדיים , באמצעות החברה שנמצאת בשליטתם , אולימפיה ויורק .	נבנה	12	Mid
אחר כך נפרדו דרכיהם , אך הקשר ביניהם נשמר .	נשמר	8	Mid
נעשות שם עוד מאות סדרות שהן ירודות ביותר , ולכן ההשוואה אינה הוגנת " .	נעשות	0	Mid
הוא העביר את התנצלותו בכתב - יד אל רב בית הכנסת הרפורמי " מקדש ישראל " , שהוא ומשפחתו חברים בו זה 30 שנה .	העביר	1	Act
" מפליא הדבר , לפיכך , שהממשלה התעלמה מדרישת האופוזיציה לפזר מועצה זו מאז שנבחרה והתעקשה שמועצה מזויפת זו תמשיך לכהן .	לפזר	10	Act
אפילו פגיעתו של טיל עיראקי אחד בלבד בגוש דן תחייב פעולה צבאית ישראלית בהיקף משמעותי .	תחייב	9	Act
אף אחד מהם לא שלל את האופציה הצבאית כדי לאלץ את עיראק לצאת מכוויית , אך צרפת אמרה כי תילחם רק על בסיס של החלטת או"ם מפורשת .	תילחם	19	Mid
מומחים אחרים סבורים כי הסיבה פשוטה יותר : אם יוזרמו כוחות גדולים כל - כך למפרץ , לא יימצאו כוחות מספיקים בעורף כדי להחליף את אלה שבחזית .	יוזרמו	9	Pass
פרוף יהושע בן - אריה קבע כי בארץ - ישראל , בין שהיה מדובר ביהודים או זרים , אנשי היישוב החדש או היישוב הישן , היוזמות העסקיות תמיד היו משולבות באידיאלים אלה או אחרים .	משולבות	29	Pass
במסגרת הצעדים של הנהלת בנק איגוד כבר הוחלט שהבנק יפסיק לעסוק בניהול תיקי השקעה בנאמנות עיוורת .	לעסוק	10	Act
כאשר נשאל מדוע בחר בנושא ארוטי ענה ורגאס יוסה שהוא חש כי הנושא בחר בו .	נשאל	1	Mid
ורגאס יוסה נמנע בערמומיות מלספק תשובות .	נמנע	2	Mid
הוא גם נחבל קשה בסנטרו והובהל לבית חולים .	נחבל	2	Mid
הנתונים של בנק ישראל מראים שמאז הונהגו אמות - מידה חדשות למתן ההיתרים ביוני , לא נרשם שינוי משמעותי במספר החברות שביקשו להשקיע בחו"ל .	מראים	4	Act
החוטפים דרשו משלטונות בורמה לשחרר את כל האסירים הפוליטיים , לשים קץ לשלטון הצבאי ולהעביר את השלטון לממשלה אזרחית נבחרת .	נבחרת	19	Mid
