Նախարարությունը պետք է նաև ուսումնասիրի գործող և կառուցվող բոլոր փոքր ՀԷԿ-երի ջրառի կետերում շահագործողի միջոցներով , հնարավորության դեպքում նաև դրամաշնորհների ներգրավման ժամանակի իրական ռեժիմում տեղեկատվության փոխանցման համակարգի ներդրման հնարավորությունները :	ՀԷԿ-երի	10	Dat
Արդեն տեղեկացրել էինք , որ արտահանումը հունվարին , նախորդ տարվա նույն ժամանակահատվածի համեմատ , աճել էր 45.2 , իսկ ներմուծումը ՝ 48.9 տոկոսով :	ներմուծումը	19	Nom
Այսպիսի մարդիկ կան « գժանոցում » :	գժանոցում	4	Loc
Նիկոլ Փաշինյանը հանդիպել է նաև « Ֆրանկ Մյուլլեր » ընկերության նախագահ , շվեյցարահայ հայտնի գործարար և բարերար Վարդան Սրմաքեշի գլխավորած պատվիրակությանը ` կազմված մի խումբ գործարարներից :	գործարարներից	25	Abl
Մի խոսքով , 1988 թվականի փետրվարի 20-ին , երբ օպերայի բակն ալեկոծվում էր , Ակաթը Մարգարյանում ծննդաբերում էր ։	բակն	10	Nom
Սևանա լճի մակարդակի նիշը 2017 թվականի հունվարի 31-ի դրությամբ եղել է 1 հազար 900,45 մետր :	նիշը	3	Nom
Մեր կողմերում վաղուց այդպիսի կոպիտ հարվածներ չեն լինում ։	կողմերում	1	Loc
Ինչո՞ւ նկարես ` ուրիշ լինի , թե չլինի ուրիշ , ի՞նչ նոր բան է ասելու նա առավոտյան , ցերեկով , երեկոյան կամ հենց թեկուզ գիշերով ։	գիշերով	24	Ins
Reuters - ը , վկայակոչելով Transparency International միջազգային կազմակերպության զեկույցը , հաղորդում է , որ 2016 թվականի կոռուպցիայի ընկալման ինդեքսում Հայաստանը հայտնվել է 113-րդ հորիզոնականում ՝ 176 երկրների շարքում :	հորիզոնականում	24	Loc
Եվ մինչև այսօր հայ ազգը հոգևորապես սնվում է հենց այս նախամեծար Արարատյան Ս . Էջմիածնի Աթոռից ՝ ստանալով իր մխիթարությունը , իր հոգևոր զարթոնքի սնունդը :	Աթոռից	15	Abl
Մորքուրներս ու տատս վրա - վրա վրա հասան , բաժանեցին մորս չեղած զավակին կորցնելու վախը ու քանի որ պարզ գյուղացի կինարմատ էին , լաց եղան , որ անցնի ։	տատս	2	Nom
Հիվանդանոցում ինձ ասեցին , որ այդ մարդը հիվանդ է « երախտագիտության զգացումով » :	զգացումով	11	Ins
- Անծայրածիր երևակայության ասպարեզ է դա , ինքնասահմանափակման եղանակով ասեմ միայն ՝ առաջինը պետք է լինի հնարավորինս արագ ազատվել հանրապետական կոնտեքստից ՝ խորհրդարանից , նախարարաներից , քաղաքապետերից :	եղանակով	8	Ins
Անցյալ տարվա ընթացքում « Անսահմանափակ շարժում » ծրագիրը պարերի , ներկայացումների և ֆիլմերի միջոցով ցուցադրեց , թե ինչի կարելի է հասնել սոցիալական ներառման շնորհիվ :	ներառման	22	Dat
Ճիշտ է , Հայաստանում , հետխորհրդային տարածքում կրթական համակարգը չի տալիս այն գիտելիքը , գործիքակազմը , որով ուսանողը կարողանա ազատվել դասական մշակույթի կռապաշտությունից և ինքնուրույն հարաբերվել ժամանակակցին ։	կռապաշտությունից	22	Abl
Ներմուծման ոլորտում հետևյալ պատկերն է ՝ պարզվում է , որ նույն հունվար ամսին Հայաստան ներմուծված հանքահումքային արտադրանքի ծավալերն ավելի մեծ են եղել , քան արտահանվածը :	ծավալերն	17	Nom
Բոլոր աշխարհների վերջում դու հանդիպում ես նրան կամրջին , որի տակով լավա է հոսում ։	վերջում	2	Loc
Ընդդիմության կողմից սկսեց գործել հայկական քաղաքական համակարգի ըմբոստ զավակի ՝ Նիկոլի գործոնը , երբ հարթակում դադարեցին պաշտոնազուրկ նախկին իշխանավորներ հայտնվել , հայտնվեց իրոք որ նորածին , քաղաքացիական ՝ ավելի քան դասական քաղաքականը ՝ մարդկանց ուրվագիծ :	հարթակում	14	Loc
Իրանցիների կարծիքով , Հայաստանի ու ԼՂՀ ղեկավարները կարգավորման գործընթացը դիտարկում են երկրում քաղաքական ընդհանուր գործընթացի համատեքստում , որպես կարևոր քաղաքական ռեսուրս :	համատեքստում	15	Loc
ՀՀ Նախագահի թեկնածու Լևոն Տեր - Պետրոսյանի դիմումի հիման վրա ` 2008 թ . ՀՀ Նախագահի ընտրություններում ՀՀ Նախագահի թեկնածուի համար առաջացած խոչընդոտներն անհաղթահարելի ճանաչելու վերաբերյալ գործով	Նախագահի	15	Dat
Թե կյանքդ կորցնում ես ամրոցների չորրորդ մակարդակում ՝ միշտ ստիպված ես անցնել նույն աշխարհը ամենասկզբից ։	մակարդակում	6	Loc
Դեսպանը նաև քաջալերեց պարողներին , նրանց ծնողներին և ծրագրին աջակցող այլ անհատներին նրանց նվիրվածության համար :	նվիրվածության	13	Dat
Աշակերտ ժամանակ , երբ մտնում էի Լեզվի ինստիտուտ , անպայման իջնում էի վերև տանող ճոխ ու լայն աստիճանասանդուղքի տակ ու դուրս գալիս ետնամուտքով Կաթողիկեի բակ :	աստիճանասանդուղքի	17	Dat
Այս կապակցությամբ Ամենայն Հայոց Կաթողիկոսն իր օրհնությունն ու գնահատանքը բերեց նաև դոկտոր Էրիկ Էսրաիլյանին այս հարցում ունեցած կարևոր դերակատարության , ինչպես նաև ԱՄՆ-ի հայ համայնքի ազգային - հոգևոր կյանքի զորացման գործում ունեցած ակտիվ մասնակցության և ներդրման համար :	դոկտոր	11	Nom
Այդ ճանապարհը Հայաստանի համար ռազմավարական նշանակություն ունի , և վստահաբար կարող ենք ասել , որ հետանկախական շրջանի եզակի խոշոր նախագծերից մեկն է , որն ունի ոչ միայն ներհայկական , այլ նաև միջազգային , տարածաշրջանային նշանակություն :	նշանակություն	5	Nom
Գյուղացիք այդ դեռ ջահել աղջկան առաջին անգամ տեսել էին հենց եկեղեցու գմբեթից խաչը գցելու օրը ։	գմբեթից	11	Abl
Հետագայում իննսունն անց Սաթոն հարազատներին ու հիշողությունը կորցրած , իր տարրալուծված գիտակցության մեջ ապրածից կպահի միայն այդ կանաչ բուռդիկը և գյուղը տակնուվրա անելով կփնտրի այն . « Բուռդիկս ... ո՞վ տարավ , ո՞ւմ տվիք ... » ։	Բուռդիկս	27	Nom
Ցավալի իրողությունը շռայլ գույներով լրացվում ու ամփոփվում էր այն գիտակցությամբ , որ այստեղ սեփական կամքով չի եկել , նաև անհայտ է , թե ինչպես է եկել ։	գիտակցությամբ	9	Ins
Գոնե սա պիտի հասկացներ իշխանությանը , որ նույնիսկ իրենց համար միակ ընդունելի ընդդիմություն ԵԼՔ-ն արդեն չի բավարարվում խորհրդարանով :	ընդդիմություն	12	Nom
ԱՄՆ դեսպանը իր խոսքում շնորհավորեց ծրագրի կազմակերպիչներին և շնորհակալություն հայտնեց ծրագրի հանձնառության համար :	հանձնառության	11	Dat
« Ժողովուրդ » թերթը գրում է . « Մինչ հասարակական քաղաքական շրջանակների ուշադրությունն այս օրերին սևեռված է ներքաղաքական ինտրիգների վրա , կառավարությունը թաքուն քայլեր է անում « Կուտակային կենսաթոշակների մասին » օրենքն ամբողջ ծավալով կիրառելու ուղղությամբ :	Ժողովուրդ	1	Nom
Լավ արաղ ունեմ ` տանձի , լավ պանիր ` ոչխարի ...	տանձի	4	Dat
Իսկ նախկինի ու ներկայի հիմնական գործող անձը ՝ ըմբոստ ժողովուրդը , կարծում եմ , չփոխվեց , և այդ իմաստով 2008 և 2018-ի ազատագրական շարժումները լիովին նույնասեռ են իրենց կազմով ու հիմնական կարգախոսներով ՝ ազատություն , արդարություն , արժանապատվություն :	կազմով	28	Ins
Ապա նա վառ ներկայացուցիչն է բիթնիկների մշակույթի , որը ցնցեց սպառողական հասարակությունը , որտեղ պատերազմի օրերին իշխող է դառնում ռազմա - հայրենասիրական հիստերիան , իսկ խաղաղ ժամանակ գորշությունը ՝ իր 50 երանգներով ։	հիստերիան	22	Nom
Սահմանադրության 52 և 100 ( կետ 4 ) հոդվածների պահանջներից ելնելով « Սահմանադրական դատարանի մասին » ՀՀ օրենքի 75 հոդվածի 5-րդ մասը սահմանել է .	պահանջներից	9	Abl
Այդ տղան սեղանիկ ուներ էդ տոնավաճառում , ու փաստորեն , միասին էին աշխատում , գնում գործի , գալիս ։	սեղանիկ	2	Nom
Առաջնությունից առաջ գլխավոր մարզիչը հետևյալ 4 ֆուտբոլիստներին ստիպում էր մարզումներից հետո մնալ , որպեսզի աշխատեին համագործակցության մակարդակը բարձրացնելու վրա :	մարզումներից	9	Abl
Ինչ խոսք , դա պատճառաբանված թուլություն էր , որովհետև , եթե հեռախոսի խելքին փչում էր զրնգալ ուշ գիշերին կամ վաղ առավոտյան , ապա խոսափողը վերցնելու համար նախասենյակ էր ուղևորվում ոչ թե ամուսինը , այլ ամենահաս կինը ։	խելքին	12	Dat
Գուցե նորից կալանավորելու հրաման տվողը ներքուստ հենց սա է ուզեցել ` ՀԱՑ ԲԵՐՈՂԻ կերպարը զարտուղի ճանապարհով առավել պարուրել լույսով :	լույսով	18	Ins
Կոյուղին խցանվել է , կպայթի , ու ջրերը կլցվեն տնով մեկ ։	տնով	9	Ins
Հայոց ցեղասպանության կազմակերպիչներից Ջեմալ Փաշայի թոռը ՝ գրող , հրապարակախոս Հասան Ջեմալին « հանցախմբի քարոզչություն » իրականացնելու հիմնավորմամբ սպառնում է մինչև 13 տարվա ազատազրկում , հաղորդում է թուրքական Diken լրատվամիջոցը :	հիմնավորմամբ	17	Ins
Գժանոցը դատավճիռ է , հոգեբուժարանը ՝ ոչ :	հոգեբուժարանը	4	Nom
Հայտնի բլոգերը Հայաստան է եկել ՀՀ քաղաքավիացիայի գլխավոր վարչության և Զբոսաշրջության պետական կոմիտեի նախաձեռնությամբ :	Զբոսաշրջության	10	Dat
Աշխատանքային այցով Շվեյցարիայում գտնվող վարչապետ Նիկոլ Փաշինյանը Ցյուրիխում հանդիպումներ է ունեցել մի խումբ գործարարների հետ , որոնց հետ քննարկել է Հայաստանում տարբեր ներդրումային ծրագրերի իրականացման հնարավորություններն ու հեռանկարները :	գործարարների	13	Dat
Զորքի առաջ ունեցած ելույթից հետո վրան խաղաղություն էր իջել և այլևս չէր մտածում պավլիկյանների հետ սպասվող կռվի մասին :	ելույթից	3	Abl
Վարչապետի հանձնարարականով համագործակցելով ՀՀ գյուղատնտեսության , էներգետիկ ենթակառուցվածքների և բնական պաշարների նախարարությունների հետ , էներգետիկ ենթակառուցվածքների և բնական պաշարների նախարարությունը պետք է հստակեցնի գետերի ցանկը , որտեղ բնապահպանական , գյուղատնտեսական և այլ առանձնահատկություններից ելնելով արգելվում է ՀԷԿ-երի կառուցումը :	առանձնահատկություններից	32	Abl
Այստեղ արդեն խոսքս ընդհանրապես թոռներին իրենց պապերից բաժանող առաջին օղակի ՝ միջին տարիքի բոլոր հայրերի և բոլոր թոռների մասին է . նրանց , որ սովորում են , նրանց , որ աշխատում են , նրանց , որ վտանգավոր օղակում են ։	տարիքի	12	Dat
Նրանք մեզ հետ սեղան նստեցին ոչ թե իրենց հայրերի տարեկիցների և ինչ - որ գրողների խոսքը լսելու , այլ ապացուցելու , թե որքան անհարկի էր մեր միջամտությունը ։	հայրերի	8	Dat
ՀՀԿ-ում երեք պայմանական թիմ է ձևավորվել , և նրանց միջև պայքարը կարող է ավելի կոշտ լինել , քան ընդդիմության և իշխանության միջև :	իշխանության	20	Dat
Գործ ունենք մի իրավիճակի հետ , երբ իշխանությունը զբաղված է իր օրակարգով , պատրաստվում է հանուն Սերժ Սարգսյանի նախագծված սահմանադրության ու պառլամենտական կոչվող համակարգի վերջնական անցմանը :	օրակարգով	11	Ins
Այնտեղ պառկած է մեկի հայրը , որի հոգեկան աշխարհը խախտվել էր սեփական խղճի ծանրությունից :	ծանրությունից	13	Abl
Տղամարդը զգաց , որ իրեն հետևում են , բայց պատին դիմելով բղավելը հիմա ավելի անիմաստ էր , քան առաջ ։	պատին	9	Dat
Ինքն էլ համաձայն էր . « Էրեխու զորությունն ի՞նչ ա , ձեռդ սեղմեցիր քիթբերնին ՝ խեղդված ա » ։	զորությունն	7	Nom
Սիրիայի Արաբական Հանրապետության տարածքում հայ մասնագետների տեղավորման , նրանց կարգավիճակի , գործառույթների և անվտանգության հետ կապված հարցերը կարգավորվել են Հայաստանի Հանրապետության օրենսդրության համաձայն :	տարածքում	3	Loc
Տրորողի կողմից էլ մոռացվում է նրա գոյությունը , իսկ նա ժամանակին ցորեն է եղել , հետո ՝ հաց ...	Տրորողի	0	Dat
Նախ ` խոչընդոտի բնույթի գնահատման արդյունքում , երբ Հանրապետության Նախագահի թեկնածուներից մեկի համար անհաղթահարելի խոչընդոտներ են առաջացել ու դրանք չեն վերացել , երկրորդ ` իրավունքի ուժով ` մինչև քվեարկության օրը թեկնածուներից մեկի մահվան դեպքում :	Նախագահի	9	Dat
Իմ նկատմամբ բռնություն չեն կիրառել , ինձ հետ խաղացել են , փաստորեն ուղղակի խաղացել են ու բաց թողել ՝ առանց փրկագին ուզելու , մի շաբաթից , բոլորի աչքի առաջ ։	փրկագին	20	Nom
Կալինիչը երկրորդ խաղում անընդմեջ պատճառաբանեց , որ մեջքի հետ խնդիրներ ունի և հեռացվեց հավաքականից :	հավաքականից	13	Abl
Եթե ԵԼՔ-ին դնենք մի կողմ , ապա արտախորհրդարանական ճամբարում , բացառությամբ ՀԱԿ-ի , մյուս խմբերն ու գործիչները , որոնց կարելի է անվանել հետծռական ալիքի գործիչներ , ունեն համախմբման մեկ կարևոր առանցք ՝ մարգինալությունը :	ԵԼՔ-ին	1	Dat
Իսկ թե պարգև ստացած դրամը ջահելը որտեղ և ինչպես է ծախսո՞ւմ ... դրա համար ես հաշիվ եմ պահանջում ։	ջահելը	5	Nom
Իսկ ինձ զարմացրեց , որ հանձնաժողովը մի տարի էլ դիմադրեց զանգվածային մշակույթի ու ճարպիկ էպիգոնության ՝ Հարուկի Մուրակամիի հաղթանակին ։	հաղթանակին	18	Dat
Իսկ մենք ՝ Խորհրդային երկրի նախկին աշակերտներս ու հիմա ՝ ուսանողներս , կանգնում էինք նրանց դիմաց ու պահանջում հեռանալ մեր քաղաքից :	ուսանողներս	10	Nom
Կարճ ասած ՝ միջազգային սրվող այս և այսպիսի այլ իրողությունների հաշվառմամբ է Ադրբեջանը զարգացնում իր վերոհիշյալ ագրեսիվ սպառնալիքները ՝ վստահ լինելով , որ այդ եռյակի իր դաշնակիցները և միջազգային աղմկոտ անտարբերությունը կնպաստեն մարսել « կատարված փաստը » :	հաշվառմամբ	10	Ins
Նախարարությունը պետք է նաև ուսումնասիրի գործող և կառուցվող բոլոր փոքր ՀԷԿ-երի ջրառի կետերում շահագործողի միջոցներով , հնարավորության դեպքում նաև դրամաշնորհների ներգրավման ժամանակի իրական ռեժիմում տեղեկատվության փոխանցման համակարգի ներդրման հնարավորությունները :	ռեժիմում	23	Loc
Հայաստանում 2018-ին տնտեսական ակտիվության ցուցանիշը կազմել է 5,8 % , սպառողական գների ինդեքսը ՝ 2,5 % . Հայաստանի Հանրապետության վիճակագրական կոմիտեն հրապարակել է ՀՀ սոցիալ - տնտեսական վիճակը բնութագրող ընթացիկ - օպերատիվ ամփոփմամբ ստացված նախնական հիմնական մակրոտնտեսական ցուցանիշները ։	գների	11	Dat
2016 թվականին ազգային ընթացակարգով ստացվել է ապրանքային նշանների գրանցման 1717 հայտ , որոնցից 1261-ը ՝ ազգային հայտատուներից :	հայտատուներից	16	Abl
2016 թվականին ազգային հայտատուներից ստացվել է 1261 հայտ , որը 2015 թվականի համեմատությամբ նվազել է 79-ով :	համեմատությամբ	12	Ins
- Պարոն Նեդոլյան , որո՞նք պետք է լինեն այն քայլերը , որոն պետք է իրականացնեն նոր կառավարությունն ու վարչապետն առաջնահերթ ։	կառավարությունն	16	Nom
Պատգամավոր Կարեն Կարապետյանը հայտարարել է նաև վարչապետ Կարեն Կարապետյանին աջակցելու մասին , և ըստ ամենայնի , հենց Կարապետյանների թիմն է տոն տալու նախընտրական պայքարում :	պայքարում	23	Loc
Հրեշին հաղթելու երկու ձև կա . հասնել նրա հետևում դրված կացնին , որը կտրում է կամուրջը պահող երկաթե ձողը , ու նա ընկնում է լավան , կամ անվտանգ հեռավորությունից հրեգնդերով ռմբակոծել ։	հեռավորությունից	28	Abl
« Միոբիուսի ժապավենը » շշնջաց , թե այդ մարդը հագուստը փոխած ոստիկան է ։	ժապավենը	2	Nom
« Հայ մասնագետները Հալեպի ՝ բացառապես ռազմական գործողություններից զերծ բնակավայրերում ծավալելու են հումանիտար ականազերծման , բնակչության հակաականային իրազեկման , բժշկական ծառայությունների մատուցման մարդասիրական գործունեություն :	բնակավայրերում	9	Loc
Հոգեշնորհ Տ . Անանիա աբեղա Ծատուրյանը , ով ավարտել է ուսումնառությունն Ամերիկայի Միացյալ Նահանգներում , հայրապետական տնօրինությամբ նշանակվել է գավազանակիր :	Տ	1	Nom
Երբ շինմոնտաժային աշխատանքները սկսվեցին այս հոգևոր տարածքում ՝ Կաթողիկեի գմբեթի խաչն անհետացավ :	խաչն	10	Nom
Մենք տներից դուրս եկանք փետրվարի քսանին ու տուն դարձանք իննսուն թվականին , որովհետև հետո ... պատերազմ էր :	պատերազմ	15	Nom
Փիլիսոփայական ֆակուլտետի երկրորդ կուրսից ինձ վռնդեցին , որովհետև ուսանողների հորդորով միզեցի լսարանի վառարանի մեջ ՝ կրակը հանգցնելու համար ։	կուրսից	3	Abl
Հայաստանում էական աճ է արձանագրվել ծառայությունների ոլորտում ՝ 18,8 % , իսկ առևտրաշրջանառության մեջ արձանագրվել է 8,7 % աճ ։	առևտրաշրջանառության	12	Dat
Իսկ ով այդ կապն ունակություն չունի տեսնելու , ուզում է փոփոխություն , բայց չի գիտակցում , որ ինքը գործ ունի անելու , որ իր ընտրությամբ պատասխանատու է դրա համար :	ընտրությամբ	24	Ins
« Հասկանում եմ » . հոգոց է հանում լեռնցիքի ձեռքից ահագին քաշված ձուկը , հետո Նեպտունի արևով , օվկիանոսի կապուտակ գույնով , իր սաղուսատկածով երդվում , թե գեղցու ասածները կանի ։	սաղուսատկածով	23	Ins
Ռուսաստանի Կրասնոդար երկրամասի Արմավիր քաղաքում մարտի 7-ի երեկոյան Լենին փողոցի բնակելի շենքի վերալակում հայտնաբերվել է 2 տղամարդու դի :	քաղաքում	4	Loc
Նոր հավելվածից կարելի է օգտվել , եթե ամուսնալուծության մասին որոշումն արդեն ընդունված է , և ամուսինների միջև տարաձայնություններ չկան ֆինանսական հարցերի կամ ունեցվածքի բաժանման շուրջ :	հավելվածից	1	Abl
Գավկոմի քարտուղարը հայտարարել էր , թե կուսակցության որոշմամբ Աստված չկա , և եկեղեցին կոլխոզի պահեստ պիտի դառնա ։	պահեստ	14	Nom
Արգելեցին զենքով եկեղեցի մտնել :	զենքով	1	Ins
Չկա , բայց իշխանությունները փորձում են համառորեն ԵԼՔ-ին տեսնել այդ ուժի դերում :	ԵԼՔ-ին	7	Dat
