Մարտի 6-ին և լույս 7-ի գիշերը արցախա - ադրբեջանական հակամարտ զորքերի շփման գծում հակառակորդը տարբեր տրամաչափի հրաձգային զինատեսակներից հրադադարի պահպանման ռեժիմը խախտել է 50 անգամ , որի ընթացքում , հայ դիրքապահների ուղղությամբ արձակել է ավելի քան 1100 կրակոց :	գծում	12	Loc
Թռչում էր պատերազմների վրայով , դավաճանության ու կոտորածների վրայով , արյուն կուլ տալով ու անեծք արտաշնչելով , ամոթից մեռնելու փոխարեն հպարտանալով , ճյուղից ճյուղ թռչելով , չքավորի ուսերին արքայական թիկնոց գցելով , հասցնում էր արմատին ։	անեծք	14	Nom
2016 թվականին ազգային ընթացակարգով ստացվել է ապրանքային նշանների գրանցման 1717 հայտ , որոնցից 1261-ը ՝ ազգային հայտատուներից :	1261-ը	13	Nom
Թշնամին սեղմում էր օղակը , սովն ու ջերմախտը հնձում էին զինվորներին , բայց Սիմեոնն անձնատուր չեղավ :	զինվորներին	10	Dat
Նշենք , որ արտահանման ոլորտը Հայաստանի կառավարությունը համարում է տնտեսական աճ ապահովելու հենասյուներից մեկը :	հենասյուներից	12	Abl
Հունվարի մեկին նա հսկայական երաժշտական կենտրոնը ձեռքին ներս է մտնում :	կենտրոնը	5	Nom
Կառաջարկեի պարզապես նշանակել Բագրատյանին նոր կառավարության բարեփոխումների գծով գլխավոր խորհրդական , իսկ եթե ոչ ՝ ինքնուրույն ուսումնասիրել իր շատ կարևոր ու նորարական մոտեցումները :	բարեփոխումների	6	Dat
Փառատոնի շրջանակում կանցկացվի Ուլրիխ Զայդլի « Սաֆարի » և ամերիկյան կինոյի ներկայացուցիչ Շոն Բեյքերի « Ֆլորիդա նախագիծը » ֆիլմերի հայաստանյան պրեմիերաները :	շրջանակում	1	Loc
Մենք ձվից ասես միայն հիմա դուրս ելանք ու զարմացած նայեցինք 5-րդ փողոց կոչվածին , մեր աչքերը ասես միայն հիմա բացվեցին , այդպես նայելու ու այդպես տեսնելու համար ։	աչքերը	15	Nom
Մարդկության դեմ գործած այդ ահավոր ոճրի միջազգային ճանաչումը և դատապարտումը կարևոր քայլ պետք է դառնա դրա կրկնությունը աշխարհում որևէ տեղ բացառելու նպատակով :	աշխարհում	17	Loc
Ծոցագրպանից օրագիրը վերցրինք , որտեղ արևի մասին տողեր կային , շուն գեներալների , հաց չմատակարարող պահեստապետերի ու իր գործիքով մեր խփած տանկերի քանակի մասին :	տանկերի	21	Dat
Վերցված գերիներին և վիրավորներին խումբ - խումբ թիկունք էինք ուղարկում :	թիկունք	7	Nom
Ինձ այդ եզրույթը ծանոթ և հասկանալի է առաջին հերթին Հրանտ Բագրատյանի հետ շփման հետևանքով , Բագրատյանը զարգացրել է դրա կիրառական , անգամ վարչարարական գործածման տեսությունը տնտեսությունում , կրթությունում , մշակույթում , աողջապահությունում . մի խոսքով իբրև ունիվերսալ վարչարարության մեթոդ :	տնտեսությունում	25	Loc
Մեծ Սևանի ափամերձ գոտու ջրի միջին ջերմաստիճանը 2017 թվականի հունվարին կազմել է 2 աստիճան , իսկ Փոքր Սևանինը ` 2,3 աստիճան :	ջերմաստիճանը	6	Nom
Կաշառք ` լռության դիմաց :	Կաշառք	0	Nom
« Անսահմանափակ շարժում » ծրագիրը մշակել և իրականացրել են ամերիկյան փոխանակման ծրագրերի մի խումբ շրջանավարտներ :	շարժում	2	Nom
Էքստրեմիզմի մասին խորհրդային ուսանողի պատկերացումները սուղ էին , ու մենք իրոք ժպտացինք մեզ ուղղված մեղադրանքի վրա :	պատկերացումները	4	Nom
- Ըստ Ձեզ ՝ որքանո՞վ էր այն սիրո և համերաշխության հեղափոխություն , երբ այս օրերին համացանցում կարծեք թե այլ պատկեր է ՝ ատելության դրսևորումներով ։	օրերին	14	Dat
Վեհափառ Հայրապետը գնահատանքով անդրադարձավ համալսարանի կողմից այդ ուղղությամբ արդեն իսկ գործադրված ջանքերին ` մասնավորապես Հայաստանի Ամերիկյան համալսարանի կայացման գործում ունեցած կարևոր ներդրմանը :	գնահատանքով	2	Ins
Երկրորդ անցումը գտնվում է չորրորդ աշխարհի երկրորդ մակարդակում ։	մակարդակում	7	Loc
Մեծ Սևանի ջրի հայելու մակերեսը 2017 թվականի հունվարի վերջի դրությամբ կազմել է 939,65 ք/կմ , իսկ Փոքր Սևանինը ` 338.39 :	դրությամբ	9	Ins
Բերանի շարժումներից եմ հասկանում :	շարժումներից	1	Abl
Ինչ - որ պահի Ցվիտանովիչը , ով Խորվաթիայում հիանալի խաղ ցույց տալուց հետո տեղափոխվել էր Իսպանիայի առաջնություն , չդիմացավ և հրաժարվեց լրացուցիչ մարզումից :	մարզումից	22	Abl
— Պարոն Մարգարյան , հանրահավաքների շարք է սկսվում Ազատության հրապարակում , իսկ դրանից առաջ էլ Նիկոլ Փաշինյանն առաջարկում էր համախմբվել և թույլ չտալ Սերժ Սարգսյանի վերարտադրությունը ։	հրապարակում	9	Loc
Ղարաբաղյան հակամարտության գոտում խաղաղապահ ուժերի տեղակայման խնդիրը Իրանի քաղաքական ու ռազմական բարձրագույն ղեկավարության ուշադրության կենտրոնում է , և Իրանը պաշտպանական միջոցառումներ կձեռնարկի այդ ուղղությամբ ։	գոտում	2	Loc
Փառատոնի շրջանակում կանցկացվի Ուլրիխ Զայդլի « Սաֆարի » և ամերիկյան կինոյի ներկայացուցիչ Շոն Բեյքերի « Ֆլորիդա նախագիծը » ֆիլմերի հայաստանյան պրեմիերաները :	Փառատոնի	0	Dat
Այս ամենին հարկ է հավելել նաև , որ ժամանակ առ ժամանակ իմ կատարած անձնամատնիչ քայլերը եղել են ոչ թե ազնվության դրսևորումից , այլ կենսաբանական կրավորությանս պատճառով ։	դրսևորումից	20	Abl
« Ձիավոր » ա , — բացատրում էր տանջանքից նվաղած կնոջը , — մի քիչ էլ սպասենք , թե չեկավ , ձեռքս կմտցնեմ կուղղեմ » ։	տանջանքից	8	Abl
Պարզապես իրադրությունների մեջ այդ խորին խորհուրդը ավելի սուր դրսևորվեց , և նրանք ավելի պինդ ապավինեցին այդ խորհրդին ։	իրադրությունների	1	Dat
Հայրը , փաստորեն , հեղափոխության ցնցումներին չդիմանալով ( մոր ասելով էր էդպես ) 1991 թվականին , աշխատանքը կառավարական ավտոպարկում կորցնելու ցավից ինֆարկտ ստացավ ու մահացավ ՝ էդպես էլ թոռանը չտեսնելով ու աղջկան չներելով ։	ցնցումներին	5	Dat
Իր հերթին Լոս Անջելեսի Կալիֆոռնիայի համալսարանի ռեկտորը նշեց , որ առաջին անգամ է այցելում Հայաստան և իր ծանոթությունը հայ ժողովրդի հետ մինչ այս եղել է ամերիկահայ համայնքի միջոցով :	հերթին	1	Dat
Եվ զամբյուղները ցած իջան արդեն կատարյալ լռության մեջ ։	լռության	6	Dat
Կառավարությունն էլ որպես փոխզիջում որոշեց , որ կուտակային կենսաթոշակային համակարգը պարտադիր է լինելու պետական կառույցների աշխատակիցների համար , իսկ մասնավորների դեպքում օրենքի կիրառումը հետաձգեց :	համակարգը	9	Nom
Անդրադարձ կատարվեց նաև Հայոց Եկեղեցու առաքելությանը նվիրյալ և հավատավոր հայորդիների բերած զորակցությանը և Մայր Աթոռի կողմից իրականացվող կրթական ու սոցիալական ծրագրերին :	հայորդիների	9	Dat
Նա ընդգծեց , որ այս տարի աշխատում են ընդլայնել պարկի ծառայություններն ու ենթակառուցվածքները :	պարկի	9	Dat
Հետո մի օր ուսանող Սերո հորեղբայրս ջրաղացի շուրջբոլորը ոսկու հանք է որոնած եղել , ու պապս քթի տակ խնդմնդացել է ։	շուրջբոլորը	7	Nom
Միևնույն ժամանակ , անհանգիստ շուռումուռ գալով անկողնում , նա բացեց աչքերը և , մի քանի վայրկյան ոչինչ չհասկանալով , նայում էր առաստաղին , մինչև գիտակցությանը հասավ , որ լսում է հեռախոսային զանգեր ։	առաստաղին	21	Dat
Այս առումով , դիմողի բերած այն փաստարկները , որոնք առնչվում են ՀՀ Նախագահի թեկնածուի գրանցմանը նախորդող գործընթացներին , անմիջականորեն չեն վերաբերում սույն գործով սահմանադրական դատարանին ներկայացված խնդրանքին :	գործով	22	Ins
« Ժողովուրդ » թերթը գրում է . « Մինչ հասարակական քաղաքական շրջանակների ուշադրությունն այս օրերին սևեռված է ներքաղաքական ինտրիգների վրա , կառավարությունը թաքուն քայլեր է անում « Կուտակային կենսաթոշակների մասին » օրենքն ամբողջ ծավալով կիրառելու ուղղությամբ :	ծավալով	33	Ins
Ցածում գետի պողպատագույն ժապավենն է , գետափի դարավանդին ` եկեղեցի , որն իր հավաք գծագրով կտրատում է լանջի գունագեղ պատկերը . վարդագույն պատեր , վերձիգ գմբեթ , կամարաձև շքամուտք , դեպի խճուղին իջնող արահետ ...	գծագրով	14	Ins
Մեզ մի կերպ հաջողվեց հարբածին դուրս բերել սրճարանից , մի կերպ հաջողվեց խուսափել ծեծկռտուքից , ջահելների մի մասը գնաց հարբածի հետքով ՝ խաղը շարունակելու , իսկ մի քանիսի հետ մենք նստեցինք զրույցի ։	ծեծկռտուքից	13	Abl
Սուտ կլինի , եթե ասեմ . « Հիշում եմ , որ եկան կանգնեցին ու ասացին . մեռնեմ կոլխոզային օրինակելի կանոնադրությանը . կամ արի կոլխոզ , կամ տնամերձդ հանձնիր » ։	տնամերձդ	26	Nom
Թունդ օղին , որ տվել էին նրան ձեռքերը լվանալու համար , գնալ - գալու արանքում արդեն կես էր արել ու հիշելով վերցրած կանաչ շալ կտորը ՝ մտածում էր , որ եթե խոսքի տերը չլինի , կանայք իրեն կսպանեն ։	արանքում	14	Loc
3 ) ապահովել հյուրերի սպասարկումը « Զվարթնոց » միջազգային օդանավակայանի կառավարական սրահում :	սրահում	11	Loc
Մայրս գդալով ապուրի մեջ ճզմում է դեղահաբը :	գդալով	1	Ins
Ինձ պես մի կյանք չունեիր , քոնոնք շատ էին , իմ միակը գումարվել էր քո համարակալված կյանքերին , ու թռվռալով առաջ էինք գնում ։	կյանք	3	Nom
« Հը՞ » , — ձնով սառած ձեռքերը շփելով սպասողական նայում ու հայացքով լռությունը թրատում էին դռան մոտ խմբված կանայք ։	ձնով	5	Ins
Նա հրաժարվել էր կարավանային բանուկ ճանապարհից , ընտրել բնակավայրերից հեռու ընկած այդ ուղին , որպեսզի աննկատ մնար բանակի առաջխաղացումը , անսպասելիորեն հայտնվեր Կիբոսսայի մատույցներում և հանկարծահաս գրոհով մեկ - երկու օրում վերցներ ամրոցը , հիմնահատակ ոչնչացներ պավլիկյան որջը :	բնակավայրերից	8	Abl
Բայց մարգինալ խմբերի առկայությունն ու ընդհանրապես մարգինալացման աճող դինամիկան ուղիղ ճանապարհ են դեպի ռադիկալացում :	մարգինալացման	6	Dat
Ու , դարձյալ , քանի որ ձուկը դեբիլ էր ( հալալ քուր - աղբոր մերձեցումից գոյացած ձկնկիթից էր սերում ) , գեղցու կառավարումն էլ մեղմ ասած ՝ իդեալական չէր ( si vis pacem pachik para bellum ) ։	աղբոր	13	Abl
Թե ի՞նչ էր իմացել Ակաթին ուղեկցող տղաներից , հայտնի չէ , բայց Ակաթի հետ չէր խոսում ։	տղաներից	6	Abl
Հունվարի վերջի դրությամբ Մեծ Սևանի ծավալը եղել է 24,04 մլրդ խմ , իսկ Փոքրինը ` 14,07 մլրդ :	դրությամբ	2	Ins
Ղարաբաղյան շարժումը սկսվել է բնապահպանական առաջին ցույցից :	ցույցից	6	Abl
- Այն դեպքում , եթե Սարգսյանի ու Ալիևի բանակցությունները սպառնալիք դառնան Իրանի ազգային անվտանգության համար , եվրոպական երկրներում իրանական դիվանագետներն արդեն նախնական հանձնարարություն ունեն Իրանի համար վտանգավոր հետևանքները կանխելու ջանքեր գործադրելու վերաբերյալ :	սպառնալիք	9	Nom
Հայտնի է միայն , որ նրանցից մեկը ՝ ծնված 1966 թ . , նույն շենքի բնակիչ է եղել :	շենքի	14	Dat
« Ժողովուրդ » թերթը գրում է . « Մինչ հասարակական քաղաքական շրջանակների ուշադրությունն այս օրերին սևեռված է ներքաղաքական ինտրիգների վրա , կառավարությունը թաքուն քայլեր է անում « Կուտակային կենսաթոշակների մասին » օրենքն ամբողջ ծավալով կիրառելու ուղղությամբ :	կենսաթոշակների	28	Dat
Այնտեղ պառկած է մեկի հայրը , որի հոգեկան աշխարհը խախտվել էր սեփական խղճի ծանրությունից :	խղճի	12	Dat
Ծրագրի իրականացումը հնարավոր է դարձել ԱՄՆ Պետդեպարտամենտի Շրջանավարտների ներգրավվածության և նորարության հիմնադրամի շնորհիվ :	նորարության	10	Dat
Եզրափակիչը տեղի է ունենալու կիրակի օրը ՝ Երևանի ժամանակով 19:00-ին :	19:00-ին	9	Dat
Հայ հանրությանը հազվադեպ է որևէ բան հուզում , բացի գազի ու հոսանքի գներից ։	գներից	12	Abl
Չորրորդներում մշտապես հայտնվում ես գլխավոր հակառակորդի ՝ հետնաթաթերի վրա կանգնած վիշապանման , եղջյուրավոր հրեշ - կրիայի ամրոցի ներսում ։	հետնաթաթերի	7	Dat
Դա կլինի 2400 մետր երկարությամբ զիփլայն , և այն կընդգրկվի աշխարհի տասը ամենաերկար զիփլայնների շարքում » , ասաց Չիբուխչյանը :	երկարությամբ	4	Ins
- Մեզ հետ զրույցներում բազմիցս նշել եք , որ նախ պետք է տեղի ունենա մտքի հեղափոխություն ։	զրույցներում	3	Loc
Հոգեշնորհ Տ . Աղան աբեղա Երնջակյանը , ազատվելով Վեհափառ Հայրապետի գավազանակրի պարտականություններից , մեկնել է ուսումը շարունակելու Իտալիայում :	Հայրապետի	9	Dat
Հետագայում իննսունն անց Սաթոն հարազատներին ու հիշողությունը կորցրած , իր տարրալուծված գիտակցության մեջ ապրածից կպահի միայն այդ կանաչ բուռդիկը և գյուղը տակնուվրա անելով կփնտրի այն . « Բուռդիկս ... ո՞վ տարավ , ո՞ւմ տվիք ... » ։	Հետագայում	0	Loc
Այդպես մտածեցինք , որովհետև նշան կար նրանց վրա ։	նշան	4	Nom
Չունենալով մարզչական փորձ , Հիերոյի հետ թիմը դժվարությամբ դուրս եկավ խմբային փուլից , իսկ ⅛ եզրափակիչում պարտվեց Ռուսաստանին :	փուլից	11	Abl
Իգնատի սև թշնամանքը , ոչ , նրանց թույլ չէր տա ձեռքները ունքներին դնել ու մորս հետ տնավարի կատակել . « Տանտիկին , հեռու քաղաքներից էս ինչ անծանոթ հյուր ես ընդունել ու մեզանից թաքուն ես պահում » ։	քաղաքներից	23	Abl
Մենք դիմել ենք ՀՀ սպորտի նախարարությանը որպեսզի մեզ հատկացվի միջազգային նորմերին համապատասխան զամբյուղներ իրենց սյուներով » , - ասաց Նազարյանը :	զամբյուղներ	12	Nom
Ընդ որում , նշենք , որ պատրաստի սննդի արատադրանքի մեջ են մտնում նաև կոնյակն ու գինին , ծխախոտը :	գինին	15	Nom
Ափի երկարությամբ , ինչքան աչքը կտրում էր , սփռված էին առափնյա մունջ ժայռերի խառը կույտեր , ծովը հանգիստ էր , իսկ ճայերը , կանխագուշակելով հաջող որս , թռչում էին ջրին քսվելով ։	երկարությամբ	1	Ins
Փորձը ցույց է տալիս , որ նույն ԵԼՔ-ում , օրինակ , կան խմբեր , որոնք այդ սահմանագիծը չեն անցնի , կան խմբեր , որոնք կանցնեն :	ԵԼՔ-ում	7	Loc
Շատ հիմարն էին , գնում ընկնում էին անդունդը , բայց թե քեզ դիպչեին ՝ մի կյանք կկորցնեինք ։	անդունդը	7	Nom
Միաժամանակ , համաձայն Հայաստանի Հանրապետության վարչական դատավարության օրենսգրքի 25-րդ գլխի դրույթների ` ընտրական իրավունքի պաշտպանության վերաբերյալ գործերի վարույթն իրականացնում է ՀՀ վարչական դատարանը ` հիշյալ օրենսգրքի 143 - 150 հոդվածներով սահմանված կարգով :	վարույթն	17	Nom
Այն զգոնության դաս պետք է լինի բոլորի համար :	զգոնության	1	Dat
Սա « ամենաուրիշ » շարժումն է շատ տարիների ընթացքում , իր մաքրությամբ , քաղաքական բնույթով , երիտասարդների մասնակցությամբ և արտահայտում է ժողովրդի ինքնամաքրման բնազդը , բնական մղումը :	մասնակցությամբ	17	Ins
Սահմանադրական դատարանը գտնում է , որ ընտրական գործընթացում տեղ գտած հնարավոր օրինախախտումների ու դրանցով պայմանավորված վիճահարույց խնդիրների լուծման համար օրենքով նախատեսվում են վերջիններիս բացահայտման , գնահատման ու վերացման կոնկրետ ընթացակարգեր ` հստակեցնելով ժամկետները և տարբեր իրավասուբյեկտների լիազորությունները :	խնդիրների	16	Dat
Մենք չգիտեինք ինչ կլինի գիշերը , երբ քնած քաղաքում աստիճանների վրա նստած ուսանողներս մենակ մնայինք :	քաղաքում	8	Loc
Վրա հասան պահակախմբի զինվորները , նիզակներով խոցոտեցին արդեն շունչը փչած Ներսեսին :	նիզակներով	5	Ins
Ակաթն էդ գործին համաձայնեց նաև այն պատճառով , որ էդ տղայի անունն էլ Արտուրիկ էր ։	տղայի	10	Dat
- Ըստ Ձեզ ՝ որքանո՞վ էր այն սիրո և համերաշխության հեղափոխություն , երբ այս օրերին համացանցում կարծեք թե այլ պատկեր է ՝ ատելության դրսևորումներով ։	համացանցում	15	Loc
Հայկը չի խոսում մի հիմնարկից , որի հանդեպ պետությունն ունի պարտավորություններ , նա խարանից է խոսում :	խարանից	13	Abl
« Ո՞ւմ ա պետք ժառանգը , որ անընդհատ պիտի հիշեցնի քո ստորացման մասին » , — համոզում էր աղջկան ։	ստորացման	11	Dat
Ի՞նչ իմանաս ` մարմնական կյանքում բավարարում չստացած մեկի հոգին չէ՞ , որ ծվարել է ծառի մեջ ու իր անհագուրդ կրքի կարոտով ներսից փչակել բնափայտը ։	կարոտով	20	Ins
Օրերս էլ Նարիշկինն աշխատանքային այցով եկել էր Հայաստան :	այցով	4	Ins
Մենք մտնում ու դուրս էինք գալիս , վազում էինք տապալված հեռագրասյուների , առաջնորդների մեծադիր յուղանկարների , գալարաթափ լարերի , մետաղների և տարաբնույթ բուրմունքներ արձակող նրանց ՝ իրար ետևից ընկնող գյուղերի միջով :	առաջնորդների	12	Dat
Պաշտոնական վիճակագրության համաձայն ՝ այս տարվա հունվարին արտաքին առևտրաշրջանառությունն էական աճ էր արձանագրել :	վիճակագրության	1	Dat
Խաչված Հիսուսի մարմարյա արձանի առջև ծունր դրած Սիմեոնը զգում էր կայսեր հայրական , ժողովրդի հիացմունքով լի հայացքները :	արձանի	3	Dat
Հանդիպման ընթացքում Ամենայն Հայոց Կաթողիկոսն իր երախտագիտությունը հայտնեց պրն . Ջին Բլոքին Հայաստանում և Միացյալ Նահանգներում այս ուղղությամբ ձեռնարկվող քայլերի համար :	Նահանգներում	15	Loc
Չորրորդ օրը վաղ առավոտյան վրանից դուրս գալով ՝ Սիմեոնը զարմանքից քար կտրեց . անձրևը փոխվել էր ձյան :	վրանից	4	Abl
Կառավարությունն էլ որպես փոխզիջում որոշեց , որ կուտակային կենսաթոշակային համակարգը պարտադիր է լինելու պետական կառույցների աշխատակիցների համար , իսկ մասնավորների դեպքում օրենքի կիրառումը հետաձգեց :	մասնավորների	19	Dat
Լատիներենի դասերից թռել էր ։	դասերից	1	Abl
