Նշված ներկայացման մեջ տարբեր կարողություններ ունեցող և տարբեր տարիքի պարողներ բեմում միասին ցուցադրեցին երկու մասից բաղկացած ներկայացում . առաջինը արդի հասարակության մեջ սոցիալական ներառման խնդրի շուրջ էր , երկրորդը ՝ « Ալիսան հրաշքների աշխարհում » հրաշալի հեքիաթի ադապտացիան :	մասից	14	Abl
Նախարարությունը պետք է նաև ուսումնասիրի գործող և կառուցվող բոլոր փոքր ՀԷԿ-երի ջրառի կետերում շահագործողի միջոցներով , հնարավորության դեպքում նաև դրամաշնորհների ներգրավման ժամանակի իրական ռեժիմում տեղեկատվության փոխանցման համակարգի ներդրման հնարավորությունները :	ներգրավման	20	Dat
Մենք վազում ենք օգնության , պառկեցնում մահճակալին . սավանից սպիրտի հոտ է փչում , սիրտը դուրս է թռչում կրծքավանդակից :	մահճակալին	6	Dat
Էն ժամանակ հեշտ էր , ոչ մի կասկած ու վախ չկար . բոլորը գիտեին , բոլորն էլ տեսնում էին , որ էդ թերհասը երեխա պահող չի , հերն էլ ծերացող , մենակ տղամարդ ...	հերն	27	Nom
Բայց մյուս կողմից էլ պալատական կյանքը ՝ կայսեր ու կայսրուհու , նրանց շրջապատող քահանաների , սարկավագների ու սաղմոսերգուների ընկերակցությունը , հոգնեցրել էր նրան :	ընկերակցությունը	18	Nom
Կարծես բոլորս լսել ենք այն կանխատեսումը ( և բոլորը հավատացել ) , թե Տիեզերքի չգիտեմ որ մասից , չգիտեմ որ ( կարծեմ ՝ Իկար ) երկնաքարը գալիս է և ուղղություն է վերցրել ուղիղ դեպի Երկիր ։	մասից	16	Abl
« … Առաքելագործության տեսիլքով է , որ Քրիստոսի երկու առաքյալները ՝ Ս . Թադեոսն ու Ս . Բարդուղիմեոսը , եկան Հայաստան և Քրիստոսի ` « գնացե՛ք , աշակերտեցե՛ք , մկրտեցե՛ք » ավետիսն ու պատգամը բերեցին նաև Հայոց աշխարհ :	տեսիլքով	3	Ins
Իսկ իր անունից խորշում էր ՝ Ակա՜թ ։	անունից	2	Abl
Շունը նորից արահետ եկավ , այս ու այն կողմ նայեց , հրացանն իջեցրեց ուսից ու դարձյալ մտավ թփերի մեջ ։	ուսից	13	Abl
Դիմումին կից սահմանադրական դատարան են ներկայացվել դիմողի փաստարկներին առնչվող նյութեր :	դատարան	3	Nom
Իսկ այն ժամանակ ՝ Զավենի հացատան տաք ալրահոտի ու քչփչոցի մեջ կանայք առաջարկել էին ՝ փորից ազատվել է պետք ։	փորից	15	Abl
Հայրը , փաստորեն , հեղափոխության ցնցումներին չդիմանալով ( մոր ասելով էր էդպես ) 1991 թվականին , աշխատանքը կառավարական ավտոպարկում կորցնելու ցավից ինֆարկտ ստացավ ու մահացավ ՝ էդպես էլ թոռանը չտեսնելով ու աղջկան չներելով ։	ինֆարկտ	21	Nom
Իսկ նախկինի ու ներկայի հիմնական գործող անձը ՝ ըմբոստ ժողովուրդը , կարծում եմ , չփոխվեց , և այդ իմաստով 2008 և 2018-ի ազատագրական շարժումները լիովին նույնասեռ են իրենց կազմով ու հիմնական կարգախոսներով ՝ ազատություն , արդարություն , արժանապատվություն :	նախկինի	1	Dat
Ես մտածում եմ , միգուցե նա մահանա , դեղահաբը ազդի արյան շրջանառության վրա , սիրտը պայթի :	արյան	10	Dat
Մինչ այս , խորվաթները լուրջ հաջողության էին հասել 1998 թվականին , երբ Միրոսլավ ( Չիրո ) Բլաժևիչի թիմը հասել էր մինչև կիսաեզրափակիչ :	կիսաեզրափակիչ	21	Nom
Պատերազմից առաջ Աբգարն ապավինել էր պղնձահանքերի կարգուկանոնավոր գյուղմասին , իր մեծ ընտանիքի գույնը տեղն էր բերել , տան մեջ էր դրել , անասուն ուներ , կարծեցին կառավարել կկարողանա Ահնիձոր ամբողջ գյուղը ։	գյուղմասին	7	Dat
Հանրային հեռուստաընկերությամբ և հանրային ռադիոյով հեռարձակվող լրատվական հաղորդումներում թեկնածուների կողմից իրականացվող նախընտրական քարոզարշավի վերաբերյալ պետք է ներկայացվի անկողմնակալ և գնահատականներից զերծ տեղեկատվություն ` ապահովելով արդար ու հավասար պայմանների պահպանումը :	գնահատականներից	19	Abl
ՇՐՋԿԵՆՏՐՈՆՑԻ չորս քեռիս ռազմաճակատում էին , հիմա զորակոչվել էին հայրս և իր հորեղբորորդի Շաքրոն , որ նաև մորս հորաքրոջ որդին էր ։	հորեղբորորդի	12	Nom
Ցածում գետի պողպատագույն ժապավենն է , գետափի դարավանդին ` եկեղեցի , որն իր հավաք գծագրով կտրատում է լանջի գունագեղ պատկերը . վարդագույն պատեր , վերձիգ գմբեթ , կամարաձև շքամուտք , դեպի խճուղին իջնող արահետ ...	գետի	1	Dat
« Սահմանադրական դատարանը կարող է անհաղթահարելի ճանաչել այն խոչընդոտները , որոնք արդեն իսկ առաջացել են և տվյալ թեկնածուից անկախ պատճառներով անհնարին են դարձնում նրա հետագա մասնակցությունն ընտրական գործընթացներին » :	թեկնածուից	17	Abl
Նամանավանդ , որ պահանջվող գումարը այնքան էլ մեծ չէ :	գումարը	4	Nom
Այս իրավիճակն իրանցիները համարում են իրական հեռանկար :	իրավիճակն	1	Nom
Թռչում էր պատերազմների վրայով , դավաճանության ու կոտորածների վրայով , արյուն կուլ տալով ու անեծք արտաշնչելով , ամոթից մեռնելու փոխարեն հպարտանալով , ճյուղից ճյուղ թռչելով , չքավորի ուսերին արքայական թիկնոց գցելով , հասցնում էր արմատին ։	ճյուղ	23	Nom
4 . Հայաստանի Հանրապետության Սահմանադրական դատարանում Հայաստանի Հանրապետության կառավարության ներկայացուցիչ նշանակել Հայաստանի Հանրապետության պաշտպանության նախարարի տեղակալ Գաբրիել Բալայանին :	ներկայացուցիչ	9	Nom
Հիմա հայրիկը շվշվացնելով զուգարանից դուրս կգա ու սովածությունից դողդողացող ձեռքերով կհամտեսի հավով ապուրը , որի մեջ լուծվել է իմ ու մայրիկի գաղտնիքը :	զուգարանից	3	Abl
Իրանը փորձում է Ադրբեջանի հետ երկխոսություն հաստատել , առաջարկելով քաղաքական ծառայությունների որոշակի հիերարխիա , որը ներառում է հետևողական առաջ քաշվող քաղաքական ռեսուրսների համակարգը :	ռեսուրսների	21	Dat
Երկնքից ընկավ երեք բամիա ( Hibiscus esculentus , փիփերթազգիների ( մոլոշազգիներ , տուղտազգիներ ) ընտանիքի միամյա բույս ) , քանի որ էս ախմախ հեքիաթի վերջում նույնիսկ Լարսի ոլորաններում մի ամիս լռված ու փտած խնձոր դժվար թե ընկներ ։	տուղտազգիներ	12	Nom
Դեսպանը նաև քաջալերեց պարողներին , նրանց ծնողներին և ծրագրին աջակցող այլ անհատներին նրանց նվիրվածության համար :	անհատներին	11	Dat
Այդ նկատառումներից ելնելով ՝ այն իրականացնում է ոլորտի զարգացմանն ուղղված մի շարք ծրագրեր ՝ ձգտելով տարածաշրջանում զբոսաշրջության խոշոր կենտրոն դառնալ :	նկատառումներից	1	Abl
Հատկանշական է , որ 1998-ին Խորվաթիան կիսաեզրափակիչում պարտվեց Ֆրանսիային :	կիսաեզրափակիչում	6	Loc
Համազգային թատրոնում նախատեսված ներկայացման բեմադրությունը Վիգեն Չալդրանյանը վստահել է դերասան և ռեժիսոր Դավիթ Հակոբյանին :	բեմադրությունը	4	Nom
Արդեն երրորդ օրն էր , որ Սիմեոնի հինգհազարանոց զորքը Գայլ գետի հովտով շարժվում էր հարավ - արևելք :	գետի	10	Dat
– Մտքով կնկարե՞ս ։	Մտքով	1	Ins
Բայց այն հանգամանքը , որ իշխանությունը հիմա կենտրոնացած է բացառապես իր ներքին խնդիրների վրա ու ըստ էության քաղաքական դաշտում ստեղծվել է վակուում , թույլ է տալիս ենթադրել , որ այդ վակուումը կարող է լցվել ռադիկալ տրամադրություններով :	դաշտում	18	Loc
Դա է մեր ՝ զինվորներիս պարտքը :	զինվորներիս	4	Dat
Ունևորները փախչում էին քաղաքից , ստրուկները ՝ կողոպտում տերերին , բարբարոսների վարձկան ջոկատները սպառնում խռովություն բարձրացնել :	քաղաքից	3	Abl
Այդ տրամաբանության շրջանակներում , ցանկանում են ճանաչել միայն ԵԼՔ-ին :	տրամաբանության	1	Dat
Նույնիսկ իմաստուն է ինչ - որ առումով , կեցութաձևի սեփական ըմբռնումով ։	ըմբռնումով	10	Ins
Բայց ես ծնվել եմ մի երկրում , որն այլևս գոյություն չունի , մի քաղաքում , որն այսօր մի պետության մայրաքաղաք է , որտեղ չափահաս տարիքում ոտք չեմ դրել ։	քաղաքում	13	Loc
Եթե Աստված ուզենա հիշել իր երազը , կապիկներից այս կողմ եղածը կմոռանա ։	կապիկներից	7	Abl
Ինչ վերաբերում է օտարերկրյա իրավաբանական անձանց ակտիվությանը , ապա 2016 թվականին ազգային ընթացակարգով ստացվել է 456 հայտ , որը 2015 թվականի համեմատությամբ նվազել է 99-ով ։	ընթացակարգով	12	Ins
Այս մոտեցումը ՝ անլուրջ վերաբերվել առաջին հայացքից իսկապես անլուրջ թվացող պրոցեսներին , քանիցս բումերանգի էֆեկտով վնասել է իշխանությանը :	իշխանությանը	17	Dat
Բուլղարները ստիպված եղան հաշտություն խնդրել և , ստանալով իրենց առաջնորդին , հեռացան Հռոմեական կայսրության տիրույթներից :	տիրույթներից	14	Abl
Ինչ վերաբերում է Բոբ Դիլանին , կարծում եմ , նա արժանի է այս մրցանակին նախ երգի խոսքերի կարգավիճակը երաժշտության պարզունակ կցորդից պոեզիայի մակարդակի բարձրացնելու համար ։	կցորդից	20	Abl
« Համագործակցելով ՀՀ գիտությունների ազգային ակադեմիայի Հիդրոէկոլոգիայի և ձկնաբանության ինստիտուտի , ինչպես նաև Քաղաքաշինության պետական կոմիտեի և Ստանդարտների ազգային ինստիտուտի հետ , պետք է մշակել ձկնուղիների կառուցման և աստիճանների բարձրության նորմեր :	ինստիտուտի	9	Dat
Վասակ Մնացականյանը , երկու տուն այս կողմ , իրենց շեմին կանգնած , ձեռքերը անդրավարտիքի գրպաններում , օրորվելով կրունկներից դեպի թաթերը ու թաթերից դեպի կրունկները , մտածեց .	ձեռքերը	12	Nom
Ողջ գիշեր լույս էր լինում , իսկ առավոտյան Գյուղը զարթնում էր հաճույքից խոնջացած կնոջ նման ։	գիշեր	1	Nom
Շվեյցարացի գործարար Հանս Շվեյկարդը ՀՀ կառավարության ղեկավարին է ներկայացրել արևային էներգիայի արտադրության խոշոր ներդրումային ծրագիր :	էներգիայի	10	Dat
Հայոց ցեղասպանության անպատժելիությունը դուռ բացեց մարդկության դեմ հետագա ծանր հանցագործությունների և ցեղասպանությունների առջև :	անպատժելիությունը	2	Nom
Մեկից ավելի անգամ կամ մի անգամ ու շատ տպավորիչ եմ լսել . « Քոնը էս կածանը ու էն չորս պատն է , էս գյուղում դու ուրիշ ունեցվածք չունես » ։	Մեկից	0	Abl
Պարտադիր չի բոլոր աշխարհները հաջորդաբար անցնել , ճանապարհը կրճատելու տարբերակներ կան , պետք է պարզապես հայտնվես բեկման գոտիներից մեկում , որտեղից հնարավոր է թռիչքաձև անցնել աշխարհից աշխարհ ։	գոտիներից	17	Abl
Ընդհանրապես կատարելությունը կազմակերպված հասկացություն է ։	հասկացություն	3	Nom
Այսպես ՝ շռայլությունը մերժած , ընչաքաղցությունը մերժած , քիչը շատ ընդունելու , փոքրը մեծ տեսնելու մեր հայրերի ավանդը ճիշտ ապրելու սկզբունք լինելուց բացի , ճշմարիտ փիլիսոփայություն է ։	շռայլությունը	2	Nom
Նրանք այդ գործը կանեն հենց այնպես , հաճույքի համար , բայց Հարութը արտաժամի վաստակից նրանց մեկ-երկու ռուբլի է տալիս ցուցում տալով .	արտաժամի	12	Dat
— Բայց երբ տեսավ , որ ծնվողը մենակ չէ ՝ պտուղը զույգ է , հասկացավ , որ իր ուժերից վեր է ։	զույգ	11	Nom
Թշնամին սեղմում էր օղակը , սովն ու ջերմախտը հնձում էին զինվորներին , բայց Սիմեոնն անձնատուր չեղավ :	սովն	5	Nom
Շրջապատված ծառաներով ու թիկնապահներով ՝ Սիմեոնն ընթանում էր բանակի կենտրոնով :	կենտրոնով	9	Ins
Հակառակ բոլոր տոհմերի , մեր ազգությունն այս անգամ սկսվում է նախատատով ։	տոհմերի	2	Dat
Արմինուսը գլխով էր անում և համբուրում նրա ձեռքը ։	ձեռքը	7	Nom
Հեռանկարում նախատեսվում են այլ բեմադրությունների առաջնախաղեր :	Հեռանկարում	0	Loc
Մշակում եմ յոդով :	յոդով	2	Ins
Իսկ « խումբը » ամբողջ Հայաստանն էր , բոլոր քաղաքներն ու գյուղերը ՝ հյուսիսից - հարավ , արևելքից - արևմուտք :	քաղաքներն	9	Nom
Ես ջերմեռանդ հավատացյալ չեմ , ու Աբովյան փողոցով անցնելիս չեմ խաչակնքվում , ինչպես մեր քաղաքի քսան տարեկան տղաներն ու աղջիկները , բայց հին եկեղեցու գմբեթին նայում էի ու խաչի զարդանախաշն անգիր գիտեմ , կարող եմ նկարագրել :	հավատացյալ	2	Nom
Ես սոսկումով խուսափում եմ նման խոսքերից , որոնք , իմ պատկերացմամբ , կարող են լինել « տականք » , « այլանդակ » ... և այլն , ու այդ պատճառով երկչոտ , չափազանց զգայուն եմ դրսից եկող ազդակների հանդեպ ։	սոսկումով	1	Ins
Բայց հարց է ՝ ինչու այդպիսի կյանք ապահովող ու այդպիսի կյանք պարտադրող իշխանությունները չեն ուզում իրենց գովազդած կյանքով ապրել :	կյանքով	17	Ins
Լինելով պարսիկների դեմ Հերակլիոս կայսեր վարած հաղթական պատերազմների հերոսի թոռ և սենատորի որդի ՝ նա զինվորական փայլուն կրթություն էր ստացել :	կայսեր	4	Dat
Ռեյտինգային ցուցակները ` վկա :	ցուցակները	1	Nom
Ես օղին եմ , ես սիգարետն եմ , ես մորֆին ու կոկայինը , ես թղթախաղը , ես , շշշը՜ , ես սսեքսսն եմ ...	թղթախաղը	14	Nom
Տղայի վարձով սենյակն էլ հարմար էր , բայց դե իրենք ամբողջ օրը աշխատում էին , ոչ շաբաթ ունեին , ոչ կիրակի , համ էլ հարևանները բա որ հանկարծ տեսնեի՞ն ...	Տղայի	0	Dat
Նշանակալի է հայտնի կինոռեժիսոր Դարեն Արոնոֆսկու ներկայությունը , որի կինոնկարների ետահայաց ցուցադրությունը կանցկացվի » , - նշեց Մովսիսյանը :	ցուցադրությունը	11	Nom
- Ըստ Ձեզ ՝ որքանո՞վ էր այն սիրո և համերաշխության հեղափոխություն , երբ այս օրերին համացանցում կարծեք թե այլ պատկեր է ՝ ատելության դրսևորումներով ։	ատելության	22	Dat
Կարճ ասած ՝ միջազգային սրվող այս և այսպիսի այլ իրողությունների հաշվառմամբ է Ադրբեջանը զարգացնում իր վերոհիշյալ ագրեսիվ սպառնալիքները ՝ վստահ լինելով , որ այդ եռյակի իր դաշնակիցները և միջազգային աղմկոտ անտարբերությունը կնպաստեն մարսել « կատարված փաստը » :	իրողությունների	9	Dat
Եվ էլի շատ վատ կողմեր ունեմ , որոնք դուք ինքներդ կնկատեք , եթե ուզենաք շարունակել ծանոթությունը իմ կյանքին ։	ծանոթությունը	15	Nom
Երկրորդը ՝ պետք է կիրառական զարգացում տալ Նիկոլի հնչեցրած կարևորագույն « ապակենտրոնացում » եզրին :	եզրին	13	Dat
Նշված ներկայացման մեջ տարբեր կարողություններ ունեցող և տարբեր տարիքի պարողներ բեմում միասին ցուցադրեցին երկու մասից բաղկացած ներկայացում . առաջինը արդի հասարակության մեջ սոցիալական ներառման խնդրի շուրջ էր , երկրորդը ՝ « Ալիսան հրաշքների աշխարհում » հրաշալի հեքիաթի ադապտացիան :	ներկայացման	1	Dat
Որքան էլ զարհուրելի ու անհասկանալի լինի ՝ մեր չնախատեսված պատերազմն անգամ ռոմանտիկների պատերազմ էր :	պատերազմ	12	Nom
Իսկ եթե , այնուամենայնիվ , չհասկանանք իրար , կա մի վերջին միջոց . այդ դեպքում այդ հայրերի աշխատանքային պլաններն ու պարտավորությունները կարելի է ընդհանրապես չընդունել ։	հայրերի	16	Dat
Ընդ որում , Կարեն Կարապետյանը խորհուրդ է տվել չընտրել ՀՀԿ թեկնածուներին , եթե ժողովուրդը դժգոհ է կուսակցությունից :	ժողովուրդը	13	Nom
Սպանված տղամարդկանցից մեկին ճանաչողները պատմել են , որ դեպքի նախօրեին գործարարներից մեկը խոշոր գումար է ստացել և պատրաստվում էր գնալ ապրանքի նոր խմբաքանակի հետևից :	դեպքի	8	Dat
Նշանների միջազգային գրանցման մասին Մադրիդյան համաձայնագրի և դրա արձանագրության շրջանակներում Հայաստանի Հանրապետության նշմամբ ստացվել է ապրանքային նշանների միջազգային գրանցման մասին 2268 ծանուցում ։	համաձայնագրի	5	Dat
Ինչևէ , երբ վերջապես սև տունը բացեց դռները , իր մեջ առավ Մարտինին ու նրա ուղեկցուհուն , մենք մտածեցինք ՝ վերջ , այս անգամ արդեն միջին ճանապարհ չկա . փոշեթավալ մարգարիտը կամ կշողշողա ամբողջ փայլով , կամ կանհետանա մեկընդմիշտ ։	փայլով	34	Ins
Եթե ԵԼՔ-ին դնենք մի կողմ , ապա արտախորհրդարանական ճամբարում , բացառությամբ ՀԱԿ-ի , մյուս խմբերն ու գործիչները , որոնց կարելի է անվանել հետծռական ալիքի գործիչներ , ունեն համախմբման մեկ կարևոր առանցք ՝ մարգինալությունը :	ճամբարում	8	Loc
ՀՀ Նախագահի թեկնածու Լևոն Տեր - Պետրոսյանի դիմումի հիման վրա ` 2008 թ . ՀՀ Նախագահի ընտրություններում ՀՀ Նախագահի թեկնածուի համար առաջացած խոչընդոտներն անհաղթահարելի ճանաչելու վերաբերյալ գործով	գործով	26	Ins
Տուն ենք վերադառնում սիրահարների պես գրկախառնված ` ցեխոտ ու քերծվածքներով :	քերծվածքներով	9	Ins
Եթե ԵԼՔ-ին դնենք մի կողմ , ապա արտախորհրդարանական ճամբարում , բացառությամբ ՀԱԿ-ի , մյուս խմբերն ու գործիչները , որոնց կարելի է անվանել հետծռական ալիքի գործիչներ , ունեն համախմբման մեկ կարևոր առանցք ՝ մարգինալությունը :	բացառությամբ	10	Ins
Նրանց գուցե ծեծում են այդ հիվանդանոցում , գուցե , ինչն ավելի հավանական է , մարդու տեղ էլ չեն դնում :	հիվանդանոցում	5	Loc
Ներկայում անում ենք ամեն ինչ , որ այս տարածքում գտնվող մի սարի գլխից հնարավոր լինի թռչել և հասնել մյուս բլուրին :	գլխից	12	Abl
— Հնարավոր համարո՞ւմ եք այս փուլում ընդդիմադիրների համախմբում այն դեպքում , երբ ընդդիմության դաշտում անգամ կարծիք է հնչում , թե Ազատության հրապարակում ատելության քարոզ է տեղի ունենում ։	փուլում	5	Loc
Պտուղը վերացնելն ավելի թանկ էր ՝ կանաչ շալ կտորը , որ ստացավ այն օրը , երբ աղբյուրի գլխին հավաքված կանանց մեջ Նախշունը երկտակվեց , ծունկը խփեց գետնին ու ցավից մզզաց ։	ցավից	28	Abl
Աշխարհի առաջնության մեկնարկից երկու օր առաջ առաջ Իսպանիայի ֆուտբոլի ֆեդերացիան աշխատանքից ազատեց Խուլեն Լոպետեգիին , պատճառաբանելով , որ վերջինս գաղտնի բանակցություններ է վարել Մադրիդի Ռեալի ղեկավարության հետ :	վերջինս	18	Nom
