Az Árgus Kiadó a szobor újraöntésével egyidejűleg albumot jelentet meg a szobrász születésének 120. és halálának 40. évfordulója alkalmából .	szobrász	11	None
Mindezt a levél írója zárójelbe teszi , s rövidre zárva feljelentését , a magyar társadalmat két osztályra bontja .	zárójelbe	4	None
Az újság szerint az államfőt november 1-jén már későn — legalább két nappal bélátfúródása után — operálták meg , ami súlyos hashártyagyulladást és vérmérgezést okozott szervezetében .	bélátfúródása	13	Sing
A feledést hozó idő az egyik oldalról , a politikai érdek a másikról talán megszépítheti ezt a borzasztó rabszolgamunkát , de az a két-három korosztály , amelyet a magyar hatóságok odavezényeltek , azért megtapasztalták Dante Infernóját .	idő	3	None
A nagyobbik koalíciós erő , a Szolidaritás Választási Akció ( AWS ) egyik csoportja , a Katolikus Családok Szervezete tagjának számító Kapera 1991-ben már lemondani kényszerült akkori egészségügyi államtitkár-helyettesi posztjáról , mert nyilvánosan perverzeknek minősítette a homoszexuálisokat .	posztjáról	29	Sing
Az egész estés rajzfilm készítői egyszerű , kedves történetet mesélnek egy lényről , aki az állatok között tapasztalja meg a szeretet , a családi összetartozás erejét , s aki ember mivoltára ébredve is inkább a dzsungelt választja .	mivoltára	30	Sing
Zaporozsje megyeszékhelyen a leszakadt villanyvezetékek miatt rendkívüli állapotot vezettek be .	megyeszékhelyen	1	None
A betegség kitörése , azaz a 80-as évek eleje óta a kórokozó 50 millió embert fertőzött meg .	eleje	8	Sing
— Ma este az Operaházban jubileumi előadással köszöntik pályakezdésének fél évszázados évfordulóját .	évfordulóját	11	Sing
A Nyugattól minden adandó alkalommal a Jugoszlávia elleni szankciók eltörlését kérő szerb ellenzéki vezetők , ha a gazdasági zárlat feloldását nem is , azt legalább elérték , hogy 350 tonna fűtőolajhoz jutnak a polgárok .	szankciók	8	None
Én pontosan emlékszem egy negyvenöt esztendővel ezelőtti beszélgetésre , amelynek minden szavát megfogadtam .	esztendővel	5	None
— Miért éppen ezt a szobrot választotta ?	szobrot	5	None
A magyar országgyűlési képviselő , ha akarja , szenátornak nevezi magát , ugyanaz a párt egyik nap ellenzék , a másik nap kormányoldalon álló , sőt a parlamenti többség akarata még a matematikánál is erősebb .	matematikánál	32	None
A koszovói háború idején kirobbant konvojügy , az orosz KFOR-gépek átrepülése körüli bonyodalom , legutóbb pedig Orbán Viktor kanadai nyilatkozata váltott ki ingerült reakciókat Moszkvában .	bonyodalom	12	None
Ezért is fontos , hogy a viszony a korrektségen , a kiszámíthatóságon , egymás érdekeinek kölcsönös tiszteletben tartásán alapuljon .	tiszteletben	16	None
Így aztán két év múltán az ifjú már valóban a szegedi alma materben folytathatta tanulmányait , ahol — kiváló eredményei birtokában — élvezte a Nobel-díjas tudós segítőkészségét .	birtokában	20	Sing
Legutóbb láthattunk egy sífelszereléseket reklámozó plakátot , melyről nyomban elhangzott , hogy nem az , ami , csak egy fénykép , melyen síoktatók között egy férfiimitátor tévébemondó társaságában ott látható a magyar miniszterelnök is .	fénykép	19	None
A német bankvilág Olümpuszát eddig megjárt hét elnök ugyanis a pénzügyi stabilitás legfőbb őreként , a szigorú kamatpolitika és a pénzmennyiség kézbentartása útján akár a mindenkori kormánnyal való konfliktust is vállalva , a márka értékállóságát helyezte mindenek elé .	őreként	13	Sing
Az éjszaka eredménye 12 személyautó , 2 autóbusz és a ráadás : a Pilisszántóba igyekvő kenyereskocsi kiszabadítása a hó fogságából .	kenyereskocsi	15	None
A májusról novemberre halasztott Martonyi-vizittől szakértők azt várják , hogy kedvező politikai légkört teremt a kétoldalú kapcsolatokban fennálló vitás kérdések megoldásához .	megoldásához	20	Sing
A horvát alkotmányban csak a tartós akadályoztatás fogalmát rögzítették , amely az államfő helyettesítésének esetére kötelezően előírta új elnökválasztás kiírását is .	alkotmányban	2	None
— A szép beszéd egyébként is kiemelkedő szerephez jut pályáján , hiszen minden évben egyszer díjátadóként lép színpadra az Operaházban , hogy a szép magyar kiejtésért alapított elismerését az erre legméltóbbnak talált kollégájának átnyújtsa .	kiejtésért	25	None
Mumadi Szajdajev ugyancsak hamisnak nevezte azokat az orosz jelentéseket , amelyek szerint a csecsen harcosok tömegesen hagyják el Groznijt és a várostól délre lévő hegyekben keresnek menedéket .	hegyekben	24	None
A XVIII. században Lengyelországban készült , a Lemberg melletti Libahara faluból származik .	században	2	None
Itt minden megtörténhet egy az egyben , még az is , hogy Tarzan beszélget az állatokkal , hogy úgy mozog , mint ők , akiktől a dzsungelélet minden fortélyát el kellett tanulnia az életben maradáshoz .	állatokkal	15	None
Törökország például Európa legnagyobb szállítója a textiláruk terén , Isztambul pedig Szöultól nyugatra a legnagyobb , elektronikai eszközöket gyártó központ .	szállítója	4	Sing
Mint Kontra Ferenc elmondta , a magyar fél már több jegyzékben kérte az orosz külügyminisztériumtól a beazonosított műtárgyak , köztük a Sárospataki könyvtár gyűjteményének visszajuttatását .	visszajuttatását	24	Sing
A tervezet értelmében Koszovó északi , Szerbiával határos részei kerülnének szerb irányítás alá , s a szerb kantonoknak Kosovska Mitrovica és Gnjilane lenne a központja .	részei	8	Sing
A szobrot 1925-ben I. világháborús emlékműként a Budapesti Műszaki Egyetem udvarán állították fel , s az 1950-es években döntötték le .	szobrot	1	None
Az aszfalton feltehetőleg irigy pillantásokat vonzó autócsoda hamarosan tehetetlen vasdarabbá válik , alaposan beragad a hócsapdába .	autócsoda	6	None
Hacsak a jugoszláv utakon , némi hatósági közreműködéssel , lába nem kél a szállítmánynak .	közreműködéssel	7	None
Az együttes 1990-es feloszlása óta főleg zeneszerzői tevékenységet folytat : komponált balettzenét , két kamaraoperát , nagyzenekari és kamaraművet , valamint több tucatnyi filmnek , színházi előadásnak is ő a zeneszerzője .	balettzenét	11	None
E kedvező politikai légkör kialakulásához nagyban hozzájárulhat Martonyi vizitje .	kialakulásához	4	Sing
Zsoldos Árpád is jól ismert és kedvelt színész Magyarországon : elég , ha csak a szentgyörgyi színház nagy sikerű Hegedűs a háztetőn című musicaljében nyújtott madárcsontú , mégis hihetetlenül erős Tevje-alakítására gondolunk .	musicaljében	23	Sing
Az alkotmány szerint a parlament november 27-i feloszlatását követő 60 napon belül parlamenti választásokat kell tartani , de a pontos dátumról még nem született döntés .	választásokat	13	None
( Radnóti a második transzportban volt . )	transzportban	4	None
Egy magángyűjtemény képei címmel nyílik kiállítás ma a budapesti Szépművészeti Múzeumban .	képei	2	Sing
Ez annak köszönhető , hogy a tavalyi második félévi regresszió után idén nemzetközi konjunktúra kezdődött , ami lehetővé tette a kereslet növekedését .	növekedését	21	Sing
Ennek érdekében egyensúlyban kell tartani a növekedés , az egyensúly , az infláció , valamint a foglalkoztatás " bűvös négyzetét " .	egyensúlyban	2	None
Fejérben volt a legkritikusabb a helyzet : 8 települést egyáltalán nem lehet megközelíteni , s időlegesen elvesztette kapcsolatát a külvilággal Lepsény és Enying is .	külvilággal	19	None
Somogyszobon egy vályogház oldalsó fala dőlt ki , az épület lakhatatlan .	fala	4	Sing
Kelebiától Budapestig százméterenként magyar és jugoszláv zászló lobogott a sínek mentén , és katonák tisztelegtek a különvonatnak .	sínek	9	None
— A szép beszéd egyébként is kiemelkedő szerephez jut pályáján , hiszen minden évben egyszer díjátadóként lép színpadra az Operaházban , hogy a szép magyar kiejtésért alapított elismerését az erre legméltóbbnak talált kollégájának átnyújtsa .	pályáján	9	Sing
Az úton ragadtak persze hálásak a tűzoltók , útmunkások segítségéért .	úton	1	None
A koszovói háború idején kirobbant konvojügy , az orosz KFOR-gépek átrepülése körüli bonyodalom , legutóbb pedig Orbán Viktor kanadai nyilatkozata váltott ki ingerült reakciókat Moszkvában .	KFOR-gépek	9	None
Elhangzik egyszer egy mű egy koncerten , a jelen lévő néhány száz ember meghallgatja , s még akkor , ha sikert arat , sincs biztosítva , hogy legközelebb is lesz mód az előadásra .	mód	30	None
A rendőrök keveset tudnak a szektáról , amely rendszeres és drága " önfelfedezési " szemináriumokat rendez .	szektáról	5	None
A közép-kelet-európai államok rendszerspecifikus vonása , hogy a piacgazdaság közigazgatási , jogi intézményrendszere csupán az elmúlt tíz évben alakult ki , és ez rövid idő ahhoz , hogy az emberek tudata is átformálódjon .	államok	2	None
Az eredeti gipszminta alapján negatívokat készítenek a 3,4 méter magas szoborról , majd a viaszkópiák alapján Gödöllőn egy magánöntődében újraöntik a szobrot .	magánöntődében	18	None
Az ellenzéki pártok képviselői az alkotmányerejű törvény ellen szavaztak , egyebek között arra hivatkozva , hogy a kormánypárt nem tartja tiszteletben az alkotmányban foglaltakat , és nem hajlandó megállapodni a parlamenti választások időpontjáról sem .	időpontjáról	32	Sing
A tárgyak még ma megtekinthetők a Biblical World Galleryben , a Wesselényi u . 13. szám alatt , az árverés pedig vasárnap délelőtt 10 órakor kezdődik a Hotel Atrium Hyatt Kármán termében .	termében	31	Sing
A felügyelet már augusztus 18-a óta vizsgálódik a London Brókernél , amelynek megromlott a likviditási helyzete .	helyzete	15	Sing
Jugoszlávia hegyei már csak ilyenek : ott fenyőfák és partizánok teremnek leginkább .	partizánok	9	None
A versenyképesség fokozása anyagi hátteret igényel .	hátteret	4	None
Svájcban a hó miatt több mint egy órára le kellett zárni a zürichi repülőtér egyik kifutópályáját .	hó	2	None
Az érthetőséghez , a szép magyar beszédhez egyébként az is hozzásegített , hogy a Zeneakadémián nemcsak dr. Molnár Imre foglalkozott velünk , hanem az egyik legszebben beszélő színész , Abonyi Géza is .	színész	27	None
A szocdemek szerint éppen ezért akadályozta mind a cseh Klaus-kabinet , mind a szlovák Vladimír Meciar kormánya az első — és szerintük felületes — vizsgálat megismétlését .	kormánya	16	Sing
A vészhelyzetből egyedül a taxisok húztak hasznot .	hasznot	6	None
A CTK hírügynökség szerint a betonfal lebontása 56 ezer cseh koronába került .	hírügynökség	2	None
" Teljesen hiábavaló a rádióban elhangzott , az újságokban megírt megannyi figyelmeztetés .	újságokban	8	None
A roppant terhek , az örökös hadi készültség , a csapatok mozgatása , az ütközetek , az utánpótlás megszervezése , a millió véletlen esemény elviselése és integrálása a katonai folyamatokba , megviselték .	utánpótlás	17	None
Gőz László nemrég indított egy huszonkét lemezből álló sorozatot , amelyben többek között Vidovszky László és Faragó Béla szerzői albuma is helyet kapott , s ennek folytatásaként jelenik meg az én CD-m is , remélhetőleg még ebben az esztendőben .	CD-m	31	Sing
A rosszfiúk jó része szláv akcentussal töri az angolt , de ez , valljuk be , csak arra a nyomorúságra utal , amelyben az utóbbi évek szegény akciófilm-forgatókönyvírói kénytelenek kiizzadni egy valamirevaló főgonoszt a kémhistóriájukhoz .	akcentussal	5	None
Nyitott gazdaságunkra jellemző a természeti tényezők szűkössége , a külkereskedelem szükségessége , az integráció igénye .	szükségessége	10	Sing
Egy magángyűjtemény képei címmel nyílik kiállítás ma a budapesti Szépművészeti Múzeumban .	kiállítás	5	None
Az elmúlt napok időjárása nyomán a Budapesttől alig 30 kilométerre fekvő pilisi települések lakói is megismerték az elszigeteltség érzését .	érzését	18	Sing
1955-ben végzett a marosvásárhelyi főiskolán , több színháznak is tagja volt , de legnagyobb alakításai a Tamási Áron Színházhoz fűzik , ahol ma is dolgozik .	színháznak	7	None
A volt cseh és a volt szlovák miniszterelnök éveken át nem tudott megállapodni a vagyonrendezés nyitott kérdésében .	vagyonrendezés	14	None
A 6-os úton keletkezett torlódás miatt bizonytalan időre lezárták a dunaföldvári hidat .	torlódás	4	None
A Vezér például bevallotta , hogy számára a szerelem hozza el a szublimálás élményét , miután az alkoholtól — ami merőben idegen a balkáni lélektől — semminemű feloldódást nem nyer .	lélektől	24	None
A Szlobodan Milosevics jugoszláv elnök vezette belgrádi rezsim pedig azért cenzúrázza a szerbek megpróbáltatásairól és tömeges meneküléséről szóló híreket , hogy továbbra is azt állíthassa : Szerbia megvédte Koszovót , s így megnyerte a NATO elleni háborút .	meneküléséről	16	Sing
Így például Bécsben és Budapesten is tíz-tíz számozott kötet kerül kalapács alá , s az árverésen összegyűlt összeget tíz-tíz alapítványnak ajánlják fel .	kalapács	10	None
A rendszerváltás legnagyobb vesztesei a szavak .	vesztesei	3	Sing
A Vörösvári Önkéntes Tűzoltó Egyesület tagjaitól tudtuk meg , hogy ez az útszakasz alig néhány éve okoz problémát a helyieknek .	útszakasz	12	None
Kiemelkedik az aukcióban részt vevő darabok közül egy ezüstből készült emeletes szédertál , amelyet cizellált arany elemekkel díszítettek és a súlya megközelíti a négy kilót .	darabok	5	None
Decemberben , a kolozsváriak tervezett Vígszínház-beli vendégjátékán erről a budapesti közönség is megbizonyosodhat , amikor is majd Shakespeare Troilus és Cressidájának Teiresziászaként láthatjuk őt a magyar fővárosban .	közönség	10	None
Mindaz a képzeletszülte meseelem , ami a gorillacsaládban nevelkedő embergyerek regénybeli történetének kalandos feszültséget és romantikus lendületet kölcsönzött , ezúttal a rajzfilm műfajában levetette az élő megjelenítés korlátait .	korlátait	27	Sing
— A szép beszéd egyébként is kiemelkedő szerephez jut pályáján , hiszen minden évben egyszer díjátadóként lép színpadra az Operaházban , hogy a szép magyar kiejtésért alapított elismerését az erre legméltóbbnak talált kollégájának átnyújtsa .	szerephez	7	None
A horvát alkotmányban csak a tartós akadályoztatás fogalmát rögzítették , amely az államfő helyettesítésének esetére kötelezően előírta új elnökválasztás kiírását is .	esetére	14	Sing
A XVIII. században Lengyelországban készült , a Lemberg melletti Libahara faluból származik .	faluból	10	None
És még egy riasztó adat : 1999-ben 5,6 millió felnőttet és gyermeket fertőzött meg az AIDS kialakulását okozó HIV-vírus .	HIV-vírus	18	None
Ma a világ három legfontosabb — a japán , a délkelet-ázsiai , az USA — gazdaságában újabb növekedési hullám kezdődött .	gazdaságában	15	Sing
A Vatikán ajánlásainak engedve a német katolikus püspökök úgy határoztak , hogy egyházuk módosítani akarja részvételét a terhestanácsadás törvény által szabályozott rendszerében .	ajánlásainak	2	Sing
Márpedig az NSZK-ban szinte mindig vannak valahol vagy helyhatósági , vagy tartományi választások — ezen az őszön például a Saar-vidéken és Brandenburgban — , s hosszabb távon egyetlen párt sem veszhet össze a választóival .	választóival	33	Sing
Az illetékesek elejétől fogva óvatosan kezelték a Nyugatra szökött volt KGB-ügynök " leleplezéseit " , ezért az olaszokra vonatkozó listát ugyan közreadták , de az igazságügyi szervek azóta alaposan tanulmányozzák azt .	KGB-ügynök	10	None
A tekintélyelvű , totalitárius hatalom szótára ugyanis mindig szemben állt a hatalom nélküliek szótárával , melyből szép és igaz mondatok fakadtak .	szótára	5	Sing
A Vecernji List című napilap úgy értesült , hogy a Dubrava kórházban lélegeztető készülékkel segítik Tudjman szervezetének működését , de az államfő nincs kómában .	működését	17	Sing
A Vecernji List című napilap úgy értesült , hogy a Dubrava kórházban lélegeztető készülékkel segítik Tudjman szervezetének működését , de az államfő nincs kómában .	készülékkel	13	None
Rájuk férne némi fűtőolaj-szállítmány , hogy a fagyos viszony felengedjen , és ők is — hasonlóan az unióhoz — name csak a frázisok terén legyenek energikusak , hanem a demokráciát illetően is .	fűtőolaj-szállítmány	3	None
Meglepett , amikor ezekre a szerepekre felkértek , hiszen voltam alvilági főnök és őrült SS-tiszt , játszhattam a Balekok és banditákban , valamint a Hány az óra , Vekker úr ? című produkciókban .	főnök	11	None
Amíg hatalmi rivalizálásukat nem szüntetik meg , a demokráciára fordítható energia csak a fele lesz annak , amire amúgy képesek lennének .	demokráciára	8	None
Bécs Budapest - Wien Budapest 2000 címmel kétnyelvű album látott napvilágot a Well-Press Kiadó gondozásában .	album	8	None
Rezníkről az a hír járta , hogy a rendszerváltás előtt az állambiztonsági szolgálat alkalmazottja volt , tehát érthető volt Dubcek tartózkodása azzal az emberrel szemben , aki korábbi üldözői közé tartozott .	üldözői	28	Sing
Az Ersténél abban reménykednek , hogy a saját részvények visszavásárlása szeptember 30-áig befejeződik — ekkor tartják azt a rendkívüli közgyűlést , amelyen a bank jegyzett tőkéjét a hitelintézeti törvényben előírt mértékhez igazítják .	visszavásárlása	9	Sing
Számos nagyszerű kötet kiadása , kiállítások és fesztiválok szervezése fűződik a nevükhöz , de most olyan vállalkozásba fogtak , amilyen korábban még nem volt Magyarországon .	szervezése	8	Sing
Mivel nem várható , hogy hazahívják , lemondani meg semmiképpen sem fog , a tekintélyelvű személyiség amerikai kutatói számára csak ajánlani lehet a vele való megismerkedést , melynek alapján nagyszerű esettanulmányok várhatók .	személyiség	15	None
Kiemelt feladatként kezelik az Előszállásnál elakadt három sertésszállító jármű kimenekítését is .	kimenekítését	9	Sing
Az intézkedést most is az orosz válság miatt megingott likviditású cégek hitelképtelensége indokolja , ami az alapanyag-termelők pozícióit is veszélyezteti .	hitelképtelensége	11	Sing
És még egy riasztó adat : 1999-ben 5,6 millió felnőttet és gyermeket fertőzött meg az AIDS kialakulását okozó HIV-vírus .	AIDS	15	None
A moszkvai külügyminiszteri megbeszéléseken Martonyi János föl kívánja vetni a Szovjetunióba vitt magyar műkincsek visszaszolgáltatásának kérdését .	műkincsek	13	None
A társaság végelszámolással történő megszüntetéséről döntenek a Corso Rt. tulajdonosai a cipőkereskedelmi cég jövő hétre meghirdetett közgyűlésén .	megszüntetéséről	4	Sing
A lórévi polgármester is hasznos elfoglaltságot talált magának , hozzájuk ugyanis már a kenyereskocsi sem jut be .	kenyereskocsi	13	None
Merthogy ilyenek bőven akadnak — legalábbis a perújrafelvétel-kezdeményezőnek véleménye szerint .	véleménye	8	Sing
A festmény- , könyv- és műtárgy-aukcióknak különleges kultusza alakult ki az utóbbi időben Magyarországon .	kultusza	7	Sing
Tegnap este az autóbuszok sok helyütt két és fél órás késéssel érkeztek a célállomásra , a főútvonalakon pedig több kilométer dugók alakultak ki .	késéssel	10	None
A hómentesítésre a Magyar Honvédség segítségét kérték , helikoptereikkel vittek kenyeret Bodmérre és Vértesboglárra .	hómentesítésre	1	None
Kelebiától Budapestig százméterenként magyar és jugoszláv zászló lobogott a sínek mentén , és katonák tisztelegtek a különvonatnak .	zászló	6	None
A globalizáció a gazdaság kínálati oldalát befolyásolja , és nem hat a jövedelmek nemzeti kereteken belül történő elosztására .	elosztására	17	Sing
Először Don Alfonsót alakítottam benne , majd Guglielmo lettem , több év elteltével pedig ismét megkaptam az öreg filozófus szerepét .	elteltével	12	Sing
Hiába tette , mint azt a rákövetkező dekabrista felkelés megmutatta .	felkelés	8	None
Fürdés , egy szerény vacsora és alvás . "	Fürdés	0	None
" Elképzelhető , hogy a Groznijtól 20 kilométerrel délnyugatra fekvő város — az egyik legnagyobb csecsen település — lesz az első olyan hely , ahol egyesült erővel harcolnak az oroszok ellen " — mondta .	település	16	None
De kuriózum a XVIII. századból Moses Mendelssohnnak ( a híres zeneszerző nagyapjának ) nagyszabású könyve , a Jerusalem is , amely a zsidó felvilágosodás első művének tekinthető .	századból	4	None
A Jutarnji List című ellenzéki napilap szerdai számának címoldalán A legrosszabb várható címmel arról adott hírt , hogy " többé már az intenzív kezelés sem segít " az elnökön .	hírt	15	None
Van viszont üldözés sítalpakon és sárkányrepülőn , motorcsónakon és olajvezetékben , és még egy atom-tengeralattjáró belseje is fontos szerepet kap , de ott már Bond az idővel is harcban áll , hogy megmenthesse az emberiséget .	atom-tengeralattjáró	14	None
Zsoldos Árpád is jól ismert és kedvelt színész Magyarországon : elég , ha csak a szentgyörgyi színház nagy sikerű Hegedűs a háztetőn című musicaljében nyújtott madárcsontú , mégis hihetetlenül erős Tevje-alakítására gondolunk .	színész	7	None
Az ENSZ francia koszovói különmegbízottja ismét felszólított a koszovói nemzetközi rendőrség létszámának növelésére .	létszámának	11	Sing
A mostani segély viszont felfogható próbának , melynek sikerétől függ a további segélyezés .	segélyezés	12	None
Az alelnök meséli el azt is , hogy az egyik elakadt autót rövid két óra alatt sikerült , az ítéletidő ellenére , valakinek kifosztania .	ítéletidő	19	None
A polgármesteri hivatalban nem tartottak attól , hogy a szállítmány esetleg nem érkezne meg rendeltetési helyére .	hivatalban	2	None
Így például Bécsben és Budapesten is tíz-tíz számozott kötet kerül kalapács alá , s az árverésen összegyűlt összeget tíz-tíz alapítványnak ajánlják fel .	kötet	8	None
A legáltalánosabb kritika , hogy a kormánynak nemhogy katasztrófaelhárítási terve nem volt , de a tragédia bekövetkezte után sem állt a helyzet magaslatán .	magaslatán	22	Sing
Kiemelkedik az aukcióban részt vevő darabok közül egy ezüstből készült emeletes szédertál , amelyet cizellált arany elemekkel díszítettek és a súlya megközelíti a négy kilót .	kilót	24	None
Nekem amúgy az életben maradáshoz , a mindennapi megélhetéshez hihetetlen csekély érzékem van , így könnyen beszélek és nehezen élek .	megélhetéshez	8	None
Olyan énekes , aki tökéletes átéléssel , szenvedéllyel , humorral alakítja lírai , drámai és buffoszerepeit .	humorral	9	None
A szobát , ahol a 66 éves Kobajasi Sinicsi teteme volt , a szekta két híve bérelte .	szekta	13	None
A rosszfiúk jó része szláv akcentussal töri az angolt , de ez , valljuk be , csak arra a nyomorúságra utal , amelyben az utóbbi évek szegény akciófilm-forgatókönyvírói kénytelenek kiizzadni egy valamirevaló főgonoszt a kémhistóriájukhoz .	nyomorúságra	19	None
Az EU éppen a fal lebontásának napján tette közzé nyilatkozatát , amely szerint a cseh EU-tagság egyik fő gondja a csehországi roma népességgel való nem megfelelő bánásmód .	EU-tagság	15	None
A magyar keretlegények durvasága , az élelem- és gyógyszerhiány , a hideg , a piszok megtette a magáét .	piszok	14	None
Nem közlekedett a Volán az M1-es autópályán sem , mivel azt a rendőrség lezárta .	autópályán	6	None
A belgyógyász-pszichiátert azonban a jugoszláv nagykövetség invitálta , miáltal nem a magyar , hanem a jugoszláv fogadócsoportban állt .	nagykövetség	5	None
A politikai közbeszédben egyeduralomra jutott jogi nyelvhasználat előfeltevése , hogy csak azt lehet számon kérni , ami le van írva és ahogyan le van írva .	közbeszédben	2	None
Brüszszelben nem is tagadják : a folytatás attól függ , hogy az elkövetkezendő tíz napban rendben megérkeznek -e Nisbe és Pirotba a szállítmányok .	napban	14	None
A bizalmas együttlétek persze módot adtak némely csevegésekre is .	együttlétek	2	None
A nisi polgármesteri hivataltól származó értesüléseink szerint a szerbiai városba szerda este megérkezett a 10 teherautó , amely az Európai Unió és a szerb ellenzék között létrejött megállapodás értelmében fűtőolajat szállít az ellenzéki vezetésű , közép-szerbiai településnek .	megállapodás	27	None
Korábbi sofőrjével jó személyes viszonya volt , teljesen megbízott benne .	viszonya	4	Sing
