Egy héten belül immár másodszor bénította meg a lengyel fővárost a hatalmas hózuhatag .	fővárost	9	None
A szobrot 1925-ben I. világháborús emlékműként a Budapesti Műszaki Egyetem udvarán állították fel , s az 1950-es években döntötték le .	emlékműként	5	None
A kamattámogatás is differenciált : az állami garancia nélküli hitelekre 100 , a garantált hitelekre pedig a kezességvállalás mértékének növekedésével csökkenően 75 , illetve 40 százalék .	növekedésével	19	Sing
— Aki valami miatt személyesen nem lehet jelen ezen az esten , az is meghallgathatja majd ennek a koncertanyagát , hiszen ezekből a szerzeményekből lemezfelvétel is készül .	koncertanyagát	18	Sing
A Tupras jövő márciusra tervezett eladásából egymilliárd dollárnyi bevételt remélt a kabinet , s bár az izmiti finomítóban négy hónap múlva teljes kapacitással folyhat a termelés , a tűzkárok helyreállítása még akár egy évet is igénybe vehet .	helyreállítása	29	Sing
Az áldozat fia , a szekta 31 éves tanítványa azt állította , hogy apja még élt , amikor megtalálták , és a boncolás okozta halálát .	tanítványa	8	Sing
A kegytárgyak között is vannak egészen különleges darabok , mint például egy kisméretű tóratekercs , amelynek a története is érdekes .	tóratekercs	13	None
Vlagyimir Putyin hangsúlyozta , hogy az új amnesztiát — amely hasonló lenne az 1994-96-os orosz-csecsen háborút követő moszkvai bűnbocsánathoz — mindenképpen megszavazná az orosz alsóház .	háborút	15	None
Hatezer fiatalembert adott el a magyar állam a németeknek , hogy velük a Todt szervezet — a Siemens és más cégek megbízásából — rezet bányásztasson , illetőleg fönt , a hegyekben vasutat építsen az érckőzet elszállításához .	elszállításához	35	Sing
A török kormány egyik nagy restanciája a gazdaság felére kiterjedő állami tulajdon privatizálása , amit az IMF ugyancsak erőteljesen szorgalmaz .	felére	8	Sing
A nyomozást azt követően rendelték el , hogy a közelmúltban egy holttestet leltek a tokiói repülőtér közelében fekvő egyik szállodában .	nyomozást	1	None
A Nyugattól minden adandó alkalommal a Jugoszlávia elleni szankciók eltörlését kérő szerb ellenzéki vezetők , ha a gazdasági zárlat feloldását nem is , azt legalább elérték , hogy 350 tonna fűtőolajhoz jutnak a polgárok .	zárlat	18	None
Rezník nem sokkal a szerencsétlenség előtt került Dubcek mellé , aki nem kedvelte őt .	szerencsétlenség	4	None
Az eldugott települések lakói már hozzászokhattak , hogy a közepesnél erősebb havazások majd minden esztendőben elzárják őket néhány napra a külvilágtól .	havazások	11	None
A hóakadályok , hófúvások országszerte számos települést zártak el a külvilágtól .	hófúvások	3	None
Kelebiától Budapestig százméterenként magyar és jugoszláv zászló lobogott a sínek mentén , és katonák tisztelegtek a különvonatnak .	különvonatnak	16	None
A Vatikán ajánlásainak engedve a német katolikus püspökök úgy határoztak , hogy egyházuk módosítani akarja részvételét a terhestanácsadás törvény által szabályozott rendszerében .	rendszerében	21	Sing
A nagyobbik koalíciós erő , a Szolidaritás Választási Akció ( AWS ) egyik csoportja , a Katolikus Családok Szervezete tagjának számító Kapera 1991-ben már lemondani kényszerült akkori egészségügyi államtitkár-helyettesi posztjáról , mert nyilvánosan perverzeknek minősítette a homoszexuálisokat .	csoportja	13	Sing
A polgármesteri hivatalban nem tartottak attól , hogy a szállítmány esetleg nem érkezne meg rendeltetési helyére .	szállítmány	9	None
Két ember életét vesztette a balesetekben , s sokakat kellett kórházba szállítani sérülésekkel is .	sérülésekkel	12	None
Volt egy öreg barátom , aki ilyen sorsot viselt .	barátom	3	Sing
Brüszszelben nem is tagadják : a folytatás attól függ , hogy az elkövetkezendő tíz napban rendben megérkeznek -e Nisbe és Pirotba a szállítmányok .	szállítmányok	22	None
A vastagon behavazott úton tényleg ez a helyzet .	úton	3	None
Az EU éppen a fal lebontásának napján tette közzé nyilatkozatát , amely szerint a cseh EU-tagság egyik fő gondja a csehországi roma népességgel való nem megfelelő bánásmód .	fal	4	None
Ennek a szakasznak a domborzata amúgy sem kedvez az autósoknak .	domborzata	4	Sing
Az álláskeresésnek e formája egyre népszerűbb , mert előnyös a hallgatóknak és a munkaadóknak .	munkaadóknak	13	None
A Jutarnji List című ellenzéki napilap szerdai számának címoldalán A legrosszabb várható címmel arról adott hírt , hogy " többé már az intenzív kezelés sem segít " az elnökön .	számának	7	Sing
A legutóbbi munkám Kamondi Zoltán Az alkimista és a szűz című filmjének kísérőzenéje volt , s most éppen Gödrös Frigyes Glamour című alkotásához írok zenét ; a filmet a jövő februári filmszemlén mutatják be .	munkám	2	Sing
Készítek emellett az Amadindának egy Full kontakt című darabot is , amelyben az ütősök egy idő után már nem a hangszereket , hanem egymást ütik .	idő	15	None
Az óriási teljesítményű munkagép kezelői elcsigázottan üldögélnek az utasfülkében .	utasfülkében	8	None
Orwell 1984-ről szóló regényének megrázó negatív nyelvi utópiája azért lehetett mozgósító erejű a szabadsághiányos múltban , mert semmi nem lehetett hatékonyabb érv a szólásszabadság mellett , mint a szólásszabadság hiánya .	érv	21	None
Nagyon szeretem a darabot , s most is rendszeresen színpadra lépek benne .	színpadra	9	None
Kísértetek szabadultak el a szabaddá vált nyilvánosságban , a szavak gyilkos , ordas , gonosz indulatok árján úszva szorongást , félelmet , az egyszer volt újra megtörténhetésének vélelmét keltették fel .	indulatok	15	None
Ezért siettették az ítélet meghozatalával az ügy lezárását , és arra is számíthattak : az önálló Szlovákia megteremtésének láza el is tereli a figyelmet a gyanús körülményekről .	láza	18	Sing
II. János Pál pápa már júniusi , majd szeptemberi levelében is bírálta a német püspökségek részvételét a terhes nőknek szervezett állami tanácsadásban , azt vetve a szemükre , hogy az igazolások kiállításával lehetővé teszik meg nem született életek elpusztítását .	nőknek	18	None
Hiszen a személyi ellentétekben is megnyilvánuló pozícióharc első nagy vesztese a klasszikus szociáldemokrata értékekre előszeretettel hivatkozó Oskar Lafontaine pártelnök lett , aki márciusban távozott a pénzügyminiszteri posztról .	vesztese	9	Sing
Az egész estés rajzfilm készítői egyszerű , kedves történetet mesélnek egy lényről , aki az állatok között tapasztalja meg a szeretet , a családi összetartozás erejét , s aki ember mivoltára ébredve is inkább a dzsungelt választja .	dzsungelt	35	None
Zaporozsje megyeszékhelyen a leszakadt villanyvezetékek miatt rendkívüli állapotot vezettek be .	állapotot	7	None
A legáltalánosabb kritika , hogy a kormánynak nemhogy katasztrófaelhárítási terve nem volt , de a tragédia bekövetkezte után sem állt a helyzet magaslatán .	terve	9	Sing
Igor Ivanov azt is elfogadta , hogy EBESZ küldöttsége december első felében utazzon a körzetbe .	küldöttsége	8	Sing
A Globus című zágrábi hetilap orvosi körökre hivatkozva azt jelentette , hogy bármelyik pillanatban bekövetkezhet Tudjman halála .	pillanatban	13	None
Pilinszky János 1964-ben ars poeticaként a Magvető Kiadó igazgatójának azt írta , hogy szeretné , ha verseinek halálraítélt legyen a lektora .	poeticaként	4	None
A narancssárga monstrum mögött járhatóvá válik az út .	monstrum	2	None
A Trajkovics-tervezet a szerbeket hozná kedvezőbb helyzetbe , hiszen épp ezekben a körzetekben találhatóak a tartomány legjobb bányái és legnagyobb ipari üzemei .	üzemei	21	Sing
Az alapítvány romániai színikritikusokból álló kuratóriuma az idén három " élő legendának " ítélte oda a kitüntetést .	kitüntetést	16	None
A nagy elődök ( Sean Connery , Roger Moore ) játékában fellelhető irónia Brosnannek ugyan nem az erőssége , de hál ' isten nem is erőlteti sem ő , sem a történet kiagyalói .	erőssége	17	Sing
A vezetékre rakódott vizes hó miatt a Dnyeper melléki vasútvonalakon villanymozdony helyett gőzmozdonyok vontatták a személyszállító szerelvényeket .	hó	4	None
— Három fotós háromféleképp fotózta le a szobrot .	fotós	2	None
A hófúvás a MÁV teljes hálózatán fennakadásokat okozott , mindenütt legalább 30 percet késtek a vonatok .	vonatok	15	None
A rosszfiúk jó része szláv akcentussal töri az angolt , de ez , valljuk be , csak arra a nyomorúságra utal , amelyben az utóbbi évek szegény akciófilm-forgatókönyvírói kénytelenek kiizzadni egy valamirevaló főgonoszt a kémhistóriájukhoz .	angolt	8	None
A megyei mentési feladatokkal a megyei védelmi bizottságokat bízták meg , ezek irányítását és az információszolgáltatást pedig az operatív bizottság végzi .	feladatokkal	3	None
1992-ben ő volt az Öregasszony Spiró György Csirkefejének Szamos-parti előadásában az Anya szerepét alakította Camus A félreértés című színművében .	színművében	18	Sing
Zsoldos Árpád is jól ismert és kedvelt színész Magyarországon : elég , ha csak a szentgyörgyi színház nagy sikerű Hegedűs a háztetőn című musicaljében nyújtott madárcsontú , mégis hihetetlenül erős Tevje-alakítására gondolunk .	Tevje-alakítására	30	None
Nem illek bele abba a közegbe , ahol nem az a fontos , hogy mit csinál valaki és annak milyen a minősége , hanem az , hogy mennyire tudja megtölteni a kiállítótermeket .	kiállítótermeket	31	None
A kiállítás egyik szenzációja az az egy méter magas , áttört Zsolnay-díszváza , amely ezen a kiállításon látható először .	méter	7	None
A vezetékre rakódott vizes hó miatt a Dnyeper melléki vasútvonalakon villanymozdony helyett gőzmozdonyok vontatták a személyszállító szerelvényeket .	vasútvonalakon	9	None
A csehországi Ústi nad Labemben szerda hajnalban teljesen lebontották azt a falat , amelyet a város vezetése építtetett október elején azért , hogy elválassza a helyi romákat a szomszédos családi házak lakóitól .	házak	30	None
Az egyetlen jelentős csapást a Tupras állami olajvállalat szenvedte el : a földmozgás által legjobban sújtott Izmitben lévő finomítója napokig lángokban állt , a kárt 200 millió dollárra taksálják , de ebből 150 milliót fedezni tudnak a biztosításból .	finomítója	18	Sing
Úgy vélekedett , hogy a banditák " élő pajzsként " használják fel polgári lakosokat , ezért a civileknek el kell hagyniuk a csecsen fővárost , s az orosz hatóságok " mindennel el fogják látni őket " .	pajzsként	8	None
Ennek a rendszernek a mítoszait mára elfelejtettük , s emiatt nekem hiányérzetem van .	hiányérzetem	11	Sing
Mivel az élet természeténél fogva leírhatatlan , és milliárdnyi történése a résztvevők között újra meg újra megkötött értelmezési szövetségen múlik , az új beszédből kimaradt az élet , kimaradtak az emberek .	szövetségen	18	None
A légzési és a szívritmust szabályozó gyakorlatok , a különféle relaxációs módszerek alkalmazása szinte kicserélték Josip Brozt .	gyakorlatok	6	None
A mondatot pontosan értette a vallató és a vallatott szerepében kényszerűen egyaránt járatos igazgató , és értetlenséget színlelve megtiltotta a költőnek , hogy szavai nyilvánosságot kapjanak .	értetlenséget	16	None
Van viszont üldözés sítalpakon és sárkányrepülőn , motorcsónakon és olajvezetékben , és még egy atom-tengeralattjáró belseje is fontos szerepet kap , de ott már Bond az idővel is harcban áll , hogy megmenthesse az emberiséget .	üldözés	2	None
A Nyugattól minden adandó alkalommal a Jugoszlávia elleni szankciók eltörlését kérő szerb ellenzéki vezetők , ha a gazdasági zárlat feloldását nem is , azt legalább elérték , hogy 350 tonna fűtőolajhoz jutnak a polgárok .	tonna	29	None
Kouchnerhez hasonlóan a tanács többi tagja sem tudja még , miképpen lehetne szavatolni a szerb kisebbség biztonságát , s így a kérdés valószínűleg még többször napirendre kerül a testület ülésein .	biztonságát	16	Sing
A kutatók minden bizonnyal felfigyelnek a nagykövet által önállótlanul alkalmazott kétosztatú gondolkodásra , mely tisztességesekre és tisztességtelenekre osztja a társadalmat , melynek elvben osztatlan képviseletét kellene ellátnia .	gondolkodásra	11	None
Mint egy edényben , az üresség , azaz a lélek tölti ki a formát .	üresség	5	None
A magyar-orosz kapcsolatokat azonban nem ez jellemezte az eltelt időszakban .	kapcsolatokat	2	None
Így került a KGB kezére az akkori olasz katonai attasé által az otthoniaknak írt titkos jelentés , sőt még a külképviselet páncélszekrényének a titkos kódja is .	otthoniaknak	12	None
Az ENSZ és a NATO abban bízik , hogy a tények kozmetikázásával sikerül valamilyen formában helyreállítani a tartomány többnemzetiségű státusát .	kozmetikázásával	11	Sing
Bécs Budapest - Wien Budapest 2000 címmel kétnyelvű album látott napvilágot a Well-Press Kiadó gondozásában .	gondozásában	14	Sing
Az államnak csupán a gazdaság szervezésében , az információ közvetítésében , az alkalmazkodás segítésében kell részt vennie , nem szabad közvetlenül beavatkoznia a gazdaságba .	gazdaságba	23	None
A digitalizált látvánnyá felturbózott kalandok sorjázásában tán kevesebb is rá az idő , elég munkájába kerülhet a stábnak már az is , hogy az intellektus fölénye azért name vesszen ki hősünkből az elképesztő csodaketyerék mellett .	idő	11	None
A lomposan megfogalmazott jogi szövegek korlátlanul megnyitották az utat az önkényes nyelvhasználat előtt , mely mögött nincs s nem is lehet gondolt , ami feltételezné a jogi nyelven túl érvényes szótár létét .	szótár	30	None
Johann Strauss műve pedig azért jutott eszembe , mert csodálatos muzsika , ami a dalszínházban mindig is a legnagyobb énekesek előadásában hangzott fel .	muzsika	10	None
Napjainkban azonban a kortárs zenének nincs infrastruktúrája .	zenének	4	None
Ezért siettették az ítélet meghozatalával az ügy lezárását , és arra is számíthattak : az önálló Szlovákia megteremtésének láza el is tereli a figyelmet a gyanús körülményekről .	megteremtésének	17	Sing
Jevgenyij Primakov ezt a vizitet viszonozva , tavaly februárban látogatott el Budapestre .	vizitet	4	None
Aztán amikor kiderült , hogy a pszichiáternek van egy kis származási eltérése , ráadásul itáliai egyetemi gyakorlata , ő , aki Fiuméban évekig dolgozott olaszokkal , megenyhült .	gyakorlata	16	Sing
A tárgyalásokon valószínűleg szóba kerülnek az európai biztonság , a délszláv válság , a koszovói rendezés és a NATO-orosz együttműködés témái .	szóba	3	None
A hivatalos verzió szerint a nyilatkozat csak következménye volt az APEH-elnök támadások miatti idegállapotának .	következménye	7	Sing
Veszprém megyében a 8-as úton órákon állt a forgalom Várpalota és a péti elágazás között két elakadt kamion miatt .	úton	4	None
II. János Pál pápa már júniusi , majd szeptemberi levelében is bírálta a német püspökségek részvételét a terhes nőknek szervezett állami tanácsadásban , azt vetve a szemükre , hogy az igazolások kiállításával lehetővé teszik meg nem született életek elpusztítását .	részvételét	15	Sing
Egyes vélemények szerint aggasztó , hogy a reálgazdaságtól egyre inkább elválik a tőkepiacok mozgását jelentő virtuális gazdaság .	tőkepiacok	12	None
Mario Babiucról van szó , aki " Ikar " fedőnéven szerepelt a szovjet titkosszolgálat jelentéseiben .	titkosszolgálat	13	None
A kiállítás ( és vásár ) szín- és formagazdagsága a tárgyak kézi megmunkálásának mesterségbeli biztonságáról , a manufakturális módszer gondosságáról vall .	formagazdagsága	8	Sing
Idén eddig 2,6 millió áldozatot szedett a gyógyíthatatlan immunbetegség , az AIDS — adta hírül a France 2 televízió az Egészségügyi Világszervezet jelentésére hivatkozva .	jelentésére	22	Sing
( Az is lehet , hogy jobban , mint a Kreml urát , amin fél évszázad múltán igazán nincs mit csodálkoznunk .	urát	11	Sing
Emberfeletti feladat volt , hiszen minden hangjegyre meg volt a kötelező mozdulat .	hangjegyre	6	None
S annak ellenére , hogy iskoláskorú volt , amikor a szlovák nyelv mellett megtanult magyarul is , az egyetlen operaénekes , aki megkapta a Kazinczy-díjat .	nyelv	11	None
Tegnap újabb házak dőltek össze a hó súlya alatt .	súlya	7	Sing
A KHVM új testületében helyet kapott a Miniszterelnöki Hivatal , a Belügyminisztérium , az Országos Meteorológiai Szolgálat , a MÁV Rt. , a Volán Egyesülés , a Közlekedési Főfelügyelet is .	helyet	4	None
Mint Kontra Ferenc elmondta , a magyar fél már több jegyzékben kérte az orosz külügyminisztériumtól a beazonosított műtárgyak , köztük a Sárospataki könyvtár gyűjteményének visszajuttatását .	külügyminisztériumtól	14	None
Ha már így esett , és nem mond le , legalább annyit megtehetne a magánbűnbe süppedt közszereplő , hogy megköveti feljelentettjeit .	magánbűnbe	14	None
A rendszerváltás radikális fordulatot hozott .	rendszerváltás	1	None
Aki egyszer azt mondta : őrület , hogy két szomszéd nép között a háború legyen az egyetlen megfelelő érintkezési forma .	háború	13	None
Brüszszelben nem is tagadják : a folytatás attól függ , hogy az elkövetkezendő tíz napban rendben megérkeznek -e Nisbe és Pirotba a szállítmányok .	rendben	15	None
" A két ország ezzel lezárta a múltat , egyszersmind a óriási mértékű együttműködés előtt nyitott teret " — jelentette ki Zeman cseh kormányfő .	múltat	7	None
Igaz , emberi " segítséget " is kapott a települések elszigeteléséhez .	elszigeteléséhez	10	Sing
Döntő szerepet játszik a politikai stabilitás , valamint a tolerancia , az előítéletek megszüntetése .	stabilitás	5	None
Állítólag mindhárom személy szerepel a Mitrohin-aktákban található listán .	Mitrohin-aktákban	5	None
Azt is rebesgették az új gépkocsivezetőről , hogy a rendszerváltás után részt vett volna egyes állambiztonsági ügynöknévsorok megsemmisítésében .	rendszerváltás	9	None
Ha összeadjuk a főbb tételeket , amelyeket a fejlesztési terv kiemelt jelentőségű beruházásnak nevez , a szükséges összeg meghaladja az 500 milliárd forintot .	tételeket	4	None
A fejlesztési terv ezért most elsősorban felkiáltójelként funkcionál , ami felhívja a figyelmet arra : mekkora szakadék tátong a van és a kell között .	figyelmet	12	None
Az 1944. március 19-e után elindított csoportba került e történet hőse is , a már majdnem orvos fiatalember .	hőse	10	Sing
II. János Pál pápa már júniusi , majd szeptemberi levelében is bírálta a német püspökségek részvételét a terhes nőknek szervezett állami tanácsadásban , azt vetve a szemükre , hogy az igazolások kiállításával lehetővé teszik meg nem született életek elpusztítását .	levelében	9	Sing
Akad , aki félreáll , hogy elhagyott hóláncát keresgélje , mások csúszkálva igyekeznek kikerülni egymást .	hóláncát	7	Sing
A cég ugyan jelezte , hogy alaptőke-emelést tervez , ám " az rt-nél kialakult helyzet kedvezőtlenül befolyásolhatja a tervezett tőkeemelés lefolytatását " — olvasható az ÁPTF-nek a Magyar Tőkepiacban közzétett határozata indoklásában .	lefolytatását	20	Sing
A kiállítás ( és vásár ) szín- és formagazdagsága a tárgyak kézi megmunkálásának mesterségbeli biztonságáról , a manufakturális módszer gondosságáról vall .	biztonságáról	14	Sing
A belső fogyasztás mérséklődött tavalyhoz képest , bővülése idén nem fogja meghaladni a bruttó nemzeti össztermék ( GDP ) növekedését .	növekedését	19	Sing
Legutóbb láthattunk egy sífelszereléseket reklámozó plakátot , melyről nyomban elhangzott , hogy nem az , ami , csak egy fénykép , melyen síoktatók között egy férfiimitátor tévébemondó társaságában ott látható a magyar miniszterelnök is .	társaságában	27	Sing
A kft 1998-ig elsősorban felújított Ikarus buszok oroszországi , illetve FÁK-országi exportjával , valamint pótalkatrész értékesítésével foglalkozott .	értékesítésével	15	Sing
Persze jól jönnek a hómunkások , amikor már megtörtént a baj , és a csupadísz Audit ki kell szabadítani a kátyúból .	kátyúból	20	None
Ezen az árverésen azok is megtalálhatják a nekik tetsző tárgyat , akik jó befektetésre vágynak , de a kispénzű érdeklődők is reménykedhetnek , mert akad a listán könyvritkaság mindössze 800 forint kikiáltási áron .	listán	26	None
A kegytárgyak között is vannak egészen különleges darabok , mint például egy kisméretű tóratekercs , amelynek a története is érdekes .	kegytárgyak	1	None
A két évtizede tartó változások következtében a török gazdaság szinte lokomotívként száguldott , teljesítményét pontosan mérni sem lehetett a feketegazdaság hatalmas volumene miatt .	teljesítményét	13	Sing
Az építmény heves nemzetközi tiltakozást váltott ki az emberi jogvédő csoportok és az Európai Unió részéről is .	csoportok	10	None
Úgy vélekedett , hogy a banditák " élő pajzsként " használják fel polgári lakosokat , ezért a civileknek el kell hagyniuk a csecsen fővárost , s az orosz hatóságok " mindennel el fogják látni őket " .	civileknek	17	None
A Jutarnji List című ellenzéki napilap szerdai számának címoldalán A legrosszabb várható címmel arról adott hírt , hogy " többé már az intenzív kezelés sem segít " az elnökön .	elnökön	28	None
— Igen , bár nehéz egészséges arányt találni a két műfaj között .	műfaj	10	None
Az orosz légierő gépei és a tüzérségi egységek ismét hevesen támadták Urusz-Martan környékét , de a várostól nyugatra elhelyezkedő csecsen erők szemmel láthatóan állták a sarat .	sarat	25	None
A belpolitikai és jogi csatározásokban formálódott orosz restitúciós törvény értelmében Magyarország igényt tarthat Oroszországba elszármazott műkincseinek nagy részére .	műkincseinek	15	Sing
Decemberben , a kolozsváriak tervezett Vígszínház-beli vendégjátékán erről a budapesti közönség is megbizonyosodhat , amikor is majd Shakespeare Troilus és Cressidájának Teiresziászaként láthatjuk őt a magyar fővárosban .	vendégjátékán	6	Sing
Kísértetek szabadultak el a szabaddá vált nyilvánosságban , a szavak gyilkos , ordas , gonosz indulatok árján úszva szorongást , félelmet , az egyszer volt újra megtörténhetésének vélelmét keltették fel .	szavak	9	None
A partizánháború körülményei között is van ám karrier .	karrier	7	None
A tanítás és a műszak végén a megyében dolgozó ingázók és a vidékről bejáró diákok Székesfehérváron rekedtek .	ingázók	9	None
Szerdán megalakult a rendkívüli havazás miatt kialakult káosz kezelésével megbízott operatív bizottság .	havazás	4	None
A tíz kis , zömében szabolcsi konzervgyár hiteleire adott 2,33 milliárd forintnyi állami garancia után ( HVG , 1999.június 19. ) a kormány újabb 5 milliárd forint értékben vállalt készfizető kezességet tartósítóipari cégek hiteleire .	hiteleire	33	Sing
A roppant terhek , az örökös hadi készültség , a csapatok mozgatása , az ütközetek , az utánpótlás megszervezése , a millió véletlen esemény elviselése és integrálása a katonai folyamatokba , megviselték .	esemény	23	None
Felhozták tehát a frontról a protezsált ifjút , aki kisvártatva meg is kezdhette szuggesztiós tevékenységét .	ifjút	6	None
Megközelíthetetlenné vált nyolc Vas megyei község , s hótorlasz mögé szorul a Bács-Kiskun megyei Újsolt 190 lakosa is .	község	5	None
— Nem hiszem , bár nagyon izgalmas , érdekes kirándulások voltak ezek a forgatások .	kirándulások	9	None
Bőven akadnak olyan szerbiai települések , ahol nem a szerb kormánypártok egyikének a jelöltje győzött , de első körben Nis és Pirot lakóit töltheti el némi melegség , mikor megérkezik az EU kora karácsonyi ajándéka , amellyel majd befűtenek .	ajándéka	34	Sing
Az államháztartás , valamint a külkereskedelmi mérleg hiánya nagyobb lesz a vártnál , a külföldről érkező tőke idén nem pótolja a folyó fizetési mérleg hiányát .	államháztartás	1	None
A tárgyak még ma megtekinthetők a Biblical World Galleryben , a Wesselényi u . 13. szám alatt , az árverés pedig vasárnap délelőtt 10 órakor kezdődik a Hotel Atrium Hyatt Kármán termében .	szám	15	None
" Az ő kocsija mindenhol átmegy . "	kocsija	3	Sing
Pedig a kilencvenes évek előtt még igenis lehetett ebben a műfajban is eredményes az ember , hiszen a 180-as csoporttal tizenkét éven át telt házak előtt játszhattunk a Zeneakadémián , jelentős törzsközönségünk volt , készültek lemez- és rádiófelvételeink .	csoporttal	19	None
A hadiipari kutatások eredményeit a korábbi 3-4 év helyett ma már hat hónap múlva felhasználják a polgári termelésben .	kutatások	2	None
