उन्होंने कहा कि समाजवाद का यह रूप दुनिया के सामने आ चुका है ।	आ	10	Masc
बल्कि उन्हें अलग बॉक्स में बैठना पड़ता है ।	बैठना	5	Masc
रक्षा मंत्रालय की इस रिपोर्ट में यह भी इंगित किया गया कि भारत तेजी के साथ उत्तरी अफ्रीका से दक्षिण पूर्वी एशिया तक फैले आतंकवाद के घेरे में आ रहा है ।	आ	28	Masc
लोनावाड़ा के सामाजिक कार्यकर्ता सोहेल का कहना है कि हालांकि कब्र में सामूहिक रूप से दफनाए गए शवों की वास्तविक संख्या के बारे में उन्हें पता नहीं है ।	दफनाए	15	Masc
वी. के. शर्मा को दिल्ली , लुधियाना , कोलकाता व मुंबई पुलिस समेत करीब आधा दर्जन राज्यों की पुलिस ढूंढ़ रही थी ।	ढूंढ़	19	Fem
यहां तक कि भारतीय राष्ट्रपति ए. पी. जे. अब्दुल कलाम भी गूगल अर्थ द्वारा खींची गयी इन तस्वीरों पर चिंता जता चुके हैं ।	खींची	14	Fem
उन्होंने कहा कि संयुक्त राष्ट्र को वैधता बनाए रखनी है , तो हमारा मानना है कि भारत को उसका सदस्य होना चाहिए ।	होना	20	Masc
उन्होंने कहा कि बहादुरशाह जफर के पूर्वज शाहजहां ने इस मकबरे को बनवाया था .	बनवाया	12	Masc
इसलिए अनुमति देने का सवाल ही नहीं उठता ।	उठता	7	Masc
मथुरा से चलकर ट्रेन सीधे कोटा रुकती है ।	रुकती	6	Fem
मुख्यमंत्री वीरभद्र सिंह ने भी कोशिश की लेकिन पर्दा नहीं सरका ।	सरका	10	Masc
यूस्टन भूमिगत स्टेशन पर सबसे पहले खतरे की घंटी बजी ।	बजी	9	Fem
जांच का मकसद चार महीने में यह पता लगाना है कि जाहिरा और तीस्ता में आखिर सच कौन बोल रहा है ।	लगाना	8	Masc
प्रधानमंत्री शनिवार को मणिपुर की राजधानी इंफाल पहुंचेंगे ।	पहुंचेंगे	7	Masc
यह पोत कार निकोबार जैसे बुरी तरह प्रभावित इलाकों में पानी के भीतर की तस्वीरें उतारेगा ।	उतारेगा	15	Masc
हालांकि उन्हें एक -JOIN दो दिन बाद मुंह से भोजन करने की अनुमति मिल सकती है लेकिन पूरी तरह स्वस्थ होने से पहले उन्हें तरल पदार्थ और फलों के रस से ही काम चलाना होगा ।	चलाना	33	Masc
बाद में हेलीकॉप्टर पर सवार विज्ञानियों ने रेगिस्तान में उस जगह को ढूंढ़ निकाला जहां कैप्सूल को उतारा गया था ।	उतारा	17	Masc
जिस धर्म की स्थापना कुछ मूल्यों और सिद्धांतों के लिए की गई , उस सिक्खी को हर समाज में महत्वपूर्ण भूमिका निभानी है ।	निभानी	21	Fem
उन्होंने यूपीए सरकार पर आरोप लगाया कि वह आतंकवाद के खतरे को गंभीरता से नहीं ले रही है .	लगाया	5	Masc
उन्होंने कहा कि पुलिस सुधार आयोग की सिफारिशें बिना किसी उचित कार्रवाई के धूल चाट रही हैं ।	चाट	14	Fem
इसके बाद उसने राइफल की मदद से एक व्यापारी से ६० हजार रुपये लूटे ।	लूटे	13	Masc
इस बीच लालू यादव ने सिंह के बचाव में भाजपा के आरोपों को खारिज करते हुए कहा है कि मामले को बेवजह उछाला जा रहा है ।	उछाला	22	Masc
उसका कहना था कि हमने सोचा भी नहीं था कि दोनों तरफ से ऐसा कोई प्रयास होगा जो हमारे परिवार को मिलाएगा ।	मिलाएगा	21	Masc
रात के समय सुनहरी रोशनी में नहाया हुआ विजय स्‍तंभ और भी खूबसूरत दिखाई देता है ।	नहाया	6	Masc
कानून मंत्री हंसराज भारद्वाज ने अपने जवाब में कहा कि न्यायपालिका में दखल देने वाले किसी भी व्यक्ति से गंभीरता से निपटा जाएगा ।	निपटा	21	Masc
दूधिया लाइटों की रोशनी में पूरी तरह से नहाए मकबरों के ऊपर से गिरता झमाझम पानी लोगों को बरबस अपनी ओर आकर्षित कर रहा था ।	गिरता	13	Masc
रात का सुरमई अँधेरा छाते ही यहाँ के पब और डिस्कोथेक रोशन हो जाते हैं ।	छाते	4	Masc
इस योजना के तहत इन राज्यों को केन्द्र से सालाना ५० करोड़ रुपये मिलते हैं .	मिलते	13	Masc
फातिमा बताती है कि दशकों पहले उनके पति गुलाम कादिर नज़र के भाई मोहम्मद अब्दुल्ला नौकरी की तलाश में मुजफ्फराबाद चले गए थे ।	बताती	1	Fem
तालिब के घर पर भी आस - पास की महिलाओं का जमावड़ा लगा हुआ है ।	लगा	12	Masc
मामले के संबंध में असम का पक्ष रखते हुए वरिष्ठ वकील के. के. वेणुगोपाल ने कहा कि सीमा संबंधी विवादों का निपटारा कोर्ट में नहीं किया जा सकता ।	रखते	7	Masc
बैठक में तय हुआ कि पार्टी राज्यपालों को हटाए जाने के मुद्दे को जोर शोर से उठाएगी , लेकिन इस पर कोई आंदोलन की योजना नहीं है ।	उठाएगी	16	Fem
वहीं इलाहाबाद पश्चिम में बसपा के राजू पाल ने सपा के खालिद अजीम उर्फ अशरफ को ४,८२४ मतों से हराया ।	हराया	19	Masc
तमिलनाडु में जयललिता के साथ लोकसभा चुनाव लड़ने के जख्म सहला रही भाजपा ने रविवार को एक तरह से साफ कर दिया कि उनसे दोस्ती जारी रखने का जोखिम वह नहीं उठाएगी .	उठाएगी	31	Fem
वैसे जुल्फ़िकार का परिवार खुद को भारतीय नागरिक बताता रहा .	बताता	8	Masc
गुफा में प्राकृतिक रूप से नमी रहती है और योनि भाग से बूँद - बूँद पानी गिरता रहता है ।	गिरता	16	Masc
जो भी भक्त इन मंदिरों में दर्शन हेतु आते हैं , वे इनसे पूजा जरूर करवाते हैं ।	करवाते	15	Masc
उन्होंने कहा कि जब रेखा ने उन्हें रोते हुए बताया कि प्रवीण ने प्रमोद को गोली मार दी है तब वह दौड़ते हुए प्रमोद के फ्लैट की ओर भागीं ।	भागीं	28	Fem
खुफिया एजेंसी के सूत्रों का कहना है कि बम धमाकों के जिम्मेदार लोग अथवा उनके साथी संभवतः शहर में ही छिपे हैं ।	छिपे	20	Masc
धार्मिक आधार पर अल्पसंख्यकों के अलावा भाषाई अल्पसंख्यकों का भी सरकार पूरा ख्याल रखेगी ।	रखेगी	13	Fem
इसकी स्थापना एक ईराकी उपदेशक ने की थी , जो 12वीं शताब्दी में असम में ज्ञान फैलाने के उद्देश्य से आया था ।	आया	20	Masc
इसके साथ ही सुप्रीम कोर्ट ने हाई कोर्ट के आदेश पर दो सप्ताह तक टाल दिया है ।	टाल	14	Masc
उन्होंने कहा कि डब्ल्यूटीओ की ३० अप्रैल को होने वाली बैठक से पहले किसान नेता इस मुद्दे पर दिल्ली में एक बड़ी रैली भी आयोजित करेंगे ।	करेंगे	25	Masc
भाजपा अध्यक्ष लालकृष्ण आडवाणी पर हमले जारी रखने के लिए पार्टी के वरिष्ठ नेता मदनलाल खुराना को पार्टी द्वारा सोमवार को नोटिस भेज दिया गया ।	भेज	22	Masc
जनता दल ( यू ) के वरिष्ठ नेता जॉर्ज फर्नांडीज ने ३० साल पहले कोला कंपनियों को खदेड़ा था ।	खदेड़ा	17	Masc
अब विश्वविद्यालय के छात्रों ने ठान लिया है कि इलाके में धर्मेंद्र और उनके दोनों बेटों सनी देयोल और बॉबी देयोल की फिल्में नहीं चलने देंगे ।	ठान	5	Masc
पाकिस्तान के विदेश विभाग के प्रवक्ता मसूद खान ने बीबीसी से एक साक्षात्कार में बताया कि वार्ता प्रक्रिया पर बगलिहार का मुद्दा सीधे तौर पर तो कोई प्रभाव नहीं डालेगा ।	डालेगा	29	Masc
प्रदेश कांग्रेस के प्रवक्ता हँसमुख पटेल ने कहा कि इससे लोगों में कांग्रेस की धर्मनिरपेक्ष छवि निखरी है ।	निखरी	16	Fem
जब पूरा राजस्‍थान गर्मी में तपता है और सारे जलस्रोत सूख जाते हैं , तब भी इस गौमुख से निकलने वाली धारा लगातार शिवजी का अभिषेक करती रहती है ।	तपता	5	Masc
अच्छा बुरा समझ सकती है साबिरा कारीअमरोहा ।	समझ	2	Fem
अमेरिकी सरकार के दो आपदा राहत विशेषज्ञ जम्मू कश्मीर में भूकंप प्रभावित इलाकों में सहायता सामग्री का वितरण करके लौटे हैं ।	लौटे	19	Masc
वापसी में यह ट्रेन मुंबई से १ जनवरी २००६ को अपराह्न ३.३० बजे चल कर अगले दिन सुबह १०.२० बजे नई दिल्ली पहुंचेगी .	पहुंचेगी	22	Fem
राहत एवं बचाव कार्यो के तहत इनमें से ३६१ लोगों को बचा लिया गया था , जबकि ११ लोगों के मारे जाने की पुष्टि की गई थी ।	बचा	11	Masc
मजूदरों एवं प्रबंधन के बीच इसको लेकर भी सहमति बनी है कि यदि श्रमिक पूर्ण सहयोग देंगे , अच्छा व्यवहार करेंगे तथा अनुशासित रहेंगे और निर्धारित उत्पादन देंगे तब ही एक वर्ष बाद उनके वेतन में वृद्धि होगी ।	देंगे	16	Masc
एक टीवी चैनल ने दिखाया कि सुनीता बच्चों को गोद में लिए थी और उसके बगल में खड़े एक व्यक्ति को फनॅडिस ने ५०० रुपये का नोट दिया ।	दिखाया	4	Masc
बुश का काफिला जिन रास्तों से होकर गुजरेगा , वे आम जनता के लिए लगभग बंद रहेंगे ।	गुजरेगा	7	Masc
अगर तुमने माफी नहीं मांगी तो दिल्ली बम धमाकों की तरह मुजफ्फरनगर की बस्तियां उड़ेंगी ।	उड़ेंगी	14	Fem
इसलिए 28 को सामूहिक कब्र में दफनाया गया ।	दफनाया	6	Masc
पर एहतियाती कदम उठाने की जगह मौसम विभाग ने दक्षिण भारत में भूकंप की सूचना को झुठलाते हुए लोगों को गुमराह किया .	झुठलाते	16	Masc
उनका कहना था कि साथी सदस्यों की याद राख में दबी चिंगारी की तरह हमेशा उनके पास रहेगी ।	दबी	10	Fem
उसने आरोप लगाए हैं कि नगमा तक १० लाख रुपये हवाला के जरिए भिजवाए गए ।	भिजवाए	13	Masc
लोग सौर ऊर्जा चालित लालटेन खोजते फिर रहे हैं , पर कस्बे की बात तो दूर दिल्ली में भी ऐसी कोई दुकान नहीं है , जहां सौर ऊर्जा चालित उपकरण बिकते हों ।	खोजते	5	Masc
आमतौर पर पोस्टमार्टम में शव के ऊपर से कपड़े हटा दिए जाते हैं और फिर उसे सफेद चादर में बांधा जाता है ।	बांधा	19	Masc
उत्तर प्रदेश के अध्यक्ष पद से हटाए गए विनय कटियार को राष्ट्रीय कार्यकारिणी में विशेष आमंत्रित के तौर पर शामिल किया गया है ।	हटाए	6	Masc
आतंकियों को ऐसे अल्पसंख्यक करार दिया जो सभ्य सिद्घांतों को मिटाने पर तुले हैं ।	तुले	12	Masc
उनके आवास पर सुरक्षा व्यवस्था बढ़ाए जाने की बाबत दिल्ली पुलिस के संयुक्त आयुक्त राजेश कुमार ने बताया कि मथेरानी की मां और परिवार के अन्य सदस्य बसंतकुंज वाले आवास में रह रहे हैं ।	बढ़ाए	5	Fem
गौरतलब है कि २६ दिसंबर को आई भीषण प्राकृतिक आपदा में इस जिले में करीब ६०० लोग मारे गए थे और ६६८.७५ हेक्टेअर कृषि योग्य भूमि को नुकसान पहुंचा था ।	मारे	17	Masc
अब देखना है कि पाकिस्तान में कानूनी प्रक्रिया किस तरह से इस मसले का हल निकालती है ।	निकालती	15	Fem
बंगलोर , हैदराबाद और चेन्नई जैसे शहरों में सुरक्षा कारणों से थोड़ी - बहुत बाधाएं आईं , लेकिन लोगों के उत्साह में कोई कमी नहीं देखी गई .	देखी	25	Fem
निजी शिक्षण संस्थानों में आरक्षण लागू करने के लिए लाए जा रहे विधेयक को लेकर राजनीति गरमा गई है ।	गरमा	16	Fem
इसके बाद यहां जमीन -JOIN जायदाद भी खरीदी .	खरीदी	7	Fem
बहरीन कोस्ट गार्ड अमेरिकी नौ सेना की मदद से दो लापता लोगों का पता लगाने में जुटा है ।	जुटा	16	Masc
पुलिस ने जनमेजय को समर्पण के लिए ललकारा तो उसने गोली चला दी ।	ललकारा	7	Masc
भाषण के बाद भी वे आधे घंटे से ज्यादा बैठी रहीं ।	बैठी	9	Fem
बकौल उमा , लेकिन आडवाणी ने मेरे खराब स्वास्थ्य पर ' एक पिता की तरह चिंता ' जताते हुए यात्रा स्थगित कर दी थी ।	जताते	17	Masc
नेपाल में संसद की बहाली के बाद संसदीय दल के नेता गिरिजा प्रसाद कोइराला के बीमार होने के कारण प्रधानमंत्री पद पर उनकी ताजपोशी कल तक के लिए टल गई है ।	टल	28	Fem
२६ दिसंबर की याद करते हुए एक अधिकारी बताता है कि उस दिन चमकदार धूप खिली थी ।	बताता	8	Masc
अब यह एक पवित्र स्थान के रूप में जाना जाता है .	जाना	8	Masc
कुल ७९११ मतदान केंद्र बनाए गए हैं ।	बनाए	4	Masc
इससे पहले पासवान ने इन बातों को दुर्भाग्यपूर्ण बताते हुए कहा कि इन्हें बिहार तक ही सीमित रहने देना चाहिए केंद्र में नहीं घसीटना चाहिए ।	घसीटना	23	Masc
यदि आप इस उक्ति पर विश्वास करते हैं तो कोस्टर डायमंड का चक्कर जरूर लगाइएगा ।	लगाइएगा	14	Masc
भारतीय मौसम कार्यालय ( आईएमडी ) के अधिकारी बी. पी. यादव ने बताया कि पिछले १५ दिन से मानसून कमजोर पड़ गया था , लेकिन इसके प्रवाह में बदलाव से इसके मजबूत होने के संकेत मिल रहे हैं ।	पड़	20	Masc
हथनीकुंड बैराज से पानी को यमुना नदी की ओर मोड़ दिया गया है ।	मोड़	9	Masc
यह कमाल बीते सप्ताह बाजार में आई एक साफ्टवेयर कंपनी ने किया है ।	बीते	2	Masc
जम्मू - कश्मीर के पहलगाम विधानसभा क्षेत्र में मुख्यमंत्री मुफ्ती मोहम्मद सईद ने अपने निकटतम प्रतिद्वंद्वी कांग्रेस प्रत्याशी रफी अहमद मीर को ५१७४ वोटों के अंतर से हराया ।	हराया	27	Masc
यहाँ गोल्फ खिलाया ही नहीं जाता बल्कि सिखाया भी जाता है ।	खिलाया	2	Masc
इसके लिए शीघ्र ही दोनों खुफिया एजेंसियों के विशेषज्ञ आपसी सहमति से एक तिथि तय करके बैठेंगे .	बैठेंगे	16	Masc
स्पीडो के जरिए आप 75 मिनिट में पूरा रोटरडैम निहार सकते हैं ।	निहार	9	Masc
शहरयार खान ने खुलकर नहीं कहा , मगर उनका संदेश यही है कि पाकिस्तानी टीम उन जगहों पर मैच नहीं खेलना चाहती , जिनके कारण इस बहुप्रतीक्षित श्रृंखला को राजनीतिक रंग दे दिया जाए ।	चाहती	21	Fem
गुजरात में गोधरा दंगे के बाद पंचमहल जिले में भड़की हिंसा में मारे गए लोगों के परिवार वालों ने सामूहिक कब्र से रिश्तेदारों के कंकाल निकालने का दावा किया है ।	भड़की	9	Fem
अब , यदि हमला करने जा रहे हैं तो दुश्मन के एक सैनिक के मुकाबले सात - आठ गुना अधिक सैनिकों की जरूरत पड़ सकती है ।	पड़	23	Fem
दोनों देश अब भारत - जापान अंतर्राष्ट्रीय साझेदारी में सुरक्षा के बिंदु पर विशेष ध्यान देंगे ।	देंगे	15	Masc
