वह क्रेडिट कार्ड से भुगतान लेता था तथा दवाओं की आपूर्ति सुनिश्चित करता था और इसके बाद भारत से दवाइयों की आपूर्ति करने वाले बंसल समेत अन्य लोगों के पास पैसे पहुंचाता था ।	पहुंचाता	31	Masc
इस समय आप यहाँ लोकतांत्रिक अमेरिका को ओरलैंडों की नजर से बेहद खूबसूरत लाल - नीले औऱ सफेद रंग में निहार सकते हैं ।	निहार	20	Masc
कांग्रेस शासित राज्यों में मंत्रियों की संख्या में कटौती का अब तक कोई फार्मूला सामने नहीं आया है और इस मामले में बनी तीन सदस्यीय समिति की बैठक एक - दो दिन में होने की संभावना है ।	आया	16	Masc
इस दिन ओरलैंडोवासी दीवाली की तरह रोशन रात का जश्न मनाते हैं ।	मनाते	10	Masc
इसका पूरा फायदा उठाकर दाएं हाथ के सीमर मोहम्मद शाहिद ने इतनी सधी गेंदबाजी की कि इरफान और सहवाग के डंडे उड़ा दिए ।	सधी	12	Fem
भाजपा ने उम्मीद जताई है कि पंजाब में दोबारा आंतकवाद नहीं भड़केगा , जिसकी वजह से राष्ट्र को भारी कीमत चुकानी पड़ी थी ।	भड़केगा	11	Masc
बातचीत के दौरान नेपाल में लोकतंत्र की बहाली के लिए राजा ज्ञानेंद्र पर दबाव बढ़ाने के लिए भारत से कहेंगे ।	कहेंगे	19	Masc
क्रिस्टियनो हवा में थे और इसी दौरान संभवतः पॉल की कोहनी उनके सीने से टकराई ।	टकराई	14	Fem
पुलिस को उनकी सिर कटी लाशें मिलीं ।	कटी	4	Fem
अपने चार - दिवसीय भारत दौरे के दौरान वे भारतीय नेताओं से सीमा विवाद और अन्य द्विपक्षीय मसलों पर बातचीत करेंगे ।	करेंगे	20	Masc
पाटिल ने सरकार की ओर से सुझाव पेश करते हुए कहा कि संसदीय व विधानसभा सीटों की संख्या बढ़ाए जाने को लेकर दशकों से लंबित मुद्दे को नए प्रस्ताव के ज़रिए सुलझाया जा सकता है ।	सुलझाया	31	Masc
स्पेशल सेल और अपराध शाखा की दर्जन भर से अधिक टीमों ने पूरे एनसीआर में अपना जाल फैलाया हुआ है .	फैलाया	17	Masc
लागत बढ़ने और नए उत्सर्जन मानक के कारण इन कारों के दाम बढ़ाए जाने हैं ।	बढ़ाए	12	Masc
सतलुज नदी में जलस्तर घटने से हिमाचल प्रदेश में बाढ़ का खतरा फिलहाल टल गया है और हजारों लोग अब सुरक्षित स्थानों से अपने घरों की ओर लौट रहे हैं ।	टल	13	Masc
छात्रों ने धर्मेंद्र ही नहीं बल्कि उनके बेटों की भी फिल्मों के प्रदर्शन को रोकने की कसम खाई है ।	खाई	17	Fem
पुलिस कोर्ट में केस डायरी पेश नहीं कर पाई , जिस पर अदालत ने कड़ी नाराजगी जताई और प्रधान की पुलिस रिमांड बढ़ाने की मांग को ठुकराते हुए उसे जेल भेज दिया ।	ठुकराते	26	Masc
मालूम हो कि पिछले मंगलवार को गुरु गोबिंद सिंह के जन्मदिन पर निकले जुलूस के कारण राजधानी खासकर कनॉट प्लेस की यातायात व्यवस्था बुरी तरह चरमरा गई थी ।	निकले	12	Masc
इन मदरसों से हर साल ४० हजार स्नातक निकलते हैं .	निकलते	8	Masc
सलीम सिंह की हवेली को जैसलमेर के प्रधानमंत्री सलीम सिंह ने बनवाया था ।	बनवाया	11	Masc
शहर के बीच स्थित चौक में पुरानी मस्जिद , हवेलियाँ अतीत की स्मृति दिलाते हैं ।	दिलाते	13	Masc
इसलिए बच्चों को समझाना पड़ता है ।	समझाना	3	Masc
कलाम ने कहा कि जैव ईंधन के पौधों को बेकार पड़ी जमीन में उगाया जा सकता है ।	उगाया	13	Masc
इसी कारण वे अच्छे स्कीयर के रूप में उभरे ।	उभरे	8	Masc
मुजफ्फरनगर में सानिया मिर्जा आई तो बम से उड़ा दी जाएगी ।	उड़ा	8	Fem
भाजपा शासित राज्यों के मुख्यमंत्रियों की नई दिल्ली में सोमवार को एक बैठक होने वाली है जिसमें पार्टी अध्यक्ष लालकृष्ण आडवाणी मुख्यमंत्रियों को सुशासन का पाठ पढ़ाएंगे ।	पढ़ाएंगे	26	Masc
उसकी इस मांग ने काफी जोर पकड़ा और इसका परिणाम देश के विभाजन के रूप में हुआ .	पकड़ा	6	Masc
इन महिलाओं से नाइटक्लब में जबरन गाना गवाया जाता था ।	गवाया	7	Masc
पिछले साल उन्होंने अपने फिल्म निर्देशकों व निर्माताओं को राजी करा लिया था कि वे पर्दे पर उन्हें धूम्रपान के लिए मजबूर नहीं करेंगे .	करेंगे	23	Masc
लेकिन आज उन्होंने कहा कि यहां पर शांति रहनी चाहिए और आज का दिन बिना घटना के गुजरना चाहिए ।	रहनी	8	Fem
घटना में मरने वालों में हकीम के परिवार के सात सदस्य भी शामिल हैं ।	मरने	2	Masc
इस नाटक में एक नौजवान की जिंदगी को दर्शाया गया है ।	दर्शाया	8	Masc
राष्ट्रीय अध्यक्ष ने कहा बेरोजगारों और महिलाओं के लिए संचार क्षेत्र में कई योजनाएं जल्द ही अमलीजामा पहनेंगी ।	पहनेंगी	17	Fem
ओरछा , 16वीं शताब्दी में बुंदेला राजपूत रुद्र प्रताप के द्वारा बसाया गया था ।	बसाया	11	Masc
उवर्रक मंत्रालय के एक वरिष्ठ अधिकारी के मुताबिक राज्य सरकारें इस बारे में नहीं बताती कि सीजन के दौरान जो उवर्रक केंद्र सरकार ने आवंटित किया वह किसानों तक कितना पहुंचा ।	बताती	14	Fem
अरावली पर्वत अधिनियम राजस्थान के रेगिस्तान को मैदानी इलाकों में आगे बढ़ने से रोकने के बंध के तौर पर काम करता है ।	करता	20	Masc
जिन उद्देश्यों की पूर्ति के लिए मुशर्रफ ने उन्हें प्रधानमंत्री की कुर्सी पर बिठाया था , उसमें जमाली विफल रहे हैं ।	बिठाया	13	Masc
संघ प्रमुख ने एक बार फिर दोहराया कि संघ के संगठन अनेक हैं किंतु विचारधारा एक ही है ।	दोहराया	6	Masc
उन्होंने कहा कि मुशर्रफ ने दक्षिण एशिया में शांति और स्थायित्व को बढ़ावा देने के लिए जो कदम उठाए हैं , वे सराहनीय है ।	उठाए	18	Masc
छापों के दौरान उनके पास ६० लाख रुपये की संपति पाई गई है ।	पाई	10	Fem
यहाँ आप रंगीन परिंदों से लेकर निराले वन्य जीवों को निहार सकते हैं ।	निहार	10	Masc
इसके बाद सुबह के नाश्ते में वे चने का सत्तू , नींबू तथा छिला हुआ खड़ा प्याज लेते हैं ।	छिला	13	Masc
सवेरे करीब छह बजे तक कोहरा न छंटने के कारण चालक ट्राला लेकर नहीं जा सका ।	छंटने	7	Masc
रक्षा मंत्री ने इस बात के भी संकेत दिए कि सरकार सुरक्षा और जरूरतों के मुताबिक अंतर्राष्ट्रीय बाजार से हथियार और उपकरण खरीदेगी ।	खरीदेगी	22	Fem
उन्होंने कहा कि वाजपेयी ने १९८० में भाजपा सम्मेलन में जो संदेश दिया था , वह उसी पर चलेंगे ।	चलेंगे	18	Masc
पहले चरण के चुनाव में राजद 64 में से 58 सीटों पर चुनाव लड़ रही है और उसने तीन सीटे भाकपा , दो सीटें माकपा और एक सीट कांग्रेस पार्टी के लिए छोड़ी है ।	लड़	13	Fem
केवल वायुसेना के लिए यह संभव नहीं था कि वह अपने बूते पर दुश्मन को मार भगाए ।	भगाए	16	Masc
उन्होंने स्पष्ट किया कि विपक्ष में रहते हुए भी सही मुद्दों पर सरकार का सहयोग किया जाएगा ।	रहते	6	Masc
राणा नवीद - उल - हसन की गेंद पर उनका कैच सलमान बट्ट ने लपका ।	लपका	14	Masc
वल्र्रर्ड हैरिटेज की मान्यता मिलने पर घाटी में पर्यटकों की संख्या तेजी से बढ़ेगी , ऐसा लोगों का मानना है ।	बढ़ेगी	13	Fem
बाद में एक अधिकारी ने पर्दे को हाथ से लपेटकर ऊपर सरकाया ।	सरकाया	11	Masc
दोनों पक्षों की दलील सुनने के बाद हाईकोर्ट की खंडपीठ ने निचली अदालत के फैसले को सही ठहराते हुए मौत की सजा बनाए रखने का आदेश दिया ।	ठहराते	17	Masc
वित्त मंत्रालय के अलावा कंपनी मामलों का मंत्रालय भी इस विवाद से जुड़े घटनाक्रमों पर नज़दीकी नज़र रखे हुए है ।	रखे	17	Masc
वरिष्ठ भाजपा नेता मदन लाल खुराना ने एक बार फिर पार्टी के मौजूदा नेतृत्व के खिलाफ विद्रोह का बिगुल फूंक दिया है ।	फूंक	19	Masc
छात्रों का कहना है कि राजस्थान में बीजेपी की ही सरकार है और अगर धर्मेंद्र चाहते तो बीकानेर विश्वविद्यालय में फीस में कमी के साथ ही कुछ मदद दिला सकते थे ।	दिला	28	Masc
बाद में वे जानी - मानी अंतर्राष्ट्रीय हस्तियों की भी मूर्तियां बनाएंगे ।	बनाएंगे	11	Masc
गुप्त सूचना पर पुलिस पहुंची और छापा मारकर मिस्टर एक्स व अन्य को दबोच लिया और गैंबलिंग एक्ट १८६७ की धारा १३ के तहत केस दर्ज कर उन्हें हवालात में बंद कर दिया .	पहुंची	4	Fem
उन्होंने बताया कि एक बार डल का पानी इतना अधिक जम गया था कि इस पर जीप भी चली थी ।	चली	18	Fem
पिछले पखवाड़े उन्होंने कहा था कि अंबानी बंधु समझौते की ओर बढ़ रहे हैं और पारिवारिक विवाद में सरकार को हस्तक्षेप करने की ज़रूरत नहीं है ।	बढ़	11	Masc
भारत में मोस्ट वांटेड अपराधी और कथित तौर पर पाकिस्तान में रह रहे अंडरवर्ल्ड डॉन दाऊद इब्राहिम पर अंतर्राष्ट्रीय स्तर पर शिकंजा कसा जा रहा है ।	कसा	22	Masc
डॉ सरकार के अनुसार अब तक देश भर में पोलियो के कुल १८ नए रोगी प्रकाश में आये हैं ।	आये	17	Masc
शिक्षकों पर अत्याचार के जरिए सरकार यह संदेश देना चाहती है कि किसी भी तरह के विरोध को पुलिस की सहायता से कुचल दिया जायेगा ।	कुचल	22	Masc
जम्मू - कश्मीर के कई हिस्सों में भारी बर्फबारी के कारण बिजली की आपूर्ति में बाधा आने से राज्य अंधेरे में डूबा हुआ है ।	डूबा	21	Masc
इसे झोले में रख कर बहुत आसानी से छिपाया जा सकता है ।	छिपाया	8	Masc
इराक़ में सामूहिक विनाश के हथियारों का हौवा खड़ा कर बिना पूरी जानकारी के अमेरिका ने उस पर कहर बरपाया ।	बरपाया	19	Masc
मथेरानी शनिवार की रात १०.२० बजे आस्ट्रियन एयरवेज की फ्लाइट से अंतर्राष्ट्रीय हवाई अड्डे पर उतरे थे ।	उतरे	15	Masc
फिर बोलीं - ' अभी तो दोस्ती हुई है ।	बोलीं	1	Fem
उन्होंने कहा कि बतौर सावधानी इमरजेंसी लैंडिंग के फौरन बाद सभी यात्रियों को उतार लिया गया ।	उतार	13	Masc
इसके अलावा कार्य स्थल या यूनिवर्सिटी में या स्कूल के बाहर जब महिलाएं कथित इस्लामिक स्कार्फ पहनती हैं तो इससे धार्मिक असहिष्णुता की प्रवृति फैलती है ।	फैलती	24	Fem
सरकारी कंपनियों के शेयर बेचकर जुटाया गया फंड राष्ट्रीय निवेश कोष में जाएगा ।	जुटाया	5	Masc
नटवर ने कहा कि उनके घर पर जुटी समर्थकों की भीड़ किसी तरह का शक्ति प्रदर्शन नहीं है ।	जुटी	7	Fem
उन्होंने यह भी कहा कि विदेश नीति में वह बिना किसी महाशक्ति की ओर झुकाव दिखाए भारत की परंपरागत गुटनिरपेक्ष छवि कायम करने का दबाव डालेंगे ।	डालेंगे	25	Masc
भट्ठल ने हार के लिए कारण गिनाते हुए कहा कि इसके लिए मुख्यमंत्री अमरिंदर सिंह का निरंकुश शासन और उनकी एकला चलो रे की नीति ही सबसे बड़ा कारण रही ।	गिनाते	6	Masc
राज्यपाल द्वारा अयोग्य ठहराए गए बसपा के १३ बागी विधायकों के मंत्री पद से इस्तीफे नामंजूर करने के आदेश से संवैधानिक संकट खड़ा हो गया है ।	ठहराए	3	Masc
दोनों देशों के इस वायु सेवा समझौते के तहत दोनों देशों के एयरोनॉटिकल प्रशासन के बीच भी सहयोग बढ़ेगा ।	बढ़ेगा	18	Masc
इधर उत्तर प्रदेश के निर्वाचन आयोग ने पंचायत चुनाव के दौरान हिंसा की घटनाओं को गंभीरता से लेते हुए बिजनौर के डीएम को तत्काल हटाने के निर्देश दिए हैं ।	दिए	27	Masc
इससे आयुर्वेद के फार्मूलों पर नए सिरे से शोध होगा तथा उनकी गुणवत्ता बढ़ाई जाएगी ।	बढ़ाई	13	Fem
विरोध के मद्देनज़र उन लोगों ने वहां कब्रों पर फूल चढ़ा कर श्रद्धांजलि तो अर्पित नहीं की , पर वहां खड़े होकर शिलालेख पढ़ते और फोटो खींचते रहे ।	पढ़ते	23	Masc
पाकिस्तान के राष्ट्रपति परवेज मुशर्रफ ने उम्मीद जताते हुए कहा है कि कश्मीर समस्या का समाधान तीन साल के अंदर निकाल लिया जाएगा ।	निकाल	20	Masc
पार्टी के अंदर यह राय भी शिद्दत से उभर रही है कि इस पद पर किसी सांसद को न बैठाया जाए ।	बैठाया	19	Masc
कमल ताल नामक तालाब के नजदीक बने इस महल के साथ राजस्‍थान के इतिहास की सबसे रोमांचक कथा जुड़ी है ।	जुड़ी	18	Fem
इस धमकी भरे खत से उलेमा नाइत्तेफाकी रखते हैं ।	रखते	7	Masc
इसी बीच वहां छिपे आतंकियों की गोली लगने से दो पुलिसकर्मी घायल हो गए जिनकी बाद में मौत हो गई ।	छिपे	3	Masc
लोग इसे दोनों देशों के बीच बढ़ते रिश्ते के परिणाम के रूप में देख रहे हैं ।	बढ़ते	6	Masc
ठेकेदार निःशुल्क मिलने वाले इन कंडोम को काफी तादात में एकत्रित कर लेते है और उन्हें हाट मिक्स प्लांट में तारकोल मिश्रित बजरी में डाल देते है ।	डाल	24	Masc
केंद्रीय खुफिया एजेंसियां और मुंबई पुलिस दुबई से प्रत्यर्पित एक भारतीय नागरिक से पूछताछ करने में जुटी हैं ।	जुटी	16	Fem
इस मामले में अमेरिकन ड्रग एनफोर्समेंट एजेंसी ( डीईए ) के सहयोग से विश्व भर में मारे गए छापों में २० लोग पकड़े गए हैं ।	पकड़े	22	Masc
टिकैत ने कहा कि आगामी २ जनवरी को गन्ने का समर्थन मूल्य बढ़ाये जाने तथा किसानों की अन्य समस्याओं को लेकर लखनऊ में महापंचायत बुलाई गई है , जिसके जरिए सरकार पर दबाव बनाया जाएगा ।	बढ़ाये	12	Masc
यह पूछे जाने पर कि क्या वे पार्टी को छोड़ेंगे , उन्होंने कहा कि वे अपनी भावी योजनाओं के बारे में निर्णय लेने के लिए आरएसएस नेतृत्व से मिलने जा रहे हैं ।	छोड़ेंगे	9	Masc
१० वर्षीया सबा और फराह की मां राबिया ने कहा कि अगर डॉक्टर कह रहे हैं कि इन दोनों को अलग किया जा सकता है तो उनकी बात को कैसे काटा जा सकता है ।	काटा	30	Masc
स्तूप क्रमांक दो पहाड़ी के शिखर पर स्थित है और यह पत्थर की सुंदर चारदीवारी से घिरा हुआ है .	घिरा	16	Masc
