अब बूटा सिंह द्वारा रेल मंत्री लालू प्रसाद यादव को लिखे एक सिफारिशी के मामले ने तूल पकड़ लिया है ।	लिखे	10	Masc
पिछले एक दशक में कृषि क्षेत्र की विकास दर ४.७ फीसदी से घट कर १.२ फ़ीसदी आ जाने से प्रधानमंत्री बेहद चिंतित दिखे ।	दिखे	22	Masc
पूर्वोत्तर में कानून व्यवस्था के लिए वे चुनौती भी बनते जा रहे हैं ।	बनते	9	Masc
नगर के शाही कटरा के मैदान में बृहस्पतिवार को भरत मिलाप के आयोजन के लिए बज रहे लाउडस्पीकर को समुदाय विशेष के कुछ लोगों द्वारा जबरिया बंद कराए जाने के विरोध में शुक्रवार की सुबह हिंसा भड़क उठी ।	कराए	27	Masc
इन महिलाओं की पहुंच इतनी ऊपर तक है कि पुलिस हाथ डालने से भी कतराती है ।	कतराती	14	Fem
शनिवार को हैदराबाद के जुबली हाल से तिरंगे में लिपटे राव की अंतिम यात्रा निकाली गई ।	निकाली	14	Fem
प्रदेश में दो हजार से ज्यादा सरकारी मुलाजिम इस समय अफसरों के घरों पर ड्यूटी बजा रहे हैं ।	बजा	15	Masc
नोएडा से अपने मॉडलिंग का सफर शुरू करने वाली सोनल चौहान ने शनिवार को ३३ देशों की बालाओं को पछाड़ते हुए मिस टूरिज्म इंटरकान्टिनेंटल का खिताब हासिल किया ।	पछाड़ते	19	Masc
अनेक लोग स्कीइंग कौशल को निखारने की खातिर लगातार अभ्यास में जुटे हुए हैं ।	निखारने	5	Fem
इस गाँव से दस - दस युवकों की टीमें अपने अभियान पर निकलती हैं ।	निकलती	12	Fem
बिहार की जेलों से चलाई जा रही अपराधिक गतिविधियां रोक पाने में नाकाम रहने पर पटना हाईकोर्ट ने बुधवार को राज्य सरकार को कड़ी फटकार लगाई ।	लगाई	25	Fem
अंडमान द्वीप समूह के निकट हिंद महासागर में जलस्तर बढ़ने की खबर से द्वीप के लोग घबराए हुए हैं ।	घबराए	16	Masc
बारामुला जिले में सोपोर की एक मस्जिद में छिपे आतंकियों की गोली से जम्मू - कश्मीर पुलिस के स्पेशल ऑपरेशन ग्रुप के दो पुलिसकर्मी शहीद हो गए ।	छिपे	8	Masc
कांग्रेसी नेताओं का कहना है कि इस मार्च में कांग्रेसियों की जबरदस्त भागीदारी से जनता में पार्टी की छवि निखरी है ।	निखरी	19	Fem
यदि किसी ने विरोध की कोशिश की तो किसी भी हद तक जाने में नहीं हिचकते ।	हिचकते	15	Masc
फार्मा कंपनियों के शेयर ऑल टाइम फेवरिट हैं , कुछ बैंकों के शेयर अब भी अंडर वैल्यूड हैं , आप उनमें निवेश करके मुनाफा वसूल सकते हैं ।	वसूल	24	Masc
एलायंस एयर बोइग - ७३७ विमान को तकनीकी खराबी के कारण छत्रपति शिवाजी अंतर्राष्ट्रीय हवाई अड्डे पर इमरजेंसी लैंडिंग के तहत सुरक्षित उतारा गया ।	उतारा	22	Masc
प्रोड्यूसर - निर्देशक - पटकथा लेखक मनु रेवाल की छोटे बजट की फिल्म ( चाय - पानी ईटीसी ) को प्रमाणन बोर्ड के कारण परेशानी झेलनी पड़ी ।	झेलनी	25	Fem
पूर्व सांसद इंद्रजीत की तरफ से वरिष्ठ अधिवक्ता फाली एस. नारीमन ने कहा कि चुनाव प्रक्रिया जारी रखी जाए ।	रखी	17	Fem
इसी को ध्यान में रखकर सबसे पहले उन इमारतों पर लगाम कसी जा रही है , जहां चकाचौंध के लिए बेवजह बिजली का इस्तेमाल होता है ।	कसी	11	Fem
सोमवार सुबह करीब सवा नौ बजे चंडीगढ़ - चेन्नई एक्सप्रेस ( 6034 ) जब जगाधरी वर्कशाप से कुछ ही आगे निकली थी कि पीछे से दूसरे जनरल डिब्बे की सवारियों ने बोगी के नीचे धुआं निकलता देखा ।	निकली	20	Fem
अर्थात , विभिन्न स्थानों पर यह देरी से पहुंचेगी और बारिश भी कम होगी ।	पहुंचेगी	8	Fem
लहरें मठ के अहाते से भी टकरायी होंगी , लेकिन उसे कोई बड़ा नुकसान नहीं पहुंचा ।	टकरायी	6	Fem
नायडू ने कांग्रेस के नेतृत्व वाली गठबंधन सरकार पर निशाना साधते हुए कहा कि उस पर अभी से तलवार लटक रही है .	लटक	19	Fem
नया वायरस बैगल , एआई खुद को संक्रमित कंप्यूटर के ई - मेल से जोड़ लेता है और उसके ऐड्रस बुक में दर्ज सभी ई - मेल पतों पर पहुंच जाता है ।	जोड़	14	Masc
मगर हादसे के सात दिन गुज़रने के बाद भी स्पेशल सेल और ख़ुफिया एजेंसियां किसी संगठन का नाम लेने से कतरा रहे हैं ।	कतरा	20	Masc
इस संग्रहालय में साँची के क्षेत्रों में मिली विभिन्न वस्तुएँ संग्रहित हैं ।	मिली	7	Fem
मिल्ली कौंसिल के महासचिव कारी शफीकुर्रहमान ने कहा कि अमर उजाला सच्चाई को उठाता है ।	उठाता	13	Masc
इसके खुले गलियारे , बाहर निकली हुई बालकनी और खूबसूरत छत शाही शौक को आसानी से बयाँ करते हैं .	निकली	5	Fem
हमें लोगों के लिए उदाहरण बनकर दिखाना होगा कि व्यवहार में यह धर्म क्यों अन्य से अलग है ।	दिखाना	6	Masc
मामले की गंभीरता को देखते हुए शहर में कर्फ्यू लगा दिया गया है ।	लगा	9	Masc
खंडपीठ ने कहा कि पहले केवल कर्मचारियों के हितों की रक्षा ही सर्वोपरि समझी जाती थी जिसके फलस्वरूप कार्यस्थलों पर आमतौर पर अनुशासनहीनता बढ़ी ।	समझी	13	Fem
उन्होंने कहा कि अध्यादेश में लाभ के पद की सूची से कुछ पदों को हटा दिया जाएगा ताकि कुछ सांसदों की सदस्यता बची रहे ।	बची	22	Fem
यहाँ पाँचवी शताब्दी में ग्रीक राजदूत हेलियोडोरस द्वारा बनवाया गया स्तंभ दर्शनीय है ।	बनवाया	8	Masc
पहले चरण के चुनाव में राजद 64 में से 58 सीटों पर चुनाव लड़ रही है और उसने तीन सीटे भाकपा , दो सीटें माकपा और एक सीट कांग्रेस पार्टी के लिए छोड़ी है ।	छोड़ी	32	Fem
उल्लेखनीय है कि पिछले साल दिसंबर में मुंबई में भाजपा की राष्ट्रीय कार्यकारिणी की बैठक के समय इस सेक्स सीडी का विवाद उठने के कारण भाजपा के महासचिव के पद से संजय जोशी ने इस्तीफा दे दिया था ।	उठने	22	Masc
फिरोजपुर के सांसद जोरा सिंह मान ने कहा कि वे इस मुद्दे को शीघ्र ही प्रधानमंत्री मनमोहन सिंह के समक्ष रखेंगे ।	रखेंगे	20	Masc
पांच एक दिवसीय क्रिकेट मैच खेलने के लिए भारत आ रही श्रीलंकाई क्रिकेट टीम का दौरा अनिश्चितकाल तक के लिए टल गया है ।	टल	20	Masc
इसके पास ही पिट्जर टेलीस्कोप ने कुछ धूल के कणों के साक्ष्य भी पाए गए हैं जो बर्फ़ , मिथेनॉल और कार्बन डाइऑक्साइड की परत से ढंके हैं .	ढंके	26	Masc
उन्होंने इस बात पर खुशी जाहिर की कि अब सरकार की भी कृष्ण लीला के प्रति रुचि जगी है .	जगी	17	Fem
अपने एजेंडे को पूरी तेजी से लागू करने में जुटे अर्जुन सिंह का अगला लक्ष्य अब इलाहाबाद विश्वविद्यालय को केंद्रीय दर्जा दिलाने संबंधी विधेयक को संसद में लाना है ।	लाना	27	Masc
दिल्ली में डेरा डाले ऐसे ही एक मंत्री का तर्क है कि यदि राज्य में ६० - ७० फीसदी विधानसभा क्षेत्रों से कांग्रेस पीछे रही है तो सबसे पहले मुख्यमंत्री को हटाया जाना चाहिए ।	हटाया	31	Masc
सूत्रों के मुताबिक केंद्रीय कारागार में 45 मिनट तक चली परेड में उक्त महिला ने कासलीवाल की ओर इशारा किया ।	चली	9	Fem
उदयपुर से केवल दो घंटे की सड़क यात्रा करके आप चित्तौड़ पहुँच सकते हैं ।	पहुँच	11	Masc
भाजपा उपाध्यक्ष मुख्तार अब्बास नकवी ने कहा कि अब तक भारतीय राजनीति में यह स्वस्थ परंपरा रही है कि कोई भी नेता विदेश में घरेलू राजनीतिक मुद्दों को नहीं उठाता है ।	उठाता	29	Masc
अदालत में जब पूछताछ हुई , तो मुंशी यह कहते हुए मुकर गया था कि उसे हिंदी आती ही नहीं , तो वह हिंदी में कैसे एफआईआर लिख या लिखवा सकता है ।	कहते	9	Masc
लाल दीन का दावा सही निकला .	निकला	5	Masc
चुनाव आचार संहिता का उल्लंघन मानते हुए जिला प्रशासन ने जॉर्ज व उनके कुछ साथियों पर वोटर को रिश्वत देने का मामला दर्ज कर लिया ।	मानते	5	Masc
पासवान की मुस्लिम मुख्यमंत्री की शर्त के बारे में दिग्विजय सिंह ने कहा कि पासवान को पहले कांग्रेस व सहयोगी दलों के साथ मिलकर चुनाव लड़ना होगा ।	लड़ना	25	Masc
गरीबों के नाम पर कोई योजना शुरु की जाए तो उस पर सबसे ज्यादा हक उत्तर प्रदेश जैसे गरीब राज्य का ही बनता है लेकिन सरकार लगातार उप्र की अनदेखी कर रही है ।	बनता	22	Masc
दिहाड़ी मजदूर के रूप में काम करने वाली नीता कभी - कभी जंगल से लकड़ियां लेकर भी बेचती है ।	बेचती	17	Fem
इस बाबत विमान सेवाएं इनसे किसी तरह की कैंसिलेशन फीस नहीं वसूल रही हैं ।	वसूल	11	Fem
आमिर खान ने यहां दर्शकों के साथ फोटो खिंचवाई ।	खिंचवाई	8	Fem
अंधेरा होने के बाद भी वे दोनों घर नहीं लौटे ।	लौटे	9	Masc
अलीगढ़ जिले की इस सीट पर पूर्व मुख्यमंत्री कल्याण सिंह अपनी नाक बचाने में सफल रहे , लेकिन बगल की इगलास सीट पर बसपा के मुकुल उपाध्याय ने रालोद के चौधरी मलखान सिंह को ११,१२० मतों से हराया ।	हराया	37	Masc
यह ट्रेन ३० दिसंबर को दोपहर २.३५ बजे प्रस्थान कर अगले दिन सुबह ८.३५ बजे मुंबई पहुंचेगी .	पहुंचेगी	16	Fem
कांग्रेस का कहना था कि भारत ने किसी भी देश के सामने घुटने नहीं टेके हैं और परमाणु समझौता लेन - देन की भावना पर आधारित है ।	टेके	14	Masc
पुलिस कमिश्नर ने दोहराया कि हमले का तौर तरीका अल कायदा आतंकियों जैसा ही है ।	दोहराया	3	Masc
उन्होंने ' बंदर कितनी तेजी से उड़ान भरते थे और राक्षस कितने समय तक सोते थे ' विषय पर आयोजित एक व्याख्यान में कई अनुत्तरित प्रश्नों का उत्तर देने की कोशिश की ।	भरते	7	Masc
भाजपा के बी. के. देव का कहना था कि सबसे गरीब राज्यों में एक होने के बावजूद उड़ीसा को विशेष पैकेज उपलब्ध नहीं कराया जा रहा है ।	कराया	23	Masc
सपा से निलंबित नेता और अभिनेता राज बब्बर ने रविवार को समाजवादी मोर्चा बनाने का ऐलान करते हुए कहा कि यह गैर राजनीतिक मोर्चा किसानों और बेरोजगार युवाओं के हक में लड़ाई लड़ेगा ।	लड़ेगा	32	Masc
चतुर्भुज के आकार का यह महल 17वीं शताब्दी में मधुकर शाह ने बनवाया था ।	बनवाया	12	Masc
फैजी ने कहा कि रेल मंत्री लालू प्रसाद यादव ने अपने मंत्रालय की कमाई उच्च वर्ग पर लुटा दी है ।	लुटा	17	Fem
अपने बचाव में सांसद महोदय दलीलें दे रहे हैं , इससे संसद की सुरक्षा व्यवस्था की पोल खुल गई हैं ।	खुल	17	Fem
पाटिल ने कहा कि राज्यों से बाढ़ की तबाही को लेकर रिपोर्टें आने लगी हैं ।	आने	12	Fem
कर्नल सिंह ने दो तरह के एयरबैग दिखाते हुए बताया कि जिन स्थानों पर धमाके हुए , वहाँ ऐसे ही लावारिस बैग रखे देखे गए थे .	दिखाते	7	Masc
आगरा सर्किल के एएसए एस. के. शर्मा फैसला सुनाए जाने के समय बोर्ड के कार्यालय में मौजूद थे ।	सुनाए	8	Masc
एवरेस्ट सफाई अभियान दल के अध्यक्ष गावो डेंग्याई के अनुसार पिछले कई वर्षो के दौरान पर्वतारोहियों द्वारा बिखेरे गए कूड़े कचरे से इस पर्वत चोटी का पारिस्थितिक संतुलन प्रभावित हुआ है ।	बिखेरे	17	Masc
नायर ने मुख्यमंत्री से कहा कि अगर उनकी सरकार भूमि और बुनियादी सुविधाएं उपलब्ध कराती है तो इसरो इस तरह के केंद्र खोलने को तैयार है ।	कराती	14	Fem
तो वहीँ दूसरी तरफ सुंदर वादियाँ हैं जो सुंदर फूलों और रंगीन पत्तियों वाले पेड़ों से ढकी रहती हैं ।	ढकी	16	Fem
एक मिनी बस को भी जला दिया गया ।	जला	5	Masc
इनमें अगर कोई भी अपनी हदों से आगे जाता है तो न्यायपालिका उसके पर कतर सकती है ।	कतर	14	Fem
यह क्षेत्र कारे जोन और बफर जोन में बँटा है ।	बँटा	8	Masc
दूसरी ओर फुटपाथ पर दुकान लगाने वालों को मुसीबतों का सामना करना पड़ा .	लगाने	5	Masc
इन खिड़कियों पर चार घंटे खड़े रहने के एवज में इन्हें खासा टैक्स चुकाना पड़ता है ।	चुकाना	13	Masc
कमरे पर भी बुलाते हैं ।	बुलाते	3	Masc
सोनिया पिछली बार से कहीं ज्यादा मतों से इस बार जीतेंगीं ।	जीतेंगीं	10	Fem
उल्लेखनीय है कि कर्नाटक में २२ नवंबर २००५ को हैदराबाद - मुंबई हाईवे पर गुजरात एटीएस की टीम ने एक निजी बस को रोककर इस दंपति को उससे उतार लिया था ।	उतार	28	Masc
भारतीय प्रबंधन संस्थान ( आईआईएम ) में फीस कटौती के मामले में सभी छह संस्थानों के बीच बनी सहमति से मंगलवार को मानव संसाधन विकास मंत्रालय को अवगत करा दिया गया ।	बनी	17	Fem
गेंहू उत्पादक राज्यों के भंडारण निगमों ने १५ लाख टन गेहूं खरीदा ।	खरीदा	11	Masc
प्रदेश के दो प्रमुख महानगर शुक्रवार को दिन भर नफरत के शोलों में झुलसते रहे ।	झुलसते	13	Masc
यहाँ आप पाँच हजार से लेकर बीस हजार रुपए में अच्छी छुट्टियाँ बिता सकते हैं .	बिता	12	Masc
केंद्र सरकार अंधाधुंध बिजली का इस्तेमाल करने वाले शॅपिंग मॉल समेत सभी कमर्शियल इमारतों की लगाम कसने जा रही है ।	कसने	16	Fem
कन्नड़ अभिनेता राजकुमार के अंतिम संस्कार से पहले उनके प्रशंसकों ने बृहस्पतिवार को जमकर उत्पात मचाया ।	मचाया	15	Masc
इस ' एनर्जी इफीसेंसी बिल्डिंग कोड ' के तहत बड़ी कमर्शियल इमारतों को बिजली ऑडिट कराना होगा ।	कराना	15	Masc
सदा - ए - सरहद दिल्ली - लाहौर बस जैसे ही पंजाब में दाखिल होती है राजपुरा के शंभु बैरियर के पास से हरियाणा पुलिस उसका साथ छोड़ देती है ।	छोड़	27	Fem
इसके साथ ही १९७१ की लड़ाई के बाद से बंद हुसैनीवाला - कसूर सीमा के लोगों के दिलों में इसके फिर खुलने की हसरत जाग गई है ।	जाग	24	Fem
नक्सलियों की लड़ाई का मुकाबला करने के लिए पुलिस भी बंदूक छोड़कर नुक्कड़ नाटक करने पर उतर आई है ।	उतर	16	Fem
