पुलिस के एक अधिकारी ने बताया कि इन दोनों को उस वक्त गोली मारी गयी जब वे सोए हुए थे ।	सोए	17	Masc
वर्ष १९३८ में ब्रिटिश पर्वतारोही फ्रैंक स्मिथ ने भ्यूंडार के ऊपरी हिस्से में यह घाटी खोजी और देखते ही देखते इसकी ख्याति पूरी दुनिया में फैल गई ।	खोजी	15	Fem
इसके साथ ही नायडू ने पुष्टि करते हुए कहा कि यदि समाजवादी पार्टी अंततः ईरान पर मतदान कराए जाने के मुद्दे पर संसद में अविश्वास प्रस्ताव लाती है , तो वे उसका ही समर्थन करेंगे ।	लाती	26	Fem
फिर हत्यारों ने अमरदीप के सिर में दो गोलियां मारी और गंड़ासे से भी वार किया ।	मारी	9	Fem
इन दुकानों में शराब वैट से पहले की क़ीमत के मुक़ाबले २५ से ३५ प्रतिशत अधिक क़ीमत पर बिक रही थी ।	बिक	18	Fem
देश के प्रमुख आईटी शो के मंच का इस्तेमाल करते हुए पूर्व प्रधानमंत्री और जनता दल एस सुप्रीमो एच. डी. देवगौड़ा ने बुधवार को आईटी क्षेत्र के एक धड़े के खिलाफ नए सिरे से निशाना साधा ।	साधा	35	Masc
नेपाल में हाल में हुई नए राजनीतिक घटनाक्रम पर भारत ने कहा है कि वहां के नरेश ज्ञानेंद्र द्वारा देश में आपातकाल हटाए जाने व राजनीतिक बंदियों के छोड़े जाने के आश्वासन के बाद ऐसा किया जाना दुखद है .	हटाए	22	Masc
लेकिन , हवाओं के बदले रूख ने लोगों की उम्मीदों और मौसम विभाग की भविष्यवाणियों पर पानी फेर दिया ।	बदले	4	Masc
अब उन्हें ही बताना होगा कि क्या वह कांग्रेस में आने को तैयार हैं और उन्हें हमसे क्या उम्मीद है ?	बताना	3	Masc
उन्होंने आरोप लगाया कि सरकार ने अमेरिका के सामने घुटने टेक दिए हैं ।	टेक	10	Masc
यूपी से मिले नतीजों के मुताबिक गाजियाबाद में सपा के सुरेंद्र कुमार मुन्नी ने कांग्रेस के सतीश त्यागी को ११,४५८ मतों से हराया ।	हराया	22	Masc
सुदर्शन ने इन सम्मेलनों में आरएसएस के कार्यकर्ताओं को चार विषयों में से एक विषय को लेने के निर्देश दिए ।	दिए	19	Masc
उन्होंने कहा कि हम करीब २,५०० समर्थकों के लिए प्राथमिकता के आधार पर एक स्टैंड को आरक्षित रखेंगे ।	रखेंगे	17	Masc
इन पर हाथ डालने में हर कोई कतराता है ।	कतराता	7	Masc
यही कंपनी समूह को सबसे अधिक कैश फ्लो व लाभ उपलब्ध कराती है ।	कराती	11	Fem
६० साल बाद लौटे सुनामी ने तटीय केरल में १५० लोगों की जानें ली हैं ।	लौटे	3	Masc
राजा ने बताया कि एक हफ्ते का समय दिए जाने के बावजूद कोई प्रतिक्रिया नहीं मिलने पर हम अगले सप्ताह अदालत का दरवाजा खटखटाना चाहते हैं ।	दिए	8	Masc
संसद के सत्र के दौरान गैरहाजिरी और उसके बाद आपसी कलह के चलते अपेक्षित भूमिका नहीं निभा पा रहा है ।	निभा	16	Masc
भाजपा पर निशाना साधते हुए पार्टी प्रवक्ता ने कहा कि अंतर विरोध व अंतर कलह से घिरा विपक्षी दल अपनी भूमिका निभाने में विफल रहा है ।	साधते	3	Masc
मुख्यमंत्री ने कहा कि फरीदाबाद के औद्योगिक आधारभूत ढांचे को मजबूत बनाया जाएगा तथा बदरपुर का एलिवेटिड फ्लाई ओवर इस वर्ष के अंत तक आरंभ हो जाएगा ।	बनाया	11	Masc
पैसा , मोबाइल और लंबी गाड़ी प्यार को परवान चढ़ाने लगे हैं	चढ़ाने	9	Masc
दिलचस्प तथ्य यह है कि कुछ साल पहले लगभग ऐसी ही परिस्थितियां खड़ी करके गुजरात के तत्कालीन मुख्यमंत्री केशूभाई पटेल का तख्ता पलट दिया गया था और उसमें नरेंद्र मोदी ने अहम भूमिका निभाई थी .	पलट	22	Masc
इस दौरान उसकी पुत्री को युवक घुमाता रहता है ।	घुमाता	6	Masc
डाट्स पद्धति में मरीज को डॉक्टरों की सीधी देखरेख में दवा खिलाई जाती है ।	खिलाई	11	Fem
इसी तरह मिल्कीपुर में सपा के रामचंद्र ने बसपा के आनंद सेन को ३५,०१८ मतों के अंतर से हराया ।	हराया	18	Masc
हालांकि ये नए ग्रह पिछले कुछ दशक के दौरान हमारे सौरमंडल के बाहर खोजे गए अन्य ग्रहों से भिन्न हैं ।	खोजे	13	Masc
बाबरी प्रकरण में लालकृष्ण आडवाणी को मिली सीबीआई की क्लीनचिट पर मुलायम सरकार ने मुहर लगा दी थी ।	मिली	6	Fem
उन्होंने कहा कि उत्तर प्रदेश में विधान सभा चुनाव करीब हैं और कांग्रेस निश्चित रूप से सोनिया के इस कथित त्याग को भुनाएगी , जहां पर इस समय उसके पास मजबूत जनाधार नहीं है ।	भुनाएगी	22	Fem
जवाब में खेलने उतरी पाकिस्तान की पूरी टीम ४४.१ ओवरों में २९८ रन बनाकर आउट हो गई ।	उतरी	3	Fem
उ.प्र. सरकार का सुझाव है कि गरीबों के ऋण पर ब्याज की दर में कमी लानी चाहिए ।	लानी	15	Fem
इसलिए , कांग्रेस को समर्थन देने का सवाल ही नहीं उठता ।	उठता	10	Masc
यह महल राजा बीर सिंह जूदेव ने 17वीं शताब्दी में जहाँगीर के ओरछा आने के पहले बनवाया था ।	बनवाया	16	Masc
स्कॉटलैंड के खूबसूरत किलों को मात देते इस किले का निर्माण भाटी वंश के राणा जैसल ने 1156 में करवाया था .	करवाया	19	Masc
समझौते में ' अन्योन्यता ' पर जोर देते हुए उन्होंने वाशिंगटन को याद दिलाया कि 18 जुलाई को हुए समझौते के दौरान उसने ' कुछ वादे ' किए थे , जिन्हें अभी तक पूरा नहीं किया जा सका है ।	दिलाया	13	Masc
चालान कर उन्हें छोड़ दिया गया ।	छोड़	3	Masc
क्या अब समर्थकों को पुरस्कृत करने का दौर चलेगा ?	चलेगा	8	Masc
मुशर्रफ ने कहा कि अगर मुस्लिम देश या भारत इराक में अपनी सेना भेजते हैं तो पाकिस्तान भी पीछे नहीं रहेगा ।	भेजते	13	Masc
प्रत्येक फसल सीजन के दौरान कई राज्यों में अक्सर उर्वरकों की कमी की समस्या सामने आती है और इसके लिए राज्य सरकारें केंद्र को जिम्मेदार ठहराती हैं ।	ठहराती	25	Fem
धन कुबेर होने के बावजूद वह आम आदमी की भाषा बोलते थे ।	बोलते	10	Masc
दीन दयाल उपाध्याय की पुण्य तिथि के अवसर पर भाजपा कार्यालय में आयोजित एक कार्यक्रम में उपस्थित लोगों को संबोधित करते हुए वाजपेयी ने कहा कि हमने अपने लिए ही संसदीय लोकतंत्र को चुना है ।	चुना	33	Masc
कचगरी में ट्रेनिंग के बाद उन्हें हथियार और ग्रेनेड देकर इसी बंगले में भेज दिया जाता ।	भेज	13	Masc
इन क्षेत्रों को पहले बाड़ लगाने से छोड़ दिया गया था ।	छोड़	7	Masc
हालांकि इस बार सात नए मामले आये हैं इससे केन्द्र सरकार संतुष्ट नहीं है ।	आये	6	Masc
गोस्वामी ने एचआईवी पॉजीटिव होने की बात आज तक किसी से नहीं छिपाई ।	छिपाई	12	Fem
यह तो मैं नहीं जानता हूं कि कटौती का यह सिलसिला कब तक चलेगा , लेकिन एक बात तो जरूर है कि स्टील उद्योग ने पहली परीक्षा पास कर ली है ।	चलेगा	13	Masc
कैसिनी अगले चार साल में शनि और उसके ज्ञात ३१ चंद्रमाओं का चक्कर लगाएगा ।	लगाएगा	13	Masc
यह शहर सात पहाड़ों तथा अनेक फ्यूर्ड से घिरा है ।	घिरा	8	Masc
याना ने बताया कि वह अपना सिर घुटनों पर रख कर बैठी थी और उसके हाथ सिर पर थे ।	बैठी	11	Fem
बादल देर रात तक गरज - गरज कर बरसते रहे ।	बरसते	8	Masc
सीएम पद की दौड़ एक बार फिर जाट बनाम गैर जाट के केंद्र बिन्दु पर सिमट चुकी है ।	सिमट	15	Fem
विशेषज्ञों का आकलन है कि इन गैर मानसूनी हवाओं के मिजाज से झलकता है कि दिल्ली में नियत समय २८ -JOIN २९ जून तक मानसून दस्तक दे देगा ।	झलकता	12	Masc
ये वकील हुबली - धारवाड़ में कर्नाटक हाई कोर्ट की पीठ को गैर जरूरी बताने संबंधी मुख्य न्यायाधीश के बयान पर विरोध जता रहे थे .	जता	22	Masc
एक कांग्रेस सांसद के घर की देखरेख में लोनिवि के दो दिहाड़ीदार जुटे रहते हैं ।	जुटे	12	Masc
आगरा से लगभग 35 किलोमीटर दूर स्थित इस स्थान को मुगल सम्राट अकबर ने अपनी राजधानी बनाया था , अतः यहाँ कई बड़ी - बड़ी इमारतें बनी हुई हैं .	बनाया	16	Masc
यदि आप भी सफेद गेंद और स्टिक पर हाथ आजमाना चाहते हैं तो ग्लासगो का चक्कर जरूर लगाइएगा ।	लगाइएगा	17	Masc
इस प्रलय में जीवित बच गए लोगों को बार - बार आने वाले भूकंप के झटके सिहरा जाते हैं ।	सिहरा	16	Masc
पर प्रधानमंत्री मनमोहन सिंह ने यह परंपरा तोड़ते हुए रक्षा मंत्री प्रणव मुखर्जी को ज्यादा तरजीह दी ।	तोड़ते	7	Masc
उन्हें सिर छिपाने के लिए छत , गरम कपड़े और दूसरी जरूरी चीजें तत्काल मुहैया कराई जानी चाहिए ।	कराई	15	Fem
संघ के विचारक एम. जी. वैद्य ने कहा कि इस विवाद को लेकर सोनिया ने लोकसभा सीट और राष्ट्रीय सलाहकार परिषद के अध्यक्ष पद को छोड़ने का फैसला कर चतुराई भरा कदम उठाया है ।	भरा	30	Masc
नौसेना के जहाजों और वायुसेना के हेलीकॉप्टरों और विमानों से राहत सामग्री जरूरतमंदों तक पहुंचाई जा रही है ।	पहुंचाई	14	Fem
यहाँ आकर आपको लगेगा कि आप वॉटर वर्ल्ड में आ गए हैं ।	लगेगा	3	Masc
सीमा सड़क संगठन की सलाह पर यात्रा २० दिन के लिए रोक दी गई है ।	रोक	11	Fem
आज ये लोग भारतीय चिकित्सा पद्धति को नष्ट करने पर तुले हुए हैं ।	तुले	10	Masc
सरकार की भूमिका अपनाते हुए झारखंड में माओवादी छापामारों का कहना है कि वे जल्द ही राज्य में पंचायत चुनाव कराएंगे ।	कराएंगे	20	Masc
मात्र ८८ गेंदों पर जब उन्होंने शतक पूरा किया तो दीर्घाओं में मौजूद २६,००० दर्शकों ने इस उभरते हुए स्टार का तालियों की गड़गड़ाहट से स्वागत किया ।	उभरते	17	Masc
हाई कोर्ट ने अपने आदेश में दोनों कंपनियों को सॉफ्ट ड्रिंक कंटेनरों पर उनके उत्पाद में मिलाए गए कीटनाशकों की मात्रा प्रिंट करने को कहा था ।	मिलाए	16	Masc
हालांकि रास्ते में फगवाड़ा भी पड़ता है , जो जिला कपूरथला का एक हिस्सा है , लेकिन जिला जालंधर पुलिस की एस्कार्ट इस जिले में भी अपना दायित्व निभाती है ।	निभाती	28	Fem
मुंबई में लोगों ने लाखों के जाम छलकाए ।	छलकाए	7	Masc
हालांकि उन्होंने कहा कि कश्मीर मुद्दे को सुलझाए बगैर अन्य मुद्दों को सुलझाने से आपसी विश्वास नहीं बहाल होगा ।	सुलझाए	7	Masc
जब वह गर्भावस्था से गुजर रही थी तो उसके पति ने उसका परित्याग कर दिया था ।	गुजर	4	Fem
लेकिन आज उन्होंने कहा कि यहां पर शांति रहनी चाहिए और आज का दिन बिना घटना के गुजरना चाहिए ।	गुजरना	17	Masc
संसद में आज हर किसी की नजर बिहार के भावी मुख्यमंत्री नितीश कुमार पर टिकी थी ।	टिकी	14	Fem
ईमेल के जरिए होने वाली दूसरी वारदातों के साथ ही अश्लील तस्वीरें भेज कर महिलाओं को परेशान करने के मामले भी पिछले कुछ समय में काफी बढ़ गए हैं ।	बढ़	26	Masc
इस समिति की अब तक हुई करीब छह बैठकों में जो जानकारी सामने आई वह चौंकाने वाली है ।	चौंकाने	15	Fem
वायुयानों के देर से उड़ने के कारण हजारों यात्रियों को हवाई अड्डे पर घंटों प्रतीक्षा करनी पड़ रही है ।	करनी	15	Fem
मेरठ के गुड़िया - आरिफ प्रकरण को सुलझाने के बजाय बोर्ड ने उसे मीडिया का खिलौना बनाया ।	बनाया	16	Masc
महाराष्ट्र में मुंबई की उत्तर - पश्चिम सीट से कांग्रेस प्रत्याशी प्रिया दत्त चुनाव लड़ रही हैं ।	लड़	14	Fem
पेट्रोलियम पदार्थो पर उपकर लगाने के प्रस्ताव का समर्थन करते हुए माकपा नेता ने कहा कि इन पदार्थो पर कस्टम ड्यूटी घटाई गई है .	घटाई	21	Fem
नए साल का जश्न मनाने के लिए गोवा में समंदर के किनारे सैलानियों का सैलाब उमड़ा है ।	उमड़ा	15	Masc
यदि उत्पादन में भी चिप्स के लिए मशहूर कनाडा का यह आलू यहां ठीक उतरा तो एक करार के तहत घाटी के कई किसान इसे अपने खेतों में बीजेंगे ।	बीजेंगे	28	Masc
इसका फ़ायदा उठाकर उसके पड़ोसी ने उससे शारीरिक निकटता बढाई लेकिन लड़की के गर्भवती हो जाने पर उसे छोड़कर भागने लगा .	बढाई	9	Fem
जोशी ने सवालिया अंदाज में कहा कि क्या उन्होंने अपनी आर्थिक नीतियां बदल दी हैं ?	बदल	12	Fem
विश्व से लुप्त हो रही गिद्ध प्रजाति के पक्षी को बचाए रखने के लिए हिमाचल के नालागढ़ में प्रजनन केंद्र का निर्माण किया जाएगा ।	बचाए	10	Masc
केंद्रीय गृह मंत्री शिवराज पाटिल ने कहा कि प्राकृतिक आपदा से बचाव को लेकर केंद्र से लेकर राज्य व ज़िला स्तर तक आपदा प्रबंधन प्राधिकरण बनाए जाएंगे ।	बनाए	25	Masc
लेकिन अगर हफ्ते में दो बार प्रसारण होने पर यह ७ जनवरी तक चलेगा ।	चलेगा	13	Masc
कांग्रेस को हटाए गए मंत्रियों में से कई को जगह देने के लिए राज्य इकाईयों में भी फेरबदल करना पड़ सकता है ।	हटाए	2	Masc
म.प्र. पर्यटन बोट क्लब बड़ी झील में नौकायन भी करवाता है ।	करवाता	9	Masc
सत्र अदालत ने इस मामले को दुर्लभ से दुर्लभतम मामला मानते हुए मृत्यु दंड की सजा दी थी पर राजस्थान हाईकोर्ट की जोधबपुर पीठ ने मृत्यु दंड की सजा को आजीवन कारावास की सजा में तब्दील कर दिया था ।	मानते	10	Masc
सानिया इस टूर्नामेंट में टखने के जख्मी होने के बावजूद उतरी थीं ।	उतरी	10	Fem
काउंसिल के महासचिव डॉक्टर मंजूर आलम के मुताबिक , वह जल्द ही सेकुलर पार्टियों के नेताओं से मिलकर इस मुद्दे पर अपनी नाराजगी जताएंगे ताकि फिर ऐसी गलती न दोहराई जाए ।	जताएंगे	23	Masc
इस मामले की छानबीन के लिए संयुक्त संसदीय समिति के गठन की मांग खारिज करते हुए उन्होंने कहा कि यह मांग तब जायज होती जब सरकार हाथ पर हाथ धरे बैठी होती और कोई कार्रवाई नहीं कर रही होती ।	बैठी	30	Fem
