Zer iritzi duzu Alaves egiten ari den denboraldiaz ?	denboraldiaz	7	Def
Olinpiar Jokoei ere adio esateko garaia heldu da .	Jokoei	1	Def
ESPAINIAKO POLIZIAK Mikel Zuluaga ezker abertzaleko militante historikoa , Santi Brouard taldeko kidea eta Piztu txostenaren egilea atxilotu zuen atzo arratsaldeko 18:00ak aldera .	POLIZIAK	1	Def
Ondorio hori atera du Arabako herrietan Udalbitzaren alde botoak batu dituztela ikustean .	herrietan	5	Def
" Estatuan ez da inolako bereizkuntzarik egingo gizarte-mailaren arabera .	bereizkuntzarik	5	Ind
HAATIK , kondenatzen badute ere , Suhartok ez du espetxea ezagutuko , gaur egungo presidente Abdurrahman Wahidek aurretik iragarri baitu indultua emango diola .	indultua	20	Def
Hautesleek sinetsi egin diotela ematen du , inkesten arabera , parez pare baitaude Fox eta PRIren hautagai Labastida .	Hautesleek	0	Def
Olanoren erreferentziarik ez zen inon ageri .	erreferentziarik	1	Ind
Mercure Hotelean daude , eta gaur 13:45ean abiatuko dira zelaira .	zelaira	9	Def
Espainian dauden enbaxada edo kontsuletxeetako funtzionarioen seme-alabak salbuetsita daude .	kontsuletxeetako	4	Def
Pasarterik zailena zeharkaldia da , eta pauso gehienak , zailtasunean , paretsuak dira " .	Pasarterik	0	Ind
Atzeko lerroan Hristo Vidakovicek debuta egingo du Osasunarekin .	debuta	4	Def
Ordu arte bazirudien CDU alderdi kontserbadoreak eta Bavarian duen adarrak CSU alokatua zutela lehen postua Alemaniako alderdi sisteman .	sisteman	17	Def
Baina Tourreko aitzin-etapa irabaziz kolpe handia eman du Cofidiseko txirrindulariak , eta jauzi kualitatiboa egin du .	aitzin-etapa	2	Def
Herenegun Heike Drechslerrek esnatu zuen ametsetatik , eta atzo Bahametako esprinterrek .	esprinterrek	10	Def
Labean sar ezazu eta , tenperatura motelean , ordu betez eduki .	Labean	0	Def
Boterea izan da beti bere obsesioa , gaur egun jada agure hauskorraren itxura duen arren .	Boterea	0	Def
Gizajo horrek beti aurkitzen du tabernaskaren bat sarrerarekin baina irteerarik gabe , edo hori esaten du behintzat .	tabernaskaren	5	Ind
Napoliko erregeordea zen Lemosko kondearen idazkari izan zen eta , bere anaia Bartolomek esaten duenez , erre egin zituen bere poemak hiri hartan .	kondearen	4	Def
Esate baterako , zazpi antzerki-taldek bederatzi emanaldi egingo dituzte .	emanaldi	6	Ind
Azken garaiotan , gerrillari txetxeniarren erasoak ugaldu egin dira .	erasoak	5	Def
" Putin ezkerrean edo eskuinean duela esertzen da mahaian , eta serieko hiltzaileekin " .	eskuinean	4	Def
EHren iritziz , sozialisten jarrera UPNrekin aurki negoziatuko dituen aurrekontuen atarian indarra baduela erakusteko " keinua da " .	iritziz	1	Ind
Erakutsitako lanak zuri-beltzezkoak dira eta 2x1 metroko formatoan ezarriak dira .	formatoan	7	Def
Aurrekontuak luzatzeak Eusko Jaurlaritzaren " ezintasuna " berresten duela uste du PPk .	Jaurlaritzaren	3	Ind
Txapelketaren hasieran pronostiko batzuk egin zituzten hamasei selekzionatzaileek ; horra zer hanka sartze egin zituzten :	selekzionatzaileek	7	Def
Ezen , Matignonen eta korsikar hautetsien arteko elkarrizketak abian jarri zirenetik , Chevenementek bere ezadostasuna azaldu du behin eta berriro .	ezadostasuna	14	Def
- Zabortegia egin beharrean , turismoa erakar dezaketen proiektuak bultzatu beharko genituzke , beharbada , Nobel Sarien arrakasta aprobetxatuz .	proiektuak	8	Def
Alanbre gainean higitzen ziren harriz edo bolaz osatuta zegoen eta zenbakien balioa , haiek okupatzen zituzten posizioen bidez markatzen zen .	balioa	11	Def
" - Buruz dakit Emiliek azken gutunean esandakoa :	Buruz	2	Ind
TOM CONSTANTINE estatubatuarrak aztertuko ditu RUC Ipar Irlandako Poliziari egingo zaizkion erreformak , atzo Peter Mandelson ministro britainiarrak iragarri zuenez .	erreformak	11	Def
Sakea hanketara jarri zion Lizasori , dejadaz bikain moldatu zen unerik aproposenetan , jo behar zuenean jo eta lasaitu behar zuenean lasaitu , teknika eta taktika erakustaldia egin zuen Zeberiok .	Sakea	0	Def
Printzipioz , patronalarenpean dagoen ANET kamioi gidarien elkarteak grebarik deitu ez arren , haren partaide diren garraio enpresa batzuk lanuztea jarraitzen ari dira .	grebarik	8	Ind
Haren hitzetan , EAEko 1993ko opor fiskalak " Frantziako Estatuak bertako erregio baterako onartutakoen antzekoak " dira , eta " Espainiak berak ere laguntza horiek bere araudira " eraman zituen , " Europako Batzordeak inolako txostenik zabaldu gabe " .	araudira	26	Def
Ipar eta Hego Koreak komunikatu bateratua argitaratu dute elkarlaguntza sendotuko dutela esanez .	elkarlaguntza	8	Def
Washingtongo Gobernuak Nazio Batuen Erakundeari zor dioten dirua ordaindu nahi du Gorek .	Erakundeari	4	Def
Arratsaldeko kotizazioaren ostean , Gamesako tituluak 21,73eurotan kotizatu zuten .	21,73eurotan	6	Ind
Arkeologoek antzinako historia aztertzen dute tenplu eta hilobi zahar horiek hondar azpitik ateraz .	Arkeologoek	0	Def
HB euskal pentsamendu tradizionalari sekula botatako desafiorik arradikalena zen seguruenik ( euskaraz behintzat ) .	desafiorik	6	Ind
Alabaina , Jospinen eta Chevenementen artean atzo goizerako iragarria izan zen hitzordua , larunbat goizean gertatu zela jakin zen , diskrezio osoan .	goizerako	7	Ind
Kaktusetan , adibidez , drenajea errazteko legar-kopurua handiagotu edo hartxintxarra gehituko dugu .	hartxintxarra	9	Def
" Nik pentsatzen nuen aurreko bi harriekin bost altxaldi kendu , kubikoarekin pittin bat kontrolatu eta bolarekin 16 jasoaldi eginda nahikoa izango nuela , eta ez zuen merezi gehiegi hustea " .	bolarekin	16	Ind
Liberalen buru Ciria jenerala zen eta Cavero karlistena .	Liberalen	0	Def
ILUNPETATIK poliki-poliki koloretako beira-gaztelua agertzen da munduaren gailurrean .	koloretako	2	Ind
Honetan zehaztua zegoenez , ama alemaniarra eta aita jatorri irakiarrekoa zuen Joseph Abdula 6 urteko mutiko bat eraila izan zen , orain dela 4 urte , Alemania ekialdeko Sebniz hiriko udal igerilekuan .	irakiarrekoa	9	Def
Kanbotarrak Baionan eman zituen urte gehienak , eta profesionaltasunaren ailegaerarekin batera , Pauera jo zuen 97-98 sasoian .	Kanbotarrak	0	Def
Armadak 40 urtetik gorako Israelgo arabiarrei eta herrialde horretako nortasun agiriak zituzten ekialdeko Jerusalemgo palestinarrei bakarrik utzi zien Jerusalemgo Meskiten Zelaiunean sartzen .	Meskiten	19	Def
IRAGAN larunbatean Legutioko Mecanizados Alberdi enpresan eztanda egindako lehergailuak ETAk Bretainian lapurtutako dinamitaz osatuta zegoen , eta 5 eta 8 kilo arteko lehergaia zuen .	eztanda	6	Ind
Maia taldeak fitxatzeko borondatea erakutsi zuen , eta Jazztel-Costa de Almeriarekin sinatzen ez badut , izango dut hara joateko aukerarik , diru gutxiago kobratuta .	aukerarik	19	Ind
Pasaitarraren iritziz finaleko erritmoa altuegia izan zen :	iritziz	1	Ind
Gainerako zigor-espedienteak egokitzat jotako ikerketez eta frogez hornituko dira , ofizioz edo doakionaren eskariz .	ofizioz	10	Ind
29 urte betetzear , ustegabean egokitu zaio distira egiteko unea .	distira	7	Ind
Gela erabat desordenatuta zegoen :	Gela	0	Def
Elkarri gizarte mugimenduak ere oharra kaleratu zuen eta kritiko agertu zen Garzonen autoarekin .	oharra	4	Def
Don Melitonek ere malkotan zituen bere begiak .	malkotan	3	Ind
Lazoak diruditen irudiz egindako dekorazio fin hau , oso tipikoa da arabiar arkitekturan .	irudiz	2	Ind
Alustiza eta Rai pixka bat esnatu ziren bukaerarako , baina ezin izan zuten 17tik haratago joan .	haratago	14	Ind
Era honetako liburua izanik eta Virgiliorena delarik testua , gutxienekoa da zaharkituak egotea edo ez egotea Minelliusen edizio hauek :	gutxienekoa	9	Def
Zentraleko iturriek adierazi zutenez , lurrun-ihesa langilerik ez zegoen gela batean gertatu zen - bertan , besteak beste , hozte-sistemako hodiak daude .	hozte-sistemako	19	Def
Usadioak eskatzen duen bezala , sakean koadro erdiko abantaila utziko dio txapeldunak txapeldunordeari errebantxan .	txapeldunak	11	Def
Itzulpenak , aldiz , ez dira - euskal literaturaren neurrietarako - azaleko eragin horrek pentsarazi lezakeen bezain urriak .	Itzulpenak	0	Def
Alberto , neska kotxera hurbildu bitartean leihoa ireki gabe mantendu da segundo batzuetan , ustekabea dela eta nahiko aztoratua .	kotxera	3	Def
Zarata egiterik ez nuen saihestu , baina ez nuen zaratarik egin .	zaratarik	9	Ind
Epaitegiaren arabera , " udalek ez dute Autonomi Erkidegoek ezarritako langileen egutegia aldatzeko ahalmenik eta , horretaz gain , udalek bi jaiegun lanegun deklaratzeko aukera dute bakarrik " .	jaiegun	21	Ind
ISTRIPUA izan zuen hegazkina Singapore Airlines enpresako Boeing 747-400 bat zen , eta 179 lagun zihoazen barruan , Taiwango hiriburutik , Taipeitik Los Angeleserako bidaia egin behar zuten .	hiriburutik	19	Def
Lehen Jokoak ditu Sydneyn Ielena Ielesina errusiarrak , eta altura jauziko urrearekin itzuliko da etxera .	urrearekin	11	Def
Israelgo intelektualen arabera , bereziki larriak dira gertakari horiek 1948az geroztik indarrean dagoen elkarbizitza eredua auzitan jartzen dutelako .	auzitan	15	Ind
Jarduera eta gaiarekin hasi aurretik eman iezaiozu begirada bat ikas-norabideari eta aztertu ea zer dakizun edo gogoratzen duzun han agertzen zaizkizun gauzez .	ikas-norabideari	9	Def
Juan Mari Olanok adierazi zuenez , " Frantziak eta Espainiak Euskal Herrian garatzen duten errepresio politikoaren aurpegiak nabarmentzera eta euskaldunoi kanpotik eta indarraz inposatu diguten gatazkaren irtenbide politikorako alternatiba aurkeztera joango gara " .	kanpotik	20	Def
Azken itzuliari 1:10eko errentarekin ekin zion .	errentarekin	3	Def
Beste zaurituei dagokienez , herenegun gauerako beste bik jaso zuten senda-agiria , eta zortzi gelditzen dira hainbat erietxetan ingresatuta .	erietxetan	17	Ind
Kezka larri batek estutzen zion barrena , sosegu hartzea galeraziz .	sosegu	7	Ind
IZAR BELTZA talde anarkistako kideek su eman zioten atzo goizaldean Poloniak Atenasen duen enbaxadako kide baten autoari .	su	5	Ind
Iaz 8.950 kilo leporatu zituen ( 57 jasoaldi ) .	jasoaldi	7	Ind
Kontseiluak ez dituela ez delitu larrien egiletzat , ez terroristatzat jo ondorioztatu dute gaiari arreta handirik eskaini ez dioten egunkari frankofonoek .	terroristatzat	9	Ind
- Beno , lo egingo dut eta nire ametsetan zerbait agertuko zait , bai , hori egingo dut .	ametsetan	8	Def
Euriak eraginda , igandean bertan behera gelditu zen torneoa , baina Loweryk arazorik gabe eutsi zion atzo lehen portuari .	portuari	18	Def
Okerrak oker , partida orekatua joan zen lehen zatian :	oker	1	Ind
Eusko Jaurlaritzako Hezkuntza Sailak eta udaletako Gizarte-Ekintzako Sailek ikasteko bekak eta laguntzak banatzeko programak dituzte .	Sailek	7	Def
Gobernuak genozidiotzat jo zuen Jugoslaviako gerra , eta mila medikuren doako laguntza eskaini zuen Kosovoko iheslari albaniarrez arduratzeko .	medikuren	9	Ind
" Argazkia ikusmenezko hautespen-sistema bat da .	ikusmenezko	2	Ind
Igandean atseden hartu zuen , eta astelehenean " oso burugogor " joan zen , baina giro sargoriak ez zion laga bidea bukatzen .	atseden	1	Ind
PSE-EEk dio Jaurlaritzak " iruzur " egin duela aurrekontuak luzatu dituelako .	iruzur	4	Ind
Irakasleek uste dute neskak eta mutilak berdin tratatzen dituztela , baina aski eta sobera frogatu da ohituraz maskulinotzat jo diren curriculum ikasketetan irakasleak gogotsuago aritzen direla mutilekin neskekin baino .	ohituraz	16	Ind
Erabaki horretan haurtzaindegiko zuzendariak emandako iritziak garrantzirik izan zuelako ustez , bahitzaileek mendekuz jokatu nahi izan du beharbada .	garrantzirik	6	Ind
Nahiko ongi ibili ginen , entrenamenduetan dena neurtuta eramaten genuelako , baina harri handia oso bestelakoa da .	entrenamenduetan	5	Def
tokiko euskara mintzatutik , edo hobeki , normalizatutik abiatuz , Baturantz joaitea .	tokiko	0	Def
Ataka zaila antzematen da euskal politikagintzan mendearen amaieran .	politikagintzan	5	Def
Ingelesez idazten duten egile australiar horien artean zenbait ospetsuak dira nazioartean .	Ingelesez	0	Ind
" Ezin izango da gizarte-bereizkuntzarik egin herri-onerako ez bada " .	gizarte-bereizkuntzarik	4	Ind
ETXEAN bezala sentituko da Julio Cesar Lamas argentinarra hurrengo denboraldian Tau Baskonian , lau herrikide izango dituelako :	herrikide	14	Ind
Baina pauso berri bat eman beharrean zaude , eta beharbada ondo etorriko zaizu berriro ere ikas-norabideari gainbegiratu bat ematea , atalez aldatu behar baituzu .	atalez	20	Ind
Espetxe batzutan ( gizonezkoenetan ) , sukaldea dago edo " barbakoa " antzeko bat egoten da janaria prestatzeko , eta emakumezkoenetan , ez .	janaria	16	Def
MADRILGO Diputatuen Kongresuak ETAren eta kale indarkeriaren inguruan proposatu dituen lege aldaketei zuzenketak egiteko epea astebetez luzatzea erabaki zuen atzo , CiUk , EAJtak eta Talde Mistoak egindako eskaera onartuz .	astebetez	15	Ind
Egoerak bueltarik ez zuela ikusi zuenean bakarrik erabaki zuen konponbidea jartzea .	bueltarik	1	Ind
ERRUBLOA izango da 2005. urtean Errusia eta Bielorrusiako diru batua , Vladimir Putin eta Alekxander Lukaxenko bi herriotako presidenteek Minsken atzo izenpetutako akordioa gauzatzen bada behintzat .	Putin	12	Ind
Era horretan , Rouen , Amiens eta Reims saihestuko genituzke final-laurdenetan " .	final-laurdenetan	10	Def
Orain arte uste dut ez dudala karrerarik izan jakiteko zer egin dezakedan profesionaletan .	karrerarik	6	Ind
- Piztu zinta , ea zer gertatu den bigarren saioan .	zinta	2	Def
Labezomorro bat pasa da bere aurrean , patxadaz , inguruarekiko axolagabe , eta amonari konplize irribarre bat marraztu zaio aurpegian .	patxadaz	7	Ind
Elisabeth Gigou Lan ministroak azaldu zuenez 1997an Jospin gobernuburu izendatu zutenetik ia milioi bat lagunetan jaitsi da langabezia .	lagunetan	14	Ind
Irakasletzako tesia Urbiako artzaintzari buruz egin nuen .	Irakasletzako	0	Ind
Jontxuk ezin zuen lorik egin .	lorik	3	Ind
Ikasleen pertzeptzioan irakasleek mutilei baino tratu hobea ematen diete neskei , ez baitiete horren segido errieta edo ahakar egiten .	ahakar	17	Ind
Ogasun batzordearen datorren bileran finkatuko da ziurrenik lan taldea .	batzordearen	1	Def
Kanal honetan galbahe bat zegoen , bikorrak , lastoa , harriak eta abar ez pasatzeko .	bikorrak	6	Def
HIROMU NONAKA Japonian Gobernuan dagoen LDP Alderdi Liberal Demokratikoko idazkari nagusiak atzo utzi egin zuen kargua .	Gobernuan	3	Def
Lasterketa bukatu eta gutxira Sydneyko hormak Freemanen argazkidun Niken afitxez bete ziren .	Lasterketa	0	Def
Nahi baduzu , esnegaina marrubizko mermeladarekin nahas dezakezu , eta oraindik bero dagoenean gainetik bota .	marrubizko	4	Ind
EUSKAL HERRIKO buruz buruko zestapunta txapelketaren bigarren saioari ekingo zaio gaur , Bilboko Deportivo frontoian .	HERRIKO	1	Def
Horri esker iraungo du hango harrobiak , eta selekzioaren etorkizuna ziurtaturik dago .	selekzioaren	8	Def
Egoera latz-latza da .	latz-latza	1	Def
Euskalaritzari zuzen-zuzenean lotzen bagatzaizkio , ostera , gertaera bi dira nahitaez nabarmendu beharreko .	Euskalaritzari	0	Def
Paraleloki , irakasleen lana jasotzeko datu base baten diseinua burutzen ari gara .	diseinua	8	Def
Atseden hartu nahi dudanean , etxera joango naiz " .	Atseden	0	Ind
Nire aurpegia zurbila zegoen eta begi berdeek ez zuten lehengo alaitasunik , itzaliak zeuden , hilik .	alaitasunik	10	Ind
Europako Batasunak orain gutxi egindako txostenaren arabera , 35 orduko lan-astearen neurriak izan da lan eskaria bultzatu duen neurri garrantzitsuena .	lan-astearen	10	Def
" Argentinan egiten duen eguraldiak , beste hainbat gauzarekin batera , jokoa baldintzatu egiten die hango jokalariei .	eguraldiak	4	Def
ZER ESKAINTZEN DIGU INFORMATIKAK HIZKUNTZEN IKASKUNTZA ARLOAN ?	INFORMATIKAK	3	Ind
- Inor jasotzen ari bada konpentsaziozko osagarria , esleitzen diren osagarriek hura irentsi eginen dute .	konpentsaziozko	5	Ind
" Aldaketak aztertzeko batzordea ETAk Lluch hil ostean bildu zen , eta ordezkari sozialistaren hitzak hunkigarriak izan ziren , baina legeak ez dira hunkimenetik egiten , aldaketak lasaitasunez eta zentzunez egin behar dira " .	zentzunez	29	Ind
Arratsaldean ere kontzentrazio ugari egin ziren herrietan .	herrietan	6	Def
- Gu bion bizitza zegoen arriskutan , Kurt .	arriskutan	5	Ind
Zenbait kidek - Erresuma Batuak , batez ere - ez dute onartzen estatuengan eragina izatea ; Frantziak , Holandak eta Alemaniak , aldiz , indar legala eman nahi diote .	kidek	1	Ind
Bosman Legea dela medio , Frantziako Ligan hango fitxa zuten jokalaririk onenek Italiara jo zuten ospe bila , eta munduko ligarik gogorrenean bildutako esperientzia erabakigarria izan da selekzioarentzat .	ligarik	20	Ind
Drogazale naizenez , arrisku handiagoa daukat , eta homosexuala ere naizenez arrisku handiagoa .	Drogazale	0	Ind
( Euskaraz da Laxalten " A Cup ot Tea in Pamplona " , edo ' Kafea hartzea Iruñean ' ere ( Elkar , 1986 ) , itzultzaile beraren lumatik ) .	Pamplona	10	Ind
Alderdi demokratiko batekoa dela dioenak ETAko presoak euren jaioterrira ekartzeko eskaerarik ez diezaiola egin Madrilgo Gobernuari " .	batekoa	2	Def
Atzokoa ikusi ondoren , Stefano Garzellik uste du biharko erlojupekoak erabakiko duela azken irabazlea :	irabazlea	13	Def
Ondoren , Urbil hipermerkatuaren proiektuaren berri izan zuten , eta haren kontra hainbat ekimen egin zituzten .	ekimen	13	Ind
Eki Timorreko ordezkaritzako kideek azaldu dutenez , Indonesiaren aldeko miliziek Diliko boxeo jimnasioa txikitu zuten , eta Eki Timorreko boxeolari ezagunena , Thomas Americo , hil zuten .	ordezkaritzako	2	Def
PTri dagokionez , bigarren txandatik landa , 300 udalerri gobernatuko dituela aurrikusten da , gaur egun 107tan gehiengoa daukarik .	udalerri	8	Ind
Kontseiluak ez dituela ez delitu larrien egiletzat , ez terroristatzat jo ondorioztatu dute gaiari arreta handirik eskaini ez dioten egunkari frankofonoek .	Kontseiluak	0	Def
Diktadurako biktimen aldeen abokatuak , berriz , atsekabetuta azaldu ziren eta Goreneko lehendakariarekin biltzeko eskatu zuten .	Diktadurako	0	Def
Bi eraikinek osatzen dute Santa Maria de Garoñako zentral nuklearra .	eraikinek	1	Def
Bestetik , epaileek Espainiako Justizia Ministeriora jo dute , Barne Ministerioak ETAren jomuga izan daitezkeen epaile eta fiskalei buruzko informazioa zabal dezan .	Ministeriora	5	Def
Joan den astean asko landu genuen uztartzea , eta fruitua eman du .	fruitua	9	Def
Nik uste dut Euskal Herriak bere nortasuna baiezteko daukan hil ala biziko premia horrengatik dela , bere herri-nortasuna kulturaren errorik sakonenetan bilatuz " .	nortasuna	6	Def
Hala ondorioztatu zuen atzo Eduardo Stein Guatemalako Atzerri ministro ohi eta OEA Amerikako Estatuen Erakundearen Peruko bozetarako misioko buruzagiak .	misioko	17	Def
Plastikozko poltsa batean goroldio hezea eta lur-nahaste bat jarri , zauriaren inguruan goi eta behean loturik .	Plastikozko	0	Ind
Bere langelara joan eta begiratu dezakegu .	langelara	1	Def
Galderak idatziz eta 48 ordu lehenago egin beharrekoak ziren .	beharrekoak	7	Def
SPD eta CDU , ezkerra eta eskuina , eztabaidan ari dira bateratzea nori eskertu behar zaion zehazteko .	ezkerra	4	Def
Astean zehar egindako entrenamenduetan , Ivan Alonso titularrekin batera jarri du Manek eta gainera , Balmasedakoa uruguaiarraren oso gainean egon da uneoro .	uruguaiarraren	16	Def
PERIKO ALONSOK badu konfiantzarik esku artean duen taldearengan .	konfiantzarik	3	Ind
Datuek ez dute bakartzen .	Datuek	0	Def
LYCOSEKO zuzendaritzako zenbait kidek enpresako 20 milioi akzio saldu zituzten Terrarekin fusioa egin zen garaian .	akzio	7	Ind
Zenbait kidek - Erresuma Batuak , batez ere - ez dute onartzen estatuengan eragina izatea ; Frantziak , Holandak eta Alemaniak , aldiz , indar legala eman nahi diote .	estatuengan	12	Def
Gaixotasuna propioki baino , izpiritua hor ahultasuna da edozein moldetan , batzuetan natur fenomenoetan beretan .	moldetan	9	Ind
Gazteak Alemanian dauden EEBBetako soldaduen semeak dira , eta karguak ukatu dituzte .	Gazteak	0	Def
Jeneralak alderdiari gai arrazialen inguruan duen ikuspuntua zabaltzeko eskatu zion , eta gogor kritikatu zituen diskriminazio positiboaren aurka agertu diren errepublikanoak , diskriminazio horrek " milaka haur beltzek hezkuntzarako aukera izaten lagundu baitu " .	Jeneralak	0	Def
Ondorio horietarako , lehenengo bizileku Espainia izan duten adingabeak Espainian jaiotakotzat hartuko dira .	bizileku	4	Ind
Taldean sartu aurretik proba batzuk egin behar izan genituen , korrikan , eskalada librean , erreken jeitsieran ... edozein ezin baita erreskate taldeko partaide izan .	jeitsieran	16	Def
" Neguan arropa asko jazten dut hotzik ez izateko " .	Neguan	1	Def
Naturarekin harremanetan , 630 mtako altueran dago , han eta hemen Ullibarriko urtegira doazen errekatxoek zeharkatzen dutela .	altueran	5	Def
Ahalegindu zaitez guzti-guztiak erantzuten .	guzti-guztiak	2	Def
Bi lehendakarigaien arteko diferentzia handiena azalez , ez mamiz misilen kontrako defentsa sistemari dagokio .	azalez	5	Ind
Sudupek , berriz , akordioa hautsi zuena EH izan zela esan zuen baina ez zuen azalpenetan sartu nahi izan .	azalpenetan	15	Def
Garciak Ertzaintzaren komisarian kolpeak , mehatxuak eta irainak jasan izana salatu zuen .	irainak	7	Def
Lanbrorik ez zegoen eta une batez hiriaren mapa imajinarioak diseinatuz amestu genuen , gure gogoko auzoak eginez itsasondoan edota muinoen inguruan .	Lanbrorik	0	Ind
Batzuek , egungo instituzioei muzin egitea leporatu diote , beste batzuk demokrazia eta legearen kontra jotzea , gehienek mamu sezesionista edo independentziaren beldurra astindu dute .	muzin	4	Ind
Dekretua uztailaren 8ko Euskal Herriko boletinean argitaratu zen eta irailaren 8tik dago indarrean .	boletinean	5	Def
Bolarekin moldatzen da ondoen .	Bolarekin	0	Def
Imazek Jaurlaritza aurrean egindako gaitzespen kontzentrazioan egin zituen adierazpenok , eta hildakoen senitartekoei " euskal gizartearen gehiengoaren elkartasuna " igorri zien .	kontzentrazioan	5	Def
Obertok ezbeharrez betetako denboraldia izan du .	ezbeharrez	1	Ind
LYCOSEKO zuzendaritzako zenbait kidek enpresako 20 milioi akzio saldu zituzten Terrarekin fusioa egin zen garaian .	fusioa	11	Def
Concordearen Roissyko pista ez zuten behar beste arakatu .	pista	2	Def
Aierbek , ordea , 60 ontzako bi enborretako epaiak itxi egin zituen , segundo asko galdu zuen .	ontzako	5	Def
Sharonen jarrera probokatzailea zertara datorren galdetu zuen Mubarakek , eta leku santuen inguruko arazoa oso zaila dela gaineratu .	probokatzailea	2	Def
Ametsak betetzea ez dago norberaren esku .	Ametsak	0	Def
- Bai , baina ... Ikasturtea hain arin pasatu da ... .	Ikasturtea	5	Def
Arkeologoek hilobietan aurkitzen diren jantzi , altzari eta janariak aztertzen dituzte ; baita altxorrak , eta hormetako idazki eta marrazkiak ere .	Arkeologoek	0	Def
Ez dago soluziorik .	soluziorik	2	Ind
Larunbataz geroztik , ultraeskuindarren indarkeriaren kontra zerbait egiteko deialdiak ugaritu egin dira .	deialdiak	8	Def
Athleticen gertatzen den bezala , atezainak ez du behar bezalako errespetua sartzen bere arean .	errespetua	10	Def
Arauaren aldaketaren ondorioz , %5 hori %8ra pasatzen da ekoizpen naturala saltzen duten nekazaritza eta basoko ustiapenak dituztenei eta %7 abeltzaintza eta arrantza ustiapenak dituztenei .	ustiapenak	16	Def
Orainarte Mendizorrotzan ikusi ahal izan den bezala , Maneren mutilek arazoak dituzte etxean jokoaren ekimena hartu behar dutenean eta atzokoa ez zen salbuespena izan .	salbuespena	22	Def
Epaiak , baina azken bi delituotatik absolbitu egin du , izan ere , Frantziak estradizioa soilik lesioengatik onartu zuen , eta beraz , legearen arabera , epaiketan ezin dizkiote bestelako delituak leporatu .	delituotatik	5	Def
Zentral nuklearraren itxieraren atarian , 1986ko hondamendiaren biktimek protestak antolatu dituzte , beren subentzioak gutxitzeko arriskua ikusi dutenean .	itxieraren	2	Def
Ezen , BEAko txostenean irakur daitekeenez , Concordea zerbitzuan jarri zenetik keroseno ontzietan sei aldiz gertatu dira kaltetzeak , baina sekula ez zen erregaiak su hartzerik gertatu .	ontzietan	12	Def
65 kolpe nahikoa izan zituen ibilbidea osatzeko zazpi parraren azpitik , eta sailkapeneko liderra da , Lee Westwood ingelesarekin batera .	ibilbidea	5	Def
Aspektu burutuaren markak , hasiera baten , beraz , aditz-lexemaren balio hutsa duela dirudi .	aditz-lexemaren	9	Def
Aurreko Errepublika Federalaren amaieratzat har daiteke hala behartutako langileei eman beharreko kalte-ordainen gaineko eztabaida nola Alemanian tradizionalistei , ezkertiar zaharrei eta 68ko naif-ei egiten zaien kritika etengabea .	amaieratzat	3	Ind
Arestik berak , eta nobelak izan duen irakurlerik adienetakoa izan liteke .	irakurlerik	7	Ind
Gorriak ikusi zituen managerrak neska konbentzitzen " matxura " konpon zezan .	matxura	7	Def
kolorea , berriz , krema-okre ahula , baina arrosa kolorea hartzen dute erabiltzen dituzten edo urratuak dituzten aldeetan .	kolorea	9	Def
Bi eta hiru paretako frontoietan , marka batzuk izaten dira ezkerraldekoan , pilotak botea leku egokian jo duen ala ez jakiteko .	frontoietan	4	Def
Zenbait arazoren ondorioz , hori ez da gauzatu , eta espiritu hori berreskuratzeko saioa egin behar litzateke .	arazoren	1	Ind
" Nire herria asko gustatzen zait , kostaldea eta mendiak batez ere " .	herria	2	Def
Hor aurrean egon naiz , tentuan beti .	tentuan	5	Def
Bi aldeetako ordezkaritzekin bilduko da Albright bisita horren harian , eta gai sumin horietan adostasun puntuak bilatzea izango du helburu .	harian	8	Def
Martinho de Araujok kirol emaitza onik ez zuela lortuko bazekiten Timorreko ordezkaritzan , baina esperantza bazuten Victor Ramos boxeolariarekin .	ordezkaritzan	11	Def
Zer da txistua ?	txistua	2	Def
" Tourrean ez egotearen arrazoietako bat dirua da .	dirua	6	Def
Hobeto ikusteko itxura eginez , gorputza aurreratzen du , beharrik ez izan arren , ongi baitaki Marietta baten erretratuaren fotokopia erakusten ari zaiola .	erretratuaren	18	Def
Erlijio borrokarekin , kristau nahiz musulmanekin , zerikusia duten soldadu guztiak handik ateratzeko eskatu zion erakundeak Jakartari .	zerikusia	7	Def
Sindikatuko diruzaina izango da .	Sindikatuko	0	Def
Inolako usteldura , zoldura , gaitz edo izurrite-arrastorik badu , etxeko beste landareetatik urruti jarri .	izurrite-arrastorik	7	Ind
