Printzipioz , patronalarenpean dagoen ANET kamioi gidarien elkarteak grebarik deitu ez arren , haren partaide diren garraio enpresa batzuk lanuztea jarraitzen ari dira .	gidarien	6	Def
Gainera , 2.000. urtean sartu diren diru partidak - dela Europatik lortutakoak , Diputazioen apartazioak edo tesoreriako soberakinak - datorren urteko aurrekontuari gehituko zaio .	apartazioak	14	Def
Gainera , Irakeko Gobernuak bere petrolio esportazioak eurotan kobratzea erabaki izana ere mesedegarri suertatu da Europako diruarentzat .	eurotan	7	Ind
Edurnezuri printzearekin ezkondu zenean , zazpi ipotxek edateari eman zioten .	ipotxek	6	Def
75 kolperekin bukatu zuen zirkuitua Olazabalek , hiru kolpe parraren gainetik , eta sailkapeneko zortzigarren posturaino jaitsi da , 140 kolperekin ( - 4 ) .	kolperekin	20	Ind
Irakasleek uste dute neskak eta mutilak berdin tratatzen dituztela , baina aski eta sobera frogatu da ohituraz maskulinotzat jo diren curriculum ikasketetan irakasleak gogotsuago aritzen direla mutilekin neskekin baino .	ikasketetan	21	Def
Sasoi betean iritsi da Jokoetara , eta aurkariei ez zien inolako aukerarik eman .	aukerarik	11	Ind
- Handik hilabetera , hegazkin-taldea azaldu zen Pepitaren herrira , eta Pepita bera , lehen hegazkinaren atzeko jarlekuan .	herrira	8	Def
Ateratzen zuten dirua ez zen etekin garbia izaten beraz .	dirua	2	Def
Ekoizpenen sailkapen hau , ulergarriak eta ulergaitzak , hain zuzen , HEGEHJ taldeak gauzatu du transkribaketak egitean ; ez da , beraz , gure erizpidea izango .	Ekoizpenen	0	Def
Hamaika lagunek galdu dute bizia bortxazko ekintzetan .	bortxazko	5	Ind
Sopelako EB-IUko zinegotzi Jose Vicente Ojinagak ere erasoa arbuiatu zuen ; eta halako erasoek " burmuin totalitario eta intoleranteen aginduei " erantzuten dietela adierazi zuen .	aginduei	19	Def
Hernandok EAJk atzo Aznarri emandako erantzunaren ildotik egin zituen adierazpenok .	ildotik	6	Def
Ipar Irlandan gizonezko katoliko bat tiroz hil dute , argitu ez diren arrazoiengatik .	arrazoiengatik	12	Def
EBren Oinarrizko Eskubideen Agiriak soil-soilik jatorria Bruselan duten legeei eragingo die , ezin ditu araudi nazionalak gainditu .	legeei	8	Def
Espainiako merkatuan sortzen den lehen kooperazio aliantza da hau , eta datorren hilabeteetan beste hiri batzuetara hedatzeko asmoa du .	aliantza	6	Def
Gehienak etxera joan ziren , prestatuta zuten jaia ospatzeko gogorik eta motiborik ez zutelako ; eta telebistaz Rijkaardek selekzioa uzten zuela entzun behar izan zuten .	jaia	7	Def
The Dream-eko bi aurkezleek Roy eta H.G. , gauero bi orduz , barrez lehertzen jarri dituzte australiarrak olinpiar irudien gaineko komentarioekin .	aurkezleek	3	Def
Hasieran esan zen , ordea , urpekoaren lehen bost gelak atzealdean zeudela eta marinel asko deseginda gertatuko zirela istripuaren ondorioz .	istripuaren	18	Def
Hala , ostiraleko egunean zehar euriak bustitako lurrean irrist egin zuten aitzinaldeko hainbat ikuslek eta jarraian bultzakada handiak izan ziren .	irrist	8	Ind
kolorea , berriz , krema-okre ahula , baina arrosa kolorea hartzen dute erabiltzen dituzten edo urratuak dituzten aldeetan .	kolorea	0	Def
Irakasleek uste dute neskak eta mutilak berdin tratatzen dituztela , baina aski eta sobera frogatu da ohituraz maskulinotzat jo diren curriculum ikasketetan irakasleak gogotsuago aritzen direla mutilekin neskekin baino .	mutilekin	26	Def
100.000 inguru Gomatik ipar-mendebaldera dagoen Kisanganira bidean dira , eta beste 100.000 Gomatik mendebaldera dagoen Kindura .	ipar-mendebaldera	3	Def
Tirapuk , Errandonearen laguntzarekin , bizitasuna eman zion partidari , eta aitzineko koadroetan nagusitasun osoa agertu zuen .	laguntzarekin	3	Def
Fetoaren sexua kontuan hartuz eginiko abortua , haur-neskatilen hilketak eta elikagai nahiz sendagaiak lortzeko baliabide eskasagoak izatea lirateke esandakoaren azalpen-arrazoiak .	azalpen-arrazoiak	19	Def
Biktimek diotenez , « agintariek Mercedes autoak erosteko dirua badute , elbarrituei laguntzeko dirua ere izan behar dute » .	Biktimek	0	Def
Kutxatxoak bi gutun-sail gordetzen zituen :	Kutxatxoak	0	Def
Jacques Delors , Lionel Jospin Lehen Ministroaren hurbileko politika gizona da .	gizona	9	Def
Jendea , ordea , behera bota arte ez da ohartzen .	Jendea	0	Def
PP-REN Gobernuak proposatutako lege aldaketek Espainiako Kongresuaren onarpena jaso zuten atzo .	aldaketek	4	Def
Izetak 100 kiloko zilindroarekin jardungo du , eta minutu batean , 23 jasoaldiko marka ondu nahi du .	zilindroarekin	3	Def
Arratseko zortzietatik aitzina izanen da eta Natxo de Felipe eta Tomas San Miguelen laguntza izanen dute besteak beste .	Arratseko	0	Def
Baina zorionez , birako lehen egunetan gutxi gora-behera perfilatua neukan zer egin nahi nuen , eta orduan , koadernoko apunteak horretara bideratuta zeuden hasieratik .	apunteak	19	Def
Talde zurigorriak Liga hasiera ikaragarri zaila dauka , eta ona izango litzateke emaitzak alde batera utzi eta entrenatzailearenganako konfiantzari eustea .	entrenatzailearenganako	17	Def
- Inor jasotzen ari bada konpentsaziozko osagarria , esleitzen diren osagarriek hura irentsi eginen dute .	osagarriek	10	Def
Goreren gobernu batek Clintonen ildoari segituko dio , Armadari buruzko aditu ezkertiar William Hartungek esan duenez .	ildoari	4	Def
Hauetako inork ezin izan zuen baieztatu orriak Alegriak eman zizkienik .	orriak	6	Def
Espetxeak , baina , ez du bete epaileak esandakoa , eta azkenaldian funtzionarioak preso hauen ziegetara sartu eta indarrez zutik jartzen dituzte .	ziegetara	15	Def
Partidan zehar , ordea , sar liteke , eta beharrezko oldarkortasuna emango dio defentsari .	defentsari	13	Def
Bahimendu ekonomikoa da , hain zuzen , mendebaldeko herrialdeek beren esku duten tresnarik eraginkorrenetakoa Milosevicen aurka .	mendebaldeko	7	Def
VLADIMIR Putin presidenteak Defentsa Ministerioko sei jeneral kargugabetu zituen atzo , horien artean Anatoli Xatalov bozeramailea .	Ministerioko	4	Def
Ni pistan egina naiz ziklista , Malta , Hong Kong eta Eskoziako belodromoetan " .	belodromoetan	12	Def
" Probintziaz eta belaunaldiz zatitutako euskal mosaiko bat zegoen " .	Probintziaz	1	Ind
" Korsikako erreformak Errepublikaren batasunean behar dira egin " .	erreformak	2	Def
Operazio hau amaitua dela iragarri zuten atzo Errusiako Armadako buruek .	buruek	9	Def
" Probintziaz eta belaunaldiz zatitutako euskal mosaiko bat zegoen " .	belaunaldiz	3	Ind
" Hasieratik erritmo azkarrean korritu da eta helmugara indarrez justu heldu gara .	Hasieratik	1	Def
Yong-Koori zientzietako esperimentuak eta matematika gustatzen zaizkio gehienbat .	matematika	4	Def
Biek Euskal Herrian bazterketa pairatzen dute , eta Espainian , aldiz , jazarpena eta heriotza " .	heriotza	14	Def
" Aldaketak aztertzeko batzordea ETAk Lluch hil ostean bildu zen , eta ordezkari sozialistaren hitzak hunkigarriak izan ziren , baina legeak ez dira hunkimenetik egiten , aldaketak lasaitasunez eta zentzunez egin behar dira " .	lasaitasunez	27	Ind
Iaz bosgarren sailkatu zen , 5.725 kilo bizkarreratuta ( 37 jasoaldi ) .	jasoaldi	10	Ind
Zabortegiari zegokionez , aurreko egunetan izandako istiluengatik edo , bazirudien agintariak ez zirela aurrerapausorik ematera ausartzen .	aurrerapausorik	13	Ind
Erabaki horretan haurtzaindegiko zuzendariak emandako iritziak garrantzirik izan zuelako ustez , bahitzaileek mendekuz jokatu nahi izan du beharbada .	haurtzaindegiko	2	Def
Orain duzu , gaiarekin hasi aurretik , eta dakizuna kontuan hartuta , zure iritzia azaltzeko momentua , disoluzioak izango baitira ikergai atal honetan .	ikergai	20	Ind
nire agindutara hago , eta hi ere joan egingo haiz !	agindutara	1	Ind
Indar Gorri taldea ez zegoen bilera hartan , Abel Diaz taldeko bozeramaileetako batek aitortu zuenez inoiz ez direlako saiatu taldea peña bezala eratzeko beharrezkoak diren agiriak lortzen .	bozeramaileetako	11	Def
LIGA Txapelketa hasi denetik laugarren jardunaldia jokatuko da gaur eta Realak oraindik ez du partidurik irabazi .	partidurik	14	Ind
Bilduma honetan 324.000 izarren posizio eta distira jaso zituen .	izarren	3	Ind
Orduan Francine gizonaren begietaz arduratu zen .	gizonaren	2	Def
Horri esker iraungo du hango harrobiak , eta selekzioaren etorkizuna ziurtaturik dago .	harrobiak	5	Def
Yong-Koori zientzietako esperimentuak eta matematika gustatzen zaizkio gehienbat .	esperimentuak	2	Def
Ekaitza mendi aldera baztertu zen eta haizea jotzen hasi zen .	haizea	6	Def
Txalotuena , beste behin , Retegi maisua izan zen .	maisua	6	Def
Abuztuaren 1ean atxilotu zituzten Montenegron , Kosovotik sartu berri ziren bi britainiar eta bi kanadiar .	kanadiar	14	Ind
Xabier Etxanizek , lan horietako batean , " Igarkizunak " deitzen den liburuan , euskarazko igarkizunak eta beste hizkuntza batzuetakoak ere erakusten dizkigu .	Igarkizunak	8	Def
Fisikoki ondo nago , baina batez ere psikologikoki nago ondo , ideiak oso argi ditut .	ideiak	11	Def
Ez duk egiazki jokatzeko gutiziarik holako batekin ?	gutiziarik	4	Ind
Nagusiki ikuskizun handiak eta talde profesionalak EASen sartuta , antzerkiaren hainbat eremuk txartelik gabe jarraitzen dute .	eremuk	11	Ind
Aireratu eta handik denbora laburrera irrati bidezko kontaktua galdu zuen kontroleko arduradunekin , atzo funtzionarioek berek jakitera eman zutenez .	kontroleko	10	Def
Loiartek 15:01 behar izan zituen bost enborrak ebakitzeko ( bi kanaerdiko , bi 60 ontzako eta oinbiko bat ) .	enborrak	6	Def
Lurrazala lantzen dutenak dira eta lehen aipatutako uraren zikloarekin zuzenean erlazionaturik daude :	uraren	7	Def
Gaur , ikertzaile ospetsuek kurtsoak eskainiko dituzte , eta hiru mintzaldi iraganen dira .	kurtsoak	4	Def
Maurice Greenek ( 100 m. ) , Hicham El Guerroujek ( 1.500m ) , Trine Solberg-Hattestadek ( xabalina ) eta Tatiana Kotovak ( luzera jauzia ) gaur dute Berlinen Diversekin dirusaria banatzeko euren azken aukera .	1.500m	11	Ind
" Nik ez dut zapatarik " .	zapatarik	4	Ind
Bi kuartel militar eta hiru begiratoki itxiko ditu Erresuma Batuko Gobernuak .	begiratoki	5	Ind
Rositari gehien gustatzen zaizkion animaliak Australiako mendebaldeko pinguinoak eta fokak dira .	fokak	9	Def
Area barrutik egin zuen jaurtiketa harmailetara joan zen .	harmailetara	5	Def
Oso gazte hasi ginen intsumisoan , eta atxiloketak ezagutu ditugu , eta desobedientzia soberanistan ere atxiloketak eta epaiketak izan zitezkeela uste genuen .	epaiketak	17	Def
Lau holandar atxilotu dituzte , Milosevic hil nahi izateaz akusatuta .	holandar	1	Ind
Uberako atzelariak , ordea , partidu borobila jokatu zuen , eta Goñiren laguntzarekin , markagailuak itzuliko berri bat izan zuen ( 20-18 ) .	markagailuak	14	Def
ABERTZALEEN arteko elkarlanaren garrantziak eta Estatuaren aldetik etor daitezkeen erasoaldiak nabarmendu zituen Joseba Egibar EAJko bozeramaileak atzo iluntzean bere jaioterrian , Andoainen eginiko ekitaldi politikoan .	elkarlanaren	2	Def
Ez zuten atzeko koadroetatik inoiz barkatu , eta bakoitzak bere aukerak bikain profitatu zituen .	aukerak	10	Def
Etorkinentzako programa berezirik ez badago ere , Estatu espainoleko hezkuntza-sistema nolakoa den eta titulazioak nola lor daitezkeen azalduko dugu , heziketa gizarteratzeko modu garrantzitsua da eta .	heziketa	20	Def
Hotz dun kanpoan .	Hotz	0	Ind
Azken atal honetan , zuzendaritza karguak berriztatzeko prozesua azpimarratu du , kongresuko berrikuntza nabarmenetako bat emakumezkoak nahiz gazteak sindikatuko goreneko egituretan sartzea izango baita .	kongresuko	11	Def
" Fitxaketen inguruan gorabeherak izan dira , eta nahastu samartuta ibili dira turkiarrekin " .	gorabeherak	3	Def
Nola sentitu zinen estadiora sartuta 100.000 pertsonak txalotu zintuztenean ?	pertsonak	6	Ind
Hegoaldean iduri zait euskararen mundu hau adi-adi dagola , Euskaltzaindiak zer erranen duen zain , haren arauen berehala betetzeko .	arauen	16	Ind
- PNP transistorea da eta 4 terminala masari konektatzen badiougu , gailuaren funtzionamendua eragotzita geratzen da , irteerako tentsioa 0 V izaten delarik .	gailuaren	11	Def
Orain profesionalak dira eta dena ondo neurtuta dago , tamalez edo zorionez .	profesionalak	1	Def
Liburua zabaldu eta orriak pasa zituen Salahadinek .	Liburua	0	Def
Aipatu horrek guztiak ordea , badu kontrako argudiotik ere , zitarik garrantzitsuenetan Ekimov ez baita onenen pare ibili inoiz .	zitarik	10	Ind
Ibilbidean Egues , Ultzama , Elortz , Xulapain , Arakil eta Salado ibaien urak hartzen ditu ; 149 km .	Ibilbidean	0	Def
" Tiroketaren arrazoia edozein dela ere , horrelakoak gertatzea ahalmentzen duten egoerak konpondu behar ditugu , gehiago gerta ez dadin " .	Tiroketaren	1	Def
Euroaren eremuko burtsak ez ziren , baina , kikildu .	eremuko	1	Def
Oraingoan erreaktoreko ontzi barnean dagoen kupeltxo bat aldatuko dute , zartatuta baitago .	erreaktoreko	1	Def
- Logelako atea giltzaz itxita dago beti .	giltzaz	3	Ind
Jaurlaritzako eledunak esan zuen ez duela " ulertzen " Aznarren jokabidea , gizarteak alderdiei batuta egoteko eskatzen dietenean , Aznar tirabirak sortu eta polemika " bilatzen ari delako " .	jokabidea	10	Def
GUARDIA ZIBILAK agiririk gabeko 75 magrebiar atzeman zituen atzo Cadizen , Espainia hegoaldean .	magrebiar	5	Ind
Alabaina , hegoaldeko eta mendebaldeko portadak gotikoak badira ere , elementu apaingarri gehienak platereskoak dira , hala nola , korua , aldare nagusiko erretaula eta ezkerraldeko hilobia .	erretaula	23	Def
Titular izan gabe ere partidu asko jokatuko ditu .	Titular	0	Ind
Bestalde , erraz bereiz daitezkeen osagaiak dituzten sistema heterogeneoak ere ezagutuko dituzu :	osagaiak	5	Def
Garraio ministroak berak , hondoraketa tokiaren gainetik helikopteroz ibili ostean , ikusi ahal izan zuenez , 700 metroko luzera eta 10 metroko zabalera zaukan kutsadura aztarna bat ageri zen itsas gainean .	zabalera	22	Ind
Barruan dituzte 100.000 metro karratu hormigoi , 12.000 tona altzairu eta 600.000 metro kable .	kable	13	Ind
Bestalde , bi aktoreek Pere Planella zuzendariaren lana azpimarratu zuten , esperientzia handiko gizona baita antzerkigintzan .	antzerkigintzan	15	Def
Sasoiko dago goizuetarra .	goizuetarra	2	Def
Klaustrokideek ordubeteko epea izan zuten bozkatzeko .	Klaustrokideek	0	Def
Aierbek , ordea , 60 ontzako bi enborretako epaiak itxi egin zituen , segundo asko galdu zuen .	enborretako	7	Ind
Bertsolariak soinuaren abiada baino azkarrago kantatzen duenean .	soinuaren	1	Def
Gobernuaren bake politika defenditu zuen Barakek saio horretan , eta ukatu egin zuen Israelgo segurtasuna kolokan jarriko duela palestinarrekiko akordioak .	akordioak	19	Def
- Bildutako diruarekin , Afganistanerako hegazkin-txartela erosi zitzaion Pepitari .	diruarekin	2	Def
Esate baterako , zazpi antzerki-taldek bederatzi emanaldi egingo dituzte .	antzerki-taldek	4	Ind
EHNEk Hego Euskal Herrian eta COAGek Espainian ( Nekazari eta Ganaduzaleen Koordinadora ) mobilizazioekin jarraituko duten ala ez gaur erabakiko dute nekazaritza gasolioaren beherapena eskatzeko .	beherapena	23	Def
Abertzaletasun horrek , bestalde , eta industrializazioak erakarritako inmigrante multzo ikaragarriaren eraginez , kutsu xenofobo nabarmena hartu zuen gerraosteko urte haietan eta honen guztionen oihartzuna bete-betekoa izan zen hizkuntzaren esparruan ere .	gerraosteko	18	Def
Volgograd hirian ( Errusia ) , txetxeniarren Xakhid komandoak zuhaitz bati itsatsitako bonba bat leherrarazi zuen konboi militar bat igarotzen ari zela .	txetxeniarren	6	Def
Bigarren zatira arte ez zuten jokatzeko aukerarik izan .	aukerarik	6	Ind
Peter Robinson DUPeko bigarren buruak eta Eskualde Garapenerako ministroak astearte gauean jakinarazi zuenez , bere taldeak mozio bat aurkeztuko du Ipar Irlandako Asanblean Sinn Fein Gobernutik kanporatzeko .	Asanblean	22	Def
Ezkerreko oposizioak , orohar , bere posizioak mantendu ditu 6 Estatu federatutako hiri nagusietan .	Ezkerreko	0	Def
Ondorio gisa atera daiteke egin nahi den bereizketak Debako udalerria oso lurralde txikiarekin utziko lukeela eta , hortaz , ez lukeela inolako aukerarik izango auzo komunitate beregain gisa bizitzeko .	aukerarik	22	Ind
Iaz Alavesen ez zegoen arren , oso ondo daki halaber , Athletic mendean hartzeko irrikaz daudela bere taldekideak .	irrikaz	14	Ind
Zenbait igelek , esate baterako , beren gorputza puztu egiten dute direna baino haundiagoak direla erakutsiz .	igelek	1	Ind
" Eskolako artisautza ikastorduetan buztinezko bi te-ontzi hauek egin ditut " .	ikastorduetan	3	Def
Guzti honengatik , gaur egun , gure soinutresna autoktonoak berreskuratzeko bi betebehar azaltzen zaizkigu .	betebehar	11	Ind
Azken sei egunetan beste bi herritar hil dira Belfasten , paramilitarren arteko erasoen eraginez .	erasoen	12	Def
Fiskaltzak , Gobernuak eta Inmigrazio Zerbitzuak erabaki zuten haurrak aitarekin itzuli behar zuela .	aitarekin	9	Def
Altxueta ( 1.343 m ) , Putxerri ( 1.296 m. ) edo Irumugarrieta ( 1.427 m ) mendietara igo daiteke .	mendietara	17	Def
Pirlo 21 urtez azpiko selekzioko jokalaririk erabakigarriena izan arren , ez du lekurik aurkitu talde nagusian , baina litekeena da datorren denboraldian hura izatea Interreko joko antolatzailea .	antolatzailea	26	Def
mundua ikusteko , sentitzeko eta ulertzeko era , norberaren hizkuntzaren kategoriek baldintzatzen dute .	kategoriek	10	Def
Eta siluetak galdu nituen nik begitatik .	begitatik	5	Ind
Odolaren urdinagatik , itxitura baten barnean babesten den jende-multzoa .	Odolaren	0	Def
Naturarekin harremanetan , 630 mtako altueran dago , han eta hemen Ullibarriko urtegira doazen errekatxoek zeharkatzen dutela .	mtako	4	Ind
Don King saiatuko da EEBBetara eramaten , baina Savon ongi bizi da Kuban , eta ez lioke iraultzari halakorik egingo .	iraultzari	17	Ind
" Nahiago izaten dut kanpoan jolastea " .	Nahiago	1	Ind
" Defentsa eskubidea ere ukatua " dela salatu zuten hainbat ordezkarik .	ordezkarik	10	Ind
Ataka zaila antzematen da euskal politikagintzan mendearen amaieran .	mendearen	6	Def
Errioxarraren tokian Asier Olaizola ariko da , eta Oscar Lasa hartu du bikote .	Errioxarraren	0	Def
Eraso larriena da , joan den astean suetena indarrean jarri zuenetik Hizbul Mujahideen gerrillak .	gerrillak	13	Def
Haien iduriko , ideia berrien bila hasteak " bake planaren eta konponbidearen heriotza " lekarke , eta atzera egite hori ez dute onartzen .	iduriko	1	Ind
Proiektuok egungo mahastien azpiegitura eta kalitatea hobetzean oinarrituko dira .	Proiektuok	0	Def
Ondo sentitzen nintzen han , nire amaren ohean , kandelaz eta beraren argarkiz inguratuta .	argarkiz	12	Ind
Trikitixako aire tradizionalei azkenaldi honetakoak gehitu dizkie , hala nola kunbia eta ska .	honetakoak	4	Def
Ihesaren jatorria aurkitu ondoren , zentraleko larrialdi taldeak erreaktorea hozteari ekin zion , gehiegizko berotzeak sortutako kalteak neurtzeko .	Ihesaren	0	Def
Asteartean lurra jo zuen hegazkina Errusian egina zen , Angolavia konpainiarena , eta Angolan bertan zen hegaldia egitekoa .	konpainiarena	10	Def
Gero , tiro-praktika haien ondoren , garai haietan pititoarekin egindako ia gauza guztiak bekatu zirenez , bere parrokiako apaizarengana joango zen , konfesatzera :	bekatu	13	Ind
Nizan hitzarmenik egitea lortuko balitz , agiria ez litzateke barruan sartuko .	agiria	6	Def
Goiko solairuan irratia jarrita zegoen .	irratia	2	Def
Oporretatik bueltan , Bilbokoak Lezaman zuzendu zuen lehen entrenamenduan bere asmoak argi eta garbi utzi zituen :	Oporretatik	0	Def
Gaztea zirudien , baina bizian egin beharrekoak jadanik eginda bailituen mintzo zen .	mintzo	10	Ind
Sobiet Batasunean perestroika-rekin hasi zenak eta Hungarian eta Polonian segida izan zuenak , itxuran bederen ez zuen ondoriorik izan AEDn .	ondoriorik	17	Ind
Odolaren urdinagatik , itxitura baten barnean babesten den jende-multzoa .	urdinagatik	1	Def
Atutxa jaunarena duzu argazki hau .	jaunarena	1	Def
Inork ez du eskubiderik bozan indargabetzeko eta eskualdean inori ez zaio otu ere egin " .	eskubiderik	3	Ind
EUROAK azken egunetako susperraldiari eutsi eta igoera nabarmena izan zuen atzo , 0,86 dolarren ingurura iritsi arte .	EUROAK	0	Def
CD-ROMetan informazio gehiegi atzigarri dagoenez ikasleak galduta aurki lezake bere burua .	CD-ROMetan	0	Def
Kilometro askotako erradioan dagoen guztia suntsitzen du bonba horrek , eta argitasunak , 30 kilometrora dagoen jendea itsutatzen du .	erradioan	2	Def
Elisabeth Gigou Lan ministroak azaldu zuenez 1997an Jospin gobernuburu izendatu zutenetik ia milioi bat lagunetan jaitsi da langabezia .	gobernuburu	8	Ind
PSOEk gai honetan ez du beste aukerarik :	aukerarik	6	Ind
Horrela , bada , patriarkatuak gizonen arteko dependentzia eta elkartasunezko lokarriak eratzen ditu , emakumeak menderatzeko bidea ematen dienak .	elkartasunezko	9	Ind
Israelgo Legebiltzarreko jatorri arabiarreko hamabi diputatuetako bat zara .	diputatuetako	5	Def
Besterik ez dugu egin , eta 1.000 lagunek esaten dute hori bera egin dutela .	lagunek	7	Ind
Fosilak deritze ( latinezko hitzetik eratorritako hitza da , eta lurretik ateratakoa esan nahi du ) .	lurretik	10	Def
Napoliko erregeordea zen Lemosko kondearen idazkari izan zen eta , bere anaia Bartolomek esaten duenez , erre egin zituen bere poemak hiri hartan .	erregeordea	1	Def
Soinutresna zaharren errepertorioaren eta soinu berri honen errekurtso handiagoaren elkartasun edo nahasketatik musika estilo berri eta berezkoa sortu zen euskal herri musika barruan .	nahasketatik	11	Def
Prentsa aipamenek zioten , azkenean , haurraren amaren ahalegin tematsuei esker , dozena bat lekukok testigantza ematea onartu egin zutela eta gisa horretan zuela Dresdeneko Fiskaltzak ikerketa baten irekitzea erabaki .	lekukok	14	Ind
Jon Eizagirrek , sakean maisua dela erakutsiz , 14 tanto egin zituen , eta beste hainbat tanto hasieratik dominatu zituen jokaldi zital horri esker .	maisua	4	Def
Mendiko bizikletako Mundialak gaur hasiko dira .	bizikletako	1	Def
Frantziako lur bideetako rallyen proba nagusia bihurtu den Gailurretako Rallyaren faborito nagusiak izango dira aurten ere pilotu zuberotarrak .	Rallyaren	9	Def
Balmasedakoa oso zuhur azaldu zen bertan Realaren inguruko iritziak ematerako orduan .	Balmasedakoa	0	Def
Sarea eratua da , baina arrantzan frogatu beharra dago .	Sarea	0	Def
Kosovoko hauteskundeez Chiracek uste du beharrezkoak zirela albaniar moderatuek botereari heltzea ; Putinek goizegi izan zirela .	hauteskundeez	1	Def
Galtzagorri sartuaz batera , beste galtzagorri asko atera ziren kaxetatik , Galtzagorriri musu ematera .	kaxetatik	9	Def
Frantziako politika gizonik ezagutuenetakoa da .	gizonik	2	Ind
Jeneralak alderdiari gai arrazialen inguruan duen ikuspuntua zabaltzeko eskatu zion , eta gogor kritikatu zituen diskriminazio positiboaren aurka agertu diren errepublikanoak , diskriminazio horrek " milaka haur beltzek hezkuntzarako aukera izaten lagundu baitu " .	hezkuntzarako	28	Def
Alkatetza utzi .	Alkatetza	0	Ind
" Nork hitzegiten duen hemen frantsesez ?	frantsesez	5	Ind
Realaren aukera garbiena berriz , hamabostgarren minutuan iritsi zen , Delfi Geli bere atean gola egitekotan izan baitzen baloi luze bat urruntzen ahalegindu zenean .	Geli	11	Ind
Gauzak ondo egiten badira joateko aukerarik izango da , eta ondo egin , eta , hala eta guztiz ere joaten ez bagara , ez da ezer gertatuko .	aukerarik	5	Ind
Gaztelaniazko frogaren normalizazioari dagokionean ere , erantzun zuzenen portzentaia oso handia dela ikus daiteke .	Gaztelaniazko	0	Ind
Ez du arerio erraza gaurkoa bere nahiak asetzeko .	nahiak	6	Def
" Miarritzek oso aitzin-multzo ona du , eta gibelean ere ondo dakite errugbian egiten .	gibelean	8	Def
Eta elikatze-bonbek itzultzen dute ontzira lehenagotik berotako ur hori .	elikatze-bonbek	1	Def
Anaiak hamasei seme-alaba ditu .	seme-alaba	2	Ind
Testuak dio Aznarrek maiz esan duela ez dagoela arazo politikorik ; eta EHren iritzia Joseba Permachen ahotan jaso du .	ahotan	16	Ind
Michael Zijlaard entrenatzaileak ( senarra gaur egun ) , ordea , txirrindularitza baino gauza garrantzitsuagoak badirela esan zion , eta geroztik garaipenen sekretua hori duela dio .	txirrindularitza	11	Ind
Partiduei ematen dien erritmoarekin gozatzen dugu Titinekin .	erritmoarekin	3	Def
GREENPEACE talde ekologista Erandioko ( Bizkaia ) Sakoni ibarrean hiri hondakin solidoen tratamendurako eraiki nahi dituzten errausteko bi planten aurka agertu zen atzo , " errauspena hondakinak tratatzeko metodorik garestiena eta ingurugiroarentzat kaltegarriena " delako .	hondakinak	26	Def
Tajinearen osagaiak haragia edo arraina eta barazkiak dira eta izena , prestatzeko erabiltzen den ontzitik datorkio .	ontzitik	14	Def
Helikopteroa garaiz aireratu zen berriro Islamabaderainoko tartea osatzeko , baina gidariak lur hartzea erabaki zuen Gilgit hirian , eguraldi txarraren eraginez .	eraginez	20	Ind
Bakea sinatu arren , ordea , Etiopiak kontrolpean izango ditu iparraldeko frontean berreskuratu dituen lurraldeak eta Zalambessa hiria .	Bakea	0	Def
Liberalek bost aulki dituzte eta bana Aliantza Demokratikoak eta Albaniarren Alderdiak .	Liberalek	0	Def
EPOa igartzen duen test berria atzo aurkeztu zioten zientzialari australiarrek NBOri .	EPOa	0	Def
Orduan itzali zitzaion itxaropena , eta bizipoza galdu zuen .	bizipoza	6	Def
Partidu Popularreko parlamentarioaren aburuz , " ez da normala ETB Espainiako Erregearen Gabonetako mezua eskaintzen ez duen Espainiako telebista bakarra izatea .	Erregearen	11	Def
Medikuek garbi ikusitu zuten apendizitis izan zitekeela , eta Basurtuko ospitalera eramatea erabaki zuten gauerdi aldera .	apendizitis	4	Ind
Londresen 1908an jokaturiko maratoian Pietri italiarra arrastaka iritsi zen estadiora , konortea erdi galduta .	maratoian	3	Def
Amak Kim Min-Sook du izena eta etxeaz arduratzeaz gain , ezpain-margoak gordetzeko kutxak egin eta saltzen ditu .	Amak	0	Def
Sarri hurbiltzen zen " haren " landarera , Andreasen presentzia somatzen zuen , bizitzaz blaituriko haren pentsamenduak sentitzen zituen .	pentsamenduak	16	Def
Biolentziari aurre egiteko , alderdien batasunak " sendoa " behar du izan .	Biolentziari	0	Def
Halaike , espero txuri urdinen zangoetan oraino beste gol batzuk gelditzen direla , Espainiako Liga ez baita oraindik hasia .	Halaike	0	Ind
