Orain geltokian , leher-leher eginda , gehien maitatu izan dituen pertsonak izotzezko estatua bihurtu zaizkiola pentsatu du , azken egunotan erraietan sufritutako hotza berriz ere sentituz .	erraietan	20	Def
Bitartean , Kakotx , nire xakurtxoa ferekatzen dut eta bere askaria ematen diot .	Kakotx	2	Ind
Iragan urrian 90.000 afiliatuen kopurua gaindituta , datozen lau urteetarako 100.000ra heltzeko helburua finkatuko du Kongresuak .	urteetarako	9	Ind
Amezketarra kexu azaldu da , antolatzaileek ez baitiote partidua astebete atzeratzeko aukerarik eman .	aukerarik	11	Ind
John emaztegaiarekin zegoen eta bikoteari ezinegona igertzen zitzaion .	bikoteari	4	Def
Horixe da EZLNk hauteskundeei buruz egindako gogoetaren abiaburua .	gogoetaren	6	Ind
Chevenement kasuari konponbide bat eman beharko dio irailerako Jospinek .	irailerako	7	Ind
Arteszena Gipuzkoako Teatro Publikoak Klaus Mann-ek idatzi eta Ariane Mnouchkinek moldatutako Mephisto antzezlanaren lau emanaldi eskainiko ditu , bai erdaraz zein euskaraz , bihar eta etzi Iruñeko Gaiarre Antzokian .	erdaraz	19	Ind
" Frogatu nahi dugu arrakasta ez dela kasualitate izan " .	kasualitate	7	Ind
Beharbada , barnean zebilzkion oraindik emakume-belaunaldi zaharren mamuak !	mamuak	7	Def
Atezaina lasai-lasai Suediako ligan jokatzen ari zen bitartean , bere izena etengabe dantzan ibili da komunikabideetan .	Atezaina	0	Def
Argiaren hedapena nolakoa den aztertzea izango da jarduera honen helburu nagusia .	Argiaren	0	Def
Atzealdeko lanaren sendotasunean oinarrituta geratu zen Alaves Txapeldunen Liga jokatzeko zorian .	Atzealdeko	0	Def
Marokoko etxe gehienetako horma eta zoruak honen antzeko azulejoz apainduta egoten dira .	azulejoz	8	Ind
Hala , Munteanu , Mihalcea edo Mara bezalako jokalari gazteek arazo asko sortu zizkieten Alaveseko atzelariei , behin eta berriz hegaletatik arrisku handiarekin sartuz .	atzelariei	15	Def
Greziarrentzat garrantzia handia izan zuen garaipenak , zortzi urte lehenago , Atlanta izendatu zutenean , Atenas zelako faboritoa , eta porrot hark Olinpiar Jokoen mendeurrenean gainera min handia egin zien .	Greziarrentzat	0	Def
Jaialdia arratsaldeko 18:00etan hasiko da .	Jaialdia	0	Def
Bigarren irten zen iazko edizioaren irabazle eta aurtengoaren faborito handia den Patrice Couillet urdiñarbetarra , 3 segundora .	aurtengoaren	7	Def
Ondorioz , Kubako federazioek kirolariak esportatu dituzte beste herrialdeetara .	federazioek	3	Def
- Foru Dekretu honen arabera osagarriaren esleipena hartzen duten lanpostuen titularrek , lanpostu horiei asimilatutako atal edo bulego edo unitateko burutzaren batean ari badira , osagarri hori jasoko dute burutzari dagokionaz gainera .	burutzaren	20	Ind
LAU egun iraungo du konbentzioak , eta EEBBetako errepublikanoak euforiko eta konfiantzaz beteta agertu dira azaroan lehendakaria aukeratzeko egingo diren hauteskundeak irabazteko dituzten aukerekin .	konfiantzaz	11	Ind
Jaurlaritzako eledunak esan zuen ez duela " ulertzen " Aznarren jokabidea , gizarteak alderdiei batuta egoteko eskatzen dietenean , Aznar tirabirak sortu eta polemika " bilatzen ari delako " .	gizarteak	12	Def
Gainera , 2.000. urtean sartu diren diru partidak - dela Europatik lortutakoak , Diputazioen apartazioak edo tesoreriako soberakinak - datorren urteko aurrekontuari gehituko zaio .	tesoreriako	16	Def
Bestetik , datak ez du atzerapenik , eta hartzera behartuta zaude .	atzerapenik	5	Ind
Goizean Errioxakoak atseden hartu zuen , eta , gauzak ondo badoaz , hurrengo egunetan normaltasunez arituko da .	normaltasunez	14	Ind
Barrualderago jo zuten hauek , propio arditara etorrita .	Barrualderago	0	Def
Teknika hau landareek ere erabili dute ( esate baterako oteak ) .	landareek	2	Def
Burua ere badudala erakutsiko diot munduari , ez dut modu horretan nire gorputza lagatuko , ahantziko .	Burua	0	Def
GUTXIENEZ 20 lagun haien artean legebiltzarkide bat hil ziren atzo Sri Lankako Muttur hirian SLMC alderdi musulmanaren mitin batean eztanda egin zuen bonba baten ondorioz .	eztanda	19	Ind
" Ez da mesederik onartuko sexua , gizarte-maila , klasea edo erlijioa dela eta .	sexua	5	Def
Bahimendu ekonomikoa da , hain zuzen , mendebaldeko herrialdeek beren esku duten tresnarik eraginkorrenetakoa Milosevicen aurka .	eraginkorrenetakoa	13	Def
( Euskaraz da Laxalten " A Cup ot Tea in Pamplona " , edo ' Kafea hartzea Iruñean ' ere ( Elkar , 1986 ) , itzultzaile beraren lumatik ) .	lumatik	28	Def
1998an ustelkeria kasuak agertzen hasi ziren .	kasuak	2	Def
Auziaz bozketa ere egin zuten , bilkuraren ondoren magistratuetako batzuek kazetariei adierazi zienez .	magistratuetako	8	Def
Txuri-urdiñek ere ez zituzten gol aukera gehiegi izan baina Igor Jauregik bigarren zatian sartutako gol batek urrezko hiru puntu eman zizkien .	Txuri-urdiñek	0	Ind
Shawn Kemp eta Dale Davis saskipeko jokalari gihartsuak fitxatu dituzte eta Brian Grant pibota joan da .	saskipeko	5	Def
Jadanik egun Bundestagen jorratzen diren legeen %60k dute « jatorria » Bruselan .	jatorria	9	Def
Lindrothek ez zuen erreparorik jarri .	erreparorik	3	Ind
Abenduaren 12rako aurkeztu behar dituzte ofizialki Estatu Batuetako presidentea aukeratuko duten hauteskunde ordezkariak .	Abenduaren	0	Def
Singapore Airlines konpainiak seguruenetakoa laguntzak iragarri ditu istripuan kaltetuentzat .	istripuan	7	Def
Ez dira ezkondu beren amentsen zoko batean irudimenezko gizon idealisatu bat gordetzen baita .	irudimenezko	7	Ind
Atzo arte 12 bat gorpu atera ziren .	gorpu	4	Ind
Arazoa batena denean , denona da .	batena	1	Def
Errefuxiatuak izatea errazten duten nazioarteko politika ekonomikoak zuzentzearen beharra azpimarratu du .	Errefuxiatuak	0	Def
( nigarrez hasten da , bestea heldu zaio kontsolatzera ) .	nigarrez	1	Ind
Errepidean , bi probetan jaun eta jabe izan zen , eta pistan urrea irabazi zuen jazarpen proban eta zilarra puntuaketan .	probetan	3	Def
Legution eztanda egindako lehergailua ETAk Bretainian lapurtutako dinamitaz osatuta zegoen .	eztanda	1	Ind
" Ez da mesederik onartuko sexua , gizarte-maila , klasea edo erlijioa dela eta .	mesederik	3	Ind
JEAN MESQUITA jui-jitsuko borrokalaria hil egin da , lehia batean , Rio de Janeiron ( Brasil ) .	jui-jitsuko	2	Def
Prentsa aipamenek zioten , azkenean , haurraren amaren ahalegin tematsuei esker , dozena bat lekukok testigantza ematea onartu egin zutela eta gisa horretan zuela Dresdeneko Fiskaltzak ikerketa baten irekitzea erabaki .	Fiskaltzak	25	Def
Esprintean ermuarra izan zen azkarrena .	Esprintean	0	Def
Arrantzaleak ez dauka medikurik itsasontzian .	Arrantzaleak	0	Def
Korritu diren sei etapetatik lau , 24 urteko txirrindulariek irabazi dituzte :	etapetatik	3	Def
- Landarea tenperatura hotzetan ez eduki .	Landarea	1	Def
Nahi bazuen , berehala joatea zeukan .	Nahi	0	Ind
Malagako erlojupekoaren ostean haren motibazio eza izan zen eztabaidagai .	eztabaidagai	8	Ind
ALBERTO IÑURRATEGI lagun eta senidez inguratuta dago , azkenean .	senidez	4	Ind
" Oso pozik " azaldu da Llorente luzapenarekin , batez ere beste kontu batzuek lehentasuna izan dutelako Luis Urangaren zuzendaritzan , eta bere kontratuaren berritzea baztertu samartua utzi zelako :	kontratuaren	23	Def
Kanpoarekiko inkomunikazioa izan da nagusi .	Kanpoarekiko	0	Def
Haiti mendebaldeko hemisferioko herrialderik pobreena da , eta ustelkeria da nagusi bertan .	herrialderik	3	Ind
Neskalaguna eta Karakorumera trekkinga antolatu duen Banoa bidai agentziako Jon Lazkano eta Mikel Eseri ordezkariak zituen zain mendizaleak .	trekkinga	3	Def
Bizitza da ibai bat , lardaskatuta eta kutsatuta egon arren , ilusio eta amets emaria daraman bitartean , zentzuren bat duena eta inoiz lehortzen ez dena .	zentzuren	18	Ind
Bergarako atzelaria oinazpiko minez ibili da , eta azken lansaioak harmailetatik ikusi behar izan zituen .	lansaioak	9	Def
Michael Zijlaard entrenatzaileak ( senarra gaur egun ) , ordea , txirrindularitza baino gauza garrantzitsuagoak badirela esan zion , eta geroztik garaipenen sekretua hori duela dio .	senarra	4	Def
Garbi zegoen , halaber , ahalegin oso berezia eginez eta adore handiz , lortu zitekeela hagatxotik leihora sartzea .	hagatxotik	15	Def
Gainera , Irakeko Gobernuak bere petrolio esportazioak eurotan kobratzea erabaki izana ere mesedegarri suertatu da Europako diruarentzat .	diruarentzat	16	Def
Txirula aukeratu .	Txirula	0	Def
Babesa justifikatzeko " ardura eta leialtasuna " azpimarratu zituen Javier Barrero PSOEko ordezkariak .	Babesa	0	Def
- Bildutako diruarekin , Afganistanerako hegazkin-txartela erosi zitzaion Pepitari .	hegazkin-txartela	5	Def
Gaurdaino behintzat alderdi publikoa izan da nagusi historigileentzat , eta horregatik gogorarazi behar da Euskal Zuzenbidearen alderdi pribatuaren garrantzia , bigarren mailara gaitzetsi gabe .	mailara	21	Def
Herri batzuetan eliza berak , bere zerbitzurako izan ditu bere jabegoko diren halako karrakak .	zerbitzurako	6	Ind
JEAN MESQUITA jui-jitsuko borrokalaria hil egin da , lehia batean , Rio de Janeiron ( Brasil ) .	borrokalaria	3	Def
Lurraren barnealdetik sortutako indarrei zor zaizkienak dira , eta beste atal batean landuko ditugu .	zor	4	Ind
Jada 19.000 lagunek azaldu dute eskaera egiteko nahia .	nahia	7	Def
Zama horiek gainerako senideen seniparteak dira ( etxean geratzen denak eman beharrekoak ) .	senideen	3	Def
1923. urtean , Mustafa Kamal Ataturk Turkiako agintari nagusiak antzeko basakeriekin jarraitu zuen armeniarren kontra , eta , ororen buru , estimatzen da 1.500.000 armeniar hil direla jasandako genozidioan .	genozidioan	28	Def
Aznarren eta PPko kide baten kontrako pintadak egin dira Amurrion .	pintadak	6	Def
Liberalek bost aulki dituzte eta bana Aliantza Demokratikoak eta Albaniarren Alderdiak .	aulki	2	Ind
Medikuarekin daukagun tratua ez dela berdina denontzat .	tratua	2	Def
Bi atleta handirentzat agur ederra izan zen 4x100eko finala .	4x100eko	7	Def
Oñati Gipuzkoako Hermandadean 1845. urtean sartu zen27 .	Hermandadean	2	Def
Haren osasuna aztertu dute , eta estupefazienteen aurkako errehabilitazioa zein klinikatan egin erabakiko dute .	klinikatan	10	Ind
Geroztik , pozak eta urduritasunak eraginda , igoera behin eta berriro errepasatzen ibili da , " loa galerazteraino " .	loa	16	Def
Bestalde , " herri palestinarrari laguntza tekniko eta ekonomikoa ematen jarraitzeko eta Estatu baketsu eta demokratiko baten ordezkari diren erakunde palestinarrak indartzeko lanean jarraitzeko konpromisoa " baieztatu zuen EBk .	konpromisoa	24	Def
Hitzaurreko neska atzeratua hamasei edo hogei urteko neskatila oso polit bihurtu da .	Hitzaurreko	0	Def
Berak idatzi zuen Schindlerren untzia eleberria , gerora Schindlerren zerrenda izenburuarekin zinemara egokitu zena .	izenburuarekin	10	Def
JAIME MAYOR OREJA Espainiako Barne ministroak adierazi du alderdi abertzaleak ETAren biolentziaz " aprobetxatzen " ari direla .	biolentziaz	11	Def
Mattin eta Xalbadorren denboran , Batuari buruz urrats eta pauso handiak egin zituzten elgarri buruz joanez ipar eta hegoaldekoek .	hegoaldekoek	18	Def
Orain urte batzuk pin-pinke deitzen zitzaion jolas horri .	pin-pinke	3	Ind
Delitu mota horregatik zenbait urtetako espetxe zigorra ere aurreikusten du zigor kodeak .	urtetako	4	Ind
Gaur , ikertzaile ospetsuek kurtsoak eskainiko dituzte , eta hiru mintzaldi iraganen dira .	mintzaldi	10	Ind
" Valdemingomezko errausteko planta jarri dutenetik tona bakoitzeko kostua 5.000 pezetakoa da eta honek eragina izango du auzokideen poltsikoetan " .	planta	3	Def
Jan Kirsipuu * Larre motzean ohitutako gizona da , eta joan den denboraldia arte ez zen esprinter handien artean aintzat hartzen , baina Tourreko lehen etapa irabazteak ireki zion atea .	atea	29	Def
Ezustea izan zen , Peres prestigioko politikoa baita Israelen nahiz atzerrian .	atzerrian	10	Def
Mendien eraketa nolakoa den aztertzen hasi behar dugu orain , baina hori baino gogora dezagun nolakoa den Euskal Herriko erliebea .	erliebea	19	Def
IRAGAN abuztuaren 9an Gasteizen atxilotutako O.G.M. adin txikiko gaztea aske irten zen atzo , Langraizko espetxetik .	espetxetik	15	Def
Maribel Belastegi Arteszenako zuzendarietako batek atzo emandako prentsaurrekoan azpimarratu zuenez , Mephisto lana giza konpromezuzko antzerki esparruan kokatzen da .	konpromezuzko	14	Ind
Bien arteko harremana oso estua zela azpimarratu dute Montenegroko komunikabideek .	komunikabideek	9	Def
Lanaren arloan , ELAk negoziazio kolektiboa azpimarratuko du ekintza sindikalaren ardatz gisa .	Lanaren	0	Def
Beldurra dauka jendeak , bere irudia galtzeko beldurra .	Beldurra	0	Def
Ez zizkigun kontratuaren baldintzak zehatz-mehatz agertu , baina ongi bizitzeko moduan direla esan zigun .	kontratuaren	2	Def
Landare bakoitzaren zikloa ezagutzea oso garrantzitsua da , negua zein tenperaturatan igaro behar duen jakiteko batik bat .	negua	8	Def
Beraz , egon badago bideren bat maitasun gorenera .	bideren	4	Ind
Oso gaztea zenean euskal gizartea ikertzen hasi zen .	gizartea	4	Def
Aurrenekoz Olinpiar Jokoetan izango dena , erakusketa kirol bezala bada ere , ureko eskia izango da .	ureko	12	Def
Sobiet Batasunean perestroika-rekin hasi zenak eta Hungarian eta Polonian segida izan zuenak , itxuran bederen ez zuen ondoriorik izan AEDn .	segida	9	Def
Orduz gero , Milosevicek ezin izan du Serbiatik atera .	Orduz	0	Ind
Bizitza da ibai bat , lardaskatuta eta kutsatuta egon arren , ilusio eta amets emaria daraman bitartean , zentzuren bat duena eta inoiz lehortzen ez dena .	Bizitza	0	Ind
Gu zenbait urratsez mintzatu gara egoera baretzeko , baina gauzak aldatu egin behar dira lehenik .	urratsez	2	Ind
Chevenementek ez du entzun ere egin nahi Korsikako Lurralde Asanbleak Frantziako legeak bermoldatzeko ahala izan dezan , eta are gutxiago berak bere lege propioak egiteko eskumenik izan dezan .	eskumenik	25	Ind
Elorrietaren hitzetan , erakundeak " subiranotasunari egin liezaiokeen mesederik handiena desagertzea da " .	mesederik	8	Ind
Jada 85.100 dolar ( 8,5 milioi pezetatik gora , 340.00 liberatik gora ) eskaini dutela zioen atzo The Daily Telegraphe-k .	dolar	2	Ind
Egia da etxean arazoak ditugula defentsa sendoko taldeei aurre egiteko baina hori Bartzelonari ere gertatzen zaio .	Egia	0	Def
Ikasleen pertzeptzioan irakasleek mutilei baino tratu hobea ematen diete neskei , ez baitiete horren segido errieta edo ahakar egiten .	neskei	9	Def
Ondorioz , Txileko epaile Correa Bulok debekatu zien diktadore ohiari eta beste sei laguni herrialdetik ateratzea .	laguni	13	Ind
Hots , hizkuntza edo hizkuntz-trebetasunen euskarria den egitura neurologikoa hein batean edo bestean kalteturik edo ezindurik daukate .	hizkuntz-trebetasunen	4	Ind
Sendo gaudenok argalen ahuleriak eraman behar ditugu .	ahuleriak	3	Def
Ospitalera bidean nahiko larri joan arren , erradiografiak ikusitakoan lasaitu da .	Ospitalera	0	Def
POLIZIAK bi jeneral atxilotu ditu ustez droga sare batean jarduteagatik .	jeneral	2	Ind
Kokotean zeuzkan orain lau txima luze eta zepilo bitxia gandorrean , fijadorez orrazten zuena .	fijadorez	11	Ind
CAHAYA BAHIRI ferryko bidaiari guztiak hil dira Molukak uhartediko itsasoan izandako istripuan .	BAHIRI	1	Ind
Ate arrunt baten forma dute ( orri bakar bateko atearena , ez bikoa ) , baina beheko erdiak sareta izaten du , eskuentzat helduleku paregabea .	eskuentzat	22	Def
EHko batzarkideek , berriz , Alegriak ez zituela orriak banatu esan zuten eta ez zirela mehatxuzkoak .	orriak	8	Def
Senaturako hauteskundeetan , ordea , New York estatuan hautagairik ez aurkeztea erabaki ondoren , Hillary Clintoni botoa emateko eskaera egin die Naderren alderdiak bere jarraitzaileei , gezurra eman badezake ere .	hautagairik	8	Ind
Lagisquetek joko irekia maite du , " baina bi taldeok ditugu hainbat jokaldi kobinatu antzeko " , zioen .	taldeok	9	Def
Osasunak ez zuen tokirik galdu , baina zelai-erdian ez zuten asmatzen , eta baloia erraztasun handiz galtzen zuten .	tokirik	3	Ind
Hanka erdian du , zilindrikoa da , zenbaitetan oinaldean erraboilduna , bikortsu-ezkatatsua , txapelaren kolore berekoa edo zertxobait argiagoa , oinaldea kotoitsua eta zurixka du , zenbaitetan hexagono forma duten eta ilunagoak diren mailek estaltzen dute .	mailek	33	Def
Egileak dioenez , egungo gizakiok " gutxi entzuten dugu " , eta inguruko pertsonez " gutxi " arduratzen garela azpimarratzen du .	Egileak	0	Def
Apika nehoiz ez zatzait lotu zure barneko hedea .	hedea	7	Def
" esan zuen bere golkorako harriturik , kinka hartatik ateratzeko hain modu erraza bilatu uste zuelako .	golkorako	4	Def
Osterantzeko abokatu defendatzaileek ere antzeko iritziak eman zituzten , eta guztiek nabarmendu zuten zigortuak ez direla espiak .	defendatzaileek	2	Def
PSE-EEK uste du Jaurlaritzak " iruzur " egin diela herritarrei 2001. urterako aurrekontuak luzatuta .	iruzur	5	Ind
EAJk ez du zehaztu zein formula erabiliko duen EH Udalbiltzatik baztertzeko .	formula	5	Ind
Alemaniako selekzioa da sailkapen horretako lider , hiru titulurekin .	titulurekin	8	Ind
Zuzenketak aurkeztutako alderdiek hainbat arlotan sumatu dituzten " gabeziak " salatu zituzten :	arlotan	4	Ind
Bere iritziz , kartzelak hustu arren , arazoek bere horretan segituko dute .	iritziz	1	Ind
Aurrelari gazteak fite ahantzarazi zien Zarauzko pelotazaleei Arretxe aitzinean ez ikusteak eragindako pena .	pelotazaleei	6	Def
Haatik , 113 lagunen heriotza eragin zuen ezbeharraren nondik norakoaz argibide nahikoa dakartza dagoeneko .	heriotza	4	Def
Korrontearen balio kritiko horri mantenu-korrontea ( I ) deitzen diogu .	I	6	Def
Saltzaile ibilkariek ere erabiltzen zituzten salmenta tokira iristen zirenean ingurukoek jakin zezaten iritsiak zirela .	ingurukoek	9	Def
Gure bikiek apartamendu txikian bizi behar zuten , etxeen prezioak uxatzearren .	prezioak	9	Def
Lehen unean , CDU oposizioko alderdi kristau-demokrata oso gogor mintzatu zen aukeratutako inmigrazioaren aurka , eta bere liderretako batzuek nahiko adierazpen xenofoboak egin zituzten .	liderretako	17	Def
Donostiako aurrelariak entrenamendua normaltasunez amaitu bazuen ere , etxera heltzean buruko mina zuelako , ospitalera joatea erabaki zuen .	normaltasunez	3	Ind
Labean sar ezazu eta , tenperatura motelean , ordu betez eduki .	motelean	6	Def
Uste dut Europako Batasuna saiatzen dela zerbait egiten , baina ez die erantzuten gertaerei behar bezain sendo eta azkar .	Uste	0	Ind
Molekula hauek atomoz osatuta egoten dira eta atomoak , bere aldetik , oinarrizko partikulaz .	atomoz	2	Ind
Beraz , garbitasunak landarearen osasunerako berebiziko garrantzia du .	garbitasunak	2	Def
Herritarrak beldurtzen aritu ziren , eta UNAMET Nazio Batuetako misioaren egoitzaren bi eraikini eraso zieten , timortarrak han babestuta zeudelako .	misioaren	9	Def
Baina lasaitasuna hautsi zuen Lashkar Jihad talde musulmaneko 3.000 kideren etorrerak .	kideren	9	Ind
" Ez da mesederik onartuko sexua , gizarte-maila , klasea edo erlijioa dela eta .	gizarte-maila	7	Def
Euren desoreken barruan denek baitute ahuldaderen bat haiek dira orekatuenak , hiru astetan mailarik onena emateko dohainik onenak dituztenak , fisikoki zein psikologikoki .	dohainik	16	Ind
Garraiolarien greba ia erabatekoa izan da Hego Euskal Herrian .	Garraiolarien	0	Def
Garaieraz 1,75 metro inguru kalkulatu zizkion .	Garaieraz	0	Ind
" Park Chang-yong da nire lagunik onena " .	lagunik	5	Ind
Arratsaldeko saioan klaustrokideek unibertsitateko gai desberdinen inguruan egindako galderei erantzun behar izan zieten .	unibertsitateko	3	Def
Arratsaldeko kotizazioaren ostean , Gamesako tituluak 21,73eurotan kotizatu zuten .	Arratsaldeko	0	Def
Sasoi goiztiar honetan Oitz haurrak bideograbaketetan zehar halako ekoizpenik gauzatu ez arren , bere gurasoek bildu duten egunerokoan halako formak ere aurki ditzakegu .	ekoizpenik	8	Ind
Bi itzuliren faltan ( 12km ) Alvaroren aldea 1:48koa zen .	12km	4	Ind
" Tutsi gutxiengoko gerrillari ohiek Kigalin finkatu zuten Gobernuak gerra kriminaltzat gaitu " .	kriminaltzat	10	Ind
Desesperatuki egiten dute larrutan , bata bestearengandik askatu nahi eta ezin bailuen .	larrutan	3	Ind
Agian , herrimindu egingo zen Estatu Batuetan baina ez zezakeen horrelakorik adierazi , ez baitzen gertatuko modu horretako aitortzarik .	aitortzarik	18	Ind
Moskuk Txetxenian izendatutako agintariordea atentatuz hil dute .	atentatuz	4	Ind
Mendien eraketa nolakoa den aztertzen hasi behar dugu orain , baina hori baino gogora dezagun nolakoa den Euskal Herriko erliebea .	eraketa	1	Def
Esnatu zenean , zikin somatu zuen bere soina tabako usaineko maindire artean , eta ahoa lehor .	ahoa	14	Def
Jugoslaviako presidentearen agintaldia hurrengo uztailean zen amaitzekoa , baina , erreforma horri esker , lau urteko beste bi agintaldi betetzeko aukera izango du .	agintaldia	2	Def
Larraungo bailaran , Aste Santuan , " hamabiak " jotzeko erabiltzen genuen .	bailaran	1	Def
EAren " izaera demokratikoa " zalantzan jartzea ez dutela onartuko esan zuen Knörrek , eta Aznar ez dela inor demokrazia ikasgairik emateko .	ikasgairik	20	Ind
Aurten , ordea , zortzi bat estatutan Al Goreren eta Bushen arteko aldea oso txikia da , eta , inkesten arabera , bietako edozeinek irabaz lezake hautes esparru horietan .	estatutan	6	Ind
Eusko Jaurlaritzatik dirulaguntza jasotzen du , eta hau talderako materiala erosteko eta gure formazio ikastaroetarako erabiltzen da .	ikastaroetarako	14	Ind
" Luxenburgo aretoa abangoardistek inbaditu dute aurten ; Estatuak erositako hainbat koadroren aurrean txundituta geratzen da bat ... " .	abangoardistek	3	Def
Urruntasun eta sakabanaketak presoentzat dituzten ondorioak " zigor bikoitza " direla azpimarratu zuten , eta familiek ere presondegiaren ondorioak zuzenki pairatzen dituztela adierazi zuten .	presondegiaren	17	Def
Liberalizazio hori gauzatzen denean , Iberdrolak hiru urte barru gas hornitzaile izateko asmoa dauka .	hornitzaile	10	Ind
Delitu larriak egin dituztenak , ustelkeria , mafia eta " terrorismoarekin " zerikusia dutenak , ez lirateke kartzeletatik irtengo .	kartzeletatik	17	Def
Nortasunaren heriotza da .	Nortasunaren	0	Def
Zeuk ongi ikus dezakezunez , zail egiten zaigu materia zer den zehaztasunez definitzea .	materia	8	Def
5. Taulan jasotako datuak dituzula oinarri eta koordenatu kartestiarrak erabiliz , egizu prozeduraren grafikoa .	prozeduraren	12	Def
ekintza 12:30ean gertatu zen goizeko 04:30 Euskal Herrian .	Herrian	7	Def
Horrela , batean , uretan nahastutako piku eta urki hostoak eman zizkion txori bati edatera , baina txoria ezer hartu ez balu bezala geratu zitzaion , ez piku ez miku :	uretan	4	Ind
Atzo heldu ziren adostasunera Alavesekin , eta gasteiztarrek 60 milioi pezeta inguru jasoko dituzte .	gasteiztarrek	7	Def
Arrotz bihurtua zegoen .	Arrotz	0	Ind
Ez die arnasik ematen kontrarioei , ez ikusleei .	kontrarioei	4	Def
( Lurraren kontra tupust egitean , zerua piztu egiten da une batean eta mila argi-puska zirimolatzen dira airean .	zerua	6	Def
Luis Fernandezek sarritan esaten zuen bere plantilan ez zegoela titularrik .	titularrik	9	Ind
Irabazlearen izena datorren urteko udazkenean jakingo da , Moskun egingo den bozketan .	udazkenean	4	Def
Ez zuen beste aukerarik Juan Jose Ibarretxeren gobernuak .	aukerarik	3	Ind
" Umearengan kreatibitatea eta imaginazioa lantzen dituzten jokuak ere egiten ditugu eta guztiaren gainetik komunikazioa eta taldeko lana burutzea garrantzitsua da " .	imaginazioa	4	Def
Kiichi Miyazawa Finantza ministro eta oraingo kabineteko kiderik boteretsuenetakoa ere zalantzan agertu zen .	kiderik	7	Ind
Hala egingo balitz , Turkiari Batasuneko kide izateko aurrebaldintzatzat ezarriko lioke heriotz zigorra eta exekuzioak bertan behera uztea .	aurrebaldintzatzat	8	Ind
Nafarroan egoera Iparraldekoaren ankekoa da , baina bertan gaztelania hutsezko irakaskuntzaren aldeko iritzi gehixeago jaso da .	Iparraldekoaren	2	Def
Silvi eta bion artean eraman genuen gelara eta , bitartean , Laurak hozkailutik jela koxkorrak ekarri zituen , buruko poltsa betetzeko .	poltsa	19	Def
Rifondazione Comunista alderdi politikoak amnistia emateko proposamena aurkeztu du Italiako Legebiltzarrean kartzeletako arazoari irtenbide bat eman nahian .	arazoari	12	Def
garraiolariendako Europako legeriaren bateratzea galdegin zuten , eta " lan denboraren murrizketa , 11 oreneko pausa eguneko , gaueko orenen ordainketa hobea , kamioiarekin pasatutako oren guztien ordainketa eta soldata handiagoak " aldarrikatu .	legeriaren	2	Def
Halaber , bestelako delitu motak ere tipifikatu dituzte , egun zigorrik jasotzen ez duten ekintzak zigortuz , batez ere adierazpen askatasunaren ingurukoak .	zigorrik	10	Ind
mexikar askok pozez hartu zituen Vicente Fox oposizioko PAN eskuineko alderdiari garaipena eman zioten otsaileko hauteskundeen emaitzak .	pozez	2	Ind
Haien argudio nagusia da zigortuen aurkako frogarik ez dagoela eta epai guztia aitorpenetan oinarritu dela .	aitorpenetan	12	Def
- Familia euskalduna da gehienbat ; lagunartea edo lan-eremua , ordea , ez .	lagunartea	6	Def
Horri erantzun zion DOSeko kide Zoran Djindjicek esanez beldurra diela herritarrei .	herritarrei	10	Def
Arrosa guztiak hil ziren , ekaitzak gainditu zituen .	ekaitzak	5	Def
Botere publikoak legitimatzeko igandeko hauteskundeetan , presidentea , Asanblea Nazionaleko 165 aulki , 219 eskualdeetako diputatu , 23 gobernadore , 336 alkate eta 13 zinegotzi metropolitar eta Latinoamerikako Parlamenturako 12 ordezkari eta Andetarrerako 5 aukeratu dira .	diputatu	15	Ind
Alderdi demokratiko batekoa dela dioenak ETAko presoak euren jaioterrira ekartzeko eskaerarik ez diezaiola egin Madrilgo Gobernuari " .	eskaerarik	10	Ind
75 kolperekin bukatu zuen zirkuitua Olazabalek , hiru kolpe parraren gainetik , eta sailkapeneko zortzigarren posturaino jaitsi da , 140 kolperekin ( - 4 ) .	posturaino	15	Def
Eskola-Graduatuko tituluak hurrengo ikasketa hauek jarraitzeko eskubidea ematen du :	tituluak	1	Def
Bahimendu ekonomikoa da , hain zuzen , mendebaldeko herrialdeek beren esku duten tresnarik eraginkorrenetakoa Milosevicen aurka .	tresnarik	12	Ind
Jean , Crystal , Armando ... dira denak eta euskaldun suerte guztiak aurki litezke EEBBetan ; hiru belaunalditan , oraintxe .	belaunalditan	17	Ind
