Etxeko bandera masailean margotuta dabil jende guztia Sydneyn , eta norbere selekzioko kideren bat podiumera igoz gero , bizitzako pozik handiena hartu dutela ematen du .	kideren	12	Ind
guztiak ihartutako edo gaitzak jotako zuhaitzen sustraietan edo enborraren gainean ateratzen dira multzo soropildu handiak sortuz .	sustraietan	6	Def
Eli jaiki eta ondoren garbitu egiten dute , usain gozozko urez , jantzi , orraztu eta apaindu egiten dute .	urez	10	Ind
Zimbaweko Gobernuaren berriemaileek bileraren inguruko zurrumurruak argitu zituzten .	berriemaileek	2	Def
Eta Ajuria Eneko iturriek diotenez , abisu horren ondorioz etorri zen Xuntak egindako afaltzeko gonbita :	Xuntak	11	Ind
Espetxeetan oso jende pobrea dago , arazo sozialekin , drogazaleak , eta legez kanpoko emigrante asko .	drogazaleak	9	Def
Mendia gustatzen zaiolako eta mendiaren inguruko gaietan ezagutza haundiagoa izateko sartu zen erreskate taldean .	Mendia	0	Def
Hurrengo orrialdeko marrazkiei begirada bat botatzen badiezu eta arretaz irakurtzen baduzu alboan duten testua , erraz ulertuko duzu nola gertatzen den fosilizazioa .	marrazkiei	2	Def
Bi multzotan , launa segalari aritu ziren finalerako txartel bila , ordu erdiko lanean .	multzotan	1	Ind
Etxea berogailuz berotzen bada , uda parteko sistema erabili .	berogailuz	1	Ind
Ardatz nagusiak Euskal Departamendua , euskararen ofizialtasuna eta presoen Euskal Herriratzea izanen direla adierazi zuen Belinek .	Departamendua	3	Def
Sakana da egungo txapelduna , eta aurten aldaketak egiteko moduan denez , ez du aukerarik galduko .	aukerarik	14	Ind
Komisarioaren arabera , Javier Solana arduradunak Batzordearen lana nahasi egin du , eta bi erakundeen artean " tentsio instituzionalak " sortu dira .	Batzordearen	6	Def
Printzipioz , patronalarenpean dagoen ANET kamioi gidarien elkarteak grebarik deitu ez arren , haren partaide diren garraio enpresa batzuk lanuztea jarraitzen ari dira .	Printzipioz	0	Ind
Hizkuntza-heldutasuna neurtzeko era hau Brown ( 1976 ) ikerlariak asmatu zuen haurren hizkuntza-maila mugatzeko helburuagaz , eta euskararentzat Idizabalek ( 1991a ) egokitu du .	Hizkuntza-heldutasuna	0	Def
" Ikus dezakezuen bezala , matematikako koadernoan neurrien ariketak daude " .	neurrien	7	Def
Toki askotatik deitu zieten , jo zezaten ; uztailean , esaterako , 33 saio egin zituzten herririk herri .	herririk	16	Ind
Etiopiarren festa Millon Woldek osatu zuen atzo , gizonezkoen 5.000 metroak irabaziz .	metroak	10	Def
Jada 19.000 lagunek azaldu dute eskaera egiteko nahia .	lagunek	2	Ind
Botoak 160 maleta txikitan banatuta zeuden eta eramateko demokratek akuratutako kamioiak Polizia autoz ingurutua egin zuen bederatzi orduko bidea .	autoz	12	Ind
Guztira 75.000 langilek dihardute EAEko sektore publikoan , eta 18.000 beharginek Nafarroan .	beharginek	10	Ind
Bi multzotan , launa segalari aritu ziren finalerako txartel bila , ordu erdiko lanean .	segalari	4	Ind
Greenek irabazi ondoren zapatilak kendu eta harmailetara botatzea ere Samaranchen itxiera ekitaldiko hitzaldia bezain bat-batekoa izan zen .	zapatilak	3	Def
Sandia izan nahi eta izan ez .	Sandia	0	Ind
Lehen hizkuntza euskara izan dutenek oso profil berezia dute eta ondoko ezaugarriok dituzte :	ezaugarriok	11	Def
Irainak " min handia " egin ziola dio , aita istripu batetik osatzen ari delako eta bere amak horregatik asko sufritzen duelako .	Irainak	0	Def
Ondoren , den-dena nahastu eta ontzi batean hiru ordu laurdenean eduki labean maribainuan .	labean	11	Def
Donostiako Epaitegiak atzera bota du Hernaniko Udalak hiru jaiegun lanegun izendatzeko hartutako erabakia .	jaiegun	8	Ind
Kontuak kontu , Rojok beste jokalari bat galdu du erdialderako .	erdialderako	9	Ind
Kanporaketak direnez , ordu erdiko lana bete beharko dute , eta belar kilo gehien batzen duten biek sartuko dira Lantzeko ( Nafarroa ) finalerdietara .	finalerdietara	23	Def
SASOIA prestatzeko bigarren lagunarteko norgehiagoka jokatuko du Miarritzek , gaur , Auchen ( Frantzia ) , Vic-Fe-censacen hain zuzen ere ( 18:00 ) .	SASOIA	0	Def
Epaiketak egin arte oso denbora luzea pasatzen da eta horrela ustelkeria kasuengatik kartzelan dauden asko , horrekin zerikusia duten politikariak , esaterako , libre irten daitezke delituak preskribitu duelako .	zerikusia	17	Def
Trukea gauzatzeko , Auzolan izeneko bonoak banatu dituzte , 100 , 500 , 1.000 eta 2.000 pezetako baliokoak .	baliokoak	17	Def
Titulua irabazteko azken aukera du .	Titulua	0	Def
Buruhauste ugari izango dituzte , beraz , Frantziako agintariek hurrengo sei hilabeetan .	hilabeetan	11	Ind
Begiak ireki ahala , asaldatu egin zen , aldamenean oilorik ikusi ez zuelako .	oilorik	9	Ind
Frantxua Maitia sozialistak " mementoz Gobernua korsikar aferarekin " ari dela argudiatu zuen eta Hego Euskal Herrian dagoen bortizkeria egoera eta " Espainiak Euskal Departamendurik sor ez dadin egiten duen presioa " azpimarratu zituen .	mementoz	4	Ind
Hauez gainera , Italia , Portugal , Belgika , Eskozia , Britainia Handia eta beste zenbait lurraldetako sindikatuak daude kongresuan ordezkatuta .	lurraldetako	16	Ind
Irteera Zumalakarregi etorbidean izango da , 15:30ean .	Irteera	0	Def
Espainiako Erregearen Gabonetako mezua ETBn emateko legez besteko proposamena egin du PPk .	Erregearen	1	Def
Ipar Euskal Herriko eskuina eta Nafarroako UPN eta PSN bereziki gogor eta sutsu agertu dira Udalerrien Biltzarraren asmoarekin kontra .	Udalerrien	15	Def
Ezin nion negarrari utzi .	negarrari	2	Def
Iaz hirugarren izan zen 7.275 kilo jasota ( 47 jasoaldi ) .	jasoaldi	9	Ind
Maticek erakutsitako bideo batean , lau atxilotuetako batek dio Milosevic bahitu nahi dutela eta gaizki irtetekotan , presidenteari lepoa moztuko diotela .	bideo	2	Ind
SERGEI ZVEREV Moskuk Txetxenian izendatutako agintari zibilaren ordezkoa hil zen astearte arratsean , Grozniko auzune batean gertatutako atentatuan .	ordezkoa	7	Def
Gazteek zubi batetik botatako harriek bi emakumeren autoa jo ostean , beren heriotza eragin eta beste hainbat pertsona zauritu zituzten .	Gazteek	0	Def
Urrean etsi ahala , aurrez ezagutzen zuten lantegiari lotu ziren :	lantegiari	7	Def
Taxian zihoala , Salahadinek behin eta berriro galdetu zion bere buruari :	Taxian	0	Def
Atzeko koadroetan , Iñaki Otxandorenak mendean hartu behar luke Philippe Hirigoien , baina ez da erregulartasuna Mugairekoaren dohain nagusia .	erregulartasuna	15	Def
Azken tantoek ere bide beretik jarraituko zutela zirudien , baina bi sake unerik onenean sartu zituen Zeberiok , eta piloteoan nagusitu zitzaion kontrarioari .	sake	11	Ind
Gorriak beti aurretik joan ziren , eta 35-29 irabazi zuten .	Gorriak	0	Def
Jugoslaviako lehendakaria ez ezik , Jugoslaviako Parlamentu Federala ere hautatuko dute serbiarrek eta montenegroarrek .	montenegroarrek	13	Def
ASPALDIAN izan den Tourrik ikusgarriena izan daiteke aurtengoa , Frantziako itzulia irabaz dezaketen artetik bakar bat ez da faltako behintzat , eta alderdi horretatik asko irabazi du gaur abian jarriko den munduko probarik garrantzitsuenak .	probarik	32	Ind
Datozen egunotan iragarriko du Londresek Patten batzordearen zein proposamen beteko dituen RUC Polizia erreformatzeko .	proposamen	8	Ind
Garai berri horri hasiera emateko hiru konpromiso eskatu zizkien Ibarretxek alderdiei :	konpromiso	6	Ind
Gehienak etxera joan ziren , prestatuta zuten jaia ospatzeko gogorik eta motiborik ez zutelako ; eta telebistaz Rijkaardek selekzioa uzten zuela entzun behar izan zuten .	gogorik	9	Ind
Zenbait etapen aurrean izaten saiatu arren , orain artean ez dute fruiturik jaso .	fruiturik	11	Ind
Eragiketa hau polimetro batez egingo dugu , diodoak egiaztatzeko eran ipinita ( diodoaren ikurra izaten du posizio horretan ) .	diodoak	7	Def
Horren arabera , askatasun baldintzatua bultzatuko litzateke indulto revocabile , preso ohia espetxera itzuliko bailitzateke bi urteko epean deliturik eginez gero .	revocabile	8	Ind
Suduperen jarrera irekiagoa izan balitz egungo egoera ezberdina izan zitekeela adierazi zuen , eta egungo egoeraren erantzuleetako bat Sudupe bera dela erantsi zuen .	erantzuleetako	16	Def
Malagako erlojupekoaren ostean haren motibazio eza izan zen eztabaidagai .	erlojupekoaren	1	Def
Aitzin multzo haustailea eta bultzatzailea du , baloi asko irabazten dute , eta defentsa zorrotza dute " .	Aitzin	0	Ind
Kartetan galtzen ari den jokalariaren kasua da ezker abertzalearen muin gogorrarena :	Kartetan	0	Def
Hautesleek sinetsi egin diotela ematen du , inkesten arabera , parez pare baitaude Fox eta PRIren hautagai Labastida .	parez	10	Ind
Pirlo eta Baroniori esker , neurri handi batean , irabazi du Italiak 21 urtez azpikoen Europako Txapelketa .	azpikoen	14	Def
Parmako jokalaria da bera , baina aurten Udinesen jokatu du , eta Eurokopan titular ari da , egindako lan bikainaren ordainean .	ordainean	20	Def
PP-REN Gobernuak proposatutako lege aldaketek Espainiako Kongresuaren onarpena jaso zuten atzo .	onarpena	7	Def
Begiak ireki ahala , asaldatu egin zen , aldamenean oilorik ikusi ez zuelako .	aldamenean	8	Def
Ez du aurrerako pausorik eman .	pausorik	3	Ind
Eskuin zein ezkerreko oposizioaren arabera , jauntxokeriaren eta eroskeriaren bidez bermatu ditu PRIk batasuna eta hainbeste urtetako agintea :	urtetako	16	Ind
Gaur egun , EBk petrolio bahimendua ezarri dio Belgraderi , debekatu egin die batasuneko enpresei Jugoslaviako enpresa gutiz gehienekin tratutan aritzea , eta bisaturik ez die ematen bere arduradunei .	bisaturik	23	Ind
Athleticen gertatzen den bezala , atezainak ez du behar bezalako errespetua sartzen bere arean .	arean	13	Def
Ez dira erabat zokoratu Greg Lemond , Bernard Hinault , Giusseppe Saronni , Francesco Moser , Freddy Maertens , Luis Ocaña , Txomin Perurena , eta , besteak beste , Eddy Merckxsen lorpenak .	lorpenak	32	Def
Errepidean , bi probetan jaun eta jabe izan zen , eta pistan urrea irabazi zuen jazarpen proban eta zilarra puntuaketan .	Errepidean	0	Def
Andereñoak Kepa besoetan hartu eta autobuseko lehenengo eserlekura eraman zuen , haizeak jotzeko .	besoetan	2	Def
Larunbatean Narancoko 34. Igoera jokatuko da .	Larunbatean	0	Def
Neskalaguna eta Karakorumera trekkinga antolatu duen Banoa bidai agentziako Jon Lazkano eta Mikel Eseri ordezkariak zituen zain mendizaleak .	mendizaleak	17	Def
Begiak ireki ahala , asaldatu egin zen , aldamenean oilorik ikusi ez zuelako .	Begiak	0	Def
Azken hilabeteotan hainbat pertsonalitate hil dituzte Serbian .	pertsonalitate	3	Ind
Prentsa aipamenek zioten , azkenean , haurraren amaren ahalegin tematsuei esker , dozena bat lekukok testigantza ematea onartu egin zutela eta gisa horretan zuela Dresdeneko Fiskaltzak ikerketa baten irekitzea erabaki .	testigantza	15	Def
Txapelak 2-4 cm-ko zabalera du eta beherantz biltzen diren bi gingilez osaturik dago , eta bizikleta-silinaren forma izan ohi du .	Txapelak	0	Def
Ez primadera izan behar zunan .	primadera	1	Def
Titinen doinuan dantzan Elkororekin , Donostia Hiria Torneoko finala irabazi du ( 16-22 ) .	Hiria	6	Def
Eta jakina da pista irristakorrean Schumacher dela errege .	errege	7	Ind
( Lurraren kontra tupust egitean , zerua piztu egiten da une batean eta mila argi-puska zirimolatzen dira airean .	argi-puska	14	Ind
Urtemuga ospatzeko entitatearen Donostiako egoitza nagusian ekitaldi berezia egin zen eta bertan izan ziren Gipuzkoako hainbat erakundetako eta enpresa munduko ordezkariak .	erakundetako	16	Ind
Mark-1 eraldatua , presioa ezabatu edo jaistea ekarriko lukeena .	Mark-1	0	Ind
Kontuan izan behar da Italian presoak , gutxi gorabehera , 53.000 direla eta kartzeletan 30.000 lagunentzako lekua dagoela .	lekua	16	Def
Umorekoa naiz , bai .	Umorekoa	0	Def
Nik uste dut Euskal Herriak bere nortasuna baiezteko daukan hil ala biziko premia horrengatik dela , bere herri-nortasuna kulturaren errorik sakonenetan bilatuz " .	errorik	19	Ind
GREENPEACE talde ekologista Erandioko ( Bizkaia ) Sakoni ibarrean hiri hondakin solidoen tratamendurako eraiki nahi dituzten errausteko bi planten aurka agertu zen atzo , " errauspena hondakinak tratatzeko metodorik garestiena eta ingurugiroarentzat kaltegarriena " delako .	ingurugiroarentzat	31	Def
Kolore hau lortzeko , hainbat oxido nahastu behar ziren .	oxido	5	Ind
Pasaportea lortzean taldeko jokalari garrantzitsua izango da .	Pasaportea	0	Def
Hainbat analistak adierazi duenez , biltzar horren erabakiarekin , errepublikanoek indargabetu egin nahi dute Floridako Auzitegi Gorenak har dezakeen erabakia .	analistak	1	Ind
Athleticen filosofia txalogarria da , baina beste talde batzuek atzerritarrak fitxatzeko beharra dute .	filosofia	1	Def
Bost artixten obrak ikus ditazke agorrilaren 31 arte .	artixten	1	Def
OHIKO estatistiketan lekurik ez duten arren , etxekoek bortxazhartzen dituzten emakumeen kopurua izugarria da .	etxekoek	7	Def
Horrela eginez gero , kontsula errekurtso-egilearen ordezkaritzat hartuko da .	ordezkaritzat	6	Ind
Maribel Belastegi Arteszenako zuzendarietako batek atzo emandako prentsaurrekoan azpimarratu zuenez , Mephisto lana giza konpromezuzko antzerki esparruan kokatzen da .	prentsaurrekoan	7	Def
Lasterketa bukatu eta gutxira Sydneyko hormak Freemanen argazkidun Niken afitxez bete ziren .	hormak	5	Def
Eta McLareneko bi gidariak , David Coulthard eta Mika Hakkinen , Munduko Txapelketako lidergoa eskuratzeko aukeran izan ziren .	lidergoa	13	Def
POPULAR bankuak 0,29 euroko dibidendu gordina banatu zien atzo akziodunei .	akziodunei	9	Def
Buliganek hiru aste daramatza haragirik jan gabe .	haragirik	4	Ind
Hondoraketa gertatu eta ordu gutxira , itsas arazoetako agintariek zaintza eta segurtasun neurri andana obratu egin zuten .	andana	13	Def
Ikusi genuenez , seinale digitalak bi tentsio-mailaz osatuta daude ( maila altuaz eta maila baxuaz ) .	tentsio-mailaz	6	Ind
Defentsa Ministerioko sei agintari kargugabetu dituzte .	Ministerioko	1	Def
pilotan erabiltzen diren tresna ezberdinak nola egiten diren erakutsiko da .	pilotan	0	Def
Titular izateko aukera asko ditu aurtengoan .	Titular	0	Ind
Barinatxeko hondartzan 6 kilometroko lasterketa egingo dute Euskal Herriako , Espainiako , Frantziako , Alemaniako , Italiako , Belgikako , Greziako , Irlandako , Argentinako eta Kolonbiako parte-hartzaileek , biluzik .	Herriako	8	Def
Gizon-ezpetxeetan dauden emakumeak , ginekologoaren beharra izanez gero , hospitalera atera beharko lukete , horrek , hilabete bat , bi edo gehiago suposa ditzake , sor daitekeen arriskua kontutan izanik .	hospitalera	9	Def
Autoak N-1etik bideratu zituen Ertzaintzak , autopistatik ibiltzea ezinezkoa baitzen .	autopistatik	6	Def
Badakizu , hemen ez dute nahi inork bere burua aparkalekuko bosgarren pisutik kalera bota dezan .	pisutik	11	Def
Gorte Gorenera jo du Demirrek , baina , horrek epaia berresten badu , kartzelara joan beharko du .	kartzelara	13	Def
SASOIA prestatzeko bigarren lagunarteko norgehiagoka jokatuko du Miarritzek , gaur , Auchen ( Frantzia ) , Vic-Fe-censacen hain zuzen ere ( 18:00 ) .	lagunarteko	3	Def
Gainera , azken hiru partiduetan ez dugu garaipenik lortu eta hori konpontzeko nahia ere badago .	nahia	12	Def
Emanaldi berezietan , aldiz , amankomunean hartu ohi zituzten erabakiak , beti ere Isidro izaten zelarik solas-kide eskatzaileekin eta hark aurkezten zuen taldeko iritzia .	erabakiak	9	Def
Hala egingo balitz , Turkiari Batasuneko kide izateko aurrebaldintzatzat ezarriko lioke heriotz zigorra eta exekuzioak bertan behera uztea .	exekuzioak	14	Def
- Aurkeztutako proiektuaren araberakoak izango dira instalazioak .	araberakoak	3	Def
Horretarako , Nazio Batuek iragarri dute Gobernu berriak errolda irekiko duela serbiarrek izena eman dezaten , eta hiru komunitate serbiarretan berriro deituko dituztela bozak .	bozak	23	Def
Espero dezagun guk irabazitako baloiez behar bezala baliatzea .	Espero	0	Ind
" Bizitza umorez hartu behar da " .	umorez	2	Ind
Kontinente arteko torneoa finalerdien atarian da .	finalerdien	3	Def
Errioxarrak eta nafarrak 22-9 irabazi zuten 40 minutu iraun zuen partiduan ( 432 pilotakada ) .	pilotakada	13	Ind
Etika medikoak , ordea , haien izenak ematea eragozten digu .	izenak	6	Def
gutxinaka-gutxinaka gainera , Reala gorantz egiten hasi zen eta azkenik , bigarren zatiko hamaikagarren minutuan , markagailuan aurrea hartu zuen izan zuten aukera bakarretakoan .	bakarretakoan	23	Def
Jadanik ideiak argi dituela aurreratu zuen entrenatzaileak .	ideiak	1	Def
Baina hitzaurreak azpimarratzen duenez , « Europako Kontseiluak uste du agiria hitzarmenean sartu beharko litzatekeela , indar legala izateko Europako Batasuneko agintarien gainean eta edozein herritarrek auzitegietara jotzeko oinarria izan dadin » .	auzitegietara	26	Def
Artzantzari utziz gero , erabat barreiatuta bizi dira euskaldunak EEBBetako gizarte anabasan igeri .	Artzantzari	0	Ind
Horrela , batean , uretan nahastutako piku eta urki hostoak eman zizkion txori bati edatera , baina txoria ezer hartu ez balu bezala geratu zitzaion , ez piku ez miku :	piku	27	Ind
( Euskaraz da Laxalten " A Cup ot Tea in Pamplona " , edo ' Kafea hartzea Iruñean ' ere ( Elkar , 1986 ) , itzultzaile beraren lumatik ) .	Kafea	15	Def
Errekuperatu ostean titular izan beharko luke .	titular	2	Ind
Dibertsifikazio asmo honen barruan , Internet eta gas natural alorrak nabarmendu ditu Oriolek .	Internet	5	Ind
NATOk , ostera , erantzun du artean goizegi dela jugoslaviarren itzulerarako , Kosovon serbiarren eta albaniarren artean ezinikusi handia dagoelako .	jugoslaviarren	9	Def
pintura , eskultura , arkitektura eta argazkigintza ; eta aitzindarietakoa izan zen argazkigintzako espezialitatea sartzen ) .	argazkigintzako	12	Def
Kilometro askotako erradioan dagoen guztia suntsitzen du bonba horrek , eta argitasunak , 30 kilometrora dagoen jendea itsutatzen du .	argitasunak	11	Def
Alderdi bakar baten izenik ere ez dakite .	izenik	3	Ind
Horrela , batean , uretan nahastutako piku eta urki hostoak eman zizkion txori bati edatera , baina txoria ezer hartu ez balu bezala geratu zitzaion , ez piku ez miku :	miku	29	Ind
Poliziak Luxenburgoko haurtzaindegiko bahitzailea tirokatu eta haurrak askatu ditu .	bahitzailea	3	Def
Ezkerrean , kristalezko ate laxo bat ikus zitekeen , denboraren poderioan markoko pintura galduz eta likistasuna bereganatuz zihoana .	kristalezko	2	Ind
Jada 19.000 lagunek azaldu dute eskaera egiteko nahia .	eskaera	5	Def
Alegia esaten zaion literatur motaren ezaugarria da :	motaren	4	Ind
Azken 30 urteotako gatazkan RUCeko 302 agente hil eta 8.000tik gora zauritu dira .	gatazkan	3	Def
Guk gogoa jarriko dugu , eta erronkari aurre eginen .	erronkari	6	Def
BONBA-auto batek eztanda egin zuen atzo Tbilisi hiriburuan , eta Defentsa ministroaren anaia Guram Tevsadze hil zuen .	eztanda	2	Ind
Zuloaldea ere kontu handiz ondo egina utzi behar da , zuloaren ertza zorrotza bukaturik .	Zuloaldea	0	Def
Ez du frogarik ematen ordea esandako horiek baieztatzeko .	frogarik	2	Ind
Finala Rotterdamen zen , baina Amsterdamek presio handia egin du ongietorria Holandako hiriburuko kaneletan ospatu zedin , eta ez Rotterdamen , iragarri bezala .	Finala	0	Def
Euria eta txingorra jasan behar izan zituzten txirrindulariek , eta epaileek lasterketa neutralizatzea erabaki zuten ordu erdiz , 73. kilometroan .	Euria	0	Def
Ezkerrean , kristalezko ate laxo bat ikus zitekeen , denboraren poderioan markoko pintura galduz eta likistasuna bereganatuz zihoana .	denboraren	9	Ind
Zenbait txirrindularik jasandako erorikoengatik jaso dute komunikabideon arreta .	erorikoengatik	3	Def
Haren iritziz , beharrezkoa da sektoreko langileek gasolioa gehienez litroko 30 pezeta ordaintzea eta ez 54 pezeta gaur egun ordaintzen duten bezala .	litroko	9	Ind
Partiduz partidu joan behar da .	Partiduz	0	Ind
" Egungo egoerari globalizazioa , merkatu batua ... buelta eman nahi diogu , aldi berean pertsona arruntek oinarrizkoak diren gaietan erabakitzeko ahalmena berreskura dezagun .	globalizazioa	3	Def
" Nuklear Segurantzarako Kontseiluak sistema honek jasotako kritikak onartu egin ditu , baina ordezkapena exijitu beharrean Garoñakoan aldaketa txiki batzuk eskatu besterik ez du egin " .	Kontseiluak	3	Def
Fosilak deritze ( latinezko hitzetik eratorritako hitza da , eta lurretik ateratakoa esan nahi du ) .	latinezko	3	Ind
" Aldaketak aztertzeko batzordea ETAk Lluch hil ostean bildu zen , eta ordezkari sozialistaren hitzak hunkigarriak izan ziren , baina legeak ez dira hunkimenetik egiten , aldaketak lasaitasunez eta zentzunez egin behar dira " .	hunkimenetik	23	Def
Baina ekimenaren berezitasunak , zalantzarik gabe , adibide praktikoak dira :	ekimenaren	1	Def
Gaztelaniazko frogaren normalizazioari dagokionean ere , erantzun zuzenen portzentaia oso handia dela ikus daiteke .	frogaren	1	Def
Iadanik ez dira erritmo , tinbre eta linea melodiko ezberdinak ezagutzen hasteko soinuzko jostailurik egiten .	soinuzko	12	Ind
Kalitateari prestakuntza fisiko eta psikologiko bikaina erantsi diete Italiako Liga gogorrean .	Kalitateari	0	Def
2001 urtean negoziazio kolektiboak enpresen kudeaketa eta kostuen murrizketarako " ezhoiko tresna " izan behar du .	murrizketarako	8	Def
ZURE HERRIAN EDO HURBILEAN ERE IZANGO DA , NOSKI , KALE EDO ESTATUAREN BAT NORBAITEN OMENEZ .	ESTATUAREN	12	Ind
Garciak Ertzaintzaren komisarian kolpeak , mehatxuak eta irainak jasan izana salatu zuen .	mehatxuak	5	Def
Argi iturriak aipatu ditugu aurreko jarduera horretan , baina argia sortzen den lekutik , fokutik , nola hedatzen da beste lekuetara ?	fokutik	14	Def
Arlo ekonomikoaren inguruan baikor agertu zen Sudupe eta Gipuzkoa 2003 plana aipatu zuen garapenerako ardatz gisa .	garapenerako	13	Def
Multikulturalismoaz eta zuzentasun politikoaz hemen garatutako ideia batzuk berari zor dizkiot .	Multikulturalismoaz	0	Def
Landaretzaren espezierik ugarienak , berriz , hauek dira :	espezierik	1	Ind
erasotako zatia ebaki eta erre , behar izanez gero fungizidak edo intsektizida egokia erabiliz sendatu .	fungizidak	9	Def
Sartu linterna piztuta zapata kaxa barruan eta estali taparekin .	taparekin	8	Def
Inguruko landareen hostoetatik eta lorontzietako lurretik lurrintzen den ura medio , inguru berezi bat sortuko da bere artean .	Inguruko	0	Def
Guztion artean ez daukagu nahikoa hatz aldiak zenbatzeko .	hatz	5	Ind
Hasiera batean ez dela titutar izango dirudi .	titutar	4	Ind
Herrira jaitsita eskulanean jardun zuen askok .	eskulanean	2	Def
Arteszena Gipuzkoako Teatro Publikoak Klaus Mann-ek idatzi eta Ariane Mnouchkinek moldatutako Mephisto antzezlanaren lau emanaldi eskainiko ditu , bai erdaraz zein euskaraz , bihar eta etzi Iruñeko Gaiarre Antzokian .	emanaldi	14	Ind
Bilbotarrek garaipena merezi zuten baina ez zuten zorterik izan Juanmiren ate aurrean .	Bilbotarrek	0	Def
Errusiarrek sobietarren garaietatik dituen base guztiak uztea nahi du Georgiako Gobernuak , bere asmoa NATOn sartzea baita .	garaietatik	2	Def
Estatubatuarrak 63 kolpe behar izan zituen atzo ibilbidea osatzeko , zortzi parraren azpitik , eta 268 kolperekin amaitu du torneoa .	kolperekin	16	Ind
lau gantxo , sake bat eta txokoan utzitako beste bat .	txokoan	6	Def
Harry bedeinkatua lana , berriz , eleberria oinarri hartu eta Careyk berak gidoia moldatuta , Ray Lawrenceren zuzendaritzapean zinemara eraman zen .	zinemara	18	Def
Bilera horretan oinarrizko errentaren proposamenak aztertu ziren , eta EAJ , PSE-EE eta PPk defendatzen duten planteamenduren ondorioz kopuru hori gutxieneko soldataren %75era mugatuko da .	planteamenduren	16	Ind
Arerioen maldizioak eta ez txaloak agerian uzten dituztenak .	Arerioen	0	Def
ez zukeen golik sartuko " .	golik	2	Ind
Akhwari urrea irabaztera joan zen , baina azken postuarekin ere harro egoteko arrazoiak bazituen .	postuarekin	8	Def
Euskadi taldeko zuzendaritzak dimisioa aurkeztu du .	zuzendaritzak	2	Def
Euste sistema da , ordea , kezka sortzen duen funtzionamenduko osagaia .	osagaia	10	Def
Beranduago , itxarongela , funtzionarien etxebizitzak eta psikiatri eritetxea gure eskubian utziz , hauek eraikin nagusitik bereizten zituen patio batera zuzendu gintuzten .	eskubian	10	Def
Azken tantoa Rairen huts garbi batek erabaki zuen , eta garaipena Tirapu eta Errandoneari eman zien .	tantoa	1	Def
Kutxatxoak bi gutun-sail gordetzen zituen :	gutun-sail	2	Ind
Gainerakoek , berriz , beti amarrako izan dela erantzuten diote , eta ea nondik atera duen " hamarreko " hori .	amarrako	5	Ind
Azken finean bi higadura motek egiten dutena lurzoruaren taxutzea eta eratzea da .	motek	4	Def
Grebarako mobilizazioak direla eta , bi garraiolari atxilotu ditu Poliziak , bata Araban eta bestea , Nafarroan .	garraiolari	6	Ind
- Zurtoinak sendotu eta gaitzekiko erresistentzia hobetu egiten da .	erresistentzia	5	Def
Ezaugarriak hautatze horretan ere bada Lafon eta bere aurrekoen artean alderik .	alderik	10	Ind
Patriarkatu kontzeptua batez ere erabili da aitaren boterea eta gobernua aipatzeko , kulturaren dominazioa , gizonaren unibertso sinbolikoa , etab .	aitaren	6	Def
AIk abiatutako kanpaina dela eta , Amnesty Internationalen jarduerarekin kritiko direla esan arren , erakunde hori indarkeriaren aurpegi ugariak mahai gainean jartzen saiatzen dela esan zuen Otegik .	indarkeriaren	16	Def
Goizean Errioxakoak atseden hartu zuen , eta , gauzak ondo badoaz , hurrengo egunetan normaltasunez arituko da .	atseden	2	Ind
Pasaportea lortzeko arazoak izan zituen , eta hori dela - eta Gasteizen izandako Kopan jokatu zuen lehen partidu ofiziala , Gasteizen bost hilabete eman ondoren .	Kopan	13	Def
Euskadiko Sei Orduetakoa utzi izan banu eta gerorako utzi , okerrago izango zatekeen , beharbada ez bainintzen saiatu ere egingo .	okerrago	10	Ind
Bi ibai hauek aproposak dira amuarrain arrantzarako ere .	arrantzarako	6	Ind
Seguru haren aitak eta Ebbak onartu egingo zutela irakasle izanik .	Ebbak	4	Ind
Ferrarik , aldiz , palmares hobea du .	palmares	4	Ind
" Nik pentsatzen nuen aurreko bi harriekin bost altxaldi kendu , kubikoarekin pittin bat kontrolatu eta bolarekin 16 jasoaldi eginda nahikoa izango nuela , eta ez zuen merezi gehiegi hustea " .	altxaldi	8	Ind
