My takiej nie prowadzimy , nie wykonujemy zadań publicznych dla zysku , ale dla dobra mieszkańców .	zysku	10	Masc
W pierwszych wiekach jego wyznawcy doznali okrutnych prześladowań .	prześladowań	7	Neut
- dodaje gen. Biel .	gen.	2	Masc
Do atrakcyjnej pani bosman podchodzi zniecierpliwiony wczasowicz .	bosman	3	Fem
Malwina spojrzała na niego z odrazą , Kulesza się zaczerwienił , ale Ewa , o dziwo , parsknęła śmiechem .	dziwo	15	Neut
Dawaliśmy mu złoto . . .	złoto	2	Neut
– Bywa , że rolnicy jeszcze przynoszą pisma .	rolnicy	4	Masc
Niektóre sprawy trafiły nawet do kolegium .	kolegium	5	Neut
Sołtys Ligoty Stanisław Kuźnik składa serdeczne podziękowanie wszystkim sponsorom , którzy przyczynili się do zorganizowania festynu i dzięki którym dzieci z Ligoty będą mogły pojechać na wycieczkę .	festynu	15	Masc
W niezwykłym spektaklu Partice'a Chfreau zabrakło głównej bohaterki .	bohaterki	7	Fem
- W iluż miastach w okresie letnim odbywa się tyle bezpłatnych występów artystycznych .	miastach	3	Neut
Najlepszy księgowy województwa śląskiego to rybniczanin .	województwa	2	Neut
Tymczasem korki paraliżują okolice ul . Saskiej , bo kierowcy , aby dostać się na Wał , muszą dojechać na niego wąskimi ulicami Saskiej Kępy .	Wał	15	Masc
- Zakłady i instytucje państwowe działają na podstawie decyzji urzędniczych .	instytucje	3	Fem
Coś notowali , robili fotografie .	fotografie	4	Fem
Aż trudno uwierzyć , że jeszcze kilkanaście dni temu ptaszki ćwierkały , że zostawi stację Waltera i przeniesie się do TVP .	ptaszki	9	Masc
Jego życie było wypełnione dążeniami do Dobra i Sprawiedliwości .	Dobra	6	Neut
Tamta urodziła dziecko z wielkim okiem pośrodku czoła .	okiem	5	Neut
Niewiele brakowało , by zaproponowała odstrzał niegrzecznych myśliwych polujących na kuropatwy .	kuropatwy	10	Fem
Poza wymienionymi , charakterystycznymi rodzajami przebiegu akumulacji w ciągu roku stwierdza się ich modyfikacje lub rodzaje pośrednie .	modyfikacje	13	Fem
Mogą jednak interweniować , gdy mają dowody przestępczej działalności .	dowody	6	Masc
MPK prowadzi jeszcze rozmowy z wojskiem i PKP .	wojskiem	5	Neut
To pierwszy sezon 11-letniego Jurka w amatorskiej lidze małopolskiej , a już wywalczył trzecie miejsce .	lidze	7	Fem
Tematyka prac twórcy z Jarantowic jest różnorodna i w poważnym stopniu zależy od zapotrzebowania , od zamówień odbiorców .	twórcy	2	Masc
W tych miastach znaczne wpływy zdobyła sobie wiara protestancka .	miastach	2	Neut
Przesłuchanie odbędzie się w poniedziałek .	Przesłuchanie	0	Neut
Prokuratura Okręgowa w Krakowie , która prowadzi śledztwo w sprawie wycieku testów w 2000 r . , potwierdziła , że sprzedawano testy w cenach od kilkuset złotych do 15 tysięcy .	testy	21	Masc
Skąd wzięto tyle szmalu ?	szmalu	3	Masc
I mimo chciwości cieszyli się w miasteczku dużym szacunkiem .	chciwości	2	Fem
Radni poruszyli problem złych nawierzchni dróg , domagając się ich remontu .	nawierzchni	4	Fem
Doroczny Bal Mody w salonach Hotelu Europejskiego zgromadził najpiękniejsze panie stolicy .	Mody	2	Fem
Przecież jestem najsławniejszym gliną Federacji " .	Federacji	4	Fem
- Z remontami kapitalnymi jest marnie .	remontami	2	Masc
Stanowczo odradza się naśladowanie ich przez turystów , ponieważ dla człowieka wejście na leżący na zboczu płat śniegu kończy się tragicznie .	zboczu	15	Neut
– Jeden z nich zaczął napierać na mnie ciałem .	ciałem	8	Neut
Ci oczywiście nie zrobili mu najmniejszej krzywdy , gdyż gość był szmalowny .	krzywdy	6	Fem
Nazwisko wyleciało z głowy .	Nazwisko	0	Neut
Za nic nie zrobię z siebie pajaca .	pajaca	6	Masc
Tego nie zastąpi żaden artykuł w gazecie czy debata w telewizji .	debata	8	Fem
Dziś już wiadomo , że powszechnie akceptowany na świecie jest model bazujący na podejściu bilansowym , koncepcji pełnej alokacji i metodzie zobowiązań .	podejściu	13	Neut
Przerwali terapię we Mstowie i w krótkim czasie zmarli z powodu narkotycznego przedawkowania .	przedawkowania	12	Neut
Czytanie jest u kalwinów powinnością religijną , obowiązkiem wierzącego .	kalwinów	3	Masc
Podczas ceremonii otwarcia Spływu organizatorzy przyznali liczne odznaczenia zasłużonym kajakarzom .	odznaczenia	7	Neut
Niedawno premier Pawlak sformułował publicznie , w specjalnym wystąpieniu telewizyjnym , swoje własne zastrzeżenia .	wystąpieniu	8	Neut
– Do dzisiaj , przez prawie półtora roku , nie występowaliśmy o nic .	półtora	6	Neut
To zwierzę wyróżnia się umiejętnością niesienia pomocy .	umiejętnością	4	Fem
Wargi nie pulsowały triumfującą czerwienią .	czerwienią	4	Fem
Poirytowani posłowie - projektodawcy sprawdzili te informacje .	posłowie	1	Masc
Uruchamiany system ma stać się zaczątkiem większego , obejmującego całą Wielkopolskę .	zaczątkiem	5	Masc
Za linią lasu błysnęła w słońcu blacha na wieży kościoła .	linią	1	Fem
Haberda patrzy na Gabrielę bez sympatii .	sympatii	5	Fem
W minionym tygodniu w Poznaniu dyskutowali o niej samorządowcy i przedstawiciele administracji rządowej województwa .	województwa	13	Neut
Nie dostawał przepustek .	przepustek	2	Fem
Jest mowa i o plastikach w paski na kurtki dla pocztów sztandarowych .	pocztów	10	Masc
W Egipcie sporo jest Polaków ; handlowców , inżynierów .	inżynierów	8	Masc
Petronakt nie zgodził się z umorzeniem i złożył na nie zażalenie .	umorzeniem	5	Neut
Czy nowa białoruska elita intelektualna jest już ukształtowana ?	elita	3	Fem
Pomagają okłady z rumianku .	okłady	1	Masc
Ustalono to na podstawie mutacji zachodzących w wirusie .	wirusie	7	Masc
Siano chrzęści w zębach wołów , słychać tylko chrupot i głębokie oddechy zwierząt .	zębach	3	Masc
Księgowe potwierdziły , że działały w porozumieniu z kilkoma członkami spółdzielni .	porozumieniu	6	Neut
Jak poinformował Cesar Fraga z Uniwersytetu w Buenos Aires , przeprowadzone tam badania wykazały , że czekolada wzmacnia antyutleniacze znajdujące się we krwi , zwiększając odporność na zaburzenia serca i naczyń wieńcowych .	zaburzenia	27	Neut
Pamiętam w Iveronie w sześciu gablotach stłoczone największe relikwie .	relikwie	8	Fem
Wprowadzenie rozwiązań proponowanych przez SLD prowadziło by do wynaradawiania .	Wprowadzenie	0	Neut
Przybysz ze Szwecji wyznał , iż od dawna interesuje się malarstwem .	malarstwem	10	Neut
Zwykły mieszkaniec kraju ma się leczyć ziołami , które zaleca tradycyjna medycyna koreańska .	ziołami	6	Neut
Dzięki archiwum zachowały się kopie .	archiwum	1	Neut
Wśród poplenerowych prac królują grafiki i szkice .	szkice	6	Masc
Jest najwyższym mężczyzną w oddziałach Agencji Restrukturyzacji i Modernizacji Rolnictwa w Polsce .	mężczyzną	2	Masc
Pan asesor zamilkł i więcej już do końca sądu nie otworzył ust swoich .	asesor	1	Masc
Malarz uspokoił się .	Malarz	0	Masc
Nie wykluczył zwolnień .	zwolnień	2	Neut
Sklejka , która była tegorocznym pewniakiem do prywatyzacji , nie ma żadnego szefa .	pewniakiem	5	Masc
Miał oczy przymknięte , blada twarz była bez wyrazu , jakby zabierał się do wysłuchania banalnej spowiedzi .	wysłuchania	14	Neut
Rozumiem twoją żałość , Mikołaju . . .	żałość	2	Fem
W ZUS nie ukrywają , że lekarzom trudno udowodnić , iż nadużywają swych kompetencji .	kompetencji	13	Fem
Sprzedaż monti i stanowisk nie pokrywała chronicznego deficytu .	monti	1	Masc
Chodzi przede wszystkim o obniżenie funduszy strukturalnych i 25-procentowy wyjściowy poziom dopłat dla rolników .	obniżenie	4	Neut
Zmarł w klinice onkologicznej w Warszawie .	klinice	2	Fem
Reagując na stan zaspokojenia tych potrzeb , przeżywa emocje .	zaspokojenia	3	Neut
Uszanowanie i respekt przed Bogiem są bardzo mocno zaakcentowane w doświadczeniu proroków .	Uszanowanie	0	Neut
- Mów że składniej , frater !	frater	5	Masc
Poczta zmniejsza swój deficyt i już w 1997 r. powinna zacząć przynosić zyski .	deficyt	3	Masc
Wczoraj , po zamknięciu lokali wyborczych , niemieckie media zapowiedziały , że pani minister ustąpi ze stanowiska .	zamknięciu	3	Neut
Milicjant i ratownik zaczynają od powrzaskiwań i epitetów .	powrzaskiwań	5	Neut
Równie dobrze mógł by m być chyba biologiem , geometrą .	geometrą	9	Masc
Na parę minut przedtem Roman przyszedł do bufetu z pustym koszykiem do bułek .	bufetu	7	Masc
Ich przedstawiciele , służąc w Gwardii Szlacheckiej , dodawali splendoru Stolicy Piotrowej , a jednocześnie znajdowali tam niejednokrotnie środki dla wygodnego życia , ponieważ za swą służbę otrzymywali pensje .	splendoru	9	Masc
Policjanci odpowiedzieli strzałami .	strzałami	2	Masc
Po ostrej wymianie zdań chłopak wszedł do środka , niestety nie zdążył już niczego zamówić .	zdań	3	Neut
W dziesięciu wsiach przybyło 424 nowych abonentów .	abonentów	6	Masc
Ale płód nie jest dzieckiem .	płód	1	Masc
Krzysztof postanowił dorzucić do maila trochę autentyzmu .	maila	4	Masc
Dziesięciu jeźdźców pokonuje trasę z Torunia do Pucka .	trasę	3	Fem
Wzdłuż kamiennej podmurówki obszedł dom wokoło .	podmurówki	2	Fem
Mój Piotrek uchodzi za speca w dziedzinie drewnianego budownictwa na Podhalu .	budownictwa	8	Neut
Kobieta obracała karty z cichym szelestem .	szelestem	5	Masc
Opony delahaye jednostajnie szumią po asfalcie .	Opony	0	Fem
Hodowla owiec jest do dzisiaj jedną z głównych gałęzi gospodarki tych nadal słabo zaludnionych rejonów .	gospodarki	9	Fem
Od tego czasu sprawa czekała na wyznaczenie terminu .	wyznaczenie	6	Neut
W sobotę podporucznik Ziemba przeniósł swoje łóżko do kuchni , rowery wstawiono do pokoju podporucznika Kowalika .	podporucznika	14	Masc
Pierwszy numer wyjdzie przed świętami .	świętami	4	Neut
Towarzysz jego wzywał Jezusa i jego Matkę , a tacy ludzie jak Esteban wołają te słowa tylko twarzą w twarz ze śmiercią .	Towarzysz	0	Masc
W czasie pozorowanych działań bojowych jednostki z pozycji obronnych dokonają przegrupowania , aby po sforsowaniu szerokiej przeszkody wodnej wyjść na nowe rubieże aktywnych działań zaczepnych .	sforsowaniu	14	Neut
- Znowu zajmujesz się jakimś morderstwem ?	morderstwem	5	Neut
Orkiestry murzyńskie grają ragtime'y , tłum cheerleaderek tworzy radosny , falujący szpaler .	ragtime'y	3	Masc
Mężczyźni po pierwszej łyżce wstali od stołu .	łyżce	3	Fem
Nie żyje już Kunz Aulock ani nikt z jego kompanii .	kompanii	9	Fem
Zauważono też nagminne zaniżanie zarobków pracowników za dni urlopowe lub chorobowe .	zarobków	4	Masc
W depresjach organicznych chory często czuje się zagubiony , bezradny , opuszczony i samotny .	depresjach	1	Fem
Działo się to podczas dochodzenia do nabrzeża w Ystad .	nabrzeża	6	Neut
W opinii BCC dzięki kompromisowi politycznemu , którego zwolennikiem był ekspremier , Polska jest obecnie gospodarczym tygrysem Europy Środkowo - Wschodniej .	tygrysem	16	Masc
Brytyjczycy są więc dominującym udziałowcem w największym polskim towarzystwie emerytalnym .	towarzystwie	8	Neut
Marek mógł by doznać szoku .	szoku	4	Masc
Jednak sam chipset nie stanowi jeszcze o atrakcyjności danej płyty dla użytkownika .	chipset	2	Masc
Skazał go na wiele niepotrzebnych cierpień .	cierpień	5	Neut
Następnie podgrzewamy i przesączamy przez gęste sito .	sito	6	Neut
– i takie akordeony kupują zawodowi akordeoniści ?	akordeoniści	6	Masc
Ale poczucie krzywdy i duma były silniejsze niż zdrowy rozsądek .	krzywdy	2	Fem
Wojewódzki Inspektorat IH był pierwszym w Polsce , który jeszcze na podstawie starych przepisów zawarł porozumienie z Polskim Towarzystwem Towaroznawczym .	Towarzystwem	18	Neut
Uroczysta msza święta w intencji reprezentacji Polski w piłce nożnej została odprawiona w piątek w Kazimierzu Dolnym .	intencji	4	Fem
W takich warunkach wielu duchownych decydowało się na organizowanie katakumbowego życia religijnego .	organizowanie	8	Neut
Dziewczynę bolało kolano .	Dziewczynę	0	Fem
Słucham i uszom nie dowierzam .	uszom	2	Neut
Wyniki badań nad wszystkimi 13 właściwościami doskonale ilustruje przejrzysty wykres na 165 stronie książki .	właściwościami	5	Fem
Biedny ptak , z szeroko otwartym dziobem , zwisał głową w dół , niby ułamana z krzewu kiść .	ptak	1	Masc
Chciał by być teraz w namiocie , oddzielony od wszystkiego .	namiocie	5	Masc
– to zero .	zero	2	Neut
Doświadczenie zawodowe zdobyła pracując w teatrze i telewizji w Polsce i na Ukrainie .	Doświadczenie	0	Neut
Zawrzały dusze , serca i umysły .	dusze	1	Fem
Trzeszczą cekaemy i tną powietrze .	powietrze	4	Neut
Wystarczy zwisający kabel od czajnika elektrycznego .	kabel	2	Masc
Dżabie chrupnęło w kościach .	kościach	3	Fem
Krzyczy na mnie tylko trochę , kiedy się biję ze starszym bratem .	bratem	11	Masc
Więc może odpolitycznić ten sport ?	sport	4	Masc
Wszyscy używają żabek do firanek .	żabek	2	Fem
Załamała się tradycja zbiorowych wystąpień i manifestacji .	tradycja	2	Fem
Trzeba pousuwać z działek stojącą wodę i uporządkować strychy oraz piwnice .	działek	3	Fem
Teraz kmieci zamieniono w niewolników .	kmieci	1	Masc
To nie jest coś , co było moim celem .	celem	8	Masc
Coraz częściej spotykamy się z tragedią samobójstw .	samobójstw	6	Neut
U nas takie imprezy są zupełną nowością , ale na Zachodzie to bardzo popularna dyscyplina .	nowością	6	Fem
To jakiś dziwak albo pomylony .	dziwak	2	Masc
Kiedy rysuje , odlewa wielkie postaci w brązie i tworzy delikatne maski z żywicy , nigdy nie zatrzymuje się na jednym egzemplarzu .	brązie	7	Masc
Ibsen zamieniał z żoną kilka wyrazów jedynie w wigilię i urodziny .	żoną	3	Fem
Z Karolem weszli śmy w ścisłą sztamę w podchorążówce .	sztamę	6	Fem
Na bezdomne po Powstaniu Warszawskim dwie głośne pisarki czekały w Łodzi zarezerwowane dla nich mieszkania .	Powstaniu	3	Neut
Choinka mieni się różnobarwnie , z bożonarodzeniowego bierwiona w kominku bije przytulne ciepło .	bierwiona	7	Neut
Skończył technikum budowlane , klasę konstrukcji stolarskich .	technikum	1	Neut
Wraz z kolejnymi minutami potrawa zmieniała się z płynnej w coraz bardziej stałą .	potrawa	4	Fem
Niezależnie od przedstawionych wyników , kontrolę przeprowadzą jeszcze policjanci z Komendy Wojewódzkiej Policji w Katowicach .	Komendy	10	Fem
- Czy w Sejmie powstaje koalicja wszystkich partii przeciw Prawu i Sprawiedliwości ?	Sprawiedliwości	11	Fem
Dziecko utopiło się w żwirowisku w okolicach Wrocławia .	Dziecko	0	Neut
Żelazny kolos Żugajowi nie nabił nawet guza .	guza	6	Masc
Przekazał policjantowi dziewczynę i popłynął do brzegu .	policjantowi	1	Masc
Jak stawiać granice dzieciom z FAS ?	dzieciom	3	Neut
Pod władzą nowego proboszcza rozpoczęła się reforma skostniałej kościelnej instytucji .	proboszcza	3	Masc
Poprawkę skrytykował już dyrektor wykonawczy Światowego Kongresu Żydów Elan Steinberg .	Poprawkę	0	Fem
Dębski z przyjemnością zapadł w kąt kanapy .	kanapy	6	Fem
Przez tydzień włóczył się bez celu po Melbourne , wyczekiwał na rozkazy .	rozkazy	11	Masc
Horti 2000 to także okazja do zapoznania się z najnowocześniejszymi sprzętami ogrodowymi , niezbędnymi nawozami , które sprawiają , ze nasza działka będzie obiektem zachwytu .	obiektem	23	Masc
W jego głosie Kloss usłyszał wahanie .	wahanie	5	Neut
Zatrzymał potop .	potop	1	Masc
Dotknął wilgotnego ręcznika w łazience , pogładził mięsistą połę szlafroka , powąchał mydło w cedrowej kasetce .	mydło	12	Neut
Ale dla mnie nie ma różnicy między Włochem , Polakiem czy Węgrem .	różnicy	5	Fem
Czasem wraca jakieś niezłe szyderstwo Wojtasa .	szyderstwo	4	Neut
Ale kłamstwa się wydały .	kłamstwa	1	Neut
Kadencja rady potrwa do 2007 r.	Kadencja	0	Fem
Z jego zeznań wynika , że wczoraj około godziny 15 podjechał samochodem na ulicę Grażyńskiego .	zeznań	2	Neut
- To sprawiło by waszemu nauczycielowi dużą przyjemność .	nauczycielowi	5	Masc
Gazety o nim piszą .	Gazety	0	Fem
Skórkę zostawia się na talerzu .	Skórkę	0	Fem
– Zamierzam rozmawiać i dzielę się z panią różnymi wrażeniami .	wrażeniami	9	Neut
Napastnicy grozili nastolatkom , że ich pobiją .	nastolatkom	2	Masc
Po utrwaleniu ich w formalinie przekazał je do muzeum w Paryżu .	utrwaleniu	1	Neut
- A kto by tam mierzył kawałki ? . . .	kawałki	6	Masc
Nowa kamera Canona automatycznie ustawia wszystkie parametry nagrywania , bardziej ambitnym użytkownikom pozwala jednak samodzielnie kontrolować ostrość obrazu i ekspozycję .	ekspozycję	19	Fem
Poczęstowano nas kawą , a nie wódą .	wódą	6	Fem
Od poniedziałku toczyły się walki o jego odbicie .	poniedziałku	1	Masc
- Mleko już się rozlało .	Mleko	1	Neut
Partie polityczne oraz reprezentujący ich politycy stanęli w wyborcze szranki .	szranki	9	Neut
w głębi duszy tłumisz pragnienie ucieczki od samej siebie .	głębi	1	Fem
Inwestycję wznowiono w połowie 2004 roku , a wartość zadania wynosi 5,6 miliona złotych .	Inwestycję	0	Fem
Oprócz słuchania Steczkowskiej delegaci zajmowali się dyskusją o strajku generalnym .	słuchania	1	Neut
Zagrać kawalerowi ?	kawalerowi	1	Masc
Miejsca rozgrywania spotkań zostały ustalone w drodze losowania w siedzibie Polskiego Związku Tenisa Stołowego w Warszawie .	Miejsca	0	Neut
Miał em je pobierać w miesięcznych ratach .	ratach	6	Fem
Miasto otuliła mgła .	mgła	2	Fem
Dzięki poradnikowi dowiadujemy się , że roczną deklarację oznaczają cyfry 01 .	01	10	Neut
Czy jednak tak jest i czy podjęcie zatrudnienia przywróci wewnętrzny spokój ?	podjęcie	6	Neut
Po drugie , wkraczali śmy na wyjątkowo niewdzięczny teren .	teren	8	Masc
Ponadto zastosował środek zapobiegawczy w postaci zakazu opuszczania kraju , zawieszenia w czynnościach służbowych oraz poręczenie majątkowe w wysokości 10 tys . zł .	poręczenie	15	Neut
Miłość nie jest nadopiekuńczością .	nadopiekuńczością	3	Fem
Miasto Detroit do tej pory płonie , a wyjątkowo upalna pogoda sprzyja rozszerzaniu się pożarów .	rozszerzaniu	12	Neut
Luksusowego forda explorera nieznani sprawcy skradli wczoraj w Warszawie generałowi rosyjskiej milicji .	generałowi	9	Masc
Kontrolerzy nie wzięli pogróżek poważnie , bo wiedzieli z doświadczenia , że w podobnej sytuacji prawie każdy podatnik powołuje się na możnego protektora . . .	pogróżek	3	Fem
– Ma Pan już hasło wyborcze i pomysł na kampanię ?	hasło	4	Neut
- Jakie znaczenie dla śledztwa ma odkrycie dokonane w archiwach w Łomży , o którym niedawno poinformowała prof . Daria Nałęcz ?	odkrycie	6	Neut
Biznesmena Roku wybierano na Pomorzu już po raz szósty .	Biznesmena	0	Masc
Drzwi uchyliły się z lekkim skrzypieniem nie naoliwionych zawiasów .	skrzypieniem	5	Neut
Sprawiłoby to , że Radzie Bezpieczeństwa znacznie trudniej byłoby podjąć niezbędne decyzje .	decyzje	11	Fem
Aby pomóc przewodnikom w sporządzeniu spisu potrzebnych rzeczy , podajemy przykładowe zestawy sprzętu dla poszczególnych działów prac na kolonii .	sprzętu	12	Masc
Dlatego ceni się sumienność , odpowiedzialność , perspektywiczne myślenie .	myślenie	8	Neut
Iluż poważnych obecnie pisarzy czytało swe pierwsze próby literackie w sali przy Krupniczej , siedząc wokół dębowych stołów zsuniętych pośrodku .	stołów	17	Masc
Duże kontrowersje wzbudził zapis wywalczony przez Związek Nauczycielstwa Polskiego .	Nauczycielstwa	7	Neut
Neandertalczycy żyli w Europie dwieście tysięcy lat .	Neandertalczycy	0	Masc
Megane oddał synowi , pracownikowi dydaktycznemu warszawskiej uczelni .	Megane	0	Neut
W samej końcówce rozpaczliwe broniliśmy się i naprawdę radomianie napędzili nam wielkiego stracha .	stracha	12	Masc
Wspominają wspólne biesiadowanie .	biesiadowanie	2	Neut
Taki czek nie może być bezpośrednio zamieniony na gotówkę .	czek	1	Masc
Turkowska mleczarnia od dłuższego czasu ma problemy finansowe .	mleczarnia	1	Fem
Nie złożyłem podpisu pod wnioskiem o wotum nieufności skierowanym do marszałka Sejmu .	nieufności	7	Fem
Umyślił teraz opowiedzieć to zdarzenie choremu wnuczkowi .	zdarzenie	4	Neut
Pojawiła się nawet sama prezes Urzędu Mieszkalnictwa Barbara Blida .	Urzędu	5	Masc
Pannę Wiosnę rozpiera młodzieńcza energia .	energia	4	Fem
Wziąłeś slipki ?	slipki	1	Neut
Podręczniki powinny uwzględniać zasadę równych praw kobiet i mężczyzn .	zasadę	3	Fem
- Stara ogrodnicza prawda mówi , że każdemu drzewu i krzewowi przycięcie zrobi dobrze .	przycięcie	11	Neut
Chodzę w czarnych okularach nawet w pochmurne dni .	okularach	3	Neut
Załamała się tradycja zbiorowych wystąpień i manifestacji .	tradycja	2	Fem
Bardzo często , kiedy był em wściekły i napięty , wypijał em na rozluźnienie piwko czy setkę .	rozluźnienie	13	Neut
W stanie obrzydzenia przyprawiającego o nowe mdłości nie zauważył nawet , że wielki ból zaczyna z wolna zanikać .	mdłości	6	Neut
Pokrzepiła mnie tym na duchu .	duchu	4	Masc
Jego usuwaniem zajęli się strażacy ze specjalistycznym sprzętem .	usuwaniem	1	Neut
Oczywiście , to było konstruktywne myślenie .	myślenie	5	Neut
W niedzielę rano odprawiono z okazji rocznicy śmierci kompozytora msze święte w kościołach sióstr Wizytek i św . Krzyża , gdzie spoczywa serce Chopina .	serce	22	Neut
I w Ławrze palił em świeczki cienkie jak włos . . .	włos	8	Masc
Zanieczyszczenia cytoplazmatyczne i błonowe są również groźne , stanowiąc prawdopodobne źródło zarówno aktywności proteolitycznej , jak i białek cytoplazmatycznych w puli niehistonowej .	Zanieczyszczenia	0	Neut
Proponuje za to referendum w sprawie przekształcenia AWS w jedną partię .	przekształcenia	6	Neut
Potępiamy prezydenta Kaczyńskiego za podłość .	podłość	4	Fem
Godzinami , chmurni , łazili po mieście , ciągała go po galeriach , muzeach , teatrach .	galeriach	11	Fem
Jeden z mężczyzn przystąpił do majstrowania przy kablach telefonicznych .	kablach	7	Masc
Kilka dni po ukazaniu się ogłoszenia telefon dzwonił 24 godziny na dobę .	dobę	11	Fem
Był ostro atakowany przez endecję .	endecję	4	Fem
Nadmieniamy , że w pierwszą niedzielę lutego br . przeprowadzono zbiórkę pieniędzy na zakup niezbędnego urządzenia medycznego do pracowni analitycznej w Wiejskim Ośrodku Zdrowia w Brzeziu .	lutego	6	Masc
Cała nadzieja na przerwanie szaleństwa tworzenia urzędów centralnych tkwi w prezydencie .	nadzieja	1	Fem
- Blondynka popatrzyła na tancerzy , którzy przy bufecie głośno rozmawiali z właścicielem knajpy .	tancerzy	4	Masc
Oczywiście , to było konstruktywne myślenie .	myślenie	5	Neut
Tak już chyba na serio nie mówimy , a nasz cyniczny wiek jakąś aurę śmieszności wokół słowa zbudował .	aurę	13	Fem
W czwartek Prokuratura Okręgowa w Warszawie skierowała do sądu wniosek o aresztowanie .	aresztowanie	11	Neut
Pod tą opinią z raportu organizacji katolickich podpisałyby się obiema rękami także feministki .	rękami	10	Fem
Pojawia się w niej panna Jane Marple , detektyw - amator .	detektyw	8	Masc
Według jego oceny niezbędne będą dalsze spotkania przed podpisaniem porozumienia .	podpisaniem	8	Neut
Lekcja kończy się rozczarowaniem , ale mistrz wydaje się daleki od rezygnacji .	rozczarowaniem	3	Neut
Ewa ma klucze .	klucze	2	Masc
Szereg takich poleceń składałby się na całą procedurę , którą urządzenie byłoby sterowane .	poleceń	2	Neut
Na tegorocznym inauguracyjnym balu tradycyjnego karnawału w Rio pracowały równolegle dwie komisje sędziowskie .	balu	3	Masc
W początkach następnego tysiąclecia jej ruiny pokrył śmietnik .	początkach	1	Masc
Tu latają cyklony , podejdą wyżej , będzie wiało od wyżu .	wyżu	10	Masc
Zapalono wszystkie lampy , ustawiono ruchome wieszadła , kelnerzy w oczekiwaniu gości spacerowali po korytarzach hotelowych .	wieszadła	6	Neut
Nie chcesz łykać lewej gorzały ?	gorzały	4	Fem
- Posiada osobowość prawną .	osobowość	2	Fem
W deklaracji żądają , by prezydent złożył dymisję .	deklaracji	1	Fem
Tymczasem w liceach prowadzonych przez Społeczne Towarzystwo Oświatowe zdanie egzaminu dojrzałości nie należy do najłatwiejszych .	liceach	2	Neut
Dochodzą niepokojące sygnały dotyczące prywatyzacji stoczni .	sygnały	2	Masc
- Zgromadziliśmy tu najstarsze i najładniejsze kostiumy .	kostiumy	6	Masc
Po 20 minutach helikopter ląduje na dachu szpitala .	helikopter	3	Masc
W związku z wyrażonym wotum nieufności , Ponikowski w imieniu całego gabinetu poprosił o dymisję , która została przyjęta .	dymisję	14	Fem
- Dobre prognozy są trudniejsze do sformułowania ?	prognozy	2	Fem
Jest sobie system języka i teksty tego języka .	teksty	5	Masc
Magazyn pozwoli firmie na zaspokojenie potrzeb rynku poprzez zapewnienie odpowiednich zapasów ogumienia .	Magazyn	0	Masc
Powrót odbywa się w tempie przyspieszonym .	Powrót	0	Masc
Przykręca knot i dmucha w płomień lampy .	knot	1	Masc
Finansowo wspiera Trutnia Gminny Ośrodek Kultury w Rabie Wyżnej , a także skawiańscy biznesmeni z Polski i Chicago .	Kultury	5	Fem
" Obywatelu Bukowiński , proponujemy wam repatriację do Polskiej Republiki Ludowej " .	Obywatelu	1	Masc
- Wrogowie czyhają na nasze ziemie !	ziemie	5	Fem
Naszym zadaniem było jedynie znalezienie i wyremontowanie pomieszczenia .	znalezienie	4	Neut
To informacja poprzedzona chrząknięciem , ściszeniem głosu , podana jakby mimochodem .	ściszeniem	5	Neut
Warszawski Indeks Giełdowy zyskał 5 procent , a WIG20 , indeks największych spółek na parkiecie , wzrósł o 6,1 procent .	parkiecie	14	Masc
Starym kawalerem zostanie i następcy zabraknie , tradycja garncarska w rodzinie Kraszewskich zaginie . . .	kawalerem	1	Masc
Muszę przyznać , że troszkę pogubił em się w tych wszystkich liczbach i datach .	liczbach	11	Fem
Wyszliśmy na dwór , a potem kroczyliśmy smutno ulicą Wolności , obok naszej piekarni , naszego fryzjera , naszej apteki .	fryzjera	16	Masc
