Policja z uwagi na prowadzone wciąż czynności operacyjne nie ujawnia szczegółów dotyczących tej sprawy .	szczegółów	10	Masc
Oznacza to , że odbierze każde przychodzące wywołanie .	wywołanie	7	Neut
Jest to istotne , zwłaszcza dla internautów korzystających z modemów .	modemów	9	Masc
Podstawowe terminy powstały podczas badań lodowców w górach umiarkowanej strefy klimatycznej .	górach	7	Fem
Pomaga w sprzątaniu i wszelkich kłopotach zdrowotnych .	sprzątaniu	2	Neut
Niezwyciężony lęk przed dziwem w każdym momencie serca przychodniów przeszywał .	lęk	1	Masc
Opiekę sprawuje opiekun .	Opiekę	0	Fem
Włącza radio , znajduje muzykę , wraca do naczyń .	naczyń	8	Neut
Balkon był pusty .	Balkon	0	Masc
Piłsudczycy nie dopuścili do dyskusji w Sejmie , który zresztą został rozwiązany 30 sierpnia 1930 r . , w połowie kadencji .	dyskusji	4	Fem
Najwyraźniej przebiegł przez holo tej reklamy .	reklamy	5	Fem
Cała delegacja była ubrana w czarne smokingi .	delegacja	1	Fem
Gorące spojrzenia towarzyszyły kandydatkom do korony podczas całego rejsu .	kandydatkom	3	Fem
Większość nie stosowała się do obowiązujących zakazów zatrzymywania i postoju .	postoju	9	Masc
- Lud jest nasz !	Lud	1	Masc
Twarz Gabrieli była szara .	Twarz	0	Fem
Wyciągał jedynie wnioski z obszaru i potencjału państwa rosyjskiego twierdząc , że dwa mocarstwa , Rosja i Ameryka , określać będą przyszłość świata .	mocarstwa	13	Neut
Nietschke myślał chwilę o samotnym , smutnym ptaku .	ptaku	7	Masc
Odwołany rząd , który zostaje przez Sejm zmuszony do rządzenia , zwykle przestaje pracować .	rządzenia	9	Neut
W ten sposób Sejm miałby szansę mieć prawdziwy mandat społeczny .	szansę	5	Fem
W sidła oszustów - pośredników oferujących pracę Polacy wpadają także w Hiszpanii .	pośredników	4	Masc
Kuskus przygotować według przepisu na opakowaniu , dodając 2 łyżki masła i szczyptę soli .	szczyptę	12	Fem
Tam kierowca forda , wymijając volkswagena golfa , uderzył w niego .	volkswagena	5	Masc
- Analfabetyzmowi wydali śmy zdecydowaną walkę , spodziewamy się niebawem zlikwidować go całkowicie .	Analfabetyzmowi	1	Masc
Według dyżurnego Komendy Miejskiej Policji w Chorzowie po przebudzeniu dziecka stwierdzono , że zostało ono upite .	Komendy	2	Fem
Andrzej Lepper miał zamówić wiersze podczas swoich urodzin .	urodzin	7	Neut
Czy mogę złożyć wspólne zeznanie z byłą żoną ?	żoną	7	Fem
W ostrym tempie przejechali sześćdziesiąt kilometrów na szosie modlińskiej .	tempie	2	Neut
Decyzja zapadnie dzisiaj rano .	Decyzja	0	Fem
Nakładamy rękawice ochronne , zapinamy swetry i wychodzimy na pokład .	rękawice	1	Fem
Członkowie nakielskiego stowarzyszenia podczas spotkania omówili główne cele swojej działalności .	cele	7	Masc
Za klechami Zyga nie jest .	klechami	1	Masc
- Niedługo będzie oczko .	oczko	3	Neut
Tematyka prac twórcy z Jarantowic jest różnorodna i w poważnym stopniu zależy od zapotrzebowania , od zamówień odbiorców .	zamówień	16	Neut
- Czy różnice interesów w koalicji nie przeszkodzą w kontynuowaniu reform ?	kontynuowaniu	9	Neut
W sprasowanych autach zginęły cztery osoby .	autach	2	Neut
Toż ja pisał em o monitorze komputera .	komputera	6	Masc
Hiszpański wicekról Argentyny kazał wysłać znalezisko do Madrytu .	znalezisko	5	Neut
Początek przedstawienia to bardzo delikatny moment wchodzenia w fikcję .	wchodzenia	6	Neut
Sanitariusz wyciągnął ze skrzyni dwa gumowe fartuchy .	skrzyni	3	Fem
Eli chwycił wiadra i ruszył za nią kamienistą dróżką .	wiadra	2	Neut
- Sapnęła , ale pod warstwą chłodu zamajaczyła iskierka rozbawienia .	chłodu	6	Masc
A więc teraz szczodrze wynagrodzi mu niedosyt !	niedosyt	6	Masc
Listę tę prezydent Stanów Zjednoczonych przekazał w poniedziałek innym państwom .	państwom	9	Neut
Komisja Europejska traci cierpliwość .	cierpliwość	3	Fem
Tym razem postawiono na casting także w mniejszych miastach .	miastach	8	Neut
Swą ważność utraciły one w czerwcu .	ważność	1	Fem
Ilość plam pulsujących w jego oczach mnożyła się w zastraszającym tempie .	tempie	10	Neut
Wybrałbyś życie matki czy świni przy tej operacji przeszczepu wątroby ?	przeszczepu	8	Masc
Sądził em , że szarość nie powinna być niema .	szarość	4	Fem
Siła uderzenia wbiła renaulta w innego tira .	uderzenia	1	Neut
" W dzieciństwie byłem często rozpieszczany przez mamę , ale tato mnie lał " .	mamę	7	Fem
W kontekście emocjonalnych , osobistych wypowiedzi ta budzi podejrzenie o nieautentyczność .	podejrzenie	8	Neut
Na cóż pogłębiać straszliwy kryzys ?	kryzys	4	Masc
Śmieszy mnie ta zabawa w barbarzyńcę , bezmyślne opróżnianie butelek pod krzyżówkę Mickiewicza z amerykańskim hamburgerem .	opróżnianie	8	Neut
Rosną tutaj , w okolicy , całe sady jarzębinowe .	sady	7	Masc
Tylko wyszła z koła dwa razy .	koła	3	Neut
Stan termiczny lodowca jest rezultatem współdziałania kilku procesów .	współdziałania	5	Neut
Jest to duże urządzenie , ale dzięki wprowadzonym ostatnio znacznym usprawnieniom łatwe jest jego obsługiwanie .	urządzenie	3	Neut
Ale ambicja kazała mu natychmiast odrzucać obrzydzenie i opory .	opory	8	Masc
Jego anegdoty traktowały o najrozmaitszych księżach dziwakach , których w okolicy nie brakło , a których przygody tchnęły często humorem z epoki Seweryna Soplicy czy nawet Paska .	humorem	19	Masc
Przewaga któregokolwiek układu skurczowego lub niedowład któregokolwiek układu rozkurczowego powoduje skurcz mięśni gładkich oskrzeli .	skurcz	10	Masc
Wojna tak długo nie potrwa .	Wojna	0	Fem
Pogoda psuła się .	Pogoda	0	Fem
Hindusi i ja wybrali śmy się na zielone gołębie .	gołębie	8	Masc
Osadza się na odzieży oraz trwałych nieprzepuszczalnych powierzchniach takich jak beton czy asfalt .	powierzchniach	7	Fem
Jeden hotel musiał być oddany po wygaśnięciu dzierżawy , drugi sprzedano , aby pokryć dług w Funduszu Społecznym Żołnierza .	wygaśnięciu	6	Neut
Mówiły one o uniezależnieniu się Prus Książęcych od Polski .	uniezależnieniu	3	Neut
Mamy dziesięcioletnie doświadczenie z samorządami gminnymi .	samorządami	4	Masc
Wojsko się skasuje .	Wojsko	0	Neut
- Nasi żarłoczni przyjaciele ciągle są w amoku . . .	amoku	7	Masc
Receptą Hewitta na zmianę tego stanu rzeczy jest odformalizowanie fizyki .	odformalizowanie	8	Neut
Największy na świecie producent sieci komórkowych zamierza skupić się na podstawowej działalności , a aparaty będzie kupował od producenta zewnętrznego z siedzibą w Singapurze i tylko sygnował je własnym znakiem towarowym .	siedzibą	21	Fem
- Czy reżyser z pewnym sukcesem , taki jak pan , może sobie w Polsce jakoś zaplanować karierę ?	reżyser	2	Masc
A znał arytmetykę ?	arytmetykę	2	Fem
Zatrzymanym przedstawiano zarzuty udziału w zorganizowanej grupie przestępczej i wprowadzenia na rynek narkotyków .	narkotyków	12	Masc
Ten okres minnesangu zakończył się w ostatniej dekadzie XII wieku , gdy naśladownictwa ustąpiły nowym tematom i formom wypracowanym przez miejscowych poetów .	formom	17	Fem
W schronisku tym przebywają bezdomne dzieci ze swoimi matkami .	schronisku	1	Neut
Fluor uszkadza nerki , zmniejsza odporność na infekcje i sprzyja rozwojowi alergii .	nerki	2	Fem
Rośnie pokolenie ludzi straconych , wyrzuconych . . .	pokolenie	1	Neut
Przez godzinę z boiska wiało nudą , a piłkarze prezentowali futbol plażowy .	futbol	10	Masc
Świadkowie twierdzą , że spod siedziby SdRP odjechało w ostatnich kilkunastu miesiącach kilka takich grup .	siedziby	5	Fem
Dankowski objął Bełchatów na początku sezonu , a pierwszej porażki doznał dopiero w siódmej kolejce .	sezonu	5	Masc
Śledztwo przeciwko świadkowi koronnemu zostanie umorzone dopiero , gdy bez zarzutu wypełni swoją rolę .	świadkowi	2	Masc
To okres na zamykanie , kończenie różnych spraw .	kończenie	5	Neut
Ci z dołu łapią ich za nogawki , żeby ściągnąć do swojego poziomu .	nogawki	6	Fem
Nie wstąpi jego stopa junacka w strzemiona ojcowe .	strzemiona	6	Neut
Co kwartał wysokość tych kwot może się zmienić w związku ze zmianą ceny metra kwadratowego ogłaszaną przez GUS .	zmianą	11	Fem
Podróżujący pierwszą klasą będą odtąd mogli wypoczywać podczas lotu na rozkładanych podwójnych siedzeniach .	klasą	2	Fem
Antybiotyki to związki chemiczne wytwarzane w naturze przez same drobnoustroje .	drobnoustroje	9	Masc
Truchtali spokojnie , bez pośpiechu , z przodu dostrzegli sylwetkę w zielonym mundurze , zbliżyli się powoli .	mundurze	12	Masc
Są to jedynie najważniejsze , opisane dość pobieżnie , zranienia w dziedzinie seksualnej , które wymagają uzdrowienia .	uzdrowienia	16	Neut
To zwierzę wyróżnia się umiejętnością niesienia pomocy .	niesienia	5	Neut
Chodzi o to , żeby demonstracje odbywały się w spokoju , żeby w minimalnym stopniu zakłócały życie innych ludzi i żeby nie było polską normą bicie policjantów , okupowanie budynków , wyrywanie znaków drogowych czy niszczenie samochodów .	okupowanie	28	Neut
Który nie dostarczył zboża na przemiał , będzie odpowiadał .	zboża	3	Neut
- Nie mogę już , kapralu , nie mogę .	kapralu	5	Masc
Wiatr przynosił ostry alkoholowy zapach traw .	traw	5	Fem
Ofiarą neofaszystów może być każdy , bo na zdjęciach są też ludzie , którzy jedynie znaleźli się w pobliżu różnych manifestacji .	Ofiarą	0	Fem
Przewiduje on wynajęcie firm zewnętrznych , które zajmą się utrzymaniem sieci abonenckiej TP SA .	utrzymaniem	9	Neut
Mieszkał em w domu polskich księży , niedaleko osobliwej piramidy , grobowca Cestiusza .	piramidy	9	Fem
Nie wyklucza się , że powodem wypadku było zaśnięcie kierowcy .	zaśnięcie	8	Neut
Tymczasem w bufecie panna Tola czyściła koszyki do chleba .	bufecie	2	Masc
Kobieta w fartuchu sprzedaje jej papierowy bilet .	fartuchu	2	Masc
Dyrektor archiwum na Łubiance przekazał te materiały synowi Stanisława Głąbińskiego .	archiwum	1	Neut
Nakazał też zdemontowanie istniejących terminali .	terminali	4	Masc
Kilka razy pociągnął nosem .	nosem	3	Masc
Leki na obniżenie temperatury nie działały , a sytuacja , według słów Havlovej , w nocy z poniedziałku na wtorek stała się krytyczna .	temperatury	3	Fem
Jeśli spojrzymy na inicjatywę polityczną liderów pierwszej dziesiątki , to okaże się , że aż szóstka zaczynała swą karierę w PZPR .	karierę	18	Fem
Dębski z przyjemnością zapadł w kąt kanapy .	kąt	5	Masc
Aspirant przerzucił kilka kartek w notesie .	kartek	3	Fem
Unosiła się wokół nich anielska aura .	aura	5	Fem
Znacznie lepiej zagrał przed przerwą Kwapisiewicz na lewym skrzydle .	skrzydle	8	Neut
Policjanci z pobliskiego komisariatu przyznają , że docierają do nich sygnały o rozbojach .	komisariatu	3	Masc
Wszystko zniechęca do prowadzenia dziennika .	dziennika	4	Masc
Ciało , które ginie , jest jedynie opakowaniem dla duszy .	opakowaniem	7	Neut
Amerykanie patrząc zza Oceanu na Europę myślą niemal wyłącznie kategoriami strategicznymi i gospodarczymi .	Oceanu	3	Masc
Proboszcz wzniósł oczy w sufit i westchnął o świętą cierpliwość .	Proboszcz	0	Masc
Nim przekroczy granice raju , musi wyrazić skruchę .	skruchę	7	Fem
Na piątym był ostatni etap .	etap	4	Masc
Na tej klepce bracia mocno się poślizgnęli .	bracia	3	Masc
Jak zwykle , kiedy wpadał w falset , uderzał laską o podłogę .	falset	6	Masc
Kłótnia trwa .	Kłótnia	0	Fem
Krzywulą wędrowca podwajał stare swe kroki .	Krzywulą	0	Fem
Po odbyciu kary Zdankiewicz znów brylował w podrzędnych knajpach .	kary	2	Fem
A seks jest przymusem .	przymusem	3	Masc
Dlatego uniknęli śmy krwawej dyzenterii lub tyfusu .	tyfusu	6	Masc
Na bezdomne po Powstaniu Warszawskim dwie głośne pisarki czekały w Łodzi zarezerwowane dla nich mieszkania .	pisarki	7	Fem
Już we wtorek prezydent Kwaśniewski wybiera się z roboczą wizytą do Paryża , by przekonywać do naszych racji prezydenta Jacquesa Chiraka .	wizytą	9	Fem
Zamek chętnie zwiedzają cudzoziemcy .	cudzoziemcy	3	Masc
Latem ubiegłego roku Kubańczyk przybył do kliniki wrocławskiej .	Latem	0	Neut
Wykręcił się na pięcie i wybiegł na dwór z rozpaloną głową .	dwór	7	Masc
Istnieje wiele mechanizmów powstawania oporności wśród bakterii chorobotwórczych .	oporności	4	Fem
Doznał poważnych obrażeń ciała i przebywa w szpitalu .	obrażeń	2	Neut
Czy gdzieś było gniazdko elektryczne ?	gniazdko	3	Neut
Naprawdę rzadko zdarza mi się puszczać tak głupie bramki .	bramki	8	Fem
Z pism Slazskiej Energetiki wynika , że opalana węglem nowa elektrociepłownia w Trzyńcu będzie spełniała wszystkie europejskie normy ekologiczne .	Energetiki	3	Fem
Cichociemni spotkali się w GROM-ie .	Cichociemni	0	Masc
Ostatnim akcentem uroczystości było wciągnięcie flagi państwowej na maszt w Dworze Artusa .	maszt	8	Masc
Sprawą zajmują się policjanci z 6 komisariatu na Górnej .	komisariatu	6	Masc
Na tym zapleczu też w istocie opiera się jednostkowa , personalna władza generała de Gaulle'a .	zapleczu	2	Neut
Miał eś żonę i trzech braci .	żonę	2	Fem
Widać , że gabinet Millera stopniowo traci kontakt z rzeczywistością .	rzeczywistością	9	Fem
Już nie patrząc na niego , sięgnęła do gumy majtek .	gumy	8	Fem
Struś nic nie szczerzy .	Struś	0	Masc
Zachód nadal robi groźne miny , mimo uspokajającego wystąpienia Klasy .	Klasy	9	Fem
Dziecko niespodziewanie wsiadło do czekającej na piętrze windy .	Dziecko	0	Neut
W ciągu godziny można było zaobserwować około stu meteorów .	meteorów	8	Masc
Dziewczynka prawidłowo szła poboczem .	poboczem	3	Neut
Polska i Izrael podpisały wczoraj umowę o zniesieniu obowiązku wizowego .	zniesieniu	7	Neut
Po urodzeniu odżywia się mlekiem matki .	urodzeniu	1	Neut
Przez uczony wywód autorki przewijają się dzieła współczesnych filozofów , od Ricoeura po Levinasa .	dzieła	6	Neut
Naukowcy z Uniwersytetu w Portland w USA sklonowali rezusa , czyli małpę należącą do rzędu naczelnych .	małpę	11	Fem
Truchtali spokojnie , bez pośpiechu , z przodu dostrzegli sylwetkę w zielonym mundurze , zbliżyli się powoli .	mundurze	12	Masc
- Uznał sprawę za skończoną i , nie zawracając sobie więcej głowy dziewczynkami , pomaszerował przez boisko .	dziewczynkami	12	Fem
Dankowski objął Bełchatów na początku sezonu , a pierwszej porażki doznał dopiero w siódmej kolejce .	porażki	9	Fem
Rzeczywiście prace organizacyjne nieco się opóźniły , ale już wkrótce biuro zacznie działać pełną parą .	biuro	10	Neut
Roboty finansowało w całości uzdrowisko .	Roboty	0	Neut
Dlatego też dojrzewanie w Chrystusie nie jest łatwe .	dojrzewanie	2	Neut
Tymczasem wiadomo , że 37-letnia gwiazda jest uzależniona od alkoholu i narkotyków .	gwiazda	5	Fem
Ma wnuczkę w takim wieku , że można się już z nią bawić .	wnuczkę	1	Fem
Zrobił em szybko dwa przysiady i skierował em się do łazienki .	łazienki	10	Fem
- Polska przez wiele lat korzystała z pomocy Zachodu .	Zachodu	8	Masc
Po trzecie , Iwan nie czytał oczywiście ani Freuda , ani ponurej antyutopii Williama Goldinga .	antyutopii	12	Fem
Wprowadzenie planu w życie wymaga uchwalenia bądź zmiany kilkunastu ustaw .	Wprowadzenie	0	Neut
Proboszcz wzniósł oczy w sufit i westchnął o świętą cierpliwość .	sufit	4	Masc
Z drugiej strony oskarżyciel potwierdza , że on sam w czasach próby był inny i pozostał inny .	oskarżyciel	3	Masc
Gospodarz milczał opuściwszy powieki , jakby się lękał zdradzić spojrzeniem .	spojrzeniem	9	Neut
Trwa dochodzenie w tej sprawie .	dochodzenie	1	Neut
Kanclerz Kiesinger wyraźnie oświadczył , że jego rząd uzależnia przystąpienie NRF do układu od szeregu warunków i w ogóle odkłada ten problem na nieokreślony termin .	przystąpienie	9	Neut
Połączono go z obchodami 70-lecia szkoły .	70-lecia	4	Neut
To poemat dla romantycznych głów .	poemat	1	Masc
Nacisnąłem przycisk piątego piętra , ale winda zatrzymała się na parterze .	przycisk	1	Masc
Świadkowie twierdzą , że przy nazwisku figuruje jego stopień .	nazwisku	5	Neut
W innych spotkaniach towarzyskich uzyskano następujące wyniki .	spotkaniach	2	Neut
Czy malował je kiedyś dla sprawdzenia samego siebie ?	sprawdzenia	5	Neut
Pies musi być podwórzowy , zły , w budzie na łańcuchu siedzący .	łańcuchu	10	Masc
Szafę widział wtedy .	Szafę	0	Fem
Taki jest głos ludu .	ludu	3	Masc
Nie dopuszcza żadnej kontroli , nie uznaje żadnych norm , nie widzi żadnych granic .	granic	13	Fem
- Czy polscy kierowcy zawodowi rzeczywiście są profesjonalistami ?	profesjonalistami	7	Masc
Wojna wdarła się w naszą młodość .	Wojna	0	Fem
Powstała nawet nauka o snach , nazywana onejrologią .	snach	4	Masc
Bez pardonu wpychały rzeczy do kieszeni i toreb .	pardonu	1	Masc
Z ciał potopionych stryjów wylęgły się tysiące myszy i wyruszyły wszystkie do Kruszwicy , prosto na dwór zbrodniarza .	dwór	16	Masc
Nie uważam , żeby na przykład Marksa szczególnie kompromitował romans ze służącą .	służącą	11	Fem
Najbliżsi rywale Orfe także nie rezygnują z przejęcia kolejnych mniejszych dystrybutorów .	dystrybutorów	10	Masc
MPK jest dziś spółką , od której samorząd kupuje przewozowe usługi .	usługi	10	Fem
Radny Eugeniusz Morta chciał przed głosowaniem usłyszeć silne argumenty za wydaniem tak dużej kwoty .	kwoty	13	Fem
Obcowanie z księgą może odbywać się w całkowitej pustce .	pustce	8	Fem
- Pisaliśmy razem komunikaty z posiedzeń TKK .	komunikaty	3	Masc
W Birkenau osadzono ich oddzielnie w podziemiach Bloku Śmierci .	Śmierci	8	Fem
ty próbowała ś to mleko dla dzieci ?	mleko	4	Neut
Dzięki temu pracownicy bardzo szybko ustalili , kto może być odpowiedzialny za zdarzające się coraz częściej w firmie tajemnicze manka .	manka	19	Neut
Jakieś światła błyszczą z prawej burty .	światła	1	Neut
To jest środowisko , które dzisiaj narzuca ton władzy w Polsce .	środowisko	2	Neut
Dzień po śmierci matka powiadomiła prokuraturę o popełnieniu przestępstwa przez lekarzy pogotowia .	lekarzy	10	Masc
Brzegi chodników były zastawione ławkami .	chodników	1	Masc
W sobotę podporucznik Ziemba przeniósł swoje łóżko do kuchni , rowery wstawiono do pokoju podporucznika Kowalika .	podporucznika	14	Masc
Antyterroryści spuścili się po linach ze śmigłowca wprost pod drzwi gangstera .	gangstera	10	Masc
Podrzuciłem kluczyki w dłoni .	kluczyki	1	Masc
Czy ich gospodynie nie prasują im na starość bielizny ?	starość	7	Fem
Zdesperowany doktor wlał płyn do dezynfekowania narzędzi chirurgicznych do dużego naczynia , włożył w płyn zaganiacza , zamieszał .	dezynfekowania	5	Neut
Miało płonąć mieszkanie na dziewiątym piętrze jednego z bloków .	piętrze	5	Neut
- Nie ma trybu .	trybu	3	Masc
Kiedy mijali ostatnie domy , Kajaki zbliżył się do wozu i położył łokieć na drabince .	drabince	14	Fem
Na farmę weszli dopiero z policjantami po 3 nad ranem .	farmę	1	Fem
Mężczyzna wpadł w ręce funkcjonariuszy dzięki opanowaniu .	opanowaniu	6	Neut
Nagle wzrok funkcjonariusza padł na pudło z płytami kompaktowymi bez hologramów .	płytami	7	Fem
Poznali się na weselu brata Edyty .	weselu	3	Neut
Miejsca rozgrywania spotkań zostały ustalone w drodze losowania w siedzibie Polskiego Związku Tenisa Stołowego w Warszawie .	siedzibie	9	Fem
Usiadła przy maszynie , taśma szybko biegła .	taśma	4	Fem
Szóstke miała m .	Szóstke	0	Fem
Wczoraj o incydencie szeroko informowała rosyjska prasa .	incydencie	2	Masc
Widać , że położył się w ubraniu , bo spod kołdry wystają stopy i nieco obszarpane nogawki spodni .	nogawki	16	Fem
Cofnął się jak oparzony , gdy fala obmyła mu łapy .	fala	6	Fem
Wykonany z asferycznych soczewek ze szkła fluorytowego , pozwala na uzyskanie bardzo dobrej jakości obrazu .	uzyskanie	10	Neut
Dobre imię dano ci na chrzcie , nasz drogi radco .	radco	9	Masc
( Przepisuję z karty po włosku dla większej autentyczności ) .	autentyczności	8	Fem
Stawiasz to na gazie .	gazie	3	Masc
Odzyskanie rodowej siedziby jest jednym z głównych celów Fundacji założonej w latach 90 . przez ks . Adama Czartoryskiego .	Odzyskanie	0	Neut
O zaliczeniu maszyny , urządzenia lub aparatu do odpowiedniej podgrupy decyduje jej przeznaczenie oraz konstrukcja i wyposażenie .	podgrupy	9	Fem
W kłamstwie czy w prawdzie , nie znam nic lepszego niż życie .	kłamstwie	1	Neut
Taka jest czasem droga do poezji , do liryki , do wyrażania Niewyrażalnego .	liryki	8	Fem
Prezes PiS-u piątkowym wystąpieniem tę opinię potwierdził .	wystąpieniem	3	Neut
W aptekach prawdziwe oblężenie zapanowało jeszcze w ostatnich dniach starego roku .	oblężenie	3	Neut
Wojskowy kandydat nie rozdawał ulotek ze swoim programem wyborczym .	programem	7	Masc
W opinii BCC dzięki kompromisowi politycznemu , którego zwolennikiem był ekspremier , Polska jest obecnie gospodarczym tygrysem Europy Środkowo - Wschodniej .	ekspremier	10	Masc
Rok funkcjonowania wyższych szczebli samorządów nie upoważnia jeszcze do ocen .	szczebli	3	Masc
Kiedy nie mamy ochoty na towarzystwo , każdy ma swój pokój .	pokój	10	Masc
Interesująco wypadła sala wystawiennicza na poddaszu , chociaż widać , że w budynku jest jeszcze parę rzeczy do robienia .	poddaszu	5	Neut
Kia sephia , którą kierował 67-letni Henryk M . , nie zatrzymała się przed przejściem i potrąciła staruszkę .	przejściem	14	Neut
Statut określa zasady wynagradzania za użytkowanie tych wkładów .	Statut	0	Masc
Spojrzał nawet porozumiewawczo na babuszkę .	babuszkę	4	Fem
Liście są kolorowe .	Liście	0	Masc
Analiza krzywych wysychania ma duże znaczenie w aspekcie poznania reżimu cieków i rzek oraz rezerw wód podziemnych .	wysychania	2	Neut
Jadący motorem 22-letni mężczyzna na łuku drogi stracił panowanie nad pojazdem i uderzył w betonowe ogrodzenie .	panowanie	8	Neut
Obudziło mnie zimne dotknięcie .	dotknięcie	3	Neut
Ministerstwo Rolnictwa , które przed rokiem obłożyło miód importowany opłatami wyrównawczymi , opracowało długofalowy program rozwoju pszczelarstwa .	opłatami	9	Fem
Czy pan zna inżyniera Jarzęckiego ?	inżyniera	3	Masc
Z początkiem bieżącego roku Ministerstwo Oświaty i Wychowania podwyższyło uczniowskie stypendia .	Oświaty	5	Fem
Kobietom odpowiadał uwodzicielsko nastrojony głos ukrytego w jakiejś dziupli wodzireja .	Kobietom	0	Fem
Moja babka jest odważna .	babka	1	Fem
Czy w różnych stadiach ewolucji Wszechświata aktywne jądra galaktyk były identyczne ?	galaktyk	8	Fem
Korespondenci budapesztańskich gazet donoszą , że wielu miejscowych Węgrów wyjechało do krewnych na wieś albo uciekło na Węgry .	krewnych	11	Masc
Uczestniczki wysłuchały wykładów doradców zawodowych i prawników , uczestniczyły w zajęciach psychologicznych , poznawały podstawy obsługi komputera i korzystania z Internetu .	prawników	6	Masc
- A ja wam mówię , że jesteście na bańce .	bańce	9	Fem
Jedenaście dni po pojawieniu się opisanej wizji sennej czar zaczął działać .	pojawieniu	3	Neut
Jego kompan uważnie obserwuje teren .	kompan	1	Masc
Rządowy projekt chroni dzieci i młodzież .	młodzież	5	Fem
W niedzielę po parkiecie snuje się już tylko kilkanaście osób .	parkiecie	3	Masc
Umyte brokuły dzielimy na cząstki i układamy w naczyniu .	naczyniu	8	Neut
Po utrwaleniu ich w formalinie przekazał je do muzeum w Paryżu .	formalinie	4	Fem
Były one niezwykle rzadkie , nadające świątyni szczególne miejsce wśród wszystkich miejsc kultu na Pomorzu Gdańskim .	kultu	12	Masc
Wyschły źródła .	źródła	1	Neut
W momencie trafienia śmigłowiec znajdował się na wysokości około 1000 metrów .	trafienia	2	Neut
- Czy chcesz , niewiasto , wziąć udział w uroczystościach ku czci bogini Zirbanit ?	niewiasto	4	Fem
Nie wiedzą , że brak jednej maszyny ?	maszyny	6	Fem
Sprytny oszust jest przekonujący , swym ofiarom proponuje pozostawienie obrączki lub innej bezwartościowej rzeczy w zastaw i zwrot gotówki za kilkadziesiąt minut .	obrączki	9	Fem
Czemu godzę się na tortury pod obojętnym światłem wielkiej lampy ?	światłem	7	Neut
Szły dzieci przez pole minowe i wesoło machały rączkami .	rączkami	8	Fem
Wydawało się , że fiskus nie będzie dłużej gnębił Waldemara Gronowskiego , legnickiego piekarza , który przez ponad 10 lat rozdawał pieczywo najuboższym .	pieczywo	21	Neut
Potem opłukała naczynia i ustawiła na drucianej kratce , by obeschły .	naczynia	2	Neut
Poseł Włodzimierz Wasiński sądzi , że zmiany w rządzie nie ograniczą się do dymisji wicepremiera Janusza Tomaszewskiego .	dymisji	13	Fem
- Najprostszym sposobem ukrycia miejsca do pracy jest korzystanie z wsuwanych blatów .	korzystanie	8	Neut
Zimą , przylatując na popas do Polski , zadowala się pozostałymi na krzakach jagodami .	popas	4	Masc
– Próbował em teraz w lecie na jachcie .	lecie	5	Neut
Widownia westchnęła ze współczuciem , a Iwana to uskrzydliło .	współczuciem	3	Neut
W wielu przypadkach powoduje to albo likwidację działalności , albo popadanie tych organizacji w długi .	długi	14	Masc
Władysław P . miał też długi , był schorowany i zażywał duże ilości leków .	długi	5	Masc
Z każdym rokiem ruch osobowy i towarowy na przejściu granicznym w Chyżnem rośnie .	rokiem	2	Masc
Prócz akcji upowszechniania czytelnictwa wśród dzieci Warszawy , podjęła prace o charakterze ogólnym , często prekursorskim .	czytelnictwa	3	Neut
Pojawia się drapanie w gardle , wysypka , nagły spadek ciśnienia , duszność , trudności w oddychaniu , bóle brzucha .	gardle	4	Neut
Pawłowi M . zarzuca się również , że działał z zamiarem spowodowania ciężkiego kalectwa rzucając nożem w głowę włoskiego piłkarza Dino Baggio .	spowodowania	11	Neut
