Decyzja zapadła , mimo że szefowie tajnych służb ostrzegli , iż Palestyńczycy wyjdą na ulice .	Decyzja	0	Fem
Szkoła ma dwie kondygnacje , 9 izb lekcyjnych , kuchnię i kotłownię .	izb	6	Fem
Astma trapi ludzkość od zarania dziejów .	zarania	4	Neut
Radny Krzysztof Krzeszowski wylicza podobne przypadki także w innych szkołach .	szkołach	9	Fem
Parę kontaktów się urwało .	kontaktów	1	Masc
Funkcję tę pełnił przez 35 lat i wywarł ogromne piętno na prawodawstwie amerykańskim .	Funkcję	0	Fem
Wieczorem wymykają się z hoteliku , by spojrzeć na ulubioną maszynę i pocałować ją na dobranoc .	dobranoc	15	Fem
- A ja się nigdy nie przyzwyczaję do tego barbarzyństwa .	barbarzyństwa	9	Neut
Rzecznik armii powiedział , iż na miejscu dokonano aresztowań .	aresztowań	8	Neut
O zaliczeniu maszyny , urządzenia lub aparatu do odpowiedniej podgrupy decyduje jej przeznaczenie oraz konstrukcja i wyposażenie .	maszyny	2	Fem
Ja na miejscu Pana Giertycha wprowadziłbym zakaz rodzenia głupim matkom .	rodzenia	7	Neut
Trwa dochodzenie w tej sprawie .	dochodzenie	1	Neut
Starczy tego rzępolenia , łajzy !	łajzy	4	Masc
Podczas mojej pierwszej bytności w Londynie miałam , dzięki uprzejmości pani z biblioteki polskiej , dostęp do teczki Krystyny .	bytności	3	Fem
Stanowią one razem z rzodkiewką potrawę pełnowartościową , dając jednocześnie ciekawy efekt dekoracyjny .	potrawę	5	Fem
- Proszę o zajmowanie miejsc .	zajmowanie	3	Neut
W Pruszkowie gang zorganizowali wychowankowie słynnego w czasach PRL bandyty Barabasza .	bandyty	9	Masc
Proboszcz wzniósł oczy w sufit i westchnął o świętą cierpliwość .	cierpliwość	9	Fem
Zgodnie z ustaleniami nie udzielił żadnych wywiadów ani nie wydał żadnego oświadczenia politycznego .	ustaleniami	2	Neut
Niebo było pokryte białymi barankami .	Niebo	0	Neut
W porównaniu z innymi miastami zachodniopomorskiego Szczecinek jest oazą porządku i bezpieczeństwa .	oazą	8	Fem
Siedzieli w zmroku .	zmroku	2	Masc
Miś Holender przysłał mu czerwone anemony i hiacynty na ostatek .	anemony	5	Masc
tam są różne różki .	różki	3	Masc
Czy coś takiego może być lotniskiem ?	lotniskiem	5	Neut
Zginęło wielu ochotników z Wielkopolski , między nimi 68 uczniów gimnazjum w Trzemesznie .	gimnazjum	10	Neut
Niektóre sale pałacyku w Karolinie przeznaczono na małe muzeum .	sale	1	Fem
Nie kieruję się przy tym ideologią wegetariańską , choć z nią sympatyzuję .	ideologią	5	Fem
Kilka lat temu ofiarą wandali padły mogiły na Cmentarzu na Powązkach w Warszawie .	wandali	4	Masc
Czy pan zna inżyniera Jarzęckiego ?	inżyniera	3	Masc
Związkowcy podkreślili jednak , że mają gwarancje ministra w sprawie modelu PKP i przyszłych przekształceń kolei oraz dalszych rozmów z nimi .	Związkowcy	0	Masc
Bo jest tylko czas na zarabianie pieniędzy i klepanie biedy .	zarabianie	5	Neut
W połączeniu z manipulowaniem ostrością tworzy to klimat z pogranicza jawy i nierzeczywistości o niejasnej proweniencji .	manipulowaniem	3	Neut
Brzęcząc pustymi kuflami , weszła do środka .	kuflami	2	Masc
Niestety , wykonane opodal obwałowania niewiele dały .	obwałowania	4	Neut
Według islamu świnia jest uznawana za zwierzę nieczyste .	świnia	2	Fem
Tu składała ręce błagalnie , tam rozkładała je gestem perswazji .	perswazji	9	Fem
Panie pośle , czy wolno dawać łapówki ?	łapówki	6	Fem
Papież Formosus zmarł w kwietniu 896 w wyniku nieznanej choroby lub otrucia .	otrucia	11	Neut
Rybka powędrowała do akwarium ustawionego przez asystentkę na stoliku .	Rybka	0	Fem
o wzięło by się czyściochę . .	czyściochę	4	Fem
Najder nie godził się na takie załatwienie sprawy .	załatwienie	6	Neut
W Berchtesgaden specjalnością jest tor saneczkowy , na którym osiąga się niebywałe prędkości .	prędkości	12	Fem
Rysiek dziękował Bogu , że nie wręczył prezesowi dolara w parku , bo by wtedy nie miał czego szukać .	dolara	8	Masc
W sobotę podporucznik Ziemba przeniósł swoje łóżko do kuchni , rowery wstawiono do pokoju podporucznika Kowalika .	podporucznik	2	Masc
Przede wszystkim wywozili ruchomy majątek i żywność .	żywność	6	Fem
Nie byłoby może przez to głupich córek i skończyłby się problem aborcji .	córek	6	Fem
— Jakie jest oblicze tego komunizmu , które pani widzi w Europie ?	komunizmu	5	Masc
Marta ciskała nuty , zamykała się z trzaskiem u siebie .	nuty	2	Neut
Bardzo często , kiedy był em wściekły i napięty , wypijał em na rozluźnienie piwko czy setkę .	piwko	14	Neut
- Może spotkasz swojego starego znajomego , Szmidta .	znajomego	5	Masc
Wtedy bandyci atakują chłopaka .	bandyci	1	Masc
Pierwsze gwiazdy toną w duszy młodego człowieka jak w górskim jeziorze .	gwiazdy	1	Fem
Marchewki obrać i zetrzeć na tarce o dużych oczkach .	oczkach	8	Neut
Podczas którejś kolacji wyznał , że przez kilkanaście lat uprawiał pięściarstwo .	pięściarstwo	10	Neut
Nie sprzyja to oczywiście bezusterkowemu oddawaniu obiektów .	obiektów	6	Masc
Wniesienie skargi o wznowienie nie tamuje wykonania zaskarżonego wyroku .	wznowienie	3	Neut
I to wydaje mi się dobrą pointą .	pointą	6	Fem
Tak przynajmniej wynika z zachowanych dokumentów i relacji .	relacji	7	Fem
Do akcji plebiscytowej włączają się działy sportowe poszczególnych gazet .	działy	5	Masc
Mimo wprowadzenia stanu wojennego i militaryzacji kopalń czterobrygadówka nie powraca .	militaryzacji	5	Fem
Pod żadnym pozorem nie zgadzaj się na pozostanie w domu w przyszły weekend .	pozostanie	7	Neut
Po paru dniach znał już wszystko i wszystkich i spędzał na górnych piętrach każdą wolną chwilę , wychodząc tylko w porze posiłków i oczywiście snu .	piętrach	12	Neut
Lecz kontynuował polemikę .	polemikę	2	Fem
Zgodnie z oczekiwaniami po złoto sięgnęły ekipy gospodarzy .	oczekiwaniami	2	Neut
Powoduje wysokie bezrobocie i sprawia , że państwo zadłuża się na bardzo wysoki procent .	bezrobocie	2	Neut
Mówić on będzie dzisiaj o sytuacji religijnej i nowych ruchach w Europie .	ruchach	9	Masc
Natomiast zdjęcia eksponowane w MDK ukazują nowe spojrzenie na fotografię , którego dominantą jest wykonywanie makrofotograficznych ujęć z bardzo bliskiej odległości przy małej głębi ostrości .	ujęć	16	Neut
Wszedł do wagonu , w przejściu natknął się na konduktora - służbistę , który zrobił mu wykład o niebezpieczeństwie związanym ze wskakiwaniem do pociągu w biegu .	niebezpieczeństwie	18	Neut
Nie byłoby może przez to głupich córek i skończyłby się problem aborcji .	aborcji	11	Fem
- On nigdy nie zjedzie chłopu z drogi , choćby był w próżni .	próżni	12	Fem
Artyści z trzech akademii sztuk pięknych oglądali wczoraj budynki przy ulicy Zamkowej .	Artyści	0	Masc
Ani złotówka nie trafia do stoczniowców .	stoczniowców	5	Masc
Ciało Gwieździka znaleziono przypadkiem .	Ciało	0	Neut
Tysiące zwiedzających oblegało stoiska .	stoiska	3	Neut
Teraz składamy paskowy patchwork , ocieplenie i podszewkę , zszywamy wzdłuż prostego brzegu i obszywamy lamówką .	podszewkę	7	Fem
Potem profesor Lalos pokazał im szkołę dziecięcą .	szkołę	5	Fem
Posiadł tę umiejętność szybko .	umiejętność	2	Fem
– w plecaku też nie masz . .	plecaku	2	Masc
W następnym oknie będzie można samodzielnie skonfigurować menu bootmanagera .	menu	7	Neut
Zrobienie takiego wzoru zajmie kilka godzin .	Zrobienie	0	Neut
Ale dzieciaki i tak odbijają piłki o ściany pod oknami .	oknami	9	Neut
On tu miał pełnić straż .	straż	4	Fem
Ostatecznie o ewentualnej winie Nowaka wypowie się sąd .	winie	3	Fem
Palcem rysuje na wykładzinie małe syrenki .	syrenki	5	Fem
Już nie patrząc na niego , sięgnęła do gumy majtek .	majtek	9	Neut
Orfeusz zmierza pewnie ku światłu , pomyślnie wyprowadzając Eurydykę z krainy zmarłych .	światłu	4	Neut
21 sierpnia 1944 roku rozegrała się w tym miejscu pierwsza po 1939 roku regularna bitwa pomiędzy oddziałami Armii Krajowej i Armii Czerwonej .	oddziałami	16	Masc
Tym świadkom , którzy powiedzą całą prawdę , przestępstwo ujdzie zupełnie bezkarnie .	świadkom	1	Masc
W dalsze wędrówki udaje się tylko dla zmiany ostoi .	wędrówki	2	Fem
Skarżył się jej przecież , że w kieracie prozaicznych zajęć , wśród ludzi zajętych tylko sprawami chleba powszedniego , brak mu rozmów na poważne tematy .	zajęć	9	Neut
Dzięki lekarzom , wsparciu rodziny i samozaparciu pokonał chorobę .	wsparciu	3	Neut
Kolejny pijany policjant straci pracę .	policjant	2	Masc
Brazylijczyk , dwukrotny zwycięzca wielkoszlemowego Roland Garros , podkreślał przed spotkaniem , że najważniejszym elementem piątkowej potyczki będzie skuteczna gra przy własnym serwisie .	spotkaniem	10	Neut
Mgły nie dźwignęły się jeszcze .	Mgły	0	Fem
Beczący głos uciszył sprzysiężonych .	sprzysiężonych	3	Masc
Może w styczniu zaproszę cię na chrzciny .	styczniu	2	Masc
Stanęła w progu , ręce oparła na biodrach .	biodrach	7	Neut
Jego Ryzyko było by Ryzykiem doprowadzonym do ostateczności .	Ryzykiem	4	Neut
Czy przyszłość świata należeć będzie do narodów ubogich , ale licznych i młodych ?	narodów	6	Masc
Kompletnie pijany zjechał na lewe pobocze drogi i uderzył w drzewo .	drzewo	10	Neut
- Pożar grozi ludzkiemu życiu ; ofiarą płomieni najczęściej są dzieci .	płomieni	7	Masc
- Czy zatrzymają pana strefy ochronne wokół siedzib władzy ?	siedzib	7	Fem
- Jedyna wartość obiektywna to profesjonalizm wykonawcy .	profesjonalizm	5	Masc
Ciągnąc go za rękaw , zmusiła do obrócenia się wśród otaczającego ich korowodu .	obrócenia	7	Neut
Z drugiej strony pisowcy chyba mnie polubili .	pisowcy	3	Masc
Sztuka miała premierę w maju 2001 .	premierę	2	Fem
Geje robią wokół siebie szum , żeby tylko się wypromować .	Geje	0	Masc
Operację na lotnisku przeprowadzono na 10 godzin przed upływem ultimatum postawionego przez porywaczy .	porywaczy	12	Masc
Zrobił eś wóz ?	wóz	2	Masc
Zwierzę polubiło piwko i bez kufla nie daje się wydoić .	piwko	2	Neut
Przypomnijmy , że 16 lipca 1994 r . dziadkowie półtorarocznej wówczas Moniki zostawili ją przed legnicką apteką pod opieką ojca , Roberta Bielawskiego .	opieką	18	Fem
Małżonka dyplomaty przez 13 lat była nauczycielką w szkole podstawowej .	nauczycielką	6	Fem
Krzysztof postanowił dorzucić do maila trochę autentyzmu .	autentyzmu	6	Masc
Szef Polsatu zapowiedział , że złoży dziś do NSA wniosek o zmianę postanowienia .	postanowienia	12	Neut
Skończyła makijaż i zaczęła przeglądać ciuchy .	ciuchy	5	Masc
Na sali gimnastycznej panował przenikliwy ziąb .	ziąb	5	Masc
Bracia Kaczyńscy chcą w tej chwili albo koalicji na swoich warunkach , albo przyspieszonych wyborów .	koalicji	7	Fem
Ukląkł em przy Mateuszu i szybko wcisnął em mu woreczek do ręki .	woreczek	9	Masc
Obstawimy łoże tabliczkami . . .	tabliczkami	2	Fem
- A obywatelka skąd o tym wie ?	obywatelka	2	Fem
Na czas akcji z kamienicy ewakuowano 10 osób , które nad ranem wróciły do swoich mieszkań .	mieszkań	15	Neut
Dla zdobywców pięciu pierwszych miejsc przewidziano regulaminowe nagrody .	zdobywców	1	Masc
Znów są na schodach i po chwili wszystko się uspokaja .	schodach	3	Neut
Pan Korzeniowski zerwał się z krzesła , podbiegł do szafy , wysunął dolną szufladę , chwilę grzebał w papierzyskach .	szufladę	13	Fem
Orzechy i migdały zemleć , wymieszać z cukrem oraz 3 łyżkami masła na gładką masę i połączyć z kuskusem .	cukrem	7	Masc
Oficer SS wyznaczył żołnierzy do plutonu egzekucyjnego .	Oficer	0	Masc
Jeden z mężczyzn przystąpił do majstrowania przy kablach telefonicznych .	majstrowania	5	Neut
Zgodnie z oczekiwaniami po złoto sięgnęły ekipy gospodarzy .	złoto	4	Neut
Z chwilą urodzenia dziecko może żądać naprawienia szkód doznanych przed urodzeniem .	naprawienia	6	Neut
Dlatego prośba o przebaczenie jest tak trudna .	przebaczenie	3	Neut
I znów poczuł eś się zwycięzcą !	zwycięzcą	5	Masc
Uczestniczki wysłuchały wykładów doradców zawodowych i prawników , uczestniczyły w zajęciach psychologicznych , poznawały podstawy obsługi komputera i korzystania z Internetu .	obsługi	15	Fem
Jednocześnie zmienia się jego skład chemiczny i ubytek ciężaru właściwego .	ciężaru	8	Masc
Patrzył na firankę , lecz tak roztargnionym wzrokiem , że nie zauważył , jak wydyma się od wiatru .	firankę	2	Fem
Homogeniczności ekspresji sprzyja izomorfizm faktury chóralnej .	faktury	4	Fem
Tutaj wyraźnie widać wrażliwe , skłonne do ufności i entuzjazmu oblicze eseisty .	eseisty	11	Masc
Lotnictwo szaleje .	Lotnictwo	0	Neut
Pracował własnej roboty heblami , wiertłami , młotkami , nożami , dłutami .	dłutami	11	Neut
W dalszym ciągu tej książki chcę Ci w tym wyzwoleniu pomóc .	wyzwoleniu	9	Neut
Dyrekcja ma też nadzieję , że w przyszłym roku znajdą się kolejne fundusze na ukończenie całego przedsięwzięcia .	przedsięwzięcia	16	Neut
Pod szczytnymi hasłami kryją się głównie ambicje polityczne i ogromna hipokryzja .	hasłami	2	Neut
Ta masa wodna , nieraz podnosząca poziom Wiku o jeden metr ponad równię Puckiej Zatoki , spotyka się przy dziobie gołębia z silnym prądem zachodnim .	równię	12	Fem
Zwykle w zimę odżywiamy się nieźle .	zimę	2	Fem
W pewnej chwili otworzył em oczy , wyrwany z gorączkowej drzemki jakimś ruchem .	drzemki	10	Fem
Dzisiejsza konfrontacja z łódzkimi zespołami , które mają pierwszoligowe aspiracje , zapowiada się niezwykle ciekawie .	aspiracje	9	Fem
Pierwsze i drugie miejsce zajęły słowackie dziewczęta , ubrane w getry i krótkie falbankowe spódniczki .	getry	10	Neut
Tu mogłem obserwować rzetelną , telewizyjną realizację bez pośpiechu , w której uczestniczenie było naprawdę przyjemnością .	uczestniczenie	12	Neut
Nadal będą funkcjonować w mediach dzięki swemu wiecznie odrębnemu zdaniu .	mediach	4	Neut
Od lat siedemdziesiątych coraz większą popularność zdobywa nurt neuroteologiczny .	popularność	5	Fem
O ileż ciekawiej rozwijała by się nasza znajomość , gdyby jakiś elegant próbował stanąć na drodze naszych uczuć .	elegant	11	Masc
Widzę Łzy w kącikach jego oczu .	Łzy	1	Fem
Ale rozumiem , że do ślubu , prędzej czy później , dojdzie ?	ślubu	5	Masc
Specjaliści z Centralnej Agencji Wywiadowczej mają już świadka , który widział zamachowców na kilka minut przed eksplozją w Nairobi .	eksplozją	16	Fem
- Sapnęła , ale pod warstwą chłodu zamajaczyła iskierka rozbawienia .	rozbawienia	9	Neut
- Czy zatrzymają pana strefy ochronne wokół siedzib władzy ?	władzy	8	Fem
Jakiś chłopak postanowił wspiąć się na słup , by osobiście zdementować bzdury o magicznym prądzie elektrycznym .	prądzie	14	Masc
Jedną rękę trzymał na pniu .	pniu	4	Masc
O ziemię zastukały ciężkie buty .	buty	4	Masc
- Bo ście moje kury w sąsieku zamknęli .	kury	4	Fem
Czarna suka posapuje .	suka	1	Fem
Społeczeństwo wychowywano w ślepym posłuszeństwie wobec Cesarstwa .	posłuszeństwie	4	Neut
Całej imprezie groziła katastrofa , mimo że istniała możliwość otrzymania odszkodowania z towarzystwa ubezpieczeniowego .	katastrofa	3	Fem
- Przechodzimy do głosowania nad założeniami polityki pieniężnej na 1995 r .	założeniami	5	Neut
Zdaniem lekarzy , szpitale cierpiące na brak pieniędzy podejmują drastyczne programy oszczędnościowe .	lekarzy	1	Masc
Wtedy będzie mogła z radością oddać się rowerowym szaleństwom .	szaleństwom	8	Neut
Z kolejnej po jabłkach , wiśniach i porzeczkach klęski urodzaju cieszą się konsumenci .	porzeczkach	7	Fem
Przed oczyma Angusa przesuwały się obrazy z przebytej epopei .	epopei	8	Fem
Można , bo istnieją historyczne analogie .	analogie	5	Fem
Wynikła awantura , ale w duchu przyznano bosmanowi rację .	awantura	1	Fem
Kropidłami żegnają granaty i rynsztokami płynie woda święcona .	rynsztokami	4	Masc
W grudniu 1996 roku Havlovi wraz z górnym płatem prawego płuca usunięto niewielki nowotwór złośliwy .	płuca	10	Neut
Sytuacja wyglądała bardzo groźnie .	Sytuacja	0	Fem
Przed tygodniem wicestarosta Hrycyna podczas wyjazdu do Gdańska uzyskał przychylność tamtejszych środowisk żydowskich .	tygodniem	1	Masc
Trudniejsze jest wtedy automatyczne sprawdzanie kompletności .	sprawdzanie	4	Neut
Tacy obserwatorzy na pewno nie wnoszą nic do naszej pracy pełnej poświęcenia .	poświęcenia	11	Neut
W obliczu trudnej sytuacji na rynku pracy , 9-miesięczna przygoda w wojsku wydaje się dla nich niemiłą perspektywą .	obliczu	1	Neut
W innym przypadku nastąpi natychmiastowe spożycie powodujące zwiększenie siły lub ochłodzenie robota .	spożycie	5	Neut
Stopniowo dół się sam zasypie śmieciami .	śmieciami	5	Masc
To był naprawdę rockowy boom .	boom	4	Masc
Użytkownik ma do dyspozycji 6 baz zawierających informacje posortowane według wybranego kryterium .	Użytkownik	0	Masc
O zaliczeniu maszyny , urządzenia lub aparatu do odpowiedniej podgrupy decyduje jej przeznaczenie oraz konstrukcja i wyposażenie .	wyposażenie	16	Neut
Kot obejrzał się na mnie i usiadł , starannie zawijając ogon na przednie łapki .	ogon	10	Masc
Pozytywne zdanie miała garstka z nich .	garstka	3	Fem
- Dziękuję , nie piję kawy o tak późnej porze .	porze	9	Fem
Jego serce ledwie się ruszało .	serce	1	Neut
Arkadiusza J . pogrążyły też zeznania taksówkarza , który zabrał oskarżonych sprzed Stodoły .	taksówkarza	6	Masc
Kością niezgody jest nadal powstanie niezależnej korporacji prokuratorów .	powstanie	4	Neut
Podniósł się , w ręku trzymał pusty słoik .	słoik	7	Masc
Naukowcy z Uniwersytetu w Portland w USA sklonowali rezusa , czyli małpę należącą do rzędu naczelnych .	rezusa	8	Masc
Część z nich była wypełniona cieczą .	cieczą	5	Fem
Poranione potłuczoną butelką zwierzę trafiło do weterynarza .	weterynarza	6	Masc
Pomaga w sprzątaniu i wszelkich kłopotach zdrowotnych .	sprzątaniu	2	Neut
Po mszy świętej wyruszyła z bazyliki katedralnej i okrążyła Stary Rynek .	bazyliki	5	Fem
Choć pod tym względem ci obecni ani trochę nie ustępują poprzednikom .	obecni	5	Masc
One potrzebują równego traktowania .	traktowania	3	Neut
Uszanowanie i respekt przed Bogiem są bardzo mocno zaakcentowane w doświadczeniu proroków .	respekt	2	Masc
Napisałaby więc z pewnością o Bali , co się stało w Kucie , tuż przy głównym deptaku .	deptaku	16	Masc
- Kto jest sukcesorem prawnym pana naczelnika ?	sukcesorem	3	Masc
Kiedy ja grzeję mleko , ty zawsze musisz zrobić awanturę .	mleko	3	Neut
Pokoje stanowią wyłączną własność poszczególnych lokatorów .	Pokoje	0	Masc
W pierwszych dniach tygodnia czekają Cię ożywione spotkania z przyjaciółmi lub kolegami .	kolegami	11	Masc
Była to jakaś specjalna lampka .	lampka	4	Fem
W miniony czwartek w referendum ratyfikacyjnym Irlandia odrzuciła ten Traktat , otwierający drogę do rozszerzenia Unii .	rozszerzenia	14	Neut
- Będzie biegł od zatoczki autobusowej przy Sandomierskiej do budynku Urzędu Gminy .	zatoczki	4	Fem
Jest to pierwszy przypadek ciąży mnogiej u żyjącej w niewoli pandy .	ciąży	4	Fem
Są to dramatyczne liczby .	liczby	3	Fem
Odpowiedź przyniosą najbliższe tygodnie i wówczas możemy spodziewać się weryfikacji wartości tych spółek .	weryfikacji	9	Fem
Gwiazda przemieniła się w inkwizytora .	inkwizytora	4	Masc
Właściwie tylko Białostockie Przedsiębiorstwo Budownictwa Przemysłowego posiada laboratorium z prawdziwego zdarzenia .	Budownictwa	4	Neut
- Poseł Janusz Wójcik sam zrzeknie się immunitetu .	immunitetu	7	Masc
Ciężki , kleisty lęk wypełnił jej serce .	serce	6	Neut
Bierzemy pod lupę najbliższych sąsiadów .	lupę	2	Fem
Ktoś inny w złości kopie ławkę i rzuca głośno soczyste przekleństwa .	przekleństwa	10	Neut
Oparła się na wypiętych za plecami rękach i z lekka wyprężyła przy tym tułów .	tułów	13	Masc
Przeciętne świadczenie emeryta , rencisty wzrośnie o 33 zł .	świadczenie	1	Neut
Zwierzę polubiło piwko i bez kufla nie daje się wydoić .	Zwierzę	0	Neut
Idziemy jeszcze do bistra na grog z sacharyną .	sacharyną	7	Fem
Odbudujmy porozumienie ponad różnicami , tak mało istotnymi wobec rzeczywistych problemów !	porozumienie	1	Neut
Asystent już podawał chirurgowi fartuch .	chirurgowi	3	Masc
Wczoraj kolegium Instytutu usiłowało wyłonić nowego kandydata na prezesa .	kolegium	1	Neut
Córka studiuje , jest na bezrobotnym .	Córka	0	Fem
Zawód przeżyły grupy protestujących warszawiaków , które licznie przybyły na wczorajszą sesję rady miasta .	Zawód	0	Masc
Rozumowanie Angusa nie było więc pozbawione podstaw , ale jeszcze zbyt daleko biegło w przyszłość .	Rozumowanie	0	Neut
PZN to jest zrzeszenie wszystkich podmiotów , które działają na terenie kraju .	zrzeszenie	3	Neut
W pierwszej części obrad sekretarzami będą pani posłanka Zdzisława Kobylińska i pan poseł Mieczysław Jedoń .	sekretarzami	4	Masc
Jak poinformował Cesar Fraga z Uniwersytetu w Buenos Aires , przeprowadzone tam badania wykazały , że czekolada wzmacnia antyutleniacze znajdujące się we krwi , zwiększając odporność na zaburzenia serca i naczyń wieńcowych .	odporność	25	Fem
Jej celem jest ukazanie roli mediów w życiu dzieci i młodzieży .	celem	1	Masc
W następstwie tego procesu dokonuje się racjonalizacja wiary .	procesu	3	Masc
To wystarczyło , żeby przestraszyć pozostałych kierowców trójkołowych pojazdów , którzy też pracowali nielegalnie .	pojazdów	8	Masc
Burza toczyła się leniwie , zanim zapadła w zachodnią czeluść nieba .	nieba	10	Neut
Po chwili ponowił pukanie , już znacznie energiczniej .	pukanie	3	Neut
Znajomość karate pomińmy . . .	karate	1	Neut
Mam swoje , bo babcia mi daje .	babcia	4	Fem
Mogą jedynie domagać się wynagrodzeń po wydaniu orzeczenia .	wynagrodzeń	4	Neut
Jak ustalili policjanci , podawał alkohol 16-letniej dziewczynie .	dziewczynie	7	Fem
- To anteny Polcomtelu .	anteny	2	Fem
Braków wtenczas nawet poeci nie wypuszczali .	Braków	0	Masc
Na ich temat nic również nie powiedzieli płatni informatorzy , do których w tej sprawie zwrócili się policjanci prowadzący dochodzenie .	dochodzenie	19	Neut
Oprócz okradania opolan eseldziaki kantowały również kumpli w interesach .	interesach	8	Masc
Tarot Marsylski powstał prawdopodobnie w końcu średniowiecza , gdy świeże były jeszcze skojarzenia Czyśćca z refrigerum .	średniowiecza	6	Neut
Prezydent Bush zapewniał w środowym przemówieniu telewizyjnym , że siły koalicji będą maksymalnie oszczędzały ludność cywilną .	przemówieniu	5	Neut
Z tych powodów w innych krajach ministrowie starają się mówić tym samym głosem .	ministrowie	6	Masc
Słuchaj , Piotr był zalany , spadał ze schodów , wyskakiwał z okna .	schodów	8	Neut
Tutaj wyraźnie widać wrażliwe , skłonne do ufności i entuzjazmu oblicze eseisty .	oblicze	10	Neut
Wyszedł po chwili z tej balowej sali , ustawił nas w rzędzie , według instrumentów , skrzypce , altówka , klarnet , trąbka , puzon , perkusja i ja , saksofon .	klarnet	20	Masc
Zajęły one terytoria w sąsiedztwie swych matek .	terytoria	2	Neut
Magnat ulega pokusie .	Magnat	0	Masc
Właściciele muszą czekać na większą imprezę .	Właściciele	0	Masc
- Wolfgang przestawił swoje krzesełko w cień .	krzesełko	4	Neut
Droga do Falsztyna prowadzi przez łagodne wzgórza Pienin Spiskich .	wzgórza	6	Neut
Pozbył się balastu , nim ten balast odebrała mu zamieć historii .	balastu	2	Masc
- Złożę też za chwilę na ręce pana marszałka ową poprawkę formalną , uzgodnioną z Biurem Legislacyjnym .	Biurem	15	Neut
Czuł em wonny zapach po uchyleniu wieka skrzynki .	wieka	6	Neut
Sprawą włamania do domu wokalistki Blue Cafe zajęli się policjanci z komisariatu przy ul . Ciesielskiej .	wokalistki	4	Fem
Rękopisy zostały przyniesione przez lwowianina , który po wojnie osiedlił się w tych stronach .	lwowianina	4	Masc
- Synek ma zespół Downa .	Synek	1	Masc
Odkryto wiele nadużyć .	nadużyć	2	Neut
Listonosz Perez pokręcił z niedowierzaniem głową .	niedowierzaniem	4	Neut
Nagle usłyszałem strzał , wpadłem do warsztatu i zastałem trupa .	warsztatu	6	Masc
Staruszkę ze zmiażdżoną prawą stopą przewieziono do szpitala przy ulicy Cegłowskiej .	Staruszkę	0	Fem
Przez takiego drania wpakowali nas wszystkich czterech na dwa dni do łóżek .	drania	2	Masc
On dał nam Siebie w Eucharystii .	Eucharystii	5	Fem
- Nie wystarczyło być na Syberii , aby otrzymać takie odznaczenie .	odznaczenie	10	Neut
Palestyńczycy będą mogli nawet sprowadzić czołg .	czołg	5	Masc
- Czy nie zabrakło woli politycznej do osądzenia komunistycznych zbrodniarzy ?	osądzenia	7	Neut
Po spotkaniu w magistracie faktycznie ją wynajął za własne pieniądze .	magistracie	3	Masc
Odnalazł Jaskra , kibicującego łupiącym w gwinta krasnoludom .	krasnoludom	7	Masc
Podporucznik Kowalik oddał pług oraczowi .	pług	3	Masc
Czemu mięsa nie je ?	mięsa	1	Neut
Echo zadzwoniło we wnętrzu złomobusu .	Echo	0	Neut
Poseł Grzegorz Skwierczyński z Samoobrony przekonuje , że jest to spełnienie oczekiwań wyborców .	oczekiwań	11	Neut
Dozorca i drugi mężczyzna , stojący obok , wzięli kobietę pod ręce i wyprowadzili na korytarz .	kobietę	9	Fem
Przeciwko wnioskom Komisji ostro zaprotestował radny Krzysztof Gajewski , wiceprezydent w zarządzie odpowiedzialnym za zakup Elektrociepłowni .	Elektrociepłowni	15	Fem
Znaleźli się wkrótce przy przesypie .	przesypie	4	Masc
Czasem krzyżowały się statki .	statki	3	Masc
Dyrekcja ma też nadzieję , że w przyszłym roku znajdą się kolejne fundusze na ukończenie całego przedsięwzięcia .	ukończenie	14	Neut
RADA BEZPIECZEŃSTWA omawia skargę Zambii z powodu powtarzających się aktów agresji ze strony rasistowskiej RPA .	BEZPIECZEŃSTWA	1	Neut
