U młodej dziewczyny psychiatra z Modusa rozpoznał początki choroby psychicznej , dziewczyna myśli o samobójstwie .	początki	7	Masc
Trzeba rozstawić gmachy ministerstw w różnych punktach miasta , również na Pradze .	ministerstw	3	Neut
To już ich zmartwienie .	zmartwienie	3	Neut
W Kcyni odbyło się spotkanie z kandydatami na kierowników na samodzielny publiczny zakład opieki zdrowotnej w Kcyni i Kowalewku .	kandydatami	6	Masc
Stanisław Mróz prawie nigdy nie rozstawał się z dudami .	dudami	8	Neut
Polacy jadący w autokarze spoglądają z nietajoną dumą na wielkiego rodaka .	dumą	7	Fem
Użytkownik ma do dyspozycji 6 baz zawierających informacje posortowane według wybranego kryterium .	baz	5	Fem
On również myśli o przyszłości .	przyszłości	4	Fem
Zajmujemy się sobą , myślimy o swoich ambicjach , urazach .	urazach	9	Fem
W Niemczech płaci sie rolnikom za nieuprawianie ziemi .	nieuprawianie	6	Neut
Znaczna koncentracja tego gazu w przyziemnej warstwie atmosfery sprzyja więc podwyższaniu temperatury powierzchni Ziemi .	atmosfery	7	Fem
Dzieli wizja kierowania partią .	wizja	1	Fem
I z drżeniem serca zadzwonił em !	drżeniem	2	Neut
Lekarze opatrzyli stłuczenia , zwichnięcia i złamania u 14 pacjentów .	stłuczenia	2	Neut
Także w ubiegłym roku zniszczono nagrobki na cmentarzach w Gdyni i Kielcach .	nagrobki	5	Masc
W święta głodowało już sześciu pracowników MZK , przedwczoraj dwóch z nich odmówiło przyjmowania płynów .	przyjmowania	13	Neut
Neapolitańska policja zatrzymała czterech młodych Polaków pod zarzutem wymuszania pieniędzy i rabunku .	zarzutem	7	Masc
Większość z nas czuje się reklamami znudzona .	reklamami	5	Fem
Habit zwisał luźno z jej ramion .	ramion	5	Neut
Śmiał się wesoło , nacisnął dziewuszce nos , a ona obruszyła się , grożąc palcem .	dziewuszce	5	Fem
Sprytny oszust jest przekonujący , swym ofiarom proponuje pozostawienie obrączki lub innej bezwartościowej rzeczy w zastaw i zwrot gotówki za kilkadziesiąt minut .	pozostawienie	8	Neut
Dotąd absolutną większość w parlamencie mieli zwolennicy Radovana Karadżicia .	parlamencie	4	Masc
- Wysłaliśmy ponad 500 zapytań , systematycznie przeglądamy odpowiedzi i nie natrafiliśmy jeszcze na urzędnika , na którym ciąży prawomocny wyrok sądowy .	zapytań	4	Neut
Angażowały też prywatnych przewoźników .	przewoźników	3	Masc
Okazało się , że 22-latek jest żołnierzem służby czynnej .	żołnierzem	6	Masc
Pomimo smutnej wymowy , sztuka obfituje w sceny humorystyczne , można również posłuchać piosenek Wasowskiego i Przybory .	wymowy	2	Fem
Nad falami sterczał jeszcze tylko wystrzelający pionowo dziób .	falami	1	Fem
I taka sytuacja może powtarzać się w nieskończoność .	nieskończoność	7	Fem
Zgadzając się co do celu , uważamy , że metoda jego osiągnięcia nie jest dobra .	metoda	9	Fem
Ale wstrząsające relacje wywołały debatę na temat stosowania przymusu przy kontroli urodzin .	urodzin	11	Neut
Ostatnim wysiłkiem naprowadza płonący samolot wprost na wieżyczkę u-boota .	wieżyczkę	7	Fem
Dzięki nim zmniejsza się u chorego zaleganie afektu , rozładowują się utrwalone stereotypy uczuciowe , obiektywniej widzi swoją sytuację .	zaleganie	6	Neut
Mężczyzna doznał licznych obrażeń .	obrażeń	3	Neut
Na ramiona zarzuciła starą liliową chustę .	chustę	5	Fem
Jeżeli ciąża zagraża życiu matki , trzeba dokonać aborcji .	ciąża	1	Fem
Potem zadzwonił ksiądz Franciszek Blachnicki z gratulacjami .	gratulacjami	6	Neut
Poruszał rytmicznie kolanami , unosząc lekko siedzącą na nich kobietę .	kolanami	2	Neut
Tylko powszechne uwłaszczenie obywateli stwarza dla Polaków ostatnią szansę na uzyskanie realnych praw własności .	własności	13	Fem
Ogolić jaja na skina ?	skina	3	Masc
Trwają przygotowania do likwidacji Zakładu Naprawy Tramwajów w zajezdni przy ul . Gajowej .	likwidacji	3	Fem
Pod koniec gotowania dodajemy sos sojowy i na kilka minut pozostawiamy pod przykryciem .	sos	4	Masc
Na Siemiradzkiego wybrzydzali krytycy , ale publiczność uwielbiała jego obrazy .	krytycy	3	Masc
Wspieramy bezpieczną aborcję .	aborcję	2	Fem
Kiedy dziecko nie wróciło do domu , rodzina samodzielnie rozpoczęła poszukiwania .	poszukiwania	10	Neut
Więc jednak się znalazła rada !	rada	4	Fem
Popędzali swoje konie , bo koniecznie chcieli dopaść upatrzonej zwierzyny .	zwierzyny	9	Fem
Śpiącego , zielem odurzonego zabiła m sztyletem .	sztyletem	6	Masc
W wielu wsiach i miasteczkach do dzisiaj mieszkańcy kultywują sztukę ludową .	sztukę	9	Fem
Nie boi się pani tak improwizować w czasie swoich koncertów ?	koncertów	9	Masc
Miś Holender przysłał mu czerwone anemony i hiacynty na ostatek .	ostatek	9	Masc
Kiedy w Banja Luce skończył się ostatni , decydujący o medalu mecz , Halina leżała na parkiecie , a na niej kłębiła się góra ciał .	góra	23	Fem
Sterowali ruchem w pobliżu cmentarzy , kontrolowali trzeźwość kierowców poruszających się drogami województwa .	cmentarzy	4	Masc
Nie odpowiada ono na przykład prototypowi stalinowskiemu .	prototypowi	5	Masc
- Matce wyrwał by m serce .	serce	5	Neut
Wydeptuję schody , duszę dzwonki .	schody	1	Neut
- Nie mówiłem mu , kim jestem , ojcze .	ojcze	8	Masc
Skrzypnęły drzwi i Liść wszedł do środka .	środka	6	Masc
Kazancewa po raz ostatni widziano , gdy podróżował śmigłowcem w rejonie walk .	walk	11	Fem
To się nazywało teatr , ale to było mieszkanie cioci Lecha Emfazego .	teatr	3	Masc
Próbował bronić swej dyktatury , Osi , paktu z Hitlerem .	Osi	5	Fem
Nadal jednak będzie PSL przeciwnikiem gospodarki wolnorynkowej , partią w podejściu do gospodarki lewicową .	partią	8	Fem
Rodzice Agnieszki nie motywowali jej do nauki .	Rodzice	0	Masc
- A jaka to rola ?	rola	4	Fem
Mają zapewnić przychylność świata .	przychylność	2	Fem
Mózg pracował intensywnie .	Mózg	0	Masc
Moje pojawienie się w studiu przyjęto oklaskami .	studiu	4	Neut
Zwłaszcza przed znajomością z Affleckiem , kiedy była dziewczyną Brada Pitta .	znajomością	2	Fem
Gdzieś daleko warczał motor niewidzialnego samolotu .	motor	3	Masc
Po czym ogłoszono , że olimpiadę zawiesza się do odwołania .	olimpiadę	5	Fem
Taki stosunek nie może sprzyjać należytemu rozwojowi myśli twórczej wśród pracowników Stoczni , a tym samym przynosi straty państwu .	państwu	18	Neut
Z jego przepalonego i odsłaniającego rusztowanie kręgów gardła wydobył się syk .	gardła	7	Neut
Walka z pomówieniem jest jak walka z cieniem .	cieniem	7	Masc
Bawiąc się chwastami swojej simlah Manahem mrużył coraz podstępniej oczy .	simlah	4	Fem
To nasza ostatnia polemika z radnymi PO .	polemika	3	Fem
- A gdzie leżą ci , którzy pójdą do piekła ?	piekła	9	Neut
Czy wybór między czołowymi producentami nart jest istotny dla wyniku , czy to tylko kwestia pieniędzy ?	producentami	4	Masc
Porad rolnikom udziela w nim Janina Zielińska .	Porad	0	Fem
Natomiast zwierzęta znają lepiej .	zwierzęta	1	Neut
To znaczy , że konsjerżki miały rację .	konsjerżki	4	Fem
Wymaga to wielkiego samozaparcia i silnej woli , żeby nie ulec presji otoczenia .	otoczenia	12	Neut
Śpiewali całą gromadą .	gromadą	2	Fem
Powoduje bowiem utratę białka ze skóry i krwi , podczas jej stosowania maleje masa serca i spada wskaźnik podstawowej przemiany materii .	materii	20	Fem
Serduszka czekoladowe będą rozdawane w autobusach dla par .	par	7	Fem
Trąba zaś staje się w tych sprawach podstawowym kierunkowskazem .	Trąba	0	Fem
– Nie dokuczam , mamo !	mamo	4	Fem
Już dali upust swoim emocjom , nie hamowali łez .	emocjom	4	Fem
Celowo wyrażał em także inne wątpliwości .	wątpliwości	5	Fem
Stolicę zamieszkuje dziś 1,115.000 ludzi .	Stolicę	0	Fem
Wirują mu musztardowe księżyce i słońca , a na samym dole żagla zjawia się łeb wieloryba o mikroskopijnych , czerwonych oczach .	żagla	11	Masc
Do odgruzowania ulic nie brak ochotników .	odgruzowania	1	Neut
Winko odstawił em , bo mnie do grobu zaprowadzi .	Winko	0	Neut
Ciało znalazło nareszcie dla siebie miejsce .	Ciało	0	Neut
Cukier puder podać w osobnym naczyniu .	puder	1	Masc
Ufundowanie muzeum dla zbiorów Jasieńskiego było naturalnym odruchem obywatela , miłośnika sztuki .	obywatela	8	Masc
Sekcja zwłok wykazała , że przyczynami zgonu były zakrzepica żyły udowej , zator tętnicy płucnej i niewydolność krążeniowo - oddechowa .	niewydolność	16	Fem
Krzywulą wędrowca podwajał stare swe kroki .	kroki	5	Masc
Mój Piotrek uchodzi za speca w dziedzinie drewnianego budownictwa na Podhalu .	speca	4	Masc
Karolowi głowa pęka z bólu , całe ciało płonie .	bólu	4	Masc
Ludzie wyjechali w poszukiwaniu wygody .	poszukiwaniu	3	Neut
Na tym zapleczu też w istocie opiera się jednostkowa , personalna władza generała de Gaulle'a .	de	13	Masc
Z pozostałymi członkami dawnego kierownictwa związanymi z Gomułką plenum obeszło się bezceremonialnie , usuwając ich w większości ze składu KC .	kierownictwa	4	Neut
Cały kraj był zdławiony tym okropnym cieniem .	kraj	1	Masc
U nas takie imprezy są zupełną nowością , ale na Zachodzie to bardzo popularna dyscyplina .	Zachodzie	10	Masc
Z konarów i pni wyczarowywał dziwne figury przywołujące na myśl słowiańskich bogów .	bogów	11	Masc
Społeczeństwo wychowywano w ślepym posłuszeństwie wobec Cesarstwa .	Cesarstwa	6	Neut
Horti 2000 to także okazja do zapoznania się z najnowocześniejszymi sprzętami ogrodowymi , niezbędnymi nawozami , które sprawiają , ze nasza działka będzie obiektem zachwytu .	działka	21	Fem
Kołdra i ściągnięte z materaca prześcieradło dziwaczną draperią zwisało z łóżka .	Kołdra	0	Fem
Dzięki temu po wyjęciu dwóch foteli uzyskamy dodatkową powierzchnię bagażową .	wyjęciu	3	Neut
W wielkim domu znajdziesz dwie malowane brody .	brody	6	Fem
Do pupy polecam maść robioną w aptece .	aptece	6	Fem
Okulary od siebie z pokoju przynosi , druty za uszy zawija .	druty	7	Masc
Jeśli w młodości nie przyzwyczaimy organizmu do tego życiodajnego płynu , organizm przestanie wytwarzać laktozę , enzym niezbędny do trawienia cukru mlecznego .	płynu	9	Masc
Nie jedzmy margaryny .	margaryny	2	Fem
To samo dotyczy leczenia , służba zdrowia praktycznie przestała istnieć .	leczenia	3	Neut
Czy to ta niemoc grzybowa zwiastowała ?	niemoc	3	Fem
Większość wpływów banku z kredytów wynika z ich oprocentowania .	banku	2	Masc
Wojna i okupacja były tylko finałem , nieuchronnie wynikającym z samej istoty faszyzmu .	finałem	5	Masc
W styczniu radni Darłowa oficjalnie nadali swemu miastu miano królewskiego .	miastu	7	Neut
- Jeżeli można , Panie Prezesie . . .	Prezesie	5	Masc
Ambona była wyjałowiona .	Ambona	0	Fem
Tak już chyba na serio nie mówimy , a nasz cyniczny wiek jakąś aurę śmieszności wokół słowa zbudował .	śmieszności	14	Fem
Dzisiaj robotnicy zaczną frezować nawierzchnię .	robotnicy	1	Masc
Kibice przyjęli mnie niezwykle serdecznie .	Kibice	0	Masc
Zorganizowano również dla nich warsztaty rękodzielnicze z zakresu robienia na drutach , haftowania , tkania , wykonywania makram .	haftowania	12	Neut
Był brytyjski lotniskowiec , amerykańskie fregaty , hiszpańska piechota morska , portugalscy komandosi , polscy lotnicy .	fregaty	5	Fem
W czołówce znajduje się też słynna Zielona Budka , ale firma nie jest już polska .	czołówce	1	Fem
- Poszedł pod kościół .	kościół	3	Masc
W Wielkopolsce na nową maturę zdecydowało się 522 abiturientów .	maturę	4	Fem
Ponadto prezes powiadomił o przestępstwie tutejszą prokuraturę .	prezes	1	Masc
Każdy duży sklep samoobsługowy lub mięsny wyposażono w krajalnice do wędlin .	krajalnice	8	Fem
Zawahała się , chwyciła plik , położyła na stoliku i podniosła słuchawkę .	plik	4	Masc
- Ludzie starsi gubią się w technicznych problemach z tym związanych , a takie ciągłe zabawy ze zmianą pasma nadawania to brak szacunku dla abonentów .	zmianą	17	Fem
Kobieta z rozciętą głową i wstrząśnieniem mózgu trafiła do szpitala .	wstrząśnieniem	5	Neut
Na konferencji mówiono też o stanie gospodarki europejskiej .	gospodarki	6	Fem
jak skorzystać z usług akwizytora , a jednocześnie nie paść ofiarą przestępstwa ?	akwizytora	4	Masc
Shimada wyznaczył więc ludzi i za chwilę wnętrze góry poczęło błyskać upiornym światłem palników i ożywiło się znów koszmarną krzątaniną .	światłem	12	Neut
Pogotowie natychmiast odwiozło rannych pasażerów do szpitala w Rybniku .	Pogotowie	0	Neut
Stoję przed obliczem celnika .	celnika	3	Masc
Potem ból stał się tak silny , że przesłonił wszystko ciemnością pozbawioną woni i dźwięków .	dźwięków	14	Masc
Czy to znaczy , że Odessa podda się zukrainizowaniu ?	zukrainizowaniu	8	Neut
Samo pojęcie wywodzi się ze średniowiecznej filozofii .	pojęcie	1	Neut
Wydaje się , że powrót do pracy jest swoistym lekarstwem .	lekarstwem	9	Neut
Termin ten nie może przekraczać dwóch tygodni .	Termin	0	Masc
- Człowieku , ten nowy też już zdążył się zestarzeć .	Człowieku	1	Masc
Nigdy nie mieszkał em w żadnym schronisku .	schronisku	6	Neut
Przysiadł na oparciu fotela , objął mnie ramieniem .	oparciu	2	Neut
Nie czekając na decyzję Akcji , Unia Wolności zaczęła lansować na prezesa Karola Modzelewskiego , historyka i polityka związanego z Unią Pracy .	historyka	15	Masc
Czarodziejka usiadła , wracając do przerwanej czynności .	Czarodziejka	0	Fem
Wojskowy kandydat nie rozdawał ulotek ze swoim programem wyborczym .	kandydat	1	Masc
Małżonka krewnego przezornie schowała się do skrzyni i to ją uratowało .	Małżonka	0	Fem
Towarzyszyli mu polscy policjanci ze specjalnego wydziału zajmującego się deportacją z Komendy Głównej Policji .	deportacją	9	Fem
Zawsze można liczyć na zrozumienie i zaufanie kolegów , a wspólne poznawanie choroby pomaga zaakceptować fakt , że jest się alkoholikiem .	zaufanie	6	Neut
Nie puszczamy w powietrze materiałów obciążających .	powietrze	3	Neut
- Ostatnio powiedział Pan , że Trybunał zachował się w sprawie konkordatu jak Piłat .	konkordatu	11	Masc
Jeszcze sprawdza zapięcia uprzęży i sprawność swego radia .	zapięcia	2	Neut
Statut określa zasady wynagradzania za użytkowanie tych wkładów .	użytkowanie	5	Neut
Miał kochającą rodzinę , swoje pasje i marzenia .	marzenia	7	Neut
Może ma pan jakieś inne życzenie ?	życzenie	5	Neut
- Codziennie jest tu opiekunka pani Gabrysia .	opiekunka	4	Fem
Przez 26 lat pracował w Komendzie Rejonowej Policji w Jarosławiu .	Komendzie	5	Fem
Można pochwalić drużynę za walkę . "	drużynę	2	Fem
Obaj chorążowie zostali natychmiast zatrzymani i osadzeni w areszcie .	chorążowie	1	Masc
Mam prawo przypuszczać , że reakcje Polaków w takim wypadku odbiegały by od zachowania Amerykanów .	reakcje	5	Fem
- Zakłady i instytucje państwowe działają na podstawie decyzji urzędniczych .	instytucje	3	Fem
Jak to wygląda w praktyce ?	praktyce	4	Fem
Maturzyści - internauci zdający na pisemnym egzaminie język polski i historię najczęściej typują tematy związane z przełomem wieków .	tematy	13	Masc
Oczekując na swoją kolej , rozmawiają i oglądają filmy w świetlicy pod czujnym okiem opiekuna Rudolfa Dyrksa .	kolej	3	Fem
500 chuliganów zorganizowało protest przeciw złej sytuacji finansowej klubu .	chuliganów	1	Masc
Chód ich był jak muzyka .	Chód	0	Masc
Etiopczycy kontynuują atak , choć pod koniec ubiegłego tygodnia władze Erytrei poinformowały o wycofaniu swych oddziałów ze wszystkich spornych terenów nadgranicznych .	wycofaniu	13	Neut
W ubiegłym roku trzynastki pochłonęły 54.537 złotych .	trzynastki	3	Fem
Ale on już nie mógł powstrzymać się od mówienia .	mówienia	8	Neut
Nauczyciel szybko uporał się z zakupami i , nie powracając już do poprzedniego tematu , z widoczną ulgą pożegnał chałupniczkę .	Nauczyciel	0	Masc
Różnica między tymi ugrupowaniami jest niewielka .	Różnica	0	Fem
Chociaż zimą też można się świetnie bawić .	zimą	1	Fem
33-letniemu mężczyźnie przedstawiono zarzut usiłowania zabójstwa ochroniarza .	ochroniarza	6	Masc
Po kilku godzinach wycofuje oskarżenia .	oskarżenia	4	Neut
Zza kamiennej podpory mostu , kilkanaście metrów od brzegu słychać było wołanie o pomoc .	podpory	2	Fem
W Charkowie 300 osób odkryło ostatnio karaimskie korzenie .	korzenie	7	Neut
Gospodarstwo Stanisławy Sowy , Irki Paulako i Moniki Niebrzydowskiej rozszerza się powoli poza obręb zabudowań gospodarskich .	Gospodarstwo	0	Neut
Ochmistrz ma otwartą kabinę , dla przyzwoitości pukam w uchylone drzwi .	kabinę	3	Fem
Gdy wchodziła w życie reforma edukacji , Jerzy Buzek otwierał rok szkolny i prezentował gimbusy .	gimbusy	14	Masc
- Strajk nie zostanie przerwany .	Strajk	1	Masc
Czy senator rzuci rękawicę wszechwładnemu przewodniczącemu ?	rękawicę	3	Fem
Przygrywały kapele , występowały zespoły i soliści .	soliści	6	Masc
Do oficjalnych transportów robotnicy dorzucali swoje ładunki .	transportów	2	Masc
Nagrody przyznała specjalna Kapituła , pragnąc uhonorować osoby i instytucje , których działalność wniosła znaczący wkład w krzewienie tolerancji .	krzewienie	17	Neut
Bardzo podobał mu się plac Centralny , wszechobecna symetria i wolne przestrzenie .	symetria	8	Fem
A poza tym , w kwestiach kuchni w szkołach i sprzątania szkół , dobrem dzieci zasłania się przede wszystkim chęć utrzymania własnego stołka .	kwestiach	5	Fem
- Spojrzał triumfalnie po obecnych , jakby przypuszczał , że ktoś mógł by nie znać tego cytatu .	cytatu	16	Masc
Według relacji świadków , gdy biały opel frontera zbliżył się do ambasady , wyskoczył z niego człowiek ubrany w panterkę , z granatnikiem w ręku , i próbował odpalić granat w kierunku ambasady .	granatnikiem	22	Masc
Po ukończeniu zakopiańskiej Szkoły Przemysłu Drzewnego i warszawskiej ASP osiadł w Zakopanem .	ukończeniu	1	Neut
Nagrody i poczęstunek był dla wszystkich , a najlepsi zawodnicy otrzymali ponadto puchary .	poczęstunek	2	Masc
koło tesko jest tektilandia i tam też są ładne .	tesko	1	Neut
Rodzice nie będą już mogli wmawiać swoim pociechom , że przynosi je bocian bądź znaleziono je w kapuście .	kapuście	17	Fem
Nigdy nie budował fantastycznych hipotez .	hipotez	4	Fem
- To te sosny za torami ?	sosny	3	Fem
– Robię to tylko z nudów .	nudów	5	Fem
W zaborze rosyjskim po śmierci Aleksandra II , który zginął w zamachu terrorystycznym , nastąpiło gwałtowne zaostrzenie polityki represyjnej we wszystkich dziedzinach życia publicznego .	dziedzinach	21	Fem
Marta straciła orientację w najprostszych sprawach .	orientację	2	Fem
Czemu godzę się na tortury pod obojętnym światłem wielkiej lampy ?	tortury	4	Fem
Zaczął em się obawiać , że wyrządził em mu krzywdę .	krzywdę	9	Fem
Rządy muszą się z nimi porozumieć w każdej poważniejszej sprawie .	Rządy	0	Masc
– Listę masz ?	Listę	1	Fem
Halina Auderska we wszystkich książkach każe swoim bohaterom szukać tożsamości .	bohaterom	7	Masc
Kiermasze te zapowiadały Wielki Tydzień , który charakteryzował się postem i wyrzeczeniami .	wyrzeczeniami	11	Neut
Nawet dla słabo zorganizowanych grup , przewalanie towaru będzie kaszką z mlekiem .	mlekiem	11	Neut
- Pozwólmy mu trochę pomyśleć nad swoimi manierami .	manierami	7	Neut
Z jakiego powodu tak zaskoczyło ono paleoantropologów ?	paleoantropologów	6	Masc
Izydor znieruchomiał z kopiowym ołówkiem nad blankietem reklamacyjnym .	blankietem	6	Masc
Proszę uzgodnić z recepcją terminy , przełączam .	terminy	4	Masc
Większość to uciekinierzy i ich potomkowie .	uciekinierzy	2	Masc
Na tej podstawie otrzymają diety , od 1500 do 2000 złotych .	diety	4	Fem
Była to procedura dość długa i niezbyt przyjemna .	procedura	2	Fem
Liczb jeszcze nie ma , ale powinny pojawić się w najbliższym czasie .	Liczb	0	Fem
Wyróżniał się licznymi szybami górniczymi , kryjącymi w swych wnętrzach wieże wyciągowe i windy do przewozu ludzi i węgla .	przewozu	15	Masc
Do dziś w sądownictwie pracują osoby , które rozpoczynały swoją karierę w latach stalinowskich .	sądownictwie	3	Neut
Adams odpowiedzialnością za tę porażkę obarczał Hamiltona i jego ludzi , którzy doprowadzili do rozłamu wśród federalistów .	federalistów	16	Masc
Pałęczkę przejęła Ciri .	Pałęczkę	0	Fem
Miłość nie jest wzajemną zależnością , ani uzależnieniem .	zależnością	4	Fem
Francuskie Zgromadzenie Narodowe uchwaliło wczoraj kontrowersyjną ustawę o skróceniu obowiązkowego tygodnia pracy z 39 do 35 godzin .	skróceniu	8	Neut
Nagrali razem pierwszą płytę .	płytę	3	Fem
Tata musiał pojechać do domu .	Tata	0	Masc
Rok funkcjonowania wyższych szczebli samorządów nie upoważnia jeszcze do ocen .	samorządów	4	Masc
Dotychczasowa siedziba Archiwum jest przede wszystkim za mała w stosunku do wzrastających w szybkim tempie zbiorów .	Archiwum	2	Neut
W tej lecznicy usunięto pacjentce martwą ciążę , a także macicę i fragment jelita .	jelita	13	Neut
Z relacji świadków wynika , że 60-latek nagle upadł .	60-latek	6	Masc
Mężczyzna z sumiastymi wąsami nazwany kawalerem wyraźnie się speszył .	wąsami	3	Masc
Jeżeli nasz samochód to combi lub van , a zwierzak jest duży , możemy przewozić go w odpowiednio przygotowanym bagażniku .	van	6	Masc
Ja stoję w bruździe i w uniesionej ręce trzymam zapalony fanarek .	fanarek	10	Masc
Zza kulis wychodzi aktorka grająca Magdalenkę .	aktorka	3	Fem
Dopuszczenie do takiego podziału jest porażką .	Dopuszczenie	0	Neut
Jest to nakrycie do lunchu .	nakrycie	2	Neut
Niby napisał Poskromienie złośnicy , ale co zrobić z Miarką za miarkę ?	złośnicy	3	Fem
Tymczasem smutny urzędnik konsulatu zajął się moim bagażem .	bagażem	7	Masc
Z lodówki wyjęła niewielki dozownik wypełniony rubinową cieczą i bardzo ostrożnie wcisnęła go do otworu w pudełku .	pudełku	16	Neut
W zgodnej opinii sztabu szkoleniowego radomian , wszyscy mają równe szanse .	sztabu	3	Masc
Sznur tirów przecina niemal cały Wrocław , ma dziesięć kilometrów długości , stoi w nim kilkaset ciężarowek .	ciężarowek	16	Fem
W lesie zające występują raczej na pobrzeżach , w głąb idą tylko w silne mrozy .	zające	2	Masc
Uczestniczki wysłuchały wykładów doradców zawodowych i prawników , uczestniczyły w zajęciach psychologicznych , poznawały podstawy obsługi komputera i korzystania z Internetu .	zajęciach	10	Neut
Wino białe pije się inaczej .	Wino	0	Neut
Mają prąd na swoje potrzeby , a nadwyżki sprzedają .	nadwyżki	7	Fem
– ale kolację zaraz będziemy szykować .	kolację	2	Fem
Statut określa zasady wynagradzania za użytkowanie tych wkładów .	wynagradzania	3	Neut
Dziecko niespodziewanie wsiadło do czekającej na piętrze windy .	windy	7	Fem
Tworzyły się tajne wspólnoty religijne , klasztory , seminaria duchowne .	seminaria	8	Neut
Kto wiatr sieje , ten burzę zbiera .	burzę	5	Fem
Woły stąpały ospale , skrzypiały jarzma .	jarzma	5	Neut
Po zakończeniu kariery Perry rok w rok komentował Wimbledon .	zakończeniu	1	Neut
Już na schodach usłyszała dźwięki dobiegające z komnaty dziadka .	dziadka	8	Masc
W dyskusji zgłoszono wniosek o odrzucenie projektu uchwały w sprawie założeń polityki pieniężnej na 1995 r .	dyskusji	1	Fem
- Komora będzie gotowa do wszczepienia za jakieś półtora roku .	półtora	8	Neut
Także usługi ogólnobudowlane prowadzi drugi z odznaczonych , pan Marek Nosal .	usługi	1	Fem
Poza tym zawsze proponuję lewicy , by odeszła od ideologicznej walki z prawicą i przeszła na spory o gospodarkę .	gospodarkę	18	Fem
Oprócz Polaków odpływali na tę wyprawę także i cudzoziemcy , wszyscy spod znaku republikańskiego .	cudzoziemcy	8	Masc
Wcześniej kupił dwie łodzie rybackie dla 12 rodzin .	łodzie	3	Fem
Poza tym boiskiem panuje chaos .	boiskiem	2	Neut
Jedziemy do Havru , ten stary kozioł płaci .	kozioł	6	Masc
Geday wymyślił depilator , cudeńko .	cudeńko	4	Neut
Prowadził też agencję reklamową .	agencję	2	Fem
Od trzeciego rozbioru Polski do odzyskania niepodległości minęły 123 lata .	odzyskania	5	Neut
Czy komornik poprzestanie na aucie byłego ministra , skoro śledczy kazali zabezpieczyć majątek wart 150 tys . zł ?	aucie	4	Neut
Za dwa dni miał em gotową pieczątkę .	pieczątkę	6	Fem
Drugi pod względem kapitalizacji giełdowej Wielkopolski Bank Kredytowy osiągnął bardzo dobrą miesięczną dynamikę zysków wynoszącą 81,4 proc .	Bank	6	Masc
Wychowałam tam 10 specjalistów chirurgii dziecięcej .	chirurgii	4	Fem
Czy wszystkie drabiny należą do drabów ?	drabiny	2	Fem
Bo chciały uratować zaskrońca , ale teraz są w kropce .	kropce	9	Fem
Tłum domaga się wydania zbiega .	Tłum	0	Masc
Wyprowadzają one małe koźlęta na płaty śniegu i uczą je zjeżdżać na racicach .	koźlęta	3	Neut
Biała plama zniknęła , cały glob był opasany siecią wspólnot .	plama	1	Fem
Maksymalizację wydajności skrawania osiąga się dzięki maksymalizacji przekroju warstwy skrawanej i prędkości skrawania .	skrawania	2	Neut
Jestem proboszczem liczącej 1180 osób parafii , która posiada zabytkowy kościół wpisany do rejestru zabytków .	kościół	10	Masc
- Będzie realizowana jedna polityka uzgodniona na posiedzeniach Rady Ministrów .	posiedzeniach	7	Neut
Zadanie dotyczy odcinka o długości 0,46438 km .	Zadanie	0	Neut
Mag osunął się bezwładnie .	Mag	0	Masc
W grupie finałowej rozegrano mecze każdy z każdym i wyłoniono zwycięzcę , którym został zespół Warka Tuchola .	Warka	15	Fem
Posiadanie pełnych praw akademickich oznacza , że uczelnia nadaje stopień naukowy doktora , przeprowadza przewody habilitacyjne oraz występuje z wnioskiem o nadanie tytułu naukowego profesora .	tytułu	22	Masc
Jej facet jest zmęczony pracą , pomidorówką oraz żoną .	pomidorówką	6	Fem
