І Марина падала навколюшки , молила матір божу , щоб велика заступниця наслала мир на її рідну сторону і захистила від напасті !	захистила	19	Fem
— Іди собі ! — гукнув голова , бачачи , що в неї й річ відтяло .	відтяло	15	Neut
Половців розвіяла татарська навала 1234 - 1240 рр . , що її наслідком було загарбання всієї України мало не на ціле століття .	розвіяла	1	Fem
Про рік 1874-й я знав від С . О . Єфремова , який знайшов ще листи , писані Вами з Відня до видавництва « Вік » .	знав	4	Masc
Дуже задоволена була зі свого партнера Катерина Рубчакова , яка грала Анну .	грала	10	Fem
Поплював у руки , взяв сокиру та коли гупнув обухом по бабиному залізному носі , той переломився .	Поплював	0	Masc
Казала , що ночувала в Домахи , але злі язики говорили , що вона деінде проводила свої ночі .	ночувала	3	Fem
Раз лиш заблудив у глибокий ліс .	заблудив	2	Masc
Регіт стих ; усі похнюпили очі у землю ; одна тільки Галя гостро дивилася на всіх гультяїв — і червона краска грала на її щоках , тоді як серце підкидалося в грудях , а груди поривчато дихали .	стих	1	Masc
Потім він зацікавився Земельвайсом , угорським акушером , який вперше почав застосовувати антисептики , від чого смертність новородків і породіль відразу зменшилася у десятки разів .	зменшилася	21	Fem
Дзядзьо не надто знався на суспільних і державних системах , але вірив у сталість людської природи .	вірив	11	Masc
Рафаель брав у мене пару кубів спирту для промивання шифрувальної апаратури і вводив його собі внутрівенно .	вводив	12	Masc
Я , як громадянин , переконаний у тому , що демократія в Україні зазнала серйозної поразки .	зазнала	13	Fem
Що свого часу й практикувалося .	практикувалося	4	Neut
" До Умані завітав представник села Дзензелівка і попросив нас приїхати до них на тиждень з виставами , – пише актор Василь Василько .	попросив	8	Masc
Ми нещодавно подібний у смарт - шоп батькам брали , фірми Assistent , коштував близько 1600 гривень .	коштував	13	Masc
Він тихо гладив їй волосся , сам погноблений чуттям , що лишає по собі пустиню .	гладив	2	Masc
Маленький смугастий звірок , що сидів собі навпочіпки на поваленій кедрині проти сонечка і пильно , з виглядом ученого дослідника , розглядав торішній грибок , тримаючи його передніми лапками , раптом нашорошився .	розглядав	21	Masc
Капітан Єлізаров видавав нам лише десяту частину спиртової норми , а решту тримав у слоїках , зачинених у сейфі .	видавав	2	Masc
Однак , пара свій роман офіційно досі не підтверджувала .	підтверджувала	8	Fem
А що був красивий , то в процесі переховування кохав усіх зустрічних жінок , тому " кохання " в назві - у множині .	кохав	9	Masc
— Візьми та гляди , — каже , — небагато накладай на віз , щоб ти мені коня не спортив .	спортив	19	Masc
В інституті ми попрацювали рік , добре поїздивши карпатськими містечками і лісами , в яких ніколи більше не довелося побувати , вивчивши паралельний світ цілої мережі лісництв і запам’ятавши основи лісівництва .	довелося	18	Neut
У травні гурт виступив на сцені міжнародного фестивалю татуювань « TattoCollection 2015 » та разом з гуртом YouCrane влаштував міні - тур містами Західної України з завершальним концертом у Києві .	виступив	3	Masc
Зустріч дозволила актуалізувати значну кількість проектів , в найшвидшій реалізації яких зацікавлені обидві сторони .	дозволила	1	Fem
Вона перебирала й інші влучні слова - означення для своїх колег , слова нібито неприйнятні в мовленні вчителя .	перебирала	1	Fem
Азовське море утворилося на місці давнього морського басейну .	утворилося	2	Neut
Він спав довгі віки , і сон його був лихий .	спав	1	Masc
Бібліотека , його рідна дитина , складена з уламків поміщицьких книгозбірень , розкладок з повітполітосвіти та дрібних купівель і пожертв , нараховувала 2178 томів , що він їх сам переписав , перенумерував і порозставляв , розбивши на відділи .	нараховувала	21	Fem
Щодо ремонтів і " облагородження " зйомної квартири , то поміняла їх кілька , але тільки в першій і в цій , що живем зараз робили " облагородження " .	поміняла	10	Fem
На фініші командир полку виставляв чергову машину з термосами чаю .	виставляв	4	Masc
В Оришки затіпались челюсті , забігала по виду мишка .	забігала	5	Fem
Він міг бути почутий , звісно , але допоки він знаходився у своїй теперішній позиції його не можна було побачити .	знаходився	10	Masc
Коли назбирувалося більше талонів , я запрошував своїх приятелів у дієтичну їдальню , і ми влаштовували собі бенкет з бабки , политої киселем .	назбирувалося	1	Neut
Як зазначає Б . Вербер : « Сінгапур – держава демократична , але для того , щоб громадяни не голосували як попало , на виборчому бюлетені пишеться номер картки виборця » .	попало	21	Neut
Перед тим , як повіситися , пані Ірця принесла до нас свою колекцію срібного начиння і попросила , щоби ми віддали його урядові незалежної України .	попросила	16	Fem
Малеча хапала гливкий жовток , давилася , чмихала .	давилася	5	Fem
Пішла вона , набрала борошна , замісила , затопила в печі й почала варити вечерю .	замісила	6	Fem
У дельфінарії в різні роки утримувалося від 4 до 6 дельфінів походженням з Чорного моря та Тихого океану , морські леви та морські котики .	утримувалося	5	Neut
Я виходжу з-за клуба , в новенькому дешевому костюмі ( три вагони цегли розвантажив з хлопцями - однокурсниками , то й купив ) і з чемоданчиком у руці .	розвантажив	13	Masc
Заглянула на піч — нікого .	Заглянула	0	Fem
Маленький смугастий звірок , що сидів собі навпочіпки на поваленій кедрині проти сонечка і пильно , з виглядом ученого дослідника , розглядав торішній грибок , тримаючи його передніми лапками , раптом нашорошився .	сидів	5	Masc
1193-го Папа Римський Целестин III ініціював хрестовий похід на прибалтійських язичників .	ініціював	5	Masc
Пішла вона , набрала борошна , замісила , затопила в печі й почала варити вечерю .	затопила	8	Fem
( Щербицьким Москва замінила Шелеста пізніше , в червні 1972-го , коли каток репресій уже був розкручений на повну . )	замінила	3	Fem
Він дуже струнко сидів на стільці , його могутня грудна клітина роздувалася та тремтіла так ніби у ній вирував штормовий океан .	вирував	18	Masc
Ухватила її , полізла на піч , забралась аж у самий куточок та й з'їла її , а кісточки забрала в торбинку й повісила на жердочці .	з'їла	14	Fem
Один із них злегка нагнувся і при допомозі другого насадив на свої плечі скоростріл .	насадив	9	Masc
Пан Коцький злякався кабана , скочив на дерево та й подерся туди , де ведмідь сидів .	злякався	2	Masc
Напрацювалася й натягнулася .	натягнулася	2	Fem
Заходив вечір , і хлопець , поблукавши трохи по Шевченківському бульвару , вирішив таки навідати Надійку , що спинилась у подруг недалеко критого ринку .	спинилась	18	Fem
Нема на світі людини , якій би це не подобалось , звісно , коли дивуються нею .	подобалось	9	Neut
Чувак побачив , що патрульні заходять у під'їзд , хутко чкурнув у квартиру і причаївся .	чкурнув	10	Masc
Свого часу пів - Ірландії виїхало в штати , і чи згубило це Ірландію ?	виїхало	5	Neut
До Красної Поляни їхалося перевантаженим пазом справжнім серпантином .	їхалося	3	Neut
Міністерство Правди яке займалося виробництвом новин , освіти , розваг та образотворчого мистецтва .	займалося	3	Neut
Смугастий звірок - бурундук почав бавитися з ними , задравши хвостика , як той драгун султана , перестрибував через них .	перестрибував	17	Masc
Квітневе сонце таки добре припікало !	припікало	4	Neut
Засмалених юнаків у синіх і червоних штанцях вона дразнила своїми духовитими десу , червоними підв’язками — Вер була брюнетка — і прозорістю довгих чорних панчіх .	дразнила	8	Fem
Вінстон різко отямив себе та сів пряміше .	сів	5	Masc
Натомість Зілинський , прекрасний діалектолог , де-не-де у своїх діалектних дослідженнях наважувався робити висновки історичного ґатунку , що ніяк не підтверджувалися пам’ятками й залишалися чистісінькими спекуляціями ( які він сам пізніше мусив спростовувати ) .	наважувався	11	Masc
Божа мрія цвіла , як і перше , і спокій був на землі .	цвіла	2	Fem
І від того дня так забагатів , що не було такого багача в цілій околиці .	забагатів	5	Masc
Фільм зняли за романом Патрісії Хайсміт " Ціна солі " , який вийшов друком ще у 1951 році .	вийшов	12	Masc
Вночі тато попросив сиґарету , спробував курити й усвідомив , що більше не зможе цього робити .	попросив	2	Masc
" Змичка міста й села — це міцна запорука майбутніх міст - садів " , — кінчив він і здав працю на годину раніше , ніж мав би право зробити це за терміном .	кінчив	16	Masc
Маю зізнатися , що коли я почула цю фразу вперше ( років в 15 ) , я надавала їй зовсім іншого значення .	надавала	17	Fem
Політична еліта , представлена більшістю тих , хто проголосував сьогодні проти українського уряду , виявилася неготовою визнати легальну економіку і публічну політику єдиним можливим способом суспільного розвитку .	проголосував	8	Masc
В Ужгороді його застрелив совєтський офіцер .	застрелив	3	Masc
– Уважайте на нього , щоб не покинув університету і не вступив до театру , – звертається колишня актриса театру " Руська бесіда " у Львові Ванда Янович до Хоми Водяного .	покинув	7	Masc
Писав сонети про війну , як було вже казано , і про « святий ідеал » .	Писав	0	Masc
От хазяїн його взяв та й вивіз у ліс , думає : « Нащо він мені здався , тільки дурно буду годувати , — нехай лучче в лісі ходить » .	взяв	3	Masc
Вона глянула ще раз на Мотрю , поступилася назад , простогнала , сіла мовчки на піл , узявшись холодними руками за крайню дошку , щоб не впасти .	простогнала	10	Fem
Випробування технології проводилось протягом грудня у Кембриджі ( Великобританія ) , і , як показали результати , доставка може тривати близько 30 хвилин , що значно швидше та ефективніше , ніж доставка багатьма іншими методами .	проводилось	2	Neut
Миттєво його обличчя стало яскраво - червоним і вода потекла з його очей .	потекла	9	Fem
Вхопив свою матір і скочив просто в пекло .	скочив	4	Masc
Обидві братові змагалися голосами , і , розуміється , побила рекорд Марія .	побила	9	Fem
На висланні він мріяв стати оперним співаком .	мріяв	3	Masc
“ Я не любився ні з ким ще зроду , – щиро зізнається він Мавці .	любився	3	Masc
Її там не впізнали , і як уже вона розказала все , то мачуха аж об поли вдарилась , що , бач , вона думала її з світу зігнати , а тут зовсім не так вийшло ...	вдарилась	17	Fem
Прийшла господиня і , вийнявши , щоб не подушилися між яйцями , тих , що вже обсохли , поклала в решето та поставила на піч .	Прийшла	0	Fem
Там принаймні відлунювало піаніно .	відлунювало	2	Neut
Що так обурило білорусів ?	обурило	2	Neut
Мр . Фред Кетлінг прочитав програму від дошки до дошки , потім добув годинник , що вказував чверть на сему , і сказав коротко :	добув	12	Masc
Мені стало ясно , чому , коли я напередодні нашого бою випадково проходив повз чеський курінь , між ним і противником стояла дивна тиша .	стояла	21	Fem
Дякую всім , хто підтримував уряд і мене у ці півтора року .	підтримував	4	Masc
Від такої точної відповіді він втягнув голову в плечі й боязко заморгав білявими віями .	заморгав	11	Masc
Але склалося так , що пізніше нас несподівано зводило ще і ще у зовсім інших сферах — виробництві і продажу шипучих вин , представництві найпопулярнішого тижневика , створенні модного журналу , ловленні форелі .	склалося	1	Neut
Одно дерево упало на віз і розтрощило його на шматочки , друге вбило коня ; насилу той чоловік вискочив з лісу .	розтрощило	6	Neut
В одній з кімнат стояла велика фізгармонія , правдоподібно , лишилася з часів дяківки .	лишилася	10	Fem
Молдавські володарі , що , здавалося би , міцно сиділи в Білгороді на Дністрі , терпіли тут наявність „ татарського царевича “ ще до нової татарської хвилі часів Менглі - Герая .	здавалося	5	Neut
І « Стодолю » з ними , подумав він , лиш уголос цього не сказав .	подумав	7	Masc
Вона зсадила .	зсадила	1	Fem
Лише на його уроках українська література виглядала симпатичною .	виглядала	6	Fem
— Він врятується , — сказала вона ; в голосі їй дзвеніли істеричні нотки : — Він вислизне , він хитрий .	сказала	5	Fem
Але все було добре , поки раптово не звіявся вітер і почалася злива .	звіявся	8	Masc
Приїхали на Димну суміш , а найбільше мені сподобалося лежати під зірками о другій ночі .	сподобалося	8	Neut
Казала , що ночувала в Домахи , але злі язики говорили , що вона деінде проводила свої ночі .	проводила	15	Fem
Ти якось неуважно дивилась серіал .	дивилась	3	Fem
Чув він , коли вертається його дружинонька , як роздягається в темноті , розщіпає натягнену корсетку , думає про останній прощальний крадений поцілунок і всміхається до темноти ?	Чув	0	Masc
Вони здавались особливо смашними , і то один , то другий голосно шльопався на землю , коли сусіда занадто сильно сіпав його за палець .	сіпав	20	Masc
Усі , кому я радила , не пожалкували .	радила	4	Fem
Лише в південно - західному наріччі принаймні декотрі говірки ( а точніше їх носії ) називаються так , як визначив сам народ ( зазвичай це слова на позначення сусідів ) , а не штучними науковими окресленнями .	визначив	19	Masc
ні розвиненої промисловості , ні доброї освіти на острові не існувало .	існувало	10	Neut
Аж тут з’явилась почвара ( то Диявол був ) .	з’явилась	2	Fem
Вуйко Осип , який був начальником медичного поїзда УГА , а тому мав шанс закінчити медичні студії лише у Празі , добре розумів становище військових еміґрантів і скуповував картини без огляду на якість .	скуповував	27	Masc
І темніли вони для дочки й для матері ; здавалась темною хата , й світ що вривався у вікна , чорнів у віччю в них ...	вривався	16	Masc
Йому нарадили одну гарну дівку , щоб він її брав ; він за ту й забув , що його врятувала від змії , з іншою заручився .	брав	9	Masc
Той і сів .	сів	2	Masc
Він жорстко ґвалтував її та перерізав їй горлянку у мить оргазму .	ґвалтував	2	Masc
аж смішно , коли пишуть " нічого не робила " , очевидно же , що груди і губи зроблені , тільки дурний не побаче .	робила	8	Fem
Утворена в травні 1919 Команда запілля , що перебрала тимчасово функції ДСВС , увійшла в червні до Етапної Команди УГА .	увійшла	13	Fem
— Ще тому кілька днів спротивився прем'єр Великої Британії , Черчіль всяким змінам у свому кабінеті , а сьогодні вже є вістка , що в уряді Черчіля проведені зміни .	спротивився	5	Masc
На листопадових канікулах я відмовлявся записуватися у почесну варту біля пам’ятника чекістам , бо треба було хоч кілька днів побути в осінньому Делятині .	відмовлявся	4	Masc
Нам подобалося слухати Брежнєвське цмокання на збільшеній швидкості .	подобалося	1	Neut
( ні в Києві , ні у Львові , ні в Дніпрі - в жодному іншому місті , де я досі читала на презентаціях цей текст , подібної реакції не було ) .	читала	21	Fem
Спочатку вироблялися стінки її від вінця аж до ноги , а тоді виготовлялося додатково ніжку , вмащуючи глину з двох боків так , щоб постало дно та частинне або повне виповнення ніжки .	постало	24	Neut
В цю ж купу йде й сонетист Жак Шаню , якого преміювала навіть французька академія ( тільки цих своїх , релігійних , патріотичних і т . інш . вона й преміює ! ) .	преміювала	11	Fem
