Поверхня посудини тоді вигладжувалась зглядно потім ще примазувалась .	вигладжувалась	3	Fem
Як правило , письмо в Україні ґрунтувалося на взірцях , узятих з інших слов’янських мов ; літописці й переписувачі аж ніяк не прагнули до відтворення реальної фонетики мови щоденного вжитку .	ґрунтувалося	6	Neut
Навіть святий Миколай залишав свої мандаринки для тети Міри у торбинці , прив’язаній до клямки її покою .	залишав	3	Masc
Пізніше почав грати свою найкращу роль – Михайла Гурмана в " Украденому щасті " .	почав	1	Masc
Скінчилося тим , що ми захотіли подивитися на нічне місто .	Скінчилося	0	Neut
На другому місці за популярністю запитів розташувалася наукова фантастика " Прибуття " , а на третьому місці розташувалася – режисерська робота Мела Гібсона , військова драма " З міркувань совісті " .	розташувалася	17	Fem
До того ж передала запрошення від королеви : новообраний президент може зупинитися в Букінгемському палаці під час офіційного візиту .	передала	3	Fem
Назовні , навіть крізь скло закритих вікон , світ виглядав замерзлим .	виглядав	9	Masc
У місті Бучачі якийсь час діяли водночас 2 ГЕС : одна називалася міською ( вважалася комунальною ) , інша називалася — « на Топольках » , яка після відновлення діє й нині .	називалася	19	Fem
От хазяїн його взяв та й вивіз у ліс , думає : « Нащо він мені здався , тільки дурно буду годувати , — нехай лучче в лісі ходить » .	вивіз	6	Masc
А громи так почали бити , що душа із чоловіка мало не вискочила вон .	вискочила	12	Fem
Мотря не озивалася ; плакала мовчки .	озивалася	2	Fem
" Правоохоронці з’ясували , що невідомий зробив потерпілому зауваження через те , що він палив у недозволеному місці та лаявся на перехожих .	палив	14	Masc
Адже і в курінях на покуті сиділо виборне отамання та чесне товариство , а не якісь заволоки - потурнаки » .	сиділо	6	Neut
Маю зізнатися , що коли я почула цю фразу вперше ( років в 15 ) , я надавала їй зовсім іншого значення .	почула	6	Fem
Давав їй місце на постелі й уважно віддалік слухав , коли засипала вона , як дихала .	засипала	11	Fem
Нижче по вулиці висів ще один плакат , обідраний з краю , що гарячково тріпотів на вітру , почергово показуючи та ховаючи одне єдине слово ІНГСОЦ .	тріпотів	14	Masc
Нам дзядзьо подарував кількадесят блискучих патронів .	подарував	2	Masc
СТАРШИЙ БРАТ НАГЛЯДАЄ ЗА ТОБОЮ , промовляв напис під зображенням .	промовляв	6	Masc
Уявляю , якби я був шпигун , та попався з таким папірцем контррозвідці ...	попався	8	Masc
Знову навіть не розглядалось .	розглядалось	3	Neut
По дорозі з Делятина я наполовину висувався з вікна і на повній швидкості стріляв з пістолета по заданих татом цілях , переважно у дорожні знаки .	висувався	6	Masc
Громадськість так і не довідалася , про що говорили за зачиненими дверима , але вже за кілька днів виявилося , що з адміністративного тиску вийшов величезний пшик .	вийшов	24	Masc
Мотря нічого не одказала , — тільки жалібно дивилася .	одказала	3	Fem
Одно дерево упало на віз і розтрощило його на шматочки , друге вбило коня ; насилу той чоловік вискочив з лісу .	упало	2	Neut
Я подивився через вікно на вікно давнього помешкання .	подивився	1	Masc
Усе , що не відповідало радянським уявленням про корисність ( інші функції мистецтва майже не бралися до уваги , воно мало лише виховувати лояльних до влади громадян ) , цензурувалося , замовчувалося .	відповідало	4	Neut
Айбо коли чоловік гримнув по її носі , той так загудів , що почули в пеклі :	загудів	10	Masc
Її там не впізнали , і як уже вона розказала все , то мачуха аж об поли вдарилась , що , бач , вона думала її з світу зігнати , а тут зовсім не так вийшло ...	розказала	9	Fem
Роздіймав він їм руки , роздіймав , нічого не вдіє .	роздіймав	5	Masc
І просто на підвіконні біля порепаної бегонії плямистої ( Begonia maculata ) Марія Василівна помішала майже вистиглий кминовий ( Carum carvi ) чайок у гарній блакитній чашечці з позолоченою окантовкою у формі листочків .	помішала	14	Fem
Гаразд , вона втратила коханого , ось на пам’ять про нього навішує цвяшок …	втратила	3	Fem
Уже й вечеря постигла , а батько не йде в хату .	постигла	3	Fem
Цей чистий випадок психологічного переносу мене так зачарував , що думала всю прогулянку .	зачарував	7	Masc
Цикнув і завмер , виглядаючи з-за стовбура .	завмер	2	Masc
Камінь цюкнув павука по голові — й той , знепритомнівши , звалився з дерева й гепнувся на землю , задерши лапи .	цюкнув	1	Masc
Вона містилася не у броньовику , а в просторому теплому автомобільному кунзі .	містилася	1	Fem
Під час таких нічних розмов , де узгоджувалися погляди на найважливіші речі , мене найбільше нервувало те , що тато безперервно курив , а я не міг собі того ніяк дозволити у його присутності .	курив	21	Masc
Від початку вісімдесятих у Франківську діяло нетипове кафе « Золотий початок » , де кукурудзу варили цілорічно .	діяло	5	Neut
Дзядзьо любив свого фльоберта , але розумів , що настав час , коли рушниця , навіть зовсім чиста й унікального калібру , повинна бути зліквідована , щоби не бути знайденою міліцією у хаті .	настав	9	Masc
І зараз лють яку відчував кожен стала абстрактною , не адресованою емоцією яку можна було передавати та спрямовувати з одного об’єкта на інший неначе вогонь у паяльній лампі .	відчував	4	Masc
Орел його поніс аж у хмару , а потім і пустив його додолу .	пустив	10	Masc
Модерністське розмежування політики і мистецтва не означало для Лесі Українки зречення громадянського служіння .	означало	6	Neut
Ідея документа під назвою « Декрет № 3 « Про запобігання соціальному утриманству » з’явилася 2014 року , а реалізовувалася 2015-го , коли він був підписаний .	реалізовувалася	19	Fem
У неї в думці пробігла смерть Остапова .	пробігла	4	Fem
— Ма , твій манник лайкнуло вісімдесят людей .	лайкнуло	5	Neut
Швидко він зживався з новим своїм місцем на старій землі — і підвертав її під себе : вона йому плодила , родила — ставало на пожиття його !	родила	21	Fem
Ударив він об поли руками :	Ударив	0	Masc
Якось у діда злетів снігоступ .	злетів	3	Masc
— Просили вовк , ведмідь , дикий кабан , і я прошу , щоб ти прийшла зі своїм паном Коцьким на обід .	прийшла	15	Fem
Потім принесла міхи й повела чоловіка до підземної комори .	повела	4	Fem
Донька Манафорта Джесіка подала на розлучення з Йохаєм у березні .	подала	3	Fem
Не бійся , не перервався б .	перервався	4	Masc
Проаілурус ймовірно був предком Псевдолурусу , який жив 10 - 20 мільйонів років назад , і напевно призвів до головної лінії котячих , включаючи вимерлих махайродових та існуючих сьогодні малих кішок та пантерових .	призвів	17	Masc
— Англійський король приняв на авдієнції новоіменованого мін . Стеффорда Кріппса і тим наче підкреслив його значення .	підкреслив	14	Masc
Шелеснула суха бирка .	Шелеснула	0	Fem
Особливо це відчувалося вночі , ліжко вібрувало , як при середньому землетрусі .	відчувалося	2	Neut
Барабан пристосував зі старої пральної машини « Ардо » .	пристосував	1	Masc
Садочок розташувався у старому палацику .	розташувався	1	Masc
Сказала і відійшла .	відійшла	2	Fem
Несподіваний різкий поштовх виривав тебе зі сну , жорстка долоня трусила тебе за плече , сліпуче світло різало твої очі , коло з жорстких облич стояло навколо ліжка .	трусила	10	Fem
Але поступово мені б хотілося викристалізувати свою особисту лінію .	хотілося	4	Neut
І мені чомусь прийшло у голову : « Йомайо .	прийшло	3	Neut
Вона повезла з собою його привітання селу , кілька доручень і листа до одного з товаришів по роботі .	повезла	1	Fem
Мотря повернулася , вийшла .	повернулася	1	Fem
У міських школах діяло правило двадцяти п’яти градусів — при такому морозі можна було залишатися вдома .	діяло	3	Neut
Книжку оплатила зразу , а від книгарні відповіді немає .	оплатила	1	Fem
Давав їй місце на постелі й уважно віддалік слухав , коли засипала вона , як дихала .	дихала	15	Fem
Вуйко Влодко відбував термін у Хабаровську , ще далі , ніж Чита і Чита - три .	відбував	2	Masc
Один мужик щось сказав , що їм не сподобалося — « ЛНРівці » виштовхали з машини , прострелили обидві ноги — « провчили » ...	сказав	3	Masc
Пустиня давно обернулася знову в розкішну країну , знову хвилювало золоте збіжжя , рясні дерева знов клонили додолу важкі віти .	хвилювало	9	Neut
Вона принесла її до школи , вчительці історії , яка була найліберальнішою і гралася у справжню дружбу учнів і вчительки .	принесла	1	Fem
Коли подзвонила , не відповіли , написала на пошту те ж саме .	написала	6	Fem
Врешті убивць вичислили на якихось підміських городах , і піхота зробила справжню облаву , загнавши їх у безвихідь .	зробила	10	Fem
Не знаю , чи цільно стріляв той прилад , але признаюся , що тоді вперше доводилось бачити таке дивовижжа та подивляти стрілецьку вигадливість .	доводилось	15	Neut
Найцікавіші і найважливіші думки із цієї дискусії зібрала " Українська правда " .	зібрала	7	Fem
Тато і мене назвав Тарасом передовсім тому , щоби не утворювалася здрібніла російська форма з жіночим закінченням .	назвав	3	Masc
Втім , Євгенові Чикаленку звірявся , що зробити це нелегко : « Трудно , Євгене Харлампійовичу , бути українським літератором .	звірявся	4	Masc
Ось такий результат всіх цих років на сцені – мені захотілося бути домашньою .	захотілося	10	Neut
( Зрозуміло , що крамольну згадку про « Ще не вмерла … » вилучили , а цензуроване речення сприймалося якимось надміру екзальтованим . )	вмерла	10	Fem
Злий дух вийшов чорним димом з лона землі і огненною хмарою полинув понад землею .	полинув	11	Masc
Я заказала книжку " Гаррі Поттер і прокляте дитя " 1 жовтня .	заказала	1	Fem
Цвіла божа мрія , розкішна й лагідна .	Цвіла	0	Fem
Квартира знаходилася на сьомому поверсі , і Вінстон , який мав тридцять дев’ять років та варикозну виразку на правій щиколотці , йшов дуже повільно , відпочиваючи по декілька разів під час сходження .	йшов	21	Masc
Така , як вишивають дівчата своїм нареченим , — і трьом мужчинам од того видива на мить заперло дух : сорочка світилася в тьмі як жива , вона хотіла бути вбраною не на смерть , а до шлюбу .	заперло	17	Neut
хотіла натиснути реплай , а видалила комент )	видалила	5	Fem
Був вісімдесят третій рік , і почалися андроповські репресії .	Був	0	Masc
Востаннє тато закурив у передостанній лікарні , просто у палаті , якось так пускаючи дим стіною , що він збирався під самою стелею , не поширюючи жодного запаху .	збирався	19	Masc
... Голубан затулив Зеленського , Дорн затулив Голубана , кулічі й паски затулили Дорна , сніг затулив кулічі й паски ...	затулив	6	Masc
Скінчилося тим , що вони побили нашого товариша .	Скінчилося	0	Neut
Крій чумарки нагадував крій жіночої кирсетки ( юпки ) з рукавами .	нагадував	2	Masc
Дорогою не втримався і вдягнув його на руку , не виймаючи з кишені .	втримався	2	Masc
Вода у кирниці не встигала профільтруватися і пахла розмоченою травою .	пахла	7	Fem
Вуйко Влодко телефонував до Франківська татові , щоби він переконав мене не відмовлятися від військової підготовки .	телефонував	2	Masc
З нічної зміни я приходив за кілька хвилин перед тим , як будилися діти .	приходив	4	Masc
Про скандал у пісочниці : як Гройсман відібрав в Омеляна паровозики , а також про Тіну Кароль та двері в Нарнію у шафі поліцейського — у новій серії « #@)₴?$0 з Майклом Щуром »	відібрав	7	Masc
Я ночував у їхньому спальному мішку , підбитому лисячим хутром .	ночував	1	Masc
Дзядзьо любив свого фльоберта , але розумів , що настав час , коли рушниця , навіть зовсім чиста й унікального калібру , повинна бути зліквідована , щоби не бути знайденою міліцією у хаті .	любив	1	Masc
Маленька рудувата жіночка , що працювала у наступній до Вінстонової кубікулі , сіла поміж ними .	працювала	5	Fem
А ще , як йому скажу , що ти його полуденок з’їв , йо - йой , неборе !..	з’їв	11	Masc
Дзядзеві бракувало повітря .	бракувало	1	Neut
Він пролітав над долинами , де хвилювало золоте збіжжя , де рясні дерева клонили додолу важкі віти .	пролітав	1	Masc
Цей голос лунав з видовженої металевої тарелі , що нагадувала поблякле дзеркало , та була вмонтована в поверхню стіни праворуч .	лунав	2	Masc
Злий дух спав у підземній країні .	спав	2	Masc
Закриймо очі на те , що поломку “ Заповіта ” списали на безглузду причину типу “ на мою машину посвітило вранішнє сонце , тому в мене пом’явся кузов і фари розбились ” .	посвітило	19	Neut
Я старанно відхиляв поли , намагаючись не зачепити нікого чимось важким , що мотулялося на рівні колін .	мотулялося	13	Neut
Особливо вбилась мені в тямку одна сценка , що застановила мене зовсім іншими очима глядіти на Український Легіон .	застановила	9	Fem
Жінка нахилила горня , аби вилити чай у вазон , але в останній момент зупинилася .	зупинилася	14	Fem
Виймаючи пачку , я мусив встигнути прорвати кишеню і вкинути кастет під підкладку плаща .	мусив	4	Masc
Через кілька місяців після дембеля Раїль розбився на мотоциклі , їдучи до дівчини , з якою про все домовився .	розбився	6	Masc
Молодший син випав з ліжечка і розбив собі чоло .	випав	2	Masc
Попросив , щоби вони самі вибрали мені якусь рибину , бо я не з-над моря .	Попросив	0	Masc
Зате під впливом спогадів , що охопили його , він докладно цікавився становищем сільбуду , тими лекціями , що програму їх ще сам склав , одвідуванням кіно , новими виставами .	склав	23	Masc
— Ну , от бачте , нічого я йому і не зробила …	зробила	11	Fem
Шоб не муляло у флуді , і шоб не викинуте було ( флуд же чиститься ) , переніс сюди .	муляло	2	Neut
Вгадайте чи спромігся Кабмін затвердити Положення про Національну раду з питань науки та технологій ?	спромігся	2	Masc
Коли хтось застрелив жінку , яка жила ще ближче від лісу , ніж ми , дзядзьо вирішив знищити свій фльоберт , який зберігався у таємній пивничці під хатою ще з тридцятих років .	зберігався	22	Masc
А здається у 97-му Кохана розбилася під час шторму , коли стояла пришвартована ...	розбилася	5	Fem
Проте недарма показали момент , де йшла мова ніби Рейгар таємно обвінчався з Ліанною , отже Джон Сноу законний і легітимний спадкоємець залізного трону .	обвінчався	11	Masc
Дзядзьо зумів витягнути тата з вуличної банди , і тато його визнав .	визнав	11	Masc
Нарешті я отримала свою довгоочікувану книгу , з таким нетерпінням летіла на пошту в дощ , як не знаю що ...	летіла	10	Fem
Убиралася в барвисті спідниці , голову накривала по-дівочому , заплела розплетену дружками косу .	заплела	9	Fem
Він вдарився , з глухим звуком , об ніс Гольдштейна та відскочив ; його голос лунав невблаганно .	відскочив	11	Masc
— Як же мені не плакати , коли змія загадала таке , що я ніколи його не зроблю , а вона сказала , щоб за одну ніч зробив .	загадала	9	Fem
За якусь хвилину привела віслюка .	привела	3	Fem
Тоді походив сам і теж зробив запис .	походив	1	Masc
Був вересень , п’ятдесятиріччя приєднання Західної України до УРСР .	Був	0	Masc
Чумарка спереду прилягала також до стану і була завжди однобортна .	прилягала	2	Fem
Як уродила їм та пшениця — давай вони зерном ділитися .	уродила	1	Fem
Довкола були яблуневі сади , і начальник медчастини прапорщик Бек вливав кожному , хто надкусив яблуко , десять літрів води з марганцівкою .	надкусив	14	Masc
