Височенна , чотириярусна тайга , буйна й непролазна , як африканський праліс , стояла навколо зачарована .	стояла	13	Fem
Маленький і легенький Пуня вибіг на лід .	вибіг	4	Masc
Її учителем української мови був Василь Щурат , біологію викладав Мельник , а географію викладала Олена Степанів .	викладав	9	Masc
Вінстон різко отямив себе та сів пряміше .	отямив	2	Masc
На кожному поверсі , навпроти ліфтової шахти , зі стіни пильно дивився плакат з величезним обличчям .	дивився	11	Masc
Тої самої ночі , коли на моїм відтинку йшла завзятуща борня , сусідний курінь 88-го полку , зложений зі самих чехів , перейшов добровільно до москалів .	перейшов	22	Masc
Тоді авторці довелося приховувати своє ім'я через скандальну на той час історію стосунків продавчині з відділу іграшок в універмазі і старшої за неї заможної жінки , яка у цей час розлучалася з чоловіком .	розлучалася	30	Fem
Несподіваний різкий поштовх виривав тебе зі сну , жорстка долоня трусила тебе за плече , сліпуче світло різало твої очі , коло з жорстких облич стояло навколо ліжка .	стояло	25	Neut
Вийшов і вп'ять прив'язав до вугла колодочку , а сам потяг додому .	потяг	10	Masc
Саме він помагав нам з Юрком так - сяк перебувати заняття у музичній школі .	помагав	2	Masc
Вони здавались особливо смашними , і то один , то другий голосно шльопався на землю , коли сусіда занадто сильно сіпав його за палець .	шльопався	12	Masc
Анжела просто хотіла , щоби АПП ( так ми називали історичку ) пояснила текст листівки .	хотіла	2	Fem
— Мамо , — питаю після того , як куці студентські новини розказано ( сесію здав , костюм ось купив ) , — а чого тітка Марфа Яркова на мене так дивиться ?	купив	19	Masc
І Міністерство Достатку що відповідало за економічні справи .	відповідало	4	Neut
Моїх дітей він здивував тим , що страшенно спритно ловив комарів і живцем їх з’їдав .	здивував	3	Masc
Мотря утерла рукавом сльози й простогнала ...	простогнала	5	Fem
Вінстон встромив кінчик пера у ручку для пера та облизав його щоб позбутися масткого бруду .	облизав	9	Masc
Погородив він загороди великі , розбив те яйце , випустив скот і забагатів .	Погородив	0	Masc
Знала , що від’їхав Корній , і не ходила більше тратити по гаях болючих ночей .	ходила	8	Fem
Вона погостювала трохи , дала батькові грошей та й поїхала в город , купила там собі будинок і зажила панію .	погостювала	1	Fem
… Вона не впала , навіть не спіткнулася , бо це ж була людина - курган : завучка пережила в школі понад сто перевірок усіх рівнів , дві держави , чотирьох директорів .	спіткнулася	7	Fem
Під час показу у США , що розпочався 18 вересня 2015 року , протягом першого тижня фільм був показаний у 545 кінотеатрах і зібрав 7_222_035 $ , що на той час дозволило йому зайняти 5 місце серед усіх прем'єр .	зібрав	23	Masc
Ванна була повна прохолодної води , і Софі , швидко роздягнувшись , лягла у неї .	лягла	12	Fem
Татарські оселі за XV ст . були також в сучасній Бесарабії на межі або навіть за межею лісостепу — від татарського „ кишла нового “ пішла назва суч . Кишинева .	пішла	25	Fem
Вуйко Осип , який був начальником медичного поїзда УГА , а тому мав шанс закінчити медичні студії лише у Празі , добре розумів становище військових еміґрантів і скуповував картини без огляду на якість .	розумів	22	Masc
Пастух покинув сопілку і вхопився за серце .	вхопився	4	Masc
Як увійшов дід , вона зараз розказала йому все , що було , дала йому грошей :	розказала	6	Fem
Він сказав це тільки на те , щоб дочка не плакала .	плакала	10	Fem
— Оце , — каже , — дідусю , за те , що ти прийняв мене , нещасну сироту .	прийняв	14	Masc
Давно хотіла придбати " Алісу " , а тепер , коли з`явилася можливість , " товар відсутній " у київському інтернет - магазині .	хотіла	1	Fem
Я ночував у лікарні коло тата .	ночував	1	Masc
Юра звучить по-нашому , тому це ім’я підійшло братові .	підійшло	7	Neut
Той вдався не дуже добре .	вдався	1	Masc
Вона вже приземлилася обома ногами на пів’ют корабля .	приземлилася	2	Fem
І завела звичку складати графік дня , спілкуватися з людьми в рамках графіку , а потім вимикати телефон і не хвилюватися , що хтось образиться .	завела	1	Fem
А очима дивився на всіх усміхнено й вивчав кожного .	дивився	2	Masc
Усіма військовими справами ЗУНР відав ДСВС , що діяв до 9 червня 1919 року та поділявся на Військову канцелярію ДСВС і 16 відділів .	поділявся	15	Masc
( І це вперше цьогоріч я виспалася , бо спала до 1 юху )	виспалася	6	Fem
Ліжко легко вібрувало від трамваїв , і час від часу блискали сині спалахи , затиснені ущелиною вулиці .	вібрувало	2	Neut
Політрук Маркідонов дозволив мені не конспектувати лекцій політзанять , бо я міг без помилки показати на політичній мапі світу столиці всіх країн — учасниць Варшавського блоку .	дозволив	2	Masc
трохи підофігів , коли побачив , що в угорськ паспорті графа " національність " виділена жирним і більша за решту тексту О_о	підофігів	1	Masc
Мотря утерла рукавом сльози й простогнала ...	утерла	1	Fem
Мабуть , найбільш іронічним і потенційно небезпечнішим прикладом зв'язку між юнгізмом та неоязичництвом виявилася та видатна роль , яку юнгівські твори зіграли у відродженні « Релігії германців » або нордичного язичництва в Європі , Англії та Північній Америці .	виявилася	13	Fem
Поїхав , - каже Юрій Васильович , - я й зо мною Платон Кречет , Галушка й дзвонар Квазимодський із собору Паризької богоматері .	Поїхав	0	Masc
А за Пунею , який прогулював математику в парку , активісти добровільної молодіжної організації « Юні дзержинці » гналися аж до озера .	прогулював	5	Masc
Часом треба було ховатися від патруля , який обходив огорожу .	обходив	8	Masc
Андрій почервонів ( Господи , який же він дурень ! ) , а водночас зрадів , це чудесно , що він має таке знамените товариство !	почервонів	1	Masc
При повному зведенні клітора стане видно його голівку , що висунулася зі складок крайньої плоті .	висунулася	10	Fem
Але татарська людність при тому залишилася ; відомі були рештки її в румунському гінтерлянді за управою своїх султанів ( soldani ) , при цьому спостерігалося засвоювання христіянських імен — аналогічне явище треба зазначити і щодо володарів колишнього подільського улуса .	залишилася	5	Fem
Вона виривалася , і на наших руках ніколи не зникали тонкі візерунки глибоких подряпин .	виривалася	1	Fem
Один близький товариш позичив у мене дуже багато грошей і втік до Америки .	втік	10	Masc
Іноді приходив Лаціс , латиш , котрий сформував у заповіднику експериментальний загін швидкого реаґування у боротьбі з браконьєрами .	приходив	1	Masc
Але бути радянським журналістом вважалося неприпустимим , і я став ботаніком .	вважалося	4	Neut
Сільський культурник , що з марксівської науки твердо засвоїв конечність економічних передумов , прокинувся в ньому цілком .	прокинувся	13	Masc
Додавалися туфельки на шнуруванні та на голову одягався очіпок або солом'яний капелюшок .	одягався	7	Masc
Хоча за звичкою не переставав носити кастет .	переставав	4	Masc
Вона була блискуча , як рання зоря , і міняла свій вид щохвилини , як вогонь .	міняла	9	Fem
Праворуч мр . Кетлінга , себто на 849-м кріслі , сидів уже бородатий добродій , що від нього на цілу англійську милю пахло чистокровним ірландцем .	сидів	10	Masc
Одного разу він забрав у мене на вулиці рештки морозива .	забрав	3	Masc
Довжина панталон вкоротилася до половини литки .	вкоротилася	2	Fem
От хазяїн його взяв та й вивіз у ліс , думає : « Нащо він мені здався , тільки дурно буду годувати , — нехай лучче в лісі ходить » .	здався	16	Masc
Сьогодні зранку - зранечку , зранечку - зісвітаночку Славік залетів у школу й на коридорі , наче велосипедист у коня ( Equus ) , врізався в завучку Надію Петрівну Проскурню .	залетів	9	Masc
В травні вісімдесят шостого ми не могли зрозуміти , чому не можна їсти зелену цибульку , на якій навіть не з’явилося жодних плям .	з’явилося	20	Neut
І пір'я не все повилазило , і взагалі тушка якась покоцана .	повилазило	4	Neut
Потім довго нюхав свої пальці , ледь стримуючись від спокуси спробувати їх полизати .	нюхав	2	Masc
Та вона може заперечувати , брехати , замовчувати , що перетворилась на звьозд штучних , яких багато , повелась на таке .	перетворилась	10	Fem
Чорт перелякався і почав просити чоловіка :	перелякався	1	Masc
Коли я стояв на варті в автопарку із законсервованими тягачами , на пост прилетів зранений бузьок .	прилетів	13	Masc
Киця ходила у пуделко з піском , постійно щось там загрібала , а дзядзьо надто сильно відчував уночі запах її непомитих лап .	загрібала	10	Fem
Йому все зробили , і він призначив зустріч для передачі конверта за годину по тому , як відлетів його літак .	відлетів	17	Masc
Це пояснювалося вологим кліматом .	пояснювалося	1	Neut
Крім світлин , я крав рогалики у хлібній крамниці .	крав	4	Masc
Це була жахливо величезна пірамідальна будівля з блискучого білого бетону , що здіймалася , тераса за терасою , на триста метрів угору .	здіймалася	12	Fem
Пішла вона , набрала борошна , замісила , затопила в печі й почала варити вечерю .	Пішла	0	Fem
Кращі , ніж на сході , фізично - географічні умови сприяли концентрації степовиків саме в районі Дністрянсько - Дунайському , як це спостерігалося за часів Ногая .	спостерігалося	22	Neut
Яґіч підсумовував уже 1884 р . : " Як не припускати для XI століття повного розвитку руських наріч , коли вже різні дрібниці їхні ясно прозирають із пам’яток .	підсумовував	1	Masc
Дзядзьо тим часом стукав якимось патиком у стелю , бо думав , що тамтешні діти їздять серед ночі на ровері , а мама питалася у брата , нащо він трясе ліжком .	стукав	3	Masc
Маленька рудувата жіночка , що працювала у наступній до Вінстонової кубікулі , сіла поміж ними .	сіла	12	Fem
Мокрий , він поліз під матір , але не міг там довго висидіти виглядав то з-під крила , то спереду , вилазив на спину або біг геть і націлявся на стіні на поважну чорну муху .	виглядав	13	Masc
На дельтаплані була відеокамера , що подавала зображення на наземний монітор , який розрізняв шістдесят відтінків кольорів .	розрізняв	13	Masc
Я дуже любив молоко .	любив	2	Masc
Він дуже струнко сидів на стільці , його могутня грудна клітина роздувалася та тремтіла так ніби у ній вирував штормовий океан .	тремтіла	13	Fem
Там хтось кохався .	кохався	2	Masc
Якраз почалася епоха невиплат заробленого .	почалася	1	Fem
На одного воно глянуло коханими очима , іншому заблищало золотом , іншому засіяло світлом слави .	засіяло	12	Neut
От і в суботу довелось викликати наряд .	довелось	4	Neut
А він говорив тим своїм усміхненим поглядом : « Не кваптесь , друзі мої !	говорив	2	Masc
Жахаючись тої страшної хуртовини , яка тоді часто й густо підіймалася , материне серце боялося , щоб Івась у іграшках , бува , не привчився до неї .	боялося	14	Neut
Поплював у руки , взяв сокиру та коли гупнув обухом по бабиному залізному носі , той переломився .	взяв	4	Masc
Жінка нахилила горня , аби вилити чай у вазон , але в останній момент зупинилася .	нахилила	1	Fem
Внизу , під кедриною , виходячи десь з бур’янів і вітролому і зникаючи знов у бур’янах та каміннім розсипу , вилась вузенька стежечка , звірина доріжка , утоптана за тисячоліття .	вилась	20	Fem
Цього ґатунку ніхто не знав , інфляція знецінила їх до вартості сірників , і я курив найкращі французькі сиґарети кілька місяців , коли був безробітним .	знецінила	7	Fem
— У чоловіка навчилася ?..	навчилася	3	Fem
Москалі значною силою відкинули мадярську частину , що кинулася у паніці до втечі .	кинулася	8	Fem
Спустилася ніч ; викликала собі на втіху зорі ; викотився з-за гаю місяць — і став оглядати околицю ...	Спустилася	0	Fem
От вона вийшла та й гукає :	вийшла	2	Fem
Раптом далеко перед ним щось блиснуло .	блиснуло	5	Neut
Дзядзьо не надто знався на суспільних і державних системах , але вірив у сталість людської природи .	знався	3	Masc
Традиційно кажу спасибі всім , хто дочитав моє полотно .	дочитав	6	Masc
Змія встає та й дивиться , що все так ізроблено , як вона йому загадала .	загадала	14	Fem
Я підрахував , що витрачаю в середньому до 10 € в день .	підрахував	1	Masc
Тета Міра купувала в « Дружбі » неймовірну кількість книжок .	купувала	2	Fem
Запріг він коня , приїхав додому та й каже :	приїхав	4	Masc
Там спустився злий дух , — і збіжжя вигоріло , мов від огню , овоч на деревах почорнів , трави пожовкли , квітки посохли , стала пустиня .	почорнів	17	Masc
Для початку , він зовсім не розумів з якою саме метою написав саме 1984 .	розумів	6	Masc
Щось у його обличчі казало про це неспростовно .	казало	4	Neut
Нове покоління хотіло непорівнянно ширших горизонтів , повноправного представлення своєї творчості перед « світовим ареопагом » .	хотіло	2	Neut
Я та й то плюнув на них у своїй « Камені » в примітках до латинських перекладів .	плюнув	4	Masc
Олександра після цього довго соромилась глянути учителеві в вічі .	соромилась	4	Fem
Здійнявся з лона землі сивим туманом і холодною хмарою полинув над землею .	полинув	9	Masc
... Голубан затулив Зеленського , Дорн затулив Голубана , кулічі й паски затулили Дорна , сніг затулив кулічі й паски ...	затулив	2	Masc
Коли подзвонила , не відповіли , написала на пошту те ж саме .	подзвонила	1	Fem
Дівчинка навчилась вирізати ножицями гнійні рани , заки три дні чекала на Каракєджбу , якого посадили на губу за те , що зачинив кількох нестаранних солдатів у пивниці з відкритими бочками лізолу .	навчилась	1	Fem
Довкола були яблуневі сади , і начальник медчастини прапорщик Бек вливав кожному , хто надкусив яблуко , десять літрів води з марганцівкою .	вливав	10	Masc
Нарешті офіцер оголосив тост за успіх угорської кампанії .	оголосив	2	Masc
Хотів відігнати , а вона тої ж хвилини щезла .	щезла	8	Fem
Коли його й не преміювала французька академія , то знайшла щось похвалити закостеніла тепер Гонкурівська .	преміювала	4	Fem
Надавав рибиною по мордасах .	Надавав	0	Masc
Тому людина і перейнялася .	перейнялася	3	Fem
Хірург погодився працювати в парі , і ми разом , тримаючи сина і голку , вдало наклали кілька швів .	погодився	1	Masc
З вагона потяга Львів — Адлер я дивився на Східну Україну .	дивився	7	Masc
Отець доктор Лаба у двадцятих був духівником у гімназії сестер василіянок , де вчилася тета Міра , а в сорокових був духівником — у дивізії « Галичина » , де служив дзядзьо Михась .	служив	30	Masc
Я промивав його рану і заразився тим ґатунком гепатиту , який подібно до сніду передається лише статево або через кров .	заразився	5	Masc
Пішов до праці і зовсім забув за веприка і грис .	забув	5	Masc
Про коломийську гімназію я знав від п . Мелетія Кічури , з яким часто і приязно зустрічаюся тут , у Києві .	знав	4	Masc
Ото побув півроку та задумав жениться .	побув	1	Masc
Якщо хресним \ ою стала людина яка насправді не була охрещеною і сама являється противником християнства , то наскільки прикольним є цей випадок ?	стала	4	Fem
Пан Коцький злякався кабана , скочив на дерево та й подерся туди , де ведмідь сидів .	подерся	10	Masc
— Заждіть ! — волосся їй розкошлалось ; виглядала як безумна .	розкошлалось	6	Neut
Уже значно пізніше у тому басейні працювала тренеркою молода жінка , яка закохалася в мого знайомого .	працювала	6	Fem
