Після того як людина перехворіла на грип , у неї виробляється несприйнятність до цього різновиду вірусу грипу .	перехворіла	4	Fem
Ця заввага літературознавця погано корелює зі свідченням самої поетеси у листі до Ольги Кобилянської : « … вчилась тільки того , що мені подобалось , а читала все , що запорву , без жадної заборони .	подобалось	23	Neut
Наймолодший грав у сопілку , дивився на зорі , і очі йому були спокійні , як зорі .	дивився	5	Masc
А матуся сьогодні в білій спідничці з мереживом ходила вже коридором !	ходила	8	Fem
Дзядзьо тим часом стукав якимось патиком у стелю , бо думав , що тамтешні діти їздять серед ночі на ровері , а мама питалася у брата , нащо він трясе ліжком .	думав	10	Masc
Наша вчителька називала нас гнилою інтелігенцією , буржуазними націоналістами , і ми писали безконечні диктанти з книжок Брежнєва « Мала земля » , « Відродження » , « Цілина » і « Спогади » .	називала	2	Fem
Маленька рудувата жіночка перетворилася на яскраво рожеву , її рот відкривався та закривався неначе у риби що потрапила на суходіл .	закривався	12	Masc
Діафрагма Вінстона стислася .	стислася	2	Fem
Але заки мр . Морріс встиг повідомити свого земляка , що передучора безробітні витовкли в його ресторані всі вікна , то галаслива й нестримна людська повінь віднесла обох джентльменів на яких двадцять ярдів одного від другого .	віднесла	26	Fem
З того часу вже ніщо не могло спокусити її .	могло	6	Neut
Він зовсім забув , що тільки тиждень минув , як покинув село .	забув	2	Masc
Нова журба нізвідки узялась .	узялась	3	Fem
А я ж добре знаю , що він закінчив перший курс біофаку заочно , а з другого його вигнали за " хвости " .	закінчив	8	Masc
Суперник довго оглядав поле , уважно вивчив свої нотатки і відмовився .	відмовився	10	Masc
Тому , якщо вона там робила щось , то явно це пішло її на користь .	робила	5	Fem
( Щодо марксизму , захоплення яким нібито знівелювало « згубний » вплив Драгоманова , то коментаторам зоставалося тільки сподіватися , ніби читачі обмежаться лише їхніми примітками .	знівелювало	7	Neut
Уже значно пізніше у тому басейні працювала тренеркою молода жінка , яка закохалася в мого знайомого .	закохалася	12	Fem
Він сказав собі : погляну на діло рук моїх !	сказав	1	Masc
Майже так само пояснив правоохоронцям наявність у власній кишені пакету з канабісом і 34-річний глухівчанин , що прямував на заробітки своєю машиною .	прямував	17	Masc
Полісмени припустили , що , судячи з зовнішніх ознак , в одному з пакетів знаходилась марихуана , в іншому знаходився – амфетамін .	знаходився	19	Masc
Казала , що ночувала в Домахи , але злі язики говорили , що вона деінде проводила свої ночі .	Казала	0	Fem
Марія іноді кидала на неї погляд змії і не раз мала бажання впитися пазурами в ясні глибокі і невинні очі .	кидала	2	Fem
І дівчинка в матроському костюмчику , що , сама того не відаючи , вишила йому останню зброю , теж була тут і дивилась на нього з любов’ю .	дивилась	22	Fem
Одно дерево упало на віз і розтрощило його на шматочки , друге вбило коня ; насилу той чоловік вискочив з лісу .	вискочив	18	Masc
Злий дух вернувся у підземну країну і ждав .	ждав	7	Masc
Умочав мішок у воду і клав один на інший .	Умочав	0	Masc
" До Умані завітав представник села Дзензелівка і попросив нас приїхати до них на тиждень з виставами , – пише актор Василь Василько .	завітав	3	Masc
Минуло сто літ , — на могилах людей , що погинули від зарази , ярий моріг зеленів , а нащадки їх спокійно ходили по горах - полонинах , весело грали в сопілки , скликали незліченні отари .	Минуло	0	Neut
А вже Михайла Грушевського та Володимира Винниченка очорнено найстрашнішими епітетами , і зостається тільки дивом дивуватися , як же могла Лариса Косач знатися та ще й листуватися з такими звироднілими й аморальними людьцями .	могла	19	Fem
Усе це збереглося як у Луганському природному заповіднику , так і в дикій природі .	збереглося	2	Neut
Решту дурман - зілля після того він поклав до гаманця й забув .	забув	11	Masc
Вона впала на високу гору , і на горі спалахнуло світло , горіло і вабило серце .	вабило	14	Neut
Прийшов додому , показав бабі кісточки .	Прийшов	0	Masc
Киця ходила у пуделко з піском , постійно щось там загрібала , а дзядзьо надто сильно відчував уночі запах її непомитих лап .	ходила	1	Fem
А як з другого боку гримнув якийсь постріл , роздягнутий сердито кричав :	гримнув	5	Masc
Сказала і відійшла .	Сказала	0	Fem
Сю ніч снилася мені моя сосна .	снилася	2	Fem
Злий дух вийшов чорним димом з лона землі і огненною хмарою полинув понад землею .	вийшов	2	Masc
Тоді кам’яною дорогою текла суцільна ріка , змиваючи насипаний шутер аж до старих кам’яних плит .	текла	3	Fem
Коли назбирувалося більше талонів , я запрошував своїх приятелів у дієтичну їдальню , і ми влаштовували собі бенкет з бабки , политої киселем .	запрошував	6	Masc
Довелося йому ретируватися від пропозицій поїсти плов " на честь свята " .	Довелося	0	Neut
Проти виступив Сталін : сказав , що не хоче бачити чоловіків у спідницях і вважає шкідливими для здоров'я часті там тумани .	сказав	4	Masc
Доскуб руками .	Доскуб	0	Masc
Але вона визнавала , що — попри відсутність освіти — він є надзвичайно інтеліґентним .	визнавала	2	Fem
Його двоюрідний брат Раїль ніколи не знав жінки і не їздив на мотоциклі .	їздив	10	Masc
Молода вчителька математики , яка занадто близько підпускала деяких старшокласників , кожного уроку перевіряла письмове домашнє завдання .	підпускала	7	Fem
Я мусив переходити від одного до іншого , щоби вислуховувати історії їхнього життя і давати мудрі поради .	мусив	1	Masc
Я собі вже сьогодні зробила " подарунок " у чорну п'ятницю .	зробила	4	Fem
Відбій — роздягання , складання одежі і вискакування на другий ярус тривав стільки , скільки горів сірник .	тривав	11	Masc
Це було через атмосферу хокейних полів , крижаних ванн , громадських піших маршів і загального порожньодумства яка кружляючи навколо неї постійно приходила разом .	приходила	21	Fem
Зміїна дочка зробилась ізнов людиною , а той дід зробився парубком , та давай утікати .	зробився	9	Masc
Мене там мати повивала .	повивала	3	Fem
Вся камера пирснула , скинулась від несподіванки й обернулася до того , що ставив запитання .	скинулась	4	Fem
Потім сів на лавицю і гріється .	сів	1	Masc
Але склалося так , що пізніше нас несподівано зводило ще і ще у зовсім інших сферах — виробництві і продажу шипучих вин , представництві найпопулярнішого тижневика , створенні модного журналу , ловленні форелі .	зводило	8	Neut
ледь не забула вкотре сказати , що джуд лоу звісно ж неймовірний актор .	забула	2	Fem
Більшість прочитаних книжок вона відразу ж здавала у комісійний відділ іншої книгарні .	здавала	6	Fem
А от у кіновсесвіті Чужих людство , схоже , деградувало , до небаченої позначки , раз на максимально відповідальні посади набрали клінічних ідіотів , істеричок і некомпетентних суїцидників .	деградувало	9	Neut
Це була програма Метрополітен - опери на сьогоднішній вечір , в якій стояло , що нині відбуватимуться незвичайно цікаві продукції великого українського хору під проводом містера Кошиця .	стояло	12	Neut
Тепер тільки Оришка розібрала своє лихо .	розібрала	3	Fem
Натерпілася страху Мотря од тих хитрих спросів та переспросів ; набралася горя Оришка , глядя на свою дитину .	Натерпілася	0	Fem
Ви уступалися йому з дороги або , кинувши всі скарби , стрімголов бігли в сіни і причиняли за собою двері , коли він надходив занадто близько .	надходив	23	Masc
Фацик був одним із тих трьох людей у моєму житті , яких я вважав досконалішими у всьому без винятку .	вважав	13	Masc
У вестибюлі тхнуло вареною капустою та старими драними килимками .	тхнуло	2	Neut
Він крикнув уголос : « Дивіться , дивіться ! » — і всі дивились туди , куди показувала його рука , — там упала зоря .	крикнув	1	Masc
— Лягай же тепер спати , а завтра рано щоб устав та понесеш змії паляницю .	устав	10	Masc
Він заглянув на піч — там висить торбинка .	заглянув	1	Masc
Більшість цих сімнадцятирічних хлопчиків і дівчаток перейшла через справжні бої з озброєними і бєзпрєдєльними заготівельниками ікри , червоної риби , ведмежого жиру , тисячолітньої модрини , гагачого пуху , тигрячих шкір , женьшеневого кореня .	перейшла	6	Fem
У кабінеті цього вчителя на кожній парті лежала підбірка основних словників , він вимагав , щоби кожен навчився писати друкованими літерами і мав записник з виписаними латинськими висловами .	навчився	17	Masc
Спочатку вироблялися стінки її від вінця аж до ноги , а тоді виготовлялося додатково ніжку , вмащуючи глину з двох боків так , щоб постало дно та частинне або повне виповнення ніжки .	виготовлялося	12	Neut
Настав день , а вона не верталась , і ніхто не знайшов її .	верталась	6	Fem
Була якось в садибі - музеї Карла Мая в Радебойлі , нарешті дізналась про нього більше .	дізналась	12	Fem
Часом казали , що урвалася хмара .	урвалася	4	Fem
Він , світ , справді опинився поза звичною дихотомією « правда – брехня » , а тому давній солженіцинський заклик « Жить не по лжи » сьогодні втрачає свій сенс .	опинився	5	Masc
В один момент я відрізала все .	відрізала	4	Fem
Поки я доходив з лопатою до кінця стежки , початок знову виглядав недоторканим .	виглядав	11	Masc
Тоді ж перестав розуміти математику і решту школи провів у цілковитих математичних сутінках .	перестав	2	Masc
На одного воно глянуло коханими очима , іншому заблищало золотом , іншому засіяло світлом слави .	заблищало	8	Neut
Там відбувалася таємна конференція всесоюзної нелеґальної студентської природоохоронної екстремістської організації , і я був делеґатом від Львова і Західної України .	відбувалася	1	Fem
А тому навіть не намагалася вийти з кімнати .	намагалася	4	Fem
А безпекові і гуманітарні питання мають бути першочерговими » , — підкреслила вона .	підкреслила	11	Fem
Вона не могла навіть цілувати його перстень .	могла	2	Fem
Але вона послухала Тіріона і допомогла Джону .	послухала	2	Fem
Потім у барах ніколи не користувався калькулятором і жодного разу не помилився у рахунках .	помилився	11	Masc
Із Батумі приїхала десятикласниця , котра вже понад рік терпіла без Каракєджби .	приїхала	2	Fem
У Підлютому , де учениці гімназії проводили частину літніх вакацій поруч з патроном гімназії митрополитом Шептицьким , тета Міра ніколи не брала участі у ранкових дівчачих боях за право застеляти ліжко митрополита .	брала	21	Fem
— Що вона загадала ?	загадала	3	Fem
Після того бідний розжився трохи , як у нього не стало злиднів , а багатий ще бідніший став , як той був .	розжився	3	Masc
( Пасковою керамікою О . Кандиба називав неолітичну « Вапсікегатік » ) .	називав	6	Masc
В неокласичний французький рух не можна не зарахувати ще й Мусса , вояку й патріота , який , побиваючи « бошів » , дістав медаль , а виспівуванням війни дістав поетичну премію Сюллі Прюдома .	дістав	23	Masc
Байдужим поглядом вона пробігала по юнаках і одверталася .	пробігала	3	Fem
Марфа ворушить губами і проводжає мене далі , аж доки я не увійду в сосну “ велику ” ( у нас її називають ще : “ та , що твій тато садив ” ) .	садив	31	Masc
Тому відомий рецепт сінгапурського прем’єра звучав так : « Посадіть трьох своїх найкращих друзів .	звучав	5	Masc
Пуні попався справжній професіонал — після першого ж ходу суперник вийняв блокнот і записав Пунин хід пішаком .	записав	13	Masc
Одходячи на спокій , сонце обдало землю блискучим промінням ; земля на прощання усміхнулася — і потемніла .	усміхнулася	13	Fem
Прийшов кінець і соняшному квітневому дню , і все товариство опинилося під піччю .	опинилося	10	Neut
Збереглося кілька її дуже добрих робіт , але вона чомусь скоро закинула живопис .	закинула	11	Fem
Я налічила 6 великих яхт і 18 менших , а три великі пароходи стоять увесь час напроти нас нерухомо і щовечора наводять світло електричне на Сан-Ремо .	налічила	1	Fem
Киця ходила у пуделко з піском , постійно щось там загрібала , а дзядзьо надто сильно відчував уночі запах її непомитих лап .	відчував	16	Masc
Але в той день нескінченно йшов дощ і все було мокре і не припиняло мокріти знову .	припиняло	13	Neut
Потім , стрепенувшись , підкидає їх угору , перебиваючи їхню дерев’яну говірку так , щоб у прорив шелепаво дзвякали мідні тарілки , дзенькав трикутник і наддавала в ритм свою мелодію струнна армія рояля .	наддавала	25	Fem
Щоби не згубити свою родину , я мусив негайно повертатися додому .	мусив	7	Masc
Покійний акад . Ф . І . Успенський в свій час вповні виявив значіння татар в балканських подіях XIII — XIV ст .	виявив	12	Masc
Тут слово « тітка » позначало японців , « Оля » позначало — провідника націоналістичної групи .	позначало	5	Neut
Полеміка із Соболевським утратила гостроту після української національної революції 1917 - 1920 рр . , тож поле стало вільним для конструктивного й об’єктивного дослідження .	утратила	3	Fem
Артистка , яка читала тексти , теж не бачила , тому на цьому місці запнулась .	читала	3	Fem
Він зробив собі лижі і вивчав ліси .	вивчав	5	Masc
Роздіймав він їм руки , роздіймав , нічого не вдіє .	Роздіймав	0	Masc
Приїхавши після Чити до Делятина , тато кілька місяців удавав у школі , що не розуміє української .	удавав	9	Masc
Вона глянула ще раз на Мотрю , поступилася назад , простогнала , сіла мовчки на піл , узявшись холодними руками за крайню дошку , щоб не впасти .	поступилася	7	Fem
Ти людина культурна , і невже ти ніколи не чув про поета , якого , крім руської , перекладають на польську , французьку , чеську , єврейську і німецьку мови .	чув	9	Masc
Став широко відомим після перемоги у фіналі Олімпіади 2000 над найкращим борцем греко - римського стилю XX століття Олександром Кареліним .	Став	0	Masc
Гонки сі робляться зовсім не так , як я собі думала .	думала	10	Fem
На спеціальному згортку паперу Юрко виписував з усіх доступних джерел імена письменників і назви їхніх творів .	виписував	5	Masc
- Зайшов , - каже , - якось до мене земляк .	Зайшов	1	Masc
Той теж , як прийшов , то такого Лазаря скорчив ...	скорчив	9	Masc
8 лютого 1965-го парламент Великої Британії заборонив рекламу сигарет на телебаченні .	заборонив	6	Masc
На крильцях залишилося декілька пір'їн .	залишилося	2	Neut
Дитинка на екрані заскочила на місце .	заскочила	3	Fem
У цю другу хвилину Ненависть розрослася до справжнього божевілля .	розрослася	5	Fem
Про це повідомив у « Фейсбуці » друг Валентина Щербачова , журналіст Віталій Довгич .	повідомив	2	Masc
І не тільки бачу , але й чую , бо запах розповсюдився по всьому поверху .	розповсюдився	11	Masc
Ім'я Волтера Вайта нагадує поета Волта Вітмена , що відіграло важливу роль у сюжеті , аж до середини фінального п'ятого сезону .	відіграло	9	Neut
( І це вперше цьогоріч я виспалася , бо спала до 1 юху )	спала	9	Fem
Покинув його й сам поїхав .	Покинув	0	Masc
Машиніст загальмував , вискочив зі своєї кабіни і скотився в яр .	скотився	8	Masc
Так сприймала свій національний гімн ґенерація , яка й спромоглася відродити державу , це якраз із цього кола вийшло чимало провідних діячів Української Народної Республіки .	спромоглася	9	Fem
