Flintstoneovi jsou nejen chytlavou zábavou pro celou rodinu , ale také další ukázkou důvtipného míchání žánrů , řemeslné virtuozity a především osvobozující sebeironie .	virtuozity	18	Fem
Pro vyhlazení štukových omítek potřebujeme ještě hladítko s plstí , které si uděláme sami tak , že plsť o * asi # * přilepíme na spodní stranu dřevěného hladítka buď pomocí sádrové kaše , anebo rozehřátého asfaltu .	hladítko	6	Neut
Opoziční oddíly kontrolují celý střed města kolem komplexu vládních budov , kde se v podzemním bunkru včera nadále skrýval Gamsachurdia .	bunkru	15	Masc
Z Ivana Kheila se mezitím stal zubař a Jiří Hrubý prodával kožichy v pražské Labuti .	Labuti	14	Fem
Smrti se takové řešení moc nepodobá .	Smrti	0	Fem
Mohla být pojmenována podle zvuku , který vydávala při zavírání nebo otvírání dveří ( srov . středoněmecké sloveso klinken ) .	zavírání	9	Neut
Některé skupiny " tvářových " neuronů odpovídají proměnami činnosti na přímý pohled na tvář , další na její profil , jiné na zátylek nebo na zdvižení či obrácení tváře bradou dolů .	obrácení	27	Neut
Kromě poslancování a povinností s tím spojených , které teprve poznám , jsem dostala krásný úkol : oddávat na Staroměstské radnici .	poslancování	1	Neut
Lesníci , kteří mají velkou příležitost pozorovat v přírodě různé jevy , si všimli , že nemocná zvěř trpící rýmou , revmatismem a podobně požírá určité rostliny .	rýmou	19	Fem
V honbě za životem , mnohdy plné chamtivosti , jsou nelítostní .	chamtivosti	7	Fem
Složený z prázdna , z atomů , ve žlutém jedeš antonu . "	antonu	10	Masc
Rada bezpečnosti uvažuje o embargu na dodávky zbraní , což okamžitě vyvolává pochybnosti o jeho efektivitě , protože právě ve Rwandě se prokázala " účinnost " smrtících nástrojů domácí provenience .	efektivitě	15	Fem
V řadě případů byla dokonce policie obviněna z přímé účasti na vyprovokování a organizování masakrů .	vyprovokování	11	Neut
Shrnutím těchto zásadních výchozích úvah o strategii dalšího postupu výstavby informační soustavy na bázi optimálního využití moderní techniky , především kybernetizace , dospíváme k hlavním zásadám , na nichž je třeba tuto výstavbu koncipovat .	bázi	13	Fem
Proto stát dotuje jeho vývoz částkou 2.1 dolaru na kilogram hotového textilu , což je asi pět běžných triček na dospělého člověka .	triček	18	Neut
Moje vlasy s červeným přelivem má na svědomí má letitá přítelkyně Renáta , která se zde nachází v pozici svědka .	přelivem	4	Masc
Tyto jednotky vznikly v průběhu druhé světové války na území Sovětského svazu a od roku # se zde aktivně podílely na bojích proti okupantům .	okupantům	23	Masc
Řízení kontrastu .	Řízení	0	Neut
V tomto smyslu tedy hovoří o hypnóze jako o ději instinktivním .	ději	9	Masc
Malé organizace mají problémy se získáním telefonních linek , a tak mají na jedné telefonní lince připojen jak fax , tak i telefon .	získáním	5	Neut
Je - li k přechodu připojeno závěrné napětí , pak se šířka ochuzené oblasti mění s velikostí napětí .	šířka	11	Fem
Tímto vzájemným působením je buď vyražen elektron z některé energetické hladiny obalu ionizace , nebo je zvýšena jeho energie a je vynesen do dráhy vzdálenější jádru excitace .	jádru	25	Neut
Členové základní organizace se zavázali k pracím spojeným s instrumentací a rozepisováním skladeb , tím dojde ke zlepšení vyučovacího procesu v kolektivních předmětech .	předmětech	22	Masc
" Přítomnost ftalátu dibutylnatého ve vodce nelze lidskými smysly určit .	vodce	5	Fem
V této oblasti se vyučovalo vždy pouze německy a v době , kdy byl prostor vyhlášen vojenským , sloužila vojenským účelům i škola .	účelům	20	Masc
Na loňském karlovarském festivalu vzbudil Branagh nadšené i odmítavé reakce rozevlátým ztvárněním Shakespearovy veselohry Mnoho povyku pro nic .	ztvárněním	11	Neut
Dr . Löw z Erlsfeldu jako hlavní znalec shledal , že kosti jsou všechny a že hmota , která vypadla z lebky , " podle své podoby , podstaty , cévnatosti , složení a červené barvy " je jazyk .	cévnatosti	30	Fem
Ve středních Čechách je doba čekání na osvojení kolem tří až čtyř let .	osvojení	7	Neut
Letadlo L - 610 M bude armáda testovat ve Výzkumném ústavu letectva v Praze - Kbelích .	Letadlo	0	Neut
Loni vzdal hned v úvodu Australanu Borwickovi , letos ho v odvetě porazil , jenže 2 . kolo opět pro zranění zad nedokončil .	odvetě	11	Fem
Varšava a několik dalších polských měst se pustilo do boje s gangstery , kteří vyžadovali od majitelů některých obchodů a restaurací výpalné .	gangstery	11	Masc
Dá se očekávat jednání mezi ministerstvy vnitra a dopravy o změně grafikonu osobní dopravy .	ministerstvy	5	Neut
PRVNÍ POLOLETÍ SOUKROMÉHO GYMNÁZIA	GYMNÁZIA	3	Neut
Ze systémového hlediska řešení integrace soustavy VTEI bude ÚTZ technickou bází pro úzkou spolupráci mezi jednotlivými odvětvovými subsystémy a regionálními subsystémy .	subsystémy	17	Masc
Tři samopaly , malorážku , dva útočné granáty a větší množství střeliva zajistili pracovníci českobudějovické expozitury Ústředí kriminální policie v bytě 30 letého podnikatele z Českobudějovicka .	malorážku	3	Fem
Na jedné straně tedy stojí nepopiratelný genotoxický a karcinogenní efekt těchto látek a kontinuální , v podstatě celoživotní expozice , na druhé straně pak jejich relativně nízká koncentrace ve stravě a reálná možnost současného ovlivnění ochrannou výživou .	ovlivnění	34	Neut
Prkno , fošnu i jiné díly musíme upevnit , aby se při řezání nechvěly .	řezání	12	Neut
Tyto znaky jsou určovány DNA v jádře buňky a jejich dědění nijak nesouvisí s děděním mtDNA .	jádře	6	Neut
Obchodování se zemědělskými plodinami by se mělo prodloužit od 18.30 do 20.05 .	Obchodování	0	Neut
Na cestě ke směnitelnosti jsme jen na dohled od cíle a na posledních metrech překáží jen sloupy starých paragrafů .	paragrafů	18	Masc
Proto všem , kteří se rozhodli nebo rozhodnou darovat krev , patří dík .	dík	12	Masc
Vystudoval knihovnictví a folkloristiku na filozofické fakultě univerzity v Brně .	folkloristiku	3	Fem
Stýkal se v přestrojení nebo bez něho s mladými venkovskými synky a dcerkami včetně čeledínů a děveček a při víně a pití s nimi do noci hýřil , aniž se viditelně opil .	pití	21	Neut
Dvacka stačí .	Dvacka	0	Fem
Kdo byl právě na WC , měl prostě smůlu a musel si na foxtrot počkat do příští neděle .	foxtrot	13	Masc
Poprvé také zazněl počet vojáků , kteří by se případné invaze měli zúčastnit - 10000 .	invaze	10	Fem
Čili nejen hmyz , ale všechny členovce vůbec ( tedy i pavouky , štíry , kraby , stonožky atd . ) a dále i červy , měkkýše , vodní houby a prvoky .	červy	24	Masc
A to se o ni jedna příbuzná , která ji zdědila , starala velmi pečlivě .	příbuzná	6	Fem
Shromáždění kolegia kardinálů , které se mělo 9 . a 10 . května zabývat přípravou Svatého roku 2000 , bylo kvůli papežově rekonvalescenci odloženo na 13 . a 14 . června .	Shromáždění	0	Neut
Jakého úsilí ostatních pracujících bylo zapotřebí k překonávání neblahého dědictví , které po sobě zanechali pravicoví oportunisté a protisocialistické síly .	dědictví	9	Neut
Pro tramvaje platí též příslušná ustanovení Pravidel technického provozu městských drah .	Pravidel	6	Neut
Oběma vynálezcům se tehdy podařilo vyrobit první model zesilovače v pevné fázi schopný činnosti .	vynálezcům	1	Masc
My se k těmto tranzistorům vrátíme opět v dalších kapitolách .	tranzistorům	4	Masc
Husova zdánlivá podoba se promítá do soch Nepomukových , ne proto , aby jeden kult byl nahrazen druhým , ale protože v očích lidu oba Janové splývají .	soch	6	Fem
Vyznačujeme si přehoustlé trsy tulipánů a narcisů hůlkami , abychom je později , po odumření nadzemní části , našli , vyryli , rozdělili a přesadili .	odumření	14	Neut
Odstraňování těchto bariér může být podle ministra Karla Dyby někdy významnější pomocí podnikání než finanční podpora státu .	Odstraňování	0	Neut
Další knihou souboru se stane jedna z nejoriginálnějších básnických sbírek letošního jubilanta - Básně ticha .	ticha	14	Neut
Je bílošedý a červenohnědý a poznáme jej podle hlubokých pórů a vrstevnatých dutin .	pórů	9	Masc
Několik mladých komunistů z našeho ročníku obdivovalo generalissima Stalina a já se bál , že jsem jim dal právě lacinou záminku , aby mohli prokázat , že jsou ještě stalinštější než Stalin .	generalissima	7	Masc
Ten erotický náboj i sama atmosféra by stačily , aby mě nadosmrti vtáhly do světa show - businessu , ale bylo v tom i něco navíc .	náboj	2	Masc
Vejdeš - li dovnitř , naplní tě úcta , skloníš hlavu před něčím , co je nad námi , něčím , co je víc než my , nebem a peklem , Bohem .	nebem	27	Neut
Žito , které jste mi vzali . "	Žito	0	Neut
Po páteční televizní předehrávce pokračovala první fotbalová liga dalšími zápasy 4 . kola .	předehrávce	3	Fem
Pro * režimů nejsou tyto meze ještě dosaženy , pro # hodnot lze již hodnoty považovat za ustálené , rozpětí mezi maximem a minimem je však značné , průměr # * .	maximem	21	Neut
Zahrádkáři si často stěžují , že žádný strašák úrodu třešní před ptactvem neuchrání .	ptactvem	11	Neut
V tyčince je difúzí kolektoru vytvořena oblast typu * , a tím i přechod , který představuje hlavní diodu .	tyčince	1	Fem
Při tomto druhu přeměny jádra je z jádra emitován kladně nabitý elektron , tedy pozitron , opět spolu s neutrinem .	neutrinem	19	Neut
Rozměry dřeva se měří skládacím dřevěným nebo kovovým metrem , svinovacím měřítkem nebo pravítkem s vyznačenými délkami .	pravítkem	13	Neut
Kde je možno hledat původ některých legislativních slepých uliček , jako tomu bylo např . s ústavním zákonem o národní bezpečnosti ?	uliček	8	Fem
Zda se budou obnovovat , jako například při etnických konfliktech , nebo zda je čas zcela odvane .	konfliktech	9	Masc
Kostra ptáků je snad nejvíc adaptovaným ústrojím .	ústrojím	6	Neut
Skutečný olej pak sami nalili do mlýnského náhonu , kde Prospecta Liberec předvedla novinku , kterou je zařízení BIMBO pro sběr ropných látek z vodní hladiny nahrazující Vapex .	Vapex	27	Masc
Pohodlí bez hranic	Pohodlí	0	Neut
Výklad generativních gramatik , který by přesáhl rámec i účel této studie , viz u * Uhlenbecka , Nové výsledky vývoje transformační generativní gramatiky , Slovo a slovesnost # * .	slovesnost	27	Fem
Naše databanka je jakousi křižovatkou informací , řekl spolumajitel firmy Michal Vacek .	spolumajitel	8	Masc
Kopal se v několika podrobných pracích zabýval vlivem viskózního tření na pracích a nutaci nebeských těles .	tření	9	Neut
Trvalo dlouho , než našel individuum ochotné za stokorunu sáhnout do kapsy někomu z podnapilých návštěvníků baru .	stokorunu	8	Fem
Devátá Aston Villa vyhrála na hřišti osmého Sheffieldu zejména díky dvěma brankám Saunderse v první půli .	brankám	11	Fem
Kapr obecný 1978 29.20 108 Rozkoš	Rozkoš	5	Fem
Zkušenější tým by určitě v Děčíně zvládl koncovku lépe .	koncovku	7	Fem
Dřevo glossopteridů má podobnou stavbu jako dřevo dnešních blahočetů .	glossopteridů	1	Masc
Voda rozpouští v zemi výživné látky a činí je tak pro rostlinu poživatelnými .	rostlinu	11	Fem
Používají se jako vložky do stropů nebo jako bloky na zdění .	zdění	10	Neut
Dosud v ní vzniklo bezmála třicet samostatných dokumentů a bylo uspořádáno přes čtyřicet seminářů , týkajících se především postotalitních společenských traumat a handicapovaných menšin .	traumat	20	Neut
I v této skupině keramiky převažují hrnce , kromě nich se vyskytují mísy , misky a poklice , vzácně se nalézají džbány a pohárky .	mísy	12	Fem
PO VÝBUCHU LIDOVÝCH NEPOKOJŮ V KAMBODŽI ZAHÁJENA SCHŮZKA NEJVYŠŠÍ RADY	SCHŮZKA	7	Fem
Běžný účet platební bilance v konvertibilních měnách zaznamenal v pololetí saldo 663.5 miliónu dolarů .	saldo	10	Neut
Polezte ven , domlouval desátník oběma vojínům .	desátník	4	Masc
- Serioznost firmy .	Serioznost	1	Fem
V oněch chvílích vzpomínáme často na to , jaké byly ty Máje dřív .	Máje	11	Masc
Má na sobě oprané džíny s dírou na koleně , v pase široký koženkový pásek pobitý železnými cvočky , černou košili s rozhalenkou , u níž mu chybí knoflík , a kožený řemínek na ruce .	řemínek	32	Masc
Při překračování daného limitu provádět rozbor práce přesčas dle jednotlivých provozů s cílem nadále omezovat přesčasové hodiny v pomocných provozech , dopravách a energetice závodů .	přesčas	7	Masc
Vypiji několik kafí denně .	kafí	2	Neut
Předměty odhazoval s klidným svědomím a bez výčitek , jako se zbavujeme starých novin .	Předměty	0	Masc
Japonský soubor Nipponia z Tokia se přizpůsobil letošnímu brněnskému heslu Proměny hudby našeho věku a předvedl na rozdíl od vystoupení v Praze jen hudbu novou .	Proměny	10	Fem
Dalším požadavkem je i omezení rozsahu placení záloh živnostníky s nejmenší předchozí daňovou povinností a jisté uvolnění možnosti zahrnout skutečnou spotřebu pohonných hmot do nákladů .	živnostníky	8	Masc
Zachytil příkop vylámaný ve skalním podloží , s přímými šikmými stěnami , široký # * a hluboký # * , s úzkým plochým dnem .	podloží	5	Neut
Cílovou stanicí spotřební elektroniky mělo být Polsko .	stanicí	1	Fem
Ještě před rokem vedly ostré konflikty o vlastnictví vojenských zařízení bývalého SSSR a o přítomnost sovětských vojsk k obavám , že by se mohly rozhořet do velké války .	obavám	18	Fem
Jen do okresů Bruntál a Šumperk , kde pěstují nejvíce brambor , je vysíláno letos z krajských zdrojů více než tisíc brigádníků .	brigádníků	21	Masc
Protivníci na návrh pochopitelně nereagují .	Protivníci	0	Masc
Pro mě je jinak šťastný nápad kombinovat českou konverzaci s ruskou i jinojazyčnými překlady nadužit : znesnadňuje nejen komunikaci mezi revizorem a městečkem ( což má svůj dobrý důvod ) , ale nechtěně i mezi jevištěm a hledištěm .	hledištěm	37	Neut
Sděluji , že ke dni # listopadu ustavuje se souhlasem předsedy ČSAV akademika Kožešníka oddělení matematické lingvistiky a fonetiky , a to organizačním spojením dosavadního oddělení matematické a fonetické laboratoře ÚJČ .	akademika	12	Masc
Na podzim proběhne jejich interní oponentura a konečné zpřesnění dalších plánů s cílem zrušit množství individuálních úkolů a jako nejdůležitější úkol vytýčil ortoepii .	ortoepii	22	Fem
Z přítomných asi nikomu nevymizí z paměti matiné Národního divadla uspořádané po návratu z úspěšného zájezdu do Edinburghu .	matiné	7	Neut
Aleš Kalista , Investiční a poštovní banka , odd . 451 : Nedomníváme se , že by první den obchodování znamenal výraznou změnu v dosavadním objemu obchodů i ceně akcií z první vlny .	odd	8	Neut
Navíc by měla nová právní úprava umožnit vlastníkům prodat i jen část domu , respektive některé byty nebo nebytové prostory s příslušenstvím .	příslušenstvím	21	Neut
Proč na pozorovateli nezávislé , nechaotické bytí v některých lidech dokáže taková dění .	pozorovateli	2	Masc
(2) Položka "D.I.1._Náklady_příštích_období" obsahuje výdaje , které se týkají nákladů příštích účetních období .	Položka	1	Fem
Čím dále , tím jsou méně atraktivní , a taková předměstská putyka už v sobě toho kouzla moc nemá .	putyka	11	Fem
Vedle potní kůry , bazénu a sprch má k dispozici ještě horské slunce , využívá se ho pochopitelně v zimě , vibrační masážní stroj a vysoušeč vlasů .	vysoušeč	25	Masc
Když před časem Slavia představovala Benzinu jako generálního sponzora , uvažoval šéf klubu Vladimír Leška o tom , že by každý desátý návštěvník mohl dostat poukázku na odběr benzínu .	poukázku	25	Fem
Posledních několik obratlů zakrnělého ocasu srůstá většinou v plochou šavlovitou kost , kostrční pygostyl , významnou pro úpony svalů pohybujících rýdovacími pery .	pygostyl	13	Masc
Český spisovatel , mimo jiné editor klíčové básníkovy sbírky Prométheova játra ( 1990 , původní vydání v roce 1970 zabaveno ) , hodlá na projekt v grafickém řešení Vladimíra Nárožníka navázat .	játra	10	Neut
Původně se z Prahy do Londýna létalo pouze pětkrát týdně , od roku 1989 se počet letů zvyšoval až na nynějších 14 letů týdně .	letů	16	Masc
Tak Evreinová , Trippová , Slobin se ve svých transaktuálních výzkumech neomezují jen na samotná jazyková data , nýbrž přihlížejí rovněž k situačním a jiným kontextovým charakteristikám dětských řečových projevů , čímž se sbližují s pojetím komunikačním .	charakteristikám	26	Fem
Víme , že základním prvkem zpracování informace mozkem je nervová buňka - neuron , kterých mozek obsahuje asi 10 11 .	buňka	10	Fem
Článek Několik rad ženám pro úspěch v manželství , Naše rodina * , vyvolal u čtenářek hlasy pro i proti .	čtenářek	15	Fem
Opačný přechod , přeskok elektronu s absorpcí energie , je možný jen tehdy , získá * atom potřebnou energii pohlcením fotonu , jehož frekvence vyhovuje třetímu Bohrovu postulátu .	absorpcí	6	Fem
Čtenáři se ocitají na jedině správné straně barikády jen tehdy , zvolí - li současné dědictví původního osvícenského pokroku , a sice jeho zbytkový rozum v podobě občanského principu .	dědictví	15	Neut
Družstevníci soustředili pracovní síly a finanční prostředky k vybudování komplexu , který při ročním zástavu # prasat zaručí s minimálními náklady produkci # centů vepřového masa .	centů	23	Masc
To jest odrazem podle okolností a vědeckosti té či oné teorie , více či méně adekvátním , více či méně odpovídajícím skutečnosti .	vědeckosti	6	Fem
Miloš Zeman počítá , kolik z vyřčených domněnek a osočení odvane čas a kolik uvízne v duši veřejnosti .	osočení	9	Neut
Toho se dosáhne zejména jízdou vyšší , rychlostí # * , použitím většího výkonu trakčního vozidla , vyloučením výběhu a brzděním do zastávky přímo z rychlosti # .	vyloučením	17	Neut
Pokud autoři výchozího textu k něčemu takovému směřují , je jejich závěr zpochybněn překladatelčinou poznámkou .	poznámkou	14	Fem
Z antikvované literatury Mahler nekriticky převzal informaci o čtrnácti tapiseriích s vyobrazením legendy svatojánské , které zdobily Svatovítskou katedrálu při kanonizační slavnosti - ve skutečnosti to jsou obrazy na plátně , dodnes dochované ve sbírkách Národního muzea v Praze .	katedrálu	18	Fem
Za úkol práva nepovažuji , aby se stalo médiem k šíření různých politických proklamací či nějakých dobře míněných apelů na chování osob , jak fyzických , tak i právnických .	médiem	8	Neut
Urychlené prokrvení pomáhá rychleji odstranit únavu , urychlí hojení zhmožděnin a celkově zlepšuje pohodu , jak si každý již pravděpodobně okusil .	hojení	8	Neut
Výjezdní ofenzíva bude koncem března završena setkáním všech zastupitelů , zvolených za KDS na radnice měst .	ofenzíva	1	Fem
Sérii cyklokrosů Superprestige zahájí 30 . října Velká cena České Kooperativy na tradiční trati v Plzni na Lochotíně .	Kooperativy	10	Fem
V dubnu 1969 , v den , kdy do funkce prvního tajemníka nastoupil Husák , jsem pak byla vládním dekretem na hodinu definitivně " smazána " z obrazovky .	dekretem	19	Masc
Ruská produkce ropy a plynných kondenzátů klesla za leden až srpen letošního roku proti stejnému období vloni z 231.5 na 201 mil . tun , tedy o 13.2 procenta .	kondenzátů	5	Masc
Při mísení dvou druhů asfaltů požaduje se důkladné promíchání během ohřívání .	ohřívání	10	Neut
Proto můžeme považovat osní roviny za shodné s rovnoběžnými s nimi plochami jednoúsekovými .	plochami	11	Fem
Podle jeho slov mu vznikla škoda daleko převyšující jeden milión korun , který je jako penále ve smlouvě při jejím neplnění zakotven .	neplnění	20	Neut
Díky demokratické politické kultuře tří hlavních aktérů , kteří jsou politiky i intelektuály , tato pnutí nepřerůstala v institucionální boj , jenž by nutně demokracii ohrozil , jak vidíme v některých zemích sousedních .	pnutí	15	Neut
Létání nebývá při postupné výměně letek a rýdovacích per vážněji narušováno .	Létání	0	Neut
Podle Benedy se počítá i se zakázkami pro Armádu České republiky , prvních 30 tahačů už jí bylo dodáno .	tahačů	14	Masc
Vším tresť , krytím nekrytí .	nekrytí	4	Neut
Bez tohoto souhlasu je sjednání dohody neplatným právním úkonem a kromě toho též porušením pracovní kázně .	sjednání	4	Neut
Lovec se třásl strachem .	strachem	3	Masc
HŘBITOV PRO KATYŇ .	HŘBITOV	0	Masc
Když stupňovitě ubývá rovnoběžnostěnů na okrajích vrstev nad sebou ležících , dekrescence , vznikají plochy s určitým sklonem .	sklonem	17	Masc
Avšak navzdory složitým podmínkám byla vypěstována nikoliv špatná úroda .	úroda	8	Fem
Proti silové hře Grafové ( 2 . ) se však neprosadila , i když jí v úvodním gamu třetího setu prolomila podání .	gamu	17	Masc
A tak jsem dělal to , co ostatní : řval smíchy , hýkal radostí , kousal se do rtů , tleskal trpaslíkům , miloval Sněhurku a strašně jsem chtěl , aby ta podívaná nikdy neskončila .	rtů	18	Masc
* Vždy je nutné důkladně zvážit , zda dnešní úspora několika desítek tisíc korun se za pár dní nezmění ve statisícové ztráty .	úspora	9	Fem
Volejbalistky doma vysoké prohry neodčinily	Volejbalistky	0	Fem
Režisér Jiří Krejčík v roce 1960 natočil podle této povídky film , který svým naléhavým protiválečným patosem a uměleckou působivostí stále patří k tomu nejlepšímu , co kdy v naší kinematografii vzniklo .	patosem	16	Masc
Pokračují také v hledání a nacházení neobvyklých projevů lidské kreativity .	nacházení	5	Neut
Svépomocí obnoví odbíjenkářské dvorce na stadiónu , které v době výstavby nových šaten byly použity jako skladiště materiálu .	skladiště	16	Neut
Exaktnost jazykové analýzy nalezla své idealistické vyhrocení v glosématice , nazývané také algebrou jazyka , a v americkém deskriptivismu , který od obtížně zachytitelného významu jazykových jednotek abstrahoval téměř úplně .	deskriptivismu	18	Masc
Na jednu stříž dala # * krásné světlé vlny s vlákny dlouhými přes # centimetrů .	vlákny	10	Neut
Další věc , na kterou bychom neměli zapomínat , je to , že mezi položením otázek konkrétním respondentům a uveřejněním souhrnných výsledků zpravidla uteče něco vody .	položením	14	Neut
Ze sólistů souboru jmenujme aspoň zpěvačku Mutsumi Masudu , s hlasem dobře vyškoleným i podle evropských měřítek .	sólistů	1	Masc
V osmi letech mě otec začal zasvěcovat do rybaření a bral mě k vodě .	rybaření	8	Neut
Ukazuje se , že v době výstavby gigantických telekomunikačních koridorů polovina lidstva pravděpodobně nikdy nedržela v ruce telefonní sluchátko .	sluchátko	18	Neut
V budově je totiž pro zaměstnance zřízena tělocvična , která je vybavena žíněnkami , ribstolem , švédskými lavicemi , bradly , míči a pingpongovým stolem s vybavením .	bradly	19	Neut
Proto se v posledních srpnových dnech sešli ministři EHS v Bruselu , aby našli společné stanovisko ke krachu měnového systému .	krachu	17	Masc
Také oni si z výslechů pořizovali písemné a zvukové záznamy , což se i nyní doporučuje " etické komisi " , před níž bude při " tvrzení chartisty proti tvrzení nečlena až do konečného vyjádření zásadně věřeno chartistovi " .	výslechů	4	Masc
Pro snadnost pochopení a možnost seberealizace s nevelkým množstvím znalostí má spoustu vyznavačů .	seberealizace	5	Fem
Existují i případy , kdy je rám cennější než obraz .	rám	6	Masc
Londýňanům rve srdce , kreslí jejich krví magické obrazce na zeď a astmatickým funěním děsí diváky dalšího thrilleru v našich kinech : ZLOMKU SEKUNDY režiséra Tonyho Maylama .	kinech	20	Neut
Umísťování jakýchkoli předmětů patřících uživatelům bytů ve společných prostorech zásadně není dovoleno .	Umísťování	0	Neut
Mnoho chvály sklízí i architekt ruských hospodářských reforem Jegor Gajdar a jeho " šoková terapie " , avšak méně poklon se dostává Jelcinovu bývalému hlavnímu politickému stratégovi Gennadiji Burbulisovi , kterého popisuje jako arogantního a samolibého člověka .	poklon	19	Fem
Rakouská agentura APA , která rovněž o účasti Mečiara v hitparádě informovala , uvedla , že konkurence bude těžká : o přízeň publika soutěží totiž také švédské duo Roxette se svým hitem Fireworks i skupina Ice MC .	publika	22	Neut
Výzdoba sloupů je stále bohatší , hlavice jsou zdobeny * .	Výzdoba	0	Fem
