Zach byl otrokem vedlejší ložnice a čas od času , vždycky pozdě navečer , byl ostrými hochy donucen si to s kamarádem Perdou rozdat .	hochy	16	Masc
Ruská nákladní loď Progress M - 24 se včera spojila s orbitálním komplexem Mir .	komplexem	12	Masc
Její poslanci se před rokem 1989 scházeli čtyřikrát do roka , odhlasovali vše , co se jim řeklo , a pak se rychle vrátili do svých domovů , kde některým běžel plat koncernových ředitelů a jiným dojiček krav .	dojiček	36	Fem
V tom časopisu jsem četl o turistech , kteří vyšli na onu horu a dívali se na velkolepé panorama - a uviděli matku s dcerou .	turistech	6	Masc
Podle těchto zákonů by se noviny rychle přeměnily z deníků na dementníky !	deníků	9	Masc
Účastníci konference se shodli také na tom , že člověk postižený kultem ideologie sekty často končí zmatený a vyčerpaný a je třeba mu pomoci .	kultem	11	Masc
Aby byl obraz úplný , je třeba se zmínit ještě o určité profesionální řevnivosti , která mezi pracovníky obou směrů často panuje .	řevnivosti	13	Fem
Jiný případ : Významný biochemik z Univerzity Johnse Hopkinse napsal referát do jednoho vědeckého časopisu , kde se zmínil o skupině sloučenin , které " jsou slibnými kandidáty jako budoucí léčiva " .	biochemik	4	Masc
V těchto dnech vládne našim lesům hřib hnědý neboli suchohřib , ve značném množství se vyskytují i bedly , holubinky , opěnky , třepenitky , křemenáče a některé druhy , hlavně ty nejedlé , ryzců .	opěnky	21	Fem
Bezpečné služební stroje , pod dohledem spolehlivých řidičů dopravující cestující tam , kam potřebují , se dílem pekelného zplozence Paynea , milujícího , když to bouchne , mění v ďábelské cely smrti .	zplozence	18	Masc
Z porovnání rovnic * a * vyplývá , že rychlost * , kde * je pohyblivost elektronů zahrnující v sobě konstanty rovnic * a * .	rovnic	2	Fem
Nechali vytisknout dva druhy pohlednic s rádobyvtipnými karikaturami , s předtištěným jménem adresáta ( kterým je Václav Klaus ) a s textem , který si dále dovolím komentovat .	pohlednic	4	Fem
Je to vžitý , ale chybně zvolený název : zvýšení teploty ve skleníku není dosahováno odrazem a zachycením zářivé energie , ale zamezením proudění teplého vzduchu ohřátého půdou .	zachycením	17	Neut
Společným jmenovatelem všech dosud podrobněji zkoumaných sídel je jejich založení nebo trvání v průběhu # století , třebaže uvedené lokality byly zakládány a zanikaly nestejně .	jmenovatelem	1	Masc
Jinak samozřejmě nevíme , co všechno vzalo za své v plamenech žároviště , a nemůžeme proto jednoznačně odpovědět na otázku , zda šlo skutečně o natolik chudé obyvatelstvo , že jedinou výbavou jejich hrobů byly rozbité nádoby .	žároviště	11	Neut
V obou ohledech jde o počin heroický .	ohledech	2	Masc
OZÓN : Koncentrace ozónu v ozónové vrstvě nad naším územím je 9 % pod dlouhodobým průměrem .	OZÓN	0	Masc
Struskosádrový cement obsahuje # * granulované zásadité strusky vysokopecní a zbytek tvoří bezvodý síran vápenatý a portlandské slínky .	strusky	7	Fem
Dům s otlučenou fasádou , secesními balkóny a terasou v posledním patře s pohledem na Hradčany a petřínské stráně .	terasou	8	Fem
Zmizení tohoto 700 kg těžkého lékařského přístroje , který obsahuje deset dekagramů aktivní hmoty , hygienikům ohlásili 30 . června letošního roku .	hygienikům	15	Masc
Většina jeho temně groteskních inscenací vyvolala rozporuplné reakce publika .	publika	8	Neut
Zatímco MSG zahrála bez playbacků , hausová pěvecko - taneční produkce holohlavého vegetariána Mobyho byla na přednatočených páscích z drtivé většiny postavena .	playbacků	4	Masc
Studium je ukončeno zkouškami a obhajobou absolventské práce .	zkouškami	3	Fem
Obě branky padly z penalt , přičemž zvláště ta druhá , odpískaná proti hostům , vyvolala velké dohady .	penalt	4	Fem
13.30 AIR magazín	AIR	1	Masc
Zkontrolován by měl být i technický stav studny a jejího okolí .	studny	7	Fem
Tento osobní automobil má dvoudveřovou karosérii Kupé pro # osoby .	karosérii	5	Fem
Výroba niobu a tantalu se rozšířila zejména díky vzrůstajícímu použití v žárupevných slitinách a slinulých karbidech .	slitinách	12	Fem
Šel bych rád zase jednou kolem břehů Vltavy a rozmlouval o hereckém umění , o otázkách herecké psychologie a estetiky .	estetiky	19	Fem
" Protože mě nemá rád ! " vyhrkla a nové potoky slz vytekly zpod zavřených víček zelených očí .	víček	15	Neut
ČNZP nenabízí tzv . nadstandardy , ale nechává na svých pojištěncích , aby se sami rozhodli pro výkon nad rámec běžné péče na základě svého účtu .	pojištěncích	10	Masc
Význam průplavu spočívá především ve vodním spojení 15 evropských států a jejich říčních přístavů .	přístavů	13	Masc
Také sluchem vnímaly věty až dosud jako celek , členění na slova , slabiky a hlásky jim zpočátku působí potíže .	hlásky	15	Fem
Spin není v kvantové teorii vířením .	vířením	5	Neut
Vždycky , když jedu autobusem a nastoupí ve Svojkově kluci s báglem , je z nich cítit pískovec , tak mě začnou svrbit ruce . . . "	báglem	11	Masc
Hodnocením výsledků veřejné prověrky OBP se zabýval tajemník ÚRO soudruh Vladimír Mařík .	Hodnocením	0	Neut
POSTUP ZAHRNOVÁNÍ ÚČETNÍCH JEDNOTEK DO KONSOLIDAČNÍHO CELKU	CELKU	6	Masc
První svobodné celní pásmo vzniklo v Ostravě přesně před rokem a mělo sloužit k rozvoji města .	pásmo	3	Neut
Posléze jsem se posadila k malému dřevěnému stolečku , ze zásuvky vyndala růžový dopisní papír i s obálkou , který již byl na koncích částečně zažloutlý .	stolečku	7	Masc
Apokalypsa nebo Eden	Apokalypsa	0	Fem
Tak u kovů při teplotě # * se amplitudy tohoto kmitání mohou pohybovat mezi # až # meziatomové vzdálenosti .	kmitání	10	Neut
Úspěšný pokus v tomto typu školení jsme měli v kopané , přihlásilo se # adeptů na trenéry z našich venkovských jednot s věkovým průměrem kolem # let , dále # pro funkci rozhodčích .	jednot	20	Fem
Musil však zastavit na kraji , protože u pumpy stál objemný vůz s velkou plechovou nádrží a tlustou hadicí napájel pumpu benzínem .	pumpu	20	Fem
Zahrnuje takové pojmy , jako jsou snažení , chtění , touha , tendence , přání , očekávání , tlak , zájem , tenze , žádost , účel , cíl .	tenze	22	Fem
Řešení příslušnosti tradičního folklóru k současné tradici nespočívá v genezi a přijetí jevů , nýbrž v objektivním faktu jejich živého kolování .	folklóru	3	Masc
Ve zmatku a rozčilení , které provází každé přípravy velké přehlídky , jsme navštívili oděvní výtvarnici Milenu Brabcovou , která se nedávno vrátila ze své výstavy a přehlídky v Moskvě .	rozčilení	3	Neut
Taková je dialektika dějin při postupu uskutečňování lidských projektů , s níž je nutno počítat jak při komparativních , tak při prognostických výzkumech .	výzkumech	22	Masc
Zádrhel vznikl na městských úřadech .	Zádrhel	0	Masc
Vyjadřuje jednotu výrobních sil a výrobních vztahů , v jejichž dialektickém vzájemném ovlivňování marxismus našel objasnění objektivní nutnosti střídání jednoho výrobního způsobu jiným výrobním způsobem .	marxismus	13	Masc
Pro případ Lomova jmenování velvyslancem ČR ve Francii to včera s poukazem na volební klíč připomněl šéf klubu KDS M . Benda .	poukazem	11	Masc
Začátky mladoboleslavské automobilky byly velmi skromné .	Začátky	0	Masc
VERCAJCH - mezinárodní výstava nástrojů , nářadí , strojů , materiálů a technického vybavení řemeslnických dílen : Trenčín , 27 . - 30 . 4 . 1994 .	dílen	15	Fem
Při všem vtipkování si Milhaud schoval to nejpěknější na konec , když svoje pohrávání uzavřel výborným melodickým nápadem plným nefalšovaného milostného vzletu .	vtipkování	2	Neut
Dalších bezmála padesát let dávali protestanti katolíkům zcela zřetelně najevo , kdo je v provincii pánem .	katolíkům	6	Masc
Přes tyto srážky projel včera na území kontrolované vládním vojskem v bihačské enklávě další humanitární konvoj OSN .	vojskem	9	Neut
Konferenci , které se má zúčastnit více než 180 delegací , zatím bojkotují Saúdská Arábie , Súdán a Libanon , účast odřekly premiérky Turecka a Bangladéše .	premiérky	22	Fem
Kdybychom chtěli Prahu přeměnit ve svítící panoptikum , jak si to kdysi představoval sochař Zdeněk Pešánek , ukazoval by daný projekt správnou cestu .	panoptikum	6	Neut
Radost sparťanů začala , když si Nedvěd zlomil malíček	sparťanů	1	Masc
2 výhry po 100000 , - Kčs připadají na losy těchto sérií a čísel : B - 034 185 , D - 068 947 ;	losy	9	Masc
V návaznosti na vídeňský kulatý stůl OSN o transferu technologií , který se konal 6 . - 8 . února , hodlá APES zajistit ČR přístup k zahraničním databázím ekologicky vhodných technologií .	transferu	8	Masc
Je vydáván za typický příklad tvůrce , který zapomněl na ideály , s nimiž bral do ruky kameru , a hlavním mottem svého jednání učinil komerční úspěch .	kameru	17	Fem
Prohlásil to nejvyšší kubánský představitel Fidel Castro na posledním zasedání kubánského parlamentu v letošním roce , které jednalo o vystupňování kontroly a represí ve společnosti v zájmu potlačení kriminality a zejména opoziční politické aktivity označované jako " kontrarevoluce " .	vystupňování	19	Neut
Ve 25 . min . vypadl švýcarskému brankáři Weiblovi puk po střele Zelenky z lapačky , ale obránci zachránili a jeden z ojedinělých nájezdů se ujal : 0 : 2 .	lapačky	14	Fem
Bedlivě pozoruji celou její postavu a všimla jsem si , že na pravém kotníku má zachycený krajkový podvazek , jenž se zřejmě uvolnil na jejím hubeném stehně .	stehně	26	Neut
Právě ona umožňuje herci , aby nastavil divákovi křivé zrcadlo odrážející jeho já , někdy poctivé , dobromyslné , otevřené , ale jindy skrývající prvky nesnášenlivosti , zlomyslnosti , krutosti .	krutosti	29	Fem
Devítičlenná porota z nich v minulých dnech vybrala 76 pořadů , které se budou ve dnech 2 . až 5 . dubna ucházet o Cenu rektora Univerzity Palackého a dílčí ceny v jednotlivých oborech .	rektora	25	Masc
Hlavními metodami , které pracovníci firmy používají při vymáhání dluhů , je častý kontakt s dlužníky , telefonáty , upomínky , osobní návštěvy i třikrát za týden .	telefonáty	17	Masc
Podnik však počítá také s najímáním stavebních dělníků , mistrů a stavbyvedoucích pro jednotlivé zakázky a chce vystupovat i jako generální dodavatel , který najímá různé stavební společnosti .	najímáním	5	Neut
V posledních letech lidé znovu začínají stále více využívat vodu čerpanou ze studní .	studní	12	Fem
Proto dal Karel # postavit vodovod z nedalekého pramene Kajetánky v Břevnově .	vodovod	5	Masc
Všichni ti kluci , kteří se mě tehdy s kamennými ksichty chystali ukamenovat , a všechny ty holky , které se na to dívaly , byli odsunuti do Německa .	ksichty	10	Masc
Zvýhodněné vklady v Komerční bance údajně zneužívali spekulanti	spekulanti	7	Masc
A mezi tím vším ruchem se # září objeví kluci a děvčata , pro které by budoucnost našeho strojírenství měla být již současností .	ruchem	4	Masc
Ale ne obyčejného , nýbrž # zlatých mincí , které byly raženy ve starořeckém městě Kynice v # až # století před naším letopočtem .	letopočtem	23	Masc
Připouštím , že leckdo může nesouhlasit s argumenty , které ekologičtí aktivisté uvádějí proti výstavbě atomových elektráren , stejně jako s formami jejich protestů , nicméně temné náznaky o teroristických záměrech těchto lidí jsou absurdní .	záměrech	30	Masc
Samozřejmě , že jsme ho potrestali , školnice si zase Míninku odnesla v náručí , a že jsem udělala , co jsem mohla - po zločinu přišel trest .	školnice	7	Fem
(1) Položka "A.II.4._Oceňovací_rozdíly_z_přecenění_při_přeměnách_společností" obsahuje rozdíly mezi oceněním majetku a závazků v účetnictví zanikající účetní jednotky nebo části účetní jednotky rozdělované odštěpením a oceněním jmění při přeměně společnosti podle zákona o přeměnách k rozvahovému dni pro ocenění .	Položka	1	Fem
Velikost je dána čtvercem a jeho násobky nebo podíly .	čtvercem	3	Masc
Sekáč často nahradí v domácí dílně obráběcí stroj při zarovnávání materiálu , přeseknutí , sekání drážek , odseknutí nýtových hlav a nerovností .	drážek	15	Fem
Položila děťátko v saténové zavinovačce na svoji postel a usedavě se rozplakala .	děťátko	1	Neut
Ve světové televizní produkci převládají skládačky různorodých skečů .	skládačky	5	Fem
V hnízdech , ve kterých byly listy odstraněny , se množství parazitů zvýšilo na čtvrt miliónu .	hnízdech	1	Neut
Oba pěvci navíc uvedou melodie ze španělských operet .	pěvci	1	Masc
Všichni jsme velice dobře porozuměli výzvě soudruha Gottwalda .	výzvě	5	Fem
Pivo a lihoviny připraveny z obilovin rovněž obsahují lepek .	lihoviny	2	Fem
Čas tráví učením a prací , například opravují objekty , ve kterých jsou ubytováni .	učením	2	Neut
Je velmi odolná proti všem druhům nepřízně povětrnosti .	povětrnosti	7	Fem
Patřil jsem vždycky mezi ranní ptáčata .	ptáčata	5	Neut
* Zlehčování je i uvedení a rozšiřování pravdivých údajů o poměrech , výrobcích či výkonech jiného soutěžitele , pokud jsou způsobilé tomuto soutěžiteli přivodit újmu .	výkonech	14	Masc
Plzeňští vyrukovali s tradiční taktikou - důslednou obrannou hrou a pokusy o brejky .	taktikou	4	Fem
Videoklipy - útěk ze světa slov	Videoklipy	0	Masc
O nějaké shodě jednotného teoretického přístupu k řešení otázky osvojování jazyka se v současné době nedá vůbec mluvit .	osvojování	9	Neut
Kadmia , rtuti a stříbra se vyrobilo každého o něco méně než # * a v téže výši se pohybovala výroba vanadu , a to téměř výlučně jako ferovanadu pro výrobu speciálních ocelí .	Kadmia	0	Neut
Třiadvacetiletý muž z okresu Pardubice odcizil z kanceláře vedoucí Supraphonu na Masarykově ulici v Brně tržbu ve výši 52980 korun a peněženku s 3000 korunami .	tržbu	15	Fem
Další desítky možností čekají opět hlavně ve formě zvláštních vlaků při příležitosti významných událostí , jako oslav # máje a VŘSR , nebo vlaků družby pro příslušníky Lidových milicí , pražskou odborovou radu , zemědělce , pedagogické pracovníky .	máje	18	Masc
Zcela jiné povahy jsou však znaky individuální , u nichž je preformace pouze podmíněná a závisí na situaci v prostředí .	preformace	11	Fem
Po poledni rumunského času letadlem Tatra airu z Brna dorazí fotbalisté do Bukurešti , z níž se ihned přesunou do Craiovy .	airu	6	Masc
Předání cen za loňskou anketu se uskuteční až 19 . března v pražské Lucerně v rámci Dvorany folk a country , ale již nyní je známo pořadí ve všech šesti kategoriích .	Předání	0	Neut
Hlavními představiteli nové flóry byly kapraďosemenné rostliny rodu Dicroidium , charakteristické vidličnatě děleným listovým žebrem a vidličnatě utvářenými plodními soubory .	žebrem	14	Neut
Bylo by vhodné již dnes určit , jakým způsobem se bude provádět výběr kozlíků pro inseminaci a ze kterých stád .	kozlíků	13	Masc
Slovenská elita byla zklamána politickou volbou Slovenska .	volbou	5	Fem
Poškozené pletivo napadají často mikroorganismy způsobující hnilobu .	hnilobu	6	Fem
K postupu starosty dodává Čestmír Huňát : " V pátek se skončilo o tři hodiny později , pořadatelé se však se starostou druhý den ústně domluvili , že skončí o to dřív , aby nemuseli platit pořádkovou pokutu .	starostou	21	Masc
Jde o to , odhalit i specifické rysy tohoto vědeckého poznání , které je usměrněno na dosažení nového , na proniknutí do podstaty studovaných objektivních jevů a které je teoretickou formou osvojení si objektů subjektem v celospolečenském smyslu .	osvojení	31	Neut
únor 1973 : Světová premiéra koncertní show the Dark Side of the Moon v Londýně .	Side	9	Fem
V druhé skupině jsou polévky zahuštěné jíškou , polévky s těstovinami , kroupami , krupicí , omáčky zahuštěné moukou , výrobky z brambor s přídavkem mouky , jako jsou bramborové knedlíky , bramborák , placky .	bramborák	32	Masc
(8) Rozvaha ( bilance ) ve zjednodušeném rozsahu zahrnuje pouze položky označené velkými písmeny latinské abecedy a římskými číslicemi .	písmeny	13	Neut
Klíč u hlavního ventilu musí býti po celou dobu svařování nasazen .	ventilu	3	Masc
Přímé obchody , jejichž struktura může investorovi sloužit jako ukazatel , o jaké akcie se má zajímat , se odehrály s 11 emisemi .	investorovi	6	Masc
Od začátku letošního ledna nabízí úschovu cenností také Pragobanka .	úschovu	5	Fem
Pronajímatel platí víc , protože je to výdělečná činnost .	Pronajímatel	0	Masc
S těmito nadějemi můžeme sympatizovat , přestože nebudeme souhlasit s nepochopením kvantové mechaniky , které je inspirovalo ( kdyby pro nic jiného , tak proto , že podklad pro tento paralelismus - kodaňská interpretace - je tak mlhavý ) .	paralelismus	30	Masc
Hlavní poznatky o vzniku člověka , o oddělení jeho vývojové větve od našich opičích předků , získávala paleontologie , resp . paleoantropologie .	paleoantropologie	21	Fem
( Absolutno ?	Absolutno	1	Neut
Jak bylo zjištěno v projektu Labe , znečištění sedimentů na dně toků toxickými látkami , například rtutí , olovem , kadmiem , pesticidy nebo radionuklidy , je v některých tocích stále velmi výrazné .	kadmiem	20	Neut
Přestože výroba většiny zelinářských plodin se bude řešit pomocí komplexních mechanizačních linek , zůstane několik druhů zeleniny , u kterých mechanizace v nejbližších letech nebude dostatečně vyřešena .	plodin	4	Fem
Simplex jsou keramické stropní vložky vyráběné jako duté tvarovky a určené jako výplně pro železobetonové žebrové stropy .	výplně	12	Fem
Když nepřivezou rohlíky , zapálím si místo snídaně tu tramvajovou camelku . "	rohlíky	2	Masc
Nájemné by na novém místě mělo být podstatně nižší , a tak by mohlo zbýt víc peněz třeba na restaurování a fotodokumentaci unikátních sbírek .	restaurování	19	Neut
Co měli čeští a slovenští emigranti ve vztahu k Vietnamu dělat .	emigranti	5	Masc
Jednomu z pracujících řemeslníků se podařilo proběhnout plameny na chodbu a vyváznout s menšími popáleninami .	popáleninami	14	Fem
Taková potřeba vidět železné koště v rukou vlády není ale než jinak oděná potřeba harmonického soužití ve společnosti , před níž Vaculík tak prozíravě varoval mládež v roce 1968 .	koště	4	Neut
Na dně zbývalo několik žhavých uhlíků , položil na ně drobná dřívka , která rázem vzplála a plápolala v praskajícím hladovém ohni .	dřívka	11	Neut
Rozdíly vzniklé z neprovedeného převodu na jinou hmotně odpovědnou osobu případně středisko , které se sepíší přímo na tiskopis , převodka pro ZP a DKP , a budou sloužit i k děrování podkladů pro změnové řízení souboru dat .	ZP	22	Masc
Vedle povinných odborných a všeobecných předmětů si mohou vybrat i mezi volitelnými , například chov koní , pěstování bobulovin nebo třeba biozemědělství , jež využívá pouze ekologické postupy .	bobulovin	18	Fem
Podle nových vědeckých výzkumů nejvíce ohrožují zdraví člověka nikoli plynné průmyslové exhalace , ale stopové kovy .	exhalace	11	Fem
A tak obyvatelé sídlišť mohou tajně doufat , že za takových tři sta čtyři sta let , až budou jejich domy vyhlášeny městskou památkovou rezervací , budou i jejich hospody plné cizinců prahnoucích po romantice a dobrodružství .	sídlišť	3	Neut
V Praze například došlo za tyto dny " jen " k 126 případům krádeží vloupáním ( celková škoda - 3951000 korun ) a v policejní cele skončil jen jeden pachatel .	vloupáním	14	Neut
Kritika tvoří součást procesu formování revolučního umění , je sebezdůvodněním tohoto umění , jeho sebepoznáním .	sebezdůvodněním	9	Neut
Jedním zdrojem mohou být dětské strategie nebo dětská intuice při vysvětlování nových nebo neznámých jevů ve chvílích pocitu ohrožení nebo stresu .	intuice	8	Fem
Tato první péra , ať už narůstají na embryu nebo po vylíhnutí , se nazývají neoptile , případný druhý stupeň tohoto prachového opeření mesoptile a následná generace krycích per teleoptile .	péra	2	Neut
Amplituda registrovaného EEG je v rozmezí 3 - 100 uV , jde tedy o signál velmi slabý ;	EEG	2	Neut
Kritické líčení života ve velkoměstě je věčné téma světové literatury , leč ani bibličtí Jonášové nemívali zdání , kterým směrem se velryby ubírají a jaká nebezpečí jim na širém moři hrozívají .	velkoměstě	4	Neut
Spíše než ovocem zpestřují dětem snídaně džemy nebo medem .	medem	8	Masc
Položka "O._Ostatní_finanční_náklady" obsahuje zejména kursové ztráty , manka , schodky a škody na finančním majetku a bankovní výlohy .	manka	7	Neut
Většinu potřebného nářadí máte doma , šroubováky a kleště s rukojetí z izolační hmoty , kleště s dlouhými čelistmi na drát , sekáč na zdivo , kladiva .	kleště	8	Fem
Třicet tisíc čtverečných metrů bezprašných komunikací , dva velké a šest malých parků , sedmdesátimilimetrové kino , panoráma , jedno z nejlepších v republice , prodejny gramodesek , dětských oděvů a potravin , benzínové čerpadlo , pláž u rybníka .	panoráma	17	Neut
Řízení neziskových organizací	Řízení	0	Neut
Aby si řemeslníci nestěžovali na horší podmínky v Novém Městě , postavili kvůli nim samospádový vodovod z pramene v místech dnešní ulice Na Rybníčku podle vzoru vyšehradského vodovodu .	řemeslníci	2	Masc
Například je třeba , aby výroky , jež popisují zákony dané teorie , byly spolu spojeny vztahem deduktivního vyplývání , aby tento systém byl relativně logicky uzavřen a byl logicky nerozporný .	vyplývání	18	Neut
Jestliže člověk hodí kamenem a zasáhne , tak má před očima hmatatelný důkaz příčinnosti .	příčinnosti	13	Fem
Jejich rozmíšky při otevřeném okně nedávají spát půlce ulice , zvláště partajím v našem vchodu , kde jsme se nikdo nedostal přes dvacet tisíc na jednu knížku .	rozmíšky	1	Fem
Přesto Židé na výjimečnost svého válečného údělu upozorňují .	Židé	1	Masc
Mně osobně se líbí dlouhá červená sukně z reliéfního úpletu doplněná bílou pletenou halenkou se stojáčkem a biedermeierovskými rukávy , přes kterou se nosí přehozený červený krajkový šál .	šál	27	Masc
Tyto složky mohou ovlivňovat biotransformaci heterocyklických aminů ve smyslu převahy detoxikačních pochodů , nebo se uplatní svým antioxidačním působením .	biotransformaci	4	Fem
Řečový procesor nosí pacient na hrudi , podobně jako krabičkové sluchadlo .	procesor	1	Masc
Příznačné pro situaci je , že jsou zde tlaky na přeřazování některých produktů ze základní do snížené sazby .	přeřazování	10	Neut
Stejně dobrým obchodním artiklem jsou také vysoce ceněná pštrosí kůže a ozdobná péra , jejichž největším světovým odběratelem je Brazílie , především v době před karnevalem , řekl J . Šustek .	péra	12	Neut
Pak by bylo možné na ni navázat a přistoupit rovnou k probírání otázek interpersonálních konfliktů .	probírání	11	Neut
Z této nesourodé situace uvnitř ČSSD plynou nyní i nemalé zmatky kolem kandidáta sociální demokracie na post pražského primátora .	zmatky	10	Masc
Stejně tak se počítá s vytvořením elektronických knihoven a muzeí , vybudováním systémů dálkového vzdělávání a lékařských služeb či systémem mezipodnikové výměny informací .	knihoven	7	Fem
Došlo i na rány pěstí do hlavy a škrcení .	škrcení	8	Neut
V IPO dbají na to , aby počet prodavačů byl úměrný dosahované tržbě při zachování odpovídající úrovně obsluhy .	prodavačů	8	Masc
Víme tedy nyní , že opylování je proces analogický s pohlavním aktem živočichů .	opylování	5	Neut
Každopádně by takováto opoziční politika byla o něco konstruktivnější než zaslepené a donkichotské hájení ztracené varty společného státu .	varty	15	Fem
Přesto byla již včera dokončena příprava náhradního řešení - okamžité vypravení nové nákladní lodi , na což by bylo ovšem zapotřebí dalších nejméně 45 dnů .	vypravení	10	Neut
Uvádí to zahraniční tisk , který rovněž konstatuje , že mezipodnikové dluhy přesáhly podle vládních představitelů 100 bilionů rublů ( 30 mld . GPY ) , což již ruskou ekonomiku zcela paralyzuje .	bilionů	17	Masc
Chapadla stranické chobotnice	chobotnice	2	Fem
S přibývajícími čísly se však kolečko měnilo v mýdlo a mazání se stalo problémem .	kolečko	5	Neut
Cílem evaluace je zdokonalování studijních programů a zajištění srovnatelné kvality vysokého školství .	zdokonalování	3	Neut
