" Kradař " , který mezitím prchal klikatou Malou Štěpánskou , upadl v opovržení .	opovržení	13	Neut
(2) Položka "C.II.1._Pohledávky_z_obchodních_vztahů" obsahuje u všech účetních jednotek zejména pohledávky z obchodních vztahů a cenné papíry předané bance k eskontu .	Položka	1	Fem
Na západní straně stavby byla odkryta kamenná konstrukce ohniště s vnitřní plochou .	ohniště	8	Neut
Zkoumáme - li soudržnost , pevnost krystalu soli kamenné v různých směrech , přesvědčíme se , že krystal se snadno štípe v rovinách rovnoběžných s plochami krychle , ale nesnadno se porušuje jeho soudržnost ve všech jiných směrech .	krystal	17	Masc
Zda * před * , nebo * před * , nebo zda mezi * a * není rozdílu , je mezi nimi stav indiference .	indiference	23	Fem
Celková mutagenní aktivita , které je člověk vystaven v důsledku konzumace tepelně upravené bílkovinné stravy , odpovídá v průměru indukci 5600 revertujících , tedy mutací pozměněných indikátorových bakteriálních buněk denně .	indukci	19	Fem
Práce jsou soustředěny do dvou objektů , konventu a kvadratury klarisek .	kvadratury	9	Fem
Tvůrci se bohužel tentokrát spokojili jen s nepříliš nápaditým obměňováním stejných komických situací i dějových zápletek .	obměňováním	9	Neut
Řidič nesmí přejíždět do jízdního pruhu , do kterého byl pro něho světelným signálem vjezd zakázán .	vjezd	14	Masc
Kdybych byl zahrádkář a pěstoval si vedle rajčat a paprik i konopí a policie mi vtrhla na zahradu a konopí sklidila , žaloval bych ji pro krádež , " říká Jiří Presl .	rajčat	7	Neut
Konec šroubováku změkne a můžeme ho opravit pilníkem .	pilníkem	7	Masc
Dojezd při použití sedmdesátilitrové lahve je 250 kilometrů a například oxidy dusíku ve výfukových plynech jsou patnáctkrát nižší než u benzínových zplodin .	plynech	14	Masc
Hlavním důkazem žaloby je videozáznam , z něhož soudní znalec ovládající odečítání ze rtů rozpoznal , že Mercer v průběhu boje učinil soupeři zmíněnou nabídku .	rtů	13	Masc
Dne 23 . června , uprostřed mimořádných veder a obavy vzbuzujícího sucha , informuje James Hansen , ředitel Goddardova ústavu pro výzkum vesmíru při NASA , americký Kongres o oteplování planety .	veder	7	Neut
Pochopily , že program je pokusem oddálit katastrofální důsledky rozsáhlé inflace vzniklé zbrojením , nezaměstnaností a dalšími vlivy , neodstraní však příčiny .	zbrojením	12	Neut
Romana Kameše jsem našla v malé tiskárně v Belleville , kde kontroloval soutisk barev na plakátu Jiřího Koláře .	plakátu	15	Masc
S obdivem musel člověk sledovat úžasný temperament a čilost tehdejších českých staváků .	staváků	11	Masc
Ještě tento rok bude započato s demolicemi vykoupené části města , aby v roce # mohlo být zahájeno budování inženýrskotechnických sítí .	demolicemi	6	Fem
Čtyři její členky , soudružky Aišmanová , Cimrmanová , Sedláková a Černá , v Sovětském svazu byly .	soudružky	4	Fem
Triky podvodníků jsou stále stejné - sebrání pasu a pak vymáhání 12 - 15 miliónů lir ( zhruba 10 - 12 tisíc dolarů ) za jeho vrácení a za možnost odjezdu nebo " práce na vlastní pěst " .	Triky	0	Masc
Trubkový rychlovařič má tyto rozměry : # * # * a jeho plotýnka má průměr # * .	rychlovařič	1	Masc
Kdo se něčím vážně zabývá , je to zřejmě schopen uskutečnit , a nic ho už neočistí před podezřením , že to vlastně potají připravuje .	podezřením	18	Neut
Levnější kovadlina je z kusu kolejnice nebo železa připevněného také ke špalku .	špalku	11	Masc
Souhlas k výplatě podílů na hospodářských výsledcích je podmíněn navíc plněním materiálových nákladů ve smyslu opatření generálního ředitele .	Souhlas	0	Masc
Jeho velká část je určena maďarským gymnáziím na Slovensku , některá již naznačila , že by s radostí přivítala , kdybych u nich měl mimo rámec osnov hodinu dějepisu .	gymnáziím	6	Neut
A premonstráti nedočkavě čekali , kdy budou moci do prostor kláštera pozvat první novice .	premonstráti	1	Masc
V současnosti je známo , že obě poloviny lidského mozku sice trvale spolupracují , nicméně levá je specializována např . na řečové funkce a kalkulus , pravá na rozlišování a tvorbu emocí , zvládání prostoru a hudebních prvků .	zvládání	33	Neut
Zvolí si definitivně cestu nezávazného posměváčství , ve své podstatě reakční , anebo začne budovat na hodnotách , které uznává .	posměváčství	5	Neut
Ta bude do ME 1996 s opcí na další dva roky dodávat českým reprezentačním týmům počínaje výběrem do 18 let a konče áčkem sportovní oblečení , obutí i míče .	áčkem	22	Neut
Použitelnost kočkodanů při přípravě očkovací látky proti HIV	Použitelnost	0	Fem
Tradiční sobotní předehrou ZP bude v sobotu Zlatá stuha juniorů .	stuha	8	Fem
V rámci oprávnění sjednaného s pronajímatelem může budoucí uživatel dát do podnájmu jednotlivé provozní celky a místnosti v objektu pro kulturní a obchodní účely , pro služby veřejnosti a návštěvníkům Prahy .	návštěvníkům	29	Masc
Chtěli ode mne také žlutý trikot vítěze .	trikot	5	Masc
Vzhledem k nákladnosti jejich výstavby bude většinou výhodné vybudovat jaderný zdroj jako teplárnu , neboť výroba elektřiny může zlepšit hospodářské výsledky .	teplárnu	12	Fem
Čili nejen hmyz , ale všechny členovce vůbec ( tedy i pavouky , štíry , kraby , stonožky atd . ) a dále i červy , měkkýše , vodní houby a prvoky .	prvoky	31	Masc
A studuje dvouletou nadstavbu pro mistry odborného výcviku na Pedagogické fakultě v Ostravě .	nadstavbu	3	Fem
Známe příběhy o pánvích , které jsou zdraví škodlivé , spousta důvěřivých naletěla na biohrnce nabízené zásilkovými firmami Axiom , Jana a Markest .	biohrnce	14	Masc
Vnímala jeho pohledy , odkládala mazlivě každou část oděvu a vychutnávala jednotlivá stadia obnažení .	obnažení	13	Neut
Vyvinuli jsme nesmírně pružnou strunu .	strunu	4	Fem
Ostatně transovou logiku všichni dobře známe - z nočního i denního snění a také z prožívání mytického .	snění	11	Neut
V plavání také existují dva styly - prsa a kraul , v lyžování se běhá i bruslí . . .	lyžování	12	Neut
Rozehrál ho Kuka a Siegl zakončil svůj gólový půst - 3 : 0 .	půst	8	Masc
Saldo zahraničního obchodu se loni propadlo do pasíva	Saldo	0	Neut
Elektrickým polem mezi katodou a anodou jsou elektrony urychlovány směrem k anodě , jejíž přechod je pólován v závěrném směru , takže jím elektrony snadno procházejí k výstupní elektrodě .	katodou	3	Fem
Záhy se věnoval tanci , gymnastice a akrobacii , zdravotní potíže s kolenem mu však neumožnily v těchto oborech vyniknout .	gymnastice	5	Fem
V 19 hodin je dávají do postelí se zábradlím .	zábradlím	8	Neut
" Kromě určitého zvýšení počtu sázek a jejich lepšího rozložení v týdnu je cílem určité zviditelnění a . s . Sazka , " tvrdí předseda představenstva Miroslav Svoboda .	sázek	5	Fem
Bývá málem hrdá , že nemá ponětí o teorii velkého třesku nebo genetickém kódu .	třesku	10	Masc
Mimo plných cihel se vyrábějí příčně děrované cihly formátu # * s otvory procházejícími svisle celou výškou a cihly lehčené , příčně nebo podélně děrované .	výškou	16	Fem
Zúčastnit se po * jednání na MZVŽ a upozornit na potíže způsobu odměňování a tyto vyjasnit v rámci VÚ podle vyhlášky PM TIR .	TIR	22	Neut
Výtěžek z koncertu by měl být příspěvkem pro Fond Rafaela Kubelíka , jehož správcem je Česká filharmonie .	Výtěžek	0	Masc
Na # * vyrobené malty se přibližně spotřebuje toto množství kusového vápna a vápenné kaše .	malty	4	Fem
Cihelná dlažba z cihel malého formátu do maltového lože , spáry vyplněné maltou .	spáry	10	Fem
Koncem # století nebylo už v Praze možno vodovod rozšiřovat , protože některými ulicemi vedlo až pět vodovodních řadů a položení dalšího řadu bránil nedostatek místa v ulicích .	vodovod	8	Masc
Také zúčtování vzájemných obchodů přes clearingový účet bude ještě nějakou dobu o 5 % znevýhodňovat české výrobky ( do doby , než Slováci upraví kurz své koruny vůči ECU či bude clearing úplně zrušen ) .	clearing	31	Masc
Anebo se tato kometa zformovala z plynného oblaku někde jinde v Galaxii a byla naší sluneční soustavou zachycena později ?	oblaku	7	Masc
A tak celník chtě nechtě si dal kufr otevřít .	celník	2	Masc
Abychom papouška přiměli k vyslovení nějakého slova , musíme mu toto slovo opakovat a spojovat je s příjemnými situacemi , potravou , které tu jsou primárním posílením , primární odměna .	vyslovení	4	Neut
Obraťte se s dotazem přímo na emitenty nebo makléřské firmy , které povětšinou tyto informace soustřeďují .	emitenty	6	Masc
Přirůstání rovnoběžných vrstev lze velmi názorně pozorovat a ověřovat přesným měřením na tmavě fialovém osmistěnu chromitého kamence , který po goniometrickém proměření necháme dále růst ve slabě přesyceném roztoku stejně krystalujícího čirého kamence hlinitého .	Přirůstání	0	Neut
Na druhém místě se umístila BSP přípravy a řízení výroby , která byla proti jiným nástěnkám na výši po obsahové stránce a nejlépe konkretizovala výsledky BSP v soutěži na počest výročí VŘSR .	nástěnkám	15	Fem
Obchodování bylo podle analytiků víceméně technické bez čerstvých impulzů .	Obchodování	0	Neut
Uvádí se to v knize amerických autorů Nicholase Kristofa a Sheryl Wu Dunnové , která se včera objevila v newyorských knihkupectvích .	knihkupectvích	20	Neut
Očekáváme převis poptávky u asi 20 titulů - petrochemie , energetika a teplárenství .	teplárenství	12	Neut
Další požár byl zlikvidován na lodi na zpracování ryb Seda plující pod litevskou vlajkou .	vlajkou	13	Fem
Myslím , že nepůjde o náraz .	náraz	5	Masc
Na úseku tvoření slov se dokončuje popis odvozování sloves a deverbativních adjektiv .	sloves	8	Neut
Zahřívá - li se krystal , začnou atomy krystalové mřížky kmitat kolem své rovnovážné polohy .	krystal	4	Masc
Neoposlouchají se a jejich popularita není dílem ústupku běžnému vkusu a módní záležitostí .	ústupku	7	Masc
V další fázi , v batolectví , se vývojový akcent přesunuje z analyzátorů na rozvoj orgánů a funkcí pohybových a mluvních .	batolectví	5	Neut
Budeme - li chtít odchýlit takové těleso z kosmické dráhy nasměrované k Zemi , není to totéž , jako strkat ze strany do rozjeté lokomotivy ?	lokomotivy	24	Fem
Neznámo na mém stole 697	Neznámo	0	Neut
V konkrétních situacích dochází k rozdílnostem .	rozdílnostem	5	Fem
ITÁLIE SE SNAŽÍ ŘEŠIT POTÍŽE LIRY , V POTÍŽÍCH I FRANCIE A BRITÁNIE	LIRY	5	Fem
U nás je stoupající počet alergií spojován se znečištěním ovzduší , ale jak podotýká Hana Drahoňovská , to se pojí především s nealergickým onemocněním horních cest dýchacích .	alergií	5	Fem
Argentinský ministr zahraničí prohlásil , že britskému ministerstvu zahraničí předá nótu odmítající protest .	nótu	10	Fem
Mezi povinnostmi , které nám hostitelé připravili , byla i účast na oslavách 44 . výročí vítězství nad fašismem .	hostitelé	5	Masc
Adresářů firem , či jak se v České republice běžněji říká podnikových katalogů , je na trhu s informacemi poměrně dost .	katalogů	12	Masc
Nářadí je umístěno v prostoru pod levým zadním sedadlem .	Nářadí	0	Neut
V případě , že darovaný předmět byl v bezpodílovém spoluvlastnictví manželů , vůbec k žádnému darování mezi vámi a vaší manželkou nedošlo , a oba jste nadále bezpodílovými spoluvlastníky ve vztahu k tomuto daru .	darování	15	Neut
Pojišťovna pojistí můj obchod proti vloupání pouze za podmínky , že mám všechny venkovní prosklené plochy - vchodové dveře a výlohy - zabezpečeny proti násilnému vniknutí buď ochrannou kovovou mříží , roletou , nebo bezpečnostní fólií .	vloupání	5	Neut
Příčinami úhynu plůdku se zabývají policisté společně s vodohospodáři a orgány hygienické služby .	úhynu	1	Masc
Odpočinek na obrátce v chatě mých rodičů jsme strávili nářkem nad únavou .	chatě	4	Fem
V lednu a v únoru 1994 postupoval stejně v pivovaru Velké Popovice ( 546000 korun ) a v květnu až červenci v podniku Rašelina Soběslav , odkud si odvezl zboží za 95000 korun .	Rašelina	23	Fem
Uvedená hypotéza bývá univerzálně využívaná jako základní důkazní prostředek pro praktické aplikace ÚSES a je dovedena až do projekčních zásad " prostorových kritérií sítě ekologicky stabilizujících segmentů krajiny a jejich ( domnělého stabilizačního - pozn . autora ) fungování .	aplikace	11	Fem
I kdyby mohl , například k řízení cash - flow vlastní firmy , musí vědět , kdy a jaké částky platit apod .	flow	9	Fem
Na této farmě dojde také k určitým změnám ve složení pěstovaných plodin , vzhledem k budované velkovýkrmně býků v Poleradech bude zvětšena plocha pro pěstování krmných plodin .	plodin	11	Fem
V případě nedodržení stanovených kritérií může být značka odebrána .	značka	7	Fem
Brusinky najdeš často spolu s borůvkami .	Brusinky	0	Fem
Proti uvedenému pojetí lze namítnout , že ač hypnóza nepochybně je subjektivním zážitkem , přece jen subjektivní stránka znamená pouze jeden aspekt a nelze se na něj omezit .	hypnóza	8	Fem
Chtělo se mi brečet vzteky a bezmocí , ale jsem bojovnice .	bezmocí	6	Fem
Kultury rychleného salátu mohou být poškozovány nejen houbovými chorobami , plíseň salátová , podehnívání rostlin , botrytida , ale i neparazitickými činiteli .	podehnívání	13	Neut
Nebyl bych si to všechno připomínal , nebýt toho , že někteří muzikanti a zpěváci dnes usilují , aby parlament uzákonil povinné hraní české muziky v rozhlasových stanicích .	muziky	24	Fem
Kolébkou přístupu antropocentrického je západní část Starého světa .	Kolébkou	0	Fem
Kachna začala kejhat !	Kachna	0	Fem
Dramatem prolíná několik motivů , například motiv diplomu starého Struny a motiv moře , po kterém celý život touží .	diplomu	7	Masc
Cílem vstupní analýzy je přitom v podstatě redukovat původní text na soubor významných slov a slovních skupin z hlediska jejich překladu do SJ a vyřešit zároveň otázky morfologického rozboru , zpracování frazeologismů , mnohoznačnosti slov .	mnohoznačnosti	33	Fem
kurs managementu - I . i II . stupeň , kurs marketingu , asertivita , finanční management firmy , kurs defektoskopie , účetnictví s praxí , programování CNC , psychologie prodeje , škola obchodníků a jiné .	CNC	27	Neut
(4) Položky "B.I._Dlouhodobý_nehmotný_majetek" a "B.II._Dlouhodobý_hmotný_majetek" obsahují též dlouhodobý nehmotný a hmotný majetek a technické zhodnocení zařazené do těchto položek v ocenění před nabytím účinnosti této vyhlášky , a to až do vyřazení tohoto majetku .	Položky	1	Fem
Jejich obsah totiž zastarává skoro tak rychle jako móda v oblékání či v účesech .	účesech	13	Masc
Voják vystoupil , podal profesorovi ruku a poděkoval .	Voják	0	Masc
Značku Czech Made udělilo Sdružení pro cenu ČR za jakost kolekci pánských ponožek z mercerované bavlny akciové společnosti Trepon Třebíč .	bavlny	15	Fem
Jediným světlem tu byla žárovka visící na drátě ze stropu , ale ten cákanec krve na zdi mi padl do oka ihned .	žárovka	4	Fem
Dohody o pracích konaných mimo pracovní poměr musí být uzavřeny v písemné formě , a to ještě před zahájením činnosti , započetím práce , jinak jsou neplatné .	započetím	21	Neut
Za účasti delegací 51 členských zemí , bez dočasně vyloučené Jugoslávie , začalo včera ve vídeňském Hofburgu jednání nově vytvořeného Fóra pro spolupráci v oblasti bezpečnosti KBSE .	Fóra	20	Neut
Interpolace kubickými spliny je podrobněji popsána v * , postup při vyhlazování pomocí splinů je popsán v * .	vyhlazování	11	Neut
Dále zkontrolovat partii kloaky , není - li poraněna nebo zalepena při vodnatých průjmech , nevyskytuje - li se v hejnu kanibalismus .	hejnu	20	Neut
K sobě " domů " , nebo , už bez uvozovek - domů ?	uvozovek	10	Fem
Jeho antiklerikální kuplety šly od úst k ústům a kolem satirického časopisu Papežové , který založil se známým karikaturistou * Siném , se brzy shromáždil kroužek nadšených vyznavačů .	kroužek	25	Masc
Získané zkušenosti nás učí , abychom i nadále věnovali mimořádnou pozornost práci lektorů a propagandistů , zlepšit jejich práci , odstranit formálnost a pasivitu , která se ještě v některých kroužcích vyskytuje .	pasivitu	23	Fem
Rukopis vyjadřuje jejich povahy i dojímavé sebevědomí , s nímž stlačují písmenka mezi řádky , aby vybylo dost místa pro generace , které přijdou po nich .	písmenka	11	Neut
Zkrátka od kterékoliv přepážky na vás může vyletět chlap nebo baba , a jen proto , že nejste věci znalý , oboří se na vás jak na psa , který právě udělal hovínko .	hovínko	32	Neut
Dělnického prvku mezi vychovateli dětí je dosud málo , jen něco přes dvanáct procent .	vychovateli	3	Masc
V nominaci na Českého lva vede Svěrákův Akumulátor 1	Akumulátor	7	Masc
Přednostně byla zpracována frekvence slovesa býti , zvláště ve funkci spony , slovesa míti a sloves modálních .	sloves	15	Neut
Je bohatý na železo , a chrání tak organismus před anémií způsobenou jednostrannou výživou .	anémií	10	Fem
Rozporuplnost hodnocení Slovenského národního povstání se patrně nepodaří během doby úplně odstranit , pro dnešní slovenskou realitu jsou však povzbuzující čerstvé výsledky výzkumu .	Rozporuplnost	0	Fem
Kolik to bylo trápení , kolik námahy , než se za pomoci hrstky přátel , těch nejvěrnějších , dostal na pulty knihkupců , než se dostal do rukou čtenářů .	námahy	6	Fem
Na třetím mesosomálním článku je patrný pár stigmat ( 5 ) , zvětšení 20 x	stigmat	7	Neut
Informační letáky centra se rozdělují ve velkoobchodech sponzorujících distributorů a informují , jak potrava má být uchovávána v mrazničkách , jak se spotřebitelé mohou chránit před bakteriální kontaminací potravy převařováním , jak se potrava může sterilovat radiací apod .	radiací	36	Fem
Písničkář měl totiž na promýšlení moře času , neboť i ty nejznámější písně se dostaly na nosič až po předlouhých letech .	Písničkář	0	Masc
Svrchovanost spotřebitele si vždy nakonec vynutí i svrchovanost občanskou , jejíž je ostatně rozhodující složkou .	svrchovanost	7	Fem
V tu chvíli se nabízejí dvě zcela protichůdná řešení : tetování zdokonalit , nebo zcela odstranit .	tetování	10	Neut
Zakoupení elektrických šicích strojů pro zájmové kroužky učňů OU a US závodu OL Mostek .	OL	12	Neut
O jejich výkonech při jarní podezřelé porážce doma s Libercem jsem si s těmito hráči promluvil , dostávají znovu příležitost ukázat , co v nich je . "	výkonech	2	Masc
Kontakt : Nakladatelství Vilímek , Brtnická 25 , 586 01 Jihlava , tel . + FAX : ( 066 ) 257 42 .	Nakladatelství	2	Neut
Jinak sestava záleží na tom , kolik hokejistů nám direktoriát povolí , řekl trenér Luděk Bukač a v dobré náladě dodal : Na taktiku se zeptejte maséra Šaška , ten ví všechno líp . . .	maséra	26	Masc
Vypadá dírami přes rozervané džíny velmi rozechvěle , asi jako novinář Joachim , který tvrdil , že pro něj už slunce v Berlíně nesvítí .	dírami	1	Fem
Známý místní rodák Roman M . , autor Průvodce pardubickými restauracemi , se upil k smrti po zjištění , že se narodil v Hradci Králové .	restauracemi	10	Fem
V odborném učilišti Zbrojovka Vyškov vyučujeme děvčata pro obory mechanička a strojní obrábění .	učilišti	2	Neut
Z předpokládaného seznamu podniků , které mají být nabídnuty dikům k investování , vybíráme jednoho typického představitele .	dikům	9	Masc
Nechť se žáci dovídají v hodinách dějepisu , literatury a dalších předmětů , jak utlačovaní bojovali proti utlačovatelům .	žáci	2	Masc
Ve vybavení LX je nutné se obejít bez elektrického stahování oken a nastavování zrcátek , což však mně vadilo méně než chybějící otáčkoměr .	otáčkoměr	22	Masc
V životě pak přišly různé zlomy .	zlomy	5	Masc
Skvělý písňový večer , který milovníkům komorního pěveckého projevu připravil po recitálu Brigitte Fassbaenderové další zážitek par excellence , na němž se podílel i klavírista Irwin Gage .	milovníkům	5	Masc
Pro potřeby podnikatelů - exportérů je v komoře k dispozici celní sazebník , přehled platných právních předpisů potřebných pro zahraniční obchod , a další nutné předpisy .	sazebník	11	Masc
Uvedl , že počítal během několika měsíců s privatizací , a tedy odkoupením celého hospodářství .	odkoupením	12	Neut
Rozloučila se s nimi také početná skupina vietnamských studentů a praktikantů působících v ČSSR .	praktikantů	10	Masc
Hlavní tíha spočívá samozřejmě na hercích .	hercích	5	Masc
Na jižní straně chrámu lze předpokládat ambit .	ambit	6	Masc
Podobně zjistil otolaryngolog R . Cruz a chirurg P . Lambert z Virginijské univerzity , že vláskové buňky kuřat , jež byly zdecimovány velkými dávkami antibiotik ( gentamicinu ) , se postupně regenerují .	otolaryngolog	2	Masc
Pro přechodný nedostatek finančních prostředků na našem bankovním účtu zaviněný nedodržením platebních povinností několika našimi velkými odběrateli uhrazuje zatím Státní banka dodavatelské faktury s několikadenním zpožděním .	odběrateli	16	Masc
Zní to paradoxně , nicméně až dosud jsem nosil nálepku věčného kritika a GEN je vlastně můj první čistě pozitivní projekt .	nálepku	9	Fem
Rady , abychom každý zametal jen před vlastním prahem a doporučovat vypínání televizorů , chceme - li zabránit šíření kriminality a násilí , dosavadním nešvarům nezabrání .	prahem	8	Masc
Jde však o extenzivní metodu růstu , která již dnes naráží na meze dané fyzikálními zákony ( potíže s chlazením , s konečnou rychlostí šíření signálu v čipu apod . ) .	chlazením	19	Neut
Spojováním lehkých jader nebo štěpením těžkých jader je možno získat energii řádu # jádro .	Spojováním	0	Neut
DŮKAZ O BRUTALITĚ REŽIMU HUSAJNA	DŮKAZ	0	Masc
Do EuroDisney přijeli novomanželé z jihofrancouzského letoviska Nice .	letoviska	6	Neut
Po celých 35 let snášeli Angličané pumové atentáty IRA s obdobným stoicismem , s jakým přijímali hitlerovské nálety na Londýn ;	stoicismem	11	Masc
V prvém případě byla dětem umožněna školní docházka nebo její prodloužení , a tím zvýšení základní kvalifikace při vstupu do zaměstnání na straně jedné a upevněny svazky rodinné i rozvoj rodiny na straně druhé .	docházka	7	Fem
Několikrát mi zabouchli dveře před nosem , ale nakonec se mi strejcovský ředitel gymnázia v Bílé ulici kouknul na lejstra a řekl , ať tedy druhý den ráno přijdu .	lejstra	19	Neut
Za rozdělení Bosny světové společenství zcela určitě dostane slib ukončení etnického běsnění a tisíciletého míru na Balkáně .	běsnění	11	Neut
Sestavení několika takovýchto mnohodrátových proporcionálních komor paralelně za sebou umožnilo Charpakovi lokalizovat dráhy částic s přesností lepší než 1 milimetr .	Sestavení	0	Neut
Kretschmer : Leptosom ( vysoký a štíhlý ) , atlet ( silná kostra , vyvinuté svalstvo ) , pyknick ( rozložitý , oblé tvary ) ;	svalstvo	15	Neut
FAVORIZOVANÁ ČESKÁ HLÍDKA KANOISTŮ OSMÁ NA MISTROVSTVÍ SVĚTA	KANOISTŮ	3	Masc
Bonbón pro Ježíška	Bonbón	0	Masc
První uklidnění sopky však neznamenalo konec apokalypsy .	apokalypsy	6	Fem
Hlavní část neosobního mikrometru tvoří otáčecí planparalelní deska mezi objektivem a okulárem , která umožňuje držet po určitou dobu v koincidenci obraz hvězdy s horizontálním vláknem .	objektivem	9	Masc
Ve stanicích Muzeum a Florenc lze přestoupit na trasu C ve směru Háje i Nádraží Holešovice .	Nádraží	14	Neut
Nebylo pak divu , když někteří hráči sami doháněli manko v osobním volnu kondičním běháním .	manko	9	Neut
Klub železničních modelářů a Lokomotiva Studio uspořádali v budově ČSD na Kounicově ulici výstavu s názvem Vlaky , vláčky , kolejiště .	modelářů	2	Masc
Studium pohybu těles sluneční soustavy včetně jejího pohybu v prostoru , analýza změn v pozicích hvězd vztažených k různým epochám a katalogům nebo k systému navázanému na vzdálené galaxie .	Studium	0	Neut
Náklady na skutečnou spotřebu pohonných hmot , rozšíření silniční daně na všechna vozidla , zjednodušení administrativy sloučením sociálního a zdravotního pojištění - to jsou otázky , o nichž podnikatelé nejčastěji hovoří .	sloučením	16	Neut
Mají lepší tepelně izolační vlastnosti než zdivo z plných cihel , zdivo může být proto tenčí , zatěžuje méně podpůrnou konstrukci a také základy mohou být slaběji dimenzované .	zdivo	11	Neut
