Proto je na zámku i mladý francouzský král Filip , jehož sestra Alice je sice královou milenkou , ale také nevěstou nástupce trůnu , jemuž přináší jako věno francouzské léno Vexin .	léno	29	Neut
Nerušenému toku zboží vyrůstají z východní strany různé , zatím ještě překonatelné , bariérky a bariéry .	bariérky	13	Fem
A slibování slovinských dotací . . .	slibování	1	Neut
Takovéto ekonomické poměry vedou poprvé k existenci státu , který je orgánem třídy otrokářů , lhostejno zda jeho forma je demokratická nebo despotická .	otrokářů	13	Masc
* Záviš Kalandra kdysi z faktu , že všichni známe pohádky , ale ne každý zná jméno svého pradědečka , usuzoval , že mýtus je důležitější než historie .	pradědečka	18	Masc
Vystoupení , prokládané bezprostřední komunikací všech členů kapely s živě reagujícím publikem , se stalo jistě zážitkem nejen pro zarputilé vyznavače rapové muziky .	Vystoupení	0	Neut
Mezi typické scénáře patří zatopení úložiště , požár uložených odpadů , průnik nepovolaných osob , pití vody ze studny zbudované těsně u úložiště , pěstování plodin v jeho areálu atp .	zatopení	4	Neut
Své sbírky Památník půjčuje ke studiu vědeckým pracovníkům , připravuje výstavy a pořady pro dospělé i děti a věnuje se publikační činnosti .	Památník	2	Masc
Když panika propukla , prodejci se zbavovali nelegálních kazet , obchody zely prázdnotou .	prázdnotou	12	Fem
Poselství , které tam ufoni zanechali , naznačuje , že si nepřejí , aby tato budova kdykoli v budoucnu přešla do vlastnictví někoho jiného .	Poselství	0	Neut
Svědek rozpadu habsburské monarchie a neúspěšný správce financí v křehké a k pádu předurčené Rakouské republice , stanul na americké pevnině už jako autor proslulého díla Theorie der wirtshaftlichen Entwicklung ( Teorie hospodářského vývoje ) .	Teorie	31	Fem
Pro výrobu železobetonových konstrukcí , stropy , sloupy , překlady , je nevhodný a nesmí se používat .	stropy	5	Masc
Televize přinesla záběry ze sobotní rodinné idylky , zástupce britské organizace pro rovnost pracovních příležitostí napadl úřady z diskriminace Johana pro příslušnost k mužskému pohlaví a místní poslanec se obrátil na ministra vnitra .	idylky	6	Fem
Zabývá se i činnostmi bezprostředně souvisejícími : Tvorbou a realizací mzdových systémů a nehmotných výhod pro zaměstnance , procesem kolektivního vyjednávání , přípravy a tvorby kolektivních smluv .	Tvorbou	7	Fem
Heterocyklické aminy jsou velice účinně inaktivovány - převážně mechanicky - adsorpcí na současně konzumovanou vlákninu .	aminy	1	Masc
Technologie byla dosud primitivní , pořad nešlo zaznamenat , nic se nedalo předtočit , nebylo tu žádné pětivteřinové zpoždění .	zpoždění	18	Neut
Obě koncepce - vládní i parlamentem nakonec přijatá - mají nesporné klady i svá úskalí .	klady	11	Masc
Vhodné je psaní nanečisto a pak přepsání úkolu do sešitu v konečné podobě .	přepsání	6	Neut
KARL RAIMUND POPPER ( 1902 ) vychází ve svém rozboru historických kořenů totalitarismu z analýzy Platonova myšlení .	kořenů	11	Masc
V útulku platí 78 liber týdně za ubytování a jídlo .	útulku	1	Masc
Měla by tak být racionálně oceněna úloha rolníků jako krajinotvorců .	krajinotvorců	9	Masc
Vlastník koryta by proto musel nově uzavřít smluvní vztahy s vlastníkem vody a vlastníkem vodohospodářských děl na svém pozemku .	koryta	1	Neut
Již r . 1988 byl popsán rod baktérií poeticky pojmenovaný Epulopiscium ( rovněž nalezený ve střevě bodloga z Rudého moře ) .	střevě	15	Neut
Proto ji dobře znám , její nebezpečí i kouzlo i všechny studny .	kouzlo	8	Neut
V místnostech , kam se betonové stropy nehodí , prý budou znovu zakryty a opraveny si počkají na své znovuobjevení .	znovuobjevení	19	Neut
Myslíte si , že voliči budou schopni takovéto drobné nuance mezi vámi a ODS vůbec zaznamenat ?	nuance	9	Fem
Nové výkonné pásové sušárny a # * komorových sušáren vybavených agregáty na topný olej usnadní a urychlí sušení zeleného zlata .	sušárny	3	Fem
Ale to už se v průhledné nylonové noční košili ( na prsou hustě zdobené krajkami ) objevila ve dveřích ředitelka a zvolna kráčela k Eduardovi .	krajkami	14	Fem
Kruh přátel hudby -	Kruh	0	Masc
Zpěvačka neskrývá , že toto dílo je jí velmi blízké svou melodickou krásou , vnitřní opravdovostí i dramatismem .	opravdovostí	15	Fem
Po celé čtvrtstoletí od konce druhé světové války převládaly v představách tamních politiků i generálů úvahy o revizi výsledků této války , o zatlačování komunismu , jinými slovy , počítalo se tam spíše s válkou .	zatlačování	23	Neut
Na skvělém dojmu z nahrávky se svou měrou podílí i podrobně vypravená průvodní knížečka s životopisy umělců a tříjazyčným překladem českého libreta .	libreta	21	Neut
Přesto docházelo ke stále větší nespokojenosti mezi irskými farmáři , kteří nemohli landlordům konkurovat .	landlordům	12	Masc
K ukončení několikaleté krize rukojmí zbývá propustit dva Němce , za něž jejich únosci požadují propuštění bratří Hamádíů , kteří jsou vězněni v Německu za vraždu , vzdušné pirátství a únos .	únos	30	Masc
Ty jsou největší firemní devizou při konkurzních řízeních , kterých se firma účastní hlavně na severní Moravě .	řízeních	7	Neut
Malý dvůr je zdrojem šarvátek v hejnu , což rozhodně chovu neprospívá .	hejnu	6	Neut
Pouze dvacet tisíc svazků se sem převeze , zbylých zhruba sto osmdesát tisíc zůstane v budově bývalého federálu na Vinohradech .	federálu	17	Masc
A s navyšovaným množstvím širokého zboží a s novými stroji , Pad - rollem a pračkou Kleinewefers , se problematika ještě prohlubuje .	pračkou	15	Fem
V malém rozsahu mění zbarvení jenom chemickým rozkladem některých labilních pigmentů uvnitř per nebo olamováním okrajů praporů doprovázeným odkrytím těch částí praporu , které mají zbarvení jiné než lem péra .	per	12	Neut
Následující autorova poklona Dagmar Peckové byla krásnou tečkou za obdivuhodným výkonem zpěvačky i klavíristy .	poklona	2	Fem
Vražda nevinného zůstává vraždou bez ohledu na národnost a vyznání , lidské utrpení a bolest zůstanou utrpením a bolestí bez rozdílu .	utrpením	16	Neut
Angela Davisová srdečně poděkovala za uvítání a řekla .	uvítání	5	Neut
Tento poměr lze zřejmě výrazně snížit delegováním na podřízené pracovníky .	delegováním	6	Neut
Lékařská prohlídka ale prokázala , že kromě pohmožděnin nedošlo k vážnějším zraněním .	pohmožděnin	7	Fem
A tak mohl v roce # * Weit použít k úspěšné transfuzi krev odebranou od dárce před třemi dny .	transfuzi	11	Fem
Potápěči pomocí podvodní vrtné soupravy odvrtali profil několika kalcitovými žilami .	žilami	9	Fem
Dnes večer se už můžeme oholit , řekl kapitán beranů Josef Štraub .	beranů	9	Masc
Chodíval jsem někdy po ránu na procházku mezi zahrady , abych mohl pozorovat krásné akrobatické výkony v letu českých staváků při jejich ranním proletu doprovázeném silným tleskáním .	tleskáním	26	Neut
Dále probereme otázky určení vhodných charakteristik spektra jako celku , určení souvislostí s okolnostmi měření , určení hranice čárového spektra , určení vlivu neharmonických složek pozadí , problém měření a jeho kontroly výpočtem .	okolnostmi	13	Fem
Je to napínavý boj na polích , kde se střídají útoky s protiútoky , pak zase obrana a úhybné boje s protiútoky křídelnými .	protiútoky	12	Masc
Jako klukovi se mi neustále vracel stejný sen .	klukovi	1	Masc
Dodnes jsou po celém ostrově zbytky starých opatství a zříceniny kamenných klášterů , které se stavěly většinou v údolích na březích jezer či řek .	zříceniny	9	Fem
Pražský komorní orchestr hraje zpravidla bez dirigenta , pod taktovkou Giacoma Zaniho dosáhl nejlepší úrovně již v temperamentně zahrané ouvertuře , ale i v doprovodných úkolech .	ouvertuře	19	Fem
Kvartetisté odkazují k pocitům , které jako by byly kdesi za hudbou .	pocitům	3	Masc
Většina převážně pomalých balad obestírá romantický , tajemný , melancholický opar , umocněný nádherným vokálem jednadvacetileté zpěvačky Dolores O ' Riordanové ( Not Sorry a Lier ) .	balad	3	Fem
Zákony , které by snížily psychiatrickým léčebnám daně , nebo umožnily vznik sociálních fondů dotujících jejich činnost , zatím nejsou .	léčebnám	6	Fem
Obdivovali vznos Wilhelma Friedemanna Bacha ( Sonáta VI , Es dur ) , jenž ideově souzněl s myšlenkami hnutí Bouře a vzdor a předjímal tvůrčí postupy vrcholného klasicismu ;	Sonáta	6	Fem
Proti Benešovu nás Bernady hlavně v závěru podržel , říká k vyřešení tajenky mezi tyčemi trenér Baníku Lička .	tajenky	12	Fem
Tandem do finále	Tandem	0	Masc
Většinou bývají samci v tomto opeření podobní samicím .	opeření	5	Neut
Ostatně za II . světové války dodával tento podnik ročně až 42000 pěchotních i leteckých kulometů .	kulometů	15	Masc
Jsme tedy v kraji , kde chléb měl po dlouhá staletí , a ještě v pamětné době , příchuť tvrdých mozolů , potu a slzí .	mozolů	20	Masc
2 / utonutí zkoušeného mistra plavčíka na Podolské plovárně	plovárně	8	Fem
Telefoto ČSTK / AP	Telefoto	0	Neut
Ke stomilionové hranici se mílovými kroky přibližuje bláznivá komedie Maska ( dosud 82 milionů dolarů ) a thriller Jasné nebezpečí , který za pouhé tři týdny od uvedení utržil 73 milionů .	Maska	9	Fem
Vzhledem k trvalé oblibě autorů české dekadence vzbudí pozornost jistě i vzpomínky Jiřího Karáska ze Lvovic ( Thyrsus , grant 50 tisíc ) .	Karáska	13	Masc
PLNOHODNOTNÝM ČLENEM Socialistické internacionály se stala SDSS .	internacionály	3	Fem
Maritzova farma poskytuje útočiště chudým bělochům .	farma	1	Fem
Velmi dobrých výsledků dosáhly divize Montáže , Klimatizace a Dodavatelská divize .	Montáže	5	Fem
Turné ( celkem 45 baletních koncertů ) se uskutečnilo pod názvem International Ballet Festival a setkalo se s velkým ohlasem u publika i kritiky .	publika	21	Neut
Dalších šestnáct národních mistrů čeká zmíněné předkolo a mezi ně bude s největší pravděpodobností díky vlastnímu klubovému koeficientu patřit i Sparta , vyhraje - li ligu ( český národní koeficient je díky rozdělení státu nulový ) .	koeficientu	17	Masc
Plánování přípravy fotbalové reprezentace je rok od roku obtížnější .	Plánování	0	Neut
Je paradoxní , že všechny velké ztráty mého dětství mají nádech jakési otupělosti , postupné rezignace , zatímco když mě odtrhli od jezevčíka , cítil jsem čiročirou bolest .	otupělosti	12	Fem
Krádežím barevných kovů především na železnici by mělo zabránit včerejší rozhodnutí poslanců ČNR .	Krádežím	0	Fem
Místnosti jsou malé , mají původní románskou dispozici .	Místnosti	0	Fem
Jistě , jsou tam předsudky a přežitky čechoslovakismu , který již dohrál svou dějinnou roli .	přežitky	6	Masc
V depu zastavila čtveřice Faresin , Della Santa , Podenzana a jeden z velkých favoritů Pantani , druhý z Giro d ' Italia a třetí z Tour de France .	čtveřice	3	Fem
Dílo neztratilo svou hodnotu - a v tomto smyslu je komplet i doporučován , zklamáním jsou však s odstupem let pěvecké výkony .	zklamáním	14	Neut
Zřejmě však tato vzdálenost je nepřekonatelnou překážkou .	překážkou	6	Fem
Další dva příklady účelně redukují čtyřpól vložený mezi dva transformátory do jednoho maticového tvaru nebo redukují obvod se dvěma čtyřpóly vázanými transformátorem rovněž do jednoho maticového tvaru .	čtyřpóly	19	Masc
Armáda svou strukturou agresivitu netlumí , pouze přenáší z vyšších na nižší a z těch na nepřítele či nepřátelské civilní obyvatelstvo .	agresivitu	3	Fem
Vybavit školu dobrou laboratoří , dílnou a pokusným pozemkem je v jistém smyslu totéž , ba více než prodloužit dobu pouze teoretické výuky o další ročník .	dílnou	5	Fem
I král dostal svou krabici gumy a nádavkem i doslova trhoveckou prezentaci .	gumy	5	Fem
Dává mu ještě větší prostor k vlastním postřehům o výkonech fotbalistů , zatímco hráči se sami zbavují možnosti jakkoliv se vyjádřit a často se i hájit .	výkonech	9	Masc
Hlouček skalních příznivců slovenské samostatnosti zinscenoval včera před budovou SNR zvláštní happening .	happening	11	Masc
Ekonomická situace policie není nejlepší , většinou se nedostává financí na nákup a obměnu dopravních prostředků .	obměnu	13	Fem
Byly na ní " slavnostně " páleny kartotéční lístky ještě se skutečnými otisky prstů .	otisky	12	Masc
To se to podniká , řeknete si , když vám pod okny restaurace a sedmi pokojů šumí horská bystřina , neopakovatelně krásná za letního slunce , v říjnové mlze i se sněhovými čepicemi a jiskřivými rampouchy na obřích balvanech .	rampouchy	35	Masc
Těsně před natáčením však jedna mužská dvojice odmítla v televizi vystoupit z obav před možnou ostudou .	natáčením	2	Neut
Když mají volno , řídí nižší soutěže včetně dorostenecké ligy a ligy žen .	volno	2	Neut
V dalších výkladech se soustředíme na období současné , a budeme proto nadále mluvit o problematice současného jazyka , postup námi naznačený může ovšem sloužit pro synchronní charakteristiku kteréhokoli období .	výkladech	2	Masc
Za neškodnou je považována intenzita 30 decibelů , práh poškození je 80 a bolestivosti zhruba 130 decibelů .	decibelů	6	Masc
Počet spojů mezi okresním městem a Novým Městem na Moravě v pracovních dnech se zvýší od příštího týdne téměř na dvojnásobek .	Městem	7	Neut
Metoda spočívající v podstatě na proložení maxim od oka není přirozeně objektivní a mimo to bere v úvahu jen hodnoty nejpříznivější , a tím přirozeně zkresluje odhad integrálního působení celého spektra .	proložení	5	Neut
V době největší poptávky přijde přespání včetně snídaně u této největší hotelové společnosti v Praze na 1094 Kč .	přespání	5	Neut
Provádět rozbor čerpání mzdových prostředků podle jednotlivých provozů závodů a * podnik s vyčíslením vícenákladů za případné energetické výseče , za investiční akce , vedlejší činnost a další jiné vícenáklady proti předcházejícímu roku .	vícenáklady	29	Masc
To platí o adverbiích , předložkách , spojkách , citoslovcích a částicích .	citoslovcích	9	Neut
Pokud nedojde k diferenciaci velkoobchodních cen v rafinériích , cenový rozdíl mezi benzínem Super a benzínem Special by se měl od počátku příštího roku zmenšit . "	Special	16	Masc
Přitom jedna tuna plastických hmot , kromě toho , že šetří kovy , v mnoha případech dává vedlejší ekonomický efekt ve výši až # * .	kovy	11	Masc
Obsahoval " potěšující " sdělení spolu se " srdečnou " gratulací , že je náš děda zaručeně jedním z výherců jejich nové hry .	gratulací	10	Fem
Lébl patří i k tvůrcům televizního Studia Kroměříž a v Divadle Na zábradlí , kde nedávno nastudoval Pokojíček od J . A . Pitínského , je od příští sezóny uměleckým šéfem .	zábradlí	12	Neut
Bangladéšští fundamentalisté vycítili v případě Nasrínové šanci k ukousnutí většího kusu mocenského koláče .	fundamentalisté	1	Masc
Petrohradský germanista Konstantin Azadovskij mi potvrdil , že Rilkovy chyby v ruštině nejsou vysvětlitelné z němčiny .	ruštině	11	Fem
Starožitnictví Solidet na Vinohradech je mladé a jeho majitelé bojují s náklady tím , že se snaží o co nejrychlejší pohyb předmětů .	Starožitnictví	0	Neut
" Pohár se v podstatě hraje proto , aby se určilo družstvo pro PVP , ale jak mu vrátit vážnost , nevím , nepřemýšlel jsem o tom , " říká trenér letošních vítězek z Olomouce Teplý .	vítězek	32	Fem
(4) Nástupnická účetní jednotka nebo přejímající společník , který je účetní jednotkou , může o účetních případech uvedených v odstavci 2 písm._a)_až_d) účtovat při sestavení zahajovací rozvahy , je-li takovýto postup efektivní .	společník	6	Masc
Branku , znamenající dva body , vsítil ve druhé minutě prodloužení nováček Donald Brashear a byla jeho první v letošní sezóně .	Branku	0	Fem
Poté , co majitelé nereagovali na opakované příkazy k odklizení stavby , stavební úřad letos v srpnu rozhodl , že demolici provedou na náklady stavebníků najaté firmy .	odklizení	9	Neut
Kladno ve stínu kontumace	kontumace	3	Fem
- Přední komorní díla Leoše Janáčka vydává Supraphon na CD v podání Talichova kvarteta a Pražského dechového kvinteta .	kvarteta	13	Neut
Vlastní vnitřní plocha má rozsah # * , pás opevnění sestávající z příkopu a valu je široký # * .	příkopu	12	Masc
Nejznámější je patrně belgická organizace HRD ( Hoge Raad voor Diamant ) , jejíž certifikát vidíte na obrázku .	Diamant	10	Masc
Jejich skladby byly plné změn rytmů i riffů , které ještě zdůrazňovala invenční kytarová sóla .	sóla	14	Neut
může celibátní církev nenávidět ženatou církev a táhnout , aby jí podřezala krky , jako to činili mohamedáni křesťanům a vice versa ;	křesťanům	18	Masc
Napadlo mě , že na Šumavě jsou tisíce hektarů neobdělaných pozemků , kde by se bizoni dali chovat , " vysvětluje Jiří Rybák , původním povoláním chemik , nyní obchodník s horolezeckými potřebami .	bizoni	15	Masc
Zařízeními firmy Honeywell jsou v ČR vybaveny kromě jiných společnosti Bohemia Glass Poděbrady , Chemopetrol Litvínov , Kaučuk Kralupy a Spolana Neratovice .	Zařízeními	0	Neut
Obsadil tak uvolněnou niku po pohanském bohu zaplašeném křesťanskou zvěstí .	niku	3	Fem
Každou novou dřevěnou násadu u kladiva i u jiných nástrojů dobře ohladíme skelným papírem .	kladiva	5	Neut
Celkem ve 12 sladovnách na Moravě i v Čechách vyrábí slad akciová společnost Obchodní sladovny Prostějov .	slad	10	Masc
Elektron uvolněný donorem se dále pohybuje jako volný elektron a příslušný polovodič je typu * , protože elektrony v něm jsou většinovými nosiči .	donorem	2	Masc
Sekretářka totiž ví , že zákazník se u nich bude cítit lépe , když mu nabídnou kávu , čaj či minerálku .	minerálku	20	Fem
Příslušník ruských pohraničních vojsk byl v pondělí zabit v jihozápadním Tádžikistánu na hranici s Afghánistánem , když neznámí útočníci ostřelovali jeho stanoviště .	Příslušník	0	Masc
Svaz českých a moravských bytových družstev připravuje návrh zákona o obecně prospěšných společenstvech .	společenstvech	12	Neut
Náš nápoj se konzumuje všude , zejména však ve zvláštních prostorách , takzvaných hospodách , pohostinstvích či restauracích .	pohostinstvích	15	Neut
První region , vykazující také nejvyšší sebevražednost v ČSFR ( okres Komárno ) , má především národnostně odlišné složení obyvatel ( vysoký podíl obyvatel maďarské národnosti , např . okres Komárno více než 70 % ) .	region	1	Masc
Nepochopení významu bojovníka se sekerou cizinci a jeho podvědomé přijímání našimi předky je např . pěkně ilustrováno následujícím srovnáním .	Nepochopení	0	Neut
Míru zdar .	Míru	0	Masc
Maximálně eliminujeme riziko ekonomické krize propagováním intenzívní produktivity a efektivnosti a popularizováním atraktivních stimulů .	popularizováním	11	Neut
Předstupoval jsem před porotu profesionálních posuzovatelů talentu klidně a sebejistě .	porotu	3	Fem
Ministerská schůzka Evropské unie a zemí Afriky , karibské oblasti a Tichomoří ( ACP ) , která se měla uskutečnit včera a v pátek v Bruselu , byla kvůli neshodám uvnitř " patnáctky " odložena na neurčito .	Tichomoří	11	Neut
To LN potvrdil také tehdejší český premiér Petr Pithart , který tvrdí , že tak zásadní změna , jakou je vyškrtnutí jednoho z kupců , by musela být v záznamu z jednání vlády zapsána .	vyškrtnutí	20	Neut
Lokvenc přitom stačil ozdobit svůj gól jesličkami a Siegl lišáckým lobem nad bezmocným brankářem Bernadym .	jesličkami	6	Fem
Doprovázel jsem manžele Riedelovy z rakouského Institutu pro humanitární a sociální evropskou spolupráci při jejich návštěvě v domově mládeže v Rovečném na Českomoravské vysočině , při které předali dárky dětem .	dárky	28	Masc
Výsledky všech zkoušek se rozhodčím započítávají do celkového hodnocení spolu se známkami za jednotlivé zápasy .	známkami	11	Fem
Nové vydání Hrabětových ( 1940 - 1965 ) zahrnující rovněž sbírku Blues pro bláznivou holku připravilo nakladatelství Labyrint v edici Česká knihovna .	Blues	11	Neut
Charakteristický rys nového umění spatřuje Fučík v jeho kolektivismu , chápaném jako protiklad individualismu .	protiklad	12	Masc
Pokud jde o rysy v souboru , je jejich diferenční zastoupení u jednotlivých útvarů takovéto .	útvarů	13	Masc
Po ztroskotání snah o trializaci ( přesněji : o subdualizaci ) habsburské monarchie většina šlechty od českého národa odpadla vůbec .	trializaci	4	Fem
Pokud vám osud ozónu a života na Zemi není lhostejný , podepište i vy petici za záchranu ozónosféry .	ozónu	3	Masc
Ludvíkovou tetou se stala choť císaře Františka Josefa , císařovna Alžběta , vynikající krásou stejně jako její bavorský synovec , avšak ta měla Ludvíka upřímně ráda .	choť	4	Fem
Proto více Vesmírů !	Vesmírů	2	Masc
Velkým koníčkem Stanislava Navrátila je shánění a lepení papírových hradů .	hradů	9	Masc
Z DOPISŮ REDAKCI 4	DOPISŮ	1	Masc
Druhá nejvyšší suma ( 100 tisíc ) pomůže na světlo světa třetímu svazku Spisů Karla Teiga , jehož se nakonec ujalo další malé nakladatelství , pražská Aurora .	Spisů	13	Masc
Poznání , jak souvisejí s ostatními fakty a principy , je podstatné , chci - li dosáhnout opravdové gramotnosti .	Poznání	0	Neut
Každé topidlo nebo otopné těleso musí mít u sebe uzávěr plynu .	topidlo	1	Neut
V kronice Kosmově nebylo původně zmínky o Sázavě , později byla do některých rukopisů připojena zmínka o jejím založení a o svěcení kostela .	zmínka	15	Fem
Třicetiletá scenáristka z New Yorku si stále živě vzpomíná na svou první omamnou noc : " Tancovala jsem sama uprostřed nacpaného obýváku plného světel a hřmotu a nemohla jsem být šťastnější . "	světel	23	Neut
Pětadvacetileté výročí umělecké práce ve vrcholném ústavu českého operního umění podnítí jistě hudební kritiky , aby vyjádřili komplexní přínos tohoto pěvce naší scény .	pěvce	20	Masc
Jsou známy případy , kdy regionální odbor ve snaze podpořit začínajícího farmáře uvolnil peníze na stavbu kravína , přičemž poblíž už jeden kravín stál .	kravín	22	Masc
Je nebezpečné dělat rovnítko mezi bezdomovci a kriminálními živly , avšak opuštěnost a osamělost ve spodních vrstvách společnosti chodí ruku v ruce s kriminalitou .	rovnítko	3	Neut
Kdyby společnost zvýšila objem produkce o pět procent , obrat by se zvýšil pouze o pět set milionů SEK .	SEK	18	Fem
Klasifikace motivů je neobyčejně obtížná , protože jde o terminologickou houštinu .	Klasifikace	0	Fem
Byl to úzký pokoj s dvěma postelemi , stolkem , židlí a umývadlem .	umývadlem	12	Neut
A tak se za závodníky stahují ti , kteří tuší , že své obvyklé poklidné posezení v parku mohou nečekaně vyměnit za něco nového .	posezení	15	Neut
Schopnost člověka pro tuto práci a vztah k ní se pozná spíš například na tom , jak kdo zachází s nářadím a nástroji , než na výučním listu .	nářadím	20	Neut
Řev tahačů a country hudba budou od pátku do neděle znít na mosteckém autodromu při prvním mezinárodním závodu svého druhu u nás - Truck Prix Czechoslovakia ' 92 .	Řev	0	Masc
Pro studenta z maloměstské internátní školy , který po šesté nesměl vytáhnout paty z baráku , byla Praha zjevením .	zjevením	18	Neut
Pán , promočený až na kůži , zůstal sám jen s jedním sluhou v hustém mlází .	sluhou	12	Masc
Vždycky , když se pustím do takového listování , jako by kolem mě stáli lidé dávno zmizelí , dávno pohřbení lidé .	listování	7	Neut
A cituje lakonický komentář Elysejského paláce , že není zvykem vyjadřovat se mezi dvěma koly voleb , které jsou vnitřní záležitostí cizí země .	koly	14	Neut
Bosenský premiér podotkl , že bude - li embargo na dodávky zbraní vůči Sarajevu zrušeno , nepovede to k vystupňování bojů .	vystupňování	19	Neut
Záležitost po právní stránce není jednoduchá .	Záležitost	0	Fem
Pro značku malty * , která má po # dnech tvrdnutí nejmenší pevnost v tlaku # * , je směrné množství pojiv vápna a cementu # * na # * písku , toto # * .	vápna	22	Neut
Poptávka neklesla ani po opakovaném zdražení a předpokládáme , že v tuzemsku letos prodáme přes 80000 aut .	tuzemsku	11	Neut
Opice , kterým se nedostalo mateřské lásky , poněvadž po narození jejich matka byla nahrazena kovovou atrapou , ve své dospělosti pak zavrhovaly svoje mláďata .	mláďata	24	Neut
